날짜,제목,본문,링크
2025-12-01 09:31:00,"화해, 연말 빅 프로모션 '화해위크' 개최","화해글로벌은 연말을 맞아 오는 8일까지 뷰티 플랫폼 화해의 대규모 할인 행사인 '화해위크'를 진행한다고 1일 밝혔다.  화해위크는 '화해쇼핑' 입점 브랜드의 인기 상품에 할인 혜택을 제공하는 화해의 대표 프로모션이다.  이번 행사에서는 역대 어워드·랭킹 1위 제품과 명예의 전당에 오른 95개 브랜드의 350여개 상품을 포함해 화해 유저들이 주목한 3000여 개 상품을 최대 90% 할인된 가격에 선보인다. 특히 해당 기간 ▲결하우스 ▲션리 ▲쓰리노프 ▲아누아 ▲아렌시아 ▲에스네이처 ▲토리든의 주요 제품을 매일 최대 84% 할인과 함께 전용 쿠폰, 사은품 증정 등 다양한 혜택으로 만나볼 수 있다.    또한 화해쇼핑의 단독 기획 상품인 'only화해' 100여개 품목을 최대 83% 할인된 가격에 제공하고, 구매 시 적립 포인트를 두 배로 지급한다. 매일 오전 10시에 진행되는 타임딜에서는 인기 상품을 특별 할인가로 구매할 수 있으며, 배송비 3000원만 부담하면 구매 가능한 '배송비딜'도 마련된다.  이와 함께 ▲only화해 전용 쿠폰 ▲4만원 이상 구매 시 30% 할인되는 선착순 쿠폰 ▲2·3.5·5만원 이상 구매 시 각각 적용되는 5·10·15% 할인 쿠폰 등 총 6종의 쿠폰을 지급한다.  어드벤트 캘린더 이벤트도 함께 진행된다. 화해위크 페이지에서 보물찾기 형식으로 참여 가능하며, 최대 3000포인트를 획득할 수 있다.  화해글로벌 관계자는 ""고객들이 평소 관심 있던 브랜드와 제품을 보다 합리적인 가격에 만나볼 수 있도록 한층 강화된 혜택을 마련했다""며 ""앞으로도 고객의 선택을 돕는 신뢰도 높은 큐레이션과 쇼핑 환경을 제공하기 위해 노력하겠다""고 했다.",https://n.news.naver.com/mnews/article/277/0005686837
2025-12-01 09:31:00,"동작구, ‘통행 불편 전신주’ 내년 상반기까지 50개 뽑는다","서울 동작구(구청장 박일하)는 주민의 보행 안전과 원활한 차량 이동을 위해 추진 중인 '통행 불편 전신주 이설 사업'의 고삐를 바짝 죈다고 1일 밝혔다.    구는 2023년 10본, 2024년 14본, 2025년(11월 11일 기준) 15본 등 지금까지 총 39본의 전신주를 정비했다. 이달부터 추가 이설을 이어가며 내년 상반기까지 민선 8기 목표량인 50본 이상을 달성한다는 방침이다.  현재 구는 각 동주민센터와 협력해 관내 전신주 전수조사를 실시하고 있으며, 조사 결과를 토대로 내달 중 현장에서 통행 방해 여부를 본격적으로 점검한다. 이어 내년 초 한전·KT의 기술 검토를 거친 뒤, 대상지 인근 주민들에게 취지와 필요성 등을 충분히 설명해 동의서를 확보할 계획이다.  특히 이러한 절차가 신속히 마무리된 사당로16가길 25, 남부순환로257가길 38, 상도동 244-291일대의 5본(통신주·한전주)은 연내 이설을 완료할 예정이다. 또한 설계가 진행 중인 사당로16사길 26, 동작대로 29, 노량진로 100 등 3개소도 내년 3월께 공사에 착수할 전망이다.  해당 지역 모두 보행자와 운전자 불편이 빈번히 발생했던 곳으로, 통행 개선 효과가 주민들의 일상에서 빠르게 체감될 것으로 기대된다.  박일하 동작구청장은 ""전신주 이설은 안전한 보행 환경을 만들기 위한 필수적인 사업""이라며 ""구민 누구나 편안하게 다닐 수 있도록 내년 상반기까지 계획한 정비를 차질 없이 마무리하겠다""고 말했다.",https://n.news.naver.com/mnews/article/277/0005686833
2025-12-01 09:31:00,[오늘의신상]'디아블로 붉은 말의 해 도깨비 에디션'…韓 한정판 와인,"인터와인은 2026년 '붉은 말의 해'를 기념해 전 세계 1위 칠레 와인 브랜드 '카시에로 델 디아블로(Casillero del Diablo)'가 한국을 지키는 수호신 '도깨비'와 십이간지 전통이 더해진 한국 한정판 '붉은 말의 해 도깨비 에디션'을 선보인다고 1일 밝혔다.    스페인어로 '악마의 셀라(Devil's Cellar)'를 뜻하는 카시에로 델 디아블로는 창립자인 돈 멜초(Don Melchor)가 와인 도난을 막기 위해 '와인 창고에 악마가 나타난다'라는 소문을 퍼트리며 명성을 얻게 된 와인 브랜드다. 1초에 2병씩 팔린다는 디아블로는 다년간 국내 소비자들에게도 사랑받으며 국내 연간 누적 판매 200만병 이상인 유일한 단일 와인 브랜드다.  카시에로 델 디아블로 붉은 말의 해 도깨비 에디션은 칠레 와인 생산량의 가장 큰 부분을 차지하는 카베르네 소비뇽을 주 품종으로 사용해 만들어졌다. 카베르네 소비뇽 특유의 블랙베리, 블랙 커런트, 자두향이 풍성하게 올라오며 집에서 쉽게 만들 수 있는 스테이크, 갈비찜, 불고기, 삼겹살 등과 잘 어울리지만 편의점에서 구할 수 있는 치즈 플래터, 소시지, 야식 상품들과도 잘 어울린다.  특히 이번 에디션은 마스터 오브 와인이자 영국 출신의 세계적 와인 평론가 팀 아킨(Tim Atkin)으로부터 91점을 획득하고, 베스트 인 클래스 카베르네 소비뇽(Best in Class Cabernet Sauvignon)으로 선정된 2023년 빈티지로 제작됐다.",https://n.news.naver.com/mnews/article/277/0005686834
2025-12-01 09:30:00,"대웅제약, '펙수클루 20㎎' 출시…소염진통제 장기 복용 환자 위궤양 예방","대웅제약은 국내 최초로 비스테로이드성 소염진통제(NSAIDs)를 장기간 먹는 환자에게서 발생할 수 있는 소화성 궤양(위 및 십이지장 상부 상처)을 예방하는 효능을 인정받은 P-CAB 계열 위장약 '펙수클루 20㎎(성분명: 펙수프라잔염산염)'을 국내에 출시했다고 1일 밝혔다.    이번에 펙수클루 20㎎이 '소염진통제 유발 궤양 예방' 효능을 공식적으로 인정받으면서, 국내 P-CAB 계열 제품 가운데 처음으로 해당 분야에 진입하게 됐다. 이는 국내 기술로 개발된 신약의 사용 폭이 넓어진 의미 있는 변화다. 소염진통제는 전 세계적으로 널리 쓰이는 만큼, 펙수클루의 글로벌 경쟁력 강화에도 긍정적으로 작용할 것으로 보인다.  새로 출시된 펙수클루 20㎎은 소염진통제를 장기간 먹으면서 위장 장애가 걱정되는 환자들에게 새로운 예방 옵션을 제공한다. 이 제품은 ▲빠르게 위산 분비를 억제하고 ▲식사와 관계없이 복용 가능하며 ▲하루 한 번 복용으로도 효과가 오래 유지된다는 점에서 환자 편의성을 크게 높였다.  효과와 안전성은 최근 발표된 국내 다기관 임상 3상 연구(Gut Liver, 2025)를 통해 확인됐다. 해당 연구에서는 소염진통제를 지속해서 복용해야 하는 성인 423명을 대상으로, 펙수프라잔 20㎎ 또는 기존 치료제인 란소프라졸 15㎎을 24주간 함께 투여한 결과, 내시경을 통해 확인된 위궤양 발생률이 각각 1.16%와 2.76%로 나타나, 펙수클루가 기존 약과 비교해 효과가 떨어지지 않는다는 비열등성 기준을 충족했다. 부작용 발생률도 두 그룹 간 큰 차이가 없었다.  이번 20㎎ 출시로 펙수클루는 40㎎·20㎎·10㎎의 세 가지 용량을 모두 갖춰 P-CAB 계열 가운데 가장 다양한 제품 라인업을 갖추게 됐다. 또한 기존의 ▲미란성 위식도역류질환 ▲급성·만성 위염 치료에 더해 ▲소염진통제 유발 소화성 궤양 예방까지 효능 범위를 넓혔다.  이창재 대웅제약 대표는 ""펙수클루 20㎎은 국내에서 최초로 소염진통제 복용 환자의 궤양 예방 효능을 확보한 제품으로, 환자들에게 새로운 치료 대안을 제시했다는 데 큰 의미가 있다""며 ""앞으로도 탄탄한 임상 연구를 바탕으로 적응증을 확대하고, 전 세계 시장에서 경쟁력을 높이기 위한 연구개발을 계속해 나가겠다""고 했다.",https://n.news.naver.com/mnews/article/277/0005686832
2025-12-01 09:29:00,"'해병특검 무혐의' 한동훈 ""출국 금지·언플하더니…정치 특검의 황당한 결말""","한동훈 전 국민의힘 대표가 자신을 향한 순직 해병특검의 의심이 무혐의로 결론 났다며 ""정치 특검의 전형""이라고 비난했다. 한 전 대표는 30일 밤 자신의 사회관계망서비스(SNS)에 해병특검의 '무혐의 결정 통보서' 사진을 공개하며 이같이 밝혔다.  통보서에 따르면 특검은 직권남용, 범인도피, 직무유기 등 이종섭 전 국방부 장관의 호주대사 임명과 출국 등과 관련해 한 전 대표가 받던 혐의에 대해 모두 '증거 불충분'을 이유로 무혐의 처리했다. 이에 한 전 대표는 ""출국금지에 이어 출국금지 연장을 하고 피의자로 입건하는 등 언론 플레이로 난리 치던 정치 특검의 황당한 결말""이라며 ""부끄러운 줄 모른다""고 비판했다.  앞서 윤석열 정부 당시 한동훈, 박성재 전 법무부 장관은 이 전 장관의 호주대사 임명을 위한 인사 검증 절차와 출국금지 해제 과정 등에 관여한 혐의로 시민단체로부터 고위공직자범죄수사처(공수처)에 고발된 바 있다. 이 시기는 한 전 장관과 박 전 장관의 교체 시점과 겹친다. 이 사건은 특검팀 출범 후 이첩됐다.  지난달 6일 한 전 대표는 '출국 금지 통지서'를 SNS에 공개하며 ""이명현 해병 특검이 저를 수개월간 출국 금지하고 출국 금지 기간도 연장했다는 우편 통지를 어제 확인했다""고 밝혔다. 당시 그는 ""저를 수십 번 상습 고발해 온 친정권 고발 전문 단체 '사세행(사법정의바로세우기시민행동)'이 오래전 저를 근거 없이 고발한 것이 이유라고 한다""며 ""특검은 얼마 전에도 이를 근거로 (저를) 피의자로 입건하느니 하는 간 보기식 언론 플레이를 했다가 아니라고 발 뺀 전력이 있다""고 주장했다.    이어 ""사세행 고발은 이 전 국방부 장관에 대한 법무부의 출국 금지 해제, 인사 검증이 잘못되었다는 주장인 것으로 보이는데, 그것이 법적으로 문제 된다고 생각하지는 않지만, 무엇보다 저는 이 전 장관 출국 금지 해제 당시(2024년 3월)에도, 인사 검증 결과가 나온 당시(2024년 1월)에도 모두 법무부 장관이 아니었으므로 당연히 저와 무관하다""고 밝혔다.  또 ""제가 2024년 3월 이종섭 (당시 주호주) 대사의 귀국을 강력히 요청하고, 2024년 7월 대법원장이 정하는 채 상병 특검 도입을 주장했던 것만 생각해 봐도 특검이 얼마나 말이 안 되는 정치 수사를 하는 것인지 알 수 있다""고 했다.  이에 정민영 특검보는 다음 날 브리핑에서 ""출국금지는 (고발) 피의자인 사람들에게 한 것으로 알고 1개월 단위로 연장한다. 연장이 안 돼 당사자한테 통보가 된 것으로 알고 있다""며 ""출국금지가 해제돼 본인에게 통보가 간 것""이라고 밝혔다.  지난 7월 2일 출범한 순직 해병 특검팀은 지난달 28일 수사를 최종 마무리했다. 150일의 수사 기간 특검팀은 구속영장을 10번 청구해 이 중 9번이 기각되는 등 주요 피의자의 범죄 혐의 소명에 실패했다는 평가가 나온다.",https://n.news.naver.com/mnews/article/277/0005686831
2025-12-01 09:27:00,'돈이 절약되고 돈이 도는 부여'…박정현 군수 민생정책 주목,"충남 부여군이 시행한 민생정책이 주민 생활비를 직접 낮추고 마을 단위 수익을 창출하면서 '돈이 절약되고 돈이 도는 경제 구조'로 자리 잡고 있다.  내년 지방선거에서 더불어민주당 충남지사 후보로 거론되고 있는 박정현 군수의 정책들이 가계비 절감·수익 환원·사회적 비용 완화로 이어지며 농촌 지역경제의 체질을 바꾸고 있다는 평가가 나온다.  1일 아시아경제 취재를 종합하면 부여군이 추진하고 있는 민생 중심 정책이 주민 생활비 절감과 마을 수익 창출로 직결되면서 실질적 경제효과를 내고 있다. 박 군수의 행정 방식이 지역 경제 활성화 모델로 주목받는 이유다.  박 군수의 대표적은 지난 2021년 추진한 '가구 단위 LPG 소형저장탱크 설치 지원 사업'이다.  이 사업은 기존의 가스통 배달 방식에서 벗어나 가구별 저장탱크를 설치해 필요한 만큼만 요금을 납부하는 구조로 바꾸면서 가구당 에너지 비용이 20~30% 감소했다.  특히 난방 수요가 많은 겨울철에는 체감 절감폭이 더욱 커, 주민들의 고정 지출을 낮추는 효과가 뚜렷하다.  이는 단순 생활비 절감에 그치지 않고, 연료 운송·배달 비용 축소 등 지역 전체 에너지 공급 구조의 효율화를 가져왔다.  아울러 '마을 단위 소규모 태양광 발전소 설치 사업'도 경제적 파급력이 큰 정책으로 평가된다.  군은 올해 10개 마을을 선정해 태양광 발전 설비를 구축했으며 사업비의 83%를 군이 부담했다. 설치된 발전 설비는 연간 약 420만 원의 순수익을 낼 것으로 예상되며, 이 수익은 마을 복지기금(마을 연금) 형태로 주민에게 다시 환원된다.  이를 통해 마을은 안정적이고 예측 가능한 재원을 확보하게 되고, 경로당 운영비·장학금·취약계층 지원 등 지역 내부에서 재정이 재투자되는 경제 선순환 구조가 형성된다.  이 사업은 주민이 운영·관리·수익 공유에 직접 참여하면서 공동체 기반 경제가 더욱 강화되는 효과도 나타났다.  이밖에도 '홀몸어르신 병원 동행서비스'는 장기적으로 경제적 부담을 줄이는 정책이다.  고령층이 제때 병원을 방문하지 못해 질병이 악화될 경우 의료비가 더 커지는 구조적 문제를 예방하고, 지역 돌봄 비용 증가를 억제하는 사회적 비용 절감 효과가 발생한다.  군은 대전·천안·군산 등 관외 병원까지 지원 범위를 확대하면서 의료 접근성도 크게 향상됐다.  이 같은 정책들은 사업 규모는 크지 않지만 주민의 실제 지출을 줄이고 마을 단위 수익을 창출하며 장기 의료비 부담을 낮추는 등 직접 경제효과와 간접 경제효과를 동시에 만드는 구조적 민생정책으로 평가된다.  지역사회에서는 ""부여의 민생경제 모델이 충남 전역으로 확산될 경우 농촌지역 경제 회복에 실질적인 변화를 가져올 것""이라는 전망도 나온다.",https://n.news.naver.com/mnews/article/277/0005686829
2025-12-01 09:27:00,"마이리얼트립, 초특가 프로모션 '마리특' 실시…""항공·숙박 등 최대 90%""","마이리얼트립은 오는 7일까지 연말 맞이 초특가 프로모션 '마리특'을 실시한다고 1일 밝혔다.  마리특은 여행 수요가 몰리는 시기에 맞춰 진행되는 두 번째 초특가 프로모션이다. 항공·숙박·패키지·액티비티·투어·티켓 등 전 카테고리에서 최대 90% 할인 혜택과 약 1000여개의 특가 상품을 선보인다.    특히 항공권 부문에서는 대한항공·진에어·에티하드항공과 전 노선 특가가 마련됐다. 일본, 중국, 동남아, 괌, 유럽, 아프리카, 미국의 주요 장·단거리 노선에 최대 30% 할인을 적용해 연말·연초 인기 구간 중심으로 선택 폭을 넓혔다. 신규 출시한 일본 인기 여행지(오키나와·규슈·북해도) 렌터카 상품에는 20% 할인 혜택을 제공한다.  제휴 서비스도 확대됐다. 마이리얼트립은 짐 배송 플랫폼 '굿럭', 비대면 모바일 세탁 서비스 '런드리고'와 협업해 여행 중 짐 보관 및 세탁 서비스를 지원한다. ▲여행 크리에이터가 구성한 '인플루언서 단독특가 마켓' ▲매일 밤 8시 오픈하는 '라이브 반짝특가' ▲무제한 참여 가능한 '0원 래플' ▲숙박 및 투어·액티비티 할인 쿠폰 ▲최대 6만원 제휴카드 혜택 등 다양한 참여형 이벤트와 추가 혜택도 선보인다.  마이리얼트립 관계자는 ""1차 특가 이벤트의 큰 호응에 힘입어 초특가 프로모션 전체 구성을 마리특으로 리브랜딩하고, 연말 성수기에 맞춰 선보였다""며 ""항공·숙박부터 액티비티까지 여행 전 과정에서 실질적인 할인 혜택을 제공해 연말 여행 계획을 지원하겠다""고 했다.",https://n.news.naver.com/mnews/article/277/0005686830
2025-12-01 09:26:00,"'복제약' 가격 낮추고 '혁신신약' 육성…제약업계 ""R&D 차질 불가피""","정부가 국제 수준보다 비싸다는 지적을 받아온 제네릭의약품(복제약)의 가격을 낮추는 강도 높은 약가제도 개편에 착수했다. 환자의 치료 접근성을 높이고 약제비 부담을 완화하는 동시에 국내 제약산업의 체질 개선과 신약 개발을 촉진하겠다는 목표인데, 제네릭 판매 비중이 높은 제약사들은 매출 감소로 오히려 연구개발(R&D) 투자가 위축될 것이라며 크게 반발하고 있다.   약가 유연계약제로 희귀질환 치료 접근성 높여  보건복지부가 지난달 28일 건강보험정책심의위원회에 보고한 '약가제도 개선방안'에 따르면, 내년부턴 희귀질환 치료제의 건보 적용을 위한 급여 적정성 평가와 협상 절차를 대폭 간소화해 현재 최대 240일에 달하는 급여 등재 기간을 최대 100일 이내로 단축할 계획이다.  혁신적 의약품이 국내에 빠르게 도입되고 해외 시장에서 경쟁력을 가질 수 있도록 국민건강보험공단과 제약사 간에 별도로 계약을 체결하는 '약가 유연계약제(가칭)'도 도입한다. 그동안 국내 약가가 해외에 비해 낮다 보니 일부 다국적제약사는 한국 시장에 신약을 출시하기를 꺼리는 경우가 적지 않은 것으로 알려졌다. 이러한 '신약 코리안 패싱'이 지속해서 발생하면서 기존 '단일 약가제'는 의약품의 적정 가치를 반영하는 데 한계가 있다는 문제가 제기돼왔다.  정부는 약가 유연계약제 적용 대상을 내년 1분기부터 대폭 확대해 신규등재 신약, 특허만료 오리지널, 위험분담제 환급 종료 신약, 바이오시밀러 등까지 포함시킬 계획이다.  필수의약품 수급을 안정화하기 위한 조치들도 마련한다. 국가필수의약품의 약가 가산 대상을 확대하고 우대 기간을 보장하는 방안을 추진한다. 2000년 도입 이후 장기간 개선 없이 운영되던 퇴장방지의약품 역시 안정적으로 공급될 수 있도록 지정 기준을 상향하고 정책가산 신설 등 가격 산정방식을 고도화해 내년 하반기부터 시행할 계획이다.  제네릭 가격 낮추고 혁신성에 가산  정부는 이와 함께 복제약과 특허 만료 의약품의 가격의 약가 산정률을 현행 오리지널 의약품의 53.55%에서 40%대로 낮추기로 했다. 2012년 정부의 약가 개편 이후 10년 넘게 가격 변동 없이 최초 산정가 수준에서 유지돼 온 품목들이 적용 대상이다.  현재 제네릭의약품의 가격은 오리지널의 53.55%를 기준으로 혁신성과 수급 안정기여도 등을 평가해 단계적으로 15%씩 깎이는 구조로 결정되는데, 개편안은 이 틀을 유지하면서도 평가 기준을 좀 더 세분화했다.  품질이 낮은 제네릭이 무분별하게 늘어나지 않도록 동일 성분 11번째 제제부터는 5%포인트씩 약가를 인하하는 계단식 인하도 강화된다. 최초 제네릭의약품이 출시될 때 10개 이상의 제품이 등재되면 1년이 경과한 후 11번째 제제 약가로 일괄 조정하도록 다품목 등재 관리도 보다 엄격화할 계획이다.  정부는 이들 정책 과제들에 대해 추가 의견 수렴 등을 거쳐 최종 확정한 뒤 관련 법규들을 신속히 개정해 내년 1분기부터 순차적으로 시행한다는 방침이다.  하지만 이같은 약가제도 개선방안을 두고 제약업계에선 매출의 상당 부분이 타격을 받을 수 있다며 반대하고 있다. 한국제약바이오협회 등이 참여한 약가제도 개편 비상대책위원회는 ""약가 산정 기준을 개선안대로 대폭 낮출 경우 기업의 R&D 투자와 고용을 위한 핵심 재원이 줄어들어 신약개발 지연, 설비 투자 축소, 글로벌 경쟁력 후퇴로 이어질 수 있다""며 ""특히 약가가 원가 수준으로 더 낮아지면 기업은 저가 필수의약품 생산을 가장 먼저 축소할 수밖에 없다""고 지적했다.  위원회는 ""R&D 투자 비율이 높은 기업, 수급 안정에 기여한 기업 등에 대한 약가 우대 방안이 산업 현장에서 실질적 효과를 낼 수 있도록 보다 강화해야 한다""며 ""정부는 개선방안 확정에 앞서 산업계의 합리적 의견 수렴과 면밀한 파급 효과 분석을 바탕으로 제도의 실효성을 확보하라""고 촉구했다.",https://n.news.naver.com/mnews/article/277/0005686828
2025-12-01 09:24:00,11월 수출 8.4%↑…'6개월 연속 플러스'(상보),"11월 수출이 8% 이상 증가하며 올해 6월부터 시작된 증가세가 6개월 연속 이어졌다. 반도체가 역대 최대 실적을 기록하며 전체 수출 증가세를 이끌었다.  산업통상부가 1일 발표한 '11월 수출입 동향'에 따르면 지난달 수출은 역대 11월 중 최대실적인 610억4000만달러로 전년 동기 대비 8.4% 늘었다. 이에 따라 수출은 6개월 연속 플러스를 기록했다.    1~11월 누적 수출은 6402억달러로 동 기간 역대 최대치를 3년 만에 경신했다. 조업일수를 고려한 일평균 수출은 13.3% 증가한 27억1000만달러로 역대 11월 중 1위 실적을 달성했다.  11월에는 15대 주력 수출품목 중 6개 품목 수출이 증가했다. 반도체 수출은 38.6% 증가한 172억6000만달러로 데이터센터를 중심으로 고부가 메모리에 대한 높은 수요가 메모리 가격 상승세로 이어지면서 9개월 연속 플러스 및 전 기간 중 최대실적을 경신했다. 이를 포함한 1~11월 누적 수출액은 1526억달러를 기록했다. 2025년이 한 달 남아 있음에도 기존 연간 최대 수출액인 1419억달러(2024년)를 넘어섰다.  자동차 수출은 내연기관·하이브리드차 호실적에 힘입어 13.7% 증가한 64억1000만달러를 기록했다. 1~11월 누적 수출은 660억4000만달러로 같은 기간 역대 최대 실적을 경신했다. 연간 최대 실적(기존 708억6000만달러) 달성까지 48억3000만달러를 남겨두고 있다.  지난달에는 9대 주요 수출지역 중 5개 지역 수출이 증가했다. 대(對)중국 수출(120억7000만달러·6.9%)은 반도체, 석유제품, 일반기계 등 주력 품목 수출이 고른 증가세를 보이면서 3개월 연속 110억달러 이상을 달성했다. 아세안 수출(104억2000만달러·6.3%)은 반도체가, 중동 수출(21억8000만달러·33.1%)은 일반기계, 석유제품 등 품목이 호조세를 보이며 각각 1개월 만에 플러스로 전환했다.  미국 수출(103억5000만달러·-0.2%)은 반도체·자동차 등 품목은 호실적을 기록했으나, 관세 영향으로 철강과 일반기계, 자동차부품 등 다수 품목이 약세를 보이면서 보합세를 기록했다. 유럽연합(EU) 수출은 철강과 선박 등이 감소하며 1.9% 감소한 53억4000만달러를, 일본(23억2000만달러·-6.8%), 중남미(21억7000만달러·-6.6%) 등으로의 수출도 감소했다.  11월 수입은 1.2% 증가한 513억달러를 기록했다. 에너지 수입(87억2000만달러·-18.4%)은 감소했으나, 에너지 외 수입(425억8000만달러)은 6.4% 증가했다.  지난달 무역수지는 전년 대비 41억7000만달러 증가한 97억3000만달러 흑자를 기록했다. 올해 1~11월 누적 흑자는 전년도 전체 흑자 규모인 518억4000만달러를 142억3000만달러 초과한 660억7000만달러를 달성했다.  김정관 산업부 장관은 ""11월26일 '한미 전략적 투자 관리를 위한 특별법'이 발의되면서 자동차·부품 기업에 대한 관세 인하 요건이 충족돼 우리 기업들의 대미 수출 불확실성이 완화됐다""며 ""우리 수출이 12월에도 성장 모멘텀을 이어가, 경제 회복과 성장의 핵심적 역할을 지속할 수 있도록 정책적 지원을 강화하겠다""고 말했다.",https://n.news.naver.com/mnews/article/277/0005686826
