날짜,제목,본문,링크
2025-12-02 15:37:00,"안규백 ""12·3, 과거사 적당한 타협이 원인…숨겨진 내란, 결코 못 벗어나""","안규백 국방부장관은 2일 12·3 비상계엄 1년을 맞아 ""12·3 내란의 토양은 5·16 군사정변, 12·12 쿠데타, 5·18 광주 학살 등 우리 현대사의 상흔 속에서 부족했던 성찰과 적당한 타협에 있었다""면서 ""마침표를 찍지 않고서는 다음 문장을 쓸 수 없듯이 반복된 과오를 직시하지 않고서는 군의 명예 회복은 불가능하다""고 말했다.    안 장관은 이날 자신의 사회관계망서비스(SNS)에 게재한 담화문을 통해 ""천망회회 소이불루(天網恢恢 疎而不漏·하늘이 친 그물은 보기에는 엉성해 보이지만, 빠져나가지 못한다)라는 숨겨진 내란은 결코 국민의 그물을 벗어날 수 없을 것이다. 군(軍)이 먼저 자신의 힘으로 바로 선 이후, 지성이면 감천이라는 자세로 다시 국민에게 신뢰를 구하겠다""고 말했다. 안 장관의 이런 언급은 12·3 비상계엄과 관련한 인적 청산을 이어가겠단 의지를 내비친 것으로 풀이된다.  안 장관은 먼저 12·3 비상계엄 1주년을 맞은 데 대해 ""무엇보다 국방부 장관으로서 국민을 지켜야 할 우리 군이 내란에 연루돼 도리어 국민 여러분을 위험에 빠뜨리고 무고한 국군장병 대다수의 가슴에 깊은 상처를 남긴 점, 헌법기관인 국회와 선거관리위원회를 무단 침탈한 중대한 과오를 저지른 점에 대해 우리 군을 대표해 공식적으로 사과드린다""고 했다.  이어 안 장관은 문민 장관으로 취임한 이후 ▲인적 쇄신 ▲12·3 비상계엄 관련 사실관계 조사 및 감사 ▲군 인사라인 문민화 ▲민관군 합동위원회 발족을 통한 견제 장치 마련 ▲헌법교육 및 부당명령 거부권 법제화 추진 ▲헌법수호 유공자 포상 및 특진 등을 추진해 왔다면서도 ""끝나지 않은 내란 속에 아직도 우리는 일진일퇴를 반복하고 있다""고 짚었다.  안 장관은 ""앞으로 우리 군은 '좋은 게 좋은 것'이라는 적당주의의 유혹과 결별하고, 시시비비를 분별할 수 있는 명민한 지성과 쇄신하는 용기를 택할 것""이라면서 ""내란의 전모가 밝혀질수록 국민이 느끼는 분노와 실망감이 깊어지는 것을 잘 알고 있다. 그 실망과 분노 앞에서 우리 군이 해야 할 일은 변명보다 성찰로, 더욱 강한 쇄신으로 답하는 것""이라고 강조했다.  안 장관은 아울러 ""국방부 장관이자 오랫동안 국민 곁에서 숨 쉬어 온 정치인의 한사람으로서, 우리 군 역시 도도한 강물처럼 '국민의 군대'라는 바다를 향해 갈 것이라 확신한다""면서 ""그것이 바로 1년 전 오늘 대한민국 민주주의를 바로 세운 국민에 대한 보답이자, 역사의 정의를 바로 세우는 순리라고 확신한다. 그리고 군심과 민심이 일치되는 날 비로소 국민의 군대는 더욱 강력한 군대로 거듭날 것""이라고 밝혔다.",https://n.news.naver.com/mnews/article/277/0005687792
2025-12-02 15:33:00,원·달러 환율 1.5원 내린 1468.4원 마감,2일 서울 외환시장에서 원·달러 환율은 오후 3시30분 기준 전 거래일 대비 1.5원 내린 1468.4원에 마감했다.,https://n.news.naver.com/mnews/article/277/0005687791
2025-12-02 15:32:00,"KAI, 개발 주관 다목적실용위성 7호 발사 성공","한국항공우주산업(KAI)는 다목적실용위성 7호가 남미 프랑스령 기아나 우주센터에서 베가(VEGA)-C 발사체에 실려 성공적으로 발사됐다고 2일 밝혔다.    KAI는 한국항공우주연구원과 다목적실용위성 7호 위성본체 개발 계약을 통해 본체개발 주관뿐만 아니라, 시스템 공동설계 및 위성체 조립시험 분야에도 참여했다. 초고해상도 전자광학(EO) 카메라를 탑재한 다목적 실용위성 7호는 0.3m급 고정밀 영상 촬영이 가능해 국토·환경·재난·도시계획·과학연구까지 폭넓은 분야에서 활용될 고품질 영상을 제공할 것으로 기대된다.  KAI는 지난주 차세대중형위성 3호 발사 성공에 이어 이날 발사에 성공한 다목적실용위성 7호 본체 개발을 통해 국내 최고 수준의 본체개발 역량과 위성체 개발 능력을 증명했다고 밝혔다. KAI는 지난해 7월 소형부터 대형 위성까지 동시 시험이 가능한 4t급 대형 열진공 챔버 시설을 민간 최초로 구축했으며, 향후 전자파 시험 시설을 추가로 확보해 설계부터 제작 및 환경시험에 이르는 위성 개발 전체 프로세스를 한곳에서 진행할 수 있는 '원스톱' 인프라를 갖출 예정이다.  김지홍 KAI 미래융합기술원장은 ""대한민국 대표 우주전문 기업으로 지난 30년간 쌓아온 노하우를 바탕으로 앞으로도 위성과 발사체 사업에 꾸준히 참여해 대한민국의 우주 강국 실현에 기여하겠다""고 말했다.",https://n.news.naver.com/mnews/article/277/0005687789
2025-12-02 15:32:00,"[속보] 李대통령 ""남북 공동성장 협력 추진…기후환경·재안난전 분야부터 교류""","[속보] 李대통령 ""남북 공동성장 협력 추진…기후환경·재안난전 분야부터 교류""",https://n.news.naver.com/mnews/article/277/0005687790
2025-12-02 15:31:00,"코스닥, 6.04P 오른 928.42 마감(0.65%↑)","코스닥, 6.04P 오른 928.42 마감(0.65%↑)",https://n.news.naver.com/mnews/article/277/0005687788
2025-12-02 15:31:00,"코스피, 74.56P 오른 3994.93 마감(1.90%↑)","코스피, 74.56P 오른 3994.93 마감(1.90%↑)",https://n.news.naver.com/mnews/article/277/0005687787
2025-12-02 15:30:00,"[속보] 李대통령 ""'평화공존' 새 시대로…남북 간 연락채널 복구 제안""","[속보] 李대통령 ""'평화공존' 새 시대로…남북 간 연락채널 복구 제안""",https://n.news.naver.com/mnews/article/277/0005687786
2025-12-02 15:29:00,[포토] 생활폐기물 직매립 금지 이행 업무 협약 체결식,"김민석 국무총리를 비롯한 참석자들이 2일 서울 종로구 정부서울청사에서 열린 '생활폐기물 직매립 금지 이행 업무협약식'에서 기념촬영을 하고 있다. 김성환 기후에너지환경부 장관(오른쪽부터) 유정복 인천광역시장, 김민석 총리, 김동연 경기도지사, 김태균 서울시행정1부시장.",https://n.news.naver.com/mnews/article/277/0005687785
2025-12-02 15:29:00,"[속보] 李대통령 ""한반도에서 전쟁 상태 종식, 핵 없는 한반도 추구""","[속보] 李대통령 ""한반도에서 전쟁 상태 종식, 핵 없는 한반도 추구""",https://n.news.naver.com/mnews/article/277/0005687783
2025-12-02 15:29:00,"거래소, 신세계 등 5개사 기업지배구조 공시우수법 선정","한국거래소가 롯데하이마트, 신세계, 아모레퍼시픽, HD현대, SK하이닉스 등 5개 기업을 2025년 기업지배구조보고서 공시우수법인으로 선정했다.  한국거래소는 2019년부터 '기업지배구조 보고서 가이드라인'에 따라 지배구조 현황을 충실하고 투명하게 공시한 상장법인을 기업지배구조 보고서 공시우수법인으로 시상해오고 있다.  올해부터 기업가치 제고 계획 및 기업지배구조 보고서 영문 공시를 한 상장법인에는 가점이 부여됐다.  수상 기업들은 모범적인 지배구조 공시를 통해 주주 보호 및 자본시장의 건전한 공시문화 조성에 기여한 것으로 평가된다.  한국거래소는 이달 중으로 2026년 기업지배구조 보고서 중점점검 사항을 사전에 예고해 보고서의 질적 향상을 도모할 방침이다. 또 2026년부터 기업지배구조보고서 의무공시 대상이 기존 '자산총액 5000억원 이상 코스피 상장사'에서 코스피 전체 상장사로 확대됨에 따라 원활한 공시를 위한 안내자료 배포, 보고서 작성 관련 1:1 컨설팅, 교육 등 상장기업을 체계적으로 지원할 예정이다.",https://n.news.naver.com/mnews/article/277/0005687784
2025-12-02 15:28:00,"인천시, 셀트리온·길병원·인하대병원과 바이오·의료 협약","인천시는 '기술·의료 혁신 중심의 글로벌 바이오 도시' 도약을 목표로 2건의 전략적 협약을 체결했다고 2일 밝혔다.  시는 이날 송도컨벤시아에서 열린 '2025 제약바이오투자대전'에서 셀트리온과 바이오산업 공동성장 협약을 맺었다.  시와 셀트리온은 협약에 따라 송도국제도시를 중심으로 한 기술 및 연구개발(R&D) 생태계를 강화하고, 생산·공급망에 더해 ▲연구개발 ▲오픈이노베이션 ▲글로벌 공동연구를 추진할 계획이다. 이는 인천의 '생산 중심 편중' 구조를 보완하는 핵심적인 산업 전략으로 평가된다.  시는 또 가천대길병원, 인하대병원과 의료혁신 협약을 체결했다.  이들 기관은 앞으로 인천 내 연구중심병원이 보유한 임상 역량과 의료데이터 자산을 바이오기업의 ▲기술 실증 ▲임상연계 ▲의료기기 상용화와 연결할 계획이다. 이를 통해 인천에 의료·산업 융합 R&D 생태계를 조성한다는 게 시의 구상이다.    하병필 인천시 행정부시장은 이날 '2025 제약바이오투자대전'에서 '인천 바이오 혁신전략'을 발표하며 급변하는 바이오산업 재편 속에서 인천이 지향할 미래 모델을 'Bio Growth Partner'로 규정하고, 송도-영종-남동을 중심으로 한 전주기(Full-cycle) 바이오 혁신생태계 조성 방향을 제시했다.  특히 시는 전략 발표를 통해 세계 1위 생산 역량을 기반으로 '기술·의료 혁신 중심의 글로벌 바이오 도시'로 확장하겠다는 강력한 의지를 표명했다. 인공지능(AI)·양자 기반 신약 개발, 벤처·인재 생태계 조성 등 생산 중심을 넘어 혁신 중심 도시로 전환하겠다는 방침이다.  하 부시장은 ""이번 협약은 인천이 세계 바이오 허브로 도약하기 위한 실행 기반을 마련한 것""이라며 ""기업이 성장하기 좋은 바이오 생태계를 만들기 위해 행·재정적 지원을 아끼지 않겠다""고 말했다.",https://n.news.naver.com/mnews/article/277/0005687780
2025-12-02 15:28:00,[포토] 발언하는 김민석 국무총리,"김민석 국무총리가 2일 서울 종로구 정부서울청사에서 열린 생활폐기물 직매립 금지 관련 업무협약 체결식에서 발언을 하고 있다. 김성환 기후에너지환경부 장관(오른쪽부터), 유정복 인천광역시장, 김민석 총리, 김동연 경기도지사, 김태균 서울행정1부시장.",https://n.news.naver.com/mnews/article/277/0005687781
2025-12-02 15:28:00,[포토] 생활폐기물 직매립 금지 이행 업무협약식,"김민석 국무총리가 2일 서울 종로구 정부서울청사에서 열린 생활폐기물 직매립 금지 관련 업무협약 체결식을 하고 있다. 김성환 기후에너지환경부 장관(오른쪽부터), 유정복 인천광역시장, 김민석 총리, 김동연 경기도지사, 김태균 서울행정1부시장.",https://n.news.naver.com/mnews/article/277/0005687782
2025-12-02 15:28:00,[포토] 협약식 후 인사 나누는 김민석 총리,김민석 국무총리가 2일 서울 종로구 정부서울청사에서 열린 '생활폐기물 직매립 금지 이행 업무협약식'을 마치고 김동연 경기도지사와 악수하고 있다.,https://n.news.naver.com/mnews/article/277/0005687777
2025-12-02 15:27:00,"[속보] 李대통령 ""일부 정치세력 계엄 위해 전쟁 유도…위험천만한 시도""","[속보] 李대통령 ""일부 정치세력 계엄 위해 전쟁 유도…위험천만한 시도""",https://n.news.naver.com/mnews/article/277/0005687778
2025-12-02 15:27:00,[포토] 생활폐기물 직매립 금지 이행 업무협약,"김민석 국무총리를 비롯한 참석자들이 2일 서울 종로구 정부서울청사에서 열린 '생활폐기물 직매립 금지 이행 업무협약식'에서 기념촬영을 하고 있다. 김성환 기후에너지환경부 장관(오른쪽부터) 유정복 인천광역시장, 김민석 총리, 김동연 경기도지사, 김태균 서울시행정1부시장.",https://n.news.naver.com/mnews/article/277/0005687779
2025-12-02 15:26:00,"[속보] 李대통령 ""남북 대결 끝내야…'코리아 프리미엄' 전환해야""","[속보] 李대통령 ""남북 대결 끝내야…'코리아 프리미엄' 전환해야""",https://n.news.naver.com/mnews/article/277/0005687776
2025-12-02 15:24:00,"""200원 주면 칭찬해 줄게""…中 중고거래 올라온 '사이버 구걸'","최근 중국 중고 거래 플랫폼에서 '사이버 구걸'이라는 신종 거래 형태가 논란이 되고 있다.  2일 중국 지무뉴스 등 다수 현지 언론은 ""일부 판매자들이 아무것도 없는 상품을 1위안(약 200원)에 올린다""면서 ""구매자가 금액 결제를 해도 상품이나 서비스를 받지 못하는 방식""이라고 보도했다.    보도에 따르면 사이버 구걸을 하는 판매자들은 부업, 또는 놀이로 치부한다. 한 판매자는 중고거래 플랫폼에 ""1위안을 내준다면 감사한 마음과 칭찬을 해드릴 것""이라고 써놓았다. 그는 직장인이지만 돈이 부족하다면서 모닝콜 서비스, 배달 쿠폰, 음료 교환권 등을 올려놓았다. 다른 판매자는 '1위안을 지불하면 게임 파트너나 대화 상대가 될 수 있다""고 했다.  '사이버 구걸'은 중국 온라인상 아무것도 하지 않고 무언가를 얻는 사람을 일컫는 밈(meme)이다. 실제 삶에서 어려움을 겪어 온라인 누리꾼들에게 도움을 구하는 사람, 어려움이 있는 척하며 재미로 무언가를 얻으려는 사람 등이다. 반면 누리꾼들의 선의를 악용해 사기를 치려는 이들도 있다. 이러한 밈을 이용한 일부 판매자들은 중고 거래 플랫폼에 다양한 거래 내용을 제시하고 있다.    지무뉴스는 이러한 신종 거래 형태가 논란이 된다면서 해당 플랫폼 고객센터의 말을 인용해 ""실물 제품 없는 상품을 올리는 것은 규정 위반이다. 확인 후 조치할 것""이라고 전했다.  허다오이 베이징 징인 법률사무소의 변호사는 게시물 내용만 보고 위법이라고 규정할 법률은 아직 없다고 했다. 이어 ""허위 정보를 게시하는 경우라면 사기 행위로 간주할 수 있지만, 명확하게 '사이버 구걸'을 하는 것은 위법이라고는 볼 수 없다""고 부연했다.",https://n.news.naver.com/mnews/article/277/0005687775
2025-12-02 15:21:00,"고령군, ‘희망2026 나눔캠페인’ 성금 모금 돌입","고령군(군수 이남철)은 연말연시를 맞아 '행복을 더하는 기부, 기부로 바꾸는 고령'을 슬로건으로 '희망2026 나눔캠페인' 성금 모금을 추진한다고 2일 전했다. 이번 캠페인은 군민과 사회단체, 기업체를 대상으로 12월 1일부터 내년 1월 31일까지 62일간 진행된다.  고령군은 오는 12월 4일 오전 10시 군청 야외광장에서 성금 모금 행사를 열 예정이며, 군청 희망복지팀과 각 읍·면 맞춤형복지팀을 통해 성금과 물품 기부에 참여할 수 있다. 모금된 성금과 물품은 지역 저소득가구 지원, 위기가구 긴급 지원 등 다양한 사회복지사업에 사용될 계획이다.  이남철 군수는 ""작년 군민들께서 보여주신 따뜻한 마음 덕분에 예상보다 더 많은 지원을 어려운 이웃에게 전달할 수 있었다""며 ""올해도 군민 여러분의 소중한 참여를 부탁드린다""고 말했다.  고령군은 지난해 캠페인에서 목표액 5억982만7000원 대비 128%인 6억5354만8000원을 모금하며 큰 성과를 거둔 바 있으며, 올해 목표모금액은 지난해와 동일하게 5억982만7000원으로 설정됐다.",https://n.news.naver.com/mnews/article/277/0005687773
2025-12-02 15:21:00,"대전시, 대전도시철도 1호선 '식장산역' 2027년 6월 개통","대전도시철도 1호선 마지막 종착역인 '판암역'에서 판암차량기지 내 차량 대기선을 활용해 지상 역사를 새로 건설하는 '식장산역' 착공식이 열렸다.  대전시는 2일 동구 판암차량기지에서 식장산역 건설 착공식을 개최하고, 명품역 건설을 위한 신호탄을 쏘아 올렸다.  식장산역은 2007년 대전 도시철도 1호선 전면 개통 이후 17년 만에 신규로 건설되는 최초의 지상 역사로 시민들의 교통 편익과 지역 발전 큰 의미가 있다.  이번 사업은 판암차량기지 내 차량 대기선을 활용하는 방식이다. 가장 효율적이면서 시민들에게 혜택이 빠르게 돌아갈 수 있는 건설 방이다. 총사업비는 198억 원으로, 2027년 6월 개통을 목표로 추진될 예정이다.  현재 판암역에서 식장산삼거리까지는 약 2.9km로 도보 47분이 소요되지만, 식장산역이 들어서면 거리가 450m로 단축되고 이동 시간도 7분대로 대폭 감소한다.  또한 반석역에서 식장산역까지 지하철로 45분 이내 이동이 가능해져 접근성이 크게 향상된다.    이장우 대전시장은 ""식장산은 대전의 대표적인 자연 관광자산으로, 지하철역과 바로 연결됨에 따라 동구 상권 활성화와 지역 관광에도 큰 시너지 효과가 기대된다. 식장산 자연경관과 어우러지는 명품 역사로 조성해 2027년 개통까지 빈틈없이 추진할 계획""이라고 말했다.",https://n.news.naver.com/mnews/article/277/0005687774
2025-12-02 15:20:00,"이규호 코오롱 부회장, 첫 계열사 지분 매입…리밸런싱 드라이브","이규호 코오롱 전략부문 총괄 부회장이 처음으로 그룹 핵심 계열사 지분을 매입하며 사업 재편 과정에서의 책임경영 의지를 드러냈다. 코오롱이 전사적 리밸런싱을 추진 중인 상황에서 이번 행보는 이 부회장이 경영 실행력을 강화하겠다는 메시지로 해석된다.  2일 금융감독원 전자공시시스템에 따르면 이 부회장은 지난달 28일 코오롱인더스트리 주식 2441주(0.01%)를 주당 4만975원에, 코오롱글로벌 주식 1만518주(0.05%)를 주당 9508원에 장내 매수했다. 총투자액은 약 2억여원 규모다.    이 부회장은 2023년 부회장으로 승진한 뒤 전략부문 총괄로 그룹 핵심 의사결정을 주도해왔다. 다만 지주사 ㈜코오롱을 포함해 계열사 지분을 전혀 보유하지 않아 '책임 있는 리더십'에 대한 의문이 제기돼 왔다. 이번 지분 매입은 사업구조 개편을 진두지휘하는 위치에서 책임을 분명히 하겠다는 신호로 분석된다. 코오롱 관계자는 ""이번 투자는 그룹의 리밸런싱 작업에 힘을 실어주는 책임경영 차원의 행보""라고 설명했다.  코오롱그룹은 지난해부터 사업 효율화와 지배구조 단순화를 중심으로 대규모 리밸런싱을 진행 중이다. 굵직한 구조 재편 내용으로 ▲복합소재 사업을 통합한 코오롱스페이스웍스 출범 ▲코오롱모빌리티의 완전 자회사 편입 ▲코오롱글로벌의 엠오디(MOD)·코오롱엘에스아이(LSI)와의 합병 ▲코오롱인더스트리와 코오롱ENP 합병 결의 등이 있었다. 특히 코오롱글로벌에서 재무 부담(2025년 3분기 부채비율 370%) 완화를 위해 재무 전문가 김영범 대표를 전격 기용하기도 했다.  이번 지분 취득은 규모는 작지만, 주요 사업 재편을 총괄하는 이 부회장이 경영책임을 명확히 한 조치로 평가된다. 재계에서는 ""실적 개선 압박이 큰 상황에서 책임경영 의지를 확인한 것""이라는 반응이 나온다.  한편 이 부회장 지분 확보가 승계 작업과 연결된 것이라는 시각도 있다. 이 부회장 부친인 이웅열 명예회장은 2018년 그룹 회장직에서 물러날 때 ""경영 능력을 인정받아야 최고경영자가 될 수 있다""며 ""능력이 없다면 주식을 한 주도 물려주지 않겠다""고 말했다. 이 명예회장은 지주사 코오롱 지분 49.74%를 보유한 최대 주주고, 코오롱인더스트리와 코오롱글로벌 지분도 일부 갖고 있다.",https://n.news.naver.com/mnews/article/277/0005687772
2025-12-02 15:19:00,"거래소, 회원사 대표이사 간담회…""불공정거래 근절 노력""","한국거래소가 2025년 하반기 회원사 대표이사 간담회를 개최했다고 2일 밝혔다.  회원사 대표이사 간담회는 자본시장의 주요 현안을 공유하고 한국거래소와 회원사 간 원활한 소통을 위해 매년 정기적으로 개최되는 행사다.  여의도 한화금융센터에서 열린 이날 간담회에는 총 21개 회원사가 참석했다. 전날에는 24개 사가 참여했다.  이번 간담회에서는 증권시장, 시장감시 및 청산결제 관련 주요 현안과 자본시장 관련 다양한 이슈에 대한 의견 교환, 애로사항 청취 등 폭넓은 논의가 이뤄졌다.  정은보 거래소 이사장은 ""지난 7월 주가조작 근절 합동대응단출범 이후 자본시장 불공정거래 근절 및 신뢰 회복을 위한 다양한 노력을 지속해왔다""며 ""향후에도 자본시장 경쟁력 강화 및 건전성 제고를 위해 회원사와 더 긴밀하게 소통하고 협력할 것""이라고 밝혔다.",https://n.news.naver.com/mnews/article/277/0005687771
2025-12-02 15:19:00,"광주시 획정위, 남구·광산구 기초의원 선거구 조정안 의결","광주시 자치구의원 선거구획정위원회가 내년 지방선거를 앞두고 남구와 광산구의 기초의원 선거구를 조정하는 안을 확정해 광주시에 제출했다.    획정위는 1일 제4차 회의를 열어 자치구의원 정수 배분 기준을 기존 '인구 50%·동수 50%'에서 '인구 60%·동수 40%'로 조정하고, 이를 적용한 선거구획정안을 의결했다. 이 기준 변경에 따라 남구는 '나선거구'를 3인에서 4인으로 늘리고 '다선거구'를 3인에서 2인으로 줄였다.  광산구의 경우 기준대로라면 현행 유지가 가능했지만, 인구 편차가 크게 벌어진 점을 이유로 일부 위원 의견을 반영해 조정 대상에 포함됐다. 이에 따라 '가선거구'는 4인에서 3인으로 축소되고, '마선거구'는 3인에서 4인으로 늘어났다. 가선거구는 인구가 7만6,000여명, 마선거구는 10만5,000여명으로 대표성 조정 필요성이 제기됐다.  또한 2022년 지방선거에서 중대선거구 시범지역으로 운영됐던 광산구 '라선거구'는 의원 정수가 3인에서 2인으로 환원됐다.  이번 획정안은 내년 3~4월 광주시의회가 '자치구의회 의원정수 등에 관한 조례'를 개정해야 효력이 발생한다. 이를 의식해 획정위는 특별결의문을 채택해 ""시의회는 획정위가 마련한 안을 존중해 조례를 제정해야 한다""며 ""특별한 사유 없이 시의회가 선거구별 의원 정수를 임의 조정하지 못하도록 공직선거법 개정도 필요하다""고 밝혔다.  획정위는 이와 함께 ▲정치 다양성 강화를 위한 공직선거법 개정 ▲획정위에 중대선거구 시범지역 선정 권한 부여 ▲획정위 설치 시기 지방선거 12개월 전으로 조기화 ▲기초의원 정수 결정의 자율성 부여 등을 건의했다.",https://n.news.naver.com/mnews/article/277/0005687770
