날짜,제목,본문,링크
2025-12-02 11:16:00,"HMM 부산 이전 로드맵 작성에 내부 반발…노조, 결의대회 예고","국내 최대 해운사 HMM이 부산 이전을 본격적으로 추진하자 내부 반발이 커지고 있다. 노동조합을 중심으로 피켓시위와 결의대회를 이어가면서 이전 저지에 나선다는 방침이다.    2일 업계에 따르면 HMM 육상노조는 전날 800여명의 노조원에게 부산 이전 반대 피켓을 배포했다. 노조원들은 서울 여의도 본사 사무실에서 '본사 이전 결사반대', '노동자 생존권 사수'가 적힌 피켓을 컴퓨터 모니터 등에 부착했다.  이어 육상노조는 HMM 부산 이전 반대를 위한 기자회견을 이번주 개최하기로 했다. 또 결의대회를 통해 반대 행동을 본격화할 예정이다.  앞서 HMM은 지난달 21일 2026년 임금·보충협약(임단협) 상견례를 시작으로 주 2회 교섭을 가지며 부산 이전을 거론하고 있다. 정성철 HMM 육상노조 위원장은 ""보충협약에서 사측이 부산 이전 로드맵을 작성하고 있다고 했다""며 ""이는 구성원을 설득하는 과정 없이 일방적으로 이전을 추진하는 것""이라고 지적했다.  전재수 해양수산부 장관은 최근 언론 인터뷰에서 내년 1월 둘째주 HMM의 이전 로드맵을 발표할 예정이라고 밝힌 바 있다. 이에 HMM 육상노조는 전 장관을 만나 본사 이전 반대 입장을 직접 전달하기도 했다.",https://n.news.naver.com/mnews/article/277/0005687625
2025-12-02 11:15:00,"서울시, '강북 집중' 모아타운 6곳 확정…총 8478가구 공급[부동산AtoZ]","서울시는 강북권인 성북·강북·동대문·중랑·마포구 등 모아타운 6개 지역을 확정해 총 8478가구를 공급한다고 2일 밝혔다.  시는 전날 제18차 소규모주택정비 통합심의 소위원회에서 '성북구 정릉동 226-1일대 모아타운' 외 5건을 통과시켰다.  통과된 안건은 성북구 정릉동 226-1번지 일대 모아타운, 강북구 수유동 392-9번지 일대 모아타운, 동대문구 답십리동 489번지 일대 모아타운, 중랑구 중화2동 299-8번지 일대 모아타운, 마포구 창전동 46-1번지 일대 모아타운, 관악구 성현동 1021번지 일대 모아타운이다. 사업 추진 시 모아주택 총 8478가구(임대 1443가구 포함)가 공급된다.  성북구 정릉동 일대에는 모아주택 2개소를 통해 총 782가구(임대 69가구 포함)가 공급된다. 대상지는 도로가 세분화되고 경사가 높아 개발이 어려웠던 지역이다. 노후 건축물 비율이 67.5%, 반지하 주택은 68.8%에 이르는 노후 저층 주거 밀집지역으로, 환경 개선이 필요했던 곳이다.  이번 결정으로 제2종일반주거지역(7층)에서 제2종일반주거지역으로 변경해 층수 및 건축규제 완화가 적용된다. 지하 2층에서 지상 29층으로 기존보다 248가구 늘어난 782가구가 조성된다. 이 외에도 주민운동시설, 휴게마당 등 공동이용시설과 함께 어린이집, 다함께돌봄센터, 근린생활시설도 조성된다.    강북구 수유동에는 모아주택 5개소가 추진돼 기존 1725가구보다 늘어난 2595가구(임대 577가구 포함)가 공급될 예정이다.  이 지역은 신축과 구축 건축물이 혼재하고 기반시설이 부족해 주거환경이 열악하다. 이번 결정에는 용도지역 상향, 기반시설 정비 및 공공시설 계획 등이 포함됐다.  또 대상지는 협소한 도로폭과 주차난이 발생하는 곳인데 도로폭을 확장 및 보차분리를 진행한다. 특히 안전한 보행환경 조성을 위해 간선도로인 삼양로변에 차량 진출입 불허구간을 설정했다. 모아타운 내 진입도로 설정을 위해 기존 6m의 좁은 도로폭을 15m까지 확폭하고, 주 가로로 설정해 진입도로로 제공할 예정이다. 공원도 동측에 설치해 공원 활성화를 유도했다.  해당 지역은 반경 600ｍ 이내 가오리역, 화계역(우이신설선), 수유역(4호선)이 인접해 있는 트리플 역세권인데 시는 이번 사업이 지역 활성화에도 기여할 것으로 보고 있다.  동대문구 답십리동 일대엔 모아주택 3개소를 통해 총 994가구(임대 216가구 포함)가 공급될 예정이다. 이곳은 노후·불량 건축물 비율이 92%에 이르고 내부도로도 협소하다. 높은 경사로로 인해 주민 불편도 있는 지역이다.  이번 사업으로 기존 제2종일반주거지역을 제3종일반주거지역으로 용도지역 상향해 사업성을 확보하고, 모아타운 내 주요 도로를 확폭해 보도 조성 등 교통 여건을 개선한다.  지하 2층에서 지상 23층으로 687가구 늘어난 994가구가 공급된다. 또 공공보행통로를 건립해 보행 접근성을 높이고 지하 주차장 설치 등을 통해 사업성을 향상할 예정이다.  중랑구 중화2동 일대 모아타운은 현재 공사 중인 가로주택정비사업 1개소와 모아주택 3개소 추진을 통해 총 1800가구(임대 286가구 포함)를 공급한다.  이 지역 역시 노후건축물 81%, 반지하 주택 70.2%에 이르는 노후 저층 주거밀집지역이다.  모아타운 관리계획은 제2종일반주거지역을 제3종일반주거지역으로 전면 상향해 사업성을 높였다. 도로 여건도 크게 개선한다. 주민공동시설(주민운동시설, 작은도서관, 어린이 놀이터 등), 공공공지 등 가로 활성화 시설 배치해 지역 주민이 이용할 수 있는 생활공간을 만든다.  시는 이번 계획이 무분별한 개발을 방지하고 지역 여건에 맞는 도로·공원 등 기반시설과 조화를 이루는 균형 있는 정비체계를 구축했다고 전했다.    마포구 창전동 일대는 이번 계획(안) 통과로 향후 모아주택 1개소가 추진돼 총 298가구(임대 41가구 포함)의 주택이 2032년까지 공급될 예정이다.  이번 모아타운 지정으로 기존 222가구에서 298가구의 주택 공급이 가능할 것으로 전망된다. 계획에는 정비기반시설(도로, 공원) 확충, 사회복지시설 등 지역 필요 시설 공급, 특별건축구역 지정, 디자인 가이드라인도 담고 있다. 와우 근린공원과 창전 어린이공원을 연결해 보행환경도 개선한다.  관악구 성현동 일대에는 모아주택 4개소가 들어서 기존 대비 624가구가 늘어난 총 2009가구(임대 254가구 포함) 주택이 공급될 예정이다.  해당 지역은 구릉지형 정비 취약 주거밀집지역으로, 협소한 도로와 주차공간 부족 등 문제가 지적돼왔다. 2023년 모아타운 대상지로 선정돼 주민설명회, 서울시 전문가 사전자문, 주민공람 등의 절차를 거쳐 심의에 상정됐다.  이번 모아타운 관리계획(안)의 주요 내용은 사업추진구역의 용도지역 상향(제2종(7층 이하)→제3종일반주거지역), 정비기반시설(도로, 공원) 및 공동이용시설 확충 등이다. 가구 수 증가와 주변 대규모 아파트단지를 고려해 내부도로를 확폭하고 대지 안의 공지를 활용한 보도를 조성해 열악한 보행환경을 개선한다. 일부 도로의 단차 발생으로 인해 통행이 불편했던 구간의 도로 평탄화도 진행한다.",https://n.news.naver.com/mnews/article/277/0005687623
2025-12-02 11:14:00,"프리미엄 모피 브랜드란 이런 것… 신세계 센텀시티, '성진모피' 선보여","신세계 센텀시티가 내년 2월 15일까지 백화점 3층에서 프리미엄 모피 브랜드 '성진모피'를 선보인다.  성진모피는 절제된 디테일과 세련된 실루엣으로 정통모피의 클래식함을 강조하며 시즌마다 다양한 컬렉션을 전개하고 있다.  대표 제품으로는 실버블루 롱베스트, 레오파드 롱코트, 버터옐로우 숏자켓 등이 있다.  200만원 이상 구매 시 플러피 머리끈, 500만원 이상 구매 시 머플러 등 사은품 증정(한정 수량) 프로모션도 진행된다.",https://n.news.naver.com/mnews/article/277/0005687624
2025-12-02 11:12:00,"코트라, 亞최대 개방형 기술매칭 행사 '이노베이션 리더스 서밋' 참가","대한무역투자진흥공사(코트라)는 일본 도쿄에서 열리는 아시아 최대 오픈 이노베이션 행사 '이노베이션 리더스 서밋(ILS) 2025'에 우리 인공지능(AI) 스타트업 11개사와 함께 참가한다고 2일 밝혔다.    ILS는 지난해 대기업 110개사, 스타트업 821개사가 참가해 총 3249건의 비즈니스 미팅, 총 923건의 협업 안건이 발굴되는 등 큰 성과를 거두며 아시아 대표 오픈 이노베이션 플랫폼으로 자리매김했다.  올해도 30개국에서 스타트업 757개사와 이들과 협력을 고려하는 대기업 100개사가 참가해 1∼5일 닷새간 피칭과 상담 등이 진행된다.  코트라는 이 행사에서 우리 AI 스타트업이 일본 등의 글로벌 기업과 기술·투자 협력을 맺을 수 있도록 지원할 예정이다.  오는 3일에는 '한국 혁신 스타트업 피칭(기업 소개) 데이'를 열고 스튜디오랩(AI 이미지 자동생성), 드라이브텍(물류 자율주행 로봇), 진스토리(유전자 분석 에듀테크) 등 혁신 스타트업이 피칭을 진행하도록 돕는다.  또 파나소닉, NTT 도코모, SBI 인베스트먼트, 소니 네트워크커뮤니케이션즈 등 일본 대기업과의 1대1 기술·투자 상담도 주선한다.  박용민 코트라 일본지역본부장은 ""우리 스타트업의 AI·디지털 응용기술과 일본 대기업의 소부장(소재·부품·장비) 경쟁력이 만나면 제조업 경쟁력을 한단계 높일 수 있다""며 ""이번에 발굴된 협력 수요를 상용화하는 것에 더해 향후에도 K-스타트업과 일본 대기업간 기술·투자 협력 기회를 확충하기 위해 힘쓰겠다""고 말했다.",https://n.news.naver.com/mnews/article/277/0005687622
2025-12-02 11:12:00,"14년 적자 버틴 쿠팡, 창사 최대 위기…김범석의 침묵","국내 최대 e커머스 플랫폼 쿠팡이 창사 이래 최대 위기에 직면했다. 2010년 설립된 이후 14년간 적자를 버티며 연간 1조원대 흑자기업으로 탈바꿈했지만, 3370만명에 달하는 고객 개인정보 유출과 이로 인한 '탈팡(쿠팡 탈퇴)' 움직임 등 각종 악재가 동시다발적으로 쏟아지면서다.    쿠팡 창업자인 김범석 쿠팡Inc 이사회 의장은 이번 개인정보 유출 사태뿐 아니라 국내 사업을 둘러싼 회사의 각종 논란에도 모습을 드러내거나 메시지를 내지 않고 무대응으로 일관하며 비판의 중심에 섰다.  더불어민주당 을지로위원회 위원장인 민병덕 의원은 2일 국회에서 열린 '쿠팡 개인정보 유출 소비자대책 촉구 기자회견'에서 ""이번 사태는 단순한 실수가 아니라 조직적인 무책임이 초래한 인재""라며 ""쿠팡은 독점적 지위를 이용해 플랫폼 안에 소비자를 가둬두는 데만 몰두하고 국민의 개인정보까지 이윤의 부산물로 취급하며 공공의 안전을 위협한다""고 지적했다. 그러면서 ""실효적 보상안도 제출하지 않고, 미국 기업이라는 이유로 한국의 규제 감시를 회피해 왔다""며 ""이 같은 행태를 근절하고 국민 앞에 합당한 책임을 지도록 하겠다""고 덧붙였다.  한국소비자단체협의회도 ""김범석 의장은 소비자에게 사죄하고 책임 있는 해결 방안을 마련하라""면서 ""쿠팡은 개인정보 유출사건에 대한 사실관계를 투명하게 공개하고 소비자 보호와 배상 대책을 수립하라""고 덧붙였다.  2010년 자본금 30억원으로 출발한 쿠팡은 2014년부터 10년간 로켓배송으로 불리는 물류 인프라를 구축하는 데만 6조원 이상을 투자하며 빠르게 성장했다. 2015년 매출 1조원을 달성한 뒤 매년 두 배가량 성장세를 이어갔다. 코로나19 이후 온라인 쇼핑 시장이 급성장하면서 2021년에는 매출 20조원을 돌파했고, 지난해에는 연 매출 40조원 고지를 넘어섰다.    국내 쇼핑 시장을 주도했던 롯데쇼핑(13조9866억원)이나 신세계그룹(35조5913억원) 등 오프라인 유통 채널마저 추월하며 압도적인 플랫폼으로 도약했다. 인프라 구축에 막대한 투자를 병행하며 누적됐던 적자도 2023년부터 흑자로 전환했다. 쿠팡Inc가 미국 증권거래위원회(SEC)에 제출한 실적보고서에 따르면 연결 기준 지난해 쿠팡의 연간 영업이익은 6023억원, 한국 법인의 영업이익은 1조6000억원 수준으로 늘었다.  이처럼 고속 성장을 이뤄낸 원동력은 회사가 지향하는 기술 우위 전략이다. 쿠팡은 ""커머스의 미래를 만드는 힘은 '고객 중심, 데이터 기반 혁신, 문제 집중과 빠른 해결'이라는 엔지니어링 문화에 있다""고 주창해왔다. 그러나 조직 운영에서는 숱한 논란을 야기했다. 산업재해와 사망 사고가 반복되면서 근로자 처우 개선 문제가 도마 위에 올랐고, 소상공인에 대한 입점 수수료와 정산 주기 문제, 배달 애플리케이션(앱) 수수료 문제 등 다양한 이슈로 올해 국회 국정감사에서 복수 상임위에 불려갔다.  현재 쿠팡 등 플랫폼 기업의 '갑질'로부터 입점업체를 보호하기 위한 온라인플랫폼법(온플법)이 논의 중이고, 쿠팡의 퇴직금 불기소 외압 의혹은 상설 특검으로 이어졌다. 이는 중부지방고용노동청 부천지청이 지난 1월 쿠팡 물류 자회사인 쿠팡풀필먼트서비스(CFS) 퇴직금 미지급과 관련해 쿠팡 측에 대한 기소 의견으로 검찰에 송치한 사건을 인천지검 부천지청이 지난 4월 무혐의로 불기소 처분을 내린 것이 문제였다.    각종 논란에도 창업주인 김 의장은 이와 관련한 입장 표명을 하지 않아 경영이나 사회적 책임을 외면한다는 비판이 제기된다. 미국 국적인 그는 해외 체류 등을 이유로 국회 청문회와 국정감사 등에 불참했고, 쿠팡을 실질적으로 지배하면서도 공정거래위원회의 '동일인(총수) 지정'에서도 빠졌다.  정연승 단국대 경영학부 교수는 ""쿠팡이 그동안 빠른 성장을 하고, 압도적인 입지를 구축하면서 기술적인 부분에 비해 체계적인 조직 문화나 시스템 등을 갖추는데 미흡한 면이 있을 것""이라며 ""이번 사태를 계기로 국민에게 진정성 있는 사과와 책임 있는 보답을 약속하고, 기술뿐 아니라 인력이나 교육 사회적 책임과 고객 서비스에 대한 투자를 강화해야 한다""고 말했다.",https://n.news.naver.com/mnews/article/277/0005687620
2025-12-02 11:12:00,"""은행 중심 스테이블코인 컨소시엄, 혁신 포기""…與 내부서 첫 반발","스테이블코인 발행 주체를 '은행 지분 51% 컨소시엄'으로 정하기로 뜻을 모은 당정협의에 대해 더불어민주당에서 처음으로 반대 목소리가 나왔다. 전통적 결제망 기득권, 규제·리스크 관리 중심 운영방식으로 인해 기존의 디지털 예금 수준으로 전락할 수 있다는 우려에서다.  국회 기획재정위원이자 민주당 정책위원회 상임부회장인 안도걸 의원은 이날 오전 국회 소통관에서 기자회견을 열고 ""혁신적 금융 플랫폼을 제대로 구축하기 위해서는 무엇보다 발행주체 설계가 개방적이고 경쟁적인 구조로 마련돼야 한다""고 밝혔다.  앞서 민주당은 전날 당정협의회를 열고 스테이블코인 발행 주체 문제에 대해 한국은행, 금융위원회, 은행권의 입장을 조율해 '컨소시엄 형태'로 정리했고, 컨소시엄 구성 시 은행이 51%의 지분을 갖는 방향으로 의견을 모았다. 발행주체를 은행에 한정한 금융당국 방안과 시장 참여를 독려하는 여러 의원안이 절충된 것이다. 이 밖의 다른 내용은 오는 10일까지 정부가 법안이 제출하면 추후 논의하기로 했다.    안 의원은 ""스테이블코인은 새로운 결제·교환 수요를 창출하고, Web3·핀테크 산업을 고부가가치 성장산업으로 견인하며, 글로벌 경쟁력을 갖춘 디지털 금융 인프라를 구축하는 국가 전략자산적 제도""라며 ""은행 중심 컨소시엄만 허용하는 것은 사실상 혁신을 포기하자는 것""이라고 지적했다.  미국·유럽연합(EU)·일본 등 주요국보다 뒤처진 후발주자 한국이 글로벌 시장에서 살아남기 위해서는 발행 주체를 혁신 서비스, 글로벌 확장성, 이용자 편익 제공이 가능한 개방형·경쟁형 구조로 설계돼야 한다는 취지다. 안 의원은 이를 위해 은행 중심 컨소시엄뿐만 아니라 비은행 금융기관·핀테크 기업·블록체인 기술기업·디지털 유통 플랫폼 등 다양한 주체가 참여하는 '다중 업권 참여'를 원칙으로 해야 한다고 주장했다.  금융당국이 다중 업권 참여시 안정성 문제 발생을 우려하는 것에 대해서도 안 의원은 ""발행주체의 적격 요건 설정, 안전자산 기반의 준비금 100% 보유와 실시간 검증, 발행·상환 절차의 투명화, 외환·자금세탁방지(AML) 통제체계 구축 등은 모두 현행 금융·외환감독 체계 안에서도 충분히 구현할 수 있는 장치""라고 목소리를 높였다.",https://n.news.naver.com/mnews/article/277/0005687621
2025-12-02 11:11:00,"""쿠팡 영업정지"" ""1조원대 과징금""…여야, 침묵 김범석 맹폭","국회가 고객 3370만명의 개인정보 유출 사태를 일으킨 쿠팡을 상대로 2일 첫 긴급 현안질의를 열고 한목소리로 규탄했다. 더불어민주당은 ""1조원대 과징금을 물어야 한다""고 했고 국민의힘도 ""영업정지까지 검토해야 한다""고 강조했다. 특히 쿠팡의 실질적 오너이지만 침묵 중인 김범석 쿠팡Inc 의장에 대한 여야 비판도 쏟아졌다.    국회 과학기술정보방송통신위원회는 2일 쿠팡 사태 관련 긴급 현안질의를 열고 개인정보 유출 경위와 책임 소재 등을 캐물었다. 고객 정보 유출 규모가 드러난 이후 첫 국회 차원 대응이다. 전체회의에는 박대준 대표, 브랫 매티스 최고정보보호책임자(CISO) 등 쿠팡 임원과 류제명 과학기술정보통신부 2차관, 이정렬 개인정보보호위원회 부위원장 등 유관기관 관계자들이 출석했다.  이훈기 민주당 의원은 ""과징금을 생각해서 이런 표현을 한 것인지 모르지만 (개인정보가) 유출이 됐는데 쿠팡이 '노출'이라는 표현을 썼다""고 지적하며 ""개인정보보호법에 따르면 매출액의 3%까지 과징금을 물어야 하는데 쿠팡의 매출액이 41조원인 만큼 1조2000억원의 과징금은 물어야 하지 않겠느냐""고 강조했다.  박정훈 국민의힘 의원도 ""이름과 전화번호, 주소가 나온 종합 세트 같은 정보가 유출된 경우는 처음인 것 같다""며 ""범죄조직이 밀수에 이용할 수 있고 보이스피싱은 기본이다. 엄청난 문제를 일으킨 거다. 영업 정지까지 고려할 수 있는 일""이라고 강조했다. 류 차관은 ""저희가 판단한건 아니지만 관계 기관과 적극 협의하겠다""고 말했다.  박 대표는 유출이 아닌 노출이란 표현을 사용한 것에 대해 ""어떤 책임을 모면하고자 하는 의미는 아니었다""며 ""다른 의도는 없었다""고 해명했다. 김 의장의 직접 사과 요구에 대해선 ""제가 현재 이 사건 전체를 책임지고 있다""며 ""한국법인 대표로서 끝까지 책임지고 사태 수습을 위해 최선을 다하겠다""고 답했다.  국회 정무위원회는 3일 오후 전체회의를 열고 이번 사태에 대한 현안질의를 이어갈 예정이다. 금융위원회, 금융감독원, 공정거래위원회 등 관계자들을 불러 소비자 보호와 정보 보안 강화 방안 등을 논의한다. 다만 국회 차원의 잇따른 대응에도 올해만 SK텔레콤, KT, 롯데카드, 예스24, 쿠팡 등 개인정보 유출이 끊이지 않는다는 지적이 나온다. 현안질의를 하더라도 실효성 있는 대책이 따라오지 않았기 때문이다.    기업 오너에 대한 미흡한 대응도 원인으로 꼽힌다. 쿠팡의 경우 창업자이면서 실질적 오너인 김범석 의장은 2021년 한국 법인 이사회 의장직 등에서 물러났다는 이유로 책임에서 비켜나 있다. 김 의장은 올해 국정감사에서 쿠팡이 불공정 거래 등 각종 이슈로 논란이 됐을 때도 해외 체류를 이유로 출석을 거부했다. 정무위는 3일 현안질의에 김 의장을 증인으로 불렀지만 나올 가능성은 낮은 분위기다.  여야는 쿠팡 사태를 계기로 개인정보보호법 개정 등 제도 보완에 나설 전망이다. 김승원 민주당 의원은 개인정보 유출 기업에 부과하는 과징금을 전체 매출액의 3%에서 4%로 높이는 내용의 개정안을 발의했다. 강훈석 대통령실 비서실장은 전날 고객정보 유출에 대한 기업들의 배상 책임이 컸다면 보안에 더 신경 썼을 것이라며 징벌적 손해배상 제도를 언급하기도 했다.  허영 민주당 원내정책수석부대표는 이날 원내대책회의에서 ""쿠팡은 이미 세 차례 개인정보 유출로 과징금 처분을 받았지만 그 총액은 고작 16억원에 불가하다""며 ""솜방망이 처벌이 결국 이번 대형사고를 키운 것""이라고 했다. 이어 ""정부는 쿠팡의 보안의무 위반 여부를 철저히 조사해 엄중 처벌하고 또 과징금 체계와 정보보호 인증 제도의 필요성을 검토하고 조속히 개선해야 한다""고 했다.",https://n.news.naver.com/mnews/article/277/0005687619
2025-12-02 11:09:00,"野에 속도 달린 대미투자특별법...""청문회 실시 우선, 비준 동의 필수""","한미 관세 협상 이행을 지원하기 위해 더불어민주당에서 발의한 대미투자특별법 처리에 시간이 걸릴 전망이다. 소관 상임위원회인 기획재정위원회 위원장을 맡은 국민의힘이 국회 비준 동의 절차를 고수하고 있는 상황이다. 국민의힘에서는 청문회를 통해 특별법 문제점을 검증하겠다는 방침이다.  2일 기재위 야당 간사인 박수영 의원은 국민의힘이 국회에서 연 대미투자특별법 점검 회의 후 기자들과 만나 ""기재위, 산업통상자원중소벤처기업위원회, 외교통일위원회 합동으로 청문회를 열고 특별법 문제점을 알리기로 했다""고 밝혔다. 이를 통해 국회 비준 동의 필요성을 설득하겠다는 입장이다.    민주당은 지난달 26일 대미투자특별법을 발의했다. 법안은 전략적 투자에 대한 의사결정 구조를 체계화하는 한편 전략적 투자를 이끌 한미전략투자공사를 설치한다는 내용을 담았다. 이에 따라 자동차·부품 관세 인하(25%→15%)가 11월 1일 자로 소급 적용되는 요건을 갖췄다. 다만 특별법이 국회를 통과하기 위해서는 기재위와 법제사법위원회 문턱을 먼저 넘어야 한다.  국민의힘은 특별법 처리가 아닌 국회 비준 동의 절차를 거쳐야 한다는 입장을 유지하고 있다. 대미 투자 규모가 3500억달러(약 500조원)로 중대한 재정 부담인 만큼 국회 동의가 전제돼야 한다는 논리다.  국민의힘은 이날 특별법의 결함을 지적하며 비준 절차의 필요성을 강조했다. 송언석 원내대표는 ""보유한 외화자산 운용 수익으로 대미 투자 전액을 충당하겠다는 정부 설명과 달리 특별법에 따라 모든 재정 수단을 동원할 수 있다""며 ""경영평가나 국정감사를 받지 않는 별도 공사 역시 정부의 낙하산 인사 가능성이 높다""고 꼬집었다. 기재위원장인 임이자 의원 역시 ""특별법과 달리 양해각서(MOU) 내용상 한국이 자금 제공을 거절할 경우 미국이 한국산 제품에 관세를 부과할 수 있고 대미 투자 결정이 깜깜이로 진행될 가능성이 있다""고 우려했다.  특별법 처리가 지연될 경우 민주당에서 강행 처리하거나 패스트트랙(신속처리안건)으로 상정할 가능성도 거론된다. 허영 민주당 원내정책수석부대표는 지난 26일 ""패스트트랙까지는 검토하지 않고 있다""며 ""국민의힘도 적극적으로 협조해 줄 것이라고 기대하고 있다""고 밝힌 바 있다. 박 의원은 ""특별법 발의로 자동차 관세가 내려간 만큼 정부·여당에서 무리하게 서둘러 추진할 필요가 없지 않겠나""라며 ""여당에서 강행 처리하는 일이 없길 바란다""고 했다.",https://n.news.naver.com/mnews/article/277/0005687616
