날짜,제목,본문,링크
2025-12-08 11:54:00,"與최고위원 보궐 '친명' vs '친청' 구도…鄭, 리더십 수습 나서","더불어민주당의 '대의원·권리당원 1인1표제·지방선거 공천룰 변경이 좌초된 이후 재점화된 친명(친 이재명)계와 친청(친 정청래)계의 긴장 관계가 최고위원 보궐선거로 이어지는 분위기다.  8일 여권에 따르면 내년 1월11일 치러지는 민주당 최고위원 보궐선거에는 이재명 대통령의 대장동 사건 변호인 출신인 이건태 의원, 당대표 시절 수석사무부총장을 맡았던 강득구 의원, 영입 인사인 유동철 부산 수영구 지역위원장 등 친명계 인사들이 출마를 고려하고 있다. 조직사무부총장인 문정복 의원, 당대표 직속 민원정책실장 임오경 의원, 이성윤 의원 등 친청계로 인사들도 후보군이다.  선거인단별 유효 투표 결과 반영비중은 중앙위 50%, 권리당원 50%로 이날 민주당 최고위원회의에서 의결됐다. 당원들의 선거권 권리행사 시행일은 올해 12월 1일이며, 입당 기준일은 올해 5월 31일까지다. 지난해 12월1일부터 올해 11월30일까지 1년간 6회 이상 당비를 납부한 당원이 선거권을 행사할 수 있다.    당내에서는 1인1표제·공천룰의 중앙위 부결 이후 거듭 제기된 명청 갈등에 대해 조승래 사무총장과 박수현 수석대변인이 각각 기자간담회와 페이스북에서 ""특정 인물 중심의 편 가르기 하는 방식은 자제될 필요가 있다""면서 진화에 나섰다.  정 대표는 이날 최고위원회에서 지방선거기획단이 전날 마련한 공천룰 개정 수정안을 의결하며 내부 반발 수습에 힘을 쏟았다. 기초의원 비례대표 후보자 선출 권리당원 투표 100%에서 한발 양보한 '상무위원·권리당원 투표 비율 50%' 반영을 당무위원회에 올리기로 했다.  정 대표는 최고위원회의에서 ""80%(공천룰 개정안), 73%(1인1표제) 찬성률로 보면 통과됐겠지만, 투표 참여 저조로 무산됐다. 중앙위 결정을 존중한다""고 했다. '대의원·권리당원 1인1표제'에 대해서는 ""당의 주인은 당원이기 때문에 당원에게 뜻을 물어 길을 찾겠다""고 했다.  박 수석대변인은 ""광역은 지금도 범위가 넓기 때문에 당원 100%로 해도 현재와 큰 차별점이 없다""며 ""당원주권정당으로 나아가자는 취지로 이 부분은 최고위원들의 동의·의결이 있었다""고 말했다.",https://n.news.naver.com/mnews/article/277/0005690356
2025-12-08 11:40:00,'건진법사 브로커' 1심서 징역 2년…3대 특검 사건 첫 결론,"건진법사 전성배씨 옆에서 잇속을 챙긴 혐의로 김건희 특별검사팀(특별검사 민중기)에 의해 재판에 넘겨진 브로커에게 징역 2년이 선고됐다. 3대 특검팀(내란·김건희·채상병)이 기소한 사건 중 1심 선고가 나온 첫 번째 사례다.    8일 서울중앙지법 형사합의21부(부장판사 이현복)는 특정범죄 가중처벌법상 알선수재 혐의를 받는 이성재씨에 대해 징역 2년과 추징금 4억원을 선고했다.  이씨가 대통령 부부나 국민의힘 유력 정치인, 고위 법조인들과 가까운 전씨에게 부탁하면 재판에서 무죄를 받아줄 수 있다며 재판 관련 청탁을 알선해주는 대가로 4억원의 금품을 수수한 혐의로 재판에 넘겨졌다.  재판부는 ""법원의 독립성·공정성, 법관 공직 수행에 대한 사회 일반의 신뢰를 중대하게 해치는 범행""이라며 ""사법정책적으로도 엄중히 처벌할 필요가 있다""고 양형 이유를 밝혔다.  이씨의 공소사실에 대해서는 전부 유죄로 판단했다. 재판부는 ""피고인이 청탁 알선 명목으로 수수한 4억 원과 전 씨를 통한 청탁 사이엔 전체적, 포괄적으로 대가 관계 성립이 인정되고, 대가성에 관한 피고인의 인식도 명확했음이 인정된다""고 판단했다.  앞서 지난달 14일 특검팀은 결심공판에서 이씨에게 징역 4년, 추징금 4억원을 구형했다. 특검팀은 ""청탁과 알선을 목적으로 4억원을 수수한 것으로 중대 부패 범죄""라며 ""대통령 부부와 가까운 건진법사의 최측근으로 활동하며 김건희 여사가 건진법사가 (가진) 권력이라는 말과 함께 사익을 추구했고, 금품 수수는 그런 행태의 일환으로 드러났다""고 했다.",https://n.news.naver.com/mnews/article/277/0005690355
2025-12-08 11:38:00,"국교위, 인문사회 특위 출범…""AI시대, '인문사회' 중요성에 주목""","대통령 소속 행정위원회인 국가교육위원회가 '인문사회 특별위원회'를 구성하고 8일 첫 회의를 열었다.  인문사회 특위는 전문 분야와 지역을 안배한 위원 10명으로 구성됐고, 김명환 서울대 영어영문학과 명예교수가 위원장을 맡았다.  특위는 6개월간 ▲인문사회과학의 학문적 재정립과 대학 내 관련 학과·연구소·관련 학회 등의 혁신을 위한 방향 모색 ▲ 학문 후속 세대 양성을 포함한 지속가능한 학술생태계 구축과 제도적 기반 마련 ▲ 학문 균형 발전을 위한 법적·제도적 기반 마련 등을 위한 정책 방안에 대해 논의할 예정이다.  차정인 국가교육위원장은 ""인공지능(AI) 등 과학기술이 고도화하는 시대를 맞아 인문사회 학문 분야의 중요성에 더욱 주목해야 한다""며 ""특히 교육의 본질이 총체적 인간 형성이며 올바른 삶을 지향하도록 옳고 그름을 가르치는 것이 국가교육의 첫 번째 존재 이유이므로 인문사회 분야 교육의 비중도 더욱 커지고 있다""고 강조했다. 그러면서 특위에 ""인문사회 분야 학문진흥과 교육 발전에 유용한 좋은 정책들을 제안해 달라""고 당부했다.",https://n.news.naver.com/mnews/article/277/0005690354
2025-12-08 11:32:00,"카카오페이, 소상공인 기부마라톤 26만명 모았다…국내러닝 최다기록","카카오페이는 온·오프라인 연계 기부 마라톤 '2025 롱런(LONG RUN)' 캠페인을 통해 모은 20억원을 함께일하는재단에 기부했다고 8일 밝혔다. 기부금은 소상공인 대상 지원 사업에 활용될 예정이다.    2025 롱런 온라인 대회엔 26만명의 참여자가 모였다. 오프라인 대회에선 5000명이 함께 달리며 소상공인을 응원했다. 카카오페이에 따르면 2025 롱런 캠페인 참가자는 국내 러닝 이벤트 중 가장 많았다.  온라인 대회는 지난달 14~30일 카카오페이 만보기 서비스를 통해 진행됐다. 기존 목표 10억보를 28시간 만에 채웠고, 두 번째 목표였던 100억보와 세 번째 목표 200억보도 넘었다. 최종 누적 걸음 수는 225억보다.  이에 카카오페이는 당초 10억보 달성 시 약속한 10억원 기부에 추가 목표 달성분을 더해 총 20억원 기부를 확정했다.  오프라인 대회는 지난 6일 경기 하남시 하남미사경정공원에서 5000명의 참가자와 함께 진행했다. 이날 현장에서는 공식 개회 후 참가자 대상 워밍업 프로그램이 진행됐고, 가수 션과 함께하는 10㎞ 코스 레이스가 이어졌다.  완주한 참가자에게는 롱런 완주 메달, 리유저블백, 은박 담요, 카카오프렌즈 핫팩 등 총 9종의 완주 기념 패키지를 전달했다. 레이스 종료 후에는 션의 축하 공연과 기부금 전달식이 열렸다.  카카오페이는 전달식을 통해 총 20억원의 기부금을 함께일하는재단에 전달했다. 기부금은 소상공인 대상 지원 사업에 활용될 계획이다.  시상식과 럭키드로우(행운권) 추첨 등 다양한 프로그램이 이어졌다. 카카오페이는 소상공인 상생 캠페인 '오래오래 함께가게' 부스에서 포토존 이벤트를 진행하며 소상공인 브랜드를 알렸다.  신원근 카카오페이 대표는 ""마라톤 대회에 응원하는 의미를 더해 26만5000여명의 사용자들이 상생의 의지를 직접 실천한 뜻깊은 행사""라며 ""카카오페이 역시 앞으로도 소상공인과 함께 롱런하는 파트너로서 다양한 상생 활동을 확대하겠다""고 말했다.",https://n.news.naver.com/mnews/article/277/0005690353
2025-12-08 11:32:00,[이미지 다이어리] '오차는 용납 못 해',국회 본청 복도에서 작업자들이 레이저 장비를 동원해 액자를 걸고 있다. 한 치의 오차도 허용하지 않겠다는 의지가 새삼 경이롭다.,https://n.news.naver.com/mnews/article/277/0005690352
2025-12-08 11:30:00,"[단독]쿠팡사태 막는다…민간 데이터 유출 방지 지원, 데이터위 신설","정부가 쿠팡 등 민간기업이 보유한 주요 데이터의 외부 유출을 막기 위한 공적 관리 체계 구축에 착수했다. 국가데이터처는 내년에 국가데이터기본법을 제정해 민간 기업이 보유한 데이터의 멸실과 유출 방지를 지원하는 내용을 검토하고 있다. 쿠팡·네이버·카카오 등 민간 플랫폼 내부에 쌓인 데이터까지 국가가 관리 대상으로 규정하는 법적 기반이 마련되는 셈이다. 또 부처 간 데이터 관리를 총괄하는 국가데이터위원회를 신설해 분절된 데이터 거버넌스를 통합할 계획이다.  8일 관계부처에 따르면, 국가데이터처는 데이터 주권 개념을 도입하는 국가데이터기본법 제정과 국가데이터위원회 신설을 추진하고 있다. 데이터 주권은 국가적으로 중요한 데이터가 멸실되지 않도록 보존하고, 국외나 외부로 부적절하게 유출되는 것을 방지하기 위한 의무를 말한다. 정부는 지금까지 국내 법체계에서 이러한 개념이 명문화돼 있지 않아, 데이터 관리의 사각지대가 발생하고 있다고 보고 있다.  정부 고위 관계자는 “쿠팡 사건처럼 중국인 직원이 주요 데이터를 유출한 사건은 우리의 데이터 주권과 연관된다”며 “통계청이 국가데이터처로 승격된 이후 무엇을 할 수 있고 어떤 법적 권한이 필요한지에 대해 검토해 국가데이터기본법 제정안을 만들고 있다”라고 말했다.   민간 기업 데이터도 '국가지정데이터' 지정, 유출 방지 지원  정부는 민간 기업 내부에 축적된 개인정보 외에도 국가 안보나 국민의 삶에 영향을 미치는 주요 데이터는 ‘국가지정데이터’로 지정해 관리 대상으로 포함되도록 할 계획이다. 민간이 보유하고 있는 주요 데이터가 기업의 내부 자산으로만 취급돼서는 안 된다는 판단이다. 정부의 다른 관계자는 “기업 내부에는 개인정보뿐 아니라 점점 더 중요한 데이터가 점점 더 쌓이고 있다”면서 “앞으로는 민간 기업들 또한 이러한 데이터들의 유출을 방지하도록 지원하고, 잘 관리하는지를 정부가 확인하겠다는 것”이라고 설명했다. 앞으로 네이버·쿠팡처럼 대규모 데이터를 축적한 민간 기업도 국가의 관리 틀 안에서 보존과 유출 방지를 지원받게 되는 것이다.  정부는 또 국가데이터위원회(가칭)를 새롭게 설치하는 방안도 구상하고 있다. 국가통계위원회(통계청), 공공데이터전략위원회(행정안전부), 국가데이터정책위원회(과학기술정보통신부) 등이 각각 다른 법적 근거 아래 운영되고 있는 상황에서, 부처 간 데이터 활용을 총괄하는 상위 컨트롤타워가 필요하다는 판단에서다. 기존 위원회를 폐지하는 방식이 아니라, 각 위원회를 개별법 체계로 두면서도 활용 과정에서 발생하는 충돌을 총괄하고 조정하는 데 중점을 둔다.  정부가 별도 컨트롤타워 신설에 나선 배경에는 심화하는 ‘데이터 사일로’(부처나 기관이 각자 데이터를 따로 관리해 서로 연계·공유가 어려워지는 구조적 단절) 문제가 있다. 현재는 금융 데이터를 활용하면 금융위 규제를, 의료 데이터를 결합하면 의료법을, 개인정보가 포함되면 개인정보보호위원회의 규제를 각각 따로 검토해야 한다. 기업이 AI(인공지능) 서비스 개발을 위해 여러 데이터를 결합하려 할 때마다 규제 체계가 중첩돼 법적 리스크와 절차적 지연이 반복되는 구조다. 정부는 데이터 컨트롤타워가 구축되면 이러한 한계를 해소하고 대규모 데이터 연계·활용이 유연해질 수 있는 만큼, 안정적인 데이터 거버넌스가 필요하다는 판단이다.  미국, 일본, 영국 등 주요국도 데이터 통합 거버넌스 구축  해외 주요국에서도 주요 데이터의 관리를 강화하기 위한 통합적인 거버넌스 구조를 갖춰나가고 있다. 일본은 2021년 디지털청을 출범시키면서 공공데이터와 민간데이터 정책을 단일 기관 중심으로 강력히 통합했고, ‘디지털사회형성기본법’을 통해 모든 행정·공공 시스템의 표준화와 메타데이터 관리를 디지털청이 총괄하도록 법제화했다. 데이터 관리·활용 규범을 하나의 기관에 집중시키는 이러한 구조는 아시아 국가 중 가장 높은 수준의 일원화된 데이터 거버넌스로 평가된다.  미국은 모든 연방기관에 최고데이터책임자(CDO·Chief Data Officer) 설치를 의무화하고, 이를 총괄 조정하는 'CDO Council(위원회)'을 운영해 데이터 관리 기능을 연방 차원에서 일원화하고 있다. 영국 역시 공공·행정·통계 데이터를 국가통계청(ONS)을 중심으로 강력하게 통합해 중앙집중형 데이터 거버넌스를 구축하고 있다.",https://n.news.naver.com/mnews/article/277/0005690351
2025-12-08 11:29:00,"변협, 내란전담재판부 반대 표명…“특정 사건 영향 미치는 입법, 순수성 공감 힘들어”","대한변호사협회(협회장 김정욱)가 국회에서 논의 중인 '내란 전담 특별재판부 설치법'과 '법왜곡죄 신설 법안'에 대해 삼권분립과 사법부 독립 원칙을 침해할 소지가 크다며 반대의사를 표명했다.  변협은 8일 성명을 통해 ""입법·사법·행정권의 분립은 민주주의 헌정질서의 근간이며, 어느 한 국가기관도 다른 기관의 고유 권한에 함부로 개입해선 안 된다""며 ""특정 사건이나 특정 집단을 염두에 둔 입법은 법치주의의 핵심 원리인 '법 앞의 평등'에 반할 위험이 크다""고 했다.  변협은 특히 사법부의 재판부 구성과 사건 배당은 헌법이 보장한 사법부 고유 권한임을 강조했다. 변협은 ""정치적 쟁점이 사법부 판단 단계로 넘어간 이상, 그 이후의 판단은 사법부에 맡겨야 한다""며 ""입법부가 특정 시점·특정 사안을 계기로 재판부 구성이나 법관·검사의 직무 수행에 영향을 미치는 입법을 반복하는 것은 헌법상 입법권의 한계를 벗어날 수 있다""고 했다.  법왜곡죄 신설과 같은 형사처벌 규정에 대해서도 ""법관의 독립적 직무 수행을 위축시킬 수 있는 규정은 구성요건 명확성 등 엄격한 헌법적 기준을 충족해야 한다""며 ""현재 논의 중인 법안들이 이러한 기준을 충족하는지 면밀한 검토가 필요하다""고 했다.  변협은 위헌 논란이 장기화될 경우 위헌법률심판 제청이나 헌법소원 등이 제기돼 오히려 관련 재판이 장기 지연되는 부작용이 생길 수 있다고 경고했다. 또한 ""정권 교체 때마다 유사 입법이 반복될 경우 사법부에 대한 국민 신뢰가 훼손되고 법치주의가 흔들릴 수 있다""고 말했다.  변협은 특히 ""사법부 독립은 국민이 정치적 영향으로부터 자유로운 공정한 재판을 보장받기 위한 최후의 보루""라며 ""국회가 삼권분립의 헌법 원칙을 존중해 해당 법안들을 신중하고 충분하게 논의해야 한다""고 촉구했다.",https://n.news.naver.com/mnews/article/277/0005690350
2025-12-08 11:25:00,"광명시, 광명시흥신도시에 4만석 대형 돔 공연장 추진","경기도 광명시가 광명시흥신도시에 국내 최대인 4만석 규모의 돔 공연장 건립을 추진한다.  광명시는 8일 시청 컨퍼런스룸에서 '광명 K-아레나 기본전략 수립용역' 최종보고회를 개최, 이런 구상을 담은 K-아레나 유치 전략을 점검했다.    지난 9월 착수한 지 2개월여 만에 완료한 이번 용역은 정부 국정 과제인 '중대형 복합 공연장형 아레나(K-아레나)' 정책에 대응해 부지 적합성, 건립 규모, 주변 복합개발 방향을 구체화한 것이다.  용역 결과 시는 광명시흥신도시에 최대 4만명을 수용할 수 있는 돔 형식의 아레나를 건립하기로 했다. 이는 국내 아레나 가운데 최대 규모다. 현재 국내에서 운영 중이거나 조성 중인 아레나 공연장은 대부분 2만석 미만 규모다.  시는 세계적으로 영향력이 커지고 있는 K-팝의 위상에 걸맞은 공연시설이 필요하다는 판단에 따라 이같은 건립 규모를 계획했다.  공연장에는 건축음향 설계, 전자음향 시스템, 다양한 무대연출이 가능한 상부 시스템 등 전문적인 공연시설을 갖추고, 시야 제한을 최소화하는 설계를 반영할 계획이다.  아레나는 대중음악 공연뿐 아니라 국가대표 축구팀 경기, e스포츠 대회, 인공지능(AI)·로봇·드론 레이싱 등 미래형 콘텐츠까지 수용할 수 있는 다목적 공연·스포츠 복합시설로 운영할 예정이다.  주변에는 시민체육시설, 호텔·쇼핑몰 등의 상업·편의·숙박시설을 배치해 관람·체험·여가가 결합된 복합 엔터테인먼트 공간을 조성한다.  시는 용역 결과 광명시흥신도시가 아레나 유치에 최적의 입지라는 판단을 내렸다. 신도시 조성 단계에서부터 아레나 중심의 도시계획이 가능한데다, KTX광명역과 신설 전철역 등 우수한 광역교통망이 갖추고 있다는 것이 시의 입장이다. 인천국제공항과 접근성도 뛰어나 해외 관광객 유치에 유리하고, 수도권 서남권의 문화시설 공급 부족 문제를 해소할 수 있다는 점도 장점으로 들었다.  시는 전문가 의견을 반영해 전략을 최종 보완한 뒤, 기본계획을 구체화할 2차 용역을 거쳐 정부 공모 절차에 맞춰 아레나 유치를 본격적으로 추진할 계획이다.  박승원 광명시장은 ""K-아레나는 광명시가 문화·관광 허브 도시로 도약하는 데 좋은 발판이 될 것""이라며 ""정부의 공모 절차에 맞춰 아레나 유치를 내실 있게 준비하겠다""고 말했다.",https://n.news.naver.com/mnews/article/277/0005690349
2025-12-08 11:24:00,"광주교육청, 위법 논란 대안교육기관 등록 취소 절차 돌입","광주시교육청은 8일 유아교육법 위반 논란이 제기됐던 관내 모 종교시설 산하 대안교육기관에 대해 등록취소 절차에 착수했다.    시교육청에 따르면 해당 기관은 일부 초·중등 대안교육시설을 인허가 없이 유아 시설로 운영한 사실이 지역 교육단체 지적으로 드러나 시정명령과 시설 변경 등 행정처분, 과태료 처분을 받은 바 있다. 이후 대안교육기관등록운영위원회 심의 대상이 됐다.  운영위원회는 위법 사실이 중대하다고 판단해 유아 시설뿐 아니라 초·중등 시설까지 함께 등록 취소하기로 결정했다. 시교육청은 청문 절차 등을 거쳐 1개월 이내에 확정할 예정이다.  광주YMCA·광주참교육학부모회·학벌없는사회를위한시민모임 등 지역 8개 단체로 구성된 광주교육시민연대는 이날 보도자료를 내고 ""그동안 드러난 문제의 심각성을 고려하면 타당한 결정""이라며 ""후속 절차를 신속하고 책임 있게 진행하길 바란다""고 밝혔다.  해당 기관은 광주지역 종교시설이 운영하는 대안교육기관으로, 어린이와 청소년 약 400여명이 등록해 교육받아온 것으로 알려졌다.",https://n.news.naver.com/mnews/article/277/0005690348
2025-12-08 11:23:00,"부안예술회관, 22일 '송년음악회' 연다","전북 부안군이 오는 22일 오후 7시 30분 부안예술회관 공연장에서 '김현철의 웃음과 감동이 유일무이한 송년 음악회' 공연을 연다.    8일 군에 따르면 이번 공연은 연말을 맞아 부안군민들이 가족과 함께 즐길 수 있는 특별한 무대로 기획됐으며 지휘자 김현철과 현마에오케스트라가 함께해 클래식의 품격과 유쾌한 무대연출을 결합한 다채로운 레퍼토리를 선보인다.  연말 분위기를 더해 크리스마스 음악, 대중에게 친숙한 클래식 명곡, 화려한 오케스트라 사운드가 어우러져 남녀노소 모두가 즐길 수 있는 무대로 꾸며질 예정이다.  특히 1부는 인기 오페라 서곡의 향연 짜라투스트라는 이렇게 말했다 등이 연주되고 2부는 오페라 아리아 & 메리 크리스마스 주제로 이원용(테너) 여자의 마음, 김성혜(소프라노) 밤의 여왕, 이준규(바리톤) ja vas liubliu(당신을 사랑합니다) 등 명곡의 협연이 구성됐다.  부안예술회관 관계자는 ""유쾌한 웃음과 깊은 감동을 느낄 수 있는 음악으로 올 한 해 지쳤던 마음을 위로받고, 상쾌통쾌한 음악과 함께 희망찬 새해를 맞이하기를 바란다""며 ""많은 군민분의 관심과 참여를 부탁드린다""고 말했다  공연 티켓은 오는 15일 오전 9시부터 티켓링크와 부안예술회관 방문을 통해 예매 가능하며, 전석 1만원(부안군민 1,000원)으로 저렴하게 관람할 수 있다. 자세한 사항은 부안예술회관으로 문의하면 된다.",https://n.news.naver.com/mnews/article/277/0005690344
2025-12-08 11:23:00,"삼성금융, 통합 앱 '모니모' 개편 이벤트","삼성금융네트웍스는 통합 애플리케이션 '뉴(new) 모니모' 오픈 기념 이벤트로 삼성금융사의 각종 혜택을 제공하는 이벤트를 한다고 8일 밝혔다.    오는 21일까지 모니모 앱 이벤트 코너에서 삼성생명 교통 상해보험 및 취미생활 상해보험, 삼성화재 사이버사고 보상보험, 삼성카드 모니머니 3000원 중 하나를 선택하면 자동 응모된다.  이달 말까지 고객의 연말정산 유형을 확인하고 선물을 주는 행사도 한다.  삼성금융은 고객 맞춤형으로 메뉴를 재구성해 모니모를 개편한 바 있다.  삼성금융 관계자는 ""앞으로도 고객들이 모니모를 더 재밌고 유용하게 이용하도록 다양한 서비스와 이벤트를 준비할 계획""이라고 말했다.",https://n.news.naver.com/mnews/article/277/0005690343
2025-12-08 11:23:00,[포토] 의원총회 참석하는 추경호,추경호 국민의힘 의원이 8일 국회에서 열린 의원총회 및 이재명 정부 독재악법 국민고발회 '분야1. 사법부 파괴'에 참석하고 있다.,https://n.news.naver.com/mnews/article/277/0005690345
2025-12-08 11:22:00,[포토] 의원총회 향하는 장동혁-송언석,장동혁 국민의힘 대표와 송언석 원내대표가 8일 국회에서 열린 의원총회 및 이재명 정부 독재악법 국민고발회 '분야1. 사법부 파괴'에 참석하고 있다.,https://n.news.naver.com/mnews/article/277/0005690346
2025-12-08 11:22:00,[포토] 의원총회 발언하는 송언석 원내대표,송언석 국민의힘 원내대표가 8일 국회에서 열린 의원총회 및 이재명 정부 독재악법 국민고발회 '분야1. 사법부 파괴'에서 발언하고 있다.,https://n.news.naver.com/mnews/article/277/0005690341
