날짜,제목,본문,링크
2025-12-13 16:55:00,남성 모델만 집요하게 쓴 70대 CEO...추악한 비밀 밝혀져도 잘 나가는 회사 [오찬종의 매일뉴욕],"오찬종 기자의 매일뉴욕 논란의 중심에 선 아베크롬비   아베크롬비는 말 그대로 ‘논란’을 이끄는 브랜드입니다.  특히 지난 해 마이클 제프리스 전 최고경영자가 수년간 자신의 지위를 이용해 젊은 남성 모델들을 성착취한 혐의가 알려지면서 브랜드 이미지가 크게 훼손됐습니다. 이미 유명한 발언인 “날씬하지 않은 사람들은 우리 옷을 입지 않으면 좋겠다”의 주인공이기도 한 인물이죠.  지난 연말 미 뉴욕 연방검찰은 10년 넘게 아베크롬비를 이끌었던 제프리스와 그의 오랜 동성 애인을 수년간 남성 수십 명을 성착취한 혐의로 기소했습니다. 검찰은 “그가 권력과 부, 영향력을 이용해 자신과 애인의 성적 쾌락을 충족하고자 남성을 사고팔았다”고 설명했습니다.  기소장에 따르면 제프리스 커플은 “모델 활동 기회를 주겠다”며 남성 모델들을 유인해 성관계를 가졌습니다. 피해자 중에는 10대도 포함돼 있으며, 이 과정에서 원치 않는 성관계와 각종 약물 복용까지 강제당했다는 내용이 담겨 있어 충격을 주었습니다.  하지만 체포 당일 제프리스는 보석금을 내고 바로 자유를 얻었습니다. 그리고 이후 다시 구금되었으나 지난 4월엔 돌연 치매에 걸렸다고 주장하며 입원한 뒤 재판을 거부해왔습니다.  최근 상황은 반전을 맞기 시작했습니다. 11일(현지시간) 미 당국은 그가 성매매 혐의 재판을 받을 수 있을 만큼 정신적으로 적합하다는 판단을 받았다고 밝혔습니다.  이 같은 논란으로 아베크롬비는 불매운동까지 벌어지면서 브랜드 이미지에 큰 타격을 받았습니다. 논란에 더해 특유의 ‘슬림핏’ 디자인도 시대에 뒤처진다는 평가를 받은 지 오랩니다.  그러나 이런 논란이 무색하게도 오히려 회사 실적은 정반대로 호조를 나타냈습니다.  지난달 말 아베크롬비의 주가는 20% 넘게 장중 급등했습니다. 그 중심엔 홀리스터(Hollister)가 있죠.  아베크롬비는 홀리스터와 아베크롬비 브랜드를 보유 중입니다. 아베크롬비는 회계연도 2025년 3분기 매출이 전년 대비 7% 증가한 12억9000만달러로 시장 전망치인 12억8000만달러를 웃돌았다고 밝혔습니다. 같은 기간 주당순이익(EPS)은 2.36달러로 역시 시장 전망치인 2.16달러를 넘어섰습니다.  특히 산하 브랜드 홀리스터가 Y2K 감성을 전면 앞세우며 실적 성장을 견인했습니다.  홀리스터는 지난 2012년 국내에도 진출했던 아메리칸 캐주얼 브랜드입니다. 2000년대 초반 국내에서 아베크롬비, 홀리스터, 갭 등의 아메리칸 캐주얼 브랜드들이 인기를 끌면서 구매대행 열풍도 불었습니다.  이 같은 인기에 2012년 홀리스터, 2013년에는 자매 브랜드인 아베크롬비가 직진출했고, 한때는 국내서 준명품 브랜드로 인식되기도 했습니다. 하지만 미국보다 훨씬 비싼 가격이 결국 발목을 잡아 입지가 위축됐습니다. 결국 국내 시장에선 철수했죠. 글로벌 시장에서도 점점 트렌드에서 뒤로 밀려나갔죠.  하지만 지난해부터 반전이 벌어졌습니다. 성장의 핵심은 홀리스터가 선보인 Y2K 모델 라인업 입니다. 2000년대 초반 감성을 재현하며 매장 분위기부터 디자인까지 레트로 분위기를 재현했습니다.  그 결과 홀리스터의 올해 3분기 순매출은 6억7330만 달러로 전년 대비 16% 늘어났습니다.  투자은행 제프리스(Jefferies)는 아베크롬비의 목표 주가를 기존 105달러에서 115달러로 약 9.5% 상향 조정하며 ‘매수’ 의견을 유지했습니다. 제프리스뿐만 아니라 모건 스탠리, JP모건 등 월가의 주요 분석가들도 잇달아 목표 주가를 올리고 있으며, 회사의 일관된 실행력과 브랜드 관리 능력을 높이 평가하여 ‘시장 수익률 상회(Outperform)’ 의견을 내놓고 있습니다.  아베크롬비는 과연 논란을 딛고 레트로 열풍을 타고 승승장구를 이어갈 수 있을까요",https://n.news.naver.com/mnews/article/009/0005605560
2025-12-13 16:54:00,2026년은 붉은 말띠 해…적토마·붉은말 도깨비 에디션 와인이 뜬다,"말을 소재로 한 와인 화제   2026년 붉은 말의 해(丙午年)를 앞두고 와인업계에서 말(馬)을 모티프로 한 라벨과 스토리를 내세운 제품이 주목받고 있다. 말이 상징하는 역동성과 승리 이미지가 새해 선물용·연말연시 모임용 와인과 맞아떨어지며 수요가 늘고 있다  9일 와인업계에 따르면 대표 제품으로는 ‘디아블로 붉은 말의 해 도깨비 에디션’, ‘후소네 그란 리제르바’, ‘1865 셀렉티드 빈야드 적토마 에디션’, ‘14핸즈 메를로’ 등이 꼽힌다. 산지는 다르지만 말 이미지를 라벨에 전면 배치한 ‘말 에디션’이라는 공통점이 있다.  K컬처 수묵화 속 붉은 말, 디아블로 붉은 말의 해 도깨비 에디션 ‘디아블로 붉은 말의 해 도깨비 에디션’은 붉은 말을 수묵화 스타일로 그린 라벨이 특징이다. K컬처 감성을 담아 한국 시장 전용으로 제작된 한정판이다. 세계적인 와인 브랜드 ‘디아블로’가 한국 시장만을 위해 매년 선보여 온 도깨비 리미티드 시리즈의 네 번째 에디션이다.  라벨은 병 전체를 감싸는 수묵화 스타일이 특징이다. 붉은 말을 붓터치가 살아 있는 수묵화 느낌으로 표현하고 그 위에 도깨비 얼굴과 불꽃을 더해 전통 한국화와 현대적인 그래픽을 함께 담았다.  와인은 칠레 센트럴 밸리산 카베르네 소비뇽으로 만든 레드 와인이다. 잘 익은 체리와 자두, 블랙커런트 향이 풍부하며 은은한 토스트와 커피 노트가 뒤를 받친다.  칠레 명마의 이름을 딴 승리의 와인, 후소네 그란 리제르바 ‘후소네 그란 리제르바(Hussonet Gran Reserva)’는 이름부터 말과 연결된 와인이다. 칠레 경마계에서 세계 대회를 석권했던 명마 ‘후소네’의 이름을 그대로 사용해 현지에서는 승리의 와인으로 불린다.  이 와인을 만드는 하라스 데 피르케(Haras de Pirque)는 피르케의 종마장이라는 뜻이다. 1892년 세워진 칠레의 경주마 목장에서 이름을 가져왔고 폴로 선수 출신 와인 애호가 에두아르도 마테가 마이포 밸리 피르케 지역의 종마장과 포도밭을 인수하며 본격적인 와인 생산을 시작했다. 이후 이탈리아 명가 안티노리가 가능성을 높이 평가해 2017년 와이너리를 전면 인수했고 지금은 안티노리 수석 와인메이커가 품질을 관리하고 있다.  이 와인은 칠레 마이포 밸리산 카베르네 소비뇽 100%로 만든 그랑 리제르바급 와인이다. 짙은 색감과 함께 스파이스, 민트, 로즈마리 향이 차례로 느껴지고 입 안에서는 부드러운 질감과 단단한 구조감이 긴 여운을 남긴다.  붉은 라벨속 강렬한 붉은 말, 1865 셀렉티드 빈야드 적토마 에디션 이른바 골프 와인으로 널리 알려진 ‘1865’는 2026년 붉은 말의 해를 기념해 ‘1865 셀렉티드 빈야드 적토마 에디션’을 선보인다. 1865는 칠레 와이너리 설립 연도를 브랜드명으로 사용해 전통을 강조하는 프리미엄 라인으로, 국내에서는 골프장과 멤버십 라운지에서 자주 만나며 자연스럽게 골프 와인이라는 별칭을 얻었다.  이번 적토마 에디션은 라벨에 ‘2026 HORSE’라는 문구와 함께 힘 있게 질주하는 붉은 말의 이미지를 담았다.  와인은 칠레 마이포 밸리에서 엄선한 포도로 만든 카베르네 소비뇽 100% 레드다. 진한 루비색에 잘 익은 블랙커런트와 자두 향이 먼저 느껴지고 뒤이어 시가 상자와 다크초콜릿 뉘앙스가 은근하게 올라온다  미국 서부 초원을 달리는 야생마, 14핸즈 메를로 미국 워싱턴주 콜롬비아 밸리를 대표하는 브랜드 ‘14핸즈(14 Hands)’는 애초에 말에서 출발한 와인이다. ‘14핸즈’라는 이름은 워싱턴 동부 평원을 누비던 야생마의 어깨 높이에서 따온 것으로 브랜드의 정체성을 그대로 보여준다.  이 와인은 미국 워싱턴주 콜롬비아 밸리에서 수확한 메를로를 중심으로 만든 레드 와인이다. 블랙베리, 자두, 체리 향과 함께 모카 뉘앙스가 퍼지며 산도와 타닌이 부드럽게 균형을 이룬다.  아영에프비씨 변원규 팀장은 “2026년 말띠 해를 맞아 말 이미지를 전면에 내세운 와인은 단순한 한정판을 넘어 새해의 기운을 나누는 상징이 되고 있다”며 “선물용·모임용으로 고르기 좋은 신년 아이템”이라고 말했다.",https://n.news.naver.com/mnews/article/009/0005605559
2025-12-13 16:52:00,“앞을 봐야지 당신이 죽였어” 기소한 검찰…법원 “이건 무죄”[어쩌다 세상이],"새벽 중앙분리대 넘다 80대 사망 법원 “‘불가항력’ 상황, 운전자 무죄” 검찰, 법원 판결에 항소…2심 진행   운전을 하는 사람이라면 누구나 ‘방어 운전’의 중요성을 귀에 딱지가 앉도록 듣습니다. ‘전방을 잘 살피라’는 말은 운전자의 제1원칙이자 법적 의무이기도 합니다.  하지만 운전자가 도저히 예측할 수 없는 상황에서, 그것도 법규를 어긴 상대방 때문에 발생한 사고라면 어떨까요? 운전자가 모두 책임져야 할까요?  법에는 ‘신뢰의 원칙’이라는 것이 있습니다. 교통규칙을 준수하며 운전하는 사람은, 다른 사람도 규칙을 지킬 것이라고 믿어도 되며, 다른 사람이 규칙을 어기는 비이성적인 행동까지 미리 예견하고 대비할 의무는 없다는 원칙입니다.  ‘설마 여기서 사람이 튀어나오겠어?’라는 운전자의 상식적인 믿음을 법이 보호해 준다는 의미죠.  최근 법원은 이 원칙을 적용해 칠흑 같은 새벽, 중앙분리대가 설치된 왕복 6차로 도로를 무단횡단하던 80대 노인을 치어 숨지게 한 운전자에게 ‘무죄’를 선고했습니다. 운전자의 ‘주의의무’ 위반보다는, 도저히 피할 수 없었던 ‘불가항력’에 손을 들어준 사례입니다.  사건은 올해 2월 어느날 새벽 6시께 한 대로변에서 발생했습니다. 회사원인 A씨는 자신의 승용차를 몰고 이동 중이었습니다. 이 당시 해가 뜨기 전인 새벽이라 사방이 어두웠습니다. A씨가 달리던 곳은 왕복 6차로의 도로였고 도로 중앙에는 무단횡단을 막기 위한 중앙분리대도 있었습니다.  A씨는 규정 속도 60km를 준수하며 주행 중이었는데, 갑자기 차량 앞쪽으로 피해자가 나타났습니다. A씨는 급히 제동을 걸었지만 안타깝게도 사고는 이미 발생했습니다. 피해자는 병원으로 옮겨졌으나 두 달여 만에 숨을 거뒀습니다.  검찰 “전방주시 게을리”…운전자 기소 검찰은 A씨가 “전방주시를 게을리 했다”며 교통사고처리특례법 위반(치사) 혐의로 기소했습니다.  그러나 재판부는 “도로교통법상 보행자는 횡단보도가 아닌 곳에서 건너서는 안된다”며 “운전자는 보행자가 중앙분리대가 설치된 곳을 넘어 갑자기 튀어나오지 않을 것이라고 신뢰하는 것이 당연하다”고 판시했습니다.  여기에 더해 사고 당시 피해자가 검은 옷을 입었던 점, 반대 차선 불빛으로 시야 방해 가능성도 존재한다는 점 등을 들어 운전자 A씨에 대해 무죄를 선고했습니다.  한세영 법무법인 한앤율 변호사는 “안타까운 사고지만 법적 책임의 영역은 냉정하다”며 “교통사고의 발생이 운전자로서는 도저히 예상하기 어려운 상황에서 벌어진 것이라면 운전자는 사고로 인해 발생한 결과에 대해 아무런 처벌을 받지 않을 수도 있다”고 말했습니다.  한 변호사는 “이는 관련한 민사상 손해배상 청구에도 큰 영향을 미친다”며 “혹여 가해자로 경찰 조사를 받게 됐는데 교통사고가 전혀 예상하기 어려운 상황에서 발생했다면 이런 점을 수사기관에 적극 주장할 필요가 있다”고 조언했습니다.  이 사건은 1심에서 법원이 운전자 손을 들어줬으나 검찰이 항소함에 따라 2심이 진행될 예정입니다.",https://n.news.naver.com/mnews/article/009/0005605558
2025-12-13 16:52:00,TK 빼고 다 내준 국민의힘…‘레드팀’이 구원투수 역할 할까,"지방선거 6개월도 안 남았지만, 국민의힘, ‘박스권 지지율’ 신세  20·30에게 ‘쓴소리’ 듣기로 張 대표 “고칠 점 말해달라”   과거 로마 가톨릭교회에서 차기 교황을 선출하는 ‘콘클라베’가 시작되면 가장 중요한 역할 중 하나는 ‘악마의 대변인(Devil’s Advocate)’이었다. 이는 새 교황 후보자를 상세하게 분석하고 파고들어 과거 행적이나 발언에 대한 부정적 견해를 제시하는 역할을 뜻한다.  사람은 물론, 나아가 조직 전반의 흠결까지 바로잡는 성과를 냈던 이 역할이 최근 ‘박스권 지지율’에 갇힌 국민의힘에도 등장했다. 내년 지방선거를 앞두고 분위기 반전이 절실한 시점이나, 원내 의견만으로 활로를 찾기 어렵다는 위기감이 작용한 것으로 보인다.  ‘내부총질 면허’ 발부한 국민의힘 국민의힘은 지난 11일 서울 여의도 국회에서 일명 ‘쓴소리 특별위원회’를 출범시켰다. 공개 모집으로 선발한 2030 청년 15명으로 구성된 이 특위는 청년의 시각에서 당 정책과 주요 현안을 진단한 뒤 의견을 지도부에 전달하는 역할을 맡는다.  장동혁 대표는 특위 임명장을 수여한 뒤 가진 간담회에서 “군대에서도 가장 중요한 게 ‘레드팀’을 동원한 가상 전투 훈련이다. 레드팀 공격력이 강할수록 실전에서 싸워 이길 전투력이 강해지고 강한 군대가 된다”며 “레드팀 역할을 충실히 해 달라”고 당부했다.  장 대표는 이어 “당이 어떤 게 부족하고 취약한지, 어떤 것을 고쳐야 하는지 허심탄회하게 말해 달라”며 “진정한 쇄신과 변화는 불편한 진실, 쓴소리를 외면하지 않을 때 시작된다. 여러분의 쓴소리가 강할수록 당은 더 강해질 것”이라고 부연했다.  우재준 청년최고위원 역시 “여러분은 ‘내부총질’할 면허가 있으니 마음껏 해도 된다. 제 욕을 해도 좋고, 대표님 욕을 해도 대표가 충분히 잘 들어줄 것”이라며 “당이 발전하고 내년 지방선거에서 더 나은 대한민국을 만드는 데 소중한 목소리를 모아가겠다”고 말했다.  20~30대 청년층으로 꾸려졌지만, 특위가 교육·취업·주거·육아 등 청년과 직결된 사안만 논하는 것은 아니다. 임명장 수여식 이후 이뤄진 첫 회의에서는 12·3 비상계엄 사태에 대한 당의 사과, 당내 갈등 문제 등에 대한 논의 역시 오간 것으로 전해졌다.  텃밭 PK서도 민주당 상대로 열세 우 최고위원의 언급처럼 국민의힘이 ‘내부총질 면허’를 발급한 건 6·3 대선 이후 국민의힘 지지율이 저조한 상황과 무관치 않아 보인다. 지방선거가 6개월도 채 남지 않았지만, 당은 중도층은 물론이며 보수성향 유권자들의 표심도 온전히 휘어잡지 못하고 있다.  엠브레인퍼블릭·케이스탯리서치·코리아리서치·한국리서치가 지난 8∼10일 실시한 전국지표조사(NBS)에 따르면 국민의힘 지지율은 20%로, 더불어민주당(44%)의 절반에도 미치지 못했다. 대구·경북(TK)에서는 국민의힘(40%)이 여당(23%)을 앞섰으나, 그 외 모든 지역에서 열세였다.  지역별로 살펴보면 국민의힘은 ▲서울 34%포인트 ▲인천·경기 29%포인트 ▲강원·제주 25%포인트 ▲대전·세종·충청 7%포인트 순으로 여당과 차이를 보였다. TK와 더불어 보수진영 ‘텃밭’으로 불리던 부산·울산·경남(PK)에서도 여당과 지지율 격차가 13%포인트였다.  국민의힘과 민주당 간 지지율 격차가 가장 컸던 지역은 광주·전라였다. 민주당 지지율이 67%인 반면 국민의힘 지지율은 3%에 그쳤다. 호남이 전통적으로 진보 진영 지지세가 강해 보수 정당의 ‘험지’라 불린다는 점을 감안해도 압도적인 열세다.  국민의힘 지지율(NBS 조사 기준)은 올해 8월 첫째 주 16%로 최저치를 기록한 뒤 10월 5주 차에 25%까지 반등했다. 그러나 지난달부터 이달 초까지 20%대 초반을 벗어나지 못하고 ‘박스권’에 갇혀 있다. 반면 여당은 이재명 정부 출범 이후 40%대 안팎을 유지 중이다.  ‘레드팀’ 기대감 속 회의적 시선도 상황이 이렇다 보니 야권에서는 현 지도부 책임을 무시하기 어렵단 주장이 연일 힘을 받고 있다. 대장동 항소 포기 사건 등 정부·여당의 리스크가 큰 상황에 통일교와의 정교유착 논란까지 여권으로 확대되고 있음에도 국민의힘 지지율이 좀처럼 반등하지 못하고 있어서다.  여기에 12·3 비상계엄 사태 1주년 때 장 대표의 공식 사과가 없었던 점, 당내 소장파 의원들의 잇따른 쇄신 요구, ‘당원 게시판 사태’를 둘러싼 계파 갈등 재점화 등이 한데 맞물리자, 지도부가 자구책 차원에서 특위 구성을 결심한 것으로 풀이된다.  장 대표를 비롯한 현 지도부는 특위의 쓴소리를 귀담아듣고 이를 당 운영에 적극 반영하겠다는 계획이다. 지도부를 비롯한 국민의힘 인사들 전반이 특위에 기대감을 품는 분위기지만, 당내 일각에서는 그 실효성에 대한 의문도 제기되고 있다.  익명을 요한 한 야권 관계자는 “지금까지 원내에서, 또는 원외에서 당 쇄신 방향에 대한 이야기가 안 나왔던 것도 아니지 않나”라며 “중요한 건 당의 쇄신 의지다. 뼈를 깎는 혁신으로 국민 앞에 읍소해야 지방선거에서도 승산이 있을 것”이라고 비판했다.  한편 기사에 인용된 NBS 조사는 만 18세 이상 1000명을 대상으로 휴대전화 가상번호(100%)를 이용한 전화 면접으로 이뤄졌다. 표본 오차는 95% 신뢰수준에서 ±3.1%포인트다. 응답률은 18.8%였다. 더 자세한 내용은 중앙선거여론조사심의위원회 홈페이지를 참조하면 된다.",https://n.news.naver.com/mnews/article/009/0005605557
2025-12-13 16:49:00,“피해액은 8600억인데 기금은 고작 14억”…77명 숨진 ‘네팔 Z세대 반정부 시위’,"지난 9월 네팔에서 77명이 숨진 이른바 ‘Z세대 반정부 시위’로 8600억원대 피해가 발생한 것으로 집계됐다.  13일(현지시간) 로이터 통신에 따르면 네팔 임시정부는 지난 9월 발생한 반정부 시위 피해액이 5억8600만달러(약 8650억원)라고 밝혔다.  당시 반정부 시위로 총리실을 비롯해 대법원, 국회의사당, 정치인 사저, 호텔 등 공공시설과 민간시설이 불에 탔다.  피해액을 산정하기 위해 구성된 위원회는 재건 비용이 2억5200만달러(약 3700억원)를 넘을 것으로 추산했다.  임시정부는 기금을 조성해 재건 비용을 모으고 있지만 지금까지 일반 시민과 기관 등이 낸 모금액은 100만달러(약 14억7000만원)도 되지 않는다.  네팔에서는 지난 9월 정부가 유튜브와 페이스북 등 26개 소셜미디어(SNS)의 접속을 차단하자 대규모 시위가 벌어졌다.  특히 부패 척결과 경제 성장에 소극적인 정부에 실망한 젊은 층인 Z세대가 대거 시위에 가담하면서 수도 카트만두뿐만 아니라 다른 도시로도 확산했다.  경찰은 최루탄을 비롯해 물대포와 고무탄을 쏘며 강경 진압했고, 경찰관 3명을 포함해 77명이 숨지고 2000여 명이 다쳤다. 사망자들 가운데 30여명은 실탄에 맞아 숨진 것으로 드러났다. 네팔 임시정부는 내년 3월 5일 총선을 치를 예정이다.",https://n.news.naver.com/mnews/article/009/0005605556
2025-12-13 16:45:00,"“수능영어 미친 수준, 직접 풀어봐라”…영국 BBC도 놀랐다","영국 공영방송 BBC는 올해 수능 영어 영역의 극도로 높은 난이도로, 한국 수험생들 사이에서 벌어진 ‘불영어’ 논란을 보도했다.  BBC는 11일(현지시간) 보도에서 “수능 영어가 악명이 높을 정도로 어렵다”며 “(일부 학생들이) 고대 문자를 해독하는 것 같다거나, 미친(insane) 수준이라고 평가한다”고 소개했다.  특히 39번 문항이 집중 조명을 받았다. 이 문제는 비디오 게임 참여자가 가상현실을 인식하는 방식을 다룬 지문에서 문장의 위치를 찾는 문제였는데, 단어 선택과 문장 구조가 지나치게 복잡하다는 지적을 받았다.  BBC는 “많은 이들이 해당 문항을 포함해 여러 문제의 단어 사용을 문제 삼았다”고 보도했다.  최고 난이도 문항으로 평가받은 34번 문제에는 독일 철학자 임마누엘 칸트의 법철학이 등장했다. ‘법치가 안전과 평화뿐 아니라 자유를 보장한다’는 칸트의 견해를 설명한 후 빈칸에 적절한 문장을 선택하는 문제였다.  BBC는 이 지문을 직접 제시하며 “자신을 시험해보고 싶다면 풀어보라”고 독자들에게 권했다. 미국 온라인 커뮤니티 레딧에서는 이 문제를 두고 “잘난 척하는 말장난” “형편없는 글”이라는 비판이 나왔다고 BBC가 덧붙였다.  BBC는 한국의 수능 제도 전반에 대해서도 상세히 소개했다. 수능을 “매년 11월 치러지는 악명 높은 8시간짜리 ‘마라톤’ 시험”이라며 “대학 진학뿐만 아니라 직업, 소득, 미래 인간관계에도 영향을 미친다”고 설명했다.  이어 “학생들은 국어, 수학, 영어, 사회, 과학 등에서 약 200문항을 풀어야 하며, 많은 청소년이 이 시험을 준비하며 성장하고 일부는 네 살 때부터 학원에 다닌다”고 BBC는 전했다.  시험 당일에는 항공기 이착륙 시간 조정, 공사 중단, 군사 훈련 연기 등 전국적인 조치가 이뤄진다고도 했다.  BBC는 “시험 난이도를 둘러싼 비판과 혼란 속에서 최고 책임자가 책임을 지고 물러났다”며 오승걸 한국교육과정평가원장이 지난 10일 중도 사임한 사실도 보도했다.  매체는 “1993년 수능 도입 이후 12명의 평가원장 가운데 3년 임기를 모두 채운 인물은 4명뿐이며, 대부분은 문항 오류로 사임했다”며 “난이도 문제로 사임한 것은 오 원장이 처음”이라고 했다.",https://n.news.naver.com/mnews/article/009/0005605555
