날짜,제목,본문,링크
2025-12-05 17:27:00,"""똥묻은 개, 겨묻은 개 비판"" … 국힘 '절윤 갈등' 악화일로","여야 지도부 리더십 흔들 국힘중진 윤한홍, 장동혁 직격 계엄사과 놓고 당 내홍 격화 野지지율 답보속 張고립 심화    '찐윤'(원조 친윤석열)으로 불렸던 3선 중진 윤한홍 국민의힘 의원이 5일 장동혁 국민의힘 대표 면전에서 ""똥 묻은 개가 겨 묻은 개를 비판하는 꼴""이라며 직격했다.  초·재선 중심 국민의힘 의원 25명이 12·3 비상계엄 사과와 함께 윤석열 전 대통령과의 절연을 공개 선언하며 장 대표에게 강력한 쇄신을 요구한 가운데 중진들까지 동참하면서 당내 갈등이 격화하고 있다.  윤 의원은 이날 국회에서 열린 '혼용무도 이재명 정권 6개월 국정평가 회의'에서 장 대표를 향해 ""똥 묻은 개가 겨 묻은 개 비판하는 꼴이니, 우리가 아무리 이재명 정부를 비판해도 국민들 마음에 다가가지 못한다. 백약이 무효""라고 했다. 이어 ""와신상담의 자세로 윤 전 대통령과 인연, 골수 지지층의 손가락질을 다 벗어던지고 계엄의 굴레에서 벗어나자""고 말했다.  그는 ""국정 마비가 계엄의 원인이라는 얘기는 더는 하면 안 된다""며 ""이런 논리로 계엄이 정당화될 수 없다""고 이른바 '계몽령' 주장과도 명확히 선을 그었다. 이는 장 대표가 지난 3일 페이스북을 통해 밝힌 '계엄은 의회 폭거에 맞선 것'이라는 메시지를 정면으로 겨냥한 것으로 풀이된다.  윤 의원은 윤석열 정부 출범 초기부터 권성동·장제원·이철규 의원 등과 함께 대표적인 친윤으로 꼽혔던 PK(부산·경남) 기반 중진이다. 윤 의원이 윤 전 대통령과 단절을 공개적으로 요구한 것이어서 당내 파장이 일고 있다. 게다가 이날 회의는 12·3 계엄 1년을 지나 당 소속 상임위원장과 간사 등을 불러모아 대여 투쟁 전열을 다지기 위한 성격으로 열린 자리여서 충격은 더 컸다. 앞서 소장파와 친한(친한동훈)계로 분류되는 초·재선 의원 등 25명은 지난 3일 국회에서 별도로 대국민 사과문을 발표했다. 당시 사회관계망서비스(SNS)를 통한 개별 사과 입장 표명도 잇따랐다.  당 지도부는 즉각 사태를 수습하는 모습이다. 신동욱 국민의힘 최고위원은 매일경제와 통화에서 ""당에서 여러 목소리가 나오는 것은 건전한 현상""이라며 ""이를 지도부에 대한 반기로 해석하는 것은 잘못된 분석""이라고 설명했다.  이날 박성훈 국민의힘 수석대변인도 회의를 마치고 기자들과 만나 ""다양한 스펙트럼을 가지고 다양한 목소리가 나오는 게 정상적인 민주 정당이라고 생각한다""며 ""우리 당을 아끼고 사랑하는 마음에서 나온 발언이라고 생각한다""고 설명했다. 장 대표는 '계엄은 의회 폭거에 맞선 것'이라는 발언이 당내 강성 지지층의 입장을 고려해 고심 끝에 내린 결정이었다는 견해를 갖고 있는 것으로 알려졌다.  당 지도부가 진화에 나섰지만 회의장 밖에서도 지도부를 향한 비판의 목소리가 나왔다. 이성권 국민의힘 의원은 이날 매일경제와 통화에서 ""윤 의원의 발언은 지극히 자연스러운 당내 여론을 반영한 결과""라면서 ""원내지도부와 당 지도부를 제외한 거의 대부분 의원과 접촉한 결과, 반 이상이 윤 전 대통령과 단절이 필요하다는 의견이었다""고 동조했다.  국민의힘 정당 지지율이 답보 상태라는 점은 장 대표의 리더십에 대한 위기감을 고조시키고 있다. 한국갤럽이 이날 발표한 자료에 따르면 더불어민주당은 12월 첫주 정당 지지도 조사에서 43%를 기록하며 국민의힘(24%)을 크게 앞선 것으로 나타났다. 특히 중도층에서는 민주당 42%, 국민의힘 17%로 격차가 더 크다. 한 재선 의원은 ""당이 여전히 강성 지지층의 포로가 돼 있다""고 평가했다.  [이효석 기자]",https://n.news.naver.com/mnews/article/009/0005601654
2025-12-05 17:27:00,'1인1표제' 중앙위서 부결…정청래표 개혁안 급제동,"여야 지도부 리더십 흔들 민주, 영남 등 가중치 보완에도 재적과반 미달로 통과 못해 개혁 주도 鄭대표 당원에 사과    정청래 더불어민주당 대표가 추진하던 '1인 1표제' 당헌 개정안이 5일 열린 민주당 중앙위원회에서 부결됐다. 앞선 1인 1표제 개정안 관련 당원 여론조사 때와 유사하게 개정안 투표가 의결정족수에 미치지 못한 것이다. 대의원과 권리당원 표의 가치를 동등하게 맞추는 것을 골자로 하는 이번 당헌 개정안은 전일 당무위원회에서 만장일치로 통과됐지만 중앙위원회 문턱을 넘지는 못했다.  특히 정 대표가 이재명 대통령이 출국길에 오르자마자 당헌 개정을 위한 당원투표 실시를 천명한 후 논란 끝에 보완해 추진한 당헌 개정이 무산되면서 정청래 지도부의 리더십이 시험대에 올랐다는 말이 나온다.  민주당 중앙위원회는 이날 전국 중앙위원 596명을 대상으로 투표를 진행한 결과 해당 안건이 부결됐다고 밝혔다. 투표에는 중앙위원 총 596명 중 373명이 참여했는데, 이 중 271명이 찬성했다. 중앙위에서 안건이 의결되려면 재적 위원 과반(299명)이 찬성해야 하지만 정족수에 미달한 셈이다. 투표 결과에 대해 조승래 민주당 사무총장은 ""중앙위원들의 의견을 존중한다""면서도 ""(정 대표가) 가장 큰 공약으로 내걸었는데 중앙위에서 받아들여지지 않은 것이 안타깝다""고 말했다. 이어 ""중앙위원들이 갖고 있는 여러 권한을 당원들에게 대폭 이양하는 문제에 대해 약간 조심스러움이 작용한 것 같다""며 ""당원·대의원 역할 태스크포스(TF)에서 여러 논의를 진행해야 할 것 같다""고 덧붙였다.  1인 1표제를 둘러싼 당 내홍은 계속돼왔다. 민주당 초선 의원 모임과 친명계 의원들을 중심으로 개정안 통과에 부정적인 의견이 나왔고, 지난 1일 열렸던 공개 토론회에서는 극렬히 반대하는 당원들이 나오는 등 정 대표 사퇴 촉구 시위까지 벌어졌다. 일부 민주당 당원은 지난달 24일 1인 1표제 당헌·당규 개정에 정당성이 없다며 법원에 가처분 신청을 내기도 했다.  이 같은 반대에도 1인 1표제 당헌 개정안이 전일 열린 당무위원회에서 만장일치로 통과되며 중앙위에서도 무난하게 통과될 것이란 분위기가 나왔다. 특히 영남 등 당세가 약한 지역 의견이 소외될 수 있다는 우려와 당내 숙의가 부족했다는 지적을 보완하기 위해 '대의원 역할 재정립을 위한 TF'가 꾸려져 해당 TF에서 논의된 보완책을 반영한 수정안이 중앙위에 올라간 상황이었다.  정 대표는 이날 최고위원회의에서 ""그동안 숙의 과정이 좀 부족하다는 지적과 함께 영남 등 전략 지역 보정에 대한 당원과 지도부의 요구가 있었다""며 ""TF에서 만장일치로 조정한 합의 내용이 중앙위 수정안으로 올라간다""고 말하기도 했다.  보완책이 반영된 수정안이 올라갔음에도 대다수 당원의 지지를 받지 못하면서 개정안이 통과되지 못한 것으로 해석된다. 이에 민주당 관계자는 ""사실상 기권으로 정 대표가 밀어붙인 당헌 개정안에 불만을 표시한 것 아니겠느냐""고 설명했다.  이날 중앙위에서는 기초·광역의원 비례대표 선출 시 권리당원에게 후보 선출권을 주고 예비경선제를 도입하는 등의 당헌 개정안 역시 부결됐다. 해당 안건은 중앙위원 373명이 투표에 참여해 297명이 찬성했다.  정 대표는 이날 중앙위 당헌 개정안 부결 후 국회에서 예정에 없던 기자간담회를 열고 ""전당대회 때 약속한 공약을 지키기 위해 노력했으나 중앙위에서 부결됨으로써 저의 약속을 지킬 수 없게 됐다""며 ""당원 여러분께 진심으로 사과드린다""고 밝혔다.  [박나은 기자 / 전경운 기자]",https://n.news.naver.com/mnews/article/009/0005601653
2025-12-05 17:26:00,"CBRE, 분양형 복합 상업시설 자문 7만㎡ 달성…리테일 전략으로 전국 주요 상권 재정의","글로벌 종합 부동산 서비스 기업 CBRE코리아는 2025년 ‘분양형 복합 상업시설 전문화(Retail Planning & Leasing)’팀을 중심으로 전국 주요 거점에서 복합 리테일 자문 프로젝트를 성공적으로 수행하며 2026년 시장 주도 전략에 본격 착수한다고 5일 밝혔다.  CBRE코리아는 올해 총 7만㎡ 규모에 달하는 분양형 복합 상업시설 자산을 대상으로 상업시설 MD 기획부터 임대 운영까지 전 주기에 걸친 리테일 자문 서비스를 제공했다. 주상복합 단지를 포함한 지역별 대형 상업시설은 물론, 주택재개발·도시정비사업 등 복합개발 초기 단계에서 마스터플랜 수립과 수익성 기반 MD 전략까지 분양형 상업시설에 특화된 리테일 통합 솔루션 역량을 입증하고 있다.  ‘분양형 복합 상업시설 전문화’팀의 리테일 자문 서비스 핵심은 지역별 상권 특성과 자산 유형에 최적화된 맞춤형 솔루션을 제공하는 데 있다. 대구·부산·인천 등 주요 도시권에서는 대형 앵커 브랜드 유치를 통한 상권 리포지셔닝을, 동탄·가산·마곡 등 신흥 복합지구에서는 소비 라이프스타일에 최적화된 리테일 조합을 제안해 상업시설의 자산 가치를 극대화하고 있다.  맞춤형 리테일 전략으로 지역 상권을 재정의한 대표 사례로는 대구 동성로 ‘더샵 센트리엘 스퀘어몰’이 있다. CBRE코리아는 동성로 중심 주상복합 상업시설에 모던하우스 등 체험형 MD와 아쿠아밸리, 고메스퀘어, 플랫폼넘버원, 팅커워시 등 집객형 콘텐츠를 전략적으로 구성해 해당 자산이 동성로 핵심 상권을 대표하는 리테일 랜드마크로 자리매김할 수 있도록 하고 있다.  또한 올해는 서울 한남3구역, 부산 사직5구역, 인천 구월 옛 롯데백화점 등 도시정비·복합개발 자산에 대한 마스터플랜 및 MD 전략 수립을 통해 기획 자문 영역을 확장했다. 2026년에도 서울 주요 상권을 비롯해 일산, 용인, 인천, 대구, 수원, 부산 등 주요 거점 도시에서 대형 미분양 및 복합개발 자산을 대상으로 상가 활성화 자문을 확대할 계획이다.  지선명 CBRE코리아 분양형 복합 상업시설 전문화팀 상무는 “복합 상업시설의 리테일은 단순한 판매 공간을 넘어 복합 문화·생활 중심 공간으로 진화하고 있으며 이에 따라 지역 상권의 특성과 상권주기, 소비 흐름을 반영한 정교한 전략이 요구된다”고 말했다. 이어 “특히 미분양 상업시설 등으로 어려움을 겪고 있는 시행사·건설사에는 상업시설 마스터플랜 수립부터 MD 기획, 앵커 테넌트 유치, 테넌트 믹스 설계, 임대 운영 전략까지 전 주기를 아우르는 맞춤형 자문을 통해 공실 리스크를 낮추고 분양성과 수익성 향상에 실질적으로 기여할 수 있는 실질적인 솔루션을 제공하겠다”라고 밝혔다.",https://n.news.naver.com/mnews/article/009/0005601652
2025-12-05 17:25:00,"미래에셋운용 ‘TIGER 미국나스닥100’, 순자산 7조원 돌파","‘상장 15주년’ 국내 최장수 미국 투자 ETF   미래에셋자산운용은 ‘TIGER 미국나스닥100’ ETF가 순자산 7조원을 돌파했다고 5일 밝혔다.  한국거래소에 따르면 지난 4일 종가 기준 TIGER 미국나스닥100 ETF 순자산은 7조2422억원이다. 이는 국내뿐 아니라 아시아에 상장된 미국 나스닥100 지수 투자 ETF 중 최대 규모다.  TIGER 미국나스닥100 ETF는 나스닥100 지수를 추종하는 국내 최초 미국 대표지수 ETF다. 지난 10월 상장 15주년을 맞이한 국내 최장수 미국 투자 ETF로, 상장 이후 현재까지 1500%가 넘는 누적 수익률을 기록했다. 상장 당시 1만원이었던 주당 가격은 현재 16만원을 넘어섰다.  해당 상품은 최근 미국 증시의 강세 속에 빠르게 성장하고 있다. 순자산 규모는 지난 9월말 6조원을 돌파한 이후 불과 2개월만에 1조원 가량 증가했다. 미국 증시는 AI를 중심으로 한 빅테크주의 견조한 실적과 금리인하 기대감이 맞물리며 강세를 이어가고 있다. 특히 나스닥100 지수는 올 들어 미국 3대 시장대표 지수 중 가장 높은 성과를 보이고 있다.  TIGER 미국나스닥100과 더불어 미국 대표지수 ETF의 양대 축인 ‘TIGER 미국S&P500’는 국내 상장된 해외주식형 ETF 중 순자산 1위(4일 기준)를 차지하고 있다. 이 상품은 순자산이 12조원에 달하는 국내 최대 해외주식형 ETF이자 아시아 최대 S&P500 투자 ETF다.  김남호 미래에셋자산운용 글로벌ETF운용본부장은 “TIGER 미국나스닥100, TIGER 미국S&P500는 미국 대형주 중심의 안정적 성장성을 지닌 대표적인 장기 투자 수단”이라며 “앞으로도 TIGER ETF는 투자자들의 든든한 투자 파트너로서 ETF를 통한 장기 투자 문화를 확산하는 데 지속적으로 힘쓰겠다”고 말했다.",https://n.news.naver.com/mnews/article/009/0005601651
2025-12-05 17:25:00,장인화號 2기 “안전·해외투자 집중..여성 리더 전진배치”,"2026년 정기 임원인사 단행 해외투자·AI·여성 리더십 강화 사업회사 여성 대표 2명 배출   포스코그룹이 ‘안전’과 ‘실행력’을 키워드로 하는 2026년도 정기 임원인사 및 조직개편을 단행했다. 장인화 회장 취임 이후 지속된 조직 쇄신 기조를 이어가며, 불확실한 경영 환경 속에서도 미래 경쟁력을 확보하겠다는 의지가 담겼다.  포스코그룹은 이번 인사의 핵심 방향으로 ▲안전 최우선 경영체제 확립 ▲글로벌 투자 실행력 강화 ▲AI·DX 등 미래 리더십 등용 ▲여성 임원 전진 배치를 꼽았다.  먼저 조직개편에서는 해외 투자와 신사업 추진에 속도를 낸다. 포스코는 인도와 미국 등 해외 철강 투자를 전담할 ‘전략투자본부’를 신설해 글로벌 확장 전략을 구체화한다. 포스코인터내셔널은 LNG 밸류체인 시너지를 위해 ‘에너지부문’을 신설했고, 포스코퓨처엠은 수주와 생산 역량 강화를 위해 에너지소재사업본부를 마케팅과 생산 본부로 각각 분리했다.  반면 저수익 사업과 비효율적인 조직은 과감히 정리했다. 포스코이앤씨는 ‘플랜트사업본부’와 ‘인프라사업본부’를 통합하는 등 임원 조직을 20% 축소해 조직 슬림화를 꾀했다. 그룹 전체 임원 규모 역시 지난해에 이어 올해도 16%가량 줄여 의사결정의 신속성을 높였다.  인사에서는 젊은 외부 전문가 수혈과 여성 리더십 약진이 눈에 띈다. 그룹 AI 전략을 총괄할 포스코홀딩스 그룹DX전략실장에 임치현 울산과학기술원(UNIST) 부교수를 영입했고, 포스코홀딩스 AI로봇융합연구소장에는 윤일용 포스코DX AI기술센터장을 앉혔다. 1970~80년대생 젊은 리더들을 전진 배치해 디지털 전환(DX)에 드라이브를 걸겠다는 구상이다.  유리천장 깨기도 가속화됐다. 최영 포스코홀딩스 전무가 포스웰 이사장에, 안미선 포스코이앤씨 상무가 엔투비 대표에 선임되는 등 사업회사 여성 대표 2명이 새로 배출됐다. 한영아 포스코홀딩스 IR실장 등 3명의 여성 임원이 전무로 승진하며 다양성을 강화했다.  안전 경영도 한층 강화된다. 포스코는 안전전문 자회사 ‘포스코세이프티솔루션’을 설립하고, 각 사별로 안전 전담 조직을 신설·격상했다. 안전사고 무관용 원칙을 적용해 현장 안전을 직접 챙기겠다는 장 회장의 강력한 의지가 반영됐다.  포스코그룹 관계자는 “이번 조직 및 인사 혁신을 통해 국내외 추진중인 투자 사업을 차질없이 진행시키고 불확실한 대내외 경영환경을 극복해 나갈 것”이라고 말했다.",https://n.news.naver.com/mnews/article/009/0005601650
2025-12-05 17:25:00,"“1020여성 겨냥”…무신사 걸즈, 타임스퀘어에 ‘첫 매장’ 오픈","무신사는 여성 패션 전문 큐레이션 공간 ‘무신사 걸즈 타임스퀘어 영등포점’을 열었다고 5일 밝혔다.  서울 영등포 타임스퀘어 3층에 오픈한 무신사 걸즈는 무신사가 오프라인 스토어 최초로 선보이는 여성 패션 전문 편집숍이다. 무신사에서 젊은층 여성 고객이 주목하는 인기 브랜드 44개를 엄선해 트렌디한 스타일 제안하는 것이 특징이다.  무신사 걸즈 타임스퀘어 영등포점은 데일리룩부터 스트리트, 포멀룩까지 아우르는 폭넓은 브랜드 라인업을 선보인다.  대표적으로 △나체 △미세키서울 △오헤시오 △애즈온 △타입서비스 △허그유어스킨 등 1020세대 여성들로부터 인기 있는 디자이너 브랜드가 입점한다. 에이이에이이(AEAE), 더콜디스트모먼트 등 캐주얼한 무드의 라이징 브랜드도 다양하게 만나볼 수 있다.  무신사 걸즈는 가방, 모자, 주얼리, 키링 등 잡화 카테고리도 함께 선보이며 의류와 다양한 아이템을 코디해 볼 수 있는 ‘토털 스타일링 공간’으로 완성했다.  일부 브랜드에서는 한정 기간 동안 홀리데이 컬렉션 선발매, 인기 아이템 재입고, 한정 캡슐 컬렉션 이벤트 등을 통해 무신사 걸즈만의 차별화된 혜택을 선보인다.  무신사 걸즈 그랜드 오픈을 기념하여 연말 시즌에 맞춘 풍성한 오프라인 프로모션을 진행한다. 오는 14일까지 무신사 걸즈 인기 입점 브랜드를 대상으로 오프라인 5% 추가 할인 혜택을 제공한다. 오는 7일까지는 타임스퀘어 지하 1층에서 오후 1시부터 7시까지 최대 20% 할인 쿠폰도 증정한다.  또 12월 한 달 동안 매주 주말 타임스퀘어 1층 아트리움에서 열리는 가챠 이벤트에서 타임스퀘어 자체 굿즈와 무신사 걸즈 할인 쿠폰을 증정할 예정이다. 구매 금액대별로 인기 캐릭터 산리오캐릭터즈와 협업한 사은품을 증정하는 이벤트도 진행한다.",https://n.news.naver.com/mnews/article/009/0005601649
2025-12-05 17:24:00,‘비버롹스 2025’에서 만난 ‘팀 안개꽃’…“앞으로도 스토리 중심 게임 만들고파”,"5일 서울 동대문디자인플라자(DDP)에서 개막한 인디게임·컬처 페스티벌 ‘비버롹스 2025’에는 오프라인 82개, 온라인 281개의 인디게임 개발팀이 참가하고 있다. 현장에서 만날 수 있는 인디 게임이 많은 만큼 자신들의 게임을 알리기 위한 개발자들의 유치 경쟁도 치열했다. 이중에는 방탈출 게임 ‘사람 속에 피는 꽃’을 개발한 팀 안개꽃의 김선규 개발자도 있었다. 그는 지난 7월 출시한 ‘사람 속에 피는 꽃’을 알리기 위해 이번 ‘비버롹스’에 참가했다. 특히 얼굴을 가리는 꽃 모양의 가면을 착용하고 나와 시선을 모았다.  김 개발자는 “학교를 다니며 2년 6개월 동안 개발한 ‘사람 속에 피는 꽃’을 알리고 게임을 즐겨본 분들과 직접 이야기를 나눠보고 싶어 참가했다”라며 “실제 개발자나 관람객 중에 게임을 해보신 분들이 있어 보람찬 것 같다”라고 밝혔다.  ‘사람 속에 피는 꽃’은 김선규 개발자가 기획과 프로그래밍을 맡고 아트와 사운드 개발자 각 1명씩 총 3명이 개발한 퍼즐 어드벤처 게임이다. 기억을 잃고 지하실에 갇힌 주인공이 함께 갇힌 소녀와 대화하며 사물을 조사하고 지하실에서 탈출하는 내용을 담았다. 두 시간 분량의 비교적 짧은 플레이 타임을 제공하지만 독특한 스토리에 힘입어 스팀 이용자 평가에서 매우 긍정적 반응을 얻고 있다.  김 개발자는 “반응이 꽤 괜찮았다. 금전적으로 엄청나게 잘됐다고까지는 아니지만 반응도 괜찮고 스토리가 좋다는 말씀을 많이 해주셔서 굉장히 감사했다”라고 말하기도 했다.  김 개발자는 내년에 졸업한 이후에도 계속해서 스토리 중심의 게임을 개발하겠다는 포부를 밝히기도 했다. 전업 개발자가 될지는 모르겠지만 그동안 여러 게임을 계속 제작했던 것처럼 게임 개발을 이어가고 싶다는 바람이다.  김 개발자는 “제 게임을 해보셨다는 개발자분도 계시고 현장에서 재미있게 즐겼다고 말씀하시브 분도 계셔 보람찼다”라며 “개인적인 사정이 있기에 그런 문제를 해결하고 꿈을 이어갈지, 게임을 만드는 것을 전업으로 삼아볼지 고민하고 있지만 일단 게임을 만들 생각”이라고 밝혔다.  한편 5일부터 7일까지 사흘간 스마일게이트 퓨처랩 재단(이사장 권혁빈)이 DDP에서 개최하는 ‘비버롹스 2025’에서는 영상편집툴에서 영감을 받은 퍼즐 플랫포머 ‘영상편집자’, AI 기술을 게임 핵심 재미요소로 삼은 ‘수상한 편의점’, 물류센터에서 일어나는 강도높은 노동을 다룬 ‘XX물류센터’ 등 다채롭고 참신한 인디게임을 만날 수 있다.",https://n.news.naver.com/mnews/article/009/0005601648
