날짜,제목,본문,링크
2025-12-10 17:36:00,탄소배출 절반 줄였죠…LG이노텍 스마트IC기판 개발,"LG이노텍이 성능은 높이면서도 탄소 배출은 기존의 절반 수준으로 줄인 '차세대 스마트 집적회로(IC) 기판' 개발에 성공했다고 10일 밝혔다. 스마트 IC 기판은 개인 보안 정보가 담긴 IC칩을 신용카드나 전자여권 같은 스마트카드에 장착하기 위한 필수 부품이다.  LG이노텍이 개발한 차세대 스마트 IC 기판은 귀금속 도금 공정 없이도 고성능을 구현할 수 있는 신소재를 세계 최초로 적용했다. 기존 제품은 팔라듐이나 금 같은 귀금속을 사용해 표면에 도금하는 공정이 필수적이었다. 많은 양의 온실가스가 발생하고 재료 가격이 높다는 단점이 뒤따를 수밖에 없었다. 조지태 LG이노텍 패키지솔루션사업부장은 ""차세대 스마트 IC 기판은 기존 대비 탄소 배출을 약 50% 줄인 친환경 제품""이라면서 ""나무 130만그루를 심는 것과 같은 효과가 발생한다""고 설명했다.  [이진한 기자]",https://n.news.naver.com/mnews/article/009/0005604094
2025-12-10 17:34:00,해롤드 로저스 쿠팡 신임대표 청문회 출석…과방위서 증인 채택,해롤드 로저스 쿠팡 임시 대표가 오는 17일 열리는 과학기술정보방송통신위원회(과방위) 청문회에 출석한다.  국회 과방위는 10일 전체회의를 열어 쿠팡 개인정보 유출 사태와 관련한 청문회 증인으로 해롤드 로저스 쿠팡 임시 대표를 채택했다.  앞서 박대준 전 쿠팡 대표는 대규모 고객정보 유출 사태 책임을 지는 취지로 사퇴했다. 이에 따른 후속 조치로 미국 모회사인 쿠팡 Inc.의 해롤드 로저스 최고 관리책임자가 같은 날 임시 대표로 선임됐다.  최민희 과방위원장은 “쿠팡 측의 상황 변경에 따른 것”이라며 “박 전 대표의 증인 신분은 유지된다”고 말했다.  과방위는 오는 17일 쿠팡 청문회를 실시한다.,https://n.news.naver.com/mnews/article/009/0005604092
2025-12-10 17:33:00,연기도 사랑도 불꽃처럼…은막의 전설 떠났다,"배우 김지미 별세 … 향년 85세 고교시절 길거리 캐스팅 '불나비'서 신여성상 연기 '장희빈' 통해 스타덤 올라 세번의 결혼과 사실혼… 원조 팜므파탈로 유명세 아카데미상 '마지막 황제' 입도선매해 한국수입도    한국 영화의 첫 번째 새벽을 깨웠던 '은막의 스타' 배우 김지미 씨가 지난 7일 별세했다. 본명 김명자. 향년 85세. 한국영화인총연합회는 10일 ""김지미 배우가 미국에서 세상을 떠났다고 이장호 감독이 알려왔다""고 밝혔다. 고인은 최근 대상포진을 앓았고 저혈압 쇼크로 건강이 악화하면서 결국 세상을 떠난 것으로 알려졌다.  20세기 한국영화사는 고인의 이름 석 자 없이는 설명하기 어려울 정도로 '배우 김지미'는 한 시대를 압도한 거대한 존재였다.  1940년 충남 대덕군 출생인 '만 17세' 고교생 김지미의 가능성을 알아본 건 김기영 감독이었다. 고인은 그해 영화 '황혼열차'로 데뷔했는데 고아원 원장의 딸이자 고아원을 대리 경영하는 한 남자를 사랑하는 여성을 연기하면서 '배우 김지미'의 얼굴은 영화계에 각인됐다.  이후 고인은 '별아 내 가슴에'(1958), '비오는 날의 오후 3시'(1959), '육체의 길'(1959) 등 3년간 20편 넘는 영화에 출연했고, 전통적 여성상에서 벗어나 도회적 이미지의 외모에 힘입어 단시간에 스타덤에 올랐다.  고인의 배우 이미지를 구축한 결정적 영화는 '장희빈'(1961)이었다. 이 영화는 희빈 장씨의 '표독스러운 요부' 이미지를 처음 만들어낸 선구적 작품이었는데, 현재 유튜브에서도 확인 가능한 이 영화에서 고인은 중전을 시기하며 번뜩이는 눈빛을 처음으로 연기해냈다. 또 고인의 '팜므파탈' 이미지는 영화 '불나비'(1965)에서 빛을 발하는데 초미니스커트를 입고 오픈카를 직접 모는 고인의 연기는 '파격 선언' 그 자체였다.  '토지'(1974)에서 고인이 맡은 안주인 윤씨부인 역은 고인에게 세계적 명성을 가져다줬다. 파나마국제영화에서 여우주연상을 수상했던 것. 귀국 후 서린호텔에서 열린 기념 파티에서 고인은 ""오늘의 영광은 저 한 사람의 것이 아니며, 영화 가족 모두가 협조해주신 덕택""이란 말을 남겨 큰 박수를 받았다. 고인이 출연한 영화는 700편이 넘는 것으로 전해진다.  영화라는 외길을 걸으면서도 끝 모를 구설과 염문이 고인의 그림자처럼 동행했다. 스스로는 탐탁지 않아 했다고 전해지는 고인의 별명 '한국의 엘리자베스 테일러'는 네 번에 걸친 결혼(사실혼 포함) 때문에 붙여졌다. '할리우드의 최후의 여신'으로 통했던 테일러는 결혼을 무려 '8번'이나 했기에 고인의 생애와 자주 비교됐다.  홍성기 감독과 4년 만에 이혼한 고인은 1962년 최무룡 배우와 스캔들을 일으켰고, 당시 '간통'이 범죄였기에 간통쌍벌죄로 구속됐다가 보석으로 풀려나기도 했다. 구속 당시 고인의 나이 24세, 최무룡 배우는 34세였다. 당시 두 사람이 '웃으면서 쇠고랑을 차는' 사진이 대서특필됐다.  떠들썩했던 고인의 결혼은 6년 만에 다시 파국을 맞았고, 시간이 흘러 1976년 '7세 연하'였던 가수 나훈아 씨와 남산 외교구락부에서 약혼을 전격 발표해 언론의 조명을 받았다. 결혼식은 올리지 않았고 사실혼 관계였다고 전해진다. 이후 1991년 심장전문의 이종구 씨와 '또' 백년가약을 맺는다는 사실이 보도됐다.  사업가로서의 면모도 두드러졌다. 고인이 제부와 설립한 영화사 지미필름은 1988년 아카데미시상식에서 9개 부문을 휩쓴 '마지막 황제'를 미리 수입 계약했다가 수십억 원의 수익을 냈다고 전해진다.  고인은 ""베르나르도 베르톨루치 감독의 이름, 한국과 근접한 중국의 '비운의 황제'란 점이 흥미로워 영화를 보지도 않고 계약했다""고 밝혔다. 당시 경쟁사들은 지미필름과 영국 KRG사의 계약을 깨려고 수억 원의 웃돈을 얹으려고도 했으나 실패했다. 1987년 '로보캅'의 수입사도 지미필름이었다. 역시 고인이 도쿄영화제 참석 때 치열한 로비 끝에 거래를 타결시켰다고 전해진다.  고인은 2019년 부산국제영화제 참석 당시 오픈토크 무대에 올라 ""세상 물정 모르고 영화계에 픽업돼서 일하다가 영화가 사회에 주는 영향이 얼마나 큰가를 느끼게 됐다""며 ""후배들이 자존심과 자긍심을 갖고 다른 세상은 쳐다보지도 말고 훌륭한 연기자가 되길 바란다""고 말했다. 이어 그는 ""끝까지 자기 스스로를 다 투자해야 최고가 될 수 있다. 제게 사랑을 주신 여러분 가슴속에서 절 영원히 간직해주시면 고맙겠다""고도 말했다.  [김유태 기자]",https://n.news.naver.com/mnews/article/009/0005604091
2025-12-10 17:33:00,효성그룹 나눔실천…성금 10억원 기탁,"효성은 10일 연말 이웃사랑 성금 10억원을 사회복지공동모금회에 기탁했다고 밝혔다. 이번 기부금은 그룹 내 주요 사업회사들과 함께 마련했다. 전달된 성금은 사회의 소외된 이웃을 위해 사용될 예정이다.  조현준 효성 회장은 평소 ""기업은 공정하고 투명한 경영으로 경제 활성화에 이바지해 국민으로부터 사랑과 신뢰를 받아야 한다""며 ""도움이 필요한 이웃들에게 실질적인 도움을 드릴 수 있도록 사회적 책임을 다할 것""이라고 말해왔다. 효성은 '나눔으로 함께하겠습니다'라는 사회공헌 슬로건 아래 취약계층 지원, 문화예술 후원, 호국보훈 3개 축을 중심으로 사회공헌활동을 이어오고 있다.  [이동인 기자]",https://n.news.naver.com/mnews/article/009/0005604090
2025-12-10 17:33:00,[부음] 이낙일씨 별세 외,"▲이낙일씨 별세, 한희진씨 배우자상, 이준영(현대자동차 상무) 이은경 이선아씨 부친상=9일 서울아산병원, 발인 12일 오전 8시 20분. (02)3010-2000  ▲백창기씨(전 현대제철 대표이사·전 대한알미늄 대표이사·공인회계사) 별세, 이현숙씨 배우자상, 백정원(KBS 아나운서) 백진우씨(KB증권 근무) 부친상, 김진유씨 시부상, 백제상씨 조부상=9일 서울아산병원, 발인 12일 오전 4시 40분. (02)3010-2000",https://n.news.naver.com/mnews/article/009/0005604089
2025-12-10 17:33:00,[인사] 태영건설 / TY홀딩스 / NH투자증권,■태영건설 ◇선임 △대표 이강석 ◇승진 △토목본부장 임태종 △건축본부장 정진형  ■TY홀딩스 ◇선임 △미디어정책실장 겸 비서실장 박병일  ■NH투자증권 ◇상무보 신규 선임 △중서부본부장 황태석 △디지털자산관리본부장 이실 △정보보호본부장 이선규 △IT본부장 박기춘 △금융소비자보호부문장 노상인 ◇전무 승진 △Wholesale사업부 대표 임계현 △경영전략본부장 박선학 ◇상무 승진 △재경1본부장 최승희 △동부본부장 이재열 △ESG본부장 임철순 △Syndication본부장 조현광 △상품솔루션본부장 전동현 △부동산금융본부장 박유신 △Industry2본부장 최민호 ◇전보 △채널솔루션부문장 이재경 △IB사업부 대표 김형진 △Industry1본부장 홍국일 △전략운용본부장 김중곤 △Operation혁신본부장 김규진,https://n.news.naver.com/mnews/article/009/0005604088
2025-12-10 17:33:00,"현대차 1등 판매왕 ""입원해서도 차 팔았죠""","서대문중앙지점 최진성 사상 첫 누적판매 8000대    ""차 파는 놈이 차는 못 타고 오토바이 탑니다. 고객들이 기다리니까.""  현대자동차 최초로 누적 판매 8000대를 달성한 판매왕, 최진성 서대문중앙지점 영업이사 얘기다. 최 이사는 1996년 입사해 약 30년 동안 일한 영업 전문가다. 2000년 연간 판매대수별 전국 1~10위 직원을 선정·포상하는 '전국 판매왕' 제도가 생긴 후 올해까지 단 한 번도 빼놓지 않고 26회 연속 해당 타이틀을 차지한 자타공인 현대차 판매왕이다.  최 이사는 10일 매일경제와의 전화 인터뷰에서 오토바이를 타고 출근하다가 교통사고로 병원에 입원한 순간이 판매왕으로서 전환점이 됐다고 꼽았다. 그는 1998년 교통사고를 당해 무려 3번의 수술을 받았는데 입원한 병원에서조차 의사와 주변 환자들에게 차량을 판매했다. 최 이사는 ""어디서든, 언제든지 (판매를) 못할 것은 없구나 하고 그때 배웠다""며 ""영업맨으로서 업그레이드되는 계기가 됐다""고 말했다.  최 이사는 지금도 병원과 경찰서를 돌아다니며 판촉한다. 그는 ""남들이 안 하는 곳에 가야 효과가 있다""고 판매왕의 비결을 전했다. 다음 목표는 9000대 판매다. 최 이사는 ""8000대 최초 판매 타이틀은 짐이기도 하지만 원동력이기도 하다""고 밝혔다. 최 이사는 누적 8000대 판매 달성으로 받은 포상금 2000만원을 출신 고교에 기부했다. 그가 출신 고교에 기부한 금액은 20년 누적 1억5000만원에 달한다.  현대차는 누계 판매대수에 따라 '판매 명예 포상제도'를 운영하는데 최 이사는 △판매장인(2000대 달성) △판매명장(3000대) △판매명인(4000대) △판매거장(5000대) 타이틀을 모두 거머쥐었다. 연평균 267대를 판매한 셈이다.  [한지연 기자]",https://n.news.naver.com/mnews/article/009/0005604087
2025-12-10 17:33:00,한국외대 총장에 강기훈,한국외대 제13대 총장에 강기훈 통계학과 교수가 선임됐다고 학교법인 동원육영회가 10일 밝혔다.  강 신임 총장은 서울대 계산통계학과를 졸업하고 같은 대학에서 통계학 박사학위를 받았다. 한국외대 통계학과 교수로 임용된 후 현재 한국통계학회 회장과 기획재정부 국가통계위원회 위원을 맡고 있다.  [이용익 기자],https://n.news.naver.com/mnews/article/009/0005604086
2025-12-10 17:33:00,샤피로 CTA 회장…내년 CES서 북사인회,게리 샤피로 미국소비자기술협회(CTA) 회장이 내년 1월 6일부터 9일까지 개최되는 국제전자제품박람회(CES) 2026 현장에서 저서 '피벗 오어 다이(Pivot or Die)' 한국어판 400부를 판매하고 현장 사인회를 개최한다. CTA는 세계 최대 규모의 기술 전시회인 CES를 매년 주관하며 전 세계 기술 트렌드를 선도하는 단체다.  CTA는 CES 전시장 내 북스토어에서 영어판과 함께 '피벗 오어 다이' 한국어판도 선보일 예정이다. 그는 CES 기간 중 저자 사인회를 진행하며 한국 독자들을 위해 출간된 한국어판에도 직접 서명할 계획이다.  [박태일 기자],https://n.news.naver.com/mnews/article/009/0005604085
2025-12-10 17:33:00,LG상남언론재단 이사장 이준희 선임,"신임 이사에 본지 이진우 실장    LG상남언론재단은 10일 신임 이사장에 이준희 한국일보 고문(사진)을 선임했다고 밝혔다. 이 이사장은 한국일보에서 편집국장과 주필, 대표이사 사장 등을 역임했으며 2019년부터 LG상남언론재단 이사로 활동해왔다. 이날 재단은 신임 이사로 양상훈 조선일보 주필, 윤석민 서울대 언론정보학과 교수, 조정 SBS 논설위원, 이진우 매일경제 기획실장을 선임했다.  [이덕주 기자]",https://n.news.naver.com/mnews/article/009/0005604084
2025-12-10 17:33:00,'자랑스러운 NYU 동문'에 윤석근·박천휴,"경영부문 일성아이에스 회장 예술부문 '토니상' 작가 선정    미국 뉴욕대(NYU) 한국동문회(회장 전찬민)가 11일 서울 중구 앰배서더 풀만 호텔에서 '2025년 송년의 밤(2025 NYU Year-End Golden Party)'을 개최한다. 250여 명의 뉴욕대 동문이 한자리에 모이는 행사다. 행사에선 '올해의 자랑스러운 NYU 동문상 시상식'도 진행된다. 동문회는 올해 수상자로 산업·경영 부문에 윤석근 일성아이에스 회장, 문화예술 부문에 박천휴 작가를 각각 선정했다고 10일 밝혔다.  윤 회장은 일성신약 창업주 윤병강 전 명예회장의 차남으로, NYU에서 경영을 전공한 후 일성신약에 입사해 대표이사를 역임했다. 국내 제약산업의 해외 진출 기반 확대에 이바지했다. 지난 6월 한국인 최초로 토니상 수상 영예를 안은 박 작가는 스튜디오 아트 전공으로 2012년 졸업한 동문이다. 그는 뉴욕대 유학 중 작곡가 윌 애런슨과 만나 뮤지컬 '어쩌다 해피엔딩'을 창작했다. 작품은 제78회 토니상 시상식에서 극본상 등 6관왕을 차지한 바 있다.  [정주원 기자]",https://n.news.naver.com/mnews/article/009/0005604083
2025-12-10 17:33:00,[매경춘추] '케데헌'과 창조적 융합,"넷플릭스 역대 최다 시청 기록을 세운 'K팝 데몬 헌터스'는 혁신적 융합의 힘을 극명하게 보여준다. K팝 아이돌이라는 초현대적 글로벌 문화와 한국 무속신앙 속 저승사자를 결합한 이 작품은, 동서양과 과거-현재, 대중문화와 신화의 경계를 넘나들며 전 세계를 열광시키고 있다. 무엇이든 섞고, 초월하며, 끝없이 새로운 것을 만들어내는 융합의 폭발적 창조성이 문화 콘텐츠에서 빛을 발한 것이다.  이런 한국의 창조적 융합 역량은 '케데헌'에만 적용된 것은 아니다. 불과 5년 만에 글로벌 시장을 장악한 배달앱 산업을 보자. 우리는 코로나 팬데믹 이전부터 이미 세계에서 가장 정교한 배달 생태계를 구축했고, 이를 바탕으로 배달의민족, 요기요 등과 같은 배달 플랫폼들이 빠르게 진화했다. 빠른 속도, 실시간 추적, 다양한 결제 방식의 융합, 그리고 여기에 정보통신(IT) 인프라와 음식 문화, 밀집된 도시 구조가 절묘하게 결합된 한국만의 창조적 융합이 있다.  이제 문화적·기술적 성취를 가능하게 한 창조적 융합의 힘을 경제 전반으로 확산시켜야 할 시점이다. 한국 경제는 선진국 진입 이후 새로운 혁신적 성장 모델을 모색해야 하는 전환기에 있다. 문화 콘텐츠와 디지털 플랫폼에서 보여준 혁신적 융합 역량을, 제조업과 서비스업 전반으로 확장할 기회가 열려 있다. 대기업의 기술력과 스타트업의 유연성·민첩성, 그리고 한국 국민의 높은 교육수준과 디지털 인프라의 강점을 어떻게 결합하느냐가 관건이 될 것이다.  창조적 융합을 가속화하기 위해서는 경제 환경적 요소가 뒷받침돼야 한다. 혁신적 제도와 인프라 자체가 중요하다. '케데헌'이 보여준 탈 경계적 상상력, 배달앱을 성장시킨 기술적·사회적 융합력을 경제 구조의 혁신으로 연결하려면, 우리 경제는 어떠한 요소가 필요할까.  무엇보다 융합을 가속화하는 제도적 유연성 강화가 필요하다. 반도체와 바이오, 제조와 서비스의 경계를 넘나드는 산업 간 융합이 새로운 혁신과 성장 동력을 만든다. 이를 위해 산업 간 융합 자체를 장려하는 전방위적 제도 혁신을 확대해야 한다. 이는 단순한 규제 완화가 아니라, 새로운 산업 생태계를 만드는 경제구조 전환이다. 다양한 분야의 전문가, 기업, 연구기관 등이 자유롭게 협력하고 아이디어를 교류할 수 있도록 지원하는 개방형 혁신 플랫폼과 융합 R&D 지원 정책도 필요할 것이다.  교육과 인력양성 제도도 바뀌어야 한다. 융합적 사고와 협업 능력을 기를 수 있는 교육, 수학, 공학뿐 아니라 인문학, 사회학적 소양도 갖춘 인재, 나아가 상상력과 창의력이 풍부한 인재가 창조적 융합에 적합한 인재상이다. 변화하는 환경에 민첩하게 대응하고, 새로운 도전을 수용할 수 있는 역량도 중요하다.  창조적 파괴 못지않게 창조적 융합이 중요한 시대다. '케데헌'의 융합적 상상력이 문화에만 머물지 않고 경제·사회 구조 전반으로 확산될 때, 한국 경제는 새로운 성장 경로를 개척할 것이다. 한국이 보유한 역동성과 혁신 DNA를 제도적으로 뒷받침하는 것, 그것이 경제혁신이자 곧 사회혁신이다.  [백승주 국립순천대 석좌교수]",https://n.news.naver.com/mnews/article/009/0005604082
2025-12-10 17:32:00,"“배상액, 한국보다 현실적일 것”…미국 쿠팡 집단소송 1000명 넘게 참여","한 번이라도 쿠팡 주문 이력있는 회원 누구나 소송 참여 가능 “미국 손해배상은 징벌 의미”   쿠팡의 3370만건 대규모 개인정보 유출 사태가 일파만파 커지고 있다. 미국 내 집단소송 참여자도 1000명을 돌파했다.  쿠팡에 대한 미국 내 집단소송을 맡은 대륜에 따르면 소송 참여 인원이 이미 1000명을 넘어섰고 쿠팡에서 한 번이라도 주문한 적 있는 회원이라면 누구나 소송에 참여할 수 있다고 10일 밝혔다.  대륜의 미 현지 법인 SJKP 소속 손동후 변호사는 10일 CBS 라디오에서 “이번 개인정보 유출 사태와 관련해 쿠팡 한국 법인의 모기업인 쿠팡 인크(inc), COUPANG inc, INC를 상대로 미국 뉴욕 남부지방법원에서 소비자 집단 소송을 제기한다”며 “쿠팡 inc는 미국 델라웨어주에 있는 법인이고, 또 뉴욕 증시 및 나스닥 상장사이며 한국 쿠팡 지분을 100% 보유한 기업”이라고 밝혔다.  ‘미국 국적이 있는 사람만 소송에 참여할 수 있나’라는 진행자의 질문에는 “피해자의 거소지는 중요하지 않다. 한국에 계신 분들, 또 한국이 아닌 외국에 계신 분도 피해를 보셨다면 미 연방법원 소송에 참여할 수 있다”고 답했다.  배상액 규모와 관련해서는 “금액 자체를 말씀드리기는 어려운 부분이 있다”면서도 “한국보다는 훨씬 배상액이 현실적일 것”이라고 설명했다.  “본인 권리를 포기하지 않는 한 판결 따른 배상 받아” 김국인 대륜 경영총괄 대표는 같은 날 MBC 라디오와의 인터뷰에서 “어제 기자회견까지 (소송 참여 인원은) 200명 정도였는데, 벌써 1000명을 넘어섰다”고 밝혔다.  김 대표는 “이번 소송은 쿠팡에서 한 번이라도 주문한 회원이라면 참여할 수 있고 미국에는 ‘옵트아웃’이라는 제도가 있어 이번 소송의 원고가 아니었더라도 본인인 권리를 포기하지 않는 한 판결에 따른 배상을 받게 된다”면서 “다만 직접 원고로 참여하신 분과 원고가 아닌 분의 배상액 차이는 있다”고 말했다.  김 대표는 한국이 아닌 미국에서 손해배상 소송을 추진한 이유에 대해 “우리나라의 손해배상은 어떤 피해가 있는지 입증하고, 그 피해에 대해 배상만 한다”며 “미국의 손해배상은 징벌의 의미가 있다. 반사회적인 기업 활동으로 손해를 끼쳤을 때, 그 손해에 대한 배상뿐만 아니라 손해를 만들어낸 과실에 대한 응보적 배상도 한다”고 설명했다. 이어 “앞으로 이런 일이 발생하지 않도록 예방하는 억제의 의미”라고 덧붙였다.  그러면서 “제가 원하는 건 이번 소송에서 ‘디스커버리(증거 개시)’ 절차를 활용하는 것이며, 쿠팡 미국 본사와 한국 쿠팡 사이 주고 받은 이메일, 보고자료, 회의자료, 이사회에서 결정한 내용 등을 저희가 확보할 수 있기 때문”이라며 “이 내용은 한국에서 수사를 통해 밝혀질 내용보다 더 신뢰할 수 있고, 양도 많을 거다. 기업 보안 시스템 관리와 관련한 내용이 있다면 확보하고 싶다”고 언급했다.",https://n.news.naver.com/mnews/article/009/0005604081
2025-12-10 17:32:00,"서울대 AMP 총동창회, 창립 50주년 기념식 개최","서울대 최고경영자과정(AMP) 총동창회가 10일 서울 소공동 롯데호텔 사파이어볼룸에서 재계와 학계 주요 인사 320여 명이 참석한 가운데 ‘창립 50주년 기념식’을 개최했다.  이날 행사에는 유홍림 서울대학교 총장과 윤철주 AMP 총동창회장을 비롯해 정석현 수산중공업 회장, 윤석철 명예교수, 곽수일 명예교수 등이 참석했다.  이날 기념식에서 AMP 총동창회는 서울대 경영대학에 발전기금 10억원을 쾌척하기도 했다.  윤철주 총동창회장은 기념사를 통해 “서울대 AMP는 지난 50년간 대한민국 성장의 주역들을 배출해 왔다”며 “앞으로 동문 간 연대와 나눔을 확장하고, 사회적 책임을 다하는 ‘노블레스 오블리주’ 정신을 실천하는 데 앞장서겠다”고 강조했다.  유홍림 서울대 총장 역시 축사에서 “6400여 명의 AMP 동문은 대한민국 산업화와 정보화를 이끈 기둥”이라며 동문들의 기여에 감사를 표하고 모교 차원의 지속적인 지원과 협력을 약속했다.  이날 기념식에서는 국가 경제 발전과 총동창회 발전에 기여한 동문과 교수들에게 공로패와 감사패를 수여하는 시간도 마련되었다. 또 총동창회는 세대를 아우르는 신구 기수 간 멘토링 프로그램을 통해 동문 네트워크의 결속력을 더욱 강화하기로 다짐했다.  AMP 관계자는 “이번 50주년 기념식은 동문들의 자긍심을 높이고 앞으로 100년을 이끌어갈 사회 기여 의지를 재확인하는 중요한 계기가 되었다”고 말했다.",https://n.news.naver.com/mnews/article/009/0005604080
