날짜,제목,본문,링크
2025-12-10 15:32:00,무신사의 오프라인 새 실험...초대형 패션 매장 ‘메가스토어’ 용산에 문열어,"1000평 규모 복합 매장 오픈 전문관부터 뷰티까지 총집약 스포츠 전문 ‘플레이어’도 선봬   무신사가 약 1000평에 달하는 초대형 패션 매장을 선보이면서 새로운 오프라인 실험에 나선다. 큐레이션 역량과 상품 경쟁력을 집약한 ‘복합형 오프라인 플랫폼’을 선보이며 온·오프라인을 잇는 O4O(Online for Offline) 전략에 속도를 내겠다는 구상이다.  10일 무신사는 오는 11일부터 아이파크몰 용산점에 ‘무신사 메가스토어 용산’과 ‘무신사 스탠다드 아이파크몰 용산점’을 동시에 연다고 밝혔다. 두 매장이 동시 입점한 복합몰 형태를 선보이는 것은 처음이다. 무신사가 선보이는 오프라인 매장 중 가장 큰 규모로 조성된다.  오픈에 앞서 이날 조만호 무신사 의장과 정몽규 HDC 회장이 메가스토어를 돌아보기도 했다. 조만호 의장은 정몽규 HDC 회장에게 직접 오프라인 전략과 공간 콘셉트 등을 소개했다. 김대수 HDC 아이파크몰 대표도 매장을 방문했다.  첫 메가스토어 입지인 용산은 1030대, 직장인, 가족 단위 방문객, 외국인 관광객까지 다양한 고객층이 방문하는 핵심 상권이다. ITX, KTX, 공항철도 등 교통 접근성이 뛰어나 수도권, 지방, 외국인이 모두 모이는 입지적 중심지라는 강점을 바탕으로 높은 집객 효과가 예상된다.  무신사 메가스토어는 무신사가 운영하는 큐레이션 콘셉트와 전문관을 한자리에 모은 초대형 매장이다. 전 카테고리를 아우르는 약 200여 개 브랜드가 입점한다. △무신사 영 △무신사 걸즈 △무신사 포 우먼 △무신사 워크&포멀 △무신사 백&캡클럽 등 콘셉트 스토어와 △무신사 뷰티 △무신사 플레이어 등 전문관 카테고리가 집약돼 있다.  무신사 스토어의 스포츠 전문관 ‘플레이어’도 처음으로 오프라인에 나왔다. 야구, 축구, 스키 등 인기 스포츠 유니폼을 한자리에 모은 팝업이 들어설 예정이다.  이 외에 무신사 자체 뷰티 브랜드를 체험할 수 있는 공간도 있다. 무신사 뷰티 존에는 메이크업 브랜드 ‘오드타입’ ‘위찌’의 대표 인기 상품을 선보인다. 또한, 방송인 노홍철과 협업한 브랜드 ‘노 더 럽’, 최근 초저가 라인을 대폭 강화한 ‘무신사 스탠다드 뷰티’ 제품도 만나볼 수 있다.  무신사는 매달 새로운 팝업을 선보인다. 오프라인 공간을 단순 판매처가 아닌, 트렌드를 선도하고 화제성 있는 상품을 가장 먼저 경험할 수 있는 콘텐츠 허브로 활용하겠다는 전략이 반영됐다. 오픈 시점에는 아디다스의 겨울 시즌 무드를 담은 팝업을 내달 11일까지 열고 팝업 한정 혜택을 선보인다.  온라인의 강점을 오프라인으로 가져온 O4O(Online for Offline) 기반의 쇼핑 경험을 제공하는 것도 무신사 메가스토어의 특징이다.  고객들은 각 상품 택에 부착된 QR코드를 통해 상품별 무신사 회원 혜택가, 매장 내 재고, 스타일 콘텐츠 ‘스냅’, 회원 후기 등을 즉시 확인할 수 있다. 특히 실시간 상품 가격에 개인의 회원 등급별 혜택을 적용한 최대 혜택 가격을 보여주는 기능은 온라인 혜택을 오프라인에서도 동시에 누릴 수 있는 무신사만의 차별화된 요소다.  이달을 기점으로 무신사는 새로운 형태의 오프라인 확장을 가속화한다. 지난 5일 여성 패션에 특화한 ‘무신사 걸즈 타임스퀘어 영등포점’을 열며 큐레이션 콘셉트를 처음으로 독립 매장으로 확장했다. 신발 큐레이션에 특화한 오프라인 스토어 ‘무신사 킥스 홍대’는 내년 1월 9일 오픈을 앞두고 있다. 또한, 내년 3월 중으로 ‘무신사 아울렛&유즈드’ 매장도 새롭게 선보인다.  이러한 전문 큐레이션 전략과 함께 폭넓은 카테고리와 브랜드를 집약한 무신사 스토어도 빠르게 늘린다. 내년 1월에는 명동, 잠실 등 국내외 젊은 유동인구가 많은 주요 상권에 순차적으로 무신사 스토어 오픈을 앞두고 있다. 특히 내년 3월에 초대형 패션 편집숍으로 약 2천 평 규모의 ‘무신사 메가스토어 성수’ 오픈이 예정되어 있다.  무신사 관계자는 “앞으로 핵심 상권을 중심으로 무신사 스토어를 빠르게 확대해 더 많은 브랜드가 오프라인에서 고객 접점을 늘릴 수 있도록 판로를 확대하며 패션 생태계를 활성화에 기여할 것”이라고 말했다.",https://n.news.naver.com/mnews/article/009/0005603918
2025-12-10 15:31:00,[포토] 자료 살피는 추미애,10일 국회에서 열린 법제사법위원회 전체회의에서 더불어민주당 소속 추미애 위원장이 자료를 살피고 있다. 2025.12.10.김재훈기자,https://n.news.naver.com/mnews/article/009/0005603916
2025-12-10 15:31:00,‘국가보안법 폐지안’에 국민의힘 반발…“누구를 위한 것인가”,"범여권 31명, 국보법 폐지안 발의 盧·文 정부 때도 시도했지만 불발 국민의힘 “안보 시스템 무너뜨려”   범여권 의원들이 최근 국가보안법 폐지안을 발의한 것과 관련해 제1야당인 국민의힘이 거세게 반발했다. 법안을 발의한 이들은 국가보안법 대부분 조항을 현행 형법 등으로 대체할 수 있다는 입장이지만, 야권에서는 국제 정세와 대체 입법 부재를 고려해야 한단 지적이 쏟아졌다.  국민의힘 정책위원회와 이성권·서천호 의원은 10일 오후 서울 여의도 국회 의원회관에서 ‘국가보안법 폐지, 무엇이 문제인가’를 주제로 토론회를 개최했다. 이 자리에는 송언석 원내대표와 야당 국방위원들, 각계 전문가들이 대거 참석했다.  축사를 맡은 송 원내대표는 “북한이 해킹을 통해 우리 가상 자산 같은 것을 탈취하고, 또 개인정보를 빼내 가고 있는 상황에서 국가보안법마저도 폐지하겠다는 시도가 있다는 것, 이 자체가 굉장히 심각한 상황”이라고 우려를 표했다.  그러면서 “민주노총에서는 북한의 지령을 직접 받아 간첩 활동을 했던 사람들이 잡혔고, 중형을 선고받기도 했는데 그런 현실 앞에서 우리가 왜 국가보안법을 폐지하려고 하느냐”며 “이것이 누구를 위한 것인가, 묻지 않을 수 없다”고 지적했다.  이어 마이크를 잡은 당의 중진 김기현 의원 역시 “입법 시스템이 무너져서 입법부는 독재 권력의 시녀화 되고 있고, 사법 시스템도 무너져서 독재 권력의 시녀화 되는 작업이 진행되고 있다”며 “이제는 대한민국의 근간인 안보 시스템을 무너뜨리겠다고 한다”고 질타했다.  국가보안법이 폐지될 경우 북한과 중국 등 인접국만 반길 것이라는 비판도 나왔다. 국민의힘 소속 성일종 국방위원장은 “우리와 적대시하고 있는 나라·존재들한테 박수받을 일을 왜 집권 여당이 하느냐. 있을 수 없는 일”이라고 언성을 높였다.  앞서 민형배 더불어민주당 의원, 김준형 조국혁신당 의원, 윤종오 진보당 원내대표 등은 지난 2일 국가보안법 폐지안을 대표 발의한 바 있다. 이 법안에는 민 의원 등을 포함해 혁신당과 진보당 등 모두 31명의 범여권 의원이 발의자로 이름을 올렸다.  이들은 법안의 제안 설명에서 “국가보안법은 제정 당시 일본제국주의 치안유지법을 계승해 사상의 자유를 억압한 악법이라는 비판을 받아왔다”며 “국가보안법의 대부분의 조항은 이미 형법으로 대체 가능하며, 남북교류협력법 등 관련 법률로도 충분히 규율할 수 있다”고 밝혔다.  국가보안법 폐지 시도는 노무현 전 대통령 임기 중이었던 2004년 말에도 있었으나, 국민의힘 전신인 한나라당과 보수 언론의 비판 등으로 무산된 바 있다. 당시 여당(열린우리당) 내부에서도 폐지론과 개정론이 맞서면서 혼선이 있었고, 시민단체의 반발도 거셌다.  문재인 전 대통령 역시 대선 후보 시절 국가보안법 폐지를 약속한 것을 근거로 진보성향 시민단체 등으로부터 개정 또는 폐지 요구를 받았으나, 국회 차원에서 폐지 논의는 구체화 되지 못했다. 폐지 시도가 두 차례 불발된 뒤 이재명 정부에서 다시금 등장한 것.  범여권에서 다시금 국가보안법 폐지 논의에 불을 지폈으나, 야권과 시민단체들의 반발은 만만치 않은 상황이다. 시민단체 서민민생대책위원회는 이날 국가보안법 공동발의에 이름을 올린 의원 31명을 직권남용 및 내란죄 혐의로 서울경찰청에 고발했다.  단체는 “KT 무단 소액결제 사건은 중국인이 윗선으로 밝혀지는가 하면 쿠팡의 중국인 직원이 3370만개의 개인정보를 탈취해 중국으로 달아나는 등 국제 정세가 넉넉하지 못한 현실”이라며 “국가보안법 전면 폐지안을 제출한 행위는 직권남용, 내란죄 등에 해당한다”고 주장했다.",https://n.news.naver.com/mnews/article/009/0005603915
2025-12-10 15:30:00,"MBK파트너스, 커넥트웨이브 활용해 아정당 인수 추진","[본 기사는 12월 10일(15:04) 매일경제 자본시장 전문 유료매체인 ‘레이더M’에 보도 된 기사입니다]  MBK파트너스가 포트폴리오 기업인 커넥트웨이브의 볼트온(Bolt-On, 연관기업 인수를 통한 외형 확장)을 위해 생활형 커머스 플랫폼 기업 아정당 인수를 추진한다. 약 1500억원 규모의 거래가 될 전망이다.  10일 투자은행(IB) 업계에 따르면 MBK파트너스는 아정당을 운영하는 아정네트웍스 경영권 지분 인수를 추진 중이다. 인수 대상은 김민기 대표 지분 50%+1주며, 거래 규모는 약 1500억원으로 알려졌다.  현재 인수를 위한 실사 단계를 진행 중이다. 별도의 인수금융을 조달하지 않고, 커넥트웨이브가 보유한 현금만을 활용해 M&A에 나설 것으로 보인다.  아정당은 통신·렌탈 가입 비교 서비스를 기반으로 성장한 생활형 플랫폼 기업이다. 인터넷과 IPTV, 이동통신 요금제, 가전 렌탈 등 생활비성 지출 영역을 중심으로 가격 비교와 가입 지원 서비스를 제공한다.  통신 가입 시장 확대로 3년 동안 꾸준히 성장해왔다. 작년에는 연결 기준 매출 4032억원, 영업이익 231억원을 기록했다.  이번 M&A는 커넥트웨이브의 볼트온 차원인 것으로 전해진다. MBK파트너스는 2022년 커넥트웨이브를 인수하며 이커머스 플랫폼 포트폴리오를 구축했다. 작년에 상장폐지 후 비상장 체제로 전환했다.  커넥트웨이브 내에는 가격 비교 서비스(다나와·에누리), 쇼핑몰 구축 솔루션(메이크샵), 해외직구 및 물류 서비스(몰테일) 등이 포진해 있다.  다만 커넥트웨이브는 최근 이커머스 거래 위축과 광고 시장 둔화 영향으로 실적이 감소했다. 이에 올해부터 AI 기반 검색 고도화 및 신규 오픈마켓 제휴 확대를 통해 매출 회복을 추진하고 있다.  커넥트웨이브의 데이터커머스 기반 구조에 가입형 서비스 모델인 아정당을 결합해 플랫폼 체질을 다변화한다는 전략이다.",https://n.news.naver.com/mnews/article/009/0005603913
2025-12-10 15:26:00,11월 은행 가계대출 증가 폭 전월 ‘반토막’…주담대 20개월만에 최저,"전월 3.5조서 1.9조원으로 ‘9월 수준 회복’ 10·15 부동산 대책·전세 수요 감소 등 영향 한은 “수도권 주택가격 추세 모니터링 필요”   지난달 은행권 가계대출의 증가 폭이 전월 대비 절반 수준으로 줄어들었다. 특히 주택담보대출 증가는 7000억원에 그쳤는데, 이는 지난 2024년 3월 이후 1년 8개월 만에 가장 작은 수준이다. 10·15 부동산 대책 이후 은행권의 가계대출 관리와 전세 자금 수요 감소 등에 따른 것으로 풀이된다.  10일 한국은행이 발표한 ‘금융시장 동향’에 따르면 11월 말 기준 예금은행의 가계대출(정책모기지론 포함) 잔액은 10월 말보다 1조9000억원 많은 1175조6000억원으로 집계됐다. 가계대출 증가 폭은 지난 6월에 6조2000억원을 기록했다가 6·27 대책 영향으로 9월 1조9000억원까지 떨어졌다. 10월 들어 3조5000억원으로 늘어났다가 10·15 대책 이후 11월엔 다시 9월 수준으로 축소된 것이다.  가계대출 증가세 둔화는 주담대가 큰 영향을 끼쳤다. 11월 은행 주담대는 7000억원 늘어나 전월(2조원) 대비 증가 폭이 1조3000억원 줄었다. 지난 2024년 3월(5000억 원) 이후 1년 8개월 만에 최소 증가 폭이다.  박민철 한은 시장총괄팀 차장은 “주택담보대출의 경우 10·15 대책 전 늘어난 주택 거래에도 불구하고, 은행의 가계대출 관리에 따라 생활안정자금 상환이 늘고 전세자금 수요도 줄어 전체적으로 증가 폭이 크게 축소됐다”며 “기타 대출의 경우 국내외 주식투자 확대 등으로 신용대출 중심으로 10월에 이어 증가세가 이어졌다”고 진단했다.  전세자금대출은 3000억원 줄어 전월(-3000억원)에 이어 감소세를 이어갔다. 신용대출 등 기타대출은 1조2000억원 증가했다. 전월(1조4000억원)보다 증가 폭은 약간 줄었으나, 국내외 주식투자 확대 등의 영향으로 여전히 1조원대 증가세를 보였다.  박 차장은 부동산·가계대출 전망과 관련해 “전반적으로 수도권 가격 상승 폭이 줄고 있지만, 핵심지역의 가격 둔화세가 더딘 만큼 계속 모니터링이 필요한 상황”이라며 “주택 거래량의 경우도 10·15 이후 서울 아파트 거래가 현저히 줄었지만, 경기·인천 지역에서 그다지 감소하지 않아 상황을 더 지켜봐야 한다”고 설명했다.  그는 이어 “11월 이후 가계대출은 연말·연초 부실채권 매·상각이나 상여금 유입 등 계절적 요인 영향으로 증가세가 둔화하는 흐름이 이어질 것”이라며 “하지만 주택 관련 대출 증가 압력이 여전히 지속되는 점에 유의해야 한다”고 말했다.",https://n.news.naver.com/mnews/article/009/0005603911
2025-12-10 15:22:00,"“내수 실적 살립시다”…한국지엠, 서비스 네트워크 대표들과 간담회","한국지엠이 전국 협력 서비스 네트워크를 중심으로 한 새로운 운영 체계를 공식 발표하며 내수 시장에서의 실적 증대를 강조했다고 10일 밝혔다.  전날 한국지엠은 인천 부평구 인천삼산월드체육관에서 전국 협력 서비스 및 판매 네트워크 대표 약 400여 명이 참석한 가운데 향후 운영 방향과 전략을 공유하는 행사를 열었다. 행사에는 한국지엠의 헥터 비자레알 사장과 구스타보 콜로시 영업·서비스·마케팅 부문 부사장을 비롯한 주요 임직원들이 참석해 서비스 체계 전환 전략과 실행 계획을 발표했다.  현재 한국지엠의 협력 서비스 네트워크는 전체 고객 서비스 물량의 약 92%를 담당하고 있다. 이번 행사는 내년부터 서비스 운영이 협력 서비스 네트워크 중심으로 전환됨에 따라, 판매와 서비스 간의 시너지를 강화하고 고객 서비스 품질을 기반으로 한 내수 시장 전략을 구체화하기 위해 마련됐다.  행사에서는 구스타보 콜로시 부사장이 2026년 판매 계획 및 서비스 통합 전략을 발표하고 네트워크 강화, 고객 케어 향상, 보증·기술 지원 체계 개선, 부품 공급 안정성 확보 등 구체적인 실행 방안을 소개했다. 콜센터 협력센터 지원 계획과 향후 운영 방향에 대한 현장 중심의 질의응답이 이어졌다.  헥터 비자레알 사장은 “한국지엠은 전국 협력 서비스센터 네트워크와 함께 최고 수준의 고객 서비스를 지속적으로 제공할 것”이라며 “현장과의 긴밀한 협업을 바탕으로 고객 신뢰 확보에 최선을 다하고, 협력 서비스센터와의 소통과 지원을 더욱 확대해 상생하는 미래를 만들어가겠다”고 말했다.  구스타보 콜로시 부사장 역시 “서비스 네트워크와의 협력은 고객 만족의 핵심”이라며 “입고 확대, 고객 케어 강화, 기술 지원 확대 등을 통해 고객 경험을 지속적으로 향상시키기 위해 최선을 다하겠다”고 강조했다.",https://n.news.naver.com/mnews/article/009/0005603910
2025-12-10 15:18:00,"JP모건 “주식·채권 6대4 포트폴리오, 인플레에 취약”","조던 스튜어트 JP모건 포트폴리오 매니저 인터뷰 인플레發 하락장도 버티는 주식·채권·대체 4-3-3 제안  비둘기파 연준 의장 임명에 중간선거 눈치보는 트럼프 내년 증시는 불안요소 줄어  원화값 회복 4대 근거도 제시   “2026~2027년 물가가 급등할 수 있다. 대체투자를 늘린 ‘60/40 플러스(+)’ 포트폴리오로 대응해야 한다”  조던 스튜어트 JP모건자산운용 포트폴리오 매니저가 최근 매일경제와 만나 앞으로 15년 동안 ‘60/40+’ 포트폴리오가 전통적인 ‘60/40’ 포트폴리오를 능가할 것으로 전망했다. 스튜어트 매니저는 JP모건 멀티에셋솔루션본부에서 아시아·태평양 지역 기관 고객의 자산 배분을 조언하고 있다.  60/40+ 포트폴리오는 채권·대체자산 60%(각 30%)와 주식 40%로 구성된 포트폴리오다. ‘4-3-3(주식·채권·대체자산)’ 포트폴리오라고 볼 수도 있다. 그간 정석(定石)으로 여겨졌던 60/40 포트폴리오가 주식(60%)과 채권(40%)에만 투자했다면 60/40+는 주식·채권 비중을 낮추고 대체자산 비중을 끌어올렸다.  60/40+ 포트폴리오의 대체자산은 세부적으로 부동산(25%), 원자재 등 실물자산(25%), 사모펀드(25%), 사모신용(15%), 헤지펀드(10%)로 쪼개진다.  대체투자 비중을 높여야 하는 이유에 대해서 그는 “인플레이션 변동성이 커졌을 때를 대비해 방어력 있는 자산을 편입하는 것”이라고 설명했다. 이어 “내년에는 관세 영향과 미 노동시장 공급 부족 등 인플레이션 스파이크(급등)를 유발할 요인이 많다”며 “지난 2022년 사례처럼 고물가 시기에는 주식과 채권이 양의 상관관계를 보여 60/40 포트폴리오의 분산효과가 떨어질 것”이라고 덧붙였다.  JP모건의 장기자본시장가정(LTCMA)은 글로벌 분산화된 60/40+ 포트폴리오가 향후 10~15년간 연평균 6.9%(달러 기준)의 수익률을 낼 수 있을 것이라고 전망한다. 이는 주식·채권 60/40 포트폴리오의 6.4%보다 높다. 수익률만 높은 것이 아니라 변동성도 큰 폭으로 줄어든다.  스튜어트 매니저는 “내년에도 지정항적·정치적 변동성은 있겠지만 올해 해방의 날(Liberation Day·4월 2일)과 같은 사태는 없을 것”이라며 “투자자들은 분산된 포트폴리오를 갖추고 계속 투자 상태를 유지하는 것이 중요하다”고 말했다.  특히 내년에 예정된 ‘빅 이벤트’는 자본시장 전반에 호재라는 분석이다. 내년 초 새롭게 임명될 연방준비제도(연준·Fed) 의장은 완화적 통화정책을 펼 것이며, 중간선거를 앞둔 도널드 트럼프 미국 대통령은 노동시장을 개선시킬 것으로 예측했다.  다만 주요국 부채 비율이 지나치게 높고, K자형 소득 불평등이 심화하고 있는 현상은 계속 주시해야 할 위험 요인으로 분석됐다.  연말 리밸런싱 아이디어로는 상대적으로 고평가된 자산에서 일부 차익을 실현하고 저평가 자산을 매집하는 것아 좋은 아이디어로 평가됐다.  내년에는 미 기술주 7대장 ‘매그니피센트 7’에서 S&P493(S&P500에서 매그니피센트 7을 뺀 나머지 기업)으로, 미국 시장에서 비(非)미국 시장으로 상승세가 확산(broadening)될 것으로 전망됐다. 다만 인공지능(AI)이 주도하는 미 증시는 높은 매출 성장률을 보이고 있어 여전히 핵심 투자 자산으로 간주됐다.  스튜어트 매니저는 한국인 투자자들에 대한 조언도 남겼다.  최근 원화 약세로 인해 한국 투자자들이 달러화 자산을 대거 매집하는 현상에 대해서는 ‘균형을 맞출 필요가 있다’고 지적했다.  그는 “향후 15년간 원화값은 연평균 2% 절상될 것”이라고 봤다. 원화값의 반등 요인은 메모리 반도체 관련 외국인 직접투자 유입, 국민연금의 한국주식 비중 확대, 한국의 세계국채지수(WGBI) 편입, 일본 정부의 엔화 절상 노력 등이다.  레버리지 등 고위험을 감수하는 투자자에 대해서는 “최소한 자산 일부라도 분산을 시작해야 한다”며 “올해 레버리지 상장지수펀드(ETF)로 돈을 벌었다면 보다 장기적인 투자처로 돈을 옮기는 것이 좋다”라고 말했다.",https://n.news.naver.com/mnews/article/009/0005603909
2025-12-10 15:13:00,"국순당, 위퍼블릭과 ‘자립준비청년 후원’ 업무협약 체결","국순당이 자립준비청년의 경제적·사회적 자립을 지원하기 위해 위메이드의 블록체인 기반 사회공헌 플랫폼 ‘위퍼블릭’과 업무 협약을 체결했다.  업무협약식은 지난 9일 경기도 성남시 분당구에 위치한 위메이드 사옥에서 국순당 차승민 경영혁신본부장과 위메이드 김원상 체인사업실장 등이 참석한 가운데 진행됐다.  자립준비청년은 아동복지시설 및 위탁가정에서 보호받다가 만 18세가 돼 독립해야 하는 청년을 말한다.  국순당은 사회 구성원으로 충분한 역할 및 높은 자립 가능성이 있으나 법적 보호 기간 종료 후 자립 이전 공백기에 대한 지원의 필요성을 절감하고 기업의 사회적 책임을 다하고자 후원 사업을 펼치게 됐다.  국순당의 자립준비청년 후원활동은 자립지원, 가치강화, 참여확대 등으로 진행된다.  자립지원은 기업 인턴십, 서포터즈 활동 등 취업에 필요한 직무체험 등을 지원할 계획이다.  가치강화 후원은 양조교육을 통해 우리 문화를 공유하고 바른 음주문화를 체험하는 문화적 경험을 제공할 계획이다.",https://n.news.naver.com/mnews/article/009/0005603908
