날짜,제목,본문,링크
2025-12-03 15:04:00,"토니모리, 이마트 전용 더마코스메틱 ‘더마티션’ 론칭","토니모리는 이마트 전용 브랜드 ‘더마티션’(Dermatician)을 새롭게 론칭하고, 글루타티온 라인 5종과 오메가 라인 4종 등 총 9종의 신제품을 출시했다고 3일 밝혔다.  더마티션은 검증된 효능의 성분을 배합하여 다양한 피부 문제를 개선한다는 클리니컬 더마(clinical derma) 코스메틱 브랜드다.  글루타티온 라인은 고순도 글루타티온과 나이아신아마이드를 배합해 기미와 탄력 저하를 막고 피부 톤 개선에 도움을 주는 2중 기능성 화장품이다. 글루타티온은 항산화 및 항멜라닌 효능의 성분을 갖췄다.  스팟 토닝 앰플은 고농축 앰플 제형으로 겉 기미와 잡티, 피부 속 숨은 기미를 케어하는 제품군이다. 브라이트닝 토너는 에센스 타입의 제형으로 거칠고 어두운 피부 속부터 차곡차곡 수분 미백 성분을 충전해준다. 래디언스 멀티밤은 기미, 잡티, 주름 등의 부위에 수시로 바를 수 있는 스틱 제품이다.  브라이트닝 크림은 피부에 촉촉하게 밀착되어 숨은 기미와 늘어진 피부 탄력을 케어하는 제품이다. 스팟 토닝 슬리핑 팩은 젤 제형으로 멜라닌을 케어하는 크림 제품이다.  오메가 라인은 식물성 오메가-3와 시카 성분, 멀티 펩타이드를 조합해 피부 보습·진정·탄력까지 케어하는 남성용 기능성 라인으로, ‘시카 오메가’ 3종과 ‘펩타이드 오메가’ 1종으로 출시됐다.  ‘시카 오메가’ 라인은 모공의 330분의 1 크기인 엑소좀 시카 성분을 더해 면도·환경 자극으로 민감해진 피부를 빠르게 진정시키는 데 도움을 준다. ‘펩타이드 오메가’ 라인은 9종 멀티 펩타이드를 담아 피부 속 탄력을 끌어올리고 겉은 팽팽하게 잡아주는 주름 케어에 초점을 맞췄다.  이번 신제품은 전국의 이마트 오프라인 매장 88개 및 온라인몰에서 판매된다. 향후 라인을 확대해 고객의 피부에 맞춘 다양한 더마 코스메틱 라인을 선보일 계획이다.  토니모리 관계자는 “다이소와 대형마트, 올리브영 등 다양한 채널에서 가성비 높은 화장품을 소비하는 트렌드에 맞춰 이마트와 함께 하는 새로운 더마 브랜드를 선보이게 됐다”며 “각 채널 특성에 맞는 제품 포트폴리오를 구성, 소비자 니즈에 적극 부응해 나가겠다”고 말했다.",https://n.news.naver.com/mnews/article/009/0005600225
2025-12-03 15:04:00,"코그, ‘그랜드체이스 클래식’ 올 마지막 대규모 업데이트…‘솔레네’ 선","코그(대표 이종원·KOG)는 ‘그랜드체이스 클래식’이 올해 마지막 대규모 업데이트를 통해 신규 지역 ‘솔레네’를 선보인다.  ‘솔레네’는 3년만에 선보이는 신대륙으로 그랜드체이스 단원들이 신규 캐릭터 ‘이리스’와 함께 모험의 서사시를 써내려 갈 새로운 맵이다.  ‘솔레네’는 모두 5개의 던전으로 이루어져 있다. 그 중 첫 번째 던전은 ‘영원의 예배당’이다.  ‘영원의 예배당’은 ‘이리스’의 회상을 시작으로 비밀스러운 과거를 엿보며 앞으로 다가올 시련을 추측할 수 있는 흥미로운 전개를 보여준다.  첫 던전 ‘영원의 예배당’과 함께 다양한 업데이트가 진행되어 육성하는 재미를 강화하고 더 빠른 성장을 지원한다.  캐릭터 최대 레벨 확장, 신규 스킬 룬 시스템 추가, 신규 발찌 장비 추가, 미션 간소화 및 UI 개선 등 업데이트를 통해 캐릭터 육성이 간편해지고 육성 방향에 따라 개성 있는 능력치를 가진 캐릭터를 만들어 볼 수 있다.  새로운 던전과 함께 게임내 새로운 주제가도 공개됐다.  번에 새롭게 선보이는 ‘약속의 노래’는 ‘희망’ 이후 22년만에 선보이는 새로운 주제가로 앞으로 이어 나아갈 그랜드체이스의 여정을 잘 표현하고 있다.  Tomo 디렉터는 “‘그랜드체이스 클래식’의 새로운 스토리, 새로운 던전, 새로운 주제가와 함께 새로운 재미를 느낄 수 있도록 많은 준비를 하고 있다. 유저들에게 소중한 추억의 시간이 될 수 있도록 앞으로 더욱 가까이 다가가고 노력하겠다”고 말했다.  ‘그랜드체이스 클래식’은 2025년 캐릭터 ‘각성’ 시스템을 추가해 기존 캐릭터들의 성장을 더욱 강화하는 동시에 캐릭터의 새로운 모습을 볼 수 있도록 성장 구간을 강화했다.  새로운 캐릭터 ‘이리스’를 출시해 그랜드체이스 세계관의 확장을 예고하는 한편 캐릭터 밸런스 개편 및 편의성 개선 등의 다양한 노력을 기울이고 있다.  연말 이벤트에서는 더욱 풍성한 보상을 마련한다.  출석 보상으로 귀여운 눈사람 코스튬 ‘귀염귀염 크리스마스 한 벌 코디 선택 상자’를 지급하고 선행도 이벤트에 참여해 ‘따끈따끈 붕어빵 코디’, ‘X-mas 사인보드’, ‘크리스마스 펫’ 등 다양한 아이템을 받을 수 있다.  이외 ‘마스터 로드 이벤트’를 통해 새로 선보이는 이벤트 복장 ‘영원의 여행자 코디’, ‘타락한 성자 가이안’ 몬스터 카드 등 다양한 혜택이 제공된다.  신규 지역 ‘솔레네’의 다음 던전은 내년 상반기까지 순차적으로 공개될 예정이다.",https://n.news.naver.com/mnews/article/009/0005600224
2025-12-03 15:03:00,"네오플, 제주 보육원에 ‘던파 페스티벌’ 기부금 후원","유저 모금·회사 기부금 등 9100만원 ‘던파 모험가 일동’ 명의로 전달   넥슨 산하 게임 개발사 네오플은 지난달 22일 개최된 ‘2025 던파 페스티벌’의 ‘성띵 스페셜’ 기부 이벤트로 조성된 모금액과 회사 기부금을 합산한 후원금 9100만원을 본사가 있는 제주도 내 보육원 시설환경 개선 사업에 지원한다고 3일 밝혔다.  이번 기부금은 유저들과의 약속을 이행하는 의미를 담아 ‘던파 모험가 일동’의 이름으로 전달되며, 제주 지역 아동들이 보다 안전하고 쾌적한 생활환경을 누릴 수 있도록 노후화된 도내 보육원 시설을 개보수하는데 사용될 예정이다.  제주도 보육원 시설환경 개선 사업의 대상 기관인 홍익아동복지센터, 제주보육원, 천사의집, 제남아동센터를 비롯한 도내 보육원 4곳은 정부 지원금이 보육료, 교육 프로그램, 기본 운영비 및 안전 필수 항목에 우선적으로 배정됨에 따라 노후화된 시설에 대한 실질적인 개선이 어려운 상황이었다.  네오플은 각 보육원별로 필요 수리 항목을 검토하고 공사 견적 비교를 거쳐 내년 말까지 공간 개보수에 필요한 금액을 후원할 계획이다.  윤명진 네오플 대표는 “20주년을 함께해 주신 던파 모험가분들과의 약속을 지키는 마음으로 후원금을 전달하게 된 만큼 그 의미가 더욱 깊다”며 “이번 기부가 도내 보육원 아이들의 생활환경을 개선하는 데 작은 보탬이 되길 바란다”고 말했다.  한편 네오플은 도내 백혈병 소아암 환아 지원, 발달장애아동 재활치료비 지원, 드림UP 예체능 꿈나무 지원, 보호대상 아동 디딤씨앗통장 적립금 지원, 방과 후 공부방 ‘꿈들’ 지원 등 제주 지역사회를 대상으로 다양한 사회공헌 활동을 펼치고 있다.",https://n.news.naver.com/mnews/article/009/0005600223
2025-12-03 15:01:00,"충남테크노파크, 6번째 입주기업 코스닥 상장 견인…창업보육 시스템 성과","‘창업보육에서 코스닥 상장까지’ 충남형 성장 생태계 모델 지속 확장   충남테크노파크(원장 서규석, 이하 충남TP)가 또 하나의 지역 대표 기술기업을 코스닥으로 배출했다. 충남TP 입주기업이었던 주식회사 엘케이켐(대표 이창엽)이 올해 2월 코스닥 시장에 상장하며 충남TP 보육기업 중 여섯 번째로 코스닥 상장이라는 기록을 세웠다.  엘케이켐은 반도체·디스플레이 공정의 핵심 소재인 전구체(Precursor)를 자체 기술로 개발해 국산화에 성공한 정밀화학소재 기업이다. ALD(원자층 증착) 공정용 고순도 전구체 기술은 국내 수요가 빠르게 증가하고 있는 분야로 엘케이켐은 이 기술력을 기반으로 글로벌 경쟁력을 확보했다. 상장 당시 일반 청약 경쟁률은 652대 1을 기록했으며 상장 첫날 공모가 대비 180% 이상 상승하는 성과를 내며 시장의 주목을 받았다.  충남TP 관계자는 “엘케이켐은 창업 초기부터 충남TP의 보육 지원을 기반으로 기술 역량을 확립하고, 소재 생산설비 확장·인증·품질 고도화를 단계적으로 달성한 기업”이라며 “기술 중심의 체계적인 성장 모델이 코스닥 상장이라는 결실로 이어졌다”라고 설명했다.  이러한 성과는 충남TP가 제공하는 창업후보육지원, 스타기업 및 선도기업 지원을 통한 기업 성장 사다리가 실제로 작동했다는 점에서 의미가 크다. 충남TP는 창업보육을 넘어 ▲기술·시제품 개발 지원 ▲시험·인증·포장재 개발 등 기업 애로 지원 ▲투자·정책자금 연계 ▲전략기술 분야 전문가 컨설팅 등을 통해 기업의 사업화와 스케일업을 촉진해 왔다.  지역 창업보육기관에서 상장기업이 나오기 어렵다는 업계 인식과 달리 충남TP는 6번째 상장기업을 공식 배출하며 전국적인 이목을 끌고 있다.  엘케이켐의 성과는 12월 3일 개최한 ‘충남 중소기업 기술경쟁력 강화를 위한 업무협약 및 홈커밍데이’ 행사에서도 크게 조명됐다.  이번 홈커밍데이는 충남TP와 충청남도, 기술보증기금이 공동으로 주최한 행사로 지역기업 300여 명이 참석해 기술·사업·투자 네트워크를 강화하는 자리였다.  서규석 충남TP 원장은 “엘케이켐은 반도체·소부장 분야에서 충남이 지향하는 기술 자립과 글로벌 경쟁력을 상징하는 기업”이라며 “충남TP는 앞으로도 혁신기업을 발굴하여 창업보육에서 코스닥 상장까지 이어지는 충남형 성장 생태계 모델을 지속적으로 확장할 것”이라고 강조했다.  엘케이켐의 상장은 단일 기업의 성공을 넘어 지역 창업보육기관이 기술기업을 세계 시장으로 이끌 수 있음을 보여주는 대표적 사례로 평가된다.  충남TP는 앞으로도 지역 전략산업을 중심으로 혁신기업을 적극 육성하여 충남 경제의 미래 경쟁력을 강화하는 데 핵심적인 역할을 할 계획이다.  충남테크노파크(원장 서규석)는 “성공기업을 매년 배출하며 지역 일자리 창출에 기여하는 등 경기 불황에도 기술 개발, 맞춤형 사업화 지원으로 성과 창출하는 기업들을 지속 견인할 계획이다”라고 강조했다.",https://n.news.naver.com/mnews/article/009/0005600222
2025-12-03 15:00:00,"“골골 80세라더니”…최고치 찍은 한국인 기대수명, 18년간 ‘유병장수’","신생아 기대수명 남 80.8세·여86.6세 건강수명 남 64.6년·여 66.4년 소폭감소   지난해 태어난 신생아의 기대수명이 83.7년으로 집계되며 역대 최고치를 기록했다. 남녀 모두 기대수명이 늘어난 반면, ‘건강하게 보내는 기간(건강수명)’은 오히려 줄어든 것으로 나타났다.  국가데이터처가 3일 발표한 ‘2024년 생명표’에 따르면 지난해 출생아의 기대수명은 83.7년으로 전년보다 0.2년 늘었다. 코로나19 영향으로 기대수명이 감소했던 2022년 이후 2년 연속 상승세다. 기대수명은 해당 연령대의 사망률이 앞으로도 동일하게 유지된다는 가정하에 산출된다.  성별로 보면 남자의 기대수명은 80.8년, 여자는 86.6년으로 각각 0.2년 늘었다. 남녀 간 기대수명 차이는 5.8년으로, 1985년 8.6년을 정점으로 꾸준히 줄어드는 추세다. 박현정 국가데이터처 인구동향과장은 “남성이 질환·음주·사고 등 위험 요인에 상대적으로 많이 노출되지만, 관련 사망률은 꾸준히 낮아지고 있다”며 “특히 지난해에는 폐렴으로 인한 남성 사망 확률이 감소했다”고 설명했다.  60세 기준 기대여명은 남자 23.7년, 여자 28.4년으로 모두 전년보다 늘었다. 지난해 출생아가 80세까지 생존할 확률은 남자 64.4%, 여자 82.2%였다.  주요 사망 원인은 악성 신생물(암) 19.5%, 폐렴 10.2%, 심장 질환 10.0%, 뇌혈관 질환 6.9% 순이었다. 사망 원인 중 암이 제거될 경우 기대수명은 3.3년 늘어날 것으로 추정됐다.  반면 건강하게 지내는 기간은 평균 65.5세로 남자는 64.6년, 여자는 66.4년으로 나타나 각각 0.5년, 0.2년 줄었다. 기대수명 중 건강하게 보내는 기간의 비율도 남자 79.9%, 여자 76.7%로 모두 하락했다. 박 과장은 “의료 접근성이 높아지면서 경미한 질환이라도 병원을 이용하는 경우가 늘어나 건강수명이 단축된 것처럼 보일 수 있다”고 말했다.  우리나라 기대수명은 경제협력개발기구(OECD) 평균보다 남자는 2.3년, 여자는 2.9년 더 길다. 남자 기대수명이 가장 높은 국가는 스위스(82.4년), 여자는 일본(87.1년)으로 나타났다.",https://n.news.naver.com/mnews/article/009/0005600221
2025-12-03 14:58:00,"엔씨, ‘BNS NEO’ ‘NEO Original’ 업데이트…특화 서버 ‘원’ 오픈","엔씨소프트(공동대표 김택진, 박병무)는 MMORPG ‘블레이드 & 소울 NEO(이하 BNS NEO)’가 ‘NEO Original’ 업데이트를 3일 진행했다고 밝혔다.  ‘BNS NEO’는 3일 19시에 신규 특화 서버 ‘원’을 오픈한다.  원 서버는 유료 재화인 ‘신석’대신 게임 내 재화인 ‘금’을 중심으로 운영된다.  이용자는 금을 사용해 거래소 이용, 캐릭터 육성, 장비 성장 등을 할 수 있다.  원 서버 캐릭터 생성 시 ‘고속 성장’을 통해 50레벨로 시작할 수 있다. 신규 외전 퀘스트 완료 후에는 백청산맥 영웅 장비를 획득할 수 있다.  엔씨소프트는 신규 직업 ‘마기사’를 선보인다.  마기사는 창을 무기로 사용하며 마기를 활용한 무공들을 선보인다.  근거리와 원거리 대응이 모두 가능하며, 상대를 봉쇄하는 능력 등 직관적인 무공이 특징이다.  기존 직업인 ‘검사’에 새로운 무공 ‘천뇌옥’을 추가했다.  ‘천뇌옥’은 주력 무공 사용 시 획득되는 ‘뇌옥’을 누적하여 발휘되는 광역 공격 기술이다. 다른 직업의 신규 무공도 추후 업데이트 예정이다.  신규 지역 ‘선환도’더 공개한다. ‘선환도’는 ‘천하사절’이라 불리는 강호들이 수련하던 지역으로 새로운 스토리와 신규 보스를 만나볼 수 있다.  엔씨소프트는 ‘NEO Original’ 업데이트를 맞이하여 ▲럭키 스타트 ▲홍사형의 무료 패스 ▲홍사형의 골든 성장 보너스 상자 등 다양한 이벤트를 진행한다.  ‘럭키 스타트’는 신규 서버 이용자에게 성향에 맞춘 직업을 추천하는 이벤트로 참여 시 원하는 직업의 전설 등급 핵심 무공 1종을 획득할 수 있다.  신규 및 복귀 이용자는 ‘홍사형의 무료 패스’를 통해 각종 성장에 필요한 재화들을 획득할 수 있다.  패스 미션을 달성하면 백청산맥 지역의 던전 플레이에 도움이 되는 ‘보패’, ‘도화’, ‘인장’ 등의 보상을 제공한다.  ‘골든 성장 보너스 상자’ 이벤트를 통해서는 강화 및 합성 등에 사용되는 ‘골든 티켓’을 얻을 수 있다. 모든 이용자에게는 ‘직업 변경 이용권’을 선물한다.",https://n.news.naver.com/mnews/article/009/0005600220
2025-12-03 14:55:00,"코웨이, 국내 최대 얼음용량 ‘아이스 스탠드 자이언트’ 정수기 출시","5.2kg 얼음 저장고·4중 UV살균 기능 장착   코웨이가 제빙 성능을 극대화한 대용량 스탠드형 얼음정수기 ‘아이스 스탠드 자이언트’를 출시했다고 3일 밝혔다.  코웨이의 아이스 스탠드 자이언트 정수기는 국내 스탠드형 얼음정수기 중 가장 얼음 저장용량이 큰 제품으로, 5.2kg의 얼음을 저장할 수 있다. 하루 제빙량도 기존보다 94% 늘려 매일 20kg(약 1659개) 얼음을 만들어낸다. 12분마다 얼음을 얼려, 기존 대비 제빙 속도도 31% 빨라졌다.  신제품은 물을 받는 주출부 높이를 팔 높이까지 올려 허리를 굽힐 필요가 없게 설계했다. 추출 공간은 27cm로 넓어져 긴 물병도 기울이지 않고 안정감 있게 올려두고 쓸 수 있다. 3단계 맞춤 추출로 500ml, 700ml, 1L 용량을 원터치로 간편하게 선택할 수 있다.  여러 명이 사용하는 대용량 제품인만큼 위생 측면도 강화했다. 4중 UV살균 기능으로 얼음 저장고와 트레이, 파우셋을 주기적으로 살균해주며, 물이 나오는 추출구 커버와 파우셋, 얼음트레이 등은 분리 세척이 가능하다.  코웨이는 “아이스 스탠드 자이언트 정수기는 압도적인 얼음 용량과 제빙 성능을 갖춰 사무실과 공공시설, 군부대 등에서도 여유롭게 사용할 수 있다”고 말했다.",https://n.news.naver.com/mnews/article/009/0005600218
2025-12-03 14:55:00,"삼화페인트, 자동차 보수용 페인트 출시","‘카로클 프리미엄 실러’   삼화페인트공업은 자동차 보수용 페인트인 ‘카로클 프리미엄 실러’를 신규 출시했다고 3일 밝혔다.  자동차 보수용 도장 시스템은 프라이머와 실러, 베이스코트, 클리어코트로 나누는데, 이번 제품은 표면 접착력을 높여 차량 색상이 균일하게 적용되도록 돕는 실러다.  ‘카로클 프리미엄 실러’는 삼화페인트의 자동차 보수용 페인트 제품인 ‘카로클’시리즈 중 하나로, 초보자부터 숙련자까지 사용할 수 있다. 건조 속도가 빨라 작업 시간을 단축할 수 있으며, 외관 품질을 균일하게 구현한다.  이 제품은 8종의 그라운드컬러(GC)를 보유해 자동차 보수용 제품에서 흔히 발생하는 미세한 색상차이를 최소화했다. 이 제품에 범퍼 전용 첨가제를 적용하면 범퍼 도장을 적용할 수 있는 것도 장점이다.  삼화페인트 관계자는 “이번 신제품은 물성이 우수하고 속건성과 은폐력에서 모두 돋보이는 성능을 갖춘 제품”이라고 말했다.",https://n.news.naver.com/mnews/article/009/0005600217
2025-12-03 14:54:00,"뉴진스 떠나보낸 민희진, 칼 다시 갈았다…새 아이돌 제작 본격 착수","뉴진스와 결별한 뒤 사실상 ‘백지 상태’가 된 민희진 전 어도어 대표가 재기를 위해 다시 칼을 갈았다. 새 아이돌 그룹 론칭을 목표로 본격적인 준비 작업에 착수했다.  3일 온라인 커뮤니티 등에 따르면 민희진이 설립한 오케이 레코즈는 오는 7일 유명 댄스 학원에서 비공개 내방 오디션을 진행한다.  민희진은 지난 10월 새 연예기획사 오케이 레코즈를 설립한 뒤 법인 등기를 마쳤고, 서울 강남구 신사동 인근에 건물까지 마련했다. 기획·콘셉트·비주얼 제작을 총괄하는 독자 체제를 구축하며 새로운 그룹 제작에 속도를 내는 모습이다.  오케이 레코즈는 연예인 매니지먼트 대행업, 음악제작·음반제작·음악 및 음반유통업, 공연 및 이벤트 기획·제작업, 브랜드 매니지먼트 대행업 등을 사업 목적으로 등록했으며, 민희진이 사내이사로 이름을 올렸다.  이 가운데 오케이 레코즈가 오디션을 통해 본격적인 연습생 모집에 나서 눈길을 끈다. 오디션 지원 자격은 2006~2011년생이다. 국적과 성별이 무관한 것으로 보아 걸그룹과 보이그룹 모두를 염두에 두고 있는 것으로 보인다.  지난해 11월 어도어와 결별하고 독립을 선언한 민희진과 달리, 뉴진스 멤버들은 지난 10월 30일 어도어와의 전속계약 유효 확인 소송 1심 패소 후 소속사로 복귀하겠다고 밝혔다.  다만 해린·혜인과 민지·하니·다니엘의 방식이 달랐다. 해린·혜인은 지난 11월 12일 어도어를 통해 복귀 소식을 전했고, 민지·하니·다니엘은 별도 입장을 내고 어도어로 돌아가겠다고 했다.  이에 대해 어도어 측은 민지·하니·다니엘의 복귀 소식을 사전에 접하지 못했다며 “개별 면담을 조율 중”이라고 입장을 냈다. 현재 어도어는 남극에 체류 중이었던 하니를 제외한 민지, 다니엘과 개별 면담을 진행한 것으로 알려졌다.",https://n.news.naver.com/mnews/article/009/0005600216
2025-12-03 14:52:00,"컴투스, ‘서머너즈 워’ 소환수 ‘세이메이’ 등 콘텐츠 업데이트","컴투스(대표 남재관)는 키우기 디펜스 RPG ‘서머너즈 워: 러쉬’에 신규 소환수 ‘세이메이’와 함께 다양한 콘텐츠를 업데이트했다.  이번 업데이트를 통해 새롭게 등장한 레전드 등급 소환수 ‘세이메이’는 ‘서머너즈 워’ IP의 인기 캐릭터인 빛 속성 음양사로 치명타 공격 시 원거리형 아군의 강타 성능을 강화한다.  일정 횟수 이상 한 대상을 공격 시 면역을 해제하고 피해를 증가시키는 등 전투 흐름을 유리하게 만드는 기술을 사용한다.  오는 17일까지 진행되는 픽업 이벤트를 통해 보다 손쉽게 획득할 수 있다.  초보 및 복귀 유저를 위한 미션형 이벤트 ‘입문자의 수련’도 열린다. 해당 이벤트는 스테이지 클리어, 마법구 사용, 소환수 레벨업, 용의 둥지 플레이 등을 통해 입문자가 자연스럽게 게임 구조를 익힐 수 있다.  미션을 완료하면 소환수·크리쳐 소환권, 골드, 마나석, 마법구 등 성장에 도움이 되는 각종 아이템을 얻을 수 있다.  콘텐츠 전반의 볼륨도 넓혔다.  소환수 최대 레벨을 기존 80에서 85로 상향해 소환수 성장과 전투 배치를 보다 세밀하게 구성할 수 있게 했다.  필드 스테이지는 기존 1만6400에서 1만7200단계로 천공섬 방어전은 챕터 29까지 확대했다.  이와 함께 던전은 900단계, 시험의 탑은 2000층까지 넓혔다.  훈련 강화, 수호 강화, 장비 슬롯 강화 등 핵심 성장 레벨도 상향 조정해 보다 다각도의 전투력 강화가 가능해졌다.",https://n.news.naver.com/mnews/article/009/0005600215
2025-12-03 14:52:00,"“스케줄 조정 어려워”…성유리, 7개월 만에 홈쇼핑 하차",남편의 법정 구속으로 논란을 빚은 그룹 핑클 출신 배우 성유리씨가 홈쇼핑 프로그램에서 하차했다.  3일 업계에 따르면 성유리씨는 홈쇼핑 채널 GS샵에서 진행하던 ‘성유리 에디션’ 방송을 마무리했다.  GS샵 관계자는 “성유리씨 활동이 많아지면서 스케줄 조정이 어려워 자발적으로 홈쇼핑 출연을 종료하게 됐다”고 설명했다.  계약 종료로 인해 GS샵 공식 홈페이지와 채널에서는 성씨 관련 게시물이 내려갔다.  앞서 성씨는 지난 4월 30일 성유리 에디션‘을 통해 2년 만에 방송에 복귀했다. 쇼호스트들과 함께 프로그램을 이끌며 시청자와 소통해왔다. 당시 남편 안성현씨가 사기 및 배임수재 혐의로 법정 구속된 이후 첫 공식 활동이라 주목받은 바 있다.  한편 성씨는 지난 1일 자신의 사회관계망서비스에 ‘성유리 에디션’ 방송 클립을 엮은 영상을 올리며 “함께 했던 모든 순간들을 기억하겠다”고 적었다.,https://n.news.naver.com/mnews/article/009/0005600214
