날짜,제목,본문,링크
2025-12-09 10:53:00,"에이블게임즈, AGF 2025서 ‘크레센트’ 폭발적 호응…4천여명 ‘방문’","에이블게임즈는 지난 5일부터 7일까지 일산 킨텍스에서 개최된 ‘Anime X Game Festival(이하 AGF 2025)’에서 관람객들의 폭발적인 호응 속에 성공적으로 행사를 마무리했다고 9일 밝혔다.  AGF 2025는 국내 공식 애니메이션X게임 페스티벌로 역대 최대 규모로 개최됐다. ‘크레센트’ 부스에는 기간 동안 약 4000여 명 이상이 방문했다.  ‘크레센트’ 부스에서는 게임의 주요 비주얼과 세계관 일부를 담은 정찰선 ‘만타리온’을 콘셉트로 한 선내 카페를 운영해 마치 게임 속에 들어간 듯한 이색적인 경험을 제공했다.  행사 현장에서는 ‘크레센트’의 세계관을 생생하게 체험할 수 있는 다양한 프로그램이 운영됐다.  풍성한 경품을 제공하는 스탬프 랠리부터 주요 캐릭터로 변신한 코스어들과 함께하는 포토타임, 스페셜 카페 데이트 등 방문객들이 게임 속 매력을 온전히 느낄 수 있는 다채로운 콘텐츠가 제공되어 호응을 이끌어냈다.  특히 스탬프 랠리에 참여만 해도 한정 굿즈는 물론 스페셜 카페 데이트 체험 기회가 제공됐다.  스페셜 카페 데이트에서는 코스어들과 함께 다과를 즐기고 폴라로이드 사진 촬영과 타로점 등 1:1 프로그램을 진행해 당첨자에게 잊지 못할 추억을 선사했다.  에이블게임즈는 이번 AGF 2025 참가를 시작으로 팬들과의 접점을 넓혀가며 ‘크레센트’만의 독창적인 매력을 꾸준히 선보일 계획이다.  ‘크레센트’는 글로벌 450만 다운로드를 기록한 ‘달토끼 키우기’와 넥슨과 공동 개발한 ‘메이플 키우기’를 선보인 에이블게임즈의 신작 서브컬처 RPG다.",https://n.news.naver.com/mnews/article/009/0005603099
2025-12-09 10:52:00,“웰니스 열풍”…롯데 잠실에 유통사 최대 규모 ‘알로’ 오픈,"본점에 이어 잠실점까지 프리미엄 웰니스 라이프스타일 공간 조성   롯데백화점이 지난 5일 잠실점 본관 1층에 요가와 피트니스는 물론 일상 전반을 아우르는 웰니스 라이프 스타일을 제안하는 프리미엄 글로벌 브랜드 ‘ALO(알로)’ 매장을 오픈했다고 9일 밝혔다.  잠실점은 올해 8월 본점 오픈에 이은 두 번째 롯데백화점 매장이자 백화점 내 공식 3호점이다. 이번 ‘ALO(알로)’의 오픈으로 롯데타운 잠실은 트렌디한 감각과 건강을 중시하는 MZ 고객들의 니즈를 완벽하게 충족시키는 ‘프리미엄 웰니스 브랜드의 성지’로 자리매김할 전망이다.  지난 8월에 오픈한 본점 ‘ALO(알로)’ 매장은 오픈 첫날부터 오픈런 행렬을 이루며 화제가 되었다. 첫날에는 800팀 이상 대기해서 입장할 정도로 반응이 뜨거웠으며, 이후에도 일평균 1000명 이상의 고객이 꾸준히 방문하며 높은 인기를 이어가고 있다.  잠실점 ‘ALO(알로)’는 약 280㎡(85평)의 유통사 최대 규모로, 남녀 모두를 위한 ‘토탈 프리미엄 라이프스타일’ 매장이다. 알로의 핵심 철학인 ‘스튜디오 투 스트리트(Studio to Street)’를 바탕으로 하는 차별화된 공간으로 조성했다. ‘프리미엄 웰니스’라는 새로운 기준과 가치를 제시하는 브랜드에 걸맞게, 기존 플래그십 매장에서 만날 수 있었던 요가 웨어, 스포츠 브라 등의 액티브 웨어 뿐 아니라 스웻셔츠, 원피스, 언더웨어, 슈즈, 가방, 액세서리 등 다양한 제품군을 한 자리에서 선보인다.  이번 매장 오픈과 함께 롯데타운 잠실에서 국내 최초로 홀리데이 팝업을 진행한다. 12일부터 내년 1월 4일까지 에비뉴엘 잠실점 더크라운에서 진행되며, 연말 시즌에 맞춰 화이트 톤의 플라워 연출로 ‘화이트 크리스마스’ 콘셉트를 구현해 기존 매장과 차별화했다. 팝업에서는 기존 매장 상품과 함께 프리미엄 ‘아뜰리에’ 컬렉션을 전개해 고객들에게 보다 차별화된 경험을 제공할 예정이다.  잠실점 오픈을 기념해 본 매장 및 팝업에서는 음료 케이터링 서비스, 아크로 요가 퍼포먼스, DJ 플레잉 등 다양한 이벤트를 진행할 예정이다.  진승현 롯데백화점 패션부문장은 “국내에서도 프리미엄 웰니스 시장에 대한 고객들의 관심이 높아지는 추세에 맞춰 잠실 상권에 ALO를 오픈하게 됐다”며 “고객의 소비 트렌드와 니즈를 반영해, 향후에도 다양한 글로벌 브랜드 발굴 및 컨텐츠 개발에 힘쓸 것”이라고 말했다.",https://n.news.naver.com/mnews/article/009/0005603098
2025-12-09 10:52:00,"“묻고 더블로” 외친 라이벌, 뒷배는 대통령 사위…사면초가 넷플릭스","파라마운트, 워너 적대적 M&A 선언 159조원 실탄 투입하며 넷플 뒤통수 쿠슈너 사모펀드 ‘쩐주’로 참여 눈길 트럼프 비판 CNN도 인수 대상 포함   할리우드를 뜨겁게 달구고 있는 워너브라더스 인수전이 넷플릭스와 파라마운트의 ‘2파전’으로 재편될 가능성이 생겼다. 파라마운트가 인수에 무려 1084억 달러(약 159조원)의 실탄을 투입하며 ‘쩐의 전쟁’의 서막을 알렸다.  8일 뉴욕타임스(NYT)와 월스트리트저널(WSJ) 등에 따르면 파라마운트 스카이댄스(이하 파라마운트)가 워너브러더스 디스커버리(이하 워너브러더스)에 대한 적대적 인수·합병(M&A) 개시를 선언하고 워너브러더스 주주들을 상대로 주식 매입 제안에 돌입했다.  파라마운트는 CNN, TNT, TBS, 디스커버리 등 WBD의 케이블 채널까지 모두 인수 대상에 포함하는 제안을 하며 1084억 달러(약 159조원)의 기업 가치를 제시했다. 6일 넷플릭스가 827억달러(약 122조원)를 들여 워너브라더스 디스커버리의 스튜디오와 HBO맥스의 우선협상 지위를 확보했지만 경쟁자가 ‘묻고 더블로 가’에 배팅한 셈이다.  이로써 인수전의 가장 큰 변수는 ‘백악관’이 됐다. NYT는 파라마운트의 인수를 위한 투자자 명단에 도널드 트럼프 대통령의 사위 재러드 쿠슈너가 설립한 사모펀드 회사 어피니티 파트너스가 포함됐다고 보도했다.  파라마운트의 인수 자금에는 데이비드 엘리슨 파라마운트 최고경영자(CEO)의 아버지인 래리 엘리슨 오라클 CEO와 사모펀드 레드버드 캐피털 파트너스의 400억 달러(약 59조 원) 현금이 포함됐고, 투자 규모가 명확하지 않은 쿠슈너의 펀드도 참여한다.  이번 인수는 트럼프 행정부의 승인을 받아야하며 대통령은 해당 회사의 자회사인 CNN을 오랫동안 비판해왔다. 엘리슨 가문이 어피니티의 도움으로 합의를 마무리할 경우, 모회사의 일부 지분이 트럼프 가문의 소유가 될 전망이다.  쿠슈너는 트럼프 대통령의 첫 임기 이후 사모펀드 회사를 설립했으며, 사우디 국부펀드인 공공투자기금(PIF)에 대한 과도한 의존으로 논란에 휩싸인 바 있다. 약 54억 달러를 운용하는 이 회사는 주로 이스라엘 자동차 리스·금융 기업인 쉴로모 그룹이나 두바이 기반 중고거래 사이트 두비즐 같은 기업에 소규모 지분을 투자하는 것으로 알려져 있었다.  최근에는 사우디 PIF 및 실버레이크 파트너스와 함께 약 550억 달러에 게임회사 일렉트로닉 아츠(EA)를 인수하기 위해 투자 중이다.  파라마운트 인수 제안의 다른 금융 후원사로는 사우디아라비아, 카타르, 아부다비의 국부펀드 회사들이 포함된다. 파라마운트는 규제 당국 제출 서류에서 이들 투자자들이 워너브라더스 디스커버리 운영에 대한 지배권 및 이사회 의석권을 포기할 것이라고 밝혔다. 파라마운트는 이번 거래가 국가 안보에 위협이 되는지 평가하는 정부 위원회인 CFIUS(미국 외국인투자위원회)의 승인을 받기 위한 우려를 완화하기 위해 이러한 양보를 했다고 설명했다.  파라마운트가 워너브라더스 디스커버리 인수를 완료할 경우, 엘리슨과 레드버드는 신생 기업의 지배 주주가 된다. 파라마운트는 또한 뱅크오브아메리카, 시티그룹, 아폴로 캐피털 매니지먼트와 최대 540억 달러 규모의 신규 부채 금융 계약을 체결했다고 밝혔다.",https://n.news.naver.com/mnews/article/009/0005603097
2025-12-09 10:52:00,"소상공인 4000명, 카카오 덕에 디지털 전환 성공했다","카카오, ‘프로젝트 단골’ 2025년 성과 공개 누적 전국 286개 상권서 4112명 상인 교육 톡채널 메시지 발송 지원금 누적 334억원   카카오는 소상공인의 디지털 전환을 지원하는 ‘프로젝트 단골’을 통해 올해까지 전국 285개 상권 내 소상공인 4112명에 대한 디지털 교육을 완료했다고 9일 밝혔다.  올해 카카오는 지원 대상을 지역 단위로 확대하고, 맞춤형 교육과 마케팅 프로그램을 강화해 지역 경제 활성화와 소상공인의 디지털 역량 향상에 주력했다.  2022년부터 진행된 프로젝트 단골은 전통시장과 지역상점가에 직접 찾아가 디지털 전환 교육과 온·오프라인 홍보를 지원하는 카카오의 대표 상생 프로그램이다.  올해 카카오는 전국 59개 상권에서 상인 1265명에게 교육기회를 제공했다. 이는 지난해 대비 43% 늘어난 수치다.  지금까지 누적 286개 상권(251개 시장·35개 상점가)에서 4112명의 상인이 교육에 참여했고 이를 통해 4000여 개의 카카오톡 채널이 개설됐다. 해당 채널에는 약 99만명의 고객이 채널 친구로 등록해 해당 상인들은 고객과의 온라인 소통 기반을 마련할 수 있었다.  카카오는 소상공인의 고객 소통을 지원하기 위해 ‘톡채널 메시지 발송 지원’ 프로그램도 운영하고 있다. 올해 지급된 지원금은 70억원을 넘었고, 이를 포함한 누적 지원금은 334억원에 달한다. 현재까지 총 7만4000여 명의 소상공인이 혜택을 받았다. 이 프로그램은 연 매출 10억원 이하 소상공인이라면 ‘카카오 프로젝트 단골’ 공식 톡채널을 통해 언제든 신청 가능하다.  올해 첫 선을 보인 ‘단골버스’는 지역 상권에 활기를 불어 넣었다.  지역 상권과 고객을 연결하는 무료 셔틀버스인 단골버스는 지난 9월 18일 목포를 시작으로 공주, 오송, 문경 등 4개 지역에서 46일간 104회 운행됐다. 이 기간 동안 2400여 명의 탑승객이 지역 상권을 방문해 매출 증대에 기여했다.  이 밖에 카카오는 지역 청년 튜터(디지털 서포터즈) 운영, 소비 촉진 행사 ‘단골데이’, 온라인 판로 확대를 위한 라이브커머스 실습 등 지역 맞춤 프로그램을 새롭게 도입해 좋은 반응을 얻었다.  카카오는 내년에도 지원 지역과 프로그램을 확대해 프로젝트 단골을 강화할 계획이다. 인공지능(AI) 활용 교육 등 디지털 역량 강화 프로그램을 고도화하고 성공사례 공유 자리를 마련하는 한편, 단골버스 운영 지역도 확대해 지역 방문객 유입을 지원할 예정이다.  정신아 카카오 정신아 대표는 “앞으로도 AI 활용 교육 고도화 등 기술과 플랫폼을 기반으로 지역 경제와 소상공인에 실질적 도움이 되는 상생 활동을 이어가겠다”고 말했다.",https://n.news.naver.com/mnews/article/009/0005603095
2025-12-09 10:51:00,"국힘 “대통령에 북한 억류자 질문한 외신기자, 안전 경고 받아”","국민의힘은 이재명 대통령이 최근 외신 기자회견에서 북한 억류 국민에 관한 질문에 “처음 듣는 얘기”라고 답한 것을 두고 “국가 리더십의 붕괴를 보여줬다”고 질타했다.  최보윤 국민의힘 수석대변인은 9일 논평을 통해 “국가안보실장조차 억류 시점을 제대로 설명하지 못하며 당황한 모습은 이 정권의 외교·안보 라인이 사실상 기능을 상실했음을 드러낸 것”이라며 이같이 말했다.  최 수석대변인은 “더 심각한 것은 그 이후 벌어진 일이다. 질문을 던진 외신 기자는 본인의 개인 안전에 대한 ‘경고(Warnings)’를 받았고, 전직 문재인 정부 관료로부터는 ‘가짜뉴스 유포자’라는 비난까지 들었다고 한다”고 소개했다.  그러면서 “대통령에게 사실을 확인하는 질문 하나로 외신 기자가 압박받았다고 공개적으로 호소해야 하는 현실은 국제적 망신을 넘어 언론 자유를 흔드는 중대한 일”이라고 비판했다.  이는 미국의 북한 전문 매체 ‘NK뉴스’ 설립자인 채드 오캐럴이 지난 6일 사회관계망서비스(SNS)를 통해 “(이 대통령에게 질문한 뒤) 신변 안전에 대한 경고를 받았다”고 밝힌 점을 언급한 것으로 보인다.  최 수석대변인은 “현재 북한에는 김정욱·김국기·최춘길 선교사, 고현철·김원호·함진우씨 등 6명의 우리 국민이 10년 넘게 억류돼 있다”며 “통일부가 위로금을 지급하고 유엔이 수차례 석방을 촉구해 온, 국제사회에서 이미 공론화된 사안”이라고 짚었다.  이어 “국민주권정부를 자처하는 이 대통령만 이 사실을 모르고 있었다”며 “국가가 국민을 어떻게 대하느냐는 곧 국가의 품격이다. 그런데 이 대통령은 이런 기본적 사실조차 보고받지 못한 채 외교·안보 정책을 결정해 왔던 것”이라고 강조했다.  또 “통일부 장관과 국가안보실장이 북한 억류자 현황조차 보고하지 않아 대통령의 실언으로 이어졌다면 명백한 직무유기이자 엄중히 문책해야 할 사안”이라며 “억류된 우리 국민 6명의 생사 확인과 송환을 위해 모든 외교·안보 수단을 즉각 가동할 것을 강력히 촉구한다”고 덧붙였다.",https://n.news.naver.com/mnews/article/009/0005603094
2025-12-09 10:50:00,"팀네이버, 세계 최고 권위 AI 학회 ‘뉴립스’서 논문 10개 채택","AI 운용 및 안전성, 현장 활용 등 제시한 10편의 연구성과 발표 부스 운영 및 밋업 개최로 역량 강조   팀네이버가 세계 최고 권위 인공지능(AI) 학회 ‘뉴립스 2025(NeurIPS 2025)’에서 논문 10편이 채택되는 성과를 거뒀다고 9일 밝혔다.  뉴립스(신경정보처리시스템학회)는 1987년부터 시작된 세계 최고 권위 AI 및 기계학습 학회다. 올해로 39회를 맞은 뉴립스 2025는 미국 캘리포니아 샌디에이고에서 지난 2일부터 7일까지 개최됐다.  팀네이버는 이번 학회에서 ‘연구에서 현실로(From Research to Reality)’를 주제로, 리서치에서부터 자체 초거대 AI 모델인 하이퍼클로바X, 네이버의 온서비스 AI와 산업특화 버티컬 서비스로 이어지는 풀스택 전략을 세계 우수 연구 인재들과 공유했다.  올해 채택된 논문 10편은 AI 풀스택 기술을 실제 서비스와 산업현장에서 효율적이고 안전하게 적용하기 위한 실용적인 내용들로 ▲초거대 AI의 효율적 운용(Efficiency) ▲생성형 AI의 안전성 강화(Controllability&Safety) ▲물리 세계와 로보틱스로의 확장(Physical AI)의 3가지 기술 분야 혁신을 담았다.  먼저 거대언어모델(LLM)의 서비스 비용 절감과 속도 향상을 위한 핵심 기술로는 LLM의 긴 문맥 처리 시 중요한 데이터를 선별적으로 압축해 성능 저하 없이 메모리를 최대 4배 절약하고 속도를 2배 향상시키는 캐시 압축 기술, LLM이 복잡한 문제를 풀 때 생성하는 사고과정(CoT) 중 불필요한 중간 단계를 제거해도 정답률은 유지됨을 증명하며 연산 효율을 높인 연구 등이 발표됐다.  또한 AI가 생성한 결과물의 품질을 높이고 안전하게 제어하는 연구도 주목받았다. 대화형 검색 환경에서 콘텐츠 품질을 정교하게 평가할 수 있는 새로운 벤치마크를 제안한 연구, 이미지 생성 과정에서 사용자 의도를 더 정확히 반영하도록 하는 텍스트 임베딩 기술, 별도 재학습 없이 유해한 콘텐츠 생성을 억제하는 안전 제어 기술 등이 발표됐다.  AI를 실세계로 확장하는 연구도 소개됐다. 로봇이나 비디오처럼 시간의 연속성이 중요한 환경에서 장면 정보를 병목 토큰으로 압축해 학습 효율을 높이는 방법과 로봇이 변화하는 공간을 기억하고 경로를 스스로 찾을 수 있도록 돕는 모델 구조를 제시한 논문이 대표적이다.  팀네이버는 올해 뉴립스에서 글로벌 인재들과의 네트워크 구축에도 나섰다. 학회 기간 중 2만9000명이 넘는 전 세계 AI 연구자들이 참석한 가운데 통합 부스를 운영하며 주요 연구성과와 AI 기술을 선보였다. 또한 밋업 행사(Meet the NAVER AI Team)를 열고 국내외 AI 연구진 80여 명과 함께 기술 비전과 철학을 공유했다.  네이버클라우드 관계자는 “논문 채택률이 약 25%에 불과한 뉴립스에서 팀네이버의 10편의 논문이 채택됐다는 점은 팀네이버의 연구역량과 기술력이 세계적으로 인정받은 것”이라며 “앞으로도 글로벌 AI 생태계를 확장하고 AI가 실제 서비스와 산업에 구현될 수 있도록 연구역량을 끌어 올리겠다”고 말했다.",https://n.news.naver.com/mnews/article/009/0005603093
2025-12-09 10:49:00,"현대면세점, 화성특례시와 손잡고 외국인 관광객 유치 활성화 나선다","관광 상품 공동 개발 등 실질적 협업 예정   현대면세점(법인명 현대디에프)이 화성특례시와 손잡고 화성시 내 외국인 관광객 유치 등 지역 관광 산업 활성화에 나선다.  현대면세점은 화성특례시와 ‘외국인 관광객 유치 및 지역경제 활성화’를 위한 업무협약(MOU)을 체결했다고 9일 밝혔다. 지난 8일 화성시청 중앙회의실에서 진행된 협약식에는 박장서 현대디에프 대표이사, 정명근 화성특례시장 등이 참석했다.  이번 협약 체결에 따라 양측은 외국인 관광객 유치 위한 공동 홍보·마케팅, 화성시 관광 산업 활성화, 지역사회 상생 활동, 상호 지속적인 교류협력 등 실질적 협업을 진행한다.  현대면세점과 화성특례시는 내년 준공을 앞둔 서해안 황금해안길을 비롯해 올해 새롭게 문을 연 에코팜랜드, 서해마루 유스호스텔 등 화성시의 관광 인프라를 활용한 여행 상품 개발에 공동으로 나설 계획이다. 이를 통해 방한 외국인 관광객의 화성시 관광 수요 확대 및 지역경제 활성화에 기여할 것으로 기대된다.  현대면세점은 화성시 유망 브랜드의 상품이나 지역 특산물의 홍보 및 판로 지원 등 상생 협력 프로그램도 공동으로 추진해 나갈 계획이다.  박장서 현대디에프 대표이사는 “이번 협력을 계기로 현대면세점 고객들에게 화성시의 우수한 관광 자원을 활용한 다양한 콘텐츠를 제공할 수 있도록 할 것”이라며 “앞으로도 지역 사회와 함께 방한 외국인 관광객 유치를 위한 상생 협력을 지속해 나가겠다”고 말했다.",https://n.news.naver.com/mnews/article/009/0005603092
2025-12-09 10:49:00,"“중국 죽이려다 다 파산할 판”...‘텃밭’ 농가 민심 폭발, 트럼프 지원금 17조 뿌린다","중국의 미국산 대두 수입 금지에 美 농가 파산 1년만에 50% 급증 트럼프 120억달러 지원계획 발표   미국 트럼프 행정부가 관세 부과 여파로 피해를 입은 농가를 돕기 위한 120억 달러(약 17조5200억원) 규모의 지원 계획을 발표했다고 월스트리트저널(WSJ)이 8일(현지시간) 보도했다. 이는 관세전쟁의 직격탄을 맞은 농업 부문에 대한 긴급 구제 조치에 해당한다.  지원액 대부분에 해당하는 110억 달러는 ‘농가 브릿지 지원 프로그램’을 통해 미국 작물 재배 농가에 일회성으로 지급될 예정이다. 나머지 10억 달러는 이 프로그램에 포함되지 않은 농산물 품목을 위해 사용할 계획이라고 미국 행정부는 밝혔다.  이번 지원안은 관세 전쟁 여파로 막대한 피해를 입고 있는 미국 농가를 위해 마련됐다. 특히 대두(콩) 농가가 큰 타격을 입었다. 중국의 미국산 대두 수입 금지 조치 때문이다. 미국의 관세 부과에 대한 보복 조치로 중국 정부는 미국산 대두 수입을 전면 금지했다. 중국은 세계 최대 대두 수입국에 해당한다. 이는 중국의 거대한 돼지고기 산업을 지탱하고 있다.  매년 미국 전체 대두 생산의 절반이 수출되고, 이 중 약 4분의1을 중국이 수입한다. 하지만 올해 관세 전쟁 여파로 중국이 미국산 대두 수입을 전면 금지하며 미국 농가의 어려움이 가중되기 시작했다. 올해 9월까지 미국의 파산 농가는 전년 동기 대비 50% 증가했다.  미국과 중국의 관세 협상 협의 이후 대두 수입이 재개되고 있지만, 여전히 불안감은 남아 있다고 WSJ은 전했다. 현재까지 중국은 올해 예정한 전체 물량의 20%만을 구입한 상태다.  미국 농가는 트럼프 행정부 출범 전부터 어려움을 겪고 있었다. 옥수수와 대두 생산이 늘어나며 공급 과잉으로 판매 가격은 떨어진 반면, 비료와 종자 등 필수 투입 비용은 늘어나 농가 수익은 크게 줄어드는 상황이다. 1년 전에도 미국 의회는 농작물의 낮은 농작물 가격을 지탱하기 위해 100억 달러 구제 패키지를 통과시킨 바 있다.  앞서 트럼프 행정부 집권 1기 당시에도 중국과의 무역 분쟁으로 정부는 농가에 230억 달러 규모의 보상안을 지급했다. 중국은 미국으로부터의 대두 의존도를 낮추기 위한 노력을 기울여왔다. 이를 위해 브라질 등과 같은 국가와의 교역을 늘리며 공급망 다변화를 추진해왔다.",https://n.news.naver.com/mnews/article/009/0005603090
