날짜,제목,본문,링크
2025-12-12 17:32:00,사교와 예술투자 동시에 …'미술 멤버십' 시대,"미술 시장 ""슈퍼리치 잡자"" 1500만원 멤버십 등장 서울옥션 프리미엄 멤버십 특별강좌·아트투어·음악회… 다양한 네트워킹 행사 초대 전담직원과 프라이빗 관람 미술품 운송·설치·보수까지 구매 수수료 할인 혜택도    전 세계에 20만명이 넘는 회원을 둔 영국의 사교 클럽 '소호하우스'는 수백만 원의 연회비에도 90%가 넘는 회원 유지율을 기록하며 글로벌 상류층의 취향 공동체를 대표하는 공간으로 자리 잡았다. 해리 왕자 부부의 첫 데이트 장소로 알려진 뒤 대중적 관심이 더해지면서 미국 뉴욕, 영국 런던 등 주요 도시에서 예술·문화 기반의 사설 멤버십 클럽이 잇달아 등장하는 계기가 됐다.  이 같은 흐름이 한국에서도 나타나고 있다. 미술품 경매사 서울옥션이 네트워킹 기반 모델을 미술 시장에 적용해 연 1500만원짜리 프리미엄 멤버십을 선보이며 고액자산가 대상 프라이빗 커뮤니티 구축에 나섰다.  12일 업계에 따르면 서울옥션이 최근 개인 회원 연 1500만원, 법인 회원 연 2000만원을 받는 프리미엄 멤버십 '더 챔버(The Chamber)'를 출시했다. 서울옥션 측은 ""예술 중심의 하이엔드 라이프스타일에 관심이 깊은 컬렉터들의 네트워킹을 지원하기 위해 만든 서비스""라고 설명했다. 회원 수는 100명으로 제한된다.  가장 큰 혜택은 구매 수수료 우대다. 멤버십 회원은 오프라인 경매에서 낙찰가와 관계없이 구매 수수료를 일괄 11%로 적용받는다. 기존 구매 수수료는 부가가치세 포함 19.8%다. 연간 2억원 이상 낙찰받는 컬렉터라면 멤버십 가입이 유리하며, 고가 작품을 구매할수록 수수료 절감의 폭이 커진다. 서울옥션은 멤버십 회원에게 전담 스페셜리스트를 지원해 이른바 '밀착 케어'를 강화할 계획이다. 경매 프리뷰 기간에는 전담 직원이 동반하는 프라이빗 관람 서비스를 제공한다. 작품 구매 후에 운송, 설치, 액자 제작, 보수 등 컬렉션 관리에 필요한 제반 사항을 지원하는 스페셜리스트의 일대일 서비스도 마련돼 있다.    프라이빗 커뮤니티의 기능도 강화된다. 서울옥션은 회원들이 교류할 수 있는 다양한 멤버십 프로그램을 운영할 예정이다. 아티스트 토크와 아틀리에 투어, 예술·인문 특별강좌, 국내외 아트 투어, 프라이빗 음악회, 프라이빗 전시 관람 등 연 9회 네트워킹 프로그램이 내년 2월부터 본격 시작된다. 멤버십 회원에게만 제공되는 특별 제작된 판화도 혜택에 포함된다. 멤버십 출시 소식이 알려지자마자 구체적인 문의가 들어오는 것으로 전해진다. 문의층은 크게 두 갈래로 나뉜다. 하나는 미술품 수집에 본격적으로 입문하려는 30·40대 '영 리치'들이다. 변호사·의사 등 고소득 전문직 종사자들이 ""자신만의 예술적 취향을 갖추고 싶다""며 관심을 보이고 있다. 이들에게 멤버십 서비스는 문화적 교양과 네트워크 형성의 통로에 가깝다. 인문학 강좌, 프라이빗 전시 투어 등을 통해 검증된 이너 서클에 편입되려는 욕구가 강하다는 게 업계 평가다.  다른 한 축은 이미 꾸준히 미술품을 구매해온 컬렉터들이다. 특히 경매를 통해 연간 수억 원 규모로 작품을 낙찰받는 상위 컬렉터들은 구매 수수료 일괄 11% 우대를 가장 큰 장점으로 꼽는다. ""어차피 살 작품이라면 멤버십 가입이 이득""이라는 반응이 적지 않다.  서울옥션은 이번 멤버십을 단순히 작품을 중개하는 수준을 넘어, 컬렉터에게 맞춤형으로 컬렉션 구성·구매 전략·보유 관리까지 지원하는 미술품 프라이빗뱅킹(PB) 모델로 확장할 것으로 보인다. 고가 미술품이 대체투자 자산으로 주목받으면서 경매회사가 고액자산가의 미술품 자산 관리 지원에 나선 것이다. 핵심 컬렉터층을 장기적으로 확보하기 위한 전략으로 해석된다.  금융권 PB센터가 고액자산가를 대상으로 비금융 프로그램을 강화하듯, 경매사 역시 체험형 콘텐츠로 고객 접점을 넓히는 모습이다. 은행들은 고액자산가 고객들에게 골프 행사, 와인 클래스, 자녀 맞선 행사 등 다양한 사교 프로그램을 제공하고 있다. 법인 회원에게는 아트 비즈니스 컨설팅과 임직원 강연, 기업 우수고객(VIP) 대상 기획 경매 운영 등 기업 간 거래(B2B) 맞춤형 서비스도 제공한다. 법인 회원이 자사 VIP를 대상으로 실시하는 기획 행사를 운영할 수 있도록 경매 진행 등 실무 지원을 제공할 예정이다. 이번 서비스는 고액자산가 컬렉터의 '록인'(다른 상품이나 서비스로 갈아타지 않는 현상) 효과를 노린 전략이라는 분석이 나온다.  케이옥션은 별도의 유료 멤버십 서비스는 없지만 VIP를 상대로 일대일 예술 자문 서비스를 제공하고 있다. 전담 직원이 국내에서 열리는 아트페어에 고객과 동행해 조언하고, 컬렉터의 보유 작품 현황에 맞춰 포트폴리오를 제안하는 등 컨설팅 중심의 방식이다.    이 같은 흐름은 이미 해외에서도 확산되고 있다. 글로벌 경매사들은 상속과 세금 전략을 포함한 종합 컨설팅을 제공하고 있다. 크리스티는 감정, 컬렉션 관리뿐 아니라 기부·상속 계획, 세금·상속세 자문 등 종합 컨설팅을 제공한다. 소더비는 개인, 미술관, 기업 등 다양한 고객별 맞춤형 컬렉션을 개발하고 작품 감정·자문 서비스 등을 운영하고 있다. 소더비는 과거 예술품 자문사인 아트 에이전시 파트너스(AAP)를 인수해 관련 기능을 강화한 바 있다. 고객들을 위한 사교 프로그램도 해외 경매사들의 핵심 전략으로 자리 잡았다.  소더비는 런던 뉴 본드 스트리트 등 주요 살롱에서 컬렉터 전용 만찬, 시즌 개막 기념 만찬 등을 열어 주요 고객들을 한자리에 모으는 행사를 정기적으로 연다. 단순한 친목을 넘어 컬렉터 간 네트워크를 강화하고 고객 충성도를 높이는 접점으로 활용하는 것이다. 크리스티스 에듀케이션이 운영하는 '영 컬렉터스 클럽(Young Collectors Club)'은 강연, 작가·아트 어드바이저와 토크, 전시 투어 등 프로그램을 통해 젊은 컬렉터들이 사교 네트워크를 형성하도록 돕고 있다.  [정유정 기자]",https://n.news.naver.com/mnews/article/009/0005605307
2025-12-12 17:32:00,간결한 선과 면 그 위의 일상,"'미니멀리즘 대가' 도널드 저드 한남동 현대카드 스토리지 전시    미니멀리즘의 대가 도널드 저드의 작품은 간결하고 차갑다. 직사각형 상자를 벽에 반복적으로 배치한 작품이 대표적이다. 저드는 예술의 초월적 속성을 거부하고 작품을 일상의 사물과 대등하게 다루고자 한다.  이 같은 철학을 공유하는 저드의 가구가 국내 최초로 대규모 공개된다. 현대카드 스토리지의 전시 '도널드 저드: 퍼니처'는 저드가 직접 디자인한 나무, 금속, 합판 소재의 가구 38점을 포함해 드로잉과 판화까지 100여 점을 선보인다.  저드의 가구는 그의 작품처럼 단순한 형태와 재료의 물성을 드러내지만, 일상적 기능을 위해 만들어졌다. 그는 1970년대 미국 뉴욕에서 자신이 사용하기 위해 가구를 디자인하기 시작했다. 이후 텍사스 마파에서 사용할 가구가 거의 없자 침대와 책상을 직접 제작하기 시작했다. 최근 전시장을 찾은 저드의 아들이자 저드재단 아티스틱 디렉터인 플래빈 저드는 ""당시 마파에서는 괜찮은 가구를 살 수 없는 상황이었다""며 ""아버지는 집에서 쓰기 위해 가구를 만들었다""고 말했다. 이후 저드는 전문 목수들과 협업하며 디자인을 확장했고, 1984년부터 가구를 전시하고 판매하기 시작했다.  저드의 가구는 겉보기에는 단순해 보이지만 제작 방식은 고유하다. 가장자리 마감, 조립 방식, 나사를 숨기는 처리 등은 정교한 기준을 따른다. 플래빈은 ""아버지는 한 소재가 다른 소재인 척하는 것을 극도로 싫어했다. 파이버글라스가 돌인 척하는 것을 보면 미칠 것 같다고 말했다""며 ""재료가 정직하게 드러나는 것을 좋아했다""고 설명했다. 저드의 예술에도 일관되게 관통하는 철학이다.  이번 전시는 가구를 만드는 과정에서 사용된 드로잉과 설계 자료, 판화를 함께 선보이며 저드의 제작 방식을 보여준다. 드로잉은 제작 지시서의 역할을 했고, 판화는 그가 회화·입체 작업에서 다룬 형식과 색채 탐구의 연장선이었다. 플래빈은 ""목수들이 정확히 이해할 수 있도록 단순한 선과 구조로 그린 것이 대부분이었다""며 ""아버지가 요구한 것은 복잡하지 않았고 명확했다""고 덧붙였다.  미술관에 있는 저드의 미니멀리즘 작업은 작품 자체보다 주변 공간과의 관계 속에서 존재 의의가 있다. 그의 가구 역시 언뜻 보면 오브제처럼 보이지만 생활에서 쓰이기 위해 제작됐다. 플래빈은 ""이번에 전시하는 가구는 유용함과 쓰임을 위한 것이지 예술로 접근한 것이 아니다""고 강조했다. 저드의 예술적 개념이 어떻게 생활 속으로 확장됐는지 확인할 수 있는 자리다. 전시는 내년 4월 26일까지.  [정유정 기자]",https://n.news.naver.com/mnews/article/009/0005605306
2025-12-12 17:32:00,[인사] (주)IMM·IMM인베,◆(주)IMM ◇부회장 승진 △대표이사 장동우 △대표이사 지성배 ◆IMM인베스트먼트 ◇사장 승진 △대표이사 정일부 △대표이사 변재철,https://n.news.naver.com/mnews/article/009/0005605305
2025-12-12 17:32:00,"풀무원식품 대표에 천영훈…풀무원, 임원 10명 승진","풀무원은 풀무원식품 신임 대표에 천영훈 영업총괄본부장을 선임했다.  12일 풀무원은 “풀무원을 포함해 계열사 임원 10명에 대한 승진 인사를 단행했다”며 이같이 밝혔다.  풀무원식품 대표를 겸직해 온 이우봉 총괄 최고경영자(CEO)는 신설한 미래사업 부문을 이끌면서 국내와 해외 전체 사업을 총괄하게 된다.  전 계열사 인공지능(AI) 전환(AX)을 위해 신설한 AX혁신실은 김성훈 실장이 진두지휘한다.  천영훈 풀무원식품 신임 대표는 1990년부터 CJ제일제당에서 영업본부장 등을 지낸 식품 제조 및 유통 분야 전문가다. 2019년 풀무원식품에 합류해 영업본부장, 영업총괄본부장 등을 역임했다.  김성훈 풀무원 AX혁신실장은 2006년부터 한국IBM에서 클라우드사업 전문가로 활동했고, 2020년 풀무원에 입사한 후 디지털혁신실장을 지냈다.  이날 인사에서 천 대표와 이동훈 풀무원푸드앤컬처 대표, 김태석 풀무원 김태석 기술원장이 E3(사장급)로 승진했다.",https://n.news.naver.com/mnews/article/009/0005605304
2025-12-12 17:32:00,"장동우·지성배 ㈜IMM 대표, 부회장 승진","정일부·변재철 대표, 사장 승진   [본 기사는 12월 12일(17:30) 매일경제 자본시장 전문 유료매체인 ‘레이더M’에 보도 된 기사입니다]  ㈜IMM과 IMM인베스트먼트가 12일 정기 임원 인사를 실시했다고 밝혔다.  ㈜IMM은 그룹의 지주 역할을 한다. 국내에 IMM인베스트먼트와 IMM자산운용, 그리고 해외에 IMM 일본, 홍콩, 싱가포르를 계열사로 두고 있다.  이번 인사를 통해 장동우, 지성배 대표이사가 지주사인 ㈜IMM 부회장으로 승진했다. 두 사람은 그룹의 장기적인 성장 방향성과 의사결정 전반을 총괄하는 역할을 맡는다.  IMM의 공동 창업자인 두 부회장은 IMM인베스트먼트 대표직에서 내려와 ㈜IMM과 IMM인베스트먼트 이사회 공동의장을 겸임한다.  IMM인베스트먼트에서는 ㈜IMM 대표이사를 역임한 정일부 대표와 변재철 IMM인베스트먼트 대표이사가 사장으로 승진했다.  정 신임 사장은 IMM인베스트먼트 대표이사로 자리를 옮겨 벤처투자 부문을 총괄한다. 변 사장은 그로쓰에쿼티·인프라 부문을 이끌게 된다.  두 사장은 IMM인베스트먼트의 각자 대표이사로서 부문별 투자 역량을 고도화해 나갈 예정이다.  이와 함께 그로쓰에쿼티투자본부의 나성민·구재윤 전무, 벤처투자1본부의 윤원기 전무는 부사장으로 승진했다.",https://n.news.naver.com/mnews/article/009/0005605303
2025-12-12 17:31:00,신간 다이제스트,"AI를 둘러싼 공포와 허상  AI 버블이 온다  아르빈드 나라야난 외 지음, 강미경 옮김, 2만4800원  프린스턴대 정보기술정책센터 소장이자 타임지 선정 인공지능(AI) 분야 영향력 있는 100인의 사상가로 꼽힌 저자가 ""AI의 진정한 가능성과 마케팅을 감별해야 '거품'이 터질 때 같이 추락하지 않을 수 있다""고 경고한다. AI만이 할 수 있는 기술과 AI도 해낼 수 없는 것은 분명히 존재한다. 저자는 AI의 공포와 허상에 대해 파헤친다. 윌북 펴냄.    영국이 브렉시트를 택한 이유  지리는 운명이다  이언 모리스 지음, 임정관 옮김, 4만9000원  '왜 서양이 지배하는가' '가치관의 탄생' 등을 쓴 저자가 ""정치적 갈등의 패턴을 틀 지은 장기적 힘""으로 지리적 요인을 주목한다. 세계와 연결될 것인지, 영예로운 고립을 택할 것인지를 고민했던 영국을 중심으로 책은 진행된다. 세계의 가장자리였던 영국은 세계의 핵심으로 부상했고 훗날 브렉시트로 유럽과의 결별을 선언하기도 했다. 글항아리 펴냄.    인구·산업·교통으로 본 도시의 미래  한국 도시 2026  김시덕 지음, 2만5000원  도시는 소음으로 가득하다. 소음은 불필요하지만 때로 시대를 읽어내는 신호음이 될 수도 있다. 저자는 2026년의 한국 도시를 책 한 권으로 예측했는데, 인구·산업·교통이 주요 키워드다. 2025 대선과 2026 지선 사이에 펼쳐졌거나 펼쳐질 논의들과 이후 드러날 '진실'은 무엇인지도 차분하고 냉철한 어조로 살핀다. 한국을 살아가는 도시인에게 호재와 악재는 뭘까. 열린책들 펴냄.    결핵은 사회적 질병이다  모든 것이 결핵이다  존 그린 지음, 정연주 옮김, 2만원  결핵은 기원전 5000년 전 이집트 미라에서도 흔적이 발견된다. 인류 역사상 가장 많은 생명을 앗아간 이 질병은 불치병이 아니다. 그럼에도 매년 100만명 이상이 결핵으로 사망하고 있다. 결핵은 왜 아직도 인류의 치명적 위협으로 남아 있는 걸까. 이 책은 의학 서적이 아니라 결핵을 통해 '우리의 세계는 어떻게 뒤틀려 있는가'를 질문한다. 빌 게이츠의 추천을 받았다. 책과함께 펴냄.    선율에 녹아든 음악가의 삶  라흐마니노프, 피아노의 빛을 따라  피오나 매덕스 지음, 장호연 옮김, 2만3000원  ""시즌이 끝날 때마다 채찍으로 맞는 기분이다."" 라흐마니노프의 삶을 따라가는 이 책은 피아니스트로서, 작곡가로서, 아버지로서의 라흐마니노프를 조명한다. 40세 이전에 작곡한 곡들로 명성을 얻었지만 러시아에서 미국으로 망명한 뒤 1100회 넘게 무대에 올라 가족을 부양했다. 선율 속에는 한 인간의 생이 녹아 있다. 위즈덤하우스 펴냄.    시대에 속박된 日 문학의 거장  미시마 유키오, 죽음의 충동과 허무의 미학  이노우에 다카시 지음, 정선태 옮김, 2만7000원  '가면의 고백' '금각사'를 남긴 문학의 총아 미시마 유키오를 조명한다. 그는 노벨문학상 후보로 거론된 일본의 거장 문학인이었지만, 할복이라는 극단적 방식으로 생을 마감한 논쟁적인 인물이었다. 미시마 유키오의 천재성과 광기, 자기 파괴적 종말의 이야기를 이 책은 두루 펼친다. 교양인 펴냄.",https://n.news.naver.com/mnews/article/009/0005605302
2025-12-12 17:31:00,초고령화는 위기이자 기회 … 일본이 답이다,"고령화, 국가와 기업 역할커져 재고용 늘려 노후빈곤 줄이고 주민 커뮤니티로 외로움 해소 시니어 산업 급성장은 기회 증권사 일본 담당 애널리스트 20년 앞선 해결책 분석해 제시    고령화 문제에서 일본은 한국의 오래된 미래다. 한국은 올해 65세 이상 인구 비율이 20%를 돌파한 '초고령사회'에 진입했다. 일본은 2005년 일찌감치 맞았다. 일본이 한국보다 20년 앞서 늙어간 셈이다. 단순한 생로병사의 문제를 넘어 산업구조와 고용시장의 변화 등 거대한 충격을 야기하는 고령화에 일본은 어떻게 대처해왔을까.  나미선 대신증권 장기전략리서치부 일본 담당 애널리스트가 쓴 저서 '노후 불안, 일본에서 답을 찾다'는 노년에 겪어야 하는 불안 요소인 건강, 경제력, 외로움을 지난 20년간 일본 사회가 어떻게 해결해왔는지 분석했다. 중앙정부의 움직임과 지방자치단체의 노력을 씨줄과 날줄로 삼아 거시적인 정책 흐름을 엮어내고 노후 불안의 주요 해결사로 지역사회와 기업을 호명한다.  저자에 따르면 노인의 건강, 외로움, 경제력은 악순환 고리에 노출되기 쉬운 구조다. 건강이 악화되면 사회적으로 고립되고 병원비로 자산을 갉아먹히게 된다. 외로움이 깊으면 건강에 문제가 생길 가능성이 높아 경제력이 약화된다. 일본 전후 세대인 단카이 세대(1947~1949년 출생)가 2007년을 전후해 대규모로 은퇴한 이후 이 같은 노후 문제의 악순환 구조가 표면화되기 시작했다.  일본 정부와 지자체는 초고령사회 진입 후 20년간 고령화 문제를 개인이 아닌 국가와 공동체의 영역으로 끌어들였다. 2000년 도입된 개호보험(한국의 장기요양보험)이 대표적이다.    노인 돌봄과 간병을 국가가 책임지겠다는 선언이었다. 수급자가 줄을 잇자 일본 정부는 개호보험제의 대규모 개편에 나선다. 전국의 시정촌(한국의 시군구) 단위마다 지역포괄지원센터를 설치해 정보 제공, 맞춤형 간병 예방 계획, 의료기관 연결 등을 통합적으로 관리했다. 노인이 일상생활을 최대한 영위하도록 도와 간병·돌봄이 필요해지는 시기를 최대한 늦추기 위해서였다. 저자는 통합적 관리 여부가 한일 간 돌봄 정책의 차이점이라고 언급한다. ""한국은 (중략) 의료, 복지, 요양, 간호가 각각 다른 체계에서 운영되면서 기관 간 정보 공유나 공동 사례 관리가 원활하지 않다.""  노년의 외로움과 경제력 악화에는 정부와 지자체, 기업이 유기적으로 움직였다. 일본 정부는 2013년 고연령자고용안정법을 통해 정년을 맞은 고령 근로자를 65세까지 재고용하도록 의무화했다. 2021년엔 이를 70세까지 늘릴 '노력 의무'를 기업에 부여했다. 기업은 정년을 70세로 연장하거나 정년 제도 폐지 등으로 호응했다. 노년에도 경제활동을 하며 자기 효능감과 사회적 연결감을 갖는 것이 외로움을 해소하고 노후 빈곤을 막는 데 기여하기 때문이다. 지자체에서는 주민 주도의 커뮤니티 거점을 꾸린다. 살롱에 모여 이야기를 나누고 취미 활동을 함께하기도 한다. 기업들은 사물인터넷(IoT), 인공지능(AI) 기술을 활용해 고독사 예방과 응급 사태 대처 등 노인의 안녕을 세세히 살핀다.  책은 초고령사회 이후 현재 100조엔(약 1000조원) 규모로 성장한 일본의 시니어 산업도 조명한다. 여행·레저 등 활력과 자기만족에 투자하는 60대 '액티브 시니어'와 안전·돌봄에 주로 비용을 지출하는 70·80대 노인을 구분하면서 기업들이 노년의 생애주기에 맞는 비즈니스를 다층적으로 형성해왔음을 알린다. 노인은 돌봄만 필요로 하는 수동적 존재가 아니라 적극적인 소비의 주체라는 점을 상기하면서 저자는 말한다. ""일본이 보여준 궤적은 연령대별 전환점이 시장의 흐름을 바꿨다는 사실이다. 한국 역시 비슷한 길을 따라가고 있으며 시차만 있을 뿐 본질적인 흐름은 동일하다.""  [최현재 기자]",https://n.news.naver.com/mnews/article/009/0005605301
2025-12-12 17:31:00,전세사기·경매…청년들의 '주거불안' 잔혹동화,"여러 차례 부동산 급등기를 거친 한국에서 주거 불안은 누구도 피할 수 없는 문제가 됐다. 오르지 않는 월급과 달리 집값은 나날이 오르고, 불투명한 시장구조 탓에 전세사기까지 기승을 부리면서 사람들의 고통은 더욱 커졌다.  김의경, 장강명, 정명섭, 정진영, 최유안 5명의 작가가 모여 선보인 '어차피 우리 집도 아니잖아'는 이 같은 현실과 현대인들의 주거 불안을 사실적으로 풀어낸 소설집이다.  김의경의 '애완동물 사육 불가'는 반지하에 사는 주인공과 집주인 간의 갈등을 그린다. 주인공은 강아지를 키우며 캣맘 생활까지 병행하다가 집주인의 반대로 이사를 가야 하는 상황에 놓인다. 그 과정에서 애완동물이 있다는 이유로 집을 구하는 데 어려움을 겪고, 결국 오랜 기간 이어온 캣맘 생활을 그만두기로 한 끝에 집을 구한다. 주인공은 ""반려동물을 키우려면 집을 사야 한다""며 자포자기한 심정을 드러낸다.  이어지는 장강명의 '마빈 히메이어 씨의 이상한 기계'는 전세사기 문제를 다룬다. 전세사기를 당한 주인공은 집주인과 부동산중개업소에 연락을 취했으나 이들은 이미 연락이 닿지 않는 상태였다. 별다른 해결 방법이 없자 이혼 혹은 심지어 자살을 하는 사람도 나오게 된다. 이에 정치인들도 관심을 가지게 되고, 전세사기피해지원특별법 법안이 무더기로 쏟아진다. 하지만 피해자들의 환호성도 잠시. 법안 심사 과정에서 황당한 조항만 들어가며 기대는 더 큰 실망으로 바뀐다.  장진영의 '밀어내기'는 신혼부부가 전세금을 돌려받지 못해 경매에까지 내몰리는 각박한 현실을 그려냈다. 결혼을 앞둔 주인공은 자가 소유를 원했지만, 지금 사는 집 수준을 그대로 유지하기 원하는 아내의 뜻에 따라 시행착오 끝에 신축 복층 빌라에 전세로 입주했다. 만족스러운 삶을 살아가던 것도 잠시, 집주인이 갑자기 집을 팔고 새 주인은 전세금을 줄 수 없다며 버티면서 곤란한 상황에 처하게 된다. 결국 아내가 경매를 통해 싼값에 아파트를 낙찰받지만 쓰레기 더미뿐만 아니라 그 안에 무단으로 거주하는 할머니 때문에 더욱 큰 위기에 빠지게 된다.  정명섭의 '평수의 그림자'는 주인공이 은행에서 부동산대출을 해주다가 고객의 그림자가 그의 집으로 보이는 망상 장애에 빠진 이야기를 다루고, 최유안의 '베이트 볼'에서는 시간강사로 취직한 뒤 번듯한 집을 꿈꾸지만 결국 타협하고 월셋집을 구하게 되는 사회 초년생의 이야기를 엿볼 수 있다.  이 소설집은 해결책을 제시하기보다는 실제 청년들의 고민과 고통을 담아내는 데 집중한다. 장강명 작가는 서문에서 ""소설가가 써낼 수 있는 건 정책 대안은 아니다. 시장 진단이나 분석조차 아니다""며 ""전모를 보지 못하고 해답도 모르더라도, 정직하게 쓰는 수밖에 없는 것 같다""고 밝혔다.  [김대은 기자]",https://n.news.naver.com/mnews/article/009/0005605300
