날짜,제목,본문,링크
2025-12-13 21:59:00,“적자나도 1천원 약속 지켰다”…고려대 명물 ‘영철버거’ 이영철씨 별세,"무일푼으로 시작해 1000원짜리 ‘영철버거’를 고려대 명물로 일궈낸 이영철씨가 별세했다. 향년 58세.  13일 대학가에 따르면 이씨는 이날 세상을 떠났다. 암 투병 중이었던 것으로 알려졌다.  초등학교도 제대로 나오지 못한 고인은 어려운 가정형편 탓에 10살부터 중국집, 군복공장, 막노동판 등을 전전했다.  2000년 무렵 신용불량자라는 딱지를 안고 수중에 단돈 2만2000원만 남은 절박한 상황에서 고인은 고려대 앞 손수레에서 1000원짜리 버거를 만들어 팔기 시작했다.  미국식 핫도그빵 사이에 고기볶음, 양배추, 소스 등을 넣은 투박한 방식의 ‘스트리트 버거’는 값싼 가격에 학생들의 허기를 채워주며 ‘명물’로 떠올랐다.  2005년쯤에는 40개의 가맹점을 거느려 ‘성공 신화’로 불리기도 했다.  고인은 버거에 들어가는 돼지고기를 등심으로 바꿨을 때도 가격을 올리지 않았다. 재료 가격이 치솟아 버거 하나를 팔면 200원의 적자가 났을 때도 ‘1000원’의 약속을 지켰다. 2004년부터는 학생들에게 보답하고자 고려대에 매년 2000만원을 기부해 형편이 어려운 학생들에게 ‘영철 장학금’을 지급했다. 정기 고연전(연고전) 때마다 영철버거 수천개를 무료로 뿌리기도 했다.  하지만 2015년 영철버거는 경영난으로 폐업했다. 그러자 고대생들은 영철버거 살리기에 나섰다. 당시 ‘영철버거 크라우드펀딩’에 총 2579명의 고대생이 참가해 6811만5000원을 모금했다. 그렇게 영철버거는 재개업을 해 다시 ‘고대 명물’로 자리 잡았다.  빈소는 고려대 안암병원 장례식장 102호에 마련됐다. 발인은 15일 오전 6시 30분, 장지는 서울시립승화원이다.",https://n.news.naver.com/mnews/article/009/0005605595
2025-12-13 21:38:00,정읍서 시외버스 가드레일 뚫고 5m 아래로 추락…4명 부상,전북 정읍에서 시외버스가 가드레일을 뚫고 추락하는 사고가 발생했다.  13일 전북소방본부에 따르면 이날 오후 3시50분께 전북 정읍시 영원면의 도로를 달리던 시외버스가 가드레일을 뚫고 5m 아래로 추락했다.  이 사고로 60대 승객 1명이 다리 등을 다치고 3명이 경상을 입어 병원에서 치료를 받고 있다.  경찰 소방당국은 부안을 출발해 정읍으로 달리던 시외버스가 빗길에 미끄러진 것으로 추정하고 정확한 사고원인을 조사하고 있다.,https://n.news.naver.com/mnews/article/009/0005605594
2025-12-13 21:26:00,"넥슨 ‘마비노기 영웅전’, 신규 성장 시스템에 신규 캐릭터 ‘칼리아’까지","13일 라이브 방송 열고 겨울 업데이트 공개…테스트 서버도 오픈   넥슨은 ‘마비노기 영웅전’의 라이브 방송 ‘2025 윈터 라이브 in 로체스트’를 13일 진행하고 대규모 겨울 업데이트 계획과 개발 방향성을 공개했다고 밝혔다.  이날 공식 유튜브 채널에서 생중계된 라이브 방송에서는 한용섭 디렉터가 출연해 신규 성장 시스템, 신규 콘텐츠, 신규 영웅 ‘칼리아’ 등 겨울 업데이트의 핵심 콘텐츠를 소개했다. 또 사전 질문 답변과 라이브 질의응답을 통해 이용자들의 궁금증을 해소하고 향후 개발 방향도 설명했다.  ‘마비노기 영웅전’ 한용섭 디렉터는 “처음으로 라이브 방송을 진행하게 됐는데 관심에 감사하다. 더 자주 소통하도록 하겠다”라며 “오늘 시청해주셔서 정말 감사하고 남은 연말도 행복하게 보내시길 바란다”라고 밝혔다.  넥슨에 따르면 12월에는 ‘플레이 경험 쾌적화’와 ‘성장의 도약’을 키워드로 내실을 다지는 대규모 업데이트가 진행된다.  먼저 신규·복귀 이용자뿐 아니라 신규 캐릭터 육성을 고민하던 이용자들도 부담 없이 성장에 착수할 수 있도록 설계된 새로운 성장 시스템 ‘영웅의 길’을 추가한다. 기존의 반복적 이동과 로딩, 장비 교체와 스킬 세팅 등 불필요한 요소를 최소화해 전투 흐름만 이어지는 구조로 정비하며 성장 단계에 맞춰 장비 능력치 보정과 스킬 자동 습득이 이루어져 이용자는 전투에만 집중할 수 있다. 각 시즌의 핵심 보스 전투를 연속적으로 경험할 수 있으며 전투 중 등장하는 실전형 튜토리얼을 통해 보스 공략법과 전투 매커니즘을 자연스럽게 익힐 수 있다.  115레벨 달성 이후에는 상위 레이드로 자연스럽게 진입할 수 있도록 돕는 실전 가이드 시스템 ‘영웅의 도약’도 만나볼 수 있다. 레이드 입장에 바로 도전할 수 있도록 오르나 장비 풀세트를 즉시 지급하고 ‘와드네’ 장비 제작에 필요한 핵심 재료의 30%를 추가로 지원한다. 아이템 체계와 성장 방식, 전투 시스템을 자연스럽게 숙지할 수 있도록 구성된 ‘성장’, ‘출정’, ‘마을’, ‘챌린지’ 미션을 즐기다 보면 손쉽게 오르나 장비 +15 강화와 풀 연마 상태를 달성할 수 있다. ‘영웅의 도약’은 3개월간 지정한 1개의 캐릭터를 집중적으로 성장시킬 수 있는 기간 한정 콘텐츠로 추후 신규 캐릭터 업데이트 시점에 맞춰 참여 가능한 캐릭터 슬롯이 추가로 제공될 예정이다.  신규 콘텐츠 ‘그림자의 성채’도 선보인다. 기존 레이드만으로는 충족되지 않았던 성장 동기를 보완하기 위해 개인의 DPS 기록을 통해 성장을 직접 확인할 수 있는 전투 무대로 설계된 것이 특징이다. 전투 시작과 동시에 SP와 캐릭터별 고유 자원이 모두 충전된 상태에서 짧은 시간 내 주력 스킬을 쏟아붓는 다이내믹한 전투를 펼치게 되며 캐릭터 간 격차를 최소화하기 위해 순수 성능을 기준으로 조정하는 ‘주간 밸런스 보정 시스템’을 적용한다. 기록한 DPS 등급에 따라 보상이 차등 지급된다.  이와 함께 새로운 성장 보조 시스템 ‘연마 대성공’을 공개했다. 기존 연마 과정에 특별 보너스 효과를 부여해 장비 성장 과정에서 소소한 행운을 더했으며 특정 시점에 대성공이 발생할 경우 추가 성능 향상이 적용되어 성장의 만족도를 높였다.  이외에도 전투 화면을 가리는 요소를 줄이고 핵심 정보를 명확히 전달하는 형태로 HUD를 개선한다. 데이터 처리 구조 개선과 불필요한 내부 로그 정리 등 근본적인 안정화 작업이 병행해 전투 흐름을 방해하는 주요 불편 요소를 단계적으로 줄여 쾌적한 플레이 환경을 확보해 나갈 예정이다.  내년 1월 업데이트되는 27번째 영웅 ‘칼리아’도 깜짝 소개됐다. ‘칼리아’는 냉소적인 겉모습과 달리 내면에는 깊은 고뇌와 강한 의지를 지닌 캐릭터로 주무기인 ‘하프 클레이모어’로 유려한 연속 공격을 선보이며 적의 공격을 흘려낸 뒤 콤보를 끊지 않고 물 흐르듯 이어가는 독특한 전투 방식을 갖췄다. 끊임없는 연계 공격 사이에 액티브 스킬을 섞으면 강화된 스킬이 발동해 쉴 새 없이 몰아치는 박진감 넘치는 액션을 경험할 수 있다.  전투 리듬과 콤보 단계 파악을 요하는 만큼 일정 수준의 조작 난이도가 존재하지만 그만큼 뚜렷한 손맛을 제공하도록 설계됐다. 체력, 스태미나, SP만을 사용하는 직관적인 자원 시스템이 도입돼 불필요한 게이지 관리 부담을 줄이고 오롯이 전투와 연계에 집중할 수 있다. ‘칼리아’는 1월 8일 정식 서버 업데이트에 앞서 12월 31일 테스트 서버를 통해 먼저 만나볼 수 있다.  여기에 2026년부터는 업데이트 사이클을 연 3회 레이드 업데이트와 연 1회 새로운 전투 경험을 제공하는 구조로 개편한다. 레이드 콘텐츠의 완성도는 한층 강화하는 한편 레이드가 없는 시기에는 기존 방식과 다른 실험적이고 도전적인 전투 콘텐츠를 선보이며 ‘마비노기 영웅전’ 특유의 액션 흐름과 캐릭터 운용 방식은 유지하면서도 전투 규칙과 환경의 변화를 통해 색다른 손맛을 전할 계획이다.  이외에도 내년 업데이트 로드맵도 2월 중 개발톡을 통해 공개할 예정이며 12월 18일 업데이트에 맞춰 출석 이벤트를 마련해 첫날 출석만 해도 신규 전설 아바타를 증정하고 내년 1월 8일부터는 신규 캐릭터 ‘칼리아’ 추가와 함께 16주년을 맞아 캐릭터 성별에 따라 변화하는 오르골 오브젝트 선물이 담긴 축하 케이크 이벤트도 실시한다.  한편 넥슨은 이날 라이브 방송 종료와 함께 테스트 서버를 오픈하고 12월 업데이트 콘텐츠인 ‘영웅의 길’과 ‘그림자의 성채’, 연마 대성공 시스템, HUD 개편 등을 미리 선보였다. 영웅의 도약의 경우 18일 정식 서비스에서 만나볼 수 있을 예정이다. 신규 캐릭터 ‘칼리아’는 12월 31일부터 테스트 서버에 추가된다.",https://n.news.naver.com/mnews/article/009/0005605593
2025-12-13 20:50:00,"로또 1등 14명, 당첨금 각 19억2천만원씩…‘5, 12, 21, 33, 37, 40’","로또복권 운영사 동행복권은 제1202회 로또복권 추첨에서 ‘5, 12, 21, 33, 37, 40’이 1등 당첨번호로 뽑혔다고 13일 밝혔다. 2등 보너스 번호는 ‘7’이다.  당첨번호 6개를 모두 맞힌 1등 당첨자는 14명으로 19억2041만원씩 받는다.  당첨번호 5개와 보너스 번호가 일치한 2등은 109명으로 각 4111만원씩을 받는다. 당첨번호 5개를 맞힌 3등은 3764명으로 119만원씩을 수령한다.  당첨번호 4개를 맞힌 4등(고정 당첨금 5만원)은 18만212명, 당첨번호 3개가 일치한 5등(고정 당첨금 5000원)은 272만3770명이다.",https://n.news.naver.com/mnews/article/009/0005605592
2025-12-13 20:47:00,규모 7.0 이상 지진 가능성 나왔다…4개 대륙판 둘러싸인 이 나라,"튀르키예 최대 도시 이스탄불 앞의 마르마라해에서 규모 7.0 이상의 지진이 발생할 수 있다는 진단이 나왔다.  13일(현지시간) 과학 학술지 사이언스(Science)에 따르면 독일지구과학연구센터(GFZ) 소속 파트리시아 마르티네스가르손 교수가 이끄는 연구팀은 최근 등재된 보고서에서 이같이 밝혔다.  연구팀은 지난 15년간 튀르키예 북서부 마르마라해에서 발생한 규모 5.0 이상의 지진을 다각도로 분석했다.  그 결과 유라시아판과 아나톨리아판 등 2개 대륙판이 만나는 북아나톨리아단층대(NAFZ)에서 지진 발생 지점이 이스탄불 시가지 방면인 동쪽으로 점차 이동하며 지진 규모도 커지는 것이 확인됐다.  이같이 진앙이 동쪽으로 옮겨가는 현상은 지난 4월 23일 마르마라해에서 발생한 규모 6.2 지진으로 뚜렷하게 확인됐다는 설명이다.  연구팀은 “최근 지진 활동은 이스탄불 남쪽 프렌스군도 부근에서 집중적으로 발생하고 있으며, 이 구간에서 규모 7.0 정도의 지진이 발생할 가능성이 있다”고 내다봤다.  지구를 둘러싼 지각 중 아나톨리아판 위에 위치한 튀르키예는 유라시아판, 아라비아판, 에게해판, 아프리카판 등 4개 대륙판에 둘러싸였고 북아나톨리아 단층, 동아나톨리아 단층 주요 단층선을 따라 지진이 빈발한다.",https://n.news.naver.com/mnews/article/009/0005605591
2025-12-13 20:16:00,올해 폐업신고 건설사 ‘사상 최다’…‘돈맥경화’에 하루 1.6개꼴로 ‘털썩’,"올해 폐업신고 종합건설사 610건 종천 최고 전년比 34건↑ “현금 유동성 악화 심각”   “올해 같은 보릿고개는 처음입니다”  올해 문을 닫은 종합건설사 수가 관련 조사가 시작된 이래 역대 최다치를 기록한 것으로 나타났다.  일반적으로 전문건설사보다 개폐업이 까다롭다는 점을 감안할 때 종합건설사의 재정 악화가 더욱 심각한 상황인 것으로 풀이된다.  13일 건설산업지식정보시스템에 따르면 올해 들어 이달 10일까지 폐업을 신고한 종합건설사 수는 총 610건으로, 이는 2005년 수치를 기록한 이후 가장 많은 규모다. 매일 1.6건 이상 폐업이 발생한 셈이다. 종전 최고 기록은 지난해 기록한 576건이다.  2013년부터 2022년까지 종합건설사 폐업 수는 300여건 전후를 기록했다. 2023년에는 528건으로 전년(316건) 대비 67.1% 증가했다. 지역도 서울, 경기, 부산, 제주 등 다양했으며, 폐업 사유는 ‘사업 포기’가 대다수를 차지했다.  폐업 증가의 가장 큰 이유는 현금 유동성 악화 때문으로 분석된다. 한 건설업계 관계자는 “대형 건설사들도 현금 유동성이 그렇게 좋지 않은 상황에서 중·소형 건설사들이 느끼는 자금 압박은 더욱 심할 것”이라며 “사업 추진을 위한 돈을 융통하는 자체가 쉽지 않다”고 말했다.  종합건설사 협력업체인 전문건설업의 상황도 좋지 않다. 올해 1월 1일부터 이달 10일까지 폐업을 신고한 전문건설업 수는 2675건이다. 3년 전인 2022년 2268건 대비 17.9% 늘었다. 전문건설업도 2023년 이후 그 수가 크게 늘었다. 같은 기간 2023년과 지난해 모두 2700건을 넘겼다.",https://n.news.naver.com/mnews/article/009/0005605589
2025-12-13 20:14:00,"넥슨 ‘메이플스토리’, 겨울 업데이트 대공개…키네시스 리마스터부터 신규 보스 ‘유피테르’까지","13일 겨울 쇼케이스 ‘크라운’ 개최…내년 2월까지 업데이트 로드맵 발표 23주년 맞아 롯데와 협업…“잠실역 일대 ‘메이플스토리’로 가득 채울 것”   넥슨은 13일 인기 온라인게임 ‘메이플스토리’의 겨울 쇼케이스 ‘크라운(CROWN)’을 개최하고 대규모 겨울 업데이트 계획을 발표했다고 밝혔다.  이날 쇼케이스를 통해 오는 18일 키네시스 리마스터와 시즌 보스 ‘카이’의 등장을 시작으로 내년 1월 15일 신규 공용 코어 ‘솔 헤카테’와 신규 보스 ‘찬란한 흉성’ 추가, 2월 12일 신규 보스 ‘유피테르’와 신규 지역 ‘기어드락’, 데스티니 무기 2차 성장, 신규 길드 콘텐츠 ‘길드 캐슬’까지 대대적인 신규 콘텐츠 추가와 콘텐츠 개편을 공개했다. 특히 내년 3월에는 서비스 23주년을 맞아 롯데와 협업해 잠실역 인근을 ‘메이플스토리’ 테마로 꾸민다는 계획이다.  이날 넥슨 ‘메이플스토리’ 김창섭 디렉터는 “지금 ‘메이플스토리’에 필요한 것들을 제공해 드리면서 더 높은 곳으로 올라갈 수 있는 수단도 함께 준비했다”라며 “많은 새롭게, 오랜만에 오시는 용사님들에게 의미있을 만한 것도 최대만 많이 가져와봤다”라고 설명했다.  이어 “내년에는 평소보다 한 달 먼저 3월부터 23주년 업데이트를 진행할 예정으로 오프라인 이벤트도 역대급으로 준비하고 있다. 메이플스토리와 롯데와의 콜라보로 롯데월드몰과 롯데월드타워, 석촌 호수, 잠실역 일대를 ‘메이플스토리’로 가득 채워 넣을 것”이라며 “크라운 업데이트를 시작으로 23주년 여름 업데이트까지 쭉 이어가며 올해가 그랬듯 내년에도 또 한 번 더 즐거운 서프라이즈를 용사님들에게 드릴 수 있는 한해로 만들겠다”라고 강조했다.  서울 메가박스 코엑스점에서 진행한 이번 쇼케이스에서는 먼저 6차 전직 HEXA 스킬의 두 번째 공용 코어 ‘솔 헤카테’를 공개했다. ‘솔 헤카테’는 모든 직업이 사용 가능한 공용 스킬로 레벨에 따라 외형이 변경되고 신규 스킬을 획득할 수 있는 성장형 소환수 스킬이다. 첫 번째 공용 코어 ‘솔 야누스’는 사냥을 지원하는 반면 ‘솔 헤카테’는 보스 전투를 지원하는 스킬로 역할을 맡을 예정이다.  이어서 신규 보스 ‘찬란한 흉성’을 선보였다. 280레벨 이상 캐릭터로 도전 가능한 보스인 ‘찬란한 흉성’은 현실과 현혹 상태를 오가며 상황에 맞는 선택을 이어가야 하는 전투 구조가 특징이다. 처치 성공 시 반지 부위 신규 광휘의 보스 장신구 ‘황홀한 악몽’을 획득할 수 있으며 격파 이벤트 기간 내 처치 성공 시 각종 기념 치장 아이템이 주어진다.  다음으로 신규 장비 아스트라 보조무기 추가를 발표했다. 제네시스 무기 퀘스트 완료 후 그란디스 지역의 보스를 퇴치하면 얻을 수 있는 ‘격전의 흔적’과 고난이도 보스 몬스터 퇴치나 그란디스 일일 퀘스트를 통해 획득할 수 있는 ‘에리온의 조각’을 모아 성장시킬 수 있는 보조무기다. 3단계에 걸친 성장 단계에 따라 강화 가능한 스타포스 수치를 확대할 수 있으며 기존 보유하고 있는 보조무기의 잠재능력을 전승할 수 있다.  ‘찬란한 흉성’과 함께 선보이는 또 하나의 신규 보스 ‘유피테르’에 관한 정보도 공개했다. 295레벨 이상 캐릭터로 도전 가능한 최상위 보스로 유피테르와 연성체가 분리와 결합 상태를 오가며 두 존재 간의 균형을 유지하는 전략적 플레이가 핵심 재미 요소다. 처치 성공 시 얼굴장식 부위 신규 광휘의 보스 장신구 ‘오만의 원죄’를 획득할 수 있으며 격파 이벤트 기간 내 처치 성공 시 각종 기념 치장 아이템이 주어진다.  ‘유피테르’ 공개에 맞춰 295레벨 신규 지역 ‘기어드락’을 함께 추가한다. 과거 신의 손으로 불렸던 고대신 ‘고브’가 병기를 개발하며 거대 용광로 ‘크로노스’를 숨겨둔 장소로 스토리 퀘스트 완료 시 ‘그랜드 어센틱심볼 : 기어드락’을 제공한다.  게임 성장 경험에 관한 다양한 개편사항도 발표했다. 먼저 에픽 던전 경험치 보상을 전 레벨 구간에서 샹향하고 몬스터파크 익스트림 콘텐츠는 275레벨 이상 참여 시 획득할 수 있는 경험치를 상승시키는 등 275레벨 이상 구간 레벨업 가속을 위해 일부 콘텐츠의 경험치 보상을 개편한다. 또 285레벨 달성 시 주어지는 ‘찬란한 영웅의 증거’로 원하는 링크 스킬을 3레벨로 확장할 수 있도록 지원하고 ‘어센틱 심볼’ 11레벨 달성 시 지역별 정해진 보스를 상대로 데미지 20% 증가 등의 추가 혜택을 제공한다.  이와 함께 지난해 겨울 출시한 데스티니 무기의 2차 성장을 오픈한다. ‘최초의 대적자’, ‘림보’, ‘발드릭스’를 처치해 ‘대적자의 결의’를 모아 2차 성장을 진행할 수 있으며 2차 성장 시 스타포스 최대 강화 가능 수치가 25성까지 확장되고 전용 무기 스킬이 강화된다.  이어서 ‘챌린저스 월드 시즌3’와 시즌 보스 ‘시간의 방랑자, 카이’에 대해서도 소개했다. 기존 5레벨 단위에서 1레벨 단위로 레벨 미션이 변경되며 신규 이벤트 ‘챌린저스 파트너’ 및 ‘챌린저스 EXP 듀오’ 등으로 구성한 ‘챌린저스 월드 시즌3’에서는 챌린저스 월드에서만 제공하는 시즌 보스 ‘카이’에 도전할 수 있다. 노말 난이도는 270레벨 이상, 하드 난이도는 280레벨 이상 캐릭터로 도전 가능한 ‘카이’는 시간을 활용하는 특수 스킬 사용의 재미를 선사한다. 처치 성공 시 ‘황금 메소주머니’, ‘카이의 칠흑의 보스 장신구 상자’ 등의 보상을 획득할 수 있으며 격파 이벤트 기간 내 처치 성공 시 각종 기념 치장 아이템이 주어진다.  뿐만 아니라 ‘하이퍼 버닝 MAX’, ‘버닝 BEYOND’ 등의 성장 이벤트와 한층 더 새로워진 ‘아이템 버닝 PLUS’ 이벤트를 실시한다. 또 미지의 존재 ‘엘라노스’를 성장시켜 단계에 따라 외형, 엘라노스 스킬 등이 성장하는 신규 이벤트와 280레벨 이상 캐릭터 대상의 ‘모멘텀 패스’, ‘메카베리 농장’ 등의 신규 콘텐츠를 포함하는 겨울 이벤트 ‘환영이 내리는 밤’과 신규 캐릭터 대상의 겨울나기 육성 지원 이벤트를 진행한다.  ‘키네시스’ 직업 리마스터 계획 발표도 이어졌다. 메인 콘셉트를 유지하면서도 스킬 이펙트와 캐릭터의 외형을 더욱 세련된 모습으로 개편할 예정으로 PP(싸이킥 포인트)를 삭제해 특정 주기에서 더욱 짧은 간격으로 얼티메이트 스킬을 난사하는 등 새로운 전투 경험도 제공한다. 이를 기념해 ‘키네시스’ 관련 치장 아이템을 제공하는 이벤트, 기존 ‘키네시스’ 캐릭터의 외형 이동과 추가 재화 소모 없는 어빌리티 재설정을 지원한다. 키네시스를 포함해 닉네임을 이동할 수 있는 ‘닉네임 익스프레스’도 함께 진행한다.  ‘크라운(CROWN)’ 개선사항도 공개했다. 보이스 챗 도입, 버프 매니저 시스템 추가, 버프 아이템 개편, 소울 컬렉션 개편, 월드 메소 통합, 5차 전직 V매트릭스 개편, 성별 전환권 추가, 하이퍼 스탯 프리셋 변경 비용 삭제, 6차 전직 퀘스트 난이도 완화, 유니온 등급 자동 성장 등 게임 이용 경험을 개선하는 다채로운 업데이트를 적용한다.  길드 시스템의 기존 기능 개편을 포함한 신규 길드 콘텐츠 ‘길드 캐슬’도 선보일 예정이다. 길드원이 함께 모여 교류할 수 있는 6개 맵으로 선보이며 일반 길드 스킬 레벨 자동 상승, 길드의 축복 패시브 스킬 전환, 길드 게시판 개편 등의 개선사항도 적용한다.  이외에도 ‘메이플스토리’ 직업 일러스트에 기반해 메이플 홈 등 게임과 연계되는 실물 굿즈 카드 ‘메이플스토리 컬렉션 카드’를 출시하고 AI를 활용해 스토리 퀘스트에서 도트 캐릭터를 일러스트로 변형한 모습을 감상할 수 있는 ‘AI 커스텀 일러스트’ 기능을 오픈 베타로 운영한다.  12월 21일 하루 동안에는 5시간 무료 플레이 등의 대규모 혜택을 제공하는 PC방 이벤트를 실시한다. 게토 PC방 혜택 매장에서 ‘메이플스토리’를 플레이하면 5시간 무료 플레이 혜택을 이용할 수 있으며 당일 접속 시간에 따라 최대 1만 넥슨캐시, ‘솔 에르다 조각’ 400개, ‘경험치 4배 쿠폰 (30분)’ 10개 등을 획득할 수 있다.  또 서울 잠실 롯데월드 어드벤처 내 매직 아일랜드에 조성 중인 ‘메이플 아일랜드’에 대한 내용도 공개했으며 내년 초부터 더 자세한 내용을 발표할 예정이다. 이외에도 이날 오후 8시부터 테스트 월드도 오픈했다.  한편 이번 쇼케이스는 ‘크라운(CROWN)’이라는 타이틀에 맞춰 ‘메이플스토리’를 향한 깊은 애정을 보낸 이용자를 우선 초청하고 연말 시상식 콘셉트의 개성 있는 구성으로 개최했다. 유니온 레벨 1만 이상 달성, 295레벨 이상 캐릭터 보유, 유니온 챔피언 S등급 이상 캐릭터 3개 이상 등록 등 정해진 조건의 다양한 기록을 보유한 이용자가 한데 모인 가운데 공통점을 보유한 이용자끼리 모여 앉은 3개의 관 사이를 김창섭 디렉터와 성승헌 MC가 이동하며 각 관에 적합한 겨울 대규모 업데이트를 발표했다. 현장에서 깜짝 선물이 공개되고 축제의 분위기가 무르익었고 발표 막바지에는 2025년을 추억하고 이용자를 향한 감사의 마음을 담은 쿠키 영상도 상영됐다.",https://n.news.naver.com/mnews/article/009/0005605588
2025-12-13 19:51:00,박나래 하차 직격탄 맞았나…올해 최저 시청률 기록한 ‘나혼산’,"개그우먼 출신 방송인 박나래가 하차한 MBC 예능 ‘나 혼자 산다’가 올해 최저 시청률을 기록했다.  13일 시청률 조사회사 닐슨코리아에 따르면 지난 12일 방송된 MBC ‘나 혼자 산다’는 전국 기준 시청률 4.7%를 기록했다.  이는 지난 5일 방송된 625회가 기록한 시청률 5.2%보다 0.5%p 하락한 수치로 올해 들어 최저 시청률이다.  기존 올해 최저 시청률은 4.8%(601회, 622회, 623회, 624회)였다.  이날 방송에서는 메이저리거 김하성이 출연했다.  앞서 박나래는 매니저 갑질 의혹과 불법 의료 시술 등의 논란에 휩싸여 방송 활동을 중단했다. 이에 따라 ‘나혼산’도 하차했다.",https://n.news.naver.com/mnews/article/009/0005605586
