날짜,제목,본문,링크
2025-12-05 15:14:00,소상공인·자영업자에 경형 전기화물차 보급...3자 업무협약 체결,"한국전기차인프라서비스사업협동조합이 5일 서울 여의도 중소기업중앙회관에서 미르식스, KC전기자동차판매와 함께 경형 전기화물차 보급사업 추진을 위한 업무협약을 체결했다고 밝혔다.  이번 협약은 소상공인·자영업자가 사용 중인 내연기관 화물차를 친환경 전기차로 전환할 수 있게 지원체계를 마련하자는 취지로 체결됐다.  이번 협약에 따라 지원되는 ‘KC-1’(가칭)은 2인승 경형 전기밴이다. 카고·탑차·픽업 등 다양한 모델로 구성돼 업종별 운송 특성에 따라 선택이 가능하다. 중소기업 회원사에서 차량을 구매할 때는 정부·지자체 보조금, KBIZ 회원 할인 혜택 등이 적용될 예정이다.  조합은 중소기업중앙회 전국 15개 지역본부와 협동조합 네트워크를 활용해 보급사업을 홍보하고, 회원들의 차량 도입 수요를 취합해 적절한 공급이 이뤄지도록 지원한다.  미르식스와 KC전기자동차판매는 차량 생산과 공급, 품질관리, 사후관리 체계 구축을 담당한다. 또 앞으로 냉동탑차 등 라인업 확대와 배터리 성능 개선, 충전 인프라 구축을 위한 기술 개발을 추진한다. 운행·안전교육도 정기적으로 제공한다.  이들 3개 단체는 앞으로 2년간 단계적으로 공급을 확대해 1년 차 1000대, 2년 차 2000대의 경형 전기화물차를 보급할 계획이다. 맞춤형 차량 개발과 충전 인프라 확충 등 지원 시스템 구축도 함께 추진한다.  황인환 조합 이사장은 “기존 내연화물차를 전기차로 대체할 경우 1대당 연간 약 1톤 이상의 탄소 배출량을 줄일 수 있다”라며 “보조금과 세제 혜택, 연료비·정비비 절감 효과로 총 소유 비용도 낮아지는 등 소상공인의 비용 절감과 친환경 전환에도 도움이 될 것”이라고 내다봤다.",https://n.news.naver.com/mnews/article/009/0005601539
2025-12-05 15:13:00,“4학점이나 준대”…미 대학서 K팝 최초 정규 강좌 주인공 된 지드래곤,"지드래곤이 미국에서 K팝 최초의 4학점 정규 강좌 주인공이 됐다. 커뮤니케이션 학과 중 세계적으로 최상위권에 꼽히는 서던캘리포니아대학교(USC) 애넌버그(Annenberg)에서 K팝 아티스트 단독으로 4학점 정규 학점 강좌가 개설된 것은 이번이 처음이다.  5일 갤럭시코퍼레이션에 따르면 이번 강좌 개설은 최근 USC 애넌버그 공식 인스타그램 계정을 통해 먼저 알려졌다. 해당 피드에는 ‘#GDRAGON’, ‘#GD’ 해쉬태그와 함께 강좌에 대한 기대감을 표하는 USC 학생의 영상이 공개됐으며, 영상 말미 지드래곤의 공식 계정이 태그되면서 큰 화제를 모았다.  예일대 비욘세, 하버드대 테일러 스위프트 강좌처럼 USC의 지드래곤 강좌 개설은 단순한 아티스트를 넘어 K팝 글로벌 문화 현상과 ‘지드래곤 세계관’이 지닌 산업적, 문화적 가치를 학계가 공식 인정한 것으로 평가된다. 특히 그의 독보적 영향력과 트렌드 메이킹 역량은 K팝의 위상을 격상하고 새로운 가치를 창출하는 중요 동력임을 시사하고 있다.  2026년 봄학기에 개설되는 ‘COMM 400: K-팝 삐딱하게 보기: 지드래곤 사례 (Crooked Studies of K-pop: The Case of G-Dragon)’ 강좌는 이혜진 교수가 담당한다. 이 강좌는 케이팝이 세계적 성공에도 불구하고 여전히 기계적·상업적·예술적 자율성 결여 등의 프레임으로 논의되는 상황에서, 케이팝 역사상 가장 영향력 있고 혁신적인 인물로 꼽히는 지드래곤을 심층 분석함으로써 K팝에 대한 새로운 담론을 제시하고자 한다.  특히 지드래곤이 ‘프로듀서 아이돌’로서 구축한 독보적인 위상과 음악을 넘어선 그의 문화적 영향력을 집중 조명한다. 이를 기반으로 K팝의 구조적, 문화적, 미학적 가정들을 비판적으로 재해석할 예정이다.  갤럭시코퍼레이션 최용호 대표는 “지드래곤의 데뷔 20주년을 맞아 USC와 같은 명문 대학에서 그의 문화적 영향력을 조명하는 정규 학점 강좌가 K팝 최초로 개설된 것은 매우 뜻깊은 일”이라며 “이는 K팝의 예술적 깊이와 글로벌 영향력을 다시 한번 확인하는 계기가 될 것이며, 앞으로도 지드래곤의 고유한 가치를 전 세계에 알리고 K컬처의 지평을 넓히는 데 최선을 다할 것”이라고 말했다.",https://n.news.naver.com/mnews/article/009/0005601538
2025-12-05 15:13:00,"[속보] 민주, 대의원·당원 ‘1인 1표제’ 중앙위서 부결","정청래 더불어민주당 대표가 추진하는 이른바 ‘1인1표제’ 당헌 개정안이 중앙위원회에서 부결됐다.  중앙위는 5일 전국 중앙위원 596명을 대상으로 투표를 진행한 결과 해당 안건이 부결됐다고 밝혔다.  이번 투표에는 중앙위원 총 596명 중 373명이 참여했다.  ‘1인1표제’ 당헌 개정안에는 이 가운데 373명이 참여해 277명이 찬성했다. 중앙위에서 안건이 의결되려면 재적 위원 과반(299명) 찬성이 있어야 한다.  기초·광역의원 비례대표 선출 시 권리당원에 후보 선출권을 주고 예비경선제를 도입하는 등의 당헌 개정안도 부결됐다. 이 안건은 중앙위원 373명이 투표에 참여해 297명이 찬성했다.  조승래 사무총장은 “투표 참여자들의 찬성이 70%를 상회하지만 재적 과반을 얻지 못해 부결됐다”면서 “중앙위원의 선택에 대해 지도부는 존중해야 할 것이나, 당원주권 강화를 향한 행진은 계속될 것”이라고 말했다.",https://n.news.naver.com/mnews/article/009/0005601537
2025-12-05 15:08:00,"李 대통령 손목시계 공개…앞면엔 서명, 뒷면에 자필글씨로 담은 문구는?","대통령실 “韓 정통성 잇고 국민통합 기원 의미”   대통령실이 이재명 대통령 취임 6개월을 맞아 ‘대통령 손목시계’를 5일 공개했다. 이 대통령도 역대 대통령의 인기 기념품 아이템인 손목시계를 제작한 것이다.  시계 앞면에는 대통령 휘장(봉황 문양)과 함께 이 대통령의 서명이 담겼고, 시계판에는 음각으로 태극 문양이 새겨졌다. 뒷면에는 이 대통령의 자필 글씨체로 ‘국민이 주인인 나라’라는 문구가 각인됐다.  이날 강유정 대통령실 대변인은 시계 앞면의 음각 태극 문양에 대해 “제품의 심미적 완성도를 높이면서도 대한민국의 정통성을 잇고 국민통합을 기원하는 의미를 담았다”고 말했다. 이어 시계 뒷면의 이 대통령 자필 문구에는 국민과 소통하며 국민의 주권 의지를 국정에 반영하겠다는 뜻이 반영됐다고 설명했다.  강 대변인은 “이번 손목시계는 제품 기획 단계부터 디자인 전문가들이 참여, 기념품으로서의 상징성과 완성도를 높였다”고 소개했다. 그러면서 “대통령실은 손목시계 공개를 계기로 ‘대통령의 1시간, 공무원의 1시간은 온 국민의 5200만 시간과 같다는 대통령의 국정철학을 되새기고, 이를 토대로 국민의 삶이 보다 나아지도록 국정운영에 더욱 매진하겠다”고 덧붙였다.  대통령 손목시계는 역대 대통령들이 자신의 서명과 국정철학을 담은 문구를 새겨 만들고 있는 전통적인 ‘대통령 굿즈’다.  과거 윤석열 시계의 뒷면에는 ‘다시 대한민국! 새로운 국민의 나라’가 쓰였고, 문재인 시계에는 ‘사람이 먼저다’라는 글귀가 적혀 있다. 노무현 시계에는 ‘원칙과 신뢰 새로운 대한민국 노무현’이라는 내용이 들어갔다. 그러나 이명박 시계 뒷면에는 특별한 메시지 없이 ‘제17대 대통령 내외 이명박 김윤옥’이라고만 각인됐고, 박근혜 시계에는 별도 문구가 담기지 않았다.  한편, 대통령은 이번 아날로그 시계를 내놓기 전에는 여러 가지 스마트워치용 배경 이미지를 만들어 국민들이 내려받아 쓸 수 있게 하기도 했다.",https://n.news.naver.com/mnews/article/009/0005601535
2025-12-05 15:05:00,자오창펑 바이낸스 창업자 “블록체인과 전통 금융 통합될 것” [매일코인],"“결국 전통 결제와와 가상자산이 통합될 것이다.”  자오창펑 바이낸스 창업자는 지난 3일과 4일 양일간 UAE 두바이 코카콜라아레나에서 열린 ‘바이낸스 블록체인 위크’에서 “비트코인은 전자 현금으로 시작했지만 쉽지 않았고, 가상자산 변동성을 스테이블코인이 등장하며 완화하고 기술이 이를 보완하고 있다”면서 이같이 말했다.  자오 창업자는 바이낸스를 설립하고 5개월만에 세계 1위 가상자산거래소로 키워낸 인물이다. 현재 약 107조원 상당의 재산을 보유한 것으로 추정된다. 자오 창업자는 지난 2023년 바이낸스의 미국법인인 바이낸스US가 자금세탁 방지 규정을 위반한 등 혐의를 받고 CEO에서 사임했다. 다만 도널드 트럼프 정부 들어 사면을 받고 다시 활동을 이어가고 있다.  자오 창업자는 블록체인이 금융을 혁신한다고 역설했다. 그는 “개발도상국일수록 금융 기관이 부족한데 블록체인은 인프라가 된다”면서 “불안정한 법정통화를 가진 곳에서는 비트코인과 스테이블코인이 헤지수단이 될 수도 있다”고 말했다.  또한 그는 “향후 시장에서 살아남는 가상자산이 되려면 사용자에 신경쓰고 진짜 제품을 만드는 코인 프로젝트여야 할 것”이라고 조언했다.  일각에서 제기되는 트럼프와의 밀월관계에 대한 질문에는 “트럼프일가와 나 사이엔 아무것도 없다”면서 “미국이 크립토수도가 되는 데 도움을 주고 싶다”고 말했다.  그는 “미국은 정말 중요하고, 인공지능(AI)등 테크 분야에서의 리더이지만 크립토 1위 국가는 아니다”면서 “미국을 돕고 싶고, 투자도 늘리고 BNB기반 프로젝트도 돕고 싶다”고 말했다.  자오 창업자는 이번 행사 마지막 무대에서 금본위 주의자로 유명한 경제학자 피터 쉬프와 격한 논쟁을 벌이기도 했다.  쉬프는 “비트코인은 가격 상승 기대에만 의존하는 구조로 탈중앙 형태의 피라미드에 가깝다”며 비트코인을 비판했다. 자오는 “비트코인은 실체가 없어서 무가치하다는 주장 자체가 디지털 시대의 가치를 오해한 것“이라며 ”인터넷 서비스가 실물이 없어도 가치를 갖는 것과 같다“고 반박했다.  [두바이=최근도 기자]",https://n.news.naver.com/mnews/article/009/0005601534
2025-12-05 15:05:00,박지원 “형님·누나 호칭은 민주당 풍토…책임진 김남국 칭찬받아야”,"박지원 더불어민주당 의원이 5일 ‘인사청탁’ 논란을 일으킨 김남국 전 대통령실 디지털소통비서관이 사퇴한 부분에 대해 “부적절한 처신에 책임진 김남국의 모습은 칭찬받아 마땅하다”는 입장을 밝혔다.  “정치권에서 형, 형님, 누나, 누님이라고 부르는 것은 선배 동료들을 살갑게 부르는 민주당의 일종의 언어 풍토”라는 옹호와 함께다.  박 의원은 이날 자신의 SNS 계정에 “동료 후배 의원들께서도 저를 의원, 전 대표보다는 대부분 거의 형님, 큰형님으로 부른다”며 이같이 밝혔다.  이는 지난 2일 김 전 비서관이 문진석 민주당 원내운영수석부대표의 텔레그램을 통해 받은 인사 청탁 요청 메시지에 “제가 훈식이형이랑 현지 누나한테 추천할게요”라고 답장한 내용을 거론한 것이다.  ‘훈식이형’은 강훈식 대통령비서실장, ‘현지 누나’는 김현지 대통령실 제1부속실장을 칭하는 표현으로 보인다. 해당 대화에서 문 원내수석은 중앙대학교 동문인 김 전 비서관을 “아우”라고 지칭하기도 했다.  이어 “김남국 전 의원은 코인관계로 국회를 떠났지만 대법원에서 무죄”라고 강조하면서도 “대통령실 비서관으로 장래의 아무것도 생각하지 않고 오직 대통령의 성공을 위해 연고 지역구도 안가고 엿새를 사무실에서 자고 먹고 1주일에 하루 집에 다녀온다는 일벌레였다”고 회상했다.  박 의원은 “저와는 제가 원외에 있을 때도 간혹 식사, 비서관 재임 시에도 서너 번 통화도 했다”며 “잘하는 것도 중요하지만 실수를 하지 말라는 DJ(김대중 전 대통령)의 말씀을 저는 달고 살지만 저도 실수투성이”라고 김 전 비서관을 감쌌다.  그는 “문 원내수석도 진솔한 사과를 했다. 날벼락 유탄을 맞은 (김현지) 부속실장도 청탁과 관계가 없고 누나 동생 사이도 아니라며 부인한다”며 “모두가 반성하고 전화위복의 계기로 삼자”고 제안했다.  이번 건을 계기로 김현지 실장 논란에 다시 불을 붙이려는 야당에 대해서는 “내란을 하고 인정도 반성도 사과도 않는 사람들, 그를 추종하는 장동혁 (국민의힘) 대표 등 일당보다 김 전 비서관 사과와 사퇴가 훨씬 돋보인다”고 두둔했다.  또한 “×묻은 개가 겨묻은 개 탓하는 꼴”이라면서도 “(인사 청탁 논란은) 부적절했기에 고개 숙여 다시 한번 국민께 사과올린다”고 마무리했다.  한편 강득구 민주당 의원도 이날 SNS를 통해 “저는 김남국을 알기에 여전히 김남국을 사랑한다. 세상이 그를 비난하지만 저는 동지로서 그와 함께 하겠다”며 “세상이 그에게 돌을 던진다면 저도 함께 맞겠다”고 말했다.",https://n.news.naver.com/mnews/article/009/0005601532
2025-12-05 15:04:00,“국민이 주인인 나라”…이대통령 취임 6개월 맞아 손목시계 공개,"대통령실은 5일 이재명 대통령의 취임 6개월을 맞아 ‘대통령 손목시계’를 공개했다.  이번 손목시계는 앞면에 대통령 휘장과 이재명 대통령의 서명이 들어갔으며, 시계판 바탕에는 태극 문양이 새겨졌다. 뒷면에는 이 대통령의 자필 글씨체로 ‘국민이 주인인 나라’라는 문구가 각인됐다.  강유정 대통령실 대변인은 태극 문양에 대해 “제품의 심미적 완성도를 높이면서도 대한민국의 정통성을 잇고 국민통합을 기원하는 의미를 담았다”고 설명했다. 또 시계 뒷면 문구에 대해서는 언제 어디서나 국민과 소통하고, 국민의 주권 의지를 국정에 반영하겠다는 대통령의 뜻이 담겼다고 부연했다.  이번 시계는 기획 단계부터 디자인 전문가들이 참여하며 상징성과 완성도를 높였다는 설명이다.  강 대변인은 “대통령실은 손목시계 공개를 계기로 ‘대통령의 1시간, 공무원의 1시간은 온 국민의 5천200만 시간과 같다는 대통령의 국정철학을 되새기고, 이를 토대로 국민의 삶이 보다 나아지도록 국정운영에 더욱 매진하겠다”고 강조했다.",https://n.news.naver.com/mnews/article/009/0005601531
2025-12-05 14:55:00,"원텍, 튀르키예·태국서 의료기기 인허가 획득","매출 60% 이상 해외서 나와   5일 미용 의료기기 기업 원텍은 튀르키예와 태국에서 각각 ‘라비앙’과 ‘브이 레이저’의 의료기기 인허가를 잇달아 획득했다고 밝혔다.  원텍에 따르면 튀르키예 보건당국은 라비앙이 1927nm 파장의 툴륨 레이저를 기반으로 피부 표피부터 진피층까지 정밀하게 조사할 수 있는 고출력 프랙셔널 기술을 갖췄다고 평가하고 피부용 의료기기 인증을 승인했다.  라비앙은 앞서 브라질 시장에서 큰 성장세를 기록했고 미국, 사우디아라비아 등에서도 인증을 취득했다. 원텍 관계자는 “이번 튀르키예 진출로 중동 및 유럽권 시장 내 점유율이 더욱 높아질 것”이라고 했다.  태국 식품의약국은 브이 레이저가 1064nm와 532nm 듀얼 파장을 기반으로 혈관 병변의 지혈·응고부터 색소 질환 치료, 반흔 개선, 제모에 이르기까지 폭넓은 치료 영역에서 효과와 안전성을 입증했다고 평가하며 사용을 승인했다.  원텍 관계자는 “동남아 의료 관광 허브인 태국에서 브이 레이저가 사용 승인을 받으며 혈관·색소 병변부터 제모, 주름 개선까지 다양한 피부 치료 수요에 종합적으로 대응할 수 있게 됐다”며 “80여 개국 수출 네트워크를 기반으로 제품별 포트폴리오와 현지 특화 전략을 강화해 글로벌 시장 입지를 지속 확대할 것”이라고 말했다.  원텍은 전체 매출의 60% 이상을 해외에서 기록하고 있다. 미국 FDA, 유럽 CE 등 주요 국제 인증을 보유하고 있으며, 미국, 일본, 태국에 현지 법인을 운영하고 있다.",https://n.news.naver.com/mnews/article/009/0005601530
2025-12-05 14:55:00,"해외여행 필수템 된 트래블로그, 이용자 1000만 돌파","41개월만 누적 환전액 5.4조 총 3362억원 환전 비용 절감   하나금융그룹의 해외여행 플랫폼 ‘트래블로그’ 가입자가 1000만명을 돌파했다. 2022년 출시 이후 41개월 만으로, 누적 환전액은 5조4000억원에 달한다.  하나금융은 그룹 출범 20주년을 맞은 지난 1일 가입자 1000만명을 달성했다고 5일 밝혔다. 트래블로그는 ‘하나머니’ 앱에서 58개 통화를 무료 환전(환율우대 100%)할 수 있고, 해외 결제·ATM 인출 수수료까지 면제한 서비스다. 이를 통해 이용자들이 절감한 비용만 총 3362억원에 이른다.  출시 이후 성장 속도도 가팔랐다. 2023년 12월 말 환전액 1조원을 기록한 뒤 2년 만에 5조4000억원으로 불어났다. 해외 체크카드 시장 점유율도 34개월 연속 1위를 기록 중이다.  하나금융그룹은 코로나19 여파로 해외여행 시장이 침체된 2022년, ‘트래블로그’를 선보이며 금융권에서는 처음으로 ▲무료 환전(환율우대 100%) ▲해외 결제·이용 수수료 면제 ▲해외 ATM 인출 수수료 면제 등의 혜택을 표준으로 정착시켰다.  이후 글로벌 결제망인 마스터·비자·유니온페이와 제휴하고, 원하는 환율에 도달하면 자동으로 충전되는 ‘목표 환율 자동 환전’ 기능을 도입했다. 또 카카오페이·신세계·플레이브·G-DRAGON 등과의 파트너십을 확대하며 서비스 외연을 넓혀왔다.  함영주 하나금융그룹 회장은 1000만 번째 가입자를 초청해 200만 하나머니를 전달하며 “트래블로그는 24시간 365일 모바일 환전으로 현금 없는 해외여행을 선도하며, 합리적 소비와 경험의 가치를 중시하는 요즘 세대에게 딱 맞는 해외여행 필수품이 됐다”며 “5000만 이용자가 될 때까지 그룹의 역량과 지원을 아끼지 않겠다”고 말했다.",https://n.news.naver.com/mnews/article/009/0005601529
2025-12-05 14:55:00,콜마 세종공장 찾은 독일 전 총리···“신규 비즈니스 논의”,"윤동한 회장과 환담···아부다비 투자진흥청 관계자도 동행   콜마홀딩스는 지난 2일 슈뢰더 전 독일 총리 부부와 아랍에미리트(UAE) 아부다비 투자진흥청 관계자 등이 한국콜마·콜마비앤에이치 세종공장을 방문해 신규 비즈니스를 논의했다고 밝혔다.  슈뢰더 전 총리는 이날 부인인 김소연 슈뢰더-김 비영리재단 이사장과 함께 세종공장을 둘러봤다. 동행한 모하메드 알 호사니 아부다비 투자진흥청(ADIO) 최고책임자와 메이드 알 함마디 EKFS(에미리트-한국 친선협회) 회장, 레이먼드 셰플러 하이티 대표 등은 화장품, 건강기능식품 생산라인 투어를 진행했다. 공장 투어를 마친 후에는 윤동한 한국콜마 회장, 윤여원 콜마비앤에이치 사회공헌부문 각자대표와 환담을 나눴다.  콜마그룹은 이번 방문이 윤동한 한국콜마 회장과 슈뢰더 전 총리 부부의 인연으로 성사됐다고 설명했다. 김소연 이사장은 2014년 독일 노르트라인-베스트팔렌 주정부 무역투자진흥공사에서 한국 대표로 활동하며, 월드클래스 300기업 협회장인 윤 회장과 인연을 맺었다. 김 이사장은 윤 회장이 독일 아헨공대, 프라운호퍼 연구소 등과 협력 관계를 구축하도록 지원했으며, 월드클래스 기업들이 독일 내 연구기관 및 기업과 협력할 수 있도록 역할을 했다.  윤 회장은 “콜마그룹의 UAE 사업을 비롯한 여러 글로벌 사업에서 협력 관계를 기대한다”고 말했다.",https://n.news.naver.com/mnews/article/009/0005601528
2025-12-05 14:54:00,“급한데 지방에서라도”…주담대 ‘풍선효과’ 현실화하나,"부산은행, 실수요자 외 주담대 취급 중단 지방은행 긴장 “중단 가능성 배제 못 해” 5대은행, 대출절벽 현실…생활자금도 막혀   최근 시중은행이 정부의 가계대출 압박과 연말 대출잔액 조정으로 대출 빗장을 걸어 잠그자 대출 수요가 지방은행에 옮겨가는 풍선효과가 나타나고 있다.  5일 금융권에 따르면 최근 BNK금융지주의 부산은행은 현재 실수요자 외 차주에 대한 대면 주택담보대출(주담대) 취급을 중단한 상태다.  단, 대면 주담대 상품 중 무주택 실수요자 구입자금, 전세반환자금과 비대면 주담대는 운영 중이다.  부산은행과 같은 BNK금융지주 계열사인 경남은행은 아직까지 모든 종류의 주담대를 정상 운영 중이다. 광주은행, 전북은행도 현재 기준 운영을 멈춘 대출 상품은 없다.  그럼에도 불구하고, 지난해 말 지방은행들은 폭증하는 대출 수요에 한시적으로 가계대출을 중단한 바 있어 수요자들 사이에서 불안은 커지고 있다. 지난 연말 경남은행, 광주은행, iM뱅크(전 대구은행) 등은 비대면 상품 판매에 이어 주담대, 전세대출 등 상품 판매를 연말까지 멈췄었다.  한 지방은행 관계자는 “아직까지 주요 대출 상품 운영을 전면 중단할 정도는 아니지만, 대출난이 심화되고 있는 만큼 향후 추이를 봐가면서 중단할 가능성을 배제할 수 없다”고 전했다.  시중은행 대출 절벽에 따른 풍선효과는 지방은행뿐만 아니라 인터넷전문은행(인뱅)에서도 관찰되고 있다.  인뱅에선 매일 주택구입자금 및 전세 대출 한도가 1~2시간 내로 소진되는 등 오픈런 현상이 빚어지고 있다. 지난해 말 인뱅 서버는 오전 대출 신청 접수가 시작되는 때 트래픽 폭주에 다운되기도 했다.  5대 은행, 줄줄이 대출 틀어막기…일부 생활자금대출도 중단 연말 총량관리 비상이 걸린 국내 주요 은행들은 줄줄이 연말 가계대출 창구를 걸어 잠그고 있다.  KB국민은행은 임차보증금 반환 목적의 주담대를 제외하고 대면과 비대면 채널의 주담대 신규 취급을 연말까지 모두 중단하기로 했다. 지난 4일부터는 연내 실행 예정인 생활안정자금 목적의 주담대도 중단했다. 당장 이날부터 올해 말까지 가계대출 중도상환수수료도 받지 않는다. 이는 대출 상환을 유도하려는 조치로 해석된다.  하나은행도 주담대 관리에 이어 신용대출 막기에 나섰다. 하나은행은 모집인을 통한 올해 신규 주담대와 전세대출 실행을 전면 중단했으며, 신용대출 상품에도 일일 한도를 부여해 관리 중이다.  신한은행은 모집인을 통한 신규 주담대 접수를 중단한 뒤 신용대출에 대해서는 일별 한도 조절을 하고 있다.  우리은행은 영엄점별 월 10억원 대출한도 제한 조치를 지속하고 있다.  농협은행은 가계대출 총량 한도가 일부 남아있는 것으로 알려진 가운데 대출 모집인 주담대 접수에 대해서만 월별 한도를 부여해 관리하고 있다.",https://n.news.naver.com/mnews/article/009/0005601527
