날짜,제목,본문,링크
2025-12-13 09:34:00,"미국서 불길 뛰어든 영웅…알고보니 ‘충격’, 이유가","불난 이웃집에 구조를 위해 달려간 남성이 5개월 만에 방화 용의자로 드러나 충격을 주고 있다.  현지시간 12일 ABC7 NY 등 외신에 따르면 지난 여름 미국 뉴저지에서 발생한 주택 화재사건의 범인으로 이웃 남성 윌리엄 알레가 경찰에 체포됐다.  해당 주택에 살던 80대 여성은 사망했다.  지난 7월 알레는 새벽 1시30분께 이웃집 주택에서 불이 나는 것을 발견했다.  알레는 화재 현장으로 달려가 여성을 구하려다 화상을 입고 병원에 실려갔다.  결국 여성은 사망했지만 이웃들은 목숨을 걸고 구조를 시도한 알레를 영웅으로 불렀다.  그는 평소 이웃들을 도와 ‘거리의 시장’이라고 불릴 정도로 평판이 좋았다.  그러나 조사당국은 여성의 사망 원인을 ‘살인’으로 판단하고 용의자로 알레를 체포했다.  검찰은 그를 살인, 절도, 방화 혐의로 기소했다.  5개월만에 알레가 방화범으로 체포되는 것을 본 이웃들은 “정말 충격적이다. 그는 평소 좋은 사람처럼 보였다”, “그는 분명 화재 속에서 여성을 구하려고 노력했다”, “정말 이해하지 못하겠다” 등의 반응을 보였다.  알레는 은퇴 전 지역 교도소에서 근무하던 경찰관이었던 것으로 전해졌다. 범행 동기는 밝혀지지 않았다.",https://n.news.naver.com/mnews/article/009/0005605486
2025-12-13 09:33:00,“약 줬으니 너희도 못 벗어나”...박나래 전 매니저 추가 폭로,"방송인 박나래가 대리 처방 등 의료법 위반 가능성이 있는 행위를 매니저들에게 강요했다는 주장이 나왔다.  지난 12일 채널A 보도에 따르면 박나래의 전 매니저 A씨는 박나래가 자신에게 대리 처방 등 불법 의료 행위를 강요했다고 주장했다.  특히 박나래가 요구한 약을 주지 않을 경우 “이것도 하나의 아티스트 케어인데 왜 주지 않느냐”, “이미 나한테 한 번 준 이상 너희도 벗어날 수 없다”, “앞으로 이 일을 영영 못할 수도 있다”는 취지의 메시지를 보냈다고 주장했다.  전 매니저는 지난 8일 경찰에 고소장을 접수하면서 박나래의 강요 정황이 담긴 메시지 캡처 사진들도 제출한 것으로 전해졌다.  앞서 박나래는 지난 3일 전 매니저들의 갑질 폭로에 이어 ‘주사이모’로 불린 B씨에게 불법 시술을 받았다는 의혹에 휩싸였다.  이에 대해 박나래 측은 6일 “면허가 있는 의사에게서 영양제를 맞은 게 전부”라며 “(주사이모와) 병원에서 처음 만난 뒤 친해졌고, 스케줄이 바빠 힘들 때마다 왕진을 요청한 것”이라고 해명했다.  B씨 역시 SNS에 의사 가운을 입은 사진과 함께 “중국 내몽고 의대 최연소 교수”라고 주장하며 억울함을 토로했다.  하지만 공정한 사회를 바라는 의사들의 모임(공의모)는 성명을 통해 “확인 결과 ‘포강의과대학’이라는 의과대학은 존재하지 않았다”고 반박했고, 임현택 전 대한의사협회 회장은 B씨를 의료법·약사법 위반 및 사기 혐의로 검찰에 고발했다.  논란이 확산되자 박나래는 지난 8일 SNS를 통해 “모든 것이 명확히 해결될 때까지 방송 활동을 중단하겠다”고 밝히며, MBC ‘나혼자산다’ ‘구해줘 홈즈’ 등에서 하차했다.  앞서 박나래 측은 “전 매니저들과 오해를 풀었다”고 주장했으나, 전 매니저들은 합의 조건 불일치를 이유로 법적 대응을 이어가고 있다.",https://n.news.naver.com/mnews/article/009/0005605485
2025-12-13 09:31:00,하지원 85억·비 300억 ‘잭팟’…불황이 뭐죠? ‘그사세’ 갓물주들[스테크],"고금리와 경기 침체로 부동산 시장엔 찬바람이 불고 있다. 하지만 연예계 ‘큰손’들의 세계는 딴 세상 이야기다. 수십억, 아니 수백억 원 규모의 시세 차익을 거뒀다는 스타들의 소식은 불황에도 꾸준히 들려오고 있다.  최근에는 배우 하지원이 100억원에 매입했던 서울 성동구 성수동 건물을 5년 만에 185억원에 매각하면서 85억원의 차익을 남겼다는 소식이 알려졌다. 어마어마한 시세 차익을 남기며 재테크에 성공한 스타들의 패턴을 들여다봤다.  개인 아닌 법인 투자 사례 급증…리스크 줄이고 최근 스타들의 부동산 투자를 보면 ‘법인’을 이용한 투자가 다수 보인다. 개인 명의로 부동산을 취득할 때는 대출 규제를 비롯해 여러 세금 부담이 있지만, 법인을 통하면 피할 수 있는 부분이 많다.  하지원 역시도 ‘법인 투자’로 시세차익을 거뒀다. 그는 지난 2020년 3월, 자신이 사내이사로 있는 가족 법인 명의를 통해 서울 성동구 성수동 2가에 있는 건물을 100억원에 매입했다. 성수역 인근, 소위 ‘힙플레이스’로 떠오르는 금싸라기 땅이었다.  매입 당시 채권 최고액은 90억원. 통상 대출의 120%를 채권 최고액으로 설정하는 것을 고려해 보면, 실제 대출금은 약 75억원에서 80억원 수준으로 예상된다. 매입가의 80% 가까이를 대출로 충당한 것. 이는 개인이 아닌 법인이기에 가능했던 대출 규모다.  하지원은 대지면적 258㎡(약 78평), 연면적 998㎡(약 302평) 규모였던 부지에 지하 1층~지상 8층짜리 신축 건물을 올렸다. 이 건물은 지난달 185억원에 매각되면서, 5년만에 시세 차익 85억원을 달성했다.  배우 조정석 역시 ‘법인’을 통한 부동산 투자에 성공했다. 2018년 대치동 학원가에 위치한 빌딩을 자신이 설립한 제이에스컴퍼니를 통해 매입했다. 해당 건물을 39억원에 매입한 그는 2020년 2월 대지면적 224.6㎡(67.94평), 연면적 710.71㎡(214.98평)에 지하1층부터 지상6층까지 규모의 건물로 새로 올렸다.  이 건물은 지난 6월 영화 ‘부산행’의 연상호 감독이 대표로 있는 법인에 110억원에 매각됐다. 단순 차익만 71억원. 건축비를 고려하더라도 50억~60억원대 순수익을 거둔 것으로 평가받는다.  낡은 건물 부수고 새 건물로…건물주 위의 건축주 단순히 건물을 사서 오를 때까지 기다리는 게 아니라 직접 낡은 건물을 사들여서 새로 건물을 올리며 가치를 재창출해내는 고수들도 있다.  가수 비는 지난 2008년 168억원에 매입해 소속사 사옥으로 쓰던 강남구 청담동 건물을 지난 2021년 6월 495억원에 매각해 327억원의 차익을 봤다.  당시 비가 매입할 당시, 두 개 필지가 합쳐진 형태의 땅에 1983년과 1991년 각각 지어진 노후 건물이 있었다. 그는 이 건물들을 증축 및 용도변경해서 사용하다가 2017년, 약 70~80억원을 들여 건물을 허물고 빌딩을 신축했다.  2019년 완공된 건물은 지하 3층~지상 6층으로, 대지면적 1024.80㎡, 연면적 3218.94㎡ 규모다. 매입 가격과 매각 가격을 단순 비교하면 약 327억원의 차익이다. 건축비를 비롯해 취득세, 등록세, 소유권 이전비용, 중개수수료 등을 감안하면 실제 차익은 이보다 줄어들 것으로 보이지만, 결과적으로 매입가 대비 3배 가까운 가격에 매도하며 적극적인 투자로 성공한 사례다.  권상우도 부동산의 귀재라 불릴만 하다. 그는 2015년 서울 성동구 성수동 뚝섬역 인근 공장 건물 2개 동을 80억원에 매입했다.  이후 기존 건물을 철거하고, 지상 2층 규모의 건물로 신축했다. 1층에는 셀프세차장을 오픈해 운영했으며, 건물 2층은 소속사 사무실로 사용했다. 권상우는 지난해 세차장 운영을 종료하고 신축 건물 공사를 시작했다. 팝업 행사장으로 리모델링을 계획 중이다.  성수동이 주목받으면서 지가가 상승했고, 해당 건물의 시세도 껑충 뛰었다. 권상우는 아직 해당 건물을 매도하지 않았으나, 현재 해당 건물의 시세는 약 430억원으로 평가받고 있다. 매도할 경우 예상 차익은 350억원. 매입가의 5배가 넘는 수치다.  건물보다 중요한 ‘땅’…환상의 입지 선정 건물 매매에 있어서 건물의 구조나 용도, 건축 기법, 외관 등 여러가지가 가격 형성에 영향을 미친다. 그러나 그 중에서도 가장 중요한 것은 바로 해당 건물이 서 있는 땅이다. 이런 ‘기본’에 충실해 성공한 사례도 있다. 바로 김태희.  김태희는 2014년 서울 강남구 역삼동에 있는 빌딩을 132억원에 매입했다. 강남역에서 도보 2~3분 거리, 초역세권에 위치한 이 건물은 유동 인구가 끊이지 않는 자타공인 최고의 상권이다.  공실 위험이 0에 수렴하는 황금 입지를 손에 넣은 그는 신축이나 리모델링 없이 매입한 건물 그대로 안정적인 임대 수익을 얻었다. 아울러 매입 7년 만인 2021년, 203억원에 건물을 매각하며 71억원에 시세 차익을 얻었다.  남편 비와 함께 소유 중인 건물 역시 엄청난 수익률을 보인다. 두 사람은 2021년 서울 서초동 강남대로변에 위치한 빌딩을 940억원에 매입했다. 지분은 비가 60%, 김태희의 법인 프레스티지투에셋이 40%를 보유하고 있다.  해당 건물은 2001년 6월 준공된 건물로 지하 2층~지상 8층, 대지면적은 485.6㎡(147평), 연면적은 2913.23㎡(881평) 규모다. 강남역 10번 출구에서 도보 2분 거리 초역세권으로 강남대로와 맞닿아 있는 최고의 입지다. 매입 당시 건물 전체의 월 임대료는 2억 3천만원 수준이었던 것으로 알려졌다. 현재 월 임대료는 이보다 많은 것으로 예측된다.  이들은 매입 1년 만인 2022년 1400억원에 매각을 추진했다가 철회했다. 전문가들은 현재 빌딩의 시세 역시 1400억원을 크게 웃돌 것으로 보고 있다.  그들만의 리그…맹목적 따라하기는 금물 스타들의 부동산 투자 성공담은 화려하다. 매입가 대비 2~3배 차익을 내기도 하고, 금액으로 봐도 수백억원 대의 차익을 남기기도 한다. 하지만 전문가들은 “연예인의 투자 방식을 따라 하는 것은 위험하다”고 경고한다.  연예인들은 대중적인 인지도를 바탕으로 건물을 ‘브랜딩’하는 힘을 가지고 있다. 연예인 소유라는 것만으로 건물을 가치가 오르거나, 임차인을 유치하기 쉬워진다. 일반적으로는 가지지 못하는 무형의 자산이다.  아울러 자금 동원력 면에서도 큰 차이가 있다. 법인을 통한 대규모 대출을 일으키는 것은 고소득이 증빙되는 연예인 법인이기 때문에 가능한 경우가 많다. 대출 규제가 강화되고, 금리가 오르는 상황에서 무리한 영끌 투자는 이자 부담을 이기지 못하고 헐값 매각으로 이어지는 상황을 만들 수 있다.  한 부동산 전문가는 “수십억원의 현금 동원력과 실패해도 본업 소득이 뒷받침되는 연예인들의 투자는 그야말로 ‘그들만의 리그’인 경우가 많다”며 “성공 사례 속 입지 선정 안목 등 배울 점은 배우되, 자산 상황에 맞지 않는 무리한 매수는 지양해야 한다”고 조언했다.  화려한 차익 뒤에는 치열한 가치 판단과 과감한 결단, 매도까지 긴 인내의 시간 등이 숨어있다. 숫자 이면에 감춰진 그들의 투자 철학을 읽어내 재테크에 접목하는 현명함이 필요하다.  김소연의 스테크(스타+재테크)  부동산, 금, 미술품 등 실물 자산부터 암호화폐 등 가산 자산까지 투자처가 다양화되고 있는 가운데, 주식을 하기엔 게으르고, 코인을 하기엔 소심해 출근을 하는 직장인 기자가 스타들의 재테크 비결을 들여다봅니다.",https://n.news.naver.com/mnews/article/009/0005605484
2025-12-13 09:23:00,“트럼프콘돔 4달러50센트”…여성들과 함께 찍은 트럼프 공개한 美민주,"도널드 트럼프 미국 대통령과 미성년자 성착취범 고 제프리 엡스타인의 관계를 둘러싼 의혹을 제기해온 미국 민주당이 두 사람이 함께 찍힌 사진을 공개했다.  워싱턴포스트(WP)에 따르면 연방 하원 감독위원회 소속 민주당 의원들은 12일(현지시간) 엡스타인과 트럼프 대통령, 다른 유명 인사들이 포함된 사진 19장을 공개했다.  감독위는 엡스타인의 저택에서 9만5000여장의 사진을 확보했는데 이날 공개된 사진에는 트럼프 대통령 외에도 빌 클린턴 전 대통령, 마이크로소프트 창립자 빌 게이츠, 영화감독 우디 앨런, 트럼프 대통령의 ‘책사’였던 우파 논객 스티브 배넌도 등장했다.  이날 공개된 사진 중에는 트럼프 대통령이 금발의 여성과 함께 있는 모습을 찍은 것이 포함됐다.  트럼프 대통령이 엡스타인 옆에 선 채 한 여성과 대화하고 있는 모습을 담은 사진과, 트럼프 대통령이 여자 6명과 나란히 선 사진도 있다.  여자들의 얼굴은 신원을 알 수 없게 가려졌다. 한 사진에는 ‘트럼프 콘돔’을 4달러50센트에 판다는 팻말이 보인다.  엡스타인이 찍히지 않은 사진도 많다.  민주당은 이번에 공개한 사진이 왜 중요한지를 설명하지 않았다.  감독위의 민주당 간사인 로버트 가르시아 하원의원은 “이 충격적인 사진들은 엡스타인, 그리고 그와 세계에서 가장 힘센 남자들 몇 명과의 관계에 대해 더 많은 의문을 일으킨다”면서 “법무부는 당장 모든 자료를 공개해야 한다”고 말했다.  반면 공화당 하원의원들은 민주당이 트럼프 대통령에 대한 거짓 서사를 만들기 위해 사진을 선별적으로 공개했다고 비판했다.",https://n.news.naver.com/mnews/article/009/0005605483
2025-12-13 09:13:00,출산율 반등에도 자연감소 막기엔 역부족…총인구 감소까지 4년 남았다,"예산정책처 장기 인구전망 발표 출산율 올해 0.8명·내년 0.9명 출생아수 2028년 정점으로 감소 20년 뒤 자연감소 38만명까지 확대   최근 혼인 증가 영향으로 내년에 강한 출산율 반등이 나타날 것으로 전망됐다. 그러나 중장기적으로는 출생아보다 사망자가 많은 자연감소가 이어지면서 2040년대에는 우리나라 총인구가 5000만명을 밑돌 것으로 추산됐다.  국회예산정책처는 최근 이같은 전망을 담은 ‘인구전망 2025~2045’ 보고서를 발간했다. 우선 합계출산율은 혼인 증가로 인해 올해 0.8명, 내년 0.9명으로 강한 반등이 나타날 것으로 예상됐다. 코로나19로 인해 지연된 혼인건수가 증가하면서 2025~2026년 출산율이 상당폭 상승한다는 분석이다.  합계출산율은 특정 연도의 가임기(15~49세) 여성의 평균 출생아 수를 의미한다. 예정처는 출산율 재조정 이후 합계출산율은 0.92명 수준의 장기 균형 상태에 이를 것으로 봤다. 다만 출생아 수는 올해 25만4000명으로 예상됐지만 2045년에는 20만6000명 수준으로 감소할 전망이다.  인구수 자체의 감소로 인해 출생아 수가 28만7000명을 정점으로 감소세로 전환돼 합계출산율 상승세에 미치지 못할 것으로 예상되기 때문이다.  총인구는 2028년까지 소폭 증가한 이후 올해로부터 4년 뒤인 2029년부터 감소세로 돌아서는 것으로 분석됐다. 2028년까지는 국제순유입이 인구 자연감소를 상쇄하며 총인구의 증가를 이끌지만 2030년 이후부터는 국제순유입이 인구 자연감소를 상쇄하기 어려운 구조로 변화하게 된다.  출생아에서 사망자를 뺀 인구 자연감소는 2035년 22만1000명에서 2045년 39만7000명까지 확대될 전망이다. 올해부터 2045년까지 내국인 인구는 연평균 0.4%씩 감소하는 반면 외국인은 2.6%씩 증가해 2045년 외국인 인구 비중은 총인구의 7%에 달할 것으로 추산됐다. 외국인은 총인구 중 국내에 3개월 이상 거주한 외국인 인구를 뜻한다.  2045년 기대수명은 여성이 90세, 남성이 86세로 전망됐다. 고령인구의 조사망률은 꾸준히 증가하지만 의료기술 발전과 생활환경 개선, 건강행태 변화 등에 따라 기대수명이 상승할 것이라는 분석이다.  지동하 예산정책처장은 “총인구 감소는 생산연령인구 감소로 인한 경제규모 감소, 학령인구 감소, 병력자원 감소를 야기할 뿐만 아니라 사회적으로도 지방 소멸, 세대 갈등 등 국가의 여러 부분에 연쇄적 효과를 야기할 것”이라며 “그동안 출산에 집중됐던 인구 문제의 외연을 확장하고, 이민 정책 등에 대해 다양하게 논의해야 한다”고 밝혔다.",https://n.news.naver.com/mnews/article/009/0005605482
2025-12-13 09:12:00,“변호사보다 더 잘 해결할 수 있다”…고소장 작성 도운 남성의 정체,"소송을 준비하는 의뢰인의 법률 문서 작성을 돕고 돈을 받아 챙긴 사설탐정에게 벌금형이 선고됐다.  부산지법 형사6단독 김정우 판사는 변호사법 위반 혐의로 기소된 사설탐정 A씨(30대)에게 벌금 800만원을 선고했다고 13일 밝혔다.  디지털포렌식 업체를 운영하는 A씨는 2022년 5월 의뢰인에게 “우리 업체에서 민·형사 사건을 수임하고 있고, 변호사보다 더 잘 해결할 수 있다”고 말하며 440만원에 탐정 계약을 맺었다.  변호사가 아니면 법률 상담이나 관련 문서를 작성할 수 없다. 그러나 A씨는 부하 직원을 시켜 의뢰인이 낼 답변서와 사실 확인서, 탄원서, 형사사건 고소장을 쓰게 했다.  A씨는 같은 해 4월 또 다른 의뢰인에게 “민사소송과 관련해 증거 수집, 합의, 재판 등 모든 절차를 도와주겠다”고 제안해 330만원을 받고 문서 3건을 작성한 혐의를 받고 있다.  김 판사는 “피고인은 누범기간 중 이 사건 범행을 저질렀다”면서 “다만 잘못을 뉘우치고 있고 피해를 모두 변제하고 합의했으며 동종 전력이 없다”고 양형 이유를 밝혔다.",https://n.news.naver.com/mnews/article/009/0005605481
2025-12-13 09:01:00,[신단수의 세상읽기] 마지막 당부,"완성이 아닌 과정을 거치는 지구에서의 삶은 부유함과 가난이 판단의 전부가 아니다. 어떤 선택을 하며 살아왔는지에 대한 평가에 있어 높은 점수를 받는 인생과 부끄러운 실패를 확인하는 인생을 만들어낸다.  모두가 주인공인 현실에서 괜한 자책감이나 남의 탓과 변명으로 과거를 되돌리는 것은 참으로 부질없는 회한이다. 이웃을 돌보고 잘 살았다는 뿌듯함에는 칭찬과 박수를, 야박하다는 원망을 듣게 된다면 그 선의의 굳은 다짐에 상처를 남겨준다. 영혼과의 대화는 자랑이 아닌 후회와 아쉬움으로 시작된다.  그들의 당부는 한 목소리로 전해진다. 어떤 순간에도 신이 함께 하며 끊임없는 시험으로 자신과의 약속을 지키라는 엄한 가르침을 실천하지 못한 간절함의 발로가 아닐까.  자신의 불안감의 원인을 찾아 해결하고 마음의 평화를 얻으려면 무슨 방법을 써야할 지 알려달라는 질문에 대한 대답은 대강 이러하다. 시간, 장소에 구애받지 말고 하루에 몇 번이라도 나는 당신을 진정으로 아끼고 사랑합니다, 이 말을 끊임없이 반복하라는 것이다.  그것을 수없이 반복하다 보면 자신도 모르는 사이에 자연스럽게 행동으로 옮겨진다. 무의식이 의식을 지배하는 것이 것이다. 자연스럽게 모든 사람에게 관심과 애정을 몸으로 나타내는 것이다. 그것은 어렵고 골치 아픈 일이 아니다. 대중교통에서 노약자에게 자리를 양보하고 무거운 짐을 대신 들어주는 잠깐의 노고가 바로 아끼고 사랑하는 것이다.  그러나 결과는 엄청나다. 그 기억들이 모든 세포에 기록으로 남아 성장의 발판을 마련하는 것이다. 그것은 또한 미래를 약속 받을 수 있는 기회가 되기도 한다. 하지만 대부분 용두사미로 끝난다. 그들은 그런 사소한 일이 무슨 도움이 될까를 먼저 생각하고 고민하기도 귀찮고 힘들며 주변 눈총이 따가워 포기해 버린다. 말릴 수는 없지만 지극히 안타깝다. 우리라는 의식의 부족함이다.  친구 모친의 갑작스런 부고에 열일을 제쳐놓고 달려가 위로를 나누었다. 잠시 한가한 틈을 이용해 사연을 물었다. 신장이 나빠 투석을 하셨지만 비교적 건강하셨는데 더운 날씨 탓에 혈관이 좁아져 예기치 못하게 돌아가셨다는 것이다. 별다른 고통 없이 임종을 맞이하신 게 그나마 다행이었다고 했다.  그런데 조금은 이상한 일이 있었다고 했다. 돌아가시기 하루 전날 병원으로 장조카가 오랜만에 얼굴을 보였다는 것이다. 어머니는 환자복을 벗으시고 옷을 새로 입으시더니 근처 식당으로 향하셨다. 평소에는 드시지 않던 장어구이를 잔뜩 주문하시면서 조카에게 연신 먹으라고 젓가락을 쥐어주셨다.  고생한 부모에게 잘해라, 형제와의 의를 돈독히 해라, 모든 일을 가족과 상의하고, 어디서나 착하게 살고 필요한 사회 일원이 돼야 한다! 어머니는 아픈 몸에도 불구하고 이런저런 부탁을 남기셨다고 한다. 식사를 마치시고는 밝은 웃음으로 어서 가라고 배웅을 하시면서 쌈짓돈을 꺼내 각자의 이름을 호명하시더니 얼마 안 되지만 나누라며 맞잡은 손에 힘을 주셨다.  아름다운 의지를 가진 거룩하신 어머니였다. 이제 살아있는 후손들이 어머니가 내주신 숙제에 답할 차례이다.  [신단수 김효성 명상가]",https://n.news.naver.com/mnews/article/009/0005605479
2025-12-13 08:53:00,"“사람 쉽게 안변한다”…god 손호영 인성 어떻길래, 멤버들 일제히","그룹 ‘지오디(god)’ 손호영이 과거 요리 경연 프로그램에서 우승한 뒤 상금 1억 원 전액을 기부했던 일화가 공개됐다.  12일 유튜브 채널 ‘채널십오야’에는 “국민그룹 지오디와 몽글몽글 추억여행 | 나영석의 몽글몽글”이라는 제목의 영상이 올라왔다.  완전체로 출연한 god는 나영석 PD와 이야기를 나눴다.  이날 대화 중 ‘마스터셰프 코리아 셀러브리티’에서 손호영이 우승했다는 사실이 언급됐다.  손호영은 “그때 우승 상금이 1억원이었는데 제가 1등했다”고 말했고 나영석PD는 “제세공과금 떼도 꽤 큰 금액이었을 텐데”라고 놀랐다.  촬영 초반 인터뷰에서 ‘상금 1억원을 받으면 무엇을 하고 싶냐’는 질문을 받았다는 손호영은 “솔직히 1등은 전혀 생각하지 않았기 때문에 그냥 ‘전액 기부하겠다’고 적었다”고 회상했다.  하지만 손호영은 우승을 차지했고 약속대로 상금은 모두 기부하게 됐다. 박준형은 “그게 호영이다. 왜 웃기냐면 이런 상황이 와도 그냥 받아들인다”고 말했다.  나PD는 “호영씨 인생은 늘 이런 식이었냐‘고 묻자 멤버들은 일제히 고개를 끄덕였다.  그는 이어 “그때 우승 상품이 신형 양문형 은색 냉장고였다”며 “결승에서 함께 경쟁했던 페이가 그 냉장고를 부모님께 꼭 드리고 싶다고 하더라”고 말했다. 결국 상금에 이어 우승 상품까지 양보하게 됐다는 것.  다행히 제작진의 배려로 냉장고를 하나 더 받게 됐고, 이를 전해 들은 멤버들은 “정말 다행이다”며 박수를 보냈다. 나영석 PD는 “이런 성격이면 살면서 손해를 많이 봤겠다”고 말했고, 멤버들 역시 “너무 많이 봤다”며 안타까워했다.  그러자 손호영은 “손해를 보더라도 그렇게 해야 마음이 편하다”고 말했다. 이에 멤버들은 “사람은 쉽게 안 변한다”며 고개를 끄덕였다.",https://n.news.naver.com/mnews/article/009/0005605478
