날짜,제목,본문,링크
2025-12-03 17:34:00,해외파견 걱정 '뚝'…집·차 알아봐 드려요,"한만주 소프트랜더스 대표 자녀 다닐 학교 찾기부터 각종 비용 처리까지 대행 이주·정착 원스톱 서비스 기업도 직원도 만족도 높아 가스공사·KT 등 재구매 '쑥' ""한국의 페이팔로 키울 것""    어느 날 회사가 서울 본사 직원을 남미에 파견하기로 했다. 파견을 나갈 직원 앞에는 당장 해결할 현안들이 생긴다. 체류 비자 발급·항공권 예약 등 출국에 필요한 절차를 밟는 것은 물론이고 현지 주택과 차량 구매, 자녀가 다닐 학교를 찾는 일까지 단기간에 처리할 일들이 산더미다. 회사 역시 번거롭기는 마찬가지다. 직원이 해외에서 적응하기 위해 결제한 비용을 건별로 국내에서 정산해야 해 다량의 경비 처리 업무가 발생한다.  리로케이션(해외주재) 결제 편의 서비스 플랫폼을 표방하는 소프트랜더스는 이 같은 해외주재원과 기업 양편의 고충에 착안해 2019년 설립됐다. 현지 정보가 적은 해외주재원에게 현지 이주·정착 서비스를 한곳에서 제공하고, 기업은 서비스 이용 비용을 한번에 후불 결제하게 해 정산의 번거로움을 덜어주는 구조다.  경기 판교 본사에서 만난 한만주 대표는 ""해외주재원은 기업의 시급한 필요에 의해 파견하는 경우가 많기 때문에 현지 정착 기간이 짧을수록 업무 경쟁력이 높아진다""며 ""한국을 넘어 해외 시장을 겨냥하는 기업들이 늘어날수록 리로케이션 서비스에 대한 수요는 커질 수밖에 없다""고 자신했다.  기업이 해외주재원을 파견할 때 기존에는 서비스 견적 비교·선정, 계약·송금, 영수증 수집, 규정 확인, 정산 및 회계 코드 입력 등 모든 단계가 담당자의 손을 거쳤다. 파견 국가나 인원이 늘어날수록 실수나 지연·세무 문제가 생길 가능성이 높아졌다.  한 대표는 시스템에 기반한 파견 제도를 운영하는 구조가 필요하다고 분석했다. 소프트랜더스는 기업 내부의 파견 규정과 보상·한도·승인 체계를 데이터 모델로 옮겨 시스템을 만들고 결제 과정을 단순화했다. 이 경우 본사나 인사팀은 주재원이 결제한 모든 항목을 건별로 결제할 필요 없이 일괄 인보이스만 확인하면 된다. 반복 업무량이 80~90%가량 줄어들고 처리 속도도 기존 대비 70~80% 정도 빨라진다. 그 덕분에 한국가스공사와 KT, 한국우주항공산업 등 기업 고객의 재구매율이 80%를 넘는다.  기업이 직접 개인에게 모든 비용을 정산할 때보다 회계가 투명해지는 것도 회사에는 이득이다. 현지에서 주재원 정착 서비스를 제공하는 업체들도 개별 기업과 정산하는 것보다 소프트랜더스를 통하면 처리 속도를 높일 수 있다. 소프트랜더스가 50개국 500개 이상의 서비스 공급자 네트워크를 갖추게 된 것도 이런 이유에서다.  소프트랜더스 매출은 결제 편의 수수료와 이사·픽업·비자 처리 등 공급자로부터 받는 선정산 수수료, 서비스 중개 수수료 등에서 주로 발생한다. 기업 대상 구독 모델 출시도 준비 중이다. 기업 간 거래(B2B) 서비스를 통해 쌓은 데이터를 활용해 기업에 인사·보상 컨설팅도 진행한다는 계획이다. 한 대표는 ""기업이 주재원을 파견할 때에는 어느 정도로 대우해야 하는지 정보가 필요한데, 정보를 필요로 하는 기업에 업계 평균 대우나 보상 시스템 등을 컨설팅하는 업무로 확장할 것""이라고 밝혔다.  그는 해외 주재원에 대한 정보가 부족하던 11년 전 '해외주재원 A to Z'라는 책을 썼을 만큼 주재원 사업에 열정적이다. 소프트랜더스의 다음 목표는 해외주재원이나 출장자가 가장 편하게 쓸 수 있는 기업 해외 결제 시장의 '페이팔'이 되는 것이다. 그는 ""쉽고 편한 결제가 가능한 소프트랜더스는 글로벌 인사관리 플랫폼 등에 결제를 도와주는 플러그인 서비스로 기능할 수 있다""며 기대감을 보였다.  [이유진 기자 / 사진 김재훈 기자]",https://n.news.naver.com/mnews/article/009/0005600401
2025-12-03 17:28:00,"야놀자, 클라우드·놀유니버스·홀딩스 대표 동시 교체","야놀자가 클라우드와 플랫폼, 투자를 담당하는 주요 계열사 3곳의 대표를 전격 교체했다.  3일 야놀자는 야놀자클라우드를 담당하는 엔터프라이즈 솔루션 부문 대표에 이준영 최고기술책임자(CTO), 여행 플랫폼 놀유니버스를 운영하는 컨슈머 플랫폼 부문 대표에 이철웅 최고마케팅책임자(CMO), 야놀자홀딩스를 이끌 코퍼레이션 부문 대표에 최찬석 최고투자책임자(CIO)를 각각 선임했다고 밝혔다.  이준영 엔터프라이즈 솔루션 부문 대표는 2022년 야놀자에 합류해 연구개발(R&D) 조직을 이끌어 왔다. 이철웅 컨슈머 플랫폼 부문 대표는 아고다·클룩·쿠팡트래블 등 여러 플랫폼을 거친 여행 마케팅·사업 전략 전문가다. 2022년부터 야놀자 CMO를 맡아 인터파크트리플과의 합병 이후 놀유니버스 리브랜딩을 이끌었다.  최찬석 코퍼레이션 부문 대표는 2021년부터 야놀자 CIO, 야놀자클라우드 최고재무책임자(CFO)를 맡아 투자를 총괄해 왔다. 최 대표는 합류 이후 2021년 소프트뱅크 비전펀드로부터 17억달러(약 2조3000억원) 규모 투자 유치했고, 인터파크와 고글로벌트래블 등 기업 인수를 주도했다.  한편 컨슈머 플랫폼 부문을 총괄해온 배보찬 전 대표와 엔터프라이즈 솔루션·코퍼레이트 부문을 맡아온 김종윤 전 대표는 고문으로 활동을 이어가게 된다.  야놀자 관계자는 “이번 변화는 고객 중심 경영을 강화하고 글로벌 경쟁력 확보를 위한 전략적 조치”라며 “책임경영 체계를 통해 각 사업 부문의 성장 기반을 더욱 공고히 하겠다”고 밝혔다.",https://n.news.naver.com/mnews/article/009/0005600395
2025-12-03 17:28:00,[부음] 최순자씨 별세 외,"▲최순자씨 별세, 유진휘씨(KBS전주방송총국 기자) 모친상=3일 전북대병원, 발인 5일 오전 7시 30분. (063)250-1444  ▲조규환씨(사회복지법인 엔젤스헤이븐 명예회장) 별세, 조성아(은평천사원 원장) 조준호(사회복지법인 엔젤스헤이븐 대표이사) 조경아(은평대영학교 교장) 조준형씨(갈현청소년센터 운영팀장) 부친상, 강태길씨(은평보호작업장 원장) 장인상=2일 연세대 세브란스병원, 발인 5일. (02)2227-7500  ▲허숙조씨(전 강남보건소장) 별세, 김후명씨(미국 국립기상연구소 선임연구원) 모친상=2일 삼성서울병원, 발인 4일 낮 12시 30분. (02)3410-3151  ▲강재학씨 별세, 심순자씨 배우자상, 강정원(청주상당경찰서 경감) 강정윤(정수유통 과장) 강경미 강은경씨(청주 용성중 교사) 부친상, 남선희(충북도청 팀장) 유진선씨 시부상, 이운재(이강코스메틱 대표) 오윤주씨(한겨레 전국부 선임기자) 장인상=2일 청주성모병원, 발인 4일 오전 6시 20분. (043)210-5444",https://n.news.naver.com/mnews/article/009/0005600394
2025-12-03 17:28:00,[인사] 공정거래위원회 / 폴리뉴스,■공정거래위원회 ◇국장급 전보 △경쟁정책국장 선중규(4일자) △서울지방공정거래사무소장 박세민(7일자)  ■폴리뉴스 △경제산업 2부장 이수진 △〃 3부장 박수남,https://n.news.naver.com/mnews/article/009/0005600393
2025-12-03 17:28:00,[포토] 매경 동우의 밤,,https://n.news.naver.com/mnews/article/009/0005600392
2025-12-03 17:28:00,배민 사회공헌 '방학도시락'…대한민국광고대상 특별상,"배달의민족 운영사 우아한형제들의 대표 사회공헌 캠페인 '처음 맛난 날 by.배민방학도시락'이 제32회 대한민국광고대상 '상생창의가치상'을 수상했다.  3일 우아한형제들은 ""배민의 대표적 사회공헌 사업인 배민방학도시락이 10회차를 맞아 어린이날을 기념해 기획한 캠페인이 대한민국광고대상 특별상인 상생창의가치상을 받았다""고 밝혔다.  한국광고총연합회가 주관하는 대한민국광고대상은 1994년 시작돼 올해로 32회째를 맞은 국내 최고 권위의 종합광고상 시상식이다.  [김시균 기자]",https://n.news.naver.com/mnews/article/009/0005600391
2025-12-03 17:28:00,"포스코, 상이군경에 로봇 의수·의족 기부","보훈부와 36명에 첨단보조기  포스코1%나눔재단(이사장 장인화 포스코그룹 회장)이 3일 서울 포스코센터에서 국가유공자 및 현직 소방관·군인 등 36명에게 첨단보조기구를 전달했다고 밝혔다. 이날 행사에는 지원 대상자로 선정된 국가유공자를 비롯해 강윤진 국가보훈부 차관, 윤종진 한국보훈복지의료공단 이사장 및 장인화 포스코그룹 회장 등 50여 명이 참석했다.  포스코1%나눔재단의 '국가유공자 첨단보조기구 지원 사업'은 나라를 위해 헌신하다 전상·공상으로 장애를 입은 국가유공자 또는 현직 소방관·군인에게 맞춤형 첨단보조기구를 지급해 사회 복귀와 실질적인 자립을 지원하는 프로그램이다. 6·25전쟁 70주년을 맞은 2020년부터 시작해 올해까지 총 219명에게 로봇 의수·의족, 다기능 휠체어 등을 전달했다. 2013년 설립된 포스코1%나눔재단은 포스코그룹 임직원 총 3만8000명의 기부금에 그만큼의 회사 기부금을 더해 운영되는 비영리 공익법인이다.  장인화 회장은 ""국가유공자 등 우리 시대의 영웅들에게 감사와 존경의 의미를 담은 작은 보답을 할 수 있어 영광으로 생각한다""고 말했다.  [정지성 기자]",https://n.news.naver.com/mnews/article/009/0005600390
2025-12-03 17:28:00,12회 동아 건축 인테리어 박람회,"동아전람이 주최하는 '제12회 동아 건축 인테리어 박람회'가 4일부터 7일까지 서울 강서구에 위치한 코엑스마곡 컨벤션센터에서 열린다. 건축 산업의 현주소와 미래, 전반적인 흐름을 한자리에서 볼 수 있을 것으로 예상된다.  이번 박람회에선 관련 산업 종사자들 간 교류는 물론 주택 건축 및 인테리어를 준비하고 있는 일반 관람객에게도 다양한 콘텐츠를 선보일 예정이다. 관람 시간은 오전 10시부터 오후 6시까지이며, 동아전람 홈페이지에 사전 등록 시 무료 관람 초청장을 문자로 받을 수 있다.",https://n.news.naver.com/mnews/article/009/0005600389
2025-12-03 17:28:00,재외동포청·한국경영학회…한상 네트워크 강화 '맞손',"재외동포청이 3일 인천 송도 재외동포청에서 한국경영학회와 업무협약(MOU)을 체결했다. 협약에는 △한상 네트워크 확대를 위한 연구·자문·상호 정보 공유 △동포 경제인 네트워크를 활용한 한국 기업의 해외 진출 방안 △한상과 국내 기업 간 연계·협력 방안 모색 등이 담겼다.  김경협 재외동포청장은 ""한국경영학회와 업무협약을 통해 전 세계 동포 경제인들의 네트워크 강화는 물론 동포 기업과 국내 기업을 연결해 국내 경제 활성화를 위한 방안을 마련해나갈 예정""이라고 밝혔다. 양희동 한국경영학회장은 ""한상 네트워크에 대한 기여를 확대하겠다""며 ""학회와 동포청이 실질적인 성과를 낼 수 있도록 노력하겠다""고 말했다.  한편 제24차 세계한상대회는 내년 10월 인천에서 열린다. 한상대회를 인천에서 개최하는 것은 2009년, 2018년에 이어 2026년이 세 번째다. 인천은 2025~2026년을 재외동포 방문의 해로 선정하고 재외동포 방문을 적극 추진하고 있다.  [정승환 재계전문기자]",https://n.news.naver.com/mnews/article/009/0005600388
2025-12-03 17:28:00,본지 김정석기자 기업거버넌스賞,한국기업거버넌스포럼이 제4회 한국기업거버넌스대상 언론인 부문 수상자로 김정석 매일경제 기자와 김학성 연합인포맥스 기자를 선정했다고 3일 밝혔다. 대상은 더불어민주당 코스피5000특별위원회가 수상했다.,https://n.news.naver.com/mnews/article/009/0005600387
2025-12-03 17:28:00,판사·변호사도 당하는 사회…'사기와의 전쟁' 필요합니다,"에세이 '사람을 얼마나 믿어도 되는가' 펴낸 정재민 변호사 23년간 판사·법무부 등 근무 부모님 의료사기 당했던 사건 소설로 써내 문학상 받고 등단 그럼에도 사는듯 살기 위해선 서로간 믿음 저버리지 않아야 인공지능도 신뢰는 대체 못해    ""사기 사건 수사 단계에서 피의자를 맡으면 성공률 90%예요. 반면 피해자를 대리하면 엄청 힘들죠. 내 자식이 살아야 할 사회가 이래도 될까요?""  신뢰가 사라진 사회에서 신뢰를 외치는 변호사가 있다. 23년 동안 판사, 중앙부처 등 공직에 있다가 지난해 서울 서초동에 사무실을 낸 정재민 법무법인 예문정 대표변호사(48·사법연수원 32기)다. 판사 시절 소설가로 등단한 특이 이력이 있는 그의 시선은 '법률 기술자'의 그것을 뛰어넘어 사회를 향한다. 최근 출간한 에세이집 '사람을 얼마나 믿어도 되는가'(페이지2북스 펴냄)에서 법률 지식을 곁들인 재치 있는 문체로 여전히 우리가 서로를 믿어야 할 이유를 설파했다.  사실 책엔 사람을 정말 믿어도 되는가 싶은 일화가 수두룩하다. 사기꾼의 마수는 판사건 변호사건 상대를 가리지 않는다. 정말 억울한 사람을 도와야 한다는 소신을 지키는 그에게조차 믿음은 종종 배신을 안겨준다. 개업 후 사건 수임료를 제대로 받지 못하기도, 노트북 수리 업체에 사기를 당하기도 했던 일화를 풀어냈다.  애초에 등단작 '보헤미안 랩소디'(2014년 제10회 세계문학상 수상)는 사기꾼 의사에게 당한 자전적 이야기를 소재로 삼았다. 그의 부모님에게 류머티즘 관절염을 허위 진단하고 독한 항암제를 7년이나 처방해 복용하게 만들었는데도 사기 무혐의 처분이 내려진 답답한 사건이다.  이런 일을 겪고도 정 변호사는 ""믿어서 불편한 점도 있지만 좋은 것도 있지 않느냐""고 반문한다. ""사람을 믿지 않으면 결국 자신도 고립돼요. 교역이 많은 국가가 번영하는 것처럼 타인과 좋은 관계를 더 맺는 것이 삶을 더 풍요롭게 만들어요. 그게 사람 사는 듯이 사는 거죠.""  물론 '사기공화국' 대한민국에 신뢰의 기틀을 다시 세우는 일은 필요하다. 지난 10년간 국내 사기 범죄는 24만건에서 42만건으로 80% 증가했다. 사기가 절도를 넘어 1등 범죄다. 믿었던 사람의 배신에 더해 비대면 온라인 거래가 늘면서 건수가 폭증했다. 정 변호사는 ""사람을 속이는 것에 대해 죄책감을 느끼지 못하는 사람들, 관계를 맺을 때 신뢰의 중요성을 의식하지 못하는 사람이 많아진 것 같다""고 했다.  검거율은 낮다. 사기는 절도·폭행·강도 같은 강력범죄에 비해 말의 맥락에서 범죄 의도를 입증해야 하니 수사가 까다롭긴 하단다.  무엇보다 그 기저에는 '경찰의 소극적인 태도'가 깔려 있다고 그는 본다. 사기와의 전쟁을 선포하고 확 달려들어도 잡기 어려운 게 사기꾼인데 경험 많은 베테랑은 수사 보직을 원치 않고, 초짜 형사들은 증거를 찾긴커녕 '찾아오라'는 태도라는 것이다. 정 변호사는 ""혐의를 입증해 송치한다고 성과를 인정해주던 상벌 체계가 사라졌다고 한다""며 ""요즘은 범인 못 잡는 것보다 괜히 생사람 잡았다가 소송당하는 걸 두려워하는 분위기""라고 꼬집었다.  경북 포항에서 태어나 서울대 법대를 졸업한 그는 공직생활의 절반은 판사로, 나머지 절반은 법무부 등 중앙부처 공무원으로 지냈다. 남들이 선망하는 안정적 직장을 두 번이나 박차고 나온 셈이다. '사는 듯 사는 삶'을 위해서였다. 그는 ""큰 조직의 비효율이 심한 시대, 작고 스마트하고 기민한 조직이 통하는 시대""라고 말했다. 많은 로펌이 그렇듯 변호사 한 사람당 100여 건씩 사건을 맡는 구조에선 의뢰인 목소리를 직접 듣기도 어렵기에, 스스로 모든 절차를 챙길 수 있게끔 소수의 사건만 맡아 '고객 인생의 셰르파'가 되겠다는 다짐이다.  그런 삶의 지향에서 신뢰가 싹튼다고도 믿는다. 사무실의 가장 큰 안쪽 창가 방을 상담실로 정하고 빨간 벽돌에 은은한 조명과 소파, 편안한 음악이 흐르도록 꾸민 건 의뢰인이 심란한 마음을 잠시나마 편안하게 털어놓길 바라서, 이 공간에서 서로의 관계가 시작되길 바라서다.  정 변호사는 이 지점에서 인공지능(AI)이 변호사의 역할을 완전히 대체할 수 없으리라 본다. 그는 ""AI로부터 법률적·심리적 조언은 받을 수 있지만, 완전히 믿을 수 있느냐는 다른 문제""라고 짚었다. ""의뢰인은 제 경력, 삶의 태도를 보고 '이 사람이 허투루 살지 않았다'는 데서 신뢰를 얻죠. 변호사가 필요할 정도의 법률 문제는 인생의 가장 어려운 시기 중 하나잖아요. 그때 의지해야 할 사람은 '무죄 받아주겠다'고 허풍 치는 변호사가 아닌, '사람 사는 듯 사는' 변호사입니다.""  [정주원 기자 / 사진 한주형 기자]",https://n.news.naver.com/mnews/article/009/0005600386
2025-12-03 17:28:00,[매경춘추] 동물 애착 과잉 시대,"미하일 불가코프는 20세기 러시아문학을 대표하는 거장이자 극작가로, 체제와 권력에 순응하지 않고 풍자와 진보적 시각을 통해 인간과 사회의 본질을 집요하게 탐구한 인물이다. 그의 마지막 장편인 '거장과 마르가리타'는 신화·종교·정치·철학이 교차하는 걸작으로 평가받는데, 그 안에는 거장이 집필한 소설 속 이야기로 본디오 빌라도와 예슈아(예수)가 등장한다. 작품에서 빌라도는 예슈아를 심문하며, 사람들보다 자신의 애완견 '방가'에게서 더욱 큰 위안과 편안함을 느껴왔다고 고백한다. 이에 예슈아는 빌라도에게 조용히 ""사람을 사랑해야 한다""고 타이르며, 누구도 사랑하지 않는 사람은 결국 가장 슬픈 인간이라고 말한다. 예슈아는 충직함과 따뜻함을 동물에게서만 찾는 것에 머물러서는 안되며, 인간 전체로 확장된 사랑과 자비가 삶의 가장 중요한 가치임을 강조한다. 이 장면은 요즘 한국 사회의 현상, 즉 지나치게 반려동물에게 집중되는 애착을 돌아보게 하는 대목이기도 하다. 동물은 인간에게 위로와 웃음을 주고, 때로는 삶의 방향을 가르쳐주는 존재가 된다. 그래서 우스갯소리로 '개인지도'라는 말도 생겼다. 그러나 반려동물에 대한 애정이 인간에 대한 관심을 대체하는 수준에 이르렀다면, 그것은 사회적으로 고민해야 할 문제다.  최근 한국의 출산율은 0.72명에 불과해 세계 최저 수준이며, 많은 지역에서 인구 소멸 위험이 현실화되고 있다. 원인이 단일하지 않지만, 일부에서는 결혼과 출산을 대신해 반려동물에게 가족의 역할을 부여하는 현상이 심화되고 있다. 반려동물을 위한 약혼식장·장례식장·호텔까지 성황을 이루고, 강아지를 '우리 아기'라 부르며 사람 이상의 관심과 자원을 쏟는 모습도 흔하다. 물론 동물에 대한 사랑은 존중받아야 하지만, 인간관계의 약화와 공동체의 붕괴로 이어진다면 사회 전체가 짚고 넘어가야 한다.  영국 동물학자 리치 박사의 유명한 사례도 시사점을 준다. 알래스카의 야생곰 사육사가 갑작스럽게 곰의 공격으로 사망한 사건을 조사한 리치 박사는 사람과 동물의 관계를 의인화하거나, 반대로 동물이 인간을 자신의 하위 존재로 인식하는 '의동물화'가 위험을 부른다고 설명했다. 곰은 사육사를 사랑해서가 아니라 자신의 질서 안에서 하위 개체로 오해했기 때문에 공격했다는 것이다. 이는 동물을 사랑하더라도 지켜야 할 경계와 질서가 존재함을 보여주는 사례다.  이 원리는 인간 사회에도 그대로 적용된다. 오늘날 민주주의는 수평적 구조를 지향하며 평등을 중시하지만, 그렇다고 모든 관계에서 권위와 책임을 부정할 수는 없다. 가정·학교·조직·국가가 건강하게 유지되기 위해서는 수평성과 수직성, 자유와 책임, 평등과 질서가 균형을 이뤄야 한다. 일방적 평등만을 강조하거나, 혹은 권위만을 절대화하는 사회는 결국 균열을 피하기 어렵다.  불가코프의 예슈아가 빌라도에게 남긴 말, ""사람을 사랑해야 한다""는 메시지는 오늘 우리에게도 깊은 울림을 준다. 인간이 동물에게 품는 애정은 소중하지만, 그보다 더 중요한 것은 사람과 사람 사이의 관계를 돌보고 공동체를 유지하는 힘을 키우는 일이다. 사랑은 동물에서 멈추는 것이 아니라 인간에게로 확장될 때 비로소 사회를 지속시키는 힘이 된다.  [라종억 통일문화연구원 이사장]",https://n.news.naver.com/mnews/article/009/0005600385
2025-12-03 17:28:00,김명수 대표 벤처기업協 공로상,"김명수 매경AX 대표가 벤처기업협회(회장 송병준) 공로상을 수상했다. 벤처기업협회는 지난 2일 '대한민국 벤처 30주년 기념식'을 열고 벤처 생태계 발전에 기여한 인물과 단체 등 총 8개 분야, 153명의 공로상 수상자를 선정·발표해 시상했다. 이날 김 대표는 대한민국 벤처 태동기부터 벤처 분야를 취재하며 벤처기업·정책을 국민에게 알리고 산업 저변 확산에 기여해 혁신 생태계 발전에 크게 공헌한 공로를 인정받아 공로상을 수상했다.",https://n.news.naver.com/mnews/article/009/0005600384
2025-12-03 17:28:00,"""이웃사랑 실천"" 40억 기부한 GS그룹","20년간 누적 성금 800억원  GS그룹이 연말 이웃사랑 성금 40억원을 사회복지공동모금회에 기탁했다고 3일 밝혔다. GS는 사회 취약계층을 돕기 위해 사회복지공동모금회에 2005년부터 연말 이웃사랑 성금을 기탁해왔으며, 올해까지 기탁한 성금은 총 800억원에 달한다. 이날 전달된 성금은 경제적으로 더 어렵고 소외된 이웃들을 위해 활용될 예정이다.  GS 관계자는 ""연말을 맞아 어려운 분들을 위한 이웃사랑을 나눔으로 실천하는 데 GS가 함께 노력하겠다""고 밝혔다. GS는 이번 성금 기탁과는 별도로 계열사별로 임직원 자원봉사 및 다양한 사회공헌 프로그램을 통해 이웃사랑 실천에 적극 나서고 있다.  허태수 GS 회장은 평소 ""우리 사회가 더욱 따뜻하고 행복해질 수 있도록 사회 전체의 관심과 참여가 필요하며 기업들도 나눔을 통한 사회적 역할에 솔선수범해야 한다""고 기업의 사회적 책임을 강조해왔다.  [이동인 기자]",https://n.news.naver.com/mnews/article/009/0005600382
2025-12-03 17:27:00,“도움이 될 수 있어 오히려 감사”…20년째 이웃사랑 실천 ‘7인 기부천사’ 훈훈,"경남 거창군에서 7명의 익명 기부천사가 20년째 이웃사랑을 실천하며 적막한 사회에 훈훈한 온기를 전하고 있다.  3일 거창군에 따르면 가조면에 거주하는 익명 주민 7명은 이날 쌀 20㎏들이 60포, 라면 100상자, 상품권 200만원 등 총 900만원 상당을 기부했다.  이들이 매년 연말 쌀, 라면 등 생필품과 기부금을 전달해온 것은 올해로 20년째에 달한다.  ‘7인의 기부천사’는 “어려운 이웃에게 조금이나마 도움이 될 수 있어 오히려 감사하다”며 “앞으로도 꾸준히 나눔을 이어가 따뜻한 지역을 만드는 데 힘을 보태고 싶다”는 소감을 남긴 것으로 전해졌다.  거창군은 기부물품들을 도움이 필요한 이웃들에게 빠르게 전달할 계획이다.",https://n.news.naver.com/mnews/article/009/0005600381
