날짜,제목,본문,링크
2025-12-12 12:03:00,"[사례] 해외자산 은닉, 명의 돌려막기…고액 체납 천태만상","국세청이 2억 원 이상 세금을 내지 않은 고액·상습체납자 명단을 공개했다. 올해 공개된 체납자는 총 1만101명으로 체납액은 7조371억 원에 달한다.  국세청은 12일 국세청 누리집(www.nts.go.kr)을 통해 고액·상습체납자의 인적사항을 공개했다. 공개 대상은 지난해 12월31일 기준으로 1년 이상 납부하지 않은 국세 체납액이 2억 원 이상인 개인과 법인이다.  공개 항목은 성명, 상호(법인명), 나이, 직업, 주소, 체납 세목, 납부기한 및 체납 요지다. 법인인 경우 대표자 정보도 포함된다. 올해 신규 공개 대상자는 개인 6848명(4조661억 원), 법인 4161개 업체(2조9710억 원)로 집계됐다.  다음은 국세청에 적발된 고액·상습체납자 사례.  <고액·상습체납자 신규 명단공개 주요 사례> ■ 사례1 해외 부동산 상속 누락 후 양도소득세 미신고   체납자 甲은 피상속인인 배우자의 국외 부동산을 상속재산에 포함하지 않아 상속세를 과소 신고했다. 이후 본인이 보유한 국외 부동산을 양도하고도 양도소득세를 신고하지 않았다. 이로 인해 부과된 상속세와 양도소득세를 납부하지 않아 총 □□억원의 세금을 체납했다.  국세청은 체납자가 보유한 국내 부동산(00억 원)을 압류해 공매를 의뢰했다. 아울러 국외 재산 보유 등 출국금지 요건에 해당한다고 판단해 출국금지 조치를 내리고 재산추적조사 대상으로 선정해 실제 거주지에 대한 현장 수색을 실시했다. 결국, 명단공개 요건을 충족해 2025년 고액·상습체납자로 명단을 공개했다.  ■ 사례2 차명 보유 전환사채 주식 전환으로 막대한 차익얻고도 세금 체납   체납자 乙은 개인투자조합 명의로 전환사채(CB)를 차명 취득한 뒤 주가 급등 시점에 이를 주식으로 전환해 양도했다. 이 과정에서 발생한 주식 전환이익과 양도소득에 대해 실소유자인 체납자에게 증여세와 양도소득세가 부과됐으나 이를 납부하지 않았다.  그 결과 체납 세액은 총 □□□억 원에 달했다. 이에 국세청은 체납자가 급여를 배우자 계좌로 이체해 재산을 은닉한 사실을 확인하고 배우자를 상대로 사해행위취소소송을 제기했다. 동시에 배우자 명의의 아파트에 대해 가압류 조치를 취했다. 또 체납자의 실거주지를 수색해 고급 주류 24점을 압류했다.  국세청은 현재 주식 양도대금의 사용처를 추적하는 한편 특수관계인의 재산 취득 자금과의 연관성 여부에 대해 조사를 이어가고 있다.  ■ 사례3 비사업용 토지 양도 후 법인세 신고만하고 납부하지 않은 부동산개발 체납법인   부동산개발업을 영위하는 체납법인 A는 비사업용 토지를 양도해 양도차익을 얻고도 법인세를 신고한 뒤 이를 납부하지 않았다. 이로 인해 법인세 등 총 □□억원의 세금을 체납했다.  국세청은 A법인이 부동산 양도대금을 수령한 직후 관계회사에 자금을 지급한 사실을 확인해 실사업장을 수색해 장부를 확보했다. 그 결과, 해당 자금은 관계회사에 대한 대여금으로 확인됐다.  이에 국세청은 관계회사에 대한 대여금 채권을 압류하고 추심을 최고했으나 응하지 않자 추심금 청구소송을 제기해 승소했다. 결국 체납법인 A는 명단공개 요건에 해당해 2025년 고액·상습체납자로 명단이 공개됐다.  국세청은 승소한 추심금 청구소송에 대한 강제집행을 신속히 진행하면서 대표 丙이 운영하는 다른 법인의 자금 흐름에 대해서도 추적 조사를 이어가고 있다.  <고액·상습체납자 감치 의결 사례> ■ 사례1 체납 발생 예상하고 부동산을 배우자에게 증여해 세금 회피  체납자는 예식장업을 영위하던 사업자로 현금매출을 과소 신고했다. 국세청의 소명 안내에 따라 부가가치세와 종합소득세를 수정 신고했으나 이를 납부하지 않아 총 □□억원의 세금을 체납했다.  체납자는 체납 발생을 예상하고 보유하던 토지를 배우자에게 증여했고, 심지어 해당 토지에 건축 중이던 건물의 건축주 명의도 배우자 명의로 변경했다. 이후 장기간 운영하던 예식장을 폐업하고 배우자 명의로 건물을 완공해 예식장업을 계속 운영했으며 매출액은 지속적으로 증가하고 있는 것으로 확인됐다.  결국 국세청은 배우자를 상대로 사해행위취소 소송을 제기하고 체납자와 배우자를 체납처분 면탈범 및 방조범으로 고발했다.  ■ 사례2 고가 아파트에서 호화생활하며 타인 명의 계좌로 수익금 받다 덜미  체납자는 부동산을 양도한 뒤 양도소득세를 신고하지 않고 납부도 하지 않아 □□억원의 세금을 체납했다.  심지어 특수관계법인 명의로 임차한 고급주택에 거주하며 고가 외제차를 리스해 이용하는 등 호화생활을 이어왔다. 별다른 소득이 없는 자녀 명의로 외국 갤러리에서 수억원 상당의 그림 등을 구입한 사실도 확인됐다. 이와 함께 수입금액을 자녀 또는 특수관계법인 명의 계좌로 수령해 소득을 은닉했다.  결국 국세청은 체납자의 실거주지를 수색해 미술품과 조형물 12점, 명품 핸드백 18점 등을 압류했다.  ■ 사례3 주식을 타인에게 명의신탁하고 배우자 계좌로 거액받아 자금 은닉  체납자는 부동산운영관리업을 영위하던 법인의 대표이사로 재직하며 법인자금 유출에 따른 종합소득세를 신고하지 않고 납부도 하지 않아 □□억원의 세금을 체납했다.  체납자는 비상장주식을 타인에게 명의신탁한 뒤 별다른 소득이 없는 배우자 명의의 계좌를 통해 수십억원의 자금이 입·출금되도록 했다. 이 중 일부는 생활자금으로 사용된 것으로 확인됐다. 또한 배우자 명의로 서울 강남 소재 고가 아파트를 임차해 거주했다.  결국, 국세청은 체납자의 예금채권과 비상장주식 등을 압류했다.  ■ 사례4 배우자 명의로 주택을 취득하고 비상장주식 주권 숨겨 강제징수 회피  체납자는 가상자산거래소를 운영하는 법인의 대표이사로 재직하며 해당 법인의 주식을 양도했다. 이후 양도소득세를 신고했으나 이를 납부하지 않아 □□억원의 세금을 체납했다.  체납자는 대표이사로 근무 중인 법인에서 고액의 급여가 발생했음에도 불구하고 급여채권 압류와 추심 요청에 응하지 않았다. 심지어 국세청의 조사 과정에서 체납자는 잔여 보유 주식을 인도하겠다고 약속했으나 실제로는 비상장법인의 주권 보관 장소를 은폐해 강제징수를 회피한 사실이 확인됐다.  또 별다른 소득이 없는 배우자 명의로 주택을 취득하고 고급 자동차를 다수 보유하는 등 사치 생활을 이어온 것으로 나타났다.  결국 국세청은 체납자의 급여채권을 압류하고 고급 자동차 3대를 압류했다.  ■ 사례5 처제 명의로 사업 운영하고 배우자 급여로 소득돌려 세금 회피  체납자는 타인 명의로 고철업을 운영한 사실이 세무조사 과정에서 드러났다. 이에 따라 본인에게 부과된 부가가치세 등을 납부하지 않아 □□억원의 세금을 체납했다.  체납자는 개인 고철업을 폐업한 뒤 처제 명의로 고철업 법인을 설립해 실질적으로 운영했다. 또 배우자 명의로 고액의 급여를 수령했고 배우자 명의의 고가 주택에서 거주하면서 자녀 명의의 고가 자동차를 운행하는 등 호화로운 생활을 이어왔다.  결국 국세청은 체납자의 주거지를 수색해 동산과 보험금채권을 압류했다.  ■ 사례6 특수관계법인 명의 고가 아파트에 거주하며 호화 사치생활 누려  체납자는 건설업을 영위하던 법인의 대표이사로 재직하며 법인자금 유출에 따른 종합소득세를 납부하지 않아 □억원의 세금을 체납했다.  심지어 특수관계법인 명의로 임차한 고가 주택에 거주하면서 해외 출입국이 잦았다. 여기에 자녀 중 한 명은 해외에 장기 체류 중인 것으로 확인됐다.  조사 결과 가족 전체의 신고 소득에 비해 몇 배에 달하는 소비 지출을 하며 호화 사치 생활을 이어온 점도 드러났다. 또 다른 자녀는 최근 지방 대도시의 아파트와 토지를 취득한 사실이 확인됐다.  결국, 국세청은 체납자의 예금채권과 보험금채권을 압류했다.",https://n.news.naver.com/mnews/article/123/0002373708
2025-12-12 12:02:00,"국세청, 거짓영수증 교회·537억 조세포탈 유흥업소 등 공개","22억 원 가량의 거짓기부금영수증을 발행한 교회, 537억 원이 넘는 세액을 포탈한 유흥업소 업주 등 세법상 의무 위반자들의 명단이 공개됐다.  12일 국세청은 불성실 기부금수령단체, 조세포탈범, 해외금융계좌 신고의무 위반자, 세금계산서 발급의무 등 위반자의 인적사항 등을 국세청 누리집을 통해 공개했다. 이번 명단 공개 대상은 국세정보위원회의 심의를 거쳐 확정되었다.  불성실 기부금수령단체는 거짓 기부금영수증을 발급했거나 상속세 및 증여세법에 따른 의무의 불이행으로 세금을 추징당한 단체 등이다.  이번에는 ▲실제 기부금 수령액보다 많은 금액으로 거짓 기부금영수증을 발급한 종교단체 ▲출연자 또는 그의 특수관계인을 임·직원으로 고용해 1000만 원 이상 증여세를 추징당한 단체 등 24개가 공개됐다.   이 중 거짓 기부금영수증을 최다 발급한 단체는 전북 전주시에 위치한 어울림교회(대표 유남규)다. 이 교회는 309회에 걸쳐 22억 4047만 원의 거짓 영수증을 발행했으며, 의무불이행으로 인한 추징세액 최고액은 1억 6504만원에 달한다.  공익사업 유형별로는 종교단체가 16개(67%)이며, 교육단체 3개(13%), 의료법인 2개(8%), 사회복지단체 2개(8%), 예술문화단체 1개(4%) 순이다.  조세포탈범은 사기나 그 밖의 부정한 행위로써 2억 원 이상의 국세를 포탈해 유죄판결이 확정된 자다.  올해는 ▲수십 개의 차명계좌를 이용해 불법 도박 사이트를 운영하고 수입금액을 신고 누락한 자 ▲직원(웨이터) 명의로 여러 유흥주점을 운영하면서 소득을 은닉하기 위해 이중장부를 작성하고 주기적으로 원본 장부를 파기한 실소유주 등 50명이 공개됐다.  이 중 포탈세액이 가장 많은 이는 강범구(52세) 씨다. 강 씨는 유흥업소 아레나를 운영하면서 현금 매출분에 대한 수입금액을 신고 누락하고 장부를 파기하는 방법으로 조세를 포탈한 것으로 드러났다. 포탈세액만 537억원에 이른다. 강 씨에게는 징역 8년과 벌금 544억 원이 확정된 것으로 전해졌다.  공개 대상자 50명의 평균 포탈세액은 40억 원(포탈세액 합계 : 1992억 원)이며, 주로 차명계좌 이용, 이중장부 및 거짓 세금계산서 수취 등으로 조세를 포탈한 것으로 드러났다.  이와 함께 정당한 사유 없이 해외금융계좌를 신고 누락한 4명의 명단도 공개됐다.  해외금융계좌 신고의무 위반자 명단 공개 대상은 신고기한 내에 해외금융계좌를 신고하지 않거나 과소 신고한 금액이 50억 원을 초과하는 자다. 올해 명단 공개 대상자 4명의 평균 신고의무 위반금액은 566억 5700만 원이다.  아울러 명의대여자를 모집해 거짓세금계산서 발급 법인(소위 폭탄업체)을 설립한 후, 실물거래 없이 세금계산서를 발행하고 일정 수수료를 수취한 사업자 등 22명도 세금계산서 발급의무 등 위반자로 공개됐다.  국세청은 ""앞으로도 성실납세 분위기 확산을 위해 세법상 의무 위반자 명단을 지속적으로 공개해 법과 원칙이 바로 선, 공정한 세정을 펼쳐나가겠다""고 전했다.",https://n.news.naver.com/mnews/article/123/0002373707
2025-12-12 12:01:00,"'선박왕' 권혁, 고액 체납 싹쓸이","'선박왕' 권혁 시도그룹 회장(75세)이 새로 공개된 고액·상습체납자 명단에 이름을 다수 올렸다. 1위에 오른 개인 체납액은 4000억원에 달했고, 그가 대표로 있는 3개 회사의 체납액도 총 4300억원을 출쩍 넘기며 법인 체납액 1~3위를 휩쓸었다.  11일 국세청은 국세체납액이 2억원 이상인 고액·상습체납자의 인적사항 등을 국세청 누리집을 통해 공개했다.  이번 명단 공개 대상은 작년 12월 31일 기준으로 1년 이상 납부하지 않은 국세 체납액이 2억원 이상인 고액·상습체납자다. 공개 항목은 체납자의 성명·상호(법인명), 나이, 직업, 주소, 체납액의 세목·납부기한 및 체납 요지다. 체납자가 법인인 경우에는 법인의 대표자를 함께 공개하고 있다.   올해 신규 공개 대상자는 개인 6848명(4조 661억원), 법인 4161개(2조 9710억원)업체이며, 총 체납액은 7조 371억원이다.  개인 최고액 체납자는 선박임대업을 운영하던 권혁 시도그룹 회장이다. 권 회장은 종합소득세 등 4개 세목에서 총 3938억원의 세금을 체납한 것으로 드러났다. 개인 체납자 가운데 쌍방울 김성태 회장은 5개 세목에서 총 165억원을 체납해 10위에 이름을 올렸다.  법인 최고액 체납자는 권 회장의 제2차 납세의무자인 시도탱커홀딩이다. 이 법인은 종합소득세 등 2개 세목에서 총 1537억원을 체납 중이다.  법인 체납액 2위와 3위 역시 권 회장이 대표로 있는 법인이다. 시도홀딩은 종합소득세 등 2개 세목에서 총 1534억원을, 화물여객 운송업체 Cido Car Carrier Service Ltd는 법인세 등 2개 세목에서 1315억원을 각각 체납하고 있는 것으로 드러났다.  신규 공개 인원은 지난해에 비해 1343명 증가했으며, 공개하는 체납액도 8475억원 늘었다.  신규 공개 대상 중 6658명(60.5%)은 수도권(경기·서울·인천)에 거주·소재하고 있으며, 이들의 체납액은 5조 770억원(72.1%)으로 나타났다.  이번에 공개된 고액·상습체납자는 압류·공매 등 강제징수 및 출국금지·체납자료 제공 등 행정제재에도 체납세금을 미납한 체납자다.  국세청은 이들 중 재산은닉 혐의가 높은 체납자에 대해 실거주지 수색, 사해행위취소 소송 제기, 체납처분면탈범 고발 등을 진행하고 있다.  국세청은 국세정보위원회의 심의를 거쳐 고액·상습체납 신규 명단 공개 대상자를 확정했다.  지난 2월 공개 대상자 1만 2165건을 안내해 6개월 동안 납부를 독려하고 소명기회를 부여했다. 분납해 체납액의 50% 이상 납부했거나 2억원 미만이 되어 공개 요건에 미달하는 경우, 공개 대상에서 제외된다.  한편, 국세정보위원회의에서는 고액·상습체납자 6명에 대해 감치 의결도 함께 진행했다.  고액·상습체납자 중 일정요건에 해당하는 악의적 체납자에 대해서는 형벌을 부과하기 전 사전적 제재 차원에서 행정적 제재인 감치 명령을 할 수 있다.  이들은 체납발생 후 1년이 지난 국세가 3건 이상이고, 해당 체납액이 2억원 이상인 자로서 납부능력이 있음에도 불구하고 정당한 사유없이 체납을 한 자들이다.  국세청은 이들에 대해서는 지난 9월에 감치 안내해 소명 기회 및 의견진술 기회를 제공했으며, 체납자의 주소 또는 거소를 관할하는 지방검찰청에 감치를 신청할 예정이라고 전했다.  국세청은 고액·상습체납자의 은닉재산을 찾기 위해 2006년부터 '은닉재산 신고포상금 제도'를 운영하고 있다.  은닉재산을 신고해 체납액을 징수하는데 기여한 신고자에게는 최대 30억 원까지 포상금이 지급된다.  국세청은 ""공개된 고액·상습체납자 명단을 참고해 체납자의 은닉재산을 알고 계신 여러분의 적극적인 신고를 부탁드린다""고 전했다.  아울러 국세청은 고액·상습체납자에 대해서는 압류·공매 등 강제징수를 적극 추진하고, 출국금지·명단공개 등 행정제재도 철저히 집행할 방침이다.  국세청은 ""특히, 재산 은닉 또는 강제징수 회피 혐의가 있는 경우에는 실거주지 수색·소송 제기·면탈범 고발 등 재산추적조사를 더욱 엄정하게 실시해 조세정의를 실현하고 성실납세문화 조성을 위해 지속적으로 노력하겠다""고 전했다.",https://n.news.naver.com/mnews/article/123/0002373706
2025-12-12 11:37:00,"송언석 ""'통일교 게이트' 특검 준비…정동영·이종석 즉각 해임해야""","통일교의 '정교유착 의혹'과 관련해 국민의힘뿐만 아니라 더불어민주당 인사들도 거론된 데 대해서, 국민의힘 송언석 원내대표는 ""국회는 즉시 '통일교 게이트' 특검 도입을 준비해야 한다""고 촉구했다.  송 원내대표는 12일 오전 국회에서 기자간담회를 열고 ""통일교로부터 금품 수수를 받은 전재수 해양수산부 장관이 어제 사의를 표명했다. 이것은 출발점일 뿐""이라며 이같이 말했다.  송 원내대표는 ""현재 통일교가 지원한 인사로는 전재수 장관 외에도 정동영 통일부 장관과 이종석 국정원장, 임종성 전 의원이 주목받고 있다""며 ""이 대통령은 정동영 장관과 이종석 원장을 즉각 해임해야 한다""고 목소리 높였다.  또한 ""민중기 특검이 4개월 가까이 사건을 덮어버린 직무유기로 정치자금법 공소시효가 얼마 남지 않았다""며 ""수사기관은 신속히 수사에 착수해야 한다. 살아있는 권력에 대해 경찰의 수사 의지·역량을 가늠하는 중대한 국면이란 점을 명심하라""고 강조했다.  아울러 ""국회는 경찰 수사와 별도로 새 특검을 준비해야 한다. 민 특검이 지난 8월 확보한 진술을 수사에 착수하지도 않고 경찰에 이첩도 않은 건 위법행위""라며 ""정청래 더불어민주당 대표가 2차 특검·종합 특검을 공언했는데, 여기에 포함해서 특검을 실시하면 매우 좋은 대안이 될 것""이라고도 덧붙였다.  한편, 더불어민주당 측에서는 국민의힘이 주장하는 통일교·민주당 간 유착 의혹과 이에 대한 특검 요구에 대해 ""전형적인 물타기""라고 거리를 뒀다. 박수현 민주당 수석대변인은 이날 최고위원회의 직후 기자들과 만나 ""특검에는 법에 정해진 수사 내용과 범위가 있다. 그것과 연관된 것이라면 특검이 수사했을 것""이라며 이같이 전했다.",https://n.news.naver.com/mnews/article/123/0002373705
2025-12-12 11:28:00,"與, '통일교 의혹 특검' 일축...""전형적인 물타기 정치공세""","더불어민주당은 12일 국민의힘과 개혁신당 등의 '통일교 의혹 특검' 요구를 ""전형적인 특검 흔들기와 물타기에 불과한 정치공세""로 규정하고 일축했다.  박수현 민주당 수석대변인은 이날 오전 당 최고위원회 직후 기자들과 만나 ""(김건희) 특검에는 법에 의해 정해진 수사의 내용과 범위가 있다""며 ""그것과 명확히 연관되는 것이라면 특검이 수사를 했을 것""이라며 이같이 말했다.  또한 ""특검법은 특검 기한 종료 후 특검 내용과 관련 없는 내용은 수사기관에 이첩하도록 돼 있다""면서 특검이 민주당 인사들의 금품 수수 의혹을 인지하고도 무시했다는 '뭉개기' 의혹 역시 선을 그었다.  박 수석대변인은 ""통일교와 관련해 여러 언론에 민주당 인사들과 관련한 명단이 우후죽순 쏟아져 나온다""면서 ""자세히 들여다보면 명확한 근거가 부족해 보인다""라고 주장했다.  그는 ""당 소속 의원과 내부 당원이 관련된 부분이 근거 있게 명확히 제시되면 대통령 말씀대로 지위고하를 막론하고 가차 없이 명확히 처리할 것""이라면서도 ""현재는 수사기관에 신속하고 엄중한 수사를 촉구하고 함께 지켜보겠다는 입장""이라며 특검은 물론 당 윤리감찰단 조사 등에도 거리를 뒀다.  반면 송언석 국민의힘 원내대표는 이날 오전 국회 기자간담회에서 ""이재명 정권과 밀접하게 연루된 통일교 게이트가 더 큰 몸체를 드러내고 있다""며 ""경찰 수사와 별도로 국회는 즉시 통일교 게이트 특검을 준비해야 한다""고 주장했다.  그러면서 ▲정동영 통일부 장관·이종석 국가정보원장 즉각 해임 ▲수사기관의 신속한 수사 착수 ▲통일교 게이트 특검 도입 등을 정부여당에 촉구했다.  이준석 개혁신당 대표도 전날 최고위원회의에서 ""전재수 해양수산부 장관이 스스로 직을 내려놓은 건 의혹이 실재한다는 방증""이라며 ""기득권 양당이 특정 종교단체와 이렇게 깊이 얽혀 있었다는 것은 대한민국 정치사의 부끄러운 민낯""이라며 특검 필요성을 강조했다.  또한 이날 페이스북에는 ""2022년 대선 당시 민주당 측이 통일교를 통해 미국프로농구(NBA) 스타 스테픈 커리 섭외를 시도했다는 정황이 드러났다""며 ""이재명 대통령이 대선 기간 여러 국내외 명사들과 면담했는데, 이들 역시 누군가가 비용을 대고 섭외한 것인지 들여다봐야 한다""고 주장했다.  통일교는 2022년 대선을 앞두고 당시 민주당 대선후보였던 이재명 대통령과 국민의힘 대선후보였던 윤석열 전 대통령 측에 마이크 펜스 전 부통령 등 미국 유력 인사와의 대담을 미끼로 접근한 것으로 알려졌다.",https://n.news.naver.com/mnews/article/123/0002373704
2025-12-12 11:22:00,"매일유업, 락토프리 적용 ‘우유속에’ 3종 리뉴얼","매일유업(대표 김선희, 곽정우, 이인기)이 맛과 기능을 강화하여 '우유속에' 3종을 리뉴얼 출시한다.  이번 리뉴얼△'우유속에 딸기과즙' △'우유속에 코코아' △'커피속에 모카치노'은 우유의 유당을 제거한 '락토프리'로 원재료의 풍미와 우유 본연의 맛을 그대로 살렸다.  300mL 용량의 냉장보관 제품이며 제품 구입은 편의점과 대형마트 등에서 가능하다.",https://n.news.naver.com/mnews/article/123/0002373703
2025-12-12 11:06:00,"아워홈 컨세션, 지역의 맛과 특색 띤 '계절 신메뉴'","아워홈은 겨울을 맞아 전국 주요 컨세션 매장에서 경상도의 특색을 담은 신메뉴 5종을 선보인다고 최근 밝혔다.  아워홈은 올해 컨세션 메뉴 콘셉트를 'Tasty Journey'로 정하고, 계절마다 국내 지역의 맛과 특색을 반영한 신메뉴를 소개한다. 제철 식재료와 지역별 별미를 활용해 전국을 여행하는 미식 경험을 제공한다는 취지다.  신메뉴는 컬리너리스퀘어 IFC몰점과 푸드엠파이어 4개 매장에서 판매되며, 푸드엠파이어 대구동산병원점은 18일 별도 출시된다.  컬리너리스퀘어 IFC몰점에서는 이달 말까지 요일별로 각각 다른 신메뉴 10% 할인 프로모션도 함께 운영한다.",https://n.news.naver.com/mnews/article/123/0002373702
