날짜,제목,본문,링크
2025-12-16 13:31:00,"[공시pick] 오리온, 11월 매출 2990억…베트남 30%↑","오리온이 지난달 연결기준 매출을 2990억원으로 잠정 집계해 16일 공시했다. 한국과 중국, 베트남, 러시아 법인의 가결산 수치를 합산한 결과다.  국가별 11월 매출은 중국 법인이 1129억원으로 전월 대비 1.5%, 전년 동기 대비 6.1% 증가했다. 베트남 법인은 604억원으로 전월 대비 30.5% 늘었고 전년 동기 대비로는 0.5% 증가했다. 러시아 법인은 338억원으로 전년 동기 대비 47.0% 늘어났다. 반면 한국 법인의 매출은 919억원으로 전년 동기 대비 2.0% 감소했다.  11월 국가별 영업이익은 중국 198억원, 베트남 127억원, 러시아 56억원, 한국 156억원으로 집계됐다. 베트남과 러시아는 전월 대비 각각 30.9%, 3.7% 증가한 반면 중국과 한국은 각각 8.8%, 10.0% 줄어들었다.  오리온은 ""중국 위안화와 러시아 루블화 강세 등 환율 효과가 전년 동기 대비 증감률에 영향을 미쳤으며, 11월 한 달 집행한 광고비 13억원이 매출 차감에 포함됐다""고 밝혔다.",https://n.news.naver.com/mnews/article/123/0002373913
2025-12-16 13:19:00,"테슬라, 로보택시 무인시험…주가 1년만에 최고치","테슬라 주가가 로보택시 시험 진전 소식에 힘입어 약 1년 만에 최고치를 기록했다. 일론 머스크 최고경영자(CEO)가 안전요원 없이 로보택시를 시험하고 있다고 밝히면서 자율주행 기술 기대감이 주가를 밀어 올렸다.  로이터통신에 따르면 머스크는 지난 14일(현지시각) 엑스(X·옛 트위터)를 통해 ""로보택시에 탑승자가 없는 상태로 시험이 진행 중""이라고 밝혔다. 이 발언 이후 다음날 테슬라 주가는 장중 한때 4.9% 오른 481.37달러를 기록했다.  회사의 시가총액은 1조5300억달러로 글로벌 완성차 업체 가운데 최고 수준이다. 테슬라 주가는 지난해 12월 18일 규제 완화 기대 속에 488.54달러로 사상 최고치를 기록한 바 있다. 테슬라의 높은 기업가치는 자율주행과 휴머노이드 로봇에 대한 기대가 반영된 결과라는 평가다. 현재 매출과 이익의 대부분은 현재까지 전기차 판매에서 나온다.  테슬라는 올해 6월 텍사스 오스틴에서 '풀 셀프 드라이빙(FSD)' 기능을 탑재한 개조형 모델Y로 제한적 로보택시 서비스를 시작했다. 초기 운영은 지정 구역 내에서 이뤄지고 앞좌석에 사람이 탑승해 안전요원 역할을 수행했다.  시장에서는 테슬라가 시험을 확대하고 내년 출시를 예고한 전용 로보택시 '사이버캡' 준비에 속도를 낼 것으로 보고 있다. 세스 골드스타인 모닝스타 선임 주식 애널리스트는 ""안전요원 없는 시험 소식은 3분기 실적 발표 당시 경영진 발언과 일치한다""며 '시장이 기술 진전을 반영해 주가를 끌어올리고 있다""고 말했다.  회사는 오래전부터 로보택시 구상을 강조해왔지만 규제 장벽과 기술적 난관으로 일정이 지연돼 왔다. 현재는 알파벳 산하 웨이모가 미국 주요 도시에서 2500대 이상 상업용 로보택시를 운영하며 선두를 달리고 있다. CNBC에 따르면 웨이모는 주당 약 45만건의 유료 운행을 수행하고 있다.",https://n.news.naver.com/mnews/article/123/0002373912
2025-12-16 12:55:00,"KB금융, 6개 계열사 대표 후보 추천…“고객·사회·기업가치 균형 성장 주도할 것”","KB금융지주는 16일 '계열사대표이사후보추천위원회'(대추위)를 개최하고 12월말로 임기가 만료되는 KB증권 등 6개 계열사의 대표이사 후보를 추천했다.  신임 대표이사 후보는 ▲KB증권 IB부문에 '강진두' 現 KB증권 경영기획그룹장 부사장 ▲KB저축은행에 '곽산업' 現 KB국민은행 개인고객그룹대표 부행장이며 KB증권 WM부문, KB손해보험, KB자산운용, KB캐피탈, KB부동산신탁의 경우 現대표이사를 재추천했다.  KB증권 IB부문 대표이사 후보로 추천된 '강진두' 부사장은 기업금융, 인수금융, 글로벌 등 다양한 IB 영역을 거치며 시장 경쟁력을 공고히 할 수 있는 전문성을 갖췄다는 점을 인정받았다. 또한 영업과 경영관리를 두루 경험한 균형감을 기반으로 '안정적 세대교체'와 '지속 성장'을 동시에 견인할 수 있는 '준비된 리더'라는 평가를 받았다.  KB저축은행 대표이사로 추천된 '곽산업' 부행장은 디지털, 마케팅을 아우르는 경험을 토대로 KB저축은행을 Kiwibank 중심의 '디지털 전문채널'로 변화시킬 수 있는 적임자로 평가받았다. 또한 고객기반 확대를 위한 은행과의 시너지 창출 역량도 겸비했다는 점을 인정받았다.  '이홍구' KB증권 WM부문 대표이사는 선임 이후 고객 가치 중심 영업기반 강화 및 초개인화 기반의 디지털 플랫폼 고도화 노력을 통해 WM 자산규모를 확대하는 성과를 시현했다는 점에서 호평을 받았다.  '구본욱' KB손해보험 대표이사는 리스크관리 전문성을 기반으로 상품 포트폴리오를 재편하고 장기인보험 점유율을 개선하는 등 시장지위를 확대하는 성과를 이뤄냈다는 점에서 높은 평가를 받았다.  '김영성' KB자산운용 대표이사는 재임기간동안 AUM과 당기순이익을 균형감있게 성장시켰으며, ETF?연금?TDF 등 핵심 영역에서 경쟁우위를 점할 수 있는 성과창출 역량을 보유했다는 점을 인정받았다.  '빈중일' KB캐피탈 대표이사는 KB차차차의 혁신금융 서비스 지정 추진을 통해 수익 모델을 확장할 수 있는 기반을 마련하고, 내실성장을 위한 우량자산 중심의 사업 포트폴리오를 구축하는 등 실행력과 전문성을 겸비했다는 점에서 높은 평가를 받았다.  '성채현' KB부동산신탁 대표이사는 부동산PF 시장 경색 장기화 등 비우호적인 경영환경에서도 내부 현안과 사업구조에 대한 이해도를 바탕으로 선제적인 리스크관리와 성공적인 체질 개선을 완수할 수 있는 추진력을 갖추었다는 평가를 받았다.  대추위는 ""새로운 성장기반 마련을 위한 '사업방식 전환'과 '시장?고객의 확장'을 속도감 있게 추진할 수 있는 분들을 계열사 대표이사 후보로 추천했다""며 ""추천된 후보자들께서 각 계열사의 내실있는 성장과 사회적 가치 창출을 통해 KB금융이 고객과 시장, 주주에게 더욱 신뢰받는 '국민의 금융그룹'이 될 수 있도록 기여해주시길 바란다""고 밝혔다.  추천된 후보는 이달 중 해당 계열사의 대표이사후보추천위원회 최종 심사 및 추천을 통해 주주총회에서 확정될 예정이다. 신임 대표이사의 임기는 2년, 재선임된 대표이사의 임기는 1년이다.",https://n.news.naver.com/mnews/article/123/0002373911
2025-12-16 12:40:00,"한은 “환율 상승, 유동성 탓만 아냐…외환수급 불균형 결과”","원·달러 환율이 1470원대를 넘어서고 수도권 집값은 고공행진을 이어가자 시장에서는 ""돈을 너무 풀어 생긴 후폭풍""이라는 비판이 쏟아지고 있다. 그러나 한국은행은 이를 정면으로 반박했다. 최근 유동성 증가는 과장됐고 환율과 집값 상승의 핵심 원인은 '돈 풀기'가 아니라 외환수급 불균형과 자금 쏠림이라고 강조했다.  한국은행은 16일 '최근 유동성 상황에 대한 이해' 보고서를 발표했다. 보고서 작성에는 금융시장국 박성진 시장총괄팀장, 통화정책국 이화연 정책분석팀장이 참여했다.  최근 수도권 아파트 가격이 높은 상승세를 이어가고 원·달러 환율은 하반기 중 꾸준히 상승(원화가치 하락)하며 1460~70원대 수준으로 높아졌다. 이에 일각에서는 최근 M2 증가율 상승을 시중에 유동성이 과도하게 풀린 것으로 해석하면서 수도권 주택가격과 환율 상승의 핵심 원인으로 주장하고 있다.  이에 한은은 최근 유동성 상황을 과거 추세 등에 비춰 평가한 후 최근 M2 증가세가 미국보다 높게 나타난 배경을 살펴보고 유동성 변화가 자산가격과 환율에 미치는 영향을 점검했다.  유동성이란 소비, 투자, 금융거래 등 경제활동에 활용되는 화폐(money), 즉 자금의 총량을 의미하는데 M1(협의통화), M2(광의통화), Lf(금융기관 유동성), L(광의유동성) 등으로 포괄범위가 확대되며 측정된다  이러한 통화지표는 2023년 말을 저점으로 완만한 상승 흐름을 보이다가 올해 하반기 들어 증가세가 다소 빨라지는 모습이다. M2 증가율은 지난 9월 전년동기대비 8.5%로 높아졌으며 Lf와 L도 각각 8.0%와 7.2%로 상승했다.  한은은 이는 경기 하방리스크에 대응해 실시한 2024년 10월 이후 네 차례의 기준금리 인하가 시차를 두고 민간신용에 영향을 미치는 가운데 최근 경상수지 흑자 폭이 확대되면서 국외로부터 유동성 유입이 늘어나고 정부의 재정지출 확대로 국채발행도 증가한 데 기인한다고 설명했다.   한은은 최근의 유동성 증가세(M2 8.5%, Lf 8.0%)가 장기평균을 소폭 상회하는 정도이며 과거 금리 인하기와 비교한 증가 속도는 평균 수준으로 평가했다. 글로벌 금융위기 이후 3차례의 금리 인하기와 비교해 보면 이번 금리 인하기 누적 M2 증가율은 8.7%로 2012년(5.9%)보다는 큰 편이나 2014년(10.5%)과 2019년(10.8%)에 비해서는 상당폭 낮은 수준이라고 강조했다  금융시장국 시장총괄팀 박성진 팀장, 통화정책국 정책분석팀 이화연 팀장은 ""유동성 수준도 실물경제 및 자산시장 성장세를 고려할 때 과도한 수준으로 보기는 어렵다""라며 ""명목GDP 대비 M2 비율은 장기 추세치 수준에서 안정적인 흐름을 보이고 있으며 자산거래 규모 대비 유동성 수준도 2023년 말 이후 하락해 장기 추세치에 근접했다""고 설명했다.   한은은 최근 증가세가 확대되고 있다는 우려가 있는 M2 증가에는 통화지표의 구성 변화와 같은 기술적 요인도 컸다는 점에 주목할 필요가 있다고 했다. 최근 시중 유동성의 흐름을 보면 M2 범위 밖에 있던 자금들이 M2 상품인 ETF 등 수익증권으로 대폭 유입되면서 M2 증가의 주요 요인이 되고 있다  올해 1~9월 중 유동성(L) 증가에서 'Lf-M2'(M2 아닌 Lf 상품) 및 'L-Lf'(Lf 아닌 L 상품)이 차지하는 비중이 상당폭 축소된 반면 M2의 비중은 상당폭 확대됐다는 점이 이를 잘 보여준다는 것이다. 특히 이러한 현상은 M2 증가율이 가팔라졌던 3/4분기 중 더욱 뚜렷하게 나타났다.  아울러 지난 5월 이후 주가가 상승하는 상황에서 개인들이 어떠한 통화지표에도 포함되지 않는(비통화성자산) 국내주식을 큰 폭 순매도했는데 동 매도자금 중 일부가 ETF 등 수익증권으로 유입되면서 M2 증가세를 가속화하는 요인이 된 것으로 추정했다.  저자들은 ""이처럼 금융시장 여건 변화에 민감한 수익증권이 9월 M2 증가(8.5%)에서 차지하는 비중은 32.1%에 달하는데 미국을 비롯한 주요국에서는 수익증권을 M2에 포함시키지 않는다는 점은 M2 증가율만으로 우리나라 유동성 상황을 해석할 때 보다 주의를 기울여야 함을 시사한다""라고 밝혔다.  한편 한국은행은 현재 금융시장 여건 변화 및 새로운 국제기준(IMF) 개정내용 등을 반영해 수익증권을 M2에서 제외하는 등 통화지표 개편을 추진하고 있는데 개편 기준으로 9월 M2 증가율은 현행보다 상당폭 낮은 5%대 중반이 될 것으로 보인다.   한은은 최근 일부에서 국내 유동성이 과도하게 풀렸다는 주장의 근거로 활용하는 것이 우리나라 M2 증가율이 미국보다 2배 가까이 높다는 통계라고 지적했다.  저자들은 ""지난 9월 기준 우리나라의 M2 증가율(8.5%, 개편후 5%대 중반)은 미국(4.5%)에 비해 상당폭 높은 것이 사실""이라면서도 ""그러나 전년동기대비 M2 증가율은 단지 지난 1년간의 유동성 증가속도를 의미하는 만큼 긴 시계에서 양국이 처한 금융·경제 상황의 차이를 반영하지 못할 소지가 있다""라고 강조했다.  미국의 경우 코로나19 직후 양적완화(QE)와 제로금리 정책 등으로 통화량이 급증하고 물가상승률이 크게 치솟았으며 이러한 부작용을 완화하기 위해 2022년 3월부터 전례없이 급격한 정책금리 인상(+5.25%p)과 양적긴축(QT)으로 대응한 바 있다. 이에 따라 미국 M2는 2022년 12월부터 2024년 2월까지 15개월 동안 이례적으로 감소했으며 아직도 이러한 영향이 이어지고 있다는 것이다.  저자들은 ""코로나19 펜데믹(2020.3월) 직전부터로 시계를 넓혀서 보면 한국과 미국의 M2 누적 증가율은 각각 49.8%, 43.7%로 크게 차이 나지 않는다""라며 ""특히 미국의 M2에는 수익증권 등이 제외돼 우리나라보다 포괄범위가 상당히 좁다는 점을 감안해 이를 조정해 보면 같은 시기 우리나라의 M2 증가세는 미국과 대체로 유사한 수준""이라고 역설했다.   한은은 이론적으로 보면 유동성 증가가 자산가격과 환율에 상방 요인으로 작용하는 것은 사실이라고 하면서도 최근 수도권 주택가격과 원·달러 환율의 상승에는 다양한 요인이 복합적으로 작용하고 있어 이를 유동성 증가만으로 설명하는 것은 무리가 있다고 힘주어 말했다.  통화량과 주택가격의 장기적 흐름을 보면 뚜렷한 선후관계가 있다기보다는 대체로 동행하는 움직임을 보이며 상호 간에 영향을 주고받는 것으로 분석했다. 늘어난 유동성이 주택시장으로 유입되면서 가격 상승압력으로 작용할 수도 있지만 반대로 주택가격 상승기에는 주택구입을 위한 대출 수요가 늘어나면서 유동성이 확대될 수도 있기 때문이라는 것이다.  저자들은 ""특히 최근 우리나라 주택시장이 수도권과 지방 간 양극화가 심화되고 있고 거시건전성 정책의 효과로 가계대출이 둔화 흐름을 보이고 있다는 점에서 최근의 수도권 집값 상승을 유동성 효과만으로 설명하기는 어렵다""라며 ""오히려 공급부족 우려, '똘똘한 한 채' 선호 등으로 특정 지역의 가격상승 기대와 수요 쏠림이 주된 배경""이라고 잘라 말했다.  아울러 ""최근 강남3구를 비롯한 서울 핵심지에서는 주택구입시 대출을 동반하지 않는 현금구매 비중이 상당폭 높아졌는데 이는 신규로 공급된 유동성보다는 과거부터 누적되어 온 유동성이 수익률을 좇아 수도권 주택시장으로 유입되고 있음을 의미한다""라고 부연했다.  한은은 환율의 경우에도 유동성 상황보다는 거주자의 해외증권투자 확대, 수출기업의 외화보유 성향 강화 등 외환수급 요인이 더 크게 작용하고 있는 것으로 판단했다. 유동성 증가는 이론적으로 물가 경로를 통해 간접적으로 환율에 영향을 미칠 수 있다는 것이다.  그러나 최근 한·미 간 장기 기대인플레이션이 큰 차이를 보이지 않고 있고 소비자물가 상승률도 미국이 최근 3% 수준으로 높아지면서 양국 간 격차가 오히려 확대된 점 등을 고려할 때 최근의 환율 상승에 물가 및 유동성 경로가 유의한 영향을 주고 있지는 않은 것으로 판단했다.  반면 거주자의 해외증권투자 규모는 사상 최대규모로 늘어났는데 올해 1~10월 중 거주자의 해외증권투자 규모는 1171억달러로 과거 10년 평균(1~10월 기준 512억 달러)은 물론 직전 최고치(2024.1~10월 중 710억달러)를 넘어서고 있다.  이는 같은 기간 경상수지 흑자 폭(896억달러)을 크게 상회하는 규모이다. 이와 함께 최근 환율 변동성이 확대되면서 국내 수출기업들이 수출대금으로 받은 달러를 원화로 환전하지 않고 외화로 보유하는 경향이 높아지고 있는데 이 또한 외환수급 불균형을 확대시켰다.  한편 실증분석 결과 올해 9~11월 중 원/달러 환율 상승 폭(+65원) 중 대략 2/3 정도가 외환수급 등 국내 요인에 기인하는 것으로 추정했다.  박성진 시장총괄팀장, 이화연 정책분석팀장은 ""최근 유동성이 과도하게 풀리고 있고 이것이 자산가격 상승 및 상대적인 원화 약세를 유발하고 있다는 일각의 우려는 그간의 국내외 통화정책 기조, 실물경제 상황, 자금흐름 변화 등을 종합적으로 볼 때 다소 과도한 해석""이라고 선을 그었다.  그러면서 ""최근과 같이 통화지표가 구성 변화 등으로 불안정한 상황에서는 금융 여건을 판단하는 데 있어 M2와 같은 특정 통화지표에만 의존하기보다는 여타 통화지표와 금융상황지수(FCI) 등 다양한 지표를 함께 살펴볼 필요가 있다""라고 강조했다.  또한 ""자산가격 및 환율 상승의 원인을 단지 유동성 증가만으로 몰고 가는 것은 자칫 문제 해결의 본질을 흐릴 우려가 있다는 점에 유의할 필요가 있다""라고 재차 힘주어 말했다.  저자들은 ""지금과 같이 국내외 금융시장이 연계되어 빠르게 성장하는 상황에서 중앙은행의 통화정책만으로 국내 유동성을 완벽하게 통제하는 것은 어려우며 통화량에만 지나치게 집중하는 것은 현재의 통화정책 체계와도 맞지 않는 측면이 있다""라고 밝혔다.  이어 ""다만 늘어난 유동성이 특정 자산시장으로 쏠릴 경우 시장 변동성과 불안심리를 자극할 가능성을 배제하기 어려운 만큼 시중 유동성이 생산적인 부문으로 흘러갈 수 있도록 국내외 투자자의 신뢰 제고를 위한 자본시장 제도 개선 등 정책적 노력을 보다 강화해 나갈 필요가 있다""라고 부연했다.",https://n.news.naver.com/mnews/article/123/0002373910
2025-12-16 12:36:00,"경찰, '통일교 의혹' 김건희특검 추가 압수수색…이틀 연속 강제수사","경찰이 세계평화통일가정연합(통일교)의 여야 정치권 불법 로비 의혹을 수사하는 가운데 김건희특검팀(민중기 특별검사)에 대한 강제수사를 연이틀 이어가고 있다.  16일 경찰 등에 따르면 경찰청 국가수사본부 특별전담수사팀은 이날 오전 10시부터 서울 종로구 KT광화문빌딩웨스트에 있는 민중기 특검 사무실에 수사관을 보내 압수수색을 진행 중이다.  앞서 경찰은 지난 10일 김건희 특검팀으로부터 통일교의 정치인 접촉 관련 내사 사건 기록을 이첩받았다. 그러나 특검이 통일교 2인자로 알려진 윤영호 전 통일교 세계본부장 등의 진술 등 관련 자료 일부가 누락되는 등 충분한 자료가 제공되지 않았다고 보는 것으로 알려졌다.  경찰은 전날 통일교 천정궁, 통일교 서울본부, 한학자 총재와 윤영호 전 세계본부장이 수감 중인 서울구치소, 전재수 전 해양수산부 장관 사무실과 자택 등 10곳에 대해 동시다발적인 압수수색을 진행했다.  이외 임종성 전 민주당 의원·김규환 전 미래통합당 의원의 자택, 김 전 의원의 대한석탄공사 사장 집무실, '편파수사' 의혹 관련 민중기 특검 사무실도 압수수색 대상에 포함됐다. 경찰은 윤 전 본부장의 진술 등 수사 자료 일체를 확보한 것으로 알려졌다.  압수수색은 전날 오전 9시께 시작해 자정을 넘겨 이날 0시 40분께 종료하며 15시간여에 걸쳐 진행됐다. 또 23명 규모의 특별전담수사팀 외에 경찰청 안보수사국 수사관들이 임시 동원됐다.  경찰은 뇌물수수 혐의를 받고 있는 전 전 장관의 자택과 의원실을 수색했으나 통일교 측으로부터 받았다는 의혹이 제기된 명품시계를 발견하지 못한 것으로 전해졌다.  전 전 장관의 경우 2018년 무렵 현금 2000만원과 1000만원 상당의 명품시계, 임·김 전 의원은 2020년 4월 총선 무렵 각각 약 3000만원의 금품을 받은 혐의가 영장에 기재된 것으로 알려졌다.  이들은 현재까지 불법적인 금품수수는 없었다며 전면 부인하고 있다. 전 전 장관은 15일 오후 국회 의원회관에서 기자들과 만나 ""다시 말씀드리지만 통일교로부터 어떤 불법적 행위도 전혀 없었다""고 거듭 강조했고, 김 전 의원도 ""통일교로부터 불법적인 돈을 받은 사실이 전혀 없다""고 말했다.  경찰은 통일교 서울본부 등 주요 시설에 대한 압수수색에서 2018년 무렵의 보고·회계자료를 확보했다.  경찰은 특검팀이 한 총재 개인금고에서 발견하고도 별다른 조처를 하지 않은 것으로 알려진 280억원 상당의 현금 뭉치 등이 정치권 인사들의 로비 자금으로 쓰였는지 등을 집중 조사할 것으로 보인다.  한편 경찰은 오는 17일 한 총재가 구속 수용된 서울구치소를 찾아 접견 조사를 시도할 예정이다.",https://n.news.naver.com/mnews/article/123/0002373909
2025-12-16 12:35:00,"위성락 안보실장, 방미…'팩트시트 후속 조치·한반도 평화' 협의","위성락 국가안보실장이 한미 정상회담 후속 협의와 한반도 평화 문제에 대해 협의하기 위해 16일 미국으로 출국했다.  위 실장은 이날 오전 인천국제공항 출국길에 기자들과 만난 자리에서 ""미국에 가서 2가지 사안에 대해 논의할 예정""이라고 밝혔다.  하나는 조인트 팩트시트의 후속 조치에 관한 협의다.  위 실장은 ""조인트 팩트시트가 만들어진 지 한 달여 되었고, 그동안 우리 쪽에서 여러 가지 TF도 결성하고 준비를 해왔다""고 설명했다.  그는 ""그런데 사안이 농축 재처리나 핵잠, 조선 등 아주 비중이 큰 사안들이고 여러 부서가 여기 관련이 돼있다""며 ""그렇기 때문에 한미 양측 간에 외교안보를 총괄하는 안보 보좌관이나 안보실장 차원에서 대화를 함으로써 실무선의 후속 협의를 촉진하는 추동력을 줄 때가 아닌가 한다""는 생각을 밝혔다.  그는 우리가 그동안에 해온 준비 동향을 공유하고, 한미가 앞으로 어디로 나가야 될지를 가늠해 보겠다며 미국 출국 목적을 암시했다.  위 실장은 두 번째로 한반도 평화에 대한 협의를 진행할 것이라고 밝혔다.  그는 그동안에 한미, 한일 관계, 한미일 관계에 대해서 많은 협의의 진전을 보았고 한중 간에도 관계 복원의 진전이 있었다고 평가했다.  이어 이런 성과를 바탕으로 한반도 평화 문제에 대해서도 노력을 기울여 나가겠다는 전략을 밝혔다.  북-미 대화 재개 가능성이 높아진 내년 한반도 주변 정세 변화를 지렛대 삼아 보다 구체적인 남북관계 복원에 성과를 내겠다는 의도로 해석된다.  위 실장은 특히 ""이 대통령께서 트럼프 대통령과 피스메이커, 페이스메이커 역할을 논의하셨기 때문에 앞으로 그러한 역할 조정을 어떻게 추진해 나가고 어떤 방안을 공조하는 게 좋을지를 세부 협의을 해보겠다""고 말했다.  그는 ""그렇게 해서 북한을 대화 과정에, 긴장 완화 과정에 견인할 수 있는 방법을 모색해 보고자 한다""고 설명했다.  한편 미국 트럼프 대통령은 내년 4월을 전후해서 시진핑 중국 주석과 정상회담을 가질 것으로 예상된다. 특히 이 시기를 전후해서 북한 김정은 위원장과 정상회담을 추진할 것이라는 전망이 유력하게 제기되고 있다.  우리 정부 역시 이 시기를 남북대화의 물꼬를 틀 수 있는 적기라고 판단해 사전 정지작업을 펼 것으로 보인다. 내년 초에 이 대통령이 일본과 중국을 방문하려는 움직임이 있는 것으로 보도되고 있는 것도 이런 연속선상에서 이해할 수 있다는 게 정치권의 대체적인 분석이다.",https://n.news.naver.com/mnews/article/123/0002373908
