날짜,제목,본문,링크
2025-12-02 16:03:00,삼성생명 '일탈회계' 논란 마침표...구조 개선 과제는 여전,"국내 생명보험업계에 오랫동안 이어져 온 '일탈회계' 논란이 마침표를 찍게 됐다. 금융감독원이 삼성생명을 비롯한 생명보험사들이 관행적으로 적용해 온 예외적 회계처리를 더 이상 인정하지 않겠다고 공식 결정했기 때문이다.  금감원은 지난 1일 한국회계기준원, 한국공인회계사회 등 전문가들과 함께 'K-IFRS 질의회신 연석회의'를 열고 생명보험협회가 요청한 유배당 보험계약 관련 일탈회계 유지 가능성에 대해 ""더 이상 적용할 수 없다""고 결론을 냈다.  이에 따라 2025년 결산부터 생보사들은 유배당 계약자 몫을 '계약자지분조정'이라는 별도 부채 항목으로 처리하던 기존 방식 대신, IFRS17에 따른 정규 회계처리를 적용해야 한다.  2일 보험업계에서는 표면적으로는 국제회계기준(IFRS17) 정착에 따른 회계 기준 정상화 조치지만, 삼성생명 유배당보험 구조와 삼성전자 지분 문제 등이 복잡하게 얽혀온 숙제가 정리됐다는 평가가 나온다.  일탈회계는 IFRS17이 도입된 2023년 직전인 2022년 말, 금감원이 과도기적 조치로 한시 허용한 방식이다. 유배당 계약자에게 지급해야 할 잠재적 배당분을 '부채'로 두면 주주 몫이 과대 계상된 것처럼 보일 수 있어 혼란이 있을 수 있다는 점을 고려한 조치였다.  그러나 국제회계기준 정합성 논란이 이어지고, IFRS17 테두리 안에서 처리하는 것이 더 투명하다는 지적이 꾸준히 제기되면서 논란이 확대돼 왔다.  ◆ 삼성전자 지분 매각 이후 논란 재점화…금감원 ""직접 관련 없다"" 선 그어  올해 삼성생명이 보유한 삼성전자 지분 중 일부를 매각하면서 '유배당 계약자몫' 회계 처리에 대한 국제기준 적용 여부가 재부각됐다.  앞서 삼성생명은 1980~90년대 유배당보험 판매로 확보한 보험료로 삼성전자·삼성화재 등 계열사 주식을 매입해왔고, 매각하지 않은 주식 평가이익을 계약자지분조정으로 별도 표시해 왔다.  삼성전자 주가 상승으로 해당 조정 금액은 올해 9월말 기준 약 12조8000억원까지 증가했다. 다만 생보사들은 삼성전자 지분을 단기간에 처분할 수 없는 만큼 이를 '부채'로 보기 어렵고 IFRS17 규정에 따라 '자본'으로 분류할 가능성이 높다는 점을 강조해 왔다.  금감원은 이번 결정이 삼성전자 지분 매각과 직접 연결된 해석을 일축하며, ""일탈회계가 지속되면 한국이 IFRS 완전도입 국가로 보기 어렵다는 국제적 문제 제기가 있었다""며 정상화 취지를 강조했다.  아울러 금감원은 이번 조치가 회계오류 수정이 아닌 회계정책 변경이라는 점을 강조했다. 과거 일탈회계를 문제 삼아 감리나 제재를 하지 않겠다는 점도 분명히 했다. 과거 금감원이 정식 승인한 예외였고 당시 상황을 고려하면 적법한 조치였다는 입장이다. 이에 따라 소급 적용도 하지 않으며, 2025년 결산부터 새로운 기준이 반영된다.  금감원은 재무제표 이용자의 혼란을 최소화하기 위해 비교표시되는 전년 재무제표도 재작성하도록 할 계획이다.  ◆ 계약자·주주 영향 제한적…""경제적 실질 변화 없어""  이번 조치가 유배당 계약자에게 직접적인 영향은 없다는 것이 금감원의 설명이다. 계약자 배당은 실현이익이 발생할 때에만 지급되므로, 회계 분류가 변해도 지급 구조 자체는 변하지 않는다.  증권가도 회계 변경의 실질적 영향이 크지 않다는 분석을 내놓고 있다. DB증권이 이날 발표한 보고서에 따르면 유배당 계약자 몫 중 약 13조5000억원이 자본으로 재분류될 전망이다.  이는 삼성생명 BPS(주당순자산가치)를 약 7만5000원 높이는 반면 ROE(자기자본이익률)를 약 2%p 낮추는 효과가 있다. 다만 이는 단순 분류 변경이기 때문에 주가에 미치는 영향은 제한적이라는 분석이다.  다만 보험업계는 이번 결정으로 회계처리 논란은 정리됐지만, 유배당보험 구조와 배당 방식에 대한 근본적 문제는 여전히 남아 있다고 지적한다. 삼성생명이 확보해 온 막대한 평가이익이 실제 계약자에게 돌아가는 시점과 방식이 여전히 불투명하기 때문이다.  보험업계 관계자는 ""금감원이 2022년과 이번 2025년 적용 모두 회계오류가 아니라고 명확히 해 앞으로 불필요한 논란은 잦아들 것""이라면서도 ""유배당보험의 배당 체계 개선 논의는 여전히 필요하다""고 말했다.",https://n.news.naver.com/mnews/article/123/0002373083
2025-12-02 15:51:00,"“중국, 내수 부진 가솔린차 해외로 대량 수출…신흥시장 장악 가속”","중국의 전기차 산업이 급격한 성장세를 이어가며 자국 시장에서 가솔린 차량 판매가 크게 위축된 가운데, 중국 완성차 기업들이 내수에서 팔리지 않는 내연기관 자동차를 해외 시장으로 대거 수출하며 글로벌 자동차 시장의 판도를 흔들고 있다.  2일(현지시간) 로이터 통신은 중국 자동차 수출 급증 현상과 신흥시장 중심의 해외 시장 확대 전략이 기존 글로벌 완성차 업체들에게 새로운 위협으로 부상하고 있다고 보도했다.  중국은 최근 몇 년 사이 전기차가 국내 판매의 절반 이상을 차지하게 되면서 가솔린 차량 중심의 기존 완성차 업계가 큰 타격을 입었다. 내수가 붕괴하자 SAIC, Dongfeng, Changan 등 국유기업을 중심으로 가솔린 차량 수출에 총력을 기울이는 전략으로 선회했다.  오토모빌리티 자료에 따르면, 중국의 전체 자동차 수출은 2020년 100만 대에서 올해 650만 대 이상으로 늘었으며, 이 중 76%가 내연기관 차량이다.  중국 업체들이 가솔린차 수출에 집중하는 이유는 단순하다. EV 인프라가 갖춰지지 않은 신흥국 시장에서는 여전히 가솔린 차량의 수요가 압도적이기 때문이다. 중국 업체들은 폴란드, 남아공, 칠레, 멕시코, 우루과이 등지에서 기존 글로벌 브랜드와 정면 경쟁을 벌이고 있으며, 가격 경쟁력을 앞세워 빠르게 시장 점유율을 확대하고 있다.  가장 공격적인 기업으로 지목된 Chery의 경우, 2020년 73만 대에서 2024년 260만 대로 판매량을 늘리며 중국 수출 1위 업체로 부상했다. SAIC 역시 같은 기간 약 40만 대에서 100만 대 이상으로 수출을 확대했다.  중국 업체들의 영향력 확대는 기존 글로벌 브랜드의 시장 지위를 빠르게 흔들고 있다. 멕시코 시장에서 중국 업체들은 올해 20만 대 이상을 팔아 점유율 14%를 확보한 것으로 추산되며, 여파로 쉐보레는 전년 대비 24% 이상의 판매 감소를 기록했다.  칠레의 경우, 중국 브랜드는 시장의 3분의 1을 장악한 반면, 기존 업체들의 판매는 34~45% 감소했다. 우루과이에서는 Dongfeng의 픽업트럭이 니산 Frontier보다 약 30% 저렴한 가격으로 판매되며 시장을 잠식하고 있다.  중국 자동차 업체들의 급증한 수출은 국내 과잉 생산 설비 문제와도 직결되어 있다. 오토모빌리티 CEO 빌루소는 중국 내 유휴 공장들이 연간 2,000만 대 규모의 내연기관차 생산 능력을 갖고 있다고 지적하며, ""그 초과 생산분이 해외 시장을 향하고 있다""고 말했다. 전기차 생산이 급성장하면서 기존 가솔린 공장이 방치되는 사실은 산업계 생존전략을 수출로 몰아가게 만들었다.  이러한 변화에 글로벌 완성차 업체들도 긴장하는 분위기다. 폭스바겐 남미 담당 최고책임자 알렉산더 자이츠는 ""중국 업체를 두려워하지 않는다. 경쟁을 환영한다""고 말했지만, 업계에서는 중국 브랜드의 저가 공세가 기존 기업의 수익성과 시장 기반을 위협할 수 있다는 분석이 우세하다. GM과 현대차는 이미 남미 전략 모델 공동개발을 발표하며 대응에 나섰다.  전문가들은 중국 자동차 산업의 해외 확대가 단순한 시장 이동이 아니라, 전기차 세계 패권을 향한 과도기적 전략이라고 분석한다. 전기차 중심의 미래 시장을 노리기 전에, 당장 팔리지 않는 가솔린 차량을 통해 장기적 브랜드 기반을 구축하고 있다는 것이다.  AlixPartners는 향후 5년 내 중국 자동차 업체가 글로벌 시장 점유율 30%를 차지할 것이라고 전망했다. 신흥시장에서 벌어지는 이 조용한 격전은 앞으로 글로벌 자동차 산업의 권력 지형을 바꾸는 분수령이 될 것으로 보인다.",https://n.news.naver.com/mnews/article/123/0002373082
2025-12-02 15:48:00,"원·달러 환율, 0.4원 오른 1468.4원",2일 서울외환시장에서 원·달러 환율은 전거래일보다 3.0원 오른 1471.0원으로 출발했다. 장중 소폭 내리며 3시 30분 기준 전거래일과 비교해 0.4원 오른 1468.4원을 기록했다.,https://n.news.naver.com/mnews/article/123/0002373081
2025-12-02 15:42:00,"현대모비스, 제품경쟁력 원천기술 신소재 개발 성과 이어져","모빌리티 선행기술과 제품경쟁력 강화에 주력하고 있는 현대모비스가 신소재 연구개발 단계에서부터 다양한 성과를 창출하고 있다. 고성능·고효율의 신소재를 적용해 상품성 향상을 견인하는 것은 물론, 글로벌 환경 규제에 대한 선제적인 대응도 가능할 것으로 기대된다.  현대모비스는 전기차 구동모터의 출력을 향상시키는 신소재 필름, 목재를 가공해 플라스틱을 대체하는 친환경 소재 등 신소재 분야에서의 다양한 연구개발 성과를 2일 소개했다. 현대모비스는 인공지능으로 가상의 환경을 모사하거나 신소재 물성(物性)을 탐색하는 연구 기법도 함께 공개했다.  현대모비스의 신소재 연구개발은 △핵심부품 경쟁력에 기여하는 혁신소재, △지속가능한 친환경 소재, △인공지능을 활용한 디지털 재료개발 프로세스 구현이라는 3가지 축을 중심으로 진행되고 있다.  원천기술인 신소재 분야에서의 연구개발 성과는 제품경쟁력 강화와 원자재 수급난 해소에도 기여하는 한편, 특히 친환경 소재를 적용한 핵심부품은 글로벌 수주에도 긍정적인 영향을 미친다. 유럽 등 선진시장 고객사들은 재생소재 사용 비중과 이에 따른 온실가스 감축 효과를 부품사 선정의 주요 지표로 활용하기 때문이다.  전기차 모터 출력 높이는 필름, 플라스틱 대체 가능한 바이오소재 등 다양한 성과  현대모비스는 전기차 구동모터의 출력을 높일 수 있는 '폴리에테르에테르케톤(PEEK)' 필름 개발에 성공했다. 혁신소재로 불리는 이 필름은 전기모터 내부에 촘촘히 감은 구리선(코일)을 감싸 비정상적인 전류의 흐름이나 발열을 차단하는 기능을 수행한다.  그 동안에는 아라미드로 불리는 합성섬유를 사용했지만, 신소재를 적용하면 코일의 점적률과 열효율이 개선돼 모터의 출력이 향상된다.. 이 필름은 기존 소재보다 표면이 균질해 코일 삽입 과정에서 마찰이 줄어 공정 효율이 개선된다. 현대모비스는 180도 이상의 고열에도 견딜 수 있도록 내구성을 확보했다.  또한 신소재 '맥신(MXene)'을 적용한 전자파 차단 흡수재 개발에서도 성과를 거두고 있다. 맥신은 전기전도성이 높은 나노물질로 꿈의 신소재로 불린다. 현대모비스는 전장부품의 고주파·고집적화·고전력화 트렌드에 따라 미래 유망 소재인 맥신을 자동차부품에 선제적으로 도입한다는 방침이다.  지속가능한 친환경 소재 개발도 현대모비스가 공을 들이는 분야다. 주요 국가들이 친환경 소재 사용을 법제화함에 따라 이를 선제적으로 대응하고 있다. 실제로 유럽연합은 2030년부터 신차에 들어가는 플라스틱의 25%를 재생 플라스틱으로 사용할 것을 의무화하기도 했다.  현대모비스는 목재를 가공한 '리그노셀룰로스'라는 바이오 소재를 업계 최초로 적용할 방침이다. 목재를 분쇄해 물리화학적 처리를 거쳐 특정 성분만 추출하는 방식이다. 이후 다른 재료와 혼합해 범퍼커버와 같은 플라스틱 부품이나 고무제품을 만들 수 있다. 국내에서는 흔한 소나무를 사용한다.  현대모비스는 리그노셀룰로스를 개발하며 제품 경량화를 실현하고, 총 8건의 특허를 출원하기도 했다. 국제 산림관리기구의 인증을 거친 목재만 활용하며, 플라스틱 사용 저감에 큰 도움을 줄 것으로 기대된다.  회사는 기능성 신소재 개발에 인공지능 활용을 확대하고 있다고 설명했다. 가상의 연구개발 환경을 구축하면 재료의 내구성이나 강도, 변형 등을 쉽게 예측할 수 있다는 장점에서다.  이러한 일환으로 현대모비스는 전기가 통하는 고무를 활용한 기능성 신소재를 개발하고 있다. 인공지능이 어느 지점에 어떤 압력으로 눌리는지 예측 분석하는 기술이다. 향후 충돌사고를 대비한 에어백의 충격 감지센서나 차량 내부의 탑승객 감지시스템, 각종 조작계 버튼 등의 용도로 발전시킨다는 방침이다.  이 밖에도 장기간 외부 환경에 노출되는 부품의 부식이나 노화를 예측하고, 복잡한 고분자 물질의 특성을 탐색하는 재료 연구분야에 인공지능을 적극 도입해 신소재 개발에 앞장서고 있다.  한편 현대모비스는 국내 부품사 가운데는 이례적으로 100여 명에 이르는 신소재 개발 전문 인력을 보유하고 있다. 또한 국내 주요 대학과 에너지 화학 전문기업들과의 협업도 확대해 차량용에 특화된 신소재 개발에 공을 들이고 있다.",https://n.news.naver.com/mnews/article/123/0002373080
2025-12-02 15:26:00,"기아, 6년만에 새롭게 변신한 소형 SUV '셀토스' 티저 공개","기아가 1일 대표 소형 SUV '디 올 뉴 셀토스(The all-new Seltos, 이하 셀토스)'의 티저 이미지를 처음으로 공개했다.  이번 셀토스는 지난 2019년 1세대 셀토스 출시 이후 6년만에 새롭게 선보이는 모델로 경쟁이 치열한 글로벌 소형 SUV 시장에서 돌풍을 일으킬 것으로 기대된다.  기아는 이날 공개한 티저 이미지를 통해 동일 차급에서는 찾아보기 힘든 정통 SUV 스타일의 셀토스를 강조했다.  셀토스는 기아의 디자인 철학인 '오퍼짓 유나이티드(Opposites United, 상반된 개념의 창의적 융합)'를 바탕으로 정통 SUV 스타일에 기아의 미래지향적이고 세련된 디자인 요소들을 조합해 유니크하고 자신감 있는 이미지를 구현했다.  또한 셀토스는 전면에 수직형 주간주행등이 돋보이는 스타맵 시그니처 라이팅을 적용해 존재감을 부각했으며 후면은 전면과 통일감을 주는 수직 및 수평형 램프로 안정적인 이미지를 연출했다.  아울러 셀토스는 플러시 도어 핸들과 같이 세련되면서도 실용적인 사양들을 통해 감성을 살렸다.  기아는 이번 셀토스를 통해 브랜드의 정수를 담은 디자인, 파워트레인, 안전 및 편의사양 등 우수한 상품성을 선보이고 글로벌 소형 SUV 시장에서 입지를 강화해 나갈 예정이다.  셀토스는 이달 10일 기아 월드 와이드 유튜브 채널에서 월드 프리미어 영상을 통해 세계 최초로 공개된다.",https://n.news.naver.com/mnews/article/123/0002373079
2025-12-02 15:25:00,"퓌 푸딩팟, '올리브영 어워즈' 컨투어링 부문 1위","메이크업 브랜드 퓌(fwee)가 시그니처 제품 '립앤치크 블러리 푸딩팟'으로 '2025 올리브영 어워즈' 컨투어링 부문 1위에 선정됐다고 2일 밝혔다.  퓌는 이번 수상을 기념해 올리브영에서만 만나볼 수 있는 푸딩팟 미공개 컬러 기획세트를 한정으로 선보였다.  올리브영 어워즈는 매년 고객 구매 누적 빅데이터를 기반으로 카테고리별 수상 제품을 선정하는 연말 결산 행사로 퓌는 컨투어링 부문에서 선두를 지켰다. 립앤치크 블러리 푸딩팟은 2024년 올리브영 어워즈 컨투어링 부문 'MD's Pick'에 이어 올해 올리브영 어워즈 컨투어링 부문 1위까지 오르게 됐다.  브랜드측은 ""푸딩팟은 젠지 세대 사이에서 립앤치크 트렌드를 이끈 퓌의 대표 제품""이라며 ""올리브영 어워즈 컨투어링 부문에서 1위를 차지한 '위드아웃' 컬러는 출시 이후 꾸준한 판매 상승세를 이어가며 높은 고객 충성도를 입증해왔다""고 설명했다.  어워즈 수상을 기념해 선보인 기획 세트는 베스트 컬러와 미출시된 신규 컬러가 함께 구성된 단독 패키지로 12월 한 달 동안만 한정 판매된다. 푸딩팟 1개 구매 시 미공개 컬러 본품을 증정하는 특별 구성으로 선보인다.  미공개 컬러 중 '버니(Bunny)'는 퓌의 새로운 모델인 트와이스 나연에게 영감을 받아 개발된 쿨 핑크 컬러로, 나연 특유의 러블리한 무드가 담겼다. 다른 신규 컬러 '바닐라(Vanilla)'는 퓌의 히트 제품인 볼류밍 글로스 '바닐라 70%'를 푸딩팟 텍스처로 재해석한 컬러다. 브랜드 내에서 가장 높은 판매량을 기록한 베스트 컬러의 푸딩팟 버전이다.  퓌 관계자는 ""기획 세트는 12월 올영세일 첫날 올리브영 온라인몰에서 전량 품절되며 인기를 증명했는데, 푸딩팟은 독자적인 제형 개발과 다양한 컬러 스펙트럼을 기반으로 립앤치크 카테고리를 새롭게 정의해온 제품""이라면서 ""올리브영 어워즈 컨투어링 부문 1위와 신규 컬러 출시를 계기로 더욱 확장된 색조 라인업과 혁신적인 제품 경험을 선보일 것""이라고 말했다.",https://n.news.naver.com/mnews/article/123/0002373078
2025-12-02 15:15:00,"한미사이언스, 피부 보습·가려움 진정에 효과적인 바디로션 출시","한미그룹 지주회사 한미사이언스는 자사 더마코스메틱 브랜드 '프로-캄(PRO-CALM)'이 고순도 우레아와 판테놀을 핵심 성분으로 한 바디 보습 케어 신제품 '프로-캄 울트라 모이스처 업 바디로션(이하 프로-캄 바디로션)'을 출시했다고 1일 밝혔다.  이번 신제품은 프로-캄의 독자 기술력으로 피부 장벽 강화 특허를 받은 유산균 복합체를 함유하고 있으며 순도 100% 판테놀과 순도 99% 우레아를 각각 10,000ppm 배합해 피부 밸런스 강화와 수분 유지에 탁월한 효과를 제공한다.  또한 피부 흡수에 효과적인 저분자 히알루론산(400달톤)이자 피부 주름 및 탄력 개선 특허 성분 히알시드, 피부 깊숙이 수분을 공급해 건조한 피부 개선에 도움을 주는 트레할로오스가 함유돼 있으며, 엑토인과 글리시리진산은 외부 유해 환경으로부터 피부를 보호하는데 도움을 준다.  프로-캄 바디로션은 수분산 액정 기술을 적용해 풍부한 보습감에도 빠르게 흡수되고 끈적임 없이 산뜻한 사용감을 제공하며, 전 연령층이 안심하고 사용할 수 있는 저자극 포뮬러로 설계됐다.  해당 제품은 인체적용시험을 통해 보습 107% 개선을 통해 건조에 의한 가려움 일시적 완화 등의 효능을 입증했으며, 피부 자극 테스트, 민감성 피부 대상 테스트, 영유아 사용 안전성 평가를 모두 통과해 온 가족이 안심하고 사용할 수 있는 저자극 보습 솔루션으로 평가받았다.  '프로-캄 울트라 모이스처 업 바디로션'은 한미약품 제품 유통 등을 맡고 있는 온라인팜을 통해 유통되며 전국 약국과 프로-캄 공식 온라인몰에서 구매 가능하다.",https://n.news.naver.com/mnews/article/123/0002373077
2025-12-02 15:07:00,"'12·3 계엄 1년'...李대통령 시민과 행진, 국회의장은 해설봉사","12·3 비상계엄 및 해제 1년을 맞는 3일 이재명 대통령이 국회 앞에서 시민들과 행진한다. 우원식 국회의장은 '그날 12·3 다크투어' 전문해설봉사자(도슨트)로 나서 계엄군과 맞섰던 상황을 시민들에게 직접 설명한다.  대통령실은 2일 ""이 대통령은 3일 오후 7시에 개최되는 '12·3 내란외환 청산과 종식, 사회 대개혁 시민 대행진'에 참여할 예정""이라고 밝혔다.  이 행사는 시민단체 '내란청산·사회대개혁 비상행동 기록기념위원회'가 주관하며 여당인 더불어민주당과 조국혁신당·진보당·기본소득당·사회민주당 등 야4당이 참여한다.  현직 대통령이 일반 시민단체가 주관하는 장외 집회에 참여하는 것은 매우 이례적이다. 윤석열 전 대통령의 불법 비상계엄을 시민들이 앞장서 막았다는 의미를 강조하는 차원으로 풀이된다.  이 대통령은 당일 오전에는 불법 비상계엄 1년을 맞아 대국민 특별성명을 발표하고, 외신 기자회견을 진행한다.  이후 5부 요인(우원식 국회의장, 조희대 대법원장, 김상환 헌법재판소장, 김민석 국무총리, 노태악 중앙선거관리위원장)과 오찬을 한 후 저녁 집회에 참석할 예정이다.  우 의장은 오후 5시 국회에서 진행되는 '그날 12·3 다크투어'에 도슨트로 참여한다. 다크투어는 전쟁, 재난 등 비극적인 역사와 범죄가 일어난 장소 등을 방문하고 기억·성찰하자는 취지의 활동이다.  우 의장은 자신이 월담한 장소, 계엄군 헬기가 착륙한 국회 운동장, 계엄군과 대치한 국회의사당 등 주요 현장을 둘러보며 당시 상황 등을 투어 참가자들에게 설명할 계획이다.  또한 ▲국회의사당 전면 미디어파사드 상영 ▲국회의사장 2층 정문에 글새김 제막식 ▲'민주주의와 국회, 그리고 헌법' 학술대회 ▲계엄 상황을 담은 사진전 및 포토존 운영 등의 행사도 진행된다.  국민의힘에서는 한동훈 전 대표가 3일 오후 1시 30분 국회 기자회견을 예고했다. 한 전 대표 측은 ""1년 전 계엄 해제를 위해 시민들, 국민의힘 동료들과 함께 국회로 들어갔던 국회 도서관 쪽 쪽문(국회 내부)에서 기자회견을 할 예정""이라고 밝혔다.  당내 친한(한동훈계) 인사들도 계엄군 헬기가 착륙한 국회 운동장에서 '계엄 사과 백합꽃 릴레이' 행사를 연다. 백합은 '정화', '속죄', '새로운 시작'을 상징하는 꽃으로, 당시 계엄 사태에 대해 반성한다는 뜻이다.  국민의힘 최다선(6선) 조경태 의원은 개인 자격으로 광주를 방문, 국립 5·18민주묘지를 참배하고 불법적인 비상계엄에 대해 사과의 뜻을 밝힐 것으로 알려졌다.  다만 국민의힘은 계엄 사과에 거리를 두는 모양새다.  장동혁 대표는 전날 인천 장외집회에서 ""과거에서 벗어나자고 외치는 것 자체가 과거에 머무는 것""이라며 당내 사과 요구를 사실상 일축했다.  윤석열 정부 대통령실에서 국정기획비서관으로 근무하고 현재 국민의힘 조직부총장인 강명구 의원은 이날 SBS라디오 '김태현의 정치쇼'에 출연해 ""(장 대표 사과는) 너무 피상적이고 지엽적인 문제""라고 거들었다.",https://n.news.naver.com/mnews/article/123/0002373076
