날짜,제목,본문,링크
2025-12-15 10:43:00,"이 대통령, '4.3 학살' 박진경 대령 국가유공자 '취소 검토' 지시","이재명 대통령이 제주 4·3 사건 진압책임자 논란이 일었던 박진경 대령에게 훈장이 수요된 것에 대해 국가유공자 등록 취소를 검토하라고 지시했다.  대통령실은 15일 이 대통령이 전날 이와 관련해 '취소 검토'를 지시했다고 밝혔다.  국가보훈부 서울보훈지청은 지난 10월 박 대령의 유족이 4·3 당시 무공수훈을 근거로 제출한 국가유공자 등록 신청을 승인해 지난달 4일 유공자증서를 전달한 바 있다.  그러나 박 대령이 4·3 사건 당시 강경 진압 명령을 내렸다는 점이 알려지며 제주 시민사회를 중심으로 논란이 일었고, 이후 지역사회가 강하게 반발하는 모습이 연출됐다.  이에 권오을 국가보훈부 장관이 11일 제주를 찾아 사과했다.  권 장관은 15일 자신의 페이스북에 ""12.10 제주4.3 진압책임자에게 국가보훈부 서울보훈청에서 이재명 대통령 명의의 국가유공자증을 발급한 일로 완전 그로기 상태""라며 ""이일로 11일 제주 4.3 유족들을 방문해 사과와 시정을 약속했다""고 그간의 사정을 설명했다.  이어 11일 저녁에 보수 성향인 제주 보훈단체장들과 저녁을 하면서 이해와 양해를 구했다고 밝히면서 ""제주 4.3 희생자는 국가폭력의 희생자며 당시 진압에 동원되었던 군인.경찰은 혼란한 시대의 피해자""라는 의견을 밝혔다.  그러면서 ""당시는 미 군정기간""이었고, ""이념과 진영의 첨예한 현장에서 사실대로 판단하고 후속 조치를 할 예정""이라고 강조했다.  대통령실의 입장과 권 장관의 페이스북 내용을 종합하면 이 대통령의 지시에 따라 국가보훈부가 박 대령에게 수여한 무공훈장을 취소하는 절차를 밟을 것으로 보인다.",https://n.news.naver.com/mnews/article/123/0002373805
2025-12-15 10:40:00,"BBQ, '대한민국 100대 브랜드' 종합 22위 올라","치킨 프랜차이즈 제너시스BBQ 그룹(회장 윤홍근)이 브랜드스탁 발표 '2025년 대한민국 100대 브랜드'에서 종합 22위에 올랐다고 최근 밝혔다.  BBQ는 전체 프랜차이즈 브랜드 가운데 1위를 기록했다.  BBQ는 지난 2019년 치킨 프랜차이즈 기업 중 처음으로 30위권에 진입한 이후, 당시 29위에서 올해 22위까지 순위를 끌어올리며 7년 연속 30위권 내를 유지했다.  BBQ는 미국 사우스캐롤라이나주에 진출해 50개 주 가운데 33개 주에 진출했다. 캐나다, 파나마, 코스타리카, 바하마, 말레이시아, 중국, 홍콩, 일본, 피지 등 57개국에서 700여 개의 매장을 운영 중이다.  최근 BLT F&B 그룹과 손잡고 스페인에 '유럽 헤드쿼터'를 설립하며 유럽 시장 공략을 본격화했으며, 남아프리카공화국과 마스터 프랜차이즈 계약을 체결해 아프리카 대륙 진출에 나섰다.",https://n.news.naver.com/mnews/article/123/0002373804
2025-12-15 10:24:00,"[속보] 경찰, 통일교 한학자 총재 정치권 금품공여 피의자 전환","[속보] 경찰, 통일교 한학자 총재 정치권 금품공여 피의자 전환",https://n.news.naver.com/mnews/article/123/0002373803
2025-12-15 10:13:00,"경찰, 통일교 천정궁·전재수·검건희특검 등 10곳 전방위 압수수색","경찰이 통일교의 여야 정치권에 걸친 금품 로비 의혹과 관련해 첫 강제수사에 착수했다.  경찰 등에 따르면 경찰청 특별전담수사팀은 15일 오전 9시께부터 경기 가평군 통일교 천정군과 서울 용산구 통일교 서울본부 등 10곳에 수사관들을 보내 압수수색을 진행 중이다.  압수수색 대상에는 통일교 주요 기관 외에도 전재수 전 해양수산부 장관의 국회 의원회관 사무실과 윤영호 전 통일교 세계본부장이 수감된 구치소, 김건희 특검 사무실 등이 포함된 것으로 알려졌다.  경찰은 통일교 회계자료 등을 확보해 자금 흐름을 추적하는 한편, 로비에 쓰인 것으로 지목된 금품 등을 찾을 것으로 보인다.  이번 압수수색은 경찰이 지난 10일 김건희 특검팀으로부터 통일교의 정치인 접촉 관련 내사 사건 기록을 이첩받은 뒤 이뤄진 첫 강제수사다.  앞서 특별전담수사팀은 지난 11일 전재수 전 해양수산부 장관, 임종성 전 민주당 의원, 김규환 전 미래통합당 의원 등 3명을 피의자로 입건하고 출국금지 조치했다. 이들에게는 정치자금법 위반 또는 뇌물 수수 혐의가 적용된 것으로 전해졌다.  이들은 현재 금품 수수 의혹에 대해 부인하고 있다.  윤 전 본부장이 특검팀에 함께 거명한 것으로 알려진 나경원 국민의힘 의원, 정동영 통일부 장관에 대해선 현재까지 혐의가 발견되지 않아 입건하지 않았다.  금품 수수 의혹을 촉발한 윤 전 본부장은 정치자금 또는 뇌물을 불법 공여한 혐의로 피의자 입건된 것으로 알려졌다.  앞서 윤 전 본부장은 지난 12일 권성동 국민의힘 의원 정치자금법 위반 혐의 재판에 증인으로 나와 특검팀 조사 진술과 관련해 ""세간에 회자되는 부분도…제 의도하고 전혀…""라며 ""저는 그렇게 진술한 적이 없다""고 사실상 진술을 번복했다.",https://n.news.naver.com/mnews/article/123/0002373802
2025-12-15 10:08:00,"[공시pick] 이마트, 신세계푸드 주식 공개매수…""자발적 상폐 추진""","이마트가 자회사 신세계푸드를 완전자회사로 편입하기 위해 공개매수를 신청한다고 15일 공시했다.  공개매수는 이날부터 내년 1월 5일까지 진행한다.  공개매수가는 신세계푸드 보통주 1주당 4만8120원이다. 매수 예정 수량은 자기주식 25만7028주를 제외한 유통주식 전량은 146만7319주다. 이는 발행주식총수의 37.89%에 해당한다.  이날 기준 이마트의 신세계푸드 보유 지분은 55.47%이며 공개매수 목표 물량이 모두 응모될 경우 이마트 보유 비율은 93.36%가 될 예정이다. 여기에 자기주식을 포함하면 100%가 된다.  자금은 전액 현금으로 조달하며 결제대금은 706억739만원으로 신한투자증권 계좌에 예치돼 있다. 완전자회사 편입 후에 신세계푸드는 관련법령에 따라 상장폐지가 진행된다.  이마트는 공개매수에 앞서 12일 특수관계사인 조선호텔앤리조트가 보유하던 신세계푸드 지분 33만2910주(8.6%)를 시간 외 대량매매로 매수하기로 계약했다. 매매단가는 공개매수가와 같은 4만8120원으로 설정됐다. 해당 블록딜 결제는 12월 16일로 예정돼 있다.  이마트는 ""이번 공개매수가 주식시장에서 제대로 평가받지 못한 신세계푸드의 소액주주들에게 확정된 프리미엄 가격으로 투자금을 회수할 수 있는 기회를 제공하는 것""이라면서 ""지배구조를 단훈화해 투명성을 제고하고, 신세계푸드가 상장 유지에 따른 비용과 시장의 저평가에서 벗어나 본연의 사업경쟁력 강화에 집중할 수 있는 환경을 마련하고자 한다""고 밝혔다.  이어 ""공개매수가 성공적으로 완려될 경우 관련 법령과 규정이 정하는 바에 따라 최대한 신속하게 신세계푸드의 자발적 상장폐지를 신청하고 필요한 수속 절차를 밟을 계획""이라고 덧붙였다.",https://n.news.naver.com/mnews/article/123/0002373801
2025-12-15 10:06:00,"빗썸, ‘25 내부감사 경진대회서 3년 연속 우수상 수상","빗썸이 '2025 내부감사 경진대회'에서 우수상을 수상했다고 15일 밝혔다. 2023년, 2024년에 이어 3년 연속 수상을 기록이다.   올해로 5회째를 맞이한 '2025 내부감사 경진대회'에는 총 23개 팀의 공공기관 및 금융기관 감사 실무자들이 참가해 치열한 경합을 벌였다.  참가팀들은 가상의 내부 감사 시나리오를 기반으로 문서·이메일·메신저 대화·이미지 파일 등 여러 형태의 전자 정보를 종합적으로 검토해 ▲법인카드 부정 사용 ▲자금 유용 및 횡령 ▲정보 유출 등 다양한 부정행위 사례를 해결하여 평가를 받았다.  3년 연속 우수상 수상으로 빗썸의 내부감사 역량을 다시 한번 인정받았다.  빗썸은 내부통제 강화를 위해 불공정거래 및 임직원 비위 행위에 대한 내부 제보 채널을 운영 중이며, 제보 시 포상제도 등 강화된 제도 운영을 통해 부정행위 사전 방지 및 내부통제 체계 고도화에 힘쓰고 있다.  김진규 빗썸 감사실장은 ""내부통제에 대한 지속적인 투자와 감사 인력의 전문성 강화를 통해 내부감사 역량을 높일 수 있도록 노력해왔다""며 ""가상자산 산업의 특성을 반영한 감사 절차 정교화, 다양한 디지털 정보를 활용한 점검 등을 통해 건전하고 투명한 가상자산 시장 질서 확립에 기여할 것""이라고 말했다.",https://n.news.naver.com/mnews/article/123/0002373800
2025-12-15 10:03:00,"[속보] 내란특검 ""尹, 반대세력제거·권력독점 계엄 선포...2023년 10월 전부터 준비""","[속보] 내란특검 ""尹, 반대세력제거·권력독점 계엄 선포...2023년 10월 전부터 준비""",https://n.news.naver.com/mnews/article/123/0002373799
2025-12-15 10:00:00,"삼양사 어바웃미, 쌀눈과 미강에서 얻은 ‘쌀 막걸리 PDRN 랩핑 마스크’","삼양사 비건 클린 뷰티 브랜드 어바웃미(AboutMe)는 신제품 '쌀 막걸리 PDRN 랩핑 마스크'를 출시했다고 15일 밝혔다.  이번 제품은 스킨 부스팅 성분으로 주목받는 PDRN(Polydeoxyribonucleotide) 성분을 식물성 원료로 구현했다.  어바웃미는 쌀눈과 미강에서 얻은 DNA를 고순도로 정제해 생산되는 비건 PDRN을 제품에 적용했다. DNA를 저분자 형태로 가공해 피부 흡수력을 높이도록 설계했다.  신제품은 △보습 성분 쌀겨수 △비타민과 미네랄을 함유한 쌀가루 △발효 과정에서 얻은 유효 성분 막걸리수 △갈락토미세스발효여과물 등을 주원료로 사용했다.  제품관계자는 ""인체적용시험에서 1회 사용만으로 피부 광채와 톤이 각각 116.87%, 102.86% 개선된 것으로 나타났고 피부 결이 109.12% 개선됐다""고 말했다.  이번 신제품은 어바웃미 공식몰에서 개당 25,000에 구매할 수 있다. 어바웃미 공식몰에서 구매 시 30% 할인된 가격인 17,500원에 구매 가능하다.. 해당 이벤트는 출시일인 이달 23일까지 진행한다.  어바웃미는 자연 유래 성분을 주 원료로 하는 비건 클린 뷰티 브랜드로, 동물성 원료를 사용하지 않는 제품에만 부여되는 '한국비건인증원'의 비건 인증을 획득했다.  패키지는 국제산림관리협의회(FSC) 인증을 받은 친환경 종이와 콩기름 잉크를 사용해 제작했다. 재활용 플라스틱을 사용한 튜브 용기를 적용해 제품 사용부터 폐기까지의 전 과정에서 환경 부담을 줄였다.",https://n.news.naver.com/mnews/article/123/0002373798
2025-12-15 09:59:00,"두나무, 개발자 50명 채용 나서…플랫폼 경쟁력 강화 박차","디지털자산 거래소 업비트를 운영하는 두나무(대표 오경석)는 내년 1월까지 개발자 50명 이상을 채용한다고 15일 밝혔다.  두나무는 이번 채용을 통해 업비트와 증권플러스 등 주요 서비스의 기술 고도화와 제도 변화 대응을 위한 인력을 보강할 계획이다. 특히 ▲웹3 인프라 브랜드 '기와(GIWA)' ▲법인용 수탁 서비스 '업비트 커스터디' 등 핵심 기술 프로젝트의 완성도를 높이는 데 집중할 방침이다.  이번 채용은 ▲백엔드 ▲프론트엔드 ▲인프라 ▲블록체인 등 개발 직군 전반에서 진행되며, 50명 이상 규모의 경력직 채용으로 이뤄진다.  서류 전형, 과제 전형, 실무진 인터뷰, 임원 인터뷰 순으로 진행되며, 지원자는 직무별 자격 요건과 우대 사항을 두나무 공식 채용 페이지에서 확인할 수 있다.  두나무 관계자는 ""'기술이 곧 경쟁력'이라는 원칙을 바탕으로, 금융과 블록체인을 잇는 혁신을 이어나가고 있다""며 ""개발자들이 새로운 시도를 주도하고 성장할 수 있는 환경을 공고히 하겠다""고 말했다.",https://n.news.naver.com/mnews/article/123/0002373797
2025-12-15 09:56:00,삼일PwC “위계 없는 이사회…상호감독 통해 책임 명확히 해야”,"삼일PwC가 이사회 책임성 강화를 위한 구체적 로드맵을 제시하며, 이사회 구성원 간 상호감독과 자기 규율의 중요성을 강조했다.  삼일PwC 거버넌스센터는 최근 발간한 '거버넌스 포커스 제32호'를 통해 전 세계적으로 기업 이사의 역할이 중요해지는 가운데 책임의 복잡성이 커지고 있으며, 이사회 경험에 대한 이사들의 불만도 증가하고 있다고 15일 밝혔다. 이번 보고서는 이사회 책임 이행을 위한 '책임 이행 로드맵'을 제시하고, 상법 개정을 계기로 실시한 국내 상장사 사외이사 대상 설문조사 결과도 함께 공개했다.   보고서는 미국 상장사 600명 이상의 이사를 대상으로 한 'PwC 연례 기업 이사 설문조사' 결과를 분석했다. 조사에 따르면 응답자의 55%가 이사회 구성원의 교체가 필요하다고 응답했으며, 그 이유로는 이사회 토론 기여도 부족(41%)과 이사의 전문성 부족(21%)이 꼽혔다. 이사회 내 역동성이 떨어지고 실질적인 토론과 감독 기능이 약화된 현실이 드러난 셈이다.  이에 대해 조명현 고려대학교 경영대학 교수(전 한국기업지배구조원장·현 한국ESG기준원)는 ""이런 결과는 토론에 활발히 참여해 이사회의 주된 기능인 감독 및 조언 기능을 잘 수행하기보다 '이사 자리'에만 연연하는 이사가 꽤 있다는 뜻""이라며 ""이사회의 역동성을 높이려면 이사후보추천위원회 역할 제고 등을 통해 적격성을 갖춘 이사 선임 과정에서부터 구조적 문제를 해결해야 한다""고 말했다.  설문조사에서는 이사회 평가에 대한 회의적 시각도 뚜렷하게 나타났다. 응답자의 78%는 현재의 이사회 평가 방식이 이사회 성과를 충분히 보여주지 못한다고 답했으며, 절반 이상(51%)은 평가 과정에 충분한 투자가 이뤄지지 않고 있다고 응답했다. 이는 이사회 평가가 실질적 개선 수단으로 활용되지 못하고 있으며, 보다 체계적이고 객관적인 평가 제도가 필요함을 시사한다.  허제헌 삼일PwC 거버넌스센터 파트너는 ""대부분의 조직 구조와 달리 이사회는 위계 없이 운영되며 이사 간 상호 감독이 기본이 되기 때문에, 이사회 운영을 위한 정책과 절차 수립, 문화, 관계 구축, 자기 규율이 매우 중요하다""며 ""정기적이고 객관적인 이사회 평가를 통해 이사회 활동을 점검하고 개선해 가는 것이 필수적이다""고 강조했다.  이번 보고서에서 제시한 '책임 이행 로드맵'은 책임과 주인의식을 기반으로 하는 이사회 문화를 구축하기 위한 구체적인 행동 지침을 담고 있다. 로드맵은 △개별 이사 △이사회 리더십 △이사회 전체 △경영진 등 네 가지 관점에서 실행 방안을 제시했다.  개별 이사 차원에서는 동료 이사와의 비공식적 소통, 동료 멘토링 참여, 개인 역량 강화에 집중, 개별 이사 평가 도입 지지 등이 제안됐다. 이사회 리더십 차원에서는 이사회 리더십 승계 계획 수립, 공감을 바탕으로 한 어려운 대화 시도, 포용적 문화 구축이 포함됐다.  이사회 전체 차원에서는 이사회 평가 재구상, 이사 선임 프로세스 재설계, 온보딩 및 리보딩 투자, 신중한 교체 관행 도입이 강조됐다. 마지막으로 경영진에게는 이사회 정보 명확성 개선, 맞춤형 교육 제공, 관계 구축 기회 조성 등이 제안됐다.  한편, 삼일PwC는 이번 보고서를 통해 ""이사회가 위계 없는 구조 속에서 상호감독과 책임 의식을 바탕으로 운영될 때, 지속가능한 거버넌스 체계가 확립될 수 있다""고 밝혔다.",https://n.news.naver.com/mnews/article/123/0002373796
2025-12-15 09:49:00,"인구감소지역, '양도세·종부세' 혜택 대상 확대 [2026 달라지는 세제-①부동산]","1. 양도소득의 필요경비 계산 특례 적용 예외 대상 추가 (소득법)  양도일부터 10년 이내에 배우자 또는 직계존비속으로부터 증여받은 자산을 양도하는 경우, 증여자의 당초 취득가액을 해당 자산의 취득가액으로 하는 양도소득 필요경비 계산 특례를 적용한다.  다만, 양도 당시 증여자인 직계존비속이 사망한 경우는 배우자가 사망한 경우와 마찬가지로 해당 특례 적용이 배제된다. (적용시기 : 2026년 1월 1일 이후 양도하는 분부터 적용)  2. 수용 시 주택부수토지 판단 기준일 조정 (소득령)  토지가 공익사업을 위한 토지 등의 취득 및 보상에 관한 법률에 따라 협의 매수·수용되거나 그 밖의 법률에 의해 수용되는 경우, 사업인정 고시일 직전일의 토지 용도에 따라 주택부수토지 인정 배율을 결정한다. (적용시기 : 영 시행일(2025년 11월 28일) 이후 양도하는 분부터 적용)  3. 비수도권 준공 후 미분양 주택에 대한 양도소득세 중과 배제 기간을 2026년 12월 31일까지 취득하는 분으로 1년 연장 (소득령)  4. 비수도권 준공 후 미분양 주택의 종합부동산세 중과 배제 기간을 2026년 12월 31일까지 취득하는 경우로 1년 연장 (종부령)  5. 인구감소지역 주택 취득에 대한 양도소득세 및 종합부동산세 특례 적용대상 지역에 비수도권 인구감소관심지역 추가 (조특법)  인구감소지역과 수도권 밖의 지역으로서 지방자치분권 및 지역균형발전에 관 한 특별법 제2조제12호의2에 따른 인구감소관심지역을 추가 (적용시기 : 2025년 11월 28일 이후 취득하는 주택분부터 적용)  6. 주택건설사업자가 토지를 취득한 후 천재지변 등 정당한 사유로 5년 이내 사업계획 승인을 받지 못한 경우, 종합부동산세 추징 대상에서 제외 (조특법) (적용시기 : 2026년 1월 1일 이후 추징 사유가 발생하는 분부터 적용)  7. 인구감소지역의 주택 취득자에 대한 양도소득세 및 종합부동산세 특례가 적용되는 주택 가액을 수도권 공시가격 4억원, 비수도권 공시가격 9억원으로 상향 (조특령) (적용시기 : 2025년 8월 14일 이후 취득하는 분부터 적용)  8. 고가주택(기준시가 12억원 초과)을 보유한 2주택자의 간주임대료 과세대상을 전세보증금 합계 12억원 초과로 구체화한다. (소득령) (적용시기 : 2026년 1월 1일 이후 발생하는 소득분부터 적용)  <출처 : 2025 핵심 개정세법 -한국세무사회>",https://n.news.naver.com/mnews/article/123/0002373795
2025-12-15 09:48:00,"코스피, 100포인트 이상 급락세로 장 시작...코스닥도 내림세 출발","15일 코스피지수가 전 거래일보다 113.42포인트 내린 4053.74에 장을 시작했다. 코스닥지수도 11.74p 내린 925.60에 개장했다. 외국인과 기관이 매도에 나서며 시가총액 상위 대형주들 대부분 하락세를 보인데 따른 것으로 풀이된다.  한국거래소에 따르면, 이날 오전 9시 38분 기준 코스피지수는 전일 대비 73.02포인트(1.75%) 하락한 4,094.14에 거래되고 있다. 급락장으로 시작했지만 시간이 지날수록 하락폭을 줄이고 있는 모양새다.  같은 시각 코스닥지수 역시 전일 대비 4.61포인트(0.49%) 하락한 932.73을 가리키며 장 개시이후 하락폭을 만회하고 있다.",https://n.news.naver.com/mnews/article/123/0002373794
2025-12-15 09:47:00,"삼정KPMG “中 한일령, 한국 호텔 시장 구조적 변화 본격화”","중국 정부의 한일령(限日令) 조치로 중국과 일본 간 관광이 급격히 위축되면서 아시아 관광 수요가 빠르게 재편되고 있다. 이에 따라 한국 호텔 시장에서도 구조적 변화가 본격적으로 나타나고 있다.  삼정KPMG는 '중국 한일령과 한국 호텔 시장 영향 분석' 보고서를 통해 이번 조치가 단기적인 수요 변동을 넘어 한국 호텔 시장 전반을 재평가할 구조적 계기로 작용할 것이라고 15일 밝혔다.  보고서는 중국의 일본 여행 제한이 한국 관광 및 호텔 시장에 가져올 변화를 심층 분석하며, 중국 한일령 압력의 영향과 향후 한국을 포함한 아시아 관광 수요 재편 가능성을 전망했다.  이번 규제는 다카이치 사나에 일본 총리의 '대만 유사 사태 시 군사 개입' 발언에 대응해 중국이 일본 방문을 사실상 억제하면서 촉발됐다. 중국 정부는 2017년 한한령을 비롯해 정치적 갈등이 발생할 때마다 해외여행을 통제해 온 바 있다.  이번 조치 또한 중국 국민 정서 변화와 정책 방향에 따라 중단기적으로 관광 흐름을 빠르게 바꿀 가능성이 큰 것으로 평가된다.  삼정KPMG는 중국의 일본 여행 제약이 장기화될 경우 중국인 관광 수요가 동남아시아 및 한국 등 인접 지역으로 분산될 수 있다고 분석했다. 실제로 태국과 싱가포르, 말레이시아 등은 언어 소통의 편의성과 정치적 중립성을 기반으로 유력한 대체지로 부상하고 있다. 아울러 지리적 근접성과 한류 확산을 고려하면 한국 역시 중국인 관광객에게 충분히 경쟁력 있는 선택지로 재부상할 여지가 크다고 평가했다.  보고서는 중국인 인바운드가 확대될 경우 서울 관광호텔 시장의 객실 가동률(OCC)과 평균 객실단가(ADR)가 동반 상승하며, 이는 투자수익률 개선과 자산가치 상승을 동시에 견인할 것으로 내다봤다.  특히 3·4성급 호텔은 이미 높은 점유율을 유지하고 있어 추가 수요 유입 시 사실상 연중 만실에 가까운 운영 효율을 보일 것으로 예상했다. 5성급 호텔 대비 초기 투자비용이 낮아 수익성 측면에서도 매력적인 투자 대안으로 부각되고 있다.  또한 보고서는 공급이 제한된 서울의 경우 구조적으로 자산가치 상승 압력이 지속될 가능성이 높다고 분석했다. 수도권 및 부산 등 주요 권역은 투자비 대비 성장 잠재력이 커 새로운 전략적 지역으로 떠오르고 있다고 덧붙였다.  이에 따라 글로벌 및 국내 기관투자자들은 ▲서울 핵심 자산의 추가 밸류업 기회 ▲수도권·부산 등 성장 지역 중심의 포트폴리오 확장 ▲신규 개발 및 리노베이션 프로젝트 참여 등 다각적인 전략을 검토해야 한다고 조언했다.  삼정KPMG 호텔 및 관광산업 전문팀 석봉길 상무는 ""중국의 한일령은 단순한 단기 변수에 그치지 않고 한국 호텔 시장의 구조적 재편을 촉발하는 전환점""이라며 ""지금이 변화 신호를 선제적으로 포착해야 할 중요한 '전략적 투자 타이밍'""이라고 말했다.  한편, 삼정KPMG는 앞으로도 글로벌 지정학 리스크와 관광 수요 변화가 국내 호텔·레저 산업에 미치는 영향을 지속적으로 모니터링하며, 투자자와 기업의 중장기 전략 수립을 지원할 계획이라고 밝혔다.",https://n.news.naver.com/mnews/article/123/0002373793
