날짜,제목,본문,링크
2025-12-18 10:29:00,"비타민하우스, 액상형 식물성 멜라토닌 '스피드 멜라온' 출시","비타민하우스가 편안하고 균형 잡힌 일상을 위한 신제품 '스피드 멜라온'을 출시했다고 18일 밝혔다.  이번 제품은 식물성 멜라토닌을 함유한 액상형 제품으로, 물 없이도 간편하게 섭취 가능하다. 자연 유래 성분에 대한 관심이 높아지는 흐름에 맞춰 토마토에서 추출한 식물성 멜라토닌이 주원료로 활용됐다.  비타민하우스는 ""식물성 멜라토닌은 다양한 식물에 자연적으로 존재하는 성분으로 알려져 있으며, 생체 리듬 조절과 환경 스트레스 대응 등 여러 생리적 과정에 관여하는 것으로 알려져 있다""면서 ""이러한 원료의 특성을 담아 소비자들이 보다 쉽고 편리하게 활용할 수 있도록 제품을 개발했다""고 설명했다.  신제품은 정제 형태 대비 흡수가 빠른 액상 제형으로 제작돼 바쁜 일상 속에서도 빠르고 간편하게 섭취할 수 있다.  비타민하우스 관계자는 ""스피드 멜라온은 바쁜 일상 속에서도 균형 잡힌 생활 패턴을 유지하고자 하는 소비자를 위해 개발된 제품""이라며 ""자연 유래 성분과 액상형의 편리함을 통해 데일리 케어의 새로운 선택지가 되길 바란다""고 말했다.  이번 제품은 비타민하우스 공식 온라인몰 및 주요 온라인 판매 채널에서 구매할 수 있다.",https://n.news.naver.com/mnews/article/123/0002374078
2025-12-18 10:28:00,"대상(주), 독일 아미노산 기업 502억원에 인수","대상(주)가 독일의 의약용 아미노산 전문기업 '아미노 유한회사(AMINO GmbH, 이하 아미노)'를 인수하며 글로벌 의약 바이오 시장에 본격 진출한다고 최근 밝혔다.  대상은 17일 독일 아미노 사의 지분 100%를 502억여 원에 인수하기 위해 승인 절차를 진행하고 있으며, 2026년 3월까지 인수 절차를 완료할 계획이다.  독일 아미노 사는 1958년 설립된 의약용 아미노산 전문기업으로, 의료용 수액제, 환자식, 바이오의약품용 세포배지 및 부형제 제조에 필요한 아미노산을 생산하고 있다.  독일 북부 프렐슈테트 지역에 연구소와 총 3곳의 생산공장(약 6,000㎡ 규모)을 운영하고 있으며, 글로벌 대형 바이오제약 기업 및 환자식 업체와 안정적인 거래관계를 구축하고 있다.  대상은 이번 인수를 통해 의약용 아미노산 시장에 진출할 계획이다. 의약용 아미노산 시장은 고령화 사회 진입과 의료 인프라 확장으로 수액제, 환자식 수요가 지속 증가하면서 매년 10%씩 성장하고 있는 분야다.  단백질·유전자·세포 치료제 등 바이오 의약품 시장이 급성장하면서 아미노산을 필요로 하는 세포배지, 부형제, 시약의 수요도 함께 증가하고 있어 향후 성장 잠재력이 높은 것으로 평가된다.  대상은 아미노 사가 보유한 제조시설 및 설비를 비롯해 67년 업력을 통해 구축한 정제 기술과 유럽 내 인허가 역량을 확보하게 된다.  아울러 아미노 사의 글로벌 대형 거래처 네트워크를 활용해 기존 유럽 시장 점유율을 유지하면서 북미, 아시아 등으로 사업 영역을 확대해 나갈 방침이다. 대상이 영위하고 있는 사료용 아미노산 사업과의 시너지 효과도 창출할 것으로 기대된다.",https://n.news.naver.com/mnews/article/123/0002374077
2025-12-18 10:24:00,"카카오뱅크 첫 투자처 '슈퍼뱅크', 인니 증권거래소 상장…2.6배 성장","카카오뱅크(대표이사 윤호영, Daniel)는 첫 글로벌 투자처인 인도네시아 디지털은행 '슈퍼뱅크(Superbank)'가 17일 인도네시아 증권거래소(IDX)에 성공적으로 상장했다고 18일 밝혔다.   슈퍼뱅크의 청약 신청에는 100만건 이상의 주문이 들어와 318대 1의 경쟁률을 기록할 정도로 인니 투자자들의 뜨거운 호응을 얻었다. 상장 당일 주가는 공모가인 주당 635루피아 보다 약 25% 상승하면서 상한가를 기록했다.  상장 첫날 슈퍼뱅크의 기업 가치는 2조4000억원 규모로 추산됐다. 카카오뱅크가 슈퍼뱅크에 첫 투자를 집행한 지난 2023년 당시 기업 가치 9000억원 대비 2.6배로 성장했다.  카카오뱅크의 보유 지분 가치도 올랐다. 카카오뱅크는 2023년과 2024년 두 차례에 걸쳐 슈퍼뱅크에 총 1140억원을 투자했다. 상장 이후 카카오뱅크가 보유한 지분 가치는 약 2044억원에 이를 것으로 보고 있다.  카카오뱅크 관계자는 ""해외시장 진출을 통한 기업 가치 제고 역량이 숫자로 증명됐다""면서 ""카카오뱅크의 혁신적인 모바일 뱅킹 노하우가 인도네시아 자본시장을 뜨겁게 달궜다""고 평가했다.  카카오뱅크 측에 따르면, 지난 2023년 10월 그랩(Grab)과 동남아시아 사업에 대한 전략적 파트너십을 맺고 슈퍼뱅크에 지분 투자를 단행했다.  카카오뱅크는 고비용·고위험의 인수합병(M&A) 대신 지분투자 방식을 통해 글로벌 진출에 나섰다. 슈퍼뱅크의 런칭부터 상품·서비스 출시, 모바일 앱 UI·UX 등 다양한 분야에서 협력했다. 단순 지분 투자를 넘어 상품 개발에 직접 참여하는 등 카카오뱅크만의 모바일 뱅킹 기술 기반의 자문을 지속 제공해왔다.  슈퍼뱅크의 상품 개발에 직접 참여함으로써 동남아 시장에 대한 전반적인 이해도를 높이고 사업 경험을 축적해 글로벌 역량을 강화할 수 있었다. 또한 다양한 해외 금융사와 협업 시 적용할 수 있는 새로운 비즈니스 모델을 발굴하고 시험해보는 계기가 되기도 했다.  실제로 카카오뱅크가 제시한 아이디어를 토대로 선보인 신상품 'Kartu Untung(카르투 언퉁)'은 출시 2주 만에 가입자 10만 명이 몰리는 등 현지 고객으로부터 큰 호응을 얻고 있다는 게 카카오뱅크 측 설명이다.  이를 통해 슈퍼뱅크 런칭 1년 6개월 만에 증시 상장이 가능했다는 설명이다. 슈퍼뱅크는 공식 런칭 9개월 만인 올 1분기 흑자 전환에 성공한 데 이어 현재 500만명 이상의 고객을 확보하는 등 성장세를 이어가고 있다.  카카오뱅크는 슈퍼뱅크와의 협업 성공 사례를 발판으로 글로벌 진출 영역을 확장한다는 방침이다. 동남아시아뿐 아니라 기타 지역으로 진출 국가를 넓히고 모바일 금융 시스템 구축을 주도한다는 계획이다.  지난 6월 인가 획득 이후 서비스 개시를 준비 중인 태국 가상은행의 경우 서비스뿐 아니라 모바일 앱 개발도 이끌어 나갈 에정이다. 동남아시아 사업 협력에 대한 파트너십을 체결한 그랩(Grab)과도 협력 논의를 이어가 시너지 창출을 모색한다는 계획이다.  윤호영 카카오뱅크 대표이사는 ""카카오뱅크에 최적화된 글로벌 진출 방식을 수립해 결실을 내보이면서 모바일 금융 기술력에 기반한 글로벌 사업 확장의 경쟁력과 가능성을 입증했다""며 ""글로벌 디지털뱅킹 네트워크를 구축해 중장기 성장 동력을 확보하겠다""라고 강조했다.",https://n.news.naver.com/mnews/article/123/0002374076
2025-12-18 10:13:00,"스타벅스, 유용욱 셰프 협업 '테이스티 저니 샌드위치' 매장 확대","스타벅스코리아(대표 손정현)가 테이스티 저니(Tasty Journey) 프로그램으로 지난 5일 선보인 '유용욱 바베큐 투컷 비프 샌드위치'가 스타벅스 리저브광화문점, 망원한강공원점, 서울숲역점, 스타필드코엑스몰R점, 용산역써밋R점 등에서 한정 판매 중이라고 최근 밝혔다.  테이스티 저니는 지난해 10월부터 다양한 컬래버레이션 상품을 선보이는 프로그램으로 '일상에 새로운 자극이 필요할 때 맛으로 떠나는 짧은 여행'이라는 콘셉트를 기반으로 고객들에게 미식 경험을 제공하기 위해 기획됐다.   스타벅스는 '유용욱 바베큐 투컷 비프 샌드위치' 출시를 기념해 오는 19일 스타벅스 리저브광화문점에서 오후 12시 30분부터 오후 3시까지 유용욱 셰프가 직접 현장에서 제조한 샌드위치를 선착순 70명에게 판매하는 쿠킹 이벤트를 진행한다.  해당 선착순 고객에게는 리저브 콜드 브루 또는 따뜻한 리저브 아메리카노 중에서 선택할 수 있는 무료 음료 1잔을 비롯해 휴대용 런치박스 1개씩을 함께 증정한다.  이달 26일부터 센터필드R점, 대구그랜드호텔R점, 나주혁신DT점, 전주에코DT점, 명지강변DT점을 추가해 총 10곳으로 판매 매장을 확대한다.  이를 기념해 26일부터 1월 7일까지 매장별로 '유용욱 바베큐 투컷 비프 샌드위치'를 구매하는 선착순 10명에게 카페 아메리카노 1잔을 현장에서 무료로 증정한다. 기존 5개 매장에서 계획했던 모든 구매 고객 대상 아메리카노 증정 이벤트 역시 26일부터 선착순 10명 증정으로 변경돼 진행된다.",https://n.news.naver.com/mnews/article/123/0002374075
2025-12-18 10:01:00,"올해 9월 신청한 근로장려금, 18일 지급","국세청은 저소득 근로자 가구의 생활 안정을 신속하게 지원하기 위해 '2025년 귀속 상반기분 근로장려금'을 법정기한(12월 30일)보다 앞당겨 이달 18일 지급한다고 밝혔다.  국세청에 따르면 이번에 지급하는 상반기분 근로장려금은 올해 9월에 장려금을 신청한 근로소득만 있는 가구로서 소득·재산 요건을 충족한 114만 가구에 5532억원이 지급되며, 가구당 평균 지급액은 48만원이다.   연령별 근로장려금 수급 현황을 보면, 노인 일자리 참여가 많은 60대 이상(53.7%)과 사회초년생이 많은 20대 이하(20.2%)가 전체의 73.9%를 차지했다. 30대~50대는 고르게(6~11%) 분포되어 있다.  가구유형별 근로장려금은 단독가구가 74만 가구(64.8%)로 수급자 3명 중 2명의 비율로 차지하고 있으며 홑벌이는 35만 가구(31.0%), 맞벌이는 5만 가구(4.2%)로 지난해와 유사한 것으로 나타났다.  장려금은 신청 시 선택한 지급방법에 따라 계좌 또는 현금으로 지급되며, 현금 지급을 선택한 경우에는 등기우편으로 발송된 국세환급금통지서와 신분증을 가지고 우체국에서 장려금을 수령할 수 있다.  심사결과는 모바일⸱우편으로 발송한 결정통지서를 통해 확인할 수 있다. 장려금 상담센터(☎1566-3636), 자동응답시스템(1544-9944), 홈택스(모바일,PC)로도 확인이 가능하다.  상반기분 근로장려금을 신청하지 못한 경우에도 하반기분 신청기간(2026년 3월 1일~16일) 또는 정기분 신청기간(2026년 5월 1일~6월 1일)에 신청할 수 있다.  다음은 반기분 근로장려금 주요 문답 사례.  Q. 반기분 근로장려금은 누가 신청할 수 있나요?  ▶반기별 소득 파악이 가능한 근로소득(배우자 포함)만 있는 경우로 한정되며, 이 경우 반기분과 정기분 중 선택해 신청 가능합니다.  Q. 이번 9월에 반기 신청했는데, 내년 8월에 정기 심사 때 심사하는 경우도 있나요?  ▶반기분 근로장려금을 신청한 근로소득자가 근로소득 외 다른 소득(사업소득·기타소득 등)이 있는 경우(배우자 포함)에는 정기 신청(5월)한 것으로 보아 8월에 심사해 지급합니다.  Q. 상반기 소득분에 대해 반기 신청한 경우 하반기 소득분도 별도 신청해야 하나요?  ▶별도로 신청하지 않아도 됩니다. 근로소득만 있는 거주자가 상반기 소득분에 대해 반기 신청한 경우 하반기 소득분은 신청한 것으로 간주합니다. (조세특례제한법 §100의6⑨)  Q. 상반기 신청의 경우 장려금 산정액의 35%만 지급하는 이유는 무엇인가요?  ▶상반기분 지급(12월) 후 정산 시(다음 해 6월) 연간 총소득 또는 재산 가액이 변동되는 경우 환수가 발생할 수 있어 환수로 인한 납세자의 불편을 최소화하기 위해 산정액의 35%를 지급하는 것입니다. (상반기분) 연간 산정액의 35% 지급 (정산) 연간 산정액 – 이미 지급한 상반기 근로장려금 = 추가지급 또는 환수  Q. 신청한 금액과 지급받은 금액이 다른 이유가 궁금합니다.  ▶ 심사 시, 지급요건 검토 후 지급금액이 달라질 수 있습니다.  예를 들어, 가구원 모두의 재산합계액이 1억 7000만 원 이상~2억 4000만 원 미만인 경우에 산정액의 50%에 해당하는 금액만 지급됩니다.(2억 4000만 원 이상인 경우 지급제외)  ▶ 반기 신청의 경우, 수집 가능한 소득 발생연도 전년도 기준 요건(가구원, 재산, 총소득금액)에 의해 상반기분(2025년 12월)을 미리 지급한 후 하반기분(2026년 6월)에는 소득 발생연도 기준 요건으로 정산*하면서 추가지급하거나 환수하게 됩니다.  *(차액) 연간 산정액 〉 상반기 지급액 : 추가지급, 연간 산정액 〈 상반기 지급액 : 환수  ※ 환수하는 경우 환수 순서 ① 해당 소득세 과세기간의 자녀장려금에서 차감 ② ① 이후 환수 금액이 남은 경우, 10개 과세기간의 근로⸱자녀장려금에서 차감 (다만, 본인이 납부 고지 요청할 경우에는 즉시 소득세 납부 고지) ③ ② 이후 환수 금액이 남은 경우에는 환수 금액을 소득세 납부 고지  ▶ 또한, 국세 체납액(환급금의 30% 한도 내 충당)이 있는 경우에도 차감해 지급합니다.  Q. 상반기분 근로장려금을 지급받지 못하는 경우는 무엇인가요?  ▶ 2024년 연간 총소득금액이 기준금액(단독가구 2200만원, 홑벌이 3200만원, 맞벌이 4400만원) 이상이거나, 가구원의 2024년 6월 1일 기준 재산의 합계액이 2억 4000만원 이상인 경우 근로장려금을 지급제외 합니다.  ▶ 상반기분 근로장려금의 지급대상금액이 15만원 미만인 경우(조세특례제한법 §100의8⑤)와 이전에 발생한 환수할 금액이 올해 상반기분 근로장려금보다 많을 경우에도 근로장려금 지급을 제외합니다.  ▶ 특히, 올해 상반기분 심사 때는 당해연도 재산 및 소득자료를 조기에 수집·반영해 내년 정산 시 환수가 예상될 경우에는 이번에 지급하지 않고 내년 6월에 지급여부 및 금액을 결정합니다.",https://n.news.naver.com/mnews/article/123/0002374074
2025-12-18 09:56:00,‘미국산 만다린 무관세’ 임박…제주 감귤 산업 붕괴 우려 확산,"미국산 만다린(감귤류)에 대한 관세가 내년부터 완전히 폐지될 예정이면서 제주지역 감귤 산업이 큰 타격을 받을 수 있다는 우려가 커지고 있다. 제주 감귤 농가들은 수입 개방이 현실화될 경우 국내 감귤 시장이 붕괴될 수 있다며 정부의 긴급 보호 조치를 요구했다.  18일 사단법인 한국후계농업경영인 제주도연합회는 성명을 통해 ""미국산 만다린 관세 폐지로 감귤 농가가 생존 위기에 놓였다""며 ""정부는 붕괴 직전의 제주 감귤 산업을 보호하기 위한 실질적 대책을 마련해야 한다""고 밝혔다.  연합회는 ""2012년 한·미 자유무역협정(FTA) 발효 이후 미국산 만다린 수입 관세율은 당시 144%에서 매년 9.6%씩 인하돼 왔다""며 ""2026년부터는 완전 무관세가 적용된다""고 설명했다.  이어 ""관세가 사라진 미국산 만다린은 가격과 물량 경쟁에서 제주 감귤을 압도할 것이며, 국내 감귤 농가의 피해가 불가피하다""고 주장했다.  수입량 증가세도 뚜렷하다. 미국산 만다린 수입 물량은 2017년 0.1톤에서 2019년 152.1톤으로 늘었고, 지난해에는 3099톤까지 급증했다. 특히 올해 상반기에는 관세율이 9.5%로 떨어지자 이미 작년 대비 2배 이상 많은 7915톤이 수입된 것으로 나타났다.  연합회는 ""올해 들어 미국산 만다린 수입 급증으로 2∼4월 한라봉 가격이 전년 동기 대비 20%, 천혜향은 28% 하락했다""며 ""이는 곧 제주 감귤 가격 폭락과 유통 혼란으로 이어질 것""이라고 우려했다.  제주 감귤 농가들은 정부에 긴급 대응책을 촉구했다. 연합회는 ""제주 감귤 산업이 붕괴하기 전에 특별긴급관세를 발동하고 감귤 농가의 소득 안전망을 구축해야 한다""며 ""지속 가능한 영농을 위한 실질적 보호 정책이 절실하다""고 강조했다.  한편 농업계는 관세 폐지로 인한 국내 과수 산업의 피해가 제주 감귤에만 국한되지 않을 것으로 보고 있다. 전문가들은 미국산 만다린의 가격 경쟁력 강화가 유통 구조 전반에 파급될 수 있다며 정부 차원의 시장 안정화 방안이 필요하다고 지적했다.",https://n.news.naver.com/mnews/article/123/0002374073
2025-12-18 09:54:00,한화갤러리아 2거래일 연속 폭등…“신사업 기대감 반영”,한화갤러리아 주가가 18일 장 초반 급등세를 이어가며 시장의 이목을 끌고 있다. 전날 상한가에 이어 이날에도 25%대 급등세를 보이며 연이틀 강한 상승 흐름을 나타냈다.  18일 유가증권시장에서 한화갤러리아는 오전 9시40분 기준 전 거래일보다 25.64% 오른 1813원에 거래됐다. 전날 상한가로 장을 마친 데 이어 이틀 연속 상승세를 기록한 것이다.  투자자들 사이에서는 김동원 한화생명 사장과 김동선 한화갤러리아 부사장이 한화에너지 지분 일부를 매각해 증여세를 납부하고 남은 자금을 계열사 신사업 확장에 활용할 것이라는 일부 언론보도가 투자심리를 자극한 것으로 풀이되고 있다. 대형 포털 종목토론방 등에서도 관련 내용이 확산되며 매수세가 몰리고 있다.  한화갤러리아는 전날 사모펀드 운용사 H&Q에쿼티파트너스와 미국 버거 브랜드 '파이브가이즈'의 지분 매각과 관련한 양해각서(MOU)를 체결했다고 공시했다. 파이브가이즈는 한화그룹 3남 김동선 부사장이 주도해 2023년 국내에 도입한 브랜드다.  한편 시장에서는 한화갤러리아의 이번 급등이 실적 개선보다는 지분 매각 이슈와 브랜드 사업 확장 기대감에 따른 단기 반응일 가능성이 크다고 보고 있다. 향후 구체적인 지분 매각 규모와 자금 활용 계획이 공개될 경우 주가 흐름에 변동이 있을 것으로 전망된다.  아울러 파이브가이즈의 국내 사업 확장 속도와 H&Q와의 협력 구조가 실질적인 실적 개선으로 이어질지 여부에도 시장의 관심이 집중되고 있다.,https://n.news.naver.com/mnews/article/123/0002374072
2025-12-18 09:49:00,"삼일PwC, 동남아 진출 기업 위한 ‘트러스트 인프라 서비스’ 출시","삼일PwC는 동남아시아에 진출한 국내 기업의 현지 법인과 지점을 대상으로 한 종합 리스크 관리 서비스 '트러스트 인프라 서비스(가칭)'를 공식 출시한다고 18일 밝혔다.  최근 글로벌 공급망 재편과 현지 규제 변화, 복잡한 사업 환경으로 인해 동남아 지역에 진출한 국내 기업 사이에서 예상치 못한 사고가 잇따르고 있다.  특히 한국과 다른 문화와 제도, 관행 속에서 발생하는 관리 공백이 주요 문제로 지적되고 있고 생산과 제조 등 밸류체인 핵심 기능에 집중된 현지 법인에서는 조달, 인력 활용, 제3자 거래, 수작업 프로세스 중심으로 부정과 오류 리스크가 빈번히 보고되고 있다.  삼일PwC 동남아시아 비즈니스 플랫폼은 현지 네트워크와 지역 전문성을 바탕으로 기업의 리스크를 종합적으로 관리하는 서비스를 제공한다.  본사와 현지 법인 간의 운영 정책을 분석하고 내부감사 체계를 구축해 구조적으로 리스크를 줄이며, 데이터 기반의 관리체계 진단을 통해 부정 발생 가능 영역을 정량적으로 파악한다. 이를 기반으로 리스크 관리 체계에 대한 실질적 제언과 인사이트를 제시한다.  또한 자금, 구매, 급여 등 핵심 프로세스에 대한 포렌식 기반 부정 진단과 커뮤니케이션 모니터링을 통한 실시간 예방 및 감시 서비스를 운영한다. 인공지능(AI) 기반 공급망 모니터링을 통해 조달 분야의 부정 리스크를 다각도로 분석하고, 사고 발생 시 외부감사 및 내부감사 전문가로 구성된 전담팀이 현장 경영진단, 부정 정황 조사, 피해 금액 산정 등 포렌식 조사를 수행한다. 필요시에는 내부통제 개선과 거버넌스 재정비 등 후속 조치도 지원한다.  스티븐 정 삼일PwC 동남아시아 비즈니스 플랫폼 리더(파트너)는 ""조직 특성과 운영 환경에 최적화된 트러스트 인프라를 얼마나 정교하게 설계하느냐가 기업의 리스크 대응 역량을 좌우한다""며 ""특히 AI 대전환과 급격한 비즈니스 환경 변화 속에서 이런 인프라 구축은 과거보다 훨씬 빠르게 기업의 성과와 안정성을 높이는 핵심 동력이 될 것""이라고 말했다.  이승환 삼일PwC AX 노드 리더(부대표)는 ""AI 활용이 본격화되면서 기업의 리스크 구조와 운영 방식이 빠르게 바뀌고 있다""며 ""특히 동남아 시장은 데이터 환경과 인프라 수준이 제각각이어서 AI 도입 초기부터 리스크 관리와 내부통제를 함께 설계하는 것이 지속가능한 전환의 핵심""이라고 설명했다.  한편, 삼일PwC는 앞으로 동남아에 진출한 한국 기업을 대상으로 진단부터 예방, 적발, 사후관리까지 전 주기에 걸친 서비스를 제공할 계획이다. 또한 AI 기술을 활용한 분석 및 모니터링 체계를 지속적으로 고도화하고, 전사적 역량을 활용한 확장형 서비스 라인업을 통해 해외 법인 리스크 관리의 새로운 표준을 제시한다는 방침이다.",https://n.news.naver.com/mnews/article/123/0002374071
