날짜,제목,본문,링크
2025-12-15 13:01:00,"‘돈나무 언니’의 경고 “비트코인, 장기적으로 금보다 나을 수도”","'돈나무 언니'로 불리는 캐시 우드 아크 인베스트 최고경영자가 최근 급등한 금값에 대해 ""역사적 고점에 근접했다""고 경고했다. 우드는 향후 금값이 급락할 가능성이 높다고 전망했다.  14일(현지 시각) 미국 경제매체 더스트리트에 따르면 우드 CEO는 아크 인베스트 공식 팟캐스트에서 금 시장의 현재 상황을 분석했다. 그는 ""시중 통화량(M2) 대비 금 보유량이 대공황을 제외하면 역사상 최고 수준""이라고 말했다.  2025년 기준 시중 통화량 대비 금 시가총액 비율은 125%로 집계됐다. 이는 대공황 시기 1930년대의 171%를 제외하면 1980년 금값 정점기와 동일한 수준이다. 당시 금값은 인플레이션 우려 속에 급등했지만 이후 장기 하락세로 전환됐다.  우드는 ""코로나19 이후 급증한 유동성과 인플레이션 방어 심리가 현재 금 매수세의 핵심""이라며 ""역사적으로 인플레이션 우려가 사라지면 금값은 급락해 왔다""고 설명했다.  그는 물가 흐름에 대해 ""추가 금리 인상보다는 실질 성장과 생산성 향상이 물가를 안정시킬 것""이라고 분석했다. 이어 ""블록체인과 인공지능 로봇공학 자동화 확산은 기업의 생산비를 낮추고 공급 능력을 높이면서 전반적인 물가 수준을 낮출 것""이라고 내다봤다.  우드는 ""기술 혁신이 경제 전반의 효율성을 높이면 기업은 적은 비용으로 더 많은 상품을 생산할 수 있고 이는 인플레이션 하락으로 이어진다""고 덧붙였다.  그는 1980년대 금 시장을 대표 사례로 언급했다. 당시 금값은 온스당 850달러까지 치솟았으나 이후 5년 동안 약 67% 하락했다. 이는 레이건 행정부의 감세 정책과 규제 완화 그리고 통화 긴축이 주식과 채권 시장으로 자금을 이동시켰기 때문이었다.  우드는 ""지금은 당시보다 더 강력한 환경으로 이동하고 있다""며 ""트럼프 행정부의 감세 정책은 스테로이드 맞은 레이거노믹스와 같다""고 평가했다. 이어 ""앞으로 4~5년 안에 금값 하락이 나타나더라도 놀라운 일은 아니다""라고 말했다.  아울러 그는 장기 자산 관점에서 '비트코인'이 금보다 우월한 수익을 낼 수 있다고 전망했다.  다만 금값 상승세를 전망하는 시각도 여전히 존재한다. 금값은 지난해 10월 사상 처음 온스당 4000달러를 돌파한 후 상승세를 이어가고 있다. 지난 4일 뉴욕상품거래소에서 금 선물 가격은 온스당 4243달러로 10월 7일 대비 5.95% 상승했다.  한편, 주식시장이 주춤하면서 안전자산 선호 심리가 강화된 점이 금 수요를 떠받치고 있다. 글로벌 투자은행 골드만삭스의 설문조사에 따르면 기관투자가의 36%는 내년 금값이 온스당 5000달러를 돌파할 것으로 내다봤다.",https://n.news.naver.com/mnews/article/123/0002373819
2025-12-15 12:57:00,[속보] 카카오 사옥 폭발물 위협에 긴급 재택근무 전환,"카카오가 폭발물 위협을 받은 뒤 전 직원을 즉시 재택근무로 전환했다. 사옥 내 안전을 확보하기 위한 긴급 조치였다.  15일 정보통신기술 업계에 따르면 이날 오전 카카오 고객센터에 '사옥에 폭발물을 설치했다'는 내용의 위협성 메시지가 접수됐다. 카카오는 즉시 경찰에 신고했으며 신속하게 대응에 나섰다.  카카오 관계자는 ""직원의 안전을 최우선으로 판단해 전 직원 재택근무로 전환하기로 결정했다""고 밝혔다. 회사는 내부 공지를 통해 전 직원에게 재택근무 전환을 안내한 것으로 전해졌다.  한편, 경찰은 위협 메시지의 발신 경로와 신원을 추적 중이다. 사옥 인근에는 폭발물 탐지반이 출동해 수색 작업을 진행하고 있다. 카카오는 경찰의 조사에 협조하며 상황을 예의주시하고 있다.",https://n.news.naver.com/mnews/article/123/0002373818
2025-12-15 12:17:00,"법무법인 바른, 홍승진 외국변호사·진혜인 변호사 영입","법무법인 바른이 입법 및 규제대응 분야 전문가인 홍승진 외국변호사, 금융 스페셜리스트인 진혜인 변호사(변시5회)를 영입했다고 15일 밝혔다.  홍승진 외국변호사는 입법컨설팅과 기업을 위한 규제대응 분야의 전문가다. 1991년 행정고등고시에 합격해 법제처, 국무총리행정심판위원회에서 기획재정부 등 중요 부처 소관 법령의 심사 및 법제기획, 행정심판, 국회의원 입법지원, 해외법제기관과의 국제협력, 법령정보화 업무 및 언론대응을 담당했다.  홍 변호사는 다년간 중앙행정부처의 행정입법과 법제기획업무를 총괄한 후 광장으로 옮겨 법제컨설팅팀에서 축적한 전문성과 경험을 바탕으로 바른에 합류했다. 홍 변호사는 기업규제대응, 법제컨설팅, 외국투자, 준법감시, 국회 및 지방자치단체 입법자문 등 다양한 분야에서 기업고객의 시간과 비용을 절감하는 소송 전 사전 권리구제 분야에 특화된 포괄적 자문업무를 담당하고 있다.  진혜인 변호사는 올해 바른에 영입된 부동산 및 외국인투자(FDI)·프로젝트 파이낸스 분야 스페셜리스트다. 법무법인 태평양과 율촌을 거쳐 다올자산운용 대체투자팀, 덴톤스리법률사무소를 거쳐 바른에 합류했다.  국내 기업의 해외 진출과 글로벌 투자자의 한국 투자 등 inbound·outbound 크로스보더 거래를 폭넓게 다루며, 대규모 부동산 개발·관광·레저 복합시설, 복합문화·아레나 개발 관련 프로젝트 등과 관련한 투자 구조 설계, 프로젝트 파이낸싱, 인허가·규제 자문, 계약 협상 및 분쟁 대응까지 전 주기에 걸친 업무를 수행해 왔다.  경제자유구역·산업단지·특별자치도의 대규모 복합 개발사업의 사업협약 검토 및 SPC 설립·외국인투자 구조 자문, 해외 부동산·실물자산 관련 펀드 및 재간접펀드, 국내외 PE/VC 펀드와 스타트업·헬스케어·테크 기업 투자·EXIT 및 스타트업 청산 구조 검토, PFV·리츠 구조 검토 및 관련 규제 자문 등 폭넓은 자문경험을 갖고 있다.  김도형 대표변호사는 ""이번 영입은 새 정부 들어 강화되는 추세인 각종 규제대응에서 해결책을 찾는 고객들에게 실질적 솔루션을 제시할 것""이라며 ""바른은 새해에도 각 전문서비스 영역별로 실력과 인품이 검증된 전문가들을 지속 영입해 고객들에게 전문적이고, 차별화된 자문서비스를 제공해 나가겠다""고 말했다.",https://n.news.naver.com/mnews/article/123/0002373817
2025-12-15 12:16:00,"조세범 처벌체계 논의.. ""배액벌금 폐지·형벌 균형 재설계 필요""","조세범죄 처벌이 가산세·벌금·징역으로 과도하게 중첩돼 비례원칙을 훼손하고 있다는 문제 제기가 학계와 수사 실무 현장에서 제기됐다. 글로벌 최저한세(QDMTT)와 조세포탈 구성요건을 둘러싼 제도 정합성 논의도 본격화됐다. 국제 기준에 부합하는 과세권 확보와 기업·납세자의 예측 가능성 제고, 형사처벌 범위의 명확화가 동시에 과제로 제시됐다.  한국세법학회와 한국국제조세협회(IFA), 조세전문검사 커뮤니티는 지난 12일 서울 서초구 대검찰청 베리타스홀에서 '2025년 공동학술대회'를 열고, 조세범 처벌 구조의 문제점과 글로벌 최저한세 도입에 따른 국내 법제 대응 방향을 집중 논의했다.  △ ""조세범, 형벌 체계 정당성 잃어.. 배액벌금 폐지해야""   첫 번째 주제 발표에 나선 정유리 변호사(법무법인 대륙아주)는 현행 조세범 처벌 체계가 형벌의 균형성과 비례원칙을 상실했다고 지적했다. 정 변호사는 ""조세포탈죄는 사기죄와, 허위 세금계산서 수수죄는 문서위조죄와 구조가 유사함에도 기본법에서는 더 가볍게, 가중처벌법에서는 오히려 더 무겁게 처벌하고 있다""고 짚었다.  특히 과세관청이 포탈세액과 가산세(40%)를 이미 징수한 상태에서 징역형과 고액 벌금을 필수적으로 병과하는 현행 구조는 비례원칙 위반 소지가 크다는 지적이다. 이에 대한 개선책으로는 결과(세액)에 연동되는 '배액벌금형 제도' 폐지와 일반 형법 체계에 맞춘 확정벌금형 전환이 제시됐다.  토론자로 나선 박영웅 변호사(법무법인 화우)도 ""전산화와 정보수집 능력이 고도화된 상황에서 실질적 세수 손실이 없는 세금계산서 수수까지 형사처벌 대상으로 삼는 것이 타당한지 재검토가 필요하다""고 말했다.  △ 글로벌 최저한세 QDMTT.. ""과세권 확보와 기업 부담 균형 필요""   두 번째 주제에서는 글로벌 최저한세(필라2) 도입에 따른 '적격 소재국 추가세(QDMTT)'의 국내 법제화 방향이 논의됐다. 김경하 한양사이버대 교수는 ""QDMTT는 다국적 기업이 15% 미만의 실효세율을 부담할 경우, 그 미달분을 소재국이 우선 과세하는 제도""라며 ""OECD 주석서상 의무 규정은 충실히 반영하되, 재량 규정은 우리 실정에 맞게 조정해야 한다""고 밝혔다.  김 교수는 특히 기업 부담 완화를 위해 QDMTT 세이프하버 요건을 적극 반영하고, 특정외국법인(CFC) 과세 시 해외 납부 예상 QDMTT를 선반영해 이중과세를 방지해야 한다고 제언했다.  토론에 나선 최용환 변호사(법무법인 율촌)는 이번 세법 개정안이 OECD 주석서상 의무 규정을 반영하면서도 과세권 확보와 납세협력 비용을 균형 있게 형량한 입법이라고 평가했다. 다만 QDMTT의 특성상 소득 통산과 지정 배분 구조로 인해 개별 자회사 소득과 세액이 1:1로 대응되지 않을 수 있다며, 합리적인 법정 산식 등 보완 장치 마련이 필요하다고 지적했다.  △ ""조세포탈 본질은 '위계'.. 구성요건 구체화해야""   마지막 주제 발표를 맡은 양재영 서울북부지검 부부장검사는 조세포탈죄의 구성요건 해석 문제를 짚었다. 그는 ""'사기나 그 밖의 부정한 행위'라는 문언이 지나치게 추상적""이라며 ""조세포탈의 본질은 세무공무원의 심사 기능을 무력화하는 '위계'에 있다""고 분석했다.  장부 조작, 명의 위장, 허위 외관 창출 등 구체적 유형 중심의 판단 기준을 정립해야 수사·재판 실무의 혼선을 줄일 수 있다는 설명이다. 이에 대해 황보영미 변호사(국세청)는 ""형사처벌과 행정제재는 입법 취지가 다른 만큼 부정행위 개념도 구별해 해석해야 한다""며, 조세채무 성립 여부에 대한 행정법원의 독자적 판단 필요성을 강조했다.  이번 학술대회를 주관한 양승종 한국세법학회 차기회장은 ""이번 공동 학술대회는 조세 형사법과 국제조세의 난제를 학계·법조·검찰이 함께 논의했다는 점에서 의미가 크다""며 ""이론과 실무의 정합성을 높이기 위한 논의를 지속하겠다""고 밝혔다.  한국세법학회는 지난 1986년 한국세법연구회로 창립된 이래 40여년 가까이 세법분야를 연구해온 학술단체로, 교수·변호사·공인회계사·세무사 등 2000여 명의 회원이 활동하고 있다.",https://n.news.naver.com/mnews/article/123/0002373816
2025-12-15 12:08:00,"전재수 ""2018년 9월 통일교 행사 추도사? 난 고향서 벌초"" 정면 반박","통일교로부터 수천만원대 금품을 수수한 의혹을 받고 있는 전재수 전 해양수산부 장관이 2018년 9월 부산에서 열린 통일교 행사에 참석해 추도사를 했다는 언론보도와 관련해 ""그날은 제 고향 (경남) 의령에서 벌초하고 있었다""며 정면으로 반박했다.  전 의원은 15일 자신의 페이스북에서 지난 2018년 9월 9월 부산 롯데호텔에서 열린 통일교의 '문선명 천주성화 6주년 기념 제5지구 신한국지도자 초청만찬'에 참석해 추도사를 했다는 정황이 확인됐다는 보도와 관련해 이같이 밝혔다.  중앙일보는 이날 통일교 소식지를 인용해 전 의원이 통일교의 2018년 9월 '신한국지도자 초청만찬'에 참석해 추도사를 했으며, 2018년~2020년에는 통일교의 교단 조직인 사단법인 남북통일운동국민연합 행사에 축사를 보내는 등 직간접적으로 참여했다고 보도했다.  또 21대 총선을 앞둔 2020년 3월 남북통일운동국민연합 관계자들과 함께 한학자 통일교 총재의 자서전인 '인류의 눈물을 닦아주는 평화의 어머니'를 들고 기념사진까지 촬영했다고 전했다.  전 의원은 ""2018년 9월 9일 통일교 행사날에는 제 고향 의령에서 벌초를 하고 있었다""며 ""저는 제 지역구 북구에서 79살까지는 형님, 누님, 80살부터는 큰형님, 큰누님이라고 한다. 선거 때 형님, 누님들께서 선거사무실에 오셔서 '힘내라, 응원한다'며 책 한 권 들고 와서 함께 사진 찍자는데 어떻게 마다할 수 있겠냐""고 했다.  이어 ""선거 때가 아니라도 동네 형님, 누님들께서 시간되면 행사에 와서 축사라도 하라하시면 다 갈수는 없어도 가끔은 얼굴도 뵙고 인사도 드리고 축사도 한 말씀드린다. 얼마나 고마운 일이냐""고 했다.  그러면서 ""우리 북구의 형님, 누님들이 교회를 다니든, 성당을 다니든, 절을 다니든 제게는 소중한 형님이자 누님이고 너무나 소중한 이웃""이라고 강조했다.  이에 더해 전 의원은 ""다시 한번 말씀드리지만 단연코 분명히 불법적인 금품 수수 등의 일은 추호도 없었다""고 재차 강조했다.  통일교 측 관계자는 2018년 9월 9일 통일교 '신한국 지도자 초청행사'에 전 의원이 참석했는지 여부에 대해 ""전 의원의 행사 참석 여부는 확인이 불가하다""면서도 ""행사에 참석하지 않은 상황에서 거짓된 내용을 소식지에 쓰지는 않았을 것""이라고 말했다.  이번 통일교 여야 정치권 금품 로비 의혹은 지난 8월 김건희 특검팀(민중기 특별검사)이 윤영호 전 통일교 세계본부장을 조사하는 과정에서 ""통일교 교단이 민주당 인사들에게도 금품을 제공했다""는 진술을 확보하면서 불거졌다.  윤 전 본부장은 당시 특검팀에 전 의원에게 현금 4천만원과 명품시계 2점을 제공했다는 취지로 진술했으며, 청탁 현안으로 '한일 해저터널'이라고 진술한 것으로 알려졌다.  전 의원은 통일교 금품 수수 의혹이 제기되자 ""저에게 제기된 금품수수 의혹은 전부 허위다. 단 하나도 사실이 아니다""라고 강하게 부인했다.  ◆ 경찰, 통일교 주요 기관·전재수 의원실·김건희 특검 전격 압수수색  한편 경찰청 특별전담수사팀은 지난 11일 전 의원을 비롯해 임종성 전 민주당 의원, 김규환 전 미래통합당 의원 등 3명을 피의자로 입건했으며, 출국금지 조치했다.  이들에게 정치자금법 위반 또는 뇌물 수수 혐의가 적용된 것으로 전해졌다. 윤 전 본부장도 정치자금 또는 뇌물을 불법 공여한 혐의로 피의자 입건됐다.  경찰청 특별전담수사팀은 15일 오전부터 경기 가평 통일교 천정궁, 서울 용산구 통일교 서울본부, 통일교 한학자 총재와 윤영호 전 세계본부장이 구속 수용된 서울구치소, 김건희 특검 사무실 등 10곳에 대해 압수수색을 진행했다.  전 의원의 국회 의원회관 사무실과 자택, 임종성 전 의원·김규환 전 의원의 자택도 압수수색 대상에 포함된 것으로 알려졌다.  또 경찰은 김건희 특검 사무실에도 수사관을 보내 윤 전 본부장 진술 등 수사 자료 일체를 확보하고 있다. 사건 이첩 과정에서 충분한 자료가 제공되지 않았다고 보는 것으로 전해졌다.  이번 압수수색은 경찰이 지난 10일 김건희 특검팀으로부터 통일교의 정치인 접촉 관련 내사 사건 기록을 이첩받은 뒤 이뤄진 첫 강제수사다.",https://n.news.naver.com/mnews/article/123/0002373815
2025-12-15 12:06:00,"'칠레의 트럼프' 카스트, 대통령 당선…美국무 ""긴밀한 협력 기대""","호세 안토니오 카스트(59) 공화당 후보가 14일(현지시간) 치러진 칠레대통령 선거(결선)에서 승리했다.  영국 BBC 방송과 로이터 통신에 따르면 칠레 선거관리위원회는 이날개표율 99.33% 기준으로 카스트 58.18%, 헤아네트 하라 41.82% 득표율을 각각 기록했다고 밝혔다.  하라 후보는 엑스(X·옛 트위터)를 통해 자신의 패배를 인정하며 ""민주주의가 분명한 목소리를 냈다. 카스트 대통령 당선인에게 전화를 걸어 칠레의 미래를 위해 성공을 기원했다""고 말했다.  카스트 당선인은 수십 년간 강경 보수 노선을 유지해온 정치인이다. 도널드 트럼프(79) 미국 대통령의 열성 지지자로 알려진 그는 미국과 긴밀한 관계를 맺을 가능성이 크다는 관측이 나온다.  그는 페루·볼리비아와 맞닿은 취약한 국경에 장벽을 설치하고, 최고 보안 등급의 교도소 건설, 범죄 다발 지역에 군 병력 배치, 베네수엘라 출신이 다수를 차지하는 불법 이민자 대규모 추방 등을 공약으로 내세웠다.  칠레는 남미에서 비교적 안전하고 안정적인 국가로 평가받지만 최근 이민 증가와 조직범죄 확산으로 많은 유권자들이 우려를 표했다. 카스트는 지속적으로 이 두 문제를 연관 지어 강조해왔다.  이번 승리는 최근 중남미 전반에서 나타나고 있는 우파 정치의 부활 흐름에 또 하나의 사례로 기록됐다.  카스트 당선인은 에콰도르의 다니엘 노보아, 엘살바도르의 나이브 부켈레, 아르헨티나의 하비에르 밀레이 대통령과 같은 흐름에 합류했다. 지난 10월에는 볼리비아에서 중도 성향의 로드리고 파스가 당선되면서 약 20년간 지속돼 온 사회주의 집권이 막을 내렸다.  이번 대선은 카스트의 세 번째 도전이자 두 번째 결선 진출이었다. 그는 2021년 좌파 가브리엘 보리치 대통령에게 패배한 바 있다. 과거에는 극단적이라는 평가를 받았지만 최근 범죄와 이민 문제에 대한 우려가 커지면서 유권자의 지지를 얻었다.  한편 미 국무부는 카스트 당선인에 공식 축하 메시지를 전했다.  마코 루비오 국무장관은 즉시 성명을 내고 ""카스트 당선인의 리더십 아래 칠레가 공공 치안 강화, 불법 이민 종식, 양국 상업 관계 재활성화 등 공동의 우선 과제를 진전시킬 것으로 확신한다""고 밝혔다.  이어 ""미국은 카스트 행정부와 긴밀히 협력해 양국 간 파트너십을 심화하고 우리 반구(서반구)에서의 공동 번영을 증진해 나가기를 기대한다""고 덧붙였다.",https://n.news.naver.com/mnews/article/123/0002373814
2025-12-15 12:01:00,"""우리 가족을 살렸어요"" 수혜자들이 전한 국세청 장려금 미담","""아이 네 명을 낳고 녹록하지 않은 30대, 40대에 갑작스런 남편의 사업 실패까지 겹쳐 부산 외곽지로 몇 번의 이사로 전전했었습니다. 힘든 순간마다 근로·자녀장려금이 저와 우리 가족을 살린 건 확실합니다. 장려금 덕분에 잘 먹고, 배움의 기회를 가져 현재 큰아들과 작은아들은 부산해사고에 진학해 항해사로 일하고, 셋째는 고등학생으로 야구선수를 꿈꾸며, 막내는 이제 중1이 되었습니다."" (맞벌이 주부 이○○씨)  ""수험공부와 고된 아르바이트를 병행하는 힘겨운 이중생활을 시작해야 했습니다. 경제적 불안감의 연속은 결국 공부와 일, 그 어느 것에도 집중하지 못하는 결과를 낳았고, 불안함은 고스란히 '불합격'으로 저를 좌절시켰습니다. 바로 그때, 저에게 찾아온 근로장려금은 단순한 금전이 아니었습니다. 제 꿈을 키우는 소중한 양분이 되어 주었습니다."" (경찰 공무원 김□□씨)  국세청(청장 임광현)이 2025년 근로·자녀장려금 체험수기 공모전을 통해 선정한 우수작 20편을 15일 발표했다.  근로·자녀장려금 수혜자(가족)를 대상으로 진행한 이번 공모전은 지난 10월 1일부터 11월 17일까지 체험수기 총 296편이 접수됐다. 장려금을 통한 생활 속 어려움 극복사례와 신청 및 수급 에피소드, 장려금 사용사례 등 사연이다. 국세청은 사례의 구체성과 진정성, 장려금 제도의 이해도, 어려움 극복 의의 등을 감안해 이중에서 우수작 20편(대상 1, 금상 3, 은상 6, 동상 10)을 선정했다.  대상은 '세상은 아직 살아 볼 만합니다. 희망 대한민국!'이라는 제목으로 수기를 쓴 50대 맞벌이 주부 이○○씨에게 돌아갔다. 장려금 덕분에 힘든 순간을 극복하고 슬하의 4형제를 잘 키워, 이제는 본인도 제2의 인생을 꿈꾸고 있다는 이야기였다.  금상은 취업 준비 기간에 근로장려금을 받아 아르바이트 시간을 줄이고 공부에 전념한 결과 공무원 시험에 합격하고 경찰관으로서 위급한 산모를 도운 미담으로 뉴스에 소개됐다고 전한 김□□씨가 받았다.  또 다른 금상 수상자인 네 자녀의 아빠 정△△씨는 수기에서 ""여섯 가족이 살아가는 데 가뭄의 단비, 힘들 때 구명튜브가 되어 준 국세청 근로·자녀장려금에 고맙고 감사한 마음""이라고 전했다.  은상을 받은 최고령 수상자 장○○씨(80세)는 구청 노인 일자리를 참여해 받은 근로장려금으로 수학여행 가는 손자에게 용돈을 줘서 행복했다는 밝혔다. 이외에도 예상보다 많은 장려금으로 10년 만에 아내의 고향 필리핀을 다녀왔다는 이□□씨와 탈북민에게도 차별 없이 다가와 삶의 역경을 헤쳐 나갈 수 있었다고 밝힌 장△△씨 등이 수상의 영예를 안았다.  수상자들에게는 국세청장상과 함께 대상 200만 원 포함 총 1000만 원의 상금이 주어진다.  임광현 국세청장은 ""근로·자녀장려금이 일하는 가정에 보탬이 되고, 보다 많은 국민에게 희망이 될 수 있도록 국세청이 더욱 노력하겠다""라며 ""금년 상반기분 근로장려금 5500억 원(대상자 114만 가구)도 법정기한인 12월 30일보다 앞당겨 12월 18일에 지급하겠다""고 밝혔다.",https://n.news.naver.com/mnews/article/123/0002373813
