날짜,제목,본문,링크
2025-12-11 15:07:00,150조원 국민성장펀드 공식 출범...AI·반도체에 50.9조원 투입,"150조원 국민성장펀드가 11일 공식 출범했다. 국가 전략산업인 인공지능(AI)와 반도체 두 산업에 펀드 1/3인 약 51조원이 지원된다. 이억원 금융위원회 위원장과 서정진 셀트리온그룹 회장, 박현주 미래에셋그룹 회장이 민관공동위원장으로 활동한다.   금융위원회는 이날 한국산업은행에서 열린 '국민성장펀드 출범식·전략위원회 제1차 회의'에서 △직접투자 15조원(기금 7.5조원+민간 7.5조원) △간접투자 35조원(7.5조원+27.5조원) △인프라 투융자 50조원(10조원+40조원) △초저리 대출 50조원(전액 기금) 등 5년간 지원 규모 계획을 제시했다.  이 중 AI 분야에는 △직접 투자 4조원 △간접투자 6조원 △인프라 투융자 10조원 △초저리 대출 10조원 등 총 30조원을, 반도체 분야에는 △직접 투자 1.6조원 △간접투자 4.3조원 △초저리 대출 15조원 등 총 20.9조원을 지원한다.  그 외 모빌리티(15.4조원), 바이오 백신(11.6조원), 이차전지(총 7.9조원), 미디어 콘텐츠(5.1조원), 항공우주 방산(3.6조원), 수소 연료전지(3.1조원), 원전(2.7조원), 디스플레이(2.6조원), 로봇(2.1조원) 등에 대규모 자금이 지원된다.   국민성장펀드는 5년간 150조원 규모로 정부보증채권 75조원과 민간자금 75조원으로 구성된다. 민간자금 유치규모는 첨단기금과 재정(`26년 1조원 예산 반영)을 마중물로 유치할 수 있는 최소 수치로서 사업별 조달 구조에 따라서는 보다 확대될 수 있을 것으로 기대하고 있다.  국민성장펀드는 전문성과 공정성 및 투명성을 갖춘 의사결정체계를 구축한다. 향후 20년을 이끌 유망한 첨단산업에 대한 성공적인 투자를 위해 금융‧산업계의 최고 전문가가 의사결정체계에 참여한다.  각계 전문가로 구성된 상시적 소통풀은 충분히 확보하되, 개별 사안별 최적 전문가로 2단계의 단순한 심사구조를 통해 신속하게 지원한다. 운용방향에 대한 자문을 위한 '전략위원회'와 정책 지원사항 논의를 위한 부처간 협의체인 '산업경쟁력강화관계장관회의'를 가동하고, 주요 운용성과에 대해서는 전문가 풀에 지속적으로 환류하여 공정성 및 투명성을 확보한다.  투자 심의·기금 관리 거버넌스와 관련해선 '투자심의위원회(투심위)'와 '기금운용심의회'가 단계별로 심사한다.  투심위(1단계 심사)에서는 산업계 및 금융계의 전문가, 사무국의 민간전문가가 실무심사를 담당하며, 업종별로 소위원회(분과)로 구분하여 개별 투자 건별 또는 산업별 투자 제안 건에 맞추어 심의위원을 유기적으로 구성한다.  특히 민간금융사에서 발굴‧제안된 사업의 경우 실무검토 및 투심위 단계부터 발굴사가 심의과정에 적극적으로 참여한다. 산은 및 지주‧증권‧보험사 등은 (가칭)'국민성장펀드 Alliance'를 구성해 프로젝트를 발굴하고, 국민성장펀드-금융권간 협업을 지원한다. 금융지주는 산은에 설치된 민간전문가 조직인 '국민성장펀드 사무국'에 10여명 이상의 전문직원을 파견해 실무단계부터 참여한다.  기금운용심의회(2단계 심사)는 개별 투자건 중 첨단전략산업기금 활용 부분에 대한 최종 의사결정을 담당한다. 운용심의회 위원은 법령이 정한 기관들로부터 추천을 받아 위촉하게 되며, 이 작업이 마무리되면 기금운용심의회를 개최해 첨단기금의 주요 투자사항에 대해 결정할 계획이다.  함께 참여하는 민간자금은 1단계 투심위 과정에서 이미 충분한 검토된 만큼 국민성장펀드 틀 안에서 첨단기금 투자부분과 협업하되, 개별 의사결정과정을 독립적으로 이행한다.  '산업경쟁력강화관계장관회의'는 정책 지원 사항의 부처 간 협의를 담당한다. '전략위원회'는 운용 방향에 자문하거나 개별 투자를 결정하지는 않는다.  전략위원회는 산업계‧금융권‧정부 합동의 자문기구로서 이 기구가 개별 건에 대한 투자를 결정하지는 않는다. 다만, 전략위는 식견‧경험 및 전문성을 겸비한 산업계 및 금융권의 저명한 인사를 골고루 배치하고, 지역 및 청년의 목소리도 반영하는 등 국민성장펀드의 운용전략 및 재원배분에 대한 자문역할을 수행한다.  금융위는 주기적으로 전략위원회를 개최하여 운용사항을 점검하고, 운용전략을 수정‧고도화해나갈 계획이다.  의사결정의 실무를 지원하기 위해서 지난달 17일 산은에 민간전문가 조직인 '국민성장펀드 사무국'을 설치한데 이어, 정부 내에는 부처합동조직인 '국민성장펀드 추진단' 설치를 추진한다.  '추진단'은 국민성장펀드를 정책‧전략차원에서 보좌하면서 범부처 협업과제 및 프로젝트별 토털솔루션을 제공할 계획이다. '사무국'은 전문가 중심 실무조직으로 금융지원의 실무 및 사후관리를 담당한다.  국민성장펀드는 대한민국의 미래를 이끌 첨단전략산업 및 그 생태계를 폭넓게 지원하고, 생태계의 관련 벤처혁신기업과 스케일업을 지원한다. 국민성장펀드 자금의 40% 이상은 지역에 배분되도록 한다는 계획이다.  성장펀드는 첨단전략산업을 직접 영위하는 기업뿐만 아니라, 지분투자 펀드 등을 통해 중소‧기술기업 전반을 지원한다. 특히 초장기기술투자펀드를 활용해 장기 인내 자본이 필요한 유망기업에 대해 10년 이상 장기투자를 지원하는 한편 직접지분투자방식을 활용해 데카콘으로 성장할 수 있는 첨단기술기업에 적극적인 투자자금을 제공한다.   이억원 금융위원장은 ""전 세계가 생존을 건 산업‧기술 패권전쟁을 펼치고 있는 가운데, 국가역량을 총동원해야 하는 시기""라며 ""9월 10일 국민성장펀드 국민보고대회 이후 150조원 국민성장펀드의 의사결정체계 및 집행계획 구체화에 만전을 기해왔다""고 설명했다.  특히 ""산업은 미래에 대한 비전을 바탕으로 혁신과 성장을 이끄는 주체이고, 금융은 장기적 안목으로 유망한 분야에 안정적이고 지속적인 모험자본을 제공한다""면서 ""산업과 금융이 융합할 때 국민성장펀드는 비로소 혁신기업들에게 가장 필요로 하는 시점에 가장 효과적인 방식으로 자원을 공급하는 강력한 엔진이 될 수 있다""고 강조했다.  그러면서 ""국민성장펀드를 계기로 금융권은 산업에 대해 보다 적극적으로 투자하기 위한 시스템과 역량을 구축하고, 국민성장펀드 및 생산적금융의 압도적 숫자에 걸 맞는 실질적 성과를 내야한다""고 강조한 뒤, ""특정 분야에 치우치지 않은 위원들로 구성하고 투자심의위원회와 기금운용심의회라는 단순한 구조를 통해 의사결정의 효율성·투명성을 높이겠다""고 덧붙였다.   서정진 전략위원회 공동위원장은 ""국민성장펀드는 성장의 속도를 높이는 것을 넘어 성장의 구조 자체를 바꾸는 국가프로젝트로서, 민간에서 축적한 경험‧데이터‧글로벌 네트워크를 국가전략으로 연결하는 통로역할을 수행하면서, 중소‧중견‧전후방기업 등 산업생태계 전반의 경쟁력 강화와 지역경제 성장‧일자리 창출 등이 실질적으로 나타나도록 노력하겠다""고 밝혔다.  박현주 전략위원회 공동위원장도 ""150조원 국민성장펀드는 AI‧로봇‧반도체‧바이오‧인프라 등 기업 성장의 초석이자 창업을 춤추게 할 마중물""이라면서 ""지속가능하고 보다 더 큰 펀드로 발전할 수 있도록 정직과 투명성에 기반을 둔 경쟁력 있는 시스템 구축에 조언을 아끼지 않겠다""고 다짐했다.",https://n.news.naver.com/mnews/article/123/0002373644
2025-12-11 15:04:00,"'가맹주 협상권 강화' 가맹사업법 통과...국힘, 필리버스터 재돌입","가맹점 사업자들의 협상권을 보장하는 가맹사업법 개정안이 11일 필리버스터(무제한토론) 끝에 국회 본회의를 통과했다.  국회는 이날 오후 본회의를 열어 가맹사업법 개정안을 재석 241명 중 찬성 238명, 기권 3명으로 가결했다.  개정안에는 ▲가맹점주단체의 공정거래위원회 또는 시·도지사 등록제 도입 ▲등록 단체가 협의를 요구할 경우 본부의 협의 의무 부과 ▲협의 불이행 시 시정조치 명령 등이 담겼다.  지난 4월 신속처리안건(패스트트랙)으로 지정된 법안으로, 가맹점 사업자 단체의 법적 지위와 교섭 권한을 강화하는 내용이 핵심이다.  지난 9일 본회의에 상정됐지만 국민의힘의 필리버스터로 표결이 이뤄지지 않았고, 이날 12월 임시국회 첫 본회의에서 처리됐다.  이어 국회는 하급심 판결문 공개를 확대하는 '형사소송법 개정안'을 상정했지만, 국민의힘이 다시 필리버스터를 신청했다. 첫 주자는 곽규택 의원이다.  필리버스터는 시작하고 24시간이 지나면 재적 의원 5분의 3 이상 찬성으로 종결할 수 있다. 필리버스터가 계속되면 하루에 법안 1건만 처리할 수 있는 구조다.  형소법 개정안 필리버스터는 12일 오후 종료될 예정이다. 형소법이 처리되면 은행법 개정안(은행의 가산금리 산정 시 소비자에 비용 전가 금지)이 상정되지만, 이 역시 국민의힘은 필리버스터를 신청할 계획이다.  국민의힘은 더불어민주당의 이른바 '개혁법안' 처리 저지를 명분으로 모든 법안 대상으로 필리버스터 카드를 쓰고 있다.  송언석 원내대표는 이날 의원총회에서 ""반헌법적, 반민주적, 전체주의 8대 악법에 대해 여당이 연내 강행처리 시도를 철회하지 않는 한 본회의에 올라오는 모든 법안에 대해 필리버스터로 맞서 싸우겠다""고 예고했다.",https://n.news.naver.com/mnews/article/123/0002373643
2025-12-11 14:31:00,"하이트진로음료, 백승혁 신임 대표이사 선임","하이트진로음료는 신임 대표이사로 백승혁 전 신화푸드 대표이사를 선임했다고 11일 밝혔다.  백 신임 대표이사는 서울대학교를 졸업하고 1997년 CJ제일제당에 입사해 식품영업, 영업기획, 경영관리, 브라질법인장 등을 거치며 국내외 식품 사업 전반에서 경험을 쌓았다. 최근에는 신화푸드 대표이사로 재직하며 외식사업 수익 구조 개선과 경영 안정화를 이끌었다.  하이트진로음료는 이번 선임을 중장기 성장 기반을 강화하고 핵심 브랜드 경쟁력 제고와 제품 포트폴리오 혁신에 속도를 낼 계획이다.  회사는 백 대표가 보유한 글로벌 사업 운영 경험과 전략, 영업, 조직 관리 역량을 바탕으로 진로토닉워터, 하이트제로0.00, 블랙보리, 티도씨 등 주요 브랜드의 성장과 신사업 발굴, 해외시장 진출을 가속화할 것으로 기대하고 있다.  백승혁 대표는 ""하이트진로음료가 시장 변화에 선제적으로 대응하고 신뢰받는 기업으로 자리매김할 수 있도록 모든 역량을 집중하겠다""며 ""국내외에서 쌓은 경험을 바탕으로 핵심 브랜드 가치를 높이고 미래 성장 분야 발굴과 글로벌 사업 확대를 통해 지속 가능한 성장 기반을 구축하겠다""고 밝혔다.",https://n.news.naver.com/mnews/article/123/0002373642
2025-12-11 14:30:00,"李대통령 ""대한민국 분수령에 서 있어…국운 공직자에 달려""","이재명 대통령은 지금 대한민국은 분수령, 분기점에 서 있다며 공직자들에게 이 나라의 미래가 달려있고, 다음 세대의 삶도 달려있는 만큼 공직자가 책임감을 갖고 열심히 일해 달라고 말했다.  이 대통령은 11일 세종 정부청사에서 진행된 기획재정부와 국가데이터처의 업무보고를 받는 자리에서 이같이 밝혔다.  이 대통령은 그러면서 ""공직자들의 태도와 역량, 충실함에 국운이 달려 있다""며 ""여러분의 1시간은 대한민국 5,200만 국민의 삶에 영향을 미치는 가치""가 있다고 강조했다.  특히 다수의 공직자들이 공개석상에서 진행되는 업무보고에 부담감을 느낀다는 말이 있다며 ""생각보다 재미있을 것""이라고 분위기를 누그러뜨린 뒤, 공직사회에 대한 국민적 오해를 언급했다.  그는 ""일을 소홀히 한다거나 사익을 챙긴다는 시선이 많지만, 실제로는 압도적 다수가 본연의 역할에 충실하다""며 ""만약 공직자 대부분이 무능하거나 사익을 추구했다면 지금과 같은 대한민국의 성장과 발전은 불가능했을 것""이라고 말했다.  이어 ""대다수 공무원들은 보이지 않는 곳에서 국민에게 실망을 주지 않기 위해 애쓴다""고 평가하면서, 다만 일부 공직자의 일탈이 전체 이미지를 흐린다는 점을 지적하며 ""흙탕물을 일으키는 극히 소수의 미꾸라지가 문제일 뿐""이라고 지적했다.  이 대통령은 공직자의 책임성을 거듭 강조하면서 ""공직은 개인의 일이 아니라 국민 전체와 연결된 일을 수행하는 직업""이라며 ""여러분이 인지하지 못할 수도 있지만 공무원의 결정과 시간은 국민 삶 전체에 영향을 미친다""고 설명했다.  특히 공직 인사와 관련해 ""이번 정부 들어 공직자들이 잘하고 있다는 것을 안다. 인사는 최대한 공정하고 투명하고 합리적으로 하려고 한다""고 밝히면서도, ""혹시라도 인사에서 부당함을 느끼는 이가 있다면 익명으로 텔레그램을 통해 제게 보내 달라. 즉시 시정하겠다""는 뜻을 밝혔다.  이 대통령은 또 현재의 국내·외 상황을 ""국가의 향방이 갈리는 분수령""이라고 규정하면서 ""여러분의 역할에 국가의 미래와 다음 세대의 삶이 달려 있다. 책임감을 가지고 임해달라""고 당부했다.  이 대통령은 발언 말미에 ""고맙다. 박수 한번 쳐 달라""고 말하며 현장 분위기를 격려했다.",https://n.news.naver.com/mnews/article/123/0002373641
2025-12-11 14:15:00,"“스페이스X, 내년 IPO 추진설 확산…머스크 ‘정확하다’며 사실상 인정”","일론 머스크가 소셜미디어 X(옛 트위터)를 통해 스페이스X의 기업공개 가능성을 직접 시사하면서, 그동안 제기돼 온 상장 추진설에 힘이 실리고 있다.  11일(현지시간) 로이터통신에 의하면, 머스크는 Ars 테크니카의 우주 전문 기자 에릭 버거가 ""스페이스X가 곧 상장할 것으로 보는 이유""라며 올린 게시물에 대해 ""항상 그렇듯 에릭은 정확하다""고 답했다. 이는 스페이스X가 상장을 준비 중이라는 시장 관측을 사실상 인정한 것으로 해석되고 있다.  ◆ 2026년 IPO 추진…25억 달러 이상 조달 검토  로이터는 전날 복수의 소식통을 인용해 스페이스X가 2026년 IPO를 통해 250억 달러 이상(약 34조 원)을 조달하는 방안을 검토하고 있다고 보도했다. 이는 상장 시 스페이스X의 기업가치가 1조 달러를 넘어설 수 있음을 의미하며, 실현될 경우 사우디 아람코(2019년) 이후 역사상 두 번째 규모의 IPO가 된다.  캘리포니아에 본사를 둔 스페이스X는 현재 전 세계에서 두 번째로 가치가 높은 비상장 스타트업으로 평가된다.  ◆ 회사 측 공식 입장은 ""답변 불가""  로이터는 스페이스X 측에 논평을 요청했으나 즉각적인 답변을 받지 못했다고 전했다. 그럼에도 CEO인 머스크가 직접 관련 언급을 내놓은 만큼, 시장에서는 상장 준비가 이미 상당 부분 진행되고 있다고 보고 있다.  ◆ 전문가들 ""스페이스X IPO는 글로벌 테크 시장의 대형 이벤트""  전문가들은 스페이스X가 상장에 성공할 경우, 글로벌 자본시장의 유동성을 흡수하는 초대형 IPO가 될것이며, 동시에 일론 머스크의 자본시장에서 영향력 확대를 점치면서 이는 민간 우주 산업 경쟁 심화 등 여러 변화가 뒤따를 것으로 분석하고 있다.  특히 스페이스X가 민간 우주 산업의 중심축을 형성하고 있는 만큼, IPO는 우주·발사체·위성통신 시장의 새 흐름을 결정지을 분기점이 될 가능성이 크다는 평가가 나온다.  머스크의 짧은 답글 한 줄이 스페이스X의 상장 가능성을 공고히 하는 신호로 받아들여지면서, 글로벌 투자자들의 관심은 이제 2026년 스페이스X IPO에 집중되고 있다.",https://n.news.naver.com/mnews/article/123/0002373640
2025-12-11 14:13:00,"이 대통령, 국정 지지율 62%...민주 44%·국힘 20% [NBS]","이재명 대통령의 국정운영 지지율이 62%를 기록한 여론조사 결과가 11일 나왔다. 엠브레인퍼블릭·케이스탯리서치·코리아리서치·한국리서치가 지난 8∼10일 만 18세 이상 1000명을 대상으로 진행해 이날 공개한 전국지표조사(NBS)에 따르면, 이 대통령의 국정운영을 긍정 평가한 응답자는 62%로 집계됐다. 이는 2주 전 직전 조사보다 4%포인트(p) 오른 수치다.  반면 이 대통령의 국정운영에 대해 부정적으로 평가한 응답률은 30%를 기록했다.  이재명 정부의 주요 정책 분야와 관련한 긍정 평가는 △외교 정책 65% △복지 정책 62% △대북 정책 52% △경제 정책 51% △부동산 정책 40% 순으로 나타났다.  각 정당별 지지도를 살펴보면, 더불어민주당은 44%·국민의힘은 20%를 기록했다. 2주 전 실시된 직전 조사와 비교해 민주당은 5%p 상승, 국민의힘은 2%p 하락한 수치다.  아울러 △조국혁신당 4% △개혁신당 3% △진보당 1% 등의 정당 지지율을 기록했다. 지지 정당에 대한 태도를 유보한 응답자는 27%로 조사됐다.  12·3 비상계엄에 대한 인식과 관련한 질의 문항에서는 △계엄은 내란에 해당한다 64% △내란에 해당하지 않는다 27% 등으로 나타났다. 모름/무응답 비율은 9%였다.  이번 NBS 조사는 휴대전화 가상번호(100%)를 이용한 전화 면접으로 이뤄졌고, 표본 오차는 95% 신뢰수준에서 ±3.1%p다. 응답률은 18.8%였다. 자세한 내용은 중앙선거여론조사심의위원회 홈페이지 참조.",https://n.news.naver.com/mnews/article/123/0002373639
2025-12-11 14:09:00,"에스오디랩·뉴셀의원, NK셀 활성도검사·SOD 활용 진료 협약","에스오디(SDO)랩이 지난 4일 서울 송파구 뉴셀의원과 SOD(슈퍼옥사이드 디스뮤타아제) 활용을 위한 업무협약을 맺었다고 11일 밝혔다.  이번 협약으로 에스오디랩은 SOD 제품을 뉴셀의원의 진료에 활용토록 할 예정이다. 이를 통해 대사질환 환자의 항산화 관리와 면역력 향상에 도움을 줄 것으로 기대하고 있다.  뉴셀의원은 활성산소 검사와 NK세포 활성도 검사를 도입하고 송파 지역 내 NK세포 활성도 전문 관리 병원으로서 역할을 확대한다는 계획이다.  이와 함께 양측은 대사 질환으로 어려움을 겪는 환자에게 보다 통합적이고 맞춤형 의료 서비스를 제공할 예정이다.  이숙기 뉴셀의원 대표원장은 한림대학교 의과대학을 졸업하고 한림대 강남성심병원을 거쳐 1995년부터 성남중앙병원 가정의학과에서 근무했으며 이후 송파구 보건소 관리의사, 춘천시 보건소 의무사무관, 가평 삼성의원 원장 등을 거쳤다.  가정의학과 전문의로 암, 당뇨, 고혈압, 고지혈, 심근경색, 두통, 이명, 허리 디스크 등 성인병, 대사질환 환자 관리에 집중해 왔다.",https://n.news.naver.com/mnews/article/123/0002373638
2025-12-11 14:08:00,"에스오디랩·매일진료365의원, SOD 활용 진료 업무협약",에스오디(SOD)랩이 지난달 27일 강원 원주 매일진료365의원과 SOD(슈퍼옥사이드 디스뮤타아제) 활용을 위한 업무협약을 체결했다고 11일 밝혔다.  이번 협약을 통해 양측은 SOD를 활용한 병원 내 진료 업무와 NK세포 활성도 검사 지정병원 운영 등 다양한 분야에서 협력할 예정이다.  고진 매일진료365의원 대표원장은 연세대학교 원주의과대학을 졸업하고 신촌세브란스병원 응급의학과에서 전공의를 수료했다. 응급의학 분야에서 임상조교수로 활동했으며 가정의학과 전문의로서 지역사회 의료 서비스에 기여하고 있다.  이번 협약으로 고 원장 에스오디랩의 항산화 효소 제품을 활용한 맞춤형 진료를 도입하고 환자에게 더 나은 건강관리 옵션을 제공한다는 계획이다. NK세포 활성도 검사 등 면역 관련 분야에서의 협력을 통해 환자 맞춤형 의료 서비스를 강화할 방침이다.,https://n.news.naver.com/mnews/article/123/0002373637
2025-12-11 14:03:00,통룬 시술릿 라오스 국가 주석 내외 공식 방한…12월 14~15일,"통룬 시술릿 라오스 국가 주석 내외가 이재명 대통령의 초청으로 오는 14일부터 15일까지 공식 방한할 예정이다.  강유정 대변인은 11일 서면 브리핑을 통해 이같이 밝혔다.  강 대변인은 이어 올해 한국과 라오스의 재수교 30주년을 맞아 이루어진 이번 라오스 국가주석의 방한은 12년 만의 양자 방한이기도 하다고 설명했다.  양 정상은 15일(월) 정상회담, 공식 오찬 등의 일정을 진행한다.  강 대변인은 정상회담에서는 재수교 이래 30년간 양국관계 발전 성과와 향후 발전 방향을 포함한 정치·안보, 교역·투자 분야 논의 외에도, 온라인 스캠범죄 등 초국가 범죄 대응을 위한 협력, 인프라, 공급망, 인적교류, 주요 지역 및 국제 현안 등과 관련하여 폭넓게 협의할 예정이라고 밝혔다.  그러면서 ""통룬 주석의 이번 방한 및 한-라오스 정상회담은 다양한 분야에서 양국 간 협력을 더욱 공고히 하고, 양국 관계 발전을 견인하는 계기가 될 것으로 기대된다""고 설명했다.",https://n.news.naver.com/mnews/article/123/0002373636
