날짜,제목,본문,링크
2025-12-16 11:04:00,"키움증권, 사업인가 후 제 1호 ‘키움 발행어음’ 출시","키움증권이 16일 발행어음을 출시했다. 지난달 19일 금융위로부터 인가를 받고 약 한달만이다.  '키움 발행어음'은 1년 이내의 범위에서 수시형(특판 금리 기준 세전 연 2.45%)과 기간형(특판 금리 기준 세전 연 2.45%~3.45%)으로 가입할 수 있다. 최소 가입금은 100만원이다. 특판 총 발행액은 약 3,000억원이다.  수시형 첫번째 가입자는 김학균 한국벤처캐피탈협회 회장으로 협회 회원사인 키움증권과의 인연으로 발행어음에 가입했다. 기간형 첫번째 가입자는 키움히어로즈 야구단 주장 송성문 선수다.  30년 가까이 모험자본을 운용해온 벤처투자의 상징적 인물인 김학균 회장은 ""모험자본은 단순한 자금이 아니라 사람과 기업의 가능성을 먼저 믿는 자본""이라고 말했다. 그는 ""발행어음이 이제 단기 수익 상품을 넘어, 국가 성장의 기초 연료가 되기를 바라는 마음으로 1호에 가입했다""며 ""특히 벤처기업으로 시작해 금융그룹으로 성장한 키움증권의 성공 노하우가 발행어음 운용에 적극 활용되기를 기대한다""고 말했다.  올해 프로야구 3루수부문 골든글러브 수상자인 송성문 선수는 끝없는 노력과 도전으로 한국을 대표하는 내야수로 발돋움했다. 이제는 미국 메이저리그 도전이라는 더 큰 모험을 앞두고 있다.  송선수는 ""야구도, 투자도 결국은 불확실성 속에서 끊임없이 결단하는 과정이라고 생각한다""며 ""이 발행어음이 또 다른 젊은 도전자들의 출발점이 된다고 생각하니 의미가 더 크게 다가왔다""고 소감을 전했다.  키움증권은 발행어음 사업에서 투자자 보호를 최우선 가치로 두고 엄격한 내부 통제 시스템을 가동할 방침이다. 키움 발행어음은 키움증권의 신용을 바탕으로 발행되는 상품이다. 예금자보호법상 보호 대상은 아니므로 투자에 앞서 발행사의 신용도와 상환 능력을 신중하게 고려해야 한다는 점을 명확히 안내하고 있다.  발행어음으로 조달된 자금은 금융당국의 가이드라인에 따라 철저한 유동성 관리원칙 안에서 혁신기업 투자, 중소기업 금융지원 등 정책적으로 허용된 범위 내 건전한 자산에 한해 운용된다. 운용과정 전반에 대한 투명성을 강화할 계획이다.  키움증권 관계자는 ""발행어음을 통해 조달된 자금은 단기 유동성 안전성을 유지하는 범위 안에서, 우리 경제에 필요한 성장자금 공급에 기여하게 된다""며 ""투자자보호를 최우선 하는 리스크 관리체계를 기반으로 신뢰받는 종합 금융투자회사로 자리매김할 것""이라고 말했다.",https://n.news.naver.com/mnews/article/123/0002373898
2025-12-16 11:03:00,"'과징금 체납 1위' 김건희母, 25억 끝내 미납…압류 부동산 공매 추진","지방행정제재·부과금(과징금) 25억원을 체납해 전국 1위에 이름을 올린 김건희 여사의 모친 최은순(79)씨의 부동산이 공매 절차에 들어간다.  16일 경기도와 성남시에 따르면 최씨는 마지막 납부 시한인 전날까지 체납 과징금을 내지 않았다.  앞서 성남시는 지난달 19일 최씨를 포함한 고액 체납자 명단이 위택스에 공개된 뒤, 최씨에게 이달 15일까지 체납 과징금을 납부하지 않으면 압류한 부동산에 대해 공매에 들어가겠다고 통보했다.  최씨는 2020년 부동산 실권리자명의 등기에 관한 법률 위반에 따른 과징금 25억500만원을 납부하지 않아 과징금 체납액 전국 1위에 이름을 올렸다.  그는 2013년 부동산 매입 과정에서 명의신탁 계약을 통해 차명으로 땅을 사들여 법을 위반한 사실이 드러나 과징금이 부과됐다. 성남시 중원구청은 2020년 4월 의정부지검으로부터 최씨의 부동산실명법 위반 사실을 통보받은 뒤 과징금 27억3000여만원을 부과했다.  최씨는 땅 매입과 관련한 구청의 과징금이 부당하다며 취소소송을 제기했지만 지난해 11월 대법원에서 심리불속행 기각으로 원심을 확정해 최종 패소했다.  성남시 측은 ""최씨가 납부하지 않은 과징금 액수보다 훨씬 많은 부동산을 압류한 상태로 오늘 중으로 한국자산관리공사(캠코)에 공매를 의뢰할 계획""이라고 밝혔다.  김동연 경기지사도 지난 4일 양평군 민생경제 현장투어에서 ""경기도가 지방세 고액체납자에 대한징수절차에 들어갔고 최씨가 지방세 체납 1등""이라며 ""차명계좌로 취득한 부동산에 대한 과장금으로 최씨의 체납은 그 죄질이 아주 나쁘다""고 했다.  이어 ""도와 성남시가 함께 최후 일정을 통첩했다""며 ""과징금, 지방세 체납액을 납부하지 않으면 부동산 공매 절차에 반드시 들어가 조세 정의를 살리겠다""고 밝혔다.",https://n.news.naver.com/mnews/article/123/0002373897
2025-12-16 11:03:00,"우리금융, 이익증가에 주주환원율 40%로 상향…목표가 '상향' [대신證]","대신증권은 16일 우리금융지주에 대해 보험 증권 실적 반영으로 내년부터 경쟁사 대비 이익증가율이 높을 것으로 예상되며, 총환원율도 꾸준히 상향될 것이므로 이에 따른 총 환원액이 커버리지 중 가장 높을 것으로 예상됨에 따라 업종 내 최선호주로 제시했다.  이 증권사 박혜진 연구원은 이날 분석보고서를 통해 ""우리금융은 홍콩 주가연계증권(ELS) 과징금에서도 4대 금융지주 가운데 유일하게 제외됐고, 올해 4분기 분기배당부터 시작될 비과세 배당도 투자 포인트""라며 이같이 밝혔다.  그는 그러면서 우리금융지주 목표주가를 기존 3만원에서 3만7000원으로 23.3% 높였다. 상향 근거로는 주당순자산(BPS)를 2026년 추정치로 변경했고, Target PBR도 0.63x에서 0.71x로 상향한 데 기인한다고 설명했다.  박 연구원은 특히 우리금융지주의 경우 총 환원율 성장 여력이 높을 것으로 전망했다. 그는 ""경쟁사의 경우 총 환원율 50%를 당초 계획보다 조기 달성하는 곳이 늘어나는데 지금과 같은 광폭 행보를 유지하기는 쉽지 않다""며 ""우리금융은 올해 35%에서 시작해 50%까지 올라갈 여력이 많이 남았다""고 분석했다.  또한 비(非)은행계열사 포트폴리오 완성에 따른 이익 증가까지 기대할 수 있어 총 환원액 관점에서 가장 높은 성장률을 보여줄 것이라고도 전망했다.   우리금융의 내년 순이익은 올해 보다 1.4% 증가한 3조3200억원으로 추정됐다. 동양·ABL생명과 우리투자증권 실적 기여가 4개 분기 모두 반영되며 타 금융지주 대비 이익 증가율이 높을 것으로 내다봤다. 다만 인수에 따른 염가매수차익이 대거 반영되어 기존 전망 대비 이익 증가폭은 다소 적을 수밖에 없다는 게 박 연구원 설명이다.  박 연구원은 ""올해 경쟁사의 비이자이익은 사상 최대로 은행의 이익이 제한되는 가운데 비이자이익이 여기서 크게 증가하는 것은 쉽지 않다""며 ""반면 우리금융은 보험과 증권 합산 약 2000억원(보험 1,557억원, 증권 611억원) 수준의 추가 이익 기여가 가능할 것""이라고 봤다.  내년 총 환원율은 40%로 상향 전망했다. 박 연구원은 ""올해 기말 보통주자본(CET1) 비율이 3분기 대비 소폭 하락한 12.76%를 기록할 것""이라면서도 ""12.5%를 상회했기 때문에 밸류업 정책에 따라 내년 총 환원율은 40%로 오를 것""이라고 진단했다.  총 환원액은 자사주 매입·소각 2000억원을 포함해 총 1조3300억원으로 올해보다 14.6% 증가할 것으로 추정했다. 아울러 내년 주당배당금(DPS)은 올해(1350원) 대비 11.9% 증가한 1,510원으로 예상했다.  박 연구원은 ""개인 투자자들의 경우 올해 4분기 분기배당부터 비과세 적용돼 실질적인 배당금은 18%가량 증가하는 혜택을 향유할 수 있을 것""이라고 부연했다. 배당기준일은 내년 2월 27일로 예상했다.  한편 한국거래소에 따르면, 이날 오전 10시 50분 기준 우리금융지주 주가는 전날보다 소폭(0.55%, 150원) 오른 2만7550원에 거래되고 있다. 최근 52주 최고가는 2만9250원, 최저가는 1만5010원을 기록하고 있다. 이날 기준 시가총액은 약 20조2600억원이며 PER은 6.36배, PBR은 0.57배 수준이다.  [알림] 본 기사는 해당 증권사의 분석보고서를 토대로 정보 제공 차원으로 작성된 것입니다. 따라서 투자시 투자자 자신의 판단과 책임하에 최종결정을 하시기 바라며 어떠한 경우에도 투자자의 주식투자의 결과에 대한 법적 책임소재의 증빙자료로 사용될 수 없습니다.",https://n.news.naver.com/mnews/article/123/0002373896
2025-12-16 11:01:00,"더존비즈온, Amaranth 10 고객사 대상 ‘연말정산 집중 교육’ 개시","더존비즈온은 15일부터 19일까지 5일간 전국 13개 주요 도시에서 'ONE AI로 원(願)하는 답(答)을 찾다'를 주제로 2025년 귀속 연말정산 집중 교육을 진행한다고 16일 밝혔다.  이번 교육은 15일 창원, 성남, 수원을 시작으로 16일 대구와 광주, 안산, 17일 대전과 서울(동국대), 18일 전주, 천안, 울산, 19일 서울(화재보험협회), 부산, 인천 순으로 이어진다.  첫날부터 기업의 인사·재무 담당자들이 강의장을 가득 채우며 연말정산 시즌과 AI를 활용한 업무 혁신에 대한 높은 관심을 보였다.  더존비즈온은 이번 교육에서 개정된 소득세법과 조세특례제한법 등 복잡한 세법 변화를 알기 쉽게 해설하고, 핵심 비즈니스 플랫폼인 Amaranth 10을 활용한 실무 처리 방안을 제시했다.  ERP와 그룹웨어, 문서관리(EDM)를 유기적으로 결합해 정보와 지식을 연결하며 디지털 전환(DX)의 방향성을 보여줬다.  특히 'AI와 함께하는 연말정산' 세션에서는 ONE AI의 자동화 프로세스를 시연해 참가자들의 호응을 얻었다. 연말정산 자료 수집부터 자동 계산, 증빙 관리, 오류 검증까지 전 과정을 AI가 스스로 처리하는 모습이 공개돼 실무자들의 관심이 집중됐다.  현장에서는 AI 기반 세법도우미 'Expert1'이 실무자의 세법 질문에 실시간으로 답변하고 누락된 공제 항목을 찾아내거나 데이터 정합성을 검증하는 시연도 이어졌다.  교육에 참석한 한 인사 담당자는 ""매년 반복되던 세법 문의 응대와 검증 업무의 부담을 대폭 줄일 수 있을 것 같다""며 기대감을 나타냈다.  더존비즈온은 Amaranth 10 고객 대상 교육 이후 오는 22일부터 내년 1월 9일까지 WEHAGO 및 Smart A 10 사용 고객을 대상으로 연말정산 집중 교육을 이어간다. 이번 교육은 서산, 창원을 시작으로 전국 21개 지역에서 총 42회 진행되며, 사전 신청이 조기 마감될 정도로 높은 관심을 얻고 있다.  이 교육에서는 직장인용 앱 NAHAGO와 연동된 간편한 자료 제출 프로세스와 ONE AI 기반 실무 활용법이 함께 소개될 예정이다.  더존비즈온 관계자는 ""이번 교육은 단순한 AI 기술이 실제 연말정산 현장에서 어떻게 업무 효율성을 극대화할 수 있는지를 보여주는 자리""라며 ""앞으로도 고객의 업무 혁신을 지원하는 최첨단 기술 기반의 다양한 솔루션을 지속적으로 제공하겠다""고 말했다.",https://n.news.naver.com/mnews/article/123/0002373895
2025-12-16 11:01:00,"비타민하우스, 온 가족 데일리 케어 '데일리 낙산균 배배' 출시","건강기능식품 브랜드 비타민하우스가 가족 데일리 케어를 위한 신제품 '데일리 낙산균 배배'를 출시했다고 16일 밝혔다.  이번 제품은 이유식을 시작한 어린아이도 안심하고 섭취할 수 있도록 순한 배합과 간편한 사용성을 갖춰 제작됐다. 주원료인 낙산균은 특정 유기산을 생성하는 균주로 알려져 있으며, 이러한 낙산균을 더 다양한 연령층의 소비자가 쉽게 접할 수 있도록 제품화했다는 게 브랜드의 설명이다.  신제품은 90도 고온에서도 생존이 가능한 균주가 활용돼 뜨거운 이유식이나 따뜻한 분유 외에도 물, 음료, 요거트 등 일상적인 음식과 함께 섭취할 수 있다.  비타민하우스는 바쁜 육아 환경 속에서도 아이부터 성인까지 간편하게 챙길 수 있는 데일리 케어 제품으로 자리 잡을 것으로 기대하고 있다.  비타민하우스 관계자는 ""온 가족이 함께 섭취할 수 있도록 데일리 낙산균 배배를 선보였다""며 ""언제 어디서든 부담 없이 건강을 챙길 수 있길 바란다""고 말했다.  신제품은 비타민하우스 공식 온라인몰과 주요 판매 채널을 통해 구매 가능하다.",https://n.news.naver.com/mnews/article/123/0002373894
2025-12-16 10:58:00,"이재명 대통령 부부, 연말연시 맞아 '기부·나눔문화 확산' 촉구","이재명 대통령 부부는 연말연시를 맞아 이웃을 살피고 돕는 기부·나눔문화의 확산과 관심을 촉구하기 위해 '2025년 기부·나눔단체 초청행사'를 개최했다.  대통령실은 16일 오전 용산 대통령실에서 이 대통령 내외가 구세군, 굿네이버스, 대한결핵협회, 대한적십자사, 밀알복지재단 등 주요 기부·나눔단체 관계자와 홍보대사, 기부자 및 후원 아동·청소년 32명을 초청해 기부 나눔문화 확산을 촉구했다고 밝혔다.  이 대통령은 모두발언을 통해 동화 '성냥팔이 소녀'를 언급하면서, ""세상이 그렇게 잔인하지 않은 것은 여러분과 따뜻한 마음으로 세상을 바라봐주는 분들 덕분""이라며 감사의 뜻을 표했다.  또한 ""정부와 행정이 최소한의 안전선을 지켜야 하나, 부족할 때가 있다""면서, ""슬프고 서러운 분들게 희망과 편안함을 주는 여러분께 진심으로 감사하다""는 뜻을 전했다.  이어 기부·나눔단체 관계자와 후원 아동·청소년 대표들이 직접 자신들의 사연을 공유하면서 소감을 밝혔다.  세이브더칠드런이 운영하는 새움센터에서 꿈을 찾은 장준희 군은 ""교육비 등 지원을 통해 그간 경제적 어려움으로 하지 못했던 반려동물 관련 자격증을 6개 취득하고, 희망 전공으로 대학에 합격했다""고 밝혔다.  장 군은 이어 ""아이들이 꿈을 찾고 배울 수 있는 기회가 많아지면 좋겠다""는 소망을 덧붙였다.  또 초록우산재단의 지원으로 우리나라 제일의 판소리꾼으로 성장 중인 이창준 군은 ""지난 6년간의 초록우산재단 지원은 학업과 판소리 연습을 지속하고 꿈을 포기하지 않을 수 있었던 가장 큰 힘이었다""고 소개하면서, ""받은 사랑을 다시 사회에 환원하는 사람이 되겠다""는 포부를 밝혔다.  이 대통령은 참석자들의 이야기를 경청한 후 ""작은 정성이 큰 정성을 만든다. 작은 정성이라도 후원자분들이 최선을 다해 주신 것을 알고 있다""고 말했다. 이어 참석자들에게 ""함께 따뜻한 세상을 만들어 가자""고 당부했다.  이 대통령 부부는 이날 참석한 각 단체에 성금을 기부했다고 대통령실이 전했다.  한편 오늘 행사에는 구세군, 굿네이버스, 대한결핵협회, 대한적십자사, 밀알복지재단, 바보의나눔, 사회복지공동모금회, 세이브더칠드런, 아름다운 동행, 월드비전, 유니세프, 초록우산어린이재단, 푸르메재단, 푸드뱅크, 한국해비타트 등 주요 기부·나눔단체 관계자와 홍보대사, 기부자 및 후원 아동·청소년 32명이 초대됐다.",https://n.news.naver.com/mnews/article/123/0002373893
2025-12-16 10:46:00,"현대모비스, 로보틱스 사업 확장 '핵심 수혜주'로 '부각'... 목표가 ↑ [주가동향]","현대모비스가 현대차그룹의 로보틱스 사업 확장에 따른 핵심 수혜주로 부각되고 있다. 주력인 자동차 부품 사업의 안정적인 실적 위에 로봇 핵심 구동장치인 '액추에이터' 성장성이 더해지며 기업가치 재평가 국면에 진입했다는 분석이다.  한화투자증권은 16일 현대모비스에 대해 투자의견 '매수'를 유지하고 목표가를 기존 37만원에서 44만원으로 '상향' 조정했다. 로봇 액추에이터 사업 가치를 밸류에이션에 점진적으로 반영하기 시작했다는 판단에서다. 다만 이날 오전 10시 39분 기준 주가는 전 거래일 대비 1.65% 내린 35만8500원에 거래되고 있다.  김성래 한화투자증권 연구원은 ""2026년은 현대모비스 로봇 액추에이터 사업의 중대한 전환점이 될 것""이라며 ""보스턴다이내믹스 로봇 등 그룹 로봇의 북미 양산이 2028년으로 예상되는 가운데, 2026~2027년에는 제조·물류 공장을 활용한 실증사업(PoC)이 본격화될 것""이라고 전망했다.  현재 현대모비스 로봇 사업의 핵심은 액추에이터다. 액추에이터는 로봇의 관절과 움직임을 담당하는 구동 장치로, 전체 로봇 부품 재료비의 60% 이상을 차지하는 고부가가치 부품이다.  현대모비스는 차량용 조향·제동·제어기 분야에서 축적한 정밀 제어 기술과 내구·신뢰성 역량을 바탕으로 로봇 구동부 시장 진입에 유리한 위치에 있다는 평가를 받는다.  현대모비스는 지난해 8월 '2025 CEO 인베스터 데이(CID)'를 통해 로봇 액추에이터 사업에 대한 중장기 전략을 공개한 바 있다.  이후 현대차그룹 차원의 미국 로봇 3만대 양산 계획과 함께 국내 로보틱스 사업 육성을 위한 피지컬 AI 애플리케이션 센터, 로봇 파운드리 공장 등 중장기 투자 구상이 발표되며 사업 가시성이 높아지고 있다.  한화투자증권은 그룹 로봇 3만대 양산 시 연간 로봇 매출을 약 3조원으로 추정했다. 이 가운데 현대모비스는 로봇 부품 재료비의 약 70% 중 40%를 공급할 것으로 가정해, 관련 매출을 연 8000억~8400억원 수준으로 추산했다. 이는 전사 매출의 약 1%에 불과하지만, 고성장 로봇 밸류체인 진입 자체가 밸류에이션 확장의 핵심 트리거라는 설명이다.  또한, 다음 달 열리는 'CES 2026'이 주가 촉매로 작용할 가능성이 크다. 시장에서는 현대차그룹이 이번 CES에서 로봇 관련 신기술과 보다 구체적인 양산 로드맵을 공개할 것으로 기대하고 있다.  김 연구원은 ""그룹 로보틱스 사업의 윤곽이 드러날수록 현대모비스 로봇 사업 확장성에 대한 가시성도 함께 높아질 것""이라고 말했다.  본업인 자동차 부품 실적 역시 안정적이다. 한화투자증권은 현대모비스의 2026년 매출액을 전년 대비 7.2% 증가한 66조1040억원, 영업이익은 7.0% 늘어난 3조6380억원으로 전망했다.  전기차 수요 둔화 우려에도 불구하고 고부가가치 전장부품 매출 비중 확대와 북미 공장 수익성 개선이 실적을 뒷받침할 것이란 분석이다.  김 연구원은 ""로봇 밸류에이션이 주가에 점진적으로 반영될 시점에 진입했다""며 ""현대모비스는 그룹 로보틱스 전략의 핵심 축으로 자리매김할 가능성이 크다""고 강조했다.  [알림] 본 기사는 해당 증권사의 분석보고서를 토대로 정보 제공 차원으로 작성된 것입니다. 따라서 투자시 투자자 자신의 판단과 책임하에 최종결정을 하시기 바라며 어떠한 경우에도 투자자의 주식투자의 결과에 대한 법적 책임소재의 증빙자료로 사용될 수 없습니다.",https://n.news.naver.com/mnews/article/123/0002373892
2025-12-16 10:42:00,"대우건설, 26MW급 전남 1호 데이터센터 첫삽","대우건설이 지난 15일 전남 장성군 남면 광주연구개발특구 첨단3지구에서 '장성 파인데이터센터' 착공식을 가졌다고 16일 밝혔다.  이날 행사에는 정원주 대우건설 회장, 김영록 전라남도 도지사, 이개호 국회의원, 김한종 장성군수 등 국회, 정부, 지자체, 기업계와 지역주민 등 약 300명이 참석했다.  장성 파인데이터센터는 전남에 처음 들어서는 데이터센터로, 2023년 정부가 '데이터센터 수도권 집중 완화 정책'을 발표한 이후 민간에 의해 첫 번째로 추진된 전체 사업비 3959억원, 수전용량 26MW(메가와트)급 규모 사업이다.  이를 통해 3만2082㎡ 대지에 연면적 2만4244㎡ 데이터센터 지상 6층, 운영동 지상 2층 건물과 부대시설이 조성된다.  사업지가 위치한 광주연구개발특구는 대덕연구개발특구에 이어 국내에서 2번째로 큰 규모로 국가AI(인공지능)데이터센터, 국가인공지능융합사업단 등 대규모 산학협력단지로 조성되고 있다.  정 회장은 기념사에서 ""장성 파인데이터센터는 AI, 클라우드, 빅데이터 시대를 선도하는 핵심인프라로서 지역경제 활성화와 국가경쟁력 강화에 중추적인 역할을 할 것""이라며 ""최고의 기술력과 품질을 바탕으로 적기 준공해 대한민국 데이터센터의 이정표를 세우겠다""고 강조했다.  이번 사업에 출자자, 시공사로 참여한 대우건설은 지난 8일 시행법인 파인디씨PFV와 공사도급계약을 체결했다. 공사기간은 24개월로 오는 2027년 12월 말 준공 예정이다.  시공을 넘어 개발, 투자, 운영에 참여하는 등 새 성장동력 확보에 나선 대우건설은 침체된 주택시장 속 신재생 에너지 전환과 인공지능 확장 기조에 발맞춰 사업포트폴리오 다각화를 추진한다는 전략이다.  회사측은 ""AI, 빅데이터 등 확산으로 대규모 데이터 저장 및 처리 수요가 폭증하며 데이터센터 건설 시장이 확대되고 있다""면서 ""높은 기술경쟁력과 양재동 GDC 시공 경험을 바탕으로 최고의 품질로 적기 준공하겠다""고 말했다.",https://n.news.naver.com/mnews/article/123/0002373891
2025-12-16 10:39:00,"김병기 ""간첩법 개정안 빨리 처리하자""...'안보 이슈'로 국힘 압박","더불어민주당은 16일 국민의힘의 전면적 필리버스터(무제한 토론을 통한 합법적인 의사진행 방해)에 대해 ""말로는 민생을 외치지만 명분 없는 필리버스터 때문에 국민의 삶과 국가의 미래도 잠시 멈췄다""고 비판했다.  김병기 원내대표는 이날 오전 국회에서 열린 원내대책회의에서 ""정쟁을 위한 지연 대가는 결국 국민이 치르게 된다""며 ""국민의힘은 민심을 무시하고 민생을 외면한 점에 대해 반성해야 한다""면서 이같이 말했다.  국민의힘은 민주당의 소위 '사법개혁안' 추진에 반대해 본회의에 상정된 모든 법안에 필리버스터를 신청하고 있다.  그러나 김 원내대표는 ""지금도 처리해야 할 법안들이 너무나도 많다""며 ▲반도체 특별법 ▲보이스피싱 피해자 환급 특별법 ▲재난 및 안전관리 기본법 ▲국립소방병원법 ▲국가유공자법 등을 언급했다.  특히 그는 전날 반도체와 디스플레이 장비 핵심 기술을 외국에 넘긴 이들이 전원 집행유예를 받은 것을 언급하고 ""명분 없는 정쟁은 중요한 안보 국익까지 위협하고 있다""면서 간첩법 개정안 통과를 국민의힘에 촉구했다.  간첩법 개정안(형법 개정안)은 간첩죄 처벌 대상을 '적국(북한)'에서 '외국 및 이에 준하는 단체'로 확대하는 내용이 핵심이다. 기존 간첩법은 '북한'만 대상으로 하고 있어 외국에 중요한 기술 유출 등 사실상 간첩 행위를 하더라도 간첩죄로 처벌할 수 없었다.  김 원내대표는 ""첨단기술은 기업의 자산이자 국가 안보의 핵심""이라며 ""수백 건의 설계 도면을 빼돌리고 그 경쟁 기업과 합작회사까지 세운 사건들인데 처벌은 이 정도 수준에 그쳤다""고 지적했다.  그러면서 ""여야가 합심해 만들고 빠른 처리를 약속한 간첩법 개정안이 아직 본회의 문턱을 넘지 못하고 있다""며 ""정쟁에 발목 잡힐수록 안보 범죄자들에게 시간과 기회만 줄 뿐""이라며 국민의힘의 결단을 거듭 촉구했다.",https://n.news.naver.com/mnews/article/123/0002373890
2025-12-16 10:35:00,"[속보] 경찰, '통일교 의혹' 김건희특검 추가 압수수색","[속보] 경찰, '통일교 의혹' 김건희특검 추가 압수수색",https://n.news.naver.com/mnews/article/123/0002373889
