날짜,제목,본문,링크
2025-12-15 16:09:00,"중형증권사 이익 2.5배 증가...""PF부실 해소ㆍ증시 호황이 실적 견인""","전례 없는 증권시장의 호항으로 증권사들이 올해 눈에 띄는 영업실적을 기록하고 있다. 하지만 업계에서는 영업력과 자본력이 큰 대형증권사들은 거래 증가, 주가 상승으로 큰 성장세를 보였지만, 중소형 증권사들은 상대적으로 시장 호황의 혜택을 많이 받지 못했다는 설명이다.  하지만 본지가 자본규모 11위~20위 중·대형 증권사들의 올해 3분기 영업실적을 분석해본 결과, 이들 중대형 증권사들의 이익 증가율이 대형사보다 월등하게 높은 것으로 확인됐다.  소위 빅5로 일컫는 미래에셋증권, 한국투자증권, NH투자증권, 삼성증권, 키움증권의 올해 3분기 순이익은 지난해보다 평균 56.5% 증가했다. 리테일, 이자수익, 운용수익 등 영업 부문 모두가 크게 증가했기 때문이다.(본지 25.11.17일자 '빅5 증권사 3분기 이익 57%↑' 참조)  또, 메리츠증권, KB증권, 하나증권, 신한투자증권, 우리투자증권 등 금융지주 증권사들은 올해 3분기에 지난해보다 18.0% 증가한 순이익을 기록했다. 빅5보다 리테일 증가세는 작았지만, 이자수익과 운용수익이 크게 증가한 것으로 나타났다.(본지 25.11.26일자 '금융지주 증권사 3분기 이익 18% 증가' 참조)  한편, 교보증권, 한화투자증권, 유안타증권, 현대차증권, DB증권, IBK투자증권 등 중대형 혹은 중형 증권사들의 올해 3분기 순이익은 지난해보다 무려 158.3% 증가하여 2.5배 커진 것으로 조사됐다.  1개 증권사 당 평균 순이익 규모는 빅5 증권사가 3808억원, 금융지주 증권사가 1055억원, 중대형 증권사가 197억원으로 조사됐다.  중대형 증권사의 이익 규모는 대형증권사 보다 크게 작았지만, 지난해에는 PF충당금 적립 등 비용 요인이 커서, 적자가 났거나 또는 이익이 났어도 수십억원대의 소규모 이익에 그친 반면, 올해는 대부분 100~300억원 수준의 순이익을 실현하면서 증가율이 큰 폭으로 증가한 것으로 조사됐다.  ■ 순이익 규모...DBㆍ교보ㆍ유안타 順, 누적기준...교보ㆍ한화ㆍDB 順  중형 증권사 가운데 올해 3분기에 순이익이 가장 큰 증권사는 356억원을 시현한 DB증권이고, 뒤를 이어 교보증권 308억원, 유안타증권이 297억원을 기록했다. 한화투자증권 215억원, IBK투자증권도 201억원으로 200억원이 넘는 순이익을 기록했다.  DB증권 관계자는 ""고액자산가 중심의 PIB 연계 사업모델을 통해 저축은행, 자산운용 등 연결종속회사의 실적 회복 등이 전체 실적을 견인했다""면서 ""상반기 100조원을 돌파한 고객자산은 3분기에도 꾸준한 증가세를 이어가며 107조원을 상회하여 안정적인 수익성 개선을 뒷받침했다""고 설명하고, 이를 통해 주주환원에도 힘쓰겠다고 말했다.   올해 연간 수익을 가늠해 볼 수 있는 1분기~3분기 누적 순이익은 교보증권이 1369억원으로 가장 큰 이익을 실현했고, 한화투자증권이 879억원, DB증권이 829억원으로 뒤를 이었다. 이밖에도 iM증권 669억원, 유안타증권 624억원 등 5개의 증권사가 3분기까지 600억원이 넘는 순이익을 실현했다.  교보증권 관계자는 ""국내 및 해외거래 확대로 브로커리지 수익이 증가했으며 우수한 사업성의 신규 PF딜 발굴, 자산운용부문 안정적 수익 발생 등 전 부문에서 고른 성과를 보였다""면서 ""앞으로도 안정적인 리스크 관리를 통한 자산건전성 강화와 수익 포트폴리오 다변화로 지속적인 수익성 개선을 이어가겠다""고 설명했다.  한화투자증권 관계자는 ""WM, Wholesale, Trading부문은 국내 주가지수 상승 및 거래대금 증가로 견조한 실적을 이어갔으며, IB부문도 인수금융 비즈니스의 확대 등 투자수익 다각화를 통해 수익성이 개선되었다""면서 ""베트남, 싱가포르에 이어 인도네시아에 진출해 성공적으로 안착함으로써 동남아시아 금융네트워크 기반을 다지고 있으며, 글로벌 확장을 지속 추진하고 있다""고 설명했다.   ■ 이익 성장세...IBKㆍ한화ㆍDB 順 (BNK, iM, 다올 흑자전환)  지난해 3분기 순이익과 비교할 때 가장 큰 성장세를 보인 증권사는 IBK투자증권으로 순이익이 무려 835.1% 증가했다. 지난해에 21억원의 순이익에 그쳤지만 올해는 201억원의 순이익을 시현하면서 10배에 가까운 증가세를 보였다. 한화투자증권도 532.6%의 증가율을 보였고, DB증권도 495.3%의 증가율을 보였다.  또, iM증권, BNK투자증권, 다올투자증권 등은 지난해 적자에서 올해 흑자로 전환했다.  모두 지난해에 PF 충당금 적립 등 비용으로 20~60억원의 순이익에 그쳤지만 올해 부실 자산을 정리하면서 이익이 큰 폭으로 늘어났다는 분석이다.  IBK투자증권 관계자는 ""중소형 증권사에 어려운 업황에도 불구하고, S&T 수익 시현, 대내외 시너지, 안정적인 PF 사후관리 등을 통해 재무성과가 성장 전환됐다""고 설명했다.  iM증권 관계자는 ""15년 연속 적자였던 리테일 부문이 세 분기 연속 흑자 전환 기조를 유지하고, 자본을 미사용하는 중개 비즈니스를 확대하는 등 순수주선 실적 을 확대했다""면서 ""부동산PF 부문의 성공적인 재구조화로 부실사업장 익스포저를 대폭 축소해 우발채무 비율을 16%p 축소했다""고 설명했다.  다올투자증권 관계자는 ""다년간 추진한 사업 다각화와 리스크 관리 노력에 힘입어 세 분기 연속 흑자를 이어갔다""면서 ""올해 신설된 전략영업본부와 글로벌마켓본부도 구조화금융, 인수금융을 비롯해 기관 대상 자금조달 솔루션 제공으로 빠른 성과를 내며 수익 다변화에 기여했다""고 설명했다.  ■ 수익성...DB증권, 유안타증권, 유진투자증권 順  증권회사의 수익성을 확인해볼 수 있는 지표인 자기자본이익률(ROE)을 살펴보면, DB증권이 가장 많은 순이익을 시현하면서 ROE도 2.84%로 가장 높았고, 유안타증권도 1.79%, 유진투자증권이 1.62%로 수익력이 높은 것으로 조사됐다.  유안타증권 관계자는 ""하우스 랩 상품 판매 및 잔고 증가와 함께 주식형 펀드 중심의 금융상품 공급 다변화로 자산관리부문이 분기 단위 최고 실적을 기록했다""면서 ""시장거래대금 증가 및 우호적인 증시 환경에 따른 위탁영업부문의 안정적인 성장세와 함께 자산운용부문에서도 양호한 성과를 보였다""고 설명했다.  유진투자증권 관계자는 ""WM 부문은 적극적인 마케팅 효과로 해외주식 자산이 큰 폭으로 증가했고, 특히, IPO 대표주관 계약 확대와 사업부문 간 시너지 영업 강화로 미래 성장 기반을 착실히 확보했다""면서, ""IB부문 구조화금융의 경우 금융기관 보증 딜, 데이터센터 PF 등 안정성과 성장성이 높은 영역의 비중을 지속적으로 확대하고 있다""고 설명했다.  올해 3분기 중형 증권사들도 이익이 크게 증가하면서 수익률도 높아졌지만 빅5 증권사 평균 4.29%, 금융지주사 평균 1.90%와 비교하면, 중형증권사는 1.42%로 여전히 수익률이 낮은 것으로 조사됐다.   ■ ""회복 더디나...'선택과 집중', 디지털 강화로 성장력 강화""  증권업계에서는, 상대적으로 영업력이 작은 중형증권사의 수익성에 대한 우려가 적지 않다. 최근 호황에서도 수수료 수익 등이 크게 증가하지 못했고, 자본력이 작아 자금 운용을 통한 이자 및 운용수익도 한계가 있다는 설명이다.  특히 최근 IMAㆍ발행어음 사업에서도 소외되고, 이를 통해 자금운용 면에서 상대적으로 더욱 취약해 질 것이라는 불만도 중형증권사들 사이에서 튀어 나오는 상황이다.  위지원 한국신용평가 금융실장은 ""중형사도 증시호황으로 투자중개부문이 실적에 긍정적인 영향을 줄 것으로 예상되지만, 상대적으로 제한적인 상황으로 대형사에 비해 이익회복력이 약하다""면서, ""특히 투자중개보다 부동산 금융을 비롯한 IB부문의 비중이 큰 중소형사의 경우 실적회복이 더딘 편으로 이에 따른 실적 양극화 현상이 심화될 가능성이 있다""라고 우려했다.  하지만 이런 가운데도 '선택과 집중' '디지털 전환' 등을 통해 경쟁력을 강화하는 증권사의 경우 상대적 영업력 취약에도 안정적 수익과 지속성을 확보할 수 있다는 의견도 있다.  금융위원회 현지은 사무관은 ""중소·중형 증권사는 구조적 부담(부동산·자본·수수료 경쟁) 때문에 단기간엔 회복이 제한적이나, 디지털 전환·포트폴리오 재편·기업금융 전환으로 차별화하면 중장기 생존·성장 가능성이 크다""고 진단했다.  또, 자본시장연구회는 지난 8일 '자본시장포커스'를 통해 ""'선택과 집중' 포트폴리오 재편ㆍ디지털·플랫폼 강화ㆍ고객유치 협업·제휴·규모 확대로 비용을 분담하거나 규모의 경제 확보를 통해 경쟁력을 강화해야 한다""면서 ""ESG 지배구조 개선을 통한 자본조달 비용 절감과 투자자 신뢰 회복. 내부통제 강화를 통한 규제리스크 저감ㆍ기업금융·지역/산업 전문화 및 금융당국의 제도 개편을 활용해 중소·중견기업 대상 기업금융·자문 역량을 키우면 중장기적으로 새로운 수익원이 될 수 있다""고 중형 증권사들의 향후 경영방향과 전략에 대한 대안을 제시하기도 했다.",https://n.news.naver.com/mnews/article/123/0002373843
2025-12-15 16:02:00,"원·달러 환율, 6.0원 내린 1471.0원",15일 서울외환시장에서 원·달러 환율은 전거래일보다 1.0원 내린 1476.0원으로 출발했다. 장중 낙폭을 키우며 3시 30분 기준 전거래일과 비교해 6.0원 내린 1471.0원을 기록했다.,https://n.news.naver.com/mnews/article/123/0002373842
2025-12-15 15:56:00,"김건희특검, 오는 17일 윤석열 소환조사 불발 가능성","김건희 특검팀(민중기 특별검사)이 오는 17일로 예정됐던 윤석열 전 대통령 소환조사와 관련해 일정을 다시금 조율하고 있다고 밝혔다.  특검팀 관계자는 15일 오후 정례 브리핑에서 관련 질의를 받고 ""(윤 전 대통령 소환조사) 그 부분에 대해서는 서로 협의할 부분이 있는 것 같다""며 ""결정이 되면 말씀드리게 될 것""이라고 전했다.  아울러 ""일정 자체에 대한 협의를 진행 중인 부분이 있다. 정해지는 대로 말씀드리겠다""며 ""가급적 서로 협의한 일정이었기 때문에 그날 이뤄지길 원했으나 (윤 전 대통령 측에서) 극구 다른 의견을 말씀하셔서 협의 중에 있는 상황""이라고 부연했다.  특검팀 관계자는 윤 전 대통령 소환조사 일정이 불발될 가능성에 대해서는 ""(양측이) 조율한 상태로 17일날 잡힌 건데 거기에 대해 다른 협의를 하자는 상황""이라며 ""저희는 조속히 조사할 수 있기를 기대한다""고 전했다.  특검팀은 앞서 의혹 당사자인 김건희 여사와 윤 전 대통령 조사를 앞두고 변호인 측과 협의해, 김 여사는 4일과 11일 두 차례·윤 전 대통령은 17일 한 차례 불러 조사하기로 했다. 이를 앞두고 윤 전 대통령 측이 일정 재조율에 나선 것이다.  특검팀은 수사 개시 초반이었던 지난 7월 서울구치소에 수감 중인 윤 전 대통령에 대한 소환을 수차례 시도했으나, 윤 전 대통령은 이에 불응해 왔다. 특검팀은 지난 8월 체포영장 집행을 두 차례 시도했으나 이 또한 윤 전 대통령의 '완강한 거부'로 모두 무산된 바 있다.  특검팀 관계자는 이날 브리핑에서 '공천개입 의혹'과 관련한 이준석 개혁신당 대표(전 국민의힘 대표) 소환조사에 대해서는 ""일정이 협의가 돼서 오는 21일 오전 소환조사 예정""이라고 밝혔다. 아울러 특검팀과 이 대표 측이 각각 일정 조율이 성사된 것이라고 부연했다.  앞서 특검팀은 지난 12일 이 대표에게 소환조사 일정을 통보했으나 이 대표가 불응하며 성사되지 않았다. 이 대표는 2022년 6·1 지방선거 및 국회의원 재보궐선거 당시 국민의힘 대표였던 이 대표가 가진 증거자료·진술이 꼭 필요하다는 입장으로 전해졌다.",https://n.news.naver.com/mnews/article/123/0002373841
2025-12-15 15:53:00,원가가산법 적용 이전가격 거래 쟁점.. 합리적 과세기준 모색,"다국적 기업의 이전가격 거래에서 '원가가산법' 적용을 둘러싼 관세평가 쟁점이 수면 위로 떠오른 가운데, 관세당국과 민·관·학 전문가들이 현장 해법 논의에 나섰다.  관세청 관세평가분류원은 15일 서울본부세관에서 '제42차 관세평가포럼 정기 학술세미나'를 열고, 특수관계자 간 거래에서 원가를 기초로 산정된 이전가격이 관세평가에 미치는 영향과 합리적인 과세가격 결정 방안을 집중 논의했다.  이날 세미나에는 국제통상 분야 교수와 관세사, 관세 공무원 등 약 100여 명이 참석해 △원가가산법이 적용된 이전가격 거래에서 특수관계 영향 판단 기준 △관세법 제34조에 따른 산정가격 기반 과세가격 결정 방식 △전자상거래 유형별 수입물품 관세평가 쟁점 등을 놓고 토론을 벌였다.  특히 최근 다국적 기업을 중심으로 특수관계자 간 거래에서 원가를 기초로 이전가격을 산정하는 사례가 늘어나면서, 해당 가격이 관세평가상 과세가격으로 인정될 수 있는지 여부가 핵심 쟁점으로 부각되고 있다. 관세평가상 과세가격은 단순한 회계상 이전가격과는 다른 판단 기준이 요구되는 만큼, 명확하고 예측 가능한 기준 정립이 필요하다는 문제의식이 공유됐다.  강병로 관세평가분류원장은 ""다국적 기업의 이전가격은 관세평가에서 주요 쟁점 중 하나""라며 ""특수관계자 간 거래에서 원가를 기초로 한 이전가격이 특수관계의 영향을 받았는지를 명확히 판단하고, 관세법상 원가 기초 과세가격 결정 기준을 합리적으로 정립할 필요가 있다""고 밝혔다  세미나에 앞서 손성수 관세평가포럼 회장(관세청 심사국장)은 외부 관세평가 전문가들과 간담회를 열고 국제 관세평가 논의 동향과 업계 애로사항을 청취했다. 손 회장은 ""기업의 성실신고를 적극 지원하는 한편, 불성실 기업에 대해서는 공정한 감독과 관리를 강화하는 것이 관세청 심사행정의 기본 방향""이라며 ""이를 위해 합리적이고 예측 가능한 납세 기준 마련이 중요하다""고 강조했다  관세평가포럼은 관세평가 이론과 실무 개선을 위한 민·관·학 공동 연구기구로, 정기 학술세미나를 통해 관세평가 제도 개선과 정책 제언 역할을 수행하고 있다. 관세청은 이번 논의를 토대로 이전가격 거래에 대한 관세평가 기준을 보다 정교화해 나간다는 방침이다.",https://n.news.naver.com/mnews/article/123/0002373840
2025-12-15 15:51:00,"이번주 공모주 청약, 리브스메드·세미파이브 2개사 나선다","이번 주 기업공개(IPO) 시장에서는 리브스메드·세미파이브 등 2개사가 일반투자자 대상 공모주 청약에 나선다.  15일 금융투자업계에 따르면, 리브스메드는 오는 15~16일, 세미파이브는 18~19일 양일간 각각 청약을 진행한다.  최소침습 수술기기 전문기업 리브스메드는 국내외 기관투자자를 대상으로 진행한 수요예측에서 최종 공모가를 희망밴드(4만4000원~5만5000원) 상단인 5만5000원으로 지난 12일 확정했다.  리브스메드는 4일부터 10일까지 국내외 기관투자자를 대상으로 수요예측을 진행했으며, 총 231대 1의 경쟁률을 기록했다. 참여 기관의 97.5%가 공모가 밴드 최상단 이상의 가격을 제시해 시장의 높은 관심을 입증했다.  이번 공모 주식 수는 247만 주로, 확정 공모가 기준 총 공모금액은 약 1358억 원에 달한다. 상장 후 예상 시가총액은 약 1조3563억 원 규모다.  일반 투자자 대상 공모청약은 15일부터 16일까지 이틀간 진행되며, 상장 주관사는 미래에셋증권이다. 리브스메드는 24일 코스닥 시장에 상장할 예정이다.  특히 이번 수요예측에는 주요 국내외 기관투자자와 연기금을 비롯해 뉴욕과 보스턴에 본사를 둔 세계 최대 규모의 글로벌 금융그룹 등 대형 투자자들이 다수 참여했다.  해외 딜 로드쇼에 참여한 대부분의 기관이 수요예측에 동참했으며, 미국·중동·아시아 등 글로벌 주요 국가 투자자 비중은 8.2%를 기록해 글로벌 시장에서의 높은 관심을 확인했다.  리브스메드는 최소침습 수술기기 분야에서 세계 최초로 90도 다관절 기술을 상용화한 기업이다. 해당 기술은 복잡한 수술 부위에 대한 접근성을 극대화해 수술 정밀도와 안전성을 크게 향상시키는 원천기술로 평가받고 있다.  핸드헬드 복강경 수술기구부터 수술로봇까지 전 제품군에 적용 가능한 플랫폼 기술로, 리브스메드만의 차별화된 경쟁우위를 구축했다.  리브스메드는 이번 상장을 통해 확보한 자금을 ▲통합생산기지 구축 ▲수술로봇 R&D 및 상품화 ▲고급형 핸드헬드 신제품의 성공적 론칭 ▲글로벌 영업망 강화 및 경영시스템 고도화 ▲디지털 서저리(Digital Surgery) 등 미래 성장동력 확보에 집중 투입할 계획이다.  이정주 리브스메드 대표는 ""세계 최초 기술력과 성장 잠재력을 인정해주신 투자자 여러분께 깊이 감사드린다""며 ""생산 역량 확충과 글로벌 시장 공략을 통해 최소침습 수술의 패러다임을 바꾸고, 의료 민주화를 실현하는 글로벌 리더로 도약해 투자자들의 기대에 부응하겠다""고 밝혔다.  AI 반도체 설계 전문기업 세미파이브는 18~19일 일반 투자자를 대상으로 공모주 청약을 진행한다. 세미파이브의 희망 공모가는 2만1000원~2만4000원으로, 10일부터 16일까지 수요예측을 거쳐 17일 최종 공모가가 확정될 예정이다. 대표 주관사는 삼성증권이다.  총 공모주식 수는 540만주로, 공모 예정 금액은 1134억~1296억원 수준이다. 공모가 상단 기준 예상 시가총액은 약 8091억원이며, 글로벌 디자인하우스 기업인 대만의 패러데이(Faraday), 알칩스(Alchip), GUC 등과의 비교 평가를 통해 기업가치는 약 1조490억원으로 산정됐다. 상장 절차가 순조롭게 진행될 경우 세미파이브는 오는 29일 코스닥 시장에 입성할 예정이다.  세미파이브는 삼성 파운드리의 디자인 서비스 파트너(DSP)로, 삼성 파운드리 제조 시설을 활용하는 국내외 팹리스 기업에 반도체 설계 용역과 양산 솔루션을 제공한다.  최근에는 일본 기업들로부터 AI·데이터센터용 고성능 반도체 설계 프로젝트를 잇달아 수주하며 기술 경쟁력을 입증했다. 일부 프로젝트에는 3D IC 기반 첨단 패키징 기술이 적용돼 데이터 처리 효율 향상과 전력 소모 절감이 기대된다.  글로벌 사업 확장에도 속도를 내고 있다. 세미파이브는 최근 일본 도쿄에 현지 법인을 설립했으며, 이를 통해 미국·중국·베트남·인도·체코에 이어 총 6개의 해외 거점을 확보했다.  회사는 이번 공모를 통해 확보한 자금을 베트남·인도 지역 디자인하우스 인수와 운영자금으로 활용할 계획이다.",https://n.news.naver.com/mnews/article/123/0002373839
2025-12-15 15:39:00,"‘주담대 변동금리’ 코픽스, 석 달 연속 상승…전월比 0.24%p ‘쑥’","변동형 주택담보대출 금리 산정의 기준이 되는 신규취급액 기준 코픽스(COFIX·자금조달비용지수)가 석 달 연속 상승했다.  15일 은행연합회가 공시한 '2025년 11월 기준 COFIX'에 의하면 신규취급액 기준 코픽스는 2.81%로 전월(10월) 2.57% 대비 0.24%p 높아졌다.  잔액기준 코픽스는 2.83%로 전월대비 0.01%p 하락했으며 신(新) 잔액기준 코픽스는 2.48%로 전월과 동일했다.  코픽스는 NH농협·신한·우리·SC제일·하나·기업·KB국민·한국씨티은행 등 국내 8개 은행이 조달한 자금의 가중평균금리를 말한다. 은행이 실제 취급한 예·적금, 은행채 등 수신상품 금리가 인상 또는 인하될 때 이를 반영해 상승 또는 하락한다.  신규취급액 기준 코픽스와 잔액기준 코픽스에는 정기예금, 정기적금, 상호부금, 주택부금, 양도성예금증서, 환매조건부채권매도, 표지어음매출, 금융채(후순위채·전환사채 제외)가 포함된다. 신 잔액기준 코픽스는 여기에 기타 예수금, 기타 차입금과 결제성자금 등이 추가된다.  신규취급액 기준 코픽스는 은행이 해당 월에 신규로 조달한 자금을 대상으로 산출하기 때문에 잔액기준 코픽스나 신 잔액기준 코픽스보다 시장금리 변동을 신속하게 반영한다.  한편 최근 4주간 공시된 단기 코픽스는 2.67%~2.89%로 나타났다. 단기 코픽스는 계약만기 3개월물인 단기자금을 대상으로 산출된다.",https://n.news.naver.com/mnews/article/123/0002373838
2025-12-15 15:36:00,"사단법인 온율, 오는 16일 '성년후견세미나'...공공후견활동지원사업 점검","사단법인 온율은 사회복지법인 한울정신건강복지재단, 사단법인 한국정신건강전문요원협회와 공동 주최하고 보건복지부 등이 후원하는 '제13회 온율 성년후견세미나'가 오는 16일 14시부터 17시까지 헤이그라운드 성수시작점 브릭스(B1)에서 개최된다고 밝혔다.  사단법인 온율은 2014년 법무법인 율촌이 공익활동을 위해 설립한 비영리 법인으로, 사회적 약자를 위한 성년후견제도의 발전과 실무 정착에 기여하고 있다.  이번 세미나는 '정신질환자 공공후견활동지원사업' 시범사업을 점검하고, 특히 지역사회 정신질환자의 자기결정권 실현과 자립을 밀접하게 지원하기 위한 '지역 중심 후견법인 발굴 및 양성 방안'을 집중적으로 모색할 예정이다.  지난 2017년 정신건강복지법 시행 이후 무연고 중증정신질환자의 후견인 선임 필요성에서 출발한 정신질환자 공공후견활동지원사업은 2025년부터 지역사회 정신질환자를 중심으로 확대 시행되고 있으며 다음해 1월 2일 본사업 시행을 앞두고 있다.  온율은 2021년부터 본 사업 참여 법인 자문 및 보건복지부 연구용역 수행 등을 통해 사업의 발전에 기여해 왔으며, 2025년부터 2026년까지 정신질환자 공공후견활동지원단을 운영하고 있다.  이번 세미나에서는 2025년 사업 성과를 보고하고, 2026년 본사업 성공을 위한 개선점을 집중 점검한다. 특히, 지역사회 정신질환자에게 맞춤형 후견 서비스를 제공하기 위한 지역 기반 공공후견법인 양성 방안이 주요 의제로 다뤄질 예정이다.",https://n.news.naver.com/mnews/article/123/0002373837
