날짜,제목,본문,링크
2025-12-02 10:34:00,"여야, 728조 내년도 예산안 합의...5년 만에 법정시한 처리","여야가 내년도 예산안 처리 시한인 2일 정부 원안 728조원 규모를 유지하는 내용의 내년도 예산안에 합의했다. 예산안이 이날 오후 본회의를 통과하면 5년 만에 법정시한 내 처리가 된다.  김병기 더불어민주당 원내대표와 송언석 국민의힘 원내대표는 이날 오전 국회에서 회동하고 오후 4시 본회의를 열어 2026년도 예산안과 예산 부수법안을 처리하기로 의견을 모았다.  여야는 정부 조직개편에 따른 이체 규모 등을 제외한 4조 3000억원을 감액하고, 감액 범위 내에서 증액해 총지출 규모(약 728조원)를 정부안 대비 늘어나지 않도록 했다.  이재명 정부 핵심 국정과제 지역사랑상품권 발행지원, 국민성장펀드 등은 감액하지 않고, 대신 AI(인공지능) 지원, 정책펀드, 예비비 등은 일부 감액키로 했다.  아울러 국가정보자원관리원 재해복구시스템 구축, 분산전력망 산업 육성, AI모빌리티 실증사업 관련 예산, 도시가스 공급 배관 설치 지원, 국가장학금 지원, 보훈유공자 참전명예수당 등은 증액한다.  여야가 이견을 보인 예산부수법안(법인세·교육세 인상안)은 정부 원안이 그대로 통과될 전망이다. 국민의힘은 '기업 부담'을 이유로 증세에 반대했지만, 민주당이 '재정 건전성' 이유로 인상 방침을 고수했다.  법인세법 개정안은 과세표준 구간별로 법인세율을 1%포인트(p)씩 인상해 윤석열 정부 이전 수준으로 복구한다. 2억원 이하 9→10%, 2억원 초과~200억원 이하 19→20%, 200억원 초과~3000억원 이하 21→22%, 3000억원 초과 24→25% 등이다.  교육세율은 수익 1조원 이상의 금융·보험사에 적용하는 교육세를 현행 0.5%에서 1.0%로 인상한다. 1조 이하는 현행 세율이 유지된다.  정부는 여야 합의를 토대로 계수조정(시트 작업)에 들어간다. 민주당 관계자는 ""지금부터 15시간 이상이 걸릴 수 있다""며 ""서두르면 (예산안 표결)을 자정 안에 할 수 있을 것""이라고 전망했다.  예산안 법정 처리시한은 2일 밤 12시다. '국회는 회계연도 개시(1월 1일) 30일 전까지 예산안을 의결해야 한다'는 헌법 제54조2항에 따른 것이다.  다만 국회는 번번이 이를 어겼고 문제 개선을 위해 '예산안 자동부의 제도'가 도입됐지만, 시한이 지켜진 해는 도입 원년인 2014년과 2020년 두 차례가 전부였다.",https://n.news.naver.com/mnews/article/123/0002373033
2025-12-02 10:32:00,"이 대통령 ""12.3 내란 종식, 국회 앞 시민대행진"" 참석 예정","이재명 대통령은 12.3 비상계엄 사태 1주년이 되는 3일 저녁 7시 국회 앞에서 개최되는 '12.3 내란외환 청산과 종식, 사회대개혁 시민대행진' 행사에 참여할 예정이라고 대통령실이 밝혔다.  대통령실 대변인실은 2일 오전 알림 메시지를 통해 이같이 밝혔다.  이 행사는 시민단체인 '내란청산·사회대개혁 비상행동 기록기념위원회'가 주관하고, 더불어민주당과 조국혁신당, 진보당, 기본소득당, 사회민주당 등이 참여할 것으로 알려졌다.  현직 대통령이 시민단체 장외 행사에 참여하는 것은 이례적이라는 평가가 나온다.  그러나 대통령실은 12.3 내란 사태를 맞아 국민주권 시대를 연 국민이 행사의 주체가 되고, 비상계엄을 해제하는 데 가장 큰 힘이 됐던 시민들이 주인공이 돼야 한다며 대통령실은 특별히 행사를 준비하지 않는 것이 기본 입장이라고 밝혔다.  이 대통령은 3일 오전 불법계엄 1년을 맞아 대국민 특별성명을 발표하고, 외시들과 기자회견을 갖을 것으로 알려졌다. 이후 5부 요인들과 오찬을 한 후 저녁에 여의도 행사에 참석할 예정이다.  행사 주최측은 지난달 25일 기자회견에서 ""내란 세력에 대한 심판은 여전히 이뤄지지 않았고, 사회대개혁은 이제 출발점에 서 있을 뿐""이라며 ""미완의 혁명을 완성하고, 민주주의 전진을 위해 다시 광장으로 모여달라""고 호소했다.",https://n.news.naver.com/mnews/article/123/0002373032
2025-12-02 10:31:00,"차세대 실손보험 개편 속도내나... 이찬진 금감원장 ""1세대 축소·5세대 전환 병행""","정부와 금융당국이 실손의료보험 구조 개선을 위해 비급여 관리 강화 및 5세대 실손보험 도입 작업에 속도를 내고 있다.  비급여 진료 남용으로 실손보험 손해율이 악화되고 건강보험 재정에도 부담이 가중되고 있다는 지적이 나오는 가운데 금융감독원과 보건복지부가 협의 채널을 구축해 구체적인 제도 개편을 논의하는 단계에 접어들었다.  이찬진 금융감독원장은 1일 서울 여의도 금감원 본원에서 열린 기자간담회에서 ""무분별하게 비급여를 양산한 기존 실손보험 구조는 상품 설계상 하자가 있다""며 ""과잉 비급여 진료가 건강보험 제도 전체를 흔들고 있다""고 강하게 비판했다.  이어 ""5세대 실손보험 출시를 위해 복지부와 협의 중이며, 1세대 실손보험의 축소와 5세대 전환을 병행하는 방안도 논의하고 있다""고 밝혔다.  정부는 내년 초부터 도수치료, 체외충격파치료, 온열치료 등 주요 비급여 항목을 '관리급여'로 지정하는 방안을 검토 중이다.  관리급여는 비급여 중 진료비 규모가 크거나 과잉진료 우려가 큰 항목을 별도 관리하는 개념으로, 가격 통제를 통해 과도한 의료 이용을 억제하려는 목적을 지닌다.  이 원장은 ""의료기관 권유에 따른 과잉 비급여 진료, 제3자 리스크가 심화하고 있다""며 ""비중증 치료의 자기부담률 인상, 급여체계 연계 강화로 과잉 진료 유인을 줄이겠다""고 강조했다.  금감원은 복지부 장관·차관과 이미 협의체를 가동 중이며, 관리급여 신설과 관련된 쟁점 사항을 논의하고 있다. 다만 국민건강보험공단과의 데이터 연계는 아직 초기 단계라는 설명이다.  차세대 실손보험(5세대)의 핵심은 비급여를 중증·비중증으로 나눠 보장을 차등화하는 것이다. 비급여 항목에 대한 과도한 청구가 쏠리는 현 체계를 구조적으로 바꾸겠다는 의미다.  이 원장은 ""5세대 실손보험을 최대한 조속히 도입하려 하고 있으나 건강보험공단과의 데이터 상호교환 등 실무 과제가 남아 있어 내년 1분기 출시 여부는 확정하기 어렵다""고 말했다.  이어 ""건보공단이 관리급여 신설에 아직 적극적이지 않아 논의가 진입 단계""라며 ""향후 적극적인 협조를 요청했다""고 부연했다.  한편, 금감원은 실손보험 제도 개편과 동시에 소비자 보호 대책도 추진할 계획이다. 보험금 안내 표준화, 부당 부지급에 대한 무관용 원칙 적용, 보험사기 조사 강화 등이 포함된다.  금감원은 ""현장 의견을 수렴해 국회·복지부와 협의함으로써 후속 제도 개선으로 이어지도록 하겠다""고 밝혔다.",https://n.news.naver.com/mnews/article/123/0002373031
2025-12-02 10:27:00,"'시티오씨엘 8단지', 오늘 1순위 청약접수","HDC현대산업개발, 현대건설, 포스코이앤씨가 선보이는 '시티오씨엘 8단지'의 1순위 청약접수가 2일 진행된다.  인천광역시 미추홀구 학익동 인천 용현·학익 1블록 도시개발구역 일원에 들어서는 이 단지는 지하 3층~지상 46층, 7개동, 전용면적 59~136㎡, 전체 1349세대 규모다. 전 세대 일반분양 물량이다.  전용면적별 세대수는 59㎡ 157세대, 75㎡ 153세대, 84㎡A 569세대, 84㎡B 251세대, 84㎡C 82세대, 101㎡ 92세대, 110㎡ 42세대, 136㎡P 3세대로 구성된다.  시티오씨엘은 전체 대지면적 약 154만㎡ 부지에 1만3000세대 수준의 미니신도시급 복합도시를 조성하는 민간도시개발사업이다. 올해 상반기 분양된 '시티오씨엘 7단지'를 비롯해 시티오씨엘에서 공급된 5개 단지가 모두 분양을 마친 바 있다.  단지에서 도보권 내 초등학교(예정)와 중·고교(예정)가 위치하며 수인분당선 학익역(예정) 역세권 입지도 갖춘다. 향후 역 개통 시 강남구청, 서울숲, 수서 등 서울 주요 지역을 환승 없이 한 번에 오갈 수 있으며 수도권 지하철 1호선, 송도역(KTX) 등 대다수 노선과도 연계가 가능해 광역 이동이 용이할 전망이다.  이밖에 제2경인고속도로 능해IC, 수도권 제2순환고속도로(인천~김포간), 인천대교, 경인고속도로로 이어지는 인천대로, 제3경인고속도로로 통하는 아암대로 등의 도로망이 인접한다.  단지 앞으로 송도센트럴파크와 유사한 규모인 약 37만㎡의 그랜드파크 조성이 예정됐고 남항근린공원, 문학산, 갯골 유수지 등이 인근에 위치힌다.  시티오씨엘 내에는 대규모 상업·문화·업무 구역으로 조성되는 '스타오씨엘'이 마련된다. 스타오씨엘에는 인천뮤지엄파크(추진 중)와 영화관, 쇼핑시설 등의 생활편의·쇼핑·문화 시설이 들어설 예정이다. 이와 함께 스타오씨엘과 그랜드파크를 잇는 보행가로(링크오씨엘)가 조성될 계획이다.  단지 중앙에 조성되는 오브제 카페를 포함해 어린이놀이터, 유아놀이터, 셔틀스테이션, 돌봄센터, 주민운동시설, 근린생활시설 등 다양한 조경·편의 시설이 마련되며 골프연습장, 피트니스, G.X, 사우나, 다목적체육관 등의 커뮤니티 시설도 계획됐다.  청약 일정은 2일 1순위, 3일 2순위 접수로 진행된다. 당첨자는 9일 발표되며 정당계약은 21~24일 4일간 이뤄진다.  견본주택은 인천광역시 미추홀구 아암대로 일원에 마련됐다.",https://n.news.naver.com/mnews/article/123/0002373030
2025-12-02 10:18:00,"한국관세무역개발원, 관세무역연구 추계학술세미나 12일 개최","한국관세무역개발원이 학술지 '관세무역연구' 편집위원회와 오는 12일 광화문 코리아나호텔에서 '2025년 관세무역연구 추계학술세미나'를 개최한다고 2일 밝혔다.  한국관세무역개발원이 주최하고 '관세무역연구' 편집위원회가 주관하는 이번 세미나는 '대미 통상환경 변화와 우리의 과제'를 주제로 트럼프 2기 행정부 출범 이후 본격화된 글로벌 통상질서 재편에 대응하기 위한 정책·학술적 논의를 심화하기 위해 마련됐다.  행사는 '관세무역연구' 편집위원장 김상만 교수의 학술지 운영성과, 내년 추진계획 보고로 시작된다. '관세무역연구'는 2024년 창간 이후 관세·무역·통상 영역에서 전문 연구 기반을 확장해왔으며, 이번 세미나는 학술지의 발전 성과를 공유함과 동시에 관세·통상 현안에 대한 다양한 전문가 의견을 교류하는 장으로 기획됐다.  기조연설에는 전 외교부 차관이자 WTO 지역무역협정위원회 의장을 역임한 이태호 고문이 나서 '미국 통상정책의 구조적 변화와 글로벌 통상질서의 재편'을 주제로 다자통상체제 속 미국 통상정책의 역사적 맥락과 정책 방향을 심층적으로 조망한다.  세션 제1주제에선 국립외교원 민정훈 교수가 트럼프 2기 통상정책의 전개 양상과 각국의 협상 동향을 분석한다. 제2주제에서는 한국해양수산개발원(KMI) 임병호 부연구위원이 글로벌 공급망 재편기 속에서 한국 산업이 직면한 위험과 기회를 진단하고 실증 분석을 바탕으로 정책적 대응전략을 논의한다.  종합토론은 전 외교관 출신의 국제통상 전문가 최원목 교수(이화여자대학교 법학전문대학원)가 좌장을 맡아 학계·실무·관계 전문가와 함께 주요 발표 내용을 검토하고 정책적 시사점을 공유할 예정이다.  한국관세무역개발원 남성훈 연구본부장은 ""대미 통상환경의 변화는 산업·물류·공급망 등 경제 전반에 직접적인 영향을 미치고 있다""면서 ""이번 세미나는 전문가들이 한자리에 모여 당면한 도전과 대응 전략을 함께 논의하는 매우 뜻깊은 자리""라고 말했다.  이어 ""앞으로도 한국관세무역개발원은 공익 연구기관으로서 국가 정책 수립에 기여하는 다양한 활동을 지속하겠다""고 덧붙였다.  이번 세미나 참석 문의는 한국관세무역개발원 연구2실로 문의하면 된다",https://n.news.naver.com/mnews/article/123/0002373029
2025-12-02 10:13:00,"삼정KPMG, 중견기업 성장 이끈 공로로 산업부 장관상 받아","삼정KPMG가 '제11회 중견기업인의 날'에서 중견기업 지원 유공을 인정받았다.  삼정KPMG는 설하영 상무가 산업통상자원부 장관 표창을 수상했다고 2일 밝혔다.  한국중견기업연합회와 산업통상자원부가 공동 주최한 이번 행사는 지난 1일 롯데호텔 서울에서 열렸다. 이 행사는 중견기업의 성장과 국가 산업 발전에 기여한 기업인 및 유공자를 포상하기 위해 마련됐다. 행사에는 중견기업 대표와 정부 및 국회 관계자, 유관기관 인사 등 200여 명이 참석했다.  이번 표창은 설하영 상무를 비롯해 삼정KPMG가 수행해 온 중견기업 성장 지원 활동이 높게 평가받은 결과다. 삼정KPMG는 조직 고도화와 경영 안정성 제고, 지속가능한 성장 기반 구축에 기여한 점을 인정받았다.  이번 수상은 정부와 한국중견기업연합회가 공식적으로 인정하는 유공 포상으로, 삼정KPMG의 중견기업 지원 활동이 공공성과 전문성 측면에서 제도적 평가를 받았다는 데 의미가 있다.  특히 설하영 상무는 중견기업 CFO들이 직면한 주요 현안에 대한 심층 인사이트를 제공하고 실행 중심의 대응 전략을 제시한 공로를 인정받았다.  또 중견기업의 인공지능 도입 전략 수립과 산업별 우수사례 확산을 통해 디지털 역량 강화를 지원하고, 중견기업 CEO와 2세 경영인을 대상으로 한 혁신 사례 공유에도 기여했다.  설하영 상무는 ""이번 표창은 삼정KPMG 중견기업성장지원센터가 축적해 온 전문성과 노력이 공식적으로 인정받은 결과""라며 ""앞으로도 중견기업 맞춤형 지원 프로그램 고도화와 신규 협력 과제 발굴 등을 통해 중견기업의 성장 생태계 조성에 지속적으로 기여하겠다""고 말했다.  한편 삼정KPMG 중견기업성장지원센터는 회계, 세무, M&A, 투자유치, 사업재편 등 각 분야 전문가로 구성된 전담 조직이다.  센터는 중견기업 및 오너가가 직면한 다양한 경영 이슈에 최적의 해결방안을 제시하는 원스톱 통합 서비스를 제공하고 있다. 또한 중견기업의 지속 가능한 성장 전략과 안정적 승계 구조 마련을 위한 지원을 강화하고 있다.",https://n.news.naver.com/mnews/article/123/0002373028
2025-12-02 09:56:00,우리금융지주 차기 회장 최종 압축 후보군 4명 확정  ,"우리금융지주 임원후보추천위원회(임추위)는 차기 회장 최종 압축 후보군(숏리스트)으로 임종룡 회장, 정진완 우리은행장 및 외부 후보 2명 등 총 4명을 선정했다고 2일 밝혔다. 외부 후보는 개인 정보 보호 차원에서 비공개하기로 했다.  임추위는 지난 10월말 경영승계절차 개시 이후 후보군을 대상으로 △내부 및 외부 전문평가기관을 통한 경영성과 △최고경영자 육성프로그램 결과 △리더십 등 평판조회 결과 등을 점검했고, 지난 1일 롱리스트 후보군을 대상으로 면접을 진행한 후 숏리스트 후보군을 확정했다.  이강행 임추위 위원장은 ""지배구조 모범관행을 충실히 반영한 경영승계규정 및 승계 계획에 따라 독립성과 공정성을 기반으로 절차를 진행했다""며 ""특히 외부 후보군을 대상으로는 그룹 경영 현황 자료 제공 및 질의응답 시간을 갖는 등 사전 오리엔테이션을 개최해 외부 후보자의 정보 접근성을 높였다""고 설명했다.  임추위는 선정된 4명의 숏리스트 후보자를 대상으로 앞으로 한 달여간 복수의 외부 전문가 면접과 후보자별 경영계획 발표(프리젠테이션), 심층 면접 등 면밀한 검증 과정을 거친 후 위원들 간의 충분한 논의를 거쳐 차기 회장 최종 후보 1인을 선정할 계획이다.  임추위에서 선정한 최종 후보자는 이사회 결의를 거쳐 내년 3월 예정된 정기 주주총회 승인을 통해 차기 회장으로 공식 취임할 예정이다.",https://n.news.naver.com/mnews/article/123/0002373027
2025-12-02 09:31:00,"물가, 또 ‘2.4%’ 상승…한은 “생활물가도 높아져…경계심 갖고 점검”","11월 소비자물가 상승률이 전월(10월)과 같은 2.4% 상승했다. 한국은행은 소비자물가가 두 달 연속 2% 중반의 상승률을 보이고 생활물가도 높아진 만큼 향후 물가 상황을 경계심을 갖고 점검하겠다고 밝혔다.  한은은 2일 오전 8시 30분 본관 16층 회의실에서 김웅 부총재보 주재로 '물가 상황 점검회의'를 개최해 최근의 물가 상황과 향후 물가 흐름을 점검했다.  김웅 부총재보는 이날 회의에서 ""소비자물가는 여행 관련 서비스가격이 예상대로 낮아졌으나 석유류가격 강세가 지속되는 가운데 농축수산물 오름세가 크게 확대되면서 전월과 같이 2.4% 상승했다""라고 말했다.  그는 ""농축수산물(전년동월비, 10월3.1%→11월5.6%)은 기상여건 악화 등으로, 석유류(4.8%→5.9%)는 환율상승 영향 등으로 오름폭이 확대됐다""라며 ""근원물가 상승률은 여행 관련 개인서비스가격이 다시 안정되면서 하락했다(2.2%→2.0%)""라고 설명했다.  김웅 부총재보는 물가 흐름에 대해 ""11월 소비자물가는 고환율 등으로 석유류가격이 상승하고 농축수산물가격도 크게 오르면서 2.4% 상승했으나 근원물가 상승률은 서비스가격이 낮아져 2.0%로 하락했다""라고 평가했다.  이어 ""근원물가가 다시 안정적인 흐름을 나타낸 가운데 농축수산물가격 상승세도 완화되면서 향후 소비자물가 상승률은 점차 2% 수준으로 낮아질 것""이라며 ""다만 높아진 환율이 향후 물가에 미칠 영향에 대해 좀 더 지켜볼 필요가 있다""라고 예상했다.  그러면서 ""소비자물가가 두 달 연속 2% 중반의 상승률을 보이고 생활물가도 높아진 만큼 향후 물가 상황을 경계심을 갖고 점검하겠다""라고 강조했다.",https://n.news.naver.com/mnews/article/123/0002373026
2025-12-02 09:31:00,"페스카로, 공모주 청약 마감일... 균등·비례 살펴보니","페스카로의 공모주 청약 1일차가 끝난 가운데 균등배정 주식 수와 비례경쟁률에 관심이 쏠리고 있다.  2일 금융투자업계에 따르면 공모주 청약 1일차에는 각각 NH투자증권 7만9479건, 한화투자증권 7248건수가 몰렸다. 이에 따른 균등배정주식수는 1.53주와 5.60주로 집계됐다. 비례경쟁률은 NH투자증권 93.41:1, 한화투자증권 18.44:1로 나타났다.  앞서 페스카로는 지난달 20~26일 진행된 기관투자자 수요예측에서 1173.21대 1이라는 높은 경쟁률을 기록하며 공모가를 희망밴드(1만2500~1만5500원) 상단인 1만5500원으로 확정했다. 총 공모금액은 약 202억 원, 상장 후 예상 시가총액은 약 1498억 원이다.  2016년 설립된 페스카로는 자동차 전장 전문가 및 화이트해커 출신이 주축이 된 기업으로, 전장부품 보안부터 차량통신, 규제 대응 IT솔루션까지 차량 전체 라이프사이클을 아우르는 3단 통합보안 체계를 구축한 것이 특징이다.  특히 전 세계적으로 자동차 사이버보안 규제가 강화되며 차량 제작사가 반드시 인증을 받아야 하는 가운데, 페스카라오는 △전장부품 보안솔루션 △차량통신 보안솔루션 △규제 대응 IT솔루션으로 단기·중기·장기 매출 구조를 모두 갖춰 재무 안정성과 성장성을 확보했다.  2024년 연결 기준 영업수익 143억 원, 영업이익 13억 원을 기록했으며 부채비율 6%, 유동비율 2000% 등 견조한 재무지표도 강점으로 꼽힌다.",https://n.news.naver.com/mnews/article/123/0002373025
2025-12-02 09:30:00,"금융위 ""홍콩H지수 ELS 과징금 제재안, 확정된 바 없다""","금융위원회는 1일 한 언론이 ""금융감독원의 홍콩 H지수 주가연계증권(ELS) 1차 제재안이 금융위원회 증권선물위원회에서 대폭 감경됐다""고 보도하자 즉각 ""아직 확정된 바 없다""고 반박했다.  이날 머니투데이는 '금융위서 뒤집힌 홍콩 ELS 1차 제재, 과징금 대폭 줄어드나' 제목의 기사에서 ""이찬진 금융감독원장이 소비자구제 여부를 감안하겠다고 한 만큼 '본게임'인 2조원대 과징금 제재 수위도 최종적으로 낮아질 것으로 보인다""라고 보도했다.  매체는 이어 ""금감원이 지난 28일 5개 은행에 통보한 조치안에는 은행의 자율배상 등 사후구제가 반영되지 않았다"", ""설명의무 위반의 어떤 조항을 적용하냐에 따라 2조원대 과징금이 대폭 줄어들 가능성도 열려있다""라고 전했다.  앞서 이찬진 금감원장은 이날 여의도 금감원에서 가진 취임 후 첫 기자간담회에서 천문학적 규모의 ELS 과징금 제재가 모험자본과 생산적 금융에 장애가 되지 않도록 하는 방향을 금융당국간 협의하고 있다고 밝혔다.  이 원장은 ""ELS 과징금과 과태료가 공정위까지 이슈가 된 상황이고, 이로 인해 생산적 금융 공급에 장애가 생길 수 있다는 우려를 잘 알고 있다""며 ""위험가중자산(RWA) 상승 문제와 자본건전성 규정에 따른 부담이 동시에 작용할 수 있다""고 설명했다.  이어 ""이런 어려움이 발생하지 않도록 금융위와 적극 협의하고 있으며 소비자보호 원칙은 지키되 정책적 우려가 최소화되도록 제재 수준을 감안해 진행하고 있다""면서 ""금융위의 최종 결정에서도 이런 부분이 반영될 것으로 보인다""고 말했다.  아울러 ""과징금이 확정되기 전에 RWA 반영을 유예하는 방안도 논의되고 있는 것으로 보고받고 있다""며 ""내년 상반기부터 모험자본과 생산적 금융이 본격화돼야 하는 상황에서 제재가 장애가 되지 않도록 하는 방향으로 금융당국과 협의하고 있다""고 했다.  이 원장은 ""홍콩 ELS 제재가 첫 리딩케이스이며, 사전 통지된 내용 중 기관에 대한 문책과 임원·직원 관련 조치가 일부 포함된 것으로 알고 있다""면서 ""다만 사전 예방적 소비자보호뿐 아니라 사고 이후 금융회사가 얼마나 충실히 구제 노력을 했는지도 제재에서 참작돼야 하며 그 균형이 무너지지 않도록 하는 것이 중요하다""고 강조했다.  지난달 28일 금감원은 홍콩H지수 ELS 판매은행(KB국민·신한·하나·NH농협·SC제일은행) 5곳에 총 2조원 규모의 과징금을 사전통보했다. 이는 ELS 불완전판매와 관련한 역대 최대 규모 과징금으로 최종 확정될 경우 이들 은행들의 회계상 부담에 적지 않을 것으로 우려되는 가운데 금융당국도 감독규정에 따른 조치이긴 하지만 규모와 관련해 쉽게 결정하기 어려울 것이라는 분위기가 감지됐다.  이찬진 금감원장이 기자간담회에서 내놓은 발언은 과징금 규모에 대한 조정이 있을 수 있다는 점을 시사한 것을 금융권은 긍정 해석하고 있는 것이다.  이런 가운데 이날 금융위는 ""ELS 판매은행에 대한 제재안은 금융감독원 제재심의위원회 심의 이후 증권선물위원회 및 금융위원회 의결을 거쳐 결정되는 사항으로 아직 확정된 바 없다""고 일단 선을 그은 것이다.",https://n.news.naver.com/mnews/article/123/0002373024
