날짜,제목,본문,링크
2025-12-14 13:16:00,"현대차, 브라질서 토요타 제치고 6년 연속 '톱5'","[이데일리 이배운 기자] 현대차가 남미 최대 자동차 시장인 브라질에서 ‘현지 생산·전략 차종’ 등 전략을 앞세워 입지를 강화하고 있다. 현대의 소형 스포츠유틸리티차 '크레타' (사진=현대차) 14일 브라질자동차유통연맹(Fenabrave)에 따르면 올해 1∼11월 브라질에서 현대차는 총 18만 2948대를 팔아 점유율 8.02%로 4위를 차지했다. 경쟁업체인 일본 토요타(15만 8864대)는 6.96%로 5위에 머물렀다.  1위는 48만 277대(21.05%)를 판매한 이탈리아 피아트가 차지했다. 독일 폭스바겐이 38만 8529대(17.02%), 미국 제너럴모터스(GM)가 24만 6401대(10.8%)로 뒤를 이었다.  현대차는 2020년부터 6년 연속 브라질 시장 판매 5위권에 안착할 것으로 전망된다. 경쟁사인 도요타와는 격차를 더욱 벌리며 시장 입지를 강화하고 있다는 평가다.  현대차는 지난해 브라질에서 20만 6029대를 팔아 2019년 이후 5년 만에 연간 판매 20만대를 재돌파했고, 토요타(20만 3793대)를 누르며 전체 4위를 차지했다. 올해도 20만대 이상의 판매량으로 토요타와의 격차를 2만 4000대 이상 벌리며 4위에 오를 가능성이 커 보인다.  이처럼 현대차가 선전하는 배경으로는 철저한 현지화 전략이 꼽힌다. 현대차는 브라질 상파울루주 피라시카바에 완성차 공장을 운영하고 있다. 2019년 1억 2500만 헤알(약 340억원)을 투자해 연간 생산 능력을 18만 대에서 21만 대로 확대했다.  현대차는 이곳에서 소형 해치백 ‘HB20’과 소형 스포츠유틸리티차(SUV) ‘크레타’를 생산하고 있다. 소형차 수요가 높은 브라질 소비자의 성향을 고려해 맞춤형 모델을 제공하는 전략이다.  HB20은 2012년 출시 이후 올해 11월까지 누적 판매 134만 131대를 기록하며 국민차 반열에 올랐다. 크레타 역시 2017년 출시 이후 52만 6158대가 판매됐다.  한편 브라질 정부는 최근 탈탄소 부문에 투자하는 자동차 제조업체에 세제 혜택을 주는 ‘그린 모빌리티 혁신(MOVER) 프로그램을 추진 중이어서 전기차 등에 강점이 있는 현대차에는 수혜로 작용할 전망이다.  현대차는 2024년 브라질 내 친환경차 투자를 공식화하며 2032년까지 수소를 포함한 친환경 분야에 총 11억 달러(약 1조 6200억원)를 투자하겠다고 밝힌 바 있다. 하이브리드 혼합연료차량(FFV) 전용 파워트레인을 개발하고 아이오닉5와 코나 일렉트릭 등 대표 전기차를 브라질 시장에 순차 투입할 계획이다.",https://n.news.naver.com/mnews/article/018/0006183108
2025-12-14 13:14:00,"송언석 ""통일교 게이트·민중기 특검에 대한 특검 필요""","[이데일리 노희준 기자] 송언석 국민의힘 원내대표는 14일 더불어민주당의 통일교 금품 수수 의혹과 민중기 특검의 인권침해·편파 수사에 대해 각각 특검이 필요하다고 밝혔다.  송언석 원내대표는 이날 국회 원내대표실에서 기자간담회를 열고 “오늘 대한민국의 사법 정의를 바로 세우기 위해 통일교 특검 도입을 공식적으로 제안한다”면서 “권력 앞에 멈춰 선 수사, 선택적으로 작동하는 정의를 그대로 두고 볼 수 없기 때문”이라고 말했다.  송 원내대표는 “민중기 특검이 그동안 뭉개고 있었던 통일교 민주당 정치자금 의혹 규명을 위한 통일교 게이트 특검이 꼭 필요하다”면서 “더불어민주당과 현 정부 핵심 인사들을 둘러싼 접촉, 금품 수수 의혹이 연일 새롭게 드러나고 있다”고 주장했다.  그는 또 민중기 특검을 수사하는 특검도 필요하다고 했다. 송 원내대표는 “1999년 특검 제도 도입 이후, 민중기 특검은 최악의 특검으로 기록될 전망”이라며 “특검의 생명은 정치적 중립성과 공정성인데 민중기 특검은 노골적으로 집권 여당의 하수인처럼 행동하며 정치 보복과 야당 탄압의 도구로 전락했다”고 지적했다.  그러면서 “야당 인사 18명을 30차례 이상 소환을 했고, 중앙당사를 포함해서 20차례가 넘는 압수수색을 진행했지만, 더불어민주당과 이재명 정권 인사들의 통일교 금품 수수 의혹에 대해서는 소환조사도 하지 않았고, 압수수색도 없이 무려 4개월을 흘려보냈다”면서 “과연, 이것이 공정한 수사라고 할 수 있겠는가”고 물었다.  송 원내대표는 또한 민중기 특검과 관련해 강압적인 기획 수사로 인한 심각한 인권 침해도 간과할 수 없는 문제라고 지적했다. 그는 “수사를 받던 양평군 공무원은 수사 이후, 스스로 생활 마감해야 했다”면서 “최근에 공개된 21쪽 분량의 유서에는 허위자백을 강요받았고, 이미 타깃이 정해진 상태에서 시키는 대로 이야기하라는 압박이 이어졌다는 절박한 호소가 담겨 있었다”고 설명했다.  이와 함께 송 원내대표는 “대장동 항소포기 외압에 대한 국정조사를 즉각 실시할 것을 더불어민주당에 다시 한번 촉구한다”면서 “왜 아직까지 항소를 포기했는지, 누가 그 결정을 내렸는지, 국민은 단 한 줄의 설명도 듣지를 못하고 있다”고 강조했다.  그는 특검법 관련 야당과의 협의에 대해선 “개혁신당이든 조국혁신당이든 어느 정당 원내대표와도 (특검법 협의를 위해) 만날 용의가 있다”고 말했다.  송 원내대표는 개혁신당과의 통일교 특검법 공동발의 가능성을 두고는 “제가 공동발의라고 말한 적이 없다”면서 “제가 이야기한 것은 실체적 진실을 밝히기 위해 누구든 뜻을 함께 하는 사람들은 같이 가는게 좋다는 취지를 말한 적은 있다”고 했다.",https://n.news.naver.com/mnews/article/018/0006183107
2025-12-14 13:05:00,"에코프로 ‘젊은 과학자상’, UST 박준우·연세대 김대우 교수 선정","[이데일리 김기덕 기자] 에코프로가 젊은 과학자를 발굴하고 연구 성과를 장려하기 위해 제정한 ‘에코프로 젊은 과학자상’(EYSA) 시상식과 혁신경진대회를 개최했다고 14일 밝혔다.  에코프로는 11일 청주 본사에서 제3회 ‘에코프로 젊은 과학자상’ 시상식을 열고 에너지 분야 박준우 UST(과학기술연합대학원대학교) 전기기능소재공학 교수, 환경 분야 김대우 연세대 화공생명공학과 교수를 각각 선정했다고 밝혔다.  에코프로는 또 이동채 에코프로 창업주를 비롯해 송호준 에코프로 대표, 최문호 에코프로비엠 대표 등 가족사 최고경영진들이 참석한 가운데 제 10회 혁신경진대회도 함께 개최했다. 특히 이번 혁신경진대회는 R&D뿐 아니라 AI분야로 확대해 2026년 AI 경영을 적극 전개하겠다는 의지를 밝혔다.  에코프로 젊은 과학자상은 에너지와 환경 등 두 분야에서 뛰어난 연구 성과를 낸 젊은 교수들을 발굴하고 지원하자는 이동채 에코프로 창업주의 제안으로 시작해 올해 세 번째를 맞고 있다. 올해 젊은 과학자상에는 총 26명의 과학자가 지원했다.  에코프로는 논문, 학술상, 특허 등록 건수, 기술 이전 내역 등을 종합 심사해 수상자를 선정했다. 수상자에게는 상패와 2000만 원의 상금이 각각 수여됐다.  이동채 에코프로그룹 창업주는 수상자들과 오찬을 함께 하며 “중국과의 치열한 경쟁에서 이기기 위해서는 산업 및 학계가 힘을 합쳐 누구도 따라올 수 없는 기술을 개발해야 한다”며 “에코프로는 우리보다 뛰어난 기술을 적극적으로 아웃소싱 할 것”이라고 밝혔다.  에너지 분야 수상자인 박준우 교수는 전고체전지, 리튬-황 전지 분야에서 국내 최고 수준의 전문성을 보유하고 있다. 특허 실적과 기술 상용화 영향력이 높이 평가받았다. 박 교수는 논문을 통해 자가 액화 코팅법을 통한 전고체전지 계면 안정화, 경량 고성능 리튬-황 전지 상용화 가능성 등을 증명한 바 있다.  환경 분야 수상자인 김대우 교수는 그래핀 소재 기반의 분리막 및 나노 소재 분야에서 혁신적 개념을 창출하며 세계적 수준의 학문적 성과와 산업적 파급효과를 인정받았다. 기술이전과 창업으로 실용화를 병행해 관련 산업 발전에 긍정적인 영향을 미친 부분도 수상으로 이어졌다.  R&D 혁신과 AI혁신 두 부문으로 나눠 진행한 혁신경진대회는 R&D 부문에서 차세대 소재 개발 등 총 7개 과제 발표가 있었으며 AI혁신 부문에서는 AI를 활용한 연구개발 효율화 방안 등을 두고 참석자들의 열띤 토론이 진행됐다.  에코프로 관계자는 “임직원들의 혁신 마인드를 고취하기 위해 도입한 혁신경진대회가 올해는 AI 부문으로 확장되면서 제조현장은 물론 연구개발, 경영지원 등 전 부문에 AI 도입이 가속화될 것”이라고 말했다.  에코프로 ‘2025 젊은 과학자상 시상식’에서 송호준 에코프로 대표(가운데)가 에너지 분야 수상자 UST(과학기술연합대학원대학교) 전기기능소재공학 박준우 교수(오른쪽), 환경 분야 수상자 연세대학교 화공생명공학과 김대우 교수와 기념사진을 촬영하고 있다.",https://n.news.naver.com/mnews/article/018/0006183106
2025-12-14 12:58:00,"GS25, ‘얼박사·서울우유 디저트’…올해 히트상품 7종 봤더니","[이데일리 한전진 기자] GS리테일(007070)이 운영하는 편의점 GS25는 올해 한 해 동안 고객 반응이 뜨거웠던 상품 7개를 ‘2025 GS25 히트상품 TOP 7’으로 선정했다고 14일 밝혔다.  GS25에서 모델이 올해의 메가히트 상품 ‘얼박사’를 선보이고 있다 (사진=GS25) GS25는 올해 음료, 주류, 디저트, 냉장식품 등 주요 카테고리 전반에서 히트 상품을 배출했다. 자체 인공지능(AI) 트렌드 분석 시스템과 ‘고객 관점’ 전략을 상품 기획 전 과정에 도입한 결과다. 특히 소비자 수요를 데이터 기반으로 읽어내고, 잠재 수요를 빠르게 상품화한 사례들이 주목받았다.  히트상품으로는 △얼박사 △안성재 소비뇽레몬블랑하이볼 △서울우유 우유크림모찌롤 △선양오크소주 △젼언니 스윗믹스젤리 △아이스브륄레 △리얼프라이스 블랙페퍼닭가슴살 등 7개가 선정됐다.  대표 상품인 얼박사는 박카스·사이다·얼음컵의 동시 구매 데이터를 분석해 하나의 음료로 통합 출시한 사례다. 누적 매출은 최근 130억원을 돌파했고, 3개월 연속 음료 매출 1위를 기록했다. 남성 비중은 약 73%로, 20대 대학생과 30~40대 직장인 선호도가 높았다.  주류 부문에선 지난 7월 출시한 안성재 소비뇽레몬블랑하이볼이 히트를 기록했다. 소비뇽 블랑 베이스에 생레몬을 더한 제품으로, 출시 4개월 만에 누적 160만개 이상 팔렸다. 소비자 80% 이상이 2030세대였으며, 여성 비율이 64%에 달했다.  서울우유 디저트 시리즈도 올해 GS25 냉장 디저트 빵 매출 상위 10위권을 모두 점령하며 존재감을 드러냈다. 출시 이후 누적 판매량은 600만개를 넘겼으며, 취급 상품수(SKU)는 14개까지 확대했다.  GS25는 사내 AI 시스템을 통해 맛·향·식감·언급량 등 요소를 실시간으로 분석한다. 아울러 트렌드 선행 캐칭 시스템을 운영해 히트 가능성이 높은 상품을 선별하고 있다. 우리동네GS 앱(애플리케이션) 검색 실패어를 통해 수요는 있으나 공급이 부족한 품목도 발굴 중이다.  이기철 GS리테일 간편MD부문장은 AI를 활용한 고객 및 트렌드 분석 데이터를 기반으로 상품 개발 전 과정을 정교하게 운영하고 있다”며 “앞으로도 고객 관점에서 맛과 품질을 지속적으로 높이고, 차별화 상품을 발굴해 독보적인 상품 경쟁력을 강화하겠다”고 말했다.",https://n.news.naver.com/mnews/article/018/0006183104
2025-12-14 12:13:00,171만명 쓰는 '기후행동 기후소득' 온실가스 40만톤 감축 효과,"[수원=이데일리 황영민 기자] 일상생활 속 탄소 배출 저감활동을 한 경기도민에게 리워드를 제공하는 ‘기후행동 기후소득’이 출시 17개월 만에 누적 가입자 171만명을 돌파했다.  기후행동 기회소득 앱 활용 장면. 카페에서 다회용기를 이용 시 리워드를 받을 수 있다.(사진=경기도) 14일 경기도에 따르면 지난해 7월 기후행동 기회소득 앱 출시 후 12월 10일까지 기준 누적 가입자 수는 171만7501명으로 꾸준한 증가세를 보이고 있다.  기후행동 기후소득을 이용 중인 도민들은 하루 8000보 이상 걷기, 플로깅, 기후퀴즈 풀기 등 16개 기후행동 실천 활동을 통해 1인당 연간 최대 6만원을 지역화폐로 받고 있다.  특히, 도민들의 적극적인 기후행동으로 온실가스 배출량이 약 39만6686톤 감소한 것으로 나타났다. 이는 소나무 317만 그루를 심은 효과와 같다는 것이 경기도의 설명이다.  기후행동 기후소득은 보상을 위한 실천에서만 그치지 않고, 환경에 대한 도민들의 인식 변화도 이끌고 있다.  지난 8월 경기도에서 기후행동 기회소득 가입자 9만7000여 명을 대상으로 설문조사를 실시한 결과, 환경 문제에 더 관심을 갖게 됐다고 응답한 비율은 94%, 기후행동을 더 많이 실천하고 있다고 응답한 비율은 90%에 달했다.  내년부터는 타지역에 주소지를 둔 경기도 소재 대학 재학생까지 기후행동 지원 범위를 확대 예정이다. 이와 관련, 현재 ‘경기도 기후행동 실천 및 확산 지원 조례안’이 경기도의회 본회의 심사를 앞두고 있으며, 조례가 통과되면 2026년부터 대학생 지원이 확대된다.  일부 시군에서는 자체 재원을 활용해 지역 특색을 살린 추가 리워드도 지급할 예정이다. 도는 지난 9월 용인특례시 등 12개 시군을 대상으로 찾아가는 기후행동 기회소득 사업설명회를 개최했으며, 내년도 예산이 확보된 시군부터 순차적으로 기후행동 기회소득 앱 서비스를 제공할 예정이다. 이를 통해 더 많은 도민들이 기후행동에 참여하고 혜택을 누릴 수 있게 될 전망이다.  한편, 경기도 ‘기후행동 기회소득’ 사업은 올해 기후에너지환경부 주관 ‘지자체 탄소중립 우수사례’ 평가에서 광역지자체 1위인 장관상을 받았다.  (자료=경기도)",https://n.news.naver.com/mnews/article/018/0006183101
2025-12-14 12:03:00,[포토]아파트 매입 78.5% 비중 역대 최고치,"[이데일리 이영훈 기자] 올해 주택 매매 시장에서 아파트의 매입 비중이 더욱 높아지며 역대 최고치를 경신한 것으로 나타난 14일 서울 남산에서 바라본 서울 시내에 아파트가 보이고 있다.  14일 한국부동산원 주택 유형별 매매 현황 통계에 따르면 올해 1∼10월 전국 주택 매매는 60만1천811건으로 집계됐다. 이 가운데 아파트 매매는 47만2천373건으로, 전체의 78.5%를 차지했다.",https://n.news.naver.com/mnews/article/018/0006183100
2025-12-14 12:03:00,"[포토]주택 매매 시장, 아파트 매입 비중 역대 최고치","[이데일리 이영훈 기자] 올해 주택 매매 시장에서 아파트의 매입 비중이 더욱 높아지며 역대 최고치를 경신한 것으로 나타난 14일 서울 남산에서 바라본 서울 시내에 아파트가 보이고 있다.  14일 한국부동산원 주택 유형별 매매 현황 통계에 따르면 올해 1∼10월 전국 주택 매매는 60만1천811건으로 집계됐다. 이 가운데 아파트 매매는 47만2천373건으로, 전체의 78.5%를 차지했다.",https://n.news.naver.com/mnews/article/018/0006183099
2025-12-14 12:03:00,[포토]남산 나무에 쌓인 눈,[이데일리 이영훈 기자] 14일 서울 중구 남산 일대에서 나무에 밤사이 내린 눈이 쌓여 있다.,https://n.news.naver.com/mnews/article/018/0006183098
2025-12-14 12:03:00,[포토]눈과 함께하는 추억,[이데일리 이영훈 기자] 14일 서울 중구 남산 일대에서 나무에 밤사이 내린 눈이 쌓여 있다.,https://n.news.naver.com/mnews/article/018/0006183097
2025-12-14 12:03:00,"한국 제안 정보보호 기술 13건, 국제 표준으로 사전 채택","[이데일리 안유리 기자] 메타버스, 디지털트윈 등 분야에서 우리나라가 제안한 정보보호 기술 13건이 국제표준으로 사전 채택됐다.  과학기술정보통신부는 3일부터 11일까지 스위스 제네바에서 개최된 국제전기통신연합 전기통신표준화 부문(ITU-T) 정보보호연구반(SG17, 수석대표: 순천향대 염흥열 교수) 국제회의에서 우리나라가 제안한 신규 표준화 항목 13건이 승인, 국제표준 13건이 사전채택, 국제표준 1건, 기술보고서 1건 및 오류정정서 1건이 최종승인되었다고 14일 밝혔다.  이번 국제회의에는 전 세계 66개 회원국 482명(온·오프라인 병행)의 전문가가 참석했다. 우리나라는 다양한 산학연 관계자들로 구성된 76명의 국제 보안 표준 전문가가 참석해 우리나라가 제안한 총 80건의 국내 정보보호 기술을 국제표준에 반영하기 위해 열띤 토론을 펼쳤다.  본 국제회의에서는 총 221건(중국 84건, 한국 80건, 유럽 20건, 일본 9건, 기타 28건)의 기고서가 논의되었으며, 우리나라의 기고서 점유율(36%)은 중국(38%)에 이어 두 번째였다.  구체적으로, 우리나라는 이번 회의에서 △종단 간 암호기술을 양자키 분배 네트워크에 적용하기 위한 보안 표준 △디지털 신분증에서 특정 정보만을 선택해서 제공할 수 있는 보안 기능 △차량 보안 강화를 위한 차량용 침입탐지시스템, △메타버스 환경에서 데이터의 신뢰성 확보를 위한 기준 및 요구사항, △차세대 보안(메타버스, 디지털트윈, 사물인터넷, 분산원장기술) 로드맵 개발 등 13건의 신규 표준화 항목을 승인받았다.  또한, 우리나라가 다년간 주도적으로 개발해 온 분산원장기술 기반 응용(신원관리, 전력거래시스템, 자산관리) 보안기술들과 소프트웨어 공급망 보안 위협 등 13건이 국제표준으로 사전채택되었다.  아울러 △모바일 단말의 보안성을 평가하는 보안기능 국제표준 △메타버스 응용에서 아바타의 데이터 보호를 위한 환경 분석 기술보고서 △분산원장기술 기반 데이터 접근 및 공유를 위한 보안 위협과 요구사항 오류정정서가 최종승인되었다.  한편, 정보보호연구반이 인공지능 자체 보안, 생성형 AI 모델, 딥페이크 탐지 및 파인튜닝 보안 등 전반적인 인공지능 보안 기술을 전담할 연구과제(Question 16)의 잠정 신설에 합의함에 따라, 우리나라는 에이전틱 및 피지컬 AI 보안 등 신흥 분야까지 연구 범위를 확대하여 새로운 리더십 확보를 목표로 적극 참여할 예정이다. 해당 연구과제는 2026년 1월 표준화자문그룹(TSAG) 국제회의에서 심의될 예정이고, 내년 6월경 차기 SG17 국제회의에서 최종 승인될 예정이다.  임정규 과기정통부 정보보호네트워크정책관은 “차세대보안 분야에서 표준개발을 착수하기 위해 로드맵 개발이 선행되는 데 우리나라가 디지털트윈, 분산원장기술 등을 주도하는 것은 의미가 크다”고 강조했다.  그는 이어 “우리나라는 이번 국제회의를 통해 질적?양적 성장을 동시에 이뤄냈으며, 인공지능 보안 표준 개발의 시작은 정보보호 시장 확대를 위한 새로운 기회로 산?학?연 전문가들과 힘을 합쳐 나가겠다”고 말했다.",https://n.news.naver.com/mnews/article/018/0006183096
2025-12-14 12:03:00,"법원, 尹정권서 쫒겨난 고용정보원장에 '해임 취소' 판결","(사진=이데일리 DB) [세종=이데일리 서대웅 기자] 윤석열 정부 당시 취임 후 한 달 만에 발생한 보안사고와 경영실적 평가 미흡을 이유로 해임된 김영중(사진) 전 한국고용정보원장에 대해 1심 법원이 해임 취소 판결을 내렸다. 공공기관 경영평가 부진만으로 기관장을 해임할 수 없다는 법원 판결이 나온 것은 이번이 처음이다.  14일 이데일리 취재를 종합하면, 지난달 27일 서울행정법원 제14부(재판장 이상덕)는 지난해 7월 해임 처분을 내린 고용노동부 장관 결정은 부당하다며 김 전 원장이 노동부 장관을 상대로 제기한 해임처분 취소소송에서 김 전 원장 손을 들어줬다.  고용정보원은 기획재정부가 지난해 상반기에 실시한 ‘2023년도 공공기관 경영평가’에서 준정부기관 중 최하위점인 78.167점을 받았다. 평가등급은 E등급(아주미흡)이었다. 앞서 2023년 6월 29일~7월 5일 ‘워크넷’ 해킹 사고로 23만여명 개인정보가 유출된 점, 경영관리 및 주요사업 평가가 미흡하다는 점이 주된 이유였다. 이를 바탕으로 지난해 6월 최상목 당시 기재부 장관은 ‘공공기관운영법’에 따라 고용정보원장 해임을 건의했고, 임면권자인 이정식 당시 노동부 장관이 7월 말 김 전 원장을 해임했다.  그러나 법원은 김 전 원장 해임사유는 인정되지 않는다며 해임 처분을 취소해야 한다고 판결했다. 보안사고에 대해 법원은 김 전 원장이 취임(2023년 5월 30일) 후 한 달밖에 되지 않은 시점에 발생한 점을 감안하면 “이러한 중대한 책임을 온전히 원고의 직무수행 탓으로 돌리기 어렵다”고 봤다.  같은 맥락에서 김 전 원장의 7개월(2023년 6~12월) 동안의 경영능력이 2023년 경영평가에서 온전히 반영됐다고 보기 어렵다고 판단했다. 기관의 주요 사업계획이나 예산은 연초에 확정되는 경우가 많다는 것이다. 공공기관 평가 때 기관장 재직 기간이 6개월에 미달하면 해임건의 대상으로 삼지 않는 점도 법원은 주목했다. 재임기간이 짧은 기관장에 대해선 경영능력을 제대로 평가할 수 없다는 점을 고려한 기준인데, 김 전 원장의 재임기간(7개월)은 6개월 미만인 다른 기관장과 비교해도 본질적인 차이점을 찾기 어렵다는 것이다.  특히 올해 실시된 ‘2024년 경영평가’에서 고용정보원은 C등급(보통)을 받았는데, 지난해 초 사업계획을 수립한 김 전 원장의 약 6개월 재임기간이 포함된 점을 고려하면 C등급은 김 전 원장의 경영성과가 포함됐다고 보는 게 합리적이라고 법원은 판단했다. 김 전 원장이 전체 재임기간 중 충실의무를 위반했거나 직무를 해태했다면 2024년 경영평가 결과도 나빠야 했다는 것이다. 법원은 “2023년도 경영실적평가의 책임은 원고(김 전 원장)가 전적으로 부담해야 하지만 2024년도 평가의 공은 원고가 가져갈 수 없다는 피고(노동부 장관)의 주장은 쉽게 납득하기 어렵다”고 판시했다.  김 전 원장은 “해임 처분으로부터 명예 회복을 할 수 있게 해준 1심 재판부의 현명한 판단에 감사드린다”며 “이번 판결이 공공기관 경영평가 제도를 합리적으로 개선하는 계기가 되길 희망한다”고 밝혔다. 김 전 원장은 행시 36회로 공직에 입문한 뒤 노동부에서 고용정책실장까지 지낸 고용정책 전문가다.  노동부는 지난 11일 항소했다. 항소 포기 시 김 전 원장의 해임이 취소돼 고용정보원장으로 복귀해야 하는데 현 원장이 자리를 잡고 있는 점을 고려한 것으로 보인다. 이창수 현 원장은 국민의힘 대변인과 충남도당 위원장을 지낸 인사로 지난해 12·3 비상계엄 직후인 12월 11일 임명돼 취임했다. ‘고용정책 싱크탱크’인 고용정보원에 고용 관련 업무 경험이 전무한 정치인을 김문수 당시 노동부 장관이 임명해 ‘알박기 인사’ 논란이 끊이지 않았다.",https://n.news.naver.com/mnews/article/018/0006183095
