날짜,제목,본문,링크
2025-12-14 10:00:00,"LG전자, 서울대와 'AI 보안' 연구한다…전문 연구센터 설립","[이데일리 공지유 기자] LG전자가 서울대와 손잡고 인공지능(AI) 보안 기술 고도화를 위한 전문 산학 연구센터를 설립한다. LG전자 김병훈 최고기술책임자(CTO) 부사장(오른쪽)과 김주한 서울대 연구부총장 교수가 최근 서울 관악구 서울대에서 만나 ‘Secured AI 연구센터’ 설립을 위한 양해각서(MOU)를 체결했다.(사진=LG전자) LG전자는 최근 서울 관악구 서울대에서 김병훈 LG전자 최고기술책임자(CTO) 부사장, 김주한 서울대 연구부총장 교수 등 주요 관계자가 참석한 가운데 ‘Secured AI 연구센터’ 설립을 위한 양해각서(MOU)를 체결했다고 14일 밝혔다.  LG전자는 서울대의 세계적 연구 인력과 풍부한 인프라를 활용해 AI 보안 핵심 기술 확보부터 안전한 AI 서비스 구현까지 다양한 산학과제를 공동 수행한다. 신설 연구센터는 대규모언어모델(LLM) 에이전트 보안 강화 기술, 데이터 유출 방지 기술 등 안전한 AI 생태계를 만드는 기술을 집중적으로 연구·개발한다.  구체적으로 소프트웨어 개발 및 운영의 전 과정에 보안 체계를 적용한 ‘머신러닝 특화 보안 운영(MLSecOps)’ 모델을 확립한다.  LLM 에이전트가 실생활에 널리 활용돼 편의를 제공하지만, 이와 동시에 거짓 정보를 생성하는 ‘할루시네이션’, 데이터에 대한 외부 탈취 시도 등 위협도 늘었다. 이러한 위협에 기존 ‘개발운영(DevOps)’과 ‘머신러닝운영(MLOps)’ 방식으로는 종합적인 대응이 어려운 만큼, 보안에 더욱 집중한 체계를 구현해 통합 대책을 마련한다는 목표다.  또 데이터 수집부터 학습, 배포, 운영, 폐기까지 이어지는 전 과정에서 침입 탐지, 데이터 보호 등의 통합 역할을 수행하며 실제 산업 환경에 적용 가능한 AI 보안 플랫폼을 개발한다는 계획이다. (아랫줄 왼쪽 두번째부터)김주한 서울대 연구부총장 교수와 김병훈 LG전자 CTO 부사장 등 관계자들이 최근 서울 관악구 서울대학교에서 열린 연구센터 설립 양해각서(MOU) 체결식에 참석해 기념촬영을 하고 있다.(사진=LG전자) 초대 센터장은 서울대 전기정보공학부 학부장인 홍용택 교수가 맡는다. 홍 교수는 국제정보디스플레이학회(SID) 펠로우, 한국과학기술한림원 정회원으로, 2025년 대한민국 과학기술훈장 혁신장을 수상한 과학기술계 리더다.  LG전자에서는 CTO부문 임효준 차세대컴퓨팅연구소장이 연구 과제를 점검 및 조율하는 역할을 담당한다. 차세대컴퓨팅연구소는 차세대 보안, 블록체인, 양자 컴퓨팅, 분산 컴퓨팅 등 미래 기술을 선제적으로 확보하고 혁신적인 비즈니스 가치를 창출하는 역할을 수행하는 조직이다.  김병훈 부사장은 “차세대 보안 기술을 고도화해 AI 보안 영역에서 리더십을 구축하고, 고객과 사회에 더 안전하고 신뢰할 수 있는 제품과 서비스를 제공하도록 노력할 것”이라고 말했다.",https://n.news.naver.com/mnews/article/018/0006183037
2025-12-14 10:00:00,"삼성물산, 폴란드 기업과 손잡고 유럽 SMR 시장 공략 박차","[이데일리 박지애 기자] 삼성물산 건설 부문이 폴란드 소형모듈원전(SMR) 개발사와 손잡고 중·동부 유럽 시장에서 SMR 사업 확장에 나선다.  미하우 소워보프 신토스그린에너지 회장(왼쪽)과 오세철 삼성물산 대표이사 사장(오른쪽)이 유럽 SMR 개발 협력을 위한 업무협약(MOU)을 체결하고 기념촬영을 하고 있다.(사진=삼성물산) 삼성물산은 폴란드 ‘신토스 그린 에너지’(Synthos Green Energy·SGE)와 유럽 SMR 개발 협력을 위한 업무협약(MOU)을 체결했다고 14일 밝혔다.  신토스그린에너지는 SMR의 주요 기술 가운데 하나로 평가받는 ‘BWRX-300’을 활용, 2030년대 초반까지 폴란드 최초의 SMR 발전소를 비롯해 최대 24기의 SMR 건설을 목표로 하고 있다.  BWRX-300은 비등형 경수로(BWR)를 개량한 300MW(메가와트) 규모의 SMR 기술로, 미국 제너럴일렉트릭(GE)과 일본 히타치의 합작사인 GVH(GE Vernova Hitachi Nuclear Energy)가 개발했다. 삼성물산은 지난 10월 GVH와 유럽·동남아시아·중동 지역 SMR 사업 확장을 위한 협약을 체결한 바 있다.  이번 협약에 따라 삼성물산과 신토스그린에너지는 체코, 헝가리, 리투아니아, 불가리아, 루마니아 등의 중·동부 유럽으로 SMR 사업을 확대할 계획이다.  또 폴란드 SMR 사업 개발에 필요한 타당성·부지 조사와 환경영향평가 등에서 협력할 예정이다.  오세철 삼성물산 대표이사 사장은 “신토스그린에너지와의 긴밀한 협력은 폴란드와 중·동부 유럽 진출의 기반을 확보하는 이정표가 될 것”이라고 강조했다.  라파우 카스프루프 신토스그린에너지 사장은 “삼성물산의 글로벌 원전 수행 역량과 신토스그린에너지의 SMR 사업 경쟁력이 더해져 폴란드 SMR 사업의 가능성을 높이고, 유럽 내 안전하고 지속 가능한 에너지 설루션을 제공할 수 있기를 바란다”고 말했다.",https://n.news.naver.com/mnews/article/018/0006183036
2025-12-14 10:00:00,50만원짜리 '종이 뽑기'에 열광하는 어른들[사(Buy)는 게 뭔지],"[이데일리 신수정 기자] 12월이 되면 SNS 타임라인은 거대한 언박싱(Unboxing) 현장으로 변한다. 매일 아침 사람들은 네모난 종이 박스의 숫자를 찾아 구멍을 뜯는다. 손가락만한 립스틱, 초콜릿 한 조각, 혹은 작은 레고 브릭이 튀어나온다. 바로 크리스마스를 기다리며 12월 1일부터 24일까지 매일 하나씩 선물을 열어보는 ‘어드벤트 캘린더(Advent Calendar)’ 이야기다.  디올 뷰티의 어드벤트 캘린더. (사진=디올 홈페이지) 과거 서구권의 크리스마스 문화였던 어드벤트 캘린더가 한국 유통가의 핵심 굿즈로 자리 잡았다. 뷰티, 패션, 식품업계 할 것 없이 앞다퉈 한정판을 내놓는다.  가격은 만만치 않다. 명품 뷰티 브랜드의 캘린더는 50만~80만원을 호가하고, 비교적 저렴한 초콜릿이나 장난감 브랜드도 수만 원을 훌쩍 넘는다. 구성품의 실제 가격을 합산해보면 “포장값 아니냐”는 볼멘소리가 나오기도 하지만, 인기 제품은 11월에 이미 ‘완판’된다. 소비자들이 지갑을 여는 대상이 단순한 ‘물건’이 아니라는 방증이다.  왜 굳이 비싼 돈을 주고 이 어드벤트 캘린더를 살까. 전문가들은 이를 ‘도파민 정기구독’ 심리로 해석한다. 한 번에 뜯어서 가지면 그만일 물건들을 굳이 24개로 쪼개어 놓은 것은, 기쁨을 24일간 유예하고 분산시키는 행위다.  춥고 팍팍한 연말, 매일 아침 눈을 떴을 때 나를 반겨주는 작은 이벤트를 돈으로 사는 셈이다. 상자 속 내용물보다, “오늘은 뭐가 나올까?” 하는 기대감이 이 소비의 본질이다. 즉, 우리는 50만원짜리 화장품 세트를 산 게 아니라, 24일간의 확실한 행복을 결제한 것이다.  경제적인 관점에서는 전형적인 불황형 소비인 ‘립스틱 효과’의 진화 버전이다. 고금리와 경기 침체로 내 집 마련이나 자동차 교체 같은 빅 럭셔리는 포기했지만, 수십만 원짜리 캘린더로 명품 브랜드의 경험을 소유하려는 심리다. 남이 사주길 기다리는 대신, 스스로 셀프 산타가 돼 1년 동안 고생한 나에게 보상을 주는 의식이기도 하다.  오늘도 누군가는 13번째 칸을 뜯으며 환호하고 있을 것이다. 비록 그 안에 든 것이 자그마한 샘플 향수일지라도, 그 순간만큼은 팍팍한 현실을 잊게 해주는 달콤한 마법이 되기 때문이다. 24번의 도파민, 어쩌면 꽤 남는 장사일지도 모른다.",https://n.news.naver.com/mnews/article/018/0006183035
2025-12-14 09:57:00,美 명문 브라운대서 총격 사건…최소 2명 사망·8명 중상,"[이데일리 임유경 기자] 미국 로드아일랜드주 아이비리그 대학인 브라운대학교에서 13일(현지시간) 총격 사건이 발생해 최소 2명이 숨지고 8명이 중상을 입었다.  미국 로드아일랜드주 프로비던스의 브라운대에서 총격 사건이 발생한 뒤인 12월13일(현지시간) 경찰 차량이 폴리스라인이 묶인 벽 인근 도로에 주차돼 있다.(사진=로이터) 로이터통신, 월스트리트저널(WSJ) 등 외신에 따르면 브렛 스마일리 프로비던스 시장은 이날 브리핑에서 브라운 대학교의 바루스 앤 홀리 공학관에서 발생한 총격으로 최소 2명이 숨지고 8명이 중상을 입었다고 밝혔다.  스마일리 시장은 희생자들이 학생이었는지 여부를 포함해 희생자들에 대한 자세한 정보는 아직 공개할 수 없다고 말했다. 부상자들은 인근 병원으로 옮겨져 치료를 받고 있으며, 중상을 입었으나 현재로서는 상태가 급격히 악화되지는 않은 것으로 전해졌다.  용의자는 아직 체포되지 않은 상태다. 현지 당국에 따르면 한 목격자는 검은 옷을 입은 남성이 건물에서 나와 도보로 현장을 빠져나가는 모습을 봤다고 진술했다.  브라운대는 아이비리그 대학으로, 학생들은 전날부터 기말고사 기간에 들어갔으며 총격 당시에도 시험이 예정돼 있었다. 대학 측은 사건 발생 당시 해당 건물에 누가 있었는지 파악 중이라고 밝혔다. 총격이 발생한 건물은 학생들의 왕래가 잦은 장소로, 강의실과 실험실이 밀집해 있는 학생 활동의 중심지라고 탈리브 레딕 브라운대 총학생회장은 설명했다.  도널드 트럼프 미국 대통령은 백악관에서 기자들과 만나 이번 총격 사건에 대해 “끔찍한 일”이라며 “지금 우리가 할 수 있는 일은 희생자들과 심하게 다친 사람들을 위해 기도하는 것뿐”이라고 말했다.  한편 뉴욕경찰국(NYPD)은 만일의 사태에 대비해 시내 대학들에 추가 경찰 인력을 배치했다.",https://n.news.naver.com/mnews/article/018/0006183034
2025-12-14 09:54:00,"지엠한마음재단, 인천 여성·다문화 복지기관에 3000만원 지원","[이데일리 이배운 기자] 지엠한마음재단코리아가 인천지역 여성과 다문화 가족의 자립을 본격 지원한다. (왼쪽부터) 윤명옥 한마음재단 사무총장 겸 GM 한국사업장 커뮤니케이션 총괄 전무, 권도국 계양구가족센터 센터장, 김성율 인천사회복지공동모금회 배분사업팀장이 기념사진을 촬영하고 있다. (사진=지엠한마음재단코리아) 지엠한마음재단코리아는 지난 12일 인천 계양구가족센터에서 ‘2025년 여성 및 다문화 기관 지원사업’ 발대식을 개최했다고 14일 밝혔다.  이번 사업은 인천지역 여성 및 다문화 사회복지기관의 기능 보강과 환경 개선을 통해 이용자들의 자립 역량을 높이고 기관 서비스 품질을 강화하기 위해 마련됐다.  한마음재단은 인천지역 사회복지기관 6곳에 기관별로 500만원씩 총 3000만원의 지원금을 전달했다. 지원금은 노후 PC와 가전제품 교육 기자재 교체 및 신규 구입 등에 활용돼 쾌적하고 안정적인 교육·생활 환경 조성과 정보 접근성 향상에 기여했다.  윤명옥 지엠한마음재단 사무총장 겸 GM 한국사업장 커뮤니케이션 총괄 전무는 “이번 사업은 여성과 다문화 가족이 스스로 삶을 설계하고 성장할 수 있는 기반을 마련하도록 할 것“이라며 “앞으로도 일회성 지원에 그치지 않고 지역사회가 지속적으로 성장할 수 있도록 현장의 목소리를 반영한 협력 사업을 확대해 나가겠다”고 밝혔다.  권도국 계양구가족센터 센터장은 “기관 환경 개선을 통해 이용자들에게 더 나은 서비스를 제공할 수 있게 되어 기뻤다”며 “이번 지원이 현장의 긍정적인 변화로 이어지기를 기대한다”고 말했다.  한마음재단은 GM 한국사업장의 사회공헌활동을 전개하는 비영리재단으로, 지역사회 복지 증진과 소외계층 지원을 위해 다양한 사업을 추진하고 있다. 한마음재단은 2005년 설립 이래 지역사회와 함께 성장하고, 사회적 책임을 다하기 위해 다양한 사회공헌 활동을 펼치고 있다.  한편 지엠한마음재단코리아는 GM 한국사업장의 사회공헌활동을 전개하는 비영리재단으로 2005년 설립 이후 지역사회 복지 증진과 취약계층 지원을 위한 다양한 사업을 추진해왔다. 현재까지 GM 한국사업장 임직원 누적 2만명 이상이 참여했으며 약 22만 시간에 달하는 봉사활동을 통해 아동 노인 장애인 등 소외계층을 지원하고 있다.  GM 한국사업장은 김장김치와 연탄 지원 등 지역 공동체 의식 강화를 위한 사회공헌 활동을 지속하는 한편 전국 380개 이상의 협력 서비스센터 네트워크를 통해 GM 본사 인증 기술과 표준화된 절차를 기반으로 한 고품질 서비스를 제공하고 있다.",https://n.news.naver.com/mnews/article/018/0006183032
2025-12-14 09:43:00,티엠씨 상장·리브스메드 공모[증시캘린더],"[이데일리 박순엽 기자] 이번 주 기업공개(IPO) 시장에선 티엠씨가 유가증권시장(코스피) 시장에. 알지노믹스와 아크릴과 나라스페이스테크놀로지, 메리츠제1호기업인수목적, 아이비케이에스제25호기업인수목적이 코스닥 시장에 각각 상장한다. 리브스메드와 세미파이브는 일반 투자자 대상 청약을 시행한다. 기관 투자자 대상 수요예측에 나서는 기업은 없다.  12월 15일(월)  △티엠씨 상장  -케이블 전 공정 내재화를 통해 선박·해양, 광케이블, 원자력 등의 산업용 특수케이블을 제조하는 기업. 주요 고객사로 현대중공업, 한화오션, 삼성중공업 등을 확보. 선박 외 광케이블 분야에서도 암페놀(Amphenol), 헥사트로닉(Hexatronic) 등 글로벌 주요 광통신 기업을 고객사로 확보했으며 원전, 신재생, EPC(설계·조달·시공) 등 특수 산업 분야에도 진출해 한국수력원자력 등에 산업용 케이블을 공급. 주관사는 미래에셋증권.  -공모가 희망 범위 상단 9300원, 공모금액 567억원.  -2024년 연결기준 매출액 3757억원, 영업이익 109억원.  △메리츠제1호기업인수목적 상장  -신재생에너지, 바이오제약(자원)·의료기기, IT 융합 시스템, LED 응용, 그린 수송 시스템, 탄소저감에너지, 고도 물처리, 첨단그린도시, 방송통신융합산업, 로봇 응용, 신소재·나노융합, 고부가 식품산업, 엔터테인먼트, 자동차 부품 제조, IT 및 반도체, 기타 미래 성장 동력을 갖추었다고 판단되는 산업에 속하는 사업을 영위하는 회사를 중점으로 합병을 추진.  -공모가 2000원, 공모금액 110억원.  12월 15일(월)~12월 16일(화)  △리브스메드 공모  -최소침습수술에 사용되는 복강경 수술기구의 개발, 제조 및 판매를 주요 사업으로 운영. 대표 제품인 다관절 복강경 수술 기구인 ArtiSential은 상하좌우 각 관절의 가동 범위를 90°까지 확장할 수 있어 체내에서의 움직임이 뛰어나며, 직경 5mm로서 절개 부위를 최소화해 복강경 수술에 최적화된 솔루션을 제공. 핵심 기술인 가동 범위 90°다관절 기술을 바탕으로 ArtiSential 외에도 혈관봉합기 ArtiSeal, 수술용 스테이플러 ArtiStapler, 3D4K 카메라시스템 LivsCam, 수술 로봇 Stark 등을 개발. 주관사는 삼성증권, 미래에셋증권.  -공모가 희망 범위 상단 5만 5000원, 공모금액 1359억원.  -2024년 연결기준 매출액 271억원, 영업손실 265억원.  12월 16일(화)  △아크릴 상장  -AI 개발의 전 과정을 지원하는 인프라 기술, 서비스 구축 기술을 통해 모든 산업의 AI를 접목해 혁신을 이끌어내는 AX 인프라 전문기업. GPU 최적화, GPU 자원 가상화, RDMA 기반 고속 전송, 학습·추론 트래픽 차등화 기술 등을 기반으로 AI 인프라 운영 기술을 확보하고 있으며, 이를 통해 워크로드 최적화와 효율적 자원 운영 관리를 실현할 수 있음. 주관사는 신한투자증권.  -공모가 희망 범위 상단 1만 9500원, 공모금액 351억원.  -2024년 연결기준 매출액 134억원, 영업손실 24억원.  12월 17일(수)  △나라스페이스테크놀로지 상장  -우주 산업 내 기술 발전과 수요 구조 변화에 발맞추어 저궤도 초소형 위성 플랫폼의 개발 및 양산, 이를 통한 고빈도 지구 관측 영상 확보, 그리고 인공위성 영상 기반 분석 서비스 제공을 핵심 사업 영역으로 영위. 회사 최초 지구관측 초소형 인공위성인 Observer-1A는 한국시간 2023년 11월 12일 SpaceX의 Falcon 9 로켓을 통해 성공적으로 발사됐으며, 발사 약 2시간 후 교신에 성공함으로써 당사의 위성 시스템 체계종합 능력에 대한 Space Heritage를 확보. 이후 2025년 현재까지 지구 저궤도에서 안정적으로 임무를 수행하며 지속적인 지구 관측 영상을 제공. 주관사는 삼성증권.  -공모가 희망 범위 상단 1만 6500원, 공모금액 284억원.  -2024년 매출액 43억원, 영업손실 44억원.  12월 18일(목)  △알지노믹스 상장  -RNA 편집·교정 분야 기업으로서, RNA 치환효소 플랫폼을 기반으로 한 유전자치료제와 원형 RNA 플랫폼을 보유. RNA 치환효소 기반 신규 유전자치료제 발굴·최적화와 RNA 치환효소 기반 원형 RNA 신규 물질 발굴·최적화를 자체적으로 수행할 수 있는 기술을 포함하는 RNA 플랫폼이 보유 기술. 이를 바탕으로 표적 유전자 RNA를 특이적으로 표적해 유전자 발현을 낮춤과 동시에, 치료용 유전자로의 편집·교정을 통한 치료 효과를 발휘할 수 있는 항암, 유전질환 및 퇴행성질환 유전자치료제를 발굴할 수 있으며, 자가환형화 RNA 구조체를 이용해 기존 선형 RNA를 대체할 수 있는 치료제, 백신 등의 신규 물질을 발굴·제작할 수 있는 독자적인 기술을 보유. 주관사는 삼성증권·NH투자증권.  -공모가 희망 범위 상단 2만 2500원, 공모금액 464억원.  -2024년 매출액 0원, 영업손실 129억원.  12월 18일(목)~12월 19일(금)  △세미파이브 공모  -전용 반도체 개발을 위한 종합적인 설계 엔지니어링 서비스를 제공. 전통적으로 팹리스 사업자가 직접 수행하던 반도체 Spec. 정의, 아키텍처 및 로직 설계부터 디자인하우스 영역의 레이아웃 디자인뿐만 아니라 파운드리 생산 관리 및 후공정 업체(패키징·테스트) 영역까지 시스템 반도체 설계의 전 과정을 아우르는 엔지니어링 서비스를 직접 제공. 이를 위해 IP를 직접 다루는 아키텍팅 및 로직 설계 엔지니어, 파운드리 공정기술을 이해하는 레이아웃 엔지니어, 그리고 후공정 설계를 담당하는 패키징·테스트 엔지니어, 칩 Bring-up을 위한 전문 소프트웨어 엔지니어까지 전 영역에 걸친 포괄적인 전문 인력을 설립 초기부터 보유하고 고객사를 위한 전용 반도체 개발 서비스를 제공. 주관사는 삼성증권.  -공모가 희망 범위 2만 1000~2만 4000원, 공모금액 상단 기준 1296억원.  -2024년 연결기준 매출액 1118억원, 영업손실 229억원.  12월 19일(금)  △아이비케이에스제25호기업인수목적 상장  -소프트웨어·서비스, 디스플레이 산업, 모바일 산업, 게임 산업, 바이오·의료, 신재생에너지, 전자·통신, 소재, 화장품, 기타 미래 성장 동력을 갖추었다고 판단되는 산업군에 속하는 합병대상법인과의 합병을 추진.  -공모가 2000원, 공모금액 100억원.",https://n.news.naver.com/mnews/article/018/0006183030
