날짜,제목,본문,링크
2025-12-06 13:03:00,"전상수 前국회입법차장, 국제의회연맹 차기 사무총장 후보에 올라","전상수 전 국회입법차장 (사진 = 전상수 측 제공) [이데일리 김한영 기자] 전상수 전 국회입법차장이 국제의회연맹(IPU·Inter-Parliamentary Union) 차기 사무총장 선거에서 최종 경합 단계인 5인 후보 명단에 포함됐다.  전 전 차장은 지난 11월, 20명으로 구성된 1차 후보 명단에 이름을 올린 데 이어, 12월 5일 IPU로부터 5인의 2차 후보 명단에 포함됐다는 공식 통보를 받았다. IPU는 전 세계 각국 의회 간 대화와 협력을 위해 설립된 국제기구로, 183개국 의회와 15개 지역 의회가 회원으로 참여하고 있는 세계 최대 규모의 의회 간 국제기구다.  앞으로 내년 4월 튀르키예 이스탄불에서 열리는 제152차 IPU 총회에서 집행위원회는 해당 5인의 후보를 대상으로 인터뷰를 진행한 뒤, 2인 이상의 최종 후보를 선출한다. 이후 183개 회원국의 투표를 통해 차기 사무총장이 결정될 예정이다.  전 후보는 지난 7월 우원식 국회의장의 추천을 받아 IPU 사무총장 선거에 공식 출마했다. 그는 1992년 제11회 입법고시 합격 후 국회에 입문해 △LA총영사관 영사(입법관) △국회사무처 기획조정실장·의사국장 △정무위원회·법제사법위원회 수석전문위원 등을 거쳐 국회 입법차장(차관급)으로 재직한 뒤 퇴임했다.  전 후보가 최종 선거에서 사무총장으로 선출될 경우, 한국인 최초로 국제의회연맹을 이끄는 사무총장이 탄생하게 된다.",https://n.news.naver.com/mnews/article/018/0006178731
2025-12-06 13:01:00,[안치영의 安건강]원인 모르게 붓는 손발…혹시 유전성 혈관부종일까,"[이데일리 안치영 기자] 40대 여성 A씨는 7~8년 전부터 원인 불명의 안면 부종과 손발 부종이 반복돼 여러 병원에 다녀봤으나, 정확한 진단을 받지 못했다.  그러던 중 목 안이 붓고 숨쉬기가 힘들어 응급실로 가게 됐는데 알레르기내과에서 유전성 혈관부종을 확인할 수 있었다. 워낙 희귀병이라 진단이 어려웠던 게 오랫동안 발견하지 못한 이유였다.  두드러기와 혈관부종의 증상 차이(자료=질병관리청 국가건강정보포털) 인구 5만에서 10만 명당 1명꼴로 발병한다고 알려진 ‘유전성 혈관부종(HAE, Hereditary Angioedema)’은 체내 염증을 조절하는 혈장 단백질인 C1-에스테라제 억제제(C1-lNH)가 결핍되거나 기능이 저하돼 신체 곳곳 급성 부종이 반복적으로 발생하는 희귀질환이다. 지난해 국내서 이 병으로 희귀질환 산정특례가 등록된 환자는 약 300명 정도다.  유전성 혈관부종은 질환의 인지도가 낮고 환자마다 증상과 중증도가 달라서 초기에 정확한 진단을 받지 못해 ‘진단 방랑’을 겪는 경우가 흔하다.  심지수 이대목동병원 알레르기내과 교수는 “유전성 혈관부종 환자는 진단까지 평균 8년이라는 장기간 진단 방랑을 겪으며 신체적·정신적 고통에 시달린다”며, “진단 이후에도 예측 불가능한 발작과 응급상황에 상시 노출돼 심리적·금전적 부분에도 상당한 부담이 발생하는 희귀질환”이라고 설명했다.  유전성 혈관부종의 주요 증상은 신체 다양한 부위에 반복적으로 발생하는 ‘부종’이다. 평소에는 증상이 없다가 얼굴(눈, 입술), 목(기도, 혀), 복부, 손발 등 신체 여러 부위에 반복적인 급성 발작 형태로 나타나는 것이 특징이다.  부종은 뚜렷한 이유 없이 자연적으로 발생한다. 다만, 유전성 혈관부종 증상을 유발할 수 있는 요인으로는 △스트레스 △경미한 외상 △치과 치료 등의 시술 및 수술 △에스트로겐 노출 등이 있다. 환자의 75%는 가족력으로 발생하나 25%는 가족력 없이 자발적 돌연변이로 인해 발생하기도 한다.  유전성 혈관부종의 치료는 예방치료와 발작 시 응급치료로 나뉘는데, 특히 가장 중요한 치료는 급성 발작 시 빠른 대처다. 특히 상부 호흡기에서 발생하는 후두부종은 적기에 적합한 치료 및 관리를 받지 못하면 질식해 기도폐색으로 이어질 위험이 있어 즉시 병원을 방문해야 한다.  다행히 2018년부터 국내에서 급성 발작을 신속히 완화할 수 있는 응급 자가투여 주사제(이카티반트 아세테이트)가 건강보험 급여가 적용됐다.  주사 투약 교육을 받은 환자들은 발작 초기에 집에서도 투약할 수 있다. A씨 또한 교육 이후 응급 자가투여 주사제를 보유하고 발작 초기 단계에서 신속히 대처할 수 있게 되면서 삶의 안정감을 크게 되찾았다.  심 교수는 “유전성 혈관부종은 무엇보다 조기 진단과 발작 초기 치료가 중요하다”라며, “진단 비용 경감, 관련 정보 공유 확대, 응급약 접근성 향상 등이 이뤄진다면 유전성 혈관부종 환자의 치료 만족도는 더욱 높아질 것”이라고 말했다.",https://n.news.naver.com/mnews/article/018/0006178730
2025-12-06 12:30:00,"남편은 강남APT, 아내는 속초 세컨하우스…1주택일까?[판례방]","[하희봉 로피드법률사무소 대표변호사] 은퇴 후 전원생활을 꿈꾸거나 주말 휴식을 위해 지방에 소형 아파트나 주택을 마련하는 이른바 5도 2촌(5일은 도시, 2일은 촌) 생활이 인기다. 정부 역시 인구 소멸 위기 지역의 활성화를 위해 지방 저가 주택을 취득할 경우 세금 혜택을 주는 등 이를 장려하는 분위기다.  하지만 세금, 특히 종합부동산세(종부세)를 계산할 때는 누구의 명의로 취득하느냐에 따라 결과가 천양지차로 달라질 수 있어 각별한 주의가 필요하다. 최근 이와 관련하여 의미 있는 대법원 판결(2025두33779)이 선고되었다.  사진=나노바나나 사안은 이렇다. 서울 강남에 공시가격 약 14억원의 아파트를 소유한 A씨는 그의 배우자가 강원도 속초에 공시가격 5790만원짜리 아파트를 소유하고 있었다. A씨는 자신이 1세대 1주택자에 해당한다고 생각했다. 종합부동산세법상 1주택자가 지방 저가 주택(공시가격 3억원 이하 등 요건 충족)을 추가로 보유한 경우, 이를 주택 수에서 제외하여 1세대 1주택자로서의 혜택(기본공제 상향 및 고령자·장기보유 세액공제)을 받을 수 있다는 규정을 믿었기 때문이다.  하지만 과세 당국의 입장은 달랐다. A씨 부부에게 1세대 1주택자 혜택을 배제하고 일반 세율을 적용해 종부세를 부과했다. 이유는 단순했다. 지방 저가 주택 특례는 1주택을 가진 사람이 지방 주택도 함께 소유한 경우에만 적용되는데, A씨 부부는 남편이 서울 집을, 아내가 속초 집을 각각 소유하고 있으니 해당하지 않는다는 것이다.  소송전으로 비화한 이 사건에서 법원은 과연 누구의 손을 들어주었을까. 지난 9월 11일 대법원은 최종적으로 과세 당국의 처분이 옳다고 판결했다.  대법원의 논리는 명쾌하면서도 엄격했다. 조세법규는 특별한 사정이 없는 한 법문대로 해석해야 한다는 조세법률주의 원칙을 재확인한 것이다. 법원은 종부세법 시행령 등을 종합해 볼 때, 특례가 적용되는 경우는 세대원 중 1명이 1주택을 소유한 상태에서 그 주택을 소유한 자가 지방 저가 주택을 함께 소유하는 경우로 한정된다고 보았다. 즉, 소유자가 동일인이어야 한다는 것이다.  납세자 입장에서는 억울할 수 있다. 한 사람이 두 채를 다 가진 경우에는 혜택을 주면서, 부부가 나눠 가진 경우에는 혜택을 주지 않는 것이 불합리해 보이기 때문이다. 그러나 법원은 이 또한 합리적인 차별이라고 판단했다.  종부세는 기본적으로 인별 합산과세 체계다. 한 사람이 집을 두 채 가지면 공시가격을 합산하여 높은 누진세율을 적용받기에 세 부담이 급격히 커진다. 법이 1인이 지방 저가 주택을 함께 소유한 경우 혜택을 주는 것은 이러한 과중한 세 부담을 완화해 주기 위함이다. 반면, 부부가 집을 나눠 가진 경우에는 이미 각자 6억원(현행 9억원)의 기본공제를 받고 낮은 세율 구간을 적용받을 수 있으므로, 굳이 1세대 1주택자 특례까지 중복 적용해 줄 필요가 없다는 것이 법원의 판단이다.  이번 판결이 주는 교훈은 뭘까? 세금 혜택은 법률에 규정된대로만 적용된다는 사실이다. 흔히 부부는 일심동체라 하여 자산을 통산해 생각하기 쉽지만, 세법의 세계에서는 엄연히 남인 경우가 많다.  지방에 세컨하우스를 마련할 계획이 있다면 명의 문제를 신중히 따져봐야 한다. 만약 기존 1주택자가 본인 명의로 지방 저가 주택을 산다면 1세대 1주택자 지위를 유지하며 최대 12억원의 공제 혜택을 볼 수 있다. 하지만 주택이 없는 배우자 명의로 산다면, 1세대 1주택자 특례는 깨지고 부부 각각이 일반 과세 대상이 된다. 물론 공시가격 수준에 따라 부부 공동명의나 별도 명의가 유리한 구간도 분명 존재한다.  결국 좋은 게 좋은 것이라는 식의 막연한 기대는 금물이다. 부동산 취득 전, 전문가를 통해 우리 가족의 소유 현황에 따른 정확한 세금 시뮬레이션을 돌려보는 것만이 세금 폭탄을 피하는 유일한 길이다.  ■하희봉 변호사 △한국외국어대학교 영어학과 △충북대학교 법학전문대학원 △제4회 변호사시험 △특허청 특허심판원 국선대리인 △(현)대법원·서울중앙지방법원 국선변호인 △(현)서울고등법원 국선대리인 △(현)대한변호사협회 이사 △(현)로피드 법률사무소 대표변호사",https://n.news.naver.com/mnews/article/018/0006178729
2025-12-06 12:11:00,[마켓인]새 정책펀드 앞두고…중소 PEF ‘소진 체크리스트’,"이 기사는 2025년12월06일 11시10분에 마켓인 프리미엄 콘텐츠로 선공개 되었습니다.  [이데일리 마켓in 원재연 기자] 150조원 규모 국민성장펀드 윤곽이 드러나면서 중소·중견 사모펀드(PEF) 운용사들의 시선이 펀드 소진으로 쏠리고 있다. 내년부터 새 정책펀드 운용사(GP) 선정이 본격화될 것이란 전제 아래, 이미 보유한 블라인드펀드 소진률을 높이고 전략산업 딜을 채우는 작업을 먼저 끝내려는 움직임이 동시다발적으로 나타나는 분위기다.    6일 투자은행 업계에 따르면 중소·중견 PEF들은 최근 보유 블라인드펀드 운용 속도를 점검하며 투자 집행 일정과 포트폴리오 우선순위를 재정렬하고 있다. 새로운 출자사업 일정이 논의되는 시점에서 최근 투자 실적을 확보해 제안서 경쟁력을 높이려는 목적이 반영된 것으로 업계는 보고 있다.  국민성장펀드는 첨단전략산업기금 75조원과 민간·국민·금융권 자금 75조원을 합쳐 150조원 규모로 설계됐다. 펀드는 반도체·2차전지·수소·방산 등 첨단전략산업을 투자 대상으로 제시하고 있다. 내년 상반기 이후 GP 선정 절차가 구체화될 수 있다는 일정 논의가 이어지면서, 운용사들의 사전 준비 움직임도 같이 나타나는 흐름이다.  정책의 초기 투자 방향과 관련해 최근 제조 AI 전환(M.AX) 얼라이언스와의 연계 논의가 공식화된 점도 시장의 관심을 받는다. 삼성전자·현대차·SK·CJ대한통운 등 참여 기업은 제조 AX 전환을 위한 투자 수요를 10조원 이상으로 제시했고, 정부는 이 계획을 내년 초 국민성장펀드 초기 투자 포트폴리오에 반영하는 절차에 착수했다. 국민성장펀드는 AI 전환 분야에 30조원 이상을 투입하는 구상을 제시한 상태다.  개별 하우스의 집행 패턴에서도 이 같은 흐름이 확인된다. 업계에 따르면 파라투스인베스트먼트는 올해 상반기 결성한 1900억원 규모 ‘혁신성장 M&A 2호’에서 결성 후 약 5개월 만에 1000억원 이상을 투입한 것으로 전해진다. 제조 기반 바이아웃을 앞세우는 동시에 메자닌을 활용한 2차전지 소재·부품 투자도 병행했다.  이외에도 BNW인베스트먼트의 첫 단독 블라인드펀드(4680억원)는 조성 1년 반 만에 소진률 80%를 넘겼다. 웰투시인베스트먼트 역시 작년 말 결성한 2780억원 규모 2호 블라인드펀드의 절반가량을 집행한 상태다.  소진률과 후속 펀드레이징이 맞물린 흐름도 나타난다. 헬리오스PE는 직전 9호 펀드(1070억원)를 90% 이상 투자한 뒤 이를 기반으로 4000억원 규모 10호 블라인드펀드 조성에 착수한 상태다. 스톤브릿지캐피탈 역시 2호 블라인드펀드 소진률이 절반을 웃도는 구간에 들어서면서 최소 7000억원 수준의 3호 펀드 조성을 검토 중인 것으로 전해진다.  한 IB 업계 관계자는 “대부분의 블라인드펀드는 정관상 일정 수준 이상 투자 집행이 진행돼야 후속 펀드 조성에 나설 수 있도록 설계돼 있다”며 “내년 상반기 국민성장펀드를 포함해 정책자금과 민간 출자사업이 맞물릴 가능성이 거론되는 만큼, 신생·중소형 하우스들이 올해 안에 소진률과 최근 딜 실적을 끌어올리려는 움직임이 더 빨라지고 있다”고 말했다",https://n.news.naver.com/mnews/article/018/0006178728
2025-12-06 12:00:00,취업·채용 ‘맞춤형’으로 돕는 고용센터[노동TALK],"(사진=연합뉴스) [세종=이데일리 서대웅 기자] 결혼이민 여성 A씨는 배우자와 사별 후 생계 어려움을 겪다 경기 안산고용센터의 ‘구직자 도약보장 패키지’에 참여했다. A씨는 심리안정 지원을 받으며 배우자 사별과 구직에서 오는 불안과 두려움을 해소하고, 고용센터와 협력한 자치단체를 통해 임대주택, 지역아동센터 정보 등 복지 제도를 소개받았다. 이후 A씨는 생활 안정을 찾으며 전문 진로상담을 받고 이중언어 능력의 강점을 살려 대학병원에서 의료통역사 실습을 거친 후 통번역 업체 취업에 성공했다.  서울 영등포구의 소기업 제조업체 B사는 오랫동안 채용에 어려움을 겪던 중 서울남부고용센터의 ‘기업지원종합서비스’에 참여했다. 고용노동부의 일터혁신 컨설팅을 받아 인사·노무 체계를 개선하고, 재직자 직무능력 향상 프로그램을 통해 직원 역량도 높일 수 있었다. 또 고용센터와 중소벤처기업진흥공단의 도움을 받아 구조혁신지원 사업에 참여하면서 기술제품 경쟁력 향상과 산업재해를 예방하는 데 도움을 받았다. 다양한 지원에 힘입어 B기업은 청년 등 8명을 채용했다.  노동부가 최근 개최한 ‘2025년 맞춤형 고용서비스 성과공유회’에서 발표된 사례다. 구직자 도약보장 패키지와 기업지원종합서비스는 고용센터가 각각 구직자와 기업에 제공하는 맞춤형 고용서비스다. 취업과 채용을 돕는 것은 물론 자치단체, 유관기관과 협력해 복합적인 어려움 해결을 지원한다.  노동부에 따르면 올해 1~10월 전국 53개 고용센터에서 구직자 도약보장 패키지에 참여한 사람은 4755명으로, 이중 1662명이 취업에 성공했다. 인공지능(AI) 분석 시스템을 기반으로 구직자 및 노동시장 분석, 심층 경력설계, 맞춤형 직업훈련을 지원한 결과다.  기업지원종합서비스는 전국 48개 고용센터에서 운영하고 있으며 올해 10월까지 2917개 기업이 참여해 2787명을 신규 채용했다. 인프라 환경개선 등 1670건 서비스도 제공했다. 기업 진단 후 일·육아 제도, 인사노무, 인프라·환경개선, 맞춤형 인재양성, 홍보 등 조합 컨설팅을 제공한다.",https://n.news.naver.com/mnews/article/018/0006178727
2025-12-06 11:38:00,투자 학원 수강생 상대 80억대 사기..운영진 중형,"[이데일리 장영락 기자] 부동산경매 투자학원을 운영하며 수강생들을 상대로 수십억원대 투자 사기 피해를 준 혐의로 기소된 운영진이 법원에서 중형을 선고받았다. 게티이미지코리아 부산지법 형사6부(김용균 부장판사)는 특정경제범죄 가중처벌 등에 관한 법률 위반(사기) 등 혐의로 기소된 A씨에게 징역 6년 6개월, B씨에게 징역 4년을 선고했다고 6일 밝혔다.  A씨는 부산의 한 부동산경매 투자학원 원장, B씨는 해당 학원의 부원장이면서 투자회사 C사의 대표였다.  두 사람은 2013년 문제의 학원을 설립한 뒤 2015년부터 2018년까지 학원 전문반 수강생 47명에게 전국의 주요 개발사업 투자 시 일정한 수익을 보장한다고 약속한 뒤 투자금 80억원을 챙긴 혐의를 받는다.  A씨와 B씨는 부동산 투자 경험이 없으면서도 전문가 행세를 했다. 이들은 2014년 수강생들의 투자금 7억2천만원으로 부실채권(NPL)을 매입했으나 투자 원금과 수익금을 반환하기 어려운 처지가 되자 학원에서 여러 차례에 걸쳐 투자 설명회를 열고 수강생들의 투자를 유도했다.  그러나 투자 명목으로 돈을 받더라도 정상적인 투자에 사용되지 않았고, 수익금 지급 등에 돌려막기식으로 사용됐다. 결국 피해자들의 고소가 이어졌다.  재판부는 “피고인들은 경매학원 수강생인 피해자들의 신뢰를 이용, 피해자들을 속이고 오랜 기간 돈을 편취해 죄질이 매우 무겁다”고 판결했다. 이어 “피해가 완전히 회복되지 않았고 상당수 피해자로부터 용서받지 못하고 있는 점 등을 양형에 참작했다”고 설명했다.",https://n.news.naver.com/mnews/article/018/0006178725
2025-12-06 11:26:00,"`꿈의 예술단 15돌`…최휘영 ""어린 시절 예술경험 도움, 지원할 것""","[이데일리 김미경 기자] “‘꿈의 예술단’ 사업은 우리의 모든 아이들이 더 당당해지고, 더 풍요로운 삶을 상상하는 데 큰 도움이 될 것입니다.”  최휘영 문화체육관광부 장관은 5일 서울 상암YTN홀에서 열린 ‘꿈의 예술단 15주년 기념공연’ 현장을 찾아 “어린 시절의 예술경험은 소중한 기회”라며 이렇게 말했다.  최휘영 문화체육관광부 장관이 5일 서울 마포구 YTN홀에서 열린 꿈의 예술단 15주년 기념행사에서 축사를 하고 있다. (사진=문체부 제공) ‘꿈의 예술단’은 베네수엘라의 저소득층 아동·청소년을 위한 무상 음악교육 프로그램 ‘엘 시스테마’(El Sistema)를 한국판 예술교육 모델로 발전시킨 문화체육관광부와 한국문화예술교육진흥원의 지원 사업이다. 2010년 오케스트라를 시작으로 2022년 무용단, 2024년 극단에 이어 올해 시각예술 분야 스튜디오까지 다양한 예술 분야로 영역을 확장했다.  최 장관은 이날 축사를 통해 “‘꿈의 예술단’‘은 우리나라의 대표적인 공공 예술교육 사업이 됐다. 올해만 해도 전국 110개 거점에서 4500여 명이 예술단에 참여했다. 그만큼 뿌리 깊게 자리 잡은 것 같다”고 의미를 짚었다.  그러면서도 “아직 해야 할 숙제가 많다. 새로운 정책, 뒷받침해야 할 것도 많은 것 같다”면서 “내년 예산이 조금 늘었다. 지난 15년간 증명해낸 수많은 일들이 인정 받고, 더 열심히 많이 해보라는 격려로 안다. 내년에도 더 멋진 그림을 그려봤으면 좋겠다”고 응원했다.  최휘영 문화체육관광부 장관이 5일 서울 마포구 YTN홀에서 열린 꿈의 예술단 15주년 기념행사에서 축사를 하고 있다. (사진=문체부 제공) 장관 이전 도서관 공간을 중심으로 아동청소년들을 위한 사업을 추진한 바 있는 최 장관은 “이때 아이들 스스로 성장할 수 있는 환경을 만들는 일이 얼마나 소중한지 배웠다. 예술이 가지고 있는 힘이 얼마나 큰 것인가에 대해 요즘 많이 생각하고 있다”며 “내년에는 ’꿈의 예술단‘을 더 많은 지역으로 확산해 전국 어디서나 아이들이 예술과 함께 성장하도록 지원하겠다”고 약속했다.  이날 기념 공연은 꿈의 예술단 첫 시작인 꿈의 오케스트라 특별 무대로 꾸며졌다. 현 단원과 사회인이 된 졸업단원으로 구성된 프로젝트 오케스트라 50여명의 단원이 2025 꿈의 페스티벌 주제가 ’나의 내일을‘과 드로르작의 ’신세계‘ 교향곡 제4악장 등을 연주했다.  꿈의 오케스트라는 2010년 8개소 470명으로 시작해 현재 전국 54개소에서 약 3070명의 단원이 활용하는 규모로 성장했다. 누적 참여 인원은 약 2만9000명으로 우리나라 대표 공공 예술교육 모델로 자리매김했다. 특히 졸업 단원 중 국립심포니 오케스트라에 입단하는 등의 성과로도 나타나고 있다.  이날 공연에 앞서 최 장관은 문화예술교육 관계자 간담회를 갖고, ’꿈의 예술단‘을 포함해 다양한 예술교육 지원사업을 운영하고 있는 지역 현장의 목소리와 건의 사항을 들었다. 최휘영 문화체육관광부 장관이 5일 서울 마포구 YTN홀에서 열린 꿈의 예술단 15주년 기념행사 시작에 앞서 대기실을 찾아 단원들을 격려하고 있다.(사진=문체부 제공) 최휘영 문화체육관광부 장관이 5일 서울 마포구 YTN홀에서 열린 꿈의 예술단 15주년 기념행사 시작에 앞서 대기실을 찾아 단원들을 격려한 뒤 기념촬영을 하고 있다. (사진=문체부 제공).",https://n.news.naver.com/mnews/article/018/0006178723
2025-12-06 11:17:00,"'민주당-통일교 금품 수수 의혹'에…송언석 ""민중기, 알면서 덮었나""","[이데일리 김한영 기자] 송언석 국민의힘 원내대표는 6일 더불어민주당이 통일교로부터 불법 자금을 받았다는 의혹이 제기되자 “민중기 특검은 심각한 범죄 혐의를 알고도 덮었다”며 즉각적인 수사를 촉구했다.  [이데일리 노진환 기자] 송언석 국민의힘 원내대표가 10일 오전 서울 여의도 국회에서 열린 제429회국회(정기회) 제3차 본회의에서 교섭단체 대표연설을 하고 있다. 송 원내대표는 이날 자신의 사회관계망서비스(SNS)에서 “야당에 대해서는 밤낮을 가리지 않고 무차별 압수수색을 벌이던 특검이, 민주당에 대해선 수사 의지조차 보이지 않는다”며 이같이 비판했다.  법조계 등에 따르면, 2022년 국민의힘 시도당 및 당협위원장 20명에게 통일교 자금 1억4400만원을 불법 후원한 혐의 등으로 기소된 윤영호 전 통일교 세계본부장은 최근 민중기 특검팀 조사 과정에서 “더불어민주당 의원들에게도 수천만원을 건넸다”고 진술한 것으로 알려졌다.  윤 전 본부장은 지난 8월 특검팀과의 면담에서 “문재인 정부(2017~2022년) 시절 민주당 의원 2명에게 수천만원을 줬다”며 “이들은 경기 가평군의 통일교 천정궁을 찾아 한학자 총재를 만나고 갔다”는 취지로 말했다고 한다.  두 사람 중 한 명은 현재 민주당 영남권 중진이고, 다른 한 명은 전직 의원으로 알려졌다. 윤 전 본부장은 현직 의원에게는 2018~2019년 사이 현금 4000만원과 1000만원 상당의 시계를, 전직 의원에게는 2020년 3000만원을 전달했다고 특검팀에 진술한 것으로 전해졌다.  이에 대해 송 원내대표는 “민중기 특검은 국민의힘에 ‘사이비 종교와 결탁한 정당’ 프레임을 덧씌우려 했지만, 이 프레임은 완벽한 허구이자 조작에 불과하다는 게 드러났다”고 주장했다.  그는 “특검이 정권의 입맛대로 움직이는 하수인이라는 점만 증명됐다”며 “이재명 정권의 ‘여당무죄 야당유죄‘라는 참담한 현실”이라고 꼬집었다.  그러면서 “야당을 향한 정치보복, 정치탄압의 칼춤은 즉각 중단하라”며 “민주당의 통일교 금품 수수 의혹에 대한 즉각적인 수사를 강력히 촉구한다”고 요구했다.  한동훈 전 국민의힘 대표도 전날 SNS서 이같은 의견에 가세했다.  한 전 대표는 SNS서 “통일교 돈을 민주당이 받으면 괜찮은 건가”라며 “민중기 특검은 정치특검이란 말도 아까운 ‘민주당 하청업자’”라고 비판했다.  그는 “이재명 대통령이 사실상 통일교를 지목하며 정치에 관여한 종교단체는 해산시키겠다고 황당한 소리를 했다”며 “돈을 받은 민주당과 하청업체인 민중기 특검부터 해산시키라”고 목소리를 높였다.",https://n.news.naver.com/mnews/article/018/0006178721
