날짜,제목,본문,링크
2025-12-06 14:21:00,‘합천이 거창하네’ 휴식과 액티비티 섞은 웰니스 투어 다녀와보니,"요즘엔 죄다 웰니스(Wellness)를 외치는 것 같다. 호텔부터 지자체까지 너도나도 웰니스를 내건다. 처음엔 그저 유행인가 싶었지만 이제는 관광의 큰 축으로 자리 잡았다. 그만큼 요즘 현대인에게 ‘잘 쉰다’는 것이 얼마나 필요한지 보여주는 지점이다.  웰니스는 단순히 질병이 없는 상태를 넘어 삶의 질을 최적화하는 상태를 의미한다. 그래서 대부분의 웰니스 상품들은 자연 속 명상이나 고즈넉한 휴식을 주제로 한다. 여기에 동적인 활동을 추가한 자연 속 ‘액티브 웰니스’가 있다.  지난 달 말 한국관광개발연구원과 경남 합천군·거창군과 함께 지리산 웰니스 여행을 다녀왔다. ‘하늘과 땅 사이, 나를 충전하다’라는 주제로 1박 2일간 자연과 체험을 즐겼다.  서울에서 약 4시간을 달려 도착하는 여정. 액티비티로 과연 웰니스가 될까, 활동이 오히려 피로를 더하지 않을까 하는 걱정 반, 호기심 반의 마음을 안고 차에 올랐다.  1일 차: 거창, 자연으로 채우는 하루 첫 일정은 거창 외곽 산속에 자리한 비건 식당 ‘베지나랑’이다. 이곳의 특징은 흰 설탕과 오신채(불교에서 먹지 못하는 다섯 가지 채소)를 쓰지 않는 것. 산속 깊숙한 위치에도 불구하고 특색 있는 메뉴로 현지에서도 소문이 자자하다. 대표 음식인 아보카도 김밥과 함께 현대적 사찰음식으로 건강하게 배를 채워준다.  식사 후에는 생태 정원 ‘거창창포원’으로 이동했다. 축구장 66배, 총 42만㎡ 규모(약 12만평)의 수변 생태공원이다. 거창군은 국가정원 지정을 목표로 콘텐츠와 기반 시설을 꾸준히 확장하고 있다.  그 덕분인지 창포원은 계절마다 전혀 다른 풍경을 선보인다. 봄에는 100만본 이상의 꽃창포, 여름엔 연꽃과 수국, 가을엔 국화와 단풍, 겨울엔 열대식물원과 갈대·억새밭이 펼쳐진다. 기자가 찾은 날은 국화축제가 막 끝난 직후로, 드넓은 국화밭이 여전히 남아 있었다.  창포원은 자전거로 한 바퀴 도는 데 약 20분. 대부분 평지여서 부담이 없고, 공원 곳곳에 볼거리가 많다. 자전거 탑승 후에는 올해 6월 문을 연 치유센터에서 족욕과 셀프 발 마사지 프로그램을 체험했다.  다만 기대에 비해 뒤에 기대는 의자가 없어 오래 앉아 있기엔 불편했고, 명상 등과 같은 프로그램이 없어 참가자들이 휴대전화를 보며 시간을 보내는 모습은 ‘휴식’과는 다소 거리가 있어 보였다. 족욕 자체는 특별함이 크지 않았지만, 이어진 발 마사지는 만족도가 높았다.  창포원을 나와 약 20분 정도 차로 이동하면 어디에나 있는 ‘그것’이 나온다. ‘출렁다리’. 이름만 들으면 뻔해 보이지만, 거창 항노화힐링랜드의 우두산 출렁다리는 조금 다르다.  세 개의 다리를 Y자 형태로 연결한 현수교로, 깎아지른 협곡을 잇는 산악 보도교다. 협곡을 가로지르는 구조라 실제로 마주하면 규모감과 시원한 개방감을 느낄 수 있다.  우두산 출렁다리는 ‘올라가면 젊어진다’는 속설이 있다. 그래서인지 입구엔 빼곡히 산악회 띠지들이 걸려있다. 젊어진다는 말은 계단 곳곳에 붙은 문구들에서 비롯된 듯했다.  살찌는 것을 곧 ‘죄악’으로 말해주는 문구를 보며 오르자면 마치 산에게 혼나는 기분이다. 이렇게 잔소리를 들으며 하는 산행이니 젊어지고 싶은 의지가 절로 생긴다.  거창의 관광지들은 고즈넉한 자연을 느낄 수 있었지만 이동 거리가 길다는 아쉬움이 있었다. 기본 15분씩 움직여야하니 차에서 잠들고 다시 깨는 과정에 휴식보다 피곤함이 더 크게 느껴지기도 했다.  2일 차: 합천, 하늘을 날고 추억에 잠기다 거창에서 합천까지는 약 1시간. 숙소는 합천영상테마파크 안에 있는 한옥 숙소 ‘한옥 우비정’이다. 정갈한 분위기와 깨끗한 침구, 친절한 서비스가 인상적이며 청와대 세트장과도 가깝다.  합천영상테마파크는 2004년 조성한 국내 대표 시대극 오픈세트장으로 영화 ‘태극기 휘날리며’ ‘암살’을 비롯해 드라마 ‘미스터 션샤인’ 등 220편의 작품을 촬영했다.  이곳은 또 다른 형태의 ‘휴식’을 느낄 수 있다. 곳곳의 물건과 장소를 보며 함께한 이들이 각자 어린 시절 이야기를 풀어놓았다. 한참을 웃으며 추억에 빠져드는 시간이 마음을 편하게 만들어준다.  여정의 하이라이트는 합천의 하늘을 두 가지로 체험하는 것. ‘패러글라이딩파크’와 ‘에어랜드 항공스쿨’이다. 패러글라이딩은 합천 대암산 활공장에서 진행한다. 360도 시야가 탁 트인 곳으로,서쪽에는 지리산 천왕봉, 북쪽에는 가야산이 시원하게 펼쳐진다.  창문 너머로 보는 풍경과 달리 생눈으로 마주하는 색감과 선명도는 완전히 다르다. 불어오는 바람과 함께 현장감을 생생하게 느낄 수 있다.  울긋불긋 물든 산등성이 한복판에서 하늘을 날며 바라본 풍경은 예상 이상으로 섬세하고 아름다웠다. 이 순간만큼은 새들이 날아다니면서 보는 풍경을 그대로 볼 수 있다. ‘새들처럼’ 노래를 들어야 했는데 끝나니 아쉬웠다.  놀이기구를 잘 타지 못할 정도로 무서움이 많은 사람도 걱정할 필요는 없다. 실제 하강은 직하가 아니라 회전하며 천천히 내려오는 방식이라 생각보다 훨씬 안정적이다. 탑승을 위한 기술도 필요 없고, 체감 난도도 높지 않았다. 다만 운영 인력이 적어 일부 인원이 긴 시간을 대기해야 했던 점은 개선이 필요해 보였다.  마지막 일정은 황매산 억새밭이다. 해발 1113m의 황매산은 봄 철쭉과 가을 억새로 유명하다. 방문했던 11월 말은 억새가 한창일 때였다. 800~900m 지점의 광활한 황매평전이 물결처럼 흔들리고 정상부에 오르면 사방이 탁 트여 합천의 풍광을 한눈에 담을 수 있다.  지금의 황매산 억새밭은 1980년대 목장 개발 당시 방목된 젖소와 양이 독성 있는 철쭉만 남기고 잡목을 먹어 치우며 만들어진 것으로 알려져 있다. 황매산은 철쭉이 만개하는 봄도 아름답지만 억새가 흐드러지는 가을 풍경은 그야말로 ‘가을’ 그 자체다.  이 풍경을 마지막으로 ‘거창한 합천여행’ 1박 2일의 액티브 웰니스 여정을 마무리했다. 지리산권 웰니스 투어였지만 정작 지리산 자체가 크게 느껴지진 않았다는 점에서 아쉽다는 지적도 있었다. 하지만 지역 명소를 체험과 함께 둘러봤다는 점에선 긍정적인 평가를 할만 했다.  합천·거창(경남) = 문서연 여행+ 기자",https://n.news.naver.com/mnews/article/009/0005601884
2025-12-06 14:16:00,"그때, 폴란드를 감동시킨 ‘팀코리아’ [논설실 Pick]",폴란드에 무기 양보한 韓 2022년 방산수출 밀알 돼  국부 살찌우는 민관 ‘원팀’ 加잠수함 사업서 재연되길   2022년 7월 28일. 매일경제 1면에 한국 방위산업 업체들의 폴란드 무기 수출 계약이 보도됐습니다. 총 19조원에 이르는 공급 계약에는 한화가 자랑하는 K-9 자주포(3조 2000억원)가 포함됐죠.  두 달 뒤. 한화그룹은 대우조선해양 인수에 나섭니다. 2008년 인수전에 뛰어들었다가 글로벌 금융위기 여파로 무산된 뒤 이뤄진 재도전이었죠. 마침내 그해 12월 한화는 산업은행과 인수 본계약을 체결합니다. 오늘날 한·미 조선업 협력 사업(마스가)의 중심 기업인 ‘한화오션’이 출발하는 순간입니다.  언뜻 연관성이 없어 보이는 두 사건(폴란드 K-9 자주포 수출·한화의 대우조선해양 인수)은 사실 흥미로운 스토리로 서로 연결돼 있습니다.  폴란드에 어떻게든 대규모 무기 계약을 성사하기 위해 민관이 협력과 발상의 전환을 꾀하면서 막대한 국부를 일으키는 데 성공한 것이죠.  두 상황을 잘 아는 국책은행 고위 관계자가 최근 기자에게 복기한 2022년 여름의 상황이 스릴 넘칩니다.  2022년 당시 러시아·우크라이나 전쟁이 격화하면서 인접국 폴란드는 공포에 휩싸였습니다. 유사시에 대비해 재무장이 발등의 불로 떨어졌죠. 첨단 무기가 필요했고 기다릴 시간이 없었습니다. 폴란드는 서둘러 한국 방산업체를 수소문하기 시작했죠.  문제는 값싸고 품질 좋고 한국산 무기를 인도받는 데 꽤 시간이 걸린다는 점입니다.  방산 특성 상 고가의 민감한 무기를 선주문 없이 만들어 재고를 쌓기 힘들죠. 아무리 빨라도 생산 후 인도까지 최소 1년.  폴란드가 기다려주기엔 너무 긴 시간이었습니다.  그런데 뜻밖에도 우리 정부와 군에서 돌파구가 나왔습니다.  그해 한화로부터 인도받아 국내 배치할 K-9 자주포 물량을 폴란드에 먼저 넘기기로 양보한 것입니다.  그 결과 자주포 1차 인도분이 수출 계약 서명 불과 석 달만에 폴란드로 건너갈 수 있었습니다.  자국의 다급함을 이해한 한국 정부와 방산기업의 노력에 감동한 폴란드는 더 큰 신뢰를 보이며 그해 11월 한화에 5조원짜리 추가 계약을 선사합니다.  수개월 만에 한화에 8조원이 넘는 무기 계약 선물을 안긴 폴란드의 행보는 ‘운명’처럼 그해 한화의 대우조선해양 인수에 활력을 일으켰습니다.  폴란드가 한화에 지급한 거액의 선수금이 대우조선해양 인수와 투자의 실탄으로 쓰이게 된 것이죠.  돌이켜보면 당시 방사청과 군 당국의 통 큰 양보가 없었다면 한화는 폴란드와 역사적 규모의 수출 계약을 달성하기 어려웠을 것입니다.  당연히 한화의 대우조선해양 인수에도 선순환을 일으키지 못했을 터이죠.  당시 혼연일체가 된 팀코리아의 수주 활동은 이렇듯 3년이 흘러 한·미 간 마스가 프로젝트로 연결되며 경제와 안보의 국부를 살찌우고 있습니다.  한국의 전략적 성공에 자극받은 것일까요. 방산 라이벌인 독일이 한국 전략을 벤치마킹하고 있습니다.  대상은 최대 12척의 잠수함 획득 사업을 추진 중인 캐나다.  최대 60조원이 걸린 이 사업은 독일(티센크루프 마린시스템즈)와 한국(한화오션·HD현대중공업 컨소시엄) 간 2파전입니다.  독일은 올해 캐나다 정부에 “티센크루프 마린시스템즈가 선정되면 독일 해군에 예약된 잠수함 인도 물량을 캐나다에 우선 양보할 수 있다”고 제안했습니다.  폴란드를 상대로 우리 군과 방사청이 내놓았던 제안과 판박이입니다.  60조원 수주 사업을 지원하는 독일 정부의 결기가 이렇듯 만만치 않습니다.  국부 창출의 이정표가 될 캐나다 잠수함 사업이 중대한 발표의 순간을 앞두고 있습니다. 이르면 다음 달 우선협상대상자가 발표될 것으로 보입니다.  독일의 만만찮은 공세 속 팀코리아가 3년 전 폴란드를 감동하게 한 저력으로 새해 벽두 멋진 낭보를 울리기를 바랍니다.,https://n.news.naver.com/mnews/article/009/0005601883
2025-12-06 14:16:00,"[포토] 매경 해커톤, 수준 높은 AI언론 서비스 경쟁","‘매경미디어 NEXT AI 해커톤’이 5일부터 6일 양일간 필동 1가 매경교육센터에서 열렸다.  매경AX와 성균관대학교 서울RISE사업단이 공동 개최한 이번 대회는 성균관대와 동국대, 서울과학기술대와 숙명여대, 홍익대 등 5개 대학 학생 40여 명, 12개 팀이 참여해 1박 2일간 AI 기반 언론 혁신 서비스를 기획해 경쟁했다.  둘째 날인 6일 결과발표와 시상식이 진행됐다.  이번 ‘매경미디어 NEXT AI 해커톤’ 시상식 대상은 동국대학교 상어가족(팀장 박주형, 팀원 서하은, 최예인, 옥선우)팀이, 최우수상은 숙명여자대학교 패트와매트(팀장 백서연, 팀원 이서현)팀, 우수상은 성균관대학교 NEXT BYTE(팀장 조민희, 팀원 배서현)팀이 수상했다.  매경AX 김명수 대표가 심사평을 하고 있다.  [강영국 스타투데이 기자]",https://n.news.naver.com/mnews/article/009/0005601882
2025-12-06 14:08:00,미국에 지은 ‘실리콘 사막’…1만8천개의 규제 돌파해야 했던 TSMC,"피닉스 사막에 242조 반도체 기지 아시아 돈과 기술로 세우는 美 공장 1만8천 개 규제 장벽에 건설은 지연 인력난·문화 차이로 노사 갈등 지속   미국 애리조나주 피닉스는 미국 반도체의 ‘심장’으로 다시 태어나고 있다.  황량한 사막에는 뉴욕 센트럴 파크보다 넓은 463만㎡(140만 평)에 걸쳐 반도체 공장이 건설 중이다. 1650억달러(약 242조원)이 투입된 이 프로젝트는 인공지능(AI)칩 제조를 위한 지구상에서 가장 비싼 산업 투자 중 하나다.  ‘상전벽해’한 피닉스 북쪽 변두리 지역은 미국의 산업 자립을 향한 도전을 보여준다. 하지만 미국의 안보를 위한 이 공장에 미국의 역할은 보이지 않는다. 동아시아의 수많은 기업이 TSMC에 필요한 화학물질, 부품부터 건설 및 엔지니어링 서비스까지 공급하기 위해 현지 공장을 설립했다. 이들은 총 400억 달러(59조원)를 추가로 지역 경제에 투자했다. 피닉스 광역권에는 280개 반도체 및 공급망 기업이 있으며, 4만 명 이상이 근무한다.  4일(현지시간) 뉴욕타임스(NYT)는 피닉스 반도체 클러스터를 샅샅이 취재한 후 아시아 기업의 힘으로 부활하고 있는 미국 반도체 산업의 현주소를 진단했다.  미국 내 공장 건설 압박 속에서 TSMC는 이미 칩 생산을 시작한 소위 팹(fab) 1개를 완공했으며, 추가로 2개 공장을 건설 중이다. 피닉스 부지에 3개의 추가 공장 및 첨단 패키징 시설 2곳을 건설할 계획도 세했다. 이 계획이 완료되면 TSMC는 첨단 칩 생산량의 약 3분의 1을 미국에서 생산할 것으로 예상한다.  피닉스 공장 건설은 태평양 건너에서 유입된 돈과 전문가가 없이는 불가능했다. 미국의 마지막 주요 반도체 공장은 2013년에 가동을 시작했고 공장 건설은 이후로 끊어졌다. 지도상의 백지를 ‘실리콘 사막’으로 변모시킨 과정은 미국의 문제점을 여실히 보여준다. 지역 주민은 반대 운동을 하고, 복잡한 관료주의는 건립을 방해하며 혼란, 불확실성, 지연을 초래한다.  피닉스뿐 아니라 뉴욕, 오하이오, 텍사스에 이르는 반도체 클러스터 건설이 지연되는 이유도 동일하다. 미국의 공장 건설은 복잡한 규제와 인력 확보의 난관을 극복해야 한다. 대만 본토에서 TSMC는 필요한 자원, 인력, 정부 승인을 정부의 전폭적 지원 아래 확보해왔다. 그러나 피닉스에서는 TSMC와 협력사들이 전혀 다른 시스템의 복잡성과 씨름해왔다.  도널드 트럼프 미국 대통령은 경제 정책의 핵심으로 미국 제조업 부흥을 외치고 있다. 그는 기업들이 미국에 공장을 세우고 미국인 노동자를 고용하도록 강제하는 수단으로 관세를 사용했다. 그러나 그 처방의 단순함은 미국이 숙련된 현실의 벽에 부딪혔다.  3년 전 TSMC가 피닉스에 공장을 설립하려 할 때 창립자 모리스 창은 워싱턴주 소규모 공장에서 칩을 생산하는 비용이 대만보다 50% 더 높다고 지적했다. 그는 애리조나에서도 비슷한 상황이 벌어질 것이라고 예상했다. 창은 브루킹스 연구소와의 인터뷰에서 “매우 비싼 공허한 노력이 될 것”이라며 “세계 시장에서 경쟁력이 없을 것”이라고 말했다.  대만에서는 TSMC와 협력사들이 중앙 당국으로부터 한 번의 허가만 받으면 되는 전용 산업 단지에 시설을 건설한다. 애리조나에서는 시, 카운티, 주, 연방 규정을 협상해야 하며 수천 건의 승인이 필요하다.  TSMC 웨이저자 회장은 올해 국립대만대학교에서 “모든 단계마다 허가가 필요하며, 허가가 승인된 후에도 대만보다 최소 두 배 이상 시간이 걸린다”고 말했다. 많은 경우 해당 산업에 대한 규정이 지방 차원에서 존재하지 않아 TSMC는 자체 규정을 마련하고 승인을 얻기 위해 전문가 팀을 구성해야 했다. 웨이 회장은 “결국 1만8000개의 규정을 수립하는 데 3500만 달러(514억원)가 소요됐다”고 말했다.  피닉스에서는 물 부족으로 개발을 제한해 왔다. 그런데 반도체 공장은 막대한 양의 물을 필요로 한다. TSMC의 첫 3개의 공장은 하루 총 1640만 갤런(약 6150만 리터)의 물이 필요할 것으로 예상됐다. 이는 20만 가구가 소비하는 물량과 맞먹는 규모다.  게다가 애리조나 당국은 사막 거북이 서식 여부를 확인하기 위해 현장 조사를 요구했다. 피닉스 시는 TSMC에 보호종 사막 식물을 보존해 이식할 것을 요구했다.  컴퓨터 칩 제조는 마술과 같다. 수십억 개의 미세 트랜지스터를 실리콘 조각에 압축하는 과정은 사진 네거티브 필름 제작과 유사하다. 기계의 광선은 머리카락 두께보다 5000배나 가늘다. 이 장비를 설치하고 제대로 작동시키려면 전문적 훈련과 경험을 갖춘 인력이 필요하다. 2년 전 TSMC는 현지에서 이를 수행할 인력을 찾기 어렵다고 인정했다. 회사는 대만에서 500명 이상의 숙련된 근로자를 데려왔다.  현지 노조들은 TSMC가 연방 보조금의 취지와 규정을 위반했다고 비난했다. 그들은 이민 당국에 대만 근로자들의 비자 발급을 차단할 것을 촉구했다. 회사는 미국인 근로자에게 우선권을 부여하겠다는 약속으로 갈등을 해결했다. 그러나 노사 분쟁은 계속되고 있다.  애리조나와 캘리포니아 시설의 전·현직 TSMC 직원 28명이 제기한 소송은 회사가 대만인 고위 관리들에게 의존해 미국인 근로자를 배제하고 현지 채용자들을 폄하하며 중국어로 업무를 진행한다고 주장한다. 소송 당사자인 데이비드 아미리는 “그들은 미국 노동자들이 게으르고 무능하며 멍청하다고 생각한다”며 “누군가에게 가르치는 것보다 그냥 직접 하는 게 더 쉬웠다”고 말했다.  TSMC 공장 건너편에서는 930만㎡(281만평)에 달하는 도시 전체가 개발 중이다. 내년 초 착공 예정인 1단계는 호텔, 대형 할인점, 자동차 대리점, 레스토랑, 체육관을 짓는다. 20년간 단계적으로 산업 단지, 사무실, 9,000세대의 주택 단지가 추가될 예정이다. 이 프로젝트는 TSMC의 공급업체들이 계속해서 피닉스로 따라올 것이라는 전제 하에 추진되고 있다.  최근 TSMC 단지 내부에서는 엔비디아를 위한 첨단 AI 칩 생산을 기념하는 행사가 열렸다. 엔비디아의 최고경영자(CEO) 젠슨 황은 피닉스 공장에서 연설한 후 TSMC 직원들에게 사인을 해줬다. 황 CEO는 연단에서 “오늘은 미국에 매우 중요한 날이다. 이것은 시작에 불과하다”면서 “여러 대만 가족들이 미국으로의 여정을 선택하지 않았다면 이 모든 것은 불가능했을 것”이라고 말했다. 하지만 흙먼지 속에서 땀을 흘리는 노동자들이 극복해야 할 어려움은 셀 수 없이 많다. 미국에서 반도체 공장을 짓는 일에는 1만8000개의 난관이 여전히 남아 있다.",https://n.news.naver.com/mnews/article/009/0005601881
2025-12-06 14:08:00,"[포토] 매경 NEXT AI 해커톤, 치열한 결과 발표","‘매경미디어 NEXT AI 해커톤’이 5일부터 6일 양일간 필동 1가 매경교육센터에서 열렸다.  매경AX와 성균관대학교 서울RISE사업단이 공동 개최한 이번 대회는 성균관대와 동국대, 서울과학기술대와 숙명여대, 홍익대 등 5개 대학 학생 40여 명, 12개 팀이 참여해 1박 2일간 AI 기반 언론 혁신 서비스를 기획해 경쟁했다.  둘째 날인 6일 결과발표와 시상식이 진행됐다.  이번 ‘매경미디어 NEXT AI 해커톤’ 시상식 대상은 동국대학교 상어가족(팀장 박주형, 팀원 서하은, 최예인, 옥선우)팀이, 최우수상은 숙명여자대학교 패트와매트(팀장 백서연, 팀원 이서현)팀, 우수상은 성균관대학교 NEXT BYTE(팀장 조민희, 팀원 배서현)팀이 수상했다.  참가팀들이 서비스 결과 발표에 나서고 있다.  [강영국 스타투데이 기자]",https://n.news.naver.com/mnews/article/009/0005601880
2025-12-06 14:01:00,“SNS가 인생의 낭비라고?”···빚 갚는 88세 노인에게 25억 잭팟 터졌다,"호주 인플루언서, 틱톡 통해 25억원 모금해 전달 알렉스 퍼거슨 전 맨체스터 유나이티드 감독은 소셜미디어(SNS)가 “인생의 낭비”라며 비판했다. 이는 축구 유망주들이 SNS에 매달려 경기력이 떨어지는 현상을 저격한 말이다. 이와 달리 SNS상에는 이웃을 돕는 훈훈한 풍경도 벌어지고 있어 주목된다.  5일(현지시간) AP통신에 따르면 미국 미시간주에서 마트 계산원으로 일하는 88세 에드 뱀버스는 22세 호주인 인플루언서 샘 바이덴호퍼가 주도한 온라인 모금을 통해 170만달러(약 25억원)를 받게 됐다.  이날 기부증서를 건네받은 뱀버스는 믿을 수 없다는 듯 “세상에”를 반복하며 눈물을 훔쳤다. 뱀버스는 미국 제너럴모터스(GM)에서 은퇴한 뒤 생계를 위해 82세의 나이로 마트 계산원 일을 시작했다. 아내는 2018년 병으로 세상을 떠났고, 빚은 22만5천달러(3억3천만원)에 달했다. 그는 90세를 앞둔 고령에도 여전히 일을 해야 하는 처지다.  인플루언서 바이덴호퍼는 최근 미국 방문 중 미시간주 한 마트에서 뱀버스와 만나 대화한 영상을 770만 팔로워가 지켜보는 SNS ‘틱톡’에 올렸다. 뱀버스는 영상에서 “지금 소득으로는 생활하기 충분하지 않다”고 털어놓았다.  이후 바이덴호퍼는 온라인 모금 사이트 ‘고펀드미’(GoFundMe)에서 뱀버스를 위한 모금 캠페인을 시작했다. 그는 “뱀버스의 사연은 많은 노년층과 참전용사들이 생계를 유지하기 위해 얼마나 어려운 상황에 놓여 있는지 보여주는 사례”라며 기부를 촉구했다.  반응은 폭발적이었다. 10달러부터 1만달러까지 다양한 금액의 기부가 이어졌고, 영상 게시 2주 만에 170만달러가 모였다. 모금을 주도한 바이덴호퍼는 “꿈 같은 일”이라고 말했다. 뱀버스는 당장 마트 계산원 일을 그만두지는 않을 계획이다.",https://n.news.naver.com/mnews/article/009/0005601878
