날짜,제목,본문,링크
2025-12-16 12:01:00,건설업 매출 3.8% 감소…외환위기 이후 최대,"[서울경제]  지난해 최악의 건설경기 한파 속에 국내 건설업 매출액이 4% 가량 줄어든 것으로 나타났다. 건설업 매출이 줄어든 것은 코로나19가 발생했던 2020년 이후 4년 만이다. 올해 체감 건설 경기는 지난해보다 더 나빠 국제통화기금(IMF) 사태가 있었던 1998년 이후 처음으로 2년 연속 역성장을 기록할 수 있다는 우려가 나온다.    16일 국가데이터처의 ‘2024년 건설업조사 결과 기업실적 부문’에 따르면 지난해 건설업 매출액은 전년 대비 3.8% 감소한 487조 7000억 원으로 잠정 집계됐다. 코로나19 영향으로 2020년 -1.9% 감소했던 매출은 2021년 이후 3년 연속 증가하며 매년 역대 최대 실적을 경신했으나 지난해 다시 한 번 마이너스로 되돌아섰다.  특히 지난해 매출 감소액은 19조 원에 달해 관련 통계를 집계한 이래 최고 감소치를 갈아치웠다. 특히 국내 건설 매출액은 439조 3000억 원으로 5.6% 감소했다. 그나마 해외 건설 매출액은 48조 7000억 원으로 17.1% 증가해 국내 감소분을 메웠다. 업계의 한 관계자는 “건설 업체들이 국내 건설 업황 부진을 만회하고자 해외로 눈을 돌렸으나 플러스 성장에는 역부족이었다”고 설명했다.  건설업 매출이 줄면서 지난해 건설업 종사자 수도 175만 9000명으로 2.8% 동반 감소했다. 감소 직종별로는 사무직(-0.4%), 기술직(-0.4%), 기능직(-0.6%)에 비해 임시및일용직(-5.1%)이 대부분을 차지했다.  업체 1곳당 매출액은 55억 원으로 5.1% 감소했다. 한계에 부닥친 종합건설업체들이 문을 닫고 영세 전문업체들이 생겨나면서 전체 기업체 수는 8만 9101개로 1.4% 증가한 결과다. 실제로 매출 상위 100대 기업의 매출이 6.9% 줄어 나머지 업체(-1.7%)보다 더 큰 충격을 받은 모습이다.  지난해 건설 계약액은 308조 원으로 3.6% 증가했다. 2023년 12.1% 감소한 지 1년 만에 반등했다. 건설 수주계약이 매출로 전환되는데 대략 1~2년 소요된다. 문제는 최근 갈수록 그 간격이 벌어지고 있다는 점이다. 업계의 한 관계자는 “원자재·인건비 상승으로 공사비를 둘러싼 분쟁이 늘어나 올해 매출은 물론 내년 상반기 매출 반등도 장담하기 어렵다”고 전했다.   ; 지난해 건설업 매출 498조, 전년比 3.8%↓…""감소액 기준 역대 최대""",https://n.news.naver.com/mnews/article/011/0004567882
2025-12-16 12:01:00,반도체 한파 끝…지난해 기업 세전 순이익 20% 반등,"[서울경제]  지난해 반도체 한파가 걷히면서 국내 기업들의 법인세 차감 전 순이익이 전년보다 20% 이상 급증하며 반등에 성공했다. 수익성 개선에 힘입어 기업들의 연구개발(R&D) 투자도 대폭 늘었다.  국가데이터처가 16일 내놓은 ‘2024년 기업활동조사 결과’ 잠정치에 따르면 상용근로자 50인 이상·자본금 3억원 이상인 국내기업(금융업 제외) 1만4922곳의 법인세 차감전 순이익은 181조9000억원으로 전년(150조8000억원) 대비 20.6%(32조1000억원) 증가했다. 세전 순이익이 플러스로 돌아선 것은 2021년 이후 3년 만이다. 이 조사는 매년 상용근로자 50인 이상이면서 자본금 3억원 이상인 기업을 대상으로 실시된다.  업종별로 보면 반도체 업황 회복으로 제조업에서만 세전 순이익이 전년보다 29.7% 급증한 124조원으로 집계됐다. 운수창고업(3.4%), 정보통신업(0.9%), 건설업(0.3%) 등도 늘었다. 반면 도소매업은 2.3% 감소했다.  매출액은 3371조원으로 5.2% 늘었다. 제조업이 1973조원으로 5.7% 증가했고, 운수창고업(16.8%), 정보통신업(5.3%), 도소매업(3.0%)등에서도 늘었다. 반면 건설업은 2.9% 감소했다.  기업들의 수익성 지표인 매출액 1000원 당 세전 순이익은 54원으로 전년보다 7원 늘었다. 업종별로는 제조업과 전기가스업에서 각각 13원, 운수·창고업에서 12원 증가했다.  기업 실적이 회복되면서 R&D 투자도 크게 늘렸다. R&D 비용은 97조원으로 1년 전보다 21.4% 증가했다.",https://n.news.naver.com/mnews/article/011/0004567881
2025-12-16 11:53:00,"서울시, 전·월세 보증금 최대 6000만 원 지원… '장기안심주택' 6000가구 모집[집슐랭]","[서울경제]  서울시가 무주택 시민 지원을 위해 전·월세보증금을 최대 6000만 원까지 무이자로 대출해 주는 ‘보증금지원형 장기안심주택’ 입주 대상자 6000가구를 모집한다.  서울시는 보증금지원형 장기안심주택의 입주자 모집을 17일 공고한다고 16일 밝혔다. 서울주택도시개발공사 인터넷 홈페이지에서 29~31일 신청을 접수한다.  6000가구는 유형별로 일반 공급 5350가구, 신혼부부 특별 공급 500가구, 세대 통합 특별 공급 150가구로 구성된다. 신혼부부 특별공급 500가구는 입주 후 자녀를 출산하면 10년 거주 후 서울시의 신혼부부 대상 장기전세주택 ‘미리내집’ 이주 신청 자격을 얻을 수 있다. 미리내집으로 이주하면 소득·자산 기준과 관계없이 최대 10년까지 추가 거주가 가능하며 2자녀 이상 출산 시에는 우선매수청구권을 얻게 된다.  서울시의 보증금지원형 장기안심주택은 보증금 4억 9000만 원 이하 민간 주택에 대해 최대 6000만 원 한도에서 보증금의 30%를 최장 10년 간 무이자로 대출해 주는 제도다. 보증금이 1억 5000만 원 이하인 경우는 최대 4500만 원 한도에서 보증금의 50%를 지원 받는다.  시는 올해 맞벌이 신혼부부를 위한 별도의 소득 기준을 마련해 적용하고 있다. 가구의 월 평균 소득이 전년도 도시근로자 가구원수별 월평균 소득의 120%(외벌이), 180%(맞벌이, 약 1040만 원) 이하면 신청 가능하다. 거주 중 자녀를 출산한 가구는 재계약 시 소득과 자산 심사가 면제된다.  입주 대상자는 입주 자격 심사를 거쳐 내년 3월 19일 발표될 예정이다. 당첨자가 입주할 주택을 찾아 심사 자료를 제출하면 서울주택도시개발공사의 권리 분석 심사를 거쳐 2027년 3월 18일까지 계약을 진행할 수 있다. 지원 대상 주택은 건축물대장 기준 단독·다가구주택, 상가주택, 다세대·연립주택, 아파트, 주거용 오피스텔 등이다. 최진석 서울시 주택실장은 “장기안심주택이 시민에게 안전한 버팀목이 수 있는 대책이 될 수 있도록 노력하겠다”고 말했다.    ; 서울시, 전·월세 보증금 최대 6000만 원 무이자 대출 6000가구 모집[집슐랭]",https://n.news.naver.com/mnews/article/011/0004567878
2025-12-16 11:49:00,주가 빠질수록 산다? 초고수 선택은 '삼성전자·일동제약 '[주식 초고수는 지금],"[서울경제]  미래에셋증권(006800)에서 거래하는 고수익 투자자들이 16일 오전 가장 많이 순매수 한 종목은 ‘삼성전자(005930)’로 집계됐다. 이어 일동제약(249420), 한라캐스트(125490), 삼성전기(009150) 등의 순으로 순매수가 많았다.  이날 미래에셋증권에 따르면 미래에셋증권 주식 거래 고객 중 최근 1개월 동안 투자수익률 상위 1%에 해당하는 ‘주식 초고수’들이 오전 11시까지 가장 많이 산 종목은 삼성전자다.  이날 오전 11시 기준 삼성전자는 전 거래일 대비 1.34% 내린 10만 3400원에 거래되고 있다. 지난 주말 미국 증시가 인공지능(AI) 거품 논란 재부각으로 기술주를 중심으로 부진한 모습을 보이면서 그 여파가 여전히 남아있는 모습이다. 다만 미국 반도체 기업 마이크론의 실적 발표를 앞두고 증권가에서 낙관적 전망이 이어지면서 삼성전자에 대한 초고수들의 관심도 높아지고 있다. 연말까지 증시 상승세를 주도할 것이라는 예측도 나왔다. D램 공급 부족에 따른 가격 상승과 고대역폭 메모리(HBM) 시장 급성장 등 수혜 요인이 삼성전자와 SK하이닉스(000660)에도 그대로 반영되며 주가에 긍정적 영향을 미칠 가능성이 크다는 분석이다. 15일(현지시각) 증권사 웨드부시는 보고서를 내고 마이크론 목표주가를 기존 220달러에서 300달러로 상향하기도 했다. 삼성전자와 SK하이닉스, 마이크론 등 메모리반도체 제조사를 대상으로 최근 증권가에서 나오는 전망은 공통적으로 HBM 및 D램 수요 강세에 따른 수혜를 예측하고 있다. 인공지능(AI) 관련 분야에서 HBM 주문량이 늘어나자 반도체 기업들이 생산 투자를 집중했고 이는 자연히 D램과 낸드플래시 공급 부족 및 가격 상승으로 이어졌기 때문이다.  순매수 2위는 일동제약이다. 일동제약은 전날 하락 마감한 데 이어 이날 역시 하락세를 그리며 오전 11시 기준 0.86% 내린 4만 500원에 거래되고 있다. 비만치료제 관련 이슈 속에 최근 주가가 급등했지만 이날 장중에는 차익실현 매물이 증가하는 영향을 받고 있는 것으로 풀이된다. 다만 초고수들은 이같은 주가 하락이 과도하다고 판단, 저가 매수에 나선 것으로 분석된다. 일동제약 주가는 글로벌 제약사가 약 3조원 규모의 저분자 화합물 기반 비만치료제 기술이전 계약을 체결했다는 소식에 주목받았다. 일동제약은 저분자 화합물 기반 비만치료제 파이프라인을 보유하고 있으며, 관련 임상 1상 데이터를 이미 발표한 바 있다. 비만치료제 시장을 둘러싼 경쟁은 갈수록 치열해지는 추세다. 이달 8일(현지시각)에는 글루카곤 유사 펩타이드-1 기반 경구용 비만치료제의 임상 2b 연구 결과가 공개됐고, 9일에는 리보핵산 기반 비만치료제의 임상 1상 중간 결과가 발표됐다. 허혜민 키움증권 애널리스트는 ""내년에는 RNA 치료제 개발기업들의 기술 거래가 활발해질 것으로 예상한다""면서 ""올릭스, 알지노믹스, 에스티팜 등에 주목할 만하다""고 조언했다.  순매수 3위는 자동차 부품사인 한라캐스트다. 한라캐스트는 자율주행 및 커넥티드 디스플레이, 로봇 등에 적용되는 경량화 부품을 생산한다. 최근 휴머노이드 로봇 분야에 진출하면서 중장기 성장 동력을 마련했다는 기대감에 매수세가 몰린 것으로 분석된다. 이 회사는 글로벌 AI 자동차사와의 파트너십을 통해 휴머노이드 분야로 사업영역을 확장했으며 올 2월 1차 벤더사로 공시 등록된 바 있다. 그동안 개발 역량을 집중해온 전기변환 장치 부품 및 자율주행 부품, 휴머노이드 로봇 부품이 올해 말부터 단계적으로 양산이 시작될 예정으로, 양산 스케쥴과 맞물려 관련 수주가 가파르게 증가할 것이로 기대된다.  이날 순매도 상위는 삼성에피스홀딩스(0126Z0), 한국전력(015760), 현대오토에버(307950) 등이 포함됐다. 전일 순매수 상위 종목은 삼성에피스홀딩스, 원익홀딩스(030530), 현대건설(000720) 등이었으며 순매도는 삼성전자, 한라캐스트, 현대오토에버 등의 순으로 많았다.  미래에셋증권은 자사 고객 중에서 지난 1개월간 수익률 상위 1% 투자자들의 매매 종목을 집계해 실시간·전일·최근 5일 기준으로 모바일트레이딩시스템(MTS) 상에서 공개하고 있다. 이 통계 데이터는 미래에셋증권의 의견과 무관한 단순 정보 안내이며 각각의 투자자 개인에게 맞는 투자 또는 수익 달성을 보장하지 않는다. 또 테마주 관련 종목은 이상 급등락 가능성이 있으므로 유의해야 한다.     ; 주가 빠질수록 산다? 초고수 선택은 '삼성전자·일동제약 '[주식 초고수는 지금]",https://n.news.naver.com/mnews/article/011/0004567877
2025-12-16 11:48:00,"[속보] 이종호 전 대표 측 ""김건희에게 3억 수표로 줬다""","[서울경제]  [속보] 이종호 전 대표 측 ""김건희에게 3억 수표로 줬다""",https://n.news.naver.com/mnews/article/011/0004567876
2025-12-16 11:46:00,"산케이 ""中, 첫 원자력 항공모함 건조 착수 정황”","[서울경제]  중국이 랴오닝성 다롄 조선소에서 첫 원자력 항공모함 건조에 착수했을 가능성이 높다는 일본 언론 보도가 나왔다.  산케이신문은 일본 싱크탱크 국가기본문제연구소(이하 국기연)의 위성사진 분석 결과 중국의 두 번째 항공모함 산둥함이 건조됐던 조선소 독(Dock)에서 지난 2월 이후 선체를 지지하는 길이 270여ｍ의 구조물이 확인됐다고 16일 보도했다. 특히 지난달 10일 촬영된 위성 사진에는 길이 150ｍ, 폭 43ｍ 규모의 선체 일부 내부에 산둥함이나 3번째 항모 푸젠함 건조 때는 확인되지 않은 세로 16ｍ, 가로 14ｍ의 직사각형 틀이 설치된 모습이 포착됐다. 국기연은 이 사각 프레임의 크기와 형상이 미국 버지니아주 뉴포트뉴스 조선소에서 건조되는 미 해군 핵추진 항모의 원자로 격납 용기 설치 공간과 매우 흡사하다고 밝혔다.  산케이는 “산둥성 칭다오 해군기지에서는 확장 공사도 진행 중이며 근교에 해군 비행장도 신설돼 4번째 항공모함 취역에 대비하고 있는 것으로 보인다”며 “새 항공모함이 랴오닝함과 같은 칭다오를 모항으로 한다면 제1열도선부터 제2열도선에 걸친 활동이 활발해질 것으로 예상된다”고 우려했다. 국기연도 “현 시점에서는 중국의 항공모함 전력이 미군보다 열세이지만, 4번째가 취역하면 일본 주변에서의 활동이 한층 더 활발해져 자위대나 미군에 대한 감시·정보 수집이 상시화될 가능성이 있다”고 지적했다.  원자력 항공모함은 일반적인 동력의 항공모함보다 더 장기간 연료 보급 없이 운항할 수 있다. 중국은 랴오닝함과 산둥함에 이어 지난달 3호 항모 푸젠이 취역, 세 척의 항모를 보유하고 있다. 중국은 2030년까지 최소 4개의 항모전단을 꾸려 미국에 이은 세계 두 번째 대양 해군을 육성하고 2035년까지 총 6척의 항공모함을 확보할 계획이다.",https://n.news.naver.com/mnews/article/011/0004567875
2025-12-16 11:43:00,"MBK·영풍, 고려아연 상대 가처분…""미국 사업 반대는 아냐"" [시그널]","[서울경제]  영풍·MBK파트너스가 미국에 약 11조 원을 투자하기로 한 고려아연의 결정에 법적 제동을 걸었다. 고려아연은 이사회를 열어 미국 테네시주에 비철금속(철 이외의 모든 금속) 13종을 생산할 수 있는 대규모 생산시설을 구축하기로 결정했다. 영풍·MBK파트너스는 고려아연의 최대주주이지만 이사회 전까지 관련 계획을 공유받지 못한 것으로 알려졌다. 이런 절차적 문제와 이번 투자가 불러올 수 있는 재무 부담, 지배구조 변동 가능성 등은 법적 공방의 변수로 꼽힌다.  영풍·MBK파트너스는 고려아연 이사회가 결의한 제3자 배정 유상증자에 대해 서울중앙지방법원에 신주발행금지 가처분을 신청했다고 16일 밝혔다. 영풍·MBK파트너스 관계자는 “미국 제련소 건설 사업에 반대한다는 의미가 아니다”라며 “신주발행금지 가처분은 경영권 분쟁 상황에서 최윤범 회장의 지배력 유지를 목적으로 설계된 신주배정이 상법과 대법원 판례가 엄격히 금지하는 행위라는 점에서 필요한 조치”라고 설명했다.  고려아연은 15일 이사회를 열고 총 투자금 11조 원 규모의 미국 제련소 건설 안건을 통과시켰다. 이번 사업에 5억 8500만 달러(한화 8600억 원)를 출자하고 △미국 정책금융 지원 대출 및 재무 투자자 대출 46억 9800만 달러(6조 9000억 원) △미국 상무부 보조금 2억 1000만 달러(약 3100억 원) 등으로 추가 자금을 조달하는 것이 골자다. 이 계획은 이사회 전까지 영풍·MBK파트너스에게는 공유되지 않은 것으로 전해졌다. 영풍·MBK파트너스는 고려아연의 최대주주이지만 현재 이사회 주도권은 경영권 분쟁 상대방인 최 회장 측이 갖고 있다.  영풍·MBK파트너스에 따르면 고려아연은 15일 월요일 오전 7시 반으로 일시가 정해진 이사회를 12일 금요일 오후 5시가 넘어 소집 통보했다. 이사회 구성원에게 핵심 자료를 사전에 제공하지 않은 것으로도 알려졌다. 이에 대해 영풍·MBK파트너스 측 관계자는 “해외 제련소 투자, 합작법인 출자, 제3자 배정 유상증자 등 회사의 지배구조, 중장기 재무구조 및 투자계획에 중대한 영향을 미치는 사안이 한꺼번에 결의됐음에도 이사회가 충분한 검토를 할 수 있는 시간과 정보가 제공되지 않았다는 점은 선관주의의무 및 충실의무 위반 가능성을 보여주는 핵심 근거”라고 말했다.  고려아연이 선택한 자금 조달 방식인 제3자 배정 유상증자도 문제가 되고 있다. 영풍·MBK파트너스는 고려아연에 주주배정 방식의 유상증자 참여 의사를 전달했다. 자금 조달이 필요했다면 주주배정 유상증자라는 선택지가 있었지만 고려아연은 외국 정부가 최대주주로 있는 제3자(미국 내 합작법인)에게 지분을 제공했다. 이번 유상증자 배경에 회사의 자금 조달보다는 최 회장의 경영권 유지 목적이 있었다고 볼 여지가 있는 것이다.  최대주주 측은 이번 투자의 이례적 출자 구조를 문제삼고 있다. 통상 외국 정부 투자·보조금을 활용해 해외 투자에 나설 때에는 현지 생산법인을 세워 자금을 받거나 지분을 나눠 가진다. 반면 고려아연은 미국 정부·기업과 새로 만든 합작법인(JV)에 제3자 배정 유상증자를 실시해 자금을 받은 뒤, 이 자금을 현지 투자 지주회사에 다시금 출자하는 이례적인 방법을 택했다. 이런 우회 출자가 완료되면 미국 정부는 고려아연 지분 10.25%를 보유하게 된다.   ; 영풍·MBK파트너스, ""고려아연 신주발행금지 가처분 신청""",https://n.news.naver.com/mnews/article/011/0004567874
2025-12-16 11:40:00,카톡 첫화면으로 친구탭 복원…친구목록 바로 본다,"[서울경제]  카카오(035720)가 카카오톡 친구탭 첫 화면을 개편 이전으로 복원했다.  카카오는 카카오톡 친구목록을 되살리는 방식으로 업데이트를 진행한다고 16일 밝혔다. 이날부터 이용자 상황에 맞게 실제 업데이트가 순차적으로 진행된다.  업데이트 후에는 격자형 피드를 선택 옵션으로 둘 수 있고, 이용자가 원할 경우 개편 전 친구탭을 사용할 수 있다. 카카오 관계자는 “이번 업데이트로 카카오톡 친구탭에서 친구 목록이 보여지는 화면을 기본으로 사용할 수 있게 된다”며 “상단에 ‘친구’와 ‘소식’ 두 가지 옵션이 분리 제공되어 이용자 성향과 필요에 따라 선택해 사용할 수 있다”고 설명했다.  올해 9월 23일 카카오톡 업데이트를 발표하면서 격자식 피드 형태의 친구탭을 내놓은 지 약 석 달 만에 친구목록을 되살리는 것이다. 당시 본래의 메신저 기능을 등한시하고 친구탭이 인스타그램을 포함한 소셜미디어(SNS) 피드처럼 개편되면서 이용자 피로도가 커졌다는 반응이 나온 바 있다.   ; 카톡 첫화면으로 친구탭 복원…친구목록 바로 본다",https://n.news.naver.com/mnews/article/011/0004567873
2025-12-16 11:28:00,"경찰, 제주항공 참사 관련 항공조사위 압수수색","[서울경제]  전남경찰청 제주항공 여객기 사고 수사본부가 항공사고조사위원회를 상대로 압수수색에 나섰다.  전남경찰청 수사본부는 16일 오전 9시께부터 김포와 세종에 있는 항공사고조사위원회 사무실 2곳에 대해 압수수색을 진행하고 있다고 밝혔다.  수사본부는 그동안의 수사 내용과 이번에 확보한 자료 분석 결과를 토대로 수사를 이어갈 방침이다.  지난해 12월 29일 오전 9시 3분께 전남 무안국제공항 활주로에서 방콕발 제주항공 여객기가 동체만으로 비상 착륙하려다 활주로 밖 로컬라이저 콘크리트 둔덕을 정면충돌하고 폭발했다. 이 사고로 탑승자 181명(승무원 6명·승객 175명) 중 179명이 숨졌다.  경찰은 참사 원인·과실 규명 과정에서 관제·조류 충돌 예방 업무 등을 담당한 공항공사 직원과 방위각 시설공사 업체 관계자, 안전검사·허가 등을 담당한 전·현직 국토부 관계자 등 총 44명에 대한 수사를 진행 중이다.  경찰 관계자는 ""법과 원칙에 따른 신속하고 엄정한 수사와 함께 유족과 피해자 지원에도 만전을 기하겠다""고 말했다.",https://n.news.naver.com/mnews/article/011/0004567871
2025-12-16 11:17:00,李대통령 “‘성냥팔이 소녀’ 결말 잔혹…우리 세상은 그러지 않길”,"[서울경제]  이재명 대통령이 16일 구세군, 대한적십자사 등 기부 활동을 하는 단체들을 초청해 “국정을 책임지는 사람으로서 진심으로 감사드린다”고 밝혔다.  이 대통령은 이날 용산 대통령실에서 열린 기부·나눔 단체 초청행사에서 “춥고 배고픈 세상에 따뜻한 역할을 맡아주신 여러분을 뵙게 돼서 참으로 반갑다”며 발언을 시작했다. 이어 동화 ‘성냥팔이 소녀’를 떠올렸다고 소개한 뒤 “다시 줄거리를 찾아보니 결말이 참 잔혹하더라”며 “우리 세상이 그렇게 잔인하지 않았으면 좋겠다”고 말했다.  이 대통령은 “다행히 여러분 같은 분들 덕분에 그렇지 않은 사회가 되고 있다”면서도 “그럼에도 가장 중요한 것은 정부와 행정이 최소한의 안전선을 지켜주는 일”이라고 강조했다.  또 “여러분은 그분들께 희망과 편안함을 주고 계신다”며 “후원금이 많은 것도 우리 사회에 이웃을 걱정하는 마음이 많다는 증거라고 생각한다. 그 연결 통로 역할을 해주시는 여러분께 국민을 대표해 감사드린다”고 했다.  이날 행사에는 구세군, 굿네이버스, 대한결핵협회, 대한적십자사, 사랑의열매, 세이브더칠드런 등 다양한 기부·나눔 단체 관계자들과 후원 아동 등이 참석했다. 이 대통령과 부인 김혜경 여사는 각 단체에 성금을 기부하고 기념 촬영을 했다.  굿네이버스 친선 대사 자격으로 행사에 참석한 배우 최수종은 “나눔은 거창한 것이 아니라 작은 사랑과 관심”이라며 “바쁜 국정 속에도 모든 단체를 초청해 격려해 주셔 진심으로 감사와 존경의 마음을 전한다”고 말했다.",https://n.news.naver.com/mnews/article/011/0004567870
