날짜,제목,본문,링크
2025-12-18 12:40:00,‘인보사 사태’ 소액주주 손해배상 소송 1심 패소…法 “허위공시 아냐”,"[서울경제]  코오롱생명과학(102940) 등의 소액주주들이 2019년 인보사케이주(인보사) 사태로 대규모 손실을 봤다며 회사를 상대로 제기한 손해배상 소송 1심에서 패소했다.  서울중앙지법 민사합의30부(재판장 김석범)는 18일 A씨 등 175명이 코오롱생명과학과 코오롱티슈진(950160)을 상대로 제기한 64억 원 규모의 손해배상 소송에서 원고 패소 판결했다. 같은 취지로 소송을 제기한 B씨 등 17명이 낸 2억 6000만원대 손해배상 청구도 기각했다. 2019년 소송이 제기된 이후 6년 만에 나온 1심 결론이다.  인보사는 사람 연골세포가 담긴 1액과 연골세포 성장인자를 도입한 형질전환 세포가 담긴 2액으로 구성된 골관절염 유전자 치료제 주사제다. 2017년 국내 판매 허가를 받았지만, 종양 유발 가능성이 있는 신장유래세포가 포함됐다는 논란이 불거지면서 2019년 허가가 취소됐다. 이로 인해 회사 주가가 급락했고, 소액주주들은 코오롱티슈진과 코오롱생명과학이 인보사의 주성분이 변경된 사실을 알고도 허위공시를 했다며 소송을 제기했다.  재판부는 이날 “성분이 달라졌다고 하더라도 효능이나 유해성이 특별히 달라졌다고 보기 어렵다”며 “중요한 사항을 거짓으로 기재하거나 누락했다고 보기 어렵다”고 판단했다.  한편 인보사 사태와 관련해 코오롱티슈진 경영진과 임원들의 형사재판에서도 무죄가 선고된 바 있다. 이웅열 코오롱그룹 명예회장은 자본시장과 금융투자업에 관한 법률 위반, 약사법 위반, 배임증재 혐의로 재판에 넘겨졌지만, 지난해 11월 1심에서 무죄를 선고받았다.",https://n.news.naver.com/mnews/article/011/0004568860
2025-12-18 12:37:00,"삼성전자, 엔비디아에 ‘제2의 HBM’ 소캠2 샘플 공급","[서울경제]  삼성전자(005930)가 차세대 D램 모듈 규격인 소캠(SOCAMM) 2세대 샘플을 엔비디아에 공급했다. 엔비디아의 차세대 인공지능(AI) 칩 '베라 루빈' 탑재를 겨냥한 제품이다. ‘제2의 고대역폭메모리(HBM)’로 떠오른 소캠 시장에서 초기 주도권을 놓치지 않기 위해 대량양산 체제도 적기에 구축한다는 계획이다.  삼성전자는 18일 자사 반도체 뉴스룸을 통해 “AI 데이터센터에 특화된 LPDDR 기반 서버용 메모리 모듈 소캠2를 개발해 현재 고객사에 샘플을 공급하고 있다”고 밝혔다.  여기서 언급된 고객사는 엔비디아를 지칭한다. 디온 해리스 엔비디아 HPC 및 AI 인프라 솔루션 총괄이사는 “삼성전자와의 지속적인 기술 협력을 통해 소캠2와 같은 차세대 메모리가 AI 인프라에 요구되는 높은 응답성과 효율을 구현할 수 있도록 최적화 작업을 이어가고 있다”며 양 사의 협업을 공식화했다.  소캠은 엔비디아가 AI 메모리반도체 시장의 주도권을 차지하고자 독자적으로 표준을 추진 중인 LPDDR D램 기반의 탈부착식 D램 모듈이다. DDR 기반의 서버용 모듈 대신 저전력이 장점인 LPDDR5X D램을 얹기 때문에 기존 RDIMM 대비 2배 이상의 대역폭과 55% 이상 낮은 전력 소비를 제공한다. 속도도 전 세대인 소캠1보다 20% 이상 개선됐다.  삼성전자가 소캠 샘플 제공을 공식화한 건 소캠 공급망에 조기 진입하겠다는 의지를 드러낸 것으로 해석된다. 삼성전자는 개발 초기부터 엔비디아와 긴밀하게 협력을 진행하며 경쟁사보다 빠르게 고객 샘플(CS) 단계에 진입한 것으로 알려졌다. CS 단계는 실제 시스템 환경에서 안정성과 호환성을 검증하는 핵심 관문으로, 엔비디아가 요구하는 전력·대역폭·열 관리 기준을 충족했다는 뜻이다. 대량 양산까지 순조롭게 이어질 경우 차세대 AI 칩 '베라 루빈'에 삼성전자의 소캠2가 탑재된다.  내년 상반기부터 소캠2 시장 개화가 전망되는 가운데 메모리 업체들은 엔비디아 공급망을 초기 선점하려 각축전을 벌이고 있다. 차세대 AI 제품군의 시장 증가 속도가 이전과는 비교할 수 없을 만큼 빠르기 때문에 조기에 대응하지 않으면 성장세에 올라타기 어려워서다. HBM의 경우 SK하이닉스(000660)가 일찍이 지배적 위치를 차지했지만 소캠의 경우 선두를 차지할 기회가 열려 있다. 삼성전자는 소캠 기반인 LPDDR 제품군에서 오랜 기간 1위를 지켜온 만큼 상대적으로 경쟁에서 유리하다는 평가를 받고 있다.  삼성전자는 소캠 공급망 진입 과정에서 잡은 승기를 바탕으로 표준화 면에서도 주도권을 지킨다는 전략이다. 현재 삼성전자는 글로벌 주요 파트너사와 함께 소캠의 JEDEC 표준 규격 제정을 주도하고 있다.  삼성전자 관계자는 “서버용 메모리 제품군을 한층 강화해 차세대 AI 데이터센터가 요구하는 성능과 전력·확장성을 균형 있게 제공하는 솔루션을 지속적으로 선보일 계획”이라고 설명했다.   ; 삼성전자, 엔비디아에 ‘제2의 HBM’ 소캠2 샘플 공급",https://n.news.naver.com/mnews/article/011/0004568859
2025-12-18 12:22:00,"롯데이노베이트, 롯데백화점 앱 AI 컨시어지 '더스틴' 구축","[서울경제]  롯데이노베이트는 아마존웹서비스(AWS), 롯데백화점과 3사 공동 협력으로 롯데백화점 모바일 앱 내 인공지능(AI) 쇼핑 컨시어지 서비스 더스틴을 구축했다고 18일 밝혔다.  더스틴은 AWS의 생성형 AI 서비스인 베드록 기반의 AI 에이전트를 국내 오프라인 백화점 매장 고객 서비스에 적용한 사례다. AI 컨시어지 서비스인 더스틴은 고객의 질의에 대한 단순 응답을 넘어 질문 의도를 분석하고 백화점·아웃렛·쇼핑몰의 실시간 데이터를 종합해 정보를 제공한다. 고객이 매장 위치만 질문하더라도 대화의 맥락을 이해하고 매장 연락처, 할인 쿠폰, 사은행사 등 부가 정보를 제공하고 후속 질문까지 예측해 답변하는 AI 챗봇 서비스다.  롯데이노베이트는 고객의 질문 의도를 분석하고 관련된 모든 데이터를 실시간으로 탐색해 가장 유용한 정보를 조합해 제공하는 핵심 로직을 개발했다. 더스틴에 탑재된 AI 에이전트는 5가지 전용 도구를 활용해 대화의 맥락을 파악하고 추론하며 끊김 없는 소통을 지원한다.  김근배 롯데이노베이트 클라우드부문장은 “이번 AI 프로젝트를 통해 매장의 반복적인 안내 업무를 자동화해 직원이 보다 고도화된 고객 서비스를 집중할 수 있게 됐다”고 말했다.",https://n.news.naver.com/mnews/article/011/0004568858
2025-12-18 12:20:00,"내란전담재판부 입법 앞두고…대법원, 전담재판부 ‘자체 설치’","[서울경제]  대법원이 형법상 내란죄·외환죄와 군형법상 반란죄 사건을 전담해 심리하는 ‘국가적 중요사건 전담재판부’를 예규로 설치하기로 했다. 더불어민주당이 이달 중 처리를 예고한 내란전담재판부 설치 법안을 두고 위헌 논란이 이어지는 가운데, 사법부가 입법이 아닌 내부 규칙을 통해 신속 재판 방안을 내놓은 것이다.  법원행정처는 18일 열린 대법관 행정회의에서 ‘국가적 중요사건에 대한 전담재판부 설치 및 심리절차에 관한 예규’를 제정하기로 결정했다고 밝혔다. 해당 예규는 이날 대법관회의 논의를 거쳐 의결됐으며, 행정절차법에 따른 10일 이상의 행정예고를 거쳐 시행될 예정이다  예규에 따르면 국가적 중요사건은 형법상 내란·외환의 죄와 군형법상 반란의 죄 가운데, 정치·사회적 파장이 크고 국민적 관심이 높아 신속한 재판 진행이 필요한 사건으로 정의된다. 각급 법원장은 이들 사건만을 전담해 집중적으로 심리하는 전담재판부를 설치할 수 있으며, 대상 사건은 다른 사건에 우선해 신속히 처리하도록 했다  특히 이번 예규는 기존 사건배당의 무작위성 원칙을 유지하면서도, 대상 사건을 배당받은 재판부를 사후적으로 전담재판부로 지정하는 방식을 택했다. 국회 법안처럼 특정 사건을 미리 전담재판부로 보내는 구조가 아니라, 무작위 배당 이후 해당 재판부의 업무를 조정하는 방식이다. 이를 통해 이른바 ‘찍어 배당’ 논란이나 사법권 침해 우려를 최소화하겠다는 취지다.  전담재판부로 지정되면 해당 재판부는 대상 사건만을 집중 심리할 수 있도록 원칙적으로 기존 사건을 모두 재배당받는다. 다만 이미 심리 중인 사건의 시급성이나 업무 부담 등을 고려해 일부 사건은 재배당하지 않을 수 있다. 전담재판부 지정 이후에는 특별한 사정이 없는 한 새로운 사건을 추가 배당하지 않도록 했다  법원행정처 관계자는 “국가적 중요사건 재판의 신속하고 공정한 진행에 대한 국민과 국회의 우려를 해소하기 위한 조치”라며 “위헌법률심판제청 등으로 재판이 지연되는 상황을 피하면서, 종전의 사무분담과 무작위 배당 원칙을 유지할 수 있을 것으로 본다”고 설명했다.  앞서 전국법원장회의와 전국법관대표회의, 최근 열린 사법제도 개편 공청회에서는 국회의 내란전담재판부 법안과 관련해 사법권 침해 및 위헌 우려가 제기되는 한편, 사법부 스스로 신속 재판을 위한 대안을 마련해야 한다는 요구도 잇따랐다. 이번 예규는 이러한 문제 제기에 대한 사법부 차원의 대응으로 해석된다.  이번 예규는 국가적 중요사건 전반에 적용되지만, 부칙상 적용 범위와 시행 시점을 고려할 때 서울고등법원에서 진행될 내란 사건 항소심에 가장 먼저 적용될 가능성이 크다.  법원행정처는 “항소심 단계에서 신속하고도 충실한 심리가 이뤄질 수 있도록 인적·물적 지원을 최우선적으로 하겠다”고 밝혔다   ; 내란전담재판부 입법 앞두고…대법원, 전담재판부 ‘자체 설치’",https://n.news.naver.com/mnews/article/011/0004568857
2025-12-18 12:08:00,"""엄마, 나 공무원 다시 준비할까""…9급 초임 월 '300만원' 시대 오나","[서울경제]  인사혁신처가 9급 공무원 채용시험을 지식·암기 중심에서 종합적 사고력을 평가하는 공직적격성평가(PSAT) 방식으로 전환하는 방안을 추진한다.  인사처는 17일 ‘2026년 주요 업무 추진 계획’을 통해 이 같은 방향을 제시했다. 우선 9급 시험과목을 PSAT로 바꾸는 로드맵을 마련하고, 내년에 연구용역과 의견수렴을 거쳐 2027년 이후 도입안을 발표할 계획이다.  PSAT는 공채뿐 아니라 경채에도 활용할 수 있도록 제도 개선을 병행하고, 공공부문 채용 전반으로의 확산도 추진한다. 채용 인프라 측면에서는 과천·세종 등으로 흩어진 채용 업무를 세종 한곳에서 처리하도록 2030년까지 국가채용센터 건립을 추진한다.  전문성 강화책도 담겼다. 고도의 전문 분야는 장기근무가 가능하도록 별도 인사관리 체계를 도입해 승진·교육훈련을 우대하고, 일반 분야도 부처 내 업무분야별 인사이동을 정착시켜 공직 전반의 전문성을 끌어올리겠다는 구상이다.  승진 제도는 속도를 높인다. 우수한 6급 실무직공무원을 5급 중간관리자로 신속 임용하는 ‘5급 조기승진제’를 신설하고, 공모직위 적용 대상을 6급까지 확대해 뛰어난 7급 공무원도 요건과 무관하게 빠르게 승진할 수 있는 경로를 마련한다.  현장 보상도 손본다. 재난·안전, 민원 등 격무 담당자와 정부 포상자에게는 승진가점, 성과급 우대 등 인사상 혜택을 제공한다. 업무 중 부상·사망 공무원에 대한 재활급여를 개선하고, 가칭 ‘공상공무원의 날’ 제정도 추진한다.  책임성과 윤리성 제고를 위한 장치도 강화된다. 성과·자질이 부족한 고위공무원은 소속 장관 직권으로 강임하고, 강임 후 승진대상에서 제외하는 ‘직권강임’을 신설한다. 고위공직자의 주식 매각·백지신탁·직무관여 금지 위반 여부를 정기 점검하고, 위반 의심자는 직권조사한다. 직무관여 금지 위반은 누구나 신고할 수 있도록 ‘주식백지신고센터’도 설치한다.  보수·복지 개선안도 포함됐다. 낮은 보수로 인한 이탈을 막기 위해 9급 초임을 내년 286만원에서 2027년 월 300만원 목표로 단계 인상한다. 5년 이상 10년 미만 저연차 공무원에게는 3일 특별휴가를 부여하고, 은행 가계대출 평균금리보다 낮은 ‘청년 전용 대출’도 신설한다.  아울러 범정부 적극행정협의체를 통해 적극·소극행정 추진상황을 점검하고, 기관별 맞춤 컨설팅 등 현장 지원을 강화한다. 최동석 인사처장은 ""공무원이 자율적인 주체로서 본인의 직무에 대해 국민에게 책임을 다할 수 있도록 민주적 공직 여건을 조성하고, 활력있는 공직사회를 구현하기 위해 최선을 다하겠다""고 밝혔다.   ; ""엄마, 나 공무원 다시 준비할까""…9급 초임 월 '300만원' 시대 오나",https://n.news.naver.com/mnews/article/011/0004568856
2025-12-18 12:04:00,경찰 기동대·기동순찰대 인력 줄여 수사인력 1200명 증원,"[서울경제]    경찰이 내년 상반기 인사에 맞춰 기동대와 기동순찰대 인력을 각각 1000명씩 줄여 수사 부서에 수사관 1200여 명을 배치한다.  유재성 경찰청장 직무대행은 업무보고 다음 날인 18일 오전 서울 서대문구 경찰청에서 열린 기자간담회에서 이같은 계획을 밝혔다.  유 직무대행은 ""내년 상반기 인사에 맞춰서 기동대와 기동 순찰대 인력을 각각 1000명씩 줄여서 수사 부서에 1200여 명을 배치하겠다""며 ""나머지 인원은 초국가 범죄와 지역경찰 등 민생 분야에 보강할 예정""이라고 말했다.  유 직무대행은 ""앞으로도 국민이 요구하는 수준에 부족함이 없는지 살펴보고 (수사 부서에) 추가 인력 보강도 검토하겠다""고 말했다.  앞서 이재명 대통령은 전날 진행된 경찰청 업무보고에서 “집회 참여 인원이 계속 줄어들고 있으니 시위 진압에 너무 많은 역량을 소진할 필요가 없다”면서 “범죄가 예전과 달리 복잡해지고 있는 만큼 수사를 위한 인력이 더 필요하다”며 집회 대응 인력을 줄일 것을 지시했다. 이에 경찰청은 수사 공정성과 책임성을 강화하기 위해 인력 내부 조정을 통해 현장 수사 부서에 수사관 1200여 명을 추가 배치할 계획이라고 밝혔다.  유 직무대행은 ""기동대는 집회시위 대응에 공백이 없는 범위에서 범죄예방과 순찰, 학생 안전, 실종자 수색 등 민생 치안 분야와 재해·재난 현장 지원 등 국민안전 전반에 상시적으로 활용할 계획""이라고 말했다. 이어 ""향후 집회시위 수요를 분석해 기동대 인력을 연차적으로 수사 부서 등 민생분야로 전환하겠다""고 말했다.  경찰은 국제공조와 지역경찰 인원도 늘려갈 방침이다. 유 직무대행은 ""국내에 체류하는 외국인들이 늘어나는 추세이기 떄문에 국제협력, 국제공조 관련 인원도 늘어야 한다""며 ""5~600여 명 정도 늘리겠다""고 말했다.  스토킹 등 관계성 범죄에는 가해자 3중 관리 체계를 운영하고, 가해자 위치 정보 연계 시스템을 구축해 피해자 보호를 강화한다. 동남아 스캠단지 등 초국가범죄 대응을 위해 현지 코리아 전담반 운영과 국제공조 수사를 확대하고, 해외 사건·사고 대응을 위한 24시간 전담팀도 신설한다. 유 직무대행은 “관계성 범죄가 늘고 있다”며 ""지역경찰 인력도 약 400명 정도 증원할 것""이라고 말했다.  온라인상 허위정보 유포와 관련해 유 직무대행은 ""매크로를 이용한 여론 조작 행위 등에 대해서도 면밀히 살펴 적극 수사하겠다""고 밝혔다.  수달 째 미뤄진 총경 전보 인사는 올해 안에 실시하겠다는 계획이다. 유 직무대행은 ""금년 안에 (인사를) 하겠다고 했다""며 ""그렇게 할 것""이라고 말했다.",https://n.news.naver.com/mnews/article/011/0004568855
2025-12-18 12:04:00,"개보위, 삼성 서비스 로봇 '볼리' 등 개인정보보호 우수 제품으로 선정","[서울경제]  개인정보보호위원회가 개인정보 보호 기능을 충실히 반영한 삼성전자(005930)의 가정용 서비스 로봇 ‘볼리’ 등 우수 제품 3종에 대해 ‘개인정보보호 중심 설계(PbD) 인증’을 부여한다고 18일 밝혔다.  개인정보위는 홈 카메라, 로봇청소기 등 국민 일상에서 널리 사용되는 스마트 기기의 개인정보 유출 우려가 지속적으로 제기됨에 따라 2023년부터 PbD 인증제를 시범 운영 중이다. 지난해까지 4개 제품에 인증서를 부여한 바 있다.  올해에는 홈 카메라 등 4개 제품을 대상으로 개인정보 보호 원칙을 반영한 인증 기준(총 71개 항목)에 따라 시험·평가 및 취약점 보완 등을 실시했다. 그 결과 이번에 인증을 취득한 제품은 △삼성전자의 가정용 서비스 로봇 ‘볼리’ △LG전자(066570)의 로봇청소기 △트루엔의 홈 카메라 ‘이글루 S8’ 총 3개 제품이다. 이들 제품은 설계 단계에서부터 개인정보 침해 사전예방 내재화, 개인정보 보호법 등 법적 요구사항 준수 등 PbD 핵심 원칙을 반영한 제품으로 평가받았다.  양청삼 개인정보위 개인정보정책국장은 “급속히 확산되는 스마트 기기 환경에 효과적으로 대응하기 위해 개인정보 보호 체계를 사후 조치에서 사전 예방 중심으로 전환하는 것이 무엇보다 중요하다”며 “내년부터는 인증 대상을 정보기술(IT) 제품 뿐만 아니라 솔루션 분야까지 확대하고 ‘개인정보 보호법’ 개정을 통해 PbD 인증의 법제화를 속도감 있게 추진하겠다”고 밝혔다.",https://n.news.naver.com/mnews/article/011/0004568854
2025-12-18 12:01:00,"포티투마루, AI·SW기업 ESG 경영대상서 과기부 장관상 수상","[서울경제]  생성형 AI 스타트업 포티투마루는가 ‘제2회 AI·SW기업 ESG 경영대상’에서 과학기술정보통신부 장관상을 수상했다고 18일 밝혔다.  AI·SW기업 ESG 경영대상은 국내 소프트웨어 기업의 ESG 경영 현황을 진단하고 우수한 ESG 경영 실천 기업을 발굴해 산업계 전반에 지속가능한 경영 문화를 확산하기 위해 제정됐다. 이번 평가는 글로벌 공급망 이슈에 대응하기 위한 AI·SW기업 특화 ESG 경영 진단 결과를 토대로 이뤄졌다.  포티투마루는 이번 진단에서 환경, 사회, 거버넌스 전 영역에 걸쳐 업계 기준을 상회하는 높은 평가를 받았다. 특히 거버넌스 부문에서는 업계 평균을 크게 웃도는 점수를 기록했다. AI 기술 기업으로서 지속 가능한 경영과 투명한 의사결정 구조를 갖추고 있다는 점이 종합 분석 평가에 반영됐다.",https://n.news.naver.com/mnews/article/011/0004568853
2025-12-18 12:01:00,대법 “지역주택조합 사기·횡령 200억대…중형 정당”,"[서울경제]  지역주택조합 사업이 곧 진행될 것처럼 속여 조합원 수백 명에게서 200억 원대 자금을 가로챈 업무대행사 대표와 이사에게 선고된 중형이 대법원에서 확정됐다.  18일 법조계에 따르면 대법원 2부(주심 권영준 대법관)는 특정경제범죄가중처벌법 위반(횡령)과 사기 혐의로 기소된 업무대행사 대표, 이사인 곽 씨와 김 씨의 상고를 기각하고, 각각 징역 20년과 징역 14년 6개월을 선고한 원심 판결을 그대로 유지했다.  이들은 은평구 불광2지역주택조합 업무대행사 대표와 이사로, 토지 사용권원 확보율이 20%에도 못 미치는 상황에서 사업이 정상적으로 추진되는 것처럼 허위 홍보를 한 뒤 조합원 428명으로부터 계약금 등 208억여 원을 받은 혐의를 받는다. 이들은 ‘GTX 연신내역’ 대단지 아파트가 2~3년 내 완공될 것처럼 모델하우스를 운영하며 조기 입주가 가능하다고 설명한 것으로 조사됐다.  또 조합원들로부터 받은 자금 가운데 약 56억 원을 업무대행비 명목으로 회사 계좌로 옮겨 임의로 사용하고, 허위 직원 급여를 지급하는 방식으로 횡령한 사실도 인정됐다.  1심은 곽 씨에게 징역 20년, 김 씨에게 징역 16년을 선고했고, 2심은 일부 피해자와의 합의를 고려해 김 씨의 형량을 징역 14년 6개월로 줄였다. 대법원은 이 같은 판단이 부당하다고 볼 수 없다며 상고를 받아들이지 않았다.",https://n.news.naver.com/mnews/article/011/0004568852
2025-12-18 12:01:00,배출권 측정용 ‘전력배출계수’ 8.1% 감소…“앞으로 매년 갱신”,"[서울경제]  기후에너지환경부가 2023년 기준 전력배출계수를 직전 공표치보다 8.1% 낮췄다. 전력배출계수는 전기를 사용했을 때 온실가스를 얼마나 간접배출했는지 측정할 때 사용하는 지표다. 정부는 재생에너지 발전량 확대로 전력배출계수가 꾸준히 하락하고 있다는 점을 고려해 전력배출계수 발표 주기를 기존 3년에서 1년으로 단축하겠다고 밝혔다.  18일 기후부는 국가 온실가스 통계관리위원회를 열고 2023년 기준 전력배출계수를 메가와트시(㎿h)당 0.4173탄소환산톤으로 공표했다, 이는 직전 최신 수치인 2020~2022년 평균 전력배출계수 0.4541탄소환산톤 대비 0.0368탄소환산톤(-8.1%) 줄어든 수치다. 최근 들어 태양광 발전량이 크게 늘어나면서 전체 전력 생산 과정에서 배출하는 온실가스가 줄어든 덕이다.  전력배출계수는 전기 소비로 인해 발생하는 온실가스 배출량을 산정하기 위해 사용하는 변환 계수다. 각 기업이 사용한 전력량에 배출계수를 곱하면 전력 소비로 인해 발생한 간접 배출량이 도출되는 방식이다. 예를 들어 한 기업이 1만㎿h의 전력을 썼다면 이날 공표된 전력배출계수 기준 4173탄소환산톤의 온실가스를 배출한 것이 된다. 이렇게 측정된 배출량은 정부가 배출권 할당제를 시행하는 근거자료로 쓰인다. 기업들이 ESG 공시 과정에서 온실가스 배출량을 발표하기도 하는데 이때도 전기 소비로 인해 발생한 온실가스는 전력배출계수로 환산한다.  정부는 기업들의 부담을 완화하기 위해 배출계수산정 주기를 3년에서 1년으로 단축하겠다는 방침이다. 전력배출계수가 하락하는 시기에 3년 평균치를 발표할 경우 기업들이 상당한 기간 실제 배출량보다 높은 수준을 부담해야 하는 문제가 발생해서다. 한국의 연평균 전력배출계수는 2018년 ㎿h당 0.5404탄소환산톤으로 정점을 찍은 뒤 2020년 0.4484톤, 2023년 0.4173톤 등 꾸준히 떨어졌다. 정부는 2030년까지 재생에너지 발전 설비 규모를 100기가와트(GW)로 늘릴 방침이어서 전력배출계수 하락세는 한동안 계속될 것으로 보인다.  오일영 기후부 기후에너지정책실장은 “기업들의 건의를 수용해 전력배출계수를 갱신 주기를 단축하기로 한 것”이라며 “앞으로도 기업들이 국제사회의 탄소중립 노력에 적극 동참할 수 있도록 최선의 노력을 다할 것”이라고 말했다.",https://n.news.naver.com/mnews/article/011/0004568851
