날짜,제목,본문,링크
2025-12-06 13:30:00,"강력하고 매력적인 포르쉐, 최초의 순수 전기 마칸 GTS 공개","[서울경제] 포르쉐가 순수 전기 SUV 라인업을 확장하며, 운전자 중심의 역동적인 모델 ‘마칸 GTS(Macan GTS)’를 공개했다.  이번에 공개된 마칸 GTS는 ‘순수 전기차 시대’로 돌입한 마칸에 포르쉐의 상징적인 ‘GTS’ 이니셜이 더해진 것으로 더욱 강력한 성능은 물론이고 스포츠 주행에 최적화된 조율이 더해진다. 이를 통해 고성능 전기 SUV 시장에서의 포르쉐의 가치 및 존재감을 강조한다.  마칸 GTS의 외형은 GTS다운 ‘검은색 디테일’ 등이 차량의 외장 색상과 선명한 대비를 이룬다. 틴팅된 매트릭스 LED 헤드라이트는 물론이고 여러 디테일이 블랙 하이글로시를 더한다. 더불어 향후 데뷔할 ‘스포츠 디자인 패키지’는 더욱 특별한 요소들이 가득 더해진다.   네 바퀴에는 21인치 마칸 디자인 휠이 기본 장착되며, 옵션으로 앤트러사이트 그레이 22인치 RS 스파이더 디자인 휠을 선택할 수 있다. 크레용, 카민 레드, 루가노 블루는 물론이고 ‘페인트 투 샘플(Paint to Sample)’ 프로그램을 통해 약 60가지 색상이 제공된다.  마칸 GTS의 실내 공간 역시 GTS 만의 매력이 담긴다. 검은색 가죽과 결합된 고품질 레이스-텍스(Race-Tex) 소재가 광범위하게 사용되어 스포티한 분위기를 연출한다. 열선 기능의 GT 스포츠 스티어링 휠, 18방향 조절식 어댑티브 스포츠 시트 등이 매력을 더한다.   여기에 옵션 사양인 ‘GTS 인테리어 패키지’는 카민 레드, 슬레이트 그레이 네오, 루가노 블루 중 하나를 선택해 외관 색상과 실내의 대조적인 스티칭, 시트벨트, ‘GTS’ 레터링 등을 감각적으로 통일할 수 있어 전통적인 GTS의 매력을 과시해 모두의 시선을 집중시킨다.  파워 유닛은 피크 출력 420kW(환산 시 약 571마력)의 듀얼 모터 패키지를 통해 폭발적인 운동 성능을 보장한다. 브랜드의 발표에 따르면 정지 상태에서 단 3.8초 만에 시속 100km까지 가속할 수 있으며 최고 속도 역시 250km/h로 ‘고성능 전기 SUV’다운 모습이다.   참고로 마칸 GTS에는 강력한 전기 모터와 고효율 900A 실리콘 카바이드(SiC) 펄스 인버터를 적용해 고성능 SUV의 완성도를 높인다. 여기에 270kW에 이르는 급속 충전을 지원해 단 21분 만에 배터리 잔량 10%에서 80%까지 충전할 수 있어 ‘전기차 운영’을 돕는다.  이외에도 GTS 전용으로 튜닝된 스포츠 에어 서스펜션(PASM 포함)이 기본 장착되어 차체를 10mm 낮췄으며, 전자식 리어 디퍼렌셜 록과 48:52의 후륜 편향 무게 배분이 민첩성과 코너링 정밀도를 극대화한다. 옵션으로 리어 액슬 스티어링도 선택할 수 있다.   또한 트랙 모드와 포르쉐 일렉트릭 스포츠 사운드(PESS)’ 등이 차량의 매력을 한껏 끌어 올린다. 또한 다양한 안전 및 편의사양 등이 더해진다. 덧붙여 포르쉐 디지털 키, AI 기반 음성 파일럿, 최대 2,500kg의 견인 용량 등 최신 보조 및 편의 기능이 탑재되었다.  신형 포르쉐 마칸 GTS의 독일 시장 공식 판매 가격은 104,200유로(약 1억 7,400만 원)부터 시작한다. 국내(한국) 시장에는 2026년 상반기 출시될 예정이며, 국내 공식 판매 가격은 출시 시점에 맞춰 공개될 예정이다.",https://n.news.naver.com/mnews/article/011/0004564242
2025-12-06 13:01:00,위암 수술의 재발견…암·대사질환 막는 ‘신의 한 수’ 될 수도[헬시타임],"[서울경제]  위암 수술의 대표적인 부작용으로 꼽히는 영양 결핍 및 체중 감소가 비만·당뇨병 등 대사질환이 흔한 현대인에게는 오히려 건강상 이점으로 작용할 수 있다는 연구 결과가 나왔다.  서윤석·강소현 분당서울대병원 외과 교수와 신애선 서울의대 예방의학교실 교수, 우형택 계명의대 예방의학교실 교수 연구팀은 2002~2020년 국민건강보험 빅데이터를 활용해 조기 위암 환자 7만4000여 명을 최장 15년간 추적 관찰한 결과, 위절제술이 내시경 절제술에 비해 만성 대사질환 및 심장·뇌혈관질환 발병률을 크게 낮추는 것으로 나타났다고 5일 밝혔다.    연구진은 조기 위암을 위절제술로 제거한 4만9578명과 내시경 절제술을 시행한 2만4789명을 비교 분석했다. 그 결과 위절제술 그룹은 내시경 절제술 그룹에 비해 고혈압 발생률이 약 53% 낮았고, 허혈성심질환·심부전·뇌혈관질환과 그 밖에 주요 심혈관질환 사건 발생률은 각각 20%, 14%가량 낮게 나타났다.  위절제술 그룹은 비만 환자에서 흔한 대장암 등 '비만 관련 암'과 그에 따른 사망률도 내시경 절제술 그룹에 비해 18%, 26% 감소했다. 위암 수술이 비만 등 대사질환을 감소시키고, 궁극적으로 비만과 연관된 다른 암들을 예방하는 효과로 이어진다는 의미다. 10년간 고혈압·당뇨병 관련 의료비를 약 25% 절감하는 효과도 확인됐다.  위절제술은 종양이 생긴 위의 일부 혹은 전체를 잘라내는 수술이다. 위의 용적이 줄어드니 자연스럽게 식사량도 줄어든다. 이러한 특성 탓에 과거부터 위암 수술을 받으면 잘 못 먹어 살이 빠지고 영양 결핍에 걸린다는 인식이 있었다. 이른바 '영양 과잉' 시대인 요즘에는 이를 단점으로만 볼 수 없다는 것이 연구팀의 설명이다.  이번 연구는 위절제술의 대사적 이점을 내시경 절제술과 비교 분석해 규명한 세계 최대 규모의 연구라는 점에서 의미가 있다. 암과 대사질환을 통합적인 시각으로 바라보고 치료 전략을 수립하는 '온코-메타볼릭'(oncometabolic) 패러다임의 핵심 근거로 쓰일 전망이다.  서윤석 교수는 ""위암 수술을 받게 되면 먹고 싶은 음식을 못 먹고 영양결핍으로 이어져 삶의 질이 매우 낮아질까 두려워하는 환자들이 많다""며 ""위암 수술이 비만 관련 2차 암 발생이나 사망을 포함한 주요 심혈관질환의 발병을 유의하게 감소시킴으로써 장기적으로 적정 체중을 유지하고 건강한 삶을 사는 데 도움을 줄 수도 있다""고 말했다.  이번 연구 결과는 세계적인 외과학 학술지 '미국외과의사협회저널'(Journal of the American College of Surgeons) 최근호에 실렸다.",https://n.news.naver.com/mnews/article/011/0004564241
2025-12-06 12:59:00,"'쿠팡 무혐의 의혹' 엄희준 검사, 상설특검 첫날 '무고' 수사요청",[서울경제]  ‘쿠팡 일용직 노동자 퇴직금 미지급’ 사건을 수사할 안권섭 특별검사팀이 6일 현판식을 열고 본격 수사에 착수한 가운데 쿠팡 수사 지휘부였던 엄희준 광주고검 검사가 의혹을 제기한 문지석 광주지검 부장검사를 무고 혐의로 수사해달라는 요청서를 특검에 제출했다  엄 검사 측 변호인은 이날 오전 특검팀이 현판식 열고 수사를 개시한 직후 사무실을 방문해 이 같은 내용의 수사 요청서를 제출했다. 엄 검사 측은 입장문을 통해 “엄 검사도 상설특검의 수사에 적극 협조할 것”이라며 “상설특검에서는 본건 사실관계를 명백히 규명한 후 문 부장검사를 무고죄로 엄중히 처벌해 달라”고 했다.  문 부장검사가 대검 감찰을 받게 되자 이를 피하기 위해 지휘권자인 엄 검사를 무고했다는 것이 엄 검사 측 주장이다. 엄 검사 측은 △대검 보고서에 쿠팡 관련 노동청 압수물 누락 △무혐의 강요 △주임검사에게 무혐의 가이드라인 제시 등 문 부장검사가 대검 감찰부에 제출한 진정서 내용이 사실과 다르다고 반박했다.  우선 압수물을 엄 검사와 김동희 검사가 누락했다는 의혹에 대해선 “김 검사는 4월 18일 대검에 노동청 압수물 내용과 문 부장검사의 입장까지 보고했다”며 “검찰 메신저 대화 내역 등 객관적 증거자료가 그대로 남아있다”고 주장했다.  또한 엄 검사가 문 부장검사를 ‘패싱’하고 무혐의를 강요했다는 주장도 사실이 아니라고 강조했다. 엄 검사 측은 “3월 5일 회의에서 문 부장검사는 쿠팡 사건을 무혐의 (처리)하는 것에 대해 동의했고 관련 메신저 내역이 남아있다”며 문 부장검사가 4월 18일 다시 한번 쿠팡 사건 무혐의에 동의한 메신저 내역도 있다고 했다.  엄 검사가 주임검사에게 무혐의 가이드라인을 줬다는 의혹에 대해서도 “주임검사가 먼저 엄 검사에게 무혐의 의견을 제시했고 주임검사 의견대로 처리하라고 한 것이 전부”라고 반박했다. 엄 검사 측은 “문 부장검사는 사전 보고 규정을 무시한 채 독단적으로 압수수색을 진행한 혐의 등으로 대검에서 감찰을 받게 됐다”며 “지휘권자인 엄 검사를 처벌받게 하고 자신의 감찰 혐의를 면탈하려는 목적으로 허위 사실로 엄 검사를 무고한 것”이라고 주장했다.  그러면서 “엄 검사는 쿠팡 측과 아무런 관련이 없고 쿠팡 관련 사건 처리를 왜곡할 그 어떤 동기도 없다”며 “상설특검은 위와 같은 사정을 고려해 양측 모두에 균형감 있는 공정한 수사를 진행해 주실 것을 부탁드린다”고 덧붙였다.  특검팀은 이날 오전 현판식을 열고 쿠팡 퇴직금 불기소 의혹과 관봉권 띠지 폐기 의혹에 대한 수사를 개시했다. 안 특검은 “객관적 입장에서 사건의 실체를 밝히는 데 최선의 노력을 다하겠다”며 “수사 결과에 따른 합당한 결정을 내리겠다”고 언급했다.,https://n.news.naver.com/mnews/article/011/0004564240
2025-12-06 12:50:00,"'김건희 집사' 공범 조영탁 IMS 대표 구속…""증거인멸 우려""","[서울경제]  ‘김건희 여사 집사’ 김예성씨의 횡령 혐의 공범인 조영탁 IMS모빌리티 대표가 6일 민중기 특별검사팀에 구속됐다.  서울중앙지법 이정재 영장전담 부장판사는 전날 조 대표에 대한 구속 전 피의자 심문(영장실질심사)을 연 후 이날 구속영장을 발부했다. 구속영장 사유에 대해 이 부장판사는 “증거를 인멸할 염려가 있다”고 밝혔다.  특검팀은 조 대표에 대해 처음 청구한 구속영장이 지난 9월 2일 법원에서 기각되자 보완 수사로 배임증재 혐의 등을 추가로 확인한 뒤 두 번째 영장을 청구해 신병을 확보했다. 배임증재와 관련해 조 대표에 대한 구속영장 청구서에는 현직 기자에게 매달 돈을 주고 자신의 회사에 대한 우호적 기사를 쓰도록 한 혐의 등이 기재된 것으로 알려졌다. 특검팀은 조 대표가 도합 수천만 원을 건넸다고 보고 해당 기자에 대해서도 배임수재 혐의를 적용해 수사 중인 것으로 전해졌다.  조 대표의 신병을 확보한 특검팀은 향후 재판에 넘기기 전까지 각종 혐의를 탄탄히 다지는 데 주력하면서 IMS모빌리티의 투자 유치와 김 여사의 관계까지 추궁할 것으로 전망된다. 조 대표는 배임증재 외에도 특정경제범죄 가중처벌법(특경법)상 배임·횡령, 업무상 횡령, 외부감사법 위반, 증거은닉교사 등 혐의를 받는다. 조 대표는 IMS모빌리티가 2023년 다수 기업으로부터 투자받고 투자금 일부로 자사 구주를 사들이는 과정에서 35억 원을 횡령한 데 이어 32억 원의 배임 행위를 저지른 것으로 조사됐다.  IMS모빌리티는 김 여사 일가의 ‘집사’로 지목된 김예성씨가 설립에 참여하고 지분까지 가진 업체다. 사모펀드 운용사 오아시스에쿼티파트너스를 통해 카카오모빌리티, HS효성, 신한은행 등으로부터 184억 원을 투자받았다. 이후 유치자금 184억 원 중 46억 원은 이노베스트코리아라는 벤처기업이 보유하던 IMS 구주를 사들이는 데 사용됐다. 이노베스트코리아는 김씨가 실소유한 차명회사로 김씨로부터 IMS구주를 양도받았던 것으로 나타났다. 이에 김씨가 '엑시트'를 성공하는 방향으로 돈이 흐른 게 아니냐는 의혹이 제기됐다.  특검팀은 당초 IMS모빌리티에 투자한 주체들이 김씨와 김 여사의 친분을 생각해 일종의 보험성·대가성 자금을 제공했다고 의심해 수사해왔으나 현재까지 김 여사와의 연관성은 규명하지 못한 것으로 알려졌다. 김씨는 조 대표와 함께 24억 3000만 원을 횡령한 혐의(특경법상 횡령)로 지난 8월 구속기소돼 오는 22일 1심 변론 종결을 앞두고 있다.",https://n.news.naver.com/mnews/article/011/0004564239
2025-12-06 12:01:00,中 VC·스타트업 30곳 韓 방문… '스파크 아시아 코리아 에디션' 행사 개최,"[서울경제]  전 세계 800여 개 정보기술(IT) 기업이 모이는 중국의 IT 박람회 ‘비욘드 엑스포’ 주최사가 한국에서 한·중 벤처 생태계 교류 행사를 개최한다.  6일 벤처 업계에 따르면 비욘드 엑스포와 한국경영학회, 피더블유에스그룹은 이달 8일 서울 강남구 팁스타운에서 ‘스파크 아시아 코리아 에디션' 행사를 개최한다. 이날 행사에는 비욘드 엑스포 주최 측과 중국의 스타트업 낫띵, 엑스탈피 등 30여 개 기업 및 벤처캐피털(VC)이 참석한다. 이들은 한국 기업과 공동 R&D, 합작법인 설립, 전략적 제휴 등 다양한 파트너십을 논의할 예정이다.  이번 스파크 아시아 코리아 에디션은 매년 중국 마카오에서 열리는 대규모 IT 박람회 비욘드 엑스포의 사전 행사로 열린다. 비욘드 엑스포는 800여 개의 글로벌 IT 기업들이 전시 기업으로 참가하며 지난해 기준 300여 명의 연사와 2만 5000여 명의 참관객이 행사에 참가했다.  제이슨 호 비욘드 엑스포 공동창업자는 “한국은 아시아 혁신과 콘텐츠 산업의 핵심 허브로 빠르게 부상하고 있다”며 “스파크 아시아 행사를 통해 한국 산업계와 긴밀한 네트워크를 구축하겠다”고 전했다.  박지민 피더블유에스그룹 대표는 “이번 행사는 한국과 중국의 기술·산업 생태계가 실제 비즈니스로 연결되는 의미 있는 출발점이 될 것”이라며 기대감을 드러냈다.",https://n.news.naver.com/mnews/article/011/0004564238
2025-12-06 11:49:00,"""추워 미치겠다"" 창문 꼭꼭 닫아놓은 당신…'당장 여세요' 경고 나왔다는데","[서울경제] 몸·마음·생활… 무분별한 정보는 많고 건강해야 할 곳도 많습니다. 어려운 건강 지식도 쉽고 정확하게 UP! 해드립니다 <편집자주>    영하권 강추위가 이어지면서 실내 환기의 중요성이 강조되고 있다. 겨울철 창문을 닫아두는 시간이 늘어날수록 실내 공기가 오염될 가능성이 높아져서다. 환기가 부족한 실내 공간은 바이러스 확산의 최적 조건이기도 하다. 질병관리청은 하루에 최소 3번, 10분 이상 창문을 열어 환기할 것을 권장한다.  세계보건기구(WHO)는 실내 공기 오염이 폐렴, 관상동맥질환, COPD(만성폐쇄성폐질환), 뇌졸중, 폐암 등 심각한 질환을 유발할 수 있다고 경고한다. WHO는 겨울철 농도가 짙어지는 ‘라돈’이 폐암을 유발할 수 있다며 1급 발암물질로 지정한 바 있다. ‘무색무취’ 라돈은 정기적인 환기로 충분히 줄일 수 있는 것으로 알려져 있다.    쾌적한 공간 만드려면 ‘이렇게’    실외보다 실내 공기가 더 오염됐을 가능성이 높다는 연구 결과도 있다. 최근 이탈리아 카시노라치오 메리디오날레 국립대 지오르지오 부오난노 교수, 영국 서리대 프라산트 쿠마르 교수 공동 연구팀은 실내공기 오염의 특성과 건강 위험을 종합 분석했다. 연구팀은 실내의 휘발성 유기화합물, 초미세입자, 요리 과정에서 배출되는 오염물, 페인트 등 생활용품에서 나오는 화학성분이 실내 공기 질을 어떻게 악화하는지를 조사했다. 분석 결과, 환기가 잘 되지 않는 실내에선 생활용품 및 조리과정 배출물이 더 많이 머물러 실외보다 오염 농도가 높았다.  음식 조리 시 발생하는 미세먼지, 향초·디퓨저의 화학물질 등은 실내 공기를 더럽히는 주범이다. 집에서 요리할 땐 자연 환기와 함께 주방 레인지후드를 켜고, 겨울철에는 향초 사용 등을 줄이는 것이 좋다.",https://n.news.naver.com/mnews/article/011/0004564237
2025-12-06 11:49:00,"""여보 옆집 여자한테 갔다와요""…1시간에 6만 원 '인기 폭발' 서비스 뭐길래","[서울경제]  심각한 성별 불균형을 겪고 있는 유럽 라트비아 여성들 사이에서 '남편 1시간 서비스' 이용이 인기를 얻으며 빠르게 확산되고 있다.  4일(현지시간) 뉴욕포스트는 라트비아에서는 남성이 부족해 각종 집안일을 대신해 줄 남성을 시간제로 고용하는 사례가 늘고 있다고 보도했다.  라트비아는 여성이 남성보다 15.5% 많아, 유럽연합(EU) 평균보다 세 배 이상 높은 편이다. 30세 미만에서는 남성이 다소 많지만, 30~40대에 접어들면 성별 불균형이 본격적으로 나타난다. 65세 이상에서는 여성이 남성의 두 배에 달하며, 남녀 평균 수명 격차는 11년으로 EU 국가 중 가장 크다.  한 라트비아 여성은 ""직장 동료의 98%가 여자""라며 ""대부분은 외국인 남자 친구를 사귀고 있다""고 말했다.  남성 부족 현상이 심화되면서 라트비아에서는 온라인 플랫폼이나 전화로 손쉽게 '남편 1시간 서비스'를 예약하는 문화가 정착했다. 예약하면 남성이 1시간 내로 방문해 배관, 목공, 수리, TV 설치 등 각종 집안일을 도와주면서 독신 여성들에게 실용적인 해결책으로 떠오르며 큰 인기를 얻고 있다.  '렌트 마이 핸디 허즈번드(Rent My Handy Husband)'를 운영하는 제임스는 DIY 작업, 페인팅, 장식, 타일 시공, 카펫 설치 등 다양한 집안일을 직접 수행한다. 그는 시간당 44달러(약 6만원), 하루 종일 약 280달러(약 41만원)를 받고 있으며 ""11월 예약은 이미 가득 차 일부는 거절해야 했다""고 말했다.   ; 美소비심리, 연말 쇼핑시즌 맞아 5개월만에 개선…관세 우려 완화  ; 크리스마스에 빠질 수 없는 케이크, 지금 예약해볼까 [똑똑! 스마슈머]  ; ‘꿈의 예술단 15주년’ 최휘영 “어린 시절 예술경험 소중해…확산 더 지원”",https://n.news.naver.com/mnews/article/011/0004564236
2025-12-06 11:49:00,車 '빅세일 대전' 불꽃…현대차 그랜저 '무이자 60개월',"[서울경제]  주요 완성차 브랜드가 연말을 맞아 경쟁적으로 할인 행사를 펼치고 있다. 현대차(005380) 그랜저는 60개월 무이자 판매에 나섰고, GM의 럭셔리 브랜드 캐딜락은 최대 1700만 원의 할인 혜택을 제공하는 상품을 선보였다.  현대차는 이달 초부터 그랜저와 GV80 등 인기 차종에 대해 최대 500만 원을 할인하는 ‘라스트 찬스 프로모션’을 실시한다고 밝혔다.  이번 프로모션은 개별소비세 한시적 인하가 끝나는 연말까지 시행한다. 프로모션 기간 내 그랜저(하이브리드 포함)를 구매하는 고객은 차량 가격 200만 원 할인 또는 무이자 할부 중 하나를 선택할 수 있다. 할부는 선수율 10% 납입에 36개월, 48개월, 60개월 상품으로 구성됐다.  가령 그랜저 하이브리드를 60개월 무이자 할부 혜택을 적용 받아 구매하면 약 498만 원의 이자 비용을 아낄 수 있다. 차량의 생산 월에 따라 최대 100만 원의 추가 할인도 받는다.    다른 현대·제네시스 인기 차종에 대해서도 할인 혜택이 주어진다. 코나 EV는 300만 원, 아이오닉 5는 200만 원의 가격 혜택을 기본적으로 적용 받는다. 쏘나타(하이브리드 포함)는 최대 200만 원의 가격 혜택을 받을 수 있고, 포터 EV는 차량 가격 150만 원 할인에 더해 50만 원의 충전 포인트를 지원한다.  제네시스 GV80은 최대 500만 원, 제네시스 플래그십 차량인 G90는 최대 400만 원의 가격 혜택을 받을 수 있으며 G80, GV70는 최대 300만 원의 혜택이 제공된다.    한국GM은 12월 한 달간 쉐보레와 캐딜락에 대해 최대 1700만 원에 달하는 할인 프로모션을 벌인다.  쉐보레는 경품을 증정하는 ‘윈터 럭키 드라이브(Winter Lucky Drive)’ 이벤트와 함께 전 차종을 대상으로 금융 및 할인 혜택을 제공하는 특별 프로모션을 시행한다.  2026년형 트랙스 크로스오버는 36개월 3.5%, 60개월 4.0% 금리의 할부 프로그램을 제공한다. 2025년형은 60개월 3.9% 금리에 50만 원을 지원하는 콤보 할부 프로그램을 운영한다.  트레일블레이저는 36개월 4.5%, 60개월 4.9%의 할부 프로그램을, 정통 아메리칸 픽업트럭 콜로라도는 36개월 4.5%, 60개월 4.9%, 72개월 5.3%의 할부 프로그램을 적용한다. 콜로라도는 500만 원의 추가 할인도 받을 수 있다.  GM의 럭셔리 브랜드 캐딜락은 브랜드 최초 순수 전기 SUV 리릭에 대해 1700만 원의 현금 할인을 비롯해 고객 맞춤형 금융 프로그램을 제공한다. 선수금 없는 60개월 무이자 할부, 보증금 7%에 50개월 무이자 리스, 제휴 금융 이용시 선수금 또는 보증금 1700만 원 지원 중 하나를 선택할 수 있다.  풀사이즈 SUV 2025년형 더 뉴 에스컬레이드를 구매하는 고객에게는 최대 10회의 엔진오일 무상 교체 혜택이 제공된다 .에스컬레이드 롱바디 모델은 현금 할인이 추가 적용된다.    KG모빌리티(003620)는 국내 최고 수준의 중고차 잔존 가치를 보장하는 ‘슬림페이 플랜 할부 프로그램’을 운영한다. 선수금(0~30%)에 따라 3.9%~4.5% 금리의 36개월~60개월 할부가 가능하다. 토레스 하이브리드, 액티언 하이브리드 등이 대상이다.  △액티언 △토레스(VAN 포함) △렉스턴 뉴 아레나 △무쏘 스포츠&칸 △티볼리 △코란도 등 주요 차종은 선수금(0~50%) 조건에 따라 0%(무이자)~5.3% 금리의 12~72개월 할부 프로그램을 이용할 수 있다.  아울러 전기차인 무쏘 EV와 토레스 EVX도 선수금(0~50%)에 따라 0%(무이자)~5.3% 금리가 적용돼 12~72개월 할부로 구매할 수 있다.",https://n.news.naver.com/mnews/article/011/0004564235
