날짜,제목,본문,링크
2025-12-01 12:35:00,‘윈터 롯데 잡카페’ 부산서 열려…부울경 취준생 지원,[서울경제]  롯데가 부산·울산·경남 지역 취업준비생을 위한 채용 박람회를 오는 4일 오후 12시부터 5시까지 롯데호텔 부산 42층에서 연다. 1일 시작하는 ‘예측 가능한 수시채용’과 연계한 행사다.  서울 외 지역에서는 유일하게 부산에서 열린다. 부울경 취업준비생에게 양질의 채용정보를 제공하려는 취지에서다.  ‘커리어 타임’ 콘셉트로 직무 탐색부터 자기소개서 컨설팅까지 지원한다. 실제 취업 과정에 필요한 프로그램을 구성해 실질적인 도움을 제공한다는 방침이다.  참여 계열사는 롯데자이언츠·롯데백화점·롯데호텔 등 10개사다. 롯데면세점·롯데월드·롯데GRS·롯데건설·롯데정밀화학·롯데이노베이트·롯데바이오로직스도 참여한다. 14개 직무 채용담당자와 현직자들이 취준생과 직접 소통한다.  계열사별 홍보 부스에서는 사업 현황과 인재상을 소개한다. 채용설명회와 1대1 직무 상담 등도 운영한다. 외부 전문가의 자기소개서 컨설팅과 채용 상담으로 커리어 계획 수립을 돕는다는 계획이다.  롯데 관계자는 “부울경 취준생에게 양질의 채용정보를 제공하고자 한다”며 “지역에서 편하게 채용정보를 접할 수 있도록 프로그램을 발전시키겠다”고 말했다.  롯데는 1일부터 ‘예측 가능한 수시채용’을 시작했다. 12개 계열사가 참여해 영업·마케팅·상품기획 등 30여개 직무에서 신입사원을 모집한다. 롯데홈쇼핑은 스펙을 보지 않는 ‘아이엠 전형’으로 PD 직무 인재를 선발한다.,https://n.news.naver.com/mnews/article/011/0004562067
2025-12-01 12:22:00,"""왜 남자만 군대 가냐, 여자도 보내자"" 투표했지만…유권자 84%가 반대한 '이 나라'","[서울경제]  유럽 안보 위기가 고조되는 가운데 중립국 스위스에서도 병역 확대 논의가 이뤄졌지만, 여성에게까지 의무 복무를 적용하자는 안건이 국민투표에서 압도적으로 부결됐다.  지난달 30일(현지시간) AP통신 등 외신에 따르면 스위스 유권자의 84%는 이날 마감된 국민투표에서 남성에게만 적용되던 징병제를 여성에게까지 확대하는 내용의 ‘시민 복무 이니셔티브’에 반대표를 던졌다.  해당 제안은 여성도 남성과 마찬가지로 군대·민방위대·기타 형태의 국가 복무를 수행해야 한다는 내용을 담고 있다. 현재 여성은 자발적으로만 참여할 수 있는데, 이를 의무화하고 군·민방위를 넘어 ‘국가 안보’ 개념을 더 넓게 적용하자는 취지였다.  찬성표를 던진 유권자들은 지지자들은 산사태·홍수·사이버 공격·에너지 부족 위험·유럽 내 전쟁 가능성 등을 거론하며 이 계획이 “각자가 위기에 맞서는 강한 스위스를 만드는 책임을 나누는 길”이라고 주장했다.  이 안을 주도한 노에미 로텐은 AFP에 이 발의안이 “진정한 평등”을 목표로 한다고 밝혔다. 그는 “현행 제도가 남성에게도, 군 복무 중 쌓는 인맥과 경험에서 배제되는 여성에게도 차별적”이라며 ""군대, 민방위, 자원 소방대 등 어떤 형태로든 모든 청년이 공동체 복지에 기여하는 게 이 발의안의 취지""라고 설명했다.  반면 스위스 정부는 여성 병역 의무 확대에 꾸준히 반대해 왔다. 정부는 군대와 민방위에 이미 충분한 인력이 확보돼 있고 불필요한 추가 모집은 노동력 감소와 비용 증가를 초래할 수 있다고 지적했다.  정부는 또 여성 의무 복무에 대해 ""겉으로는 성평등을 향한 한 걸음처럼 보일 수 있지만, (실제로는) 아이 돌봄, 가족 돌봄, 가사 노동 등 무급 노동 대부분을 이미 부담하고 있는 여성들에게 추가적인 짐을 지우게 될 것”이라고 우려를 표했다.  이날 스위스 시민들은 이른바 ‘슈퍼 리치’ 과세안도 함께 부결시켰다. 최종 집계 결과 유권자의 78% 이상이 반대했다. 스위스 사회당 청년부가 발의한 이 법안은 기후 대응 자금 마련을 위해 5000만 스위스 프랑(약 912억 원) 이상의 재산에 50%의 상속세를 부과하는 내용으로, 법안이 시행될 경우 약 2500가구가 대상이 될 것으로 추정됐다.  법안 발의자들은 이를 통해 연간 60억 스위스 프랑(약 11조원)을 확보해 건물 리모델링·재생에너지 개발·대중교통 확충 등 경제 전반의 ‘친환경 전환’에 투자할 수 있다고 주장했다. 그러나 반대 측과 정부는 고액 자산가들이 조세 회피를 위해 해외로 빠져나갈 가능성을 경고하며 “국가 경제 기반이 약화될 수 있다”고 반박했다.",https://n.news.naver.com/mnews/article/011/0004562066
2025-12-01 12:21:00,"동서대 RISE 사업단, 지산학 협력 본격화","[서울경제]  동서대학교가 지역산업 혁신성장을 위한 산학협력 체계를 본격 가동한다.  동서대 RISE사업단은 최근 주례캠퍼스 소향아트홀에서 ‘동서대 RISE 사업 지산학협의체 발대식’을 개최했다고 1일 밝혔다.  부산시와 부산라이즈혁신원, 연구기관, 지역 기업 100여개 사 등 150여명이 참석했다. 동서대 학생 300여명도 함께했다.  지산학협의체는 문화관광·디지털테크·바이오헬스 등 지역 산업을 선도할 산학협력 플랫폼으로, 부산형 RISE 사업의 지산학 생태계 조성의 출발점이 될 것으로 기대받는다.  동서대는 이 자리에서 지역 기반 산학협력 전략과 협의체 운영 로드맵을 공개했다. BIG3 산업 정주인력 양성과 AX 기반 BIG3 산업 R&BD 혁신을 중점 추진한다는 방침이다. BIG3는 문화관광, 디지털테크, 바이오헬스 분야다.  산·학·연·관 협력체계 구축과 지산학협의체 확산 방안도 발표했다. 지역 정주인력 양성, AX 혁신기술 개발, BIG3 산업 창업을 단계적으로 확산할 계획이다.  RISE 사업은 교육부가 추진하는 지역혁신 신모델이다. 대학이 지역문제 해결과 산업혁신의 중심 역할을 수행하도록 지원한다. 동서대는 부산 RISE 체계의 핵심 역할을 맡고 있다.  장제국 동서대 총장은 “지산학협의체는 부산형 혁신 생태계 모델이 될 것”이라고 말했다. 그는 “산업현장에 실질적 도움이 되는 프로젝트로 지역경제 경쟁력 강화에 앞장서겠다”고 말했다.",https://n.news.naver.com/mnews/article/011/0004562065
2025-12-01 12:11:00,"경찰 ""쿠팡 협박 이메일 IP 추적 중… 용의자 특정은 아직""","[서울경제]  국내 전자상거래 1위 업체 쿠팡에서 사실상 모든 가입 고객의 개인정보가 무단으로 유출되는 대규모 사고가 발생한 가운데 경찰이 고객들과 쿠팡 고객센터에 전달된 ‘협박 메일'의 IP를 추적하고 있다.  1일 서울경찰청 관계자는 서울 종로구 내자동에서 진행된 정례 기자간담회를 통해 “현재 쿠팡 측으로부터 서버 로그기록 제출 받아 분석 중”이라며 “서울청 사이버수사과장을 팀장으로 해서 집중 수사에 나설 방침”이라고 밝혔다.  현재까지 피의자의 국적이나 쿠팡 근무 여부, 협박성 이메일 발신 여부 등은 파악되지 않았다. 다만 경찰은 모든 가능성을 열어두고 용의자를 특정하겠다는 방침이다. 일각에서 용의자가 중국 국적자라는 주장이 제기된 것과 관련해 경찰 관계자는 “현재 용의자는 특정하는 중이며 중국 국적 직원의 소행이라는 점은 확인되지 않았다”라며 “용의자가 특정이 돼 국제공조가 필요하다면 요청하고 범죄인인도신청 등도 고려할 것”이라고 밝혔다. 앞서 쿠팡 측은 자사에서 근무하다 퇴사한 중국인 직원이 강력한 용의자라고 지목한 바 있다.  경찰은 이달 16일 일부 고객의 이메일과 이달 25일 쿠팡 고객센터에 “회원들의 개인정보를 보유하고 있다. 보안을 강화하지 않으면 (정보) 유출 사실을 언론에 알리겠다”는 내용의 협박성 이메일이 온 것과 관련해 경찰은 발신 지역 특정을 위해 IP 추적을 진행하고 있다. 용의자와 메일 발송자가 동일인인지는 확인되지 않았다.  경찰은 지난달 18일 일부 고객이 협박성 메일을 받았다는 사실을 인지해 쿠팡에 확인한 뒤 입건 전 조사(내사)에 착수했다. 당시 쿠팡이 밝힌 피해 규모는 4500여 명 수준이었다. 이후 25일 쿠팡 측 역시 협박 이메일을 받자 쿠팡은 서울경찰청 측에 정보통신망 침입 혐의로 '성명불상자'를 수사해달라는 고소장을 접수했다. 경찰은 정식 수사로 전환해 이달 28일 고소인 조사를 진행했다. 경찰은 필요시 고소인 추가 조사를 진행할 방침이다.   ; 경찰 ""쿠팡 협박 이메일 IP 추적 중… 용의자 특정은 아직""",https://n.news.naver.com/mnews/article/011/0004562063
2025-12-01 12:07:00,"운전면허 도로 연수, 이제 집 앞에서도 가능해진다","[서울경제]  운전면허를 취득한 초보운전자들이 앞으로는 집이나 직장 인근에서도 운전학원 도로 연수 교육을 받을 수 있게 된다. 기존에 운전 학원을 직접 찾아가 지문 등록·수강 신청을 거쳐야만 교육이 가능해 불편이 컸던 점을 개선한 것이다. 운전학원 운영비 절감으로 인해 수강료 인하 효과도 있을 것으로 기대된다.  경찰청은 도로교통법 시행령·시행규칙이 개정·공포되면서 2일부터 이같이 도로 연수 환경이 바뀐다고 밝혔다.  기존에는 직접 학원을 방문해야 했다면 이젠 도로 연수 강사가 학원 차량을 직접 교육생이 원하는 장소로 이동해 교육을 진행할 수 있도록 허용됐다. 교육 장소 역시 학원이 정한 코스 외에 교육생 주거지, 직장 인근 등 실주행이 필요한 구간에서 받을 수 있다.  도로 연수 교육용 차량 규제도 완화된다. 기존에는 도로 주행 교육 표지·도색 기준을 충족한 특정 차량만 사용 가능해 차종 다양화에 한계가 있었으나, 앞으로는 경차·중형차·대형차 등 다양한 차종을 활용한 맞춤형 교육도 가능해진다. 경찰청은 교육생이 체계적인 교육을 받을 수 있도록 표준 운영안을 함께 제공했다.  이번 조치로 수강료 부담도 낮아질 것으로 예상된다. 현재 10시간 도로 연수 비용은 평균 약 58만 원 수준이지만, 차량과 강사 규제 완화로 운전학원 운영비 절감이 가능해지면서 교육비 인하가 뒤따를 것으로 경찰청은 내다보고 있다.  방문 연수 제도는 학원 준비 절차가 마무리되는 이달 중순부터 시행될 전망이다.  김호승 경찰청 생활안전교통국장은 ""운전 교육의 품질을 높이고, 수강생에게 최대한 편의 제공과 교육비 부담을 최소화함으로써 초보운전자가 안전하게 운전 교육을 받을 수 있는 환경을 조성해 교통사고 예방에 이바지할 것""이라며 ""앞으로도 안전한 교통환경 조성에 최선을 다할 것""이라고 말했다.",https://n.news.naver.com/mnews/article/011/0004562062
2025-12-01 12:06:00,"日 정부, 외국인 부동산 소유 ""국적등록 의무화"" 추진","[서울경제]  일본 정부가 외국인의 부동산 소유 실태를 국가 차원에서 통합 관리하는 데이터베이스(DB) 구축을 추진하는 한편 부동산 취득 시 국적 제출 의무를 확대한다. 다카이치 사나에 총리가 지난달 4일 외국인 토지 취득 실태 파악과 제도 검토를 관계부처에 지시한 데 따른 것이다.  1일 요미우리신문에 따르면 일본 정부는 부처 협의를 거쳐 2027회계연도 중 DB 운용을 시작할 계획이다. 정보 등록 대상은 아파트 등 일반 부동산 등기부터 산림, 농지, 국경 도서와 방위 시설 주변 등 중요 토지까지 폭넓게 포함된다.  이번 통합 DB 도입을 계기로 외국인의 부동산 취득을 겨냥한 신고 요건도 강화한다. 현재 농지 취득 시에는 국적 신고가 필수지만 일반 부동산 등기에는 국적 제출 의무가 없다. 또한 외국 자본이 일본 기업을 통해 부동산을 매입하는 경우 실소유자를 파악할 수 있도록 법인 취득 시 주요 주주·임원의 국적 신고도 요구할 방침이다. 해외 거주 외국인의 일본 내 부동산 취득 역시 현재는 외환법상 일부 투자 목적에 한해 신고 대상이지만 범위가 확대될 것으로 보인다.  일본 정부가 투명성 제고에 나선 배경에는 외국인의 토지 매입 확대에 대한 사회적 우려가 있다. ‘외국인이 일본 땅을 매점하고 있다’거나 ‘수원지를 사들여 지하수를 채취하고 있다’ 같은 주장과 함께 외국인의 투기 목적 구매가 아파트 가격 폭등으로 이어지고 있다는 비판 여론도 적지 않다.  국적 정보를 명확히 파악할 수 있게 되면 세율 차등 부과, 취득 제한 조건 설정 등 정책의 선택지도 다양해질 것으로 전망된다. 일본 정부는 내년 1월 공개될 예정인 외국인 정책 기본 방침에 관련 규제 방향을 반영할 계획이다.  지난해 참의원 선거에서 ‘일본인 퍼스트’를 앞세운 참정당이 선전한 후 유사한 정책 기조를 강화하며 ‘반(反)외국인 정책’으로 보수층 결집을 시도하는 흐름이 두드러지고 있다는 평가가 나온다.   ; 日 정부, 외국인 부동산 소유 ""국적등록 의무화"" 추진",https://n.news.naver.com/mnews/article/011/0004562061
2025-12-01 12:05:00,"뚱뚱한 사람, '이 주스' 60일 마셨더니 배가 '쏙'…몸속 지방 태우는 유전자 작동 [건강UP]","[서울경제] 몸·마음·생활… 무분별한 정보는 많고 건강해야 할 곳도 많습니다. 어려운 건강 지식도 쉽고 정확하게 UP! 해드립니다 <편집자주>     같은 오렌지주스를 마셔도 체중에 따라 체내 유전자 반응이 전혀 다르게 나타난다는 연구 결과가 발표됐다. 과체중인 경우 지방 대사 관련 유전자가, 정상 체중에서는 염증 조절 유전자가 주로 활성화되는 것으로 확인됐다.  지난달 30일(현지시간) 과학전문매체 스터디파인즈에 따르면 브라질 상파울루대와 미국 노스캐롤라이나주립대 공동연구팀은 20~30대 건강한 성인 20명을 대상으로 60일간 매일 오렌지주스 2컵을 섭취하게 한 뒤 혈액 분석을 실시했다. 연구팀은 실험 전후 채취한 혈액 샘플에서 면역세포의 유전자 활성화 패턴을 관찰했다.  분석 결과 오렌지주스는 단백질 생성과 관련된 1700개 이상의 유전자 활동을 변화시켰다. 이는 혈압 조절, 지방 대사, 염증 반응, 세포 신호전달 등 다양한 생리 기능에 영향을 미치는 것으로 나타났다.  연구진이 참가자를 체중별로 분류해 분석하자 흥미로운 차이가 드러났다. 과체중 그룹에서는 지방세포 생성 및 분해 관련 유전자가 활성화됐다. 특히 GSK3B와 GRK6 유전자는 이 그룹에서만 활동 변화를 보였다. 지방세포 발달과 지방 처리 과정을 조절하는 마이크로RNA 역시 영향을 받았다. 과체중인 사람들의 경우 오렌지주스가 지방 대사 시스템에 집중적으로 작용하며, 비만 관련 유전자와 백색 지방세포 생성 유전자의 활동을 감소시키는 것으로 확인됐다.  반면 정상 체중 그룹은 염증 관련 유전자에서 주요 변화가 관찰됐다. 특히 인터루킨 계열 신호전달 물질과 관련된 유전자에 집중됐다. STAT3, MAPK1, BCL2 등의 유전자가 변화했으며, 관련 마이크로RNA도 영향을 받았다. 오렌지주스는 체내 주요 염증 조절자인 NF-κB의 활동을 낮추고, 이와 연결된 여러 유전자의 활동 수준을 감소시켜 염증 경로를 진정시키는 효과를 나타냈다.  두 그룹 모두에서 공통으로 변화한 유전자도 있었다. 혈압 관련 유전자는 체중과 무관하게 영향을 받았으며, 고혈압 환자에게서 높게 나타나는 것으로 알려진 일부 유전자도 포함됐다. 특히 SGK1 유전자는 연구진의 주목을 받았다. 이 유전자의 활동 저하는 혈압 상승 억제에 도움이 될 수 있는데, 오렌지주스는 두 그룹 모두에서 SGK1을 감소시켰다. 약 950개 유전자가 체중과 관계없이 동일하게 변화해 오렌지주스의 보편적 효과를 확인할 수 있었다.  연구팀은 오렌지주스의 어떤 성분이 유전자 변화를 유발하는지 규명하고자 했다. 오렌지주스에 함유된 플라바논 화합물은 체내에서 작은 분자로 분해돼 혈류에 유입된다. 컴퓨터 시뮬레이션을 통해 이 분해 산물이 유전자 발현을 조절하는 스위치 단백질에 결합하는지 검증한 결과, 플라바논 분해 산물이 NF-κB, PPAR-α 등의 조절 단백질에 실제로 결합할 수 있음이 확인됐다.  이는 소량의 플라바논이 다수의 유전자에 동시에 영향을 미칠 수 있다는 의미다. 연구진은 오렌지주스가 작용할 수 있는 38개 이상의 유전자 조절 스위치를 확인했다. 또한 단백질을 직접 생성하지는 않지만 다른 유전자를 조절하는 유전자 조절자에도 변화가 나타나, 오렌지주스가 개별 유전자뿐 아니라 전체 유전자 조절 네트워크에 영향을 미친다는 사실을 확인했다.",https://n.news.naver.com/mnews/article/011/0004562060
2025-12-01 12:03:00,서학개미外 기관도 줄줄이 해외로…3분기 외화증권투자 247억 달러↑,"[서울경제]  올해 3분기 중 국내 기관투자가들의 외화 증권 투자 잔액이 247억 달러 가량 늘었다. 미국 등 주요 국가의 주가가 상승해 평가 이익이 크게 늘고 순투자 금액도 증가한 영향이다.  한국은행이 1일 발표한 ‘2025년 3분기 중 주요 기관투자가의 외화증권투자 동향’에 따르며 지난 9월 말 기준 주요 기관투자가의 외화증권투자 잔액은 4902억 1000만 달러로 집계됐다. 올 3분기 중 246억 7000만 달러(5.3%) 늘었다. 증가폭은 올 2분기(+347억 4000만 달러), 2020년 4분기(+247억 달러)에 역대 3위다. 또 작년 4분기 69억 7000만 달러 감소 이후 올해 들어 3분기 연속 증가세다.  상품별로 보면 △외국주식(+191억 3000만 달러) △외국채권(46억 6000만 달러) △코리안 페이퍼(외화표시증권·8억 8000만 달러) 등이 모두 늘었다.  외국주식은 주요국 주가 상승에 따른 평가이익에 자산운용사를 중심으로 한 순투자가 더해지면서 증가했다. 실제로 올 3분기 중 미국 S&P500 지수는 7.8%, 나스닥은 11.2%, 일본 닛케이225 지수는 11% 상승했다.  외국채권은 미 연준의 금리인하 등에 따른 미 국채금리 하락으로 평가이익이 발생하고, 보험사 및 증권사를 중심으로 순투자가 지속되면서 늘었다. 한국 정부나 금융기관, 기업 등이 해외 금융시장에서 발행하는 외화표시증권은 외국환은행과 증권사를 중심으로 잔액이 늘었다.  투자주체별로는 △자산운용사(+178억 5000만 달러), 보험사(+33억 6000만 달러), 증권사(+20억 1000만 달러), 외국환은행(14억 6000만 달러) 등 모두 투자잔액이 증가했다.   ; 서학개미外 기관도 줄줄이 해외로…3분기 외화증권투자 247억 달러↑",https://n.news.naver.com/mnews/article/011/0004562059
2025-12-01 12:01:00,"아직도 해외 고액알바 유인글이…경찰 ""233건 삭제 요청, 캄보디아 TF 28명 검거""","[서울경제]  한인 캄보디아 납치·감금 사태를 수사 중인 경찰이 고액알바를 미끼로 해외 취업을 유인하는 게시글 233건을 유관기관에 삭제 요청했다고 밝혔다.  1일 서울 종로구 서울경찰청 청사에서 열린 정례 기자간담회에서 서울경찰청 관계자는 “해외 고액 알바 유인글 233건과 (유인글이 올라온) 63개 사이트에 대해 방송통신심의위원회 등에 관리 협조 요청 공문을 발송했다”고 밝혔다.  캄보디아 범죄를 전담하는 서울경찰청 집중수사 태스크포스(TF)는 현재 관련 사건 32건을 수사 중이다. 서울경찰청은 당초 연관된 사건 81건을 접수해 36건을 종결했고, 이 중 17건을 TF로 이관해 들여다 보고 있다. TF는 캄보디아 관련자 28명을 검거했고 이 중 12명이 구속됐다.  캄보디아 범죄 거점으로 지목되는 ‘태자단지’를 운영한 프린스그룹 관계자는 총 3명이 입건된 상태다. 경찰이 입건한 이들은 프린스그룹 한국 연락사무소에서 근무하던 책임자 등이다. 경찰은 금융위원회 산하 금융정보분석원(FIU)과 국세청에도 자료를 요청하는 등 유관기관과의 협력을 통해 이들이 국내에서 연락사무소를 설치한 경위 등을 조사하고 있다.  다만 불법 자금의 세탁 통로가 된 캄보디아 금융그룹 후이원그룹에 대해서는 아직 입건된 사람이 없는 것으로 파악됐다. 경찰 관계자는 “관련 자료를 분석하고 후이원 국내 환전소의 운영자와 종업원을 조사할 예정”이라고 밝혔다.",https://n.news.naver.com/mnews/article/011/0004562058
2025-12-01 12:01:00,"3대 신용평가사 피치, 2일 방한…""국가신용등급 평가 받는다""","[서울경제]  국제 신용평가사 피치(Fitch)가 한국의 국가신용등급 평가를 위해 2일부터 사흘간 연례협의를 실시한다.  기획재정부는 피치 연례협의단이 12월 2일부터 4일까지 방한해 한국 정부 및 주요 기관과 국가신용등급 평가를 위한 연례협의를 진행한다고 1일 밝혔다.  이번 협의단은 제레미 주크 아태지역 국가신용등급 담당 이사와 사가리카 찬드라 이사 등으로 구성됐다. 피치는 현재 한국의 국가신용등급을 ‘AA-’, 등급 전망은 ‘안정적’으로 유지하고 있다.  피치 협의단은 방한 기간 동안 기재부를 포함한 정부 부처와 한국은행, 대외경제정책연구원(KIEP), 한국개발연구원(KDI) 등 국책연구기관 및 민간 주요 기관을 방문할 예정이다.  주요 논의 대상은 한국의 거시경제 상황과 전망, 재정운용 방향, 통상 환경을 포함한 대외경제 현안 등이다. 피치는 매년 1회 한국을 방문해 경제 상황을 진단하고, 이를 바탕으로 국가신용등급을 결정해 왔다.  이번 연례협의 결과에 따른 한국의 국가신용등급 및 전망은 내년 상반기 중 발표될 것으로 예상된다. 피치는 올해 2월 한국의 국가신용등급 평가 결과를 발표한 바 있다.  정부는 이번 협의에 체계적으로 대응하는 한편, 한국 경제의 견고함을 강조하기 위해 고위급 면담도 진행한다. 기재부는 구윤철 부총리 겸 기획재정부 장관과 피치 연례협의단과의 대면 면담을 추진할 예정이라고 밝혔다.  이런 가운데 무디스와 스탠더드앤드푸어스(S&P)는 한국의 신용등급을 각각 ‘Aa2(안정적)’, ‘AA(안정적)’로 평가하고 있다.",https://n.news.naver.com/mnews/article/011/0004562057
