날짜,제목,본문,링크
2025-12-18 17:31:00,"달라진 우리금융…해외법인장에 ‘젊은 피’, 계열사 임원은 내부승진 [S마켓 인사이드]","[서울경제]  동양생명과 ABL생명이 다가오는 연말 임원인사에서 전문성과 보험업에 대한 이해도를 최우선 기준으로 두기로 했다. 7월 우리금융그룹의 자회사로 편입됐지만 은행 출신 낙하산 인사보다는 보험사의 가치를 극대화할 수 있는 최적의 인물을 뽑겠다는 것이다.  이는 우리금융그룹의 비은행 자회사 임원 선임 기준이 과거와 확연히 달라졌음을 보여주는 대표 사례다. 나눠 먹기가 아닌 실용주의에 기반한 능력 위주 인사를 하겠다는 뜻이다. 금융계의 고위 관계자는 “은행 출신 고위 임원을 사업 연관성이 낮은 비은행 자회사 요직으로 내려보내는 인사가 일반적”이라며 “퇴직자를 예우하고 은행 중심의 경영을 공고하게 한다는 측면이 있지만 자회사의 전문성을 저해하고 직원들의 사기를 꺾는 부작용이 있다”고 지적했다.  우리금융그룹의 조직·인사 문화가 바뀌고 있다. 임종룡 우리금융그룹 회장 취임 이후 계속된 노력의 성과가 나타나고 있는 것이다. 시장에서는 옛 한일과 상업은행 출신으로 나뉘어 자리다툼을 벌이던 모습은 옛말이 됐다는 말이 나온다.  18일 금융계에 따르면 우리금융그룹의 16개 계열사 가운데 외부 출신은 약 43.7%(7곳)에 달한다.  정진완 우리은행장은 은행 출신이지만 성대규 동양생명 대표와 진성원 우리카드 대표, 남기천 우리투자증권 대표 등은 밖에서 왔다. 현재 우리금융은 계열사 최고경영자(CEO)는 전문성을 갖춘 인사, 임원은 내부 출신을 중용하고 있다. 특히 2금융권은 은행과 업의 성질과 내용이 크게 다르다. 은행과 달리 카드사는 소비와 마케팅에 특화돼 있고 증권사는 원금이 보장되지 않는 투자 상품을 다룬다. 우리금융은 자회사의 인사권을 보장하기 위해 지난해 말 자회사 임원 선임 시 지주 회장과의 사전 협의 제도를 폐지했다. 금융계의 또 다른 관계자는 “비은행 부문은 은행과는 완전히 다른 문법으로 작동한다”며 “내부 승진을 통해 검증된 전문가를 기용하고 열심히 하면 CEO까지 갈 수 있다는 희망은 자회사 직원들에게 강력한 동기부여가 될 것”이라고 설명했다.  이뿐만이 아니다. 지금까지 부행장급 인사가 마지막에 거쳐가는 자리였던 우리은행의 해외법인장에 ‘젋은 피’가 수혈되고 있다. 인도네시아우리소다라은행에는 A 본부장이 내정됐고 베트남우리은행의 경우도 B 본부장이 공식 인사를 기다리고 있다. 캄보디아우리은행도 본부장급인 C 씨가 내정된 상태다. 우리은행의 경우 러시아와 브라질, 유럽우리은행 등은 부장급이 법인장이다. 은행 해외지점의 꽃인 우리은행 뉴욕지점장은 해외 경영학석사(MBA) 채용으로 입행한 권오희 지점장이 맡고 있다. 트렌드에 민감한 젊은 리더를 중심으로 보은형 인사가 아닌 실질적인 영업 성과를 내기 위한 의도다. 우리금융의 관계자는 “단순한 세대교체를 넘어 우리금융이 추구하는 실용주의 경영의 일환”이라며 “단순한 인사 이동이 아닌 전문성과 성과를 핵심으로 한 조직 문화 혁명”이라고 전했다.",https://n.news.naver.com/mnews/article/011/0004569005
2025-12-18 17:31:00,[단독]보험사 ‘기본자본 킥스’ 도입방안 내년 1월 나온다,"[서울경제]  보험사의 가장 기초적인 자본 건전성을 보여주는 기본자본 킥스(K-ICS) 도입 방안이 내년 1월에 나온다. 시장에서는 당국이 경과 조치를 도입할 것으로 기대하고 있지만 규제 강화에 따른 자본 관리 부담은 계속 커질 것으로 보인다.  18일 금융계에 따르면 금융위원회와 금융감독원, 생명보험협회·손해보험협회, 생·손보사 등은 22일 보험 업권 기본자본 규제 도입을 위한 협의를 한다.  이 자리에서는 보험 업권의 기본자본 관리 필요성과 기본자본 규제 감독기준(안) 설명이 이뤄질 예정이다. 금융계의 관계자는 “금융 당국이 감독기준안을 설명하겠다고 한 만큼 구체적인 내용을 들을 수 있을 것으로 생각하고 있다”고 전했다. 금융 당국은 이날 업계의 의견을 수렴한 뒤 보험사 기본자본 규제 방안을 내년 1월 초까지 내놓을 예정이다.  기본자본 킥스는 은행의 기본자본 비율과 비슷하다고 보면 된다. 후순위채와 신종자본증권 등 보완 자본을 뺀 기본자본을 따진다. 보험사들의 상당 수가 후순위채 발행을 통해 자본비율을 높여온 만큼 기본자본 킥스의 도입은 부담스러운 부분이 존재한다. 9월 말 현재 한화생명의 킥스 비율은 158.2%지만 기본자본 킥스는 56.9%다. 현대해상 역시 킥스 비율은 179.8%인 반면 기본자본 킥스는 59.7%로 50%대다.  보험 업계는 기본자본 킥스 도입과 관련해 해약 환급금 준비금 적립을 두고 고민이 깊어지고 있다. 해약 환급금 준비금은 시가로 평가하는 보험부채가 해약 환급금보다 부족할 경우 이를 준비금으로 적립하도록 한 것이다. 보험사가 배당 가능 이익 확보를 위해 킥스 비율을 높여 해약 환급금 준비금을 적게 쌓을 경우 되레 기본자본이 빠지는 결과를 낳을 수 있기 때문이다. 현재 보험사들이 해약 환급금 준비금 적립 비율을 낮춰서 쌓을 경우 나머지 차액은 기본자본에서 차감돼 보완 자본으로 분류된다. 이는 기본자본 킥스 비율에 영향을 주게 돼 배당에도 제한이 생길 수밖에 없다.  한편 기획재정부가 보험사의 해약 환급금 준비금이 세수에 미치는 영향을 두고 실태 조사를 벌이고 있는 것으로 파악됐다. 해약 환급금 준비금 급증이 법인세수 감소로 이어질 수 있다는 해석이 제기되고 있어서다. 실제로 기재부는 최근 국내 전 보험 업계를 대상으로 올해 회계연도 말까지의 해약 환급금 준비금 적립 현황 관련 자료를 요청했다.",https://n.news.naver.com/mnews/article/011/0004569004
2025-12-18 17:31:00,"HUG, 부산 지역 공공기관과 '임직원 이해충돌 방지' 협력","[서울경제]  주택도시보증공사(HUG)가 부산 지역 공공 기관과 임직원 이해충돌 방지 인식 확산에 나섰다.  HUG는 ‘청렴웨이브 합동 이해충돌방지 다짐대회’ 행사를 개최했다고 18일 밝혔다. 청렴웨이브는 HUG, 한국자산관리공사, 한국남부발전, 부산항만공사, 한국수산자원공단 총 5개 부산소재 공공기관이 소속된 윤리경영 협의체다.  이번 행사는 부패 취약시기인 연말연시를 맞아 반부패·청렴 인식의 중요성을 환기하고 이해충돌 방지를 다짐하기 위해 마련됐다. 5개 기관의 임원진은 출근하는 임직원들에게 직접 이해충돌방지법 및 청탁금지법 문구가 담긴 ‘이해충돌 Free 쿠키’를 전달했다.  윤명규 HUG 사장직무대행은 “청렴은 공직자의 기본 소양이자 국민과의 약속이라고 생각한다”며 “앞으로도 국민 눈높이에 맞는 깨끗한 공직문화 확산을 위해 노력하겠다”고 말했다.",https://n.news.naver.com/mnews/article/011/0004569003
2025-12-18 17:31:00,흥국화재 대표에 김대현…생명은 김형표 내정,"[서울경제]  태광그룹이 18일 김대현 흥국생명 대표를 흥국화재 대표이사로, 김형표 흥국생명 경영기획실장을 흥국생명 대표이사로 각각 내정했다고 밝혔다.  김대현 흥국화재 대표 내정자는 손해보험 업권에서 30년 넘게 근무한 보험 전문가다. 김형표 흥국생명 대표 내정자는 흥국생명 내부에서 기획·재무·감사 조직을 두루 거친 ‘재무통’이다. 태광그룹 관계자는 “불확실한 경영 환경 속에서 보험 업계 경쟁이 한층 심화하고 있다”며 “각 업권에서 경험과 전문성을 갖춘 인사를 적소에 배치해 계열사 경쟁력 제고에 집중할 계획”이라고 말했다.",https://n.news.naver.com/mnews/article/011/0004569002
2025-12-18 17:29:00,"李대통령 ""대전·충남통합…지선서 통합단체장 뽑자""",[서울경제]    이재명 대통령이 18일 대전·충남 지역 여당 의원들과 만나 “지방선거에 (대전·충남이) 통합된 자치단체의 새로운 장을 뽑을 수 있게 해야 한다”며 지선 전 대전·충남 통합의지를 강조했다. 앞서 김민석 국무총리가 해당 지역 의원을 만나 행정 통합 관련 의견을 교환한 데 이어 사흘 만에 이 대통령이 더불어민주당 소속 대전·충남 의원 14명을 다시 호출한 것은 통합에 속도를 올려 달라는 당부로 해석된다.  이 대통령은 이날 서울 용산 대통령실에서 이들 의원과 오찬을 갖고 대전과 충남 통합자치단체의 시너지를 강조했다. 강유정 대통령실 대변인은 서면 브리핑을 통해 이 대통령이 “지방정부의 통합이 쉽지 않지만 복잡한 정치적 이해관계를 넘어서는 정책적 판단이 필요하다”고 말했다고 전했다. 강 대변인은 “해당 의원들이 향후 충북까지 포함할 수 있는 준비 기구 내지는 특위의 당내 설치를 요청하기로 의견을 모았다”며 “대전·충남 통합 관련법 발의 및 지역 주민들의 의견을 수렴할 방안을 논의했다”고 전했다.  이 같은 통합 속도는 이재명 정부가 이른바 ‘5극 3특’을 추진하는 가운데 국민의힘 소속의 이장우 대전시장과 김태흠 충남지사 역시 일찌감치 대전·충남 통합을 주장해 여야 반대 없이 국정과제를 실행할 수 있다는 판단이 크게 작용하고 있다. 이 시장과 김 지사는 지난해 11월 21일 ‘통합 지방자치단체’출범 추진을 위한 공동 선언문에 서명했다.  다만 겉보기와 달리 속사정은 복잡하다. 현 광역단체장으로서 통합 이슈를 주도해 각각 시장과 지사 재선에 도전하려던 이 시장과 김 지사 측은 1년 새 여야 위치가 바뀐데다 이 대통령이 적극 통합 이슈를 수용해버리면서 주도권을 빼앗길 상황이다.  지선 전에 대전·충남이 통합이 되면 대전시장과 충남지사 대신 대전충남특별시장 1명을 뽑게 된다. 재선 캠페인 일환으로 준비해왔던 이 시장과 김 지사로서는 지선 전략의 수정이 불가피해진 셈이다.  이 대통령 입장에서는 다소 불리한 해당 지역의 판을 뒤집어 선거 우위를 점하겠다며 속도를 내는 것으로 해석된다. 통합 지자체장은 체급이 한 층 커져 인물 차출도 용이해진다. 당장 충남 아산을 지역구로 뒀던 강훈식 대통령 비서실장이 호명되고 있다. 여당 위치에서 산업생태계의 중복 투자를 막고 국책사업의 집중 투입을 약속해 충청표심을 얻기는 유리할 수 밖에 없다. 여당 보다 먼저 통합을 주장했던 현역 단체장들 역시 하루 아침에 입장을 바꾸기도 어려운 형편이다.  일각에서는 이 대통령이 정원오 성동구청장을 소셜네트워크서비스(SNS)에서 칭찬한 뒤 서울시장 관심도를 높인데 이어 해수부 부산 이전으로 부산민심을 자극하고 이어 대전·충남 통합을 통해 지선 전략의 큰그림을 그리고 있다는 평가가 나오고 있다.,https://n.news.naver.com/mnews/article/011/0004569001
2025-12-18 17:29:00,"호반그룹, 충남 당진서 '교통약자 주차공간' 조성 지원","[서울경제]  호반그룹이 농어촌 지역 교통약자 이동 편의 증진을 위해 주차 공간을 조성한다.  호반그룹은 충남 당진시 ‘교통약자 주차공간 조성 사업’을 지원한다고 18일 밝혔다. 김선규 호반그룹 회장과 오성환 당진시장은 이날 충남 당진시청에서 만나 장애인복지관 이용자의 주차 문제 해소 등을 논의했다.  호반그룹은 당진시 장애인복지관 주변 1322㎡ 토지에 주차장을 조성할 계획이다. 이 사업은 호반그룹의 농어촌상생기금을 활용해 총 10억 원의 예산을 들여 민관 협력으로 진행된다. 호반그룹은 2018년부터 상생협력기금을 조성해 다양한 상생 활동을 펼쳐왔다. 호반그룹과 당진시는 기금 출연과 조성 공사 관련 심의 등 구체적인 준비 절차를 연내 마치고 사업을 추진할 예정이다. 완공 목표 시기는 내년 5월이다.  김선규 호반그룹 회장은 “농어촌 지역 교통약자 이동 편의성 증진에 기여할 수 있게 돼 매우 뜻깊게 생각한다”며 “장애인복지관 주차장 조성 사업을 통해 장애인과 가족들이 더욱 편리하게 복지 서비스를 이용하고, 삶의 질이 향상될 수 있도록 최선을 다해 지원하겠다”고 말했다.",https://n.news.naver.com/mnews/article/011/0004569000
2025-12-18 17:27:00,"“방미통위, 급변하는 미디어 환경서 운영의 묘 발휘해야”","[서울경제]  이재명 정부에서 새로 출범한 방송미디어통신위원회가 급변하는 미디어 환경을 고려해 ‘운영의 묘’를 발휘해야 한다는 제언이 나왔다. 숙의을 통해 오랜 기간을 걸쳐 의사결정을 진행하다 보면 실기할 가능성이 있다는 우려에서다.  김태오 창원대 법학과 교수가 18일 서울 중구 웨스틴조선 호텔에서 '미디어 거버넌스 개편에 따른 방송, 미디어 분야 법정책적 과제’를 주제로 발표했다.  김 교수는 “오늘날 미디어 환경이 숙의를 통해 결정할 사안만 있는 게 아니고 빨리 결정해 위기를 극복해야 할 사안도 많다”면서 “운영의 묘를 발휘해야 한다”고 말했다. 이어 “여전히 우려되는 것은 (방미통위의) 합의제에 치중하다보면 신속한 의사결정 타이밍을 실기할 가능성이 높다는 것”이라고 덧붙였다.  대표적인 미디어 환경의 변화는 넷플릭스를 위시한 온라인동영상서비스(OTT)의 지배력 강화다. 문제는 기존 방송처럼 OTT를 정책적으로 규정하기 어렵다는 점이다. 김 교수는 “OTT는 콘텐츠-플랫폼 혼재형 서비스이므로 기존 잣대로 적용하는 게 불가능하다”면서 “기존의 규제 정당성은 오늘날 더 이상 지지받기 어려우므로 단위 규제 별로 새로운 규제, 기존 규제의 지속, 기존 규제의 강화, 규제폐지 사항을 식별하고 각 규제에 대한 논리적 대응 방안을 마련할 필요가 있다”고 진단했다.    방송미디어통신위원회는 지난 10월 1일 출범한 이후 58일 만인 11월 28일 위원장 후보자와 비상임위원 1명이 각각 지명·위촉되며 정상화의 첫발을 내디뎠다. 옛 방송통신위원회가 위원장을 포함해 5명의 상임위원으로 구성된 것과 달리 방미통위는 위원장을 포함한 3명의 상임위원과 4명의 비상임위원 등 모두 7명의 위원으로 구성된다. 국회 과학기술정보방송통신위원회는 전날 여야 합의로 김종철 방미통위원장 후보자에 대한 인사청문경과보고서를 채택했다.  김 교수는 방미통위 거버넌스와 관련해 “비상임위원 참여를 통해 정책적 전문성이 있을 것”이라고 평가했다.",https://n.news.naver.com/mnews/article/011/0004568999
2025-12-18 17:27:00,'코벤펀드' 세제 혜택 연장…기관 자금도 몰려온다 [시그널],[서울경제] 이 기사는 2025년 12월 18일 16:45 자본시장 나침반  '시그널(Signal)' 에 표출됐습니다.    코스닥 신규 상장기업에 집중 투자하는 정책펀드가 올해 공모주 열기를 한층 더 뜨겁게 만들었다. 공모주는 통상 50% 이상이 전문 기관투자가에 배정돼 기관의 청약 수요와 장기 보유가 기업공개(IPO) 흥행 및 상장 후 주가에 영향을 준다. 올해 기관 수요예측 경쟁률은 대부분 1000대1을 웃돌았고 일정 기간 주식 보유를 약속하는 비율도 과거보다 크게 높아졌다. 정부는 내년 이들 기관을 대상으로 주어지는 정책 혜택을 유지해 연중 풍부했던 IPO 유동성을 꾸준히 이어갈 방침이다.  18일 투자은행(IB) 업계에 따르면 연말 일몰 예정이었던 코스닥벤처펀드 대상 세제 혜택은 2028년 말까지 3년 연장됐다. 코벤펀드는 코스닥 신규 상장기업의 공모주나 벤처기업 신주에 주로 투자하는 일종의 정책펀드다. 코벤펀드 가입자는 투자 기간을 3년 이상 유지하면 최대 300만 원의 소득 공제를 받을 수 있다. 세제 혜택이 종료되면 펀드 가입자가 줄어들 수 있는 구조인데 최근 법령 개정으로 일몰 기한이 연장되면서 펀드 자금이 꾸준히 유지될 기반이 마련됐다.  코벤펀드는 공모주 흥행에 중요한 역할을 한다. 현행 금융투자협회 ‘증권 인수업무 등에 관한 규정’에 따르면 코스닥에 신규 상장하는 기업은 공모주 최소 25%를 코벤펀드에 배정해야 한다. 코벤펀드 결성액이 감소하면 공모주 수요도 줄어들게 되는 구조다. 내년에는 의무 배정 물량이 최소 30%로 높아질 예정이어서 코벤펀드의 역할이 더욱 중요해졌다. 정책 당국은 코벤펀드 대상 세제 혜택을 유지하고 우선 배정 물량을 확대하는 인센티브를 제공하면서 이에 대한 반대급부로 코벤펀드의 공모주 장기 보유를 유도하고 있다. 기관의 장기 보유율이 높아지면 상장 후 주가를 방어하는 데 도움이 된다.  IB 업계 관계자는 “올해 공모주 열기가 뜨거웠던 것은 기관들이 적극적으로 수요예측에 참여하고 주식을 장기 보유했기 때문”이라며 “정책펀드 대상 혜택을 유지하는 것은 공모주 열기를 이어가는 데 필수적”이라고 말했다.   ; “둘 중 하나는 따블↑”…내년에도 공모주 열풍 이어진다 [시그널],https://n.news.naver.com/mnews/article/011/0004568998
2025-12-18 17:26:00,"""위례에 첫 '카이브유보라' 공급""… 반도건설, 위례지구 복합용지 낙찰","[서울경제]  반도건설이 주상복합용지를 낙찰받아 위례신도시에 프리미엄 브랜드 카이브유보라를 공급한다.  반도건설은 18일 서울주택도시공사(SH)가 공급하는 ‘위례 택지개발지구 복합용지 E1-1블럭’ 용지를 최종 낙찰받았다고 밝혔다.  반도건설이 이번에 낙찰받은 ‘위례 택지개발지구 복합용지 E1-1블럭’ 부지는 송파구와 하남시, 성남시가 맞물려 있는 위례신도시 중에서도 북위례에 속하는 송파구 권역이다. 해당 부지에는 전용면적 60~85㎡ 이하 656가구 규모의 주상복합 단지가 들어설 전망이다. 총 대지면적은 2만 631㎡ 규모로 아파트 656가구를 포함한 상업 및 문화복합시설로 조성될 예정이다. 총 사업비는 6000억 원가량이다.  위례지구 주상복합용지 E1-1블럭은 서울 동남권과 수도권 남부를 잇는 교통축에 위치한다. 인근에 지하철 5호선·8호선 환승권역이 형성돼 있으며, 위례선 트램이 현재 공사 진행 중으로 개통 시 부지에 인접한 북위례역을 포함한 위례 내부 접근성과 강남·잠실권 연결성이 한층 강화될 전망이다.  단지 인근에 초·중·고교가 밀집해 있어 교육환경이 안정적이며, 청량산·장지천·근린공원 등 녹지자원이 가까워 주거 쾌적성이 높다. 위례신도시 중심 생활권과 인접해 상업·의료·공공시설 이용이 편리하고, 인접한 의료복합용지에 종합병원(강동성심병원)이 들어설 예정이다.  해당 부지에 공급할 단지는 분양가 상한제 대상이다. 위례신도시의 인근 단지 시세는 3.3㎡당 평균 3000만 원 후반에서 4000만 원 초반대로 가격이 형성돼 있다.  반도건설 관계자는 “위례신도시 첫 입성인 만큼 반도건설의 주택 시공 기술력을 집약한 프리미엄 브랜드 ‘카이브유보라(KAIVE UBORA)’를 공급할 계획”이라며 “위례의 격에 맞는 ‘탁월한 입지·최고급 마감·특화 설계·프리미엄 커뮤니티 시설’을 적용해 입주민의 자부심이 될 수 있는 프리미엄 랜드마크 단지를 조성하겠다”고 밝혔다.",https://n.news.naver.com/mnews/article/011/0004568997
2025-12-18 17:24:00,"‘IPO 삼수생’ 케이뱅크, 내년 코스피 상장 1호 유력 [시그널]","[서울경제] 이 기사는 2025년 12월 18일 15:51 자본시장 나침반  '시그널(Signal)' 에 표출됐습니다.    내년에는 기업가치가 1조 원을 가뿐히 넘는 기업공개(IPO) ‘대어’ 다수가 국내 증시 입성을 노릴 예정이다. 세 번째 IPO 도전에 나서는 케이뱅크와 미국 권선(절연전선) 시장점유율 1위 기업 에식스솔루션즈는 지난달 한국거래소에 코스피 상장 예비심사를 신청했다. SK그룹의 반도체 자회사를 다수 흡수합병하며 체급을 키운 SK에코플랜트는 예심 신청 시기를 저울질하고 있고 이외에도 ‘K엔비디아’를 꿈꾸는 인공지능(AI) 반도체 기업 리벨리온, 국내 리조트 업계 선두 기업 소노인터내셔널이 내년 증시 입성을 추진할 예정이다.  18일 투자은행(IB) 업계에 따르면 케이뱅크·에식스솔루션즈·SK에코플랜트·리벨리온·소노인터내셔널은 내년 신규 상장을 목표로 IPO를 준비하고 있다. 케이뱅크와 에식스솔루션즈가 이미 거래소에 코스피 상장 예심을 신청해 내년 ‘코스피 상장 1호 기업’ 타이틀을 어느 곳이 가져갈지도 관심거리다. 케이뱅크는 앞서 두 차례 예심을 통과한 적이 있는 데다 이번 IPO에서 공모가를 크게 낮출 예정이어서 가장 먼저 코스피 공모 시장에 등장할 가능성이 높다. 시장에서는 2월로 내다보고 있다. 에식스솔루션즈는 ㈜LS의 증손자회사여서 신규 상장에 따른 모회사 주주 보상 구조를 거래소가 보다 면밀히 들여다보는 상황이다.    SK에코플랜트는 내년 초 상장 예심을 신청하는 것이 유력하다. 2022년 재무적투자자(FI)에게 자금을 받는 과정에서 내년 7월까지 증시에 오른다는 계획을 제시해 기한 내 상장하려면 1월에는 거래소 심사가 개시돼야 한다. IPO 추진 기업은 거래소 상장 예심 신청·승인 과정을 거쳐 증권신고서 제출·검토, 기관투자가 대상 수요예측, 일반 청약을 마무리해야 최종 상장 승인을 받아 증시에 오른다. SK에코플랜트는 올 들어 SK머티리얼즈 산하 반도체 소재 기업인 SK트리켐·SK레조낙·SK머티리얼즈제이엔씨·SK머티리얼즈퍼포먼스를 합병하면서 성장 비전을 높였다.  리벨리온은 코스닥 시장의 문을 두드릴 예정이다. 아직 흑자를 내지 못해 코스닥에만 적용되는 기술특례상장 제도를 활용해야 한다. 다만 기술력은 높게 인정받고 있어 목표 밸류에이션(기업가치)으로 3조 원 이상이 거론된다. ‘소노’ 브랜드로 호텔과 리조트를 운영하는 소노인터내셔널은 코스피 입성에 도전할 계획이다. 올해 중순 유가증권시장 입성을 노렸지만 티웨이항공을 인수하며 급증한 부채비율이 문제가 됐다. 이외에도 올해 상장 주관사 선정을 마친 무신사와 FI에 지분을 매각하며 IPO를 약속한 한화에너지, 최근 주관사 선정에 나선 HD현대로보틱스가 상장 추진 후보군으로 꼽힌다.  한 증권사 IPO 본부장은 “올해 코스피지수가 급격히 올랐고 신규 상장기업의 주가 강세가 이어지면서 내년을 상장 적기로 보는 기업이 많은 상황”이라며 “한국거래소가 중복 상장 가이드라인을 제시해 관련 리스크가 줄어들면 IPO를 추진하는 기업은 더 늘어날 것”이라고 전망했다.   ; “둘 중 하나는 따블↑”…내년에도 공모주 열풍 이어진다 [시그널]",https://n.news.naver.com/mnews/article/011/0004568996
