날짜,제목,본문,링크
2025-12-01 17:25:00,"국힘, 吳 기소에 ""지선에 영향 미치려는 노골적 정치공작""","[서울경제]  국민의힘이 1일 이른바 명태균 여론조사 관련 의혹으로 오세훈 서울시장을 기소한 민중기 특별검사팀을 향해 “서울시정을 흔들고 지방선거에 영향을 미치려는 노골적인 정치 공작이자 명백한 지방선거 개입”이라고 비판했다.  박성훈 국민의힘 수석대변인은 이날 오 시장이 정치자금법 위반 혐의로 재판에 넘겨지자 논평에서 이같이 밝히며 “내년 지방선거를 불과 몇 달 앞둔 시점에 현직 시장이자 야당의 유력 후보를 대상으로 정해진 결론을 강제로 끼워 맞춘 흠집 내기용 기소를 밀어붙인 것은 민주당이 설계하고 특검이 집행한 하명수사이자 표적수사 그 자체”라고 강조했다.  박 수석대변인은 특검의 기소를 “논리적 모순과 법적 허점이 가득한, 전형적인 정치 기획 수사의 표본”으로 규정하며 ""특검은 수년 전 선거 과정을 두고 당사자가 일관되게 부인한 사안을 대납 공모라 규정하는 억지 논리를 들이밀면서도 정작 사건의 핵심 고리인 브로커 명태균 씨는 기소하지 않았다""고 짚었다. 오 시장만을 표적 삼은 수사임을 특검 스스로 증명했다는 주장이다.  그는 “상식적으로 납득 불가능한 조치로, 추측과 정황만을 가지고 현직 시장을 기소하는 것은 법치주의에 대한 중대한 도전”이라며 “정치적 이해관계가 걸린 사건만 골라 야당 인사들을 겨냥하고, 정작 대장동 사건과 같이 이재명 대통령을 향한 의혹에는 항소 포기 등으로 눈을 감는 이중 잣대는 반드시 심판받아야 한다”고 목소리를 높였다.  박 수석대변인은 “국민의힘은 정치 특검의 비열한 정치 공작에 절대 굴복하지 않을 것이며 모든 정치적 모략에 대해 강력히 투쟁할 것을 강력 경고한다”며 “법과 상식을 벗어난 특검의 정치적 기소에 대한 책임을 끝까지 묻겠다”고 했다.",https://n.news.naver.com/mnews/article/011/0004562192
2025-12-01 17:23:00,"이크레더블·나이스디앤비, 코스닥 우수 전문평가기관으로 선정","[서울경제]  한국거래소가 2025년 코스닥 우수 전문평가기관으로 이크레더블(092130)과 나이스디앤비(130580)를 선정해 시상했다고 1일 밝혔다.  거래소는 코스닥 기술평가의 전문성, 평가 품질 등 정성·정량 평가를 거쳐 2개 기관을 우수 전문평가기관으로 선정했다.  전문평가기관은 코스닥시장 기술특례 상장에 필요한 기술평가를 위해 거래소가 선정한 평가기관이다. 현재 기술신용평가기관(TCB) 8사, 국책연구기관 18사로 이뤄진 총 26사 전문평가기관이 기술성과 시장성 평가 업무를 수행하고 있다.  민경욱 거래소 코스닥시장본부장은 “코스닥 기술특례상장의 신뢰 구축에 있어 전문평가기관의 역할이 매우 중요하다”며 “앞으로 AI(인공지능), 반도체, 바이오 등 높은 기술력을 갖춘 딥테크 기업들의 기술특례상장이 예상되는 만큼 전문성과 공정성을 갖춘 기술평가가 될 수 있도록 노력을 당부한다”고 밝혔다.",https://n.news.naver.com/mnews/article/011/0004562191
2025-12-01 17:23:00,"금호타이어, 폴란드 오폴레에 유럽 新공장 짓는다","[서울경제]  금호타이어(073240)가 유럽 시장을 공략하기 위해 폴란드 오폴레 지역에 생산 거점을 짓기로 확정했다.  1일 금호타이어에 따르면 폴란드 오폴레에 건설될 유럽 신공장은 투자 승인과 인허가 절차를 거쳐 2028년 8월 첫 가동을 시작할 예정이다. 1단계 생산 규모는 연간 600만 본으로, 시장 상황에 따라 단계적인 증설로 생산 능력을 확대하겠다는 방침이다. 총 투자금액은 5억 8700만 달러(약 8606억 원)다.  지금까지 금호타이어는 유럽 공장 건설을 위해 폴란드를 비롯한 유럽 국가들을 대상으로 입지 조건·판매 확대 가능성·투자 안정성·수익성·인센티브 혜택 등을 종합 검토해 왔다. 물류·인력·인프라 등 각국의 기반 사항들과 유럽 내 공급 안정성, 거점 신설에 따른 인센티브 등을 고려할 때 최적의 지역으로 오폴레를 선정했다는 설명이다.  유럽 시장은 세계 주요 프리미엄 완성차 업체가 집중돼 있을 뿐 아니라 전세계 타이어 소비의 약 25% 차지하는 핵심 시장이다. 지난해 금호타이어 전체 매출 중 유럽 시장이 차지하는 비중은 약 26.6%에 달했다. 그간 핵심 시장임에도 현지 생산 시설의 부족으로 영업에 어려움을 겪었는데, 이번 공장 신설을 통해 각 브랜드와의 협업 기회도 크게 늘어날 것으로 전망된다. 금호타이어는 특히 고성능·고인치 제품 등 고부가가치 제품(HVP) 중심의 포트폴리오를 강화하겠다고 설명했다.  금호타이어가 폴란드에 신공장을 세우게 되면서 업계에서는 ‘마지막 퍼즐’을 맞췄다고 평가하고 있다. 금호타이어의 전 세계 생산 거점은 총 8곳으로 한국과 중국·미국·베트남 등 4개국에 걸쳐 있다. 연간 타이어 생산 규모는 총 6500만 본에 달하지만 주요 시장인 유럽에는 공장이 없었다. 이번 신공장 건설로 아시아·유럽·북미를 잇는 생산 체계를 완성하면서 시장 경쟁력을 한층 강화했다는 설명이다.  정일택 금호타이어 대표이사는 “유럽 시장은 글로벌 타이어 산업에서 매우 중요한 전략적인 위치를 차지하고 있다”며 “금호타이어는 단순한 수출을 넘어, 유럽 현지 생산과 공급을 통해 품질·서비스 경쟁력을 강화하고 프리미엄 브랜드 가치를 획기적으로 높일 것”이라고 말했다.",https://n.news.naver.com/mnews/article/011/0004562190
2025-12-01 17:17:00,"[단독] 이 와중에… 쿠팡, 입점업체 상대 대출금리 19% '이자 장사'","[서울경제]  개인정보 유출 사태로 홍역을 앓고 있는 쿠팡이 입점 업체들을 대상으로 한 대출에 최고 연 19%의 금리를 적용하고 있는 것으로 확인됐다. 입점 업체의 성장을 돕기 위한 대출인데 되레 판매자들을 대상으로 고금리 ‘이자 장사’를 한다는 지적이 나온다.  1일 금융계에 따르면 쿠팡 계열사 쿠팡파이낸셜은 최근 일부 입점 판매를 대상으로 사업자금대출 사업을 개시했다. 은행권 대출이 어려운 입점 업체를 대상으로 대출을 제공해 성장을 지원한다는 취지다.  대출 상품명은 ‘쿠팡 판매자 성장 대출’로 핀테크 계열사인 쿠팡페이로부터 유상증자를 받아 운영에 들어갔다. 해당 상품의 대출 심사는 금융사와 달리 신용점수를 보지 않고 쿠팡 내 매출과 반품률 등을 통해 진행된다. 대출금리와 한도, 상환 조건 등도 이에 따라 정해진다.  하지만 입점 업체들 사이에서는 쿠팡이 판매자들을 대상으로 고금리 장사를 하고 있다는 비판이 나오고 있다. 해당 상품의 금리는 최저 8.9%에서 최고 18.9% 수준으로 캐피털·저축은행 등 2금융권이나 대부 업체 수준의 금리가 책정됐다.  네이버의 금융 계열사인 네이버파이낸셜 역시 네이버스마트스토어 판매자들을 대상으로 비슷한 대출을 내주고 있지만 제공하는 금리는 훨씬 낮다. 네이버파이낸셜의 경우 크게 ‘전용 신용대출’과 ‘보증부 대출’ 상품을 운영하고 있다. 전용 신용대출은 미래에셋캐피탈과 함께 8.7~12.50%의 금리를, 우리은행과는 5.9~7.79%의 금리를 제공한다. IBK기업은행·신용보증기금과 함께하는 보증부 대출 금리는 3.56~4.70% 수준이다.  시장에서는 명륜진사갈비 운영사 명륜당이 가맹점을 대상으로 고금리 대출을 내준 것과 뭐가 다르냐는 지적까지 나온다. 쿠팡에 입점한 한 업체 관계자는 “일부 매출 상위권 판매자를 제외하면 대부분 10% 후반대 금리를 받을 것”이라며 “대부 업체 수준의 금리를 매기는 것을 보면 쿠팡이 판매자를 어떻게 생각하는지 모르겠다”고 지적했다.",https://n.news.naver.com/mnews/article/011/0004562189
2025-12-01 17:14:00,"""AI 전력 수요 급증…직접 발전설비 갖추는 기업들 더 많아질 것"" [시그널]","[서울경제] 이 기사는 2025년 12월 1일 16:05 자본시장 나침반  '시그널(Signal)' 에 표출됐습니다.    한동현 딜로이트안진 파트너가 전원을 직접 개발하는 시대가 도래했다고 진단했다. 인공지능(AI) 산업의 성장으로 전력수요가 급증한 반면 공급이 이를 제대로 충족하지 못하면서 자체 조달에 나섰다는 설명이다.  한 파트너는 1일 서울경제신문과 만나 “기업들이 직접 전력 공급 인프라를 갖춰나가기 시작했다”며 “대규모 전력이 필요하지만 공급이 원활하지 않으니 수요자가 직접 개발을 시작한 상황”이라고 말했다.  한 파트너는 전력 생산, 신재생에너지 등의 분야에서 18년 이상 경력을 보유한 인프라 전문가다. 정책 수립부터 인수합병(M&A)까지 에너지 전환 과정에서 기업과 정부를 가리지 않고 전략적 자문을 제공하고 있다. 현재 딜로이트안진은 에너지 분야의 자문 역량을 높이기 위해 조직 규모를 40여 명으로 확대했다.  기업들이 전력을 자체 조달하는 것은 비단 한국에서만 일어나는 일은 아니다. 글로벌 시장에서는 구글과 같은 빅테크(거대 기술) 기업들이 데이터센터 운영을 위해 직접 발전소를 지어 전력을 자체적으로 조달하고 있다. 이 같은 현상은 한국에서도 나타나기 시작했으며 점차 많은 기업들이 자체 전원을 갖출 것이라는 게 한 파트너의 분석이다.  대표적인 예로 SK하이닉스를 꼽았다. 한 파트너는 “SK하이닉스의 경우 그룹에서 여러 발전소를 운영하고 있어 자체적으로 발전소를 지을 역량을 보유하고 있다”며 “자체 발전설비를 운영해보니 긍정적인 효과가 나타나 이 같은 방안을 지속적으로 추진할 것으로 예상된다”고 설명했다. 이어 그는 “삼성 등 국내 대기업들도 자체 인프라를 확보하는 방안을 고려하고 있는 것으로 안다”고 덧붙였다.  기업들이 자체 조달에 나서는 것은 기본적으로 인공지능 산업 전환에 따라 전력 수요가 많아졌기 때문이라는 설명이다. 여기에 친환경 에너지로 전환하면서 기업이 사용하는 전력 단가 상승이 예상되는 점도 인프라 확보에 주력하는 이유다. 한 파트너는 “자체 발전설비는 플랜트 중 일부 설비이기 때문에 별도 발전 사업 인허가를 받을 필요가 없어 용이하다”며 “그렇기 때문에 전력을 빠르게 확보할 수 있다는 게 장점”이라고 했다.  한 파트너는 이 같은 흐름하에 기업들의 신재생에너지 분야 투자도 늘어날 것으로 내다봤다. 그는 “재생에너지로 재편됨과 동시에 원자력·수소에너지도 부상 중”이라며 “에너지 분야에서 M&A 기회가 더욱 많아질 것으로 보인다”고 예측했다.",https://n.news.naver.com/mnews/article/011/0004562188
2025-12-01 17:12:00,"엔비디아 칩 규제 구멍?…""미 업체, 中고객사 위해 구매 대출""","[서울경제]  미국에 소재한 한 인공지능(AI) 업체가 중국 고객사가 일본에서 사용할 고급 엔비디아 칩 구매 자금을 지원하기 위해 거액의 대출을 받는다는 보도가 나왔다.  1일(현지 시간) 블룸버그 통신은 미국 실리콘밸리에 본사를 둔 AI 기업 '페일블루닷 AI'가 약 3억 달러(약 4400억원) 규모의 대출을 추진 중이며 은행 및 사모 신용 회사들과 접촉했다고 전했다. 페일블루닷 AI는 회사 보도자료에 따르면 AI 클라우드 에이전트 업체로, 베이징대 출신 등이 공동 창업자인 것으로 알려졌다고 업체""블룸버그는 전했다.  소식통들에 따르면 해당 칩(그래픽 처리 장치)은 일본 도쿄의 데이터센터에서 사용될 예정이지만 최종 사용 고객은 중국의 인기 소셜미디어 플랫폼 '샤오훙수'(영문명 레드노트)가 될 것으로 전해졌다.  미국 최대 은행인 JP모건체이스는 대출 마케팅 자료 준비에 관여한 것으로 알려졌으나 최종적으로 이 거래에 참여하지 않을 수도 있다고 블룸버그는 전했다. 페일블루닷 AI 측은 블룸버그 보도 내용에 대해 ""사실과 다르다""고만 짧게 밝혔다.  2022년 이후 미국 정부는 중국에 대한 고성능 엔비디아 칩 수출 제한을 강화해왔다. 이번 대출 추진은 이러한 미국 정부의 규제에 기술 기업들이 어떻게 대응하고 있는지 보여주는 것이라고 블룸버그는 짚었다. 중국 기업들이 직접 고성능 엔비디아 칩을 구매할 순 없지만, 중국 밖 다른 국가의 데이터센터를 통해 합법적으로 활용할 수 있다는 것이다. 데이터센터는 외부 업체가 AI 연산을 진행할 수 있도록 전산 자원을 원격으로 빌려 줄 수 있다.  앞서 파이낸셜타임스(FT)는 중국 기술 기업들이 고성능 엔비디아 칩을 갖춘 싱가포르 등 동남아시아 국가의 데이터센터를 통해 AI 모델을 개발하는 전략을 확대하고 있다고 전하기도 했다.",https://n.news.naver.com/mnews/article/011/0004562187
2025-12-01 17:06:00,"조지호 ""尹, 국회 월담 의원들 ‘체포’ 지시했다""","[서울경제]  조지호 경찰청장이 비상계엄 당일 윤석열 전 대통령으로부터 국회로 월담하는 의원들을 체포하라는 지시를 받았다고 법정에서 증언했다.  서울중앙지법 형사합의32부(재판장 류경진)는 1일 내란 중요임무 종사 등 혐의로 기소된 이상민 전 행정안전부 장관에 대한 8차 공판을 열었다. 법정에는 조 청장이 증인으로 출석했다.  조 청장은 이날 비상계엄 상황에서 윤 전 대통령과 비화폰으로 6차례 통화했던 내용을 구체적으로 설명했다. 그는 “첫 통화에서 윤 전 대통령이 국회를 통제하라고 했지만 법적 근거가 없어 불가능하다고 말씀드렸다”며 “이후 국회로 월담하는 의원이 많다는 내용에 대해서 ‘다 잡아라, 체포해라’고 지시했다”고 진술했다.  특검이 “윤 전 대통령이 ‘국회 들어가는 건 다 불법이다, 체포해라’라고 말했느냐”고 묻자 조 청장은 “그 워딩이 분명히 기억난다”고 답했다. 그는 6차례 통화 중 첫 통화는 국회 통제 관련 내용이고, 포고령 발령 이후 통화에서는 체포 관련 지시가 이어졌다고 강조했다.  윤 전 대통령의 체포 지시를 받고도 이를 이상민 장관에게 보고하지 않은 이유에 대해 조 청장은 “이행하지 않기로 마음을 굳혔기 때문”이라고 밝혔다. 그는 “구체적으로 계획을 세웠다면 보고 내용에 포함했을 수도 있다”며 “하지만 ‘이건 아니다’는 생각이 들어 이행하지 않기로 마음을 굳힌 상태에서 장관 전화를 받았다”고 말했다.  조 청장은 또 비상계엄 선포 직전 삼청동 안가에서 열린 대통령 주재 만찬 상황도 상세히 증언했다. 그는 “경찰 독려 만찬 정도로 생각하고 갔는데, 자리에 앉자마자 대통령이 격앙된 어조로 야당과 종북세력에 대한 불만을 많이 쏟아냈다”며 “예상과 다른 분위기에 당황하며 듣고 있었는데, 얼마 지나지 않아 비상계엄을 하겠다는 말을 해 깜짝 놀랐다”고 회상했다.  조 청장은 이 자리에서 김용현 전 국방부 장관이 메모가 적힌 A4용지를 나눠줬다고도 밝혔다. 조 청장은 “30년 공직생활에서 처음 보는 다소 조잡한 수준의 문서였다”며 “집중해서 읽을 상황은 아니었지만, 언뜻 보기에 ‘2200시 국회’, ‘2300시 민주당사’ 등이 적혀 있었다”고 말했다. 특검이 “김 전 장관이 경찰 인력을 어디에 배치할지를 직접 그려가며 설명했느냐”고 묻자 조 청장은 “사실이 아니다. 필기구를 제가 보지 못했다”고 부인했다.",https://n.news.naver.com/mnews/article/011/0004562186
2025-12-01 17:01:00,'대한민국 벤처 30년'…열정과 혁신의 역사 기념 전야제 개최,"[서울경제]  벤처기업협회는 벤처30주년 기념식 전야제를 통해 지난 벤처30년 벤처생태계 조성과 성장에 기여한 기업인과 관계자에게 감사의 뜻을 전했다. 또 미래 30년을 준비하는 다짐의 메시지로 ‘시대가 다시 벤처를 부른다’는 의지를 나타냈다.  협회는 1일 오후 서울 삼성동 인터콘티넨탈 파르나스 호텔에서 ‘대한민국 벤처 30주년 전야제’를 개최했다. 전야제에는 국회·정부· 공공기관 인사, 벤처기업인, 30주년 기념사업 후원사 등 300여 명이 참여해 벤처 30년의 상징성을 더했다.  송병준 회장은 환영사에서 “대한민국 벤처 생태계는 지난 30년 동안 수많은 도전과 변화 속에서도 기업인들의 열정과 혁신으로 성장해 왔다”며 “이번 전야제는 지난 30년 도전의 발자취를 돌아보고 생태계 구성원들이 서로를 격려하는 자리로 마련했다”라고 밝혔다.  전야제의 하이라이트인 뮤지컬 갈라 공연에서는 배우 홍지민이 ‘This Is Me’, ‘Dancing Queen’ 등을 부르며 큰 호응을 받았다. 또 참석자 전원이 함께 참여한 ‘아름다운 강산’ 합창으로행사 전반의 화합과 교류의 의미를 더했다.  전야제의 분위기는 오는 2일 개최되는 ‘대한민국 벤처 30주년’ 기념식으로 이어진다. 기념식에서는 벤처 30년 주제영상, 고(故) 이민화 회장 AI 축사, 세대별 창업가 토크쇼, 벤처 30주년 연구보고, 청년 창업가 발표 등 대한민국 벤처의 과거와 미래를 잇는 다양한 프로그램이 진행될 예정이다.  송 회장은 “내일 본 행사는 벤처 30년의 성과와 앞으로 우리가 함께 만들어갈 미래를 담은 뜻깊은 자리”라며 “많은 분들이 참석해 대한민국 벤처의 새로운 30년을 여는 데 힘을 보태주시길 바란다”고 말했다.",https://n.news.naver.com/mnews/article/011/0004562185
2025-12-01 16:59:00,유네스코 세계지질공원 연천군…'베개용암 출렁다리'로 관광 새 전기 마련,"[서울경제]  경기 연천군은 청산면 궁평리와 전곡읍 신답리를 잇는 '한탄강 베개용암 출렁다리'를 개통했다고 1일 밝혔다. 총 사업비 136억 원이 투입된 이 시설은 유네스코 세계지질공원인 연천의 관광 인프라를 한층 강화했다.  연천군에 따르면 행정안전부 접경지역 발전지원사업으로 추진된 베개용암 출렁다리는 길이 300m, 폭 1.5m의 보도현수교를 중심으로 200m 진입도로, 1855㎡ 규모 휴게쉼터, 75면 주차장을 갖췄다.  새로 개통한 출렁다리는 천연기념물 제542호 아우라지 베개용암과 한탄강·영평천이 합류하는 지점을 조망할 수 있는 국내에서 유일한 시설이다. 방문객들은 다리 위에서 주상절리와 세계적으로 희귀한 내륙 베개용암을 동시에 체험할 수 있어 지질학적·경관적 가치가 매우 높다.  연천군은 이번 개통으로 궁평리 먹거리촌, 재인폭포 공원, 좌상바위 등 기존 관광지와의 연계 효과를 기대하고 있다. 특히 겨울철 백설과 얼음이 어우러진 강바닥 풍경은 사계절 중에서도 가장 압도적인 장면을 연출하는 것으로 평가되며, 연천군의 대표 관광 콘텐츠로 자리매김할 것으로 기대된다.  김덕현 연천군수는 “궁평리와 신답리를 잇는 출렁다리는 한탄강 주상절리 트래킹 코스와 연계해 더 많은 관광객이 연천을 찾는 계기가 될 것”이라며 “연천의 아름다움을 보여주는 상징적 랜드마크로 자리 잡고 지역 발전의 새로운 활력을 이끌어낼 것”이라고 말했다.",https://n.news.naver.com/mnews/article/011/0004562183
