날짜,제목,본문,링크
2025-12-01 09:00:00,"전국 반도체 투자 훈풍, 청주 부동산도 반사이익 받아…‘두산위브더제니스 청주 센트럴파크’ 12월 1일(월) 무순위 청약 접수","[서울경제] 국가 단위의 반도체 산업 육성이 본격화되면서, 주요 산업단지뿐 아니라 주변 도시와 배후 주거지역까지 낙수효과를 기대할 수 있는 구조가 형성되고 있다. 특히 충북 청주는 SK하이닉스의 M15X 반도체 팹 가동이 임박한 가운데, 수도권·충청권을 잇는 ‘중간 거점’으로서의 역할을 수행하며 부동산 시장에서도 다시 주목받고 있다.  현재 국내 반도체 산업은 경기 용인·평택을 축으로 한 수도권 남부, 충청권 청주·세종·천안 등으로 분산돼 대규모 투자 유치가 진행되고 있다. 삼성전자는 평택에 세계 최대 규모의 시스템 반도체 클러스터를 조성 중이며, SK하이닉스는 청주에서 생산라인을 확장하고 있다. 이에 따라 각 산업단지를 둘러싼 주거지들로 실수요와 인프라 수요가 연쇄적으로 확산되는 구조가 만들어지고 있다.  이 가운데 청주는 상대적으로 저평가된 가격, 이미 구축된 광역 교통망, 행정·산업 기능을 동시에 갖춘 도시 구조를 바탕으로, 산업 중심지와 생활 중심지의 중간지대에서 가장 현실적인 수혜 가능성을 갖춘 도시로 평가받고 있다.  청주 SK하이닉스의 M15X는 20조 원 이상이 투입되는 초대형 프로젝트로, 완공 시점에는 약 1만 명 이상의 고용 유발이 예상된다. 이는 충북 지역의 인구 구조와 주거 수요에 직접적인 영향을 미칠 수 있는 규모이며, 청주 원도심 및 인근지역 등으로 직주근접 입지를 선점한 배후 주거지로 실수요자들의 관심을 끌고 있다.  여기에 더해 청주는 KTX 오송역과 청주국제공항, 경부·중부고속도로 등 교통 인프라가 이미 잘 구축돼 있다. 수도권이나 세종, 대전 등 주요 도심과의 연결성이 뛰어나 외부 투자자들의 접근성도 용이하다는 점에서, 반도체 산업 확산의 중심축과 외연을 잇는 중간 허브 역할을 할 수 있다는 평가다.  한 업계 관계자는 “산업투자는 단순한 공장 유치로 끝나지 않고, 해당 지역의 인프라와 주거 기능을 빠르게 성장시키는 역할을 한다”며 “청주는 전국 산업벨트 확장의 수혜를 받을 수 있는 입지적·경제적 균형점을 갖춘 지역으로, 지금은 아직 시장에 과도하게 반영되지 않은 구간”이라고 분석했다.  이런 가운데, 두산건설은 충청북도 청주시 흥덕구 신봉동 일원 청주 운천주공 주택재건축정비사업을 통해 ‘두산위브더제니스 청주 센트럴파크’를 분양 중이다. 단지는 지하 2층~지상 최고 31층, 18개 동, 전용면적 59~114㎡ 총 1,618가구 규모로 조성되며, 이 중 전용면적 59~114㎡ 705가구를 일반분양한다.  금번 무순위 청약접수는 거주지역 상관없이, 무주택 성년자이면 누구나 청약이 가능하며, 청약통장 가입여부와 상관없이 신청이 가능하다. 또한, 청주시는 비규제지역으로 전매에 대한 제한이 없어 계약금 완납 시 무제한으로 전매가 가능하다.  또한, 수분양자들에게는 계약금 5%에 1차 계약금 1,000만원 정액제 조건이 적용되며, 중도금 이자후불제로 입주 시까지 계약금 외 추가 비용이 발생하지 않아 초기 자금 부담을 크게 덜었다.  우수한 상품성도 갖췄다. 단지는 두산건설의 하이엔드 브랜드 ‘두산위브더제니스’가 적용돼 차별화된 상품 가치가 돋보인다. 우선 세대 내 유리난간 창호를 도입해 탁 트인 조망권을 확보했으며, 프리미엄급 입면 고급화(일부 동)를 통해 단지 외관에도 세련된 이미지를 더했다. 특히 일부 세대에서는 운천공원을 조망할 수 있어 수요자들의 기대를 모은다.  또한 단지는 남향 위주로 배치돼 채광성이 우수하며, 전 세대가 판상형 구조로 설계돼 통풍성을 극대화했다. 아울러 대부분의 세대에 선호도 높은 4BAY 판상형 구조가 적용된다. 팬트리, 드레스룸, 다용도실 등 넉넉한 수납 공간도 도입돼 실용성과 편의성을 한층 높였다.  대단지 규모에 맞는 커뮤니티 시설도 마련된다. 입주민들의 건강을 위한 피트니스, 골프연습장, GX룸 등의 스포츠 시설과 휴식 공간인 카페라운지, 자녀들을 위한 작은도서관, 독서실, 돌봄센터 등 다채로운 커뮤니티 시설이 들어설 예정이다.  한편, ‘두산위브더제니스 청주 센트럴파크’의 무순위 청약 접수는 12월 1일(월) 진행되며, 견본주택은 충청북도 청주시 흥덕구 송절동 일원에 마련돼 있다.",https://n.news.naver.com/mnews/article/011/0004561931
2025-12-01 09:00:00,"에어큐브, 태국 방콕서 파트너 초청 행사 개최.. BlueZebra와 MSP 파트너십 계약 소식 전해","[서울경제] IT인증·보안 솔루션 전문 기업 에어큐브(AirCUVE)가 지난 11월 26일부터 27일까지 태국 방콕에서 파트너 초청 행사를 개최했다.  이번 행사는 고객사 및 리셀러와의 네트워킹 강화, 제품 홍보, 보안 솔루션 교육을 목표로 태국 파트너사인 ‘블루지브라(BlueZebra)’와 협력하여 진행되었다.  행사에는 태국 공군, 해군, 육군, 공항청, 군 보안 센터 등 다수의 정부 기관과 민간 기업들이 참여했으며, NEC, NTT, ProEn 등의 리셀러 파트너사가 참석해 자리를 빛냈다.  특히 에어큐브는 이번 행사를 통해 블루지브라와의 MSP(Managed Security Provider) 파트너십 계약(AirCUVE Inc & BlueZebra Network Security Identity MSP Partnership Contract) 체결 소식을 발표하며 양사 간 협력과 시장 확장의 의지를 공식화했다.  이와 함께 에어큐브는 행사에서 대표 보안 솔루션 △AirFRONT, △ByFRONT, △V-FRONT를 소개했다. AirFRONT는 유무선 통합 인증 솔루션으로 IP 관리, 단말 관리, 비허가 단말 차단 기능을 제공하며 TTA GS 인증 1등급 및 IT 보안 인증사무국 EAL-4 CC 인증을 획득, 국내외 기업과 공공기관에서 널리 사용되고 있다.  ByFRONT는 SDN 기반 지능형 네트워크 인증 및 정책 솔루션으로, 삼성전자, Cisco Systems, Arista Networks, HP, Juniper 등 글로벌 네트워크 벤더와 완벽 호환되며 대기업 및 금융기관의 복잡한 네트워크 환경 관리에 높은 호응을 얻고 있다.  V-FRONT는 계정 해킹 방지를 위한 MFA, IAM, SSO 솔루션이며, FIDO와 패스키(Passkey)를 지원하고 안면 인증, 지문 인증 등 생체 인증 기능을 확장 가능하다. 또한, 올해 AWS Marketplace에 공식 등록되어 글로벌 고객 접근성과 배포 효율성을 강화했다.  에어큐브 장윤주 부사장은 “이번 행사를 통해 태국 파트너와 고객사들로부터 에어큐브의 혁신적인 인증 보안 솔루션에 대한 높은 관심을 다시 확인할 수 있었다”며 “블루지브라와의 MSP 파트너십 계약 체결을 계기로, 태국 및 글로벌 시장에서의 입지를 더욱 강화할 계획”이라고 말했다.  이어 “에어큐브는 이번 행사를 기반으로 해외 시장 활동을 확대하며, 보안 솔루션 분야의 글로벌 선도 기업으로 자리매김할 예정이다”고 덧붙였다.",https://n.news.naver.com/mnews/article/011/0004561930
2025-12-01 08:59:00,"조폐공사, 새해 기념 화폐 요판화 ‘말의 해’ 출시","[서울경제]    한국조폐공사는 병오년(丙午年)을 기념한 새해 화폐 요판화 ‘말의 해’의 사전 예약 판매를 진행하고 있다고 1일 밝혔다.  이번 작품은 조폐공사 요판화 시리즈의 네 번째이자 올해 마지막 공개작이다. 기존 명화 기반이 아닌 조폐공사 디자이너가 처음으로 창작한 오리지널 디자인 요판화라는 점에서 의미가 크다. 붉은 말이 2026년을 향해 질주하는 모습을 섬세한 선으로 표현해 새해의 기상과 에너지를 담아냈다.  ‘말의 해’ 화폐 요판화는 조폐공사가 보유한 정교한 화폐 제작 기술이 집약돼 있다. 선과 점을 촘촘히 조합해 형태를 구축하는 요판 인쇄 기법이 적용돼 표면을 손끝으로 따라가면 특유의 입체적 요철감을 느낄 수 있다. 이러한 기술은 말의 갈기가 살아 움직이는 듯한 시각적 효과가 나타난다. 또한, 요판의 입체감은 말이 움직이는 듯한 생동감을 자아낸다.  작품 속에는 미세문자 ‘HORSE’, ‘2026’, ‘KOMSCO’가 삽입돼 있고 복사나 프린터 사용 시 글자가 깨지거나 선이나 점으로 나타나 위조를 방지하는 역할과 찾아보는 재미를 선사한다. 이러한 디테일은 화폐 요판화의 창의적 포인트로 작품의 완성도를 한층 높이고 있다.  이번 화폐 요판화 ‘말의 해’는 소형(종이, 그림 267x207.5㎜) 1종으로 구성된다. 사전 예약 판매 이후 상시판매로 전환될 예정이다. 모든 작품은 전용 액자와 보관 케이스, 품질보증서가 함께 제공되며, 보증서에는 일련번호가 포함되어 있어 소장 가치를 더한다.  사전 예약은 12월15일까지 조폐공사 온라인쇼핑몰에서 선착순으로 진행된다.  조폐공사 성창훈 사장은 “조폐공사의 요판화 시리즈는 정밀한 화폐 제조 기술을 예술적으로 재해석한 작품”이라며 “이번 화폐 요판화‘말의 해’는 새해의 시작을 깊이 새길 수 있는 선물이자, 예술성과 기술력을 동시에 갖춘 작품이 될 것”이라고 말했다.   ; 조폐공사, 새해 기념 화폐 요판화 ‘말의 해’ 출시",https://n.news.naver.com/mnews/article/011/0004561929
2025-12-01 08:58:00,"여주 부평천 홍수 막는다…경기도, 176억 들여 하천 정비","[서울경제]  경기도가 여주시 부평천의 홍수 대응 능력을 높이기 위해 176억 원을 투입, 4.75km 구간의 하천을 정비한다. 도는 이를 통해 반복되는 침수 피해를 막을 계획이다.  경기도는 여주시 강천면 일원을 흐르는 부평천에 대한 지방하천 정비사업을 추진한다고 1일 밝혔다. 부평천은 상류부 급경사 구간에서 집중호우 시 농경지 침수가 반복되고, 하류부는 남한강 수위 상승으로 역류성 범람 위험이 있어 정비가 시급했다.  정비사업은 총 4.75km 구간에 걸쳐 진행된다. 제방을 3.4km 쌓고 교량 8개를 새로 설치하는 것이 주요 내용이다.  총 사업비 176억 원은 전액 도비로 충당한다. 지난 2022년 실시설계를 마치고 보상 절차를 진행해 왔으며, 2028년 11월 완공을 목표로 한다.  강성습 경기도 건설국장은 ""정비사업으로 집중호우 시 부평천 범람 위험이 크게 줄어들 것""이라며 ""여주시와 긴밀히 협력해 사업을 차질없이 추진하겠다""고 말했다.",https://n.news.naver.com/mnews/article/011/0004561928
2025-12-01 08:58:00,"울산시, 생계난 시민에 ‘그냥드림’ 사업 시작",[서울경제]  울산시가 서류 없이 식료품을 지원하는 ‘그냥드림 사업’을 시작했다. 이번 사업은 보건복지부 시범사업으로 12월 1일부터 내년 4월까지 운영된다.  울산나눔푸드마켓(월~목 오후 1시~4시)과 중구푸드뱅크(화·목 오전 10시~오후 6시)에서 2만 원 상당 식료품 꾸러미를 받을 수 있다.  갑작스러운 위기로 생활이 어려워진 시민이면 누구나 해당 기관을 방문해 즉시 지원받는다. 복잡한 서류나 증명 절차가 필요 없다. 2회 이상 이용 시에는 상담을 통해 추가 복지서비스와 연계한다.  시는 이번 시범 운영을 통해 운영 시간과 이용한도 등 운영체계를 보완해 나갈 예정이다.  울산시 관계자는 “복잡한 서류 절차나 사회적 편견 때문에 복지서비스 이용을 주저하는 시민들이 부담 없이 도움을 받을 수 있길 바란다”고 말했다.,https://n.news.naver.com/mnews/article/011/0004561927
2025-12-01 08:56:00,"""목표전환형에 손실제한까지""…KB운용, 'KB 코리아 업앤다운 타겟관리 목표전환 1호' 펀드 출시","[서울경제]  KB자산운용은 KB국민은행과 변동성 국면에서 안정적인 수익을 추구할 수 있도록 설계한 목표전환형 펀드를 선보인다고 1일 밝혔다.  ‘KB 코리아 업앤다운 타겟관리 목표전환형 펀드’는 주식형 상장지수펀드(ETF)에 50% 미만, 채권형 ETF에 50% 이상 투자해 국내 주식 시장 상승 시 이익을 추구하는 동시에 채권 투자에 따른 안정적 이자 수익을 기대할 수 있다.  해당 펀드는 목표 수익률 7% 달성과 손실제한 마이너스 7% 범위 내에서 운용하는 타겟관리 전략을 적용해 시장 등락에 유연하게 대응하는 것이 특징이다. 시장 대표지수인 코스피200 지수 중심으로 투자하되(약 30%), 모멘텀이 강한 섹터, 테마 관련 ETF에도 분산 투자해(약 20%) 시장 대비 적극적인 초과 수익을 노린다. 아울러 국내 단기채 관련 ETF 등 우량 채권에 50% 수준으로 투자하면서 안정성을 가져간다. 목표 수익률이 7%에 도달하면 주식 관련 자산을 모두 매도하고 채권 재간접형 펀드로 전환한다.  주식시장 하락으로 펀드 수익률이 마이너스로 돌아서면 손실 방어를 위해 단계적으로 주식 편입비율을 하향 조정한다. 7% 손실에 도달할 경우에는 주식 관련 자산을 매도하고 채권 재간접형으로 전환하는 로스컷 구조를 적용해 투자자의 손실 위험을 관리한다.  범광진 KB자산운용 연금WM본부장은 “자본시장 체질 개선과 수출주 실적 개선을 고려하면 국내 증시의 추가 상승 여력은 충분하다”며 “다만 주가 고점에 대한 우려로 투자를 망설이는 투자자들을 위해 로스컷 구조를 도입, 부담을 줄였다”고 설명했다. KB국민은행 관계자는 “‘KB 코리아 업앤다운 타겟관리 목표전환형 펀드’는 고객의 수익뿐만 아니라 손실 위험까지 관리해주는 KB금융그룹의 고객중심 철학이 담겨진 상품”이라며 “앞으로도 급변하는 시장 환경 하에서 고객의 자산 증식과 자산 관리에 기여할 수 있도록 최선을 다하겠다”고 말했다.",https://n.news.naver.com/mnews/article/011/0004561926
2025-12-01 08:53:00,"""누가 경차를 20만원 주고 빌려요""…제주 렌터카 '바가지 요금' 난리나더니 결국","[서울경제]  제주도가 렌터카 요금 산정 방안을 새로 마련해 성수기 요금 상승을 막기로 했다.  제주도는 렌터카 요금 안정화를 위한 제도 개선책으로 업체가 렌터카 요금을 신고할 때 회계자료 등 경영상황을 반영한 객관적 근거에 기반해 요금을 책정하도록 하는 규칙 마련을 추진한다고 지난달 30일 밝혔다. 현재는 신차 렌터카를 등록할 때 차량 가격 등에 따라 대여료를 책정하고 있지만, 바뀐 규칙이 시행되면 업체의 재무제표 등 경영 상황을 반영해 대여료를 신고해야 한다.  렌터카 업체들은 대여 요금 신고제에 따라 매년 한 차례 대여 요금을 신고한다. 업체들은 여름철 성수기를 염두에 두고 상한 수준의 대여료를 신고해 사실상 신고 요금이 최고 요금이다. 경차 기종인 '레이'의 경우 여름철 성수기에 하루 20만원의 대여 요금을 받아 '바가지' 논란에 휩싸인 바 있다.  제주도는 새로 도입되는 요금 산정안을 적용하면 레이 기종 렌터카의 최고 대여료를 하루 10만원까지 낮출 수 있다고 기대한다. 제주도는 관련 규칙을 마련해 내년 10월 전국체전 이전에 새로운 요금 신고제가 시행되도록 추진할 계획이다.  도는 대여 요금이 낮아지면 영세 업체의 경영 악화가 우려된다는 의견에 따라 과도한 할인에 의한 출혈 경쟁을 막기 위해 할인율 상한제를 도입할 계획이다. 현재 최고 90%까지 이뤄지는 대여료 할인을 50∼60%까지만 허용하는 방안이 유력하게 검토하고 있다.  제주도 관계자는 ""신고하는 대여료 자체가 크게 낮아지면 할인율 상한제를 도입하더라도 소비자에게는 큰 부담이 되지 않을 것이며 비수기 과도한 할인분이 성수기 요금에 전가되는 구조적 문제도 해결할 수 있을 것으로 본다""고 말했다.",https://n.news.naver.com/mnews/article/011/0004561925
2025-12-01 08:52:00,"기보, 중기 사회적 가치 활성화 투자 연계 방안 찾는다","[서울경제]  기술보증기금이 지난달 28일 서울 성동구 KT&G 상상플래닛에서 '소셜벤처 임팩트플러스' 행사를 개최했다고 1일 밝혔다.  행사는 기보의 사회적 가치 측정 체계(KSVM)를 통해 계량화된 사회적 성과를 공유하고 이를 투자 및 지원으로 연결하기 위한 실질적 방안을 모색하기 위해 마련됐다.  사회적 가치 측정 기업과 벤처투자사, 소셜벤처기업, 기보 임직원 등 50여 명이 행사에 참석했다.  주요 프로그램으로는 △사회적 가치 측정 제도 성과 발표 △우수 소셜벤처 임팩트 IR △사회적 가치 측정 활성화 간담회 등이 진행됐다.  기보는 2020년 사회적 가치 측정 체계를 도입한 이후 5년간 집계된 102건의 사회적 가치 활동을 화폐가치로 환산한 결과 규모가 약 250억 원에 이른다고 설명했다.  IR 세션에는 기보의 사회적 가치 측정을 받은 △루트릭스(대기오염 저감) △나눔비타민(복지자원 효율적 분배) △로카101(주거비 경감) 등 우수 소셜벤처 3개 사가 발표를 했다.  각 기업은 사회문제 해결과 더불어 수익 창출이 가능한 지속 가능한 비즈니스 모델을 제시했다.  마지막 간담회 세션에서는 사회적 가치 측정 전문기관인 사회적가치연구원과 임팩트스퀘어, 임팩트투자사 엠와이소셜컴퍼니가 참여해 소셜벤처 지원을 위한 사회적 가치 측정 체계의 개선 방향과 활용 방안에 대해 깊이 있는 논의를 진행했다.",https://n.news.naver.com/mnews/article/011/0004561924
2025-12-01 08:47:00,"GIST ""차세대 에너지 연구 고도화”…배터리·수소 연구센터 본격 가동","[서울경제]  광주과학기술원(GIST)은 배터리·수소 분야의 차세대 에너지 기술을 선도하고, 국가 에너지 실증사업에 대응하기 위해 ‘배터리·전기화학연구센터’와 ‘수소·광전기화학에너지전환연구센터’를 개소했다고 1일 밝혔다.  지난달 열린 두 연구센터의 개소식은 지난달 28일 GIST 차세대에너지연구소에서 열렸으며, GIST 교수진과 지자체·산업계·연구기관 관계자 등 약 50여 명이 참석해 차세대 배터리·수소 기술 고도화를 위한 협력 방향을 논의했다.  산·학·연·관 전문가들은 배터리 셀·전극·전해질 소재, 광전기화학 기반 수소 전환 기술의 실증·평가·정책 연계 필요성에 공감하며 GIST 중심 협력 생태계 구축 의지를 공유했다.  개소한 두 연구센터는 △차세대 배터리 전기화학 △전극·전해질 소재 개발 △고에너지밀도·고안전성 셀 구조 △광전기화학 기반 수소 생산(PEC) △촉매·광전극 소재 △캠퍼스·산단 실증 기반 구축 등 배터리와 수소 분야의 핵심 원천기술과 실증·평가 시스템을 통합적으로 구축할 계획이다.  또한 국가 실증사업과 연계해 광주·전남을 배터리·수소 실증 거점으로 삼고, 지역 RE100 산업단지와의 연계 연구도 병행할 예정이다.  GIST는 배터리·수소 연구센터 공동 개소를 계기로 캠퍼스 실증 부지 조성, 지역 RE100 산업단지와 연계한 배터리·수소 기술 실증, 국내외 전문가 초청을 통한 공동연구 확대 등을 추진할 예정이다. 이를 통해 광주·전남 지역을 중심으로 한 배터리·수소 연구·실증 허브 구축과 국가 에너지전환 기술 경쟁력 제고에 적극 나선다는 계획이다.",https://n.news.naver.com/mnews/article/011/0004561922
2025-12-01 08:47:00,"노타·퓨리오사AI, NPU 기반 AI 기술협력 MOU 체결",[서울경제]  노타는 인공지능(AI) 반도체 기업 퓨리오사AI와 신경망처리장치(NPU) 기반 AI 기술 협력을 위한 전략적 업무협약(MOU)을 체결했다고 1일 밝혔다.  NPU 전력 효율성과 고속 추론 성능은 복잡하고 고도화된 AI 모델 연산을 안정적으로 구현하기 위한 필수 조건으로 평가 받는다. 양사의 업무협약은 이러한 NPU 기술 고도화를 목표로 체결됐다. 양사는 △AI 솔루션 개발 및 사업화 △기술 파트너십 확대 △기술 및 사업성 검증 프로젝트 등을 위해 협력할 예정이다.  노타는 퓨리오사AI의 NPU가 제한된 전력으로 대규모 AI모델을 신속하게 구동할 수 있도록 지원한다. 노타의 AI 최적화 기술을 통해 퓨리오사의 NPU 성능을 향상시켜 시장 확대에 협력할 방침이다.  또한 이를 기반으로 로봇과 모빌리티 등 다양한 산업에 적용 가능한 실증모델 구축에 협력하고 국내외 시장 진출에도 힘을 합칠 예정이다.  채명수 노타 대표는 “노타는 AI 최적화 기술로 퓨리오사AI NPU의 전력 효율성과 고속 추론 성능을 극대화해 대규모 AI 모델의 안정적 구동을 적극 지원할 것”이라고 말했다.  백준호 퓨리오사AI 대표는 “노타와 협력으로 퓨리오사 2세대 칩 RNGD 위에서 다양한 최신 AI 모델을 더욱 신속하고 효율적으로 지원할 수 있게될 것”이라고 말했다.,https://n.news.naver.com/mnews/article/011/0004561921
