날짜,제목,본문,링크
2025-12-18 09:02:00,2030년 ‘AI 기지국’ 500개 짓는다…자율주행·휴머노이드 뒷받침,"[서울경제]  정부가 자율주행차와 휴머노이드 로봇 등 고성능 인공지능(AI) 서비스 상용화로 인해 처리해야 할 데이터 양이 급증할 것에 대비해 차세대 연산 인프라인 AI랜(AI 기지국)을 2030년까지 500개 이상 구축하기로 했다. AI랜은 중앙서버인 데이터센터와 달리 이용자가 가까운 기지국에 그래픽처리장치(GPU)를 탑재해 근거리에서 즉각적인 데이터 처리가 가능해 엔비디아와 삼성전자 등 국내외 주요 기업들이 기술 선점 경쟁을 벌이는 분야다.  과학기술정보통신부는 18일 제2회 과학기술관계장관회의에서 AI시대 대한민국 네트워크 인프라의 전면 고도화 및 산업 경쟁력 강화 방안을 제시하는 ‘하이퍼 AI네트워크 전략’을 발표했다. 정부 최우선 과제인 ‘AI고속도로 완성’과 ‘AI 3강(G3) 도약’을 뒷받침하는 네트워크 종합 전략으로 세계 최고 수준의 초지능·초성능 네트워크 전면 구축과 6G·AI네트워크 산업 1등 국가라는 양대 목표 달성을 추진한다.  정부는 우선 세계 최고 수준의 초지능·초성능 네트워크를 전면 구축한다. AI시대 트래픽 폭증과 초저지연 통신 등 수요에 대응해 2030년까지 AI랜 500개 이상 구축을 추진한다. 또 현재 LTE·5G 코어를 함께 사용하는 비단독모드(NSA) 방식의 5G를 내년에는 단독모드(SA)로 전면 전환해 이동통신망의 지능화와 다양한 혁신 서비스의 발전을 촉진한다. 내년 6G 상용화기술 연구개발사업 성과를 결집한 ‘프리 6G 비전 페스트’ 시연행사를 개최하고 2028년 LA올림픽과 연계한 6G 시범서비스를 거쳐 2030년경 6G 상용서비스를 개시한다는 계획이다.  정부는 두번째로 전국을 연결하는 유선(광)통신망도 대용량·지능화를 추진한다. 국가 네트워크의 ‘대동맥’으로서 전국 주요 거점과 데이터센터를 상호 연결하는 백본망은 2030년까지 용량을 4배 이상 확대해 대규모 트래픽을 안정적으로 수용한다. 네트워크 운영 체계 지능화·자동화로 인적(人的) 오류를 최소화하고 초저지연 통신을 보장한다.  백본망과 각 가정·기업을 연결하는 가입자망의 경우 현재 광케이블 보급률이 91%로 OECD 최고 수준이나 국민 모두가 고품질 AI서비스를 향유할 수 있도록 실제 수요가 있는 전국 모든 가정으로 광케이블 및 기가급 인터넷 인프라를 확대 구축한다.  마지막으로 해저케이블·위성통신 등 국제망의 경쟁력도 강화한다. 해저케이블은 글로벌 AI 트래픽 증가에 대응하여 2배 이상 용량을 확대하고 동남권 해안에 집중된 해저케이블 육양국을 서해·남해 등으로 다변화하여 안정성을 제고한다. 저궤도 위성통신은 3200억 원 규모 사업을 통해 핵심기술을 확보하는 한편 주요 부품·장비의 글로벌 공급망 진출을 촉진한다. 내년에는 민·관·군 협의체를 기반으로 독자 위성통신망 확보의 타당성 및 국제협력 방안을 검토한다.  정부는 이를 통해 2030년까지 글로벌 6G·AI네트워크 시장 점유율 20%와 매출액 5000억 원 이상 글로벌 도약 기업 5개 육성을 목표로 한다. 3700억 원 규모로 초저지연 통신 및 AI 융합을 지원하는 차세대 6G 이동통신 기술개발을 통해 주요 표준특허 점유율을 세계 1위 수준인 30% 선점한다. 동시에 AI를 활용해 네트워크를 고효율·저전력으로 운영하기 위한 AI네트워크 기술 개발을 병행하고 연구성과를 결집하여 네트워크 전 영역에 이르는 완전자율화·지능화 기술력까지 확보한다.  AI네트워크 기술 개발이 산업 생태계 발전으로 이어질 수 있도록 대규모 실증과 ‘수요 창출’도 추진한다. 교육·의료·제조·안전·미디어 등 5대 주요 분야별로 첨단 AI네트워크를 선제 구축하고 이를 기반으로 대규모 AI 선도 실증을 수행한다. 국가망 고도화와 전국 광케이블·기가인터넷 인프라 구축을 촉진함으로써 AI네트워크 산업 초기 수요를 창출하고 국가 AI대전환을 견인한다.  차세대 6G 기지국·AI-RAN 등 주요 네트워크 연구개발·투자에 대한 세제혜택 확대, 주파수 재할당 및 신규 주파수 공급, 6G 주파수전략 수립 등 주파수정책을 통해 망 투자 유인을 제고한다. 저전력·고효율 통신망 구축을 독려하기 위한 수단으로 ‘저전력·친환경 기지국 인증제’ 도입도 내년 추진한다.  과기정통부는 전략 이행을 위해 올해보다 450억 원 증액한 2900억 원을 네트워크 기술 개발부터 실증·사업화에 투자한다. 배경훈 과학기술부총리 겸 과기정통부 장관은 “AI시대, 대한민국 네트워크 인프라를 월등한 지능과 성능으로 고도화해 국민 모두가 고품질 AI서비스를 최상의 환경에서 누릴 수 있는 ‘모두의 네트워크’를 만들어나가겠다”고 말했다.   ; 2030년 ‘AI 기지국’ 500개 짓는다…자율주행·휴머노이드 뒷받침",https://n.news.naver.com/mnews/article/011/0004568726
2025-12-18 09:01:00,PBS폐지·우수연구진 상여금 신설…출연연 보상 체계 개편한다,"[서울경제]  정부가 과학기술분야 정부출연연구기관(출연연)의 연구과제중심제도(PBS)를 폐지하고 성과 중심의 보상 체계 개편을 추진한다.  과학기술정보통신부(과기정통부)는 18일 ‘제2회 과학기술관계장관회의’에서 출연연의 임무 새행 체계, 평가 및 보상 체계, 연구 환경 혁신 등의 내용을 담은 ‘과학기술분야 출연연 정책 방향’을 발표했다.  출연연은 국가연구개발의 중심 축으로 혁신과 변화를 선도하는 핵심 주체로서의 역할이 요구되나 불안정한 재정구조, 우수인력을 유인하지 못하는 보수 및 인센티브 구조, 연구자 행정부담 가중 등의 문제로 대형 성과를 창출하지 못하는 한계에 직면해 있다. 이에 과기 정통부는 누적된 구조적 문제를 해결하고 출연(연)이 시대적 임무에 부합하는 성과 창출형 국가거점으로 재도약하기 위한 방안을 마련했다.  우선 과기정통부는 출연연의 국가임무 수행체계를 확립한다. 이를 위해 PBS를 폐지하고 기관출연금으로 인건비 전액을 지원하여 연구자들이 인건비 확보를 위한 수주경쟁에서 탈피하도록 한다. 효과적 임무 수행을 위해 정부·기업 수요를 바탕으로 출연(연)이 주도하여 기획하는 전략연구사업을 신설하고 관련 추진체계도 구축한다.  평가 및 보상체계는 성과 중심으로 개편한다. 기관평가는 계획 대비 달성도 중심의 평가에서 국민체감형 대표성과 중심 평가로 전환하며, 평가 부담은 대폭 간소화한다. 평가 결과를 반영한 전체 구성원 대상 성과급과 우수 연구진 대상 상여금을 신설해 성과지향형 보상체계를 구축한다. 처우개선과 특별채용 확대 등 우수 인재의 유치 및 확보를 위한 정책 또한 지속 추진할 계획이다.  이를 통해 연구 몰입을 지원하는 연구 환경을 조성한다. 연구행정을 전문화하여 연구자에게 전가되는 행정부담을 최소화 하고 2004년 제정된 ‘과학기술분야 정부출연연구기관 등의 설립·운영 및 육성에 관한 법률’을 전부개정해 현재의 기술·정책환경에 적합한 출연연 지원·육성기반을 구축할 계획이다.  구혁채 과기정통부 제1차관은 “과학기술분야 출연연은 과학기술계의 혁신과 변화를 선도해 나갈 핵심 주체”라고 말하며, “출연연이 국가임무 수행의 거점이 되도록 아낌없이 지원해나갈 것” 이라고 밝혔다.",https://n.news.naver.com/mnews/article/011/0004568725
2025-12-18 09:00:00,"전세난 속 주거 대안 부상, 마곡 ‘롯데캐슬 르웨스트’ 관심 집중","[서울경제] 서울 아파트 전세 물건이 최근 1년 새 약 20% 감소하면서 내년 봄 이사철 전세난이 심화될 것으로 예상된다. 최근 부동산 시장은 아파트 매매 시장 위축과 전세 매물 감소 속에서 전·월세 수요는 늘어나 수급 불균형이 심각하다. 이런 상황에서 규제가 상대적으로 덜하고 실거주와 임대 활용이 모두 가능한 오피스텔로 수요가 이동하는 흐름도 관측된다.  부동산 플랫폼 아실에 따르면, 10일 기준 서울 아파트 전세 물건은 2만5,005건으로 올해 초(3만1,814건)보다 21.5% 줄어들었다. 한국부동산원이 발표한 서울 전세수급지수는 12월 첫째 주(12월 1일 기준) 104.4로 나타났다. 전세수급지수는 전세 시장의 수요와 공급 균형을 나타내는 지표로, 기준값 100을 넘으면 수요가 공급보다 많은 상황을 의미한다. 월간 전세수급동향도 지난 10월 105.0을 기록하며, 2021년 10월 108.3 이후 48개월 만에 최고치를 기록했다.  전세 가격도 상승세가 이어지고 있다. 같은 날 서울 아파트 전세가격은 전주 대비 0.14% 오르며 43주 연속 상승했다. 지역별로는 서초(0.32%), 송파(0.28%), 강동(0.25%), 양천(0.21%), 강서(0.17%), 동작(0.17%), 영등포(0.16%) 등이 평균을 웃돌았다.  이 같은 전세난의 배경에는 정부의 10·15 부동산 대책 영향이 크다는 분석이다. 이번 대책으로 아파트 가격에 따라 주택담보대출 한도가 차등 적용되고, 규제지역의 주택담보인정비율(LTV)도 기존 70%에서 40%로 낮아지며 매매 수요가 위축됐다. 매수 대기 수요가 전세 시장으로 이동하며 전세 수요는 오히려 증가했다는 것이다.  하지만 전세 공급은 줄어들 수밖에 없는 구조가 됐다. 10·15 대책에 따라 그동안 규제에서 제외됐던 1주택자의 전세대출이 총부채원리금상환비율(DSR) 규제 대상에 포함되면서 대출 한도가 축소됐고, 갭투자(전세 끼고 매매)도 사실상 차단됐다.  여기에 서울 전역이 토지거래허가구역으로 지정되면서, 해당 지역에서 새로 주택을 매수할 경우 일정 기간 실거주 의무가 부과돼 최소 2년간 전세를 놓기 어렵다. 이로 인해 신규 매입 주택 중 전세로 공급될 수 있는 물량이 줄어들며 전세 시장의 공급 여력이 약화된 상황이다.  이처럼 전세 수급 불균형이 심화되자 대안 주거지로 오피스텔이 주목받고 있다. 오피스텔은 주택법상 ‘준주택’으로 분류돼 규제가 비교적 약하고, 실거주와 임대 활용이 모두 가능하다는 점이 강점이다. 실제로 오피스텔 담보대출의 LTV는 아파트보다 높은 최대 70%까지 적용되며, 실거주 의무나 자금조달계획서 제출 등도 대부분 면제된다. 아파트에서 사실상 어려워진 갭투자도 가능한 구조여서 실수요자뿐 아니라 투자 수요까지 빠르게 유입되는 모습이다.  부동산 업계 관계자는 “대출 규제 강화와 토지거래허가제 확대가 전세 수요 증가와 공급 축소를 동시에 불러온 상황으로, 입주 물량 감소까지 겹치면서 내년까지 전세난이 이어질 가능성이 높다”며 “이 같은 흐름 속에서 대체 주거지인 오피스텔의 거래량이 느는 등 수요 이동이 뚜렷하다. 다만 아파트보다 규제가 덜하다고 해서 무작정 투자하기보다는 향후 가치와 임대수익, 입지 등을 종합적으로 검토해야 한다”고 조언했다.  이러한 가운데 주거용 오피스텔 ‘롯데캐슬 르웨스트’에 대한 수요자들의 관심이 뜨겁다.  롯데건설이 서울 강서구 마곡도시개발사업지구 CP2블록에 선보인 ‘롯데캐슬 르웨스트’는 지하 6층~지상 15층 5개 동 규모의 복합 주거단지로, 오피스텔 전용 45~103㎡ 총 876실과 판매시설, 업무시설, 부대시설 등으로 이뤄졌다. 지난해 8월 준공돼 즉시 입주도 가능하다.  롯데캐슬 르웨스트는 지하철 5호선 마곡역과 9호선·공항철도 마곡나루역을 모두 이용할 수 있는 트리플 역세권 입지에 위치했으며, 단지 지하 2층에 직접 연결되는 통로가 마련돼 편리한 이동이 가능하다. 김포공항까지는 차량으로 10분, 인천국제공항까지는 30~40분 거리로, 국내외 여행은 물론 비즈니스 이동에도 최적의 환경을 제공한다.  현재 마곡지구에는 정보통신(IT), 바이오(BT), 나노(NT), 그린(GT)과 같은 연구개발 분야의 국내외 기업 200여 곳이 입주 계약을 마쳤고, LG사이언스파크, 롯데, 코오롱, 넥센, 에쓰-오일 등은 이미 입주를 완료했다. 최근에도 LG AI연구원, 대한항공, 에어제타, 이랜드그룹, DL그룹 등이 잇따라 터를 잡았으며, 대명소노그룹과 롯데건설 주요 사업부도 이전을 추진하고 있다. 롯데캐슬 르웨스트는 이러한 마곡산업단지를 도보로 이용할 수 있다.  생활 인프라도 풍부하다. 마곡 마이스(MICE) 복합단지 내 상업시설을 비롯해 수도권 서남권 최대 규모의 트레이더스 마곡점이 도보권에 있으며, LG아트센터, 이대서울병원 등 문화·의료 인프라도 잘 갖춰져 있다. 롯데몰(롯데백화점, 롯데시네마, 롯데마트) 김포공항점, NC백화점 등 대형 쇼핑몰 이용도 용이하다. 약 50만㎡ 규모로, 축구장 70개 크기에 달하는 서울식물원과 다양한 근린공원도 인근에 자리하고 있어 쾌적한 주거 환경을 제공한다.  신축 브랜드 단지에 걸맞은 차별화된 상품성도 갖췄다. 다채로운 평면 구성과 1.5룸, 2룸, 3룸 설계를 통해 1인 가구부터 4인 가구까지 라이프스타일에 따라 선택할 수 있도록 했다. 또 타입별로 발코니 면적을 제공해 실사용 공간을 넓혔다. 전용 69㎡ 타입은 3베이(bay) 판상형 구조로 설계해 통풍을 극대화했다. 전용 91㎡ 타입은 3면 개방 타워형으로 설계해 탁 트인 도심뷰를 누릴 수 있다. 현관 중문, 전기오븐, 세탁기, 건조기, 김치냉장고, 냉장고 등이 무상으로 제공되는 ‘풀 퍼니시드’ 시스템도 갖췄다.  지상 2층과 지하 2층에 마련된 커뮤니티는 지역 최고 수준을 자랑한다. 지상 2층에는 맘스라운지, 키즈카페, 1인 독서실, 스터디룸, 오픈스터디, 라이브러리, 라운지&바, 다이닝&카페, 와인라운지 등이 들어선다. 지하 2층에는 피트니스, 실내골프클럽, 스크린골프, 락커룸, GX(그룹운동)룸, 탈의실 등 운동시설이 마련돼 있다.  롯데캐슬 르웨스트 분양홍보관은 롯데캐슬 르웨스트 AVENUE 일원에서 운영 중이다.",https://n.news.naver.com/mnews/article/011/0004568724
2025-12-18 08:58:00,"한투, 국내 첫 IMA 상품 판매 시작…김성환 ""생산적 금융 인프라""","[서울경제]  한국투자증권은 국내 최초 종합투자계좌(IMA) 사업자로서 첫 IMA 상품을 출시하고 18일부터 판매를 시작한다고 밝혔다.  IMA는 증권사가 고객 예탁금을 모아 모험자본 등 기업금융 자산에 투자하고, 그 운용 실적에 따른 성과를 고객에게 돌려주는 원금 지급 의무형 실적배당 상품이다.  이번에 출시된 1호 IMA 상품은 2년 만기의 폐쇄형 구조로 설계됐으며, 최소 가입금액은 100만 원, 1인당 투자 한도는 없다. 판매 기간은 오는 23일까지이며, 한국투자증권 영업점과 홈페이지, 모바일트레이딩시스템(MTS) 등을 통해 가입할 수 있다. 실적 배당형 상품으로 사전에 확정된 수익률이 정해져 있지 않으며, 만기 시점의 자산 운용 성과와 자산가치에 따라 고객에게 지급되는 금액이 최종 결정된다.  운용 자산은 기업대출과 회사채, 인수금융 등 현금흐름이 비교적 안정적인 기업금융 자산을 중심으로 구성된다. 원금의 안정적 보전을 최우선으로 하면서 시장금리 대비 초과수익을 추구하는 것을 목표로 일반 개인투자자들이 직접 접근하기 어려웠던 비상장, 사모영역의 대체투자 자산에 분산 투자한다.  한국투자증권은 제도에 따른 모험자본 공급 의무를 충실히 이행하는 한편, 상품의 시장 반응과 운용 성과를 바탕으로 향후 단계적으로 고객군·만기·위험 수준별 다양한 IMA 상품을 선보일 계획이다. 김성환 한국투자증권 사장은 “IMA는 단순한 신상품이 아니라 자산관리와 기업금융을 연결하는 생산적 금융 인프라”라며 “발행어음 1호에 이어 IMA 1호 사업자로서 시장을 키우고 기준을 만드는 역할을 책임 있게 수행하겠다”고 말했다.",https://n.news.naver.com/mnews/article/011/0004568723
2025-12-18 08:52:00,"한미약품 목표가 37% '껑충'…""비만·MASH 치료제 성과 가시화""[Why 바이오]","[서울경제]  현대차증권은 18일 한미약품(128940)에 대해 비만 및 대사이상지방간염(MASH) 치료제 파이프라인이 본격화되면서 기업가치가 지속적으로 올라가고 있다고 평가했다. 목표주가를 기존 40만원에서 55만원으로 37.5% 상향 조정하고, 투자의견 '매수'를 제시했다. 전 거래일 종가는 43만4500원이다.  여노래 현대차증권 연구원은 ""에페글레나타이드는 지난 10월 국내 임상 3상 데이터를 발표하며 40주 시점에서 우수한 체중 감량 효과와 안전성을 입증했다""고 밝혔다. 내년 하반기 국내 출시가 예상되며, 가격 경쟁력을 바탕으로 시장 점유율 확보가 기대된다는 분석이다.  MASH 환자 대상 임상 2b상이 진행 중인 에피노페그듀타이드는 12월 말 임상이 종료되며, 내년 초 주요 임상 데이터(탑라인) 공개가 예상된다.  여 연구원은 ""파트너사 MSD(머크)의 기대치가 높은 상황""이라며 ""내년 1월 JP모건 헬스케어 컨퍼런스에서 MSD의 개발 현황 발표가 주목된다""고 말했다.  지난 11월 임상 2상을 시작한 HM15275는 2027년 결과 발표가 예상된다. 2030년 국내, 2031년 글로벌 출시를 목표로 하고 있다. 여 연구원은 ""최근 동일 기전의 레타트루타이드가 28%의 체중 감량 효과를 확인하면서, 빠른 체중 감소를 원하는 프리미엄 시장 수요가 형성될 것""이라고 전망했다.  지난 11월 임상 1상 승인 및 개시를 마친 HM17321은 내년 상반기 초기 결과 발표가 예상된다. 여 연구원은 ""기존 GLP-1 계열이 아닌 CRFR2 수용체를 타깃하는 비만 치료제로, 지방 감소뿐 아니라 근육 증가 효과를 보이는 First-in-Class 후보물질""이라며 ""GLP-1 비만 치료제와 병용하는 보조제 시장 수요를 확보할 수 있을 것""이라고 평가했다.    ; 한미약품 목표가 37% '껑충'…""비만·MASH 치료제 성과 가시화""[Why 바이오]",https://n.news.naver.com/mnews/article/011/0004568722
