날짜,제목,본문,링크
2025-12-04 17:22:00,"GS건설, 스틸 모듈러 최고층 짓는다","GS건설이 경기 시흥시 ‘시흥거모 공공주택지구’에서 국내 최고층 스틸 모듈러 아파트를 짓는다. 특허 기술로 모듈러 건축의 고도화를 보여주는 계기가 될 것이란 기대가 나온다.  GS건설은 LH(한국토지주택공사)가 발주한 ‘시흥거모 A-1블록 통합형 민간참여 공공주택건설사업’(조감도)에 대한 도급 계약을 체결했다고 4일 밝혔다. 이 단지는 총 6개 동, 801가구 규모다. 일반 철근콘크리트 구조의 아파트 3개 동과 스틸 모듈러로 지을 아파트 3개 동이 혼합된 단지로 조성된다. 스틸 모듈러 1개 동은 14층으로 기존 국내 최고층 스틸 모듈러 아파트가 될 전망이다. 공사비는 1858억원이고, 2029년 준공 예정이다.  이번 사업에는 GS건설이 특허를 보유한 고층 모듈러 내화 기술, 모듈 간 접합 기술 등이 적용될 예정이다. 고층 모듈러 내화 기술은 화재 발생 때 고온 환경에서도 구조체의 안정성을 유지하는 기술이다. 모듈 간 접합 기술은 정밀한 연결을 구현하고, 고층에서도 모듈을 빠르고 안전하게 조립하는 스틸 모듈러의 핵심 기술이다. GS건설은 축적된 기술을 바탕으로 작업 안전성과 공기 단축 효과를 확보할 계획이다.  GS건설 관계자는 “이번 사업은 국내 고층 모듈러 공동주택 시장의 변곡점이 될 것”이라며 “단순한 아파트 건설을 넘어 모듈러 건축의 기술 수준을 보여주는 계기가 될 수 있을 것”이라고 밝혔다.  GS건설은 인천 강화신문2단지와 GS칼텍스 여수공장 사무동 등에서 모듈러 프로젝트를 진행했다. 올해 준공한 인천 강화신문2단지는 모듈러 건축의 가능성을 보여줬다는 평가를 받는다.",https://n.news.naver.com/mnews/article/015/0005220294
2025-12-04 17:22:00,"""힘겹게 호흡하길래""…윤현민, 사우나서 시민 목숨 구했다","배우 윤현민이 위급한 상황에 처한 시민을 구했다.  윤현민은 지난 3일 자신의 사회관계망서비스(SNS)에 글을 올려 직접 겪은 일을 공유했다.  윤현민은 ""사우나에서 나오는 길에 한 분이 힘겹게 호흡을 하길래 119에 신고했다. 5분도 안 돼서 구급대원분들이 왔고, 응급처치를 해서 다행히 회복할 수 있었다""고 전했다.  이어 ""다시 한번 구급대원 분들에게 감사함을 느낀다""며 신속한 대응과 헌신에 존경과 감사를 표했다.  네티즌들은 윤현민의 눈썰미와 적극적인 대처가 자칫 위험한 상황으로 번질 뻔한 것을 막았다며 칭찬했다. 이들은 ""그냥 지나칠 수도 있는일인데 대단하다"", ""큰일했네"", ""이런 건 칭찬해줘야 한다"", ""멋있는 배우"" 등의 반응을 보였다.  윤현민은 야구선수 출신 배우로 2010년 뮤지컬 '김종욱 찾기'로 데뷔했다. 드라마 '마녀의 연애', '연애의 발견', '보라! 데보라', '내 딸, 금사월' 등에 출연했다. 현재는 KBS2 주말드라마 '화려한 날들'에 출연 중이며, 오는 11일부터 뮤지컬 '보니 앤 클라이드'로도 관객들과 만난다.",https://n.news.naver.com/mnews/article/015/0005220293
2025-12-04 17:21:00,"박윤영·주형철·홍원표…KT CEO 후보, 7명으로 압축","KT 차기 대표 선출을 위한 1차 대진표가 7명으로 압축됐다. 7명 중 6명은 전현직 KT 임원 출신이다.  4일 KT 등에 따르면 KT 이사후보추천위원회는 차기 대표 후보군을 34명에서 7명으로 압축하고, 대상자에게 통보했다. 명단엔 김철수 전 KT스카이라이프 사장, 김태호 전 서울교통공사 사장, 남규택 전 KT CS 사장, 박윤영 전 KT 기업부문장(사장), 이현석 KT 커스터머부문장(부사장), 주형철 전 청와대 경제보좌관, 홍원표 전 SK쉴더스 대표가 포함됐다.  KT 이사후보추천위는 오는 9일 두 차례 회의를 열어 최종 면접 대상자를 3~4인으로 압축한 쇼트리스트를 공개할 예정이다. 최종 후보는 16일 확정된다. KT 출신 후보 6명 중에선 박윤영 전 사장이 쇼트리스트에 포함될 가능성이 높다.  박 전 사장은 2019년과 2023년 대표 경선에서도 최종 후보군에 들었다. 기업 간 거래(B2B)와 신사업 분야 전문성이 강점이다. 2020년 초까지 구현모 대표와 공동으로 KT를 이끌었다. 최근 보안 사고로 내부 홍역을 앓고 있는 조직을 정비하는 데 적임이라는 평가가 나온다.  홍원표 전 대표는 삼성전자 사장, 삼성SDS 대표 등을 지내는 등 외부 경험이 많다는 것이 장점이다. 유일한 외부 인사인 주형철 전 보좌관은 SK커뮤니케이션즈 대표와 청와대 경제보좌관을 지내며 전문성과 정무 감각을 겸비했다는 평가다. 최종 후보는 내년 3월 정기 주주총회에서 대표로 선임될 예정이며 2029년 3월까지 KT를 이끈다.",https://n.news.naver.com/mnews/article/015/0005220292
2025-12-04 17:21:00,"새만금수변도시 분양, 최고 경쟁률 30 대 1","전북 군산 일대 새만금 경제권역(409㎢)에서 처음 분양된 주택용지의 최고 경쟁률이 30 대 1을 웃돈 것으로 나타났다. 내년 새만금 스마트 수변도시(조감도)에도 1만9000여 가구에 달하는 주택 용지가 순차적으로 공급될 예정이다.  새만금개발공사는 새만금 스마트 수변도시 1차 분양 결과 근린생활시설용지와 단독주택용지에서 최고 31 대 1의 분양 경쟁률을 기록했다고 4일 밝혔다.  이번 분양에서는 근린생활시설용지 2필지가 모두 낙찰됐다. 단독주택용지도 67필지 중 45필지가 주인을 찾았다. 단독주택용지(필지별 266~330㎡) 분양가는 1억5600만~1억9300만원이었다. 새만금개발공사는 대금 납부 조건으로 3년 무이자 분할납부(2년 거치)를 제시해 수요자의 부담을 낮췄다. 새만금개발공사는 분양 결과에 대해 “새만금 사업지역의 주거용지 기대감이 반영된 것”이라고 설명했다.  새만금지역에 들어서는 첫 주거지역인 새만금 스마트 수변도시에는 총 1만9525가구, 3만9000명이 거주할 수 있다. 새만금개발공사는 1만4500가구 규모의 공동주택 용지와 3800가구 규모의 주상복합 용지도 내년부터 차례로 분양할 방침이다.",https://n.news.naver.com/mnews/article/015/0005220291
2025-12-04 17:20:00,"""식당은 필수 시설인데""…레지던스 발목 잡는 규제","#. A 생활숙박시설(레지던스)은 인피니티 풀, 루프톱 라운지, 레스토랑 등 고급 호텔에 맞먹는 부대시설을 갖추고 연말 개장 준비에 한창이었다. 하지만 최근 지방자치단체가 식당 영업 신고를 받아들이지 않아 어려움을 겪고 있다. 건축허가 기준으로 레지던스 내 식당은 ‘부대시설’이다. 지자체는 “식당 영업 신고는 ‘근린생활시설’에만 내줄 수 있다”는 입장이었다.  4일 업계에 따르면 레지던스를 분양받은 소유자들이 각종 규제로 재산권을 행사하지 못하는 사례가 늘고 있다. 레지던스 필수 부대시설인 식당 영업이 가로막히는 사례가 대표적이다.  레지던스는 국토교통부 고시인 ‘생활숙박시설 건축 기준’에 따라 투숙객을 위한 조식 등을 제공하는 편의시설(레스토랑 등)을 의무적으로 갖춰야 한다. 건축 허가 단계부터 부대시설 설치가 강제된 것이다. 그런데 막상 건물이 완공된 후 소유주가 식당 영업 신고를 하려면 상당수 지자체는 이를 거부한다. 거부 사유는 건축물대장에 해당 공간이 ‘근린생활시설’이 아닌 ‘부대시설’로 표기돼 있다는 이유에서다.  이는 식품위생법 취지를 지자체가 기계적으로 해석한 탓이라는 지적이 나온다. 지자체 공무원은 관행적으로 ‘일반음식점 영업은 근린생활시설’이라는 공식을 적용해 왔다. 부대시설은 건물 이용자만 쓰는 부속 공간이라 외부 손님은 받을 수 없다는 논리다. 하지만 레지던스는 관광객을 위한 시설이고, 부대시설 역시 불특정 다수를 대상으로 운영된다. 더구나 식품위생법상 일반음식점 영업은 허가가 아닌 ‘신고’ 대상으로, 위생 기준과 시설 요건을 갖추면 받아들이는 게 원칙이다. 업계 관계자는 “식품위생법 어디에도 건축물대장상의 용도 표기를 이유로 식당 영업 신고를 받아들이지 않는 규정은 없다”고 강조했다.  지자체의 소극 행정은 혹시 모를 ‘용도 위반’ 시비에 휘말리지 않으려는 것으로 해석된다. 이 같은 문제를 해결하기 위해서는 관광호텔 등에 적용되는 ‘신고 의제’ 제도를 레지던스에도 도입해야 한다는 목소리가 나온다. 신고 의제는 관광진흥법상 관광사업자로 등록하면 개별 법령에 따른 숙박업이나 음식점 영업 신고를 이미 한 것으로 간주해 주는 제도다. 호텔 등은 이를 통해 ‘부대시설’ 표기만으로도 문제없이 식당을 운영하고 있다.  레지던스의 주거용 오피스텔 전환 등이 쉽지 않은 상황에서 본래 목적인 숙박업도 규제에 가로막히고 있다는 지적이다. 업계 관계자는 ""레지던스가 숙박시설로 자생력을 갖추려면 부대시설 정상화가 필수적""이라며 ""정부가 명확한 지침을 내리거나 입법 보완이 필요하다""고 말했다.",https://n.news.naver.com/mnews/article/015/0005220290
2025-12-04 17:19:00,"iM증권, 성평등가족부 주관 '가족친화기업 인증' 획득","iM증권이 성평등가족부가 주관하는 가족친화기업 인증을 획득했다고 4일 밝혔다. 가족친화기업 인증은 근로자의 일·가정 양립을 지원하기 위해 운영되는 제도로, 출산과 양육, 유연근무 제도 등 가족친화제도를 모범적으로 운영하는 기업과 공공기관에 부여한다.  iM증권은 다양한 가족친화 제도 운영으로 가족친화 경영을 실천하고 있다. 자녀 출산 및 양육과 관련하여 여성 직원의 육아휴직 및 육아기 단축 제도를 운영하고 있는 것은 물론, 남성 직원이 자유롭게 육아휴직 등을 사용할 수 있도록 하고 있다.  시차출퇴근제 등 탄력적 근무제도도 운영하고 있으며, 가족돌봄 휴직과 휴가, 가족 건강검진 지원 제도 등을 통해 임직원의 일과 가정을 양립할 수 있도록 하고 있다.  iM증권은 이번 가족친화기업 인증 획득을 시작으로 가족친화 실행을 위한 다양한 제도를 지속적으로 확대하여 임직원이 일, 가정, 개인의 성장을 균형 있게 누릴 수 있는 기업문화를 정착시켜 나간다는 계획이다.  성무용 iM증권 사장은 “임직원의 행복은 회사의 성장을 지속할 수 있는 무엇보다 중요한 기반”이라며 “균형잡힌 일과 가정의 양립 환경 구축으로 가족친화 경영에 대한 만족감을 높여나갈 수 있도록 할 것” 이라고 밝혔다.",https://n.news.naver.com/mnews/article/015/0005220289
2025-12-04 17:19:00,"목동 1·2·3단지, 최고 49층 재건축 확정","재건축 사업 속도가 늦었던 서울 양천구 목동1·2·3단지가 최근 정비구역 지정을 마무리 지었다. 영등포구 여의도동 ‘꼬마 단지’ 화랑아파트는 조합을 설립해 재건축 대열에 합류했다.  양천구는 ‘목동1·2·3단지 재건축 정비계획 결정 및 정비구역 지정’을 고시했다고 4일 밝혔다. 목동신시가지 14개 단지에 대한 정비구역 지정이 모두 완료됐다. 목동신시가지에서는 재건축 사업으로 총 4만7438가구의 ‘미니 신도시’급 주거단지가 조성될 예정이다.  목동1·2·3단지는 나머지 11개 단지와 달리 제2종 일반주거지역으로 분류돼 사업성을 높이는 데 한계가 있었다. 양천구는 녹지 축 조성 부지를 공공기여받는 조건으로 제3종 일반주거지역으로 종 상향했다. ‘목동 그린웨이’로 불리는 이 사업은 국회대로 상부공원(추진 중)과 안양천을 연결하는 녹지를 조성하는 프로젝트다.  목동1·2·3단지는 최고 49층, 1만206가구 규모로 탈바꿈할 전망이다. 세 단지 중 규모가 가장 큰 곳은 1단지다. 기존 15층, 1882가구가 향후 3500가구로 재건축된다. 2단지(1640가구)와 3단지(1588가구)는 각각 3389가구, 3317가구로 변신한다.  같은 날 영등포구는 화랑아파트 소규모 재건축 사업의 조합설립을 인가했다. 소규모 재건축 사업은 200가구 미만이면서 대지면적 1만㎡ 미만인 노후 공동주택을 정비하는 프로젝트다. 지어진 지 50년가량 된 이 단지는 지상 47층, 244가구의 초고층 아파트로 재탄생할 전망이다.",https://n.news.naver.com/mnews/article/015/0005220288
2025-12-04 17:19:00,"리차드 텅 ""10월 대규모 청산에 6억달러 투입…사용자 보호가 최대 경쟁력"" [코인터뷰:BBW2025]","""사용자 손실을 외면하지 않겠다. 바이낸스의 가장 큰 강점은 안전한 거래 환경과 신뢰도 구축에 있다""  리차드 텅 바이낸스 최고경영자가 지난 10월10일 글로벌 급락장에서 사용자 보상과 굿윌 페이먼트로 총 6억달러를 투입한 배경을 이렇게 설명했다. 그는 단기 비용을 감수하더라도 안전한 거래 환경과 신뢰 회복이 결국 바이낸스의 가장 큰 경쟁력이 된다고 강조했다.  리차드 텅 바이낸스 최고경영자는 4일(현지시간) 바이낸스블록체인위크2025(Binance Blockchain Week 2025)에서 진행한 언론 인터뷰를 통해 ""다른 중앙화 거래소와 디파이 프로토콜은 어떤 굿윌 보상도 하지 않았지만 우리는 사용자와 고통을 나누기 위해 6억달러를 부담했다""고 말했다. 그는 이번 사태가 가상자산 특유의 문제가 아니라 희토류 수출 규제와 100% 관세 발표로 촉발된 전형적인 글로벌 매크로 이벤트였다고 강조했다.  텅 최고경영자에 따르면 당시 미국 증시에서는 하루 동안 시가총액 1조5000억달러가 증발했고 강제 청산 규모만 1500억달러에 달했다. 가상자산 시장에서도 약 190억달러 규모의 청산이 45분 안에 몰렸다. 이더리움 네트워크 가스 수수료가 평소보다 200배 급등하면서 스테이블코인 송금까지 막히자 유동성이 더 빠르게 말랐고 중앙화 거래소와 디파이 프로토콜을 가리지 않고 손실이 발생했다.  바이낸스는 이 과정에서 발생한 자체 전송 지연과 일부 토큰 가격 괴리에 대해 전액 책임을 인정하고 약 3억달러를 직접 보상했다. 여기에 더해 텅 최고경영자는 ""법적 책임이 없는 부분까지도 가장 많이 피해를 본 이용자를 추려 추가 3억달러를 지급했다""고 했다. 그는 이런 결정이 ""사용자 보호를 최우선에 두겠다는 회사 철학의 연장선""이라고 설명했다.  보상 재원은 바이낸스가 수년 동안 쌓아온 SAFU 펀드와 자체 자본에서 나왔다. SAFU 펀드는 바이낸스가 규제 당국 요구 이전에 먼저 만든 사용자 보호 기금으로 현재 규모는 약 10억달러 수준이다. 텅 최고경영자는 ""우리는 보안과 컴플라이언스에 과투자한다는 비판을 들어도 좋다""며 ""플랫폼이 커지면서 이 영역을 소홀히 한 경쟁사들은 반복적으로 해킹을 당하고 있다""고 지적했다.  그는 중앙화 거래소뿐 아니라 디파이 프로토콜 전통 금융회사까지 모두 해킹 리스크에서 자유롭지 않다고 선을 그었다. 다만 ""보안과 감시 인프라에 얼마나 투자했느냐가 차이를 만든다""며 ""다른 거래소에서 사고가 터질 때마다 자금이 바이낸스로 이동하는 이유가 여기에 있다""고 말했다. 실제로 바이낸스는 보안 사고 시 사용자 자산 유출을 막기 위한 실시간 모니터링과 이상 거래 탐지 시스템을 운영하고 있다는 설명이다.  텅 최고경영자는 토큰화 열풍과 관련해 ""블록체인 기술의 핵심 실사용 사례(Use case) 중 하나""라고 규정했다. 그는 스테이블코인과 가상자산 결제에 이어 자산 토큰화가 전통 금융과 웹3를 잇는 세 번째 축이 될 것이라고 내다봤다. 바이낸스는 프랭클린템플턴과 블랙록 등 글로벌 자산운용사와 토큰화 협력을 진행 중이며 웹2 금융 인프라와 웹3 네트워크의 결합을 지원하는 역할을 자임하고 있다.  인공지능(AI) 활용에 대한 이야기도 이어졌다. 텅 최고경영자는 ""이제 바이낸스 코드의 40%가 AI를 통해 작성된다""고 밝혔다. 고객 문의 대응과 문서 위조 탐지 같은 기초 업무에서 거래 모니터링 시세 조작 감시 내부 운영 효율화까지 회사 전 영역에 AI를 도입했다는 것이다. 그는 ""AI와 블록체인은 향후 5년에서 10년 사이 거의 모든 산업 구조를 다시 짜게 될 것""이라며 ""이 기술을 빨리 흡수한 기업이 그렇지 못한 기업보다 압도적인 우위를 점하게 된다""고 말했다.  결제 부문에서는 바이낸스 페이가 핵심 실험장으로 꼽혔다. 서비스 출범 3년 만에 누적 결제 처리액은 2720억달러 수준이고 가맹점 수는 올해 초 1만2000곳에서 최근 2100만곳으로 급증했다. 텅 최고경영자는 ""부탄 왕국은 올해 바이낸스 페이를 기반으로 국가 단위 암호화폐 결제 시스템을 도입했고, 항공권 숙박 현지 상점 결제까지 모두 바이낸스 페이로 처리할 수 있다""며 ""이 같은 국가 단위 사례를 여러 지역으로 확대하겠다""고 했다.  규제 대응 전략에 대해서는 ""지금도 전 세계 규제 당국의 3분의 1만이 가상자산 규제 틀을 갖췄다""며 ""나머지 3분의 2와는 기본 개념부터 설명하며 같이 만들어가는 단계""라고 말했다. 바이낸스는 현재 21개 국가에서 인허가를 받았고 전체 인력의 22%인 약 1300명이 컴플라이언스 조직에 속해 있다. 그는 ""규제를 비용이 아니라 경쟁력으로 만들겠다""며 ""규제 리스크를 감당할 여력이 없는 중소 사업자와의 격차가 벌어질 것""이라고 내다봤다.  리차드 텅은 지난 3일 허이 공동창립자와 함께 공동최고경영자(Co-CEO) 체제를 공식화했다. 그는 ""우리는 처음부터 사용자 우선이라는 하나의 목표를 공유해 왔다""며 ""최고 수준의 보안과 규제 준수 사용자 경험을 동시에 갖춘 플랫폼을 만들고 다음 단계로 3억명 이후의 '차기 10억명' 사용자를 온보딩하는 것이 공동 목표""라고 말했다.  <블록체인·가상자산(코인) 투자 정보 플랫폼(앱) '블루밍비트'에서 더 많은 소식을 받아보실 수 있습니다>  두바이=이영민 블루밍비트 기자 20min@bloomingbit.io",https://n.news.naver.com/mnews/article/015/0005220287
2025-12-04 17:18:00,[속보] 법원 '1인1표제 의결 무효' 민주당원 가처분 신청 기각,"정청래 더불어민주당 대표가 추진하는 '1인1표제'는 정당성이 없다면서 무효임을 확인해달라는 가처분 신청을 당원들이 냈지만, 법원은 받아들이지 않았다.  서울남부지법 민사합의51부(권성수 수석부장판사)는 지난달 24일 민주당을 상대로 당원 954명이 낸 '당헌·당규 개정안 의결 무효확인' 가처분 신청을 4일 기각했다.  이에 따라 민주당은 계획대로 오는 5일 중앙위원회를 열고 1인1표제 도입을 위한 당헌·당규 개정안을 의결할 수 있게 됐다.",https://n.news.naver.com/mnews/article/015/0005220286
2025-12-04 17:17:00,"'현지누나' 파문 이틀 만에 김남국 사의…대통령실 ""수리"" [종합]","'인사청탁 논란'에 휩싸인 김남국 대통령실 디지털소통비서관이 4일 사직했다.  대통령실은 이날 기자들에게 보낸 공지에서 ""김 비서관이 오늘 대통령비서실에 사직서를 제출했으며, 해당 사직서는 수리됐다""고 밝혔다.  김 비서관은 이날 오후 용산 대통령실에서 이재명 대통령이 주재한 수석보좌관 회의에도 참석하지 않았다.  이와 관련해 강유정 대통령실 대변인은 브리핑에서 ""김 비서관에 대한 엄중경고와 강한 질책이 있었다""며 ""이후 김 비서관 스스로 국정에 부담이 될 수 있다는 점을 우려해 직접 사의를 밝힌 것""이라고 설명했다.  앞서 김 비서관은 더불어민주당 문진석 원내수석부대표와 인사청탁 성격의 문자 메시지를 주고받은 사실이 드러나면서 논란이 됐다.  문 수석부대표는 지난 2일 국회 본회의 도중 김 비서관에게 휴대전화 메신저로 같은 대학 출신 특정 인사를 한국자동차산업협회장에 추천해달라고 부탁하는 문자를 보냈다.  이에 김 비서관은 문자로 '훈식이 형(강훈식 비서실장)이랑 현지 누나(김현지 제1부속실장)한테 추천할게요'라고 답변했는데, 이후 문 수석부대표의 휴대전화 화면이 일부 언론의 카메라에 포착되면서 양측 대화 내용도 고스란히 노출됐다.  다만 대통령실은 실제로 강 실장이나 김 실장에 대한 인사 청탁 행위가 벌어지진 않았다고 일축했다.  강 대변인은 '민간 단체 협회장직에 대해 대통령실이 개입하는 것이 옳은 일이냐'는 물음에 ""사실이 아니므로 해당 질문에는 답을 하지 않겠다. 개입이 없었단 의미""라고 말했다.  '인사수석이 아닌 제1부속실장 등 다른 직책의 참모들에게 인사 청탁이 들어가는 경우가 있느냐'는 질문이 재차 나왔으나, 강 대변인은 이에 대해서도 ""제가 아는 한 그런 일은 없다. 부속실장은 인사와 관련된 자리가 아니다""라고 선을 그었다.",https://n.news.naver.com/mnews/article/015/0005220285
