날짜,제목,본문,링크
2025-12-15 15:15:00,"카카오페이의 오프라인 간편결제 선도 전략…""모두에게 이로운 생태계""","간편결제 전쟁이 온라인에서 오프라인으로 번지는 가운데 카카오 계열사 카카오페이는 차별화 전략을 통해 오프라인 간편결제 시장 변화를 이끌고 있다. QR 테이블오더, 초개인화 결제혜택 등을 무기로 오프라인 결제 영역을 확대하며 시장 변화를 선도한다는 계획이다.  15일 카카오페이에 따르면 이 회사의 오프라인 결제액은 두 자릿수 이상으로 급증하고 있다. 올해 3분기 카카오페이 오프라인 결제 거래액은 지난해 같은 기간보다 46% 급증했다. 앞서 올해 1분기와 2분기에는 각각 42%, 35% 증가한 데 이어 증가폭을 키운 모양새다. 지난해에는 증감률이 공개된 2~4분기 동안 꾸준히 130%대 증가율을 기록한 바 있다.  카카오페이 오프라인 결제 성장 요인으로는 차별화된 전략이 꼽힌다. 하드웨어가 아닌 디지털 채널에 집중하는 독자적인 노선과 함께 생성형 인공지능(AI) 서비스를 접목한 맞춤형 혜택 체계로 결제 사용자와 가맹점, 단계별 사업자 등 '모두에게 이로운 시장'으로 이끌어간다는 청사진이다.  카카오페이는 밴(VAN), 포스(POS) 등 오프라인 결제 단계별 사업자들과 손잡고 독자적인 QR 테이블오더 생태계를 만들며 시장을 확대하고 있다.  전용 결제 단말기 사업과 비교해 기존 시장 참여자들의 몫을 침해하지 않는다는 게 카카오페이 측 설명이다. 여기에 주목도가 높은 카카오의 지식재산권(IP)과 카카오페이의 마케팅 툴을 지원해 소상공인 사업장에 결제 수단 이상의 솔루션 패키지로 기능하게 한다는 전략이다. 가맹점의 비용부담이 적고 기존 결제망 네트워크를 활용할 수 있어 시장 확대에도 유리한 전략으로 평가된다.  아울러 맞춤형으로 제공하는 결제 혜택 풀은 사용자를 끌어모으는 유인으로 작용하고 있다. 일례로 올해 2월 32개 브랜드를 대상으로 조건 없는 상시 할인 혜택을 선보이며 출범한 '굿딜'은 현재 두 배가 넘는 브랜드로 대상을 확대하며 혜택 폭을 넓히고 있다.  굿딜의 3분기 거래금액은 전분기 대비 250% 치솟았고, 사용자는 150% 증가하며 높은 관심도를 증명했다. 인기 브랜드를 대상으로 매달 릴레이 제휴 할인을 제공하는 '꼬리에 꼬리를 무는 할인 페스티벌, 꼬.꼬.페'도 꾸준한 관심을 받고 있다고 전했다. 특히 매 회차 30~40%의 사용자가 '꼬.꼬.페'를 통해 해당 브랜드에서 처음으로 카카오페이 결제를 경험하는 등 소비자와 가맹점을 잇는 효과가 뚜렷하다는 분석이다.  카카오페이는 오프라인 결제 시 QR·바코드, 삼성페이 기능 등 결제 방식에 따라 월 최대 3만원까지 카카오페이포인트를 적립해준다. 이와 함께 삼성월렛에서도 카카오페이머니로 결제할 수 있게 하는 등 결제 사용자의 혜택과 편의를 늘리고 있다.  사용자 맞춤형 혜택 제공을 위한 데이터 기반 '초개인화'에도 공을 들이고 있다.  카카오페이의 생성형 AI 서비스 브랜드인 '페이아이'는 지난 10월 사용자의 현명한 소비를 돕는 'AI로 나만의 혜택 찾기'의 베타서비스를 시작했다. 사용자의 결제 데이터 및 마이데이터를 활용해 결제처와 결제 금액에 맞춰 최적의 결제 수단을 알려주는 서비스다. 사용자가 보유한 신용카드별 실적 현황과 놓치기 쉬운 혜택도 알려주고 소비 패턴을 분석해 맞춤형 카드를 제안하기도 한다. 월간 소비 내역을 분석해 다음달 혜택을 극대화하기 위한 전략을 제안하는 '소비 리포트' 등을 추가하는 등 서비스를 꾸준히 고도화한다는 계획이다.  카카오페이는 오프라인 시장에서 입지를 탄탄히 한다는 계획이다. 지난 7월 국내 플랫폼 기반 간편결제사 중 처음으로 월간 오프라인 결제 사용자가 500만명을 돌파했다. 카카오페이는 2027년까지 사용자를 두 배 수준인 1000만명으로 끌어올리겠다는 포부를 밝힌 바 있다.  카카오페이는 ""앞서 있는 결제 인프라와 차별화된 디지털 채널 기반 전략, 강력한 맞춤형 혜택 프로그램으로 오프라인 간편결제 시장 선두권을 더 공고히 할 것""이라며 ""오프라인 결제 사용자는 물론 가맹점과 프로세스별 사업자 모두 카카오페이 하나로 가장 좋은 혜택과 사업성을 경험할 수 있는 '모두에게 이로운 생태계'를 만들겠다""고 밝혔다.",https://n.news.naver.com/mnews/article/015/0005224578
2025-12-15 15:14:00,"""겨울인데 가격이""…딸기빙수 한 그릇에 10만원 넘어섰다",호텔신라에서 운영하는 서울신라호텔에서 판매하는 딸기빙수 가격이 10만원을 넘어섰다.  신라호텔은 오는 16일부터 내년 3월 7일까지 판매하는 올해 겨울 딸기빙수 가격을 10만2000원으로 책정했다고 공지했다. 지난해 9만8000원 대비 4.1% 인상된 가격이다.  한국농수산식품유통공사(aT)에 따르면 딸기 소매가격은 지난 12일 기준 100g에 2420원으로 1년 전보다 10% 떨어졌다. 재룟값 하락에도 신라호텔은 빙수 가격 인상을 단행했다.  애플망고빙수(애망빙) 유행을 선도한 신라호텔은 애플망고빙수를 지난해 10만2000원에 판매하며 10만원 대 가격에 진입한 바 있다. 올해 여름에는 가격을 11만원으로 7.8% 더 올렸다.  이번 달에는 크리스마스를 맞아 50만원짜리 초고가 케이크 '더 파이니스트 럭셔리'도 선보여 물가 인상을 주도한다는 비판도 나왔다.,https://n.news.naver.com/mnews/article/015/0005224577
2025-12-15 15:09:00,"LS전선, 美 희토류 자석공장 설립 추진…전략자산 확보","LS전선이 미국에 1조원을 투자해 희토류 영구자석 공장을 구축하는 방안을 추진하고 있다. 희토류 자석은 전기차, 풍력발전기, 로봇, 전투기 등 첨단 산업에 필수적인 소재다.  LS전선은 미국 버지니아주 체서피크시에 신규 투자 후보지를 선정하고 희토류 영구자석 공장 설립에 대한 사업 타당성을 검토 중이라고 15일 밝혔다. 신규 공장은 LS전선이 건설 중인 해저케이블 공장 인근인 체서피크 햄프턴 로즈 지역에 부지가 마련될 전망이다.  LS전선이 지난 12일 버지니아주 체서피크시에서 열린 투자발표회에서 밝힌 내용에 따르면 투자비는 6억8900만달러(1조원) 규모로, 430개 이상의 새로운 일자리를 창출할 것으로 예상이다. LS전선은 버지니아주와 협력 방안에 대한 논의도 본격화할 계획이다.  희토류 자석은 글로벌 생산의 약 85%를 중국이 차지하고 있으며, 미국 내 생산 기업은 극소수에 불과하다. 생산된 희토류 자석은 주요 완성차 업체와 전장 기업 등에 공급될 예정이다.  LS전선은 희토류 산화물 확보부터 금속화, 자석 제조에 이르는 밸류체인(가치사슬) 구축을 추진하고 있다. 이를 위해 자회사 LS에코에너지를 통해 베트남, 호주 등에서 정제된 희토류 산화물을 확보하고 금속화하는 사업을 추진 중이다.  아울러 LS전선은 미국 현지에서 세각선(구리선)과 고품질 구리 소재를 생산하는 방안도 검토 중이다. LS전선은 이미 제너럴모터스(GM), 현대차 등에 세각선을 공급하고 있으며, 영구자석 생산까지 갖추면 모빌리티 핵심 소재 경쟁력은 더욱 강화하게 된다.  업계에선 LS전선이 미국에 희토류 공장을 세운다면 미국은 물론 한국 에너지 안보 및 공급망 다변화에도 보탬이 될 것으로 보고 있다. LS전선 관계자는 “사업이 현실화하면 케이블 중심의 사업을 전략 소재 분야로 확장하는 새로운 성장축이 될 것”이라고 강조했다.",https://n.news.naver.com/mnews/article/015/0005224576
2025-12-15 15:04:00,"광주은행, 차기 은행장에 정일선 부행장 단독 후보 추천","광주은행은 정일선 광주은행 부행장을 차기 광주은행장 후보로 단독 추천했다고 15일 밝혔다.  광주은행은 이날 열린 임원추천위원회에서 정 부행장을 단독 후보로 추천하고, 오는 17일 이사회와 주주총회를 열어 차기 행장을 최종 확정·발표할 예정이다.  정 부행장은 1995년 한림대학교 경영학과를 졸업하고 같은 해 광주은행에 입행한 내부 출신 인사다.  그는 여신지원팀 팀장과 첨단2산단지점장, 포용금융센터장 등을 역임하며 여신 심사·관리와 영업 부문에서 전문성을 쌓았고, 2021년 인사지원부장으로 이동해 조직 운영과 인사 제도 전반을 총괄했다.  2023년 부행장보, 2024년 부행장으로 연이어 승진한 정 부행장은 은행 내부에서 업무 전반에 대한 이해도가 높고 조직 관리 역량과 리더십을 두루 갖췄다고 평가받는다.  현 고병일 은행장은 차기 행장 최종 후보로 추천받았으나 고사 의사를 전달한 것으로 알려졌다.  은행권 관계자는 ""고 은행장이 내부 출신 인사가 차기 행장에 오를 수 있도록 후보 경쟁 구도를 펼친 뒤 최종 단계에서 스스로 물러나는 방식으로 후배들에게 길을 터준 것으로 알고 있다""고 말했다.    고 은행장은 2023년 1월 제14대 광주은행장으로 취임한 뒤 한 차례 연임에 성공했다.  재임 동안 지역 기반의 상생 경영을 강화해 광주·전남 대표은행으로서 광주은행의 위상을 한층 공고히 했다는 평가를 받는다.  취임 직후 최대 현안으로 꼽혔던 광주시 금고를 지켜냈고, 토스뱅크와의 협업을 통해 금융권 최초의 공동대출 상품을 선보이며 사업 영역 확장에도 기여했다.  광주은행은 2024년 사상 최대 수준의 순이익을 기록하고 지역 금융기관 평가에서도 잇따라 최고 등급을 받았다.  정 부행장이 최종 선임되면 광주은행은 제13대 송종욱 은행장(2017~2022), 제14대 고병일 은행장(2023~2025)에 이어 세 번째 내부 출신 광주은행장을 배출한다.  광주=임동률 기자",https://n.news.naver.com/mnews/article/015/0005224575
2025-12-15 15:02:00,"골든플래닛, 기업 데이터 구조 이해하는 AI 에이전트 ‘제노바 넥서스 GA4’ 12월 15일 출시","AI 데이터 전문기업 골든플래닛이 기업 고유의 데이터 구조까지 이해하고 분석하는 차세대 데이터 분석 AI 에이전트 ‘제노바 넥서스 GA4(Genova Nexus GA4)’를 오는 15일 정식 출시한다고 밝혔다.  이번에 출시되는 ‘제노바 넥서스 GA4’는 시중의 범용 생성형 AI 모델들이 가진 데이터 분석의 한계를 기술적으로 극복했다는 점에서 출시 전부터 업계의 주목을 받아 왔다.  기존의 범용 LLM(거대언어모델) 서비스들은 기업이 구글 애널리틱스 4(GA4) 에서 자체 설정한 ‘맞춤 정의(Custom Definition)’ 정보를 인식하지 못했다. 이로 인해 복잡한 비즈니스 질의에 대해 없는 데이터를 지어내는 ‘할루시네이션(환각)’ 현상을 보이거나, 비효율적인 조회 명령어(SQL)를 생성하는 등 실무 적용에 한계가 있었다. 또한, 보안상의 이유로 기업의 민감한 데이터 구조를 외부 AI에 입력하는 것 역시 제약이 따랐다.  반면, ‘제노바 넥서스 GA4’는 골든플래닛의 독자 기술을 통해 기업별 고유의 데이터 스키마와 맞춤 정의를 안전하게 연동한다. 이를 통해 일반 AI는 접근 불가능한 비공개 데이터 영역까지 정확하게 파악하여 최적화된 분석 코드를 생성해낸다.  실무 활용성도 대폭 강화됐다. 마케터나 데이터 분석가가 별도의 가공 없이 일상 언어로 질문하면 즉시 심층 분석 결과를 얻을 수 있다.  예를 들어 “메인 퍼널(상세 조회→장바구니→결제) 중 이탈률이 가장 높은 단계는 어디야?”, “신규 방문자와 재방문자의 매출 기여도 차이를 비교해줘”, “유료 광고(Paid)와 자연 검색(Organic)의 성과 추이를 보여줘”라고 질문하면, AI 에이전트가 ▲빅쿼리(BigQuery) 조회용 SQL 구문 생성 ▲예상 처리 용량 및 비용 산출 ▲데이터 조회 및 시각화 결과 제시까지 전 과정을 자동으로 수행한다.  특히 단순 코딩 지원을 넘어선 강력한 ‘실행(Execution)’ 능력이 강점이다. 기존 툴은 코드를 생성해도 사용자가 이를 복사해 별도 시스템에서 실행해야 하는 번거로움이 있었다. 제노바 넥서스 GA4는 질문의 의도 파악부터 쿼리 실행, 시각화까지 하나의 플랫폼에서 원스톱으로 처리하는 진정한 ‘에이전트(Agent)’ 역할을 수행한다.  이를 통해 기업의 데이터 전문가들은 반복적인 쿼리 작성 업무에서 해방되고, AI가 도출한 인사이트를 바탕으로 고도화된 마케팅 전략 수립 등 핵심 업무에 집중할 수 있을 전망이다.  골든플래닛 김동성 대표는 “제노바 넥서스 GA4는 단순한 챗봇이 아니라, 기업 데이터의 맥락(Context)을 깊이 있게 이해하고 스스로 행동하는 ‘전문가형 AI 에이전트’”라며, “기업 내부 데이터 구조를 이해하지 못하는 일반 AI 서비스와는 차원이 다른 정확도와 업무 효율을 경험하게 될 것”이라고 강조했다.  한편, 골든플래닛은 12월 15일 정식 런칭과 함께 자사의 GA4 컨설팅 및 운영 서비스를 이용 중인 기존 기업 고객들을 대상으로 우선적인 도입 혜택을 제공한다. 이를 통해 파트너사들의 데이터 활용 역량을 즉각적으로 고도화하고, 검증된 성공 사례를 바탕으로 향후 전체 엔터프라이즈 시장으로 서비스 저변을 넓혀갈 계획이다.  골든플래닛은 2009년 설립된 AI 및 빅데이터 기술 중심 기업으로, 산업별 맞춤형 AI 솔루션과 AI 에이전트 기술을 공급하는 데 주력하고 있다. 또한, 구글 프리미어 파트너로서 ▲영상 AI 에이전트 ‘제노바 AI(Genova AI)’, ▲비전AI 기반 산업 자동화, ▲AI 상권분석 플랫폼 등 산업별 특화 솔루션을 공급 중이다.  한경닷컴 뉴스룸 open@hankyung.com",https://n.news.naver.com/mnews/article/015/0005224574
2025-12-15 15:01:00,'출산가정 지원 놓칠 뻔'…강남구가 2700만원 찾아줬다,"출산가정이 몰라서 못 받을 뻔한 취득세 감면을 강남구가 먼저 찾아 환급했다. 출산 정보와 세무 정보를 연계해 감면 누락 가구를 선제 발굴한 결과다. 서울 자치구 가운데 출산 세무 연계 방식은 강남구가 처음이라고 구는 밝혔다.  강남구는 출산·양육 주택 취득세 감면 제도의 실효성을 높이기 위해 출생신고 단계에서 감면 검토까지 이어지는 시스템을 정비했다고 15일 밝혔다. 출산 전후 일정 기간 내 주택을 취득한 부모에게 최대 500만원의 취득세를 공제하는 제도지만 당사자가 신청하지 않으면 혜택을 놓치기 쉽다는 게 구 설명이다. 개인정보 보호 해석이 불명확해 행정기관이 출산 정보와 과세 자료를 대조하기 어려웠던 점도 걸림돌이었다.  강남구는 출생신고 과정에서 취득세 감면 여부를 살필 수 있도록 절차를 손봤다. 지난 10월부터 통합출산신청서에 ‘취득세 감면 검토’ 항목을 신설해 제도를 안내하고, 동의를 기반으로 감면 가능성을 확인하는 방식이다. 개인정보보호위원회 결정 사례와 법적 검토를 거쳐 출산 정보와 세무 자료를 연계하는 적극행정도 추진했다.  구는 지난해부터 올해까지 출산 부모 정보 4707건과 취득세 재산세 등 세무 정보 5만540건을 대사해 감면 누락 가구를 찾아냈다. 시범 운영 한 달 만에 8가구를 추가로 발굴했고 환급액은 2700만원이었다.  이 가운데 5가구는 생애최초 주택취득 감면만 적용받고 있었지만 더 유리한 출산·양육 감면을 추가로 안내받아 환급을 받았다. 나머지 3가구는 감면 신청 자체를 하지 않아 전액 납부할 뻔했으나 구 안내로 환급 처리됐다.  조성명 강남구청장은 “정당한 감면 혜택이 누락되지 않도록 촘촘한 행정 시스템을 구축했다”며 “출산과 양육 부담을 덜 수 있는 정책을 이어가겠다”고 말했다.",https://n.news.naver.com/mnews/article/015/0005224573
2025-12-15 15:00:00,"경남은행사랑나눔재단, 사회공헌자의 날 기념 ‘경상남도지사 표창’","BNK경남은행은 경남은행사랑나눔재단(이사장 김태한)이 ‘2025년 경상남도 사회공헌자의 날 행사’에서 ‘경상남도지사 표창’을 수상했다고 15일 밝혔다.  올해로 3회째를 맞은 경상남도 사회공헌자의 날 행사는 경상남도의 사회공헌문화 확산에 기여한 공헌자에 대한 감사와 존경의 뜻을 담아 마련됐다.  BNK경남은행이 지난 2005년에 설립한 경남은행사랑나눔재단은 지역 사회와의 상생을 핵심 가치로 삼고 각종 사회공헌 사업과 활동을 수행하는 비영리 재단이다.  특히 취약계층 복지, 아동ㆍ청소년 교육 지원, 청년 미래역량 강화, 지역경제 활성화 등 다양한 분야에서 지속 가능한 사회공헌 활동을 펼치고 있다.  또 명절과 계절별 나눔 사업, 장학 사업, 재난구호 지원 등 실질적인 복지 안전망 구축에도 힘써왔다.  경남은행사랑나눔재단이 추진하고 있는 대표적인 사회공헌 사업으로는 경남과 울산지역 최대 가족 문예 행사로 자리매김한 ‘BNK경남은행 가족 문화 페스티벌(제34회 BNK경남은행 백일장 및 미술대회)', 경남오페라단을 후원하고 지역민들에게 문화예술 공연관람 기회를 무료로 제공하는 ‘오페라 관람 행사’ 등이 있다.  이외에도 저출산과 지역 인구 소멸이 사회문제로 현실화된 지역의 당면 위기를 함께 고민하고 극복하기 위해 지난 2024년 4월부터 ‘우리 경남ㆍ울산 살리기 프로젝트’를 추진 중이다.  경남은행사랑나눔재단 고영준 부이사장은 “이웃과 이웃, 지역과 지역이 함께 어깨동무하고 공동체를 이루며 행복한 세상을 만들어 가는데 도움이 되고자 경남은행사랑나눔재단을 운영하고 있다. 앞으로도 BNK경남은행과 경남은행사랑나눔재단은 사랑나눔 문화를 확산시키고 지역 사회 문제를 해결하기 위해 더욱 노력할 계획이다”고 말했다.  한편 경남은행사랑나눔재단은 지난 10일 경남은행사랑나눔재단 김태한 이사장(BNK경남은행 은행장)을 비롯해 임원들이 참가한 ‘2025년 제2차 정기 이사회’를 개최했다. 창원=김해연 기자",https://n.news.naver.com/mnews/article/015/0005224572
2025-12-15 14:59:00,"이이경 사생활 폭로자 근황…""지속적 협박 받고 있어""","배우 이이경의 사생활을 폭로한 독일인 여성 A씨는 ""폭로 이후 지속적인 협박과 신상 훼손을 당하고 있다""며 법적 대응을 예고했다.  A씨는 지난 14일 자신의 소셜미디어에 ""특정 배우를 폭로한 이후 지속적인 협박을 받아왔다""며 ""이틀 전부터는 내 신상을 훼손하기 위한 인스타그램 계정이 개설돼 앱으로 생성된 조작 카카오톡 대화 캡처와 동의 없이 유포된 사적인 사진이 게시됐다""고 주장했다.  그는 ""해당 계정이 처음 올린 카톡 대화가 지나치게 부자연스럽다는 점을 인지했는지 게시물을 삭제한 뒤 흐릿하게 편집해 재업로드했다""고도 했다.  A씨는 문제의 카카오톡 대화가 조작됐다고 거듭 주장하며 ""조작된 대화에 사용된 모자를 쓴 비행기 셀카는 배우 본인과 나만 소유하고 있는 사진""이라며 ""누군가 허위 서사를 만들기 위해 이를 사용했다면 출처는 명확하다""고 밝혔다. 이어 ""대화 생성 앱은 실제 카톡과 미묘한 차이를 두고 설계돼 있고, 이미지 내부에 생성 흔적이나 워터마크가 남는 경우가 많다""고 주장했다.  또 A씨는 ""해당 계정에는 내가 보관하지 않은, 오직 나와 배우 둘만 나눈 카톡 일부가 포함돼 있었고 가족 회사와 관련된 민감한 개인정보까지 노출돼 있었다""며 ""단순한 추측이나 제3자의 창작으로는 알 수 없는 정보로, 개인정보를 훼손하려는 명백한 의도가 있다""고 토로했다.  그러면서 ""조작된 카톡 대화 유포와 사적인 사진 유출, 신상 훼손 및 협박과 관련한 모든 증거를 기록·보관하고 있으며 더 이상 묵과하지 않고 법적 조치를 취하겠다""고 했다.  이번 논란은 A씨가 지난 10월 네이버 블로그에 ""이이경님 찐모습 노출합니다""라는 제목의 글을 올리며 불거졌다. 해당 글에는 배우로 추정되는 인물과 주고받았다는 카카오톡과 인스타그램 메시지, 신체 사진 요구와 욕설, 성희롱성 표현이 담겼고 촬영장으로 보이는 셀카도 함께 공개됐다.  이에 대해 이이경 측은 즉각 ""사실이 아니다""라고 반박했다. 이후 A씨는 한때 ""AI로 조작했다""고 사과했다가, 다시 ""AI는 거짓말을 한다""며 입장을 번복했고, 이후에는 ""AI는 연예인 사진을 만들 수 없고 내가 공개한 증거는 모두 진짜""라고 주장해 논란을 키웠다.  이이경 측은 A씨의 주장을 일관되게 부인하며 법적 대응에 나섰다. 이이경은 최근 고소장을 제출하고 고소인 조사를 마쳤으며, 법원은 지난 11월 21일 A씨 계정과 관련해 압수수색 영장을 발부한 것으로 전해졌다.  아울러 이이경 측은 A씨가 금전 협박을 목적으로 사전에 모의한 정황이 담긴 증거를 확보했다고 밝혔다. 제보 자료에는 A씨가 인스타그램 DM에서 ""회사에 메일 보내고 10억 정도 요구하면 될까?"", ""생활비도 부족해서 휴대폰을 팔았다""는 취지의 대화를 나눈 내용이 포함돼 있는 것으로 알려졌다.",https://n.news.naver.com/mnews/article/015/0005224571
2025-12-15 14:55:00,'K딸기' 4배나 비싼데 '이럴 줄은'…동남아서 인기 폭발한 이유,"한국 딸기가 SNS를 타고 해외에서 인기를 끌면서 딸기 수출액이 증가하고 있다  15일 대체데이터 플랫폼 한경에이셀(Aicel)에 따르면 딸기 시즌이 본격적으로 시작된 올해 12월 1~10일까지 딸기 수출액은 511만5187달러(약 75억3000만원)으로 전년동기 대비 25.6% 증가했다. 딸기 시즌이 막 들어선 지난달 20~30일까지의 수출액도 39만3097달러(약 5억7000만원)로 지난해 같은 기간 대비 22% 늘었다.  K딸기의 수출이 증가하는 건 틱톡 등 SNS에서 달고 맛있는 딸기로 입소문을 타면서다. 베트남 틱토커 꾸인 쯔엉이 올린 ‘한국 딸기 먹방’ 제목의 영상은 조회수 1570만회, 110만 개의 좋아요, 6876개의 댓글을 기록했다.    동남아 지역에서 K딸기는 프리미엄 취급받고 있다. 한국 딸기는 300g 기준 현지 딸기(500g 기준 4245~6792원)보다 3~4배 이상 비싼 1만6000원~2만1000원에 판매된다.  한국서 공부하는 베트남 유학생 리는 “베트남에서 딸기는 날씨가 쌀쌀한 산지 일부 지역에서만 자라는데 그마저도 작고 신맛이 강하다“며 “K딸기는 크기가 크고 당도가 높기 때문에 인기가 높다”고 말했다  K딸기의 인기에 힘입어 올해 2월 인도네시아 수도 자카르타에서 열린 ‘논산 딸기 축제’에는 43만명이 방문했다.  이소이 기자",https://n.news.naver.com/mnews/article/015/0005224570
