날짜,제목,본문,링크
2025-12-15 10:00:00,"""골프 더 이상 못 치겠어요""…2030 줄줄이 떠나자 '휘청' ['영포티' 세대전쟁]","영포티와 넥스트포티는 어떤 분야에선 치열하게 대립, 반목하는 세대로 인식되지만, 소비 시장에서는 트렌드를 주고받는 협력자에 가깝다. 유행의 씨앗은 넥스트포티가 뿌리지만, 이런 흐름을 시장의 주류로 안착시킨 주체는 대개 인구와 구매력을 갖춘 영포티 세대였다.  최근에는 영포티 세대가 먼저 열어둔 시장에 넥스트포티가 합류하며 판이 더 커지는 흐름도 나타나고 있다. 반대로 넥스트포티의 발길이 끊긴 시장은 성장 동력을 잃고 빠르게 식는 모습도 관측된다. 넥스트포티의 구매력이 세진 않더라도 판세를 키울 키를 쥔 '스윙보터'로 떠오르고 있다는 해석도 나온다. ◇ 1위 되려면 40대 잡아야 한다 쿠팡, 카카오톡, 네이버, 당근. 이들 1등 브랜드의 공통점은 40대 사용자가 가장 많다는 점이다. 넥스트포티가 트렌드를 시작하는 데 기여한다면, 40대는 이를 주류로 자리매김하는 데 일조하곤 한다. 쿠팡은 2021년까지만 해도 30대 사용자가 가장 많았다. 하지만 이듬해 40대 사용자가 1위가 됐다. 그리고 2023년 사상 첫 흑자를 냈다. 넥스트포티 사용자도 꾸준히 늘었지만, 구매력이 더 큰 영포티 세대가 합류하지 않았다면 불가능했을 성과다.   영포티 세대가 '큰 손'이라는 점을 노리고, 넥스트포티가 주 타깃이었다가 연령대를 높이려는 기업들도 하나둘 등장하고 있다. 패션업계 1위 애플리케이션(앱) 무신사가 그렇다. 2022년까지만 해도 40대의 무신사 앱 월간 활성 사용자 수(MAU·안드로이드+iOS·중복포함) 비율은 14.6%였다. 40대 비중은 매년 늘어나더니 올해 1~11월까지는 18.1%가 됐다. 반면 20대 MAU는 39.4%에서 36.0%로 줄었다.  무신사는 본래 20대의 주 무대라 할 수 있는 e커머스만 하다 영포티 세대에게도 어필할 수 있는 백화점 진출 및 오프라인 확장에 나서고 있다. 최근 용산에서 연 초대형 패션 편집숍 '무신사 메가스토어'에서는 기존 타깃인 젊은 층에서 나아가 40대까지 겨냥한 '무신사 워크&포멀' 존을 꾸렸다.   40대는 온라인에서 소통하는 방식도 넥스트포티에 가까워졌다. 그간 4050세대의 사회관계망서비스(SNS) 앱 1위는 모두 '네이버밴드'였다. 그런데 그중 40대가 이탈해 올해부터 '인스타그램'이 1위를 차지하기 시작했다. 와이즈앱·리테일은 ""40대가 젊은 세대가 주로 이용하는 SNS(인스타그램)로 이동한 것으로 보인다""며 ""네이버 밴드의 문자 중심 (온라인) 커뮤니티에서 시각 중심 SNS로 40대의 디지털 라이프스타일이 변화하고 있다""고 풀이했다.   전문가들은 영포티 세대가 먼저 움직인 넥스트포티의 문화를 수용하는 경향성이 있다고도 분석했다. 임명호 단국대 심리학과 교수는 ""젊은 세대는 문화를 선도하고 자신의 개성을 자유롭게 표현하는 세대다. 반면 4050세대는 상대적으로 유연성이 떨어지는 면이 있다""며 ""자신의 생활 방식과 현실적 조건 등을 고려해 2030세대의 문화를 수용하고 있다""고 해석했다. ◇ 20대가 40대 역전 앞선 사례처럼 트렌드가 마치 20대에서 시작된다는 통념도 있지만, 이는 사실 절반만 맞는 말이다. 영포티 세대가 먼저 선도하다 20대가 합류해 트렌드를 만든 경우도 있기 때문이다. 특히 '가성비' 영역에서 이러한 일이 확인된다.  테무가 한국에 진출하자마자 가장 먼저 핵심 소비층으로 자리매김한 것은 40대였다. 2022년 초만 하더라도 테무의 20대와 40대 MAU는 각각 35만과 46만이었다. 그런데 가장 최근인 지난 11월에는 각각 180만명과 200만명으로 늘었다. 처음에는 30% 차이가 났으나 최근에는 격차를 좁혀가더니 10% 정도 차이게 그치고 있는 셈이다.  국내에서 가성비라면 빠질 수 없는 균일가 생활용품점 다이소도 마찬가지다. 다이소 앱인 '다이소몰'의 연령대별 MAU를 분석해보면, 2023년까지만 해도 40대 30.3%, 30대 27.1%, 20대 20.9% 순이었다. 그런데 2024년에는 20대 29.0%, 30대 26.1%, 40대 23.2% 등 순으로 넥스트포티가 역전했다. 올해 1~11월도 20대 31.8%, 30대 24.9%, 40대 20.8% 등 순으로 20대 비중이 더 많이 늘어난 것으로 파악됐다.   고물가 시대 초 가성비에 가장 민감하며 반응하며 생존 전략을 모색한 게 40대였다면, 20대는 이를 디지털이라는 자신의 언어로 새로운 문화로 확산시킨 세대다. 이들은 각종 SNS에서 다이소나 테무에서 산 물건들과 관련된 콘텐츠를 확산시켰다. 일종의 '가성비 실험실'처럼 말이다. 지난해부터 SNS에선 다이소 주방용품을 결합해 만든 '다이소 DIY 쇠테리어'나 다이소 화장품 관련 콘텐츠가 그 예시다. 지난해 다이소의 영업이익은 전년 대비 42% 증가한 3712억원이었다.   최근에는 그간 상대적으로 품질이 떨어진다는 평가를 받던 다이소의 의류 품목이 20대의 환심을 사고 있다. 한 20대 여성이 ""다이소 기모 내복 이렇게 좋다고?""라고 올린 영상이 온라인에서 확산하며 이목을 끌었다. 영상 속 이 여성이 입은 상·하의는 각각 5000원이다. 누리꾼들은 ""싼 티가 전혀 나지 않는다""는 반응을 내놨다.  이밖에 유튜브 등에서는 '실시간 품절 중인 다이소 가성비 대란템' 등 제목의 이름으로 다이소의 플리스 등을 추천하는 영상이 조회수 30만회를 기록할 정도로 인기다. 한 유튜버는 ""두께감 하며 푹신한 털까지 5000원이라고는 전혀 안 믿긴다. 퀄리티가 장난 아니다""며 극찬했다. 다이소 공식 홈페이지를 비롯해 온라인에선 이러한 제품에 대해 ""가성비 짱이다. 따뜻하다"", ""이건 물건이다"" 등 긍정적인 후기가 올라오고 있다.  이른바 '어른이' 혹은 '키덜트'(어른 아이) 사례에서도 유사한 일이 있다. 2023년 '슬램덩크' 광풍이 대표적인 사례다. 당시 원작 슬램덩크의 리메이크 극장판인 '더 퍼스트 슬램덩크'가 영화로 개봉된 후, 만화책의 주 소비층이던 40대 외 2030세대 구매량이 급증한 것이다. 한세예스24홀딩스는 분기 매거진을 통해 ""영화 개봉 전까지는 '슬램덩크 신장재편판'을 찾는 주요 구매층이 40대 남성(33.9%)으로 나타났지만, 영화 개봉 이후 올 상반기에는 20대 여성(24.5%)과 30대 여성(20.0%)의 구매 비중이 가장 높았다""고 전했다.   여전히 월간 90만명의 사용자가 찾는 포켓몬도 성인 중 30대 25%, 20대 24%, 40대 19% 순으로 많이 한다. 2022년까지만 해도 어렸을 때 포켓몬을 보고 자라온 40대가 약 24%로 가장 많았는데 상황이 바뀌었다. ◇ 넥스트포티 빠지니 휘청이는 골프·명품 영포티 세대가 대세였던 시장에 20대가 유입돼 시장이 크게 성장했다가, 20대가 빠져나나가면서 시장이 휘청이는 일도 발생하고 있다.  스크린골프 예약 앱 1위인 골프존의 올해 누적 20대 MAU는 8.6%로 한창 젊은 층 사이에서 골프가 인기였던 2022년과 비교해 약 2%포인트 떨어졌다. 30대는 같은 기간 3%포인트(21.9%→18.7%) 넘게 하락했다. 40대와 50대 비중은 각각 2~4%포인트 늘어났다. 고점 대비 20대와 30대 사용자는 30%가 빠져나갔다. 40대와 50대는 각각 60만명과 30만명 안팎에서 움직이며 비슷한 수준을 유지 중이다. 골프존의 영업이익이 계속 악화되면서 2021년 말 19만원까지 올라가던 주가는 현재 6만원까지 떨어졌다. 업계 2위였던 카카오VX는 2023년 적자 후 2024년 적자 폭이 확대됐고, 올해 초 매각을 추진했으나 기업 가치 하락으로 난항을 겪고 있다. 이밖에 골프웨어 등을 취급하는 기업들이 철수하는 등 업계 파장이 커지고 있다.  명품 시장도 마찬가지 상황이다. 한때 2030세대 사용자가 절반을 차지하던 트렌비의 MAU는 40대가 42%로 압도적으로 높다. 한때 25%에 달하던 20대 사용자는 이제 절반 수준인 15%에 그치고 있다. 대표적인 럭셔리 쇼핑 앱인 발란과 머스트잇에서도 40대는 각각 30%, 29%로 가장 큰 비중으로 집계됐다. 팬데믹 당시 넥스트포티를 등에 업고 장밋빛 미래를 그리던 트렌비, 발란, 머스트잇의 지난해 매출은 전년 대비 각각 49%, 29%, 50% 급감했다. 국내 1위를 다투기도 하던 발란은 정산금 수백억을 지급하지 못하고 기업회생 절차를 밟게 됐다.  앤데믹(풍토병화) 후 고물가에 2030세대의 럭셔리 구매력이 사실상 소멸하면서 이러한 현상이 심화했다는 게 전문가들의 진단이다. 이홍주 숙명여대 소비자경제학과 교수는 ""4050세대는 유행을 필터링하는 세대""라면서 최근 현상에 대해선 ""4050세대는 품질이 좋거나 기능성이 있는 제품을 중시하고 2030세대는 보기에 예쁘면서도 가격이 저렴한 것을 중시하는 트렌드가 고착화되고 있다""고 말했다.  신현보/박수림 한경닷컴 기자",https://n.news.naver.com/mnews/article/015/0005224407
2025-12-15 09:59:00,"[속보] 내란특검 ""24명 기소…尹, 2023년 10월 이전 계엄 준비""",,https://n.news.naver.com/mnews/article/015/0005224406
2025-12-15 09:59:00,2030 몰리더니 삼성 또 '대박'…2개월 만에 100만명 '우르르',"삼성전자가 결제와 충전, 혜택을 결합한 단일 애플리케이션(앱) 출시한 지 약 2개월 만에 가입자 100만명 이상을 끌어모았다. 최근엔 삼성월렛 교통카드 기능에 서울시 기후동행카드를 포함하는 등 서비스 범위를 꾸준히 확장하고 있다.  삼성전자는 15일 충전식 간편결제 서비스 '삼성월렛 머니·포인트' 가입자 수가 100만명을 돌파했다고 밝혔다. 회사는 지난 10월16일 삼성월렛에서 결제부터 충전, 포인트 적립·사용까지 가능하도록 단일 앱을 출시했다고 밝혔다.  삼성월렛의 '혜택 탭'에 있는 '선물하기'를 통해 제품을 구매하면 결제 금액 중 일부가 포인트로 적립되는 혜택이 호응을 끌어냈다는 설명이다.  '삼성월렛 머니'는 실물 카드가 필요 없는 모바일 결제 수단이다. 사용자들은 기존에 쓰던 은행 계좌를 삼성월렛 머니와 연결해 활용할 수 있다. 삼성월렛 포인트는 삼성월렛 머니로 결제할 때마다 일정 금액이 포인트로 적립되는 리워드 서비스다. 포인트는 현금처럼 사용할 수 있다.  삼성월렛 머니·포인트는 적립 한도에 제한이 없다. 또 모든 오프라인 카드 가맹점에서 결제, 포인트 적립·사용이 가능하다.  삼성전자는 가입자 100만명을 기념해 여러 프로모션을 진행한다. 이날부터는 '삼성월렛 머니·포인트'로 결제하는 고객에게 결제 금액의 최대 10%를 삼성월렛 포인트로 적립이 이뤄진다. 결제 횟수에 따라 포인트를 추가 지급하는 혜택도 제공된다.  채원철 삼성전자 모바일경험(MX)사업부 디지털월렛팀장(부사장)은 ""삼성월렛 머니·포인트는 디지털 결제와 리워드 서비스의 통합을 통해 고객 편의성과 혜택을 크게 강화했다""며 ""앞으로도 더 다양하고 실질적인 혜택을 제공해 삼성월렛 생태계를 더 확장하는 한편 고객 가치를 지속적으로 높여 나가겠다""고 말했다.  삼성전자는 지난 12일에도 기후동행카드를 삼성월렛 교통카드에 연동했다고 밝혔다. 기후동행카드는 한 번 요금을 충전하면 일정 기간 대중교통을 무제한으로 이용할 수 있는 정기권으로 교통비를 절감할 수 있다. 삼성전자는 또 이심(eSIM)으로 개통한 스마트폰에서도 티머니 교통카드를 사용할 수 있도록 개선했다.  기후동행카드의 경우 갤럭시 워치에서도 사용 가능하다. 삼성월렛 교통카드 앱을 갤럭시 워치에 내려받은 다음 이즐 교통카드를 등록하면 된다.  삼성월렛은 올해로 출시된 이후 10년간 국내 가입자 1800만명 이상을 확보하면서 영향력을 키웠다. 젊은층에서도 인기가 높다. 국내 20~30대 갤럭시 사용자 10명 가운데 9명이 가입한 것으로 나타났다.  삼성월렛은 일상 속 경험을 유기적으로 연결하는 '라이프 허브'를 표방하고 있다.  채 부사장은 지난 8월 삼성전자 뉴스룸 기고를 통해 ""디지털 세상의 새로운 아이템을 담고 온라인 결제·신원 인증의 사용성을 강화하는 것은 물론 AI 기술을 통해 개인 맞춤형 서비스를 고도화하고 특히 온라인 결제 분야를 중심으로 고객 경험을 자동화·지능화하는 방향으로 발전할 계획""이라며 ""갤럭시 AI와 연계해 고객의 일상, 여행, 여가 전반을 통합적으로 연결하는 서비스를 확장할 것""이라고 했다.",https://n.news.naver.com/mnews/article/015/0005224405
2025-12-15 09:59:00,[단독] 회사채 캡티브 영업 제재 없이 가이드라인만…증권사 자율규제 수준 그쳐,"이 기사는 12월 12일 14:28 마켓인사이트에 게재된 기사입니다.   금융당국과 금융투자협회가 회사채 캡티브 영업과 관련된 가이드라인을 마련해 증권사와 공유한 것으로 확인됐다. 앞으로 증권사가 회사채를 주관할 때 증권사의 계열사인 자산운용사와 보험사 등이 해당 수요예측을 참여하려면 내부 보고절차를 거치도록 하는 내용이 골자다. 중장기적으로 발행금리 이하(낮은금리)로 수요예측에 참여할 경우 그 참여내역을 공시하는 방안까지 포함됐다. ▶본지 2월 27일자 A1, 3면 금감원, 회사채 수요예측 가이드라인 마련 12일 투자은행(IB)업계에 따르면 금융투자협회는 이같은 내용의 캡티브 규제안을 증권사에 공유하고 발표 전 마지막 의견을 수렴하고 있다. 금감원은 증권사 감사부, 금투협은 증권사 IB 기업금융부서를 통해 의견을 들은 것으로 알려졌다.  가이드라인은 법 개정 없이 즉시 시행할 수 있는 조치와 중장기적 제도 개선 과제로 나뉜다. 우선 내년부터 시행할 즉시 조치에는 증권사의 업무 매뉴얼 개정이 포함됐다. 회사채 주관 과정에서 IB 부서가 계열 금융사(보험사, 자산운용사)와 운용부서에 수요예측을 참여하도록 종용하는 행위를 금지하도록 규정했다. 이어 기업과 캡티브 관련 협의를 하는 행위를 금지하는 내용도 담겼다.  증권사는 이런 내용을 기반으로 체크리스트를 작성해 회사채 발행 전 과정을 관리해야 한다. 증권사는 주관사 계약 체결부터 수요예측 과정에서 투자자 배정 등 모든 기록을 자본시장법 시행령상 정해진 기간 동안 보존해야 한다.  특히 증권사의 계열사가 회사채를 1개월 내 처분하는 경우 수요예측에 왜 참여하고 매도했는지 그 사유와 매도가격을 기록해야 한다. 공모 회사채 발행을 담당하는 기업금융부서가 운용부서에 수요예측의 참여 대가를 지급하거나 손실을 보전하는 행위도 금지된다. 기업금융부서가 회사채 수요예측 참여용 ‘전략북’을 운용하는 행위도 금지된다.  중장기적으로 인수업무 규정 개정이 추진된다. ‘주관사가 발행사로부터 계열사 참여 요청을 받을 수 없다’는 내용을 인수업무 규정에 명문화하고, 계열사가 발행금리 이하(낮은 금리)로 수요예측에 참여했을 경우 그 참여 내역을 공시하는 방안도 추진할 예정이다.   ""증권사 제재없이 자율규제""   올해 초까지 회사채 수요예측에서는 계열사의 참여를 약속해 수임을 따내는 ‘캡티브 영업’ 관행이 퍼져있었다. 계열 자산운용사 보험사 등이 대거 참여하면 회사채를 발행하는 입장에서는 금리를 낮추는 효과가 있다.  증권사는 회사채 주관을 대가로 발행 기업의 요구대로 회사채를 인수했다가 발행 직후에 손해를 보며 매각하는 일이 반복됐다. 이로 인해 회사채 발행 금리가 왜곡되자 국민연금 등 연기금이 회사채 수요예측 참여를 외면하는 악영향이 발생하기도 했다. 금감원은 지난 4월부터 대형 증권사를 대상으로 캡티브 영업에 대한 조사를 본격화했다.  하지만 증권업계에서는 이번 자율 규제가 실효성이 낮을 것이라는 지적이 적지 않다. 가장 핵심인 계열 금융사를 동원한 수요예측 교란 행위에 대한 제재 조항이 빠진 채 내부 보고와 체크리스트만 강조됐기 때문이다.  이미 상당수 증권사가 계열사 참여 시 내부 보고 절차를 갖추고 있는 만큼 새로 도입되는 가이드라인이 실질적인 변화를 만들 가능성은 낮다는 지적이 나온다. 금감원이 제시한 체크리스트 역시 발행사가 캡티브 참여를 요구했는지 증권사 스스로 체크하는 수준에 그쳐 실효성이 떨어진다는 평가다.  한 IB업계 관계자는 “어떤 증권사가 발행사로부터 금리 요청을 받았다고 체크하겠느냐”며 “지금도 발행사에 금리를 제시하는 관행이 계속되고 있는데, 이런 자율 규제로는 시장 관행을 바꾸기 어렵다”고 지적했다.",https://n.news.naver.com/mnews/article/015/0005224404
2025-12-15 09:58:00,"[포토] 홈플러스, 18일부터 설 선물세트 사전예약",홈플러스가 오는 18일부터 내년 2월 6일까지 51일간 설날 선물세트 사전예약을 진행한다고 15일 밝혔다. 고물가 장기화로 명절 선물에 대한 고객 부담을 낮추기 위해 전체 품목의 78%를 5만원대 이하로 구성했다. 모델들이 서울 등촌동 ‘홈플러스 메가 푸드 마켓 라이브’ 강서점에서 ‘2026 설날 선물세트 사전예약’을 소개하고 있다.  / 홈플러스 제공,https://n.news.naver.com/mnews/article/015/0005224403
2025-12-15 09:55:00,"제주항공, 올해 정비 지연율 대폭 개선…정시 운항률도 ↑","제주항공은 올해 정비 지연율이 지난해에 비해 대폭 개선됐다고 15일 밝혔다.  올 들어 지난달까지 제주항공의 정비 지연율은 0.52%로 지난해 같은 기간(1~11월) 정비 지연율 0.89%에 비해 0.37%포인트(P) 감소해 40% 이상 낮아졌다.  국내선 정비 지연율은 1.11%에서 0.61%로, 국제선 정비 지연율은 0.65%에서 0.44%로 각각 0.5%P, 0.21%P 줄었다. 특히 지난 11월에는 월 단위로 올해 중 가장 낮은 수준인 0.22%의 정비 지연율을 기록했다.  정비 지연율은 항공기 정비 문제로 인한 지연 비율을 나타내며 항공사의 안전성과 정시 운항 능력을 평가하는 주요 지표로 활용되고 있다.  정시 운항률도 크게 나아진 것으로 나타났다. 제주항공의 올해 1월부터 11월까지 정시 운항률은 77.2%로, 지난해 같은 기간 70.8%와 비교해 6.4%P 향상됐다.  국내선 정시 운항률은 지난해 70.7%에서 78.2%로 7.5%P, 국제선 정시 운항률도 70.8%에서 76.1%로 5.3%P 상승했다.  제주항공은 2023년 차세대 항공기 B737-8 2대 구매 도입을 시작으로 올해 계획한 6대의 B737-8 구매기 도입을 완료하며 기단 현대화를 통한 체질개선과 운항 안정성 강화 노력을 이어가고 있다.  제주항공이 현재 보유한 43대의 여객기 중 차세대 항공기가 차지하는 비중은 18.6%로, 제주항공은 내년에도 차세대 항공기 도입 및 경년 항공기 반납 등 기단 현대화 프로젝트를 차질없이 진행해 2030년까지 평균 기령을 5년 이하로 낮춘다는 계획이다.  제주항공 관계자는 “정비로 인한 지연율을 낮추고 정시 운항률을 개선하기 위해 노력을 지속하고 있다”며 “운항 안정성 강화를 통해 고객들이 신뢰할 수 있는 안전운항 체계를 구축해 나갈 것”이라고 말했다.",https://n.news.naver.com/mnews/article/015/0005224402
