날짜,제목,본문,링크
2025-12-20 11:57:00,"주병기 공정거래위원장 ""쿠팡 영업정지 가능성 열어놔""","대규모 고객 정보를 유출한 쿠팡이 영업 정지 처분을 당할 가능성이 생겼다.  주병기 공정거래위원장은 지난 19일 오후 KBS '뉴스라인W'에 출연해 쿠팡에 대해 ""영업정지 처분을 할 가능성도 열어놓고 있다""고 말했다.  주 위원장은 ""분쟁 조정이나 소송 지원 같은 가용 수단을 총동원해서 소비자 피해를 구제하려고 하고 있다""며 소비자의 재산 피해 등이 발생했을 때 쿠팡이 적절한 회복 조치를 하지 않을 경우 영업정지를 명령할 수 있다고 설명했다.  최근 쿠팡은 중국인 퇴사자에 의해 고객 3370명의 개인정보가 유출됐다. 최근에는 이와 관련된 보이스피싱·스미싱 등 2차 피해가 확산할 수 있다는 우려가 커지고 있다.  이러한 문제를 논의하고자 국회 과학기술정보방송통신위원회가 지난 17일 '쿠팡 개인정보 유출 사태' 청문회를 열었지만, 김범석 쿠팡 창업주이자 쿠팡 모회사 쿠팡 아이엔씨 이사회 의장은 불출석하고 한국어가 서투른 해럴드 로저스 쿠팡 신임 대표만 참석했다.  쿠팡이 책임을 회피하려는 모습을 보인다는 비판이 나오자 주 위원장이 작심발언을 한 것으로 풀이된다.  다만 쿠팡이 영업을 중지할 경우 이용자 불편이 클 수 있다는 문제에 대해서는 ""영업정지가 소비자들에게 피해를 입힐 수 있다면 그것에 갈음해서 과징금을 처분할 수 있다""며 영업정지 처분을 내리지 않을 가능성도 함께 제시했다.  주 위원장은 ""현재 합동 조사반의 조사가 진행 중""이라며 ""개인정보 유출에 대한 책임을 묻는 것이 가장 첫 번째 해야 할 일""이라고 강조했다.",https://n.news.naver.com/mnews/article/015/0005227063
2025-12-20 11:40:00,"尹, 김건희 특검 첫 출석…""아내 금품 수수 몰랐다"" [특검 브리핑]","윤석열 전 대통령(사진)이 김건희 여사 관련 의혹을 조사하는 민중기 특별검사팀의 첫 피의자 조사를 받기 위해 20일 출석했다.특검팀이 지난 7월 2일 수사에 착수한 이후 윤 전 대통령이 피의자 신분으로 받는 첫 조사다.  경기도 의왕시 서울구치소에 수용된 윤 전 대통령은 이날 오전 9시30분께 종로구 KT광화문빌딩 웨스트에 마련된 특검팀 사무실에 법무부 호송차를 타고 도착해 입실했다.  수사 기간이 28일 종료되는 점을 고려하면 사실상 마지막 조사가 될 가능성이 크다. 윤 전 대통령 변호인인 유정화 변호사는 ‘김 여사의 귀금속 수수 사실을 알고 있었느냐’는 취재진 질문에 “전혀 알지 못했다”고 답했다. 이배용 전 국가교육위원장 임명 과정에서 윤 전 대통령이 김 여사와 협의했는지를 묻는 질문에는 “협의 같은 것은 없었다. 청탁 같은 것 자체를 들은 바가 없다”고 일축했다.  윤 전 대통령의 출석요구서에는 여섯 가지 피의 사실이 적시된 것으로 알려졌다. 김 여사가 명태균 씨로부터 2억7000만원어치 여론조사 결과를 제공받은 혐의(정치자금법 위반), 김상민 전 부장검사로부터 1억4000만원 상당의 이우환 화백 그림을 받은 혐의(특정범죄가중처벌법상 뇌물)의 공범으로 지목됐다.대선 후보 시절이던 2021년 말 공개 토론회에서 김 여사 관련 허위 사실을 공표한 혐의(공직선거법 위반)도 받는다.  김 여사가 서희건설 이봉관 회장, 이배용 전 국가교육위원장, '로봇개 사업가' 서성빈 씨로부터 인사·이권 청탁과 함께 고가의 금품을 받는 데 윤 전 대통령이 관여했는지도 조사 대상이다.  최근 특검 조사에서 대체로 진술을 거부한 여사와 달리 윤 전 대통령은 적극적으로 진술할 것이라는 관측도 일각에서는 나온다. 윤 전 대통령은 건강상 이유 등을 들어 재판이나 내란 특검팀, 순직 해병 특검팀의 대면 조사에 불출석하다가 10월 중순부터는 거의 빠짐없이 출석해 방어권을 행사해 왔다.",https://n.news.naver.com/mnews/article/015/0005227062
2025-12-20 11:37:00,성북구 아파트에서 화재…주민 50여명 대피 소동,서울 성북구 석관동의 한 아파트에서 20일 오전 8시 53분께 화재가 발생해 주민 50여명이 대피하는 소동이 벌어졌다.  신고를 받고 출동한 소방 당국은 차량 33대와 인원 129명을 투입해 화재 발생 30여분 만인 9시 32분께 불을 진압했다.  현재까지 인명피해는 발생하지 않은 것으로 확인됐다.  경찰과 소방 당국은 아파트 12층에서 불이 시작된 것으로 보고 정확한 화재 원인을 조사할 예정이다.,https://n.news.naver.com/mnews/article/015/0005227061
2025-12-20 11:21:00,"""당장 나가""…美 식당서 모유 수유했다 쫓겨난 엄마","미국의 한 음식점에서 모유 수유했다는 이유로 쫓겨난 여성의 사연이 알려져 공분을 사고 있다.  지난 14일 뉴욕포스트에 따르면 플로리다에 거주하는 아리스 코피엑은 최근 남편과 4세·2세·생후 4개월 된 딸, 지인들과 함께 조지아주 블루리지의 유명 강변 식당 '토코아 리버사이드 레스토랑'을 찾았다.  식사를 하던 중 막내가 울자 코피엑은 가리개로 몸은 가린 채 모유 수유를 했다. 이후 그가 모유 수유를 마치고 상의를 내리자 식당 주인으로 보이는 남성이 다가와 ""여기서 그런 행동을 하면 안 된다""며 퇴장을 요구했다.  코피엑은 ""이미 수유가 끝난 상태였고, 한쪽 팔에는 아기를 안고 다른 한쪽으로는 아이들을 챙기고 있었다""며 ""사장은 계속 '내 식당을 보호해야 한다'고만 하며 내 말은 들으려 하지 않았다""고 토로했다.  결국 그는 친구와 함께 아이들을 데리고 밖으로 나가 기다렸고, 남편과 일행이 식당 안에 남아 계산했다. 코피엑은 ""직원들은 나에게 사과하지 않았다""며 ""짐을 챙기려고 가게 안에 들어갔을 땐 상황이 더욱 악화했다""고 말했다.  코피엑은 ""조지아주 법에 따라 공공장소에서 모유 수유할 권리가 있다고 설명했지만, 사장이 격분했다""고 떠올렸다. 코피엑이 당시 상황을 촬영한 영상에서 카운터 뒤에 선 남성은 ""여기서 당장 나가""라고 코피엑에게 소리쳤다.  코피엑은 ""처음에는 내가 잘못한 것 같아서 본능적으로 사과할 뻔했다. 하지만 여성은 모유 수유할 법적 권리가 있고 저는 아무 잘못도 하지 않았다는 걸 스스로 상기했다""고 했다.  실제 조지아주 법에는 '어머니와 아기가 합법적으로 있을 수 있는 모든 장소에서 모유 수유할 수 있으며, 수유를 이유로 퇴거 또는 제한을 받아서는 안 된다'고 규정하고 있다.  논란이 일자 식당 주인이라고 밝힌 한 남성은 ""이 식당을 33년간 운영했고, 33년간 모유 수유를 허용했다""며 ""이번 사건은 조회수를 노린 연출""이라고 주장했다. 다만 영상 속 인물이 본인인지에 대한 확인은 거부했다.  한편 공공장소에서의 모유 수유는 국내에서도 논란이 됐다. 한 누리꾼은 카페에서 모유 수유했던 경험을 공유하며 ""구석 모서리에서 등을 돌리고 담요로 가린 채 수유하는데, 20대 젊은 여자 두 명이 지나가면서 '저렇게까지 하면서 뭐 하러 밖에 나와 수유하냐. 보기 불편하다'고 하는 말을 들었다""고 토로했다.  또 다른 누리꾼도 카페에서 몸을 가린 채 수유하는 모습을 공개하며 ""배고픈 아기는 참을 수 없다""고 주장했다. 이에 일부 누리꾼들은 ""남이 수유하는 모습 보고 싶지 않다"", ""화장실이라도 가서 해라"" 등의 반응을 보였다.  이를 본 다른 누리꾼들은 ""화장실에서 아이 먹이라고 할거면 본인들도 밥은 화장실에서 먹어라"", ""이런 걸로 불편해하는 사람들 때문에 나라가 저출산으로 망한다""고 반발했다.",https://n.news.naver.com/mnews/article/015/0005227060
2025-12-20 11:01:00,"""작은 집도 품격 필요""…좋은 집이란, '취향과 질서'의 조화 [강영연의 건축 그리고 건축가]","“좋은 집은 내가 만든 질서 안에서 편안한 집이다.”  최하영 마인드맵 소장은 좋은 집을 이렇게 정의한다. 좋은 집은 추상적인 개념이 아니라, 추구하는 삶의 방식과 집의 결이 잘 맞는 상태라는 설명이다. 단독주택이라면 구조와 단열, 채광이 기본적으로 충족돼야 한다. 기본적으로 비가 새지 않고 관리가 쉬운 물리적 조건이 갖춰져야 한다는 뜻이다. 기본이 갖춰진 다음 건축주의 취향이 정돈된 형태로 반영될 때 비로소 좋은 집이 완성된다.   이화여대에서 건축을 전공한 최 소장은 핀란드 헬싱키공과대 우드프로그램을 수료했다. 이후 한국의 조병수 건축연구소에서 실무경험을 쌓고, 2017년부터 마인드맵 건축사사무소를 운영하고 있다. 마인드맵은 그 이름처럼, 직관적 영감과 논리적 사고 사이에서 창의적 결과물을 찾아가는 과정을 중요하게 생각한다. 건축가, 건축주, 그리고 시공자의 조화로운 협업으로 건물을 완성해 나아가며 건축의 지평을 넓혀가고 있다. 대표작으로는 화성주택, 유일주택, 블루창고, 부암동 가꿈 등이 있다.   최 소장이 집을 설계할 때 가장 중요하게 생각하는 것도 '취향'과 '우선순위'다. 취향이 반영된 집을 짓기 위해서는 설계에서 무엇을 먼저 할지 순번을 정하는 일이 가장 중요하기 때문이다. 건물을 짓는 일도 정해진 예산이 있어 모든 것을 실현할 순 없다. 최 소장은 ""설계 초반에는 요구사항을 최대한 반영한 뒤, 이후 건축주와 함께 우선순위를 조정한다""며 ""선택과 결정이 반복되는 건축 과정에서 기준이 없으면 후회로 이어질 수 있기 때문""이라고 설명했다.   그는 원룸과 같이 작은 집이라도 좋은 집의 조건은 분명하다고 봤다. 특히 짧은 기간 세를 들어 살게 되는 다세대나 원룸처럼 취향을 직접 반영하기 어려운 경우에도 공간의 품격은 중요하다고 말했다. 맨발에 허름한 티셔츠를 입고 돌아다녀도 심리적으로 안정되는 집이어야 한다는 생각이다. 최 소장은 ""밥을 먹는 자리에서 화장실 변기가 보이지 않고, 침대 옆에 싱크대가 드러나지 않는 것처럼 생활 공간이 정리돼 있어야 한다""며 ""원룸은 임시 거처일 수 있지만, 2~4년의 시간이 쌓이는 만큼 공간의 질을 높이는 고민이 필요하다""고 말했다.   집을 고를 때 가장 중요하게 보는 기준도 생활 환경이다. 특히 주택을 고를 때는 동네를 직접 걸어보라고 했다. 주택은 한 필지에 하나의 건물이 들어서는 만큼 주변 환경의 영향을 크게 받기 때문이다. 그는 “골목의 분위기가 대문 안으로 그대로 들어온다”며 ""동네에 익숙해지는 과정이 필요하다""고 설명했다. 최 소장은 ""아파트 역시 단지 환경의 영향을 받는 만큼, 단순한 가격보다 생활 감각을 살펴야 한다""고 덧붙였다.  모두가 대단지 아파트를 원하는 현상에 대해서는 “건축가로서는 슬픈 일이지만 이해가 안 되지는 않는다”고 말했다. 집 한 채가 재산의 대부분인 사람이 많고, 자산 증식이 노후와 직결되는 현실에서 브랜드 아파트가 주는 심리적 안정감은 분명하다는 설명이다.   다만 주택과 빌라 밀집 지역의 노후한 인프라가 아파트를 더 매력적으로 보이게 만든 측면도 있다고 했다. 이 때문에 주거 인프라를 정비하면 아파트만 선택하는 지금의 상황이 달라질 수도 있다고 기대했다. 그는 ""최근 단독주택을 의뢰하는 연령대가 낮아지고, 취향을 드러내는 삶을 시도하는 사람이 늘고 있다는 점은 변화의 신호로 읽힌다""며 ""아직은 소수의 시도일 수 있지만, 공감대가 쌓이면 도시 환경도 함께 바뀔 수 있을 것""이라고 말했다.   앞으로 건축가로서 꼭 해보고 싶은 일로는 공공건축, 그중에서도 도서관을 꼽았다. 최 소장은 도서관을 과거와 현재, 미래를 잇는 공간으로 바라봤다. 그는 “사회의 기반을 다져주는 공간”이라며 ""공공건축에서 의미 있는 성취를 이루고 싶다""고 말했다.  건축적인 재미를 위해서는 제로에너지하우스에도 관심을 보였다. 그는 ""헬싱키 공대에서 목조 건축과 모듈형 주택 프로젝트를 경험해봤는데 이를 실현해보고 싶다""며 ""생산과 소비까지 고려한 건축을 직접 구현해보고 싶다""고 했다.   건축가를 꿈꾸는 학생들에게 필요한 자질로는 폭넓은 경험을 강조했다. '건축은 건축만 공부해서 되는 직업이 아니다'라는 생각에서다. 그는 ""사회의 흐름과 도시, 그리고 여러 분야의 사람들을 이해하고 소통하는 과정이 필수""라며 “책을 통해 얻는 간접경험뿐만 아니라 아르바이트나 소모임 등 다양한 사회활동을 통한 직접 경험이 모두 도움이 된다”고 설명했다.  가장 현실적인 조건으로 체력을 꼽았다. 건축은 1~2년 이상 이어지는 장기 프로젝트가 많아 정신력만으로는 버티기 어렵다고 했다. 그는 ""학생들을 만날 때마다 '꼭 운동하라'고 조언한다""며 ""책을 읽고 다양한 경험을 하는 것만큼이나 중요한 일""이라고 강조했다.",https://n.news.naver.com/mnews/article/015/0005227059
2025-12-20 10:55:00,고흐의 ‘밀밭의 양귀비’ 국내 첫 공개,"고흐 모네 르누아르 세잔 등 세계적인 인상파 화가들의 작품을 감상할 수 있는 ‘인상파, 찬란한 순간들: 모네, 르누아르, 반 고흐 그리고 세잔’ 전시회가 지난 19일 노원아트뮤지엄에서 개막됐다. 서울 노원구(구청장 오승록)가 주최한 이 전시회는 내년 5월31일까지 계속된다.    ‘인상파, 찬란한 순간들’은 서양 근대 미술사를 이끈 거장들의 작품을 통해 인상주의의 탄생과 발전 등을 재조명하는 특별 기획전이다. 특히 전통 회화 관습에서 벗어나 빛과 색채, 순간의 인상을 담아낸 인상주의가 서양 근대 미술의 중심으로 자리 잡기까지의 미술사적 의미를 엿볼 수 있다.  이번 전시에는 빈센트 반 고흐와 클로드 모네, 피에르-오귀스트 르누아르, 폴 세잔, 폴 고갱, 차일드 하쌈 등 인상파를 대표하는 거장 11인의 원화 21점이 공개된다. 전시는 총 3부로 구성된다. 1부는 수면 풍경과 반사, 2부는 도시 풍경, 자연, 인물이 있는 풍경화, 3부는 인물과 정물이다.  최대 화제작은 반 고흐의 ‘밀밭의 양귀비(1887)’로 국내에서 최초로 공개되는 작품이다. 녹색 밀밭과 붉은 양귀비의 강렬한 색채 대비가 인상적이며 화면 전체를 아우르는 몰입감이 돋보인다. 또한 모네의 ‘수련이 있는 연못(1907)’은 인상주의의 상징적 주제인 ‘수련’과 ‘연못’을 세로 1미터가 넘는 크기의 대형 캔버스에 담은 작가의 후반기 대표작으로 꼽힌다.  오승록 노원구청장은 “이번 전시는 세계 미술사에서 중요한 전환점을 이룬 인상주의 거장들의 작품을 지역 구민들께 소개하는 자리”라며 “멀리 가지 않고도 수준 높은 문화예술을 경험할 수 있도록 기획했다”고 말했다.  한겻닷컴 뉴스룸 open@hankyung.com",https://n.news.naver.com/mnews/article/015/0005227058
2025-12-20 10:42:00,"국민의힘 ""與, 특검 정국 몰아가더니 '통일교 특검'엔 내로남불""","국민의힘이 더불어민주당의 '통일교 특검' 반대에 대해 ""내로남불이라는 말로도 부족하다""고 비판했다.  박성훈 수석대변인은 20일 논평을 내고 ""야당 탄압용 특검을 6개월도 모자라 2차까지 추진하면서 자신들의 의혹을 수사하는 특검에는 문을 굳게 걸어 잠그고 있다""며 ""양심이라는 것이 존재하기는 하는지 묻지 않을 수 없다""고 꼬집었다.  이어 ""통일교 금품 수수 의혹에 대해 특검 도입을 요구하는 국민 여론이 62%에 달하는 것으로 나타났다""며 ""통일교 특검은 정치공세라는 민주당의 주장과 달리, 여당 지지층의 67%, 40대의 76%까지 특검 도입에 찬성하고 있다. 명백한 국민적 요구임이 확인된 것""이라고 주장했다.  박 수석대변인은 ""민주당과 이재명 정부는 내란 특검, 김건희 특검, 채 해병 특검을 줄줄이 출범시키고 상설 특검까지 동원해 국정을 사실상 '특검 정국'으로 몰아갔다""며 ""그런데 정작 자신들을 향한 통일교 금품 수수 의혹 앞에서는 특검을 거부하고 있다""고 지적했다.  이어 ""'경찰 수사를 지켜보자'고 하지만 살아있는 권력을 제대로 수사한 전례가 거의 없는 경찰, 그것도 여당 소속 장관의 지휘를 받는 조직의 수사를 국민이 신뢰하겠느냐""며 ""특검의 취지를 정면으로 부정하고 특검을 자신들의 이익을 위한 도구로 활용하겠다는 것""이라고 비판했다.  박 수석대변인은 ""더구나 통일교 의혹은 민중기 특검이 여권 인사 관련 진술을 확보하고도 야당만 겨냥했다는 편파 논란에서 비롯된 사안""이라며 ""불신이 누적된 사건이라는 점에서 독립적인 특검이 반드시 필요하다""고 강조했다.  한편 한국갤럽이 지난 16~18일 전국 만 18세 이상 1001명을 대상으로 조사한 결과 응답자의 62%는 '특검을 도입해야 한다'고 답했고 '필요 없다'는 응답은 22%에 그쳤다. 정치성향별로도 △보수 61% △중도 65% △진보 67%가 특검 도입에 찬성했다. (자세한 내용은 중앙선거여론조사심의위원회 홈페이지 참조)",https://n.news.naver.com/mnews/article/015/0005227057
2025-12-20 10:25:00,"尹, 김건희특검 출석…변호인 ""청탁·금품수수 들은 바 없다""","윤석열 전 대통령이 김건희 여사 관련 의혹을 수사하는 민중기 특별검사팀에서 첫 피의자 조사를 받고 있다.  윤 전 대통령은 이날 오전 9시 30분께 종로구 KT광화문빌딩 웨스트에 마련된 특검팀 사무실에 법무부 호송차를 타고 도착해 입실했다.  특검팀의 수사 기간이 오는 28일 만료되는 점을 감안하면, 특검팀의 윤 전 대통령 대면 조사는 이번이 처음이자 마지막이 될 전망이다.  윤 전 대통령의 변호인인 유정화 변호사는 ""김건희 여사의 귀금속 수수 사실을 인지했는가""라는 취재진 질문에 ""전혀 인지하지 못했다""고 답했다.  이배용 전 국가교육위원장 임명 과정에서 윤 전 대통령이 김 여사와 협의했는지에 대한 질문에도 ""협의는 없었다. 청탁 같은 것 자체를 들은 바 없다""고 말했다.   윤 전 대통령 출석요구서에는 6가지 피의사실이 적시된 것으로 알려졌다. 윤 전 대통령은 김 여사가 명태균씨로부터 2억7000만원어치 여론조사 결과를 받은 혐의(정치자금법 위반), 김상민 전 부장검사로부터 1억4000만원 상당의 이우환 화백 그림을 받은 혐의(특정범죄 가중처벌법상 뇌물)의 공범으로 지목됐다.  대선후보 시절인 2021년 말 공개 토론회에서 김 여사와 관련한 허위 사실을 공표한 혐의(공직선거법 위반)와 김 여사가 서희건설 이봉관 회장, 이배용 전 국가교육위원장, 로봇개 사업가 서성빈 씨로부터 인사·이권 청탁과 함께 고가 금품을 받는데 관여했다는 혐의도 받는다.  일각에서는 특검 대면 조사에서 윤 전 대통령이 적극적으로 진술할 수 있다는 관측도 나온다. 윤 전 대통령은 건강상 이유 등을 들어 재판이나 내란특검팀, 순직해병특검팀의 대면조사에 불출석했지만, 10월 중순부터는 거의 빠짐 없이 나와 방어권을 행사해왔다.",https://n.news.naver.com/mnews/article/015/0005227056
2025-12-20 10:01:00,회사 면접보다 더 깐깐한 '세입자 면접' 온다 | 백家사전,"요즘 전월세 시장에서 화제인 '임차인 면접제'에 대해 아시나요? 현재 임대차 계약 전 세입자는 집주인의 등기부등본, 세금 체납 내역을 확인할 수 있지요. 앞으로는 임대인도 세입자를 받기 전 신용정보, 전과 등을 확인하고 면접을 치르자는 제안입니다.  한국에서는 낯선 방식이지만 월세 시장이 주류인 미국과 독일 등에서 임차인 면접제는 이미 보편화된 제도입니다. 하지만 이 나라들에서 예비 세입자들이 겪고 있는 문제점도 있는데요. 무엇인지는 영상에서 확인하시죠.",https://n.news.naver.com/mnews/article/015/0005227055
