날짜,제목,본문,링크
2025-12-09 15:31:00,다양해지는 금 ETF…주식·채권 혼합형 줄이어,"안전자산인 금에 투자하는 상장지수펀드(ETF) 상품군이 다양해지고 있다. 금 투자수요가 이어지면서 단순한 금 시세 추종에서 벗어나 주식과 채권 등 다양한 자산과 혼합해 투자하는 식으로 종류가 늘어나는 추세다.  9일 금융투자업계에 따르면 키움자산운용은 유가증권시장에 ‘KIWOOM 미국S&P500&GOLD’를 출시했다. S&P500 기업에 90%, 금에 10%를 투자하는 ‘S&P501’(500개 종목+금) ETF다. 정기적인 변경(리밸런싱)을 통해 기본적인 투자 비중을 유지해 나갈 예정이다. 상대적으로 많이 오른 자산은 포트폴리오에서 덜어내고, 저평가된 자산은 더 많이 담는 효과가 있다. 총보수는 투자자가 금과 S&P500 ETF에 각각 투자할 때보다 낮은 수준에서 정해질 전망이다.  한화자산운용은 ‘PLUS 금채권혼합’을 준비하고 있다. 금과 국채 3년물을 절반씩 투자하는 상품이다. 채권에 ETF 자산의 절반 이상을 투자하기 때문에 채권혼합형으로 분류된다. 퇴직연금 계좌에서는 채권혼합형 등 안전자산에 최소 30%를 투자해야한다. 최근 S&P500, 나스닥 등 주식과 채권을 절반씩 섞은 채권혼합형 상품이 주목받은 이유다. 기존 금 ETF는 위험자산으로 분류돼 퇴직연금에서 70%까지만 투자할 수 있다.  다양한 투자전략을 활용한 ETF가 등장하는 배경에는 꾸준한 금 투자 수요가 있다. 최근 1년동안 국제 금 가격이 60% 이상 급등하면서 국내에서도 금 투자가 크게 늘었다. 2021년 상장한 ‘ACE KRX금현물’은 몸집이 3조3713억원까지 불어나면서 한국투자신탁운용 ETF 가운데 가장 규모가 큰 상품으로 성장했다. 선물이 아닌 현물을 담아 퇴직연금 계좌에서도 투자할 수 있다는 점을 앞세워 투자자를 끌어모았다.  금 투자가 인기를 얻으면서 올들어 시장에서는 선물을 활용한 커버드콜, 국제 금에 투자하는 ETF 등 다양한 상품이 출시됐다. ‘SOL 국제금커버드콜액티브’는 금을 기초자산으로한 첫 커버드콜 상품이다. 커버드콜 전략은 기초자산을 담는 동시에 콜옵션을 일부 매도한다. 미래에 주식을 살 수 있는 권리인 콜옵션을 팔기 때문에 자산 가격이 크게 오를 때는 수익률이 상대적으로 낮지만, 자산이 횡보하거나 떨어질 때는 옵션 프리미엄에서 얻은 프리미엄을 받을 수 있다는 장점이 있다. 기초자산이 횡보하거나 천천히 상승하는 자산에 적합한 전략이다.",https://n.news.naver.com/mnews/article/015/0005222062
2025-12-09 15:29:00,"[속보] 백해룡 ""검찰이 사건 덮어""…검찰·관세청 등 6개소 압수수색 영장 신청","백해룡 ""검찰이 사건 덮어""…검찰·관세청 등 6개소 압수수색 영장 신청",https://n.news.naver.com/mnews/article/015/0005222061
2025-12-09 15:29:00,"미래에셋증권, 투자 성향·시장 상황 맞춰 포트폴리오 추천","알고리즘을 기반으로 포트폴리오를 자동 구성·운용해주는 미래에셋증권의 퇴직연금 로보어드바이저 서비스가 금융 소비자들 사이에서 관심을 끌고 있다. 2022년 9월 처음 출시된 이후 지난달 30일 기준 8만8785계좌, 평가금액 5조2773억원을 넘어서며 빠른 성장세를 이어가고 있다는 평가다.  로보어드바이저는 컴퓨터 알고리즘을 활용해 고객의 투자 성향과 금융 데이터를 분석하고, 현재 시장 상황에 맞는 상품과 투자 비중을 자동으로 추천해주는 서비스다. 고객의 투자 성향을 진단한 뒤 이에 적합한 맞춤형 포트폴리오를 제안하며, 시장 환경 변화에 따라 새로운 포트폴리오를 지속적으로 제공하는 것이 특징이다. 이 모든 과정이 시스템을 통해 자동으로 이뤄져, 개인 맞춤형 자산관리가 가능하다는 장점이 있다.  미래에셋증권의 로보어드바이저 서비스는 코스콤 테스트베드센터의 엄격한 심사 절차를 통과한 검증된 알고리즘을 기반으로, 퇴직연금 운용에 특화되도록 설계됐다. 글로벌 우량 자산에 분산 투자해 안정성을 높이고, 시장 상황에 따라 자산배분 전략을 유연하게 조정해 고객 특성에 맞는 포트폴리오를 제공한다. 포트폴리오 변경이 필요할 경우에는 알림 메시지를 통해 고객에게 즉시 안내하며, 지속적인 관리도 지원한다.  이 서비스는 투자 경험이 부족해 퇴직연금을 방치하고 있는 고객, 퇴직연금을 직접 운용하는 데 어려움을 느끼는 고객, 복잡한 절차 없이 간편하게 글로벌 자산에 분산 투자하고자 하는 고객에게 특히 적합하다. 최소 가입금액은 1만원이며, 미래에셋증권 퇴직연금 가입자라면 별도의 수수료 없이 포트폴리오를 무료로 제공받을 수 있다.  모바일 앱 ‘M-STOCK’을 통해 간편하게 가입할 수 있으며, 가입 후 ‘내 계좌 맞춤설계’를 진행해 포트폴리오를 확인·승인하면 바로 운용이 시작된다.  정효영 미래에셋증권 연금본부장은 “리스크 할당 방식의 자산배분 모델을 적용해 장기적으로 안정적인 성과를 추구하는 서비스로, 퇴직연금 관리에 매우 적합하다”며 “그동안 방치돼 온 퇴직연금의 효과적인 투자 대안으로, 고객의 성공적인 노후자산 관리에 도움이 될 것”이라고 말했다.",https://n.news.naver.com/mnews/article/015/0005222060
2025-12-09 15:28:00,"NH아문디운용, 중장기 성장 핵심 산업과 기업에 집중 투자","NH아문디자산운용이 한국 경제의 구조적 변화에 주목한 ‘NH아문디 성장주도 코리아 증권투자신탁’을 출시했다. 중장기 성장이 기대되는 핵심 산업과 기업에 선별 투자하는 액티브 주식형 펀드다.  NH아문디는 AI 대전환(AX), 자본시장 대전환(CX), 친환경 대전환(GX)을 중심으로 산업 구조가 빠르게\ 단기 유행이 아닌 중장기 성장 사이클로 이어질 것으로 보고, 관련 산업을 ‘성장 주도 산업’으로 정의해 집중 투자에 나선다는 전략이다.  특히 생성형 AI를 넘어 에이전트, 피지컬 AI 단계로 진입하면서 고대역폭메모리(HBM)를 포함한 AI 반도체, 서버, 전력 인프라 전반에 대한 수요 확대가 예상된다. 이에 따라 삼성전자와 SK하이닉스를 비롯해 AI 반도체 경쟁력을 갖춘 기업과 전력 설비, 변압기 등 인프라 기업들이 주요 투자 대상으로 포함된다. 글로벌 빅테크 기업들의 원자력 발전 투자 확대에 발맞춰, 대형 원전 및 소형모듈원자로(SMR) 사업을 수행하는 두산에너빌리티 등도 주목하고 있다.  방산과 조선 업종 역시 지정학적 리스크 확대와 글로벌 수주 증가 흐름 속에서 새로운 성장 동력으로 부각되고 있다. NH아문디는 빠른 납기와 기술 경쟁력을 갖춘 국내 방산·조선 기업들이 중장기적으로 안정적인 실적 성장을 이어갈 것으로 보고 비중 확대를 검토하고 있다.  ‘팀플레이 전략’을 특징으로 하는 운용 방식도 눈에 띈다. 펀드 운용역과 함께 9명의 전담 애널리스트가 산업별 경쟁 구도를 분석하고, 유망 기업을 공동 발굴하는 구조다. 이를 통해 다양한 모델 포트폴리오를 구성하고, 시장 변화에 유연하게 대응한다는 계획이다.  NH금융지주 계열사들도 이번 펀드에 힘을 보탰다. 농협상호금융, NH농협은행, NH투자증권 등 주요 계열사는 총 250억원 규모의 시드머니 투자를 결정했다. 이와 함께 펀드 운용보수 일부를 활용해 사회공익기금도 조성할 예정이다. 지난 10월 14일 설정된 이 펀드는 지난달 24일 기준 수익률 7.11%, 순자산총액 약 669억원을 기록했다. 총보수는 A클래스 기준 연 1.550%다.",https://n.news.naver.com/mnews/article/015/0005222059
2025-12-09 15:27:00,"삼성증권, 중국 성장 이끄는 업종 대표 5개 종목에 투자","삼성증권은 중국 자동차 기업과 인공지능(AI) 기술주에 투자할 수 있는 상장지수증권(ETN) 상품 2종을 추천했다.  ‘삼성 중국 자동차 TOP5 TR ETN(H)’과 ‘삼성 중국 AI 테크 TOP5 TR ETN(H)’은 각 업종을 대표하는 5개 종목으로 구성된 지수를 기초자산으로 삼는 상품이다. 최근 중국 AI 및 전기차 산업에는 막대한 투자가 이어지며 빠르게 성장하고 있다. 이러한 기대감 속에 중국 주식에 투자하는 ‘중학개미’들도 급증하는 추세다.  한국예탁결제원에 따르면 국내 투자자들이 보유한 홍콩 상장 중국 주식은 지난 3일 기준 25억2552만달러(약 3조3000억원)어치로, 연초 대비 37.8% 급증했다. 삼성증권은 이번 ETN 상품을 통해 국내 투자자들이 보다 손쉽게 홍콩 시장에 상장된 중국 혁신 기업에 접근할 수 있도록 했다고 설명했다.  두 상품은 중국 시장에서 성장성이 돋보이는 자동차 및 AI 산업 상위 5개 종목에 각각 투자한다. 시가총액 상위 종목을 중심으로 구성해 종목 선정의 부담은 낮추면서, 업종별 성장성을 반영하는 전략이다.  ‘삼성 중국 자동차 TOP5 TR ETN’은 중국의 대표적인 완성차 및 배터리 기업 5곳으로 구성된다. 지난달 말 기준 포트폴리오에는 배터리 제조사 CATL(비중 37.8%)과 비야디(BYD·24.7%), 자동차 기업 지리자동차(14.5%), 리오토(12.2%), 샤오펑(10.8%)이 포함돼 있다.  ‘삼성 중국 AI 테크 TOP5 TR ETN’은 AI 인프라, 소프트웨어, 하드웨어 등 인공지능 밸류체인을 구성하는 핵심 기업들로 포트폴리오를 꾸렸다. 텐센트가 32.9%로 가장 큰 비중을 차지하며, 샤오미(24.9%), 넷이즈(15.1%), 메이퇀(14.4%), SMIC(12.7%) 등이 뒤를 잇는다.  삼성증권 관계자는 “중국 AI 테크와 전기차 산업은 향후 중국 경제 성장의 핵심 동력으로 주목받는 분야”라며 “관련 ETN을 통해 국내 투자자들이 글로벌 혁신 산업에 손쉽게 접근할 수 있을 것”이라고 말했다.",https://n.news.naver.com/mnews/article/015/0005222058
2025-12-09 15:27:00,"KB증권, 온오프라인 결합 맞춤형 노후자산 컨설팅","KB증권은 영업점과 연금자산관리센터를 연계한 ‘하이브리드 연금자산관리’ 서비스를 추천했다. 대면과 비대면을 결합한 고객 맞춤형 1대1 자산관리 서비스다.  KB증권은 고객별 연금자산 구조와 생애주기, 노후 목표 등을 종합적으로 진단한 뒤 이를 기반으로 최적의 연금 솔루션을 제시한다. 이를 위해 연금 컨설팅 전문 인력을 배치해 세밀한 진단과 체계적인 관리 서비스를 제공한다. 동시에 모바일·온라인 기반의 비대면 채널을 확대해 고객이 언제 어디서든 연금 상담을 받을 수 있는 환경을 구축했다.  대면 상담 부문에서는 최고 수준의 연금 컨설팅을 제공하는 프라이빗뱅커(PB)를 ‘연금마스터’로 선정해 전국 주요 영업점에 배치했다. 고객은 영업점을 방문해 1대1 맞춤형 상담을 받을 수 있다. 필요 시 연금본부 소속 세무사·노무사·계리사 등 전문가가 직접 영업점 또는 고객이 원하는 장소를 방문해 심층적인 상담 서비스를 제공한다. 이러한 전문성 기반의 대면 컨설팅은 복잡한 연금 제도나 세제 관련 문의에도 실질적인 도움을 줄 수 있도록 설계돼 있다. 비대면 상담 서비스도 강화했다.  연금자산관리센터 ‘PrimePB’를 통해 전화 상담 서비스를 제공하고 있으며, 모바일트레이딩시스템(MTS) ‘KB M-able(마블)’에서 상담 예약을 하면 전문 상담원이 고객이 지정한 시간에 직접 연락해 맞춤형 연금 컨설팅을 진행한다. 이를 통해 고객은 고객센터 연결 대기 없이 빠르고 편리하게 상담을 받을 수 있어 만족도가 높다는 평가다.  KB증권은 이러한 하이브리드 시스템을 통해 오프라인의 전문성과 온라인의 접근성을 동시에 구현하며 고객만족 서비스를 강화하고 있다. KB증권은 하이브리드 상담 체계를 기반으로 연금 자산의 효율적 운용과 장기적 성장 지원에 주력하고 있다. 특히 디폴트옵션, 추천 포트폴리오, 자동투자 솔루션 등 연금 특화상품과 서비스를 지속적으로 고도화해 고객이 체감할 수 있는 수익률 개선과 안정적 자산 성장을 도모하고 있다. 송상은 KB증권 연금본부 본부장은 “앞으로도 고객의 노후자산이 안정적으로 성장할 수 있도록 차별화된 연금 특화상품과 상담 서비스를 확대해 나가겠다”고 밝혔다.",https://n.news.naver.com/mnews/article/015/0005222057
2025-12-09 15:25:00,"한국투자증권, 손실 위험 낮추고 수익은 고객에 우선 배정","한국투자증권은 개인 고객에게 먼저 수익을 배정하는 ‘손익차등형 펀드’를 추천했다. 이 펀드는 고객의 손실 가능성을 줄이는 동시에 수익이 발생할 경우 고객에게 먼저 배정하는 구조를 갖췄다.  이 펀드는 수익증권의 선순위 투자자를 고객으로, 후순위 투자자를 한국투자금융그룹 계열사로 설정한다. 손실이 발생하더라도 일정 수준까지는 후순위 투자자인 한국투자금융그룹 계열사가 먼저 손실을 감수하고, 수익이 날 경우 고객에게 먼저 배정돼 투자 안정성을 높였다는 것이 회사 측 설명이다.  한국투자증권은 지금까지 총 34개(공모 12개, 사모 22개)의 손익차등형 펀드를 선보였다. 이 가운데 공모형 펀드는 8개가 설정됐으며, 이 중 7개가 이미 조기 상환되는 등 목표를 웃도는 성과를 냈다고 회사 측은 설명했다.  가장 최근에 설정된 손익차등형 펀드 ‘한국밸류 코리아기업가치포커스’는 1600억원이 넘는 설정액을 기록했다. 이 상품은 국내 주식시장 트렌드를 반영해 국내 주식 및 상장지수펀드(ETF)에 7가지 테마로 분산 투자하는 구조다. 한국투자증권 측은 증시 조정 국면에서도 개인 고객의 손실을 완충하면서 구조적인 안정성을 유지했다고 밝혔다.  한국투자증권은 손익차등형 펀드 공급을 확대할 계획이다. 금융시장에서 소비자 보호와 지속 가능한 투자가 핵심 화두로 떠오른 만큼, 단순한 수익률 제시에 그치지 않고 투자자의 위험 감내 수준과 재무 목표에 맞춘 구조적 대안을 지속적으로 마련하겠다는 방침이다.  또한 개인 고객의 이익을 높이는 동시에 접근이 어려웠던 글로벌 상품에 대한 투자 기회를 확대하는 데 주력하겠다는 전략도 내놨다. 최근에는 ‘월 지급식 펀드’ 분야에서 AB, 캐피탈그룹, 만(MAN)그룹 등 글로벌 운용사와의 협업을 강화하며 상품 경쟁력을 높이고 있다.  한국투자증권 관계자는 “개인 고객의 자산 위험 관리가 어느 때보다 중요한 시점”이라며 “소비자 보호형 구조화 상품을 지속적으로 확대해 나가겠다”고 말했다.",https://n.news.naver.com/mnews/article/015/0005222056
2025-12-09 15:24:00,"[포토] 롯데월드, '트윙클 미라클 윈터' 겨울 시즌 오픈",9일 서울 송파구 롯데월드 어드벤처에서 겨울 시즌을 맞아 해피 크리스마스 퍼레이드가 펼쳐지고 있다  롯데월드 어드벤처는 내년 3월 2일까지 101일간 인기 애니메이션 ‘프린세스 캐치! 티니핑’과 함께 하는 겨울 시즌 축제 ‘트윙클 미라클 윈터’를 운영한다.,https://n.news.naver.com/mnews/article/015/0005222055
2025-12-09 15:24:00,"신한투자증권, 생활비·의료비 쓰고 남은 재산 맡아 상속·증여","신한투자증권은 종합자산관리 서비스와 유언대용신탁을 결합한 ‘신한 프리미어 행복이음신탁’을 추천했다.  ‘신한 프리미어 행복이음신탁’은 위탁자가 재산을 맡기면 신한투자증권이 제휴 기관 및 전문가 그룹과 협업을 통해 관리한 뒤, 위탁자 사후 지정된 수익자에게 상속하는 상품이다. 위탁자가 수익자와 지급액수, 시기, 방법 등을 자유롭게 설계할 수 있고 생전 생활비와 의료비를 수령하는 것도 가능하다. 제3자를 신탁운용지시권자로 지정해 정해진 범위 안에서 자산을 운용할 수도 있다.  증여용 상품인 ‘신한 프리미어 행복이음증여신탁’도 있다. 행복이음신탁과 유사한 구조지만, 상속이 아닌 증여 목적의 가입자를 위한 것이다. 사전 증여를 통해 자산을 이전하고, 전문가 집단 관리를 통해 만기 시 더 많은 금액을 수령할 수 있도록 운용된다. 신탁 만기 시점까지 자산 관리의 최종 권한이 증여자에게 있어, 수증자는 증여자의 동의 없이 출금하거나 해지할 수 없다. 증여계약상 조건이 충족되면 증여된 신탁재산을 수증자로부터 반환받는 것도 가능하다.  신한투자증권은 이 외에도 미성년 자녀를 위한 ‘신한 프리미어 내자녀 금전증여신탁’, 생명보험의 보험금청구권을 신탁하는 ‘신한 프리미어 내가족 보험금청구권신탁’ 등을 판매하고 있다. 두 상품은 신한투자증권 모바일 앱 ‘신한SOL증권’을 통해 가입할 수 있다.  행복이음신탁의 최소 가입금액은 3억원, 행복이음증여신탁은 1억원이며, 비금전 재산을 신탁하는 경우 최소 가입금액이 높아질 수 있다. 신탁 보수는 계약 체결 시 발생하는 체결보수와 수익권 이전 시 발생하는 집행보수로 구성된다. 금전 외에도 유가증권, 부동산, 보험금청구권 등 다양한 자산을 신탁할 수 있으나, 비금전 자산의 경우 사전 협의가 필요하다.  권영대 신한투자증권 투자상품본부장은 “미성년자 금전 증여 신탁은 비대면으로 가입할 수 있으며, 모든 신탁 상품은 가입 후 홈페이지와 모바일트레이딩시스템(MTS)을 통해 계약 정보를 투명하게 확인할 수 있다”고 했다.",https://n.news.naver.com/mnews/article/015/0005222054
2025-12-09 15:23:00,"""한국 가전 기술의 산실""…50살 맞은 'LG 가산 R&D 캠퍼스'","LG전자가 설립한 국내 민간기업 최초의 종합 연구소인 '가산 R&D 캠퍼스'가 설립 50주년을 맞았다.  LG전자는 지난 8일 서울 금천구에 위치한 가산 R&D 캠퍼스에서 '50년의 기술과 열정, 내일을 향한 약속'을 주제로 기념 행사를 개최했다고 9일 밝혔다. 행사에는 이현욱 LG전자 HS연구센터장(부사장), 오세기 ES연구소장(부사장)을 비롯해 김쌍수 전 부회장, 이영하 전 사장, 신문범 전 사장, 송대현 전 사장 등 전현직 가전 사업본부장 및 연구소장들과 LG전자와 산학 협력 중인 국내 주요 대학 교수들이 함께 참석했다.  LG전자는 1975년 12월 체계적인 연구 거점 마련 및 연구소 간 시너지를 위해 '금성사 중앙연구소'라는 이름으로 가산 R&D 캠퍼스를 설립했다. 국내 기업 대부분이 개별 공장 내 소규모 연구조직을 운영하던 당시 가전, 컴퓨터 등 제품군을 모두 아우르며 신제품 개발, 품질 향상, 생산시스템 자동화 등을 전담하는 민간기업 첫 종합 연구소다.  단층 건물에 전기 계측, 제어, 표준 등 실험시설을 갖추고 출범한 연구소는 2002년 압력, 온도, 소음 등 다양한 실험실을 갖춘 실험동을 신축한 데 이어 2007년 지상 20층·지하 5층 규모의 연구동, 2013년에는 별관을 추가로 준공해 현재 전체 연면적은 3.5만 평에 달한다. 개소 당시 수십여명이었던 상주 인원도 현재 1700여명까지 늘어났다.  회사 관계자는 ""글로벌 기술 전문가를 배출하는 LG가전 R&D 혁신의 중심지로 자리매김한 것""이라며 ""가전의 새로운 지평을 연 혁신 제품들이 이곳에서 탄생했다""고 말했다.  1998년 세계 최초 벨트 없이 모터와 세탁통을 직접 연결한 DD모터와 2001년 모터가 회전 대신 직선운동을 하는 냉장고용 리니어 컴프레서가 대표적이다. 뛰어난 에너지 효율과 내구성으로 LG가전의 핵심 부품 기술력을 입증했다.  2016년 선보인 국내 최초 듀얼 인버터 에어컨은 기존 대비 에너지 효율을 최대 40% 높이며 미국 최고 권위의 발명상인 '에디슨 어워드' 최고상을 받았다.  또 2011년 의류 관리기 'LG 스타일러', 2015년 세계 최초 분리세탁 '트윈워시', 2022년 새로운 기능이 지속 업그레이드되는 '업(UP) 가전' 등 기존에 없던 새로운 가전을 지속 선보여 왔다.  이에 앞서 연구소에서는 1977년 전자식 금전등록기(POS)의 국산화 성공을 시작으로 국내 첫 전자식 한·영 타자기 출시, 주문형 반도체(Custom IC) 독자 개발 등 한국 전자산업의 이정표를 세워왔다. 특히 1981년 2만개 이상의 부품이 집적된 전자식 ‘비디오 테이프 레코더(VTR)'의 첫 국산화 성공은 일본 기업이 독점하던 세계 가전 시장서 한국의 기술력이 인정받은 계기가 됐다.  현재 연구소에서는 가전 제품뿐 아니라 핵심부품, 기능성 신소재, 플랫폼 등 다양한 연구가 진행되고 있다. 고속회전 모터·인버터 실험실, 미생물·위생 실험실, 선행플랫폼 실험실 등 다양한 연구·실험실은 물론 의류과학연구소, 공기과학연구소 등 특화 연구 시설과 소재 연구소를 운영하며 다양한 형태와 용량의 HVAC 컴프레서, 기능성 신소재 '유리파우더', 차세대 가전 플랫폼 등 LG전자의 미래를 위한 연구가 지속되고 있다.  이현욱 LG전자 HS연구센터장 부사장은 ""지난 50년간 쌓아온 세계 최고 수준의 기술 역량을 기반으로 새로운 AI홈 시대를 주도하는 전략 거점이자, 차별적 고객 가치를 제공하는 제품을 선보이는 R&D 혁신의 중심지로 자리매김할 것""이라고 말했다.",https://n.news.naver.com/mnews/article/015/0005222053
