날짜,제목,본문,링크
2025-12-04 13:53:00,SK하이닉스 'HBM 1등' 조직 구축…신규 임원 37명 선임,"SK하이닉스가 2026년 조직 개편·임원 인사를 단행했다. 풀 스택 인공지능(AI) 메모리 크리에이터로 도약하는 데 초점을 맞췄다는 설명이다. 신규 임원 37명을 선임해 차세대 리더 육성에도 힘을 실었다.  회사는 4일 ""2024년, 2025년 연속으로 HBM 글로벌 1위를 유지한 SK하이닉스는 AI 메모리 시장의 새로운 표준을 제시해 왔다""며 ""이번 조직 개편을 통해 글로벌 AI 시대를 선도하기 위한 기반을 강화하고 지속가능한 성장 체계를 더욱 공고히 할 것""이라고 밝혔다.  이번 조직 개편은 글로벌 경쟁력 확장을 위한 대대적인 체질 개선을 목표로 했다. 이를 위해 미국·중국·일본 등 주요 거점에 '글로벌 AI 리서치 센터'를 신설한다. 안현 개발총괄(CDO) 사장이 이 조직을 맡아 컴퓨팅 시스템 아키텍처 연구를 가속화하고 글로벌 빅테크 기업들과 협력을 강화할 계획이다. 특히 미국 AI 리서치 센터에는 글로벌 구루(Guru)급 인재를 영입해 시스템 연구 역량을 업계 최고 수준으로 끌어올린다.  미국 인디애나 어드밴스드 패키징 팹 구축도 본격화한다. 글로벌 생산 경쟁력 강화를 전담하는 '글로벌 인프라' 조직도 신설된다. 국내 이천과 청주의 생산 현장에서 경험을 쌓은 김춘환 담당이 이 조직을 이끈다. 글로벌 생산 체계의 일관성을 강화해 AI 메모리 수요 확대에 선제적으로 대응한다는 전략이다.  글로벌 경영 환경·지정학 현안을 심층 분석하고, AI와 반도체 중심의 전략 솔루션을 제시할 '매크로 리서치 센터'도 세운다. 이곳에 글로벌 거시경제부터 개별 산업·기업 분석에 정통한 전문가를 영입해 미래 대응 역량을 강화한다.  글로벌 수준의 인텔리전스 체계를 고도화하기 위해 고객 중심 매트릭스형 조직인 '인텔리전스 허브'를 운영한다. 이 조직은 고객·기술·시장 정보를 AI 기반 시스템으로 통합 관리한다. 이를 토대로 고객 기대 이상의 가치를 제공하는 데 필요한 통찰력을 확보한다.  SK하이닉스는 HBM 1등 기술 리더십을 이어나가기 위한 조직 개편도 단행했다. 주요 HBM 고객들에 대한 신속한 기술 지원을 위해 미주 지역에 HBM 전담 기술 조직을 신설한다. 또 커스텀 HBM 시장 확대에 적기 대응할 수 있도록 HBM 패키징 수율, 품질 전담 조직도 별도로 구축한다. 개발부터 양산·품질까지 전 과정을 아우르는 HBM 특화 조직 체계를 완성했다는 설명이다.  37명의 신규 임원을 선임해 차세대 리더 육성에도 속도를 냈다. 이들 가운데 70%는 주요 사업·기술 분야에서 발탁했고 기술·지원 조직에서는 80년대생 여성 임원도 배출했다. 회사는 기술기업의 성과 중심 인사 원칙을 일관되게 이어갔다고 강조했다.  중장기 성장을 이끌 미래 리더십 체계도 강화한다. 제조·기술 분야 핵심 리더 이병기 담당을 'C레벨' 핵심 임원인 '양산총괄(CPO)'로 승진시킨 것. 그는 글로벌 생산 체계 혁신을 이끌게 됐다. 수율과 품질 전문가로 꼽히는 권재순 담당과 eSSD 제품 개발을 주도한 김천성 담당도 회사의 주요 보직인 M&T 담당, 솔루션 개발 담당으로 각각 승진했다.  전사 지원 조직 기능을 통합적으로 조율하는 코퍼레이트 센터 산하 주요 임원에 김동규 담당(미래전략), 강유종 담당(구매), 진보건 담당(기업문화) 등을 선임하는 세대교체도 진행됐다.  곽노정 SK하이닉스 최고경영자(CEO)는 ""이번 조직 개편과 임원 인사는 풀스택 AI 메모리 크리에이터로 도약하기 위한 필수적 조치""라며 ""세계 시장을 선도하는 글로벌 리딩 컴퍼니로서의 경쟁력을 더욱 강화하는 계기가 될 것""이라고 말했다.",https://n.news.naver.com/mnews/article/015/0005220139
2025-12-04 13:52:00,"[인터뷰] 룰루레몬 아태 사장 ""한국은 아시아의 핵심 시장""","“한국의 23개 룰루레몬 매장 대부분이 수도권에 있는데 영업지역을 부산 등 광역시로 더 넓히려 합니다.”  게러스 포프 룰루레몬 아시아태평양 지역 사장(사진)이 룰루레몬 매장을 전국적으로 확대하겠다는 뜻을 밝혔다. 포프 사장은 최근 한국경제신문과 인터뷰에서 “한국은 진출 10년 만에 아시아 핵심 시장으로 성장했고 여전히 발전 가능성이 크다”며 “지방 도시로도 매장을 늘려 한국 내 입지를 더욱 강화할 계획”이라고 강조했다.  컨버스, 나이키 등 글로벌 스포츠 브랜드에서 일하다가 2017년 요가, 필라테스오 등 스튜디오 스포츠웨어 기반의 룰루레몬에 합류한 포프 사장은 아시아시장에 투입되기에 앞서 유럽·중동·아프리카 지역을 총괄했다.  포프 사장은 지난 20일 개점한 서울 역삼동 강남 플래그십 매장을 둘러보기 위해 한국을 찾았다. 920㎡ 규모의 강남 매장은 홍콩, 상하이, 도쿄에 이은 아시아태평양 지역 네번째 플래그십 스토어로 새로운 공간 디자인 콘셉트가 적용됐다.  브랜드가 태어난 캐나다 서부 해안도시 밴쿠버의 자연을 담아내려했다. 매장에는 국내 처음으로 남성 전용 공간을 마련했다. 여성뿐만 아니라 아니라 남성복 시장까지 공략하겠다는 뜻에서다.  강남 플래그십 스토어는 일반 매장보다 제품 구성이 다양하다. 포프 사장은 “러닝, 테니스, 골프, 일상 등 다양한 카테고리를 강남 매장에서 새롭게 선보였다”며 “한국에서 수요가 빠르게 늘고 있는 러닝과 웨이트 트레이닝 라인업도 지속적으로 강화하겠다”고 말했다.  룰루레몬이 아시아 시장에 공을 들이는 이유는 성장성을 유지하기 위해서다. 북미 시장서 매출 증가율이 2023년 12%에서 지난해 4%로 둔화했기 때문이다. 반면 같은 기간 중국 시장에서 매출은 41% 증가했다. 룰루레몬의 작년 매출은 106억달러로 내년 목표는 125억달러다.  한국의 첫번째 플래그십 매장을 연 것도 아시아 성장 전략의 일환이다. 포프 사장은 “한국은 아시아에서도 성장 속도가 매우 빠른 시장”이라며 “한국에서 매장을 꾸준히 늘려 아시아 시장 확대의 교두보로 삼으려 한다”이라고 말했다.    다음은 인터뷰 전문.  ▶룰루레몬은 창립 초기부터 ‘커뮤니티 중심 브랜드’를 강조해왔습니다.  “단순히 제품을 파는 것이 아닌, 커뮤니티 형성을 목표로 합니다. 저희가 진행하는 요가·러닝 등 스포츠 체험 행사를 통해 소비자들과 하나의 커뮤니티를 만드는 것이죠.”  ▶커뮤니티 형성에 있어서 이번 플래그십 매장이 갖는 의미는 무엇입니까?  “이번 플래그십 매장은 단순히 제품을 판매하는 공간이 아니라 커뮤니티가 실제로 모이고 연결되는 허브 역할을 할 계획입니다. 국내 처음으로 도입한 남성 전용 공간은 남성 고객층과의 접점을 넓히고 새로운 커뮤니티를 형성하기 위한 장치입니다.  6명의 한국 엠배서더들과 함께 지역 기반 활동을 강화해, 매장을 ‘룰루레몬 커뮤니티 문화’를 가장 잘 보여주는 거점으로 만들고자 합니다.”  ▶글로벌 스포츠웨어 시장 경쟁이 날로 격화하고 있습니다. 이 상황에서 룰루레몬이 선두를 유지할 수 있는 이유는 무엇이라고 생각하십니까?  “첫 번째는 ‘사람 중심의 제품 디자인’을 하는 것입니다. 룰루레몬의 핵심 철학인 ‘사이언스 오브 필’을 반영해 기능성과 착용감을 넘어 옷을 입었을 때 느끼는 감정적 반응까지 고려해 제품을 디자인합니다.  두 번째는 ‘품질’입니다. 최고급 원사와 원단을 사용하는 것이 ‘알로’와 같은 경쟁사와의 가장 두드러진 차별점입니다.  세 번째는 ‘커뮤니티 활성화’입니다. 요가·러닝 클럽 등 다양한 활동을 지원해 소비자들과 하나의 공동체를 형성하는 것이 룰루레몬 성장을 이끌어온 핵심 동력이라고 생각합니다.”    ▶사이언스오브필 정의에 대해 자세히 알려주실 수 있으실까요?  “사이언스 오브 필은 룰루레몬의 제품과 디자인 철학을 말합니다. 인간의 신체적·감정적 경험을 과학적으로 분석해, 개인의 퍼포먼스와 웰빙을 높이는 방향으로 제품을 개발하는 개념입니다.  소비자가 룰루레몬 제품을 착용했을 때 자기 몸을 더 정확하게 느끼고 이해할 수 있도록 돕는 것, 나아가 삶의 질을 높이는 데 기여하는 것이 이 철학의 핵심입니다.”  ▶이 철학을 구현하기 위한 회사 내부에서의 노력도 궁금합니다.  “브랜드가 추구하는 가치가 내부에서도 실천돼야 진정성이 생긴다고 생각합니다. 이를 위해 사내에서는 수평적인 피드백 문화를 유지하고 있습니다. 또 하나는 ‘마인드풀 무브먼트’ 문화입니다.  이는 단순한 운동 지원이 아니라 신체·정신의 균형을 함께 돌보는 라이프스타일을 뜻합니다. 직원들의 건강한 일상을 위해 매달 약 300달러의 운동비를 지원합니다.  매장 직원부터 물류센터·본사 직원까지 모두 동일하게 적용합니다. 직원이 건강해야 브랜드의 철학도 자연스럽게 구현되고, 결국 회사의 성장으로 이어진다고 보기 때문입니다.”  ▶ 2026년 매출 125억달러 달성을 위해 ‘파워 오브 쓰리 타임즈 투’ 전략을 발표했습니다.  “제품군 확장, 고객 경험 강화, 글로벌 시장 확대. 이 3가지가 저희의 전략입니다. 우선 제품군을 룰루레몬하면 보편적으로 잘 알려진 요가, 필라테스 등 스튜디오 운동뿐만 아니라 테니스, 골프, 스포츠화 등으로 확장해 고객층을 넓히는 것을 목표로 하고 있습니다.  두 번째는 고객과의 경험을 늘리는 것입니다. 카카오 등 한국 고객들이 자주 사용하는 플랫폼에서의 연동도 강화할 것입니다. 마지막으로 새로운 국가로의 진출입니다.  기존 북미 시장 중심에서 아시아, 유럽 등 새로운 시장에서 매장을 확대해 나갈 계획입니다. 서울 플래그십스토어를 연 것도 아시아 시장을 키우기 위해서입니다.”  ▶ 한국시장은 다른 국가와 어떤 점이 다르다고 보시나요.  “한국 소비자들은 스타일에 민감하고 트렌드를 빠르게 수용합니다. SNS 확산 속도가 빠르고 온라인 쇼핑 비중이 다른 국가에 비해 높습니다. 러닝, 요가 체험 이벤트 등 커뮤니티 활동 참여율도 높습니다.  러닝과 웨이트 기반의 트레이닝 제품군 성장세도 빠릅니다. 테니스, 골프 제품군도 빠르게 성장하고 있어 향후 성장 잠재성이 크다고 생각합니다.”  ▶ 향후 5년간 룰루레몬의 성장 키워드는 무엇인가요.  “지난 10년간 유지해온 세 가지 전략(마인드풀 무브먼트·제품 혁신·커뮤니티 강화)을 더욱 고도화하는 것입니다. 마인드풀 무브먼트는 참여형 프로그램을 통해 신체 건강은 물론 정신적 웰빙까지 높여 건강한 사회를 만드는 데 힘쓸 것입니다. 제품 혁신을 위해서는 연구개발(R&D) 투자를 확대할 계획입니다.  ‘얼라인’이나 ‘그루브 팬츠’가 소비자들에게 큰 인기를 얻는 것도 소재·원단 혁신이 뒷받침됐기에 가능했습니다. 마지막으로 커뮤니티 강화입니다. 광고처럼 일방적으로 메시지를 전달하는 방식이 아니라, 앰배서더와 함께 러닝·요가 클럽 등 참여형 활동을 통해 소비자가 직접 경험할 수 있는 소통의 장을 키워나갈 계획입니다.”  이소이 기자",https://n.news.naver.com/mnews/article/015/0005220138
2025-12-04 13:48:00,'룡룡버거하우스×메이커스마크' 성수동 콜라보 파티 개최,"성수동의 버거 브랜드 룡룡버거하우스가 프리미엄 버번 위스키 브랜드 메이커스 마크(Maker’s Mark)와 함께 지난 9월 말 성수에서 독특한 콘셉트의 파티를 열었다.  룡룡버거하우스는 ‘바오버거’라는 새로운 장르를 열며 잃어버린 스트릿 정신을 되실리자는 미션을 가진 브랜드다.  브랜드의 심볼 ‘fuxxin grandma’는 1980년대 홍콩 티하우스에서 예술가들을 후원하며 당대의 언더그라운드 문화를 지탱했던 인물로, 이를 뮤즈 삼아 “BE HUNGER, EAT BURGER”라는 반항적 메시지를 앞세워 성장해왔다.  이번 파티는 이러한 브랜드 이미지와 메이커스 마크의 ‘독주(獨酒)’ 아이덴티티가 겹쳐지며 더욱 강렬한 분위기를 만들었다. 네온 조명 아래 빨갛게 빛나는 Fuxking Grandma 심볼, 붉은 네온사인과 힙한 음악이 어우러진 공간에서 방문객들은 마라바오버거와 45도 버번을 페어링하며 버거하우스만의 리듬을 만들어냈다. 일부 참가자들은 버번을 버거 쉐이크에 섞어 마시는 등 파격적인 방식을 즐기며 현장을 더욱 뜨겁게 달궜다.  공간 전체는 하나의 스트릿 무대처럼 꾸며졌고, 참여자들은 강렬한 힙합 음악에 맞춰 몸을 흔들며 열기를 더했다. 머쉬베놈, 힙노시스테라피, 영비(양홍원) 등의 라이브 퍼포먼스로 펼쳐진 이틀간의 공연은 가장 독특하고 거침없는 플로우를 자랑하는 머쉬베놈의 무대로 시작을 알렸다. 2일차에는 힙노시스테라피의 도발적인 무대를 이어 영비의 압도적인 에너지가 이어졌다. 거친 힙합 비트와 매운 마라버거, 독한 버번의 강렬한 충돌은 룡룡버거하우스가 지향하는 정체성을 감각적으로 보여주는 장면들이었다.  룡룡버거하우스 관계자는 이번 파티가 단순한 이벤트가 아니라 “우리가 어떤 브랜드인지 명확히 드러내는 선언”이라고 설명했다. 스트릿 문화와 대담한 감성을 중심으로 발전해온 룡룡버거하우스는 앞으로도 이러한 기조를 더욱 확장해 나갈 계획이라고 밝혔다.  한경닷컴 뉴스룸 open@hankyung.com",https://n.news.naver.com/mnews/article/015/0005220136
2025-12-04 13:41:00,디아이티 수주공시 - 반도체 제조 장비 211.6억원 (매출액대비 18.14 %),"12월 04일 디아이티(110990)는 수주공시를 발표했다.  ◆디아이티 수주공시 개요 - 반도체 제조 장비 211.6억원 (매출액대비 18.14 %)  디아이티(110990)는 반도체 제조 장비에 관한 단일판매ㆍ공급계약체결 을 04일에 공시했다. 계약 상대방은 에스케이하이닉스 주식회사이고, 계약금액은 211.6억원 규모로 최근 디아이티 매출액 1,166.6억원 대비 약 18.14 % 수준이다. 이번 계약의 기간은 2025년 12월 04일 부터 2026년 03월 18일까지로 약 3개월이다. 한편 이번 계약수주는 2025년 12월 04일에 체결된 것으로 보고되었다.    수주 공시는 향후 기업의 실적에 직접적인 영향을 미치기 때문에 계약의 규모, 계약 기간 등에 대해서 주의 깊게 살펴볼 필요가 있다. 특히 수주 공시가 늘어나는데 주가는 움직이지 않는다면 매수 관점에서 접근해 볼 수도 있다.  한경로보뉴스  이 기사는 한국경제신문과 금융 AI 전문기업 씽크풀이 공동 개발한 기사 자동생성 알고리즘에 의해 실시간으로 작성된 것입니다.",https://n.news.naver.com/mnews/article/015/0005220135
2025-12-04 13:40:00,투자리딩방 제보자에 1억원…역대 최고 보상금,"투자리딩방 조직 제보자에 역대 최고의 검거보상금 1억원이 주어졌다. 수백억원대 사기를 친 투자리딩방 조직 검거에 결정적 제보를 했다는 취지에서다.  이는 경찰청이 지난 7월 보이스피싱, 마약 등 조직범죄 신고 활성화를 위해 특별검거보상금 제도를 도입한 이후 역대 최고 보상금이다.  해당 투자리딩방 조직은 국내를 거점으로 활동한 것으로 전해졌다.  다만 제보자 신변 보호를 위해 경찰은 구체적인 사건 경위는 공개하지 않았다.  불법대부업 운영 범죄단체, 조직강도 상해 피의자 검거 과정에서 주요 제보를 한 시민에게도 각각 4000만원, 1300만원의 특별검거보상금이 지급됐다.  박성주 국가수사본부장은 제보자에게 직접 감사장과 보상금을 전달했다.  경찰청은 지난 7월부터 △보이스피싱·투자리딩 사기 △대규모 마약류 밀반입·유통 △수십억원 규모의 불법 도박장 개설 등 범죄조직 제보를 심사해 총 5억6600만원(22건)의 검거보상금을 지급했다.  이중 특별검거보상금은 3억원(7건)이다.  박 본부장은 ""적극적 신고와 제보가 악성·조직성 범죄 근절의 핵심 동력""이라며 ""보상금을 더욱 활성화하고 제보자 신변 보호에도 만전을 기하겠다""고 말했다.",https://n.news.naver.com/mnews/article/015/0005220134
2025-12-04 13:38:00,"방폭협회 2025년 하반기 세미나 성료...""중대재해 예방 협력 결의""","화재·폭발 방지 안전관리 대응 전략 및 신기술 소개   한국방폭협회(공동회장 박종훈·백순흠)가 화학네트워크포럼과 공동 주최한 '2025하반기 산업안전 세미나'가 성황리에 열렸다.  협회는 지난 3일 오후 3시 울산 문수컨벤션 다이너스티룸에서 개최한 산업안전세미나에 산업안전 및 방폭 관련 종사자, 울산여천공장장협의회, 울산안전소통위원회 등 200여명이 참석했다고 4일 밝혔다.  기념식에는 부산지방고용노동청 김준휘 청장, 낙동강유역환경청 서흥원 청장, 울산시 이은숙 안전정책관, 한국화학연구원 서봉국 본부장, 산업단지공단 울산지역본부 윤기수 본부장 등이 참석해 울산지역 공단 화재폭발 사고예방을 위해 상호 협력하며 결의를 다지는 시간도 가졌다.  김준휘 부산지방고용노동청장은 ""최근 부·울·경에서 두 건의 중대산업사고가 발생해 근로자들이 소중한 생명을 잃었다""며 ""앞으로 사고 없는 일터와 안전한 대한민국이란 목표 실현을 위해 선제적 예방지원강화, 노동안전 인프라 확대를 통한 구조개선, 실효적 제제수단 도입을 통한 안전 예방활동에 적극 나서겠다""고 밝혔다.  서흥원 낙동강유역환경청장은 ""화학사고 등 산업현장에서 발생하는 사고를 예방하기 위해 방폭협회 전문가의 고급 인력풀을 적극 활용해 단 한 건의 사고라도 사전에 예방할 수 있도록 노력하겠다""고 말했다.  박종훈 한국방폭협회 공동회장은 ""한국방폭협회는 위험지역의 사고 예방을 위해 전문 인력 양성과 법·제도 개선, 기술역량 강화를 위한 방폭산업을 지속적으로 확대하고, 사고예방을 위해 보다 과학적이고 객관적인 정보를 제공하는데 힘쓰겠다""고 말했다.   이어 열린 세미나에서는 서창주 가스안전공사 전문위원이 '전기방폭시설 안전관리 대응', 울산연구원 환경안전실 윤영배 박사가 '산업단지 방폭안전 울산에서 전국으로'로 주제발표를 했다.  파이프 케어 안영흠 대표의 '노후화된 지하배관 갱생', 온브랜딩 강현덕 소장의'제조산업에서 활용가능한 딥러닝 기술현황', 세이프가 개발한 '비접촉 정전기 및 열화상 측정기'에 대해 한국전기연구원 배준한 박사 등이 신기술 개발 소개도 가졌다.  울산시는 전국 최초로 제정된 방폭 조례안에 따라 내년부터 화재 폭발사고 예방을 위해 산업체 방폭설비 진단과 개선에 나선다.  방폭협회는 산·학·연·관 협업을 통해서 사업수행에 적극 나서기로 했다.  울산=하인식 기자 hais@hankyung.com",https://n.news.naver.com/mnews/article/015/0005220133
2025-12-04 13:34:00,"'프로티나' 52주 신고가 경신, SPID, 블록버스터 발굴해 줘 - 한국투자증권, None","◆ 최근 애널리스트 분석의견 - SPID, 블록버스터 발굴해 줘 - 한국투자증권, None 12월 02일 한국투자증권의 위해주 애널리스트는 프로티나에 대해 ""항체 바이오베터 발굴 속도 전세계 1위. 항체 기반 플랫폼, 소분자화합물 발굴도 가능. 생각보다 빠른 성과 창출도 가능: SPID 성과는 생각보다 빠르게 나올 수 있다. 논문 발간, 확장 계약 그리고 2026년 부터는 실제 기술이전 등의 성과도 기대할 수 있다. 최근 빅파마의 기술도입 트렌드는 임상 성공 가능성 높은 Best-in-class 또는 바이오베터를 도입하는 것이라 기술이전 실현 가능성 높다. 한편 비상장 피어인 Generate:Biomedicines은 23년 9 월 누적 7억달러 펀딩 후 포스트 20억달러, Xaira Therapeutics는 27억달러로 평가 받고 있다. 기존 AI 신약개발 기업은 검증되지 않은 가상의 AI 알고리즘으로 구성된 기업이라 진입장벽이 낮지만, 프로티나는 AI 및 인간에 의해 설계된 후보물질의 참과 거짓을 최단기간 내 구분하는 실제 데이터 생성 기업이라는 측면에서 차별성이 있다.""이라고 분석하며, 투자의견 'None'를 제시했다  한경로보뉴스  이 기사는 한국경제신문과 금융 AI 전문기업 씽크풀이 공동 개발한 기사 자동생성 알고리즘에 의해 실시간으로 작성된 것입니다.",https://n.news.naver.com/mnews/article/015/0005220132
2025-12-04 13:31:00,"'엘앤케이바이오' 52주 신고가 경신, 외형 확장 본격화 기대 - KB증권, None","◆ 최근 애널리스트 분석의견 - 외형 확장 본격화 기대 - KB증권, None 12월 02일 KB증권의 김현겸 애널리스트는 엘앤케이바이오에 대해 ""척추 임플란트 및 확장형 케이지 시스템 개발, 제조·판매에 주력하는 정형외과 의료기기 전문기업이다. 척추 수술 관련 Full 라인업을 갖추었으며, 미국 FDA, 유럽 CE 등 주요 글로벌 인증을 획득하여 제품 경쟁력과 신뢰도를 입증했다. 3Q25 누적 매출액 (연결) 303억원 (+16.3% YoY), 영업이익 19억원 (-23.7% YoY)을 기록했다. 체크포인트 1) 글로벌 파트너사와의 총판 계약 본격화. 2) 흉곽용 신제품 'CastleLoc Pectus' 주목""이라고 분석하며, 투자의견 'None'를 제시했다  한경로보뉴스  이 기사는 한국경제신문과 금융 AI 전문기업 씽크풀이 공동 개발한 기사 자동생성 알고리즘에 의해 실시간으로 작성된 것입니다.",https://n.news.naver.com/mnews/article/015/0005220131
