날짜,제목,본문,링크
2025-12-15 17:30:00,자율주행 스타트업 투자 급감…항공·해양은 늘어,"국내 자율주행 분야 스타트업 투자가 크게 줄어든 것으로 확인됐다. 15일 스타트업레시피에 따르면 올해 1~11월 국내 모빌리티 스타트업 투자액은 2246억원으로 전년 동기보다 35% 감소했다. 3년 연속 하락세다. 자율주행 분야의 타격이 컸다. 모빌테크, 뉴빌리티 등이 각각 30억원대 자금을 확보한 것을 포함해 총 100억원 수준에 그쳤다. 지난해 오토노머스에이투지, 라이드플럭스, 스트라드비젼 등이 각각 200억~400억원대 투자를 받은 것과 대조된다. 자율주행 투자는 지난해 전체 모빌리티 스타트업 투자 중 37%를 차지했지만 올해 비중은 한 자릿수(4%)로 줄었다.  자율주행 분야의 대형 사업실증(PoC)도 감소하고 있다. 한 자율주행 스타트업 C레벨은 “국내에서 자율주행 사업 진척이 더뎌 투자금 확보와 인재 유치가 쉽지 않은 상황”이며 “신규 스타트업도 거의 등장하지 않고 있다”고 말했다.  항공·해양 모빌리티 투자가 655억원으로 전체 모빌리티 투자 가운데 29%를 차지했다. 이어 프리뉴(종합무인항공기) 150억원, 넥스트에어로스페이스(유무인 항공기) 185억원, 에이드로(모빌리티 에어로테크) 100억원, 드라이브포스(친환경 선박) 60억원 등이 모빌리티 부문 투자를 이끌었다.",https://n.news.naver.com/mnews/article/015/0005224699
2025-12-15 17:30:00,19일 만에 500만 돌파…‘주토피아2’가 바꾼 흥행지도,"글로벌 박스오피스를 휩쓸고 있는 영화 ‘주토피아2’가 국내 극장가에서도 흥행가도를 달리고 있다. 갈등 대신 공존에 주목한 ‘편안한 서사’가 관객의 호응을 끌어내고 있다. 한국영화의 존재감이 옅어진 틈새를 탄 ‘외화 강세’ 흐름도 관람 열기에 불을 지폈다.  15일 영화진흥위원회 입장권통합전산망에 따르면 ‘주토피아2’는 전날까지 537만 명이 관람했다. 지난달 26일 개봉한 이후 19일 만에 누적 관객 500만 명을 돌파했다. 올해 최고 흥행작인 ‘귀멸의 칼날: 무한성편’보다 20일 앞선 기록이다. 장기 불황이 이어지며 ‘천만 영화’가 실종된 올해 극장가에서 500만 관객은 흥행 성패를 가르는 지표로 꼽힌다.  올해 최단기간 500만…中까지 홀렸다  ‘주토피아2’는 최근 전 세계에서 가장 티켓 파워가 강한 영화로 이름을 올리며 시장을 주도하고 있다. 한국뿐 아니라 북미, 프랑스, 중국 등 주요 시장에서 관객을 동원하며 17일 만인 지난 12일 글로벌 박스오피스 수익 10억 달러(약 1조5000억원)를 기록했다.  특히 중국에서 흥행성적이 두드러진다. 무역·안보를 두고 미중 패권갈등이 심화되며 할리우드 영화가 고전하는 상황에서도 ‘주토피아2’ 만큼은 중국 관객들이 거부감 없이 받아들이고 있다. 중국 박스오피스 집계 플랫폼 마오옌에 따르면 ‘주토피아2’는 이날 기준 35억6000만 위안(약 4억9000만 달러)의 수익을 냈다. ‘어벤져스: 엔드게임’에이어 중국에서 개봉한 역대 미국 영화 중 흥행 2위다.  전작이 개봉한 2016년 당시 중국 언론에서 “서양식 사고방식을 주입하는 ‘보이지 않는 프로파간다’”로 비판했던 것과 확연히 다른 분위기다. 중국마저 홀린 ‘주토피아2’의 매력을 두고 해외에선 ‘공존의 서사’를 거론한다. 동물들이 서로 협력한다는 스토리는 중국 공산당도 환영하는 메시지란 점에서다.  누구나 쉽게 공감할 수 있는 무겁지 않은 편안한 이야기도 관객들을 사로잡았다는 평가다. 캐나다 매체 글로브앤드메일은 ‘중국은 왜 주토피아에 열광할까’라는 기사에서 “중국 관객은 선전용 영화에 지쳐 있고, 관객을 가르치려 들지 않는 작품을 원한다”고 분석했다.  영화계는 ‘주토피아2’의 국내 흥행도 비슷한 시각으로 바라본다. 자극적 폭력이나 갈등으로 피로감을 주는 대신 공존을 그린 세계관이 흥행요소란 것. 윤가은 감독의 ‘세계의 주인’이 의외의 흥행을 거둔 것과 비슷한 맥락이다. ‘주토피아2’ 제작에 참여한 이숙희 수퍼바이저는 최근 한국 언론과의 인터뷰에서 “사람마다 웃는 포인트가 다르다”며 “여러 동물의 공존을 다루다 보니 남녀노소 불문하고 많은 사람이 공감할 요소가 있었다”고 했다.  올해 ‘흥행 TOP5’는 외화 일색  ‘주토피아2’ 흥행을 바라보는 영화계의 속내는 복잡하다. 관객의 발길이 늘어나는 것은 반길 일이지만 흥행 집중도가 외화에 쏠리고 있기 때문이다. 영화진흥위원회에 따르면 이날 기준 올해 누적 관객 수 상위 5편은 ‘귀멸의 칼날: 무한성편’(567만) ‘좀비딸’(563만) ‘주토피아2’(537만) ‘F1:더 무비’(521만) ‘체인소 맨:레제편’(341만)이다. 국내 영화는 ‘좀비딸’ 한 편 뿐이다.  지난해 상위 1~5위(‘파묘’ ‘범죄도시4’ ‘인사이드 아웃2’ ‘베테랑2’ ‘파일럿’)에 외화가 단 한 편이었던 것과 대비된다. 1년 만에 국내 영화와 외화 간 흥행 지형도가 뒤바뀐 것이다. 한 배급사 관계자는 “전체적인 극장 관객 볼륨이 줄어든 데다 ‘어쩔수가없다’ 등 국내 기대작들이 흥행에 어려움을 겪은 영향”이라고 말했다.  유승목 기자",https://n.news.naver.com/mnews/article/015/0005224698
2025-12-15 17:29:00,"'10년마다 매출 2배' 태경…""대리석·뷰티 소재로 2조 도전""","대전 대덕산업단지에 있는 인조대리석 제조사 라이온켐텍. 15일 찾은 이곳은 수묵화를 연상케 하는 물결무늬 대리석을 성형하고 가공하는 작업으로 분주했다. 라이온켐텍의 미래 먹거리 ‘스마트 패턴 대리석’이다. 김홍진 라이온켐텍 대표는 “스마트 공정을 통해 최근 18종의 패턴 대리석 개발을 마치고 양산을 준비 중”이라며 “경쟁사가 모방하기 어려운 다양한 무늬를 구현해 스페인 미국 등 해외 거래처의 방문이 이어지고 있다”고 설명했다.  라이온켐텍은 기초 소재 제조 기반의 태경그룹이 올해 초 인수한 회사다. 올해 창립 50주년을 맞은 태경그룹은 라이온켐텍을 새로운 성장 동력으로 삼아 10년 후인 2035년 매출 2조원을 달성하겠다는 미래 비전을 제시했다.  ◇내수 한계를 수출로 극복 태경산업 등 4개 상장사와 13개 관계사를 거느린 태경그룹은 ‘산업의 소금’으로 불리는 무기화학물 계열의 기초 소재를 국산화하며 성장했다. 제지, 철강, 화학산업에 쓰이는 석회, 중질탄산칼슘, 산화아연 등이 대표적이다. 태경그룹은 올해 신규 법인 3개를 인수해 매출 1조원을 눈앞에 뒀지만 추가 성장 동력이 절실한 상황이었다. 창업 2세인 김해련 태경그룹 회장은 “국내 제조업의 설비투자가 줄고 있어 내수 시장 중심의 기초 소재 산업은 이미 성숙 시장 단계로 접어들었다”며 “글로벌 시장 진출을 확대해 성장 한계를 극복해 나갈 것”이라고 강조했다.  태경그룹 도약의 첨병 역할은 라이온켐텍이 맡는다. 올해 3분기까지 매출 1000억원을 기록한 이 회사는 5년 뒤 5000억원 매출을 목표로 하고 있다. 스마트 패턴 인조대리석이 성장 엔진이다. 라이온켐텍은 20~30가지 안료를 배합해 무늬가 일정하게 새겨지도록 분사하고, 각종 첨가제의 화학적 성질을 활용해 안료가 대리석에 깊숙이 침투할 수 있는 스마트 공정을 개발했다.  지난해 4조원대인 세계 인조대리석 시장은 2035년 11조원 규모로 성장할 것으로 전망된다. 김 대표는 “사무 공간과 주택, 식당 등에 널리 쓰이던 MDF(중밀도 섬유판)가 위생과 디자인이 우수한 인조대리석으로 바뀌는 추세”라며 “화려한 무늬가 들어간 인조대리석은 개발 과정이 쉽지 않아 단색의 범용 인조대리석에 비해 가격이 두 배에 이르는 고부가가치 제품으로 주목받고 있다”고 말했다. ◇화장품 소재도 신성장 동력 라이온켐텍은 산업용 왁스 사업도 강화하고 있다. 플라스틱제품 촉매제용 특수 왁스 국내 1위다. 글로벌 시장 규모는 2조원에 이른다.  태경그룹은 김 대표를 영입하는 것을 전제로 라이온켐텍을 인수했다. 김 회장은 “경영은 사람이 하는 만큼 확실하게 검증된 최고경영자(CEO)가 있는 기업을 인수하는 것이 철칙”이라고 했다. 김 대표는 한화그룹 상하이 법인장과 동화기업 대표 등을 지낸 뒤 올해 3월 대표로 취임해 원가절감, 공정 개선 등을 거쳐 적자 상태였던 라이온켐텍을 6개월 만에 흑자 전환으로 이끌었다.  화장품 기초 소재도 태경그룹의 미래 먹거리 가운데 하나다. 친환경 무기계 자외선 차단 원료를 국산화한 태경에스비씨와 태경코엠, KPT가 세계적인 나노 입자 제어 기술 등을 보유하고 있다. 로레알, 아모레퍼시픽, LG생활건강, 코스맥스, 콜마 등에 보습 원료를 비롯한 다양한 화장품 원료를 공급한다. 태경그룹은 현재 400억원 정도인 화장품 소재 매출을 2035년까지 2000억원으로 끌어올릴 계획이다.  태경그룹은 1000억원 매출을 찍은 1995년 이후 10년마다 매출을 두 배로 늘리는 성장세를 이어왔다. 김 회장은 “점유율을 확대해 기존 사업에선 확고한 1등으로 올라서고 신규 사업에선 글로벌 시장에 진출해 10년 안에 매출 2조원을 달성하겠다”고 강조했다.  대전=이정선 중기선임기자 leeway@hankyung.com",https://n.news.naver.com/mnews/article/015/0005224697
2025-12-15 17:28:00,당대표 선거 '전초전' 與보선…김 총리 최측근 강득구 '출사표',"강득구 더불어민주당 의원이 15일 최고위원 보궐선거 출마를 공식 선언했다. 강 의원은 이재명 대통령이 민주당 대표를 지낼 당시 사무부총장을 맡았고, 김민석 국무총리의 최측근으로 분류되는 인물로 이번 선거에서 ‘친명’ 진영 후보로 꼽힌다.  강 의원은 이날 국회에서 기자회견을 열고 “대통령 혼자서는 개혁을 완성할 수 없다”며 “당과 정부가 하나의 팀으로 움직이는 원팀 체제가 반드시 필요하다”고 강조했다. 친명계 원외 조직인 더민주혁신회의 공동위원장 유동철 부산 수영구 지역위원장과 이재명 대통령의 대장동 사건 변호인이었던 이건태 의원이 각각 지난 9일과 11일 출마를 선언한 데 이어, 강 의원은 세 번째 친명계 후보로 이름을 올렸다. 친청(정청래) 진영에서는 문정복 의원과 이성윤 의원이 출마를 선언했다.  강 의원은 “이 대통령의 성남시장 시절부터 가까이에서 함께했고, 민주당 대표 시절에는 수석사무부총장으로서 당 운영을 책임졌다”며 “이 경험을 바탕으로 이재명 정부의 성공을 흔들림 없이 뒷받침하겠다”고 밝혔다. 그는 3선 경기도의원과 경기도의회 의장, 경기도 부지사를 지낸 ‘풀뿌리 정치인’으로, 전국자치분권민주지도자회의 초대 공동대표를 맡았던 이력도 강조했다. 강 의원은 “지방자치 현장에서 쌓은 경험을 토대로 지방선거 압승을 이끌겠다”고 말했다.  이날 출마 회견에는 이 대통령의 핵심 측근으로 꼽히는 김우영 의원을 비롯해 박성준·민병덕·이정헌·이연희 의원 등이 참석해 힘을 실었다. 강 의원은 이번 보궐선거가 친명 대 친청(친정청래) 구도로 비쳐지는 데 대해 “우리 당은 모두 친명”이라며 “언론이 만든 프레임”이라고 일축했다.  다만 정치권에서는 강 의원의 출마를 두고 ‘전초전’ 성격이 짙다는 분석도 나온다. 정청래 대표가 내년 지방선거 이후 치러질 당대표 선거에서 연임에 도전할 것이라는 전망이 우세한 가운데, 대항마로 김민석 총리가 거론되고 있기 때문이다. 김 총리의 최측근인 강 의원의 출마를 놓고 내년 당권 경쟁의 사전 신호탄이라는 해석도 제기된다.  내년 1월 11일 치러지는 민주당 최고위원 보선은 전현희·김병주·한준호 의원이 6월 지방선거 출마를 위해 최고위원직을 사퇴하며 치러진다.",https://n.news.naver.com/mnews/article/015/0005224696
2025-12-15 17:28:00,"[특징주 & 리포트] '티엠씨, 상장 첫날 80% 급등' 등","● 티엠씨, 상장 첫날 80% 급등  티엠씨 주가가 유가증권시장 상장 첫날인 15일 급등했다. 공모가(9300원) 대비 80.32% 뛴 1만6770원에 거래를 마쳤다. 1991년 서진공업으로 시작한 티엠씨는 선박용 및 해양용 케이블을 주로 제조·판매하는 회사다. 2011년 원자력 발전용 케이블에 대해 전력산업기술기준(KEPIC) 인증을 획득한 이후 원자력용 케이블 사업에도 진출했다. 지난해 기준 제품의 매출 비중은 선박용 케이블 60.6%, 해양용 케이블 15.8%, 광케이블 6.7%다. 의무보유확약 비율은 58.2%다. 일반 청약 때 1305.47 대 1의 경쟁률을 보였다.  ● 에쓰오일 목표가 11만원으로 상향  하나증권은 에쓰오일에 대한 목표주가를 기존 10만원에서 11만원으로 올렸다. 사우디아라비아의 원유 공식판매가격(OSP) 인하와 파라자일렌(PX) 시황 개선으로 호실적을 보일 것으로 예상했다. 윤재성 연구원은 “유가 하락에 따른 재고 관련 손실이 발생하겠지만 정제마진 개선 효과가 더 클 것”이라며 “석유화학 부문 적자도 축소될 수 있다”고 설명했다. 올해 4분기 영업이익은 4954억원으로 추정했다. 컨센서스(증권사 추정치 평균) 2886억원을 72% 웃도는 수치다. 그는 “내년 영업이익 급증 이전에 선매수하는 전략이 유효하다”고 평가했다.  ● 투자경고에…한화에어로 5% 뚝  한화에어로스페이스가 5.52% 급락한 90만8000원에 마감했다. 한국거래소가 투자경고종목으로 지정한 게 주요 배경으로 꼽힌다. 한화에어로스페이스 주가는 1년 전보다 200% 이상 뛴 상태다. 투자경고종목으로 지정된 건 최근 15일간 시세 영향력을 고려한 매수관여율 상위 10개 계좌의 관여율이 기준을 초과한 일수가 나흘 이상이어서다. 거래소 측은 “투자경고종목 지정일 이후 2일동안 40% 이상 상승하고 지정전일 종가보다 높으면 1회에 한해 매매거래가 정지될 수 있다”고 안내했다. 현재 거래소는 시가총액 상위 종목에 대해선 투자경고 예외로 두는 방안을 검토 중이다.  ● 무관세에…조미김 관련주 상승  미국이 ‘K푸드 선두주자’로 꼽히는 조미김의 관세를 면제하자 관련 종목이 일제히 강세를 보였다. 수산물 가공유통업체 사조씨푸드는 4.41% 오른 9000원으로 거래를 마쳤다. CJ씨푸드(1.29%), 신라교역(1.28%), 사조대림(1.31%) 등도 상승했다. 미국 백악관이 발표한 상호관세 관련 설명자료에 따르면 조미김이 한국 수산물 중 유일하게 무관세 품목으로 기재됐다. 관세율 0%는 지난달 13일부터 소급 적용됐다. 조미김은 미국 내 생산이 어려운 품목이다.",https://n.news.naver.com/mnews/article/015/0005224695
2025-12-15 17:28:00,"세아항공방산, 보잉에 납품…알루미늄 소재 장기 계약","세아베스틸지주의 자회사 세아항공방산소재가 미국 보잉에 알루미늄 합금 소재를 장기 공급하는 계약을 체결했다고 15일 밝혔다.  세아항공방산소재는 내년부터 항공기 동체·날개용 고강도 알루미늄 합금 소재를 보잉에 납품한다. 이번 계약은 지난해 보잉과 맺은 직거래 계약의 후속 약정이다.  항공기 구조 부품 소재인 고강도 알루미늄 합금은 고도의 정밀성과 균일한 품질 안정성이 요구된다.  이번 계약을 통해 세아항공방산소재는 경남 창녕에 건설 중인 2300t 규모 알루미늄 소재 신공장의 납품 물량을 선제적으로 확보했다. 신공장은 2027년 본격 가동에 들어간다. 세아항공방산소재는 보잉 이외에 에어버스와 중국 코맥, 브라질 엠브라에르, 캐나다 봄바디어 등 여러 글로벌 항공 제작사에 소재를 공급하고 있다.  이 회사는 올해 3분기 누적 기준으로 989억원의 매출을 올렸다. 영업이익과 영업이익률은 각각 203억원, 20.6%를 기록하며 세아베스틸지주의 핵심 자회사로 성장했다는 평가를 받는다.",https://n.news.naver.com/mnews/article/015/0005224694
2025-12-15 17:27:00,"기획재정부, 산업경쟁력강화 관계장관회의 겸 성장전략 TF","▶오전 8시30분 기획재정부, 산업경쟁력강화 관계장관회의 겸 성장전략 TF  ▶오전 10시 포스코DX 3분기 실적  ▶오전 11시 더불어민주당-대한상공회의소 정책간담회  ▶낮 12시 한국은행 10월 통화 및 유동성  ▶낮 12시 국가데이터처 2024년 기업활동조사 결과  ▶오후 4시 한국은행 금통위 의사록  ▶오후 9시30분(한국시간) 미국 10월 소매판매  ▶오후 10시30분(한국시간) 11월 미국 고용보고서  ▶아크릴 상장(공모가 1만9500원)  ▶리브스메드 청약(공모가 5만5000원)  ▶한화 온타이드 동아화성 에이에스텍 디앤디플랫폼리츠 주주총회",https://n.news.naver.com/mnews/article/015/0005224693
2025-12-15 17:27:00,"""AI로 기업 기술 평가하는 시대…특허 분석도 쉬워진다""","기업 기술을 평가할 때 인공지능(AI)을 어디까지 활용할 수 있을지를 비롯한 AI 시대의 경영 전략을 논의하는 장이 열렸다. AI로 인해 특허 기술을 평가할 때 시간이 대폭 단축될 것이란 전망도 나왔다.  기술보증기금은 15일 한국경제신문과 함께 서울 여의도 글래드호텔에서 ‘딥테크 기술평가 서밋’을 개최했다. ‘AI 대전환 시대 기술평가의 미래와 도전’이라는 주제로 열린 이날 행사에선 고기석 오픈AI 글로벌 어페어즈 한국정책총괄이 기조연설을 맡았고 구나 문트 유럽투자은행(EIB) 수석고문관이 축사를 했다.  고 총괄은 기조연설에서 “AI는 정보 비대칭에 따른 비효율을 줄여주고 기술평가의 공정성과 정확성을 높여주는 좋은 수단이 된다”며 “기보의 기술평가에 AI가 접목돼 앞으로 연구실에서 시장으로 진출하는 길을 더 단축해줄 것”이라고 내다봤다.  AI 시대에 전력 안정망 확보가 기업 성장을 좌우할 핵심 변수가 될 것이란 관측도 제기됐다. 박진서 인피니언테크놀로지스 아시아태평양 전략총괄(상무)은 “향후 AI 데이터센터 전력 소비량이 세계 전력 소비량의 7%를 차지할 것으로 예상된다”며 “AI 시대에는 기술 발전 외에 데이터센터에 공급할 전력망 안정성도 고려해야 한다”고 강조했다.  ‘AI로 재편되는 기술혁신 생태계, 기술평가 뉴 패러다임’을 주제로 열린 패널토론에서는 AI 시대에 적정한 기술평가 관점이 무엇인지 등이 논의됐다. 이재필 기보 상임이사는 “기술평가 인력의 차별성과 도메인 특화 모델 개발 방안 등을 고민 중”이라며 “신뢰성 있는 데이터를 지속적으로 확보하면서 보안을 철저히 유지해야 한다는 점이 중요하다”고 했다.  기보는 기업의 성장성과 위험도를 동시에 평가할 수 있는 시스템과 특허 평가 체계, 실시간 학습 모형 등을 내년부터 순차적으로 선보일 계획이다. 특히 벤처캐피털(VC)이 스타트업에 투자할 때 의사 결정에 도움이 될 만한 모델을 개발하고 창업 기업용 테크인덱스 등을 신설할 예정이다.  김종호 기보 이사장(사진)은 “기술평가가 모든 해답을 줄 순 없지만 새로운 기술 환경 속에서 방향을 판단하는 좌표 역할을 하는 것은 분명하다”며 “평가체계가 시대적 요구에 부합하도록 꾸준히 다듬어나갈 계획”이라고 말했다.",https://n.news.naver.com/mnews/article/015/0005224692
2025-12-15 17:26:00,코스피보다 쏠쏠하네…'124%' 수익률 대박 난 종목 보니,"국내 최초의 ‘로테이션 상장지수펀드(ETF)’인 ‘SOL 코리아메가테크액티브’가 올해 코스피지수 상승률을 훨씬 웃도는 성과를 냈다. 시장 상황에 따라 투자 테마를 교체하는 전략이 주효했다는 평가가 나온다.  펀드가이드에 따르면 지난 11일 기준 SOL 코리아메가테크액티브는 연초 대비 124.16% 올랐다. 같은 기간 코스피지수 상승률(71.31%)의 1.7배에 달한다. 2022년 10월 상장 이후 누적 수익률은 207.13%에 이른다. 효성중공업과 두산에너빌리티 등을 담은 인공지능(AI) 전력 인프라 테마가 수익률을 견인했다는 분석이다. 파운드리, 지능형 로봇 등 다른 테마도 수익률 상승에 기여했다.  자금 유입도 활발했다. 지난해 말 161억원이던 순자산은 이달 11일 기준 3439억원으로 20배 넘게 증가했다. 국내 주식형 액티브 ETF 가운데 순유입 규모 1위다.  SOL 코리아메가테크액티브는 시장 흐름에 따라 테마 비중을 적극적으로 조정하는 것이 특징이다. 한국경제신문이 개발한 ‘KEDI 메가테크’ 지수를 기반으로 운용된다. 이 지수는 국내 주요 리서치센터장과 한경 베스트 애널리스트 등 전문가 30여 명의 설문을 토대로 매년 두 차례(6월·12월) 정기적으로 리밸런싱된다.  이번 리밸런싱에서는 AI, 지능형 로봇, 항공우주, 모빌리티, 맞춤형 헬스케어, AI 전력 인프라, 파운드리, 에너지저장장치(ESS) 등 기존 8개 테마를 유지하기로 했다. 이미 시장을 주도하는 테마와 핵심 종목을 포트폴리오에 편입하고 있고, 내년 전망도 밝다는 판단에서다.  김주영 신한자산운용 주식투자운용본부 이사는 “2026년 상반기 국내 증시는 주도주 가운데 실적이 좋은 종목을 중심으로 상승할 것”이라며 “반도체와 전력 인프라 등 테마가 내년에도 매력적”이라고 말했다.",https://n.news.naver.com/mnews/article/015/0005224691
2025-12-15 17:26:00,"""법정기금, 벤처 투자 의무화""…중기중앙회, 민주당에 요구","중소기업중앙회는 15일 서울 여의도 중기중앙회에서 더불어민주당과 함께 ‘중소기업 입법과제 타운홀미팅’을 개최했다고 15일 밝혔다. 지난 9월 열린 정청래 민주당 대표와 중소기업인 간담회의 후속 조치를 공유하고, 중소기업 입법 과제를 논의하기 위한 자리다.  민주당에서는 정 대표와 한정애 정책위원회 의장, 권칠승 중소기업특별위원장 등이 참석했다. 중소기업계에서는 김기문 중기중앙회장을 비롯해 김학균 한국벤처캐피탈협회장, 송병준 벤처기업협회장 등 80여 명이 자리했다.  이날 간담회에서 중소기업계는 투자 촉진, 규제 혁신, 성장 지원과 관련한 정책을 건의했다. 구체적으로 국민연금과 공무원연금을 비롯한 67개 법정기금의 벤처·스타트업 투자를 의무화하자는 게 골자다. 이 밖에 국민성장펀드와 코스닥 활성화 펀드 등을 연계해 중소기업과 벤처기업, 스타트업에 대한 자금 유입을 촉진해달라고 요구했다.",https://n.news.naver.com/mnews/article/015/0005224690
