날짜,제목,본문,링크
2025-12-04 23:50:00,"더 많이 생각할수록, 더 나쁜 상황 속으로 빠져든다","2025년이 저물고 있다. 올해도 정말 많은 사건 사고들이 우리의 생각과 마음을 어지럽혔다. 차분하게 한 해를 살고 싶었지만, 수시로 분노가 치밀어 올랐고, 두려움이 밀려 왔으며, 한숨을 쉬어댔다. 가만 생각해보면, 삶이 그토록 혼란스러웠던 이유는 뜻대로 돌아가지 않는 주변 상황과 맘대로 되지 않는 다른 사람들 때문이었다. 자신의 의지대로 온전히 살지 못했기 때문이었다.   올 한해 영국에서 베스트셀러 목록에 올랐던 자기계발서들을 살펴보면, <렛뎀이론(The Let Them Theory)> <생각중독(Overthinking)>, <당신이 생각하는 모든 것을 믿지 말라(Don&#39;t Believe Everything You Think> 등, 어지럽혀진 생각과 감정을 정리하는 방법을 알려주는 책들이 인기를 끌었다. 남에게 휘둘리며 삶의 주도권을 잃어버린 사람들에게 각성과 성찰을 요구하는 책들도 많았다. 호주 출신의 베스트셀러 작가이면서 2백만 명 이상의 팔로워를 보유한 인플루언서인 다니엘 치디아크(Daniel Chidiac)가 쓴 <휘둘리지 마세요(Stop Letting Everything Affect You)> 역시 그런 책이다. 생각 과잉이나 감정 과잉, 그리고 죄책감이나 자기 비난에서 벗어나는 방법을 알려준다. 사소한 일들에 마음을 빼앗겨 하루를 망쳐버리는 사람들에게 도움이 될만한 조언을 소개한다.  “우리 마음이 종종 우리를 속이곤 합니다. 그리고 이러한 속임수 때문에 우리는 과도한 생각에 빠지게 됩니다. 우리는 충분히 오래 생각하면 문제를 해결할 수 있을 거라고 믿지만, 사실은 더 많이 생각할수록, 더 나쁜 상황 속으로 빠져듭니다. 결국 ‘오버씽킹이 문제를 해결하지 못한다’는 것을 깨닫게 됩니다. 심리학자들은 그것을 ‘불안 루프(Anxiety Loop)’라고 부릅니다.” 책은 과도한 생각이 또 다른 걱정을 유발하고, 더 많은 스트레스 속으로 우리를 빠트린다고 경고하며, 심리적 악순환인 불안 루프에서 벗어나야 한다고 강조한다.  심리적 악순환과 불안 루프에서 벗어나기 위해서는 전략과 장치가 필요하다. 저자는 ‘집중력 회복 시스템’과 ‘정신적 여유 공간’을 설계하라고 제안한다. 바쁘게 돌아가는 현대 사회에서 필요한 것은 ‘시간 관리’가 아니라, ‘집중력 회복’이다. 집중력 회복 시스템을 위해서는 첫째, 조용한 구석, 평화로운 야외 공간 또는 화장실 등, 시각과 청각의 자극을 최대한 덜 받을 수 있는 공간으로 가야 한다. 둘째, 각종 기계로부터 자유로워져야 한다. 디지털 세계와 연결되는 휴대폰, 태블릿, 시계 등과는 잠시 이별하는 것이 좋다. 셋째는 자연 요소가 있으면 도움이 된다. 새 소리, 물소리, 초록색 푸른 풍경은 집중력 회복에 큰 도움이 된다. 넷째, 시간을 확보해야 한다. 단 5분이라도 집중력 회복을 위한 로그아웃 시간을 따로 마련해야 한다. 정신이 맑은 오전 시간대에는 10분 정도 ‘걱정을 위한 시간’을 정해놓는 것도 생각 과잉을 피하는 방법이다. 이렇게 뭔가에 집중할 필요가 없는 시간이 도리어 집중력을 회복시켜준다.  인생에 대한 주도권을 잃었을 때 압박감과 무력감이 찾아온다. 호시탐탐 우리의 삶에 참견하려고 고개를 기웃거리는 사람들, 우리의 생각과 마음을 압도하는 중요하지 않은 걱정거리들이 집중력과 안정감을 흩트린다. 책은 불안과 고통을 빚어내는 모든 생각과 감정에서 벗어나게 하는 해독제다.  홍순철 BC에이전시 대표, 북칼럼니스트",https://n.news.naver.com/mnews/article/015/0005220472
2025-12-04 23:50:00,"""인간지능은 늘 기술과 협력하며 진화…AI는 새로운 동반자""","인공지능(AI)은 '생각하는 동물' 인류의 정의를 뒤흔든다. 역사상 인류는 수고로운 일을 기계에 위탁하며 발전해왔지만, AI은 생각하는 힘을 외부에 맡긴 최초의 기술이다. 'AI가 대체할 수 없는 인간의 본질은 무엇인가'를 탐구하는 책이 쏟아지는 건 곧 인간의 불안이 가중되고 있는 현실을 보여준다.  반면 최근 출간된 ＜인간지능의 역사＞는 ""인간의 고유성은 고정된 속성이 아니라 변화하는 맥락 속에서 스스로를 재발견하고 재창조하는 역동적 과정 그 자체에 있다""고 강조한다. ""인간의 고유한 능력은 변화하는 기술 환경 속에서 인간의 역할을 재정의하면서 유지돼왔다. (…) 그러므로 우리는 인간의 고유성을 인공지능의 발전에 맞추어 끊임없이 조정해야 하는 변수로 놓아야 할 것이다.""  저자는 이은수 서울대 철학과 조교수로, 현재 서울대에서 AI연구원 인공지능 디지털인문학센터장을 맡고 있다. 이 교수는 서울대 수학과를 졸업하고 동대학원에서 서양고전학 석사학위를, 스탠퍼드대에서 고전학 박사학위를 받았다. AI 시대 인문학의 미래를 탐구하는 작업을 이어가는 중이다.  책은 '인간다움'의 조건을 '깊은 맥락을 읽어내는 이해력, 이질적인 요소를 융합하는 창의력, 섬세한 윤리적 분별력, 삶에 의미를 부여하는 힘'이라고 본다. 이제 인류는 AI를 인간적 사고의 대체물이 아닌 확장된 지적 파트너로 인정하고 협력할 방법을 탐구해야 한다고 주장한다. ""인공지능을 피해야 할 위협이나 통제해야 할 도구로만 보는 관점에서 벗어나, '인간지능'의 새로운 가능성을 함께 탐색하는 동반자로 바라보는 관점의 전환이 필요하다.""",https://n.news.naver.com/mnews/article/015/0005220471
2025-12-04 23:50:00,"'공쿠르상' 카멜 다우드 ""정답없는 비극이 소설 쓰게 만들어""","알제리계 프랑스 소설가이자 기자 카멜 다우드는 알제리에서 금지된 작가다. 알제리 헌법으로 언급을 막은 '알제리 내전(1991~2002)'의 비극을 소설과 기사로 기록해 두 차례 체포 영장을 받았다. 그에게 지난해 세계 3대 문학상 중 하나인 공쿠르상을 안긴 장편소설 ＜후리＞는 현재 알제리에서 '금서'다. 신변의 위협을 느낀 그는 2년 전 고향을 떠나 프랑스에서 집필활동을 이어가고 있다.  다우드는 지난 3일 서울 합동 주한프랑스대사관에서 진행한 내한 간담회에서 ""＜후리＞가 출간된 후 강렬하고 폭력적인 반응을 마주했다""며 ""소설이 알제리의 상처를 건드렸기 때문인 것 같다""고 말했다. ""제가 건드린 상처는 숨겨서 덧난 상태입니다. 상처를 마주하고 치유하려는 노력이 있었더라면 제 책이 출간됐어도 소리소문 없이 잊혀졌을 텐데, 그렇지 않았기 때문에 반응이 거셌습니다.""  최근 국내 출간된 ＜후리＞의 주제는 기억과 목소리다. 알제리 군부와 이슬람 세력 간 내전 중 벌어진 민간인 학살에서 생존한 '오브'라는 소녀를 화자이자 주인공으로 삼아 비극을 증언한다. 참혹한 미소처럼 얼굴을 가로지르는 흉터를 가진 오브는 후두와 성대가 손상돼 육성을 잃고 튜브로 숨을 쉬는데, 이는 알제리의 ""제도화된 망각""을 상징한다. 다우드는 ""전 세계적으로 기억을 금지하는 법이 있는 국가는 알제리밖에 없을 것""이라며 ""가장 고통스러운 죽음은 기억에서 잊혀지는 것으로, 글은 지난 세월에 고통 겪었던 사람들이 잊히지 않도록 하는 유일한 방법""이라고 말했다.  다우드는 한강 작가의 노벨문학상 수상 1주년을 기념하는 '연세노벨위크' 참석차 처음 방한했다. 그는 ""한 작가와 함께 언급되는 건 큰 영광""이라며 ""우리는 기억과 개인의 자유를 이야기한다는 점에서 공통점이 있다""고 설명했다.  현재도 알제리 정부의 감시를 받고 있다는 다우드는 ""유럽 밖을 벗어난 게 처음이라 인천공항에 도착했을 때 조금 두려웠다""고 털어놓기도 했다. ""정부를 비판해 1년간 구금됐다가 최근 풀려난 알제리 동료 작가 부알렘 상살을 그저께 만났습니다. 그가 알제리 비밀경찰의 이야기를 전해주더군요. '다우드에게 전해. 파리에 있다고 네가 안전한 건 아니야. 우리는 너를 찾아낼 수 있어'라고요.""  ＜후리＞ 금서 지정은 오히려 책을 화제작으로 만들었다. 프랑스에서만 60만 부 팔렸다. 알제리에서도 비밀리에 읽히고 있다. ""파리 도서관이나 서점에서 북토크를 진행할 때 어떤 참석자들은 이야기를 나누지 않고도 그가 알제리 사람이라는 걸 알 수 있었습니다. 뒤쪽에 서서 말 없이 눈물을 흘리면서 제 이야기를 듣고 있었거든요.""  기자로서 알제리 내전을 취재했던 그는 왜 소설을 통한 증언을 택했을까. 다우드는 ""정답이 없을 때는 소설을 쓰게 된다""고 했다. 소설 속에서 오브는 뱃속에 품고 있는 딸 아이를 낳는 게 옳은지, 끔찍한 현실에 아이를 내놓는 게 과연 사랑일지 고민한다. 다우드는 ""소설은 질문을 제시하는 행위로, 작품 속 인물들이 현실의 모순을 어떻게 이겨내고 답을 찾아가는지 그 과정을 쓰려 한다""고 설명했다.    그의 고국 알제리와 현재 머물고 있는 프랑스, 두 국가의 관계는 복잡미묘하다. 알제리는 131년간 프랑스 식민지배를 받았는데 여전히 프랑스어를 널리 사용한다. 일각에서는 현재 알제리 내전과 독재 등 정치적 불안을 식민지배의 후유증으로 해석한다. 프랑스가 이민 협정 등을 통해 알제리의 경제·외교적 우방 역할을 맡는 측면도 있다.  최근 양국 간 관계가 악화된 상황에서 다우드가 지난해 알제리 출신 작가 최초로 공쿠르상을 받자 정치적 해석이 쏟아졌고, 그가 프랑스 식민지배의 책임을 비판하는 데 소극적이라는 지적이 나왔다. 다우드는 ""알제리의 현재 불안정한 상황이나 어려움이 절대적으로 프랑스 식민지배에서 비롯됐다고 여기기에는 문제가 복잡한 거 같다""며 ""제가 프랑스어로 글을 쓰는 건 프랑스어가 사랑의 언어, 열망의 언어이기 때문이라 정당화하거나 설명할 필요를 느끼지 못한다""고 했다.  그는 ""나는 현재를 살기 위해 글을 쓴다""며 ""국가폭력을 경험한 바 있는 한국의 독자들이 '고통, 죽음 이후에도 삶은 존재하고 이어진다'는 메시지를 가져갔으면 좋겠다""고 했다. ""아랍 세계는 후손보다 조상에 초점이 맞춰져 있습니다. 저는 이런 관점을 뒤집고 싶었습니다.""  소설 제목 '후리'는 이슬람교에서 선녀와 같은 존재다. 의인들이 천국에 가서 만나는 72명의 아름다운 처녀를 뜻한다. 다우드는 제목과 관련해 알제리 길거리를 걷다가 이슬람 사원 길 건너 미용실을 발견한 일화를 들려줬다. 그는 ""그 풍경을 보니 '왜 죽은 뒤에야 여성들을 마주해야 하지? 바로 맞은편에 (현실의) 여성들이 있는데?' 하는 생각이 들었다""며 ""저는 소설을 통해 매일매일 우리가 사랑하고 만나고 교류하는 여성들을 주제로 다루고 싶었다""고 했다. 이어 ""제가 페미니스트인 이유는 단순하다""며 ""한 국가가 여성을 어떻게 대하느냐가 국가의 미래를 보여주기 때문""이라고 덧붙였다.",https://n.news.naver.com/mnews/article/015/0005220470
2025-12-04 23:49:00,한교총 신임 대표회장에 김정석 감리회 감독회장,"국내 개신교 최대 연합기구인 한국교회총연합(한교총)의 새 대표회장으로 김정석 기독교대한감리회 감독회장이 선임됐다.  4일 한교총은 서울 한국교회100주년기념관에서 제9회 정기총회를 갖고 김 회장을 비롯한 신규 임원을 선임했다. 한교총에는 39개 교단, 교회 6만4700여 곳이 속해 있다. 대표회장 임기는 1년이다.  서울신학대와 서울감리교신학대학원을 졸업한 김 회장은 미국 애즈베리신학대학원에서 목회학 석·박사 학위를 받았다. 부친 고(故) 김선도 목사에 이어 2001년부터 지난해 10월까지 광림교회 담임목사를 지냈다. 이후 감리회를 대표하는 감독회장을 맡고 있다.  한교총은 이날 총회에서 ""대한민국의 정치적·경제적 양극화와 극단적 혐오와 분열을 깊이 우려하며, 초(超)갈등 사회 극복을 위해 대화와 타협의 문화를 조성하고, 국론 통합을 위해 힘쓸 것""이라며 한국교회의 연합과 사회적 책임을 강조하는 결의문을 채택했다.",https://n.news.naver.com/mnews/article/015/0005220469
2025-12-04 23:44:00,"[속보] 金 총리, 서울 폭설에 ""제빙·제설 및 교통대책 마련"" 긴급지시","4일 서울 전역에 기습적인 폭설이 내린 상황을 보고받은 김민석 국무총리가 행정안전부와 관계 지방정부에 ""신속성, 효율성, 투명성 원칙하에 선제적으로 필요한 행정조치를 시행하라""면서 긴급 대응을 지시했다.  총리실에 따르면 김 총리는 먼저 행정안전부에 ""서울시 등 관계된 지방정부와 협력해 즉각적으로 도심 주요 간선도로 및 중심지 도로에 대해 제설·제빙 작업을 개시하고, 가능한 경우 차량 통제 및 우회 조치하라""고 주문했다.  이어 한국도로공사와 경찰청에는 ""즉시 고속도로 통행에 문제가 없도록 제빙 작업을 하고 우회도로 안내 등을 하라""고 지시했다.  또 서울시 등 지방정부에는 ""원활한 대중교통 운행을 위해 지하철 연장 운행, 버스 우회 노선 및 긴급 셔틀버스 편성 등 방안을 마련해 시행하라""면서 ""5일 출근 시간대 빙판길 등으로 시민이 불편함을 겪지 않도록 도로교통 상황과 대피 요령, 대체 교통수단, 안전 안내 사항 등을 즉시 알려달라""고 당부했다.  이보배 한경닷컴 객원기자 newsinfo@hankyung.com",https://n.news.naver.com/mnews/article/015/0005220468
2025-12-04 23:43:00,탈북 동생 '살해 혐의' 친누나 입건…남편도 숨진 채 발견,"함께 탈북한 남동생을 숨지게 한 혐의로 친누나가 경찰 조사를 받고 있다.  부산 기장경찰서는 살인 등 혐의로 50대 여성 A씨를 입건해 조사하고 있다고 4일 밝혔다.  경찰에 따르면 A씨는 지난 8월 29일 부산 기장군 거주지에서 40대 남동생 B씨를 숨지게 한 혐의를 받는다.  A씨는 당시 '외출하고 돌아오니 동생이 움직이지 않았다'고 진술했고, 경찰은 주변 인물 등을 용의선상에 두고 수사를 벌여오다 최근 A씨를 피의자로 입건했다.  1차 검안 결과 B씨 사인은 '경부 압박 질식사'로 파악됐다. 또 B씨 약물 검사에서 A씨가 복용하던 수면제와 같은 성분이 검출된 것으로 드러났다.  A씨는 ""함께 탈북한 동생을 죽일 이유가 없다""면서 혐의를 강하게 부인하는 것으로 전해졌다.  한편, B씨가 숨진 지 며칠 뒤 A씨의 남편이 승용차에 유서를 남겨놓고 숨진 채 발견되기도 했다.  경찰은 CCTV와 각종 압수수색 자료를 분석하는 한편, 주변 인물들을 상대로 수사를 이어가고 있다.  이보배 한경닷컴 객원기자 newsinfo@hankyung.com",https://n.news.naver.com/mnews/article/015/0005220467
2025-12-04 23:07:00,'남녀공학 전환' 동덕여대 칼부림 예고글…작성자는 10대 女 [종합],"남녀공학 전환 방침이 결정된 동덕여대를 향해 칼부림 예고 글을 올린 여성이 붙잡혔다.  서울 남대문경찰서는 경남경찰청과 공조해 마산에 거주하는 10대 A씨를 공중협박 혐의로 임의동행해 검거했다고 4일 밝혔다.  경찰은 전날 오후 '동덕여대 칼부림 예고 글이 온라인에 올라왔다'는 신고를 접수하고 작성자를 추적해왔다. A씨는 전날 사회관계망서비스(SNS)에 동덕여대를 겨냥해 영어로 '학교 갈 준비가 됐다'는 문장과 함께 칼이 든 가방 사진을 게시한 혐의를 받는다.  A씨는 경찰 조사에서 범행을 시인한 것으로 파악됐다. 경찰은 A씨의 주거지를 관할하는 마산 내 경찰서로 사건을 이송해 범행 경위 등을 조사할 계획이다.  아울러 서울경찰청은 3월 공중협박죄 신설 이후 47명을 검거했다고 밝혔다. 피의자들은 대부분 자신의 행위가 단순한 장난이나 불만 표시였다고 주장했다는 설명이다.  경찰은 ""이러한 행위는 실행 의사가 없더라도 시민들에게 불안감을 조성하고 사회 안전망을 교란하는 명백한 범죄""라며 ""불특정 다수를 겨냥한 협박 행위를 끝까지 추적해 처벌하겠다""고 강조했다.",https://n.news.naver.com/mnews/article/015/0005220466
2025-12-04 23:02:00,태안 천리포 인근서 어선 전복…1명 심정지 상태로 발견,"4일 오후 6시 20분께 충남 태안 천리포 인근 해상에서 승선원 7명이 탄 9.77t 규모 어선이 전복됐다.  신고를 접수한 태안해경은 경비함정 6척과 연안구조정 1척 등을 동원해 인명 구조에 나섰다.  현재까지 승선원 7명 중 1명이 십리포 해안가에서 심정지 상태로 발견됐고, 승선원 가운데 3명은 선박 인근에서 표류하던 중 구조돼 병원으로 이송 중인 것으로 알려졌다.  사고 인근 바다에는 풍랑주의보와 강풍주의보가 발효 중인 상황에서 태안해경은 나머지 승선원 3명을 수색 중이다.  이보배 한경닷컴 객원기자 newsinfo@hankyung.com",https://n.news.naver.com/mnews/article/015/0005220465
2025-12-04 22:57:00,"CZ ""비트코인, 실사용 증명한 미래 자산""…피터 시프 ""탈중앙 피라미드일 뿐"" 정면충돌 [BBW2025]","글로벌 가상자산(암호화폐) 거래소 바이낸스의 창립자 창펑 자오(CZ)와 월스트리트에서 가장 유명한 금본위주의자 피터 시프가 4일(현지시간) 두바이 코카콜라아레나에서 진행된 바이낸스블록체인위크2025(Binance Blockchain Week 2025) 메인스테이지에서 '비트코인 vs 금' 공개 토론을 진행했다. 두 사람은 비트코인의 실사용 가치, 금의 산업적 수요, 미래 금융 구조에서의 역할을 두고 근본적 시각차를 드러냈다. ""비트코인 이미 실제 사용 중""…CZ, 가치·확장성 강조 창펑 자오는 실물 금괴를 직접 들어보이며 논쟁을 시작했다. 그는 ""금은 국경 이동이 어려운 자산이지만 비트코인은 몇 초 만에 전송이 가능하다""며 이동성과 확장성에서 비트코인의 우위를 강조했다. 이어 ""비트코인은 실체가 없어서 무가치하다는 주장 자체가 디지털 시대의 가치를 오해한 것""이라며 ""인터넷 서비스가 실물이 없어도 가치를 갖는 것과 같다""고 설명했다.  창펑 자오 창립자는 비트코인의 실사용 사례도 강조했다. ""아프리카 사용자 한 명은 공과금 납부에 사흘이 걸렸지만 지금은 3분 만에 해결할 수 있다""며 ""기존 금융 시스템이 닿지 않는 지역에서 비트코인이 실질적 대안 역할을 한다""고 말했다. 이러한 사례는 비트코인이 단순 가격 자산을 넘어 기능적 가치를 갖고 있다는 근거로 제시됐다.  창펑 자오는 비트코인을 금 토큰화 프로젝트와 비교하며 ""토큰화된 금은 결국 제3자를 신뢰해야 하지만 비트코인은 네트워크 합의만으로 신뢰가 성립한다""고 주장했다. 이어 ""수억 명 단위로 성장한 이용자 기반은 비트코인의 현실적 확장성을 보여주는 지표""라며 ""금이 제공하지 못하는 네트워크 효과를 이미 확보했다""며 비트코인의 우위를 강조했다. ""비트코인은 실체 없는 기록""…시프, 금 본질적 가치·수요 구조 부각 피터 시프는 비트코인의 실체 부재를 가장 강하게 비판했다. 그는 ""비트코인을 전송해도 실제 이동하는 것은 아무것도 없고 기록만 바뀐다""며 ""반면 금은 전기·반도체·의료 분야 등 실물 수요가 존재하는 물질 기반 자산""이라고 강조했다. 이어 ""금은 부식되지 않고 수천 년 동안 동일한 효용을 유지한다""며 희소성과 영속성을 근거로 내세웠다.  그는 중앙은행의 매수 흐름도 언급했다. ""금은 각국 통화 가치를 방어하기 위한 준비자산으로 사용된다""며 ""비트코인과 달리 구조적 수요가 존재한다""고 말했다. 시프는 ""비트코인이 4년 동안 금 대비 40% 떨어졌다""며 가격 흐름 역시 가치 부재를 반영한다고 주장했다.  결제 수단 논쟁도 이어졌다. 시프는 ""비트코인을 결제에 사용한다고 해도 결국 비트코인을 팔아 법정화폐로 전환하는 과정이 필요하다""며 ""이는 화폐가 아니라 투기 자산의 성격""이라고 말했다. 그는 ""비트코인은 가격 상승 기대에만 의존하는 구조로 탈중앙 형태의 피라미드에 가깝다""고 평가했다. '사용성과 신뢰의 미래'…토큰화 금 vs 비트코인 격돌 토론은 금과 비트코인이 미래 금융 시스템에서 어떤 위치를 차지할지로 확대됐다. 창펑 자오는 ""비트코인은 제3자 신뢰 없이 자산을 전송할 수 있는 새로운 금융 구조""라며 ""사용자에게 중요한 것은 기술 내부가 아니라 속도·효율·접근성이다. 디지털 네이티브 세대는 실물 금보다 비트코인을 더 직관적인 자산으로 받아들이기 시작했다""고 전망했다.  시프는 토큰화된 금이 미래 화폐 구조에 더 적합하다고 주장했다. 그는 ""금 기반 토큰은 실물 금 소유권이라는 명확한 자산 기반을 제공한다""며 ""안정성과 예측 가능성 측면에서 디지털 금이 비트코인을 넘어설 것""이라고 반박했다. 이어 ""크립토는 무한히 발행될 수 있지만 금은 물리적으로 공급이 제한돼 있다""고 덧붙였다.  창펑 자오는 ""비트코인은 발행량이 고정된 자산""이라며 시프의 지적을 반박했다. 그는 ""현재 규모의 사용자 기반과 글로벌 전송 효율성은 금이 따라올 수 없는 수준""이라며 ""비트코인은 단순 대체재가 아니라 새로운 형태의 기초 금융 기술""이라고 강조했다.  <블록체인·가상자산(코인) 투자 정보 플랫폼(앱) '블루밍비트'에서 더 많은 소식을 받아보실 수 있습니다>  두바이=이영민 블루밍비트 기자 20min@bloomingbit.io",https://n.news.naver.com/mnews/article/015/0005220464
