날짜,제목,본문,링크
2025-12-09 17:32:00,"진대제 ""도전 안 하면 그만큼의 삶만 산다…미래 바꾸려면 공대로 가라""","진대제 스카이레이크인베스트먼트 회장은 최근 꽤 좋은 천체망원경을 구입했다. 10대 시절 관심이 컸던 우주에 대해 본격적으로 파헤치기 위해서다. 새로운 공부를 시작한 진 회장은 요즘 ‘탐구하는 엔지니어’라는 본인의 정체성을 다시 느낀다고 한다.  1호 미국 국비유학생, 삼성전자 최연소 임원(1987년 당시 35세), 수십억원 가치의 스톡옵션을 포기하고 맡은 정보통신부 장관을 거쳐 유명 사모펀드(PEF) 회장까지. 진 회장의 화려한 경력 뒤엔 남모를 고난의 시기도 있었다. 위기 극복의 원동력은 공대 출신 엔지니어 특유의 ‘호기심’과 ‘도전 정신’. 진 회장은 “나의 삶은 궁금하면서도 좋아했던 것(물리, 수학, 공학)을 잘하기 위한 도전의 연속이었다”며 “나이 먹은 지금도 똑같다”고 말했다. 70세 넘어서도 물리·수학 지식을 활용해 골프공의 궤적을 분석하는 앱을 개발하고, 인수 회사(솔루스첨단소재) 제품 수율을 올리기 위해 생산라인을 직접 도는 진 회장의 열정이 그제야 이해가 됐다.   ▷왜 의대가 아니라 공대에 갔습니까.  “당시(1970년대 초반)엔 공부 좀 한다는 이과생은 당연히 서울대 물리학과 아니면 전자공학과를 갔습니다. 의대는 이공계 학과 순위로 따지면 20번째였죠.”  ▷전자공학을 택한 이유가 궁금합니다.  “서울대 시험을 본 뒤 동문 전자공학과 선배를 만났습니다. ‘물리, 수학도 잘해야 한다’고 하더군요. ‘한 번 해보자’ 싶었죠. 청계천에 가서 고급미적분 원서를 사서 입학하기 전까지 파고들었습니다.”  ▷반도체에 관심을 두게 된 계기가 있습니까.  “주로 물리, 수학 이런 걸 파다 보니까 결국 반도체로 이어지더라고요. 그런데 당시 한국에 반도체를 가르치는 선생님이 거의 없었어요. 제가 석사 학위 반도체 논문을 한국에서 처음 쓴 사람일 정도입니다.”  ▷어려움이 컸을 것 같습니다.  “소재는 재료공학과 가서 빌리고, 웨이퍼는 당시 한국반도체(삼성전자 반도체사업의 전신)에 가서 얻어오고 그랬죠. 열악했지만 즐거웠습니다.”  ▷지도교수를 찾는 것도 쉽지 않았겠습니다.  “마침 KAIST에 김충기 교수님(한국 반도체학계 대부로 불리는 석학)이 오셨습니다. 당시 서울대와 KAIST는 라이벌 의식이 강했죠. 서울대에 적을 뒀지만, KAIST 서울 캠퍼스로 찾아갔어요. 김 교수님이 반도체를 한다고 하니까 특별 공부방도 만들어주셨습니다.”  ▷석사 후 미국 유학길에 오르셨습니다.  “1977년에 MIT(매사추세츠공대)로 갔는데, 시뮬레이션을 중심으로 하는 학교였죠. 반도체학회지에 논문도 싣고 했지만 ‘공부를 더 해야겠다’ 싶어서 스탠퍼드대에 장학금을 받고 갔습니다.”  ▷스탠퍼드는 달랐습니까.  “일단 천재가 많았고요. 박사 과정에서 요구하는 게 반도체가 다가 아니었습니다. 컴퓨터 등 다른 쪽 수업을 들었죠. 당시 한국에서 가르치지 않은 분야였습니다.”  ▷고전하셨을 것 같습니다.  “컴퓨팅 관련해서 숙제를 열심히 풀어서 제출했는데 60점 만점에 10점을 받았죠. 영어가 문제인가 싶어 교수를 찾아가서 이유를 물어보니 ‘영어가 문제가 아니라 답이 틀렸다’고 하더라고요.”  ▷앞이 캄캄하셨겠습니다.  “교수님께 사정해서 기본 교재를 소개받았습니다. 강의를 다 알아듣지 못했지만, 발표도 하고 더 적극적으로 했습니다. 2년 있으니까 ‘올A’를 받게 되더라고요.”  ▷불모지에서 길을 찾는 것의 연속이었네요.  “맨땅에 헤딩했죠. 하지만 저는 정말 좋아서 공부했기 때문에 다른 사람이 저를 이길 수 없었습니다. 스탠퍼드에서도 위상수학 같은 과목은 저만 답을 썼습니다.”  ▷IBM에서 현장을 배우셨죠.  “1983년 박사 학위를 받고 IBM에 갔습니다. 4메가 D램을 하는 팀에서도 근무했고요. 1년 정도 있으니까 ‘잘할 수 있겠다’는 생각이 들더군요.”  ▷계속 D램 분야에 계셨습니까.  “회로 설계를 알아야 한다는 생각이 들어서 관련 팀에 있는 동문에게 ‘너희 팀에 나도 끼워달라’고 부탁했습니다. 회로설계에 1년 있으면서 CMOS(상보형 금속산화물 반도체)를 배우고, 설계하다가 1985년 10월 삼성으로 갔습니다.”  ▷계기가 있었습니까.  “IBM은 좋은 회사였어요. 1983년에 연봉 4만7000달러를 받았고 또 부서 옮길 때마다 월급을 15%씩 올려줬어요. 하지만 원래 저는 한국에서 일하려고 했습니다.”  ▷IBM에서 가만히 안 있었을 텐데요.  “당시 IBM에서 50건 정도 특허를 썼고, 평가가 괜찮았어요. 그런데 IBM은 일본업체가 아닌 제3의 D램 파트너사가 필요했거든요. 제가 삼성에 가서 ‘일본 잡고 IBM에도 도움이 되겠다’고 하니까 흔쾌히 보내주더군요.”  ▷‘삼성이 반도체 하면 망한다’고 할 때 아닙니까.  “삼성이 1985년 원가 1달러35센트짜리 64K D램을 35센트에 팔며 적자를 볼 때였습니다. 주변에서 다 말렸죠.”  ▷삼성에 가서 첫 업무가 무엇이었는지 궁금합니다.  “삼성에서 국책과제로 하고 있던 4메가 D램을 맡았습니다. ‘트렌치’(아래로 뚫는) 방식과 ‘스택’(위로 쌓는) 방식 중 선택을 고민하고 있었는데 제가 ‘스택으로 해보자’고 제안했습니다.”  ▷받아들이던가요.  “가보지 않은 길을 가는 것이었죠. 경영진에게 ‘트렌치는 구멍 속에 뭐가 생기는지 모르는데, 스택으로 올리면 월등히 쉽습니다’라고 보고했습니다.”  ▷그 이후엔 일사천리였나요.  “웨이퍼 100장을 투입했는데, 트렌치 방식은 다 불량이었죠. 스택은 15~16장 살아나왔습니다. 당시 대통령이 ‘4메가 개발 성공 축하연 한다’고 할 정도였어요.”  ▷힘든 일은 없었습니까.  “16메가 D램에 불량도 있었어요. 제가 사업부장(전무)으로서 불량을 해결하는 프로젝트를 이끌었습니다. 불량을 해결하기 위한 미분방정식을 만들어 문제점을 찾았죠. 천운인 게 당시 D램이 공급 부족 상황이어서 ‘크게 문제없으니 쓰겠다’는 고객도 많았습니다(웃음).”  ▷결국 기본이네요.  “수학이나 물리를 알아야 반도체 안에 다른 문제를 해결합니다. 기술 문제에 직면했을 때 기본에서 출발해 분석하고 해결할 때가 많아요.”  ▷대학도 그런 부분을 강조해야 할 것 같습니다.  “지난주에도 공대생 다섯 명이 찾아와서 ‘어떻게 살아야 합니까’라고 묻더군요. ‘기본적으로 자네가 지금 대학교 3학년이면 3학년 때 해야 할 일을 가장 충실히 하면 된다’고 말했습니다. 전공이면 전공, 기본적인 수학이나 물리를 잘해야죠.”  ▷인공지능(AI) 시대에도 기본이 중요하겠죠.  “네 맞습니다. 하나 더 하자면, 새로운 환경도 중요합니다. 국내에서 잘하더라도 MIT, 스탠퍼드 가서 경쟁을 해봐야 합니다. 대가에게서 얘기를 들으면 시야가 넓어집니다.”  ▷글로벌에서 도전하란 말씀이시네요.  “도전하는 삶을 사는 게 중요합니다. 젠슨 황, 빌 게이츠 등은 모두 이과 출신인데 도전해서 대단한 부자가 됐고 명성을 날리죠. 도전하지 않으면 그만큼의 삶만 살게 되는 겁니다.”  ▷그런데 의대 광풍이 불고 있습니다.  “지금 의사 중 젠슨 황, 빌 게이츠만큼 유명한 사람 있습니까. 의사는 평생 많이 벌면 30억~50억원이겠죠. 이공계 소양을 갖추고 신약 개발하는 스타트업을 창업하면 1조원도 벌 수 있습니다.”  ▷높은 목표에 도전하란 말씀이시네요.  “의사가 나쁘다는 건 아닙니다. 하지만 뛰어난 인재라면 목표를 더 높게 가지라고 하고 싶네요.”  ▷퍼스트무버의 시대, 한국의 인재상은 무엇입니까.  “저는 회사를 경영하기도 하고 투자도 하며 3000개 이상의 회사를 분석했습니다. 결국 사람에 달렸어요. 사람이 남다른 생각을 해서 어떻게 차별화하느냐가 중요하죠.”  ▷대학 교육도 바뀌어야 할 것 같습니다.  “수월성 교육을 해야 합니다. 천재들을 모아서 스스로 해결하는 법을 알려주는 교육이죠. 토론을 많이 시켜야 합니다. AI 시대에 AI보다 문제를 해결하지 못 하는 인재는 살아남기 어렵습니다. 절실합니다.”  ▷삶에 후회는 없으십니까.  “평생 엔지니어로 살고 있습니다. 엔지니어링의 원리는 비슷합니다. 솔루스첨단소재를 인수한 뒤 수율을 40%에서 90% 이상으로 올릴 수 있었던 것도 제가 엔지니어이기 때문이죠.”  ■ 진대제 회장은…  △1952년 경남 의령 출생 △1970년 경기고 졸업 △1977년 서울대 전자공학과 졸업 △1983년 IBM 왓슨연구소 연구원 △2000년 삼성전자 디지털미디어총괄 최고경영자(CEO) △2003년 정보통신부 장관 △2006년 스카이레이크인큐베스트 대표 △2020년 솔루스첨단소재 CEO",https://n.news.naver.com/mnews/article/015/0005222209
2025-12-09 17:31:00,수산인더스트리 수주공시 - GS동해전력 석탄취급설비 경상정비공사 및 운전용역 152.7억원 (매출액대비 4.82 %),"12월 09일 수산인더스트리(126720)는 수주공시를 발표했다.  ◆수산인더스트리 수주공시 개요 - GS동해전력 석탄취급설비 경상정비공사 및 운전용역 152.7억원 (매출액대비 4.82 %)  수산인더스트리(126720)는 GS동해전력 석탄취급설비 경상정비공사 및 운전용역에 관한 단일판매ㆍ공급계약체결(자율공시) 을 09일에 공시했다. 계약 상대방은 (주)GS동해전력이고, 계약금액은 152.7억원 규모로 최근 수산인더스트리 매출액 3,167.9억원 대비 약 4.82 % 수준이다. 이번 계약의 기간은 2026년 01월 01일 부터 2027년 12월 31일까지로 약 1년 11개월이다. 한편 이번 계약수주는 2025년 12월 08일에 체결된 것으로 보고되었다.    수주 공시는 향후 기업의 실적에 직접적인 영향을 미치기 때문에 계약의 규모, 계약 기간 등에 대해서 주의 깊게 살펴볼 필요가 있다. 특히 수주 공시가 늘어나는데 주가는 움직이지 않는다면 매수 관점에서 접근해 볼 수도 있다.  한경로보뉴스  이 기사는 한국경제신문과 금융 AI 전문기업 씽크풀이 공동 개발한 기사 자동생성 알고리즘에 의해 실시간으로 작성된 것입니다.",https://n.news.naver.com/mnews/article/015/0005222208
2025-12-09 17:27:00,"'10년 부진' IBM, AI 데이터로 반등 노린다","IBM은 1990년대 초반까지 글로벌 시가총액 1위였다. 8일(현지시간) 기준으로 IBM의 순위는 40위권이다. 매출은 최근 10년간 반토막 났다. IBM은 두 번의 실수로 위기를 자초했다. 기업용 서버 등 하드웨어 판매에만 매달리다가 2000년대 클라우드라는 신개념을 들고나온 아마존웹서비스(AWS)의 진격을 막지 못했다. 2011년엔 인공지능(AI) 플랫폼 ‘왓슨’으로 주목받았지만 데이터 품질 문제에 시달려 구글, 오픈AI 등에 AI 주도권마저 뺏겼다. 이랬던 IBM이 ‘하이브리드 클라우드’와 ‘AI 맞춤형 데이터’라는 양 날개로 부활을 꾀하고 있다.  ◇M&A로 새판 짜는 IBM IBM은 110억달러(약 16조원)를 들여 콘플루언트 인수 작업을 하고 있다. 콘플루언트는 기업 내부 시스템과 외부 클라우드에서 발생하는 방대한 데이터를 실시간으로 연결해 처리하는 데 특화한 기업이다. AI 에이전트를 기업 현장에 도입하려면 이 같은 데이터 연결이 필수다. 사용자가 AI에 업무를 지시했는데 AI가 기업의 과거 데이터는 읽어도 실시간으로 발생하는 이벤트를 반영하지 못하면 제대로 된 결과를 도출할 수 없어서다. IBM이 콘플루언트를 ‘AI를 위한 데이터 철도망’으로 부르는 이유다.  AI가 비정형 데이터까지 학습 가능하도록 솔루션을 제공하는 것도 IBM이 기업 고객을 늘리기 위해 내놓은 전략이다. 이수정 한국IBM 사장은 9일 간담회에서 “기업 데이터의 1%만 실제 AI 학습에 활용된다”며 “기업 데이터 중 90%에 이르는 비정형 데이터를 활용할 방법을 구축하는 것이 기업 혁신의 관건”이라고 설명했다. PDF 문서만 해도 사람 눈에는 잘 정리된 문서처럼 보이지만 AI에는 비정형 데이터다. 글자 추출과 표·이미지 분리 작업을 거치기 전에는 내용을 정확히 이해할 수 없다. ◇양자컴퓨팅 상용화 시점이 관건 IBM이 바닥 모를 추락을 막기 위해 반격에 나선 시점은 2019년 레드햇을 340억달러에 인수하면서부터다. 레드햇은 클라우드와 내부 시스템(온프레미스)을 하나처럼 쓸 수 있는 ‘오픈시프트’ 플랫폼을 개발한 기업이다. 기존 클라우드 기업과 정면 승부하는 대신 기업용에 특화한 하이브리드 클라우드 시장으로 방향을 전환한 것이다. 금융, 제조, 공공 등 규제가 강한 산업에서는 데이터를 공공 클라우드로 옮기기 어려워 온프레미스와 병행하는 하이브리드 환경이 필수적이라는 것을 노린 선택이었다.  당시 아빈드 크리슈나 IBM 최고경영자(CEO)는 “IBM의 미래는 하이브리드 클라우드와 AI에 달려 있다”며 “레드햇은 그 전환을 가능하게 하는 핵심 기반”이라고 강조했다. 작년엔 클라우드 인프라 자동화 도구를 제공하는 하시코프를 사들였다. 이번에 콘플루언트까지 인수를 완료하면 IBM은 인프라, 클라우드, 데이터를 한 번에 제공할 수 있는 ‘풀스택’ AI 기업으로 도약할 전망이다.  문제는 IBM이 이 분야에서 여전히 후발주자라는 점이다. 마이크로소프트, 구글, AWS는 이미 엔터프라이즈 AI 시장에서 전 분야에 걸쳐 가치사슬 구축을 완료했다. AI업계 관계자는 “IBM은 AI 모델과 클라우드 시장에서 경쟁자와 정면 승부를 벌이는 것이 불가능하다는 점을 잘 알고 있다”며 “자동화, 보안, 실시간 데이터 흐름이라는 틈새를 공략해 AI 인프라 시장에서 운영 표준을 구축하겠다는 의도일 것”이라고 해석했다.",https://n.news.naver.com/mnews/article/015/0005222207
2025-12-09 17:26:00,"엔비디아·소프트뱅크, 로봇SW에 10억 달러 투자",소프트뱅크와 엔비디아가 로봇 소프트웨어(SW) 기업 스킬드AI에 10억달러 이상을 투입하는 신규 투자 라운드를 논의 중인 것으로 전해졌다. 로이터통신은 8일(현지시간) 이 같은 내용을 보도하며 거래가 성사되면 스킬드AI의 기업가치가 약 140억달러에 달할 것으로 추산했다.  삼성도 주요 투자자인 스킬드AI는 다양한 로봇 유형과 사용 환경에 적용 가능한 ‘로봇 비종속 파운데이션 모델’을 개발하는 SW 기업이다. 이번 투자 논의는 소프트뱅크가 피지컬AI를 차세대 성장 축으로 삼고 로봇 분야에 베팅을 강화해온 흐름과 맞물린다.  엔비디아 역시 로보틱스 파운데이션 모델 확산이 그래픽처리장치(GPU) 수요를 장기적으로 늘릴 것으로 기대하고 있다.,https://n.news.naver.com/mnews/article/015/0005222206
2025-12-09 17:26:00,"크래프톤, 튀르키예 게임사 투자…중동을 '제 2의 인도'로 키운다","크래프톤이 튀르키예 게임 스타트업에 투자하며 중동 게임 시장 공략에 속도를 내고 있다. 인도에서 ‘배틀그라운드 모바일 인디아’(BGMI)로 게임 생태계를 성공적으로 구축한 데 이어 중동에서도 비슷한 성장 전략을 구사하려는 행보로 해석된다.  9일 게임업계에 따르면 크래프톤은 지난달 말 튀르키예 게임 스타트업 슈퍼기어스게임스에 시드(초기) 투자를 단행했다. 튀르키예 최대 자산운용사 중 하나인 헤데프포르트푀이가 주도 투자자로 나섰고, 현지 벤처캐피털(VC) APY벤처스 등이 참여했다. 총투자액은 210만달러(약 29억원)다. 슈퍼기어스는 모바일 레이싱 게임 지식재산권(IP)을 보유한 신생 스튜디오다.  크래프톤의 중동 진출은 2021년 중동 최대 모바일게임 퍼블리셔 중 하나인 타마템게임스에 600만달러를 투자하며 본격화했다. 타마템은 누적 다운로드 1억 건, 월간활성이용자(MAU) 100만 명 이상을 확보한 지역 1위 퍼블리셔다. 이후 크래프톤은 배틀그라운드 IP의 현지화, SNS 운영 등에서 타마템과 협업을 이어왔다.  최근 들어선 단순 퍼블리싱을 넘어 현지 개발 생태계에 들어가고 있다. 크래프톤은 2023년부터 아랍에미리트(UAE), 사우디아라비아를 거점으로 활동하는 VC 벤처수크와 함께 핀테크 펀드 투자에 참여하고 있다. 이 네트워크에는 사우디 국부펀드(PIF) 산하 자다 펀드, 사우디벤처캐피털(SVC), 무바달라 등 중동 핵심 금융기관이 연계돼 있다. 배틀그라운드는 올초 인도 핀테크 기업 캐시프리페이먼츠에도 투자했다.  배틀그라운드 IP로 인도에서 대성공을 거둔 크래프톤이 비슷한 방식을 재현하는 전략으로 평가된다. 크래프톤은 인도가 2016~2022년 경험한 ‘디지털 결제 폭발기’를 발판 삼아 성장했다. 2020년 인도법인 설립을 시작으로 현지 스타트업 투자, 결제 플랫폼 투자, 게임 퍼블리싱 등을 이어가며 시장을 빠르게 장악했다. 지난 9월 기준 BGMI 누적 이용자는 2억4000만 명에 달한다. 크래프톤 관계자는 “2~3년 안에 1억5000만달러를 추가로 투입할 계획”이라고 말했다.  중동 시장의 인구 구조도 시장 확대에 나선 배경이다. 시장조사업체 뉴주에 따르면 중동 인구의 52.9%는 30세 이하로 게임 및 콘텐츠 소비에 적극적인 연령층이 높은 비중을 차지하고 있다. 중동 게임 시장은 2027~2028년을 전후해 150억달러 안팎으로 성장할 전망이다.",https://n.news.naver.com/mnews/article/015/0005222205
2025-12-09 17:26:00,AI에 수백조 썼는데…겨우 1시간 업무단축 효과?,"글로벌 빅테크가 한 해 수백조원을 쏟아붓는 인공지능(AI) 기술이 정작 산업 현장에서 하루 1시간 업무를 단축하는 수준에 그치고 있다는 분석이 나왔다. 노동 생산성을 올려 산업의 판을 바꿀 것이라는 기대와 달리 체감 성과가 여전히 제한적이라는 평가가 제기된다.  오픈AI는 8일(현지시간) ‘기업용 AI 현황’ 보고서에서 전 세계 100여 개 기업, AI 이용자 9000명을 조사한 결과 응답자의 75%가 “AI 활용 후 업무 속도와 품질이 개선됐다”고 답했다고 밝혔다. 오픈AI는 성과 지표로 챗GPT 대화량이 2024년 대비 8배, 기업용 추론 토큰 사용량이 320배 늘었다는 점도 함께 제시했다.  하지만 기업용 서비스 ‘챗GPT 엔터프라이즈’ 이용자들이 실제 절약한 업무 시간은 하루 평균 40~60분 수준에 그쳤다. 데이터과학, 엔지니어링 등 직군도 하루 60~80분 단축에 머물렀다. 일각에선 AI 활용이 산업 전체의 생산성 지표를 뒤흔들 정도의 변화로 확대되기엔 아직 한계가 있다는 해석이 나온다.  특히 가성비(가격 대비 성능)가 떨어진다는 측면에서 ‘AI 거품론’이 힘을 얻고 있다. 마이크로소프트, 알파벳, 아마존, 메타 등 미국 빅테크 4사는 지난 3분기 AI 인프라에 1123억달러(약 165조원)를 쏟아부었다. 메타는 2028년까지 6000억달러 규모의 추가 투자를 예고했고, 알파벳도 올해 AI 인프라 구축을 위한 자본 지출 규모를 950억달러 수준으로 상향했다. 투자 확대를 정당화할 만큼 AI 성과가 분기마다 수익으로 연결되고 있느냐를 놓고 의문이 커지는 배경이다.  수익 창출이 투자 속도를 따라가지 못하고 있다는 비판도 나온다. 미국 매사추세츠공대(MIT) 연구진은 최근 “생성형 AI에 투자한 다수 기업이 아직 실질적 이익을 거두지 못하고 있다”고 지적했다. 이에 대해 브래드 라이트캡 오픈AI 최고운영책임자(COO)는 “현장과 연구 사이에는 큰 격차가 있다”고 반박했다. 오픈AI 수석경제학자인 로니 채터지 듀크대 교수도 “4명 중 3명이 ‘이전엔 할 수 없던 일을 하게 됐다’고 답했다”며 “AI의 효과는 시간 절감 이상의 구조적 변화로 이어지고 있다”고 강조했다.",https://n.news.naver.com/mnews/article/015/0005222204
