날짜,제목,본문,링크
2025-12-20 07:13:00,"尹, 오늘 김건희특검 출석…'처음이자 마지막' 대면 조사","윤석열 전 대통령이 20일 김건희 여사 관련 의혹을 수사하는 민중기 특별검사팀에 출석한다.  민중기 특검팀은 이날 오전 10시 종로구 KT광화문빌딩 웨스트에 마련된 특검팀 사무실로 윤 전 대통령을 불러 대면 조사에 나선다. 윤 전 대통령은 법무부 호송차를 타고 서울구치소에서 특검팀 사무실까지 이동한다.  특검팀은 지난 7월 말에도 윤 전 대통령에 대한 대면 조사를 시도했지만, 윤 전 대통령이 연이어 불응하며 무산됐다. 특검팀이 구치소를 찾아 강제 구인에도 나섰으나, 윤 전 대통령의 완강한 거부를 이기지 못했다.  특검팀은 지난달 윤 전 대통령에게 다시 출석을 요구했고, 일정 조정 끝에 비로소 대면 조사가 성사됐다. 다만 오는 28일이 수사 기간 만료인 점을 감안하면, 특검팀의 윤 전 대통령 대면 조사는 이번이 처음이자 마지막이 될 전망이다.  윤 전 대통령 출석요구서에는 6가지 피의사실이 적시된 것으로 알려졌다. 윤 전 대통령은 김 여사가 명태균씨로부터 2억7000만원어치 여론조사 결과를 받은 혐의(정치자금법 위반), 김상민 전 부장검사로부터 1억4000만원 상당의 이우환 화백 그림을 받은 혐의(특정범죄 가중처벌법상 뇌물)의 공범으로 지목됐다.  대선후보 시절인 2021년 말 공개 토론회에서 김 여사와 관련한 허위 사실을 공표한 혐의(공직선거법 위반)와 김 여사가 서희건설 이봉관 회장, 이배용 전 국가교육위원장, 로봇개 사업가 서성빈 씨로부터 인사·이권 청탁과 함께 고가 금품을 받는데 관여했다는 혐의도 받는다.  일각에서는 윤 전 대통령이 적극적으로 진술할 수 있다는 관측도 나온다. 윤 전 대통령은 건강상 이유 등을 들어 재판이나 내란특검팀, 순직해병특검팀의 대면조사에 불출석했지만, 10월 중순부터는 거의 빠짐 없이 나와 방어권을 행사해왔다.  특검팀은 이날 조사를 마친 뒤 남은 수사 기간 공소장 작성, 증거기록 정리, 잔여 사건 이첩 준비 등에 매진할 방침이다.  오세성 한경닷컴 기자 sesung@hankyung.com",https://n.news.naver.com/mnews/article/015/0005227039
2025-12-20 07:01:00,국민들 살 빠지고 술 끊었더니 '비상'…나라 곳간에 무슨 일이 [글로벌 머니 X파일],"이 기사는 국내 최대 해외 투자정보 플랫폼 한경 글로벌마켓에 게재된 기사입니다.     최근 인류의 오랜 꿈인 '무병장수'가 국가 재정에 영향을 끼치고 있다. 비만 치료제 GLP-1(글루카곤 유사 펩타이드-1)의 열풍과 젊은 세대를 중심으로 확산한 '소버 큐리어스(Sober Curious·의식적 금주)' 트렌드가 결합하면서다. 이에 따른 건강 증진이 정부의 전통적 수입원인 '죄악세' 기반을 무너뜨리고 있다는 분석이 나온다. 일부 국가에선 국채 시장의 금리 상승 압력으로 작동하는 현상까지 나타났다. 술 안 마시고 살 빼는 미국 20일 글로벌 시장조사기관 갤럽이 지난 8월 발표한 조사 결과에 따르면, 미국 성인의 음주율은 54%로 1939년 갤럽이 조사를 시작한 이래 최저치를 기록했다. 주목할 점은 인식의 변화다. ""적당한 음주도 건강에 해롭다""고 응답한 비율이 53%에 달했다. 10년 전인 2015년(28%)보다 두 배 가까이 급증했다.  제프 존스 갤럽 선임연구원은 ""미국인의 음주율 54%는 단순한 경기 침체 여파가 아닌, 웰니스 트렌드가 정착된 결과""라며 ""급격한 절벽이라기보다 완만하지만 되돌릴 수 없는 하강 곡선""이라고 분석했다.  '기적의 비만약'으로 불리는 GLP-1 치료제도 최근 글로벌 트렌드로 꼽힌다. 미국 카이저가족재단(KFF)의 지난달 데이터에 따르면, 미국 성인의 약 12%가 현재 GLP-1 약물을 복용 중이다. 18%는 복용 경험이 있는 것으로 나타났다. 헬스케어 데이터 분석기업 IQVIA는 올해 초 기준 당뇨 환자의 약 25%가 GLP-1 치료를 시작했다고 분석했다. 이는 4년 전 3%에서 8배 이상 급증한 수치다.  이 약물은 식욕뿐만 아니라 알코올과 니코틴 등에 대한' 중독적 욕구'까지 억제한다는 분석이 나온다. 미국의학협회지 정신의학에 올해 게재된 임상 연구 결과를 보면 세마글루타이드(GLP-1 성분) 투여군은 알코올 섭취 욕구 지표가 대조군 대비 유의미하게 감소한 것으로 나타났다.   술 소비 감소는 세수의 하락으로 이어졌다. 미국 재무부 산하 주류담배세금무역국(TTB)의 '2025 회계연도 1분기(2024년 10~12월)' 데이터에 따르면 알코올 소비세 세입은 24억 8400만 달러로 전년 동기 대비 3.4% 감소했다. 담배 소비세는 19억 4000만 달러로 전년 대비 4.9% 줄었다. 3개월 만에 약 1억 8700만 달러의 세수가 증발했다.  장기 전망의 영향은 더 크다. 미국 회계감사원(GAO) 보고서에 따르면, 미연방 정부의 담배 소비세 수입은 2014 회계연도 약 140억 달러(약 19조 원)에서 2024 회계연도 90억 달러(약 12조 원)로 10년 새 35% 이상 급감했다. 물가 상승을 고려하면 실질 가치는 반토막 난 셈이다.  반면 '담배세 환급(Drawback)' 신청액은 급증했다. 2020년 약 200만 달러에 불과했던 환급 신청액은 지난해 3억 9200만 달러로 약 200배 가까이 크게 늘었다. 담배세 환급은 내수 시장용으로 세금을 내고 출하된 제품이 팔리지 않아 해외로 수출되거나 폐기될 때 정부가 이미 납부된 세금을 돌려주는 제도다. 국가 세수에 영향 다른 국가들도 비슷하다. 영국 예산책임청(OBR)은 2025~2026 회계연도 주류세 수입 전망치를 130억 파운드로 하향 조정했다. 담배세 수입 역시 2030년까지 70억 파운드대로 하락할 수 있다고 분석했다. 호주 정부 또한 2025~2026 예산안에서 ""합법 담배 소비의 유의미한 감소""를 이유로 향후 4년간 특소세 전망치를 86억 호주달러 깎았다.   일각에서는 '죄악세 펑크'가 국가 재정을 뒤흔들 정도는 아니라는 반론도 나온다. 경제협력개발기구(OECD)의 2025년 세수 통계에 따르면, 회원국들의 건강 관련 소비세(술·담배 등)는 GDP 대비 평균 0.74%에 불과했다. 전체 조세 수입에서 차지하는 비중도 2.24% 수준이다. 15%가 줄어든다 해도 GDP의 0.11%포인트 영향에 그친다는 계산이 나온다.  하지만 시장이 우려하는 것은 총량이 아니다. 관련 추세와 지방 재정이다. 미국의 경우 연방 세수보다 주 정부나 지방 정부의 죄악세 의존도가 높다. 미국은 1998년 담배 회사들과 주 정부 간의 합의에 따라 미래의 담배 판매 수익을 담보로 발행한 이른바 '담배 채권'이 지방 재정의 뇌관으로 떠올랐다는 지적도 나온다.  세수 부족 영향이 국채 시장에 영향을 미친다는 분석도 나온다. 이달 들어 미국 국채 수익률 곡선은 4년 만에 가장 가파른 이른바 '베어 스티프닝(Bear Steepening·장단기 금리차 확대)' 현상을 보였다. 뉴욕 연방준비은행의 분석에 따르면 최근 미 국채 10년물 금리 상승의 주된 원인은 '텀 프리미엄'의 재축적이다.  텀 프리미엄은 투자자가 장기 채권을 보유하는 대가로 요구하는 추가 보상이다. 재정 적자 우려가 커질수록 상승한다. 시장 참여자들은 ""세수 기반이 약화한 정부가 부족한 돈을 메우기 위해 국채를 더 찍어낼 것""이라는 우려를 가격에 반영하고 있다. 죄악세 감소가 이런 현상에 일부 영향을 줬다는 분석이다.  세인트루이스 연방준비은행 경제연구팀은 ""최근 10년물 국채 금리 상승의 절반 이상은 텀 프리미엄의 복귀로 설명된다""며 ""이는 특정 세목(죄악세 등)의 결손 때문만이 아니라 장기적인 재정 적자 확대 전망과 연준의 정책 불확실성이 복합적으로 작용한 결과""라고 분석했다.  로이터통신의 마이크 돌런 칼럼니스트는 ""투자자들은 단순히 죄악세 몇 푼이 줄어든 것을 걱정하는 게 아니다""라며 ""세입 기반이 구조적으로 무너지는 상황에서도 정부가 지출을 줄이지 못하고 국채를 찍어내는 '재정 우위' 시나리오에 대해 리스크 프리미엄을 매기기 시작한 것""이라고 경고했다. 글로벌 경제 '충격파' 관련 산업계는 생존을 위한 변신을 꾀하고 있다. 글로벌 주류 분석기관 IWSR에 따르면, 전 세계 무알코올 및 저 알코올 음료 시장은 2024~2028년 물량 기준 연평균 4% 성장할 것으로 전망된다. 순수 무알코올 시장은 같은 기간 연평균 7%의 고성장이 예상된다.  마텐 로드베이크스 IWSR 대표는 ""소비자들은 이제 취하기 위해 마시는 게 아니라 분위기를 즐기기 위해 마신다""며 ""주류 기업들이 알코올을 빼는 대신 건강 기능성을 더하거나 패키지를 고급화해 객단가를 높이는 전략으로 선회했다""고 설명했다.  담배 업계 역시 궐련(연초) 판매 감소를 전자담배와 니코틴 파우치 등으로 상쇄하고 있다. 필립모리스인터내셔널은 비연소 제품 비중을 50% 이상으로 끌어올리며 '담배 연기 없는 미래'를 강조했다. 영국 정부가 내년 10월부터 전자담배 액상에 대한 새로운 세금을 도입하기로 했다.  비만 치료제 시장은 호황이다. 일라이 릴리의 2025년 3분기 실적 발표에 따르면 '마운자로' 매출은 전년 동기 대비 109% 급증한 65억 2000만 달러를 기록했다. 제약 바이오산업이 반도체에 버금가는 국가 전략 산업으로 부상했다.   이런 글로벌 트렌드는 개방형 경제 구조를 가진 한국에도 영향을 미친다. 금융 시장 측면에서 '킹 달러'의 영향이 우려된다. 미 국채 금리 상승은 글로벌 자금을 빨아들여 원화 가치 하락(환율 상승) 압력으로 작용한다.  한국 자본시장연구원은 ""미 국채의 텀 프리미엄 상승은 한국과 같은 신흥국 증시에서 외국인 자금 이탈을 유발하고, 원·달러 환율을 1400원대로 고착화할 위험이 있다""고 경고했다.  한국에서도 정부의 세수 구조 개편을 서둘러야 한다는 목소리가 커지고 있다. 현재 담배세에 과도하게 의존하는 국민건강증진기금 등의 재원 구조는 지속할 수 있지 않기 때문이다. WHO가 지난 7월 전 세계 국가들에 ""설탕, 알코올, 담배 가격을 50% 인상하라""고 강력히 권고했다.  [글로벌 머니 X파일은 중요하지만 잘 알려지지 않은 세계 돈의 흐름을 짚어드립니다. 필요한 글로벌 경제 뉴스를 편하게 보시려면 기자 페이지를 구독해 주세요]",https://n.news.naver.com/mnews/article/015/0005227037
2025-12-20 07:01:00,5000원까지 떨어지나 했는데…주가 2배 폭등에 개미 환호 [윤현주의 主食이 주식],"지난 3월(3월 13일 고가 8650원) 주가가 8000원을 넘길 때만 해도 분위기가 좋았는데, 8개월 만(11월 7일 장중 5280원)에 연고점 대비 38.96% 하락했다. 하지만 외국인과 기관의 쌍끌이 매수로 현재 주가는 1만원에 육박한다. 롤러코스터 같은 흐름이지만 연말 상승세에 개인들은 웃고 있다.  코스닥시장 상장사 파이버프로(시가총액 3203억원)가 시장의 관심을 받고 있다. 이 회사는 1995년 설립된 광섬유 센서 및 광 계측 전문기업이다. 설립 초기 광섬유를 활용한 정밀 측정 장비와 센서 개발에 집중해 다양한 제품을 선보였고, 이를 통해 연구기관과 산업 현장에서 인정받고 있다.  30년 광섬유 기술 노하우를 바탕으로 사업 영역을 넓히고 있다. 광섬유 자이로스코프(FOG)를 활용한 관성측정장치(IMU)와 관성항법시스템(INS)을 개발·공급하며 항공기, 위성, 드론, 무인 차량 등 정밀 항법이 요구되는 다양한 플랫폼에 적용하고 있다. 또 전자전 환경에서 위성항법(GNSS) 신호가 교란되더라도 안정적인 위치와 시간을 제공하는 항재밍 GNSS 솔루션을 통해 방산·국방 분야에서도 입지를 확대하고 있다.  파이버프로 제품은 나로호와 누리호 같은 한국형 발사체와 여러 위성, 국내외 주요 방위산업 무기체계에 적용되며 성능과 신뢰성을 인정받았다. 광 파워미터, 편광 스크램블러, 광 정렬장비 등 다양한 광 계측 장비도 글로벌 광통신 연구개발 현장에서 활용되고 있다. 파이버프로 “통합 PNT 솔루션 발전 … 미래 항법 시장서 질주” 20일 회사 관계자는 “우리의 강점은 개별 센서 공급을 넘어 관성항법(INS/IMU)과 항재밍 GNSS를 결합한 통합 PNT(Positioning, Navigation, Timing) 솔루션으로 발전하고 있는 것이다”고 말했다. 이를 통해 군사 분야뿐 아니라 민간 드론, 자율주행, 우주 분야 등 다양한 시장에서 경쟁력을 높이고 있다. 그는 “미래 항법 시장의 한 축으로서 소형·경량 센서, 고성능 항재밍 기술, 통합항법 시스템을 지속적으로 개발해 글로벌 PNT 솔루션 시장에서 영향력을 확대하겠다”고 강조했다. 파이버프로는 제품을 직접 판매하는데 B2B(기업 간 거래) 영업 위주다. 고객 요구에 따라 맞춤 시스템을 공급하거나 기술 서비스 및 유지·보수, 연구개발(R&D) 및 국책과제로 선정됐을 때 수익을 얻고 있다. 국내 정부기관과 방산업체, 연구소가 고객이며 북미와 유럽에 항법·광통신·측정기기 등을 수출한다. 작년 매출의 40%를 통합항법 시스템, 34%를 광 계측 기기가 담당했다.  투자 긍정 요인으로는 오랜 기간 축적된 광섬유 기반 기술력과 사업 다각화다. 나로호와 누리호 같은 우주 발사체와 위성, 주요 무기체계에 적용되면서 시장의 신뢰를 얻었다. 다만 방산과 항공우주 산업은 특성상 정부 정책과 예산에 크게 좌우되며 프로젝트 수주 시점과 규모에 따른 실적 변동성이 크다. 글로벌 시장에서는 허니웰, 사프란 등 방산 대기업과 경쟁해야 하고 관성센서 기술의 고도화로 가격 및 성능 경쟁이 심화될 수 있다.  신사업 확장을 위해 지속적인 R&D 투자가 필요한 만큼 단기적으로 수익성 압박이 따를 수 있고 해외 진출 과정에서 수출 규제, 인증 절차, 지정학적 위험, 환율 변동 등 외부 요인도 부담으로 작용할 수 있다. 한국IR협의회 “올해 매출 389억·영업익 66억” 실적은 우상향이다. 2020년 매출 157억원, 영업이익 23억원에서 작년 매출 329억원, 영업이익 72억원으로 4년 만에 각각 109.55%·213.04% 증가했다. 한국IR협의회는 올해 매출 389억원, 영업이익 66억원을 전망했다.  총 주식 수는 3285만4225주로 고연완 대표 외 특수관계인 7인이 지분 38.69%를 보유한 최대주주다. 인터베스트 17.96%, 이봉완 외 3인 9.2%, 자사주 0.29%다. 외국인은 한 달 만에 지분율을 2.49%에서 4.25%까지 높였다. 유통 물량은 30%에 조금 못 미친다. 3분기 기준 현금성 자산 157억원, 유형자산 162억원 있다. 20일 한국거래소에 따르면 주가는 9750원(KRX 기준)으로 한 달여 만에 84.66% 상승했다. 미국 스페이스X 상장 추진으로 우주 섹터가 관심을 받고 있는 영향이다. 아쉬운 건 올해 증권사 보고서가 없다. 스몰캡에 해당해 기관들의 관심이 적은 탓이다. 사측의 적극적인 IR 활동이 필요해 보인다. 동종업계로 볼 수 있는 한화에어로스페이스, 한국항공우주, 에이치브이엠, 스피어는 꾸준히 보고서가 나오고 있다. 지난 17일 신규 상장한 나라스페이스테크놀로지는 급등세를 보이고 있다.  독립리서치를 운영하는 이재모 아리스 대표는 20일 기자와의 통화에서 “고성능 광센서 솔루션을 제공하는 파이버프로는 첨단 광기술 기반 제품을 지속적으로 출시하는 등 성장 흐름을 보이고 있다”고 분석했다. 이어 “최근 3개년 매출이 연평균 32% 증가했다”며 “성장성 등 고려 시 타깃 PER(주가수익비율) 30배 가정 시 적정 주가는 1만2000원으로 보인다”고 주장했다. 그는 “인공지능(AI), 우주항공, 방산분야 섹터에 있는 만큼 추가적인 주가 상승을 기대할 수 있다”고 조언했다. 현 주가 대비 23.08% 상승 여력이 있는 셈이다. '1500만 개미'와 함께 달리겠습니다. 아래 기자 페이지에서 윤현주 기자 구독과 응원(매일 가능)을 눌러 주세요. 여러분의 주식 계좌에 빨간불이 켜지는 날이 더 가까워질 수 있도록 알찬 기사로 찾아뵙겠습니다.",https://n.news.naver.com/mnews/article/015/0005227035
2025-12-20 06:59:00,"""엔비디아 주가, 이례적 저평가 국면""…과거 사례상 큰 반등 가능성 [종목+]","엔비디아 주가가 반도체 업종 내에서 이례적으로 낮은 밸류에이션 구간에 진입했다는 분석이 나왔다. 과거 사례를 보면 이 같은 국면 이후 주가가 큰 폭으로 상승한 경우가 많았다는 점에서 투자자들의 관심이 쏠리고 있다.  마켓워치는 19일(현지시간) 번스타인을 인용해 엔비디아 주가가 현재 선행 주가수익비율(PER) 기준 25배 미만에서 거래되고 있다고 전했다. 이는 연초 대비 약 27% 낮아진 수준으로, 최근 10년을 기준으로 보면 엔비디아 주가가 드물게 낮은 평가를 받고 있는 구간이라는 평가다.  번스타인의 스테이시 래스곤 애널리스트는 “일반적인 종목이라면 특별히 싸 보이지 않을 수 있지만, 엔비디아 기준에서는 의미 있는 저평가 국면”이라며 “절대적인 기준에서도 충분히 매력적인 수준”이라고 밝혔다.  특히 엔비디아 주가는 선행 PER 기준으로 필라델피아 반도체지수(SOX) 대비 약 10% 이상 할인된 상태로 거래되고 있다. 최근 10년을 놓고 볼 때 엔비디아가 업종 지수 대비 이 정도 수준으로 저평가된 사례는 매우 드물었다는 설명이다.  엔비디아 주가는 올해 들어 약 30%가량 상승했지만, 7월 이후로는 주가 흐름이 정체되며 업종 지수 상승률을 밑돌았다. 인공지능(AI) 인프라 투자 둔화 우려와 반도체 경쟁 심화에 대한 경계심이 주가 부담으로 작용했다는 분석이다.  다만 과거 흐름을 보면 현 구간은 긍정적으로 평가된다. 지난 10년간 엔비디아 주가가 선행 PER 25배 이하에서 거래됐던 시점에 매수했을 경우, 이후 1년 평균 수익률은 큰 폭의 상승을 기록했다. 해당 기간 뚜렷한 하락 구간이 나타나지 않았다는 점도 특징이다.  래스곤은 “현재의 밸류에이션과 투자 환경을 감안할 때 새해를 앞둔 투자 여건은 우호적”이라며 “이 구간에서는 매수 관점이 유효하다”고 강조했다.  AI 인프라 투자 환경에 대해서도 우려는 제한적이라는 평가다. 하이퍼스케일러들의 대규모 자본 지출은 “현 시점에서는 감내 가능한 수준”이며, 구글과 브로드컴이 개발한 주문형 반도체(ASIC)에 대한 우려도 “GPU 중심의 투자 논리가 다시 힘을 얻고 있다”고 분석했다. GPU 중심의 투자 논리는 주문형 반도체(ASIC)는 특정 연산에 최적화돼 있지만 활용 범위가 제한적인 반면, GPU는 학습과 추론 전반에 걸쳐 폭넓게 활용될 수 있어 AI 기술 변화에 더 유연하게 대응할 수 있다는 점을 강조하고 있다.  향후 주가를 자극할 촉매도 적지 않다. 엔비디아는 2026년 하반기 차세대 ‘루빈’ AI 플랫폼 출시를 앞두고 있으며, 내년 3월에는 연례 GPU 테크놀로지 콘퍼런스(GTC)를 개최할 예정이다. 최근 트럼프 행정부가 엔비디아의 H200 칩의 중국 판매를 승인한 점도 중장기적으로는 긍정적 변수로 거론된다.  래스곤은 “월가의 엔비디아 실적 전망은 회사가 제시한 2026년까지 5000억 달러 규모의 매출 기회에 비해 여전히 보수적인 수준”이라며, 향후 실적 추정치 상향 가능성도 열려 있다고 평가했다.",https://n.news.naver.com/mnews/article/015/0005227034
2025-12-20 06:39:00,"스타벅스, 아마존 출신 CTO 영입…디지털·공급망 혁신 가속 [종목+]","스타벅스가 아마존 식료품 사업을 이끌어온 기술 전문가를 최고기술책임자(CTO)로 영입하며 디지털 전환과 운영 효율화에 속도를 낸다.  스타벅스는 19일(현지시간) 아마존 출신의 아난드 바라다라잔을 신임 CTO로 선임했다고 밝혔다. 바라다라잔은 내년 1월 19일부터 부사장(EVP) 겸 CTO로 취임해 브라이언 니콜 최고경영자(CEO)에게 직접 보고한다.  바라다라잔은 약 19년간 아마존에 몸담으며 최근까지 글로벌 식료품 매장 사업의 기술과 공급망을 총괄했다. 아마존 프레시와 홀푸드 마켓을 아우르는 조직을 이끌었으며, 이전에는 오라클에서 소프트웨어 엔지니어로 근무한 경력도 있다.  이번 인사는 스타벅스가 추진 중인 턴어라운드 전략의 일환이다. 전임 CTO였던 데브 홀 르페브르는 지난 9월 회사를 떠났으며, 당시 스타벅스는 두 번째 구조조정과 함께 10억 달러 규모의 구조조정 계획을 발표했다.  니콜 CEO는 내부 메모에서 “바라다라잔은 신뢰성과 보안성을 갖춘 시스템을 구축하고, 운영 효율성을 높이며 고객 중심의 솔루션을 확장할 수 있는 인물”이라며 “기술을 가능하게 하는 조직과 인재를 성장시키는 데도 깊은 관심을 갖고 있다”고 평가했다.  아마존 재직 시절 바라다라잔은 홀푸드 매장에 소형 로봇 창고를 도입하는 파일럿 프로젝트 등 식료품 유통 분야의 기술 혁신을 주도했다. 이를 통해 매장 고객들이 오프라인 진열 상품과 함께 아마존의 광범위한 온라인 재고를 동시에 구매할 수 있도록 했다.  한편 스타벅스는 2024년 9월 취임한 니콜 CEO 체제에서 실적 회복 조짐을 보이고 있다. 최근 분기 기존점 매출은 약 2년 만에 처음으로 증가세로 전환됐으며, 연말 쇼핑 시즌 매출도 양호한 흐름을 이어가고 있다. 다만 일부 매장에서 노조 바리스타 파업이 이어지고 있지만 영향은 크지 않은 것으로 전해진다.  스타벅스는 턴어라운드 전략의 핵심으로 ‘그린 에이프런 서비스’를 추진 중이다. 바리스타를 중심에 두고 인력 배치와 매장 동선, 디지털 주문 시스템을 통합 개선하는 스타벅스의 핵심 운영 혁신 플랫폼이다.이 프로그램에는 5억 달러가 투입됐으며, 적정 인력 배치와 서비스 속도 개선을 위한 기술 고도화가 병행되고 있다. 디지털 주문 비중은 현재 전체 매출의 30%를 넘어섰다.",https://n.news.naver.com/mnews/article/015/0005227033
