날짜,제목,본문,링크
2025-12-09 10:05:00,"""이게 한복이라고?""…사우디 '코리아 빌리지' 의상 '발칵'","고름이 보이지 않는 저고리, 널찍한 소매. 이처럼 전통 한복과 거리가 먼 기괴한 디자인의 한복이 사우디아라비아 수도 리야드의 한국 전통문화 체험 공간에서 등장했다.  지난 10월 리야드 중심 상업지구에 개장한 '코리아 빌리지'(Korea Village)는 현지 최대 글로벌 축제인 '리야드 시즌'의 주요 공간에 조성됐다. K-팝, K-푸드, 한국 카페, 한복 체험, 나전칠기 등 한국 현대·전통 문화를 아우르는 복합 문화형 전시·체험 공간으로 구성된 것이 특징이다.  서경덕 성신여대 교수는 9일 자신의 SNS에서 ""최근 이와 관련된 SNS 영상에는 전통 한복으로 보기 어려운 기괴한 의상이 등장해 논란이 되고 있다""고 설명했다. 사진 속 일부 복장에는 태극기 문양이 여러 곳에 붙어 있어 외형만으로 '한국적 요소'를 과장해 연출한 듯한 인상을 준다는 지적도 나왔다.  한복 전문가들도 ""전통 한복 디자인과는 거리가 멀다""는 의견을 냈다. 서 교수는 ""중동 지역에 한국 문화를 알린다는 좋은 취지로 시작된 일이지만 한국의 전통 의상인 한복에 대해 좀 더 자문을 받고 진행을 했어야 했다""며 ""제대로 된 한복으로 교체해야 한다""고 지적했다.  코리아 빌리지는 한국의 한 기업이 기획한 행사다. 사우디 국부펀드(PIF) 산하 문화콘텐츠 전문기관 씰라(SELA) 등이 공동 운영하는 것으로 알려졌다.",https://n.news.naver.com/mnews/article/015/0005221916
2025-12-09 10:05:00,"李 대통령, 정원오 콕 찍어 공개 칭찬…박홍근 ""부럽고 당혹""","이재명 대통령이 여권의 서울시장 후보로 급부상한 정원오 성동구청장을 공개 칭찬한 것과 관련, 서울시장 출마를 선언한 박홍근 민주당 의원이 '부럽다'는 반응을 보였다.  더불어민주당에서 가장 먼저 출마를 공식화한 박 의원은 9일 CBS 라디오 '뉴스쇼'에 출연해 ""대통령이 특정인에게만, 특히 공직 후보로 거론되는 사람들에게 힘을 실어줄 분은 아니다""라면서도 이같이 말했다.  그는 우선 ""(이 대통령이) 행정 경험이 있는 단체장 출신으로서 잘하고 있는 단체장에 대해서 칭찬하는 건 좋다고 생각한다""면서도 ""소식을 접했을 때 인간적으로는 좀 의아스럽기도 하고 좀 당혹스러운 게 솔직한 마음 아니겠나""라고 했다.  이어 ""곰곰이 생각해 보니 대통령의 스타일이 있다. 대통령이 어떤 사안을 진중하고 무겁게 접근하지 않고 재치 있게 접근하는 경우들이 많았다면서 ""이번에도 후속 파장을 깊게 생각하고 하신 것 같지는 않다""고 했다.  박 의원은 ""어제 늦게 대통령실 관계자와 다른 이유로 통화하다가 분위기를 물어봤더니 내부에서도 전혀 예상치 못했다고 했다""며 대통령실 내부의 분위기도 전했다.  그는 ""원래 대통령께서 성동을 오래전부터 방문할 일정이 있었는데, 어제 저 글에 이어서 오늘 또 방문하면 마치 특정한 사람에게 힘 실어주기라는 그런 오해가 커질 수 있다는 판단에 오늘 그 일정을 취소했다고 한다""고 했다.  박 의원은 ""대통령도 아마 이렇게 파장이 있을 줄 몰랐던 것인데, 결과적으로 정원오 구청장은 여러 혜택을 받은 건 사실이고 인간적으로 부럽기는 하다""면서도 ""대통령이 특정인에게만, 특히 공직 후보로 거론되는 사람들에게 힘을 실어줄 분은 아니다""라고 강조했다.  앞서 전날 이 대통령의 자신의 엑스(옛 트위터)에서 정 구청장이 성동구민을 대상으로 한 구정 만족도 여론조사에서 92.9%의 긍정 평가를 얻었다는 언론 기사를 공유하며 정 구청장을 공개 칭찬했다.  이 대통령은 ""정원오 구청장이 일을 잘하기는 잘하나 보다. 저의 성남 시정 만족도가 꽤 높았는데 명함도 못 내밀 듯""이라고 말했다. 이에 정치권 일각에서 이 대통령의 '원픽'이 정 구청장 아니냐는 해석이 나왔다.  다만 대통령실은 이 대통령이 자신의 성남시장 재직 당시를 떠올리며 얘기한 것일 뿐 내년 지방선거와는 무관하다는 입장을 보였다.",https://n.news.naver.com/mnews/article/015/0005221915
2025-12-09 10:04:00,"쌍용건설, 싱가포르 대형 병원 공사 수주","쌍용건설이 최근 싱가포르 보건부(MOH)가 발주한 대형 병원공사를 수주했다.  쌍용건설은 5억8000만달러(약 8000억원) 규모의 알렉산드리아(Alexandra) 병원 외래병동(Outpatient Ward) 공사를 40%의 지분으로 일본(Shimizu), 싱가포르(Kimly)와 조인트벤처(JV)를 구성해 수주했다고 9일 밝혔다. 지하 3층 ~ 지상 12층, 진료실, 클리닉, 오피스, 주차장 등을 지을 예정이다.  쌍용건설은 전세계 약 1만2000개 병상에 달하는 첨단 의료시설 시공실적을 보유하고 있다. 싱가포르에서는 1998년 탄톡생병원, 1999년 New K.K 병원, 2024년 WHC에 이어 Alexandra 병원을 시공하게 됐다.  쌍용건설 관계자는 ""이번 수주에 앞서 코로나 역경을 극복하며 착공 6년 만에 완공한 WHC(Woodlands Health Campus) 프로젝트를 통해 고난도 병원공사에 대한 시공·관리 역량을 입증했다""고 설명했다.",https://n.news.naver.com/mnews/article/015/0005221914
2025-12-09 10:01:00,이어지는 출근길 영하권 추위…낮에는 '포근' [내일 날씨],"수요일인 10일 전국 아침 최저기온이 영하로 떨어지는 초겨울 추위가 이어지겠다. 낮부터는 조금씩 추위가 꺾일 전망이다.  9일 기상청에 따르면 10일 아침 최저기온은 영하 6도에서 영상 4도, 낮 최고기온은 영상 7~14도로 예보됐다.  전국 대부분 지역의 아침 기온이 0도 이하에 머무르겠다. 이후 조금씩 추위가 풀리면서 낮부터는 기온이 전날보다 3도 넘게 오르겠다.  강원동해안·산지와 경북동해안·북동산지, 대구, 일부 경남권은 당분간 대기가 매우 건조하고 바람도 약간 강하게 불어 작은 불씨가 큰불로 번질 수 있으니 각종 화재 예방에 각별히 유의해야겠다.",https://n.news.naver.com/mnews/article/015/0005221913
2025-12-09 10:01:00,'신림5구역' 밑그림 나왔다…재개발 시계 빨라지는 신림동,"서울의 노후 주거지로 꼽히던 관악구 신림동의 재개발사업이 속도를 내고 있다. 신림1구역 다음으로 규모가 큰 5구역이 신속통합기획으로 정비사업 밑그림을 그리면서 노후화된 신림동 일대가 서울 서남권의 주거 중심지로 재평가받을 것이란 기대가 나온다.  서울시는 지난 8일 열린 제13차 도시계획위원회 수권분과위원회에서 '신림5 주택정비형 재개발구역 정비계획 수립 및 정비구역 지정·경관심의안'을 수정가결했다고 9일 밝혔다.  신림5구역은 신림선 서원역과 가까운 역세권이다. 신림초와 인접해 교육환경이 우수하며 북측 도림천과 남측 삼성산(건우봉)이 맞닿는 자연·여가 여건이 뛰어나다. 다만 동일 생활권 내에서도 고저차가 매우 크고 접근성이 떨어져 생활 불편이 적지 않아, 서울시는 신속통합기획 가이드라인을 반영해 지역 특성에 맞춘 정비계획을 마련했다.  이번 심의를 통해 구역 내는 주거지역별 용적률 기준(획지1: 250% 이하, 획지2·3: 300% 이하)을 적용해 최고 34층, 3973가구(공공 624가구) 규모로 조성된다. 최종 건축계획은 정비사업 통합심의위원회에서 확정된다.  특히 신림동 일대의 오랜 숙원이었던 급경사 지형 문제를 해소하기 위해 경사도 12% 이하의 내부 순환도로를 신설해 상·하부 생활권 간 이동성을 크게 개선했다. 주요 진출입 교량인 문화교와 신본교를 확폭해 교통 흐름도 개선했다.  보행환경도 개선한다. 저지대 접근성을 높이는 공공보행통로 3개소를 설치하고, 건축한계선 이격으로 형성되는 공간은 보행공간으로 활용해 안전성과 편의성을 높였다. 진입부에는 진입광장을 조성해 가로 활성화를 유도하고, 단차가 큰 구간에는 계단·엘리베이터를 설치해 보행약자도 이용하기 편리한 환경을 만들었다.  북서측 문성로30길은 신림초 학생들의 주요 통학로로, 학생 안전을 위해 어린이공원을 새로 조성하고 공원 남측으로 기존 키움센터와 구립 경로당을 이전 배치해 교육·복지서비스 접근성을 강화했다. 남측의 삼성산 경사면에는 경관녹지 2개소를 조성해 자연성 회복과 도시경관 향상을 도모했다. 신림현대아파트와의 경계부는 공공공지로 확보해 단기적으로는 고도차에 따른 급경사·옹벽 발생을 방지하고, 장기적으로는 향후 신림현대아파트 정비 시 기반시설과 연계할 수 있는 여지를 마련했다.  획지 2·3은 주거복합용지로 저층부 특화설계와 공개공지(오픈스페이스)를 확보했다. 도림천 및 주변 지역과의 공간적 연계성을 높였다. 순환도로 북측에는 생활공유가로를 조성해 지역 커뮤니티 활성화도 도모했다.  이번 신림5구역의 정비계획 수정가결로 신림동 일대는 신림1구역(신속통합기획 1호), 2024년 9월 지정된 신림7구역과 더불어 정비사업이 본격적인 속도를 낼 것으로 전망된다.  최진석 서울시 주택실장은 “신림5구역은 관악구 정비 흐름의 중요한 전환점으로, 지역 환경을 실질적으로 개선할 수 있는 기반이 마련된 사업”이라며 “경사지·통학환경·녹지축 등 지역 특성을 세심하게 반영해 계획한 만큼, 앞으로도 주민 삶의 질 향상과 정비사업의 신속한 추진을 위해 서울시가 적극적으로 지원하겠다”라고 밝혔다.",https://n.news.naver.com/mnews/article/015/0005221912
2025-12-09 10:01:00,"속도내는 여의도 재건축…광장아파트, 최고 49층으로 '재탄생'","서울 영등포구 여의도 광장아파트가 최고 49층 높이의 대규모 주거복합단지로 새롭게 탄생한다. 여의도 일대 12개 재건축 단지 중 8번째로 정비계획이 확정되면서 여의도 재건축도 속도를 내고 있다.  서울시는 지난 8일 열린 ‘제13차 도시계획위원회 수권분과위원회’에서 여의도 광장아파트 재건축 정비계획 결정안을 ‘수정가결’ 했다고 9일 밝혔다.  광장아파트는 1978년에 준공된 샛강변 노후단지다. 이번 정비계획을 통해 용도지역이 제3종일반주거지역에서 일반상업지역으로 변경되고 최고 49층, 1314가구 규모의 단지로 조성된다.  정비계획에는 샛강변 연결녹지와 여의나루로변 소공원 조성이 포함됐다. 이를 통해 인근 직장인과 주민을 위한 산책로와 휴식공간을 확보하고, 샛강공원과 여의도역을 잇는 보행 접근성도 개선한다.   고령화 추세를 고려해 사회복지시설을 신설한다. 여의도역 주변 업무시설과 연계가 가능한 서울시 공공임대업무시설을 확보했다.  주요 가로변에는 공개공지를 조성해 개방감을 높인다. 단지 중앙부에 공공보행통로를 계획해 단지 내·외부 동선을 연결해 인근 업무종사자와 주민들의 보행 편의성을 향상시켰다.  광장아파트는 여의도 일대 12개 재건축 단지 중 8번째로 정비계획이 통과됐다. 여의도에서는 대교, 한양 등이 사업시행인가가 완료됐고, 시범은 통합심의가 통과됐다. 조합설립을 완료한 공작은 통합심의를 준비 중이다. 진주와 수정은 조합 설립을 준비 중이다. 이번 결정으로 광장은 목화와 함께 정비계획 결정이 완료됐다. 서울시는 이번 심의 결과를 반영해 통합심의를 거쳐 건축계획을 신속하게 확정할 계획이다.  최진석 서울시 주택실장은 “광장아파트가 샛강을 품은 고급 주거복합단지로 재탄생해 여의도 일대 재건축사업에도 긍정적인 영향을 미칠 것”이라며 “사업이 신속히 추진될 수 있도록 적극적으로 지원하겠다”고 말했다.",https://n.news.naver.com/mnews/article/015/0005221911
2025-12-09 10:00:00,"기준금리 동결 요청?…金총리 ""환율·물가안정에 한은·정부 공조""","김민석 국무총리는 9일 이창용 한국은행 총재와 만난 자리에서 ""환율, 물가 안정 등 시장안정을 위하여 한은과 정부와의 공조가 중요하다""고 말했다. 치솟는 원·달러 환율과 물가 부담을 감안할 때 기준금리 정책에 대한 정부의 협조 요청을 우회적으로 전달한 것 아니냐는 해석이 나온다.  김 총리는 이날 오전 정부서울청사 집무실에서 진행한 이 총재와 면담에서 “정부는 경제회복 불씨를 안착시키고, 이를 민생안정으로 확산시킬 수 있도록 최선을 다하겠다”며 이같이 말했다. 이어 ""거리 물가 부담 완화, 지역경제 활성화, AI대전환·초혁신경제 등 성장잠재력 확충을 위해 정부는 최선의 노력을 다할 계획""이라고 설명했다.  이창용 총재는 “한은은 단기적 경제안정뿐만 아니라 중장기 성장잠재력 확충을 위해 구조개혁 연구를 지속할 것""이라며 ""정부와의 소통과 협력을 더욱 강화해 나가겠다”고 말했다.  통화당국 수장과 국무총리의 만남은 이례적이라는 평가다. 그동안 이 총재는 통화정책과 재정정책의 협업을 위해 구윤철 경제부총리 겸 기획재정부 장관과는 수시로 회동해 왔다. 하지만 국무총리와의 공식 면담은 드문 만큼, 김 총리의 발언을 둘러싼 시장의 관심도 커지고 있다.  김 총리가 ""시장안정을 위하여 한은과 정부와의 공조가 중요하다""고 말한 데 대한 해석도 무성하다. 환율은 최근 1470원 안팎에서 고공행진을 이어가고 있고, 물가도 지난달 2.4%로 물가안정 목표(2.0%)를 웃돌고 있다. 여기에 수도권을 중심으로 집값도 오름세를 이어가다 1015 대책 이후 숨 고르기를 이어가는 상황이다. 이런 가운데 김 총리의 ‘공조’ 발언은 현 수준의 기준금리 동결 기조를 유지해야 한다는 메시지를 담은 것 아니냐는 분석을 낳고 있다. 한국은행은 지난달 27일 기준금리를 연 2.50%로 동결했다.  국무총리실 관계자는 ""앞으로도 한국은행은 주요 경제, 금융 현안에 대한 인식을 공유하면서 긴밀히 소통해 나갈 계획""이라고 설명했다.",https://n.news.naver.com/mnews/article/015/0005221910
2025-12-09 09:59:00,"코드비전, '인도네시아 전시회'서 AI 기반 불량 검출 시연…현지 기업 12곳과 NDA 체결","자율 AI 에이전트 전문기업 코드비전(대표 송응열)이 지난 3일부터 6일까지 인도네시아 자카르타에서 열린 ‘2025 인도네시아 산업기계 전시회(Manufacturing Indonesia 2025)’에 참가해, 현지 제조 기업 12곳과 기술 협의를 위한 기밀유지협약(NDA)을 체결했다고 9일 밝혔다.  이번 성과는 과학기술정보통신부와 정보통신산업진흥원(NIPA)이 주관하는 ‘AI반도체 응용실증 지원 사업’의 결과이다. 코드비전은 이번 전시회에서 해당 사업을 통해 구축한 국산 AI 반도체 기반 엣지(Edge) 시스템이 전기차 핵심 부품인 아우터캔(Outer Can) 제조 공정에서 불량을 실시간으로 검출하는 AI 기반 불량 검출 시연 영상을 공개했다.  인도네시아는 최근 ‘Made in Indonesia 4.0′ 정책에 따라 제조 디지털 전환 수요가 높지만, 여전히 현장에서는 육안 검사에 의존해 검사 속도 저하와 품질 편차 문제를 겪고 있다.  코드비전의 부스를 찾은 현지 제조 기업 관계자들은 시연 영상 속에서 AI가 미세한 불량(찍힘, 눌림 등)을 놓치지 않고 잡아내는 장면에 주목했다. 자신들의 공정이 겪고 있는 유사한 문제점을 코드비전의 국산 AI 반도체 기반 비전 솔루션이 해결해 줄 수 있다는 점에 공감을 표했고, 이는 12건의 NDA 체결이라는 실질적인 성과로 이어졌다.  해당 솔루션은 기존 외산 GPU(RTX 4060) 대비 데이터 처리 속도는 약 3배 빠르고, 전력 효율은 6배 이상 우수한 성능을 검증받았다. 또한, 제조 현장의 핵심 지표인 ‘불량 검출 정확도’ 99.9% 이상을 달성해 고속 공정에서도 작업자의 안전과 품질을 동시에 확보할 수 있는 기술로 평가받고 있다.  송응열 대표는 “아우터캔 실증 영상을 통해 인도네시아 현지 제조 기업들이 자사 공정의 품질 관리 이슈를 코드비전의 AI 기술과 자연스럽게 연결해 보는 모습을 확인할 수 있었다”며 “실증 성과를 바탕으로 인도네시아를 시작으로 글로벌 제조 시장으로의 진출을 본격화하겠다”고 말했다.  한편, 코드비전은 1차년도에 확보한 ‘실시간 불량 검출 기술’을 토대로, 향후 거대언어모델(LLM)을 연계해 불량 원인 분석 및 조치 가이드까지 제공하는 ‘지능형 제조 AI 통합 패키지’로 기술을 고도화할 계획이다.  한경닷컴 뉴스룸 open@hankyung.com",https://n.news.naver.com/mnews/article/015/0005221909
2025-12-09 09:59:00,"""성수동에 깃발 꽂은 메디큐브""…에이피알, 세 번째 플래그십 매장 연다","뷰티 기업 에이피알이 서울 성수동에 플래그십 매장인 ‘메디큐브 성수’를 열었다고 9일 밝혔다.  해당 지점은 홍대점과 도산점에 이어 에이피알이 세 번째로 선보이는 플래그십 매장이다. 메디큐브의 존재감을 더욱 키우기 위해 트렌드 중심지이자 외국인 필수 방문 지역인 성수동에 신규 매장을 개점했다고 회사 측은 설명했다.  성수점은 총 2층으로 조성됐으며 ‘핑크 요정’이라는 콘셉트로 기획됐다. 분홍색과 흰색, 메탈 소재 등을 결합한 인테리어로 고급스러운 분위기를 연출한 게 특징이다. 특별 전시 공간으로 꾸며진 1층에는 브랜드 인기 화장품과 메디큐브 에이지알(AGE-R) 뷰티 기기를 전시했고, 2층에는 실물 제품을 체험해볼 수 있는 공간을 마련했다.  에이피알 관계자는 “국내외 고객 모두에게 인기가 높은 성수동의 특징을 활용해 보다 많은 고객들에게 브랜드 체험 기회를 제공하고자 신규 플래그십 매장을 선보이게 됐다”며 “향후에도 더욱 밀접한 고객 소통과 긍정적 브랜드 경험 제공을 위해 노력할 것”이라고 말했다.",https://n.news.naver.com/mnews/article/015/0005221908
2025-12-09 09:57:00,"철도공단, 철도시설 성능검증으로 품질·안전성 강화","국가철도공단은 운행선을 활용한 철도시설 성능검증을 통해 시설의 성능향상과 고도화를 추진한다고 9일 밝혔다.  철도시설 성능검증은 새로 개발되거나 개량된 철도시설의 성능을 확인하고 운행선 적용 타당성을 검증하기 위한 제도다.  노반과 궤도, 전기, 신호, 통신 등 주요 분야를 대상으로 수행되고 있다.  이 제도는 2011년 2월 도입 이후 현재까지 총 58건의 성능 검증을 완료했다.  침목·체결장치 등 24건의 시설을 규격화해 설계 및 시공에 반영하는 등 철도시설 품질향상에 기여해왔다.  성능검증 절차는 업체 신청을 시작으로 분야별 전문가로 구성된 위원회를 구성해 △기술 요건 적합성 검토 △구성 요소별 단위 성능을 검증하는 조립 시험 △운행선을 테스트베드로 활용하는 현장 설치시험 등 단계별 심의를 거친다.  최종 통과한 시설에 대해 성능 검증서를 교부하는 방식으로 진행된다.  최근 철도시설의 노후화, 환경오염, 소음 등 문제 해결을 위한 철도시설 개발이 활발해지면서 목침목 대체재, 소음·진동 저감 장치 등 성능검증 수요도 꾸준히 증가하고 있다.  철도공단은 이러한 변화에 대응해 신청자가 보다 쉽게 성능검증을 신청하고 수행할 수 있도록 철도시설 성능검증 실무 매뉴얼을 마련했다.  해당 자료는 국가철도공단 누리집을 통해 확인할 수 있다.  철도공단은 내년에 철도시설 성능검증 고도화 연구용역을 발주해 단계별 심의 세부 기준을 마련하는 등 실정에 맞게 현행화할 예정이다.  이성해 국가철도공단 이사장은 “철도시설 성능검증은 검증된 성능을 바탕으로 안전하고 쾌적한 철도를 구현하는 데 중요한 역할을 하고 있다”며, “앞으로도 업체가 개발한 시설이 성능검증에 적극적으로 참여할 수 있도록 지원을 강화하겠다”고 밝혔다.  대전=임호범 기자",https://n.news.naver.com/mnews/article/015/0005221907
2025-12-09 09:54:00,"""AI로 업무 간편해져""…GS건설, 'AI 레시피' 대회 개최","GS건설이 인공지능(AI) 활용 역량을 전사적으로 강화하기 위해 'AI 레시피' 경진대회를 개최했다고 9일 밝혔다. 지난 8월 국내 건설사 최초로 OpenAI사의 기업용 AI 솔루션 'ChatGPT Enterprise' 도입 후 사내에 처음으로 활용 사례를 공유하는 자리다.  경진대회는 AI를 활용해 실제 업무 효율성 강화로 이어지는 사례를 내부적으로 공유하기 위한 취지로 마련됐다. 현업에서 총 50여개의 AI 활용 사례가 접수됐다. 이 가운데 부서별 팀장들이 활용도, 혁신성, 확장성 등을 평가해 최종 4건의 우수사례를 선발했다.  대회에서는 현장에서 문서 파일명을 정리하기 쉽게 자동으로 변환해주는 기능 등 AI를 활용해 반복 업무를 자동화하고, 데이터 분석을 효율적으로 하는 아이디어들이 직원들의 큰 반응을 얻었다. AI 레시피에 참여한 한 GS건설 직원은 ""AI를 효율적으로 업무에 활용한 사례를 서로 공유하면서, AI 활용에 대한 진입장벽이 낮아졌다""고 했다.  GS건설은 이번 경진대회를 시작으로 AI를 업무에 효율적으로 활용하는 우수사례를 지속적으로 발굴해 공유할 계획이다. 축척된 우수사례를 기반으로 AI활용 교육지원 프로그램을 강화해 직원들이 더 스마트하게 일할 수 있는 체계를 구축해 나갈 예정이다.  GS건설 관계자는 ""AI 활용은 단순한 기술 채택이 아닌, 업무혁신을 위한 전략적 선택""이라며 ""직원들이 AI를 자유롭게 활용하고, 그 경험을 서로 공유할 수 있는 문화를 적극적으로 만들어 갈 것""이라고 밝혔다.",https://n.news.naver.com/mnews/article/015/0005221906
2025-12-09 09:53:00,"성호전자, 에이디에스테크 인수에 2연속 '상한가'","성호전자가 상한가까지 치솟았다. 인공지능(AI) 데이터센터 부품 업체를 인수한다는 소식이 전해지면서다.  9일 오전 9시47분 현재 성호전자는 전일 대비 1150원(29.79%) 뛴 5010원에 거래되고 있다. 52주 최고가다. 전날에도 성호전자는 상한가에 마감했다.  데이터센터 부품 업체를 인수한다는 소식에 매수세가 몰린 것으로 풀이된다. 전날 성호전자는 에이디에스테크 지분 87.5%를 2800억원에 인수한다고 공시했다. 지난해 말 기준 성호전자 총자산 3673억원 대비 76.23%, 자기자본 1535억원 대비 182.44%에 해당하는 규모다. 인수 예정일은 내년 1월16일이다.  에이디에스테크는 광통신 관련 제품 및 시스템의 설계·개발·제조·판매업을 주요 사업으로 한다. 에이디에스테크의 주요 고객사는 엔비디아 자회사 멜라녹스인 것으로 알려졌다. 실리콘 포토닉스 기술을 보유하고 있다. 에이디에스테크는 실리콘 포토닉스는 광신호를 이용해 데이터를 전송하는 기술로, AI 데이터센터 구축에 필수적인 핵심 기술로 꼽힌다.  전날 성호전자는 타법인 증권 취득 자금을 조달하기 위해 500억원 규모 전환사채를 발행했다. 또 운영자금 100억원, 타법인 증권 취득 자금 200억원을 조달하기 위해 300억원 규모 신주인수권부사채 발행도 공시했다.",https://n.news.naver.com/mnews/article/015/0005221905
