날짜,제목,본문,링크
2025-12-04 09:18:00,"'에이프릴바이오' 52주 신고가 경신, SAFA 기술력 검증과 함께 모멘텀 가속 - 삼성증권, None","◆ 최근 애널리스트 분석의견 - SAFA 기술력 검증과 함께 모멘텀 가속 - 삼성증권, None 11월 21일 삼성증권의 서근희 애널리스트는 에이프릴바이오에 대해 ""SAFA 플랫폼 기반의 파이프라인에 대한 임상적 검증으로 플랫폼 가치 입증. 2026년에도 주요 데이터 발표 예정, 파트너사 에보뮨의 M&A 가능성까지 부각""이라고 분석하며, 투자의견 'None'를 제시했다  한경로보뉴스  이 기사는 한국경제신문과 금융 AI 전문기업 씽크풀이 공동 개발한 기사 자동생성 알고리즘에 의해 실시간으로 작성된 것입니다.",https://n.news.naver.com/mnews/article/015/0005219986
2025-12-04 09:18:00,"마이크론, '소비자 메모리' 사업 철수…""AI 메모리에 올인""","미국 메모리반도체 기업 마이크론이 PC·노트북용 D램과 낸드플래시, 개인용 솔리드스테이트드라이브(SSD) 등 '소비자 메모리' 사업에서 철수한다. 소비자용 사업을 시작한 지 29년 만이다. AI용 메모리에 주력하기 위한 목적이다.  마이크론은 3일 ""소비자용 메모리사업을 중단한다""고 발표했다. 이에 따라 마이크론의 소비자용브랜드 '크루셜'을 붙인 메모리 생산은 내년 2월까지만 진행된다. 기존 제품의 보증은 유지된다. 인력은 내부 직무 재배치를 통해 충격을 최소화한다는 계획이다.  마이크론은 대신 고대역폭메모리(HBM) 등 AI용 메모리반도체 생산에 집중한다. 수빗 사다나 마이크론 최고비즈니스책임자(CBO)는 ""AI가 이끄는 데이터센터 성장 때문에 메모리·스토리지 수요가 급증했다""면서 ""더 빠르게 성장하는 전략 고객을 지원하기 위해 소비자용 크루셜 사업을 접기로 했다""고 설명했다.  마이크론의 소비자용 철수는 한정된 생산 능력을 수익성이 높은 HBM 등 AI 데이테센터용에 배정해 매출을 극대화하기 위한 목적으로 분석된다. 삼성전자 등 한국 기업도 최근 빅테크 등의 주문에 대응하느라 소비자용 제품 공급에 소극적인 것으로 알려졌다.  대만 메모리 제품 모듈 업체 트랜센드는 지난 2일 “한국 삼성전자와 미국 샌디스크에서 낸드플래시를 납품받지 못해 지난 한 주에만 제조 비용이 50~100% 급증했다”고 고객사들에 밝혔다. 업계에선 인공지능(AI) 산업발 메모리 공급 부족 현상이 심화하고 있다는 신호로 해석했다.  트랜센드는 삼성전자 등에서 반도체를 공급받아 SD카드, 플래시드라이브 등 저장 장치를 제조하는 기업이다. 트랜센드는 “4분기 하이퍼스케일러(대형 클라우드 업체) 수요가 늘어나자 메모리 제조사들이 이들 고객에게 납품하는 데 집중하고 있다”며 “이에 따라 가격이 오르고 물량을 할당받기 어려워졌다”고 전했다.",https://n.news.naver.com/mnews/article/015/0005219985
2025-12-04 09:18:00,"쿠팡 '개인정보 유출' 폭탄, 관세청도 덮쳤다…통관번호 대란","3370만건의 개인정보가 쿠팡에서 유출되면서 전자 금융 사기(피싱)와 문자 결제 사기(스미싱) 등 2차 피해에 대한 우려는 점차 커지는 가운데 관세청 통관번호 재발급에 이용자들이 몰리면서 '먹통' 사태까지 벌어지고 있다.  4일 업계에 따르면 최근 쿠팡에서 제기된 개인정보 유출 우려 이후 통관번호 변경 요청이 폭주하면서 관세청 시스템 접속 장애가 반복됐다. 연중 최대 직구 성수기인 '블랙프라이데이'(블프) 시즌을 앞두고 불안감이 커지면서 소비자 문의도 늘어나고 있다.  관세청은 전자통관시스템(유니패스) 홈페이지 먹통에 ""현재 유니패스 이용량 증가 및 서버 처리 지연으로 일부 서비스 이용이 원활하지 않을 수 있다""며 ""서비스는 안정화 작업 진행 중""이라고 안내했다.  유니패스 홈페이지가 먹통이 된 것은 개인통관고유부호를 재발급하려는 이들이 몰렸기 때문이다. 개인통관고유부호는 관세청에서 해외 직구 시 주민등록번호 대신 사용할 수 있도록 발급하는 12자리 식별 번호다. 이 번호와 기존 노출된 개인정보까지 포함하면 스미싱 등에 무단 노출되고 최악의 경우 밀수품 수입에 개인 명의가 도용될 수 있다는 우려도 나온다.  더불어민주당 정일영 의원실 자료에 따르면 개인통관고유부호 재발급 건수는 지난달 30일 12만3302건, 이달 1일 29만8742건이다. 이틀간 재발급 건수가 올해 1~10월 재발급 건수(11만1045건)의 4배에 달한다.  일각에서는 쿠팡의 미온적인 태도가 불안감을 부추긴다는 지적도 나온다. 이름과 주소, 전화번호에 공동 현관 비밀번호까지 유출된 상황에서 쿠팡이 조사가 진행 중이라는 등의 이유로 대책 마련에 대한 언급이 나오지 않는 가운데, 온라인에서는 비정상 로그인 시도와 해외 결제 승인 알림이 이어졌다는 제보가 잇따르고, 탈퇴·집단 소송 움직임까지 가시화하고 있다.  특히 쿠팡 계정에 신용카드 등 결제 수단을 연동해 둔 경우가 많다. 신용카드를 분실한 적이 없고 쿠팡 사태를 제외하면 결제 정보가 유출될 이유가 없는데, 해외 승인 시도가 여러 건 있었다는 게시글도 이어졌다. 이 밖에 쿠팡을 사칭한 스미싱 문자가 잇따르고 스팸 전화가 하루에 여러 건 오고 있다고 소비자들은 피해를 호소한다.  개인통관번호는 쿠팡의 '로켓 직구'를 이용하기 위해 입력해 둔 경우가 많다. 이번 개인 정보 유출로 쿠팡에 입력해 둔 개인통관번호가 유출됐을 가능성이 제기됐고, 물건을 받지 않은 상태에서 개인통관번호를 변경해 혼란이 더욱 커지고 있다는 지적도 나온다.  관세청에 따르면 해외 직구 배송 중 통관번호가 변경될 경우 세관 신고 정보 불일치로 통관 지연이나 오류가 발생할 수 있다. 잘못된 번호로 신고가 접수된 경우 관세청이 해당 업체에 정정 요청을 보내고, 소비자는 새 번호를 다시 제출해야 정상 통관이 가능하다.  다만 쿠팡은 개인통관번호는 유출되지 않았다는 입장을 견지 중이다. 그렇지만 조사가 진행 중이어서 단정할 수 없다는 신중론도 나온다.  이날 열린 국회 과방위 쿠팡 현안 질의에 참석한 김승주 고려대 정보보호대학원 교수는 ""피해가 확산할 수 있어 쿠팡에 결제용 카드를 등록했다면 삭제해야 하고 해당 (신용·체크) 카드 비밀번호를 바꿀 수 있다면 바꾸는 게 좋다""면서 ""로그인 비밀번호도 바꾸면 좋다""고 조언했다.  다만 해당 권고에 박대준 쿠팡 대표는 ""(김 교수가 말한) 정보가 노출됐다고 확인된 바는 아직 없고 너무 과잉해서 안내할 경우 불안감을 조성하게 된다""며 사실상 거절했다.",https://n.news.naver.com/mnews/article/015/0005219984
2025-12-04 09:17:00,"'현대위아' 52주 신고가 경신, 전일 기관 대량 순매수","◆ 주체별 매매동향 - 전일 기관 대량 순매수 지난 한달을 기준으로 보면 외국인이 2.4만주를 순매수했고, 기관도 45.1만주를 순매수했다. 반면 개인들은 45.7만주를 순매도한 것으로 나타났다. 같은 기간 이 종목의 거래비중은 외국인과 개인이 각각 33.0%, 43.8%로 비중이 높다. 더욱이 전일 기관이 대량 순매수를 하고 있어 투자자들의 관심이 집중되고 있다.  [그래프]현대위아 외국인/기관 매매동향   ◆ 최근 애널리스트 분석의견 - 3Q Review: 이제는 성장의 시간 - 교보증권, BUY 11월 20일 교보증권의 김광식 애널리스트는 현대위아에 대해 ""3분기 실적 매출액 2.2조원(+7.2% YoY), 영업이익 518억원(+1.2% YoY, OPM 2.5%)으로 컨센서스(매출액 2.1조원, 영업이익 416억원) 대비 상회. 멕시코 엔진 단산 영향에도 불구하고, 해당 요인 제외한 모든 법인/부문 외형 증가로 인해서 레버리지 및 믹스 효과 기인한 서프라이즈 실현. 4분기 실적은 매출액 2.1조원(+5.2% YoY), 영업이익 531억원(-2.9% YoY, 2.6% OPM)으로 QoQ 수익성 개선 추세 예상. 외형은 영업일수 감소, 솔루션 납기 일정 공백이 부정적 요인이나, 4Q24부터 본격화된 멕시코 엔진 물량 감소 영향이 기저효과로 반영되어 YoY 성장 추정. 수익성도 믹스/레버리지 효과 및 일회성 비용 제거로 QoQ 개선 예상. 차년도 부터 HEV 확장 수혜 지속 및 공조 ITEM 확장으로 본격적인 회복기 진입 전망. 안정적 순이익 기록했던 `16년도 이전 시점의 P/E 적용하여, 목표주가 66,000원으로 상향 조정.""이라고 분석하며, 투자의견 'BUY', 목표주가 '66,000원'을 제시했다.  한경로보뉴스  이 기사는 한국경제신문과 금융 AI 전문기업 씽크풀이 공동 개발한 기사 자동생성 알고리즘에 의해 실시간으로 작성된 것입니다.",https://n.news.naver.com/mnews/article/015/0005219983
2025-12-04 09:17:00,"'현대엘리베이터' 52주 신고가 경신, 전일 기관 대량 순매수","◆ 주체별 매매동향 - 전일 기관 대량 순매수 지난 한달을 기준으로 보면 기관이 146.9만주를 순매수한 반면, 외국인은 129.0만주를 순매도했고, 개인들도 24.5만주를 순매도했다. 같은 기간 이 종목의 거래 비중은 외국인과 개인이 각각 45.1%, 28.3%로 비중이 높다. 더욱이 전일 기관이 대량 순매수를 하고 있어 투자자들의 관심이 집중되고 있다.  [그래프]현대엘리베이터 외국인/기관 매매동향   ◆ 최근 애널리스트 분석의견 - 대규모 배당 지속될 전망 - DS투자증권, BUY 12월 03일 DS투자증권의 김수현 애널리스트는 현대엘리베이터에 대해 ""내년 2월말 기준 주당 최소 12,000원 배당 전망: 동사는 주주가치 제고 정책의 일환으로 자본 준비금 3,072억원을 전액 감액하고 이익 잉여금으로 전입했으며 이를 전부 25년 결산 배당 재원에 포함한다고 밝혔 다. 여기에 추가로 23년 발표한 ‘주주환원 정책’에 따라 당기 순이익의 50% 이상을 경상 배당 재원으로 활용한다는 방침이다. 25년 예상 당기 순이익은 1,735 억원이며 이 중 50% 이상이 배당에 활용된다. 여기에 최근 보유 자산 매각(빌딩 일부 및 무벡스 지분 매각 735억원 등) 과정에서 발생한 이익에 대해서는 최대 100% 배당할 계획이다. 추가로 11월 30일 기준일로 주당 1,000원의 3분기 결산 배당을 지급한다. 이를 합치면 최소 총 주당 12,000~14,000원의 배당이 지급될 전망이다. 전일 종가 기준 배당 수익률은 13.7~16%에 달한다.""이라고 분석하며, 투자의견 'BUY', 목표주가 '110,000원'을 제시했다.  한경로보뉴스  이 기사는 한국경제신문과 금융 AI 전문기업 씽크풀이 공동 개발한 기사 자동생성 알고리즘에 의해 실시간으로 작성된 것입니다.",https://n.news.naver.com/mnews/article/015/0005219982
2025-12-04 09:16:00,"'금호타이어' 52주 신고가 경신, 전일 기관 대량 순매수","◆ 주체별 매매동향 - 전일 기관 대량 순매수 지난 한달을 기준으로 보면 외국인이 626.1만주를 순매수한 반면, 기관은 26.5만주를 순매도했고, 개인들도 603.0만주를 순매도한 것으로 집계됐다. 같은 기간 이 종목의 거래비중은 외국인과 개인이 각각 40.2%, 44.1%로 비중이 높다. 더욱이 전일 기관이 대량 순매수를 하고 있어 투자자들의 관심이 집중되고 있다.  [그래프]금호타이어 외국인/기관 매매동향   ◆ 최근 애널리스트 분석의견 - 유럽 공장 신설로 저변 확대 본격화 - DS투자증권, BUY 12월 02일 DS투자증권의 최태용 애널리스트는 금호타이어에 대해 ""유럽 폴란드에 600만본 규모 PCR/LTR 생산 공장 신설 발표. 유럽 저변 확대 기회로 작용, 물량 확대와 믹스 개선으로 연결될 전망. 현금흐름 감안 시 충분한 자금 여력, 향후 밸류에이션 확대 기대: 폴란드공장과 함평공장을 합산한 신공장 투자소요는 총 1.5조원으로 자금 여력은 충분하다는 판단이다. 3개년(25~27년) 간 영업으로부터 창출되는 현금흐름과 보험금 5,000억원, 기존 현금성 자산 등을 감안 시 추가적인 자금 조달 필요성은 낮다. 만약 영업 환경의 변화 등으로 자금이 부족해지더라도 광주 공장 매각 등의 Plan B도 있다. 따라서 리스크보다는 상방에 주목이 필요하다. 유럽 자동차 업황의 턴어라운드가 가시화되고 있는 시점에 적기인 투자다. 향후 유럽 시장의 부활과 함께 밸류에이션 Re-rating을 기대한다.""이라고 분석하며, 투자의견 'BUY', 목표주가 '7,000원'을 제시했다.  한경로보뉴스  이 기사는 한국경제신문과 금융 AI 전문기업 씽크풀이 공동 개발한 기사 자동생성 알고리즘에 의해 실시간으로 작성된 것입니다.",https://n.news.naver.com/mnews/article/015/0005219981
2025-12-04 09:16:00,"'KPX홀딩스' 52주 신고가 경신, 기관 4일 연속 순매수(610주)","◆ 주체별 매매동향 - 기관 4일 연속 순매수(610주) 지난 한달을 기준으로 보면 외국인이 7,884주를 순매수한 반면, 기관은 1,078주를 순매도했고, 개인들도 9,474주를 순매도한 것으로 집계됐다. 같은 기간 이 종목의 거래비중은 외국인과 개인이 각각 21.8%, 62.9%로 비중이 높다. 한편 기관은 이 종목에 대해서 최근 4일 연속 610주 순매수를 하고 있다.  [그래프]KPX홀딩스 외국인/기관 매매동향   한경로보뉴스  이 기사는 한국경제신문과 금융 AI 전문기업 씽크풀이 공동 개발한 기사 자동생성 알고리즘에 의해 실시간으로 작성된 것입니다.",https://n.news.naver.com/mnews/article/015/0005219980
2025-12-04 09:16:00,"'와이투솔루션' 52주 신고가 경신, 전일 외국인 대량 순매수","◆ 주체별 매매동향 - 전일 외국인 대량 순매수 지난 한달을 기준으로 보면 외국인이 90.0만주를 순매수한 반면, 기관은 771주를 순매도했고, 개인들도 77.0만주를 순매도한 것으로 집계됐다. 같은 기간 이 종목의 거래비중은 외국인과 개인이 각각 24.9%, 72.4%로 비중이 높다. 한편 외국인은 이 종목에 대해서 최근 7일 연속 81.3만주 순매수를 하고 있다. 더욱이 전일 외국인이 대량 순매수를 하고 있어 투자자들의 관심이 집중되고 있다.  [그래프]와이투솔루션 외국인/기관 매매동향   한경로보뉴스  이 기사는 한국경제신문과 금융 AI 전문기업 씽크풀이 공동 개발한 기사 자동생성 알고리즘에 의해 실시간으로 작성된 것입니다.",https://n.news.naver.com/mnews/article/015/0005219979
2025-12-04 09:16:00,'의왕시청역SK뷰아이파크' 1순위 청약 마감…평균 경쟁률 4.53대 1,"SK에코플랜트와 HDC현대산업개발이 경기 의왕시 고천동에 선보인 '의왕시청역SK뷰아이파크'가 평균 4.53대 1의 경쟁률로 1순위 청약을 마감했다.  4일 한국부동산원 청약홈에 따르면 의왕시청역SK뷰아이파크는 450가구(특별공급 제외) 모집에 총 2038건의 청약접수가 몰리며 1순위 쳥균 4.53대 1의 경쟁률을 기록했다. 전용 84㎡A 타입이 14.53대 1로 가장 높은 경쟁률을 썼다.  의왕시청역SK뷰아이파크는 의왕시 고천동 265번지 일원에 위치하며, 지하 3층~지상 최고 40층 11개 동, 전용 39㎡·46㎡·51㎡·59㎡·74㎡·84㎡·100㎡ 총 1912가구 규모로 조성된다. 이 가운데 일반분양 물량은 전용 46㎡·51㎡·59㎡·74㎡·84㎡ 958가구다.  의왕시 고천동 일대는 다수의 주택재개발 정비사업과 의왕고천 공공주택지구 등을 통해 대단지 아파트 밀집 지역으로 거듭나고 있다. 현재는 비역세권이지만 입주 시점에는 '인덕원~동탄 복선전철 의왕시청역(계획)'이 단지 앞에 있는 초역세권 아파트로 거듭날 것으로 예상된다.  분양 관계자는 ""현재보다 미래가 더 기대되는 입지 조건과 함께 인동선 등 교통 호재까지 예고돼 있다는 점에서 높은 주거 가치를 평가받은 것으로 보인다""며 ""초, 중, 고 모든 학군이 도보권이고 다수의 공원이 가까이 있어 쾌적한 주거환경을 기대할 수 있다는 점도 청약 흥행에 한몫했다""고 말했다.  의왕시청역SK뷰아이파크는 오는 10일 당첨자를 발표하고 22일부터 25일까지 4일간 정당계약을 실시한다. 입주는 2030년 1월로 예정됐다.",https://n.news.naver.com/mnews/article/015/0005219978
2025-12-04 09:16:00,"[분석+]안트로젠 ""줄기세포치료제 日 허가 9부 능선 넘었다""…생산시설 실사 남아","안트로젠이 수포성 표피박리증 치료제(ALLO-ASC-EB) 일본 허가를 위한 9부 능선을 넘었다. 마지막 단계로 알려진 생산시설 실사 절차만 남겨도면서다. 허가 가능성에 대한 관심이 커지면서 이 회사 주가는 최근 4거래일(11월 28일~12월 3일) 동안 30% 넘게 급등했다.  안트로젠은 ""이달 중으로 일본 의약품의료기기종합기구(PMDA)의 제조시설 실사가 있을 예정""이라고 3일 밝혔다. 실사가 마무리되면 심사는 사실상 마지막 단계에 들어선다는 게 업체 측의 설명이다.  김미형 안트로젠 대표는 “PMDA에서 요구하는 보완 작업도 모두 완료된 것으로 안다”며 “허가까지 9부 능선을 넘은 셈”이라고 설명했다.  안트로젠으로부터 수포성 표피박리증 치료제 후보물질을 기술도입한 일본 파트너사 이신제약은 지난 7월 임상 3상 결과가 담긴 약 1만쪽 분량 보고서를 PMDA에 제출했다.  ALLO-ASC-EB는 염증 완화 및 피부 재생 효능이 있는 지방유래 중간엽줄기세포를 주원료로 하는 세포치료제다. PMDA는 희소유전질환인 수포성 표피박리증 환자들의 의료적 미충족수요가 크다는 판단에서 이 약을 희소의약품으로 지정했다. 이에 따라 PMDA는 통상 9개월 안에 승인 가부를 발표해야 한다.  이신제약이 지난 7월에 신약허가를 신청했기 때문에 PMDA는 늦어도 내년 3월께엔 결과를 공지해야 한다. 업계는 이르면 내년 1~2월 중에도 결과가 나올 것으로 보고 있다.  수포성 표피박리증은 피부에서 콜라겐을 만드는 유전자에 돌연변이가 생겨 발생하는 희소 유전질환이다. 서로 잘 붙어 있어야 할 피부 표피와 진피층이 떨어져 전신에 물집이 생긴다.  ALLO-ASC-EB가 일본 허가당국의 승인을 받으면 안트로젠이 생산해 이신제약에 공급할 예정이다. 김 대표는 “판매 로열티와 별개로 높은 마진율을 기대하고 있다”고 했다.  일본 수포성 표피박리증 환자 수는 1000여명 정도로 추산된다. 업계에서는 안트로젠이 이신제약에 연간 2000억원어치 세포치료제를 수출할 수 있다는 전망도 나온다.  **이 기사는 한경닷컴 바이오 전문채널 <한경바이오인사이트>에 2025년 12월 3일 17시 24분 게재됐습니다.",https://n.news.naver.com/mnews/article/015/0005219977
2025-12-04 09:16:00,"엑스퍼트컨설팅 일경험 프로젝트형 참여 청년, '2025년 미래내일 일경험 우수사례 공모전' 장려상 수상","엑스퍼트컨설팅이 운영한 ‘디지털 트윈 기반 스마트 정량 디스펜싱 장치 제어 시스템 개발(대한전열)’ 프로젝트 참여 청년이 지난달 24일 고용노동부 주관 ‘내일을 여는 청년의 날’ 행사에서 ‘미래내일 일경험 우수사례 공모전’ 우수 프로젝트 부문 장려상을 수상했다고 4일 밝혔다.  이번 프로젝트는 디지털 트윈을 활용해 스마트 정량 디스펜싱 장치의 제어 시스템을 설계·개발하는 것을 목표로 총 8주간 진행됐다. 참여 청년들은 설계–제어–시뮬레이션–검증에 이르는 전 과정을 단계적으로 경험하며 산업 현장과 유사한 실무형 프로젝트를 수행했다.  참여 청년들은 전 과정을 실무 중심으로 경험했다. 또한, 대한전열 및 관련 기업 견학을 통해 산업 현장의 실제 공정과 장비를 이해하고, NX 기반 모델링, 아두이노 제어 로직 구현, 디지털 트윈 연동 시뮬레이션 등 기술 실습을 수행하며 현업에 가까운 업무 흐름을 체득했다.  멘토단은 “참여 학생들이 난이도 높은 디지털 트윈–실제 제어 시스템 연동 과제를 스스로 분석하며 해결해 나가는 과정에서 큰 성장을 보였다”며 “이번 경험은 산업 현장에 즉시 투입 가능한 실무 역량을 갖추는 데 중요한 밑거름이 될 것”이라고 평가했다.  엑스퍼트컨설팅은 2025년 미래내일 일경험 프로젝트형 운영기관으로서, 구직 청년들이 보다 실질적인 역량을 쌓고 안정적으로 일자리와 연결될 수 있도록 프로그램 영역을 확대하고, 다양한 기관·기업과의 연계를 강화해 지속적으로 지원할 계획이다.  한경닷컴 뉴스룸 open@hankyung.com",https://n.news.naver.com/mnews/article/015/0005219976
2025-12-04 09:15:00,"'현대모비스' 52주 신고가 경신, 전일 외국인 대량 순매수","◆ 주체별 매매동향 - 전일 외국인 대량 순매수 지난 한달을 기준으로 보면 외국인이 56.8만주를 순매수한 반면, 기관은 5.6만주를 순매도했고, 개인들도 50.2만주를 순매도한 것으로 집계됐다. 같은 기간 이 종목의 거래 비중은 외국인과 기관이 각각 51.1%, 26.8%로 비중이 높다. 한편 외국인과 기관은 이 종목에 대해서 각각 최근 8일, 5일 연속 사자 행진을 벌이고 있다. 더욱이 전일 외국인이 대량 순매수를 하고 있어 투자자들의 관심이 집중되고 있다.  [그래프]현대모비스 외국인/기관 매매동향   ◆ 최근 애널리스트 분석의견 - 본업 반등과 신사업까지 시간을 벌어줄 AS - iM증권, BUY(신규) 11월 25일 iM증권의 이상수 애널리스트는 현대모비스에 대해 ""2026년 매출액 69.5조원 (+11.6% YoY) 영업이익 3.7조원 (+14.7% YoY)을 전망하며 근거는 아래와 같다. 매출액의 경우 1) 현대차그룹의 미국 생산 확대, 2) 글로벌 OEM향 수주 등에 근거한다. 영업이익의 경우 1) 낮아진 관세 부담, (2) 우호적인 환율에 따른 AS 사업부 기여도 증가 등에 따른다. 투자포인트 (1) 완성차 생산 물량 확대, 전동화 부문 외형 성장. (2) AS 사업부의 높은 이익 기여도는 계속될 것. (3) SDV 상용화를 기점으로 핵심부품 수주 시작. (4) Boston Dynamics에 들어가는 액츄에이터를 설계""라고 분석하며, 투자의견 'BUY(신규)', 목표주가 '370,000원'을 제시했다.  한경로보뉴스  이 기사는 한국경제신문과 금융 AI 전문기업 씽크풀이 공동 개발한 기사 자동생성 알고리즘에 의해 실시간으로 작성된 것입니다.",https://n.news.naver.com/mnews/article/015/0005219975
2025-12-04 09:15:00,"'SJG세종' 52주 신고가 경신, 3Q25 Review: 성장세 지속 vs. 저평가","◆ 최근 애널리스트 분석의견 - 3Q25 Review: 성장세 지속 vs. 저평가 11월 20일 유진투자증권의 박종선 애널리스트는 SJG세종에 대해 ""3Q25 Review: 전년동기 대비 매출성장세 지속, 하이브리드카 등 제품 믹스로 수익성 큰 폭 개선도 긍정적임. 매출액 4,688억원, 영업이익 247억원으로 전년동기 대비 매출액은 6.6% 소폭 증가하였으나, 영업이익은 79.3% 큰 폭으로 증가하였음. 당사 추정치 대비 매출액은 유사한 수준이었으나, 영업이익은 크게 상회하였음. 4Q25 Preview: 배기계 사업의 안정적인 실적 성장과 함께 수소차, 전기차 등 사업다각화 확대도 긍정적. 매출액 4,653억원, 영업이익 176억원으로 전년동기 대비 각각 3.2%, 146.6% 증가하면서 성장세 유지 예상함. 현재주가는 2025년 실적 기준 PER 2.8배로, 국내 유사업체 평균 PER 6.7배 대비 큰 폭 할인되어 거래 중임."" 이라고 분석했다.  한경로보뉴스  이 기사는 한국경제신문과 금융 AI 전문기업 씽크풀이 공동 개발한 기사 자동생성 알고리즘에 의해 실시간으로 작성된 것입니다.",https://n.news.naver.com/mnews/article/015/0005219974
