날짜,제목,본문,링크
2025-12-14 18:29:00,부울경 광역철도에 국민성장펀드 투입,"정부가 국민성장펀드를 부산울산경남 광역철도 등 지역 교통 인프라에 투입한다. 국민성장펀드의 핵심 투자 방향 중 하나로 '지역균형발전을 위한 지역프로젝트'를 꼽은 만큼 지역 핵심 인프라에도 속도감 있게 투자할 전망이다.  14일 정부 및 금융권에 따르면 정부는 국민성장펀드를 부울경 광역철도(부산~양산~울산) 등에 지원하는 것을 검토하고 있다. 부울경 메가시티의 핵심 기반이 될 광역철도에 국민성장펀드를 투입해 지역균형성장을 뒷받침한다는 구상이다.  앞서 금융위원회는 150조원의 국민성장펀드 가운데 40% 이상(약 60조원)을 지역에 분배하겠다는 청사진을 그렸다. 5극(수도권·중부권·대경권·호남권·동남권) 3특(제주·전북·강원)을 고려한 지역별 할당을 통해 지역에 20년 성장엔진을 마련할 계획이다. 부울경 광역철도는 이재명 대통령의 공약인 '5극 3특 균형발전'의 상징적 사업이다. 수도권 일극 체제를 넘어서 생활권과 경제권을 지역별로 연결하는 초광역권 체제를 구축하는 것이 목표다. 지난 7월 예비타당성 조사를 통과하며 본격적으로 닻을 올렸다.  이억원 금융위원장은 지난달 한국형 생산적 금융 모델로 '스위스 융프라우 철도'를 꼽은 바 있다. 정책금융이 마중물 역할을 해 생산적 금융으로의 대전환을 추진하는 과정에서 융프라우 철도의 성공 사례를 참조하겠다는 의미다. 금융이 뒷받침된 융프라우 철도가 스위스의 관광 수요를 창출하며 지역경제의 자생력을 키웠다면, 부울경 광역철도 역시 초광역경제권 구축을 견인하는 핵심 인프라라는 점에서 국민성장펀드의 투자철학과 맞닿아 있다는 분석이다.  지역의 신성장을 이끄는 기업도시나 창업도시 프로젝트도 투자 테이블에 올라갈 전망이다. 경남 거제 '기업혁신파크', 전남 해남·영암 기업도시 '솔라시도' 등이 대표적이다. 특히 솔라시도에 추진 중인 국가AI컴퓨팅센터는 1호 투자처 후보군으로 유력하게 거론되고 있다.  부울경 광역철도 등 교통 인프라 지원은 중·장기적 관점에서 논의될 것으로 보인다. 금융위원회는 초기 투자대상을 인공지능(AI), 반도체, 모빌리티 등 국가 경쟁력을 높이는 첨단전략산업 및 생태계, 이와 관련된 데이터센터, 전력망, 발전 등 인프라 중심으로 잡고 있다. SK하이닉스가 조성 중인 경기 용인 반도체 클러스터, 삼성전자의 경기 평택 5공장(P5) 등이 유력 후보지로 거론된다.  자금은 직접투자와 간접투자, 인프라 투·융자, 초저금리 대출 등의 방식으로 내년 초부터 집행될 예정이다. 산업·금융계 전문가로 꾸려진 '투자심의위원회'가 1차 심사를 하고, 각계에서 추천한 전문가 9인으로 구성된 '기금운용심의회'가 최종 결정을 내리는 구조다.",https://n.news.naver.com/mnews/article/014/0005448641
2025-12-14 18:29:00,공급망 리스크에도… 韓 ‘유턴기업’ 11곳뿐 [국내 복귀 꺼리는 기업],"【파이낸셜뉴스 서울·뉴욕·도쿄=박지영 기자 이병철 서혜진 특파원】 글로벌 공급망 재편이 가속화되는 가운데 한국의 유턴기업은 오히려 감소하는 흐름을 보이고 있다. 대미 관세 리스크로 해외 생산기지 재편을 검토하는 기업은 늘고 있지만, 국내 복귀로 이어지지 않으면서 국내 제조 공급망이 약화될 수 있다는 우려가 커지고 있다. 반면 미국과 일본은 적극적인 정책 지원을 바탕으로 유턴기업이 증가하는 흐름을 보이고 있다.  14일 산업통상부와 코트라에 따르면 올해 3·4분기까지 국내 유턴기업으로 선정된 기업은 11곳에 불과한 것으로 집계됐다. 지난해 유턴기업이 20곳이었던 점을 감안하면, 올해는 전년 대비 감소가 불가피한 상황이다. 지난 2021년 25곳이었던 유턴기업 선정 수는 이후 몇 년째 감소세가 이어지고 있다.  더 큰 문제는 국내 복귀를 선언했던 유턴기업이 실제 투자를 이행하지 못하거나 폐업해 지원 신청이 취소된 사례가 올해 역대 최대치를 기록했다는 점이다. 올해 3·4분기 기준 유턴기업 선정이 취소된 기업은 모두 14곳으로, 매년 한자릿수에 머물던 취소 건수가 처음으로 두자릿수를 기록했다. 취소된 기업들의 투자계획 규모는 965억5000만원, 고용계획은 654명으로 제도 도입 이후 최대 규모다.  공급망 리스크 대응 차원에서 국내 복귀 필요성은 인식하면서도 실행 단계에서는 발길을 돌리는 사례가 늘고 있는 셈이다. 미국의 관세정책 강화와 지정학적 갈등 심화로 기업들의 글로벌 생산전략은 빠르게 재편되고 있지만, 이러한 움직임이 한국으로의 생산기지 복귀로 이어지지는 않고 있다. 업계에서는 국내 인건비 부담과 규제, 투자여건 등을 이유로 ""해외 생산기지를 조정하더라도 국내 복귀는 쉽지 않다""는 반응이 나온다.  반면 미국과 일본은 리쇼어링을 통해 자국 중심 공급망을 강화하고 있다. 미국 상무부와 리쇼어링 이니셔티브 자료를 토대로 비주얼 캐피털리스트가 정리한 통계에 따르면 미국의 리쇼어링 총액은 2023년 9330억달러에서 지난해 말 1조7000억달러로 급증했다.  일본 역시 정책 방향을 조정하며 기업의 국내 복귀를 유도하고 있다. 글로벌 금융위기 이전 연간 470여개 기업이 리쇼어링을 결정했던 일본은 금융위기 이후 연 600~700개 기업으로 규모를 키웠다. 코로나19 이후에는 단기 보조금 중심 정책의 한계를 인식하고 세액공제 중심 구조로 빠르게 전환하며 기업의 장기투자를 유도하고 있다.  전문가들은 유턴기업 유치가 단순한 기업 지원정책을 넘어 국가 차원의 공급망 안정성과 직결된 사안이라고 지적한다. 글로벌 통상 환경이 관세·안보 중심으로 재편되는 상황에서 국내 생산기반이 약화될 경우 향후 관세충격이나 수출규제 발생 시 대응여력이 크게 떨어질 수 있다는 것이다. 특히 핵심 부품·소재와 전략산업의 국내 생산비중이 낮아질수록 공급망 리스크는 구조적으로 확대될 수밖에 없다는 분석이다.",https://n.news.naver.com/mnews/article/014/0005448640
2025-12-14 18:29:00,"[단독] 여야 정쟁에 입법 과잉… 의뢰 2만건, 통과는 348건","22대 국회 개원 약 1년6개월 만에 국회 사무처 법제실에 2만건 넘는 법안 의뢰가 접수된 것으로 확인됐다. 20·21대 국회에 비해 압도적인 수치로 법안이 쏟아지고 있는 것이다. 정책보다는 '정쟁'에 치우친 입법도 잇따르면서 22대 국회가 '입법 과잉' 국회로 전락했다는 지적이 나온다.  14일 파이낸셜뉴스가 입수한 자료에 따르면 22대 국회가 개원한 지난해 5월 30일부터 올해 11월 19일까지 국회 사무처 법제실에 2만931건의 법안 의뢰가 접수됐다. 법제실은 국회의원의 정책 아이디어를 법률안 형태로 입안하는 역할을 맡고 있다.  22대 국회가 개원한 지 1년6개월이 채 지나지 않은 시점에서 2만931건 접수는 지난 20·21대 국회보다 속도가 빠르다. 20대 국회에서는 4년간 4만3135건, 21대 국회에서는 4만4122건의 입안 의뢰가 접수됐다. 22대 국회가 절반도 지나지 않았다는 점을 감안하면, 이번 국회에서 최대치를 경신할 것으로 전망된다.  현 국회에서는 매달 평균 1100건이 넘는 입안 의뢰가 들어오고 있는 것으로 확인됐다. 22대 국회 개원 첫 달인 2024년 5월과 국정감사 및 예산안 심의가 있는 2024·2025년 10·11월, 대선이 치러졌던 2025년 5월을 제외하면 매달 1000건을 넘었다.  이 중 실제로 같은 기간 법률안으로 발의된 건수는 1만3197건이다. 20대 국회에서는 8984건, 21대 국회에서는 1만2196건으로 역시 매년 증가하는 추세다. 이 중 여야가 진영싸움을 하기 위한 법안도 적지 않다.  반면 이 가운데 실제로 22대 국회 본회의를 통과한 법안은 매우 적다. 지난 11월 19일까지 본회의 문턱을 넘은 의원 법률안은 단 348건이다. 대안이 반영돼 폐기된 법안이 1642건이라는 점을 감안하면, 1990건만이 실제 정책으로 실현됐다. 이를 고려하면 단순계산으로는 법제실에 의뢰된 정책 아이디어가 본회의에서 통과된 사례는 단 9.5%에 불과하다.  입법 남발의 원인으로는 법안 발의 수를 기준으로 한 의정활동 평가와 정치 양극화가 지목된다.  또 법안을 발의하고 지지층에 홍보활동만 한 뒤 책임 있는 논의를 하지 않는다는 비판도 나온다.",https://n.news.naver.com/mnews/article/014/0005448639
2025-12-14 18:27:00,대한민국 슈퍼리치는 몇명... 금융자산 10억 이상 47만6천명,"우리나라 부자(富者) 수가 지난 15년 동안 매년 10%가량 늘어 47만명을 넘어선 것으로 나타났다. 이들이 보유한 전체 금융자산 규모는 올해 처음 3000조원을 돌파했다. 단기와 중·장기를 가리지 않고 이들은 유망 투자처로 '주식'을 첫손가락에 꼽았다.  KB금융그룹은 14일 한국 부자의 투자 행태와 향후 전략을 정리한 '2025 한국 부자 보고서'를 발간했다.  ■15년 새 3배 늘어난 '부자'  보고서에 따르면 지난해 말 기준 금융자산 10억원 이상을 보유한 '부자'는 47만6000명으로, 전체 인구의 0.92%를 기록했다. 부자 수는 전년 대비 3.2% 늘었으며, 조사가 시작된 2011년(13만명)과 비교하면 3배 이상 증가했다. 연평균 증가율은 9.7%로, 같은 기간 전체 인구 증가율(연평균 0.5%)을 크게 웃돌았다.  이들 부자가 보유한 총금융자산은 3066조원으로 1년 새 8.5% 증가했다. 2011년 1158조원이었다는 점을 감안하면 15년 동안 연평균 7.2%가 늘어난 셈이다. 보고서는 코로나19 이후 유동성 확대와 주식시장 급등이 부의 축적을 가속화한 핵심 요인이라고 분석했다.  부자들 내부의 자산 양극화도 뚜렷해지고 있다. 2020년 이후 총금융자산 증가율을 보면 자산가와 고자산가는 각각 연평균 6.2%, 4.9% 성장에 그친 반면, 초고자산가는 연평균 9.4% 증가했다. 지역별로는 전체 부자의 69.2%가 수도권에 거주했으며, 서울의 비중이 줄고 경기도는 확대되는 흐름이 이어졌다.  또 부자가 스스로 인식하는 '부자의 자산기준'은 꾸준히 100억원 수준을 유지했지만 부를 축적한 원천에는 변화가 나타났다. 과거 부동산 투자와 상속·증여 중심에서 최근에는 사업소득을 통한 축적이 늘었고, 근로소득과 금융투자 이익 비중도 확대된 것으로 조사됐다.  ■투자 성향은 보수적  올해 7~8월 부자 400명을 대상으로 한 면접조사 결과 이들의 자산은 부동산과 금융자산에 각각 평균 54.8%, 37.1%로 배분돼 있었다. 전년 대비 부동산과 금융자산 비중이 모두 소폭 낮아졌는데 이는 금·보석과 디지털자산 등 대체자산 투자가 늘어난 영향으로 풀이됐다. 보고서는 부동산 시장에 대한 관망세와 신규투자 위축도 배경으로 지목했다.  투자 성향은 한층 보수적으로 바뀌었다. 높은 수익과 손실을 감내하는 '적극·공격투자형' 비중은 17.1%로 1년 전보다 줄었고, '안정형·안정추구형' 비중은 49.3%로 확대됐다.  다만 주식에 대한 선호는 여전히 압도적이었다. 금융상품 가운데 수익 경험률은 주식이 40.0%로 가장 높았고, 부자들은 평균 국내주식 5.8개, 해외주식 4.9개 종목을 각각 보유했다. 향후 1년 이내 단기 고수익 투자처와 3~5년 중·장기 유망 투자처 모두에서 주식이 1위로 꼽혔다.  전반적으로 부자들의 자산 운용은 공격적 확장보다는 안정과 선택의 국면으로 옮겨가고 있다. 위험관리를 중시하면서도 수익 가능성이 확인된 자산에는 선별적으로 자금을 배분하는 전략이 뚜렷해졌다는 평가다. 황원경 KB금융지주 경영연구소 부장은 ""부를 축적하고자 하는 이들에게 자산 관리의 기본 원칙과 방향성을 제시할 것""이라고 말했다.",https://n.news.naver.com/mnews/article/014/0005448638
2025-12-14 18:27:00,전세사기 빌라로 눈돌린 매수자들…정산 끝난 'HUG 경매 물건' 불티,"정부가 10·15 부동산 대책을 발표한 지 두 달이 지난 가운데 전세사기 빌라 물건이 주목받고 있다. 특히 주택도시보증공사(HUG)의 '인수조건변경'이 붙은 빌라 물건 수요가 급증하고 있다. 부동산 규제가 심해지며 아파트를 사기 힘들어지자 상대적으로 규제가 약하고 HUG가 보증금 잔액을 요구하지 않는 빌라에 수요가 대거 몰리는 모양새다.  ■""잔액청구 없다""는 이 제도, 인기  14일 부동산 업계에 따르면 서울 양천구 서울남부지방법원에서 진행하는 HUG 인수조건변경부 빌라 경매에 참여자들이 꾸준히 증가하고 있다.  인수조건변경부 경매란 HUG가 배당금으로 보증금 전액을 변제받지 못해도 매수인에게 잔액을 청구하지 않고 임차권등기 말소를 확약해주는 제도다. 쉽게 말해서 HUG가 돌려받아야 하는 보증금 2억원의 물건이 1억원에 낙찰되더라도 매수자가 나머지 1억원에 대해 물어주지 않아도 된다는 것이다. 다만 HUG가 변제받지 못한 나머지 채무가 있을 경우 기존 집주인(원채무자)에게 구상하게 된다.  HUG는 악성채권을 떨어낼 수 있고, 매수인은 보증금 잔액을 물어줄 의무가 없어 사실상 '윈윈'인 셈이다. 경매업계 관계자는 ""잘 찾아보면 시세 대비 저렴하게 낙찰받을 수 있는 물건들도 있다""며 ""재개발·재건축 지역 빌라 물건도 나와 매수자들의 관심이 매우 높아지는 추세""라고 귀띔했다. 실제 부동산경매 전문 플랫폼 옥션원에 따르면 지난 12일 기준 서울시에 나온 빌라 경매 건수는 1800여건, 이 가운데 인수조건변경이 붙은 물건은 700여건이다. 전체의 3분의 1 이상이 관련 물건으로 구성된 것이다. 가장 최근인 11일 서울남부지방법원에서 열린 관련 경매에도 사람들이 북새통을 이뤘다는 후문이다. 이날 경매는 통상적인 종료 시간 오후 1시를 넘겨 오후 3시까지 진행됐다.  ■규제 피해 전세사기 물건 산다  이처럼 전세사기 물건에 매수자들의 수요가 쏠리는 이유는 10·15 대책으로 아파트 가격이 올라가고 규제가 심해졌기 때문으로 분석된다. 10·15 대책은 정부가 서울 전역과 경기도 12개 지역을 규제지역 및 토지거래허가구역으로 지정한 점이 핵심이다. 해당 지역 아파트 매매자는 취득일로부터 2년 동안 실거주해야 한다는 조항도 있다. 반면 빌라는 토허제를 적용받지 않는 데다 매수자가 임대사업자 등록을 하면 세금 감면 등 다양한 혜택도 받을 수 있다.  아파트와 달리 실거주 의무도 발생하지 않는다. 상당수 전세사기 빌라 금액이 1억~3억원 전후 소액이라는 점도 또 다른 이유다.  특히 재개발·재건축 지역 인근 전세사기 물건은 '없어서 못 산다'는 분위기다. 재건축은 조합설립인가 전, 재개발의 경우 관리처분인가 전 그 지역 빌라를 매수하면 조합원 자격을 얻을 수 있는데 인수조건변경이 붙은 빌라는 잔액에 대한 걱정을 줄일 수 있어 낙찰가가 오히려 감정가를 웃도는 경우도 나온다.",https://n.news.naver.com/mnews/article/014/0005448637
2025-12-14 18:25:00,유턴 결심했다가 전력·부지·노동비에 놀라 발길 돌린다 [국내 복귀 꺼리는 기업],"미국의 관세 리스크가 현실화되면서 각국이 자국 중심의 공급망 강화에 나선 가운데, 우리 정부도 국내 공급망을 지켜내기 위한 대응전에 나섰다. 미국 관세 피해기업을 대상으로 유턴기업 요건을 완화하고, 관세 부담을 이유로 국내투자를 검토하는 기업에 대한 지원 문턱을 낮춘 것이 핵심이다. 정부는 이를 시작으로 내년 상반기 유턴기업 활성화를 위한 종합 보완책을 추가로 내놓을 계획이다. 다만 전문가들은 유턴기업 유치에만 초점을 맞추기보다는 전반적인 국내투자를 확대하도록 유도하는 방향으로 정책의 시야를 넓혀야 한다고 조언한다.  14일 산업통상부에 따르면 정부는 최근 '해외진출기업의 국내복귀 지원에 관한 고시'를 개정하고, 관세 피해기업에 대한 국내복귀 지원 특례를 구체화했다. 미국의 관세 부과로 매출이나 영업이익이 급감한 기업이 국내에 생산기지를 신증설할 경우 해외사업장을 축소하지 않더라도 유턴기업 지원을 받을 수 있도록 문턱을 낮춘 것이 핵심이다.  개정 고시에 따르면 해외 법인·사업장의 매출 가운데 미국 수출비중이 20% 이상이면서 관세 부과 영향으로 매출액 또는 영업이익이 전년 동기 대비 20% 이상 감소한 기업이 대상이다. 정부는 이를 통해 '완전한 철수 후 복귀'가 아닌, 해외 생산기지를 유지하면서도 국내투자를 병행하는 형태의 복귀를 유도하겠다는 구상이다.  이번 고시 개정과 함께 유턴기업 우대지역도 확대됐다. 산업부는 기존 산업위기대응지역에 더해 기회발전특구와 산업위기선제대응지역을 우대지역으로 포함하고, 이들 지역에 투자하는 유턴기업에 대한 보조금 지원비율을 상향했다. 보조금 지원한도 기준도 기존 사업장당 국비 300억원에서 국내복귀 선정 건당 국비 300억원으로 변경, 추가 유턴에 대한 지원 여지도 넓혔다.  산업부 관계자는 ""해외로 나가는 기업이 늘어나는 상황에서 국내에도 적정한 투자를 유지할 수 있도록 유치하기 위해 지원을 강화하는 데 초점을 맞췄다""며 ""제도개편 효과를 높이기 위해 기업 대상 설명회와 홍보를 이어가며 현장 반응을 살펴보고 있다""고 말했다.  산업부는 기업들의 의견을 지속적으로 수렴해 내년 상반기 중 유턴기업 지원대책을 추가로 보완할 계획이다. 관세 리스크가 상시화되는 상황에서 국내투자를 유도할 수 있는 실효적인 방안을 중심으로 정책을 재정비할 방침이다.  다만 정부가 유턴기업 확대를 위해 각종 정책을 내놓고 있음에도 현장에서는 여전히 부담이 크다는 목소리가 나온다. 리쇼어링을 추진하더라도 인건비와 노동규제 등 구조적 비용 부담이 해소되지 않은 데다 기존 지원사업만으로는 해결하기 어려운 현실적인 문제가 산재해 '정착'을 뒷받침할 실질적 지원은 부족하다는 지적이다. 특히 리쇼어링을 가로막는 현실적 요인으로는 전력비·부지비·노동비의 이른바 '3중고(高)'가 꼽힌다. 전문가들은 리쇼어링을 단순한 공장 이전이 아니라 기술·부품·숙련 인력·금융·인프라가 함께 복귀하는 산업 생태계 회복 프로젝트로 접근해야 한다고 지적한다. 단기 보조금 확대만으로는 한계가 분명한 만큼 전력요금과 입지규제, 노동시장 등 구조적 비용을 낮추고 장기적으로 예측 가능한 세제·투자 인센티브와 범부처 원스톱 지원체계를 마련해야 한다는 것이다.  아울러 해외진출 기업 다수가 현지 시장 공략을 목적으로 나간 만큼, 실제로 국내로 복귀할 수 있는 기업 수에는 구조적인 한계가 있다는 지적도 나온다. 이에 유턴기업에 한정하기보다는 국내투자를 확대하고 공급망 안정에 기여하는 기업 전반을 포괄하는 방향으로 정책을 전환하는 것이 효과적이라는 분석이다.  한국개발연구원(KDI) 정성훈 선임연구원은 ""최근의 해외 직접투자는 현지 시장 공략 목적이 강해 단순 보조금만으로는 복귀를 유도하기 어렵다""며 ""유턴기업이라는 틀에 매달리기보다 국내투자를 확대하고 공급망 안정에 기여하는 기업 전반을 포괄하는 인센티브 체계로의 전환이 필요하다""고 말했다.",https://n.news.naver.com/mnews/article/014/0005448636
2025-12-14 18:25:00,"美, 신규 장비·연구개발 비용공제…日, 반도체·배터리·로봇기업 지원","【파이낸셜뉴스 뉴욕·도쿄=이병철 서혜진 특파원】 미국의 트럼프 정부는 각종 세금 혜택 등 정책적으로 자국 기업들의 귀환, 리쇼어링을 뒷받침하고 있다. 트럼프 행정부는 올해 '하나의 크고 아름다운 법안'을 제시하며 신규 장비에 대한 전액 비용공제 및 국내 연구개발에 대한 즉시 비용공제와 같은 기타 세금절감 조항을 영구화했다. 또 반도체 및 첨단산업(세액공제 25%→35%)을 지원하고 친환경 정책을 철폐하면서 기업들의 지원책을 늘렸다.  관세정책도 리쇼어링을 가속화하고 있다. 도널드 트럼프 미국 대통령은 취임 후 보편관세 10%와 국가별로 상호관세를 부과했다. 철강이나 가구, 자동차 등에도 품목관세를 부과하면서 미국 내 투자를 압박하고 있다. 딜로이트에 따르면 올해 7월 기준 기업들은 미국 반도체 제조 생태계 활성화를 위해 5000억달러 이상의 민간부문 투자를 발표했다. 또 2032년까지 미국 내 생산능력이 3배로 증가할 것으로 예상된다.  애플은 6000억달러를 투자키로 했으며 소프트뱅크·오픈AI·오라클은 '스타게이트 프로젝트'를 추진하면서 미국 내 인공지능 인프라에 5000억달러 규모의 투자를 발표했다. 엔비디아 역시 향후 4년간 5000억달러, IBM은 1500억달러, 존슨앤드존슨은 550억달러, 구글은 250억달러 등의 투자계획을 밝혔다.  일본은 코로나19 이후 리쇼어링 정책의 방향을 빠르게 전환하면서 일본 기업들의 국내 복귀를 지원하고 있다. 2020년 1800억엔 규모의 보조금 정책으로 시작했지만 2년 만에 이를 세액공제 중심 구조로 전환했다. 단기 보조금보다 지속가능한 기술 귀환형 리쇼어링이 효과적이라는 판단에서다. 특히 일본 경제산업성은 반도체·배터리·로봇 등 전략산업 투자기업에 시설투자액의 최대 40%를 법인세에서 공제하는 제도를 도입했다. 최근에는 반도체를 중심으로 리쇼어링이 확산되고 있다.  일본정책투자은행(DBJ)의 '2024년 설비투자 계획 조사'에 따르면 응답한 제조업체의 절반에 가까운 기업이 향후 3년 내 국내 생산거점을 강화할 방침을 밝혔다. 10년 이내에 국내투자를 강화하겠다는 응답도 절반을 넘었다.  실제로 일본 전력 반도체 제조업체인 로옴은 지난해 여름부터 미야자키현 구니토미초에 위치한 자사 공장에 장비 반입을 본격화했다. 그해 연말 가동을 시작해 전기차(EV)의 전압 제어 등에 쓰이는 탄화규소(SiC) 파워 반도체를 양산했다. 반도체 제조업체 르네사스일렉트로닉스도 지난해 4월 야마나시현 가이시 소재 고후 공장을 재가동, 지난해부터 파워 반도체 양산에 나섰다.  대만 TSMC가 구마모토 공장 건설에 나선 것을 기회로 삼는 일본 기업들도 있다. 구마모토 공장을 운영하는 JASM에는 소니그룹, 덴소, 도요타자동차 등 일본 기업들이 출자하고 있다. 소재기업들의 투자도 가속화되고 있다. 후지필름홀딩스는 지난해 1월 구마모토현에서 반도체 제조용 연마제 신공장을 가동했다. 전자부품 분야에서는 무라타제작소가 약 470억엔을 들여 시마네현 이즈모시에 적층세라믹콘덴서(MLCC) 신규 생산동을 건설, 내년 3월 준공한다. EV와 스마트폰 등에 쓰이는 부품으로, TDK도 이와테현 공장에 MLCC 신공장동을 마련했다.",https://n.news.naver.com/mnews/article/014/0005448635
