날짜,제목,본문,링크
2025-12-09 14:15:00,"전북도, 자연재난 대책 4년 연속 '최우수'","【파이낸셜뉴스 전주=강인 기자】 전북특별자치도는 행정안전부 '자연 재난 대책 평가'에서 최우수기관으로 선정됐다고 9일 밝혔다.  겨울과 여름철 모두 최우수 평가를 받은 곳은 전국에서 전북이 유일하다.  이번 평가는 2024~2025년 겨울철 대설 대비와 2025년 여름철 집중호우 대응을 대상으로 실시됐다.  전북은 도 단위로 6억원의 특별교부세를 확보했다. 시군 평가를 통해선 순창군이 겨울철 최우수 기관으로 1억5000만원, 김제시 장려 기관 5000만원을 교부받는다. 여름철 평가에선 군산시가 장려 기관으로 선정돼 1억5000만원을 확보하게 됐다.  전북도는 AI기반 도시침수 대응 시스템을 도입하고 5단계 재난 대응 체계와 24시간 비상근무 체제를 운영하는 등 선제적이고 실효성 있는 대책을 추진했다. 시군 간 협업 체계 가동도 높이 평가됐다.  김관영 전북도지사는 ""이번 성과는 도민의 참여와 민·관·군이 함께 이룬 결과""라며 ""앞으로도 한발 앞선 재난 대응으로 도민의 생명과 재산을 지키는 데 최선을 다하겠다""고 전했다.",https://n.news.naver.com/mnews/article/014/0005446331
2025-12-09 14:13:00,"장관호 국민주권교육포럼 대표, 전남도교육감 선거 출마 공식 선언","【파이낸셜뉴스 무안=황태종 기자】전교조 전남지부장을 역임한 장관호 국민주권교육포럼 대표가 9일 전남도의회 브리핑실에서 기자회견을 갖고 내년 6월 치러질 제9회 전국동시지방선거 전남도교육감 선거 출마를 공식 선언했다.  장관호 대표는 이날 출마 선언문을 통해 ""정치만 있고 교육은 없는 전남교육의 현실을 끝내고, 학교와 지역의 힘으로 전남교육을 다시 세우겠다""라며 교육 대전환에 대한 강한 의지를 밝혔다.  그는 특히 현재 전남교육의 위기를 기초학력 붕괴, 재정 위기, 교육행정 불신, 미래 방향 상실로 진단하고 ""이제는 전남교육의 근본을 다시 세워야 할 때""라고 강조했다. 또 ""유능한 혁신가, 뚝심 있는 실천가, 현장과 지역 중심 리더십이 필요하다""면서 ""학교·지역·미래 중심의 교육 개혁으로 교육 공동체를 회복하겠다""라고 덧붙였다.  그러면서 전남교육의 회복과 미래를 위한 5대 혁신 비전으로 △교육격차 해소·기초학력 책임교육 강화 △기본이 강한 전남 미래교육 구축△지역-학교 동반성장 체계 확립 △도민이 직접 정책을 만드는 교육 참여 주권시대 개막 △전남도교육청 혁신(전문성·자율성·책임성 회복)을 제시했다.  장관호 대표는 ""학교가 살아야 지역이 살고, 지역이 살아야 전남의 미래가 열린다""면서 ""모두가 빛나는 진짜 전남교육을 도민과 함께 열겠다""라고 포부를 밝혔다.  또 ""이번 교육감 선거는 전남교육을 지켜낼 마지막 기회가 될 것""이라며 ""도민과 손잡고 전남교육 대전환을 완수하겠다""라고 강조했다.  한편 장관호 대표는 전교조 정책실장, 전남교 전남지부장, 전남교육연구소 이사장, 전남교육회의 공동대표로 활동해 왔으며, 정책·현장·지역을 두루 아우르는 준비된 교육감 후보임을 강조하고 있다.",https://n.news.naver.com/mnews/article/014/0005446330
2025-12-09 14:13:00,정기웅 전북교육청 공무원노조위원장 6연임,"【파이낸셜뉴스 전주=강인 기자】 정기웅 전북특별자치도교육청 공무원노조위원장이 6연임에 성공했다.  노조는 지난 8일 진행된 제9대 위원장 선거에서 정 위원장이 당선됐다고 9일 밝혔다.  단독 출마한 정 위원장은 96.34% 지지를 받았다. 투표율은 56.01%였다.  임기는 2028년까지 3년이다.  정 위원장은 지난 2012년 제4대 위원장을 시작했다.  정 위원장은 ""지금 전북교육은 그 어느 때보다 균형과 협치가 필요한 시기""라며 ""기울어진 운동장을 바로 세우고, 교사·지방공무원 간 불합리한 수직 구조를 수평적·협력적 관계로 바꾸는 데 모든 역량을 집중하겠다""고 전했다.",https://n.news.naver.com/mnews/article/014/0005446329
2025-12-09 14:11:00,"“감히 우리 누나 욕해?” 둔기로 친구 폭행한 20대, 징역형 집유","[파이낸셜뉴스] 술자리에서 친누나에게 욕설한 친구를 둔기로 폭행한 20대 남성이 징역형 집행유예를 선고받았다.  9일 법조계에 따르면 서울동부지법 형사8단독 이준석 판사는 지난달 28일 특수상해 및 폭행 혐의로 재판에 넘겨진 김모씨(25)에 대해 징역 8개월에 집행유예 2년을 선고했다.  김씨는 올해 2월 서울 강동구의 자택에서 친누나와 피해자를 포함해 4명이 술을 마시던 중 피해자가 친누나에게 욕을 하자 얼굴을 때리고 둔기로 내려친 혐의를 받는다.  김씨는 다른 피해자가 말리는 과정에서 그의 얼굴을 주먹으로 폭행하기도 했다.  이 판사는 양형 이유에 대해 ""주짓수 체육관에서 근무한 경력이 있는 격투기를 수련한 사람인 바 일반인에 비해 죄책이 더욱 무겁다""고 판시했다.  다만 ""범행을 인정하며 반성하고 있는 점, 다소 우발적으로 범한 것으로 보이는 점, 아무런 범죄전력이 없는 초범인 점 등을 종합적으로 참작했다""고 설명했다.",https://n.news.naver.com/mnews/article/014/0005446328
2025-12-09 14:11:00,K-푸드 수출 확대 총력… 비관세장벽에 민·관 손잡았다,"[파이낸셜뉴스] 농림축산식품부는 9일 서울 aT센터에서 K-푸드 수출 관련 협회·단체와 함께 비관세장벽 대응 방향을 논의하는 현장 간담회를 열었다고 밝혔다.  이번 간담회는 농식품 수출 증가세를 지속적으로 이어가기 위해 민·관이 협력해 우리 수출 기업이 겪고 있는 주요 수출국의 비관세장벽 대응 방안을 모색하고자 마련했다.  농식품부는 수출 기업의 비관세장벽 애로 사례를 조사해 국별 유형별로 분석하고, 사례별 세부 대응 전략을 수립해 문제 해소를 지원해 나갈 계획이다. 심층 분석을 통해 단계별 애로 해소 방안을 마련하고, 민·관 공동 대응을 통해 실질적 성과로 이어지도록 한다는 구성이다.  이를 위해 농식품부는 현장 애로를 상시 접수하고 지원을 전담하는 창구(가칭 ‘N-데스크’)를 설치해 연중 운영한다. 접수된 건의 사항은 난이도에 따라 분류해 단순 사안은 신속 처리하고, 장기적 접근이 필요한 현안은 민·관 협의를 통해 공동 해결책을 마련한다는 방침이다.  또한 농식품부는 접수된 사례들을 정리해 농식품 분야 국가별 무역장벽(NTE) 보고서로 종합하고, 애로사항이 해소되기까지 논의 경과 등을 체계적으로 관리해 나갈 예정이다.  참석자들은 수출 활성화를 위한 정부의 노력을 환영하고, 미국 배 수출 과정에서 통관 차질이 있었으나 농식품 현지화 지원사업을 통해 문제를 해결한 사례를 언급했다. 그러면서 업계 애로를 중장기적으로 관리하고 지속적인 관심과 노력을 기울여 줄 것을 정부에 요청했다.  정용호 농식품부 국제협력관은 “더 적극적이고 체계적인 농식품 통상정책을 추진해 K푸드 수출 확대를 지원해 나가겠다”며 “현장의 의견이 중요한 만큼 협·단체에서도 개별 기업과 정부 간 적극적인 소통을 위한 가교 역할을 해주시길 바란다”고 당부했다.",https://n.news.naver.com/mnews/article/014/0005446327
2025-12-09 14:11:00,"한진, ‘언박싱데이 2025’서 K브랜드 글로벌 커머스 전략 공개","[파이낸셜뉴스] 한진이 K브랜드의 해외 진출을 지원하기 위해 물류와 인플루언서 마케팅을 결합한 새로운 커머스 전략을 공개했다.  한진은 9일 서울 용산에서 ‘언박싱데이(UNBOXING DAY) 2025’를 열고 고객사·파트너사 등 370여명과 글로벌 시장 공략 방안을 논의했다고 밝혔다.  ‘언박싱데이’는 고객의 가능성을 ‘상자를 여는 순간(Unboxing)’처럼 함께 확장하자는 취지로 2023년 시작된 행사다. 올해는 △동반성장 고객사 감사 △비즈니스 커뮤니티 형성 △산업 전문가 인사이트 공유를 중심으로 진행됐다. 한진이 제시한 ‘넥스트 커머스(Next Commerce)’ 비전도 주목을 받았다.   노삼석 한진 대표는 개회사에서 ""오늘날 물류는 단순 운송이 아니라 브랜드의 가치와 경험을 전달하는 핵심 요소""라며 ""안정성과 예측 가능성, 글로벌 확장성을 갖춘 솔루션이 필요한 시기""라고 말했다. 이어 ""고객 성공이 우리의 존재 이유""라며 ""브랜드가 꿈꾸는 비전을 현실로 옮기는 파트너가 되겠다""고 밝혔다.  이어 조현민 한진 사장은 “지금은 콘텐츠가 커머스를 이끌고, 커머스가 콘텐츠를 완성하는 시대”라며 브랜드·인플루언서·물류를 연결한 ‘넥스트 커머스’ 전략을 제시했다. 조 사장은 “선택된 브랜드 경험은 소비자가 상자를 여는 순간까지 빈틈없는 물류 역량이 뒷받침될 때 완성된다”고 강조했다. 글로벌 인플루언서 마케팅으로 성장한 ‘메디큐브’를 사례로 들며 “기술력, 인플루언서 신뢰, 현지 체험이 결합될 때 진정한 글로벌 확장이 가능하다”고 말했다.  한진은 이를 실현할 물류 솔루션으로 인플루언서 커머스 특화 시스템 ‘원스타(OneStar)’를 소개했다. 조 사장은 “브랜드는 제품을 만들고, 인플루언서는 진정성 있게 알리고, 한진은 글로벌 물류 인프라로 경험을 전달할 것”이라며 통합 물류 솔루션을 기반으로 K브랜드의 정착을 지원하겠다고 했다.  이날 행사에서는 고객사와의 상생을 기념하는 ‘한진 더함 시상식’도 열렸다. 장기 고객·상생 협력·서비스 개선·물량 성장·소상공인 물류 성과 등을 기준으로 제이비물류와 하림산업, APR 등 10개 기업이 수상했다.  행사장에는 해외 진출을 지원하는 파트너 부스도 운영됐다. 에어월렉스, 세일즈포스, 틱톡코리아, 카페24, 디노스튜디오, 프리즘 등이 참여해 상담과 네트워킹을 진행했다. 한진의 원클릭, 숲(SWOOP), 슬로우레시피, 훗타운 등 디지털 플랫폼 홍보 부스도 함께 마련됐다.  한진 관계자는 “언박싱데이는 글로벌 진출을 준비하는 브랜드에 실질적 인사이트를 제공하는 행사로 자리 잡았다”며 “파트너십을 기반으로 고객사의 해외 성장을 지속 지원하겠다”고 말했다.  한편 이번 행사에는 유진투자증권, KB손해보험, 파스토가 후원사로 참여했다.",https://n.news.naver.com/mnews/article/014/0005446326
2025-12-09 14:10:00,"행복한백화점, 학대피해 아동 돕는다","[파이낸셜뉴스] 행복한백화점은 지난 8일 한국중소벤처기업유통원 목동 사옥에서 위드캔 복지재단에 기부금을 전달했다고 9일 밝혔다.  행복한백화점 나눔 바자회로 조성된 기부금은 학대 피해 아동의 심리 치료 등에 사용될 예정이다.  이종화 위드캔복지재단 사무총장은 ""한유원의 따뜻한 나눔은 학대피해로 심리적·정서적 어려움을 겪는 아동들에게 큰 힘이 될 것""이라고 말했다.  이태식 한유원 대표이사는 ""학대피해 아동이 과거의 아픈 기억을 잊고 건강한 마음으로 새로운 출발을 하는데 작게나마 도움이 되길 바란다""고 했다.  한유원이 운영 중인 행복한백화점은 중소기업 판로를 지원하고자 1999년 설립됐다. 지난 3일 개점 26주년을 맞이했다.",https://n.news.naver.com/mnews/article/014/0005446325
2025-12-09 14:10:00,"GIST, 인공태양 연구 핵심 중수소 감응도 세계 최초 규명","[파이낸셜뉴스] 인공태양 연구시설광주과학기술원(GIST)은 물리·광과학과 방우석 교수 연구팀이 기존 입자 검출 장비의 한계를 극복하고, 미래 청정에너지로 주목받는 핵융합의 핵심 연료 ‘중수소 이온’이 실제 핵융합 반응이 일어나는 에너지 구간(5~200 킬로전자볼트(keV))에서의 ‘절대 감응도’를 세계 최초로 측정하는 데 성공했다고 9일 밝혔다.  ‘절대 감응도’란 입자 한 개가 검출기에 남기는 실제 신호의 세기를 뜻한다. 이를 알면 많은 입자가 동시에 들어오는 고강도 방사선 환경에서도 입사 입자 수와 방사선량을 신뢰성 있게 측정할 수 있다.  이번 성과는 최근 전남 나주시가 우선협상대상자로 선정된 인공태양(핵융합) 연구시설과도 직결된다. 핵융합 장치 내부에서 발생하는 고에너지 중수소·삼중수소 입자를 정확히 측정하기 위해서는 신뢰성 높은 절대 감응 데이터가 필수이기 때문이다.  중수소 이온은 핵융합·플라즈마·가속기 연구에서 매우 중요하지만, 핵융합에 필수적인 주요 에너지 영역(수 keV~수백 keV)에서는 검출기 ‘포화’ 때문에 절대 감응 데이터를 확보할 수 없었다.  이번 성과는 그동안 전 세계적으로 확보되지 않았던 핵심 데이터를 처음으로 측정한 것으로, 핵융합·가속기·방사선 계측 등 다양한 분야에서 정확한 입자 계측의 기반을 마련했다는 평가다.  방우석 교수는 “이 기술은 많은 입자가 한꺼번에 쏟아지는 극한 실험 환경에서도 신호를 정확히 읽어낼 수 있는 새로운 진단 기법을 제시한 것”이라며 “이번 연구로 확보한 절대 감응도 데이터는 국제 핵융합·가속기 실험에서 즉시 활용될 수 있으며, 다양한 입자 실험 연구에도 폭넓게 기여할 것”이라고 말했다.  GIST 물리･광과학과 방우석 교수가 지도하고 김형일 석박사통합과정생이 제1저자로 참여한 이번 연구는 한국연구재단 중견연구자지원사업의 지원을 받았다. 연구 결과는 세계 학술지 평가 지표인 JCR(저널 인용 보고서) 기준 핵과학 분야 상위 6.1% 국제학술지 '방사선 물리 및 화학(Radiation Physics and Chemistry)'에 2025년 11월 24일 온라인으로 게재됐다.",https://n.news.naver.com/mnews/article/014/0005446324
2025-12-09 14:08:00,"HS효성, 김규영 회장 선임..그룹역사상 첫 전문경영인 회장","[파이낸셜뉴스]  HS효성이 9일 김규영 회장 선임을 포함한 2026년 정기 임원 인사를 단행했다.  HS효성은 이번 인사에서 김규영 전 효성그룹 부회장을 HS효성그룹의 회장으로 선임하는 한편, 송성진 트랜스월드 PU장과 양정규 HS효성인포메이션시스템㈜ 대표이사 전무를 각각 부사장으로 승진시키고 신규 임원 2명을 선임하는 등 총 10명의 임원 인사를 발표했다.  김 전 부회장의 회장 선임에 대해 회사측은 “‘HS효성 가족들이 가장 소중한 자산이고, 누구든 역량을 갖추면 그룹의 회장이 될 수 있다’는 조현상 부회장의 평소 지론을 반영했다”고 설명다. 집단지성을 비전으로 제시해 온 조 부회장은 “오너가 아니어도 가치를 극대화하는 준비된 리더가 그룹을 이끌어야 한다. 그것이 곧 가치경영이다”라고 강조해 온 것으로 알려졌다.  이번 인사는 △기술과 품질을 바탕으로 한 가치경영을 이끌어 갈 인재, △실적주의에 따라 회사 성장에 기여한 인사, △다양성에 기초한 인재 발굴 및 육성이라는 발탁 기준에 따라 이뤄졌다.  특히, 김규영 HS효성 회장 선임은 기술과 품질을 바탕으로 한 가치경영을 대표하는 상징적 인사로 평가된다. 50여 년간 효성그룹을 지켜오며 ‘샐러리맨의 신화’로 불리는 김규영 회장은 1972년 효성그룹의 모태기업인 동양나이론에 신입사원으로 입사해 언양공장장, 안양공장장, 중국 총괄 사장, 효성그룹 CTO 및 기술원장을 역임한 바 있다. 특히 스판덱스 개발을 포함한 섬유기술 확립과 기술품질 향상에 기여했고, 2017년부터 8년간 효성그룹 지주사 대표이사를 역임한 바 있다.  송성진 부사장은 현대 경영의 중요한 화두인 공급망 안정화와 물류사업을 도맡아 HS효성그룹의 도약에 기여하고 있다. 물류사업의 수장으로서 글로벌 사업과 해외 고객이 많은 HS효성의 가치를 더욱 높일 것으로 기대된다.  양정규 부사장은 HS효성의 주요 사업군 중 하나인 AI/DX 사업을 선도하며 다년간 실적을 내왔다. 국내 하이엔드 스토리지 시장 11년 연속 1위를 기록하는 등 독보적 입지를 구축해 온 역량을 바탕으로 HS효성그룹의 AI/DX 사업 부문을 더욱 강화해 나갈 예정이다.  기획관리 부문에서는 박창범 상무보가 신임 임원으로 발탁됐다. 박 상무보는 HS효성그룹 출범 후 시작된 인재육성 및 조직문화 개선 작업을 이끌 예정이다.  신규 여성 임원으로는 정유조 상무보가 발탁됐다. 정 상무보는 효성그룹 공채 출신으로 경영기획팀, ESG경영팀, 신사업팀 등을 거친 기획통이다. HS효성은 공채 출신 최초의 여성 임원인 전유숙 상무를 발탁한 데 이어, 여성 임원을 꾸준히 발탁하고, 테리 스와너(Terry Swanner)를 그룹 최초의 외국인 임원으로 임명하는 등 인사의 다양성을 강조해 왔다.  정기 임원 인사를 단행한 HS효성그룹은 새로운 진용을 통해 급변하는 시장 환경에 선제적으로 대응하고 지속 가능한 성장 기반을 마련하는 한편, 조현상 HS효성 부회장이 강조해 온 ‘가치경영’을 지속적으로 강화해 나갈 계획이다.",https://n.news.naver.com/mnews/article/014/0005446323
2025-12-09 14:07:00,"하나금융, 장애인 거주시설에 친환경 차량 기부","[파이낸셜뉴스] 하나금융그룹이 장애인 거주시설 10곳에 친환경 전기차와 경차를 기부했다. 도시 외곽에 주로 위치한 장애인 거주시설에 친환경 차량 등을 제공함으로써 장애인 거주시설의 복지 환경을 끌어올리고, 장애인의 이동권을 지원한다. 함영주 하나금융그룹 회장(오른쪽)이 지난 8일 서울 을지로 하나금융 사옥에서 진행된 차량 전달식에서 김성이 한국사회복지협의회 회장과 기념촬영을 하고 있다. 하나금융그룹 제공",https://n.news.naver.com/mnews/article/014/0005446322
2025-12-09 14:07:00,"日정부 ""정전 10가구·단수 480가구..허위 정보 확산 주의""","【파이낸셜뉴스 도쿄=서혜진 특파원】일본 정부는 9일 일본 혼슈 동북부 아오모리현 앞바다에서 전날 발생한 강진으로 약 10가구가 정전됐고 약 480가구가 단수됐다고 발표했다. 또한 향후 일주일 간 정부와 지방자치단체, 언론 등을 통해 재난 정보를 확인하라고 당부하는 등 이번 지진 관련 허위 정보 확산을 경계했다.  니혼게이자이신문에 따르면 기하라 미노루 일본 관방장관은 이날 기자회견에서 전날 발생한 강진 피해 상황에 대해 발표했다.  그는 “아오모리현에서 약 10가구가 정전됐고 단수는 아오모리현과 이와테현에서 약 480가구 발생하고 있다”고 밝혔다.  또한 과거 재난 발생 시 인터넷을 통해 허위 정보가 확산된 사례가 있었다며 “재난 관련 정보는 정부, 지자체, 언론의 정보를 통해 확인해 달라”고 당부했다.  기하라 장관은 “‘자신의 생명은 스스로 지킨다’는 원칙에 따라 방재 행동을 취해 달라”며 비상식량과 대피 장소를 다시 한번 점검해 달라고 요청했다. 이어 “앞으로 약 일주일 동안은 기상청과 지방자치단체의 정보에 각별히 유의해 달라”고 말했다.  일본 기상청은 전날 강진과 관련해 '홋카이도·산리쿠 앞바다 후발 지진 주의 정보'를 처음으로 발표했다.  2022년 12월 도입된 이 주의 정보는 일본해구·쿠릴해구를 따라 거대지진 발생이 예상되는 진원 지역에서 규모 7.0 이상의 지진이 일어나 평소보다 거대 지진 발생 가능성이 커졌다고 판단되는 경우 발령된다.",https://n.news.naver.com/mnews/article/014/0005446321
2025-12-09 14:03:00,"""오늘은 우리가 산타""...우리금융, 양육시설에 크리스마스 선물 전달","[파이낸셜뉴스] 우리금융미래재단이 지난 8일 서울 중구 우리은행 본점에서 ‘우리금융 위비산타 출정식’을 열었다. 임종룡 우리금융그룹 회장 겸 우리금융미래재단 이사장은 자립준비청년들과 함께 전국 아동 양육시설 초·중등생 6500명에게 총 8억원 규모의 크리스마스 선물 ‘꿈 응원상자’를 마련했다.이날 행사에는 우리금융미래재단 ‘자립준비청년 우리 찬스(WOORI Chance)’ 프로젝트에 참여 중인 보호종료 자립준비청년 25명이 ‘위비산타’로 동참했다. 아동양육시설 후배 아동들을 응원하며 나눔의 의미를 더한 것이다. ‘자립준비청년 WOORI Chance’는 보호아동과 자립준비청년을 위해 △돌잔치 △꿈 응원 상자 △진로교육 △자립키트 △멘토링 등 6개 프로그램을 생애주기별로 제공하는 특화 지원사업이다.  임종룡 이사장과 자립준비청년, 임직원들은 ‘꿈 응원상자’를 함께 포장한 뒤, 인근 아동양육시설을 방문해 선물을 전달하고 아이들과 크리스마스 파티를 함께했다. 올해는 지원 대상을 중학생까지 확대해 연령별 2종으로 구성했다. 학용품과 보온용품, 간식 등 실용적인 물품을 담아 학습과 일상을 동시에 지원했다.  ‘꿈 응원상자’는 세이브더칠드런과 협력해 크리스마스 전까지 전국 아동양육시설에 순차적으로 전달된다. 임종룡 우리금융 회장은 “자립준비청년들이 ‘위비산타’로 함께해 더욱 따뜻한 크리스마스가 됐다”며 “앞으로도 미래세대 아이들을 위한 사회공헌을 꾸준히 이어가겠다”고 말했다.  우리금융미래재단은 △발달장애인의 일자리 생태계 조성을 위한 ‘굿윌스토어’ 매장 건립과 우리은행 영업점 내 ‘굿윌기부함’ 운영 △저소득 아동·청소년의 시·청각 수술을 지원하는 ‘우리루키’ △청소년 미혼 한부모의 자립을 돕는 ‘우리 원더패밀리’ 등 복지 사각지대 취약계층을 위한 사회공헌 사업을 통해 따뜻한 나눔을 실천하고 있다.",https://n.news.naver.com/mnews/article/014/0005446320
2025-12-09 14:02:00,"한화자산운용, 美 마시펜과 7000억 규모 'K컬처' 펀드 조성","[파이낸셜뉴스] 한화자산운용은 아랍에미리트(UAE) 아부다비에서 개최된 '아부다비 금융주간(ADFW) 2025'에서 미국 투자사 마시펜 캐피털파트너스와 K-컬처 및 라이프스타일 산업의 글로벌 성장을 위한 업무협약(MOU)을 체결했다고 9일 밝혔다. 양사는 5억달러(약 7천억원) 규모의 공동펀드 조성을 목표로 협력할 예정이다.  한화자산운용은 아시아 라이프스타일·소비재 산업의 성장 흐름에 맞춘 전략적 성장 투자 모델을 공동으로 개발하는 역할을 맡는다. 그동안 아시아 시장에서 축적해 온 기업 분석 역량과 투자 구조 설계 경험을 기반으로, 유망 기업의 글로벌 확장을 지원하는 핵심 성장 자본 파트너로 참여할 계획이다.  현재 한화자산운용은 미주에서 뉴욕·샌프란시스코, 아시아에서 싱가포르를 거점으로 글로벌 투자를 전개하고 있다. 이를 기반으로 급성장하는 문화·소비재 생태계에서 유망 기업을 발굴하고 글로벌 자본과 연결해 한국과 아시아 기업의 스케일업을 돕는 혁신적인 새로운 투자 프레임워크를 구축한다는 전략이다.  마시펜은 글로벌 소비재·브랜드 분야에서 전문성을 갖춘 투자사로, 글로벌 엔터테인먼트 기업 및 뷰티 브랜드 등을 보유하고 있다.  김종호 한화자산운용 대표는 ""K-컬처와 라이프스타일 산업은 전 세계 소비자 트렌드를 이끄는 핵심 성장 분야""라며 ""이번 MOU는 이러한 시장에서 아시아 기업이 글로벌로 도약할 수 있도록 협력 기반을 마련했다는 점에서 의미가 크다""고 말했다.  로비 로빈슨 마시펜 최고경영자(CEO)는 ""한국은 뷰티, 콘텐츠, 식품, 엔터테인먼트, 라이프스타일 등에서 글로벌 트렌드를 주도하는 아시아의 문화적 허브""라며 ""이번 협력을 기반으로 아시아 지역의 혁신기업에 대한 투자 기회를 적극적으로 발굴해 나가겠다""고 밝혔다.",https://n.news.naver.com/mnews/article/014/0005446319
