날짜,제목,본문,링크
2025-12-09 10:26:00,"부산진해경자청, 전략품목 컨설팅으로 신규사업화 아이템 도출","[파이낸셜뉴스] 부산진해경제자유구역청은 ‘부산진해경제자유구역(BJFEZ) 전략품목 신규사업화 컨설팅 지원사업’을 통해 커피, 선박부품, 청정연료 등 전략품목과 관련된 규제 및 제도 개선 등 정책추진 과제를 발굴했다고 9일 밝혔다.  이 사업은 부산진해경제자유구역의 5대 전략품목인 커피콩, 콜드체인 부품, 수소에너지, 선박용 기계부품, 로봇부속품을 중심으로, 구역 내·인근 기업들의 신규사업 추진을 돕고 컨설팅 과정에서 드러난 현장의 애로사항을 정책과제로 연결하기 위해 마련됐다.  경자청은 공모를 통해 전략품목 연관 6개사를 선정하고, 기업이 직접 선택한 전문가와 일대일 방식으로 사업계획 수립 컨설팅을 지원했다. 시장 및 수요 분석, 사업모델 구체화, 단계별 실행계획 수립 등을 함께 진행, 기업들이 사업을 추진하는 과정에서 반복적으로 지적한 제도·규제 문제를 별도로 정리해 정책과제로 묶어냈다.  커피 분야에선 커피 원두의 카페인 성분함량 표시기준에 대한 해석이 기업 입장에서 명확하지 않다는 점, 자유무역지역·경제자유구역에서 커피 제조·가공·위탁가공을 추진할 때 적용되는 입주 범위와 과세·통관 기준이 복잡하다는 점 등이 문제로 제기됐다. 경자청은 이를 ‘카페인 성분함량 표시·인증 기준 정비’와 ‘자유무역지역 내 커피 제조·가공 제도 개선’ 과제로 이끌어냈다.  선박부품과 물류 분야에서는 선박용 기계·부품을 전문적으로 보관·관리할 수 있는 물류체계와 스마트물류센터를 항만배후부지에 조성할 경우, 관련 인증 기준과 입주·지원제도가 함께 설계돼야 한다는 의견이 제시됐다. 암모니아 등 청정연료 분야에서는 선박용 연료·버너·보일러에 대한 안전기준과 인증체계를 미리 정비해, 향후 국제 규범(IMO 기준)과 국내 실증·사업화를 연계할 수 있는 기반이 필요하다는 점이 공통적으로 도출됐다.  경자청은 이번에 정리된 과제들을 향후 ‘커피산업 활성화 테스크포스(TF)’, ‘글로벌 물류혁신 TF’, ‘스마트수송기기 기획위원회’ 등 구역 내 협의체 안건으로 상정해 구체화할 예정이다. 각 TF·위원회에서 논의된 내용을 바탕으로 관계부처 공모사업과 정책 제안으로 연계해 나간다는 구상이다.  박성호 경자청장은 “이번 전략품목 신규사업화 컨설팅은 기업의 신규사업 아이디어를 구체화하는 것에 그치지 않고, 현장에서 체감하는 규제·제도 문제를 체계적으로 모아냈다는 데 의미가 있다”며 “경자청에서 운영하고 있는 TF, 위원회와 연계해 기업들의 목소리가 실제 제도 개선과 국비사업으로 이어질 수 있도록 후속 지원을 강화하겠다”고 밝혔다.",https://n.news.naver.com/mnews/article/014/0005446162
2025-12-09 10:24:00,"삼성증권, 'DC형 퇴직연금' 신규 가입 이벤트","[파이낸셜뉴스] 삼성증권은 오는 31일까지 '웰컴 퇴직연금 DC이벤트'를 진행한다고 9일 밝혔다.  행사 기간 내 삼성증권에서 퇴직연금 DC형 계좌를 신규 개설한 고객에게 커피 쿠폰이 제공된다. 조건 충족 후 이벤트 신청을 한 고객 전원에게 지급된다.  상품은 DC계좌 개설 완료 시기에 따라 분할 지급된다. 이벤트 기간 내 개설 완료 시 내년 1월 말, 이벤트 기간 내 전환신청 후 내년 1월 말까지 개설 완료 시 2월 말 지급될 예정이다.  삼성증권 모바일 앱 엠팝(mPOP)에서는 연금 관련 정보를 제공하고 있다. '연금정보' 탭에서 △유용한 연금정보 △연금 ETF 랭킹 △연금펀드·TDF랭킹 등 투자자들이 본인의 운용 성향과 시장 트렌드에 맞춰 연금계좌를 운용할 수 있도록 도움을 준다.  삼성증권 관계자는 ""삼성증권은 퇴직연금 DC형 가입자들이 계좌를 효율적으로 운용할 수 있도록 다양한 서비스를 제공하고 있다""며 ""앞으로도 연금 고객 경험을 높이기 위한 서비스를 꾸준히 이어 나갈 것""이라고 밝혔다.",https://n.news.naver.com/mnews/article/014/0005446161
2025-12-09 10:23:00,"野, 민생법안도 필리버스터..“與, 쟁점법안 올리지 말라”","[파이낸셜뉴스] 국민의힘은 9일 국회 본회의에서 더불어민주당이 쟁점법안들을 올릴 경우 비쟁점 민생법안 70여건에 대해서도 필리버스터(국회법상 합법적 의사진행 방해를 위한 무제한토론)를 진행한다는 방침이다.  최은석 국민의힘 원내수석대변인은 이날 국회에서 열린 원내대책회의 직후 기자들과 만나 “민생법안도 필리버스터 대상에서 배제하지 않는 건, 민주당이 오늘 민생법안만 올리더라도 내일(10일) 예정된 임시국회에서 사법파괴 악법들을 통과시킬 계획이기 때문”이라며 “사법과 헌법을 파괴하는 악법에 대해 국민에 호소 드릴 수밖에 없다는 걸 이해해 달라”고 밝혔다.  국민의힘은 전날 의원총회에서 민주당이 쟁점법안을 상정하지 않겠다고 약속하지 않으면 앞으로 본회의에 오르는 모든 안건들에 필리버스터를 실시하기로 정했다.  국민의힘은 소속 의원들에게 보낸 문자메시지에서 “민주당이 쟁점법안을 올리지 않겠다는 선언이 없을 시 향후 본회의에 상정되는 모든 안건에 대해 무제한토론을 실시하기로 결정했다”고 전했다.  실제 필리버스터 실시 여부는 이날 우원식 국회의장 주재 여야 원내대표 회동 결과에 따라 결정될 예정이다. 국민의힘이 극렬히 반대하는 법안은 내란전담재판부 설치법안과 판·검사 처벌 법 왜곡죄 도입 형법 개정안 등이다.",https://n.news.naver.com/mnews/article/014/0005446160
2025-12-09 10:20:00,"""아내가 5명, 자식은 14명"" 일부다처제 남성 사연 화제","[파이낸셜뉴스] 미국에서 5명의 아내와 14명의 자녀를 둔 남성의 사연이 공개되며 이목을 끌고 있다.  현지시간 8일 더선 등 외신에 따르면, 미국에 거주하는 제임스 배럿(30)은 5명의 아내와 14명의 자녀를 둔 것으로 알려졌다. 그는 사회관계망서비스(SNS)를 통해 대가족의 일상을 공개하며 11만2000명 이상의 팔로워를 확보했다.  배럿은 ""사람들은 '폴리아모리'라는 말을 들으면 진정한 가족도, 사랑도 없다고 생각한다""면서도 ""하지만 우리를 보면 그들이 틀렸다는 것을 증명할 수 있다""고 밝혔다. 폴리아모리는 '많은'을 의미하는 그리스어 '폴리'(poly)와 '사랑'을 뜻하는 라틴어 '아모르'(amor)의 변형인 '아모리'(amory)가 합쳐진 합성어다.  폴리아모리는 서로를 독점하지 않고 두 명 이상의 사람을 동시에 사랑하는 개념을 의미한다. 폴리아모리스트들은 전통적인 혼인 관계에 얽매이지 않고 한 사람에게만 집중하지 않는 연애 방식을 지향하는 것으로 전해졌다.  배럿의 5명인 아내는 캐머런(29), 제시카(31), 레타(28), 개비(30), 다이애나(30)로 구성됐다. 이들은 스스로를 '자매 아내'라고 칭하며 자녀 양육에 서로 협력하고 있다고 설명했다.  제임스는 ""캐머런과 제시카와 가장 오랫동안 함께 지냈다""며 ""가장 최근에 결혼한 아내는 다이애나로 4년 동안 함께 지내고 있다""고 밝혔다. 그는 또한 ""과거 일부일처제 관계에서도 항상 바람을 피워왔다""면서 ""다양성에 대한 열망을 가지고 있었으며, 이는 여성뿐만 아니라 모든 것에 해당한다""고 덧붙였다.  그는 ""폴리아모리가 자신의 관계와 육아 방식을 개선했다""며 ""사랑과 양육에 있어 배우자들의 많은 도움을 받고 있으며, 많은 아이를 원했는데 그렇게 되어 기쁘다""고 말했다.  그러나 배럿은 폴리아모리가 항상 긍정적인 면만 있는 것은 아니라고 설명했다. 그는 ""5명의 아내와 14명의 아이를 이끄는 것은 힘든 일이며, 이들에게 정서적, 재정적 지원을 제공하는 것 또한 어려운 과제다""라고 강조했다.",https://n.news.naver.com/mnews/article/014/0005446159
2025-12-09 10:19:00,"부동산원, 토지보상법연구회와 손실보상 연구 협력 MOU","[파이낸셜뉴스] 한국부동산원은 지난 5일 서울지역본부에서 한국토지보상법연구회와 '공익사업 손실보상 제도 관련 연구 협력을 위한 업무협약'을 체결했다고 9일 밝혔다. 이번 협약은 손실보상 제도 관련 연구성과와 데이터 공유, 정책 발굴에 기여하기 위해 마련됐다.  양 기관은 이번 협약을 통해 △손실보상 법제 개선에 관한 연구 교류 △공익사업·손실보상 분야 사회적 쟁점 해결방안 모색 △학술행사를 통한 연구성과 공유 및 확산에 상호 협력하기로 했다.  아울러 두 기관은 같은 날 '공익사업 활성화와 정당보상 실현을 위한 정책 제언'을 주제로 학술세미나도 공동 개최했다.  세미나에서는 △토지보상법에 따른 보상금 산정·지급 단계의 문제점과 개선방안 △개발부담금제도의 최근 쟁점과 개선방안 △공익보상지원센터 설립 필요성 등에 대한 논의가 이뤄졌다.  부동산원 김남성 산업지원본부장은 ""이번 업무협약과 학술세미나가 보상제도의 공정성·투명성 제고와 공익과 사익의 균형을 위한 시발점이 되길 기대한다""며 ""앞으로도 부동산원은 공익사업 활성화와 정당보상을 위한 논의를 지속해 보상전문기관으로서의 역할을 강화하겠다""고 말했다.",https://n.news.naver.com/mnews/article/014/0005446158
2025-12-09 10:17:00,"롯데손해보험, '스키 보험' 새단장...시즌권 플랜으로 보장 확대","[파이낸셜뉴스] 롯데손해보험은 겨울 스키 시즌을 맞아 생활밀착형 보험 플랫폼 '앨리스'(ALICE™)를 통해 'CREW 스키보험'을 새롭게 단장하고 '시즌권' 플랜을 신설했다고 9일 밝혔다.  'CREW 스키보험'은 지난 7월 출시한 '서핑보험'에 이어 롯데손해보험이 선보이는 계절별 미니보험으로, 연령·성별에 관계없이 스키, 보드 등 겨울 스포츠를 즐기는 고객이 부상을 입었을 때 보장받을 수 있는 상품이다.  특히 이번 'CREW 스키보험'에 새롭게 추가된 '시즌권' 플랜은 스키장 시즌권을 구매해 스키장에 장기 체류하거나 자주 방문하는 이용객을 위해 마련됐다.  과거 스키장을 찾는 사람들은 본인이 가입한 실손보험이나 일상생활 배상책임 보험 등을 가입해야 스키장에서 발생하는 사고를 보장받을 수 있었다.  반면 'CREW 스키보험'은 하루만 스키장을 갈 계획이라면 ‘1회권’ (24시간 보장)플랜을 선택해서 1000원으로 가입이 가능하고, 스키장 폐장까지 오래도록 즐길 스키어라면 ‘시즌권’(26년 3월 폐장까지 보장) 플랜을 선택해 가입 가능한 장점이 있다.  ‘시즌권’ 플랜의 보험료는 약 1만원 수준이며 주요 보장 항목은 △후유장해 진단 시 최대 3000 만원 △골절 진단 시 20만원 △스키 중 배상책임 300만원 △골절 수술 시 20 만원 △깁스 치료 시 10만원 등이다.  한편 'CREW 스키보험'은 ‘X5 시즌권’과 제휴하여 X5 시즌권 교부 데스크(모나용평, 하이원, 웰리힐리파크, 엘리시안 강촌, 지산)에 비치된 스키보험 QR코드를 통해 모바일로 손쉽게 가입이 가능하다.  롯데손해보험 관계자는 “서핑과 스키 등 계절 스포츠 활동 인구가 늘면서 안전사고에 대한 대비 필요성도 커지고 있다”며 “앞으로 계절별 맞춤형 보험 서비스를 지속적으로 확대할 계획”이라고 말했다.",https://n.news.naver.com/mnews/article/014/0005446157
2025-12-09 10:15:00,김동원 한화생명 사장 “아부다비와 지속가능한 금융 파트너십 구축”,"[파이낸셜뉴스] 김동원 한화생명 최고글로벌책임자(CGO) 사장이 8일(현지시간) 아부다비 금융주간(Abu Dhabi Finance Week, ADFW) 2025의 글로벌 마켓 서밋(Global Markets Summit) 개회사를 맡아, 양국 협력의 의미와 금융의 역할을 강조했다. 글로벌 마켓 서밋은 ADFW 2025의 공식 세션으로, 글로벌 자본시장의 구조적 변화를 다각도로 분석하고, 향후 자본 네트워크의 방향을 제시하는 장이다.  김동원 사장은 “한국과 UAE는 1980년 수교 이후 협력의 지평을 꾸준히 넓혀왔다”며 “금융사로서 양국의 ‘100년 동행’을 다음 세대까지 이어가는 데 앞장서겠다”고 밝혔다.  이어 김 사장은 “한국과 UAE는 위기를 기회로 바꾸고, 변화를 두려워하지 않으며, 신뢰 기반의 장기적인 관계를 지향하는 DNA를 공유하고 있다”며 “양국의 지속가능한 금융 파트너십 구축을 위해 금융의 역할이 중요하다. 금융은 협력의 의지를 기회로 전환시키는 촉매이며, 산업과 혁신을 살아 움직이게 하는 핵심”이라고 강조했다.  김 사장은 이러한 맥락에서 아부다비와의 실질적이고 지속 가능한 협력의 중요성을 언급했다. 그는 “아부다비의 고도화된 시장 인프라를 바탕으로, 새로운 금융 생태계를 함께 만들어갈 것”이라며 양국의 미래 협력이 △실물 자산 공동투자 △공급망 금융 △국경 간 결제 인프라 고도화 △디지털 자산 플랫폼 구축 등 금융 분야를 중심으로 확대될 것이라고 전망했다.  또한 “아부다비와 한국이 함께 만들어 갈 여정이 미래 금융의 글로벌 기준점이 되기를 기대한다”며 한화금융이 미래 금융 전환의 중심 파트너로 UAE와 긴밀히 협력하겠다는 의지를 표했다.  한편 한화생명, 한화손해보험, 한화자산운용, 한화투자증권 등 한화 금융 계열 4개사는 ADFW 2025의 프리미어 파트너로 참여했다.  ADFW는 아부다비 왕세자 후원 아래 아부다비 글로벌 마켓(ADGM)이 주최하는 중동 최대 금융 행사로, 글로벌 주요 금융 리더들이 한자리에 모여 미래 금융의 주요 의제와 협력 방향을 논의하는 플랫폼으로 자리 잡았으며 올해로 4회째를 맞았다.  올해 ADFW는 ‘자본 네트워크의 재구축(Engineering the Capital Network)’을 주제로 글로벌 자본의 흐름을 재설계하고 전통 금융과 디지털 금융이 결합하는 새로운 금융 운영체계를 구축하는 방안을 집중 논의하고 있다. 이와 함께 온체인 금융과 실물 기반 디지털 자산 구조화 등 차세대 금융 인프라 전환이 핵심 의제로 다뤄지고 있다.",https://n.news.naver.com/mnews/article/014/0005446156
2025-12-09 10:15:00,"교촌에프앤비 문베어, 오라카이 청계산 호텔 입점","[파이낸셜뉴스] 교촌치킨을 운영하는 교촌에프앤비는 수제맥주 브랜드 문베어가 '오라카이 청계산 호텔'에 입점한다고 9일 밝혔다.  서울 서초구 청계산 입구에 자리한 오라카이 청계산 호텔은 193개 객실을 갖춘 4성급 프리미엄 호텔이다. 글로벌 호텔 체인인 베스트 웨스턴의 상위 등급 '프리미어 컬렉션'브랜드다.  이번 입점으로 문베어는 윈디힐 라거, 문댄스 골든에일, 짙은밤 페일에일, 소빈블랑 IPA, 모스카토 스위트 에일 등 총 5종을 선보인다. 문베어는 정통 독일식 라거부터 과일향을 살린 IPA, 스위트한 에일까지 폭넓은 맛의 스펙트럼을 갖추고 있다.  문베어 관계자는 ""앞으로도 다양한 공간에서 문베어가 지향하는 수제맥주의 즐거움을 전할 수 있도록 노력하겠다""고 말했다.",https://n.news.naver.com/mnews/article/014/0005446155
2025-12-09 10:14:00,"항문에 5830명 투약분 마약 은닉... 인천공항세관, 외국 여행객 적발","[파이낸셜뉴스] 관세청 인천공항세관은 MDMA 175.13g을 신체 은밀한 부위에 은닉한 채 인천공항에 입국한 네덜란드 국적 A씨를 '마약류 관리에 관한 법률' 위반 혐의로 검거해 검찰에 구속 송치했다고 9일 밝혔다.  MDMA(Methylenedioxymethamphetamine)는 ‘엑스터시’, ‘도리도리’ 등으로 불리며 파티, 클럽문화에서 악용되는 마약이다. 강한 환각작용을 유발하며 우울증, 기억력저하, 불안장애 등의 부작용을 유발한다.  이번에 적발된 MDMA는 약 5830명이 동시에 투약할 수 있는 규모다.  인천공항세관은 유럽발 여행자에 대한 우범성 분석 과정에서 A씨를 고위험 마약 운반책으로 분류하고, 입국 후 면세라인(신고물품 없음)을 통과하려는 A씨를 검사대로 인도해 정밀 검색을 실시했다. A씨의 휴대품 검사 과정에서 헤드셋 상자 바닥에 은닉된 MDMA 4덩이 34.69g이 적발되자 수사관들은 A씨에 대한 추가 정밀 검사를 진행했고, 그 결과 항문에서 MDMA 16덩이를 추가 발견해 총 20덩이 175.13g을 적발했다.  수사 결과, A씨는 네덜란드 현지 노숙자 쉼터에서 생활하던 중 네덜란드 마약 조직으로부터 일정 금액을 받는 조건으로 마약을 운반해달라는 의뢰를 받은 것으로 드러났다.  A씨는 조직으로부터 캡슐 형태로 제작된 MDMA를 제공받아 항문에 삽입한 뒤 기차를 타고 프랑스로 이동해, 프랑스 파리 공항에서 인천공항으로 밀반입을 시도한 것으로 확인됐다.  A씨가 시도한 밀수 방법은 ‘바디패킹(Body Packing)’이라고 불리며, 마약을 사람의 몸속에 숨겨 운반하는 방법이다. 은닉성이 높은 대신 체내에서 약물이 유출될 경우 사망에 이를 수 있는 위험성이 있어, 국제 마약조직이 취약계층을 대상으로 운반책을 모집할 때 사용하는 방식으로 알려져 있다.  인천공항세관 관계자는 “최근 마약 밀수 수법이 점점 극단화·지능화되고 있는 가운데, 사회 취약계층을 마약 운반책으로 이용하는 사례가 발생하고 있다”며 “인공지능(AI) 기반 위험분석 시스템을 활용해 우범여행자 선별·검사를 강화하는 등 마약류 밀반입 시도에 엄정하게 대응하는 한편, 마약 대리 반입의 위험성도 지속적으로 홍보하겠다”고 말했다.",https://n.news.naver.com/mnews/article/014/0005446154
2025-12-09 10:10:00,"비트코인, 9만달러선…FOMC 앞두고 관망세 [크립토브리핑]","[파이낸셜뉴스] 비트코인이 9일 9만달러선에 거래되고 있다. 미국 연방공개시장위원회(FOMC) 회의를 앞두고 관망세가 형성된 것으로 풀이된다.  글로벌 가상자산 정보 플랫폼 코인마켓캡에 따르면 비트코인은 이날 오전 10시 기준 전일대비(24시간 기준) 0.08% 오른 9만달러선에 거래 중이다. 비트코인은 최근 일주일 동안 4.37% 상승했다.  비트코인은 원화마켓에서 1억3400만원선에 거래되고 있다. 글로벌 가상자산 시황 비교 플랫폼 크라이프라이스 기준 한국 프리미엄은 1.25%다.  미국 연방준비제도(연준)는 9일(현지시간)부터 이틀간 FOMC를 열고 기준금리 인하 여부를 결정할 계획이다. 시장에선 기준금리를 0.25%p 인하할 것이라고 보고 있다. 반면 제롬 파월 연준 의장이 내년 금리 기조에 대해 어떤 입장을 보일 지에 대해서도 경계하는 모습이다.  뉴욕 증시도 관망세에 들어갔다. 8일(현지시간) 다우존스산업평균은 전 거래일 대비 215.67p(0.45%) 하락한 4만7739.32, 스탠더드앤드푸어스(S&P)500은 23.89p(0.35%) 내린 6846.51로 장을 마쳤다. 나스닥은 32.22p(0.14%) 하락한 2만3545.90으로 거래를 마쳤다.  코인마켓캡이 제공하는 ‘가상자산 공포 및 탐욕 지수’는 이날 25로 ‘공포’를 나타냈다. 수치는 0부터 100사이를 나타내는데, 0에 가까울수록 ‘극단적 공포’를, 100에 가까울수록 ‘극단적 탐욕’ 상태로 해석된다.  같은 시간 이더리움은 전일대비 1.73% 오른 3118달러선에 거래 중이다. 리플은 1.38% 상승한 2.07달러선에 거래되고 있다.",https://n.news.naver.com/mnews/article/014/0005446153
2025-12-09 10:10:00,"부산해수청, 해양오염 예방 등 겨울철 안전대책 시행","[파이낸셜뉴스] 부산지방해양수산청이 겨울철 기상악화에 대비해 항만 현장에서 벌어질 수 있는 각종 안전사고를 예방하기 위해 오는 10일부터 안전점검에 돌입한다.   부산해수청은 오는 10~19일 해양수산환경팀이 ‘유류 등 해양시설 대상 안전점검’을 시행하고 공유수면팀이 오는 10~24일 ‘계선 신고 선박 대상 안전점검’을 진행한다고 9일 밝혔다.  먼저 해양시설 대상 안전점검은 시설 소유자의 안전점검 이행 여부와 기름이나 유해 액체물질이 해양에 배출될 경우 조치해야 하는 해양오염 비상계획서 작성 여부를 살펴본다. 또 방제자재 약재 비치 여부, 저장탱크와 돌핀 또는 원유 송유용 부이 등 관련 시설에 대한 안전 문제를 집중적으로 들여다볼 예정이다.  이번 점검에서 기름을 비롯한 각종 저장시설과 방제자재 노후에 따른 안전문제가 우려되는 곳이 있으면 시정조치와 함께 재점검을 진행해 점검 실효성을 높인다. 또 위법 사항이 확인된 사업장의 경우 관계 법령에 따라 행정처분에 나선다는 방침이다.  부산해수청 서밀가 해양수산환경과장은 “해양 오염사고는 예방과 초기 대응이 무엇보다 중요하다”며 “이에 점검 체계를 강화해 해양 환경 보호에 최선을 다하겠다”고 강조했다.  24일까지 이어지는 계선 신고 선박 대상 안전점검은 20톤 이상 선박 중 부산 북항과 신항, 감천항의 수상구역 등에 정박하거나 장기 계류하고자 하는 선박을 대상으로 진행한다. 이들 선박은 ‘선박의 입항 및 출항 등에 관한 법률’ 제7조에 따라 항만 관리기관인 부산해수청에서 지정한 장소에 계선해야 한다.  점검은 해상과 육상에서 병행 진행돼 선박의 실제 위치를 확인하고 안전관리자의 상주 여부와 관리 실태, 장비와 비상연락망 비치 여부, 고박 상태, 주변 통항로 확보 등을 확인한다. 지정 장소에 계선하지 않은 선박에는 계선 신고가 취소되며 신고 없이 정박한 선박에 대해선 자진신고를 위한 계도기간을 운영, 이후에도 미신고 정박 시 관계법에 따라 과태료가 부과된다.  부산해수청 서 과장은 “부산항 내 계선 신고 선박에 대한 주기적인 안전 점검을 시행해 원활한 선박 통항과 계류지 안전질서 유지에 집중할 것”이라고 말했다.",https://n.news.naver.com/mnews/article/014/0005446152
2025-12-09 10:08:00,"""태극기만 덕지덕지, 기괴한데?"" 정체불명 '한복' 등장한 사우디 축제","[파이낸셜뉴스] 최근 사우디아라비아 중심가에 '코리아 빌리지'가 조성된 가운데 정체 불명의 한복이 등장해 논란이 일었다.  한국 홍보 전문가 서경덕 성신여대 교수는 9일 ""현지 한국인들의 제보를 받고 SNS로 영상을 확인한 결과, 행사 현장에서 기괴한 형태의 한복 차림을 한 여성들이 등장하고 있었다""고 밝혔다.  코리아 빌리지는 사우디의 대표 글로벌 축제 '리야드 시즌(Riyadh Season)' 행사장 내에 조성된 복합문화공간으로, K-팝, K-푸드, K-패션, 전통 공예 등 한국 문화를 체험할 수 있다.  문제는 이 과정에서 정체 불명의 한복을 입고 한국 문화를 알리는 등 교두보 역할을 하는 공간의 의미가 퇴색했다는 지적이 일었다.  문제의 한복은 전통 디자인과 거리가 멀고, 장식구가 과해 오히려 한국 문화의 정체성을 훼손한다는 우려의 목소리가 나왔다.  서 교수는 ""전통 한복 디자인과는 거리가 멀다""며 ""무엇보다 태극기만 덕지덕지 붙여놨다고 해서 한복으로 간주할 수는 없을 것""이라고 말했다.  이어 ""중동 지역에 한국 문화를 알린다는 좋은 취지로 시작된 일이지만 한국의 전통 의상인 '한복'에 대해 좀 더 자문을 받고 진행했어야 했다""고 지적했다.  특히 ""최근 중국은 한복의 원조가 '한푸'라며 억지 주장을 계속 펼치고 있는데, 이런 상황들은 빌미만 제공할 따름""이라고 우려했다.  이에 서 교수는 ""주최측은 제대로 된 한복으로 빨리 교체해 SNS상에서 중동인들에게 오해를 불러 일으키지 않도록 해야만 할 것""이라고 강조했다.",https://n.news.naver.com/mnews/article/014/0005446151
