날짜,제목,본문,링크
2025-12-14 13:02:00,"""휴전은 무슨""...트럼프도 못말리는 태국·캄보디아 분쟁, 총성 계속","[파이낸셜뉴스] 도널드 트럼프 미국 대통령의 휴전 중재에도 태국과 캄보디아 간 무력 충돌이 수그러들지 않고 있다. 태국이 휴전에 합의한 적이 없다며 군사 작전을 이어가자 캄보디아는 국경 통행을 전면 차단하며 맞대응에 나섰다.  14일(현지시간) 캄보디아 국방부는 태국군의 폭격이 멈추지 않고 있다며 태국과의 모든 국경 통행을 전면 차단했다고 밝혔다. 국경 봉쇄 기간에 대해서는 별도 시한을 두지 않고 추후 공지하겠다고 설명했다. AFP 통신은 이번 조치가 트럼프가 전날 ""양국이 교전을 중단하고 휴전 협정으로 복귀하기로 했다""고 발표한 직후에도 태국이 강경한 태도를 유지한 데 따른 대응이라고 전했다.  그러나 태국과 캄보디아 정상 모두 트럼프가 언급한 합의 내용을 공식적으로 확인하지는 않았다. 최근 트럼프가 전화 통화를 한 아누틴 찬위라꾼 태국 총리와 훈 마네트 캄보디아 총리는 휴전 합의에 대해 별다른 언급을 하지 않았다. 오히려 아누틴은 통화 이후 ""우리 영토와 국민에 더 이상 피해와 위협이 없다고 느낄 때까지 군사 작전을 계속할 것""이라고 밝혔다.  미국 백악관은 태국의 강경 기조가 이어지자 공개적으로 경고에 나섰다. 캐롤라인 레빗 백악관 대변인은 성명을 통해 ""(트럼프) 대통령은 모든 당사국이 지난 10월 평화 협정에 서명하며 약속한 내용을 완전히 이행할 것을 기대한다""며 ""살상을 중단하고 지속 가능한 평화를 보장하기 위해 필요하다면 책임을 묻겠다""고 말했다.  아세안 의장국인 말레이시아도 중재에 나섰다. 안와르 이브라힘 말레이시아 총리는 소셜미디어(SNS)를 통해 추가 군사 행동을 자제하라고 양국에 촉구하면서 말레이시아군 총사령관이 이끄는 아세안 관측단을 국경 지역에 배치하겠다고 밝혔다. 미국 정부가 위성 감시를 지원할 것이라는 계획도 함께 언급했다. 훈 마네트는 안와르가 제안한 ""13일 저녁부터 적대 행위 중단""을 환영한다고 했지만, 태국은 즉각적인 휴전에 선을 그었다.  태국 국방부는 트럼프의 중재 발표 이후에도 자국 군인 4명이 추가로 사망했다고 발표했다. 이번 충돌로 지금까지 태국에서는 군인 15명과 민간인 3명이 숨지고 270명이 부상을 입었다. 캄보디아에서는 민간인 11명이 사망하고 70명 넘게 다친 것으로 집계됐다. 태국과 캄보디아는 프랑스 식민지 시기인 1907년 처음 측량된 817㎞ 국경선 가운데 일부 구간의 경계가 확정되지 않으면서 100년 넘게 영유권 분쟁을 이어오고 있다.  #태국캄보디아 #동남아분쟁 #트럼프중재 #ASEAN #국경분쟁",https://n.news.naver.com/mnews/article/014/0005448512
2025-12-14 13:01:00,부산 삼락 강변대로서 차량 역주행 3중 충돌…3명 부상,"[파이낸셜뉴스] 지난 13일 오후 6시 55분께 부산 사상구 삼락생태공원 앞 강변대로에서 역주행 차량에 의한 3중 추돌이 발생해 3명이 부상을 입는 사고가 났다.  부산 사상경찰서는 이날 오후 사상~구포 방면 강변대로에서 역주행 교통사고 신고를 접수했다고 14일 밝혔다.  당시 강변대로 출구 방면을 진입한 운전자 A씨(60대) 차량은 그대로 도로를 역주행하며 1차로를 진행하던 B씨의 차량과 1차 충돌 후 연이어 2차로의 C씨 차량과 부딪혔다.  사고로 운전자 A씨는 병원으로 후송됐으며 B씨(50대)와 C씨(20대) 또한 경상을 입은 것으로 확인됐다. A씨는 의식은 있으나 부상 정도로 인해 현재 경찰 조사를 받지 못하고 있는 것으로 전해진다.  다만 경찰 음주측정 결과 운전자들은 모두 음주 상태는 아닌 것으로 보여진다. 이에 경찰은 역주행을 한 A씨가 길을 잘못 들은 것으로 추정하고 있다.  경찰 관계자는 “당시 CCTV 등을 토대로 살펴본 바, A씨가 강변대로 출구를 진입로로 착각해 잘못 진입한 것으로 보인다”며 “다만 차량 블랙박스와 주변 CCTV 등 영상자료 추가 분석을 진행 중이다. 향후 A씨의 상태가 괜찮아지면 추후 조사를 진행할 예정”이라고 설명했다.",https://n.news.naver.com/mnews/article/014/0005448511
2025-12-14 13:00:00,"""전통시장이 직접 만든 수제맥주, 가게에 납품까지""","[파이낸셜뉴스] 특색 있는 전통시장이 지역 문화의 아이콘으로 자리잡고 있다. 단순한 장보기 공간을 넘어 '시민이 머물고 즐기는 시장'으로 거듭나고 있는 모습이다.  소상공인시장진흥공단은 '2025년 특성화시장 육성사업' 참여시장 중 지역협력, 문화·관광자원, 먹거리 등을 연계해 시장 고유의 특·장점을 육성한 우수시장을 발굴했다고 14일 밝혔다.  이 중 서울 강북구 수유역의 '백년시장'은 시장 고유의 강점인 먹거리로 야간 상권 활성화 하는 '백년나이트' 콘텐츠를 개발해 고객 유입과 매출 증대를 이뤄냈다. 야간 상권 활성화를 위해 네온사인과 미러볼로 레트로 클럽감성의 야시장을 연출하고 합리적인 3000원 메뉴제와 수제맥주 페어링 안주, 야시장형 신메뉴 12종 개발 등 다채로운 먹거리를 제공했다.  이에 올해 9월과 10월 각 2일간 운영에 약 2만8800명 방문, 110개 점포 매출이 평소 대비 200% 이상 상승했다.  지난 2023년 대형화재로 35개 점포가 소실된 인천 동구 현대시장은 '문화관광형시장 육성사업'을 발판으로 지역 대표 문화관광 프로그램 '현대시장에서 떠나는 동구여행'을 개발했다. 지난 6월 500여명이 참여한 걷기축제는 현대시장을 출발해 수도국산달동네박물관, 송현그린공원 등 지역 관광자원을 연계한 8.3km 코스다. 시장 110개 점포 전부가 참여하며 스탬프 이벤트 등을 진행했고 모든 참가자에게 1만원 규모의 1일 이용권을 제공해 실제 소비로 연결시켰다.  행사 전후 1주일 기준 일 방문객이 3500명에서 5000명으로 약 43% 증가했고 110개 점포의 1주일 매출 증가액은 2300만원에 달했다. 신규 고객 재방문율은 60% 이상을 기록하며 내년부터 정례행사로 확대 추진하기로 했다.  석탄산업 쇠퇴와 인구 감소로 침체된 강원 정성군 고한구공탄시장은 인접한 강원랜드(하이원리조트)의 이득을 누리지 못한 '고립된 섬' 같은 상황이었다. 시장은 강원랜드, 지역 기관, 지역축제 주관 단체들을 '상생 파트너'로 재정의하고 주말 야시장 콘텐츠인 '온기 가득 달빛산책'의 시기별 협력 로드맵을 구축했다. 5월 강원랜드 '댕댕 트레킹'과 연계한 '댕댕이 콘테스트'로 신뢰를 확보했고 7~8월에는 지역축제(함백산야생화축제)와 야시장(고한맥주축제)을 융합 운영했다. 9월에는 강원랜드 '하이원 트레킹'과 '구이축제'를 연계해 시즌 이후에도 관광객 유입을 유지했다.  그 결과 야시장 참여 상인은 전년 대비 69% 증가(13팀→22팀)했고 총매출도 1억800만원에서 2억1300만원으로 2배 증가했다.  서울 목동깨비시장은 오랜기간 생활형 전통시장으로 운영 됐지만 온라인 쇼핑과 대형마트 확산으로 고객 유입 감소에 직면했다. 시장의 정체성을 강화하고 차별화된 경쟁력을 갖추기 위해 '맥주와 거리 행사'를 결합, 수제맥주 개발을 결정했다. 지난해 상인회장이 직접 수제맥주 교육을 이수한 뒤 강사를 초빙해 상인들을 대상으로 제조 교실을 열었다. 이후 페일 에일 맥주의 한 종류인 IPA 기반 레시피를 개발해 '깨비어'로 이름 붙이고 시간당 700개 캔입이 가능한 양조장을 갖추며 직접 제조 역량을 쌓아갔다. 올해부터 본격적인 상품화에 나섰다.  이후 시장 방문객은 사업 추진 전 대비 약 18%, 매출액은 39% 증가했다. 또 시장 인근 9개 음식점에 납품하며 판로도 확보했다.  소진공 관계자는 ""특성화시장 육성사업을 통해 시장별 맞춤형 지원을 강화하고 우수 사례 확산으로 전국 전통시장의 경쟁력 향상에 힘쓸 계획""이라고 말했다.",https://n.news.naver.com/mnews/article/014/0005448510
2025-12-14 12:56:00,코로나 피해 소상공인 분할상환지원 신청 내년 6월까지,"[파이낸셜뉴스] 중소벤처기업부는 '코로나19 피해 소상공인 분할상환지원' 사업 신청 기간을 내년 6월 30일까지 연장한다고 14일 밝혔다.  이 사업은 소상공인시장진흥공단의 직접 대출을 성실히 상환해 왔으나 코로나19 여파로 경영상 어려움을 겪는 소상공인을 대상으로 최대 7년 상환기간 연장과 대출금리를 1%p 감면해주는 사업이다.  당초 이달 19일까지 신청 접수를 받기로 했지만 코로나19 이후 최근까지도 경영난을 겪는 소상공인이 적지 않다는 점을 고려해 신청 기간을 연장하기로 했다.  신청은 소상공인 정책자금 누리집에서 온라인으로 가능하다. 온라인 이용이 어려운 소상공인은 전국 78개 소상공인 지원센터를 방문해 신청할 수 있다.  박상용 중기부 소상공인경영안정지원관은 ""이번 사업을 통해 소상공인의 금융 부담이 줄어 경영안정에 도움이 되길 기대한다""고 말했다.",https://n.news.naver.com/mnews/article/014/0005448509
2025-12-14 12:47:00,"경호처 ""청와대 복귀에도 댕댕런·등산 안막는다""","[파이낸셜뉴스] 대통령경호처가 14일 청와대 복귀 준비 과정에서도 경호 강화를 이유로 국민 불편을 키우는 일은 없도록 하겠다는 방침을 분명히 했다.  대통령경호처는 이날 “청와대 복귀를 대비한 경호·경비 조치를 단계적으로 진행하고 있으나, 국민과의 소통과 개방 기조가 후퇴하지 않도록 하겠다”고 밝혔다.  경호처는 청와대 안팎의 경호구역을 다시 설정하면서도 법적 기준과 안전성 검토를 바탕으로 필요한 범위에서만 최소화해 지정했다고 설명했다. 대통령 안전을 확보하면서도 시민들의 일상과 편의를 함께 고려하겠다는 취지다.  시민 불편을 줄이기 위한 조치도 이어진다. 청와대 주변을 달리는 시민 러너들의 이용은 계속 보장되며 등산로 역시 기존처럼 개방된다.  청와대로 들어갈 수 있는 5개 진입로에서는 앞으로 ‘검문소’라는 명칭을 쓰지 않기로 했다. 또 과거처럼 일반 시민의 목적지를 묻거나 소지품을 무분별하게 검사하는 관행에서 벗어나, 교통 흐름 관리 중심으로 운영할 방침이다.  현재 경복궁역청와대국립민속박물관 구간을 오가는 평일 자율주행버스 역시 시민 편의를 위해 제한 없이 계속 운행하는 방안을 검토 중이다.  경호처는 이번 청와대 복귀 준비 과정에서 경호 목적뿐 아니라 주변 환경 개선에도 힘을 쏟았다고 밝혔다. 싱크홀(땅 꺼짐) 점검, 지하 하수관 안전 점검, 교통체계 개선, 시설물·환경 정비 등을 통해 인근 주민들의 통행 여건과 재난 대응 능력도 함께 보완했다는 설명이다.  아울러 3년여간 청와대가 전면 개방되면서 생길 수 있는 보안 위험에 대비해 정부기관 합동 점검, 도·감청 탐지 활동, 각종 돌발 상황을 가정한 현장훈련도 병행하고 있다고 덧붙였다.  황인권 대통령경호처장은 “청와대 복귀에 필요한 안전 조치는 철저히 준비하되, 주권자인 국민의 일상과 편의는 최대한 존중하겠다”며 “국민주권정부가 약속한 ‘열린 경호·낮은 경호’ 원칙은 앞으로도 흔들림 없이 지켜나가겠다”고 말했다.",https://n.news.naver.com/mnews/article/014/0005448508
2025-12-14 12:46:00,반도체가 이끈 반등…연말 변동성 속 코스피 방향성 탐색[주간 증시 전망],"[파이낸셜뉴스] 이번주 국내 증시는 미국 금리 인하 기조가 유지되는 가운데 인공지능(AI) 관련 우려와 실적 기대가 교차하며 연말 변동성 국면 속 방향성을 탐색하는 모습을 보일 전망이다. 증권가는 이번주 코스피 밴드를 3900~4200선으로 제시했다.  14일 한국거래소에 따르면 지난주(8~12일) 코스피는 전주(4100.05) 대비 1.64% 오른 4167.16으로 거래를 마쳤다. 코스피에서 외국인과 기관은 각각 1조173억원, 3614억원을 순매수한 반면, 개인은 1조5173억원을 순매도했다.  지수 반등은 반도체를 비롯한 대형 수출주가 이끌었다. 글로벌 인공지능(AI) 투자에 대한 우려와 마이크로소프트의 AI 실적 눈높이가 낮아졌다는 관측이 나오며 부담으로 작용했지만 이내 우려가 불식되며 회복세를 나타냈다.  나정환 NH투자증권 연구원은 ""마이크로소프트가 AI 부문 매출 전망치를 하향 조정했다는 루머가 돌며 반도체 주가가 하락하기도 했으나 메타가 AI에 집중하겠다는 발표를 하며 강세로 전환했다""며 ""엔비디아의 H200 중국 수출 소식도 반도체 주가에 호재로 작용했다""고 설명했다.  향후 시장에서는 AI 투자에 대한 시각 변화와 미국 통화정책 흐름이 주요 변수로 작용할 전망이다. 최근 오라클의 대규모 투자 확대와 실적 부진이 맞물리며 AI 사업의 수익성에 대한 우려가 제기됐고, 이 여파로 국내 반도체와 AI 인프라 관련주도 단기 부담을 받았다.  다만 이 같은 투자는 향후 AI 수요 증가에 대비한 성격이 강하다는 평가가 이어지고 있다. 메모리 반도체 시장에서는 D램 가격 상승 흐름이 이어지며 실적 기대가 유지되고 있어, AI 인프라 전반의 투자 흐름이 급격히 꺾였다고 보기는 어렵다는 시각이 우세하다.  미국 통화정책 역시 비교적 우호적인 환경이 이어지고 있다. 최근 연방공개시장위원회(FOMC) 결과는 주식시장에 부담을 주기보다는 안도감을 주는 방향으로 해석됐다. 고용 둔화에 대한 우려는 있지만, 기준금리 인하는 경기 부양이 아닌 정상화 과정의 성격이 강하다는 인식이 확산되고 있다. 금리 인하 기조가 당분간 유지될 것이라는 기대가 이어지며, 시장 전반의 정책 부담은 제한적인 상황이다.  나 연구원은 ""이번주 다수의 미국 주요 경제데이터가 발표될 예정으로 미 연준의 정책 관련 중요한 데이터지만 12월 FOMC가 종료된 이후 발표로 시장 여파는 제한적""이라며 ""코스피는 미국 기업 실적 발표를 확인하며 4000선을 중심으로 횡보할 것으로 전망한다""고 말했다.",https://n.news.naver.com/mnews/article/014/0005448507
2025-12-14 12:45:00,"우리은행, 인공지능 디자인 플랫폼 ‘W-스케치’ 출시","[파이낸셜뉴스] 우리은행이은 생성형 인공지능(AI) 기반 이미지 제작 서비스 ‘W-스케치(W-Sketch)’를 지난달 24일 도입했다고 14일 밝혔다. 우리은행은 지난해 W-스케치 서비스의 내부 개념검증(PoC)를 거쳐 실무 활용성을 검도했다. 올해부터 전 부서가 사용할 수 있도록 W-스케치를 캐릭터·사물·일러스트 등 실제 디자인 업무 전반으로 확대 적용했다.  직원들은 명령어 입력만으로 그래픽 디자이너 수준의 이미지 결과물을 생성할 수 있다. 특히 우리금융 대표 캐릭터인 ‘위비(WeBee)’가 실무 콘텐츠에 바로 활용 가능한 수준으로 구현된 점이 특징이다.  이번 도입으로 △보고서 △영업점 마케팅 안내 △SNS 콘텐츠 등 다양한 시각자료 생산 속도가 크게 높아질 것으로 예상되며, 브랜드 일관성 강화 등 디자인 업무의 효율성도 향상될 전망이다.  우리은행은 우선 AI가 은행 브랜드 가이드에 맞는 컬러·폰트·레이아웃을 자동 추천하는 기능을 확장해 우리금융 모바일 앱 ‘우리 WON뱅킹’의 마케팅 제작 업무를 대폭 자동화할 예정이다. 추후에는 ‘W-스케치(W-Sketch)’를 ‘AI 배너생성기’로 고도화해 우리금융그룹 전 계열사로 확대할 계획이다.  국내 최초로 우리은행은 브랜드 캐릭터와 디자인 자산을 기반으로 이미지 생성 AI를 자체 구축했다. 앞으로 저작권 우려 없이 우리은행 고유의 시각 스타일을 그대로 재현할 수 있게 됐다.  우리은행 관계자는 “W-스케치는 우리금융 대표 캐릭터인 위비와 브랜드 자산을 AI 기반으로 손쉽게 확장하는 혁신적 서비스”라며 “향후 배너생성기 AI 고도화를 통해 업무 효율과 디자인 일관성을 한 단계 더 높일 것”이라고 말했다.",https://n.news.naver.com/mnews/article/014/0005448506
2025-12-14 12:45:00,'스페이스X IPO' 기대 우주항공 강세…AI는 숨 고르기[ETF 스퀘어],"[파이낸셜뉴스] 국내 상장지수펀드(ETF) 시장에서 우주항공을 중심으로 한 성장 테마가 강세를 보였다. 민간 우주기업 스페이스X의 증시 상장 기대가 확산되며 글로벌 우주산업 재평가 흐름이 나타난 영향으로 해석된다. 반면 금융 고배당 ETF와 미국 AI 테마는 리밸런싱 이슈와 과잉 투자 경계 속에 조정을 받으며 테마별 온도차가 뚜렷하게 나타났다.  14일 한국거래소에 따르면 지난 8일부터 12일까지 국내 ETF 가운데 상승률 1위는 ‘1Q 미국우주항공테크’로 9.41% 상승했다. 같은 기간 ‘TIGER K방산&우주’(6.22%), ‘KODEX K방산TOP10’(5.88%), ‘PLUS K방산’(5.45%) 등 방산·우주 테마 ETF가 나란히 상위권에 이름을 올렸다. 레버리지 및 인버스 상품과 일평균 거래량 10만주 미만 종목은 조사 대상에서 제외한 기준이다.  우주항공 ETF 강세는 글로벌 산업 전반에 대한 기대 확산이 배경으로 꼽힌다. 일론 머스크가 이끄는 민간 우주기업 스페이스X의 증시 상장 가능성이 거론되며 우주항공 산업이 장기 성장 산업으로 재조명받는 흐름이 나타났고, 방산 중심이던 투자 시선이 위성·발사체 등 우주항공 전반으로 확산되며 관련 ETF로 매수세가 유입됐다는 분석이다. 이 밖에도 우크라이나 종전 협상 불확실성이 이어지는 가운데 지정학적 긴장이 지속되며 방산주 투자심리가 유지된 점도 영향을 준 것으로 풀이된다.  이주은 신한투자증권 연구원은 ""스페이스X의 IPO는 단순 상장 이벤트가 아닌 우주 산업의 패러다임이 실험에서 거대 산업으로 전환되는 분기점""이라고 설명했다.  ‘KODEX 은선물(H)’은 한 주간 9.24% 오르며 상승률 2위를 차지했다. 글로벌 은 시장에서 공급 부족이 장기화되며 가격 랠리가 이어진 가운데, 런던과 중국 거래소 연계 창고 재고가 빠르게 감소하면서 공급 부담이 완화되지 않고 있다는 점이 지속되고 있다는 점이 상승 요인으로 작용했다.  'TIGER 2차전지소재Fn'(8.01%) 등 이차전지 관련 ETF도 반등 흐름을 보였다. 유럽 전기차 수주 재개 신호 속에 낙폭 과대 인식이 겹치며 단기 반등 흐름이 나타났다.  반면 하락률 상위권은 금융 고배당 ETF가 차지했다. ‘KODEX 금융고배당TOP10’(-5.35%)과 ‘KODEX 금융고배당TOP10타겟위클리커버드콜’(-4.51%)은 지수 리밸런싱 과정에서 신규 편입 종목의 주가 변동성이 확대되며 조정을 받았다. 선물·옵션 만기일과 맞물린 리밸런싱이 ETF 기준가에 부담으로 작용한 것으로 분석된다.  가장 중점적으로 약세를 보인 분야는 미국 AI 테마 ETF였다. ‘RISE 미국AI클라우드인프라’(-3.44%), ‘ACE 미국AI테크핵심산업액티브’(-3.25%) 등이 하락률 상위권에 포함됐다. 최근 AI 투자 확대에 따른 과잉 투자 우려가 다시 부각된 가운데, 일부 대형 기술주의 실적 부담이 겹치며 테크 업종 전반에 단기 조정 압력이 나타났다는 분석이다.  서정훈 삼성증권 연구원은 ""오라클의 실적이 기대치에 미치지 못했다""며 ""필라델피아 반도체 지수 또한 하락하며 AI 관련주를 둘러싼 경계심이 반영됐다""고 말했다.",https://n.news.naver.com/mnews/article/014/0005448505
2025-12-14 12:42:00,[이런펀드어때요?] 삼성운용 'KODEX 로봇액티브ETF',"[파이낸셜뉴스] 삼성자산운용의 'KODEX 로봇액티브'는 최근 뜨거운 감자로 떠오른 국내 로봇산업 관련 기업들에 투자할 수 있는 액티브 ETF다. 최근 인공지능(AI) 기술 진화에 힘입어 로봇의 성능이 급속도로 발달하고, 휴머노이드 상용화 기대감이 커지면서 전 세계적으로 로봇 산업 전환이 가속화되고 있는 가운데 로봇 테마에 투자하는 대표적인 국내 ETF로 투자자들 사이 주목받고 있다.  14일 삼성운용에 따르면 지난 11일 기준 이 상품의 연초이후 성과는 111%에 달한다. 최근 1개월, 3개월 성과도 각각 10.65%, 44.30%을 기록했다.  이 ETF는 iSelect K-로봇 지수를 비교지수로 하며, 비교지수 대비 초과성과를 추구하는 액티브 ETF다. 지난 2022년 11월 15일 상장한 이후 지난 10일기준 4239억원 규모로 성장했다.  펀드 운용역인 정재욱 ETF운용3팀 팀장은 ""KODEX 로봇액티브는 로봇 산업의 구조적인 성장과 정책 모멘텀이 결합된 결과로 빠르게 성장하고 있다""라며 ""미국에서 내년 중 로봇산업 관련 행정 명령을 검토한다는 소식이 전해지면서 로봇 모멘텀이 다시 상승 탄력을 받았고, 국내 정책 모멘텀도 강하다""라고 말했다. 이어 “특히 지난 4월 산업통상자원부 주도로 출범한 K-휴머노이드 연합은 참여 기업 수가 160여 개로 확대되는 등 한국 정부 또한 로봇 산업 육성에 박차를 가하고 있다”라면서 “여기에 노동 환경 변화에 따라 노동력을 로봇으로 전환하려는 움직임이 빨라질 수 있을 것이라는 기대감이 더해져 국내 로봇 관련 기업들의 주가가 상승 곡선을 그리고 있다”라고 설명했다.  현재 이 ETF엔 로보티즈, 레인보우로보틱스, 두산로보틱스 등 로봇 핵심 종목과 함께 로봇 산업 투자에 적극적인 삼성전자, NAVER, 카카오 등 국내 빅테크 기업을 높은 비중으로 담아 포트폴리오로 구성하고 있다.  정 팀장은 “이 상품은 국내 최초의 로봇 관련 종목 액티브 ETF의 장점에 관련 기업들은 물론 로봇산업에 적극 나서고 있는 네이버, 카카오 등 대기업들도 포트폴리오에 담은 점이 특징”이라며 “최근 성과에 가장 기여를 많이 한 종목은 대표적인 로봇부품 업체인 로보티즈와 삼성전자가 인수한 레인보우로보틱스, 로봇손을 만드는 자회사를 보유한 원익홀딩스, 로봇 관제시스템을 하는 클로봇 등의 기여도가 컸다”라고 전했다.  향후 운용계획과 관련 그는 현대차 그룹이 50조원 규모로 밝힌 피지컬AI, 로보틱스 미래 신사업 전략 등에 주목했다.  연초 엔비디아 젠슨황 CEO의 휴머노이드 로봇 및 피지컬 AI 비전과 함께 미국 정부 또한 로봇 산업 육성에 대한 의지가 점진적으로 강해지고 있는 것으로 파악되는 점도 호재로 봤다.  그는 “추가적으로 내년 1월부터 이어지는 CES 2026과 함께 테슬라 옵티머스 Gen 3 공개 예정, 유니트리의 신규 상장 이벤트 등 로봇 관련 모멘텀은 지속될 전망”이라며 “로봇 산업은 아직 초기이지만, 장기적인 성장성은 밝다”라고 말했다.",https://n.news.naver.com/mnews/article/014/0005448503
