날짜,제목,본문,링크
2025-12-04 13:30:00,"국민의힘 ""내란전담재판부는 헌법 파괴...어떻게 봐도 위헌""","국민의힘이 내란전담재판부 설치와 법 왜곡죄 도입을 두고 더불어민주당이 헌법을 파괴하려고 하고 있다고 강하게 비판했다.  국회 법제사법위원회 소속 국민의힘 의원들은 4일 오전 서울 여의도 국회에서 '특별재판부 설치 및 법왜곡죄 신설의 위헌성 긴급세미나'를 개최했다. 전날 법사위에서는 민주당 주도로 '윤석열·김건희 등의 국정농단 사건 진상규명을 위한 전담재판부 설치에 관한 법률안'(전담재판부설치법), 형법 개정안(법 왜곡죄, 간첩법), 고위공직자범죄수사처법 개정안을 의결했는데 이에 대한 문제를 지적하기 위한 자리였다.  장동혁 국민의힘 대표는 세미나에 참석해 ""대한민국은 검찰이 해체되고 특검이 일상화된 나라가 됐다""며 ""내란특별재판부는 한 번으로 끝나지 않을 것""이라고 밝혔다. 이어 ""내란특별재판부는 사법부 독립이라는 국민이 입혀준 옷을 입고 있는 법원을 해체하고 사실상 특별재판부란 이름으로 정권의 입맛에 맞는 법관을 임명해서 이를 일상화하겠단 선언이나 마찬가지""라고 지적했다.  송언석 국민의힘 원내대표도""내란특별재판부 설치는 100% 위헌이란 것이 대다수 헌법학자의 의견""이라며 ""민주당이 헌법을 파괴하려는 폭주를 멈추지 않고 있는데, 국민의힘은 끝까지 이에 맞서 싸우겠다""고 밝혔다.  나경원 국민의힘 의원은 ""내란특별재판부는 사법부 독립과 삼권분립, 사법의 공정성을 현저하게 침해한다""며 ""중국산 제품을 아무리 '태그 갈이'해도 한국산이 되지 않는다. 어떻게 봐도 위헌""이라고 지적했다.  법 왜곡죄에 대해서도 나 의원은 ""판·검사를 무수하게 고발하는 결과가 나올 것이고, 이제 복잡한 사건은 아무도 해결하지 않을 것""이라며 ""정치적 사건뿐만 아니라 민생 사건과도 연결된다. 터무니없는 판·검사 법왜곡죄는 소송 지옥을 만들 것""이라고 비판했다.  조배숙 국민의힘 의원은 ""민주당이 다수 의석을 점하면서 대한민국의 민주주의가 철저하게 파괴되고 있다""며 ""이재명 대통령의 사법리스크를 지우기 위해 내란몰이 특검에 이어 전담재판부까지 하는 것""이라고 주장했다.  이날 세미나에 발제자로 나선 차진아 고려대 법학전문대학원 교수는 ""내란에 관한 유죄 확정판결이 나오지 않은 상태에서 내란 관련 입법을 추진한다는 것은 매우 모순적""이라며 ""그 자체의 성격부터 개별 조문 내용까지 위헌과 모순, 혼란이 뒤섞인 문제법안""이라고 지적했다.  차 교수는 ""법관을 법원 외부세력이 고르게 하는 것은 독일 나치 시절의 특별재판소에서 정적 숙청을 위해 나치가 재판부를 구성한 것과 본질적으로 다르지 않다""고 주장했다.  지성우 성균관대 법학전문대학원 교수는 법왜곡죄와 관련해 ""법관의 소신 있는 재판에 대해 반대 정치세력이 고소·고발하게 되면 독립적인 사법권 행사가 저해된다""며 ""결국 권력이 사법부를 장악하는 수단으로 악용될 소지가 매우 크다""고 밝혔다.  내란전담재판부 설치법은 내란 혐의 피의자 사건을 전담할 재판부를 사법부 내에 신설하는 법안이다. 이 법이 통과되면 3대 특검 사건을 각각 맡을 전담재판부를 만들어 1심과 항소심을 맡기게 된다. 법 왜곡죄는 재판 또는 수사 중인 사건에 법관이나 검사가 고의로 법리를 왜곡하거나 사실을 조작해 정의 실현을 방해하는 경우 처벌하는 것이 골자다.",https://n.news.naver.com/mnews/article/008/0005287343
2025-12-04 13:30:00,"정청래 ""檢 조작기소도 내란처럼 단죄…국민적 요구 높아""","정청래 더불어민주당 대표가 4일 ""내란을 단죄하듯 윤석열 정권 동안 자행됐던 검찰의 무도한 조작 기소에 대해서도 단죄해야 한다""고 밝혔다.  정 대표는 이날 서울 여의도 국회 본관 로텐더홀에서 열린 '윤석열 정치검찰의 조작 기소 책임자 처벌 촉구를 위한 규탄대회'에서 ""범죄를 처벌해야 할 검사가 오히려 범죄를 저질렀다면 처벌하는 것이 당연하다""며 이같이 말했다.  정 대표는 ""우리는 지난 윤석열 검찰독재 정권 기간 야당 탄압, 정적 제거, 이재명 죽이기에 온몸으로 맞서 싸웠다""며 ""검찰의 칼로 이재명 (당시) 민주당 대표를 죽이지 못하자 결국 계엄군의 총·칼로 죽이려 했으나 국민들 덕분에 살아날 수 있었다""고 했다.  이어 ""(이 대통령의) 변호사비 대납이 있었다고 했는데 이 사건이 무고로 끝나자 대북 송금을 들고나왔다""며 ""또 진술 조작과 연어파티 등 검찰에서는 아니라고 항변하고 있지만 국민 대다수는 검찰의 조작 기소가 있었다고 믿고 있지 않겠나""라고 말했다.  그러면서 ""이제 내란을 단죄하는 것과 마찬가지로 검찰의 조작 기소도 단죄해야 할 시점이고 국민적 요구도 높은 상황""이라며 ""그것이 민주주의고 사법 정의""이라고 했다.  정 대표는 ""어제 12.3 비상계엄 1년을 맞이해 우리는 헌법수호와 민주주의를 지키는 것이 대한민국 국민의 바람이고 뜻이라는 것을 다시 한번 확인했다""며 ""조작 기소, 그리고 법을 악용해 정치적 반대편을 죽이려고 했던 자들을 낱낱이 고발해 그런 범죄가 다시는 발붙이지 못하도록 싸우겠다""고 말했다.  김병기 민주당 원내대표도 같은 자리에서 ""정치 검사들의 조작 수사, 조작 기소는 대한민국의 법과 상식을 무너뜨린 국가적 범죄 행위""라며 ""이들을 단죄하지 못한다면 결단코 대한민국의 민주주의는 회복될 수 없다""고 밝혔다.  그는 ""대장동 재판에서 조작된 진실이 드러났고 대북 송금 재판에서는 왜곡된 증거와 짜 맞춘 기소가 밝혀졌다""며 ""정치 검사들은 윤석열이 원하는 결론을 먼저 써 놓고 그 결론에 사실을 비틀고 증거를 감췄다""고 주장했다.  그러면서 ""민주당은 조작 수사와 조작 기소의 진실을 끝까지 추적하며 낱낱이 밝혀내겠다""며 ""국정조사와 청문회, 특검(특별검사) 등 할 수 있는 모든 수단을 총동원해 책임자와 관련자 모두 단 한 명의 예외도 없이 법의 심판대에 세우겠다""고 말했다.  한편 민주당은 지난 2일 '정치검찰의 조작 수사·조작 기소 사건 진상규명'을 위한 국정조사 요구서를 국회 의안과에 제출했다.  민주당이 제시한 국정조사 조사 범위는 △대장동 개발 비리 사건 △쌍방울 대북송금 사건 △김용 전 민주연구원 부원장 사건 △월성 원전 사건 △부동산 통계 조작 사건 △서해공무원 피살 사건 등이다. 이들 사건 수사·기소 과정에서 국가 기관에 의한 축소·은폐·조작이 있었는지 규명하겠다는 것이다.",https://n.news.naver.com/mnews/article/008/0005287342
2025-12-04 13:30:00,"조성호 KISTEP 센터장 ""韓, 피지컬 AI 메카 가능""","[편집자주] 챗GPT 등장 이후 AI가 전 세계를 뒤흔들고 있다. 이제 AI는 단순한 기술 트렌드를 넘어 국가와 기업, 개인의 경쟁력을 좌우할 패러다임의 변화가 됐다. AI는 LLM(대규모 언어모델)을 넘어 에이전틱 AI와 피지컬 AI로 진화하면 변화의 속도는 더 빨라질 전망이다. 특히 피지컬 AI는 제조 강국 대한민국의 명운을 가를 키워드가 될 수 있다. AI 시대를 이해하고 변화를 기회로 삼아 현명하게 대응할 수 있도록 한 발 앞선 전문가들의 이야기를 들어봤다. ""한국에 엔비디아 블랙웰(GB200) 칩이 26만 장 들어온다. GPU(그래픽처리장치)를 이 정도 갖고 있는 국가는 미국과 중국뿐이다. 이를 잘 활용하면 한국이 중국을 제외하고 독보적인 '피지컬 AI'(물리적 인공지능) 메카가 될 수 있다.""  조성호 KISTEP(한국과학기술기획평가원) 성장동력사업센터장은 머니투데이와의 인터뷰에서 한국 AI(인공지능) 산업에 대해 ""블랙웰의 성능이 기존 칩보다 수십 배가 좋아, 기존 주력 GPU인 호퍼(H100) 기준으로 하면 100만 장 이상이 국내로 들어오는 효과가 있다""며 이같이 말했다.  앞서 젠슨 황 엔비디아 CEO(최고경영자)는 지난 10월 아시아태평양경제협력체(APEC) 정상회의를 계기로 이재용 삼성전자 회장, 정의선 현대차그룹 회장을 만나 2030년까지 한국에 최신형 GPU 26만 장을 공급한다고 밝혔다. GPU는 AI 학습과 추론에 필요한 핵심 반도체다. 과학기술정보통신부 등에 따르면 26만 장 중 약 5만 장은 공공부문에, 나머지는 삼성·SK·현대자동차그룹(각 5만 장)·네이버(6만 장) 등 산업계에 배분된다.  조 센터장은 확보된 GPU를 '한국형 피지컬 AI 설루션'을 구축하는 데 활용해야 한다고 강조했다. 제조업 데이터 보안을 유지하고 불필요한 국부 유출을 막기 위해서다. 조 센터장은 ""(피지컬 AI 관련) 국내 설루션이 반드시 있어야 한다""며 ""이왕 들어갈 비용이라면 글로벌 빅테크(기술 대기업)가 아니라 국내 기업으로 순환되는 게 더 좋다""고 말했다.  피지컬 AI란 AI가 로봇과 자동차 등 물리적 실체를 가진 장치에 탑재돼 실제 환경에서 움직이고 보고 듣고 행동하며 주어진 작업을 수행하는 것을 말한다. 예컨대 기존의 로봇팔이 사전에 저장된 작업만 수행했다면 피지컬 AI는 자율적으로 환경에 맞게 조절하면서 제품을 생산할 수 있다.  조 센터장은 피지컬 AI에 대해 ""현재 적용되는 분야는 협동 로봇 등 제조, 자율주행 등 모빌리티가 있고 두 분야의 궁극의 기술이 하나로 합쳐지는 것이 휴머노이드(인간형) 로봇이 될 것""이라고 말했다.  한국형 설루션을 강조하는 이유는 최근 피지컬 AI가 해외 컨설팅사의 노하우, 글로벌 빅테크의 클라우드 자산·AI 등을 결합한 형태로 발전하고 있어서다.  조 센터장은 ""최근에는 매킨지앤컴퍼니, 액센추어, 베인앤컴퍼니 등 컨설팅사가 제조혁신을 추진하는 수요 기업에게 과거처럼 직접 설루션을 제공하는 것이 아니라 해당 기업을 진단한 후 수요 기업에 맞는 전문 클라우드 업체인 마이크로소프트, 아마존, 구글 등을 연결해 주는 방식으로 AX(인공지능 전환)가 이뤄지고 있다""고 설명했다.  이어 ""클라우드서비스를 쓴다는 것은 마이크로소프트, 아마존, 구글이 마련해 놓은 표준화된 데이터 포맷에 수요기업의 데이터를 저장한다는 것""이라며 ""해당 데이터가 (AI 모델과 결합돼) 피지컬 AI로 발전하고 있다""고 밝혔다.  AX를 통해 제조업 혁신을 이루려면 데이터의 측정과 저장, AI 모델 개발 등이 필요한데 글로벌 빅테크들이 클라우드서비스를 통해 데이터 저장 관련 시장을 선점하고 있다는 것이다.  조 센터장은 ""(AI 모델을) 오픈소스로 가져오더라도 우리 설루션이 없으면 우리나라 제조업이 미국 클라우드서비스와 컨설팅사에 종속될 수밖에 없다""며 ""한번 아이폰 쓰면 계속 아이폰 쓰고, 한번 안드로이드폰 쓰면 계속 안드로이드폰 쓰는 상황이 국내 공장들에게도 벌어진다는 얘기""라고 짚었다.  국내 클라우드서비스가 없을 경우 한국 제조업체들의 노하우가 해외로 유출될 수 있다는 우려도 내놓았다. 조 센터장은 ""AI 시대가 오면 데이터가 돈인데 한국은 거의 모든 산업을 갖고 있는 국가로 중국 다음으로 강력한 데이터를 가지고 있다""며 ""그 데이터를 해외 클라우드에 저장해 놓으면 유출되지 않는다는 보장을 할 수 없고 그런 의미에서도 소버린 AI(주권을 가진 AI) 생태계 안에서 데이터를 지키는 국내 설루션이 필요하다""고 강조했다.  조 센터장은 AX를 위해 국내 기업들이 적절한 데이터를 쌓는 것도 필수로 꼽았다. 그는 ""데이터라는 것이 쌓는다고 다 인포메이션(정보)이 되지는 않는다""라며 ""구조화된 데이터를 축적해야 하고, 구조화하는 것이 설루션""이라고 조언했다.  국내 기업들이 제조 관련 데이터를 충실히 쌓으면 AI 오픈소스(공개된 소프트웨어)를 활용해 피지컬 AI를 구현할 수 있다고 설명했다.  조 센터장은 ""인더스트리 4.0의 종착점이 생산에서 출하까지 한 회사 안에서 최적화하는 것이라면 인더스트리 5.0은 공급망 전체의 최적화가 될 것""이라며 ""공장과 공장을 최적화하려면 여기서도 돌아가고 저기서도 돌아가야 하고 그렇게 하기 위해서는 데이터 표준화, 오픈소스 활용이 필요하다""고 말했다.  조 센터장은 이 같은 문제가 해결되면 한국이 제조업 강국에서 피지컬 AI 강국으로 거듭날 수 있다고 강조했다. 조 센터장은 ""인구 1만 명당 로봇 보유 비중이 전 세계에서 1위인 국가가 한국""이라며 ""역설적인 건 그 로봇, 장비를 사람이 붙어서 저부가 제품을 생산하는 데 쓰고 있다는 것""이라고 지적했다.  조 센터장은 ""(우리나라에는) 장비도 있고 데이터 밑천도 있는만큼 이 부분을 혁신해서 미국 수준으로 맞추면 노동생산성을 현재의 2배 수준으로 올릴 수 있다""고 강조했다.",https://n.news.naver.com/mnews/article/008/0005287341
2025-12-04 13:30:00,"키움인베스트, 운용자산 9000억 눈앞...내년 '1조 클럽' 입성 기대","[이 기사에 나온 스타트업에 대한 보다 다양한 기업정보는 유니콘팩토리 빅데이터 플랫폼 '데이터랩'에서 볼 수 있습니다.] 키움인베스트먼트가 800억원 규모로 계획했던 세컨더리펀드를 50억원 증액해 850억원 규모로 결성한다. 이번 펀드와 함께 올해 위탁운용사(GP) 자격을 따낸 바이오, 인공지능(AI) 관련 펀드 결성이 마무리되면 운용자산(AUM) 규모는 9000억원 수준에 이를 전망이다.  4일 벤처투자업계에 따르면 키움인베스트먼트는 이달 내 결성총회를 열고 세컨더리펀드 조성을 마칠 예정이다. 한국벤처투자의 '스타트업 코리아펀드' GP로 선정된 이후 키움증권 등 그룹사의 지원을 바탕으로 펀드 결성에 속도를 냈다. 키움증권은 이 펀드에 200억원을 출자한다.  이 밖에 세컨더리펀드 민간 출자자 풀로 참여하는 IBK기업은행 등이 출자 확약을 한 것으로 알려졌다. 키움인베스트먼트는 일반적인 구주 투자 외에도 LP지분 유동화, M&A 목적 투자 등 다양하게 투자할 계획이다.  대표 펀드매니저는 김대현 대표가 직접 맡는다. 다우키움그룹 전략경영실 출신인 김 대표는 한신평정보, 유니텔, 테라스테크놀로지 등 다수의 M&A 자문을 수행하며 전략적 투자 분야에서 전문성을 쌓았다.  키움인베스트먼트는 그간 축적한 세컨더리 펀드 운용 및 청산 경험을 바탕으로 이번 GP 자격을 확보했다. 앞서 200억원 규모의 'KoFC-키움 파이오니아 챔프 2010-12호 투자조합'은 내부수익률(IRR) 17.4%를 기록했으며, 400억원 규모의 '키움성장15호세컨더리투자조합' 역시 IRR 16%의 우수한 성과로 지난해 청산을 마쳤다.  한편 결성을 추진 중인 바이오, AI펀드 펀딩도 막바지 단계다. 키움인베스트먼트는 보건복지부가 출자하는 'K-바이오·백신 6호 펀드'(목표 결성액 600억원)의 GP로 선정돼 국내 바이오헬스 및 백신 공정 개발 기업 발굴에 나설 예정이다. 또한 산업은행이 출자하는 '2025 AI코리아 펀드' 역시 당초 목표액인 750억원보다 큰 규모로 결성을 추진하고 있다.  벤처투자회사 전자공시에 따르면 지난 10월 기준 키움인베스트먼트의 AUM은 7118억원이다. 청산 펀드 등을 감안하더라도 신규 펀드가 더해지면 내년 AUM은 9000억원에 달할 것으로 보인다. 키움인베스트먼트는 오는 2026년 말까지 AUM 1조원 돌파를 목표로 외형 성장을 지속할 계획이다.  [머니투데이 스타트업 미디어 플랫폼 유니콘팩토리]",https://n.news.naver.com/mnews/article/008/0005287340
2025-12-04 13:30:00,차기 새마을금고회장 3파전… '연임 분위기' 속 고소·고발 잡음도,"차기 새마을금고중앙회장을 뽑기 위한 선거가 2주일 앞으로 다가오면서 후보자 간 경쟁이 본격적으로 시작됐다. 김인 현 중앙회장의 연임에 무게가 실리는 가운데 고소·고발 등 선거를 앞두고 잡음도 발생하고 있다.  중앙선거관리위원회는 제20대 새마을금고중앙회장 선거에 김인 현 중앙회장, 유재춘 서울축산새마을금고 이사장, 장재곤 종로광장새마을금고 이사장이 본 후보로 등록했다고 4일 공고했다.  중앙회장은 전국 1262개 새마을금고 이사장이 직접 투표해 선출한다. 투표는 오는 17일 충남 천안 MG인재개발원에서 진행된다. 이번 중앙회장 선거는 처음으로 선거관리위원회 의무위탁으로 진행된다.  현재까지는 김 회장의 연임이 유력하다는 분위기다. 김 회장은 전임 박차훈 회장이 금품수수 혐의로 기소되면서 직무가 정지되자 직무대행을 맡았다. 이후 치러진 보궐선거에서 19대 중앙회장이 됐다. 이번에도 당선된다면 새마을금고중앙회의 마지막 연임 회장이 된다.  김 회장은 뱅크런(대규모 예금인출) 사태 이후 새마을금고 건전성 관리를 강화하면서 위기를 잘 넘겼다는 평가를 받는다. 새마을금고는 올해 상반기에만 약 3조8000억원 부실채권을 매각했다. 치솟았던 새마을금고 연체율은 지난 3분기에는 6.78%까지 안정화됐다. 연말까지 5%대까지 연체율을 낮출 계획이다.  익명의 개별 금고 이사장은 ""김 회장이 조금 더 안정적으로 끌고 가줘야 한다는 여론이 많다""며 ""당선 이후 큰 과오 없이 PF 위기를 잘 수습해가고 있다는 게 긍정적인 평가를 받는다""고 밝혔다.  반면 선거를 앞두고 김 회장은 고소·고발에 휘말리기도 했다. 경찰에 따르면 서울 용산경찰서는 지난달 27일 김 회장이 성희롱 및 음란 발언을 했다는 혐의의 고소장을 접수했다. '서민금융선진화시민연대'라는 시민단체는 뇌물수수·직권남용·업무상 배임·증거인멸 교사 등 혐의로 김 회장을 지난달 29일 대검찰청에 고발하기도 했다.  이를 두고 선거가 다가오면서 유력 후보를 견제하기 위한 움직임이 본격화했다는 분석이 나온다. 새마을금고 관계자는 ""선거를 앞두고 굳이 지금 시점에서 공론화하는 건 일종의 흠집 내기로 추정된다""고 말했다.  유재춘 후보는 별도 홈페이지에서 AI(인공지능)를 활용한 선전물과 출마선언문을 게재하는 등 적극적으로 선거운동을 진행 중이다. 유 후보는 중앙회를 '지시하는 조직'에서 '지원하는 조직'으로 바꾸고, 개별 금고의 이익을 우선시하겠다는 공약을 내세웠다. 다만 유 후보가 이사장으로 있는 서울축산금고가 공격적인 PF(프로젝트파이낸싱) 영업으로 자산을 빠르게 늘렸지만, 동시에 건전성도 악화시켰다는 점은 리스크로 꼽힌다.  장재곤 후보는 금융과 유통을 연결하는 '상생경제 플랫폼' 구축을 강조했다. 이를 위해 중앙회가 홈플러스를 인수하겠다는 다소 파격적인 공약을 내걸었다. 이 외에도 PF 리스크 관리 체계를 전면 개혁하고, 농·어촌과 취약 금고를 보호해 재생시키겠다는 개혁 과제 등을 내세웠다. 새마을금고를 '소상공인·자영업자'를 위한 전문은행으로 도약시키겠다는 공약도 걸었다.",https://n.news.naver.com/mnews/article/008/0005287339
2025-12-04 13:29:00,"SK그룹, 40대 임원 전진배치…SK지오센트릭 대표 교체","SK그룹은 2026년 임원 인사와 조직개편을 단행했다고 4일 밝혔다.  SK그룹은 지난 10월 핵심과제의 성공적 수행과 마무리, 현장과 실행 중심의 리더십 전환을 위한 사장단 인사를 선제적으로 시행했었다. 임원 인사와 조직개편 또한 △현장 중심 실행력 제고 △조직 혁신과 내실 강화 △차세대 리더 육성을 기조를 키워드로 한다.  추가적인 사장단 변화가 있었다. 김종화 SK에너지 대표이사 사장이 SK지오센트릭 대표이사를 겸직하기로 했다. 석유·화학 밸류체인의 통합과 최적화를 도모하고 양사 간 시너지를 강화할 예정이다.  2026년 신규선임 임원은 85명이다. 전체의 20%인 17명이 1980년대생이다. 60% 이상(54명)이 40대로 구성됐다. 여성 신규선임 임원은 8명 중 6명이 1980년대생이다. 신규선임 임원의 평균 연령은 만 48.8세다. 지난해 만 49.4세보다 젊어졌다. 최연소 신규선임 임원은 안홍범 SK텔레콤 네트워크 AT/DT 담당으로 1983년생이다.  SK 관계자는 ""현장 중심 실행력 제고를 위해 각 사에서 사업과 기술 역량이 검증된 인력을 중용했다""며 ""젊은 인재들을 전진배치 하는 등 과감한 세대교체를 통해 현장 실행력을 강화했다""고 설명했다.  이어 ""급변하는 경영환경에 민첩하게 대응하기 위해 그룹 전반에 조직 효율화가 시행됐다""며 ""임원 조직 강소화(强少化)를 통해 '작고 강한 조직'을 구축하고 미래 성장을 준비한다는 계획""이라고 강조했다.  미래 성장분야인 AI 사업 추진 가속화를 위한 각 사의 조직 개편도 진행됐다. SK하이닉스는 글로벌 기술 리더십을 공고히 하기 위해 지역별 AI 리서치 센터를 신설하는 조직개편을 시행하고 안현 개발총괄 사장이 겸직키로 했다. SK하이닉스는 글로벌 생산 경쟁력 강화를 준비하기 위한 '글로벌 인프라' 조직도 신설한다.  SK이노베이션은 CEO 직속으로 AX단을 신설한다. SK에코플랜트는 설루션 사업(건축)과 에너지 사업(AI 데이터센터 등)을 통합한 AI 설루션 사업 조직을 출범시킨다. SK그룹 관계자는 ""현장 실행력 강화, 내실 경영, 차세대 리더 육성을 통해 본원적이면서도 실질적인 변화를 가속화한다는 계획""이라며 ""각 사의 미래 성장을 견인하기 위한 발판이 될 것으로 기대한다""고 밝혔다.",https://n.news.naver.com/mnews/article/008/0005287338
