날짜,제목,본문,링크
2025-12-07 10:25:00,"SK하이닉스, 'GSA 어워즈' 2관왕…""AI 시장 성장 이끌 것""","SK하이닉스는 지난 4일(현지시간) 미국 캘리포니아주 산타클라라에서 개최된 'GSA(세계반도체연맹) 어워즈 2025'에서 '최우수 재무관리 반도체 기업상'(연 매출 10억달러 초과 부문)과 '우수 아시아 태평양 반도체 기업상'을 수상했다고 7일 밝혔다.  GSA는 글로벌 반도체 기술 정보 공유 플랫폼이자 허브 역할을 하는 반도체 업계 CEO 네트워크 조직이다. 25개국 이상, 250개 이상의 기업 회원을 보유하고 있다. GSA가 1996년부터 개최한 'GSA 어워즈' 반도체 업계의 최고 권위 시상식으로 평가받는다.  SK하이닉스는 최우수 재무관리 부문에서 2017년에 이어 두 번째 수상을 했고, 아시아 태평양 반도체 기업 부문에서는 첫 수상의 영예를 안았다. 수상의 배경에는 글로벌 AI(인공지능) 시장에서 획기적인 HBM(고대역폭메모리)을 선제적으로 제시해 고객 수요에 적기 대응한 것이 꼽힌다.  최태원 SK그룹 회장은 평소 ""어려울 때일수록 흔들림 없이 기술 경쟁력 확보에 매진해야 한다""고 강조한 바 있다. 장기적 관점의 기술 투자와 글로벌 협력 네트워크 구축이 실적 개선과 재무 건전성 강화로 이어졌다.  SK하이닉스는 올해 분기마다 역대 최대 실적을 갈아치우고 있다. 3분기 누적 매출 64조원, 영업이익 28조원을 달성했다. 지난 3분기 말 현금성 자산이 27조9000억원으로 전 분기 대비 10조9000억원 늘면서 약 4조원의 순현금 체제로 전환하는 데 성공했다.  이러한 성과를 바탕으로 SK하이닉스는 대규모 투자를 이어가고 있다. 지난 10월 클린룸을 조기에 오픈한 청주 M15X 팹(Fab)은 빠른 장비 반입을 거쳐 내년 상반기 내 HBM 양산에 돌입할 예정이다. 올해 2월 본격 착공한 용인 반도체 클러스터 1기 팹도 당초 계획보다 빠른 준공을 목표로 건설 중이다.  김주선 SK하이닉스 AI 인프라 사장은 ""SK하이닉스를 대표해 수상하게 되어 영광""이라며 ""시장을 선도하는 제품과 차별화된 기술 경쟁력을 바탕으로 고객과 함께 새로운 가치를 창출하며 AI 시장의 성장을 이끌어 나가겠다""고 밝혔다.",https://n.news.naver.com/mnews/article/008/0005288307
2025-12-07 10:24:00,"한국타이어, 인니 수자원 지원 프로젝트 마무리…""지역사회 상생 실천""","한국타이어앤테크놀로지가 인도네시아 수자원 인프라 지원 사업인 '워터 펌프 설치 프로젝트'를 성공적으로 마무리했다고 7일 밝혔다.  한국타이어는 지난 5일 인도네시아 브카시군 스랑 바루 소재 나가 십타 마을에서 워터 펌프 설치 프로젝트를 종료하고 이를 기념하는 기증식을 진행했다.  이 프로젝트는 국제연합(UN)과 국제사회가 시행하는 '지속가능발전목표(SDGs) 2030'의 세부 목표 중 하나인 '깨끗한 물과 위생' 달성을 목표로 인도네시아 공장이 위치한 브카시 지역 사회에 깨끗하고 안전한 수자원을 안정적으로 제공하고자 지난해부터 진행됐다.  브카시 지역은 이상 기후 현상 중 하나인 '엘니뇨'의 영향으로 건기 기간 극심한 가뭄과 물 부족 사태를 겪는 곳이다. 나가 십타 마을에는 한국타이어 인도네시아공장 임직원을 포함한 300여가구가 거주하는데 이 중 50여 가구는 빈곤으로 인해 빗물을 받아 생활용수로 활용하고 있다.  한국타이어는 프로젝트 기간 브카시 지역 사회와의 긴밀한 협력을 기반으로 해당 마을에 최신 워터 펌프 설비와 보관용 물탱크를 설치했다. 생활용수 구입 비용을 낮춰 경제적 부담을 경감하는 동시에 인프라가 상대적으로 열악한 현지 생활 여건을 개선할 것으로 기대된다.  지난해 8월 츠카랑 푸삿 인근 파시란지 마을에서 진행한 프로젝트 결과 한국타이어는 지난 8월 기준 230여가구, 1100여명에 달하는 주민들에게 총 약 280만리터의 깨끗한 물을 공급해오고 있다.  한국타이어는 UN 지속가능발전목표 기반의 다양한 사회공헌(CSR) 프로젝트를 이어 나가며 인도네시아 지역사회와의 상생 실천에 속도를 내고 있다. 지난 10월에는 야간 이동 안정성 보장을 위한 고효율 LED 가로등 설치, 8월에는 5000여그루의 맹그로브를 해안가에 심는 해안 숲 조성 봉사활동 등을 진행했다.  이외에도 현지 공공기관과 민간단체를 대상으로 안전하고 효율적인 업무를 지원하고자 매년 타이어 기부를 진행하고 있고 교육기관 인프라 지원 사업, 취약계층 무료 건강검진과 기부금 전달 등 수혜자 중심의 지역 밀착형 나눔 활동을 펼치고 있다.  한국타이어 관계자는 ""인도네시아를 포함한 미국, 헝가리, 중국 등 글로벌 생산기지를 보유한 세계 각지의 지역사회와 긴밀한 소통을 이어 나가며 기업의 사회적 책임을 적극적으로 이행하는 동시에 지속가능한 미래 가치를 함께 실현해 나간다는 계획""이라고 밝혔다.",https://n.news.naver.com/mnews/article/008/0005288306
2025-12-07 10:20:00,"프라다와 어깨 나란히…""콧대 높은 프랑스 뚫었다"" 존재 과시한 '타임'","[편집자주] 주식회사 대한민국이 재도약과 도태의 갈림길에 섰다. 'K웨이브'로 달궈진 'K산업'의 성장엔진이 식기 전에 글로벌 영토 확장에 사활을 걸어야 한다. 머니투데이는 전세계 곳곳을 누비면서 '푸드·리테일·패션·뷰티' 등을 중심으로 'K이니셔티브'를 실현하고 있는 기업들이 고군분투하고 있는 현장을 집중 조명하고 대한민국의 미래를 위해 나아가야 할 방향을 제시한다.  #지난 10월2일(현지시간) 오전10시, 프랑스 파리에 있는 150여년 역사의 '사마리텐(Samaritaine Paris Pont Neuf)' 백화점에선 '2026 봄·여름(S/S) 파리 패션위크'에 맞춰 국내 여성복 브랜드인 '타임(TIME)'의 패션쇼가 열렸다. 행사 시작을 앞두고 국내·외 패션 매거진 담당자와 인플루언서, 해외 바이어 등 업계 관계자들이 줄이어 입장했다. 20여분간 진행된 쇼가 마무리되고 모델들이 한번에 등장해 인사에 나서자 무대에선 박수가 쏟아졌다. 관람을 마친 패션 관계자들은 지하 1층에 마련된 타임의 팝업 매장을 들러 제품을 살펴봤다.  현대백화점그룹의 계열사인 패션업체 한섬은 패션의 본고장으로 유명한 프랑스 파리에서 영향력을 넓히고 있다. 국내 패션 기업으론 유일하게 2019년부터 7년 연속 파리 패션위크에 참가하는 등 글로벌 인지도를 높이는데 공을 들인 결과다. 이날 타임은 루이비통모에헤네시(LVMH) 그룹 내 브랜드의 무대로 쓰이던 공간에 국내 여성복 브랜드로선 최초로 패션쇼를 열었다. 콧대높은 프랑스 여성복 시장에서 존재감을 인정받았기 때문에 가능했단 평가다. 한섬 관계자는 ""패션쇼 장소를 물색하던 중 사마리텐측의 제안을 받아 무대로 활용하게 됐다""며 ""타입 팝업스토어(임시매장)을 기념해 패션 관계자들에게 브랜드를 홍보할 수 있는 기회를 제공하는 취지로 제안받은 것""이라고 설명했다.  타임은 지난 8월말부터 2달간 사마리텐 백화점에서 타임 파리의 첫 글로벌 팝업스토어를 운영했다. '셀린느'와 '프라다' 등 글로벌 럭셔리 브랜드들이 팝업을 진행했던 공간에서 이들 브랜드와 어깨를 나란히 한 것이다. 이는 사마리텐에서 진행되는 국내 패션 브랜드의 첫 공식 팝업스토어이자 타임 파리의 첫 글로벌 오프라인 진출 무대다. 팝업 매장엔 '시나우 바이 나우(See Now, Buy Now)' 콘셉트로 쇼에서 공개된 가방을 고객이 바로 구매할 수 있도록 진열이 됐다.  한섬은 타임을 글로벌 명품 브랜드로 키우기 위한 노력을 지속해왔다. 2020년 글로벌 패션 시장 진출을 위한 테스크포스(T/F)를 구성한 것을 시작으로 글로벌 라인인 '타임 파리'의 전용 디자인실도 별도로 신설했다. 이를 바탕으로 2023년엔 글로벌 시장을 타깃으로 한 신규 라인을 선보이며 패션·유통 관계자들을 대상으로 첫 패션쇼를 열었다. 지난해부턴 파리 패션위크 기간 프랑스 현지에서 매년 2회씩 단독 프레젠테이션을 진행하는 등 글로벌 시장 공략에 속도를 내왔다.  한섬은 타임 외에도 시스템 등 주요 브랜드를 중심으로 유럽 현지 내 오프라인 유통망을 지속 확대해 나간단 계획이다. 내년 1월엔 프랑스 최대 백화점 체인인 라파예트에 남성 캐주얼 브랜드인 시스템옴므 정식 매장을 선보일 예정이다. 영국 헤롯 백화점을 비롯한 여러 글로벌 유통 업체들과도 홀세일 계약을 진행 중이다.  한섬이 이같이 전세계 패션의 중심지인 파리에서 잇단 러브콜을 받을 수 있었던 건 '디자인·품질 우선주의'를 바탕으로 40여년간 쌓아온 역량을 인정받은 결과란게 업계의 평가다. 한섬은 패션 업황이 좋지않을 때도 국내 대표 패션 기업이란 자긍심을 바탕으로 꾸준하게 글로벌 패션 브랜드로 자리매김할 수 있도록 역량을 집중해왔다.  한섬 관계자는 ""40여년간 국내 패션 시장을 선도한 업력과 10여년간 쌓아온 글로벌 시장 진출 노력이 결실을 맺고 있다""며 ""프랑스 파리를 글로벌 패션 기업 도약의 전초기지로 삼고 유럽을 넘어 북미·아시아 등으로 추가 진출도 준비하고 있다""고 말했다.",https://n.news.naver.com/mnews/article/008/0005288304
2025-12-07 10:15:00,"[메디컬아시아 2025]서울페이스21치과병원, 얼굴비대칭 교정&양악수술 부문상 수상","서울페이스21치과병원(원장 정한울)이 '메디컬아시아 2025, 제15회 대한민국 글로벌 의료서비스대상(메디컬아시아 2025)'에서 얼굴비대칭 교정&양악수술 부문상을 수상했다고 7일 밝혔다. 이번 시상식은 지난 4일 한국프레스센터 국제회의장에서 진행됐다.  서울페이스21치과병원은 '얼굴에 대한 모든 것을 다룬다'는 모토 아래 구강악안면외과, 치과보철과, 치과교정과가 유기적으로 협진하는 토탈 페이스 솔루션을 제공하고 있다. 보건복지부 인증을 받은 병원급 의료기관으로, 고성능 장비와 정부 인증 설비를 기반으로 기능과 심미의 균형을 맞춘 의료 서비스를 실현한다.  서울페이스21치과병원은 구강악안면외과에서는 양악수술, 안면윤곽수술, 비대칭 교정 등 안모 개선을 통해 턱관절 장애나 저작장애와 같은 기능적 문제를 해결한다. 단순한 뼈 수술을 넘어 연조직까지 고려해 수술 후 처짐이나 부작용을 최소화하는 것이 특징이다. 또한 치과보철과와 치과교정과의 협진을 통해 임플란트·보철치료·교정 등 개개인에게 맞는 맞춤 진료로 삶의 질 향상을 돕고 있다.  정한울 원장은 ""기능과 심미를 함께 고려한 얼굴 중심 치료로 환자들의 일상에 자신감을 더하고 싶다""며 ""앞으로도 최고의 진료를 제공하기 위해 지속적인 연구와 노력을 이어가겠다""고 밝혔다.  한편, '메디컬아시아 2025'는 우수한 의료 기술을 바탕으로 의료관광 활성화에 기여한 병의원을 선정하는 시상식으로 15회를 맞았다. 머니투데이, 봉황망길림, 미주 중앙일보 뉴욕 등 한·중·미 3개국 언론사가 공동주최하며, 보건복지부, 식품의약품안전처, 한국관광공사가 후원한다.",https://n.news.naver.com/mnews/article/008/0005288303
2025-12-07 10:02:00,"한동훈 ""통일교 로비에서 민주당만 빼준 특검, 당장 구속감""","통일교가 더불어민주당 중진 의원에게도 금품을 전달했다는 진술을 확보하고도 수사하지 않은 김건희 특검(특별검사 민중기)에 대해 한동훈 전 국민의힘 대표가 ""당장 구속감""이라고 비판했다.  한 전 대표는 전날인 6일 SNS(소셜미디어)에 ""'통일교 금품로비에서 민주당만 쏙 빼준 민주당 하청업자 민중기 특검'이야말로 민주당이 신나서 추진하는 위헌적인 법왜곡죄 최악의 적용 대상""이라며 이같이 밝혔다.  한 전 대표는 ""민주당 법안 상 (법왜곡죄는) '적용해야 함이 분명한 법령을 적용하지 않거나 왜곡하여 적용한 경우'""라며 ""물론 위헌적 법왜곡죄 없이도 현행법으로도 직무 유기, 직권남용 등으로 당장 구속감""이라고 했다.  한 전 대표는 ""민주당은 자기들이 통일교에 받은 거액 돈과 시계는 불법이 아니라 합법이라는데, 그런 헛소리 하려거든 민주당은 '그동안 계속 통일교 돈 받아먹어 왔다'고 털어놓으시라""며 ""앞으로 민주당에 입당하면 수천만 원 현금과 명품시계 받아 먹어도 되는 것이냐""고 했다.  또 한 전 대표는 ""통일교의 돈, 시계를 받은 사람들이 문재인 (전 대통령) 쪽 사람들이라 민주당 내의 권력투쟁이 예상된다고들 하던데, 그런 거 상관없이 '걸리면 가야' 하는 것""이라며 ""통일교 돈 받아먹을 때, 그런 생각 못했냐""고 했다.",https://n.news.naver.com/mnews/article/008/0005288302
2025-12-07 10:00:00,이번주 전국 10개 단지 1만가구 공급…수도권 공공분양 눈길,"이번 주 전국 분양시장은 공공분양과 수도권 핵심 입지 단지를 중심으로 공급이 이어진다.  7일 부동산R114에 따르면 12월 둘째 주에는 전국 10개 단지에서 총 1만2가구가 공급된다. 이 가운데 일반분양은 3646가구다. 경기 남양주시 진접읍 '남양주왕숙 B-17(공공분양)', 경기 군포시 대야미동 '군포대야미 A-2 신혼희망타운(공공분양)', 경남 창원시 신월동 '창원센트럴아이파크' 등이 청약을 진행한다.  모델하우스는 서울 강남구 역삼동 '역삼센트럴자이'를 비롯해 경기 오산시 '북오산자이리버블시티', 경기 이천시 '이천중리금성백조예미지' 등 7곳이 문을 연다.  경남 창원시 성산구 신월동 '창원센트럴아이파크'는 HDC현대산업개발이 신월2구역 재건축사업을 통해 공급하는 단지다. 지하 2층~지상 최고 33층, 12개 동, 총 1509가구 규모로 이 중 전용 59㎡ 36가구가 일반분양 물량이다.  단지 반경 1km 내 창원시청, 성산아트홀, 대형 백화점과 상남시장 등 생활 인프라가 밀집해 있고 가음정공원, 용지공원 등 녹지환경도 갖췄다. 차량 이동 10분 거리에는 창원국가산업단지가 있어 직주근접성이 높고, 초·중·고교가 도보권에 위치한다.  서울 강남구 역삼동 '역삼센트럴자이'는 GS건설이 역삼동 일대 재건축을 통해 선보이는 단지다. 지하 3층~지상 최고 17층, 4개 동, 총 237가구 중 전용 59~122㎡ 87가구가 일반분양된다. 수인분당선 한티역 역세권 입지에 테헤란로·강남대로 접근성이 뛰어나고, 대치동 학원가와 명문 학군이 도보권에 형성돼 있다.",https://n.news.naver.com/mnews/article/008/0005288301
2025-12-07 10:00:00,"""고객이 더 편하게""…LG전자, '컴포트 키트' 신제품 출시","LG전자는 가전제품 보조 액세서리 'LG 컴포트 키트' 4종을 새롭게 선보인다고 7일 밝혔다.  'LG 컴포트 키트'는 성별·나이·장애 유무와 상관없이 모든 고객이 가전을 편리하게 사용하도록 자체 개발한 보조 액세서리다. 제품을 기획하고 개발, 검증하는 전 과정에서 고객의 의견을 꼼꼼하게 담아냈다. '컴포트 키트'의 총 제품 수는 18종으로 는다.  신제품은 △세제 투입구와 투입량을 알기 쉽게 표시해주는 '세탁기 이지세제컵' △정수기 출수 위치에 정확하게 컵을 놓을 수 있도록 안내해주는 '정수기 이지트레이(물받침)' △도어를 편리하게 여닫도록 돕는 '식기세척기 이지핸들(도어)' △전면부 터치 버튼의 위치와 기능을 촉각으로 알도록 안내해주는 '전자레인지 터치가이드' 등이다.  특히 '정수기 이지트레이(물받침)'의 경우 초기 아이디어는 시각 장애 고객들이 정수기 출수구 위치를 찾기 어렵다는 점에서 착안해 기획됐다. 하지만 이후 시선이 낮은 휠체어 이용 고객이나 키가 작은 영유아 자녀가 사용하는 경우까지 고려해 물을 흘리지 않도록 돕는 물받침 기능까지 더했다.  'LG 컴포트 키트'는 아이디어 구상 단계부터 사용성 평가까지 전 과정에서 철저히 고객의 목소리가 반영된다. LG전자는 지난 3월 세계 최대 규모의 접근성 콘퍼런스(CSUN AT 2025)에 참가해 글로벌 고객과 업계 전문가로부터 자문을 얻었다.  또 LG전자의 가전 접근성 개선 커뮤니티 '볼드 무브(Bold Move)'와 다양한 연령와 특징을 가진 고객들로 구성된 고객 조사단이 직접 제품을 사용해보며 편의성, 실용성, 심미성 등을 종합적으로 검증했다.  백승태 LG전자 HS사업본부장 부사장은 ""고객의 목소리에 귀 기울이고 눈높이를 맞춘 'LG 컴포트 키트'를 지속해서 선보여 고객에게 더욱 편리한 가전 사용 경험을 제공할 것""이라고 말했다.",https://n.news.naver.com/mnews/article/008/0005288300
2025-12-07 09:52:00,11월에도 보이스피싱 피해 감소…'통합대응단 출범 효과' 계속될까,"경찰청은 전기통신금융사기 통합대응단이 출범한 이후 2개월 간 보이스피싱 발생건수 및 피해액이 전년 동기 대비 감소 추세로 전환됐다고 7일 밝혔다.  경찰청은 통신·금융·수사 분야에 걸쳐 범정부 합동으로 종합 대응할 수 있는 전기통신금융사기 통합대응단을 구축해 지난 9월29일부터 운영하고 있다. 통합대응단은 정부가 8월28일 '보이스피싱 근절 종합대책'을 발표한 후 꾸려졌다. 경찰청 외 과학기술정보통신부·금융위원회·방송미디어통신위원회·KISA(한국인터넷진흥원)·금융감독원·금융보안원이 참여 중이다.  지난해와 올해 보이스피싱 피해 추이를 분석한 결과, 통합대응단이 출범하기 전인 9월까지는 전년 대비 총 발생건수와 피해액이 각각 28.0%, 90.7% 증가했다.  통합대응단 출범 이후 추이를 분석한 결과, 10월은 전년 동기 대비 발생건수와 피해액이 각각 32.8%, 22.9% 감소했다. 11월 발생건수와 피해액도 각각 26.7%, 35.0% 줄었다.  10월은 추석 연휴가 포함돼 있어 보이스피싱 발생건수·피해액이 감소하는 특성이 있으나 연휴 효과와 무관한 11월에도 전년 대비 감소 추세가 지속됐다.  통합대응단의 그간 주요 추진사항은 △신고대응센터 24시간·365일 상시 운영으로 응대율을 62.9%에서 96.4%로 향상 △범죄이용 전화번호 차단 363% 증가 △간편제보·긴급차단 시스템 도입으로 통신사 요청 시 10분 이내 차단체계 구축 △통신사·금융보안원 등과 악성 앱 서버와 사이트 탐지 및 차단 △통신3사와 협업해 최신 수법을 반영한 대국민 예경보 문자 발송 등이다.  10월에는 국가수사본부장의 캄보디아 방문으로 범죄조직원 64명을 국내로 송환하기도 했다. 12월에는 캄보디아·태국과의 합동작전으로 조직원 28명을 검거했다. 앞으로도 캄보디아 내 '코리아 전담반'을 운영해 초국가 범죄에 강력하게 대응한다는 방침이다.  경찰 관계자는 ""범정부 보이스피싱 종합대책에 따른 적극적인 대응이 소기의 성과를 보이고 있다""며 ""통합대응단을 중심으로 연말까지 보이스피싱 범죄 대응역량을 총동원해 감소 추세를 이어가겠다""고 밝혔다.",https://n.news.naver.com/mnews/article/008/0005288298
