날짜,제목,본문,링크
2025-12-07 13:20:00,"장동혁, 보수정당 국제회의서 ""한국, 심각한 민주주의 위협 직면""","장동혁 국민의힘 대표가 국제 보수정당 연합체인 국제민주연합(IDU) 회의에서 ""최근 대한민국은 매우 심각한 민주주의의 위협에 직면해 있다""며 ""어떠한 부당한 시도에도 굴하지 않고 국민과 함께 자유민주주의를 지켜나가겠다""고 했다.  장 대표는 지난 2~4일(현지 시각) 미국 워싱턴D.C.에서 열린 2025 IDU 포럼에 보낸 영상 메시지를 통해 이같이 말했다.  IDU는 미국 공화당·영국 보수당·독일 기민당(CDU)·캐나다 보수당 등이 회원으로 활동 중인 국제 보수민주정당 연합체다.  장 대표는 ""국민의힘은 1992년부터 IDU 정회원으로 활동하며 자유민주주의, 시장경제, 인권과 법치라는 핵심 가치를 굳건히 지켜왔다""며 ""탄탄한 한미동맹을 바탕으로 인류 보편의 가치를 공유하는 동반자들과의 연대를 강화하며 한반도 평화는 물론 세계 평화를 위해 노력해 왔다""고 밝혔다.  그러면서 국내 정치 상황에 대해 ""국회 다수 의석을 차지한 정당의 일방적 횡포가 반복되고, 심각한 부작용이 초래되는 정책들이 충분한 사회적 논의 없이 추진되고 있다""고 했다. 이어 IDU 회원 정당들에 ""대한민국의 민주주의와 보수정당의 굳건한 존재를 위해 여러분의 따뜻한 응원과 강력한 지지를 간곡히 부탁드린다""고 호소했다.  한편 국민의힘에 따르면 IDU는 지난 5일(현지 시각) 집행위원회의에서 '대한민국 민주주의 원칙과 법치주의에 관한 결의안'을 채택했다. 결의안에는 △국민의힘이 대한민국의 진정한 보수정당임을 확인하고 △대한민국 보수정당들의 활동을 약화시키는 인위적 시도들에 대해 주의를 기울일 것과 △일방적 정치세력에 의한 대한민국 사법제도의 변화가 일방적 지배로 이어져 민주주의에 위협이 되지 않도록 경계하면서 △대한민국의 종교의 자유 상황을 계속 주시하겠다는 내용 등이 담겼다.  국민의힘은 이번 포럼을 계기로 IDU와의 공조를 강화하고 국제 보수정당과의 연대를 확대해 자유민주주의 가치 수호를 위한 노력을 지속해 나갈 계획이라고 밝혔다.",https://n.news.naver.com/mnews/article/008/0005288359
2025-12-07 13:20:00,"[속보]이재명 대통령, 감사원장에 김호철 변호사 지명",7일 이규연 대통령실 홍보소통수석.,https://n.news.naver.com/mnews/article/008/0005288358
2025-12-07 13:15:00,"[메디컬아시아 2025]예영제한의원, 혈액순환장애 부문상 수상","예영제한의원(원장 윤재홍)이 '메디컬아시아 2025, 제15회 대한민국 글로벌 의료서비스대상(메디컬아시아 2025)'에서 혈액순환장애 부문상을 수상했다고 7일 밝혔다. 이번 시상식은 지난 4일 한국프레스센터 국제회의장에서 진행됐다.  예영제한의원은 이번 수상으로 2022년부터 2025년까지 4회 연속 수상이라는 기록을 세웠다. 예영제한의원은 혈액순환장애로 인해 발생할 수 있는 다양한 질환의 악순환을 치료하기 위해 혈액순환에 집중 연구를 해오면서 개발된 치료시스템으로 국내외 한방치료의 전문성에 기여하는 의료기관이라는 평가를 받는다.  예영제한의원은 환자들에게 혈액순환의 중요성을 강조하며 순환이 원활하지 않을 때 발생할 수 있는 △척추관절질환 △통증질환 △위장질환 △만성피로 △수족냉증 △저림·통증 △어지러움 △순환장애 △냉증 △여성질환 등의 치료에 집중해왔다. 단순 증상 치료가 아닌 체질과 장부기능을 개선하는 전신치료를 시행하고 있다.  윤재홍 원장은 ""항상 찾아오시는 환자 분들에게 몸의 순환이 곧 건강과 직결된다고 말한다""며 ""앞으로도 환자분들의 일상이 편안할 수 있도록 한의학 치료 연구를 이어가겠다""고 전했다.  한편, '메디컬아시아 2025'는 우수한 의료 기술을 바탕으로 의료관광 활성화에 기여한 병의원을 선정하는 시상식으로 15회를 맞았다. 머니투데이, 봉황망길림, 미주 중앙일보 뉴욕 등 한·중·미 3개국 언론사가 공동주최하며, 보건복지부, 식품의약품안전처, 한국관광공사가 후원한다.",https://n.news.naver.com/mnews/article/008/0005288357
2025-12-07 13:10:00,다가오는 '이중항체' 대전…中 독주 전망 속 'K-바이오'도 개발 속도,"올해 대규모 글로벌 제약바이오 라이선스 딜(거래)에서 이중 및 다중항체가 차지하는 비중이 높게 나타나면서 내년부터 본격적인 다중항체의 시대가 시작될 것이란 전망이 나온다. 중국의 약진이 두드러진 가운데 셀트리온, 삼성에피스홀딩스, 에이비엘바이오 등도 임상 단계 개발에 속도를 내고 있어 관심이 모인다.  7일 업계에 따르면 올해 글로벌 제약바이오 라이선스 딜 상위 20개 중 6개가 이중항체와 관련된 것으로 나타났다. 이는 글로벌 제약사들의 관심이 최근 수년간 항암 영역에서 가장 주목받았던 항체-약물접합체(ADC)에서 이중 및 다중항체로 옮겨가고 있단 것을 보여준다. 특히 상위 10개의 다중항체 딜 중 7개가 중국 바이오 기업의 라이선스 성과란 점이 눈에 띈다.  네이처는 이를 두고 ""중국 기업으로부터 인수한 에셋(자산)의 규모가 불균형적으로 크다""고 평가했다. 또한 ""특허 절벽에 직면한 글로벌 제약사들은 이를 메우기 위해 글로벌 국경 간 기술이전을 활발히 이어갈 것""이라며 ""중국 개발사들은 빠른 개발 속도와 대규모 임상 수행 능력을 무기로 연구자 주도 임상에서 초기 인간 대상 '신호 검증' 데이터를 확보해 수익화할 가능성이 높다""고 내다봤다.  이중항체는 글로벌 빅파마(대형 제약사)에게 혁신신약으로서의 가치뿐 아니라 기존의 단일 표적 단일클론항체(mAB) 블록버스터를 확장할 수 있는 비즈니스 모델이란 점에서 더 매력적인 모달리티(치료접근법)인 것이다. 전 세계적으로 라이선스 딜의 건수는 줄어들고 있지만 이중항체 딜의 규모는 커지고 있는 것도 이러한 빅파마의 '베팅' 심리를 방증한다.  현재 이중항체 영역에서 중국 기업들이 사실상 독주하고 있는 만큼 국내 기업 입장에선 이들과 단순히 경쟁하려고 할 것이 아니라 오픈 이노베이션을 통해 강점을 배워야 할 필요성이 있단 목소리도 높다. 여러 바이오텍과 협업 중인 셀트리온도 현재 ADC와 다중항체 분야에서 중국 이노베이션 프로그램을 준비하고 있다. 셀트리온은 이미 에이비프로와 임상 단계에서 이중항체 T세포 인게이저(CE)를 개발 중이다.  신약개발을 공식화한 삼성도 삼성에피스홀딩스 산하의 자회사 에피스넥스랩을 통해 이중항체 ADC 플랫폼을 자체 개발하는 한편 삼성바이오에피스가 중국 프론트라인과의 이중항체 ADC 공동개발을 진행 중이다. 업계 관계자는 ""에피스와 프론트라인 케이스는 고육지책 같은 측면도 있지만 글로벌에서 봐도 중국 파이프라인의 경쟁력이 높은 건 사실""이라며 ""삼성의 프론트라인 지분투자도 놀라운 일은 아니다""라고 말했다.  상대적으로 규모가 작은 국내 바이오텍들도 이중항체 개발에 속도를 내고 있다. 그 중에서도 가장 존재감이 큰 건 에이비엘바이오다. 에이비엘바이오는 4-1BB 기반 이중항체 TCE 플랫폼 '그랩바디-T'가 적용된 다수의 이중항체 항암신약 파이프라인(신약후보물질)을 임상 단계에서 개발 중이다. 뇌-혈관장벽(BBB) 셔틀 플랫폼 '그랩바디-B' 못지 않은 성과를 보여줄 것이란 기대감이 높다.  에이비엘바이오는 내년부턴 미국 자회사 네옥바이오를 통해 이중항체 ADC 임상도 본격화할 예정이다. ADC는 강력한 항암 물질인 페이로드(암세포를 사멸하는 물질)를 갖고 있어 약물이 정상 조직엔 영향을 주지 않고 암 세포만 공격하도록 하는 것이 매우 중요하다. 이중항체 ADC는 단일항체 ADC 대비 종양에 침투하는 능력이 높아 이러한 측면에서 강점을 지닌다.  에이비엘바이오 관계자는 ""기존 단일항체 ADC와는 달리 아직 승인된 약물이 없는 최신 모달리티인 만큼 향후 시장성이 매우 크고 조속한 임상 개발을 통해 시장을 선점하는 것도 가능하다""며 ""현재 'ABL206'과 'ABL209'의 임상시험계획서(IND) 준비가 마무리 단계에 있고, 네옥바이오가 이미 임상 준비를 마친 만큼 빠른 임상 진행이 가능할 것으로 기대하고 있다""고 말했다.",https://n.news.naver.com/mnews/article/008/0005288356
2025-12-07 13:08:00,전남 열차 건널목서 새마을호와 차 충돌…60대 운전자 사망,전남 보성군 열차 건널목에서 새마을호와 차가 충돌해 60대 운전자가 숨졌다.  7일 뉴스1에 따르면 이날 오전 9시35분쯤 전남 보성군 조성면 한 철길 건널목에서 목포역 출발-부전역 도착편 새마을호가 차와 충돌했다.  이 사고로 차량 운전자 A씨(60대)가 심정지로 병원에 이송됐으나 끝내 숨졌다. 새마을호 탑승자 가운데 부상자는 발생하지 않았다.  목포보성선(새마을호)은 올해 9월27일 첫 운행됐다.  철도 건널목 차단기는 정상 작동된 것으로 파악됐다. 코레일 측은 사고 차가 차단기 앞에서 정차해 있던 다른 차를 추월하다가 사고가 난 것으로 추정하고 있다.  당국은 목격자 진술을 토대로 정확한 사고 원인을 조사하고 있다.,https://n.news.naver.com/mnews/article/008/0005288355
2025-12-07 12:49:00,"암모니아 기반 수소, 상용화 길 열렸다...안전기준 법적근거 마련","[이 기사에 나온 스타트업에 대한 보다 다양한 기업정보는 유니콘팩토리 빅데이터 플랫폼 '데이터랩'에서 볼 수 있습니다.] 중소벤처기업부와 기후에너지환경부, 충청북도는 '충북 그린수소산업 규제자유특구' 실증사업을 통해 암모니아 기반 수소 생산·활용 시설의 안전성을 검증하고 관련 안전기준(KGS AH-171) 개정을 완료했다고 7일 밝혔다.  안전기준 개정을 통해 암모니아에서 수소를 추출하는 기술이 법적 근거를 갖게 됐다. 그동안 도시가스나 LPG(액화석유가스) 등 탄화수소 계열에서만 수소 추출이 가능했던 규제가 풀리면서 암모니아 기반 수소 생산 기술의 상용화 길이 열렸다.  기존 '수소추출설비 제조의 시설·기술·검사 기준'에 따르면 수소 추출은 도시가스나 LPG 등 탄화수소 계열 연료만 사용할 수 있었다. 이 때문에 수소 저장과 운송 효율이 높아 차세대 에너지원으로 주목받는 암모니아는 관련 규정 부재로 수소 추출 원료로 사용할 수 없었다.  충북 특구는 이 같은 제약을 해소하기 위해 2024년 9월 충주시 대소원면에 국내 최초로 상용급(일 0.5톤 생산) 암모니아 기반 수소 생산 시설을 준공했다. 이후 실증 운영을 통해 기술적 안전성과 신뢰성을 입증하는 데 성공했다.  이를 바탕으로 한국가스안전공사와 기후에너지환경부는 지난달 28일 안전기준을 개정, 암모니아를 수소 추출 원료로 공식 인정했다. 개정안에는 독성가스인 암모니아를 안전하게 취급하기 위한 재료, 구조, 장치, 성능 기준 등이 신설됐다.  이번 규제 해소는 국내 수소산업 생태계 확장에 기여할 것으로 보인다. 암모니아는 단위 부피당 수소 저장 용량이 크고 상온에서 쉽게 액화돼 운송과 저장이 용이하다는 장점이 있다. 이번 안전기준 마련으로 국내 기업들이 암모니아 기반 수소 생산 기술을 선점하고 글로벌 표준화를 주도할 수 있는 기반이 마련됐다는 평가다.  이현조 특구혁신기획단장은 ""규제자유특구 사업을 통해 암모니아를 비롯한 다양한 수소 사업이 상용화되면 국내 수소 산업의 저변 확대와 탄소중립 실현을 앞당기는 중요한 계기가 될 것""이라고 밝혔다.  [머니투데이 스타트업 미디어 플랫폼 유니콘팩토리]",https://n.news.naver.com/mnews/article/008/0005288354
2025-12-07 12:45:00,"[메디컬아시아 2025]김재우한의원, 체질개선 부문상 수상","김재우한의원(원장 김재우)이 '메디컬아시아 2025, 제15회 대한민국 글로벌 의료서비스대상(메디컬아시아 2025)'에서 체질개선 부문상을 수상했다고 7일 밝혔다. 이번 시상식은 지난 4일 한국프레스센터 국제회의장에서 진행됐다.  김재우한의원은 17년간 지역 기반 진료와 임상 경험을 토대로 한 체질개선 치료시스템을 구축해왔다. 한방내과 전문의의 진단 노하우를 기반으로 질병의 기저에 있는 체질적 불균형을 우선 파악하고, 증상 치료가 아닌 근본 개선을 목표로 하는 점이 특징이다.  이 과정에서 반복되는 △근골격계 통증 △심혈관 및 혈액순환 장애 △대사성 질환 △피부 및 알레르기 질환 △성인병·비만 등 다양한 영역에서 환자별 맞춤형 일대일 치료법을 적용하며 치료 범위를 넓혀가고 있다.  김재우 원장은 ""체질개선을 기반으로 한 한방치료는 단순히 병증을 없애는 데 그치지 않고, 신체기능 전반을 회복시키며 만성질환의 재발을 예방하고 면역력을 강화하는 데 목표가 있다""고 말했다.  이어 ""개인의 체질을 정확히 진단한 후 어떤 치료 전략을 선택하고 적용하느냐가 치료 결과를 좌우하며, 궁극적으로 환자의 삶의 질 향상으로 이어진다""고 했다.  한편, '메디컬아시아 2025'는 우수한 의료 기술을 바탕으로 의료관광 활성화에 기여한 병의원을 선정하는 시상식으로 15회를 맞았다. 머니투데이, 봉황망길림, 미주 중앙일보 뉴욕 등 한·중·미 3개국 언론사가 공동주최하며, 보건복지부, 식품의약품안전처, 한국관광공사가 후원한다.",https://n.news.naver.com/mnews/article/008/0005288353
2025-12-07 12:44:00,CJ대한통운 배송박스에 아바타 광고…디즈니와 협업 마케팅,"CJ대한통운이 월트디즈니 컴퍼니 코리아(디즈니코리아)와 '아바타: 불과 재' 개봉을 기념한 배송박스 활용 협업 마케팅을 전개한다고 7일 밝혔다.  프로모션은 내년 1월 31일까지 CJ대한통운 풀필먼트센터에서 출고되는 상품박스를 통해 진행된다. 배송박스 양면에 오는 17일 개봉하는 아바타: 불과 재 광고를 실어 전국 소비자에게 노출한다. 박스에는 QR코드가 인쇄돼 스캔 시 영화 공식 예고편을 시청할 수 있고 영화를 예매할 수 있는 링크로 연결된다.  회사는 오는 14일까지 홈페이지를 통해 정답자 중 100명을 추첨해 1인 2매의 영화 예매권을 증정하는 퀴즈 이벤트도 진행하고 있다.  CJ대한통운은 디즈니코리아와의 협업을 계기로 배송박스 광고 사업을 한층 확대해 나간다는 방침이다. 배송박스는 매일 전국의 소비자들에게 직접 전달되는 만큼 도달률이 높고 개봉 시점에 맞춘 집중 노출이 가능해 영화·콘텐츠를 비롯한 다양한 브랜드와의 공동 마케팅 플랫폼으로 성장 잠재력이 크다는 판단이다.  CJ대한통운 관계자는 ""전국 각지로 배송되는 배송박스는 브랜드 메시지를 직접 가정까지 전달할 수 있는 강력한 매체""라며 ""글로벌 스튜디오와의 협업을 통해 고객에게는 새로운 즐길 거리를, 파트너사에는 효과적인 마케팅 솔루션을 제공하는 생활물류 기반 광고 플랫폼으로 발전시켜 나가겠다""고 말했다.",https://n.news.naver.com/mnews/article/008/0005288352
2025-12-07 12:15:00,"[메디컬아시아 2025]청풍한의원, 비만 다이어트 부문상 수상","청풍한의원(대표원장 황주원)이 '메디컬아시아 2025, 제15회 대한민국 글로벌 의료서비스대상(메디컬아시아 2025)'에서 비만 다이어트 부문 대상을 수상했다고 7일 밝혔다. 이번 시상식은 지난 4일 한국프레스센터 국제회의장에서 진행됐다.  청풍한의원은 체질, 건강 상태, 생활 습관 등 비만의 복합적인 원인을 정밀하게 분석하고, 한방내과 전문의의 1:1 맞춤 치료를 통해 건강한 체중 감량을 유도한다. 특히 오장육부의 기능을 균형 있게 조절해 노화나 호르몬 불균형으로 인한 체중 증가에도 효과적으로 대응할 수 있도록 돕는다.  청풍한의원은 환자별 건강 상태와 생활 패턴을 반영해 체중 증가 원인을 면밀히 진단하고, 장기적인 체중 관리를 위한 개인 맞춤형 감량 전략을 제시하는 것이 특징이다. 황주원 대표원장은 ""노화나 호르몬 불균형으로 인한 체중 증가에 대응하려면 체질에 맞춘 전략이 필요하다""며 ""건강을 해치는 감량 방식은 장기적 체중 관리에 효과적이지 않다""고 강조했다. 그는 또 ""K-뷰티와 K-메디컬의 융합을 통해 국내외 환자 모두에게 신뢰받는 진료를 이어가겠다""고 덧붙였다.  한편, '메디컬아시아 2025'는 우수한 의료 기술을 바탕으로 의료관광 활성화에 기여한 병의원을 선정하는 시상식으로 15회를 맞았다. 머니투데이, 봉황망길림, 미주 중앙일보 뉴욕 등 한·중·미 3개국 언론사가 공동주최하며, 보건복지부, 식품의약품안전처, 한국관광공사가 후원한다.",https://n.news.naver.com/mnews/article/008/0005288351
2025-12-07 12:00:00,라텍스 위에서 전기장판 켰다 '활활'…겨울철 난방용품 화재 주의보,"본격적인 한파를 앞두고 겨울철 난방용품 화재와 과열 사고가 잇따르자 정부가 소비자안전주의보를 발령했다.  공정거래위원회와 한국소비자원은 겨울철 난방용품과 관련 소비자안전주의보를 발령했다고 7일 밝혔다.  최근 5년간(2020~2024년) 한국소비자원 소비자위해감시시스템(CISS)에 접수된 난방용품 관련 안전사고는 총 4154건으로 매년 꾸준히 발생했다. 월별로는 1월이 741건(17.8%)으로 가장 많았고, 계절이 바뀌는 11월도 589건(14.2%)으로 뒤를 이었다.  사고 원인은 '화재·과열'이 49.2%(2043건)으로 절반 가까이를 차지했다. '제품 불량 관련' 사고는 36.1%(1501건)으로 뒤를 이었다. 특히 화재·과열 사고는 제품 주변 물건이 타거나 화상으로 이어진 사례가 많았다고 설명했다.  품목별로는 '전기장판 및 전기요'가 64.2%(2666건)으로 가장 많았다. 이어 '온수매트'(16.5%, 684건), '전기히터(난로)'(6.6%, 276건) 등 순이었다.  전기장판의 경우 라텍스 매트리스나 두꺼운 이불을 덮고 사용해 과열로 화재가 발생한 사례가 다수 확인됐다. 온수매트는 제품 불량 관련 사고 비율이 60.7%로 가장 높았다.  또한 신체 피해가 확인된 579건 중 85.3%(494건)가 화상 사고였다. 공정위는 저온 화상 사례도 보고돼 장시간 고온 사용에 대한 경각심이 필요하다고 강조했다.  공정위와 소비자원은 안전한 사용을 위해 △KC 인증 제품 구입 △타기 쉬운 소재와 함께 사용 금지 △장시간 사용 자제 및 미사용 시 플러그 분리 △전선·열선 꺾임 주의 등의 수칙 준수를 당부했다.",https://n.news.naver.com/mnews/article/008/0005288350
2025-12-07 12:00:00,"중기부, 수탁·위탁 거래 실태 조사…불공정 빈번한 취약 업종 '집중점검'","중소벤처기업부가 불공정거래가 빈번하게 일어나는 취약 업종을 중심으로 수탁·위탁 기업 간의 실태조사에 나선다.  중기부는 기업 간 수탁·위탁거래 과정에서 발생하는 불공정거래행위를 바로 잡기 위해 '2025년 수탁·위탁거래 정기 실태조사'를 8일부터 실시한다고 7일 밝혔다.  수탁·위탁거래란 '대·중소기업 상생협력 촉진에 관한 법률'(상생협력법)에 따라 제조, 공사 등을 영위하는 기업이 물품 등의 제조를 다른 중소기업에 위탁하고 위탁받은 중소기업이 전문적으로 물품 등을 제조하는 거래를 말한다.  올해 조사는 2024년 하반기(7월~12월)에 수탁.위탁거래 관계가 있는 1만5000개사(위탁 3000개사, 수탁 1만2000개사)를 대상으로 불공정거래행위 전반에 대해 진행한다.  주요 조사내용은 상생협력법 제21조부터 제25조에서 규정하고 있는 위탁기업의 의무사항인 △납품대금 연동제 이행 △약정서의 발급 △납품대금의 지급 △납품대금 지급기일 준수 △부당한 납품대금 감액 금지 △부당한 대금 결정 금지 △부당한 기술자료 요구 금지 등의 준수 여부다.  특히 올해 조사부터 납품대금 연동제 도입, 디지털화 확대 등 급변하는 거래 환경에 대응하고 조사의 정확성을 높인다.  중기부는 우선 조사 표본(위탁기업 3000개사)을 재설계해 대표성을 강화했다. 비수도권 기업 비중이 높던 기존표본을 수도권, 비수도권 각각 50% 비율로 재설계해 기업이 수도권에 집중된 상황을 반영했다.  또 불공정거래가 빈번한 취약 업종을 선정해 관리하기로 했다. 전 산업 대비 법 위반율이 높은 업종·불공정 이슈 업종(제조업, 건설업, 운수 및 창고업)에서 500개사를 조사대상 위탁기업으로 선정했다. 해당 업종에 대한 법 위반률 등 조사결과는 별도로 관리해 주기적으로 재검토할 예정이다.  아울러 위탁기업 설문조사를 신설한다. 변화하는 거래 관행을 입체적으로 파악하기 위해 수탁기업만 대상으로 하던 설문조사를 위탁기업까지 확대해 양방향 설문조사 체계를 구축했다.  나아가 조사대상 거래의 사각지대를 해소했다. 지난해까지는 해당연도 상반기 거래를 대상으로 조사해 하반기 거래가 조사대상에서 제외됐으나 올해 조사는 지난해인 2024년 하반기 거래를, 2026년 조사부터는 1년 전체 거래를 대상으로 한다.  나아가 조사는 1단계 위탁기업 거래현황 및 설문조사, 2단계 수탁기업 설문조사, 3단계 법 위반 의심기업 현장조사 등 3단계로 진행되며 조사 결과 상생협력법 위반이 확인된 기업에 대해서는 개선요구 등 행정처분이 이뤄진다.  이 밖에 조사 대상 위탁기업을 대상으로 오는 10일부터 11일까지 이틀간 온라인으로 '수·위탁거래 실태조사 기업설명회'를 개최할 계획이다.  이은청 중기부 상생협력정책국장은 ""이번 정기 실태조사 개선을 통해 중소기업의 피해를 더 효과적으로 구제할 수 있을 것으로 기대된다""며 ""수도권 기업 비중 확대와 취약 업종 집중점검을 통해 건전한 수탁·위탁거래 질서를 확립하고 약자가 보호받는 기업 환경을 조성하는 데 최선을 다하겠다""고 말했다.  한편 중기부는 조사 대상 위탁기업에 조사의 상세한 내용을 담은 안내책자(위탁기업 참여 가이드)를 우편으로 배포했다. 추가적인 안내 사항은 중소기업 수·위탁거래 종합포털 누리집(https://www.smes.go.kr/poll)을 통해 게시할 예정이다.",https://n.news.naver.com/mnews/article/008/0005288349
2025-12-07 12:00:00,"기재부, AMRO와 연례협의…""경제동향 등 협의""","기획재정부는 오는 8일부터 19일까지 '아세안+3 역내 거시경제조사기구'(AMRO)와 연례협의에 나선다고 7일 밝혔다.  AMRO는 아세안(ASEAN) 10개국, 한국, 일본, 중국의 경제동향을 점검하고 회원국 경제·금융 안정을 위해 운영 중인 치앙마이 이니셔티브 다자화(CMIM)를 지원하는 국제기구다.  특히 회원국의 거시경제, 재정, 금융 등 경제동향 점검 및 정책 권고 제공을 위해 매년 회원국을 방문해 연례협의를 실시한다. 이를 바탕으로 각 회원국에 대한 연례협의 보고서를 작성해 발표한다.  AMRO 연례협의단은 한국을 방문해 기재부, 금융위원회, 한국은행, 금융감독원 등 총 13개 기관과 전문가 면담을 실시한다.  기재부는 오는 8일 경제동향, 전망, 정책방향에 대한 실무협의를 진행하고, 오는 18일 최지영 국제경제관리관 주재로 전반적인 협의 결과를 점검한다.",https://n.news.naver.com/mnews/article/008/0005288348
