날짜,제목,본문,링크
2025-12-01 16:18:00,"""서학개미·국민연금 쏠림에 고환율 고착화""…단기 처방 가능할까","최근 원/달러 환율 상승 배경으로 서학개미와 국민연금 해외투자 등 수급불균형 문제가 지목되는 가운데 1500원을 위협하는 수준의 박스권 장세가 이어진다.  전문가들은 단기적으로 수급 문제를 완화하더라도 구조적인 고환율 고착화를 막기 어렵다고 지적한다. 중장기적인 원화 가치 회복을 위해서는 실물 경제 회복 등 경제 펀더멘탈 회복이 뒤따라야 한다는 설명이다.  1일 서울 외환시장에서 원/달러 환율 주간거래 종가는 전 거래일 대비 0.7원 내린 1469.9원을 기록했다. 지난 18일 이후 1460~1470원대를 오가며 좁은 박스권 장세를 이어가고 있다. 정부의 외환시장 안정화 정책 발표에도 추가 상승 기대감이 누그러지지 않는 모양새다.  외환당국은 최근 환율 상승의 주된 원인으로 '서학개미'들의 해외주식투자 확대와 국민연금의 해외투자 등 수급 요인을 꼽는다. 해외투자에 따른 외환수급 불균형이 지속되면서 원화 약세 기대가 고착화되고 있다는 분석이다.  한은에 따르면 올해 1~3분기 '일반정부'의 해외주식 투자는 245억1400만달러로 집계됐다. 전년 동기 대비 92% 늘었다. 같은 기간 '비금융기업 등'의 해외주식 투자액은 166억2500만달러로 74% 증가했다. 한은 통계상 '일반정부'는 국민연금으로, '비금융기업 등'은 개인투자자로 해석해도 무방하다는 게 한은 설명이다.  외환당국은 국민연금의 자산 규모가 커지면서 외환시장에 미치는 영향도 극대화됐다고 지적했다. 정부가 기획재정부·한국은행·보건복지부·국민연금 등 4자 협의체를 구성한 것도 이 때문이다. 국민연금에 따르면 2024년 말 기준 국민연금의 해외주식 잔액은 431조원에서 올해 8월 말 486조4000억원으로 늘었다.  구윤철 부총리 겸 기획재정부 장관은 지난달 26일 ""전세계에서 세 번째로 큰 연기금인 국민연금의 기금 규모는 이미 GDP(국내총생산)의 50%를 상회하고 있다""며 ""보유한 해외 자산도 외환보유액보다 많아지면서 외환시장에서 단일 플레이어 중 가장 큰 역할을 하고 있다""고 말했다.  외환당국은 단기적인 환율 급등 통제가 아닌 외환시장 안정화를 위한 중장기적 시스템 개선을 위해 4자 협의체를 구성했다고 강조했다. 이창용 한은 총재는 지난달 27일 이와 관련해 ""국민 노후자산을 희생하는 것이 아니라 보호하기 위해서 새로운 프레임이 필요하다고 보는 것""이라고 말했다.  그러면서 ""당장의 환율도 문제지만 환율이 올라갈 때 장부가 수익률이 높다고 단기간 노후 자산이 커지는 것이 아니다""라며 ""해외 투자자산을 국내로 갖고 들어올 때를 생각하면 환헤지 등 여러가지 방법으로 수익성을 확보할 필요가 있다""고 설명했다.  전문가들은 근본적인 원화 약세 구조가 해결되지 않으면 고환율 고착화를 피하기 어렵다고 조언했다. 환투기 세력이 붙거나 기대심리가 지속되면 원/달러 환율이 1500원대로 올라설 가능성도 있다는 설명이다.  김정식 연세대 경제학과 명예교수는 ""국민연금의 환헤지나 외환스와프에 따른 달러 공급을 무한정으로 할 순 없기 때문에 근본적인 고환율을 막기는 어렵다""며 ""수급 문제 해결과 동시에 근본적인 원인 해결도 추진해야 한다""고 말했다.  이어 ""해외투자 수요가 늘어나는 건 국내 경제 불확실성이 크기 때문""이라며 ""정부 정책에 신뢰도를 높이고 국내 산업 경쟁력을 키워 기업 수익성을 높이는 등 실물 경제 반등이 필요하다""고 덧붙였다.",https://n.news.naver.com/mnews/article/008/0005285534
2025-12-01 16:18:00,"""쿠팡 IT인력 절반 이상 중국인""...의혹 제기에 쿠팡 ""사실과 달라""","""현재 쿠팡 IT(정보통신) 인력 반이상이 중국인""  국내 이커머스(전자상거래) 1위 쿠팡에서 3370만개 고객 계정 정보가 유출돼 파문이 확산한 가운데, 한 익명의 쿠팡 직원이 인터넷 커뮤니티에 올린 글이 주목받고 있다. 이번 정보유출 사건의 유력한 용의자로 중국 국적의 전 직원이 거론되고 있는 상황에서 최근 쿠팡이 중국인 개발자 인력을 대거 채용했단 사실을 밝혀서다.  1일 관련 업계에 따르면 커뮤니티 블라인드에 '쿠팡 개발자'라고 밝힌 한 직원은 ""현재 쿠팡 IT 인력 반이상이 중국인, 매니저는 거의 90퍼 이상 중국인""이라며 ""몇 년전까지만 해도 (중국인 직원 비중이) 20, 30% 였는데 올해 신규 입사자들 80%가 중국 나머지가 인도, 한국인""이라고 썼다.  그는 이어 ""차근차근 (중국인 직원) 비율 높이면서 카르텔을 형성, 꽤 많은 인원을 한국으로 온보딩시키고 최고급 주거시설(잠실 용산) 자녀 국제학교 학비 등 한국인에게도 없는 복지로 꿀먹인다(큰 혜택을 준다)""고 지적했다.  그는 ""매 분기 퇴사 인사는 한국분들이고 시간이 갈수록 비율은 더 늘어날 것""이라며 ""이번 (고객 개인정보 유출) 사태도 개인적인 생각으로 무분별하게 중국인을 데려다 쓴 결과라고 본다. 그들은 우리 서비스를 이용하지도 않고 오너십도 없다""고 썼다. 그러면서 ""진짜 한국 개발자들도 실력있고, 책임감은 그들과 비교도 할 수 없는데 안타깝다""고 덧붙였다.  이 글은 각종 온라인커뮤니티와 SNS(사회관계서비스망)에 공유되며 확산하고 있다.  이에 대해 쿠팡은 사실과 다르단 입장이다. 관련 업계에 따르면 쿠팡 개발 인력 상당 수는 미국, 인도, 한국 국적 직원이며 중국인 직원 비중은 이보다 낮은 것으로 알려졌다.",https://n.news.naver.com/mnews/article/008/0005285533
2025-12-01 16:18:00,"구윤철 ""외국 투자금 국내 유입 위한 인바운드 영업 확충 뒷받침""","구윤철 부총리 겸 기획재정부 장관이 ""정부의 자본·외환시장 선진화 노력과 시너지를 낼 수 있도록 앞으로 외국 투자자금의 국내 유입을 확대하기 위한 금융회사의 인바운드(inbound) 영업 확충과 이를 뒷받침할 수 있는 환경 조성에 정책의 중점을 두고자 한다""고 말했다.  구 부총리는 1일 국제금융정책자문회의를 주재하고 ""글로벌 투자자들의 접근성을 높이기 위해 정부는 현재 새벽 2시까지 운영되는 외환시장을 24시간 개방하고 외국 금융기관이 해외에서 원화를 운용할 수 있도록 '역외 원화 결제 인프라'를 구축해 나갈 것""이라며 이같이 밝혔다.  국제금융정책자문위원회는 기재부 장관이 국제금융과 외환정책의 운영에 대해 각계의 전문가로부터 전문적이고 다양한 의견을 수렴하기 위해 설립된 회의체다. 학계(4명), 연구기관(3명), 시장(3명) 등 민간위원과 당연직 위원 등 12명 이내로 구성된다. 국제금융정책자문위원회가 열린 건 처음이다.  구 부총리는 ""글로벌 통상환경 변화, 세계경제의 분절화, 지정학적 리스크 상시화 등으로 국제금융의 기존 질서가 흔들리고 있다""며 ""판이 흔들리는 시기에 국가 간 승자와 패자가 나뉘고 순위가 뒤바꿀 수 있는 만큼 정부의 각별한 대응과 전문가들의 긴밀한 소통이 무엇보다 중요하다""고 말했다.  이어 ""최근 수년간 한국의 순대외금융자산이 빠른 속도로 증가하면서 1조1000억달러 수준에 이르고 있다""며 ""이는 위기 발생 시 외채 상환 요구 등에 충분히 대응할 수 있는 견고한 대외 안전판을 갖추게 됐다는 점에서 의미가 있다""고 밝혔다.  구 부총리는 ""다만 그 이면에는 우리 자본시장에서 기업들이 활용할 자금이 충분히 공급되지 않다는 문제도 있다""며 ""이러한 자금흐름의 불균형은 기업의 투자여력과 성장자금 확보를 제약해 우리 실물경제의 활력에 부담을 줄 수 있다""고 말했다.  자문위원들은 최근 외환시장이 심리적 쏠림현상과 거주자의 해외투자 증가 등 구조적 수급 요인의 영향을 받고 있다고 평가했다. 한국의 신용부도스와프(CDS) 프리미엄 등 주요 대외건전성 지표들이 양호하다는 점에서 위기 상황은 아니라고 진단했다.  자문위원들은 외환시장 안정화를 위해 단기적으로 시장의 기대심리 반전을 위한 외환시장 변동성 관리가 긴요하다고 밝혔다. 일부 참석자들은 스테이블코인 등 국경 간 디지털 자산 거래의 건전성을 확보하고 불법·우회 거래를 막기 위해 외국환거래법상 모니터링 체계 마련이 시급한 과제라고 언급했다.  국제금융정책자문위원회는 원칙적으로 연 2회 개최한다. 필요할 경우 소인수 회의를 통해 국제·금융시장 상황, 주요 국제금융 현안에 대한 동향·전망을 공유한다.",https://n.news.naver.com/mnews/article/008/0005285532
2025-12-01 16:17:00,"K-바이오 증시서 반등 시작…""신약 상업화 성과 이어질 것, 비중확대""","국내 증시에서 주요 제약·바이오 기업의 시장가치 상승이 눈에 띈다. 에이비엘바이오를 비롯한 주요 신약 개발 바이오텍(바이오기술기업)의 잇따른 글로벌 기술수출 계약이 투자심리를 자극한 것으로 보인다. 바이오 업종에 대한 투자수요가 확대되며 산업 성장을 가로막던 유동성 악화 문제를 해소할 수 있을지 관심을 끈다. 전문가들은 비만치료제와 항체약물접합체(ADC), 인공지능(AI) 의료 솔루션 등의 연구 및 상업화 성과가 이어지는 추세라 바이오에 대한 시장의 우호적 평가가 당분간 이어질 것으로 내다봤다.  1일 한국거래소 등에 따르면 올해 하반기 KRX헬스케어지수는 30.4% 상승했다. 올해 상반기 KRX헬스케어지수 상승률 2.6%와 확연한 차이가 있다. 올해 국내 주식시장 '불장'에도 상반기 바이오 업종은 주가 흐름이 상대적으로 부진했는데, 하반기 들어 분위기가 달라진 셈이다. KRX헬스케어지수는 국내 주요 제약·바이오 종목 67개로 구성했다.  우선 최근 바이오 업종 주가 상승의 배경으로 K-바이오의 글로벌 상업화 성과를 빼놓을 수 없다. 지난달까지 올해 국내 신약 개발 바이오텍의 글로벌 기술이전 계약 규모 합산액은 18조1110억원으로 역대 최고 기록이다. 에이비엘바이오가 각각 4조원대, 3조원대 2건의 플랫폼 기술수출로 선두에 섰다. 알테오젠과 올릭스, 에이비온, 알지노믹스 등도 대규모 기술이전 계약으로 역량을 입증했다.  국내 바이오텍의 글로벌 상업화 성과는 앞으로 계속될 것이란 분석이 우세하다. 글로벌 시장에서 연구가 한창인 비만치료제와 ADC, 이중항체, RNA(리보핵산) 치료제 등 영역에서 K-바이오의 기술이 경쟁력을 인정받고 있기 때문이다. 국산 신약 플랫폼 기술이나 주요 파이프라인의 해외 진출이 늘면서 글로벌 시장에서 K-바이오를 보는 시선이 달라진 산업 환경도 기대를 높이는 요인이다.  미국의 의약품 관세 부과 예고와 약가 인하 등 정책 불확실성이 일정 부분 해소된 점도 긍정적이다. 앞서 우리 정부와 미국 트럼프 행정부 간 관세 협상이 타결되면서 의약품 분야에 대해 최혜국 대우(MFN)가 적용될 가능성이 커졌다. 의약품 관세와 관련한 국내 기업의 부담이 줄었단 의미다. 다만 미국의 의약품 관세 등 정책과 관련한 더 구체적인 내용은 아직 공개되지 않은 상황이라 국내 제약 및 바이오 기업이 실제 어느 정도 영향을 받을지는 지켜봐야 한다.  이날 이희영 대신증권 연구원은 내년 제약·바이오 산업이 금리인하와 정책 리스크(위험) 완화, 기술 수요 증가로 긍정적 흐름을 지속할 것으로 내다봤다. 그러면서 투자의견 '비중확대'(Overweight)를 유지했다. 이 연구원은 ""내년 미국 기준금리는 상저하고를 예상한다""며 ""금리 인하 구간에서 할인율 축소로 신약 개발 중심 바이오텍의 밸류에이션(가치평가) 재평가를 기대한다""고 분석했다.  또 ""트럼프 행정부의 약가 규제와 관세 이슈는 일단락되며 산업 전반의 정책 부담이 해소됐다""며 ""2030년까지 69개 블록버스터(연간 매출액 1조원 이상의 의약품) 약물 특허 만료 예정으로 빅파마(대형제약사)의 신규 파이프라인 확보를 위한 외부 생산 및 기술도입 수요가 확대되며 국내 CDMO(위탁개발생산) 및 신약 개발 기업에 기회 요인이 될 것""이라고 조언했다.  정재원 아이엠증권 연구원은 제약·바이오 업종에 대한 투자의견을 '비중확대'로 상향조정하며 내년 연구개발(R&D) 성과를 기대할 만하다고 분석했다. 정 연구원은 ""올해 글로벌 제약사와 성과 측면에서 국내 기업이 보여준 퍼포먼스는 역대급""이라며 ""에이비엘바이오처럼 글로벌 트렌드에 부합하고 경쟁력이 있는 플랫폼을 보유한 기업들이 글로벌 제약사와 큰 규모의 기술이전 계약을 체결하면서 시장의 기대감을 끌어올렸다""고 평가했다.  또 ""앞으로 신약 개발 영역에서 AI와 바이오를 결합한 성과가 발생할 것으로 예측하며, 이를 통해 새로운 기업가치 상승의 모멘텀(동력)을 만들 수 있을 것""이라며 ""내년 R&D 측면에선 비만과 항체분해약물접합체(DAC) 치료제의 성과를 주목할 필요가 있다""고 조언했다.",https://n.news.naver.com/mnews/article/008/0005285531
2025-12-01 16:17:00,"""나 이재명 대통령인데""…경찰, 가짜계정으로 금품 요구한 가계정 수사","경찰청 국가수사본부(국수본)가 최근 SNS상에서 이재명 대통령을 사칭하면서 금품을 요구하는 가짜 계정들이 확인돼 서울경찰청 피싱사기수사대에서 수사에 착수했다고 1일 밝혔다.  이 대통령 직함과 성명을 무단으로 사용한 가짜 계정엔 공식 행사 사진과 영상 등이 게시됐다. 이 가짜 계정은 특정인에게 인스타그램 메시지(DM)를 보내 금품을 요구하고 있다.  국수본 관계자는 ""모든 피싱 사기는 온라인 공간에서 이뤄진다""며 ""최근엔 무단 도용 뿐 아니라 딥페이크, 딥보이스 등을 이용하기도 하니 허위정보를 특히 주의해 달라""고 말했다.  경찰은 온라인 게시판에서 유포된 대통령 사칭 '대국민 담화문' 형태로 '해외주식 양도소득세율 인상, 보유세 신설' 내용의 글도 수사 중이다.  경찰 관계자는 ""법과 원칙에 따라 엄중하게 처벌할 것""이라며 ""온라인상 금품을 요구하는 경우 응대하지말고 즉시 경찰에 신고해달라""고 했다.",https://n.news.naver.com/mnews/article/008/0005285530
2025-12-01 16:13:00,"5G 단독망 고도화 의무화, 5G 실내망 투자확대시 2.9兆","당국이 SK텔레콤, KT, LG유플러스 등에 무선서비스용 주파수를 재할당(임대)하는 조건으로 현재의 5G 서비스를 SA(Standalone, 단독망)로 고도화하는 것을 의무화하겠다는 방침을 내걸었다.  5G 실내 서비스 품질을 끌어올리기 위해 이통사들이 실내망 투자를 일정 수준 이상으로 확대할 때 이통 3사가 납부해야 할 주파수 할당 대가는 총 2조9000억원 수준에 형성될 것으로 보인다.  남영준 과학기술정보통신부 주파수정책과장은 1일 서울 삼성동 오크우드센터에서 열린 '주파수 재할당 세부 정책방안(안) 공개설명회'에서 ""네트워크 고도화를 위해 5G SA 서비스 제공은 반드시 필요하다고 보고 이를 (주파수 재할당의) 의무이행 조건으로 부여하고자 한다""며 ""5G 실내품질 향상 유도를 위해 2031년까지 5G 실내 무선국을 최대 2만국 이상 구축하면 3사 합계 주파수 할당 대가는 2조9000억원이 될 것""이라고 밝혔다.  이번에 재할당이 추진되는 대상 주파수의 대역폭은 총 370㎒(메가헤르츠)인데 이 중 20㎒는 3G용, 나머지 350㎒는 LTE(롱텀에볼루션·4G)용 주파수다. 이통사별로 SK텔레콤이 155㎒, KT가 115㎒, LG유플러스가 100㎒ 대역폭 재할당에 참여한다. 일부는 2016년 경매를 통해, 나머지는 2020년 재할당을 통해 배분됐다가 내년 6월·12월 이용기간이 만료된다. 정부는 이들을 한 데 묶어 이번에 재할당을 추진한다.  문제는 LTE 등 주파수에 얼마의 가격을 매기는 게 적절한지 여부다. 과기정통부 등에 따르면 국내 전체 휴대폰 사용자 중 5G 서비스 이용자 비중은 2023년 말 59.7%에서 올 3분기 말 65.8%로 높아졌다. 반면 LTE 이용자 비중은 같은 기간 40.9%에서 33.4%로 낮아졌다.  4G는 LTE 서비스 뿐 아니라 5G에서도 사용된다. 국내에서는 5G 구현 방식 중에서도 LTE 인프라를 병용하는 NSA(Non Standalone) 방식이 주로 쓰인다. 한국이 세계 최초의 5G 서비스 상용화에 성공할 수 있었던 것도 기존에 촘촘하게 깔아둔 LTE 인프라 덕분이었다. 이통사들은 이 5G NSA 방식의 네트워크를 통해 5G 음영지역을 커버하거나 트래픽을 분산처리한다.  5G NSA는 고속 데이터 전송에 강점이 있지만 저지연 및 대량 연결 등 5G의 다른 기능을 구현하는 데는 한계가 있다. 특히 AI(인공지능) 확산을 위해서는 특정 용도의 AI에 맞는 안정적 망 환경을 구성하는 '네트워크 슬라이싱'(가상 네트워크 분할·할당)이 필요한데 5G NSA에서는 불가능했다.  정부는 NSA 위주의 국내 5G를 SA 방식으로 고도화하도록 유도한다는 방침이다. 또 현재 실내 환경에서 5G 서비스가 원활하지 않다는 지적이 잇따르는 것을 반영해 실내 무선국 투자가 일정 수준 늘어나면 더 싸게 주파수를 제공하겠다고 했다.  아울러 향후 6G 시대로의 이행 과정에서 LTE 주파수를 유용하게 사용할 수 있는 기간이 줄어들 수 있다는 점을 반영해 LTE 주파수의 이용기간 단축을 허용한다는 방안도 나왔다. 과기정통부는 ""3G·4G 서비스 이용자 보호, 주파수의 효율적 이용 측면 등을 종합적으로 고려해 대역별 이용기간을 설정할 것""이라며 ""이용자 보호에 문제가 없는 경우 이용기간 동안 5G 이상의 기술 방식으로 (주파수를) 이용할 수 있도록 기술기준 선개정을 추진할 것""이라고 밝혔다.",https://n.news.naver.com/mnews/article/008/0005285529
2025-12-01 16:13:00,"르노코리아, 11월 판매량 4649대…전년比 69.4%↓","르노코리아의 지난달 판매량이 감소했다.  르노코리아는 올해 11월 총 4649대를 판매하며 전년 동기 대비 판매량이 69.4% 줄었다고 1일 밝혔다. 내수에서 3575대, 수출에서 1074대를 판매하며 각각 51%, 86.4% 급감한 탓이다.  내수 판매 1위는 여전히 중형 SUV(다목적스포츠차량) '그랑 콜레오스'로 2403대가 팔렸다. 다만 지난해 6582대와 비교하면 63.5% 판매량이 줄었다. 이 중 하이브리드 E-Tech 모델은 2052대로 85.4%를 차지했다.  쿠페형 SUV '아르카나'는 1.6 GTe 459대, 하이브리드 E-Tech 101대 등 총 560대가 판매됐다. 아르카나 판매량은 81.2% 증가했다.  스테디셀러 SUV 'QM6'와 중형 세단 'SM6'는 11월에 각각 601대와 6대의 판매를 기록했다. QM6는 71.7% 늘었지만 SM6는 84.6% 줄었다. 지난달을 마지막으로 판매가 종료된 탓이다.  수출은 그랑 콜레오스(수출명 뉴 르노 콜레오스) 421대, 아르카나 349대 등이 선적됐다. 폴스타의 폴스타4는 캐나다향으로 304대 수출길에 올랐다.  앞서 르노코리아 부산공장은 미래 전기차 생산 기지로의 전환을 위해 올해 초 68개 설비에 대한 대규모 업데이트를 진행하고 하나의 혼류 생산 라인에서 내연기관과 하이브리드 차량은 물론 최신의 순수 전기차도 생산할 수 있는 역량을 갖췄다.",https://n.news.naver.com/mnews/article/008/0005285528
2025-12-01 16:12:00,성과 과시에 힘 쏟는 北 김정은…당대회 앞두고 전략미사일까지 공개,"김정은 북한 노동당 총비서 겸 국무위원장이 병원·발전소·농장 등을 잇달아 방문하며 '지방발전 20X10' 정책의 성과를 선보인 데 이어 '북한판 타우러스' 등 공군의 신규 '전략자산'도 대내외에 공개하며 치적 과시에 집중하고 있다. 내년 초 열릴 9차 당대회를 앞둔 만큼 이달 내내 전시적 행보가 이어질 전망이다.  북한 노동당 기관지 노동신문은 지난달 30일 김 위원장이 지난 28일 딸 김주애와 강원도 원산의 갈마비행장을 방문해 공군 창설 80주년 행사에 참석했다고 보도했다. 행사에 참석한 김 위원장은 연설을 통해 ""우리 공군에는 새로운 전략적 군사 자산들과 함께 새로운 중대한 임무가 부과될 것""이라며 ""핵전쟁 억제력 행사에서 일익을 담당하게 된 공군에 대한 당과 조국의 기대는 실로 크다""고 밝혔다.  이날 행사 사진에선 북한의 각종 공중 무기 체계가 공개됐는데, 특히 수호이(SU)-25 전투기에 '타우러스'와 비슷한 모형의 미사일이 장착된 모습이 처음 포착됐다. 이와 함께 신형 공대공 미사일과 공격·정찰용 무인기와 북한의 첫 공중조기경보통제기 등도 행사에 동원됐다.  김 위원장의 이번 행보는 지난 10월 북한의 첫 번째 5000t급 신형 구축함인 최현호를 방문해 해군력 강화 의지를 강조한 데 이이 전략자산을 공개하며 공군력 강화 역량을 과시한 것으로 풀이된다.  정부는 김 위원장의 이같은 행보가 이어질 것으로 전망했다. 윤민호 통일부 대변인은 1일 서울 종로구 정부서울청사 브리핑룸에서 이뤄진 정례브리핑에서 ""(북한은) 9차 당대회를 앞두고 관련 준비 과정이 있을 것 같다""며 그 성과를 결속하고 준비하는 과정에서 내부 성과를 독려하는 이런 동향이 이어질 것으로 보고 있다""고 밝혔다.  김 위원장은 최근 평양 인근 강동군병원 방문, 강원도 회양군 소재 소수력발전소인 회양군민발전소 준공식 참석, 완공단계에 들어선 신의주온실종합농장 현지 지도 등 국가경제발전 5개년 계획의 성과를 과시했다. 이번 공군 전략자산 공개는 경제 5개년 계획과 함께 이뤄진 국방 5개년 계획의 홍보 목적으로서 일종의 '치적 과시'로 해석된다.  아울러 북한은 이달 중순 올해 부문별 사업을 총화(결산)하는 노동당 중앙위원회 전원회의를 앞두고 있다. 이번 전원회의는 2021년 1월 8차 노동당 대회 때 구성된 당 중앙위원회 8기의 마지막 전원회의로, 내년 초 9차 당대회를 앞두고 열리는 것이다.  올해는 북한이 8차 당대회 때 정한 5개년 계획을 마무리하는 해인 만큼 김 위원장이 직접 회의를 주재하고, 경제 및 국방 발전 5개년 계획의 성과에 대한 총괄적 평가도 이뤄질 것으로 전망된다.  전문가들은 북한의 중요 일정을 앞둔 만큼 김 위원장의 성과 과시 행보가 이어질 것으로 전망한다.  양무진 북한대학원대 석좌교수는 머니투데이 더300(the300)과의 통화에서 ""올해 5개년 계획을 마무리하고 내년 9차 당대회를 기점으로 새 노선 전략을 내놔야 하는 만큼 소위 치적 점검 차원의 활동이라고 보면 된다'며 ""(전원회의 전) 남은 보름 동안 김 위원장은 현지 지도를 통해 경제·국방 과제를 계속 점검할 것""이라고 말했다.  이어 ""북한은 이를 통해 김 위원장이 밤낮으로 일하는 지도자상을 확립하고, 이를 통해 9차 당대회의 새로운 문을 열자고 (홍보할 것)""이라며 ""그 속에서 김정은 위원장 중심의 유일 영도체계 강화가 이뤄질 것""이라고 내다봤다.",https://n.news.naver.com/mnews/article/008/0005285527
