날짜,제목,본문,링크
2025-12-01 09:35:00,"""AKMU 이찬혁과 함께 새해 소망 빌어요""…현대차, 카운트다운 캠페인","현대자동차가 2026년 카운트다운 캠페인 'Hyundai Wish Tale'을 시작한다고 1일 밝혔다.  2011년 처음 시작한 현대차 카운트다운 캠페인은 새해를 앞두고 희망과 감동을 고객과 함께하기 위한 회사의 대표 연말 행사다.  올해는 '소망이 우리를 나아가게 한다'라는 주제로 악뮤(AKMU) 이찬혁과 함께 행사를 준비했다.  우선 캠페인 무비 '더 스노우위시맨(The Snowish Man)'의 티저 영상을 1일 공개한다. 첫눈에 담긴 소망으로 탄생한 스노우위시맨과 현대차의 미래 모빌리티 로봇 '스팟(Spot)'이 사람들의 새해 소망을 이뤄주는 내용을 담은 10분 분량의 판타지 무비다. 10일 현대차 공식 유튜브에서 본편을 공개하며, 롯데시네마에서 스페셜 상영이벤트를 개최한다.  현대차는 이찬혁이 편곡·개사하고 직접 부른 캐럴송 'We Wish'도 현대차 공식 SNS(소셜미디어)에 1일 공개한다. 또 누구나 쉽게 참여할 수 있는 모바일 연하장 '위시카드(Wish Card)' 이벤트로 고객이 현대차 공식 SNS 계정에서 가족과 지인에게 감사의 마음을 전할 수 있도록 한다.  31일 자정에는 캠페인의 하이라이트 'Wish 카운트다운 필름'이 공개된다. 현대차 공식 유튜브 채널과 방송사에서 선보이는 이 영상에선 1500대의 드론이 등장하는 '드론 아트워크'를 통해 휴머노이드 로봇 '아틀라스(Atlas)'의 역동적인 퍼포먼스를 구현, 현대차의 미래 기술 비전을 상징적으로 전달한다.  현대차 관계자는 ""이번 캠페인으로 회사의 '인류를 위한 진보(Progress for Humanity)' 비전을 고객이 직접 경험하고 모든 분의 소망이 이뤄지는 새해가 되기를 기원한다""고 밝혔다.",https://n.news.naver.com/mnews/article/008/0005285242
2025-12-01 09:34:00,"백석대-충남교육청, 인성교육 협력 MOU...충남인성교육 협의회 출범","백석대학교 인성개발본부가 지난달 28일 교내 본부동에서 충청남도교육청과 충남 초·중·고 학생의 성장 및 회복 지원을 위한 업무협약을 체결하고, 'S-PIPES 휴먼인성개발 포럼'을 열었다고 1일 밝혔다.  이날 행사에 김행금 천안시의회 의장, 송해영 천안동남경찰서 총경, 이병도 충남교육연구소장, 윤여숭 충남청소년재단 관장, 김용준 천안다나힐병원장, 최성수 천안아산변호사회장, 박호철 순성초 교장 등 20여명이 참석했다.  1부 협약식에서는 지역사회의 인적·물적 자원 교류를 중심으로 한 상호 연계 방안을 논의했다.  협약의 주요 내용은 △학업중단 위기학생 대상 대학 연계 대안위탁교육 프로그램 운영 △학교폭력 관련 학생 특별교육 및 관계회복 프로그램 추진 △발달 단계에 따른 인성교육 프로그램 개발·운영 등이다.  송기신 백석대 총장은 ""지역사회 교육의 동반자로서 함께 책임을 나누는 일은 매우 의미 있다""며 ""학생의 변화와 성장을 이끌 수 있는 교육 프로그램을 지속적으로 개발하겠다""고 말했다.  김지철 충남교육감은 ""이번 협약은 제도적 연계를 넘어 교육의 본질에 다가가는 발걸음""이라며 ""앞으로 지역사회와의 협력을 확대하겠다""고 전했다.  2부 'S-PIPES 휴먼인성개발 포럼'은 지역 인성교육 수요에 기반한 협력 모델 고도화와 지속가능한 생태계 구축을 목표로 마련됐다.  포럼은 이계능 백석대 인성개발본부 부총장의 '인간의 인성은 AI시대의 존재적·관계적·생산적 도구' 기조강연으로 시작해 천종호 부산지방법원 부장판사의 '인성과 법, 정의로운 사회' 강연으로 이어졌다.  이외에도 △충남 위기학생 지원 사례 분석 △충남 초·중·고 학생 인성 개발 수준 분석 등 교육·복지·법 분야 현장 기반 연구를 소개하고, 통합 인성지원 체계의 필요성에 대해 논의했다.  이 부총장은 ""학업·관계·정서 영역을 통합해 학생을 지원할 것""이라며 ""기관 간 전문성을 연계해 충남 학생의 건강한 성장 모델을 실현하겠다""고 강조했다.",https://n.news.naver.com/mnews/article/008/0005285241
2025-12-01 09:33:00,"SKAI, AI 마케팅 신사업 10개월 만에 수주 '30억' 돌파…성장 궤도 안","AI(인공지능)테크 솔루션 기업 스카이월드와이드(SKAI)가 올해 신설한 마케팅솔루션사업부를 통해 불과 10개월 만에 누적 수주액 30억원을 달성했다고 1일 밝혔다. 이는 회사의 AI 기반 광고·마케팅 솔루션이 시장 진입 초기임에도 불구하고 빠른 속도로 경쟁력을 입증했음을 보여주는 성과다.  이번에 수주한 프로젝트들은 국내외 대형 제조·금융·라이프스타일·엔터테인먼트 기업을 포함한 다양한 산업군에서 확보한 것이다. 스카이월드와이드의 맞춤형 AI 마케팅 솔루션이 특정 분야에 국한되지 않고 폭넓게 적용될 수 있는 가능성을 보여줬다. 특히 정교한 데이터 분석 능력과 AI 기반 콘텐츠 제작 역량이 광고 타겟팅의 정밀도와 ROI(투자 대비 효과)를 높이는 데 기여했다는 평가를 받고 있다.  스카이월드와이드는 그래프 데이터베이스(DB) 분야에서 국내 유일의 전문 기술을 확보하고 있으며, 세계 최초로 관계형 DB와 그래프 DB를 결합한 하이브리드 기술을 상용화한 바 있다.  회사는 이러한 고도화된 데이터 표현 및 추론 기술을 기반으로 올해 초 AI 솔루션 기업으로의 전환을 선언했다. 임시주주총회를 통해 △AI 이커머스 타겟팅 △금융 리스크 분석 △헬스케어 데이터 분석 △공급망 관리(SCM) 등을 사업 목적에 추가했다. 이번 수주는 이러한 전략적 확장이 실질적인 수익으로 연결되고 있음을 보여주는 대표적 사례다.  향후 마케팅솔루션사업부는 그래프 데이터베이스 및 그래프 검색증강생성(RAG) 기술을 접목해 광고 타깃팅의 정밀도를 한층 강화하고, 고객 맞춤형 AI 기반 마케팅 전략을 고도화할 계획이다.  특히 온톨로지 사업을 통해 축적해 온 데이터 구조화·운영 역량이 마케팅 분야에서도 경쟁우위를 창출하는 핵심 기반이 되면서, 이를 바탕으로 보다 큰 규모의 마케팅 비즈니스로 확장을 본격화하고 있다. 또한 관계사인 스카이인텔리전스와의 긴밀한 기술 협력을 통해 데이터 인프라부터 콘텐츠 생산까지 유기적으로 연결되는 통합형 AI 솔루션을 강화하며, 기업들이 요구하는 고도화된 데이터 기반 마케팅 수요에 종합적으로 대응해 나갈 예정이다.  신재혁 스카이월드와이드 대표는 ""출범 10개월 만에 30억원 규모 신규 사업을 확보한 것은 당사의 검증된 데이터·AI 융합 기술력과 고객 신뢰가 뒷받침된 성과""라며 ""데이터 기반 인사이트가 곧 비즈니스 기회를 만든다는 점을 현장에서 확인해온 만큼, 이러한 데이터 운영 능력을 기반으로 향후 온톨로지 사업을 넘어 대기업 및 글로벌 브랜드들을 대상으로 더욱 큰 규모의 마케팅 영역에서 도전과 확장을 하겠다""고 말했다.",https://n.news.naver.com/mnews/article/008/0005285240
2025-12-01 09:33:00,"펩트론, 장초반 4%대 하락","코스닥 상장사 펩트론이 1일 오전 9시 30분 기준 전거래일 대비 4.26%(1만45000원) 하락한 32만5500원에 거래되고 있다.  펩트론은 지난달 28일 39만2500원까지 올라 52주 신고가를 경신했다. 펩트론은 이날 장초반에 9%대 급락했다가 낙폭을 줄여가고 있다. 이날 하락은 최근 급등에 따른 차익실현 물량이 출회한 것으로 분석된다.  펩트론은 충북 청주 오송첨단의료복합단지에 미국 우수의약품 제조품질관리기준(cGMP) 신공장 건설을 추진하고 있다. 공장 규모는 지상 3층, 연면적 8000㎡에 달한다. 연간 최대 1000만 바이알(병)의 장기지속형 주사제를 생산할 수 있는 규모다. 펩트론은 공장 건립과 관련해 충북경제자유구역청이 건축 인허가 심의를 진행 중이다.",https://n.news.naver.com/mnews/article/008/0005285239
2025-12-01 09:33:00,"""도굴꾼 잡아라""... SK플래닛-민속촌, AR 적용 체험프로그램 운영","SK플래닛은 1일 한국민속촌과 함께 전통문화와 AR(증강현실) 기술을 결합한 모바일 AR 체험 프로그램을 선보인다.  '도굴꾼 검거 대작전'을 콘셉트로 한 이번 프로그램은 참여자가 조선시대 포도대장이 되어 한국민속촌 곳곳을 누비며 단서를 추적하는 체험형 AR 콘텐츠다. 한국민속촌 내 주요 전통 공간에 전통문화의 상징성과 의미를 담은 단서를 배치해 스토리텔링을 강화하고, 시각·청각 효과를 더해 AR로 구현했다.  SK플래닛은 2016년부터 브랜드 프로모션을 체험형으로 전환하고 이용자의 참여를 확대하기 위해 웹 AR 기반 마케팅 솔루션 '플레이 AR(play AR)'을 구축해왔다. 이 솔루션을 활용해 코카콜라·스타벅스·한국관광공사·카카오페이증권·파라다이스시티 호텔 등과 20여 건의 AR 프로모션을 진행해왔다.  플레이 AR은 별도 앱 설치 없이도 QR 코드를 스캔하는 것만으로 AR 콘텐츠에 접속할 수 있도록 했다. 이를 통해 브랜드 노출 확대는 물론 사용자 접근성을 크게 개선해 고객 참여를 자연스럽게 유도하고 몰입감을 높인다는 게 회사 측 설명이다. 특히 이용자가 경험한 AR 콘텐츠가 SNS(소셜미디어)를 통해 공유되며 자연스러운 확산 효과도 기대된다.  SK플래닛 관계자는 ""한국민속촌과의 이번 협력을 계기로 전통문화와 AR 기술을 결합한 관광 혁신 모델을 지속 확대할 것""이라며 ""온·오프라인에서의 고객 접점을 높이고, 초등학생 및 청소년 단체 방문객에게도 교육용 AR체험을 제공할 수 있도록 서비스를 지속 개발하겠다""고 말했다.",https://n.news.naver.com/mnews/article/008/0005285238
2025-12-01 09:32:00,"남태현, 앞차 추월하려다 '쾅'...마약 집유 중 음주운전→재판행","그룹 위너 출신 가수 남태현(31)이 음주운전 혐의로 재판을 받는다.  1일 뉴시스에 따르면 서울서부지법 형사11단독 허준서 부장판사는 오는 11일 도로교통법 위반(음주운전) 등 혐의를 받는 남태현의 첫 공판 기일을 진행한다.  남태현은 지난 4월 27일 오전 4시10분쯤 강변북로 일산 방향 동작대교 인근에서 음주운전을 하다 사고를 낸 혐의를 받는다. 당시 남태현은 앞차를 추월하려다 중앙분리대를 들이받았다. 사고로 인한 인명피해는 발생하지 않았다.  서울 용산경찰서는 지난 5월 중순 남태현을 불구속 상태로 검찰에 넘겼고, 사건을 넘겨받은 서울서부지검은 지난 7월 14일 남태현을 불구속 기소했다.  남태현은 음주운전 혐의 외에도 제한속도 위반 혐의를 받는다. 현행 도로교통법에 따르면 제한 속도보다 시속 80㎞ 초과한 속도로 자동차를 운전한 경우 30만원 이하의 벌금이나 구류에 처할 수 있으며, 시속 100㎞ 이상 초과 시에는 100만원 이하의 벌금이나 구류 처분이 내려진다.  남태현은 2014년 그룹 위너 멤버로 데뷔했으나, 2016년 탈퇴하고 그룹 사우스클럽의 보컬과 솔로 가수로 활동을 이어오다 마약 투약으로 방송 활동을 중단했다. 남태현은 마약류관리법 위반 혐의로 징역 1년에 집행유예 2년을 선고받은 바 있으며, 2023년 3월에는 마약 수사 중 음주운전 사고를 내 벌금 600만원의 약식명령을 받았다.",https://n.news.naver.com/mnews/article/008/0005285237
2025-12-01 09:30:00,"쿠팡, 대규모 개인정보 유출에 …보안주 강세","1일 오전 국내 보안주 주가가 강세다. 국내 전자상거래 대표 업체인 쿠팡에서 대규모 개인정보 유출 사태가 발생한 영향으로 풀이된다.  이날 오전 9시26분 기준 지니언스는 코스닥시장에서 전 거래일 대비 2520원(13.04%) 2만1850원에 거래되고 있다.  같은 시각 에스투더블유(4.49%), 싸이버원(등락률 21.59%), 샌즈랩(7.61%), 라온시큐어(3.65%), 등 사이버보완 관련주로 분류되는 이들 회사의 주가도 일제히 강세를 보인다.  앞서 쿠팡은 고객 계정 약 3370만개가 무단으로 노출된 사실을 확인했다고 지난달 29일 공지했다. 쿠팡은 노출된 정보는 이름, 이메일, 전화번호, 주소 등이며 해외 서버를 통해 지난 6월24일부터 개인정보에 무단 접근한 것으로 추정된다고 설명했다.  이번 정보 유출 규모는 개인정보 보호 위반으로 개인정보보호위로부터 사상 최대 과징금(1348억원) 처분을 받은 SK텔레콤의 개인정보 유출 사고(약 2324만명)를 뛰어넘는 규모다.  개인정보보호위는 현재 관련 조사를 진행 중이다. 과학기술정보통신부는 민관합동조사단을 꾸려 사고 원인을 분석하고 재발 방지 대책을 마련하기로 했다. 서울경찰청 사이버수사대는 지난달 25일 쿠팡 측으로부터 이번 사태에 대한 고소장을 받아, 개인 정보 유출 사태에 대한 수사에 착수했다.",https://n.news.naver.com/mnews/article/008/0005285236
2025-12-01 09:28:00,"'AI융합 통관영상 솔루션' 만든 딥노이드, '안전 AI전환 혁신상' 수상","AI(인공지능) 소프트웨어 전문기업 딥노이드는 지난달 25일 한국정보통신산업진흥원(NIPA)이 주관하는 '2025 NIPA 파트너스 데이'에서 '안전 AX(인공지능 대전환) 혁신상'을 수상했다고 1일 밝혔다.  매년 NIPA가 주관하는 이 행사는 NIPA의 지원 사업을 기반으로 매출 증대, 해외 수출, 혁신적 기술·서비스 등 우수 성과를 달성한 기업을 발굴해 시상한다.  딥노이드는 '부처협업 기반 AI 확산 사업'의 성과를 인정받아 '안전AX혁신상'을 수상했다. 이 사업은 정부 각 부처가 현장 수요와 데이터를 제공하고, 참여 기업이 이를 토대로 AI 솔루션을 개발·실증·개선·확산하는 선순환 구조를 만들어가는 프로젝트다. 딥노이드는 2023년 해당 사업의 주관기관으로 선정돼 3년 동안 'AI융합 통관 영상 관리 솔루션'을 개발해왔다.  이날 시상식에는 임문영 국가AI전략위원회 부위원장, 엄열 과학기술정보통신부 국장, 박윤규 NIPA 원장 등이 참석했다.  김태규 딥노이드 전무는 ""정부 부처와 기업 간 협력 사업에 참여해 의미 있는 성과를 낼 수 있어 기쁘다""며 ""앞으로도 정부와 긴밀히 협력해 보안뿐 아니라 의료 등 다양한 분야에서 실효성 있는 AI 솔루션을 만들어가겠다""고 전했다.  딥노이드는 이 외에도 NIPA가 주관하는 △AI 기반 중증 외상 전주기 케어시스템 개발 및 실증 △국산 NPU(신경망처리장치)를 활용한 초거대 언어 모델 기반 의료 영상 판독문 생성 AI 응용 서비스 실증 사업 등을 수행하며 AI 기술 협력을 통한 공익 증진에 앞장서고 있다.",https://n.news.naver.com/mnews/article/008/0005285235
2025-12-01 09:28:00,외인 매수에도 코스피 하락 반전…강세 이어가는 코스닥,"코스피와 코스닥이 동시 상승 출발하며 올해 마지막 달 거래를 시작했으나, 개장 20여분 만에 코스피만 하락 반전했다.  1일 9시 24분 현재 코스피는 전 거래일 대비 8.48포인트(0.22%) 내린 3918.11을 나타낸다. 이날 코스피는 41.33포인트(1.05%) 오른 3967.92로 시작했으나, 9시 21분을 기점으로 하락 반전한 뒤 낙폭을 넓히고 있다.  이경민 대신증권 연구원은 ""코스피가 4주째 금요일마다 급락 후 반등을 반복하고 있는데, 3600~3700선에서 지지력 확보가 가능해 보인다""며 ""이는 펀더멘털 변수가 아닌 투자심리, 수급 변동성으로 인한 조정이다""고 했다.  그러면서 ""단기 급락 때마다 적극적으로 모아가는 전략을 추천한다""며 ""이 패턴을 오는 11일 전후, 코스피 저점이 확인될 때까지 이어가는 게 유리하다""고 했다.  코스피 시장에서 외국인은 558억원, 개인은 122억원 순매수 중이고, 기관은 517억원 순매도 중이다.  업종별로는 제약, 전기·전자, 운송·창고, 의료·정밀기기가 1%대 강세고, 제조, 유통, 증권, 종이·목재, 기계·장비, 금융, IT서비스, 통신, 화학이 강보합이다. 보험, 금속, 일반서비스, 오락·문화, 섬유·의류, 건설, 음식료·담배는 약보합, 전기·가스, 운송장비·부품은 1%대 약세다.  시가총액 상위종목에서는 SK스퀘어, 삼성바이오로직스가 3%대, SK하이닉스가 2%대, 삼성전자, 셀트리온이 1%대 강세다. LG에너지솔루션, NAVER, KB금융, 삼성물산은 강보합, 두산에너빌리티는 약보합이다. 기아, 현대차, HD현대중공업은 1%대, 한화에어로스페이스는 3%대 약세다.  같은 시각 코스닥은 전 거래일 대비 11.25포인트(1.23%) 오른 923.92에 거래 중이다.  코스닥 시장에서는 개인이 378억원, 기관은 520억원 순매수 중이고 외국인이 823억원 순매도 중이다.  업종별로는 기계·장비가 2%대, 금융·화학, 전기·전자, IT서비스, 제조, 의료·정밀기기, 일반서비스는 1%대 강세고 비금속, 기타제조, 종이·목재, 운송장비·부품, 출판·매체복제, 제약, 금속, 통신, 유통, 섬유·의류가 강보합권, 오락·문화, 운송·창고, 건설이 약보합권이다.  시가총액 상위종목에서는 레인보우로보틱스, 에코프로비엠이 4%대, HLB가 3%대, 에코프로, 파마리서치가 2%대, 케어젠, 삼천당제약, 에이비엘바이오, 리가켐바이오가 1%대 강세다. 알테오젠, 코오롱티슈진은 강보합권, 보로노이는 보합, 리노공업은 약보합권이다. 펩트론은 9%대 약세다.  원/달러 환율은 서울 외환시장에서 전 거래일 대비 3.6원 내린 1467원에 주간 거래를 시작했다.",https://n.news.naver.com/mnews/article/008/0005285234
2025-12-01 09:28:00,"새 가정 꾸린 전처 '돌변'...""아이 데리고 집 나가"" 쫓겨날 위기","이혼한 아내가 새로운 가정을 꾸렸다는 이유로 아내 명의 아파트에서 살아온 저와 아이를 집에서 나가라고 요구하고, 양육비까지 깎아달라고 한다면 어떻게 해야 할까.  1일 YTN 라디오 '조인섭 변호사의 상담소'에서 초등학생 자녀를 혼자 키우고 있다고 밝힌 남성 A씨는 최근 전처로부터 재산분할 소송과 양육비 감액 청구를 받았다며 고민을 토로했다.  A씨는 프리랜서 디자이너였던 30대 초반에 아내를 처음 만났다. 당시 A씨는 가진 것도, 내세울 것도 없었지만 번듯한 직장에 다니며 돈을 꽤 모아둔 상태였던 아내로부터 청혼받고 결혼을 결심했다.  하지만 행복은 오래가지 못했다. 워커홀릭이었던 아내는 아이를 낳고도 육아에 소홀했다. 아이가 초등학교 입학할 무렵에는 집까지 나갔다. 이후 2년간 A씨는 재택근무를 하며 아이를 돌봐야 했다.  그러던 어느 날 아내는 ""이혼하자""고 통보했다. A씨도 마음이 떠난 상태였기 때문에 협의 이혼에 동의했다. 양육권은 A씨가 가졌고, 아내는 법원 기준에 따라 양육비를 지급하기로 했다. 아내 명의 아파트에 A씨와 아이가 살고 있었으나 재산분할은 따로 하지 않았다.  그런데 이혼하고 1년이 지났을 때쯤 재산분할 청구 관련 우편물이 날아왔다. 아내는 아파트가 자신의 특유재산이고, A씨가 무단 점유를 했다며 당장 집을 비워달라는 건물 명도 소송을 제기했다. 그동안의 월세도 청구했다.  A씨는 ""저와 아이가 아파트에 계속 살았고, 아이 학교 문제도 있으니 막연하게 '언젠가 재산분할 하겠지'라고 생각했다""며 ""그 뒤에 온 우편물은 더 기가 막혔다. 재혼하고 새로운 아이가 생겼다면서 이미 정한 양육비에 대한 감액 소송도 한 것""이라고 설명했다.  이어 ""친엄마라는 사람이 어떻게 자기 아이와 사는 집에서 나가라고 할 수 있냐""며 ""게다가 새 가정이 생겼으니 양육비를 깎겠다는 게 말이 되냐. 10년간 아이를 키웠는데, 이 집에 제 권리는 없는지 궁금하다. 제 수입으로 아이를 어떻게 키울지 막막한 상황""이라고 토로했다.  김미루 변호사(법무법인 신세계로)는 ""재산분할은 합의가 안 된 경우 이혼 확정일로부터 2년 안에 청구해야 한다""며 ""A씨 전처는 아파트가 자신의 특유재산이라고 주장하지만 혼인 기간이 10년이 넘었고, 아파트가 혼인 중 형성된 재산이라면 A씨가 기여한 부분이 있으므로 재산분할 대상에 포함된다. 전처 소송에 맞서서 반소를 제기하면 된다""고 설명했다.  다만 ""건물 명도는 해야 할 것 같다""며 ""이혼한 뒤 1년 이상 아파트에 살고 있다면 재산분할 대상 여부와는 별개로 A씨가 계속 거주할 수 있는 권리가 있다고 보긴 어렵다""고 했다.  그러면서 ""원칙적으로는 집을 비워야 하는 게 맞지만, 현재 미성년자 자녀를 양육하고 있고 재산분할 소송을 진행하고 있는 사정을 고려해 법원이 퇴거 시점을 늦추는 결정을 내릴 수도 있다""고 덧붙였다.  A씨 전처의 월세 요구에 대해서는 ""혼인관계가 실질적으로 파탄된 이후 전처 명의 부동산을 점유하는 것에 대해 차임 상당액 부당이득 반환 청구를 할 수 있다""며 ""월세를 별도 지급하기보다는 진행 중인 재산분할 과정에서 지분 조정으로 해결될 가능성이 높다""고 봤다.  또 ""전처 재혼이나 출산은 양육비 감액 사유가 되지 않는다""며 ""건강상 문제나 실직 등 현저한 소득 변화가 있는 게 아닌 이상 생활비가 늘었다는 이유로 양육비를 감액해 달라는 주장은 받아들여지지 않을 것""이라고 밝혔다.",https://n.news.naver.com/mnews/article/008/0005285233
