날짜,제목,본문,링크
2025-12-04 09:36:00,"에이비엘바이오, '빅딜' 성과 이어간다…""그랩바디-B 사업화 확장""","에이비엘바이오의 잇따른 대형 플랫폼 기술이전 계약에 바이오 업계 전반에 훈풍이 불면서 차기 주자에 대한 기대감이 높아지고 있다. 다만 이미 글로벌 빅파마로부터 검증받은 플랫폼 기술과 확대되는 뇌-혈관장벽(BBB) 셔틀 수요를 감안하면 후속 기술이전의 무게추는 여전히 에이비엘바이오에 기울어 있단 전망이 나온다.  4일 업계에 따르면 에이비엘바이오는 올해 글락소스미스클라인(GSK), 일라이 릴리와 약 8조원 규모의 플랫폼 기술이전 계약을 체결했다. 이는 올해 전체 국내 제약바이오 기업의 글로벌 기술이전 실적의 절반을 차지할 정도로 압도적인 성과다. 또한 일라이 릴리와 1500만달러(약 220억원) 규모의 전략적 지분투자 계약을 체결하며 국내 기업 최초로 글로벌 빅파마의 지분투자를 유치하는 데 성공했다.  지난 11월 일라이 릴리와의 계약 소식은 국내 바이오 업계 전반에 훈풍을 불러왔다. 국내 바이오텍이 글로벌에서 인정받고 있으며 향후 글로벌 '빅 바이오텍'으로 성장할 수 있단 가능성을 명확히 입증하면서다. 에이비엘바이오에 대한 관심이 'K-바이오' 전체로 확산하면서 차기 주자에 대한 기대감도 높아졌다.  다만 글로벌 수준에서 충분히 검증된 플랫폼 기술을 보유한 곳이 많지 않아 이미 글로벌 파트너십 경험이 있는 기업이 추가 기술이전 성과를 낼 가능성이 높단 분석에 무게가 실린다. 그 중에서도 에이비엘바이오는 에피톱 기반 기술이전 등 플랫폼 기술이전에 최적화된 전략을 갖추고 있어 빠르게 후속 기술이전 계약을 체결할 가능성이 가장 높단 평가를 받고 있다.  최근 BBB 셔틀에 대한 글로벌 제약사들의 관심이 높아지고 있는 것도 추가적인 그랩바디-B 플랫폼 기술이전 기대감을 높이는 요인이다. 지난 1일(현지시간) 알츠하이머병 임상학회(CTAD 2025)에서 업데이트된 로슈의 항아밀로이드 항체 '트론티네맙' 임상 데이터를 보면 항체 치료제가 중추신경계(CNS) 영역에서 한계를 넘으려면 BBB 셔틀 도입이 필수란 점은 더 분명해진다.  에이비엘바이오 관계자는 ""그랩바디-B의 기술 사업화는 여전히 활발히 진행되고 있다""며 ""최근 개최된 바이오 유럽에서도 그랩바디-B에 관심을 보인 여러 기업들과 만나 파트너십을 논의했다""고 말했다. 이어 ""최근에는 그랩바디-B의 적응증을 퇴행성뇌질환에서 비만 치료제 부작용으로 인한 근감소증 등의 근육 질환으로 확대하는 연구도 진행 중""이라고 덧붙였다.  일라이 릴리의 지분 투자도 향후 파트너십 확대를 염두에 둔 전략적 선택으로 해석된다. 에이비엘바이오는 적응증 확장을 염두에 두고 그랩바디-B를 계속 진화시키고 있을 뿐만 아니라 차세대 BBB 셔틀도 개발 중이다. 일라이 릴리는 계약상 그랩바디-B의 적용 범위를 다양한 모달리티, 복수의 비공개 타깃 후보물질 등으로 크게 열어뒀다.  서근희 삼성증권 연구원은 ""그랩바디-B는 사노피, GSK에 이어 최근 일라이 릴리와의 추가 계약 및 지분 투자까지 함께 이뤄진 점은 플랫폼의 범용성과 기술적 신뢰도를 강화한 것으로 평가된다""며 ""일라이 릴리는 알츠하이머뿐만 아니라 MASH, 비만 등 대사질환 영역에 집중하기 때문에 그랩바디-B의 적용 영역 또한 넓어질 전망""이라고 분석했다.  4-1BB 기반 이중항체 플랫폼 '그랩바디-T' 기반의 파이프라인(신약후보물질) 개발도 가속화하고 있다. 'ABL111'은 현재 위암 표준치료법인 '옵디보+화학 항암제'와 병용하는 미국 임상 1b상이 진행 중이다. 중간 결과에서 높은 안전성이 확인되면서 그랩바디-T 플랫폼의 진가가 드러나기 시작했다. 에이비엘바이오는 ABL111을 시작으로 다른 파이프라인의 임상 역시 병용요법 중심으로 확대해 나갈 계획이다.",https://n.news.naver.com/mnews/article/008/0005287186
2025-12-04 09:34:00,"이철우 도지사, 베트남 방문…""인도·교육·산업·제도 분야 협력 확대""","경북도는 지난 1일부터 3박4일간 일정으로 베트남 타이응우옌성과 박닌성을 공식 방문해 실질적인 협력 성과를 거뒀다고 4일 밝혔다.  도는 지난 3일 박닌성과 우호 교류 재약정식을 갖고 박장성과 통합된 박닌성의 새로운 광역 행정 체계에 맞춘 교육·문화·산업 등 다방면의 협력 기반을 재정비했다.  이 자리에서 이철우 도지사는 팜 황 썬 박닌성 성장에게 내년 중 경북 공식 방문을 요청하고 양 지역 간 자매결연을 체결해 교류를 제도화할 것을 제안했다.  이어 하노이에서 현지 자문위원, 베트남 진출 기업인, 한국 대사관 및 경운대학교 관계자들과 간담회를 갖고 수출기업의 베트남 판로 확대, K뷰티·농식품의 현지 마케팅 지원, ICT·기계부품 분야 협력 발굴, 베트남 청년 인재의 경북 산업계 취업 연계 등의 논의를 펼쳤다.  지난 2일에는 찐 쑤언 쯔엉 타이응우옌성 당 서기를 만나 태풍 피해 성금 전달에 이어 타이응우옌대학교 1000여명의 학생에게 경북의 산업 기반, 유학 제도, 지원 정책 등을 소개하기도 했다.  도는 이번 방문을 통해 인도지원(타이응우옌 태풍 피해 구호), 교육·청년교류(타이응우옌대·K창 협력 확대), 산업·경제 협력(수출·기업 네트워크 강화), 제도적 협력 기반(박닌성 우호재약정·자매결연 추진) 등 4개 분야에서 실질적인 성과를 도출했다고 평가했다.  이 지사는 ""이번 방문은 양 지역 간 협력을 실질 사업으로 발전시키는 중요한 전환점이 됐다""며 ""청년 인재 교류, 산업 협력, 교육 연계 등 포스트 에이펙 세계화 전략을 지속 확장하겠다""고 말했다.",https://n.news.naver.com/mnews/article/008/0005287185
2025-12-04 09:33:00,"HUG, 대한민국 커뮤니케이션 대상 3개 부문 수상","주택도시보증공사(HUG)가 지난 3일 한국프레스센터에서 열린 '2025 대한민국 커뮤니케이션 대상'에서 캐릭터, SNS, 영상물 등 3개 부문을 수상했다고 4일 밝혔다.  올해로 35회를 맞는 대한민국 커뮤니케이션 대상은 한국사보협회가 주관하고 문화체육관광부, 고용노동부 등 국내외 정부 기관, 단체 등이 후원하는 국내 대표 커뮤니케이션 분야 시상식이다.  HUG는 2025년 새롭게 리뉴얼한 공식 캐릭터 '허부기'로 캐릭터 마스코트(굿즈) 부문 최우수상을 수상했다. 또 공식 인스타그램 운영 성과를 인정받아 SNS 부문 국제미래학회장상을 받았다.  영상물 부문에서는 한국교육방송공사(EBS)의 인기 캐릭터 펭수와 협업한 HUG 든든전세주택 홈투어 영상이 국회 행정안전위원장상을 수상하는 등 총 3개 부문을 수상하며 공공 커뮤니케이션 분야에서 우수한 성과를 인정받았다.  HUG 관계자는 ""국민과의 소통을 강화하기 위해 추진해 온 다양한 콘텐츠와 혁신적인 시도가 인정받게 되어 매우 뜻깊게 생각한다""며 ""앞으로도 국민의 관심과 참여를 이끌어낼 수 있는 소통 방식을 지속적으로 확대해 나가겠다""고 말했다.",https://n.news.naver.com/mnews/article/008/0005287184
2025-12-04 09:32:00,"현대건설, '동절기' 건설현장 안전 강화한다…협력사 지원도 확대","현대건설이 겨울철 현장 안전사고 예방을 위한 '동절기 안전점검 릴레이 캠페인'을 진행한다. 협력사 안전관리 인력과 지원범위를 대폭 확대 운영할 방침이다.  현대건설은 전날(3일) 경기 안산시 '힐스테이트 라군 인테라스 2차'와 시흥시 '힐스테이트 더웨이브시티'에서 '동절기 대비 건설 현장 안전점검 릴레이 캠페인'을 진행했다고 4일 밝혔다. 이날 행사에는 이한우 현대건설 대표이사가 직접 현장을 방문해 안전시설과 작업환경을 점검하고, 직원들에게 안전의 중요성을 강조하며 자발적인 참여를 독려했다.  이번 캠페인은 국토교통부의 동절기 대비 릴레이 캠페인 추진계획에 따른 '사고예방 특별 강조주간' 운영의 일환으로 마련됐다. 겨울철 건설 현장에서 발생할 수 있는 추락사고 및 동절기 사고를 예방하기 위해서다. 현대건설은 내년 2월까지 지속하는 동절기 캠페인에 적극 동참하는 한편, 12월 첫 주를 강조 주간으로 정하고 CEO 현장 방문 및 안전점검, 동절기 안전교육, 현수막 설치, 노사 합동점검 등 다양한 예방활동을 진행한다.  우선 공사 수행 중인 국내 전 사업장에 난간·가설재 미끄럼 여부, 동결·결빙 가능 구간, 화재 및 질식 위험 설비 등 겨울철 취약 요소를 중심으로 현장점검을 강화할 방침이다. 고위험 공종에는 사전 점검 절차를 강화해 위험요인을 사전에 차단하고, 외기 온도 변화에 따른 작업여건 조정과 보온·난방 설비 점검 등 계절 특화 조치를 적용한다.  현장 근로자의 한랭질환 예방을 위해 '동절기 3GO 프로그램'을 운영한다. 상시 옥외작업자와 한랭질환 민감군을 대상으로 발열조끼·핫팩 등 보온장구를 지급하고 온수·난방시설 설치, 휴식시간 부여 등 동절기 전용 안전관리 조치를 강화하고 있다. 또 한파 특보 단계에 따라 법적 기준을 상회하는 현대건설만의 자체 휴식 기준을 마련해 옥외작업 시 한랭질환 위험도를 구분해 대응한다. 한파 강도에 따라 작업을 조정하거나 중지하는 등 작업자 건강 보호를 최우선으로 한 대응 기준을 적용하고 있다.  건설 협력사 안전관리 역량과 실효성을 높이기 위한 지원도 전면 확대한다. 법정 의무가 없는 공사금액 100억 원 미만 공종까지 안전관리자 배치를 확대 적용하고, 300억 원 이상 공종에는 추가 인력을 배치하는 한편 공종·규모별 경력 및 자격 요건을 세분화해 협력사의 안전관리 역량을 높일 계획이다. 변경된 기준이 적용되면 1000가구 규모 주택 현장의 경우 기존 3명에서 최대 16명까지 안전관리자 배치가 가능해지고, 현장 특성에 따른 공종별 적용 범위도 더욱 세밀하게 운영될 예정이다.  또 국내 현장을 대상으로 안전보건 경영 체계의 수위를 최고 단계로 높이고, 고위험 작업에 대한 집중적 관리 강화와 안전 장비 투자를 확대한다. 현대건설 관계자는 ""'365 안전패트롤팀'을 운영하며 현장의 위험요인을 선제적으로 점검·조치해 안전관리 체계를 한층 강화하고, 스마트 안전 시스템 구축 및 협력사 대상 안전 지원 프로그램을 확대하는 등 전방위적인 안전관리에 총력을 기울고 있다""고 말했다.",https://n.news.naver.com/mnews/article/008/0005287183
2025-12-04 09:30:00,"한국전력, 군산 앞바다 2ha에 잘피 8만주 이식","한국전력이 탄소중립 실현과 기후위기 대응을 위해 해양 탄소흡수원(이하'블루카본')인 '잘피' 군락지 조성을 꾸준히 이어오고 있다.  한전은 한국수산자원공단과 함께 지난해 전남 완도군 연안에 '잘피 숲' 3ha를 조성한데 이어, 올해는 전북 군산시 장자도 연안 2ha에 잘피 8만주를 성공적으로 이식했다고 4일 밝혔다.  한전이 블루카본으로 이식한 '잘피'는 바닷속에서 꽃을 피우는 해초류로 맹그로브 숲, 염습지와 함께 UN IPCC(기후변화에 관한 정부간 협의체)가 공식 인증한 3대 블루카본 중 하나이다.  한전이 완도·군산 지역에 조성한 5ha 규모 잘피 군락지는 승용차 1000대가 1년간 배출하는 약 2500여t의 탄소를 흡수할 수 있을 것으로 기대된다.  '블루카본'은 바다와 해초 등 해양생태계가 흡수하는 탄소로 산림 등 육상의 탄소흡수원인 '그린카본'보다 50배 이상 빠르게 탄소를 흡수할 수 있다. 또한 탄소 저장 능력도 2배 이상 높아 국제사회에서 새로운 온실가스 감축 수단으로 주목받고 있다.",https://n.news.naver.com/mnews/article/008/0005287182
2025-12-04 09:27:00,"토스 차보험 비교 2.0, 이용자 5배 껑충… 절반은 '최저가' 찾았다","토스 앱(애플리케이션)에서 자동차 보험을 비교하는 이용자가 빠르게 늘어나고 있다. 고객 절반은 토스를 통해 현재 자동차 보험보다 더 저렴한 상품을 안내받았다.  토스는 올해 '차보험 비교·추천 서비스 2.0' 데이터를 분석한 결과, 서비스 개편 전인 지난 2월과 비교해 지난달 말 기준 보험료를 끝까지 계산해 본 이용자 수가 5배 증가했다고 4일 밝혔다.  이는 지난 3월 금융위원회가 추진한 '차보험 비교·추천 서비스 2.0' 도입 이후 토스가 보험료 계산의 정확도와 신뢰성을 꾸준히 높여온 데 따른 변화다.  이용자의 체감 혜택 역시 뚜렷했다. 지난달 말 기준으로 이전 가입 보험료보다 더 저렴한 조건을 확인한 고객이 이용자 중 절반에 달했다. 이는 차량 정보와 할인 특약(대중교통·만보기)을 자동으로 반영해 이용자가 직접 입력하지 않아도 받을 수 있는 할인이 정확하게 적용되도록 개선한 결과다. UI·UX도 불필요한 단계를 줄여 보험료를 더 빠르고 쉽게 확인할 수 있도록 다듬었다.  이용자 2명 중 1명은 가장 저렴한 상품으로 중소형 보험사의 상품을 안내받았다. 대형 보험사 중심이던 기존 자동차보험 시장에서 소비자 선택권이 확대되는 흐름이 뚜렷하게 나타나고 있다. 보험료를 확인한 뒤 실제 보험사 가입 페이지로 이동한 이용자 비율도 지난달 말 기준 약 60%로 비교 결과가 실제 가입 절차로 자연스럽게 이어졌다.  토스는 기술을 기반으로 이용자가 더 합리적이고 투명한 기준에서 보험을 선택할 수 있도록 지속해서 고도화 작업을 이어가고 있다.  토스 관계자는 ""정확한 보험료 계산과 자동화된 할인 검증 덕분에 이용자들이 체감하는 혜택이 더욱 커졌다""며 ""앞으로도 소비자가 합리적인 기준에서 자동차보험을 비교하고 선택할 수 있도록 기술 기반의 개선을 이어가겠다""고 말했다.",https://n.news.naver.com/mnews/article/008/0005287181
2025-12-04 09:26:00,"'5000원 게하 파티'서 돈자랑 진상 손님...""재미없다, 위자료 5000만원 내놔""","게스트하우스에 과도한 환불을 요구하며 위자료 수천만원을 요구한 손님이 협박 혐의로 고소를 당했다.  JTBC '사건반장'은 지난 3일 방송에서 진상 손님에게 시달리고 있다는 게스트하우스 사장의 사연을 공개했다.  사장은 제주도에서 1박 2만원의 저가 게스트하우스를 운영 중이다. 게스트하우스에서는 매일 밤마다 희망자에 한해 각자 준비해온 음식을 나눠 먹는 '포틀럭 파티'를 진행하는데, 지난달 24일 저녁에도 15명 넘는 손님이 파티에 참여했다. 참가비는 5000원이었다.  다만 이날 파티는 평소보다 일찍 마무리됐다. 손님 A씨의 과도한 자기 자랑과 욕설이 분위기를 망친 탓이다. A씨는 당시 다른 손님에게 ""난 돈이 많다"", ""전라도 XX들이 제일 싫다. 다 죽여버려야 한다"", ""코 고는 사람 때릴 것"" 등 욕설을 한 것으로 전해졌다.  사장은 A씨에게 ""혼자만 얘기하지 말고, 다른 사람에게도 말할 기회를 달라""고 타일렀고, A씨는 ""제가 말이 좀 많다. 고치겠다""고 했지만, 달라진 건 없었다.  A씨의 막말에 지친 손님들은 하나둘 자리를 떠났다. A씨도 ""재미없다""며 혼자 술을 마시러 나가 다른 곳에서 잠을 잤다고 한다.  이튿날 아침에야 다시 게스트하우스로 돌아온 A씨는 사장에게 뜬금없이 환불을 요구하고 나섰다. 그는 ""거기서 자지도, 씻지도 않고 나왔는데 환불이 가능하냐. (제가) 돈은 많다"", ""제가 술을 많이 먹긴 했지만, 손님들이 너무 반응이 없어 (재미가 없었다)""라고 했다.  이에 사장은 A씨가 전날 밤 파티에서 했던 말을 조목조목 설명하며 ""그런 말씀을 하면 누가 좋아하겠냐. 남한테서 문제를 찾으려고 하면 안 될 것 같다""고 지적했다. A씨가 환불을 안 받겠다고 했지만, 일을 더 크게 만들고 싶지 않았던 사장은 숙박비 2만원을 돌려주고 통화를 끝냈다.  그런데 A씨는 이틀 만에 다시 전화를 걸어 ""파티비와 아이스크림값은 왜 환불하지 않느냐""며 언성을 높이고 법적 대응을 운운했다. 그러면서 사장에게 ""두 유 스피크 잉글리시? 유 노우?(Do you speak English? You know?) 영어로 할까요?"", ""X발, 사람을 X신 만들어요?"", ""혹시 법을 잘 모르세요?"", ""(법을 모르면) 상황이 생각보다 많이 힘드실 거예요""라고 조롱했다.  손님은 파티 당시 게스트하우스 직원의 추천으로 아이스크림을 주문했는데, 이를 강제 구매라고 주장하며 손해배상과 위자료 5000만원을 3일 안에 송금하라는 내용증명을 보내기도 했다.  사장은 이를 무시했지만, 손님은 지속적으로 전화해 ""왜 일을 크게 만드냐"", ""나한테 이러면 본인만 힘들어진다""고 압박했다. 결국 사장은 경찰에 고소장을 제출한 상태다.  사장은 ""손님이 위치를 알고 있어 혹시 해코지를 할까 두려워 잠시 영업을 쉬어야 할지 고민했다""며 ""숙박비 환불을 요구한 손님은 있어도, 이렇게 한 손님은 처음이다. 이해할 수가 없다""고 호소했다.",https://n.news.naver.com/mnews/article/008/0005287180
2025-12-04 09:24:00,"로킷헬스케어, 의료 AI 플랫폼 '글로벌 보안' 인증…""진입장벽 형성""","인공지능(AI) 초개인화 장기 재생 플랫폼 전문기업 로킷헬스케어가 'AI 장기재생 플랫폼'에 대해 글로벌 시험·인증기관 티유브이 슈드(TUV SUD) 로부터 사이버보안 기술 검증을 통과했다고 4일 밝혔다. 회사는 이번 보안 검증이 단순 기능·성능 평가를 넘어, 의료 AI·클라우드·바이오프린터가 결합한 고난도 융합 의료 시스템의 보안 수준을 국제 기준으로 공식 입증했다는 점에서 의미가 크다고 평가했다.  로킷헬스케어에 따르면 이번 검증 대상은 AI 장기재생 앱(AiD Regen), 바이오 3D 프린터(Dr. INVIVO 4D2D / APLICOR 3D) 및 클라우드 기반 데이터·운영 시스템이 유기적으로 연결된 통합 플랫폼 전체다.  최근 미국 FDA와 유럽연합(EU)은 의료기기 인허가 단계부터 승인 이후까지 전 주기에 걸친 보안 업데이트와 위협 대응 체계를 요구하고 있다. 로킷헬스케어 관계자는 ""단순히 판매 자격을 유지하는 수준을 넘어, 글로벌 규제 당국이 제시하는 보안 요구 수준을 선제적으로 초과 충족하는 플랫폼을 만들기 위한 전략적 선택""이라며 ""경쟁사가 단기간에 따라오기 어려운 질적 진입장벽이 될 것""이라고 했다.  이어 ""이번 인증은 AI 디지털 헬스케어 시장에서 미래 매출과 성장성을 뒷받침하는 핵심 인프라가 될 것""이라며 ""전 세계 대형 병원·글로벌 의료 기관의 높은 보안기준을 초과 충족시킴으로써 세계표준 AI 장기재생플랫폼으로 성장하겠다""고 덧붙였다.",https://n.news.naver.com/mnews/article/008/0005287179
2025-12-04 09:23:00,"유유헬스케어, 강원특별자치도 백년기업 선정","유유헬스케어가 강원 경제의 미래를 선도하는 백년기업에 선정됐다.  유유헬스케어는 지난 3일 강원특별자치도청 통상상담실에서 진행된 2025년도 백년기업 수여식에서 유경수 대표이사가 강원특별자치도 김진태 도지사로부터 백년기업 인증서 및 현판을 수여 받았다고 4일 밝혔다.  강원특별자치도는 2012년부터 도내 20년 이상의 장수기업 중 경영 능력이 우수하고 기술 혁신 노력과 지역경제 기여도가 높은 기업을 발굴해 백년기업으로 선정하고 있다. 백년기업에게는 강원도 중소기업육성자금 한도 우대, 경쟁력 강화사업 지원, 지방세 세무조사 유예, 강원도 경제진흥원 등 유관기관 사업 참여 우대 등의 혜택이 제공된다.  유유헬스케어는 지난달 강원도 횡성군에 제2공장 착공을 진행한 바 있다. 연질캡슐 및 액상 제형 생산라인의 제2공장이 완공되면 정제 등 고형제 생산라인의 1공장과 함께 도합 연 700억원 규모의 건강기능식품 생산이 가능하게 되며 지역인력 135명이 유유헬스케어 횡성공장에 근무하게 된다.  유경수 대표이사는 ""지역 일자리 창출과 산업생태계 활성화라는 선순환 구조를 구축해 강원특별자치도 백년기업의 사회적 책임을 다할 것""이라 말했다.",https://n.news.naver.com/mnews/article/008/0005287178
2025-12-04 09:23:00,"국립목포대, '수업·연구 생산성 향상 위한 AI Tool 활용법' 워크숍 개최","국립목포대 교무처 교수학습이러닝센터가 최근 도서관 영상세미나실에서 '수업·연구 생산성 향상을 위한 AI Tool 활용법' 실습을 위한 교수 워크숍을 개최했다고 4일 밝혔다.  이번 워크숍은 임태형 전주교육대 교수가 지난주 온라인 특강에 이어 대면 실습 강의로진행됐다. 교수자가 수업과 연구 활동에서 활용할 수 있는 생성형 AI 도구들을 살펴보고, 적재적소에 활용하는 방법과 함께 임 교수의 평소 AI 활용 노하우를 공유했다. 또한 NotebookLM, Gemini, Chat GPT 등 최신 생성형 AI의 동향과 함께 AI를 활용한 실제 수업·연구 적용 방법 등도 소개했다.  참여 교원들은 본인 전공에 맞는 강의 자료를 분석하거나, 연구 자료를 요약·재구성 하는 시간을 가지며 ""실제 수업과 연구에 바로 활용해 볼 수 있는 유익한 시간이었다""고 밝혔다.  임 교수는 ""AI는 각자 고유한 특성이 있지만, 교수자와 연구자로서 목적에 맞게 전략적으로 활용하는 역량을 키우는 것이 중요하다""고 말했다.  박석일 교수학습이러닝센터장은 ""이번 워크숍은 다양한 AI 중에서도 특히 수업과 연구 활동에서 활용하기 좋은 실제적인 방법을 배워볼 수 있는 유익한 시간이었다""며 ""앞으로도 생성형 AI를 기반으로 교수·연구 역량 강화를 위한 다양한 교수 워크숍을 지속적으로 운영할 예정이다""고 말했다.",https://n.news.naver.com/mnews/article/008/0005287177
