날짜,제목,본문,링크
2025-12-10 16:25:00,"임상도 전에 3조원 계약…'먹는 비만약' 불 지핀 화이자, 일동제약도?","화이자가 약 3조원 규모 계약을 맺고 저분자 화합물 기반 비만약 파이프라인(신약후보물질)을 도입했다. 내년 상반기부터 여러 개발사의 글로벌 임상 데이터가 순차적으로 도출될 예정인 만큼 펩타이드에 이어 저분자 화합물 기반 비만약 파이프라인의 기술이전도 본격화할 전망이다. 국내에선 일동제약이 임상 1상 데이터까지 확보한 파이프라인의 기술이전을 추진하고 있어 기대감이 높아진다.  10일 외신에 따르면 화이자는 지난 9일(현지시간) 중국 포순제약의 자회사 야오파마로부터 저분자 화합물 기반의 글루카곤 유사 펩타이드-1 수용체 작용제(GLP-1RA) 'YP05002'를 도입했다. 총 계약 규모는 업프론트(선급금) 1억5000만달러(약 2207억원)를 포함해 약 20억8500만달러(약 3조675억원)다.  YP05002는 현재 호주에서 임상 1상이 진행 중인 파이프라인(신약후보물질)으로, 내년 상반기에 임상이 종료될 예정이다. 화이자는 향후 임상 2상 중인 위 억제 펩타이드 수용체(GIPR) 길항제 'PF-07976016' 등 이미 보유하고 있는 저분자 화합물 파이프라인과 병용 연구를 진행할 계획이다.  아직 임상 1상이 종료되지 않은 상태에서도 3조원대의 기술이전 계약이 체결된 만큼 현재 임상 단계에서 개발 중인 저분자 화합물 기반 비만치료제 파이프라인의 기술이전 기대감도 높아진다. 또한 이번 야오파마의 기술이전 사례가 향후 다른 회사들의 딜 규모 산정 등에 영향을 미칠 것이란 전망도 나온다.  지난 8일엔 미국 스트럭처 테라퓨틱스가 저분자 화합물 기반 GLP-1RA '알레니글리프론'의 임상 2b상 결과를 발표하며 시장을 예열시키기도 했다. 알레니글리프론 120mg 투약군은 36주차에 위약군 대비 체중이 11.3% 감소한 것으로 나타났다. 탐색 임상 2b상에선 240mg 투약군의 체중 감소 효과가 15.3%로 나타났다. 스트럭처는 내년에 알레니글리프론 임상 3상에 진입할 예정이다.  이외에도 로슈가 'RO7795081'(CT-996)의 임상 2상을 진행 중이다. 해당 임상은 내년 상반기에 종료될 것으로 보인다. 국내에선 일동제약이 사실상 유일한 플레이어다. 한미약품은 지난 9월 유럽당뇨합회(EASD)에서 저분자 화합물 기반 GLP-1RA 'HM101460'의 초기 연구 성과를 발표했지만 아직 임상에 진입하진 않은 상태다.  일동제약의 'ID110521156'는 임상 1상에서 최고용량 200mg을 투약했을 때 4주차에 평균 9.9%의 체중 감소 효과가 확인됐다. 이는 일라이 릴리의 '오르포글리프론' 의 임상 1상에서 나타난 최고 용량에서의 체중 감소 효과보다 약 3.5%p 높은 수치로 지난 9월 발표 당시 큰 관심을 받았다. 회사는 글로벌 임상 2상 진입을 준비하며 글로벌 기술이전 논의도 이어가고 있다.  이번 딜을 통해 화이자가 멧세라를 인수하며 펩타이드 기반 비만치료제를 확보했음에도 저분자 화합물 영역에서의 개발 의지를 드러낸 점도 이목을 끈다. 통상 저분자화합물은 펩타이드보다 반감기가 짧고, 부작용 우려가 높단 점이 한계로 지적되지만 낮은 제조원가와 편리한 복용법 등이 시장성까지 고려하는 제약사 입장에선 포기할 수 없는 부분이란 분석이 나온다.  일라이 릴리 역시 펩타이드 기반인 '젭바운드'로 비만 치료제 시장 점유율 1위를 점했지만 저분자 화합물 기반 오르포글리프론 출시를 앞두고 생산능력을 확충하고 있다. 오르포글리프론은 최저 용량 기준 월 149달러(약 22만원), 추가 용량 최대 399달러(약 58만원)에 판매될 예정이며, 최대 150억달러(약 22조원)의 매출을 올릴 것으로 전망된다.  업계 관계자는 ""점차 저분자 화합물 비만약 딜이 나오면서 기술이전을 준비하고 있는 경우 이번 화이자의 기술이전 규모를 당연히 참고하는 지표로 삼지 않을까 싶다""며 ""특히 화이자가 펩타이드뿐 아니라 저분자 화합물 기반 비만약 시장이 커질 것이라고 보고 이번 딜을 진행했단 점이 큰 의미가 있다""고 말했다.",https://n.news.naver.com/mnews/article/008/0005290055
2025-12-10 16:24:00,"신안산선 늑장 복구…박승원 광명시장, 시공사에 강경 대응 예고","신안산선 붕괴 사고 복구가 지연되면서 시민 피해가 장기화되자 박승원 경기 광명시장이 10일 시공사인 포스코이앤씨에 강경 대응을 예고했다.  박 시장은 이날 사고 현장을 찾아 ""복구 작업에 소극적 태도를 보이는 포스코이앤씨의 대응은 납득하기 어렵다""며 ""즉각적인 조치가 없다면 피해보상 소송을 포함한 법적·행정적 조치를 검토하겠다""고 밝혔다.  신안산선 붕괴 사고는 발생 후 8개월이 지났지만 주변 주민들의 생활 불편이 여전히 해소되지 않고 있다. 사고 당시 추가 붕괴 우려로 구석말 일대 주민과 상인은 터전을 비우고 대피해야 했다. 양지마을로 연결되는 통로박스는 지금까지 폐쇄된 상태다. 시는 안전을 이유로 통로박스 재시공을 요구했지만, 포스코이앤씨는 보수·보강만으로 충분하다며 별다른 조치를 하지 않았다.  또한 지반 침하로 인근 수로 암거 내구성에 이상이 발생했다는 지적도 있지만, 시공사는 시의 재설치 요청에도 대응을 미루고 있다.  박 시장은 ""시민 피해가 명백한 상황인데 시공사는 여전히 소극적 태도를 보이고 있다""며 ""더는 외면할 수 없는 사안""이라고 경고했다.  박 시장은 이날 신안산선 현장 점검에 이어 포스코이앤씨가 시공 중인 광명~서울 고속도로 공사 현장도 직접 확인했다. 이 현장에서는 최근 미신고 폐수배출시설 운영, 노동자 감전 사고 등이 적발되며 안전·환경 관리 부실 논란이 불거졌다.",https://n.news.naver.com/mnews/article/008/0005290054
2025-12-10 16:23:00,"""쿠팡 피해 보상금 드려요"" 문자에 덥석...텔레그램 접수했다간 털립니다","'개인정보가 유출됐습니다. 금융감독원 지침에 따라 피해보상을 신청하세요.'  한국인터넷진흥원(KISA)과 과학기술정보통신부가 쿠팡의 개인정보 유출 사고를 악용한 전자금융사기(피싱) 시도가 잇따르고 있다며 이용자 주의를 당부했다. 피해보상, 피해환급 등의 키워드로 피싱사이트 접속 및 악성앱 설치를 유도하는 방식이다.  악성 문자 유포 사례의 경우 △최근 쿠팡 등 개인정보 유출 사고를 언급하며 당사도 고객의 개인정보가 유출되었다고 고지 △금융감독원, 소비자보호원 지침을 언급하며 정부가 관여된 것처럼 위장 △구체적으로 유출된 정보(이름, 연락처, 계좌정보, 주소 등)를 나열해 실제 개인정보가 있음을 과시 △피해보상액을 구체적으로 제시 △지정 기한내 피해보상 신청 유도 △개인정보보호법에 따라 텔레그램을 통해 피해보상 신청을 받는다고 비밀 대화 유도 △이후 악성앱 설치 유도 등을 통해 금전피해를 유발할 수 있다.  보이스피싱은 △쿠팡이 발송한 개인정보 유출 피해자 대상 안내 문자 수신여부를 재확인한 뒤 △검찰, 경찰을 사칭해 유출된 개인정보가 범죄에 연루됐다고 협박 △안전한 장소로 이동 및 도피를 권한 후 생활비를 안전계좌에 입금하라는 지시로 금전 피해를 유발할 수 있다.  이에 KISA는 ""쿠팡을 포함해 개인정보 유출 피해에 따른 보상 안내는 개인을 대상으로 시행되지 않으며, 정부기관 등에서 텔레그램 등 메신저를 통해 개인정보 유출 관련 민원접수를 하지 않는다""고 강조했다. '개인정보 유출 피해 보상', '텔레그램으로 신청/접수' 문구가 포함된 경우 문자결제 사기(스미싱) 문자이므로 신고·삭제해야 한다는 설명이다. 또 쿠팡 개인정보 유출을 이유로 수사기관에서 연락 시 연락자의 부서, 계급, 이름을 확인하고 수사기관 대표번호를 통해 재직사실을 재확인해야 한다.  KISA와 과기정통부는지난달 29일 보호나라 홈페이지에 해킹 피해 악용 스미싱·피싱 주의에 관한 보안공지문을 게시했다. 또 보이스피싱, 스팸·스미싱 등 디지털 민생범죄에 대한 모니터링을 지속 강화할 계획이다.",https://n.news.naver.com/mnews/article/008/0005290053
2025-12-10 16:21:00,"이철우 도지사, '필수의료 특별법안 대비 신속 준비' 지시","이철우 경북도지사가 10일 간부회의에서 현재 국회에 계류 중인 '필수의료 강화 지원 및 지역 간 의료격차 해소를 위한 특별법안'에 대한 보고를 받고 이에 따른 관련 정책과 사업을 신속히 준비하라고 지시했다.  이 지사는 ""수도권과 비교해 지역에서 중증 환자가 발생하면 처리할 수 있는 시스템이 부족한 건 사실""이라며 ""이번 법안이 통과되면 도내 지역 간 의료격차와 필수의료 공백을 방지할 수 있도록 잘 준비해야 한다""고 전했다.  이어 ""응급환자를 살리기 위해선 소방-지정병원 간 긴밀한 협력체계를 통해 중증 응급환자 발생 시 신속한 이송과 적정 수용을 추진해 환자 생존율을 높여야 한다""고 말했다.",https://n.news.naver.com/mnews/article/008/0005290052
2025-12-10 16:20:00,"박대준 쿠팡 대표 전격 사임..정부, 징벌적 과징금 강화 추진","박대준 쿠팡 대표가 전격 사임했다. 쿠팡이 지난달 29일 3370만개 고객 계정 정보가 유출됐다고 발표한지 11일만이다.  10일 쿠팡에 따르면 박 대표는 이날 ""최근의 개인정보 사태에 대해 국민께 실망하게 한 점에 대해 매우 송구스럽게 생각한다""며 ""이번 사태의 발생과 수습 과정에서의 책임을 통감하고 모든 직위에서 물러나기로 했다""고 밝혔다.  쿠팡 모회사인 미국 쿠팡 Inc.의 해롤드 로저스(Harold Rogers) 최고관리책임자 겸 법무총괄이 후임 대표로 선임됐다. 쿠팡 창업자 김범석 의장의 '최측근'으로 알려진 그는 미국 본사를 대표해 쿠팡의 개인정보 유출 사태를 적극적으로 수습하고, 조직 안정화에 주력할 계획이다.  로저스 신임 대표도 사내 공지를 통해 ""지금 우리의 우선순위는 명확하다""고 강조한 뒤 ""이번 사태를 철저히 대응하고, 재발을 방지하기 위해 정보보안을 강화하며, 신뢰를 회복하는 것""이라며 ""또한 조직을 안정시키고, 앞으로 나아가는 과정에서 모든 팀을 지원하는 데에도 집중하겠다""고 약속했다.  대표 교체를 단행한 쿠팡은 후속 대책을 추진한다. 현재 약 10단계인 유료 회원(와우 회원) 탈퇴 절차를 단축하고, 유선상담을 통한 회원 탈퇴 신청 처리도 앞당긴다. 정보유출 사태가 불거진 이후 소비자단체와 정치권에서 쿠팡의 회원 탈퇴 처리 절차가 복잡하단 지적이 잇따랐고, 이재명 대통령도 ""가입 절차만큼 (탈퇴)처리가 간단한지""를 관계부처에 문의한 것이 알려지자 신속한 대응에 나선 것으로 보인다.  다만 쿠팡은 정치권 등에서 제기된 '회원 탈퇴 심사제' 의혹은 사실이 아니란 입장이다. 고객이 이미 주문한 상품의 주문 취소 및 배송 처리를 완료하고, 쿠팡 캐시 미결제 금액 정산 등 개별 회원마다 확인해야 할 내용이 많기 때문에 회원 탈퇴를 곧바로 수락하면 혼선이 생긴단게 회사측 설명이다. 한편 정부는 쿠팡에 대한 고강도 제재를 예고했다. 김민석 국무총리는 이날 정부서울청사에서 열린 제7회 국가정책조정회의에서 ""이번 (쿠팡) 사고는 심각한 수준을 넘어섰다""고 직격한 뒤 ""디지털 사회에서 국민의 정보 보호는 플랫폼 기업의 가장 기본적인 책무""라며 정부 각 부처에 대책 마련을 지시했다. 이에 정부는 대규모 정보유출 사건 재발 방지를 위해 △징벌적 과징금 도입 △손해배상 실효성 강화 △대표자 책임성 제고 △기업 정보보안 관리체계 고도화 등을 추진할 예정이다. 아울러 개인정보보호위원회는 쿠팡의 개인정보 안전조치 위반 여부를 집중 점검하고, 고객정보 유출에 따른 보이스피싱 등 2차 피해 방지책에 주력할 방침이다.",https://n.news.naver.com/mnews/article/008/0005290051
2025-12-10 16:17:00,"제브라앤시퀀스, 계룡산국립공원에 'AI 실종자 인식시스템' 설치","제브라앤시퀀스(대표 오동근)가 계룡산 국립공원(소장 송요섭)에 'AI(인공지능) 기반 실종자 인식시스템'을 설치하고 실증에 나선다고 10일 밝혔다.  제브라앤시퀀스는 AICA(인공지능사업융합사업단) 주관 실증사업에 선정돼 계룡산 국립공원에 실종자 인식 시스템을 설치했다. 'AI 기반 실종자 인식시스템'은 신고된 실종자 사진을 기반으로 영상 속에서 대상자의 특징을 판단해 찾아내는 기술이다. 기존 관제 방식이 주로 육안에 의존했던 점을 고려하면 실종자 탐색 속도를 높일 수 있다는 설명이다.  계룡산 국립공원 측은 ""국가 정책에 따라 스타트업의 실증 테스트 베드를 지원해 원활한 시장 진입을 돕고자 한다""고 말했다. 해당 시스템은 '국가 혁신제품 인증'을 받았으며 기획재정부 주관 '공공기관 기술마켓'에도 등재돼 있다.  제브라앤시퀀스는 2015년 AI 분야로 창업한 벤처기업이다.",https://n.news.naver.com/mnews/article/008/0005290050
2025-12-10 16:16:00,"10% 떨어지고 꼴찌로 '게임 오버'?…릴스에 밀린 게임, 반격카드는","국내 증시에서 게임주 부진이 눈에 띈다. 국내 게임 소비가 둔화된데다 중국 게임업체 등과의 경쟁이 치열해지면서다. 다만 증권가는 내년부터 인앱 수수료 인하와 신작 출시 등 각종 모멘텀으로 반등을 시도할 수 있을 것으로 전망한다.  10일 한국거래소에 따르면 국내 대표 게임 10개 종목으로 구성된 'KRX 게임 TOP 10 지수'는 4분기 들어 696.53포인트에서 627.55으로 9.90% 하락했다. 전체 테마지수 중 최하위다. 게임 지수 다음으로 큰 하락폭을 기록한 '인터넷 TOP 10 지수'의 낙폭은 2%대다. 같은 기간 코스피와 코스닥 지수가 각각 20.74%, 11.05% 급등한 것과 비교하면 대조를 이룬다.  게임주 대장주인 크래프톤 역시 부진한 흐름을 비껴가지 못하며 이 기간 15.38% 하락했다.  최근 국내 게임주가 약세를 보이는 건 게임 소비가 둔화하면서 국내 게임 업종 전반에 대한 관심이 떨어진 영향이다.  남효지 SK증권 연구원은 ""코로나19 이후 유저들의 콘텐츠 소비 패턴이 틱톡, 릴스 등 숏폼 중심으로 재편됐다""며 ""숏폼 시청 시간은 40~140분대로 꾸준히 증가하는 반면 모바일 게임 플레이 시간은 하루 40~60분 수준에 정체돼 있다""고 말했다.  여기에 중국 기업을 중심으로 외국산 게임 점유율이 늘고 있는 점도 부담이다. 최승호 DS투자증권 연구원은 ""국내 게임사의 시장점유율이 하락하고 있다""며 ""최근 출시되는 웰메이드 중국 게임들은 유저들에게 어필하기 위해 과금 강도가 더욱 낮아지고 있으며 공급 과잉과 경쟁 심화가 판가 하락으로 이어지고 있다""고 분석했다.  다만 증권가에서는 내년부터 인앱 결제 수수료 인하와 국내 게임사의 자체 결제 시스템 도입이 이러한 시장 분위기를 반전 시킬 수 있을 것으로 기대한다.  모바일 기반인 국내 게임 업종은 그동안 애플과 구글에 최대 30%에 달하는 수수료를 내고 있다. 다만 최근 구글과 에픽게임즈 간 소송을 계기로 애플과 구글의 독점 체제가 크게 흔들리면서 수수료 인하 기대감이 불고있다. 지난달 5일(현지 시각) 로이터통신에 따르면 구글이 에픽게임즈와 '포괄적 합의'에 도달했으며, 수수료 인하·경쟁 촉진·개발자와 소비자의 선택권 확대를 목표로 하는 안드로이드와 앱스토어 개혁에 동의했다.  임희석 미래에셋증권 연구원은 ""(국내 게임사는) 다양한 파이프라인을 갖춘 일본과 중국 게임사보다 투자 매력도가 낮다""면서 ""앱 수수료 인하가 유일한 희망""이라고 했다. 그러면서 ""앱 수수료가 17%까지 하락할 경우 국내 주요 게임사들의 영업이익률은 평균 7%포인트 상승할 전망""이라며 ""구글, 애플의 30% 수수료율 체제에 금이 가기 시작하면서 국내 게임사의 자체 결제로의 전환이 잇따를 것""이라고 했다.  특히 엔씨소프트의 경우 지난달부터 모바일 자체 결제 시스템을 전격적으로 도입했다  남 연구원도 ""국내 게임사들이 내년부터 점차 자체 결제 시스템을 도입하며 지급수수료 절감 효과를 누릴 것""이라며 ""특히 엔씨소프트, 넷마블, 더블유게임즈의 플랫폼 수수료 절감 효과가 클 것""이라고 설명했다. 다만 ""바스켓 전략( 여러 종목을 한 번에 묶어 거래하는 방식)보다는 주요 기대작 출시 시점에 맞춘 선별적 매수 전략이 유효하다""고 말했다.  SK증권에 따르면 내년 출시 예정인 주요 기대작으로는 △펄어비스의 '붉은사막' △넷마블의 '일곱 개의 대죄: Origin'과 '몬길:STARDIVE' △ 크래프톤의 '팰월드 모바일'과 '서브노티카 2' △카카오게임즈의 '아키에이지 크로니클' 등이다.",https://n.news.naver.com/mnews/article/008/0005290049
2025-12-10 16:15:00,50대 교사가 여중생 2명 껴안고 추행...항소심 형량 늘었지만 집유,"중학생 제자 2명을 추행한 혐의로 재판에 넘겨진 50대 교사가 항소심에서도 징역형 집행유예를 선고받았다.  10일 뉴스1에 따르면 서울고법 인천원외재판부 형사2부(부장판사 임영우)는 아동·청소년의성보호에관한법률상 강제추행 혐의로 기소된 50대 남성 A씨 항소심에서 징역 2년에 집행유예 3년을 선고했다.  앞서 1심 재판부는 A씨에게 징역 1년에 집행유예 2년을 선고한 바 있다. 항소심에서 원심판결보다 형량이 늘었으나 집행이 유예된 점은 같다.  항소심 재판부는 또 A씨에게 사회봉사 120시간과 40시간의 성폭력 치료 강의 수강, 아동 및 청소년 관련 기관에 5년간 취업제한 등도 명령했다.  A씨는 지난해 11월부터 올해 3월까지 자신이 근무하던 중학교에 재학 중인 B양 등 2명을 여러 차례 껴안는 등 추행한 혐의로 재판에 넘겨졌다.  B양 등으로부터 피해 사실을 확인한 학교 측은 경찰 신고 후 A씨에 대한 조사를 진행했다. 교육 당국은 A씨의 교사 직위를 해제한 상태다.  재판부는 ""피고인과 피해자들의 관계와 범행 방법 등을 보면 죄책이 가볍지 않다""며 ""다만 피고인이 앞서 형사처벌 받은 전력이 없고, 피해자 한 명과 합의한 뒤 남은 피해자에게 금원을 공탁한 점 등을 고려해 형을 정했다""고 판시했다.",https://n.news.naver.com/mnews/article/008/0005290048
2025-12-10 16:15:00,"'부동산 가압류' 박나래 매니저, 선 넘었다?…""법대로 해도 '1억씩' 줘야""","개그우먼 박나래의 전 매니저 2명이 박나래 명의 부동산에 대해 1억원의 가압류를 신청했다. 이들은 1년3개월간 월평균 409시간 고강도 업무에 시달리면서 정산조차 제대로 받지 못했다는 입장인 반면, 박나래는 지나친 요구라며 난색을 표하고 있다.  다만 매니저들의 주장이 사실이라면, 박나래가 매니저 1명당 줘야 할 돈은 1억여원 수준일 것으로 추산된다. 최소한 가압류신청만큼은 '지나친 요구'가 아니라는 반응이 나온다.  10일 연예계에 따르면 박나래는 지난해 회사를 옮기면서 매니저 A씨와 B씨를 스카우트했다. 박나래가 두 매니저에게 제시한 조건은 파격적이었다. 기본급 500만원에 월 매출 10%를 인센티브로 주겠다고 구두로 약속했다.  하지만 박나래의 약속은 공언(空言)에 지나지 않았다. 박나래는 ""당장 리스크가 있으니 1년만 기다려달라""며 표준계약서 작성을 미루더니, 기본급으로 500만원이 아닌 300만원을 지급했다. 인센티브는 한 푼도 없었다.  이런 가운데, 노동 강도는 심각했다. 월평균 근로시간이 409시간에 달했다. 소정 근로시간(209시간)의 두배 길이다. 특히 매니저들은 술 파티가 열리는 날이면 24시간 대기조가 돼야 했다. 파티 준비부터 뒷정리, 심부름을 감당해야 했고, 이를 위한 비용도 매니저 사비로 충당했다고 한다.  매니저들은 입사 1년 3개월 만에 퇴사를 결정했다. 하지만 박나래는 초과근무수당은 물론, 미지급한 업무비도 정산하지 않았다. 퇴직금은 기본급 300만원에 맞춰 겨우 300여만원을 지급했다.    박나래 ""지나친 요구""…사실일까  법대로라면 A씨와 B씨는 박나래로부터 각각 1억여원씩 더 받아야 한다.  A씨와 B씨의 시급은 약 1만4300원(300만원/소정근로시간 209시간)이었다. 이들의 월평균 근로시간은 409시간. 이를 기준으로 두 매니저가 못 받은 1년3개월치 연장근로수당을 계산하면 6460만원이라는 액수가 나온다. 여기에 술파티 대기 등으로 인한 야간근로수당 등을 보수적으로 잡아도 약 1200만원이 추가된다. 법정수당만 7700만원이 넘는 액수다.  퇴직금도 더 줘야 한다. 연장근로수당, 야간근로수당 등을 합친 월평균 임금은 800만원이 훌쩍 넘는다. 이를 토대로 재산정한 퇴직금은 약 1000만원이다. 여기에 임금 체불에 따른 지연이자(연20%) 등을 더하면 박나래가 매니저 1명에게 지급해야 할 돈은 약 9900만원에 달한다. 박나래가 애초 약속했던 매출액 10% 및 업무비 정산은 차치하더라도 1억원씩을 추가로 줘야 하는 셈이다.  다만 박나래 측은 이미 절차대로 퇴직금 정산을 마쳤다는 입장이다. 아울러 매니저들이 전년도 매출의 10%를 추가로 요구하고 있다며 매니저들을 공갈미수 등으로 고소했다.  박나래의 소속사 앤파크는 지난 6일 ""A씨와 B씨에 대한 공갈미수 혐의 고소장을 서울 용산경찰서에 제출했다""며 ""1년 3개월간 근무했던 전 매니저들이 퇴직금을 받은 후 추가로 회사의 전년도 매출의 10%에 해당하는 과도한 금액을 요구했다. 요구 금액 역시 점차 증가해 수억 원 규모에 이르게 됐다""고 주장했다.",https://n.news.naver.com/mnews/article/008/0005290046
