날짜,제목,본문,링크
2025-12-10 09:38:00,"벡트, 무인화 트렌드 수혜 전망에…상한가 직행","벡트가 10일 상한가로 직행했다. 무인화 트렌드가 확산하면서 관련 수혜를 입을 것이라는 증권가의 전망이 투자 심리를 자극한 것으로 보인다.  10일 오전 936분 기준 벡트는 전일 대비 29.83%(710원) 치솟으며 상한가(3090원)를 기록 중이다.  이날 장 시작 전 스마트시티, 가상현실(VR) 콘텐츠 등 벡트가 보유한 디지털 사이니지 기술의 수요처 확대로 실적 개선이 기대된다는 분석이 나왔다.  서지범 신한투자증권 연구원은 ""벡트가 동남아 국가들을 중심으로 스마트 캠퍼스, 공공 인프라 프로젝트에 디지털 사이니지를 공급할 것으로 예상한다""며 ""아시아 국가를 시작으로 중동 및 유럽 시장 등 해외 사업의 본격화가 기대된다""고 했다.  벡트는 프로젝터, 전자칠판 등을 활용해 영상 기획과 운영 솔루션을 제공하는 디지털 사이니지 전문 업체다. 최근엔 AI(인공지능) 서비스를 결합한 신제품을 출시하며 제품 포트폴리오 다각화에 힘쓰고 있다.  벡트의 지난 3분기 매출액은 84억원으로 지난해 동기 대비 41% 감소했고, 영업이익은 1분기 이후 적자가 지속되고 있다. 다만 사업 특성상 1, 4분기에 매출이 집중되는 경향이 있고, 글로벌 파트너십도 확대되고 있다.  서 연구원은 ""벡트는 지난 10월 싱가포르 인프라 구축 업체와 디지털 사이니지 공급 계약을, 지난달엔 글로벌 로보틱스 솔루션 업체와 업무협약(MOU)을 체결하며 신성장동력을 확보했다""며 ""글로벌 파트너십 확대를 통한 신규 사업 (AI,로보틱스 등) 기회에 주목할 시점""이라고 말했다.",https://n.news.naver.com/mnews/article/008/0005289745
2025-12-10 09:36:00,"삼성SDI, 2조원대 美 수주 소식에 4%대 강세","삼성SDI가 2조원대의 대규모 수주 소식에 장 초반 강세를 보인다.  10일 오전 9시29분 기준 전 거래일보다 1만3000원(4.19%) 오른 32만3000원에 거래 중이다. 삼성SDI는 장중 한 때 3만2900원까지 오르며 6%대 강세를 보이기도 했다.  삼성SDI는 이날 삼성SDI 아메리카가 미국 에너지 관련 인프라 개발·운영 업체와 ESS(에너지저장장치)용 LFP(리튬인산철) 배터리 공급 계약을 맺었다고 밝혔다. 계약 규모는 2조원이 넘으며, 제품은 2027년부터 약 3년간 공급한다.  삼성SDI가 이번 계약으로 공급하는 LFP 배터리는 일체형 ESS 배터리 솔루션인 '삼성 배터리 박스(SBB) 2.0'에 탑재된다. SBB는 20피트 크기의 컨테이너에 배터리와 화재 안전장치 등을 통합 설치한 일체형 ESS 솔루션이다. SBB 2.0은 각형 LFP 배터리가 적용되는 첫 모델이다.  이번 계약으로 삼성SDI 미국 현지 공장은 생산 라인은 전환해 제품을 생산·공급하게 된다. 삼성SDI는 미국 내 전기차용 각형 배터리 공장을 가동하고 있으며, 현지 수요 변화에 대응하기 위해 일부 생산라인을 ESS용으로 전환하고 있다. 삼성SDI는 현재까지 미국 내에서 유일한 비(非) 중국계 각형 배터리 제조사로 알려져 있다.",https://n.news.naver.com/mnews/article/008/0005289744
2025-12-10 09:34:00,"위메이드, 국순당과 자립준비청년 지원 MOU 체결","위메이드가 국순당과 블록체인 기반 사회공헌 플랫폼 '위퍼블릭'(Wepublic)을 활용해 자립준비청년을 지원하기 위한 업무협약을 체결했다고 10일 밝혔다.  위메이드는 전날 오후 판교 사옥에서 국순당과 업무 협약식을 진행했다. 위메이드 김원상 체인사업실장, 국순당 차승민 경영혁신본부장 등이 참석했다.  자립준비청년은 시설 보호가 종료되는 만 18세 이후 사회에 홀로 서야 하는 청년을 뜻한다. 이번 협약으로 '위퍼블릭'이 도움을 필요로 하는 자립준비청년과 국순당의 후원 프로그램을 연결하는 '후원 매칭 플랫폼'으로서의 역할을 수행한다.  또 위퍼블릭을 통해 국순당 공식 커뮤니티와 후원 프로그램 운영을 지원하는 것은 물론, 블록체인 기술을 사용해 후원 내역과 활동 과정도 투명하게 기록하고 공개할 예정이다.  국순당은 위퍼블릭이 다양한 사회복지기관과 협력하며 쌓아온 네트워크와 매칭 시스템을 기반으로 △직무 체험 및 인턴십 지원 △양조 교육 및 문화 체험 청년 참여형 프로그램 운영 등 자립준비청년을 위한 다양한 후원 활동을 추진할 계획이다.  위메이드 김원상 체인사업실장은 ""위퍼블릭의 매칭 역량을 통해 국순당의 후원이 필요한 곳에 정확히 전달될 것으로 기대한다""며 ""양 기관의 협력을 통해 자립준비청년에게 보다 현실적인 맞춤형 지원을 제공하겠다""고 말했다.",https://n.news.naver.com/mnews/article/008/0005289743
2025-12-10 09:32:00,"티웨이항공, 유럽·시드니·밴쿠버 노선 최대 10% 할인 프로모션","티웨이항공이 오는 20일까지 유럽·시드니·밴쿠버 장거리 얼리버드 프로모션을 진행한다고 10일 밝혔다.  '장거리 얼리버드' 프로모션은 유럽 4개 노선(파리·로마·프랑크푸르트·바르셀로나)과 호주 시드니, 캐나다 밴쿠버 노선을 대상으로 티웨이항공 공식 홈페이지와 앱(웹)을 통해 진행된다. 탑승 기간은 일부 기간을 제외한 2026년 3월 1일부터 10월 24일까지다.  티웨이항공 회원이라면 누구나 항공권 예매 시 'FLYDEC'를 입력하면 최대 10% 할인된 가격에 유럽·시드니·밴쿠버 노선을 예약할 수 있다. 항공권은 이코노미석과 비즈니스 세이버 모두 적용할 수 있으며 항공권 편도·왕복 예약 시 가격 확인 단계에서 할인코드 배지를 확인 후 예매하면 된다.  얼리버드 할인코드 이벤트와 함께 이벤트 페이지에서 결제 금액에 따라 각각 사용할 수 있는 4만원, 10만원 쿠폰을 다운받을 수 있다. 여기에 프론트 존과 프리미엄 존 구매 시 사용할 수 있는 2000원, 5000원 할인 사전 좌석 할인 쿠폰도 지급한다.  이 외에도 티웨이항공 탑승객이라면 유럽 철도 8% 즉시 할인 프로모션도 진행 중이다. 티웨이항공 가입 시 신규 회원 쿠폰팩부터 발권 수수료 무료, 기프트 카드 할인, 항공권 특가 알림 혜택도 받을 수 있다.  장거리 얼리버드 프로모션 페이지에서는 연휴와 연차를 활용해 더욱 효율적으로 즐길 수 있는 2026년 장거리 여행 추천 시기도 선보이고 있다.  티웨이항공 관계자는 ""다가오는 2026년 유럽과 시드니, 밴쿠버로 장거리 여행을 계획하시는 분들을 위해 합리적인 항공권 프로모션을 준비했다""며 ""티웨이항공을 이용하시는 승객분들의 편안한 여정을 위해 항상 안전 운항을 기반으로 최상의 서비스를 제공할 수 있도록 최선을 다하겠다""고 말했다.",https://n.news.naver.com/mnews/article/008/0005289742
2025-12-10 09:32:00,"이준석 ""홍매화에 '주술'이라 했던 분들, '통일교 큰절'에 뭐라 할지 궁금""","이준석 개혁신당 대표가 ""(양당 정치인이) 한학자 통일교 총재에게 큰절까지 하면서 통일교 측의 자금을 받았다면 그야말로 종교에 의탁하는 행위""라고 비판했다.  이 대표는 10일 SNS(소셜미디어)를 통해 ""통일교로부터 부정한 정치자금을 받은 것으로 의심되는 양당 정치인들이 십수명 거론되고 있다. 액수도 상당하다""며 ""특검(특별검사)이 선별적 수사를 했다는 의혹까지 불거지는 상황""이라고 밝혔다.  이 대표는 ""작년에 제가 조계종 사찰인 지리산 칠불사에서 어사화로도 쓰이는 홍매화를 기념식수 했을 때 주술이니 뭐니 했던 분들은 정작 이런 사안 앞에서 뭐라고 할지 궁금하다""며 ""같은 지리산 자락의 화엄사에서 매화 축제를 여는 것만 봐도 알 수 있듯, 주술과 아무 관련이 없다""고 했다.  이어 ""더불어민주당이 아무리 우겨도 지리산이 주술의 산이 되는 것도 아니고 화엄사 스님들이 주술사가 되는 것도 아니다""라며 ""홍매화 밑에 100만원을 묻었다는 허위사실을 유포한 사람들은 공직선거법 위반으로 검찰에 송치된 상태""라고 했다.  그러면서 ""시간이 지나면 누가 정말 문제 될 일을 하며 살았는지 백일하에 드러난다""며 ""게이트키핑 없이 음모론을 퍼뜨리는 유튜브 탓에 여럿이 우기면 사실이 된다는 착각 속에 공작만 난무할 뿐""이라고 했다.",https://n.news.naver.com/mnews/article/008/0005289741
2025-12-10 09:32:00,"""입원 중에도 차 팔았다""…현대차, 첫 누적 8000대 판매 '전설' 탄생","현대자동차 처음으로 누적 판매 8000대를 달성한 주인공이 탄생했다.  현대차는 최진성 서대문중앙지점 영업이사가 누적 판매 8000대를 달성했다고 10일 밝혔다.  1996년 입사한 이래 약 30년간 연평균 267대를 판매한 최진성 영업이사는 2018년 누적 판매 5000대를 달성해 '판매거장' 칭호를 획득했고 2023년 6월 역대 두 번째로 누적 판매 7000대를 달성한 인물이다.  이뿐 아니라 연간 판매대수에 따라 전국 1~10위 직원을 선정해 포상하는 '전국판매왕'에도 17회 연속 선정됐다.  최진성 영업이사는 누적 8000대를 판매할 수 있었던 비결에 대해 ""판매를 하루도 거를 수 없는 끼니라고 생각했기에 달성할 수 있던 기록""이라며 ""매일매일 밥 먹듯이 판매해야 한다고 생각한다""고 밝혔다.  이어 가장 기억에 남는 순간으로 교통사고로 3번의 수술을 받았던 1998년을 꼽으며 ""입원을 한 상황에서도 의사와 환자들에게 차량을 판매하며 늘 한결같은 꾸준함의 중요성을 배웠다""고 말했다.  또 최 영업이사는 8000대 달성의 포상금인 2000만원을 출신 고등학교에 기부하며 지역사회에서 선한 영향력을 펼치는 데 앞장선다. 최진성 영업이사가 출신 고교에 기부한 금액은 20년간 누적 1억4000만원에 달한다.  현대차 관계자는 ""현대차는 '판매 명예 포상제도'를 운영해 누계 판매 △2000대 달성 시 '판매장인' △3000대 달성 시 '판매명장' △4000대 달성 시 '판매명인' △5000대 달성 시 '판매거장'이란 칭호와 함께 부상을 수여하고 있다""고 밝혔다. 이어 ""이 외에도 일선 영업 현장에서 최선을 다하는 카마스터를 격려하고 건강한 판매 경쟁을 유도하기 위해 연간 판매 우수 직원을 선정해 시상하는 '전국판매왕(Master of the Year)' 및 '더 클래스 어워즈(The Class Awards)'도 운영 중""이라고 말했다.",https://n.news.naver.com/mnews/article/008/0005289740
2025-12-10 09:31:00,"'세관 마약수사 외압' 무혐의에 국힘 이성권 ""이재명정권의 민낯 보여줘""","이성권 국민의힘 의원이 '세관 마약수사 외압' 의혹이 대부분 사실무근이라는 검찰 수사 결과가 나오자 ""혼란과 피해를 직접 키운 이재명 대통령은 국민 앞에 분명히 사과하고 상응하는 책임을 져야 한다""고 밝혔다.  이 의원은 10일 SNS(소셜미디어)를 통해 ""망상에 빠진 경찰의 황당한 주장을 믿고 국가 사법체계를 허물어 벌인 이번 사태의 최종 책임자는 분명 이재명 대통령""이라며 이같이 밝혔다.  이 의원은 ""백해룡 경정은 '세관 공무원들이 마약 밀수에 연루됐고 윤석열정부가 이를 은폐하려 했다' '이유는 윤석열 전 대통령 부부가 내란 자금을 마련하기 위함'이라며 황당한 주장을 했다""며 ""이 대통령은 수사권까지 쥐여주며 힘을 실어줬다""고 했다.  이어 ""앞서 야당 시절 더불어민주당은 특별검사와 국정조사를 촉구하며 의혹을 키웠다. 작년 8월에는 별도 청문회까지 열었다""며 ""가짜뉴스까지 만든 뒤 자신들의 죄를 심판하려는 사법부를 파괴하는데 국가 공권력을 총동원하고 있는 이재명정권의 민낯을 여실히 보여준 사건""이라고 했다.  그러면서 ""내란전담특별재판부를 설치, 법 왜곡죄를 신설을 통해 자신들 뜻에 맞는 재판부와 판사를 구성하고 원하는 재판 결과를 만들려는 행태도 그 일환""이라며 ""이 수사를 책임진 임은정 서울동부지검장은 백 경정의 주장을 '사실무근'으로 발표한 뒤 자신의 SNS에 '국가 차원에서 여러모로 피해가 크다'고 고백했다""고 했다.  서울동부지검 '세관 마약밀수 연루 의혹 합동수사단'(단장 채수양 부장검사)은 전날 중간 수사결과 발표를 통해 세관 직원 7명에 대해 무혐의 처분을 했다고 밝혔다. 합수단은 ""(세관 직원들이) 마약 밀수 범행을 도움 사실이 없다""며 ""실제 대통령실의 개입이나 관여 사실도 확인되지 않았다""고 했다.",https://n.news.naver.com/mnews/article/008/0005289739
2025-12-10 09:30:00,"북한, 어제 서해로 방사포 10여발 발사…북중러 같은날 무력 시위","북한이 서해상으로 방사포 10여발을 발사했다. 중국과 러시아도 같은 날 동해에서 무력 시위를 벌이면서 한반도 역내 군사적 긴장감이 고조되고 있다.  10일 군 소식통에 따르면 북한군은 지난 9일 오후 3시쯤 서해상으로 방사포 10여발을 발사했다.  합동참모본부는 북한군이 240㎜ 방사포를 쐈다고 분석한 것으로 알려졌다. 이 방사포는 서울·경기 등 수도권을 겨냥한 북한군 장사정포다.  앞서 북한군은 지난달 1일과 3일에도 240㎜로 추정되는 방사포 10여발을 서해상으로 발사한 바 있다.   북한군이 방사포를 쏜날 오전 10시쯤에는 중국과 러시아 전투기·폭격기 등 9대가 동해와 남해 한국방공식별구역(KADIZ)을 무단 진입했다.  KADIZ는 개별 국가의 주권 사항인 영공과는 다르지만, 타국 방공식별구역 진입 땐 비행계획 제출 등 사전 통보가 관행이다.  하지만 중러는 2019년부터 연간 1~2차례 공중 연합훈련 등을 실시하고 있지만 KADIZ 진입 등에 대한 사전 통보를 하지 않고 있다.  북중러가 한반도 역내 긴장감을 끌어올리는 가운데 최근 한국과 일본은 국방당국 간 갈등을 겪고 있다.  앞서 우리 공군 특수비행팀 블랙이글스는 지난 10월28일 독도 상공에서 비행을 펼쳤는데, 일본 내각이 이에 항의 서한을 보낸 것으로 알려졌다.  일본은 블랙이글스가 독도 상공을 비행했다는 이유로 우리 공군의 중간 급유를 거부하는 등의 조치를 내놨다.  이 때문에 한일 간 군사훈련은 물론 한미일 합동훈련 등이 축소될 수 있다는 우려가 제기된다. 또 다카이치 사나에 일본 총리가 최근 독도 영유권을 주장해 양국 간 갈등이 생길 여지가 있다.",https://n.news.naver.com/mnews/article/008/0005289738
2025-12-10 09:27:00,청담 한복판에 신세계 DNA…신개념 식품관 '트웰브' 첫선,"신세계백화점이 10일 서울 강남구 도산대로 442에 '하우스오브신세계 청담'을 연다. 기존 SSG푸드마켓 청담점 지하 1층과 지상 1층을 새롭게 구성한 공간으로, 식품·패션·리빙·다이닝을 함께 경험할 수 있는 형태로 재정비했다. 지난해 강남점에서 선보인 모델을 청담 상권 특성에 맞게 확장한 것으로, 단순 식품 구매를 넘어 머무르며 즐기는 공간을 지향한다.  지하 1층에 신규 식품관 '트웰브(TWELVE)'를 선보인다. 의류 매장의 진열 방식을 식품에 적용해 대표 상품을 단독 전시하고 색감과 질감을 강조하는 등 시각적 연출을 강화했다. 레몬이나 당근 등 신선식품의 대표 제품을 쇼케이스로 보여주고, 제철 식재료를 나란히 배치해 상품 특성을 쉽게 파악할 수 있게 했다.  입구엔 약 100석 규모의 라운지형 공간 '아고라'가 자리하며, 델리와 스무디바로 이어지는 구조로 휴식과 식사, 쇼핑이 자연스럽게 연결된다. 매장 한가운데에는 자연광이 들어오는 중정을 조성해 머무는 시간을 늘릴 수 있도록 했다. 기존 일방향이던 동선을 양방향으로 바꾸고, 전 고객 무료 발렛 서비스를 제공하는 등 접근성을 높였다.  트웰브는 인근 거주민과 직장인을 고려해 '웰니스 푸드' 구성을 강화했다. 스무디·착즙 주스 40여 종을 제공하는 '트웰브 원더바', 제철 재료로 조리한 한식 델리와 세계 각국 메뉴를 조합해 약 900가지 식사 구성이 가능한 '트웰브 키친'을 운영한다. 6천여 종의 그로서리를 갖춘 '팬트리'에서는 건강한 식생활을 주제로 한 기준에 맞춘 상품을 큐레이션해 선보인다. 영국 스낵 브랜드 '미스터 프리드', 맞춤형 시리얼 브랜드 '홀리' 등 국내 처음 소개되는 제품도 판매한다.  자체 기획 상품도 마련했다. 단백질과 식이섬유 등을 담은 웰니스칩, 오가닉 우유·요거트, 비멸균 원유로 만든 버터 등 약 40종을 출시했다. '프레시 푸드' 코너에서는 한우, 제주 해산물, 지역 특산 채소 등 산지 기반 상품을 모아 판매하며, 드라이에이징 장비를 도입해 숙성 전문 서비스도 운영한다. 인기 베이커리와 건강빵 전문점이 입점하고, 시코르·자주·까사미아 등 라이프스타일 브랜드도 함께 구성했다.  지상 1층은 패션·주류·다이닝을 중심으로 꾸렸다. 남성·여성 의류 브랜드, 사케·샴페인·화이트와인 등 특정 주종을 전문적으로 취급하는 매장 '클리어', 7석 규모 예약제 가이세키 레스토랑 '모노로그', 캐주얼 일식당 '호무랑' 등이 자리한다.  신세계 관계자는 ""삶과 취향, 일상을 연결하는 새로운 형태의 리테일 공간""이라며 ""향후 콘텐츠와 서비스를 지속해서 확장해나갈 계획""이라고 밝혔다.",https://n.news.naver.com/mnews/article/008/0005289737
2025-12-10 09:27:00,"이재명 대통령, 與지도부 만찬서 ""개혁입법, 합리적 처리""…무슨 의미","이재명 대통령이 9일 여당 지도부와의 만찬 회동에서 ""개혁입법은 국민의 눈높이에 맞게 합리적으로 처리됐으면 좋겠다""고 밝힌 가운데 더불어민주당이 ""대통령 말씀을 있는 그대로 이해하면 될 것""이라고 밝혔다.  박수현 민주당 수석대변인은 10일 오전 SBS라디오 '김태현의 정치쇼'에 출연해 ""대통령이 어떤 배경에서 해당 발언을 했느냐""는 질문에 이같이 말했다.  박 수석대변인은 ""(개혁입법에 대한) 공론화가 활발하게 진행 중이라서 대통령 말씀에 당에서 해석을 붙이는 것은 공론화 과정에 영향을 미치기에 적절하지 않은 것 같다""고 말했다.  그러면서 ""다만 우상호 대통령실 정무수석이 이재명 대통령의 6개월 성과 설명회를 할 때 '당과 (내란전담재판부) 문제에 대해 공감대가 있다' '당의 의견을 존중한다'는 말씀을 하셨다""며 ""그 뒤에 유튜브에 출연해서 '내란전담재판부가 2심부터 하면 좋겠다는 것이 대통령의 뜻'이라고 말을 한 적이 있다""고 말했다.  박 수석대변인은 ""언론은 우 수석의 발언을 소환하면서 '우 수석이 그렇게 이야기했는데 어제 만찬 브리핑에서 그에 대한 특별한 언급이 없는 것으로 보아 아마 그런 방향으로 (내용이) 잡히지 않느냐' 등으로 해석 중""이라며 ""그렇게 하면 설명이 전체적으로 되지 않을까 싶다""고 말했다.  박 수석대변인은 '합리적으로 하라는 말은 내란전담재판부에 대한 우려를 해소하라는 의중으로 봐도 되느냐'는 질문에는 ""그런 것이 폭넓게 포함됐다고 봐야 할 것""이라고 말했다.  그러면서 ""일각에서는 당이 '졸속 추진한다, 성급하게 추진한다, 강행한다' 이런 표현을 하시는데 사실 그렇지 않다""며 ""당은 한정애 정책위의장을 중심으로 법원, 변협 등 관련 단체와 서로 의견들을 비공개로 충분하게 들어오고 있다""고 말했다.  박 수석대변인은 '(내란전담재판부에 대한) 반대 목소리가 너무 크면 원점에서 검토하거나 추진을 안할 수도 있느냐'는 질의에는 ""그건 없다""고 말했다. 그러면서 ""이 문제에 대해 강한 요구를 하는 국민과 당원 요구도 분명히 있다""며 ""이에 응답하는 목소리도 있고 대책도 있어야 하지 않겠느냐""고 했다.  이 대통령은 전날 오후 6시30분부터 서울 한남동 관저에서 정청래 대표와 김병기 원내대표를 만나 9시까지 2시간 30분 동안 만찬을 겸한 회동을 가졌다. 이 대통령은 해외순방 성과를 설명하며 ""한국의 위상이 많이 높아졌더라. 예산안 합의 처리에 고생이 많았다""고 했다.  이 대통령은 특히 이 자리에서 정 대표와 김 원내대표에게 ""개혁입법은 국민의 눈높이에 맞게 합리적으로 처리됐으면 좋겠다""고 말했다. 내란전담재판부와 법 왜곡죄 등 민주당이 추진하고 있는 사법개혁안 등을 겨냥한 발언으로 해석된다.  내란전담재판부 설치법은 내란 혐의 사건을 전담할 재판부를 사법부 내에 신설하는 내용을 담고 있다. 법안이 통과되면 3대 특검 사건을 각각 맡을 전담재판부를 구성해 재판을 진행하게 된다. 전담재판부 법관은 헌법재판소 사무처장, 법무부 장관, 각급 법원 판사회의가 3명씩 추천한 9명의 위원으로 꾸려진 추천위가 2배수를 추천하고, 대법원장이 최종 임명하도록 했다.  사법부와 국민의힘, 심지어 범여권인 조국혁신당에서도 위헌 소지가 크다고 지적하고 있다. 특정 사건을 다루기 위해 사건을 강제배정하는 것 자체가 문제가 될 수 있다는 것이다. 지난 5일 열린 전국 법원장회의에서도 내란전담재판부 설치법에 대해 ""공정한 재판을 받을 권리를 본질적으로 침해해 위헌성이 크고, 향후 재판 지연 등 혼란이 초래될 수 있다""며 심각한 우려를 표했다.",https://n.news.naver.com/mnews/article/008/0005289736
