날짜,제목,본문,링크
2025-12-01 13:08:00,"구미시, 출생아 수 2년 연속 증가… ""인구정책 성과 나타나""","경북 구미시 출생아 수가 2년 연속 증가한 것으로 나타났다.  1일 시에 따르면 지난 1~10월 구미지역 출생아 수는 1722명으로 전년(1649명) 대비 4.4% 늘었다. 같은 기간 혼인 건수도 1534건으로 7% 증가했다. 이 같은 증가세는 지난해부터 시작해 최근까지 2년 연속 이어지며 본격적인 인구 반등 신호로 시는 분석했다.  시는 출생아 수 증가를 위한 사업으로 지난해 3월 첨단의료장비와 전문인력(전문의 3명, 간호사 1명)이 상주하는 구미 플러스 신생아집중치료센터(NICU) 개원에 이어 지난 9월 경북 최초의 달빛어린이 병원(3개소)을 개소했다. 또 △공공심야약국 4개소 △산부인과·소아청소년과 연장 진료 △365 소아청소년 진료센터 등 소아의료 기반도 마련했다.  돌봄 영역에선 '10분 거리 내 24시간 돌봄' 목표로 실질적 정책을 다양하게 쏟아냈다. 지난 9월 전국 최초로 60일~12개월 영아 전용 '0세 특화 육아나눔터' 개소에 이어 전국 최다인 '다함께돌봄센터 20개소'(24시 포함), 경북 최초 권역별로 운영 중인 '아이돌봄서비스'(2개소), '365 돌봄 어린이집'(7개소) 등을 운영 중이다. 내년 1월에는 '아픈아이 돌봄센터'를 추가로 문을 열어 안정적인 돌봄 지원에 나설 예정이다.  가족 형성을 위한 결혼정책 추진에도 집중하고 있다. 올해부터 시행된 20대 부부 대상 '결혼축하 혼수비용 지원사업'과 30~45세 근로자 대상 '결혼장려금 사업'은 지금까지 총 682가구가 혜택을 받았다.  김장호 시장은 ""결혼·출산·돌봄이 유기적으로 연결되도록 정책을 펼쳐 아이 낳고 살기 좋은 행복한 구미를 만들겠다""고 말했다.  한편 여론조사 전문업체 (주)리얼미터가 지난 10월20일부터 12일간 18세 이상 시민 1050여명을 대상으로 실시한 '구미시정 운영 및 정책만족도 조사'에서 복지·돌봄 시설 확충에 대한 시민 만족도는 83.2% 나왔다.",https://n.news.naver.com/mnews/article/008/0005285383
2025-12-01 13:02:00,"백사마을, 16년 만에 재개발 '첫 삽'…3178가구 사회통합형 단지로","서울 마지막 달동네로 불리는 '백사마을' 주택재개발사업이 16년 만에 첫 삽을 떴다.  1일 서울시는 백사마을 재개발사업 기공식을 열고, 최고 35층 총 3178가구 규모의 주거단지로 거듭날 백사마을의 새 출발을 알렸다. 사업지에는 지하 4층~지상 35층의 26개동 총 3178가구 자연 친화형 공동주택 단지가 조성된다.  서울 노원구 중계본동 30-3번지 일대 노후·불량 주거지 밀집지역인 백사마을은 2009년 5월 '중계본동 제1종지구단위계획 및 주택재개발정비구역'으로 지정됐다. 하지만 사업 추진 과정에서 분양주택과 임대주택의 획지 구분으로 입주민 사이에 위화감이 조성됐으며, 기존 지형·터·골목길 등을 유지한 계획으로 사생활 침해 등 문제가 발생할 수 있다는 의견이 제기돼 사업 추진이 지지부진했다. 저층주거지 보존이라는 과도한 규제도 발목을 잡았다.  시는 2022년 4월부터 2024년 2월까지 주민·전문가와 150회 이상 소통하며, 통합정비계획 수립을 추진했다. 지난해 3월 토지등소유자 전체 회의에서는 참석 주민 95% 이상의 찬성표를 획득해 통합정비계획 변경에 대한 빠른 추진이 가능해졌다. 올해 4월 2009년 재개발정비구역 지정 이후 16년 만에 재개발정비계획(안)을 확정했다.  특히 시는 '주거지보존 용지'에서 '공동주택 용지'로 전환, 사업성 보정계수 적용과 용도지역 상향 등 과감한 규제 혁신으로 사업성을 대폭 개선했다. 또 분양·임대 획지 구분이 없는 통합개발과 소셜믹스를 통해 해당 지역을 다양한 세대와 계층이 함께 어울려 살아가는 사회통합의 공간으로 탈바꿈시킨다.  백사마을은 올해 5월 본격적인 철거를 시작으로 연내 철거공사 완료 후, 내년 상반기 착공에 들어간다. 시는 착공, 준공, 입주까지 신속하게 추진해 2029년 입주를 완료할 계획이다.  한편 시는 백사마을 재개발을 본격화하면서 동북권에 대규모 주택공급 등 균형발전의 기반을 마련할 방침이다. 앞서 지난해 강북권(동북권·서북권)의 노후 주거지, 상업지역에 대한 규제 완화와 인센티브 부여로 개발을 활성화하고, 대규모 유휴부지를 첨단산업과 일자리 창출 거점으로 조성하는 강북권 대개조 구상을 공개했다.  이날 기공식에서 오세훈 시장은 ""백사마을은 오랜 세월 주민들의 삶과 애환이 켜켜이 쌓인 곳이자 새로운 미래를 향해 나아가는 서울 동북권의 미래를 다시 그리는 강북 대개조 프로젝트의 중요한 축""이라며 ""강북권의 도시경쟁력을 획기적으로 끌어올릴 백사마을의 변화를 위해 착공부터 준공, 입주까지 모든 절차를 신속하고 투명하게 끝까지 책임지고 챙기겠다""라고 말했다.",https://n.news.naver.com/mnews/article/008/0005285382
2025-12-01 13:01:00,"'특혜' 논란에 한호건설, 종묘 앞 세운4구역 토지 매각한다","유네스코 세계유산인 서울 종묘(宗廟) 앞 세운4구역 개발 특혜 논란에 휩싸인 한호건설이 보유한 세운4구역 내 토지 3135.8㎡(약 950평)를 매각하기로 결정했다. 사업에 앞서 세계유산영향평가를 받아야 한다는 지적이 제기된 데다 최근 정치권을 중심으로 개발이익 특혜 논란까지 거세지자 토지를 되팔기로 한 것으로 풀이된다.  1일 한호건설에 따르면 회사 측은 이날 세운4구역의 시행사인 서울주택도시개발공사(SH)에 한호건설 보유 토지를 매수해 줄 것을 공문으로 정식 요청했다. SH공사를 통한 매각이 여의찮을 경우 일반 대상으로 매각 절차를 진행할 예정이다.  이번 세운4구역 토지매각 이유에 대해 한호건설은 ""최근 종묘와 세운4구역 관련된 보존, 개발 논란과 일부 언론의 허위, 과장 보도에 깊은 유감을 표명한다""며 ""종묘 보존으로 촉발된 정치권의 정쟁에 한호가 휩쓸려 회사의 명예와 사업 운영에 심각한 타격을 받고 있다""고 설명했다.  세운4구역 개발이 정상적으로 추진돼도 개발이익을 기대하기 어려운 상황에서, 해당 토지를 보유할 경우 불필요한 오해와 논쟁이 생길 것으로 우려해서라는 설명이다. 인근 세운3지구 오피스 사업원가는 약 3.3㎡당 3390만원이지만, 최근 세운지구 오피스 매각가격은 3.3㎡당 2512만원(을지로4가역 을지트윈타워)으로 결정됐다.  한호건설은 ""이번 4구역 토지매각을 계기로 부당 개발이익 등 그간의 터무니없는 보도로 촉발된 오해를 불식시키고, 일개 부동산 개발회사인 한호건설이 더 이상 정치권의 정쟁 중심에서 거론되지 않기를 원한다""고 강조했다. 한편, 한호건설은 특혜 논란을 보도한 언론사와 개인방송 등을 대상으로 허위과장 보도에 대한 언론중재위원회 제소 및 손해배상 청구 등 법적 조치를 취할 예정이다.  앞서 정치권 등에서는 서울시의 세운4구역 개발 높이 제한 완화 과정을 두고 특례 논란이 제기됐다. 서울시는 최근 세운4구역의 높이 계획을 변경하는 내용을 담은 재정비촉진계획 변경안을 고시했는데, 건물 최고 높이는 당초 종로변 55ｍ·청계천변 71.9ｍ에서 종로변 101ｍ·청계천변 145ｍ로 변경됐다. 다만 종묘의 경관 영향을 최소화하기 위해 서울시의 앙각 기준(27도)을 세운지구까지 확대 적용했다. 종로변은 101.1ｍ, 청계천변은 149.4ｍ까지 가능하나, 단계적으로 높아지는 형태로 경관 영향이 저감되도록 종로변은 98.7ｍ, 청계천변은 141.9ｍ로 높이를 계획했다.",https://n.news.naver.com/mnews/article/008/0005285381
2025-12-01 13:00:00,"셀렉트스타, 55억 시리즈B 추가 투자유치…누적투자금 434억 달성","[이 기사에 나온 스타트업에 대한 보다 다양한 기업정보는 유니콘팩토리 빅데이터 플랫폼 '데이터랩'에서 볼 수 있습니다.] AI(인공지능) 데이터·신뢰성 평가 전문 기업 셀렉트스타는 55억원 규모의 시리즈B 추가 투자를 유치하며, 총 260억원 규모의 시리즈B 투자를 마감했다고 1일 밝혔다. 누적투자금은 434억원이다.  이번 추가 투자에는 삼성벤처투자, 미래에셋벤처투자, 플럭스벤처스가 신규 참여했다. 특히 삼성벤처투자는 삼성생명 전략투자펀드를 통해 셀렉트스타에 전략적 투자에 나섰다. 삼성생명이 추진 중인 AI 에이전트 도입 등 AX(AI 전환) 전략에 셀렉트스타와의 시너지 효과가 기대된다.  2018년 설립된 셀렉트스타는 AI 학습 데이터 구축 및 AI 신뢰성 검증 솔루션 '다투모 이밸'을 운영하고 있다. 국내 5대 그룹 및 5대 금융그룹을 포함해 320여 개 고객사와 협력하고 있다. SK텔레콤 컨소시엄으로 국가대표 AI 개발을 위한 '독자 AI 파운데이션 모델 개발 프로젝트'에도 참여하고 있다.  최근 셀렉트스타는 '삼성금융 씨랩 아웃사이드'에서 '금융업 특화 AI 데이터 파이프라인 및 신뢰성 평가 솔루션'을 제안해 삼성생명 최우수 스타트업으로 선정됐다. 삼성생명과의 실증 협력 성과가 전략적 투자로 이어지며, 향후 금융 AI 검증 솔루션 분야에서의 추가 협력이 예상된다.  셀렉트스타는 지난 8월 KB인베스트먼트, 신한벤처투자, 세일즈포스 등 국내외 유수의 투자사로부터 시리즈B(205억원)를 유치한 바 있다. 이번 추가 투자까지 금융권 중심의 VC들이 대거 참여하면서, 국내 금융 업계 선두 기업들의 AI 핵심 파트너로 자리매김했다는 평가다.  김세엽 셀렉트스타 대표는 ""이번 시리즈B 추가 투자는 셀렉트스타의 AI 데이터 및 신뢰성 평가 기술력이 금융권을 중심으로 폭넓게 인정받았다는 데 의미가 있다""며 ""국내 금융기관을 비롯해 다양한 산업에서 AX 특화된 데이터 파이프라인 구축과 품질·안정성 평가 플랫폼을 구축해 나가겠다""고 밝혔다.  이번 실증을 주도한 삼성생명 관계자는 ""삼성생명이 추진하는 AX 혁신에 셀렉트스타의 데이터 설계 및 신뢰성 평가 기술이 주요하게 활용될 것""이라며 ""이번 투자를 계기로 삼성생명과 셀렉트스타와의 전략적 시너지가 기대된다""고 말했다.  [머니투데이 스타트업 미디어 플랫폼 유니콘팩토리]",https://n.news.naver.com/mnews/article/008/0005285380
2025-12-01 12:54:00,"인천경제청, 글로벌 톱텐 시티 위크 2025…AI City 시대 '개막'","인천경제자유구역청(IFEZ)은 오는 4일까지 송도컨벤시아와 경원재 바이워커힐에서 '글로벌 톱텐 시티 위크 2025'(Global Top 10 City Week 2025)를 개최한다고 1일 밝혔다.  이번 행사에는 전 세계 10개국에서 15여개 도시 대표단과 산학연 관계자 등 300여명이 참여한다. 1일과 2일 열리는 IFEZ 스마트시티 서밋 2025는 '스마트도시부터 AI 도시까지'(From Smart to AI City)를 주제로 세계 주요 도시 및 기관 대표들이 참여해 도시혁신과 AI 기술 융합 전략을 논의한다.  정책 세션에선 4개국 주요 도시 및 경제특구 대표들이 모여 'IFEZ AI 도시 협력전략'을 공유하며 협력 방안을 논의한다. 성과공유 세션에선 해외 여러 도시들이 IFEZ 도시모델을 기반으로 한 스마트시티 협력 프로젝트 사례도 발표한다.  기조 세션에선 미래 스마트시티 방향을, 기술세션에선 AI 기술 개발과 디지털 트윈 기반 스마트 그린 환경 구축 사례를 소개한다. 참가자들은 IFEZ 홍보관, 스마트시티 운영센터, 바이오공정인력양성센터 등 주요 시설을 방문해 AI 기술과 스마트 인프라를 체험한다.  특히 오는 3일 인천스타트어파크에서 개최되는 '송도 바이오 오픈이노베이션 라운드테이블'에선 셀트리온, 삼성바이오로직스, 롯데바이오로직스 등 글로벌 바이오 기업들과 연세사이언스파크, 인천테크노파크, 인천창조경제혁신센터 등 입주기관들이 '송도 오픈이노베이션의 미래'를 주제로 성공 사례를 공유하고 협력 전략을 논의한다.  마지막 날에는△ AI 기반 바이오데이터 분석 △정밀의학 △글로벌 공동연구 및 인재양성 협력 방안을 논의하는 미국 존스홉킨스대 주재 '바이오테크 혁신 서밋'도 열린다.  인천경제청은 이번 행사를 계기로 △AI 기반 도시운영 실증(Testbed) 플랫폼 조성 △AI-바이오 융합 산업 생태계 확장 △글로벌 AI 스타트업 허브(Startup Park 2.0) 육성 △국제 AI 거버넌스 협력체계 구축 등을 본격 추진한다는 방침이다.  윤원석 인천경제청장은 ""AI 도시 이니셔티브는 도시가 데이터를 스스로 학습해 시민의 삶을 예측·개선하는 새로운 도시 운영 철학""이라며""IFEZ가 앞으로 혁신과 협력의 거점 역할을 충실히 수행하겠다""고 말했다.",https://n.news.naver.com/mnews/article/008/0005285379
2025-12-01 12:51:00,"""에이전틱 AI 구현능력 입증""... 메가존클라우드, AWS 인증 취득","메가존클라우드는 AWS(아마존웹서비스)의 에이전틱 AI 스페셜라이제이션을 취득했다고 1일 밝혔다.  메가존클라우드는 올해 초 AWS 생성형 AI 컴피턴시(Generative AI Competency)를 획득한 데 이어, 이번 에이전틱 AI 스페셜라이제이션까지 확보함으로써 AI 분야에서 독보적인 기술력을 다시 한번 인정받게 됐다.  에이전틱 AI 스페셜라이제이션은 AWS가 운영하는 파트너 역량 인증 프로그램 'AWS AI 컴피턴시' 내에 새롭게 개설된 인증이다. AWS는 고객이 신뢰할 수 있는 AI 전문 파트너를 더 쉽게 찾을 수 있도록 기존 'AWS 생성형 AI 컴피턴시'를 'AWS AI 컴피턴시'로 개편하면서, 스페셜라이제이션 중 하나로 에이전틱 AI 인증을 도입했다.  이 스페셜라이제이션은 사람처럼 스스로 판단하고 계획하며 여러 시스템과 협업해 복잡한 업무까지 자동으로 처리할 수 있는 에이전틱 AI를 실제 기업 환경에 구현할 수 있는 기술력과 경험을 갖춘 파트너에게 부여된다.  메가존클라우드는 금융·리테일·건설·제조 등 전 산업 분야에서 수백 건의 AI 및 데이터 프로젝트를 수행했다. GC녹십자에는 품질 문서 자동화를 위한 생성형 AI 시스템을 구축해, 문서 작성 및 검토 효율을 크게 향상시켰다. 또 하나투어의 AI 기반 패키지 일정 자동 설계 시스템 개발에도 참여해, 여행 상품 기획 과정의 효율성과 맞춤 추천 기능을 고도화했다. 국내 금융사들을 대상으로 챗봇 에이전트 등 AI 및 데이터 기반 시스템을 구축하는 사업도 진행 중이다.  2026년에는 AI·데이터 프로젝트 수행 건수가 전년 대비 3배로 확대되고, 관련 매출도 2배 수준으로 증가할 것으로 전망된다.  메가존클라우드는 내부 업무 솔루션에 AI와 데이터 분석을 적용한 결과 올 상반기 전사 업무 생산성이 '23년 상반기 대비 40%나 향상되는 성과를 거뒀다. 특히 자체 개발한 MSP(클라우드 관리서비스) 에이전트로 내부 클라우드 엔지니어들의 고객 지원 업무 생산성을 대폭 향상시켰다. 이 MSP 에이전트는 8000여 고객사에 대한 서비스를 통해 축적한 운영 경험과 사용 패턴 학습을 바탕으로 개발됐다. 지속적 데이터 축적과 개량을 통해 엔지니어들의 생산성을 3~4배까지 끌어올릴 것으로 기대된다.  공성배 메가존클라우드 공성배 CAIO(최고AI책임자)는 ""이번 스페셜라이제이션 취득은 메가존클라우드가 AI 도입을 넘어 실제 기업 환경에서 에이전틱 AI를 구현할 수 있는 역량을 공식적으로 인정받았다는 점에서 의미가 크다""며 ""고객이 사람처럼 판단·계획·협업하는 에이전틱 AI를 활용할 수 있도록 지원을 강화해 다양한 산업에서 기업의 실질적인 AI 혁신을 빠르게 이끌겠다""고 말했다.",https://n.news.naver.com/mnews/article/008/0005285378
2025-12-01 12:46:00,"스페이스코인 2번째 위성 안착... ""탈중앙 위성 인터넷망 가속화""","탈중앙화 위성 인터넷 프로젝트 스페이스코인의 두 번째 위성이 목표 궤도에 안착했다.  스페이스코인은 이 회사의 두 번째 위성 CTC-1 3기가 지난달 29일 오전 3시18분(한국시간) 미국 캘리포니아주 반덴버그 우주군 기지에서 스페이스엑스(SpaceX)의 팔콘9(Falcon 9) 로켓을 통해 발사돼 목표 궤도에 성공적으로 안착했다고 1일 밝혔다.  스페이스코인은 저궤도 위성(LEO)을 이용해 탈중앙화 위성 인터넷 인프라(DePIN)를 구축하는 프로젝트로 기존 고비용 지상 인프라 없이도 전 세계 26억 명의 인터넷 소외 지역 거주자에게 저렴하고 자유로운 인터넷 접근 기회를 제공하는 것을 목표로 하고 있다. 위성 인터넷 사용 이력 등을 기반으로 온체인 신용 데이터를 구축하고, 향후 크레딧코인의 탈중앙화 대출 서비스와 연계해 웹3(Web3) 금융 생태계로 확장할 계획이다.  이번 위성은 실제 궤도 환경에서 스페이스코인의 핵심 기술을 검증하는 역할을 수행한다. 구체적으로는 △위성 간 데이터 릴레이 △네트워크 동기화 △지상국 연동 테스트 등 임무를 수행할 예정이다. 앞서 스페이스코인은 지난해 12월 첫 번째 위성 'CTC-0' 를 성공적으로 발사한 바 있다. 스페이스코인은 이번 발사 이후 추가 위성 발사를 지속적으로 추진해 글로벌 탈중앙화 위성 인터넷망 구축을 가속화할 계획이다.  스페이스코인은 올해 6월 미국 특허청으로부터 위치 증명(Proof of Location) 기술 특허(미국 특허번호 12335739)를 취득했다. 이 기술은 중앙 서버나 외부 신호에 의존하지 않고 GPS 정보를 검증해 스푸핑(spoofing)을 방지하는 방식으로, 탈중앙화 위성 네트워크의 보안성과 신뢰성을 강화하는 핵심 기술로 평가된다.  이번 발사에는 니어스페이스런치(Near Space Launch), 애로우 사이언스 테크놀로지(Arrow Science and Technology), 도너웍스(DornerWorks) 등 다수의 항공우주 전문 기업이 협력 파트너로 참여했다. 이들은 위성 제작, 통신 하드웨어 통합, 미션 컨트롤 시스템 구축 등 전반적인 기술 개발을 지원하고 있다.  스페이스코인 관계자는 ""이번 CTC-1 위성군 발사는 스페이스코인의 핵심 기술이 실제 궤도 환경에서 작동하는지를 검증하는 중요한 이정표가 될 것""이라며 ""위성 간 데이터 릴레이와 네트워크 동기화, 지상국 연동 테스트를 통해 탈중앙화 위성 네트워크의 상용화를 앞당길 것""이라고 말했다.",https://n.news.naver.com/mnews/article/008/0005285377
2025-12-01 12:45:00,"3번 이상 음주운전 '가중처벌'…헌재 만장일치 ""위헌 아니다""","음주운전 금지규정을 3회 이상 위반한 경우 가중처벌 하도록 한 구 도로교통법 조항이 헌법에 위배되지 않는다는 헌법재판소의 판단이 나왔다.  헌재는 재판관 9인 전원일치 의견으로 음주운전 금지규정을 2회 이상 위반한 사람이 다시 음주 상태에서 운전한 경우 가중처벌 하도록 한 구 도로교통법 제148조의2 제1항 제1호는 합헌이라고 결정했다고 30일 밝혔다.  이 사건 신청인 A씨는 2018년 8월 혈중알코올농도 0.153% 상태로 무면허 운전을 한 혐의로 2023년 세 번째로 재판에 넘겨졌다. A씨는 2015년 1월과 2017년 11월 두 차례 음주운전으로 징역형 집행유예로 유죄 판결을 받은 바 있다.  세 번째 재판을 받던 A씨는 도로교통법상 음주운전 금지규정을 2회 이상 위반한 사람을 가중처벌 하는 구 도로교통법 제148조의2 제1항 제1호에 대해 위헌법률심판 제청 신청을 했고 법원은 이를 받아들여 헌재에 위헌법률심판을 제청했다.  A씨가 문제삼은 구 도로교통법 조항은 음주운전을 2회 이상 위반한 사람이 또 다시 음주운전을 한 경우 1년 이상 3년 이하의 징역 또는 500만원 이상 1000만원 이하의 벌금에 처한다고 정하고 있다.  헌재는 구 도로교통법에 따라 A씨를 가중처벌하는 것에 문제가 없다고 봤다. 헌재는 ""반복적 음주운전은 교통안전을 위협하면서 사회구성원의 생명·신체·재산을 거듭 위험에 처하게 하는 무분별한 행위이고 비난 가능성이 매우 크다""고 밝혔다.  그러면서 ""특히 음주운전 금지규정을 3회 이상 위반한 자는 교통법규 준수에 관한 책임 의식, 교통관여자로서의 안전의식 등이 현저히 결여돼 있다""며 ""국민의 생명·신체·재산 및 도로교통에 관련된 공공의 안전에 심각한 위험을 초래할 가능성이 높다""고 했다.  헌재는 이번 심판에서 가중처벌 조항이 적용되는 음주운전 위반 전력의 기간적 범위를 명확히 했다. 문제가 된 조항에 따르면 가중 처벌되는 과거 음주운전 전력은 2006년 6월부터 2018년 9월까지 발생한 경우로 한정된다. A씨가 저지른 세 번째 음주운전은 이 기간 안에 저지른 범죄에 해당했다.  헌재는 또 ""구체적 사안에 따라 재범 행위의 비난 가능성에 차이가 있더라도 법관이 양형을 통해 불법의 정도에 알맞은 형을 선고할 수 있으므로, 법정형이 지나치게 과중하다고 볼 수 없다""고 했다.  해당 조항이 처벌에 대해 '1년 이상 3년 이하의 징역 또는 500만원 이상의 1000만원 이하의 벌금'으로 징역형과 벌금형을 선택적으로 규정하고 있어 여러 제반 사정을 종합해 형량을 정할 수 있다는 것이다.",https://n.news.naver.com/mnews/article/008/0005285376
2025-12-01 12:30:00,"'장례 스타트업' 고이장례연구소, 90억 시리즈A 유치…누적 119억","[이 기사에 나온 스타트업에 대한 보다 다양한 기업정보는 유니콘팩토리 빅데이터 플랫폼 '데이터랩'에서 볼 수 있습니다.] 장례 서비스 스타트업 고이장례연구소가 90억원 규모의 시리즈A 투자를 유치했다고 1일 밝혔다. 이번 투자유치를 포함해 고이장례연구소의 누적 투자유치액은 119억원이 됐다.  이번 투자 라운드는 신한벤처투자 주도로 에이치지이니셔티브(HGI), 우신벤처투자, 한빛인베스트먼트, 하나벤처스, 디캠프가 참여했다.  2021년 9월 설립된 고이장례연구소는 장례 준비부터 사후 행정 절차 등을 원스톱 서비스를 제공하는 스타트업이다. 2024년 6월 계약금 상조 모델인 '100원 상조'를 출시하며 성장세를 높였다. 월 100원 납입으로 가입 시점의 장례 가격을 평생 보장하는 방식이다. 출시 이후 누적 5만명이 가입했으며, 지난 10월 가입자 1만5000명을 돌파했다.  이번 투자를 리드한 신한벤처투자 관계자는 ""장례 시장에서 고객이 가장 중요하게 여기는 가치는 서비스 안정성""이라며 ""고이는 품질 관리와 운영 시스템을 통해 신뢰를 만들어가고 있다""고 설명했다.  고이장례연구소는 이번 투자금을 서비스 품질 관리 고도화에 활용할 계획이다. 특히 장례지도사 교육 시스템 확장과 파트너 품질 관리 강화에 집중한단 설명이다. 송슬옹 고이장례연구소 대표는 ""이번 투자유치를 바탕으로 서비스 안정성을 지속 강화하겠다""고 밝혔다.  [머니투데이 스타트업 미디어 플랫폼 유니콘팩토리]",https://n.news.naver.com/mnews/article/008/0005285375
