날짜,제목,본문,링크
2025-12-09 09:50:00,국무총리 “환율·물가 긴밀히 협조” 한은 총재 “정부와 소통 강화”,"김민석 국무총리가 9일 오전 이창용 한국은행 총재와 경제 현안 간담회를 했다. 국무총리가 한은 총재와 따로 만나는 것 자체가 이례적인 일이다. 그동안 한은 총재는 통화정책 독립성을 이유로 정부 고위 관료들과 공개적인 자리에서 만나는 것을 꺼려왔다.   총리실에 따르면, 간담회는 김 총리 제안으로 개최된 것으로 전해졌다. 간담회는 이날 오전 7시30분부터 약 1시간 가량 진행됐다고 한다.  총리실은 보도자료에서 “김 총리와 이 총재가 최근 경제·금융 상황에 대한 의견을 교환했다”고 밝혔다. 이 총재가 최근 경제 성장률과 물가, 환율 흐름에 대해 분석한 내용을 공유했고 김 총리는 주로 들었다고 한다.  김 총리는 이 총재에게 “환율, 물가 안정 등 시장 안정을 위해 한은과 정부의 공조가 중요하다”고 했다고 한다. 그러면서 “앞으로도 당면한 현안들에 대하여 긴밀히 소통하고 협조해 나가자”고 한 것으로 전해졌다.  이에 이창용 총재는 “한국은행이 단기적 경제 안정뿐만 아니라 중장기 성장잠재력 확충을 위해 구조개혁 연구를 지속하고 정부와의 소통과 협력을 더욱 강화해 나가겠다”고 답했다고 한다.  한편, 최근 한은은 기획재정부, 국민연금, 보건복지부와 함께 ‘환율 안정 4자 협의체’를 출범했다. 원·달러 환율이 지난 6월 1360원대에서 최근 1480원 직전까지 오르자 정부 차원에서 대책 마련에 나서기로 했는데 한은도 동참하기로 한 것이다.",https://n.news.naver.com/mnews/article/366/0001128886
2025-12-09 09:49:00,"[특징주] 코오롱모빌리티그룹, 상장폐지 앞두고 장중 25% 급락","9일 코오롱모빌리티그룹 주가가 상장폐지를 앞두고 19% 급락 중이다.  이날 오전 9시 45분 기준 유가증권시장에서 코오롱모빌리티그룹은 전 거래일 대비 2970원(19.19%) 하락한 1만2510원에 거래되고 있다. 장중에는 전 거래일 대비 3890원(25.1%) 하락한 1만1590원에 거래되기도 했다.  코오롱모빌리티그룹은 오는 2026년 1월 7일 상장폐지를 앞두고 있다. 모회사인 코오롱이 코오롱모빌리티그룹 주식 전부를 인수해 100% 자회사로 편입하는 과정에 돌입했기 때문이다.  주식 교환 일정에 따르면, 코오롱모빌리티그룹 보통주와 우선주는 12월 15일 매매거래가 정지되고, 12월 17일 코오롱 주식과 교환된다.  코오롱은 앞서 지난 8월 8일부터 9월 8일까지 공개 매수를 통해 코오롱모빌리티그룹 주식을 사들인 바 있다. 당시 공개 매수가는 보통주 기준 주당 4000원이었다. 코오롱은 이 과정을 통해 코오롱모빌리티그룹 지분 90.37%를 확보했으며, 나머지 주식은 12월 17일 주식 교환 방식으로 취득할 예정이다.  한편, 상장폐지 절차를 앞두고 단기 급등 현상이 나타나기도 했다. 지난 9월 26일에는 상장폐지 테마를 노린 단기 수급 쏠림으로 인해 주가가 공개매수가인 4000원의 5배가 넘는 2만2500원에도 거래되는 이상 현상을 보였다.",https://n.news.naver.com/mnews/article/366/0001128885
2025-12-09 09:46:00,전국 지식산업센터 ‘최악의 한파’…3분기 거래 5년래 최저치,"3분기 지식산업센터 거래량 520건 거래금액은 2089억원으로 전분기比 40.2% 감소 서울 지역 거래금액 1000억원대 무너져   올해 3분기 지식산업센터 거래 규모가 최근 5년 이래 최저치를 기록했다.  9일 인공지능(AI) 기반 상업용 부동산 종합 서비스 기업 부동산플래닛이 발표한 올해 3분기 전국 지식산업센터 매매시장 동향 보고서에 따르면 지식산업센터 거래량 520건, 거래금액 2089억원으로 직전 분기 대비 각각 36.1%, 40.2% 감소했다. 이는 2021년 집계 이후 가장 부진한 거래 실적이다.  다만, 전국 지식산업센터 전용면적당 평균 가격은 상승했다. 3분기 전용면적당 평균 가격은 1629만원으로 직전 분기(1569만원)보다 3.8% 상승했다. 이는 2024년 3분기(1879만원) 이후 가장 높은 금액이다.  3분기 지식산업센터 거래량의 88.1%, 거래금액의 90.1%가 수도권(서울·인천·경기)에서 발생한 것으로 나타났다. 같은 기간 수도권에서 매매된 지식산업센터는 총 458건, 1883억원으로 전분기(725건, 3231억원) 대비 각각 36.8%, 41.7% 감소했다.   서울의 경우 지식산업센터 거래량과 거래금액의 감소 폭이 다른 지역에 비해 상대적으로 작았다. 올해 3분기 서울의 지식산업센터 거래량은 150건에서 142건으로 5.3% 감소했다. 다만, 거래금액은 1111억원에서 12.8% 줄어든 969억원을 기록하면서 작년 1분기부터 유지한 거래 금액 1000억원 선을 유지하지 못했다.  서울시 지식산업센터 전용면적당 평균 가격은 2515만원으로 직전 분기(2373만원) 대비 6.0% 오름세를 보였다.  비수도권 시장도 전분기 대비 거래량은 30.3% 감소한 62건, 거래금액은 20.8% 줄어든 206억원을 기록하며 하락세를 피하지 못했다.  3분기 전용면적당 평균 가격은 수도권과 비수도권 모두 상승했다. 수도권 지식산업센터는 1619만원에서 1679만원으로, 비수도권 지식산업센터는 1165만원에서 1261만원으로 오르며 전분기 대비 각각 3.7%, 8.2% 증가했다.  부동산플래닛 정수민 대표는 “3분기 지식산업센터 시장은 공급 부담이 누적된 가운데 수요까지 둔화되면서 거래량과 거래금액 모두 전분기 대비 감소했다”며 “수요 회복을 위해서는 실수요자의 부담 완화와 업종별 업황 회복이 병행돼야 하지만, 현재 업황 개선이 쉽지 않은 만큼 단기간 내 뚜렷한 회복세를 기대하기는 어렵다”고 말했다.",https://n.news.naver.com/mnews/article/366/0001128884
2025-12-09 09:43:00,"北 김정은, 러 푸틴에 ‘주북 러시아대사 사망’ 조전… “커다란 상실”","김정은 북한 국무위원장이 러시아로 주북한 러시아 대사 사망 조전을 보내고 애도를 표했다.  9일 조선중앙통신은 김 위원장이 마체고라 주북한 러시아 대사의 사망과 관련해 블라디미르 푸틴 러시아 대통령에게 조전을 보냈다고 보도했다.  조선중앙통신에 따르면 김 위원장은 조전에 “조선민주주의인민공화국 정부를 대표해 푸틴 동지와 러시아연방 지도부, 유가족들에게 심심한 애도와 위문을 표한다”고 했다  김 위원장은 이어 “마체고라 대사는 지난 30여년간 조로(북러) 친선 관계 발전을 위해 한생을 바친 조선 인민의 친근한 벗이며 동지”라며 “우리 인민에게 커다란 상실”이라고 평가했다.  김 위원장에 이어 최선희 북한 외무상도 같은 날 세르게이 라브로프 러시아 외무장관에게 조전을 보낸 것으로 전해졌다.  최 외무상은 조전에서 “다재다능하고 노련한 외교관이었다”고 평가하며 “두 나라 친선의 역사와 더불어 새 세대 외교 일꾼들의 고귀한 귀감으로 길이 기억될 것”이라고 했다.  러시아 외무부는 8일(현지 시각) 성명을 통해 마체고라 대사가 지난 6일 70세로 사망했다고 밝혔다. 사인은 언급되지 않았다.  마체고라 대사는 1999년 주북한 러시아 대사관 1등 서기관 근무를 시작으로 주북 대사관 공사참사관 등을 거쳐 2014년 12월 주북 러시아대사로 임명됐다.  2015년 1월부터 10년간 주북 대사를 지낸 마체고라 대사는 최근 러시아와 북한의 밀착이 강화되면서 양국 간 연결 고리 역할을 했다.",https://n.news.naver.com/mnews/article/366/0001128883
2025-12-09 09:36:00,"KOSA, 국내 AI·SW 기업 미국 진출 협의회 발족","한국인공지능·소프트웨어산업협회(KOSA)는 지난 8일 국내 인공지능(AI)·소프트웨어(SW) 기업의 미국 시장 진출을 지원하기 위한 ‘미국 진출 협의회’를 공식 발족했다고 9일 밝혔다.  협의회는 중소벤처기업부와 대·중소기업·농어업협력재단이 주관하는 ‘대·중소 동반진출 협의회 사업’의 일환으로 추진됐다. 국내 AI·SW 기업의 미국 시장 이해도와 진출 준비 역량을 강화하고 기업 간 동반진출 네트워크를 구축하는 게 목표다. 협의회에는 포티투마루, 인스웨이브, 투비소프트, 트레드링스 등 미국 시장 진출을 추진하는 26개 기업이 참여한다.  KOSA는 이날 AI·SW 기업의 미국시장 진출 전략 세미나(Doing Business in USA)’도 개최했다. 세미나에서는 신은혜 500글로벌 수석심사역이 미국 진출을 준비하는 스타트업의 핵심 역량을, 김윤선 뉴욕경제개발청 디렉터가 뉴욕 진출의 장점과 지원 프로그램을, 이정수 플리토 대표가 국내 기업의 실제 미국 진출 사례를 소개했다.  KOSA는 “미국 진출 협의회를 통해 미국 시장 동향 및 진출 전략 정보를 지속 제공하고 참여 기업 간 협력을 통한 동반진출 기회를 모색할 계획”이라며 “미국 현지 투자기관, 경제개발청 등과의 협력 채널을 구축해 회원사의 미국 시장 진출을 체계적으로 지원할 예정”이라고 밝혔다.",https://n.news.naver.com/mnews/article/366/0001128882
2025-12-09 09:35:00,"[특징주] 코스닥 첫 英 기업 테라뷰, 상장 첫날 80%대 ‘쑥’","9일 영국 기업 최초로 코스닥시장에 상장한 테라뷰가 상장 첫날 80% 넘게 주가가 오르고 있다.  이날 오전 9시 31분 기준 테라뷰는 공모가(8000원) 대비 6770원(84.63%) 오른 1만4770원에 거래되고 있다. 주가는 장 초반 1만5500원까지 뛰며 ‘따블(공모가 대비 두배)’에 다가서기도 했다.  테라뷰는 영국 소재 반도체·이차전지 검사장비 기업이다. 영국 케임브리지에 본사를 두고 있다. 반도체와 2차전지 제조 공정에서 필수로 여겨지는 전자기파 ‘테라헤르츠’(THz)파 기반의 고도 측정 장비를 개발한다.  테라뷰는 지난달 13~19일 진행한 기관투자자 대상 수요예측에서 646대 1의 경쟁률을 기록했다. 국내외 기관 1811개사가 참여했고, 공모가는 희망범위 상단인 8000원으로 확정했다.  지난달 21~24일 진행된 일반투자자 대상 공모주 청약에서는 42.7대 1의 경쟁률을 보였다. 청약 증거금으로는 2137억원이 모였다.",https://n.news.naver.com/mnews/article/366/0001128881
2025-12-09 09:34:00,"“해외 진출 전략 공유” 중진공, K스타트업 데이 개최","중소벤처기업진흥공단은 9일 서울 강남구에 있는 엘리에나 호텔에서 글로벌 시장 진출에 관심 있는 스타트업을 대상으로 ’2025 글로벌 K-스타트업 데이’를 개최한다고 밝혔다.  이번 행사는 국제 스타트업 페스티벌 ‘컴업(COMEUP) 2025’ 주간과 연계해 국가별 시장 진출 전략을 공유하고 참석자들의 네트워크 구축을 지원하기 위해 마련됐다. 스타트업, 벤처캐피털(VC), 협력 기관 관계자 등 130여 명이 참석한다.  주요 프로그램은 ▲K-스타트업센터(KSC) 지원 사업 안내 ▲해외 VC 초청 글로벌 진출 전략 세미나 ▲KSC 우수 성과 공유 △현지 전문가 1대1 상담 및 네트워킹 등으로 구성된다.  중진공은 미국, 싱가포르, 베트남, 일본, 프랑스 등 전 세계 5개국 6개소 해외 거점에서 근무 중인 KSC 현지 직원들이 직접 참여해 거점별 지원 내용을 소개한다. KSC를 활용해 계약 체결, 대규모 투자 유치, 현지 파트너 확보 등 글로벌 시장에서 성과를 창출한 스타트업의 성공 사례도 발표한다.  오후에는 창업진흥원 주관으로 현지 액셀러레이터와 창업기업의 해외진출 우수 성과 발표 세션도 별도로 열린다.  박장혁 중진공 글로벌성장이사는 “앞으로도 인공지능(AI)·딥테크 등 혁신 분야 지원을 강화하고 국내 스타트업이 글로벌 유니콘으로 성장할 수 있는 든든한 기반을 마련하겠다”고 말했다.",https://n.news.naver.com/mnews/article/366/0001128880
2025-12-09 09:34:00,"美 래퍼 제이지, 한화운용과 손잡고 7000억원대 투자 나선다","미국의 래퍼이자 프로듀서인 ‘제이지(Jay-Z)’가 한화자산운용과 손잡고 한국 대중문화에 7000억원대 투자에 나선다.   9일 한화자산운용과 영국 파이낸셜타임스(FT) 등에 따르면 한화자산운용은 제이지의 투자회사 마시펜 캐피털 파트너스와 업무협약(MOU)을 맺었다.  글로벌 투자 플랫폼인 마시펜은 한국 대중문화에 투자하는 5억달러(약 7300억원) 규모의 펀드를 목표로 하고 있는 것으로 전해진다. 마시펜은 제이지가 전문 투자자 제이 브라운, 로비 로빈슨 등과 함께 공동 설립했다.  FT 보도에 따르면, 한화자산운용이 투자 대상이 되는 기업을 발굴하면 마시펜이 마케팅을 통해 글로벌 시장에 선보이는 방식이다. 투자 대상은 K팝, K푸드 등 한국 문화와 관련된 기업들이다.  FT는 “최근 몇 년 사이 한국 대중문화는 폭발적으로 인기를 얻었고 블랙핑크와 BTS같은 그룹이 전 세계 공연장을 채웠다”며 “펀드는 내년 하반기에 기관 투자자, 국부펀드, 고액 자산가들에게서 자금을 모집하기 시작할 계획”이라고 전했다.  김종호 한화자산운용 사장은 FT에 “이를 통해 한국 기업의 글로벌 진출 기회가 있다”며 “보통 한국 기업들은 자체 자본이나 기업 자금을 사용하지만, 제3자의 지원이 있다면 성장 잠재력이 더 커질 것”이라고 말했다.  이날 마시펜은 보도자료를 통해 “오늘 동서양 시장을 연결하는 데 독보적인 위치를 차지하게 될 전략적 합작 법인 ‘마시펜 아시아’를 설립하기 위해 한화자산운용과 최종 계약을 체결했다”면서 “마시펜은 마시펜 아시아의 지분 과반을 보유하게 되며, 서울에 기반을 둔 투자팀이 회사를 이끌고 운영하게 된다”고 했다.",https://n.news.naver.com/mnews/article/366/0001128879
2025-12-09 09:33:00,"세라젬 ‘마스터 V9’, 대한변리사회 제품특허인증 골드마크 획득","세라젬의 척추 관리 의료기기 ‘마스터 V9’이 대한변리사회 ‘제품특허인증’ 심사에서 적합 판정을 받아 최상위 등급인 골드마크를 획득했다고 9일 밝혔다.  대한변리사회가 지원하는 제품특허인증사업은 제품의 특허를 표기할 때 실제로 해당 특허기술이 제품 기능에 반영됐는지를 전문가가 직접 심사하는 공적 인증 제도다. 의뢰받은 제품 내 특허 적용 여부를 변리사회 심사를 통해 통과한 제품에는 인증마크가 부여된다.  세라젬은 이번 인증을 통해 마스터 V9에 척추 스캔, 견인모드, 음파·에어 등 마사지 장치를 비롯한 총 12건의 특허 기술이 실제 제품 기능으로 구현됐다는 것을 입증했다.  ‘마스터 V 컬렉션’은 연구개발부터 생산까지 이르는 전 과정을 국내에서 일원화함으로써 기술 신뢰성과 품질의 안정성을 강화해 왔다. 천안 스마트팩토리에 구축된 정밀 센싱 품질관리 시스템을 통해 제품 간 편차를 최소화하고 높은 수준의 품질을 균일하게 유지하고 있다.  세라젬 관계자는 “마스터 V9은 단순한 안마가전이 아니라 공인된 특허 기술 기반의 척추 관리 의료기기임이 공식적으로 검증됐다”며 “특히 최고 등급인 골드마크의 획득은 세라젬이 27년간 축적해 온 독자적인 기술력과 R&D 투자의 성과를 입증하는 결과”라고 말했다.",https://n.news.naver.com/mnews/article/366/0001128878
2025-12-09 09:31:00,"동원산업, ‘2025 한국의경영대상’ AI 혁신 부문 대상 수상","올해 신설된 ‘AI 혁신’ 부문 첫 수상   동원산업은 이날 서울 신라호텔에서 열리는 ’2025 한국의경영대상' 시상식에서 AI 혁신 부분 대상을 수상한다고 9일 밝혔다.  한국의경영대상은 국내 산업의 지속 가능한 성장과 글로벌 경쟁력 강화를 목표로 1988년 제정된 국내 경영 부문 최고 권위의 상이다. 올해 AI(인공지능) 시대에 발맞춰 ‘AI 혁신’ 부문을 신설했다. 첫 수상자로 동원산업이 선정되면서 AI 활용 선도 기업으로 자리매김했다.  동원산업은 동원그룹의 지주회사다. 그룹이 영위하는 사업 전(全) 영역에서 AI를 활용하도록 지원하고 있다. 자체 AI 플랫폼 동원GPT 도입이 대표적이다. 사내 인트라넷에 설치돼 내부 정보 유출 없이 안심하고 사용할 수 있을 뿐 아니라 보고서 작성·데이터 분석 등 작업도 지원해 업무 생산성을 향상한다.  현재는 지속적인 고도화 작업을 통해 직무·성향에 따라 맞춤 서비스를 설정할 수 있는 ‘My GPT’와 지정한 업무를 별도의 지시 없이 자동·반복적으로 실행하는 ‘AI 에이전트’ 기능을 확대하고 있다. 그룹 ERP(전사적 지원 관리) 시스템과 연결해 임직원들이 데이터를 유기적으로 활용하도록 지원할 계획이다.  동원그룹 계열사도 AI를 사업 현장에 도입하고 있다. 동원F&B는 육안으로 확인하기 어려운 통조림 속 가시나 이물질을 AI 기술로 검출하고 있고, 제품 디자인을 평가하는 시스템도 구축해 연구 비용을 절감하고 신제품 출시 기간도 단축하고 있다. 이 외에 ▲동원산업(사업 부문)이 개발한 AI 챗봇을 통한 외국인 선원들의 선상 생활 지원 ▲동원건설산업이 개발한 AI 스마트 견적 시스템을 통한 공사 견적 단가 및 내역 자동 작성 ▲임직원 대상 AI 활용 역량 강화를 위한 사내 교육 등도 운영 중이다.  박종성 동원산업 DT본부장은 “동원그룹은 경영진부터 임직원까지 AI에 많은 관심을 두고 있다. AI를 활용해 기존 업무 방식을 개선하려는 문화가 자리 잡았다”며 “앞으로도 빠르게 발전하는 AI 기술을 우리의 사업에 적재적소로 적용해 미래 성장동력을 확보할 것”이라고 했다.",https://n.news.naver.com/mnews/article/366/0001128877
2025-12-09 09:28:00,"팀네이버, 세계적 권위 AI학회서 논문 10편 채택","팀네이버가 세계 최고 권위의 인공지능 학회 ‘NeurIPS 2025’에서 논문 10편을 채택하며 연구 역량과 AI 기술 경쟁력을 세계에 입증했다고 9일 밝혔다.  이번 학회에서 팀네이버는 ‘From Research to Reality’를 주제로, 초거대 AI 모델 ‘하이퍼클로바X’와 네이버의 산업 특화 AI 서비스를 공유하며 AI 풀스택 전략을 소개했다.  이번에 채택된 논문은 초거대 AI 효율적 운용, 생성형 AI의 안전성 강화, 물리 세계로의 AI 확장 등 3가지 기술 분야의 혁신을 다루고 있다. 특히, LLM의 문맥 처리 시 성능 저하 없이 메모리를 최대 4배 절약하고 속도를 2배 향상시키는 캐시 압축 기술과, AI 생성물의 품질을 높이고 안전하게 제어하는 기술들이 주목을 받았다.  또한, AI를 실세계로 확장하는 연구도 발표됐다. 로봇이 변화하는 공간을 기억하고 경로를 찾을 수 있도록 돕는 모델 구조 등은 AI 기술의 현실 적용 가능성을 보여주었다. 팀네이버는 이번 학회에서 2만9000명 이상의 AI 연구자들과 네트워크를 구축하며 기술 비전을 공유했다.  팀네이버 관계자는 “NeurIPS에서 10편의 논문이 채택된 것은 연구 역량이 세계적으로 인정받았다는 증거”라며, “앞으로도 AI 기술을 산업에 실현시킬 수 있도록 연구 역량을 강화하겠다”고 밝혔다.",https://n.news.naver.com/mnews/article/366/0001128876
2025-12-09 09:27:00,"현대오토에버, 테크 꿈나무 대상 교육 진행","현대오토에버는 ‘테크 꿈나무’ 육성을 위한 사회공헌 활동을 진행했다고 9일 밝혔다. 그 일환으로 현대오토에버는 미래 세대의 소프트웨어(SW) 역량을 지원하는 ‘배리어프리 앱 개발 콘테스트’와 스마트 모빌리티 양성교육·캠프를 운영했다.  올해로 9회째를 맞은 배리어프리 앱 개발 콘테스트는 대학(원)생을 대상으로 사회취약계층의 편의 증진을 위한 아이디어를 모집한다. 현대오토에버는 선정된 아이디어가 실제 앱 개발로 이어지도록 멘토링, 앱 개발 교육, 지원금 등을 제공한다. 올해 콘테스트에는 총 151개팀이 지원했고, 내년 2월 최종 선정될 8개의 아이디어가 앱으로 구현될 예정이다.  현대오토에버는 정보보안 전문가를 희망하는 고등학생을 대상으로 화이트해커 경진대회 참여 기회를 제공하는 ‘화이트해커 양성교육’도 7년 연속 진행했다. 올해에는 특성화 고교생 50명을 선발해 보안 관련 교육을 제공했다.  김윤구 현대오토에버 “앞으로도 미래 SW 인재 육성을 위한 다양한 사회공헌 활동을 전개해 나가겠다”고 말했다.",https://n.news.naver.com/mnews/article/366/0001128875
2025-12-09 09:27:00,FOMC 앞두고 경계감 커졌나…금리 인하 전망에도 뉴욕증시 약세 마감,"뉴욕증시 3대 주가지수가 동반 약세로 마감했다. 미국 연방공개시장위원회(FOMC) 회의를 앞두고 경계감이 확산된 여파로 풀이된다.   8일(현지 시각) 뉴욕증권거래소에서 다우존스30산업평균지수는 전장보다 215.67포인트(0.45%) 하락한 4만7739.32에 거래를 마쳤다. 스탠더드앤드푸어스(S&P)500 지수는 23.89포인트(0.35%) 밀린 6846.51에, 기술주 중심의 나스닥지수는 32.22포인트(0.14%) 내린 2만3545.90에 각각 마감했다.  FOMC는 9일부터 이틀 일정으로 올해 마지막 정례회의를 여는데, 이번 회의에서는 25bp(1bp=0.01%포인트)의 금리 인하가 이뤄질 것으로 전망된다. 다만 시장은 금리 인하 자체보다도 불안한 향후 금리 경로 방향성을 더 주목하는 양상이다.  업종별로는 기술을 제외한 모든 업종이 하락했다. ▲에너지 ▲임의소비재 ▲소재 ▲통신서비스 ▲유틸리티 ▲필수소비재 ▲의료건강이 1% 이상 떨어졌다.  다만 기술주는 오름세를 보였는데, 시가총액 1조달러 이상의 거대 기술 기업 중에선 엔비디아가 1.72%, 브로드컴이 2.78% 뛰었다. 특히 엔비디아는 미국 정부가 인공지능(AI) 칩 H200의 중국 수출을 허용할 가능성이 크다는 소식에 상승했으며, 장 마감 후 H200의 대중 수출은 실제로 승인됐다.  반면 하반기 가파르게 뛰었던 알파벳은 2% 넘게 하락했으며 테슬라는 3.39% 떨어졌다. 넷플릭스는 워너브라더스 디스커버리 인수에 성공했으나 반독점법 위반에 막힐 가능성으로 3% 넘게 밀렸다.",https://n.news.naver.com/mnews/article/366/0001128874
2025-12-09 09:24:00,"‘조폭 연루설’ 조세호, ‘유퀴즈’ ‘1박2일’ 자진 하차… “의혹은 사실 아냐”","‘조직폭력배 연루설’에 휩싸인 방송인 조세호가 출연 중인 프로그램에서 자진 하차한다.  조세호 소속사 A2Z엔터테인먼트는 조세호가 tvN ‘유퀴즈 온 더 블럭’과 KBS 2TV ‘1박 2일’에서 하차하기로 했다고 9일 밝혔다.  A2Z엔터테인먼트는 “조세호는 최근 본인에게 제기된 오해와 구설에 깊은 책임감을 느끼고 있다”면서 “제작진과 상의 후 자진 하차를 결정했다”고 했다.  앞서 한 SNS 계정에는 조세호가 지방의 조직폭력배로 지목되는 인물 A씨와 친분을 유지하며 고가의 선물을 주고받았다는 주장과 함께 관련 사진이 올라와 논란이 불거졌다.  A2Z엔터테인먼트는 “사업 홍보를 목적으로 A씨로부터 금품을 수수했다는 주장 역시 명백히 사실이 아니란 점 다시 한 번 밝힌다”면서 “우려와 위로에는 깊이 감사하고 있다”고 했다.  그러면서 “보다 엄중하게 대응하려고 한다. 오해를 해소하고, 실추된 이미지를 회복하기 위한 법적 대응을 보다 더 신속하고 강경하게 진행해 갈 예정”이라고 강조했다.  한편 조세호의 조직폭력배 연루 의혹을 제기한 A씨는 “내일부터 다시 하나씩 하나씩 진실이 승리할 때까지 싸우겠다”며 폭로전을 이어가겠다고 했다.  A씨는 “도박 자금 세탁에 대해서 제보받은 게 많아서 그걸로 한 번 올려보겠다”면서 “내가 좋아하는 개그맨 조세호씨는 계속 고소한다고만 하지 말고 남자답게 해명해달라”고 덧붙였다.",https://n.news.naver.com/mnews/article/366/0001128873
