날짜,제목,본문,링크
2025-12-09 15:55:00,‘727.9조’ 李정부 첫 예산안 국무회의 통과,"올해 본예산 대비 8.1% 증가  이재명 정부의 첫 본예산안인 2026년도 예산안이 9일 국무회의를 통과했다.   정부는 이날 용산 대통령실에서 이재명 대통령 주재로 국무회의를 열고 2026년도 예산안을 심의·의결했다. 최종 확정된 예산 규모는 727조9000억원으로, 정부 제출안(약 728조원)보다 1000억원가량 줄었다. 올해 본예산(673조3000억원)과 비교하면 8.1% 증가한 수준이다.  이 정부의 역점 사업 대부분은 정부 원안이 유지됐다. 지역사랑상품권 발행 지원 1조1500억원과 국민성장펀드 1조원은 삭감 없이 반영됐다. 반면 일부 인공지능(AI) 지원 예산과 정책펀드는 감액됐다. 예비비도 약 2000억원 줄었다.  증액 사업도 포함됐다. 국가정보자원관리원의 재해 복구 시스템 구축에는 4000억원이, 자율주행차 상용화를 위한 실증 도시 신규 조성 사업에는 618억원이 각각 늘었다.  이날 국무회의에서는 예산안 외에도 내란 특검과 김건희 특검의 수사 기간 연장, ‘관봉권 띠지 폐기 의혹 및 쿠팡 퇴직금 불기소 외압 의혹’ 상설 특검 출범과 관련한 지원 경비 30억5143만원을 목적 예비비에서 지출하는 안건 등이 의결됐다.  또 ‘온누리깡’(온누리상품권을 구매한 것처럼 속인 후 현금으로 돌려받는 행위)을 차단하기 위해 부정취득액의 최대 3배까지 과징금을 부과하도록 하는 ‘전통시장 및 상점가 육성을 위한 특별법’(전통시장법) 개정안 등도 이날 함께 의결됐다.",https://n.news.naver.com/mnews/article/366/0001129021
2025-12-09 15:47:00,"암참 “노란봉투법, 취지는 존중하지만 기업에 명확한 가이드 필요”","제임스 김 주한미국상공회의소(AMCHAM, 이하 ‘암참’) 회장은 시행을 앞둔 노란봉투법(개정 노동조합법)에 대해 “법의 취지 자체는 존중하지만, 기업들은 실제로 어떤 변화가 발생할지에 대해 보다 명확한 가이드가 필요하다”고 밝혔다.  김 회장은 지난 8일 법무법인 태평양이 암참과 공동으로 개최한 노란봉투법 관련 세미나에서 “한국이 아시아·태평양(APEC)의 지역 본부 허브로 도약하려면 글로벌 기준에 맞는 노동 정책과 예측 가능한 기업 환경이 뒷받침돼야 한다”며 이같이 말했다.  김 회장은 글로벌 기업의 아태 지역 본부는 싱가포르에 약 5000개, 홍콩에 1400여 개, 상하이에 900여 개 있지만 한국에는 100개 미만이라고 설명했다. 그러면서 “암참은 정부와 긴밀히 소통하며 근로자 보호와 기업 경쟁력이 균형을 이루는 정책 환경 조성에 힘을 보태겠다”고 했다.  이준기 태평양 대표변호사는 “노란봉투법은 모든 기업에 영향을 미치는 중요한 노동법 변화로, 정확한 이해와 대비가 필수”라고 말했다. 태평양 소속 이효진 외국 변호사(미국 뉴욕주)는 “노란봉투법은 국내 외국계 회사들에도 광범위하게 영향을 미칠 수 있는 만큼, 그 내용과 회사에 미칠 영향을 시행 전에 미리 잘 파악하고 준비해 두는 것이 중요하다”고 했다.  조흥선 태평양 변호사는 “현재까지 주요 하급심 판결을 살펴보면, 시행을 앞두고 있는 노란봉투법이 각 산업별로 기업에 어떤 방향으로 영향을 미칠지 예상해 볼 수 있다”고 말했다.  세미나에는 암참 회원사를 비롯해 국내외 주요 기업과 기관 법률 관계자, 담당자 150여 명이 참석했다.",https://n.news.naver.com/mnews/article/366/0001129020
2025-12-09 15:46:00,"중·러 군용기 9대, 방공식별구역 무단 진입 후 이탈","중국과 러시아의 군용기가 9일 오전 한국 방공식별구역(KADIZ)에 진입했다가 이탈했던 것으로 나타났다.   합동참모본부(합참)는 이날 문자 공지를 통해 오전 10시부터 러시아 군용기 7대와 중국 군용기 2대가 동해 및 남해 KADIZ에 순차적으로 진입 후 이탈했다고 밝혔다. 이 군용기들은 한국의 영공을 침범하진 않은 것으로 파악됐다.  합참 관계자는 “군은 중국 및 러시아 군용기가 KADIZ에 진입하기 이전부터 식별했다”며 “공군 전투기를 투입해 우발 상황에 대비한 전술 조치를 실시했다”고 말했다.  KADIZ는 한반도 지역으로 접근하는 군용기 등 항공기의 항적을 조기 식별하기 위한 구역을 말한다. 국제법상 영공에 속하지 않는다. 군용 항공기가 다른 국가의 KADIZ에 진입할 때에는 해당 국가에 미리 비행 계획을 통보하는 것이 국제 관례다.  합참은 중러 양국이 연합 공중훈련을 실시한 것으로 보고 있다.  러시아와 중국 군용기가 동시에 KADIZ에 진입한 건 지난해 11월 29일 이후 1년여 만이다. 러시아와 중국 군용기가 함께 KADIZ에 진입했었고, 지난 3월 15일에는 러시아 군용기만 KADIZ에 진입한 바 있다.",https://n.news.naver.com/mnews/article/366/0001129019
2025-12-09 15:42:00,"백해룡, 검찰·관세청 등 압수수색 신청…“검찰이 사건 덮어”","‘세관 마약 수사 외압 의혹’을 주장한 백해룡 경정이 검찰청과 인천공항세관 등에 대해 9일 압수수색 영장을 신청했다. 이날 본인이 속한 서울동부지검 ‘세관 마약밀수 연루 의혹 합동수사단’(합수단)이 세관 직원을 비롯해 수사 외압 의혹 당사자를 무혐의 처분했다고 밝힌 직후다.  백 경정은 입장문에서 세관 3곳(인천공항세관·김해세관·서울본부세관)과 검찰청 3곳(인천지검·서울중앙지검·대검찰청)에 대한 압수수색을 법원에 신청했다고 밝혔다.  백 경정은 “세관이 말레이시아 마약 조직 필로폰 밀수에 가담한 정황 증거는 차고 넘친다”라며 “검찰 사건기록상으로도 충분히 소명된다”라고 했다. 이어 “검찰이 마약 조직의 마약 밀수 사업에 세관이 가담한 사실을 인지하고 사건을 덮고, 오히려 밀수를 방조한 정황도 기록상 여러 군데 드러난다”고 했다.  백 경정의 발표는 합수단이 의혹 당사자인 세관 직원 7명을 혐의없음 처분했다는 중간 수사결과를 공지한 직후 나왔다. 합수단은 “마약 밀수범의 허위 진술로 시작된 의혹은 결국 사실무근이었다”고 발표했다.  합수단은 크게 윤국권 검사팀과 백 경정팀으로 나뉘어 있다. 백 경정팀이 신청한 압수수색 영장을 법원에 청구할지 여부는 합수단장이 결정한다. 윤 검사팀이 이날 관련 의혹 대부분을 사실무근이라고 판단, 무혐의 처분한 만큼 영장을 청구할 가능성은 크지 않다는 평가가 나온다.",https://n.news.naver.com/mnews/article/366/0001129018
2025-12-09 15:41:00,"檢, 선행매매로 112억원 챙긴 기자·증권사 직원 구속 기소","주식 종목 보도를 이용한 선행매매로 100억원이 넘는 부당 이익을 챙긴 전 경제매체 기자와 증권사 직원이 구속 상태로 재판에 넘겨졌다.  서울남부지검 금융조사2부(부장검사 김정환)는 9일 자본시장법 위반 혐의를 받는 전 경제매체 기자 A씨와 공범인 전 증권사 직원 B씨를 각각 구속 기소했다고 밝혔다.  이들은 2017년부터 올해 6월까지 약 8년간 특정 종목 주식을 사들인 뒤 호재성 기사를 보도하고, 주가가 상승하면 매도하는 방식으로 112억원 상당의 부당이득을 취한 혐의를 받는다.  검찰에 따르면 초기에는 A씨가 일하는 경제지 소속 기자가 작성한 보도를 이용하거나 기자 작성을 지시하는 방법을 썼다. 이후에는 다른 기자의 이름을 빌리거나 존재하지 않는 기자의 이름으로 기사를 보도하는 등 수법을 넓혀갔다.  검찰은 수사 초기부터 금융감독원과 협력해 고발 대상에 포함되지 않았던 공범 B씨의 존재를 파악했다고 한다.  검찰은 사건을 넘겨받기 전 선제적으로 추징보전을 청구했고, 송치 후 압수수색 등 보완 수사를 통해 A씨와 B씨가 범죄 수익으로 취득한 명품·호텔 회원권·가상 자산·차명 주식 등을 추징보전했다.  검찰 관계자는 “범죄 수익을 끝까지 추적해 박탈하고 금융 당국과 협력해 금융·증권 범죄에 엄정하게 대응하겠다”고 했다.",https://n.news.naver.com/mnews/article/366/0001129017
2025-12-09 15:40:00,"태광그룹, 이지스자산운용 매각 주간사 형사고소 검토 중","“형법상 경매·입찰 방해죄 해당” 주장   이 기사는 2025년 12월 9일 15시 31분 조선비즈 머니무브(MM) 사이트에 표출됐습니다.  국내 1위 부동산 전문 운용사 이지스자산운용의 인수 우선협상대상자로 중국계 힐하우스인베스트먼트가 선정된 가운데, 본입찰에서 힐하우스와 막판까지 경쟁했던 흥국생명이 매각 주간사 측을 검찰에 고소하는 방안을 검토 중인 것으로 전해졌다.  흥국생명은 이지스자산운용 매각 주간사가 힐하우스를 우협으로 선정하는 과정이 불공정했으며, 이 행위가 형법상 입찰방해죄에 해당될 가능성이 있다고 주장하고 있다. 아울러 흥국생명은 주간사의 자본시장법 위반 혐의 유무도 따져볼 것이라고 했다. 민·형사상 법적 책임을 모두 묻겠다는 의도다.  9일 투자은행(IB) 업계 및 법조계에 따르면 흥국생명은 현재 이지스자산운용 매각 주간사인 모건스탠리와 골드만삭스를 상대로 형사 고소를 검토하고 있다.  앞서 이날 오전 태광그룹 계열 흥국생명은 입장문을 내고 매각 주간사가 자사를 속인 채 불공정한 입찰을 진행했다고 주장했다.  흥국생명 측은 “주간사가 본입찰을 앞두고 ‘프로그레시브 딜(경매호가식 입찰)’을 하지 않겠다고 약속했기에 이를 신뢰하고 본입찰에서 최고액을 제시했다”며 “그러나 주간사는 우협 발표를 미루더니 힐하우스에 최고가 이상의 가격을 요청했고, 본입찰 실시 27일 만에 힐하우스를 우협으로 선정했다”고 했다.  업계에 따르면 예비입찰에서 흥국생명은 8000억원대 후반, 한화생명과 힐하우스는 9000억~1조원의 가격을 적어냈다. 이후 본입찰에서는 흥국생명이 3사 가운데 가장 높은 1조원 이상의 가격을 써냈는데, 주간사가 물밑에서 힐하우스에 프로그레시브 딜을 제안해 힐하우스가 입찰가를 1조1000억원으로 상향 조정했고 결국 우협 지위가 힐하우스로 돌아갔다는 게 흥국생명 측 입장이다. 흥국생명은 그 과정에서 주간사가 흥국생명의 입찰가를 힐하우스에 유출했을 가능성이 크다고 주장한다.  태광그룹 관계자는 “우리는 프로그레시브 딜이 없다는 주간사의 약속을 믿었기에 처음부터 높은 가격을 적어냈던 것”이라며 “만약 프로그레시브 딜로 전환한다는 걸 알았다면 적정가를 제시했다가 이후에 상향 조정했을 것”이라고 말했다.  흥국생명 내부 사정에 정통한 업계 관계자에 따르면, 이번에 매각 주간사가 흥국생명을 속이고 물밑에서 프로그레시브 딜을 진행한 게 맞는다면 이는 형법에 위배될 가능성이 있다.  현행 형법 제315조는 “위계 또는 위력 기타 방법으로 경매 또는 입찰의 공정을 해한 자는 2년이하의 징역 또는 700만원이하의 벌금에 처한다”고 규정한다. 여기서 ‘위계’란 속임수, 거짓을 뜻한다. 해당 조항은 공기업의 경매 입찰뿐 아니라 사기업의 경매 입찰에도 적용된다는 게 법조계 관계자들의 해석이다.  흥국생명은 주간사를 형사 고소하는 방안을 검토 중인 것으로 전해졌다. 흥국생명을 ‘피해자’로 볼 경우 고발이 아닌 고소가 가능하다.  회사는 그 외에도 주간사가 거짓말을 한 것이 민사상 자본시장법에 위배되지 않는지 여부도 검토 중이다. 검토를 마치는 대로 법적 대응에 나선다는 방침이다.  이에 대해 매각 주간사 측은 프로그레시브딜을 진행한 적이 없으며, 힐하우스에 혜택을 줬다는 건 흥국생명의 일방적인 주장이라는 입장을 고수하고 있는 것으로 전해졌다.",https://n.news.naver.com/mnews/article/366/0001129016
2025-12-09 15:40:00,"소녀시대 서현, 꿈이엔티와 전속계약… 7개월 만에 또 이적","그룹 소녀시대 출신 가수 겸 배우 서현이 소속사를 꿈이엔티로 옮긴다.  9일 연예계에 따르면 서현은 최근 리드 엔터테인먼트와 계약을 해지하고 꿈이엔티와 전속 계약을 체결했다. 지난 5월 리드 엔터테인먼트와 전속 계약을 알린 지 7개월 만이다.  서현은 2007년 소녀시대로 데뷔한 이후 2013년 SBS 드라마 ‘열애’를 통해 연기에 도전했다. 이후 SBS ‘달의 연인-보보경심 려’, MBC ‘시간’ 등에 출연했다.  꿈이엔티는 배우 전혜빈, 김예은 등이 소속된 매니지먼트사다. 꿈이엔티는 “서현은 성실한 태도와 열정을 모두 갖춘 배우”라면서 “세심하게 곁을 지킬 예정”이라고 말했다.  한편, 서현은 2026년 극장 개봉 예정인 영화 ‘왕을 찾아서’를 통해 관객들을 만날 예정이다.",https://n.news.naver.com/mnews/article/366/0001129015
2025-12-09 15:36:00,"원·달러 환율, 5.4원 오른 1472.3원 마감","9일 원·달러 환율이 전 거래일보다 5.4원 오른 1472.3원에 마감했다.  서울 외환시장에 따르면 이날 환율은 전날 주간거래 종가(오후 3시 30분 기준)보다 2.3원 높은 1469.2원에서 출발한 뒤 상승 폭을 키우며 오전 중 1470원을 돌파했다. 장 마감 직전에는 1472원도 넘어섰다.   환율 상승은 8일(현지 시각) 뉴욕 연방준비은행이 발표한 기대인플레이션(1년 후 소비자 물가 전망)이 3.2%로 나타나 달러 강세가 이어진 영향이 컸다. 기대인플레이션이 높게 유지되면 미 연방준비제도(Fed·연준)의 추가 기준금리 인하가 지연될 수 있어서다.  인베스팅닷컴에 따르면 주요 6개국 통화 대비 달러 가치를 나타내는 달러인덱스(DXY)는 이날 오후 4시 4분 기준 99.07로, 전날과 비슷한 수준을 유지했다. 전날 장중 98까지 떨어졌던 것과 달리 이날은 줄곧 99를 웃돌며 100선에 바짝 다가섰다.  엔화 약세도 원·달러 환율 상승을 부추겼다. 일본 아오모리현 앞바다에서 규모 7.6의 지진이 발생했다는 소식이 전해지면서 엔화 가치가 약세를 보였다. 지진 피해가 커질 경우 일본은행(BOJ)의 금리 인상이 지연될 수 있다는 전망이 영향을 준 것으로 풀이된다.  임환열 우리은행 연구원은 “달러 강세가 이어지는 가운데 엔화 약세까지 겹치며 환율이 소폭 올랐다”면서 “다만 고점 부담에 따른 매도세가 상단을 제한하면서 변동 폭은 크지 않았다”고 말했다. 그는 또 “미국 연방공개시장위원회(FOMC) 결과가 발표되는 11일(한국 시각)까지는 비슷한 흐름이 지속될 것”이라고 전망했다.",https://n.news.naver.com/mnews/article/366/0001129014
2025-12-09 15:31:00,"넥슨, ‘아크 레이더스’ 흥행에 “K게임 저력 입증…IP 성장 전략 강화”","아크 레이더스, 출시 12일 만에 400만장 돌파    넥슨은 신작 ‘아크 레이더스(ARC Raiders)’가 출시 12일 만에 전 세계 판매량이 400만장을 돌파했다고 9일 밝혔다. 넥슨은 아크 레이더스의 초기 흥행 성과를 지속해 차세대 지식재산권(IP)으로 키운다는 전략이다.  아크 레이더스는 넥슨 자회사 엠바크 스튜디오가 개발한 PvPvE(이용자간 대결, 이용자와 게임 환경의 대결) 익스트랙션 어드벤처 게임이다. 경쟁이 치열해 신규 게임이 두각을 드러내기 어려운 환경에서 아크 레이더스는 유료로 구매해야 한다는 점에서 진입장벽이 있었고, 장르도 상대적으로 하드코어하다는 평가를 받아 초기 흥행을 장담할 수 없었다. 그러나 아크 레이더스는 독창적인 아트 스타일과 세계관으로 관심을 모았고, 여러 차례 진행된 테스트를 통해 입소문을 타며 존재감을 키웠다고 회사 측은 설명했다.  정식 출시 직전 진행한 서버 슬램 테스트에서는 스팀 최고 동시접속자 19만명, 최다 플레이 4위를 기록했고 출시 이후에는 2주 만에 판매량 400만장, 동시접속자 최고 79만명을 달성했다. 스팀에서는 20만여개의 리뷰 중 89%가 긍정 평가를 남겼고, 글로벌 게임 평점 사이트 오픈크리틱(OpenCritic)에서는 비평가 추천 지표 90%를 획득했다.  넥슨 관계자는 “아크 레이더스는 신속한 업데이트와 이용자 소통을 기반으로 이용자 잔존율을 강화하고 있다”고 설명했다. 아크 레이더스는 출시 2주 만에 신규 맵 ‘스텔라 몬티스’를 포함한 대규모 업데이트 ‘노스 라인’을 선보였고 오는 12월에는 신규 환경과 콘텐츠를 담은 ‘콜드 스냅’ 업데이트를 진행할 예정이다. 그 결과 현재 스팀 기준 매일 30만명 이상의 동시접속자를 유지하고 있다고 회사 측은 설명했다.  나아가 출시 2주 만에 ‘더 게임 어워드(TGA)’에서 2025년 ‘최고의 멀티플레이어 게임(Best Multiplayer)’ 부문 후보에 올랐다. 한국 게임이 이 부문에 이름을 올린 것은 약 8년 만이다. 신규 IP 패키지 게임이 출시 한 달도 되지 않아 후보에 오른 것은 10년 만에 처음이다.  넥슨은 아크 레이더스의 성공을 이어가 글로벌 퍼블리싱 전략에도 박차를 가한다는 구상이다. 그간 넥슨은 개발팀과 스튜디오의 창의성을 존중하고 완성도를 강조한 장기 개발과 자율성 중심의 접근에 주력해왔다.  회사에 따르면 그 결과 민트로켓의 ‘데이브 더 다이버’는 글로벌 평가 사이트 메타크리틱에서 평점 90점을 기록하며 ‘머스트 플레이(Must Play)’ 게임으로 인정받았고, 엠바크 스튜디오의 ‘아크 레이더스’도 지금의 성과를 거둘 수 있었다. 이밖에도 넥슨은 좀비 콘셉트의 ‘낙원: LAST PARADISE’와 한국 전통 요소를 담은 ‘우치: 더 웨이페어러’ 등 새로운 IP 프로젝트를 가동 중이다.  넥슨은 기존 IP를 재해석하는 작업도 진행 중이다. 올해는 넥슨 인기 IP를 기반으로 새롭게 재해석한 타이틀 ‘퍼스트 버서커: 카잔’과 ‘메이플 키우기’ 그리고 2025년 대한민국 게임대상을 수상한 ‘마비노기 모바일’을 선보였다. 특히, ‘메이플 키우기’는 3주 넘게 국내 모바일 양대 마켓 1위를 유지하고 있다. 대만과 싱가폴 앱스토어에서도 1위를 달성하고 북미 시장에서도 견고한 성적을 내고 있다.  넥슨 관계자는 “앞으로도 신규 IP와 기존 IP를 아우르며 장기적인 관점에서 투자해 글로벌 퍼블리셔로서 존재감을 확대하고, 나아가 K-게임의 글로벌 경쟁력 강화에도 힘쓰겠다”고 말했다.",https://n.news.naver.com/mnews/article/366/0001129013
2025-12-09 15:30:00,"개미들, 12월 코스닥으로 몰려간다…지난달 4801억 순매도→이달 662억 순매수 급반전","개인, 12월 초 코스닥 주식·ETF 3000억원 순매수 美 금리 인하·정책 기대감이 상승 동력… “세부 정책 현실화 필요”   국내 개인 투자자들이 12월 들어 코스닥 시장에서 뚜렷한 매수세를 보이고 있다. 최근 6거래일 동안 개인은 코스닥 지수 상승에 베팅하는 상장지수펀드(ETF)만 2400억원 넘게 사들였다. 미국 기준금리 인하 기대와 정부의 코스닥 활성화 정책 발표 임박이 맞물리며 투자 심리가 급반전한 것으로 풀이된다.  9일 코스콤 체크에 따르면 이달(1~8일) 개인 순매수 상위 1~5위 안에 ‘KODEX 코스닥150 레버리지’와 ‘KODEX 코스닥150’ 등 코스닥 지수 추종 ETF가 올랐다. 총 순매수 규모는 2400억원에 달한다. 지난달까지만 해도 개인 순매수 상위는 ‘KODEX 200’, ‘TIGER 미국 S&P500’ 등 코스피·미국 증시 중심이었던 것과 극명히 대비된다.  개별 종목으로도 개인은 이달 코스닥에서 662억원어치를 순매수하며 지난달 4801억원 순매도에서 급전환했다. 알테오젠(코스피 이전 상장 호재, 3389억원)을 제외해도 에임드바이오(959억원), 지투지바이오(820억원), 펩트론(707억원), 에이비엘바이오(610억원) 등 바이오주와 AI 경량화 기업 노타(830억원)를 집중 매수했다.  이 같은 매수세에 힘입어 지난 4일 코스닥 시가총액은 장중 500조원을 돌파했다. 지난달 말 880선이었던 코스닥 지수는 전날 927.79로 단기간 5% 이상 상승했다.  시장에서는 이달 말부터 정부가 코스닥 대규모 활성화 대책을 내놓을 것이란 기대가 매수세를 부추긴 것으로 보고 있다. 실제 정부는 이미 증권사의 종합투자계좌(IMA) 자금 25%를 벤처·모험자본에 투입하도록 의무화한 바 있고, 오는 10일부터 AI·반도체·바이오·로봇 등 첨단 산업에 투자하는 150조원 규모 국민성장펀드가 본격 출범한다. 해당 자금이 코스닥으로 유입될 가능성이 높다.  여기에 미국 연준이 오는 10일(현지시각) 기준금리를 인하할 확률이 87.2%(CME 페드워치 기준)로 높아진 점도 코스닥에 호재로 작용하고 있다.  하인환 KB증권 연구원은 “12월 정부 정책 발표 시점과 맞물려 연준 금리 인하 시점이 맞물리게 되는 상황으로, 코스피 시장도 전망이 좋지만 코스닥 시장이 그간 소외돼 있던 터라 더 주목받을 것”이라고 말했다.  연초 미국 라스베이거스에서 열리는 세계 최대 IT·가전 전시회 CES와 JP모건 헬스케어 콘퍼런스에 참여하는 기업들에 대한 기대감도 있다. 하 연구원은 “CES 등에서 새로운 기술이 통상 발표되는 만큼 관련 종목의 주가 상승으로 이어지는 흐름이 있다”고 했다.  다만 정책 세부안이 아직 나오지 않아 최근의 코스닥 급등세가 과도한 기대감일 수 있다는 의견이 제기된다. 앞서 금융위원회는 지난 4일 ‘코스닥시장 경쟁력 강화 방안’을 발표할 예정이었지만 별도의 공지 없이 취소한 바 있다.  박기훈 한국투자증권 연구원은 “금융위가 아직 세부안 확정을 해주지는 않아서 기대감만 있는 상황”이라며 “정책의 세부 내용에 따라서 수혜주 선별 과정이 일어나면서 지수가 다시 움직이거나 실망 매물이 나오는 등 결정이 될 것”이라고 했다.",https://n.news.naver.com/mnews/article/366/0001129012
