날짜,제목,본문,링크
2025-12-09 14:01:00,양상추·고등어 이어 방어… 치솟는 밥상 물가에 유통街 ‘비상’,"방어 시세 25%↑…높은 수온 등 영향 산지 다변화·통합 매입으로 가격 방어 고등어·양상추도 ‘금값’… 대체제 공급  밥상에 자주 오르는 식품 가격이 치솟으면서 유통업계는 수급 불안을 최소화하기 위한 대책 마련에 분주하다. 기후 변화로 전반적인 생산량이 줄어든 데다 국내산을 대체하던 수입산 가격마저 환율 상승(원화 가치 하락)으로 급등한 탓이다.  9일 관련 업계에 따르면 이마트는 지난 5~7일 방어회(360g)를 2만4900원(신세계포인트 및 행사카드 결제 시 50% 할인 적용)에 판매했다. 이는 지난해 겨울철 판매가(360g, 2만9960원)보다 17% 저렴한 수준이다.   최근 방어 가격이 급등하는 가운데 선제 투자, 산지 다변화를 통해 인상 폭을 최대한 억제했다는 게 이마트 측의 설명이다. 한 해 전부터 방어 치어(새끼)를 확보한 것은 물론 거제·통영 등 여러 양식장에서 물량을 나눠 확보했다. 트레이더스 등과 통합 매입에 나선 것도 가격 방어 효과로 이어졌다.  이마트 관계자는 “이마트, 트레이더스, 에브리데이까지 세 개의 채널을 합쳐 매입을 진행하면 절대적인 물량이 늘어나기 때문에 가격이 낮아진다”며 “방어뿐 아니라 소고기 등 가격 변동성이 큰 신선식품에 자주 활용하는 전략”이라고 설명했다.  올해 높은 수온, 적조 등 이상 기후 여파로 방어 생육이 늦어지면서 시세는 지난해보다 약 30% 상승했다. 수협 노량진수산시장의 ‘주간수산물동향’에 따르면 지난달 방어는 경매시장에서 ㎏당 평균 2만3406원에 거래됐다. 지난해 같은 기간(1만8767원)과 비교하면 약 25% 올랐다.  국민 생선으로 불리는 고등어는 수급 불안으로 가격이 뛰면서 아예 다른 어종으로 대체됐다. GS샵은 고등어를 볼락으로 대체한 상품을 출시했고, 롯데마트는 고등어 비축 물량을 확대해 할인 행사를 진행하는 한편, 고등어처럼 구이·조림 등 활용도가 높은 삼치를 대체 품목으로 내세웠다.   어획량이 줄어 비싸진 국산 고등어를 대신하던 노르웨이산 고등어 역시 수온 상승과 현지 어획량 제한, 고환율이 겹쳐 가격이 급등했다. 한국해양수산개발원(KMI) 수산업관측센터에 따르면 지난달 신선냉장 고등어 소비자가격은 ㎏당 1만2077원으로 전년 대비 3.1%, 최근 5년 평균 대비 11.3% 상승했다.  햄버거·샌드위치 등 프랜차이즈 업계는 핵심 재료인 양상추 수급 차질로 대체 채소를 제공하거나, 아예 공급을 중단했다. 롯데리아는 햄버거에 양상추와 양배추를 혼용하고 있고, 써브웨이는 양상추가 필수로 들어가는 샐러드 판매를 잠정 중단했다.  지난달보다는 안정세를 찾았지만, 지난해나 평년과 비교하면 양상추 가격은 여전히 높은 편이다. 한국농수산식품유통공사(aT) 도매 유통정보시스템에 따르면 12월 초순 기준 전국 도매시장의 양상추(고품) 가격은 ㎏당 4735원으로 전년 대비 25%, 평년 대비 103% 높은 수준이다.  식품 물가는 5년 새 30% 가까이 상승했다. 국가데이터처 국가통계포털(KOSIS)에 따르면 지난달 식품 물가지수는 127.1(2020년=100)로 5년 전보다 27.1% 상승했다. 같은 기간 전체 소비자물가지수(17.2%), 생활물가지수(20.4%) 상승폭을 모두 웃도는 수준이다.",https://n.news.naver.com/mnews/article/366/0001128961
2025-12-09 14:01:00,한은 “가계대출 줄이고 기업대출 늘리면 장기 성장률 0.2%P 올라”,"가계에 집중된 대출이 기업으로 흘러가면 우리나라의 장기 경제성장률이 0.2%포인트(p) 높아진다는 분석이 나왔다.  한국은행은 9일 이 같은 내용을 담은 ‘생산 부문으로의 자금 흐름 전환과 성장 활력’ 보고서를 발간했다. 보고서는 한국은행 경제연구원 금융통화연구실 소속 황인도 실장과 장훈 가장, 김우석 조사역이 작성했다.   연구진에 따르면 우리나라 전체 민간신용(가계신용+기업신용)에서 생산 부문인 기업신용 비중은 지속적으로 감소해 왔다. 1975년 약 80%에 달했던 기업신용 비중은 2020년 53.4%까지 하락했다. 민간신용은 가계와 기업이 금융기관이나 다른 민간 부문으로부터 빌린 돈(대출) 또는 외상 거래(판매 신용)을 합한 개념이다.  연구진이 1975년부터 작년까지 43개국 자료를 분석한 결과, 민간신용 규모가 같더라도 기업신용의 비중이 높을수록 장기 성장률이 뚜렷하게 개선되는 것으로 나타났다. 생산과 연관성이 낮은 가계신용과 달리, 기업신용은 투자 확대와 생산성 제고를 통해 성장에 직접 기여하기 때문이라는 설명이다.  이를 토대로 연구진이 추가 분석을 한 결과, 민간신용 규모가 동일한 상태에서 국내총생산(GDP) 대비 가계신용을 90.1%에서 80.1%로 줄이고 기업신용을 늘릴 경우 장기 성장률이 약 0.2%p 오르는 것으로 나타났다. 예컨대 연평균 1.9% 성장하는 경제가 있다면, 신용 재배분으로 성장률이 2.1%로 높아진다는 의미다.  연구진은 “비생산 부문에서 생산 부문으로 자금 흐름을 전환해 경제성장률을 높이기 위해서는 금융기관의 대출 인센티브 구조를 조정해야 한다”고 조언했다.",https://n.news.naver.com/mnews/article/366/0001128960
2025-12-09 14:00:00,"성상욱 전 천안지청창, 로백스 대표변호사로 합류","성상욱(사법연수원 32기) 전 천안지청장이 법무법인 로백스의 대표변호사로 합류했다.  9일 로백스에 따르면, 성 변호사는 부산 배정고와 서울대 법대를 졸업하고 같은 대학교 대학원 법학과를 수료했다. 2003년 수원지검 검사로 임관해 울산지검·창원지검 특수부·인천지검 강력부·서울중앙지검 금융조사부 검사, 청주지검 부부장검사, 광주지검 장흥지청장, 의정부지검 고양지청·서울중앙지검 부장검사, 서울동부지검 차장검사 등을 역임했다.  2019년 대검 수사정보2담당관을 지냈고 2025년 8월 사의를 표명한 뒤 지난달 변호사로 개업했다.  김기동 대표변호사는 “풍부한 수사 경험과 경제·기업 분야에 대한 깊은 이해를 갖춘 성상욱 대표변호사 합류로 로백스의 전문 역량이 한층 강화될 것”이라며 “기업·금융·첨단(IT) 분야 특화 로펌으로서 수준 높은 법률서비스를 제공하는 데 큰 시너지가 기대된다”고 말했다.",https://n.news.naver.com/mnews/article/366/0001128959
2025-12-09 13:59:00,동양고속 20억원 손절한 2대 주주… 팔자마자 상한가 행진,"5년 물려있던 동대구화물, 주가 급등에 서둘러 손절 매도 직후 동양고속 4연상 행진… 차익 기회 놓쳐  코스피 상장사 동양고속의 2대 주주였던 주식회사 코리아와이드동대구화물(이하 동대구화물)이 최근 보유 지분을 전량 처분한 것으로 나타났다. 이번 매도로 동대구화물은 20억원 넘게 손실을 봤다. 회사는 서울고속버스터미널 재개발 이슈로 주가가 오르던 초기 동양고속 지분을 팔았는데, 만약 계속 보유하고 있었다면 3억원 이상의 추가 수익이 발생할 수 있었다.   동대구화물은 지난 2020년 10월부터 동양고속 지분을 7.85%(22만7181주) 보유했다. 1주당 평균 2만6428원으로, 약 60억원 규모다. 이후 지분 변동이 없다가 지난달 26~28일 사흘에 걸쳐 1주당 평균 1만7268원에 장내 매도해 약 39억원을 회수했다. 결과적으로 약 20억8000만원의 손실을 봤다.  이 지분은 노헌영 경북고속 부회장과 관계사들이 2020년 지분 보유 주체를 동대구화물로 변경하며 공시상 양도 형태로 정리된 물량이다. 노헌영 부회장은 2012년 코리아와이드대화교통, 코리아와이드진안고속 등 관계사들과 동양고속 지분을 5.81% 사들이며 5대 주주로 이름을 처음 올렸다. 단순 투자 목적이었고 이후 주식배당, 무상증자 등으로 지분이 늘었다.  동대구화물의 현재 최대 주주는 지분 73.39%를 가진 주식회사 코리아와이드다. 동양고속 주가는 2020년 2만6000원대에서 올해 4월 6560원까지 줄곧 하락했다. 2020년 이후 지난해까지 5년 연속 적자를 냈다. 동대구화물은 이 때문에 동양고속에 5년 넘게 물려있던 상황이었다.  그런데 지난달 26일 서울시가 서초구 서울고속버스터미널 부지 복합개발과 관련해 사전 협상에 착수한다고 하면서 서울고속버스터미널 지분 0.17%를 보유한 동양고속이 수혜주로 주목받았다. 주가는 단숨에 1만7000원을 넘기며 급등했고, 동대구화물은 빠르게 지분 처리에 나선 것으로 보인다.  하지만 동양고속의 주가는 이달 2일부터 5일까지 거래가 정지된 4일을 제외하고 3거래일 연속 상한가를 기록하며 2만7750원까지 치솟았다. 이후 투자위험종목으로 지정되며 하루 매매거래가 정지됐지만, 9일 거래 재개 후 3만6050원까지 오르며 상한가를 재차 찍었다.  동대구화물은 전 거래일 종가로만 팔았어도 3억원 이상의 차익을 볼 수 있었다. 하지만 주가 상승 초기에 서둘러 지분을 정리한 탓에 결과적으로 수익 실현에 실패했다는 평가가 나온다.",https://n.news.naver.com/mnews/article/366/0001128958
2025-12-09 13:58:00,바디프랜드 ‘팔콘2026’ 출시…누워서 마사지 받는다,"바디프랜드는 팔콘의 기능과 편의, 디자인을 개선한 헬스케어로봇 ‘팔콘2026’을 선보인다고 9일 밝혔다.  팔콘2026은 앉은 자세에서만 가능했던 마사지와 스트레칭을 누운 자세에서도 받을 수 있도록 변화를 줬다. 각도도 최대 155도까지 조정할 수 있다. 누운 자세에서도 허벅지·엉덩이·하체 전반을 포함한 전신의 마사지와 스트레칭을 받을 수 있는 기능을 추가했다.  온열 기능도 한 단계 더 강화했다. 온열이 최대 섭씨 60도까지 올라가고, 3단계 온열 시스템으로 겨울철이나 장시간 근육 긴장 상태에서도 몸의 중심부를 데워준다. 뭉친 근육도 빠르고 부드럽게 이완되고, 마사지 효과도 배가된다.  마사지 프로그램 역시 28개에서 깊은 수면과 낮잠, 고요한 밤 등 숙면을 위한 기능을 추가했다.  바디프랜드 관계자는 “팔콘2026은 좁은 공간에 최적화돼 있으면서도 상위 모델에서만 가능했던 기술을 중저가 라인업에서 구현됐다”며 “진보한 헬스케어로봇 경험을 일상에서 합리적인 가격으로 누려볼 수 있다”고 말했다.",https://n.news.naver.com/mnews/article/366/0001128957
2025-12-09 13:54:00,"HS효성, 김규영 신임 회장 선임…첫 전문경영인 출신","HS효성이 김규영 신임 회장 선임을 포함한 2026년 정기 임원 인사를 9일 단행했다.  HS효성은 이번 인사에서 김규영 전 효성그룹 부회장을 HS효성그룹의 회장으로 선임했다. 송성진 트랜스월드 PU장과 양정규 HS효성인포메이션시스템㈜ 대표이사 전무를 각각 부사장으로 승진시키고, 신규 임원 2명을 선임하는 등 총 10명의 임원 인사를 발표했다.   회사 관계자는 김 회장 선임에 대해 “‘HS효성 가족들이 가장 소중한 자산이고, 누구든 역량을 갖추면 그룹의 회장이 될 수 있다’는 조현상 부회장의 평소 지론을 반영했다”고 밝혔다.   이번 인사는 ▲기술과 품질을 바탕으로 한 가치 경영을 이끌어 갈 인재 ▲실적주의에 따라 회사 성장에 기여한 인사 ▲다양성에 기초한 인재 발굴 및 육성이라는 발탁 기준에 따라 이뤄졌다.  김규영 신임 회장은 1972년 효성그룹의 모태 기업인 동양나이론에 신입사원으로 입사해 언양공장장, 안양공장장, 중국 총괄 사장, 효성그룹 CTO 및 기술원장을 역임했다. 스판덱스 개발을 포함한 섬유 기술 확립과 기술 품질 향상에 기여했고, 2017년부터 8년간 효성그룹 지주사 대표이사를 역임한 바 있다.  송성진 부사장은 현대 경영의 중요한 화두인 공급망 안정화와 물류 사업을 도맡아 HS효성그룹의 도약에 기여하고 있다. 양정규 부사장은 HS효성의 주요 사업군 중 하나인 AI/DX 사업을 선도하며 다년간 실적을 내왔다.   기획 관리 부문에서는 박창범 상무보가 신임 임원으로 발탁됐다. 박 상무보는 HS효성그룹 출범 후 시작된 인재 육성 및 조직 문화 개선 작업을 이끌 예정이다.   신규 여성 임원으로는 정유조 상무보가 발탁됐다. 정 상무보는 효성그룹 공채 출신으로 경영기획팀, ESG경영팀, 신사업팀 등을 거친 기획통이다. 다음은 전체 인사.  <임원 선임 및 승진 명단>  <㈜HS효성>  ◇회장  ▲김규영 ㈜HS효성 부회장  ◇부사장  ▲송성진 트랜스월드PU장  ◇상무보  ▲박창범 지원본부 인사총무팀장  <HS효성첨단소재㈜>  ◇전무  ▲이태정 타이어보강재PU 섬유영업 담당 상무  ◇상무  ▲천병호 중국 가흥 화섬법인 동사장 ▲손판규 베트남 관리본부 담당 상무보  ◇상무보  ▲정유조 미래전략실 신사업1팀장  <HS효성인포메이션시스템㈜>  ◇부사장  ▲양정규 대표이사  ◇전무  ▲양천봉 HIS PU 전략기획본부장 ▲이정걸 HIS PU 금융본부장",https://n.news.naver.com/mnews/article/366/0001128956
2025-12-09 13:53:00,컨츄리꼬꼬 탁재훈·신정환 유튜브 ‘노빠꾸 탁재훈’서 8년 만에 재회,2인조 그룹 컨츄리꼬꼬로 활동했던 가수 탁재훈과 신정환이 재회한다.  9일 방송가에 따르면 신정환은 최근 탁재훈이 운영하는 유튜브 채널 ‘노빠꾸 탁재훈’ 촬영에 게스트로 참여했다.  두 사람이 함께 촬영에 나서는 건 지난 2017년 Mnet 예능 프로그램 ‘프로젝트 S: 악마의 재능기부’ 이후 8년 만이다.  과거 컨츄리꼬꼬로 활동했던 두 사람은 오랜만에 선 카메라 앞에서 추억을 나누고 근황을 공유하는 등 솔직하고 유쾌한 대화를 나눈 것으로 전해졌다.  신정환은 지난 2010년 해외 원정 도박 혐의로 실형을 선고받고 방송 활동을 잠정 중단했다. 이후 2017년 방송가에 복귀했지만 활발한 활동을 이어가지 못했다.  신정환은 최근 진행된 한 인터뷰에서 신규 웹예능을 준비 중이라고 밝히며 “‘노빠꾸 탁재훈’을 따라잡을 것”이라는 포부를 밝히기도 했다.  신정환과 탁재훈의 재회는 오는 17일 노빠꾸 탁재훈에 공개될 예정인 것으로 알려졌다.,https://n.news.naver.com/mnews/article/366/0001128955
2025-12-09 13:47:00,"SSG닷컴, 새 맴버십 ‘쓱세븐클럽’ 출시… 7% 적립·티빙 제휴","SSG닷컴(쓱닷컴)이 신규 유료 멤버십 ‘쓱세븐클럽’을 내년 1월 초 출시할 예정이라고 9일 밝혔다. 업계 최고 수준인 ‘7% 적립’ 혜택과 ‘티빙 온라인동영상서비스(OTT)’를 함께 누릴 수 있는 것이 특징이다.  새 멤버십 핵심은 ‘장보기 결제 금액 7% 고정 적립’이다. 쓱배송(주간·새벽·트레이더스) 상품 구매 시 쓱머니로 자동 적립돼 쓱닷컴에서 사용 가능하다. 이마트, 신세계백화점, 스타벅스 등 신세계그룹 관계사를 비롯한 다양한 사용처에서도 쓸 수 있다.   또한 티빙과 제휴를 통해 드라마, 예능, 프로야구(KBO리그), 프로농구(KBL리그) 등 스포츠 중계 등 콘텐츠를 즐길 수도 있다. 다만, 기본 혜택에 일괄 포함시키지 않고, 고객이 자율적으로 선택하는 옵션으로 구성된다. 신세계백화점몰, 신세계몰 상품 할인 쿠폰도 제공될 예정이다.  쓱닷컴은 새 멤버십을 기반으로 쓱닷컴 고객 유입에 속도가 붙을 것으로 내다봤다. 지난달 29일부터 이달 7일까지 쓱닷컴 일평균 신규 방문자 수는 전년동기대비 120%, 일 평균 방문자 수는 15% 증가했다.  이명근 쓱닷컴 영업본부장은 “압도적인 장보기 적립에 OTT 서비스까지 더해 체감 혜택을 높이고자 한다”며 “고객 만족도를 높이기 위해 다양한 추가 혜택을 준비하고 있다”고 말했다.",https://n.news.naver.com/mnews/article/366/0001128954
2025-12-09 13:43:00,"미 FCC, 차이나모바일·차이나텔레콤·유니콤에 RMD 인증 시정 요구","미국 연방통신위원회(FCC)가 중국 통신사들을 상대로 ‘자동전화 완화 데이터베이스(RMD)’ 관련 인증 결함을 시정하라며, 이를 따르지 않을 경우 미국 통신망에서 사실상 퇴출할 수 있다고 경고했다. RMD는 미국 내 통신 사업자들이 불법 로보콜·스팸 전화를 줄이기 위한 자구 노력을 등록·증명하는 데이터베이스로, 다른 사업자들이 이를 참조해 특정 사업자로부터 들어오는 불법 트래픽을 차단할 수 있도록 하는 제도다.  미 언론 등에 따르면 FCC 집행국(EB)은 8일(현지시각) 차이나모바일, 차이나텔레콤, 차이나유니콤 등 중국 통신사 3곳에 명령서를 보내 RMD 인증상의 결함을 시정하고, 그 결과를 통보하라고 요구했다.  EB는 명령서에서 이들 통신사에 대해 “RMD 인증 내 결함을 시정했는지 보고하거나, 왜 자신들의 인증이 RMD에서 제외돼선 안 되는지 설명하라”고 밝혔다. 또 이들 회사를 RMD에 포함시키는 것이 “공익에 반하지 않는 이유”도 함께 제시하라고 요구했다. 답변 제출 기한은 14일이다.  FCC는 이번 명령서에서 관련 인증이 취소될 경우 “모든 중간 공급자와 음성 서비스 제공 사업자는 북미전화번호계획(NANP)을 사용하는 번호를 통해 해당 통신사에서 걸려오는 전화를 수신하지 말아야 한다”고 명시했다. 사실상 중국 통신사들을 경유해 미국으로 발신되는 일반 음성통화를 전면 차단할 수 있다는 뜻이다. 업계는 이번 RMD 인증 시정 명령은 중국 통신사의 미국 통신망 접근을 추가로 제한할 수 있는 조치로 보고 있다.  FCC는 중국 통신사의 미국 내 활동을 안보 리스크로 보고 규제를 강화해 왔다. 2019년에는 차이나모바일의 미국 내 통신서비스 제공 허가 신청을 국가 안보 위험을 이유로 불허했다. 2021~2022년에는 차이나유니콤, 퍼시픽네트웍스 및 자회사 컴넷, 차이나텔레콤 아메리카의 미국 영업 허가를 잇따라 취소한 바 있다.",https://n.news.naver.com/mnews/article/366/0001128953
2025-12-09 13:43:00,"‘KBO 고교 대어’ 키움 박준현, ‘괴롭힘·따돌림’ 학폭 행위 인정","올해 한국프로야구(KBO) 신인 드래프트 전체 1순위로 지명된 충남 천안북일고 투수 박준현군의 학폭 행위가 인정됐다. 당초 ‘학폭 아님’ 처분 결과를 받았지만 뒤집혔다.  9일 충남교육청 행정심판위원회는 천안교육지원청이 박군에게 내렸던 학폭 아님 처분을 취소하고 학폭 행위로 인정한 뒤 1호 처분인 서면사과 명령을 결정했다고 9일 밝혔다.  위원회에 따르면 위원들은 박군이 피해자인 같은 학교 야구부 선수 A군에게 한 욕설 등이 정신적 피해를 입힐 수 있는 학폭 행위로 볼 수 있다고 판단했다.  앞서 A군은 지난 5월 박군에게 괴롭힘과 따돌림 등을 당했다고 주장, 박군을 학폭 가해자로 신고했다. 최초 천안교육지원청 학교폭력대책심의위원회는 학폭 아님을 처분했다.  박군은 앞서 KBO 신인 드래프트에서 키움 히어로즈에 1라운드 1순위 지명을 받았다. 박준현은 신인 드래프트를 앞두고 KBO 사무국에 드래프트 신청서와 함께 학폭에 연루한 사실이 없다는 서약서, 생활기록부를 제출했다.  키움은 심의위원회에서 나온 처분을 존중한다는 입장과 함께 박준현을 전체 1순위로 지명했다. 박준현은 지명 후 학폭 혐의에 대해 “제가 떳떳하기 때문에 별로 신경 쓰지 않았다”며 “야구도 야구지만, 인성이 먼저인 선수가 되고 싶다”고 말했다.  박군과 A군 측이 이번 위원회 결정에 불복하면 행정소송으로 이어질 가능성도 있는 것으로 전해졌다.",https://n.news.naver.com/mnews/article/366/0001128952
2025-12-09 13:41:00,"한양증권, 상장지수펀드 AP·LP 업무 개시","한양증권은 상장지수펀드(ETF)의 지정참가회사(AP)와 유동성공급자(LP) 업무를 시작한다고 9일 밝혔다.  ETF AP·LP 업무는 한국거래소 상장 ETF의 설정·해지와 매수·매도 호가 제공을 통해 유동성을 공급하는 기능으로, ETF 가격 안정과 투자자 거래 접근성을 높이는 역할을 한다.  한양증권은 지난 11월 한국거래소와 유동성공급 계약을 체결했으며, 현재 60여 개 ETF를 대상으로 각 운용사들과의 LP 계약을 완료했다. 향후 40여 개 종목을 추가해 총 110개 ETF에 대한 LP 업무를 수행할 계획이라고 설명했다.  아울러 운용사와의 협업을 기반으로 AP 업무도 함께 수행한다. AP는 ETF의 설정·해지를 통해 시장 수급을 조절하는 기능으로 LP와 함께 ETF 인프라를 구성하는 핵심 요소다.  이규진 한양증권 멀티솔루션센터장은 “이번 ETF AP·LP 업무 시작은 한양증권이 마켓 인프라 영역으로 사업 기반을 확장했다는 데 의미가 있다”며 “ETF 시장의 근간을 이루는 유동성 공급 체계에 참여함으로써 수요가 높은 ETF를 중심으로 라인업을 확대해 상품 경쟁력 강화와 고객 서비스 차별화에 나서겠다”고 말했다.  한양증권은 ETF AP·LP 업무를 통해 ▲ETF 유동성 공급 경험 ▲호가 관리 역량 ▲트레이딩 시스템 구축 등 향후 시장조성자(MM) 진입에 필요한 기반을 단계적으로 확보해 나갈 수 있을 것으로 보고 있다.",https://n.news.naver.com/mnews/article/366/0001128951
