날짜,제목,본문,링크
2025-12-06 09:00:00,"[청기홍기]인적분할 삼바 '재평가 사이클'…""목표가 200만원' 대세","이번주 증권가는 삼성바이오로직스를 비롯한 주요 바이오 기업들의 목표주가를 일제히 상향 조정했다. 특히 삼성바이오로직스가 삼성에피홀딩스와 인적분할하면서 위탁개발생산(CDMO)을 맡은 삼성바이오로직스의 재평가 가능성이 커졌다는 평가다.  바이오주, 분할 효과·수주 확대에 '상향 릴레이'  삼성바이오로직스와 삼성에피스홀딩스는 지난달 24일 65대 35 비율로 인적분할 후 재상장됐다. 삼성바이오로직스는 위탁개발생산(CDMO), 삼성바이오에피스는 바이오시밀러 사업을 한다. 삼성바이오에피스는 신설 지주회사인 삼성에피스홀딩스 산하 100% 자회사로 편입됐다.  증권가에서는 삼성바이오로직스의 CDMO 사업 가치가 높아질 것으로 전망했다. 삼성바이오로직스의 올해 위탁생산(CMO) 신규 계약만 38억 달러(5조5700억원)에 달한다. 또 기존 제1바이오캠퍼스(1~4공장)에 이어 지난 4월 5공장이 준공되면서 생산능력 확대가 기대된다는 평가다.  서근희 삼성증권 연구원은 삼성바이오로직스 목표가를 125만원에서 200만원으로 올리면서 ""인적분할에 따라 감소한 주식수를 반영하고 실적 추정치를 상향 조정했다""고 말했다. 그는 이어 ""삼성바이오로직스는 전 세계 최대 규모의 항체의약품 생산능력(CAPA)을 기반으로 CMO 업계 1위로 자리매김했다""며 ""4공장 풀가동, 5공장 가동률 상승에 이어 6공장까지 논의되는 확장 사이클에 따라 향후 실적 가시성을 높은 수준으로 확보했다""고 평가했다.  이지수 다올투자증권 연구원도 삼성바이오로직스 목표가를 130만원에서 230만원으로 상향했다. 그는 ""4공장 풀가동과 원·달러 환율 상승 효과로 견조한 실적 흐름이 지속될 전망""이라며 ""2026년부터 5공장 매출이 발생되며 성장 모멘텀이 강화될 것으로 예상되고, 연내 6공장 착공 가능성도 열려 있다""고 말했다.  정유경 신영증권 연구원도 삼성바이오로직스 목표가를 140만원에서 210만원으로 올리면서 ""CDMO의 영업이익률이 40%대인 반면 바이오시밀러 사업의 영업이익률은 20%대""라며 ""인적분할에 따라 영업이익률 희석이 사라지면서 순수한 CDMO 기업으로서 성장성과 수익성을 평가받을 수 있을 것""이라고 강조했다.  서미화 미래에셋증권 연구원은 에스티팜 목표가를 12만5000원에서 16만원으로 올렸다. 서 연구원은 ""지난해 12월 미국 식품의약국(FDA) 승인을 받은 가족성 킬로미크론혈증(FCS) 치료제의 매출이 예상보다 빠르게 성장하고 있다""며 ""또 에스티팜은 같은 약물로 고중성지방혈증 적응증에 대해 FDA로부터 혁신 치료제 지정을 받았다""고 말했다. 그러면서 ""FDA 승인 및 매출 증가에 따른 수주 확대가 기대된다""고 덧붙였다.  서근희 삼성증권 연구원도 에스티팜 목표가를 13만원에서 15만원으로 올리면서 ""원·달러 환율 상승 효과가 수주 확대에 따른 가동률 상승을 반영했다""고 말했다.  그 외 삼성증권은 유한양행 목표가를 14만원에서 16만원으로, 대신증권은 한미약품 목표가를 50만원에서 56만원으로, 삼성증권은 한미약품 목표가를 40만원에서 55만원으로 올려 잡았다.  조선·해운주는 부담 가중…HD현대중공업·HMM 목표가↓  강경태 한국투자증권 연구원은 HD현대중공업 목표가를 73만원에서 71만원으로 내려 잡았다.  미국 시장 진출 가치와 HD현대미포와의 합병 효과를 재산정하는 과정에서 밸류에이션 부담을 반영한 조치다. HD현대중공업과 HD현대미포는 지난 1일 합병 절차를 완료했다.  강 연구원은 ""HD현대중공업의 적정 기업가치(74조1000억원)를 합병 신주 1619만 주를 가산한 유통주식 수로 나눠 계산했다""며 ""산출한 적정 기업가치의 내재 주가순자산비율(PBR)은 6.4배인데, 이는 조선 슈퍼사이클 고점(3.0배)보다 2배 이상(114% 할증) 높다""고 말했다.  실적 추정치는 현재 컨센서스에 부합한다는 평가다. 강 연구원은 ""HD현대미포와의 합병을 반영한 결과 HD현대중공업의 내년 연결 매출액은 전년 대비 37.9% 증가한 23조8480억원, 영업이익은 64.8% 증가한 3조5091억원으로 추정한다""고 말했다.  그는 이어 ""아직 시장 컨센서스가 조정되지 않았기 때문에 단순 비교는 무의미하다""며 ""합병 효과를 제외한 추정치는 현재 컨센서스에 부합한 수준""이라고 말했다.  김영호 삼성증권 연구원은 ""공급 부담이 가중되고 있다""며 해상운송사(해운사)인 HMM 목표가를 2만2000원에서 2만원으로 내렸다. 수에즈 운하 통항 제한 여파로 단기적으로는 운임을 방어하고 있지만, 컨테이너 운임 지수(가격)는 이미 하락 조정 국면에 들어갔다는 설명이다. 김 연구원은 ""새로운 선박 발주량이 전 세계 선복량의 30%에 달하면서 증가하는 공급 능력이 부담스러운 상황""이라고 말했다. 앞으로 시장에 쏟아질 해운 공급량이 운임에 부담을 줄 것이라는 분석이다.  김 연구원은 이어 ""국제해사기구(IMO)의 온실가스 감축 중기 조치 도입이 지연되면서 고령선의 폐선 사이클도 미뤄질 것""이라며 ""공급이 수요를 웃도는 상황이 불가피하다""고 전망했다.",https://n.news.naver.com/mnews/article/648/0000042448
2025-12-06 08:17:00,찬 바람 속 서울 관망세? 한강벨트는 '딴 세상',"서울 아파트값 상승폭이 2주 연속 줄면서 전반적으론 '관망세'에 들어섰다는 분석이 나와요. 하지만 강남 3구(서초·송파·강남)와 강동을 비롯해 용산, 동작 등 강남권과 한강벨트 주요지역은 여전히 서울 평균을 훌쩍 뛰어넘는 상승률을 기록하고 있어요. 마치 딴 세상 얘기처럼요.   경기도 역시 과천과 광명 등 규제지역(조정대상지역·투기과열지구·토지거래허가구역)으로 묶인 곳들에서도 매매가가 급등하는 모습을 보이고 있어요. 규제에 따른 풍선효과를 기대했던 외곽지역에서는 상승폭이 둔화하며 다시 양극화가 심해지는 모습이에요.   '한강벨트'는 딴 세상   한국부동산원은 12월 첫째 주(1일 기준) 서울 아파트 매매가격이 전주 대비 0.17% 상승했다고 밝혔어요. 지난주(0.18%)와 비교하면 상승폭이 다소 줄었는데요. 11월17일 0.20% 이후 2주 연속 상승폭이 줄었어요.   대부분의 자치구에서 상승폭이 줄어든 반면, 일부 지역에선 오름폭이 커졌어요. 특히 용산은 전주 대비 0.35% 오르며 지난주 상승률(0.34%)보다 0.01%포인트 상승폭을 키웠고요. 송파(0.33%)와 동작(0.31%), 강동(0.30%)도 통상 '급등' 수준으로 보는 주간 매매가 0.3% 상승률을 넘어섰어요. 서울 평균 상승률의 약 2배가량이에요.   이른바 강남 주변 '한강벨트'의 상승이 여전히 두드러지는 모습인데요. 특히 송파와 성동은 올해 연간 상승률이 각각 19.38%, 17.63%에 달해요. 10억원짜리 집이 1년도 못 돼 약 12억원이 됐다는 얘기예요.   강남구의 한 공인중개업소 관계자는 ""매매시장이 가격 상승 흐름을 유지하면서도 실수요 중심의 선별적 매수가 이어지고 있다""면서 ""관망 기조 속에서도 입지와 상품성이 검증된 단지들에 대한 매수 문의는 끊이지 않고 있다""고 말했어요.  과천·광명은 '폭등' 구리·화성은 '시들'  경기지역은 0.07% 상승하며 전주(0.08%) 대비 상승폭이 줄었는데요. 오히려 규제지역으로 묶인 곳들에서 급등 현상을 보였어요.   과천은 전주 대비 상승폭이 0.13%포인트 오른 0.45%로 서울 주요 지역을 훨씬 웃도는 상승률을 보였고요. 이어 광명(0.43%), 용인 수지(0.37%), 의왕(0.35%), 성남 분당(0.33%), 수원 영통·권선(0.26%), 하남(0.24%), 수원 팔달(0.22%) 순으로 상승률이 높았어요.   한국부동산원은 ""평택(-0.18%), 고양 일산서구(-0.14%) 등은 중소형 규모 위주로 하락했으나 과천은 중앙·원문동 위주로, 광명은 철산·광명동, 용인 수지는 풍덕천·동천동 역세권 단지 위주로 상승했다""고 분석했어요.   반면 규제지역으로 묶이지 않아 '풍선효과'가 기대되며 상승폭을 키웠던 구리(0.31%→0.18%)와 화성(0.26%→0.01%) 등은 급격히 상승폭이 꺾이며 대조되는 모습을 보였어요.   인천(0.09%)도 전주(0.10%) 대비 상승폭이 소폭 줄었고요. 서울을 포함한 수도권은 0.11% 상승을 기록, 지방은 0.05% 상승하면서 전국 상승률은 0.06%를 기록했어요.  양지영 신한프리미어 패스파인더 부동산 전문위원은 ""대출 한도 축소, 실거주 의무 부과, 정비사업 투자 여건 악화, 계절적 비수기 등으로 수요가 잠시 관망세에 들어섰다""면서 ""내년 1~2월까지 상승폭은 다소 줄어들 것으로 보이지만 대출 여력과 상관없는 강남 3구 등 주요지역은 신고가 행렬이 계속될 수 있어 지역·단지별로 양극화가 더 심해질 것""이라고 말했어요.   매물 없고 월세화…전셋값 고공행진   전셋값은 서울을 비롯해 전국에서 상승세를 이어가고 있어요. 10·15 규제로 인해 갭투자가 금지되면서 매물량이 줄어든 데다, 전세대출 규제와 월세화 가속화로 물건 자체가 사라지고 있어서예요.   부동산 플랫폼 아실에 따르면 지난 5일 기준 서울 아파트 전세 매물은 2만5146건으로 올해 초(3만1814건) 대비 21% 줄었어요. 2024년 연초(3만4822건)와 비교하면 27.8%, 2년 새 약 30% 가까이 물량이 줄어든 셈이에요.   서울 아파트 전세값 상승률은 전주와 동일한 0.14%를 유지했어요. 다만 경기는 0.11%에서 0.10%로, 인천은 0.10%에서 0.09%로 상승률이 소폭 하락했어요. 지방의 전세값 상승률은 0.05%를 유지하면서 전국 상승률은 전주와 동일한 0.08% 상승을 기록했어요.   양 전문위원은 ""전세는 신규 공급 물량도 부족하지만 실거주 의무로 기존 매물 공급 자체가 부족한 상황""이라며 ""월세 전환도 가속화되면서 전월세 가격이 오를 수밖에 없는데 내년 임대차 계약갱신청구권 도입 6년 차로 못 올렸던 임대료도 높일 수 있어 가격 상승폭을 더 키울 수 있다""고 우려했어요.",https://n.news.naver.com/mnews/article/648/0000042447
2025-12-05 18:01:00,"포스코, 여성 리더 전면 배치…전담조직 통해 안전 경영에 '만전'","포스코그룹이 전사 구조를 손보고 여성 리더를 전면에 배치하며 조직 전열을 다시 짰다. 안전 무관용 체계와 글로벌 투자 실행력, 인공지능(AI)·DX 기반의 기술 경쟁력 강화를 세 축으로 한 조직개편과 임원 인사를 조기에 단행하며 장인화 회장 체제의 실행력 중심 경영이 본격화됐다는 평가다.  안전·해외투자·DX 중심으로 조직 재편…전사 구조 손봤다  5일 포스코그룹은 2026년도 조직개편·임원인사를 단행했다. 이번 조직개편의 최우선 순위는 안전문화 재건이다. 그룹은 안전 전문 자회사인 포스코세이프티솔루션을 출범시키고 포스코와 포스코인터내셔널에 각각 안전 전담 조직을 신설했다. 포스코이앤씨는 안전 체계 재정비와 함께 플랜트사업본부와 인프라사업본부를 통합해 임원 조직을 20% 줄였다.  글로벌 투자 실행력도 대폭 강화했다. 포스코는 인도·미국 프로젝트를 총괄하는 '전략투자본부'를 신설해 JSW 합작 사업을 포함한 해외 철강 투자 기능을 직접 관리한다.  포스코인터내셔널은 LNG 탐사·생산·운송·발전 등 전체 밸류체인을 하나로 묶는 '에너지부문'을 신설해 내부 시너지를 확대한다. 포스코퓨처엠은 에너지소재사업본부를 마케팅과 생산으로 분리해 수주 확장과 제조 효율성을 동시에 강화했다.  DX 추진도 핵심 개편 요소로 자리잡았다. 포스코인터내셔널은 기존 DX 조직을 'DX전략실'로 통합하고 포스코퓨처엠은 'DX추진반'을 신설했다. 포스코DX는 IT 인프라 구축 기능을 넓혀 그룹사 디지털 전환의 속도를 높인다.  여성 대표 전면 배치…AI·R&D 리더십도 재구성  임원 인사는 여성 약진과 세대교체가 두드러졌다. 포스웰 이사장에는 최영 포스코홀딩스 사회공헌실장(전무), 엔투비 대표에는 안미선 포스코이앤씨 구매계약실장(상무)이 각각 선임돼 사업회사 여성 대표가 두 명 동시에 배출됐다. 여성 전무 승진자도 IR·기술전략·IT사업 등 3명으로, 주요 조직에서 역할이 확대됐다.  DX·R&D 영역은 70~80년대생 중심으로 전열을 재정비했다. 그룹DX전략실장은 UNIST 임치현 부교수가 맡아 AI·디지털 기반 전략을 이끈다. AI로봇융합연구소장은 포스코DX 윤일용 센터장이 선임됐으며 철강 R&D의 핵심 거점인 포스코 기술연구소는 엄경근 강재연구소장이 승진해 이끈다. 해외사업 전담 리더십도 강화됐다. 천성래 사업시너지본부장은 인도 합작 법인(P-India)으로 이동해 현지 프로젝트 실행을 맡고 정석모 산업가스사업부장은 본부장으로 승진했다.  포스코그룹은 장 회장 취임 후 '2 코어(철강·이차전지소재)+뉴 엔진(New Engine)' 전략을 축으로 사업 포트폴리오를 재편해왔다. 그룹은 이번 조직·인사 조정으로 글로벌 투자사업을 차질 없이 추진하고 중장기 경쟁력 확보 흐름을 가속화한다는 계획이다.",https://n.news.naver.com/mnews/article/648/0000042446
2025-12-05 17:46:00,또한번 외부수혈...신한운용 사장에 운용전문가 이석원 발탁,"신한자산운용의 고속성장 주역인 조재민 사장이 올해말 임기를 끝으로 물러난다. 후임은 4년 전 조 사장처럼 외부출신 운용전문가다.   신한금융지주는 5일 자회사최고경영자후보추천위원회(자경위)를 열고 이석원 전 국민연금공단 기금운용본부 전략부문장을 신한자산운용 신임 사장 후보로 추천했다.   1968년생인 이 후보는 고려대학교 경제학과를 졸업, 같은 대학에서 석사학위를 받고, 한성대학교 경영학 박사과정을 거쳤다.   장은투자신탁운용에서 운용업계 첫발을 딛었고, 이후 미래에셋자산운용과 KB자산운용을 거쳐 2011년부터는 하이자산운용(현 iM에셋자산운용) 주식운용본부에서 상무를 지냈다. 2018년 국민연금공단으로 자리를 옮긴 후 기금운용본부 주식운용실장과 전략부문장을 맡았다.  자경위는 이 후보자에 대해 ""기금운용본부 최초로 공모에 의해 주식운용실장으로 영입된 뒤, 성공적으로 안착해 전략부문장까지 역임했으며, 자산운용업계 내에서 전문성과 리더십 모두 높은 평가를 받는 인물""이라고 평가했다.  이례적 2년 연임했던 조재민, 추가 1년 대신 다시 외부전문가  이석원 후보자 추천과 함께 현 조재민 사장은 올해말을 임기로 물러나게 됐다. 조 사장은 1988년 씨티은행에서 출발해 동양증권, 크레디트아그리콜 홍콩지점, 스탠다드뱅크 홍콩지점 등에서 외환과 채권 딜러로 활약한 외국계은행 출신이다.   1999년 마이다스에셋자산운용 인수로 운용업계에 발을 들인 후 2022년 신한운용내 최초 외부인사로 사장직에 올랐다. 특히 2024년에는 2+1의 임기 관행을 깨고 2년의 추가임기를 부여받으면서 업계에선 이례적인 2+2 연임을 했다.   업계에선 조 사장이 오랜 운용업계대표 경력과 신한운용에서의 ETF 고속성장 성과를 바탕으로 추가로 1년 더 임기를 부여받는 것을 점치기도 했다.  실제로 조 사장 취임 전인 2021년말 6000억원이 채 되지 않던 신한운용의 ETF 순자산규모는 조 사장 임기 4년만에 10조원을 돌파했다.  운용업계 관계자는 ""업계에선 유일하게 '2+2' 연임을 한 것으로 이미 조 사장의 능력은 인정받은 것""이라며 ""신한운용이 또 다른 성장을 위해 조 사장 때처럼 외부에서 운영전문가를 모신 게 아닌가 생각된다""고 평가했다.  신한금융은 이석원 후보가 연금운용 경험을 바탕으로 조 사장이 다져 놓은 신한운용을 새롭게 성장시킬 것으로 기대하고 있다. 자경위는 ""SOL ETF의 선전으로 고무된 신한자산운용에서 이석원 후보가 폭넓은 경험과 전문성을 살려 회사를 한 단계 더 도약시킬 수 있을 것""이라고 밝혔다.",https://n.news.naver.com/mnews/article/648/0000042445
2025-12-05 17:30:00,"큐리어스, 이도에 3000억 투자…IPO 체질 만들기 돌입","국내 구조개선 전문 사모펀드(PEF) 운용사 큐리어스파트너스(이하 큐리어스)가 환경·인프라 운영관리 기업 이도에 3000억원 규모의 구조화 투자를 추진한다. 이번 거래는 단순한 성장자금 투입이 아니라, 누적된 차입 부담을 조정하고 비핵심 자산 매각과 기업공개(IPO)까지 단계적으로 엮은 관리형 구조개선 패키지 성격이 강하다는 평가가 나온다.  5일 투자은행(IB) 업계에 따르면 큐리어스파트너스는 최근 이도에 3000억원을 투자하기로 결정했다. 투자는 이도가 발행하는 전환우선주(CPS)와 전환사채(CB)를 인수하는 형태다. 큐리어스는 기존 블라인드펀드에서 1050억원, 신규로 결성한 프로젝트펀드에서 450억원을 각각 투입하고, 인수금융 1500억원을 더해 재원을 마련한다.  이번 투자에는 최소 상각전영업이익(EBITDA) 달성과 순차입금 감소 조건, 콜옵션과 풋옵션 등이 결합됐다. 큐리어스는 향후 IPO, 사업부문 분할 등을 통해 전체 기준 약 13%, PEF 투자 기준 약 19% 수준의 내부수익률(IRR)을 목표로 하고 있다.  이 같은 조건 설정은 투자 성과를 IPO 성패에만 걸지 않고, 투자 기간 이도의 현금창출력 개선과 재무 안정화를 동시에 관리하겠다는 의미로 해석된다. EBITDA와 순차입금 지표가 직접 연동된 만큼 향후 경영의 주요 관리 지표는 수익성 개선과 차입 축소에 맞춰질 전망이다. 콜옵션과 풋옵션 역시 상장이나 자산 매각 일정이 지연될 가능성까지 감안한 안전장치로 풀이된다. 회수 경로에 대한 유연성을 확보하려는 의도가 읽힌다.  이도가 투자유치에 나선 배경에는 급격한 사업 확장 과정에서 누적된 재무 부담이 꼽힌다. 회사는 환경·인프라 사업을 중심으로 골프·레저, 부동산 등으로 사업 영역을 확대하며 대규모 자산 매입 투자를 지속해 왔다. 이 과정에서 차입 규모가 빠르게 늘었고, 금융비용 부담도 함께 확대됐다.  재무지표도 이러한 부담을 그대로 보여준다. 이도의 부채비율은 2021년 290%에서 지난해 446%로 치솟았다.  부채 규모뿐 아니라 만기 구조도 문제다. 지난해 유동부채는 4946억원으로 전년보다 67.9% 급증했다. 이 가운데 2798억원이 1년 안에 상환해야 하는 유동성장기차입금이다. 단순 부채가 많은 것보다 단기간에 갚아야 할 금액이 한꺼번에 늘어난 점이 부담 요인이다.  단기 상환 압박은 전환사채(CB)에서도 가시화됐다. 2023년까지 비유동부채로 분류되던 CB 전액(426억원)이 지난해 유동성CB(475억원)로 이동했다. 상환할증금 누적과 전환권 재평가로 장부금액이 증가한 가운데 풋옵션 행사 가능 시점에 진입하면서 1년 내 상환 대상 채무로 재분류된 영향이다.  지난해 말 기준 이도가 1년 안에 대응해야 했던 핵심 금융부채(단기차입금+유동성장기차입금+유동성사채+유동성CB)의 합계는 4132억원에 달했다. 영업현금흐름만으로는 대응이 어려워 외부 자금조달이나 자산 매각 없이는 유동성 리스크가 커질 수 있었다는 평가다.  큐리어스는 이번 투자를 통해 이도의 차입 구조를 정리하는 동시에 비핵심 자산 매각과 핵심 사업 중심의 선택과 집중을 병행한다는 구상이다. 실제로 이도는 지난 9월 매각 예정 자산 가운데 하나였던 ‘클럽디금강’ 매각을 통해 905억원을 확보하며 선제적인 유동성 보강에 나선 바 있다.  향후에도 추가적인 자산 매각을 통해 순차입금을 단계적으로 축소하고, 재무제표를 상장 친화적인 구조로 재편할 것으로 보인다. 이르면 내년 혹은 내후년에는 본격적인 IPO 작업에 착수할 예정이다.  IB업계에서는 이번 거래를 단순한 자금 수혈이 아니라, IPO 전에 재무구조를 미리 손질하는 ‘관리형 구조개선 투자’로 보고 있다. 기존 대주주 체제는 유지한 채 큐리어스가 재무·자산·자본 구조 전반에 사실상 실질적 관리 역할을 하며 상장 준비 과정을 함께 끌고 가는 형태다. 단기 유동성만 메우는 투자라기보다 상장에 필요한 재무 여건을 단계적으로 만들어가는 성격이 짙다는 게 시장의 평가다.  한 IB업계 관계자는 이번 딜에 대해 “재무구조를 재정비하고, 필요하면 자산을 정리해 상장 가능성을 높이는 구조화 투자”라고 평가했다.  큐리어스는 그동안 삼성중공업 드릴십, 성동조선해양 등 굵직한 구조개선 거래를 수행해 온 스페셜 시추에이션 전문 운용사다. 주로 영업은 정상적으로 이뤄지지만 재무 레버리지가 과도해진 기업에 들어가 부채와 자본 구조를 다시 정비해 회수 여건을 만드는 방식을 활용해 왔다. 이번 이도 투자 역시 같은 전략의 연장선상에 있다는 분석이다.",https://n.news.naver.com/mnews/article/648/0000042444
