날짜,제목,본문,링크
2025-12-05 16:22:00,"[AGF 2025]③넥슨·엔씨·넷마블, '3N'의 덕후 공략법","국내 게임업계 큰형님으로 불리는 '3N'(엔씨소프트·넥슨·넷마블)이 아니메 게임 페스티벌(AGF)에 총출동했다. 일찍이 '페이트: 그랜드 오더'로 서브컬처 장르 포트폴리오를 더한 넷마블, 다수의 서브컬처 장르 라인업을 보유한 넥슨에 이어 엔씨소프트까지 '리밋 제로 브레이커스'로 서브컬처에 도전했다.   서브컬처 팬 '교집합' 고려한 넥슨  5일 일산 킨텍스 제1전시장에서 열린 'AGF 2025' 내 '마비노기 모바일' 부스는 아침 일찍부터 '밀레시안'(마비노기 이용자)들로 북적거렸다. 넥슨은 마비노기 모바일의 첫 마을 '티르코네일'의 풍경을 구현했다. 돌계단을 내려가면 통나무 의자와 캠프파이어 모형이 나오는 광장이 있고, 식료품점과 낚시터가 나란히 양 옆에 위치해 있다.  관람객들은 콘센트가 마련된 광장에서 휴대폰이나 전자기기를 충전하면서 쉬어가거나, 유튜브 구독을 인증하고 받은 '식료품점'에서 받은 쿠키를 한 입 베어물거나 짐을 정리했다. '작은 낚시터'에서는 여러 캡슐 사이에서 녹색 캡슐을 자석 낚싯대로 낚는 데 성공하고 환호성을 지르기도 했다. 마비노기 모바일을 설치한 관람객은 낚시게임에 참여할 수 있는데, 녹색 캡슐을 낚으면 갤럭시 버즈3 프로부터 굿즈 패키지, 넥슨 캐시쿠폰, 나오 아크릴 마그넷 등 경품과 교환할 수 있다. 기자도 낚시에 도전해 넥슨캐시 5000원을 낚는 데 성공했다.  넥슨은 '룩덕'(캐릭터 외향을 꾸미는 행위)들이 많은 밀레시안들에 맞춰 캐릭터를 꾸미고 이미지를 인화할 수 있는 이벤트를 준비하거나, 타투 스티커팩을 증정하기도 했다. 마비노기 모바일 특유의 평화롭고 느긋한 분위기를 떠올리게 하는 부스 구성이었다.  일반적으로 서브컬처는 '블루 아카이브'처럼 일본 애니메이션풍의 미소녀가 등장하며 특정 마니아층을 공략한 게임을 일컫는다. 마비노기 모바일은 다중접속역할수행게임(MMORPG)으로 흔히 서브컬처로 분류되지는 않지만, 넥슨은 AGF에 마비노기 모바일 부스를 꾸렸다. 서브컬처 팬들과 마니아들이 많은 마비노기 모바일의 이용자 층이 일부 겹치는 만큼, 더 많은 이용자들과 만나기 위해서다. 넥슨 관계자는 ""이용자들과의 접점을 늘리고자 AGF에 나오게 됐다""고 말했다.  '큰형님'도 서브컬처 도전, 세계관 충실 부스  올해 AGF에서 가장 눈에 띄는 참가사는 엔씨소프트다. 몇 년 전까지만 해도 서브컬처 게임은 대형 게임사들이 잘 시도하지 않는 장르였다. 주변 게임사들이 너나 할 것 없이 서브컬처에 뛰어들었을 때도 'MMORPG 명가' 엔씨소프트와 서브컬처는 비교적 거리가 멀었다. 그러나 지난해 서브컬처 전문 개발사 빅게임스튜디오에 투자하고, 올해 도쿄게임쇼(TGS)에 '리밋 제로 브레이커스'를 공동 출품하는 등 완전히 달라진 행보를 보였다.  엔씨소프트는 올해 AGF에 '리밋 제로 브레이커스'(이하 브레이커스) 단독 부스를 냈다. 부스에는 브레이커스의 세계관을 충실히 따라갈 수 있는 체험형 콘텐츠들이 가득했다. 장난감 활을 쏘아 캐릭터 과녁을 맞히면 되는 '크리스티앙의 지원사격'과 펀치게임을 연상케 하는 '에르카의 괴력망치', 시간에 맞춰 버저를 누르는 '위버렌스를 부탁해'까지 미니게임 3종이 준비됐다. 이벤트에 참여하면 에르카 캐릭터 가방, 캠핑의자, 달력 등 브레이커스 테마 굿즈를 받을 수 있다.  브레이커스의 주요 캐릭터 '헬렌'으로 코스프레한 유명 코스어 '마이부'의 사인회, 버추얼 유튜버 '빙하유'와 '라디유'가 등장하는 브레이커스 테마 카페도 마련했다. 부스 한켠에서는 내년 상반기를 목표로 개발 중인 브레이커스의 비공개베타테스트(CBT) 참가자를 모집했다.  덕후 '잘알' 넷마블…'페그오' 인기 여전  넷마블은 서브컬처 붐이 일어나기 한참 전인 2017년 '페이트: 그랜드 오더'(이하 페그오)를 국내에 출시했다. 페그오는 2025년에도 여전한 스테디셀러이자 대표 서브컬처 게임으로 넷마블 매출의 한 축을 차지하고 있다.  평일인데도 넷마블이 페그오 부스에는 내내 긴 대기줄이 늘어섰다. 오전 11시 기준으로 최소 80분이 걸린다는 안내문이 붙었지만 마스터(페그오 이용자)들은 꿈쩍하지 않았다. 용인에서 왔다는 최모(34)씨는 ""페그오 이용자로 기대하면서 왔다. 일부러 연차도 냈다""면서 설레는 표정을 감추지 못했다.  부스에서는 네컷 부스부터 개념예장 진화 미션, 스톰포드 획득 미션 등 미니게임, 포토존까지 다양한 스탬프 랠리도 진행했다. 코스프레 이벤트나 퀴즈를 통해 팬들의 열정을 확인하는 '페잘알 OX 서바이벌'에는 일본 나고야에서 건너왔다는 마스터가 등장해 주위 이용자들의 박수를 받기도 했다.  넷마블은 2023년부터 3년 연속으로 AGF에 참가해 페그오 부스를 꾸렸다. 올해는 한국 서비스 8주년을 기념해 AGF에 처음으로 페그오 공식 굿즈를 내놨다. △FGO 칼데아 윈드 브레이커 △FGO SD 금속 배지 △FGO 스테인드글라스 아크릴 스탠드 △눈노스 모찌 키링 등이다.",https://n.news.naver.com/mnews/article/648/0000042440
2025-12-05 16:05:00,"컴투스홀딩스, 신작 '프로젝트 V' 퍼블리싱 계약","컴투스홀딩스는 유티플러스인터랙티브가 개발 중인 다중접속역할수행게임(MMORPG) '프로젝트 V'(가제)의 글로벌 퍼블리싱 계약을 체결했다고 5일 밝혔다.  이번 계약을 통해 컴투스홀딩스는 프로젝트 V의 국내외 퍼블리싱을 담당하며, 2026년 출시를 목표로 준비를 본격화한다. 컴투스홀딩스와 두번째 협업을 진행하는 유티플러스인터랙티브는 2006년 설립 이후 MMORPG '탈리온'을 비롯해 다양한 장르에서 개발 역량을 인정받았다.  프로젝트 V는 컴투스홀딩스가 서비스 중인 '탈리온'의 정식 후속작이다. 전작의 호쾌한 액션성과 전투 감각을 계승하면서 현재 시장 트렌드에 걸맞는 새로운 방향성으로 제작한다.  기존의 페이투윈(Pay to Win) 방식에서 벗어나 플레이에 따른 자연스런 성장과 그 과정의 재미를 추구한다. 향상된 그래픽과 연출을 통해 몰입감을 극대화하고, 경쟁 중심의 PVP 대신 협동 기반의 성장과 목표 달성의 즐거움에 초점을 맞춘 게 특징이다.  컴투스홀딩스는 프로젝트 V를 비롯해 전략 디펜스, 메트로배니아, 퍼즐, 수집형 RPG 등 다양한 장르의 게임으로 퍼블리싱 라인업을 확장하며 게임 사업을 강화해 나가고 있다.",https://n.news.naver.com/mnews/article/648/0000042439
2025-12-05 15:59:00,"삼성생명, 삼성화재 지분법 적용 논란도 종지부","삼성생명을 둘러싼 회계논란이 마무리 국면에 접어들었다. 생명보험협회의 질의에 금융감독원이 질의회신을 통해 일탈회계를 중단하고, 유의적 영향력과 관련해선 경영진이 판단토록 결정한 까닭이다.  삼성생명이 삼성화재 자회사 편입을 결정하면서 지분법을 적용해야 한다는 지적이 있었지만, 유의적 영향력을 입증하기 쉽지 않아 현 상황을 유지할 것으로 보인다.  밸류업 '불똥' 지분법 적용 논란  삼성생명의 삼성화재 자회사 편입과 지분법 적용 논란은 삼성화재의 밸류업 정책에서 시작됐다. 올 초 삼성화재는 밸류업 정책에서 2028년까지 주주환원율 50%로 확대, 자사주 비중은 5% 미만으로 낮추겠다는 내용을 담았다.  삼성화재가 자사주 비중을 낮추는 과정에서 삼성생명의 삼성화재 지분율이 상승한다. 보험업법에 따라 보험사는 타 회사 발행주식 15% 이상을 소유할 수 없고, 15%를 넘기면 금융위원회 승인을 받아 자회사로 편입해야 한다.  삼성생명은 삼성화재가 안정적으로 밸류업 정책을 실현할 수 있도록 삼성화재를 자회사로 편입하기로 결정했다. 3분기말 기준 삼성생명은 삼성화재 지분 15.43%를 보유하고 있다.  삼성생명이 삼성화재를 자회사로 편입하자 보유한 지분율 만큼 삼성화재 실적을 삼성생명에 반영하는 지분법을 적용해야 한다는 주장이 제기됐다. 일반적으로 특정 기업 주식 20% 이상을 보유해야 해당 기업의 주요 영업과 재무 정책 결정에 영향력을 행사할 수 있다고 판단해 지분법을 적용토록 한다.  다만 지분율이 20% 미만이어도 이사선임권 등 경영진 구성에 영향력을 행사하거나 경영 정책 등 주요 의사 결정에 참여하면 관계기업으로 분류해 지분법 회계를 적용할 수 있다. ▷관련기사: 삼성화재 품는 삼성생명, '자회사 편입' 선택 배경은(2월14일)  이에 대해 회계기준원은 질의회신에서 ""'지분법을 적용해야 한다' 혹은 '적용하지 않아도 된다'를 확인하는 게 아닌 경영진이 모든 사실과 상황을 종합적으로 고려해 유의적인 영향력 보유 여부를 판단하라는 취지""라고 설명했다.  그 동안 삼성생명은 삼성화재 자회사 편입 후에도 경영에는 변동이 없다는 입장이라 지분법을 적용하지 않을 가능성이 크다.  유의적 영향력 입증 어려워  회계업계 일각에서 삼성생명이 삼성화재를 지분법 회계를 적용해야 한다고 주장한 배경에는 지분율은 20% 미만이지만 유의적 영향력을 행사한다고 판단했기 때문이다.  K-IFRS에선 △피투자자의 이사회나 이에 준하는 의사결정기구에 참여 △배당이나 다른 분배에 관한 의사결정에 참여하는 것을 포함해 정책결정과정에 참여 △기업과 피투자자 사이의 중요한 거래 △경영진의 상호 교류 △필수적 기술정보의 제공 가운데 하나 이상에 해당하면 일방적으로 유의적인 영향력을 보유한다는 것이 입증된다.  홍원학 삼성생명 사장은 이전에 삼성화재 사장을, 이문화 삼성화재 사장은 삼성생명 전략영업본부장 부사장을 역임했다. 경영진의 상호 교류가 이뤄진 것으로 주장하는 측의 대표적인 근거다.  이와 함께 삼성금융네트워크의 앱인 '모니모' 개발 과정에서 삼성카드가 주도적 역햘을 하고 삼성생명과 삼성화재 등이 개발 자금을 분담했다는 것도 필수적 기술정보의 제공으로 볼 수 있다는 사례로 꼽힌다.  하지만 이 같은 사례가 실제 유의적 영향력을 입증하기는 어렵다는 분석이다. 삼성생명과 삼성화재 임원진 교류는 삼성의 그룹 차원 인사를 통해 결정된 것으로 삼성생명이 삼성화재에 행사한 영향력으로 보기 힘들다는 시각도 있다.  모니모 역시 삼성 금융 계열사들이 함께 이용하고 있어 유의적 영향력으로 볼 수 있을지 명확하지 않다고 보고 있다.  한 회계업계 관계자는 ""모니모는 계열사들의 시너지를 위한 것이지 영향력을 발휘하기 위한 것으로 보기는 어렵다""며 ""삼성생명과 삼성화재 이사회를 겸직하는 게 아니고 각 사의 이사회가 다른 회사에 영향력을 주는지도 객관적으로 입증하기 어렵다""고 설명했다.",https://n.news.naver.com/mnews/article/648/0000042438
2025-12-05 15:52:00,"넥슨, 개발 자회사 '딜로퀘스트' 설립…신작 개발 추진","넥슨은 5일 개발 법인 '딜로퀘스트'를 설립했다고 밝혔다.  딜로퀘스트는 넥슨코리아의 100% 자회사로, 넥슨이 보유한 지식재산권(IP)을 바탕으로 개발 역량을 집중해 안정적이고 체계적인 개발 환경을 마련하고 신작 개발을 추진할 계획이다.  딜로퀘스트 사명은 갑옷 같이 단단한 외피를 지닌 동물 '아르마딜로'의 강한 방어력과 체력을 바탕으로 회사를 지키고 퀘스트(게임성공)를 완수한다는 의미를 담았다.  초대 대표이사는 넥슨코리아의 김종율 퍼블리싱라이브본부 부본부장이 선임됐다.  김종율 대표는 2008년 넥슨에 입사해 크레이지아케이드비엔비, 버블파이터, 마영전, 메이플스토리2 등의 해외 서비스 및 퍼블리싱을 진행한 인물이다. 특히 바람의나라: 연, 프라시아전기 등 프로젝트의 라이브 퍼블리싱 총괄을 맡은 바 있다.   또한 이태성 총괄디렉터(개발 총괄 부사장)를 주축으로 핵심 개발 인력 다수가 딜로퀘스트에 합류한다. 다만 딜로퀘스트가 맡을 넥슨의 기존 IP는 아직 비공개다. 회사는 내년 중 공개 채용을 통해 개발팀의 규모를 확대해 신작 개발을 본격적으로 추진할 계획이다.  김종율 대표는 ""새로운 개발 법인에서 넥슨의 개발 역량을 집중해 많은 유저의 기대에 부응하는 신작을 선보일 수 있도록 최선을 다하겠다""고 말했다.",https://n.news.naver.com/mnews/article/648/0000042437
2025-12-05 15:34:00,"신한지주 자경위, 신한라이프·신한자산운용 CEO 교체","신한금융지주가 신한라이프 사장 후보로 천상영 신한금융 부사장(CFO)을 신규 추천했다. 신한자산운용 사장 후보로는 이석원 전 국민연금 기금운용본부 전략부문장을 추천했다.  신한지주는 5일 서울 중구 세종대로 본사에서 자회사최고경영자후보추천위원회(자경위)를 열고 이 같은 내용의 자회사 사장단 후보 추천을 실시했다.   자경위 위원장인 진옥동 신한지주 회장은 '조직관리와 인재 육성 책임자로서 최고경영자(CEO) 역할'과 '절대적 이익이 아닌 성과의 질의 중요성' 등을 강조했다. 조직의 새로운 변화와 함께 현재 추진하고 있는 내부 혁신의 완수를 강조한 것으로 전해졌다.   CEO 임기만료 대상이 되는 4개 자회사 중 2개 자회사 CEO가 새로 선임됐다. 신한라이프와 신한자산운용 대표가 교체됐고, 신한자산신탁과 신한EZ손해보험 대표는 1년 연임했다.  우선 신한라이프 천상영 사장 후보는 지주사에서 경영관리 업무를 장기간 담당하며 그룹 사업라인 전반에 대한 이해도가 높고 재무·회계 전문성이 뛰어난 인물로 평가받는다. 특히 지난해부터 신한라이프 이사회 일원으로 참여하면서 이사진과 임직원들로부터 호평을 받았다는 평가다.  자경위 관계자는 ""이영종 신한라이프 사장이 외형적으로 양호한 성과와 성장세를 이끌어왔지만, 새로운 리더십을 통해 질적 성장을 추구해야 할 타이밍""이라며 ""천 후보가 재무 및 경영관리 분야의 전문성을 살려 신한라이프를 한 단계 더 업그레이드해 주길 바란다""고 했다.   신한자산운용 이석원 신임 사장 후보는 기금운용본부 최초로 공모에 의해 주식운용실장으로 영입된 인물이다. 이후 성공적으로 안착해 전략부문장까지 역임했으며 자산운용업계 내에서 전문성과 리더십 모두 높은 평가를 받고 있는 것으로 전해졌다.    연임하는 신한자산신탁 이승수 사장은 자경위로부터 당면한 이슈를 수습하고 조직 체질개선을 완수하는 과제를 부여받았다. 신한EZ손해보험 강병관 사장도 1년 연임이 결정됐다. 자경위는 지난 2022년부터 회사를 이끌어 온 강 사장이 안정적 리더십을 발휘할 것이라고 판단했다.  자경위는 ""올해 CEO 인사는 조직 내 긴장감을 불어넣는 동시에 내부 혁신의 완수를 위한 인재를 적재적소에 활용하겠다는 의지를 강조했다""고 밝혔다. 이날 자경위에서 추천된 후보는 각 회사 임원후보추천위원회에서 자격요건 및 적합성 여부 등에 대한 검증을 거쳐 각 사 주주총회 및 이사회에서 최종 선임될 예정이다.",https://n.news.naver.com/mnews/article/648/0000042436
2025-12-05 14:35:00,"80살 기아, 부도 2번에도 꺾이지 않은 비결","정의선 현대자동차그룹 회장은 기아 80주년 사사 기획단계에서 3가지를 당부했다. 첫째 쉽게 써라. 둘째 있는 그대로 써라. 셋째 임직원이 자긍심을 갖게 해달라. '기아 80년'을 쓴 이장규 현대차 고문은 5일 열린 '기아 80주년 행사'에서 ""자랑스럽고 성공한 역사만 아니라, 시련과 실패의 뼈아픈 역사도 에누리 없이 담아달라는 요구였다""고 전했다.  1944년 자전거 부품 회사로 설립된 경성정공을 모태로 한 기아의 80년 역사에선 성공보다 실패가 많았다. 1952년 최초의 국산 자전거 '3000리호'를 시작으로 오토바이, 삼륜차를 거쳐 첫 승용차 '브리사'를 선보이는 과정에서 수많은 시련을 거쳤다.  기아는 부도 위기를 두 번이나 겪었다. 1960년 자전거 사업 적자로 첫 부도를 맞았고 자동차 사업이 확장되던 1997년 '부도유예'에 직면했다. 1997년 브라질 출장에서 회사 부도 소식을 전해 들은 정의철 기아 전무는 ""하늘이 무너지는 것 같았다""고 회상했다. 송호근 기아 사장은 ""도전과 실패 극복을 반복한 분발의 역사""라고 평했다.  부도를 이겨낸 비결은 위기에서 강해지는 기아 특유의 DNA에 있다. 이장규 고문은 ""두 번이나 부도나고 법정관리 거쳐 제3자 인수되는 기구한 운명의 차 회사였지만, 부도가 났을 때 아무일 없었던 듯 신차 개발을 멈추지 않았다""고 전했다.   기아 DNA는 여러 경영자를 거치면서 완성됐다. 이 고문이 '마치 독립운동 하듯 사업을 했다'고 평한 김철호 창업자는 ""자전거가 완성되면 자동차, 자동차가 완성되면 비행기를 만들겠다""는 철학을 회사에 심었다. 1998년 현대차에 인수된 뒤에는 정몽구 명예회장의 품질 경영, 정의선 회장의 디자인 경영이 기아 체질을 확 바꿨다.   정 회장은 2004년 설립된 유럽 생산거점인 슬로바키아 공장에서 정 명예회장과 함께 했던 일화를 소개했다. 그는 ""정 명예회장은 슬로바키아 공장에서 아직 검수도되지 않은 '씨드' 옆 자리에 나를 태우고, 품질경영을 강조했다""며 ""아직 잊지않고 똑같이 강조하고 있다""고 전했다.  품질에 디자인이 더해지자 기아는 질주했다. 2009년 호랑이 코를 닮은 라디에이터 그릴을 단 K시리즈가 큰 인기를 끌었다. 2014년부터 3년간 '300만 대 판매'도 달성했다.   고속성장 속에서도 위기는 있었다. 구형 모델을 팔며 급성장했던 중국 시장에서 경쟁력을 잃으며 부진의 늪에 빠졌다. 이 때도 위기 극복 DNA가 발동했다. 2018년 판매 중심이 본사에서 권역본부로 분산하면서 나라별로 성과가 나오기 시작했고, 2020년 사명에서 자동차를 빼며 미래 모빌리티 비전을 제시했다.   정 회장은 ""기아는 정제되지 않은 다이아몬드 같이 원초적으로 강하고 개성이 있다""며 ""잘 다듬으면 훌륭한 보석으로 태어날 수 있다""고 말했다.",https://n.news.naver.com/mnews/article/648/0000042435
2025-12-05 14:17:00,[AGF 2025]②빙판길 뚫고 코스어들 한자리 모인 이유,"오늘 코스프레한 캐릭터는 니지산지 쿠즈하의 라구자 버전입니다.   5일 일산 킨텍스에서 열린 애니메이션·게임 축제 'AGF(Anime X Game Festival)'에서 만난 이터너티(예명) 씨는 이른 아침부터 행사장을 찾았다. 그는 ""코스프레를 준비하다 보면 시간이 오래 걸린다. 일찍 와야 현장도 구경하고 지인들도 만날 수 있다""며 기대감을 나타냈다. 최근 즐기고 있는 넥슨의 마비노기 모바일 부스가 가장 기대된다는 말도 덧붙였다.   현장에는 알록달록한 렌즈와 화려한 가발을 착용한 코스어들로 북적였다. 지난달 부산에서 열린 게임 행사 지스타와는 사뭇 분위기가 달랐다. 지스타가 대형 게임사 중심으로 진행된 행사라면 AGF는 게임 뿐만 아니라 애니메이션 등 서브컬처 전반을 총망라한 행사다. 코스어 전용 탈의실을 별도로 마련해 둘 정도로 서브컬처 특화형 행사라고 할 수 있다.   영하 10도에 달하는 날씨에도 불구하고 킨텍스 앞은 수백 명의 대기 인파로 가득했다. 지난 밤 내린 첫눈으로 빚어진 교통체증도 관람객들을 막지 못했다. 입장시간 전부터 오픈런을 하는 관람객들이 가득했다. 오픈 시간인 10시가 되자마자, 부스 안으로 뛰어 들어가는 모습도 곳곳에서 포착됐다.  현장에서 만난 관람객들은 들뜬 마음을 감추지 못했다. 올해 처음 AGF에 와본다는 김민정씨는 ""제가 좋아하는 애니메이션 '봇치더락'의 팝업스토어가 열린다고 해서 AGF에 참석하게 됐다. 현장서 판매하는 국내 한정판 굿즈도 기대된다""며 ""극장판을 선공개로 볼 수 있다는 점도, 보고 싶었던 성우들의 미니 라이브와 토크 콘서트가 열린다는 점도 무척 설렌다""고 말했다.   AGF는 애니메이션과 게임는 물론 라이트 노벨·애니메이션 음악·버츄얼 유튜버 등 폭넓은 콘텐츠를 선보이는 행사다. 올해는 '명일방주: 엔드필드', '승리의 여신: 니케' 등 인기 서브컬처 게임 부스는 물론 '봇치 더 록!', '최애의 아이' 등 유명 애니메이션 부스가 마련돼 역대급 규모라는 평가를 받고 있다.   최근 서브컬처 시장이 커지면서 국내 대형 게임사들도 이번 행사에 적극적으로 참여했다. 올해 메인 스폰서는 스마일게이트가 맡았으며, 넥슨·엔씨소프트·넷마블 역시 대규모 부스를 마련해 팬심 공략에 나섰다. 올해 AGF는 5일부터 7일까지 일산 킨텍스 제1전시장에서 개최된다.",https://n.news.naver.com/mnews/article/648/0000042434
