날짜,제목,본문,링크
2025-12-05 13:23:00,"20년 표류한 성북1구역, LH·GS건설이 협력해 재개발","서울 성북1구역 노후 주거지가 공공재개발을 통해 '자이' 브랜드를 단 2000가구 이상의 대규모 단지로 거듭날 전망이다.  GS건설은 '성북 1구역 재개발 사업'에 이달 6일 홍보관을 열어 토지등소유자 관람을 시작한다고 밝혔다. 이 회사는 지난달 17일에 시공사 선정을 위한 입찰에 참가했다.  성북 1구역 재개발은 성북구 성북동 179-68 일대에 최고 30층 높이의 공동주택 2086가구를 조성하는 내용이다. 한국토지주택공사(LH)가 사업시행자로 참여하는 공공재개발 사업이다. 지난 2004년 정비예정구역 지정 이후 수년간 사업 지연과 복잡한 이해관계로 난항을 겪다가 지난해 10월 LH를 사업시행자로 지정하며 속도를 내고 있다.  GS건설은 성북1구역의 단지명으로 도심 주거의 새로운 시작이자 통합된 하나의 명품 단지('Begin One' 또는 'Be One')를 상징하는 의미에서 '자이 비:원'을 제안했다.  또 입지적 특성을 고려한 혁신 설계도 제안했다. 특히 약 80m에 달하는 큰 높낮이 차이를 지닌 경사지라는 난제를 해결하기 위해 '지형 순응형 데크'를 도입한다는 계획이다. 높낮이 차를 해결하기 위해 데크(Deck, 건물 외부에 까는 목재)를 쌓는 방식의 설계라는 게 GS건설의 설명이다.  GS건설은 이 같은 혁신적인 설계를 통해 평탄화 구간을 최대한 확보하고 단지 중심에 넓은 중앙광장을 조성한다는 계획이다.  아울러 남향 위주의 배치와 판상형 비율을 높이고 북악산, 낙산 등 자연 녹지와 서울 도심 조망을 동시에 갖추도록 한다. 단지 내에 3개의 경관 타워, 성북근린공원과 도심을 연결하는 산책로 등도 조성한다.  홍보관은 성북구 성북동 243-9에 있으며 성북1구역 토지 소유자들은 홍보관에서 자이(Xi)가 제시하는 단지 특화 설계를 관람할 수 있다. 시공사선정 총회는 오는 20일 열린다.  GS건설은 이번 성북1구역 외에도 올해 중화5구역, 거여 새마을 공공재개발 사업을 연이어 수주하는 등 LH와의 협업 및 공공재개발 사업 경험을 쌓았다.  GS건설 관계자는 ""성북1구역 재개발 사업은 LH가 참여하는 공공재개발의 투명성과 신속성, 성북동의 입지적 장점을 극대화한 특화 설계가 도입될 것""이라면서 ""노후 주거지의 문제를 해결하고 도시의 지형적 한계를 극복하는 공공재개발의 새로운 이정표가 될 것으로 기대한다""고 말했다.",https://n.news.naver.com/mnews/article/648/0000042427
2025-12-05 12:40:00,"정의선 ""테슬라 자율주행과 격차있지만…안전에 포커스""","""안전에 좀 더 포커스를 둘 생각이다""  5일 경기 용인시 비전스퀘어에서 열린 '기아 80주년 기념 행사'에서 정의선 현대차그룹 회장은 자율주행의 안전성에 대해 강조했다.  정 회장은 ""현대차그룹의 자율주행이 늦은 편""이라며 ""중국 업체와 테슬라가 잘하고 있기 때문에 미국에서 모셔널을 열심히 하고 있지만, 격차는 조금 있을 수 있다""고 말했다. 이어 ""격차보다 중요한 것은 안전""이라고 덧붙였다.  모셔널은 현대자동차그룹과 미국 자율주행 기업 앱티브가 2020년 설립한 합작사로, 현대차그룹의 자율주행 기술을 개발하고 있다. 모셔널은 미국에서 무인 자율주행 택시 상용화를 추진했지만, 아직 뚜렷한 성과를 내지 못하고 있다.   국내에선 소프트웨어 중심 자동차(SDV) 사업을 이끈 송창현 현대차 첨단차플랫폼(AVP) 본부장이 최근 사임했다. 현대차그룹은 송 사장이 창업한 자율주행 스타트업 포티투닷을 인수하며 자율주행 고도화에 나섰지만, 송 사장이 사임으로 동력을 잃게 됐다.   반면 글로벌 완성차들은 자율주행 서비스를 상용화하고 있다. 테슬라는 미국과 캐나다, 중국 등에 이어 지난달 한국에 감독형 완전자율주행(FSD, Full Self Driving) 서비스를 선보였다. GM의 핸즈프리(Hands-free) 운전자 보조 시스템 '슈퍼크루즈' 서비스도 지난 10월 한국에 공개했다. 바이두, 샤오펑 등 중국 자율주행 기술도 세계적인 수준이다.",https://n.news.naver.com/mnews/article/648/0000042426
2025-12-05 10:30:00,"광동제약, 최성원·박상영 2인 대표…'투트랙 성장' 가속","광동제약이 기존 최성원 대표이사 회장 체제에서 최성원·박상영 각자대표 체제로 전환하면서 '투트랙 경영'에 나선다. 최 회장이 구축한 경영 안정성을 바탕으로 전문 영역별 분담을 통해 조직 효율성을 끌어올린다는 전략이다.  광동제약은 전날(4일) 이사회를 열고 박상영 경영총괄 사장을 각자 대표이사로 선임했다. 이번 체제 개편을 통해 경영의 지속성과 혁신을 동시에 잡는다는 구상이다.  회사의 성장과 사업 다각화를 이끌어온 최 회장은 전략·신사업·R&D 총괄 CEO로서 회사의 미래 비전 수립과 신사업 발굴을 통해 장기 경쟁력 확보에 총력을 기울인다.  박 사장은 최고안전환경책임자(CSEO) 및 커뮤니케이션실장을 역임하며 축적한 경험으로 전사 사업본부와 지원조직을 총괄하며 전반적인 경영활동과 사업 운영을 책임진다.  이 같은 역할 분담은 각 대표이사가 자신의 전문영역에서 효율적인 의사결정을 가능하게 해 조직 실행력이 극대화될 것으로 기대를 모으고 있다.  각자 대표이사 체제는 단순한 업무 구분을 넘어 경영 시너지를 창출할 수 있다는 점이 장점이다.  우선 의사결정 속도가 한층 빨라진다. 각 대표가 담당 영역에서 독립적인 권한을 갖고 판단함으로써 조직 실행력을 높일 수 있다. 급변하는 제약 시장에서 기회를 포착하고 경쟁우위를 확보할 수 있는 핵심 요인이 될 수 있다는 평가다.  전문성 또한 강화된다. 최성원 회장이 미래 전략과 혁신에, 박상영 대표이사는 현장 경영과 실행에 집중하면서 깊이 있는 전문성을 발휘할 수 있다. 이는 장기 비전 수립과 단기 성과 창출을 동시에 달성할 수 있는 구조다.  책임 경영 체계 역시 공고해질 것으로 보인다. 각 대표이사가 명확한 권한과 책임을 가진 만큼, 경영 투명성과 주주가치 제고에도 긍정적인 영향을 미칠 것으로 예상된다.  광동제약의 각자대표 체제 도입에 대한 업계 기대감이 모인다. 광동제약에 따르면 ""각자대표 체제는 빠르게 변화하는 제약산업 환경에서 의사결정 속도와 실행력을 높일 수 있는 경영 방식""이다. 즉 전략과 실행을 분리해 전문성을 강화하면서도 기업가치 제고라는 목표를 하나로 집중시킨 구조라는 설명이다.  광동제약 관계자는 ""각 부문의 전문성과 성과를 토대로 조직의 실행력을 높이고, 미래 성장 기반을 한층 견고히 다지는 것이 이번 체제 전환의 핵심""이라며 ""안정된 경영 기조 아래 지속가능한 성장과 기업가치 제고에 집중할 것""이라고 밝혔다.",https://n.news.naver.com/mnews/article/648/0000042425
2025-12-05 10:00:00,"[기자수첩]약가인하, 제약사 어디로 내모나","제약과 바이오 업계 분위기가 요즘 극명하게 엇갈리고 있다. 전통 제약사들은 정부의 '제네릭(복제의약품) 약가 인하 정책' 후폭풍으로 구조조정이 예상돼 생존을 걱정하고 있다. 반면 바이오 업체들은 생각하지도 못했던 정부의 위탁개발생산(CDMO) 지원 발표로 잔뜩 고무된 상태다.   정부는 지난 2일 바이오의약품 CDMO 특별법을 제정했다. 수출용 바이오의약품 제조업 신설에 따른 통관절차 간소화, GMP 인증 절차·제조시설 기술자문 및 수입특례 규정 등 위탁개발생산에 필요한 지원책을 '패키지'처럼 묶었다.  바이오 업계에 '당근'을 줬다면 제약 업계에는 '채찍질'을 가했다. 정부는 지난달말 전통 제약사들의 핵심 매출원인 제네릭 약가를 크게 낮추는 약가제도 방안을 발표했는데 이로 인해 전통 제약기업들은 그야말로 비상사태다.  제네릭은 고정비가 많이 들어가고 이익은 박하다. 즉 원료를 비롯해 생물학적동등성시험, 품질·제조관리 등 고정비 비중이 높아서 약값 자체를 낮추면 비용 부담에 이익을 거두기 힘들어 진다. 소형 제약사들은 이익은 커녕 적자로 돌아설 가능성이 높다.   전통 제약사 입장에선 이번 정부 약가 인하 정책으로 주요 매출원인 제네릭 기반 자체가 붕괴할 위기다. 제네릭 중심의 전통 제약기업들이 신사업으로 CDMO를 염두해 두지 않은 것은 아니다. 상당수 제약사들이 이 분야로 눈을 돌리면서 새로운 성장 동력으로 삼은 바 있다. 하지만 만만치 않은 도전이었다.  실제로 최근 몇년 사이 한미약품, GC녹십자, 대웅제약, 보령, 휴온스, HK이노엔 등이 CDMO 사업 진출에 도전장을 내밀었지만 쉽지 않다. 실제 수주 계약을 따낸 제약사는 손에 꼽을 정도다.  그 이유는 진입장벽이 높기 때문이다. 기존 제네릭 생산설비는 활용이 어렵고 바이오 공정기술 역량도 처음부터 다시 확보해야 해 대규모 설비 투자와 품질 시스템 구축에만 수백억에서 수천억원의 자금 투입이 필요하다. 여기에 CDMO의 핵심 고객이 글로벌 빅파마들인 만큼, 내수 시장 중심으로 성장해온 전통 제약사들은 글로벌 네트워크가 부족한 문제가 있다.  이러한 현실로 CDMO 확대가 산업 전체의 성장동력으로 작동하기보다 특정 기업 중심의 '승자독식' 구도를 더욱 견고하게 만드는 결과로 이어지고 있다.  제네릭 수익성 붕괴…캐시카우 찾아 CDMO로 발길  수출 중심 CDMO를 키우는 것은 국가 제약바이오 산업 성장에 분명 필요한 일이다. 그러나 정부 정책이 특정 CDMO 기업의 확대만 가속하고 전통 제약사를 압박하는 방식으로 작동한다면 '산업 내부의 양극화'는 더욱 심화될 수밖에 없다.  삼성바이오로직스 같은 CDMO 선두 기업들의 영업이익률이 30~40%대에 이르는 반면, 전통 제약사는 10%대에 머문다. 지금도 '버티는 장사'에 가깝다. 이런 상황에서 기업들이 높은 진입장벽에도 불구하고 높은 수익성만을 좇아 CDMO로 몰릴수록 결과적으로 제조 역량은 비대해지고, 정작 산업의 근간인 R&D 혁신은 후퇴하는 결과를 가져올 수 있다.  신약 R&D를 활성화하기 위해 제네릭 약가 인하를 추진하는 정부는 이러한 질문들에 대해 진지하게 고민해야 한다. 제네릭 수익 기반이 붕괴될 때 전통 제약사는 어떤 모델로 지속 가능성을 확보할 수 있을지, CDMO 외에 제약사들이 선택할 수 있는 새로운 성장 경로는 무엇인지, R&D와 제조 생태계를 '전체 산업 기준'에서 어떻게 균형 있게 설계할 것인지에 대해 말이다.  합성의약품 중심으로 역량을 다져온 제약기업이 바이오의약품 생산으로 사업을 확대하기란 생각보다 쉽지 않기 때문이다. 이 과정에서 전통 제약사들은 정작 자신들이 잘하던 영역과 미래 전략 사이에서 길을 잃고 있다. 무엇보다 심각한 것은 산업의 핵심 동력인 신약 연구개발(R&D)이라는 본질적 가치에서 점점 더 멀어지고 있다는 점이다.  전통 제약기업들의 제네릭 기반이 무너지고 CDMO로 몰리게 된다면 그건 새로운 돌파구가 아니라 막다른 길일지도 모른다. 지금 필요한 건 '한쪽을 밀고 한쪽을 당기는' 정책이 아니라, 전통 제약과 바이오 신산업이 함께 지속 가능한 구조를 만들 수 있는 균형감 있는 전략이다.",https://n.news.naver.com/mnews/article/648/0000042424
2025-12-05 09:12:00,"코인원, 법인고객 전용 서비스 오픈","가상자산 거래소 코인원이 법인 고객 전용 서비스 '코인원 비즈(BIZ)'를 오픈했다고 5일 밝혔다.  코인원 비즈는 법인 고객의 회원가입부터 거래까지 서비스 이용 정보와 함께 다양한 법인 전용 혜택을 담았다. 강력한 보안 시스템으로 예치한 자산을 안전하게 관리한다.  국내 거래소 중 유일하게 자금 분리 기능도 지원한다. 법인은 투자 전략과 목적에 따라 자산을 나눠 관리할 수 있다. 특히 API 고객에게는 국내 최저 거래 수수료율(0.02%)을 적용해 수수료 부담을 낮췄다.  또 거래 보고서 발급, 기관용 지갑 관리, 전담 어카운트 매니저 배정 등 계좌 운영을 전문가에게 체계적으로 관리받을 수 있다. 코인원은 법인 전용 문의 채널을 마련해 이용 중 발생하는 이슈를 신속하고 정확하게 대응할 방침이다.  이성현 코인원 대표는 ""가상자산 법인계좌 단계적 허용에 발맞춰, 상장 법인, 전문 투자법인과 같은 미래 고객층까지 서비스 제공 범위를 확대해 나갈 예정""이라고 말했다.",https://n.news.naver.com/mnews/article/648/0000042423
2025-12-05 08:58:00,"우리은행, 투·융자 전담 조직 신설…생산적금융 드라이브","우리은행이 생산적금융과 미래성장을 위한 조직개편을 실시했다.  우리은행은 지난 4일 투자은행(IB)그룹과 기업그룹에 투·융자 전담 조직을 각각 신설했다. 인공지능(AI)·반도체·이차전지 등 10대 첨단전략산업 중심의 유망 산업에 그룹 타 계열사와 함께 투자하고 지역성장기업 및 혁신벤처기업 등에 적시성 있는 금융지원을 강화하기로 했다.   비이자수익을 늘리기 위한 조직 정비도 했다. IB조직은 M&A와 지분투자 중심으로 전문성과 사업역량을 강화한다. 자금시장 조직은 마케팅과 운용 기능을 분리해 자산운용 효율성과 시장 대응력을 높인다. 연금 조직은 전략·마케팅과 영업지원 역할을 분리해 수익률 관리와 상품 라인업 확대에 주력한다.  기존 디지털전략그룹은 'AX(인공지능대전환) 혁신그룹'으로 변경했다. AX기반의 업무 프로세스 혁신을 통해 신속한 의사결정 체계를 구축하고 효율성을 향상시키고, 디지털자산 관련 사업도 체계적으로 추진할 방침이다.  IT 서비스 품질과 안정성 제고를 위해 IT그룹 내에는 'IT혁신본부'를 신설했다. 금융개발본부 소관부서도 일부 개편했다. 삼성월렛, BaaS 등 제휴 서비스를 비롯한 신사업에 대한 IT 지원 역량을 집중적으로 강화해 나간다.  브랜드전략그룹에는 '사회공헌부'를 신설해 금융의 사회적 책임을 한층 강화하기로 했고, 브랜드전략부에는 농구단과 사격단을 운영하는 스포츠마케팅팀을 신설했다.  아울러 미래 임원 후보군으로 성장할 본부장 인사도 실시했다. 이번엔 전체 구성원이 신뢰할 수 있는 리더십과 품성을 갖춘 본부장을 선발하기 위해 새롭게 강화된 승진 프로세스를 도입했다. 리더십 특별 연수, 강화된 외부 평판조회 등을 실시해 승진 평가에 반영했고 본부장 승진대상자 평가에 약 6000여 명의 임직원이 참여해 인사의 공정성과 신뢰도를 높였다.  우리은행 관계자는 ""이번 조직개편과 임원인사는 조직 전반의 운영 효율성을 높이고 장기 성장 기반을 더욱 공고히 하는 데에 집중했다""며 ""급변하는 환경에 맞춰 선제적인 대응체계를 구축함으로써 생산적 금융, AX 혁신을 주도해 미래성장동력을 지속적으로 강화해 나가겠다""고 말했다.",https://n.news.naver.com/mnews/article/648/0000042422
2025-12-05 08:28:00,한미그룹 5년안에 매출 5조…비만·신약 청사진 나왔다,"한미그룹이 2030년까지 그룹사 합산 매출 5조원을 목표로 한 중장기 비전을 발표했다.  '다시, 창조와 혁신'을 슬로건으로 내걸고 비만·항노화, 디지털헬스케어, 로보틱스를 미래 성장 축으로 삼아 글로벌 도약에 속도를 낸다는 계획이다.  한미그룹은 전날(4일) 서울 송파구 '한미 C&C 스퀘어'에서 'Hanmi Vision Day' 기업설명회를 열고 한미사이언스, 한미약품, JVM 등 주요 계열사의 2030년 성장 전략과 재무·주주환원 목표를 공개했다.  한미사이언스, 포트폴리오 재편… 약품·헬스케어 투 트랙  지주사 한미사이언스는 사업구조를 신약·바이오 중심의 한미약품(북경한미·한미정밀화학 포함)과 JVM·의료기기·컨슈머헬스·의약품 유통(온라인팜) 등 비약품 군으로 나누는 듀얼 포트폴리오 전략을 제시했다.  이를 위해 지주사 내에 기획전략본부와 이노베이션 본부를 신설해 미래 사업 발굴과 M&A, 글로벌 확장을 전담하게 했다. 약품 부문에서는 혁신신약 개발을 강화하고, Medtech&Healthcare(메드테크·헬스케어) 부문에서는 수술용 치료재료, 의료기기, 디지털 헬스 플랫폼, 컨슈머헬스·케어푸드·건강기능식품 등으로 영역을 넓혀 B2C 헬스케어 브랜드를 집중 육성한다.  글로벌 전략으로는 미국을 최우선 거점으로, 중국 생산법인과 함께 유럽·중동·남미·동남아 등으로 네트워크를 확장해 매출 기반을 다변화할 계획이다.  한미약품, 2030년 매출 2.9조… 비만·항노화로 확장  한미약품은 2030년까지 국내 1조9000억원·해외 1조원 등 총 2조9000억원 매출을 목표로 제시했다. 매년 연 매출 100억원 이상급 플래그십 제품 1개 이상 출시를 내걸고, 포트폴리오의 질적 성장도 동시에 추진한다.  세계 최초 1/3 저용량 항고혈압제 '아모프렐', 국내 제약사 최초 GLP-1 계열 비만 치료제 '에페글레나타이드', 롤론티스 오토인젝터 등 주요 제품을 중심으로 국내 시장 지배력을 높이는 한편, 글로벌 특허 만료 품목을 겨냥한 맞춤형 신제품과 라이선스 아웃을 통해 해외 매출을 키운다는 전략이다.  한미약품 R&D센터는 GLP-1 약물의 비만·염증·노화 기전을 활용해 항노화·역노화 파이프라인을 확대한다. 차세대 삼중작용 비만치료제 HM15275, 근육량 증가까지 겨냥한 HM17321 등을 개발 중이며, AI·바이오인포매틱스·오믹스 기반 연구 인프라를 강화해 항암·대사성질환·항노화 분야로 R&D 영역을 확장하고 있다.  JVM, 로보틱스 기반 글로벌 자동화 솔루션 기업으로  계열사 JVM은 의약품 자동 조제 솔루션 기반을 바탕으로, 로보틱스 기술을 접목한 글로벌 자동화 솔루션 기업을 목표로 한다. 2024년 약 1700억원 수준인 매출을 2030년 5000억원까지 끌어올린다는 계획이다.  로봇팔 적용 차세대 조제기 '메니스(MENITH)'와 바이알·블리스터 포장 솔루션 등 제품군을 확대하고, 북미·유럽 중심의 해외 매출 비중을 늘려 성장 속도를 높이겠다는 구상이다.  연평균 20%씩 성장… 주주환원율 30% 이상 목표  한미그룹은 2024년 약 2조원 수준 매출을 2030년 5조원으로 확대하는 것을 목표로 하며, 이를 위해 연평균 약 20% 성장을 약속했다.   먼저, 지주사 한미사이언스는 2030년까지 영업이익률 25% 이상을 계획하고 있다. 의료기기 및 뷰티케어 영역에서의 고부가가치 사업 확장과 그룹 계열사의 성장 견인을 통해 달성할 수 있을 것으로 예상된다.  한미약품은 20% 이상의 영업이익률을 목표로, 글로벌 수준의 R&D 역량을 바탕으로, 라이선스 아웃 성공과 국내외 블록버스터 신약 출시를 통해 달성해 나갈 계획이다.   한미그룹은 주주들을 위한 주주환원 정책도 계획하고 있다. 최소배당금제도를 우선 실시하고, 성장에 따른 이익을 주주들에게 환원하기 위해 최소총주주환원율 제도를 함께 운영해 나갈 계획이다. 한미사이언스는 30%, 한미약품은 20%, JVM은 20% 이상의 총주주환원율을 계획하고 있다.  또한, 자사주 매입과 임직원 주식기반보상제도를 통해 임직원의 성과 보상과 업무에 대한 동기부여뿐 아니라, 우수한 인재가 한미그룹에서 성장할 수 있는 기반을 마련하고, 나아가 안정적인 주주환원 정책을 펼쳐 나가고자 한다.  한미사이언스 CFO 심병화 부사장은 ""2030년에는 한미사이언스, 한미약품, JVM의 새로운 미래 성장동력에 대한 투자를 더욱 확대해 기업가치를 높이고, 주주가치의 상승을 함께 이루어 내겠다""고 말했다.",https://n.news.naver.com/mnews/article/648/0000042421
2025-12-05 07:40:00,"'쑥쑥' 크는 SOOP 광고 매출, 비결은?","스트리밍 플랫폼 SOOP의 광고 매출이 쑥쑥 성장하며 주요 수익원으로 자리잡고 있다. 대형 e스포츠 시장 경쟁력을 기반으로 콘텐츠형 광고 매출이 늘고 디지털광고 대행사 플레이디 편입 효과가 컸다.  SOOP의 광고 매출(연결기준)은 올해 3분기 누적 916억원으로 지난해 연간 매출(817억원)을 훌쩍 뛰어 넘었다. 총매출에서 차지하는 광고 매출 비중도 지난해말 19.8%에서 올해 3분기말에는 26%로 증가했다.  광고 매출이 늘어난 것은 플레이디 인수 효과가 컸다. 지난 3월 SOOP에 편입된 플레이디는 검색광고, 디스플레이 광고에 강점을 가진 회사로 올해 들어 3분기까지 누적 269억원의 매출을 올렸다.  여기에 대형 e스포츠 대회를 잇달아 개최해 콘텐츠형 광고 매출이 대폭 상승했다. SOOP의 분기별 광고 매출은 올해 1분기 218억원에서 2분기 308억원, 3분기 405억원으로 매분기100억원씩 증가하며 상승세를 이어가고 있다.   SOOP은 게임사와 협업으로 e스포츠 리그 등 행사와 방송 콘텐츠를 제작하고, 여기에 광고를 얹어 수익을 얻는다.  연간 80건 이상의 e스포츠 리그를 제작해온 SOOP은 올해도 아시아 태평양 지역의 발로란트 1군 리그 '2025 VCT 퍼시픽', 국내 배틀그라운드 최상위 리그 'PWS', 10년째 이어지고 있는 스타크래프트 리그 'ASL' 등 대형 대회를 열었다.  특히 e스포츠 콘텐츠 제작에 있어 SOOP은 업계 최고 수준의 역량을 갖춘 것으로 평가받는다. SOOP은 라이브 콘텐츠에 특화된 노하우와 다양한 방송 현장 경험을 기반으로 몰입도 높은 연출, 다채로운 앵글 설계 등 기획부터 제작 전 과정에 전문화된 역량을 갖고 있다.  사업 역량 강화를 위해 전문가 영입 등 인력과 시설 투자도 확대했다. 올해는 스타크래프트 리그를 만든 e스포츠 전문가 위영광 프로듀서를 콘텐츠 제작 본부장으로 영입했다. 또 관련 경력 10년 이상의 인력들로 구성된 프로덕션팀이 촬영과 연출을 맡고 실시간 편집 시스템 등을 갖추고 있다.  현재 네이버 치치직 등 경쟁업체들도 e스포츠 콘텐츠 확대에 나서고 있지만, 대부분 업체들이 기존 글로벌 리그들을 구매하는 데 비해 SOOP은 자체 제작 역량을 보유하고 있어 사업 확장성과 경쟁력이 뛰어나다는 평가를 받고 있다.  SOOP 관계자는 ""지속적인 기술 투자와 콘텐츠 고도화로 글로벌 제작 시장 내 협업 범위를 넓혀가고 있다""며 ""e스포츠 산업 내 신뢰받는 제작 파트너로의 입지를 강화해 나가겠다""고 말했다.",https://n.news.naver.com/mnews/article/648/0000042420
