날짜,제목,본문,링크
2025-12-03 10:58:00,"염창역 5분거리 서울 첫 LH 가로주택 ""5년만에 준공""","한국토지주택공사(LH)는 소규모 주거환경정비사업으로 진행한 강서구 염창동 '덕수연립' 가로주택을 준공했다고 3일 밝혔다. 동문건설이 시공을 맡아 지은 새 아파트는 '염창역 동문 디 이스트'다.  염창동 283 일원에 위치한 이 아파트는 지하 3층~지상 18층 총 66가구(대지면적 1763㎡) 규모로 지어졌다. 전용면적 59㎡ 32가구, 84㎡ 34가구로 구성됐으며, 이중 18가구가 작년 일반분양됐다. 청년·신혼부부 등을 위한 공공임대는 14가구로 차후 LH가 분양 공고를 할 예정이다.  가로주택정비사업은 노후·불량건축물이 밀집한 가로구역에서 기존 가로를 유지하며 진행하는 소규모 정비사업이다. 특히 'LH 참여형 가로주택정비사업은'은 민간 방식 대비 재원 조달, 감정평가, 건설관리 등에서 투명성과 안정성을 확보하고, 사업 기간이 짧아 신속한 주택공급이 가능했다.  덕수연립은 LH 참여형 가로주택정비사업의 서울 첫 준공사례로 현재 입주가 진행 중이다. 기존 재개발·재건축이 15년가량 걸리는 반면 덕수연립은 조합 설립부터 준공까지 5년 걸렸다.   LH는 내년 2월까지 '덕수연립 가로주택' 내 소규모정비사업 사업 현황부터 실제 모습 등을 체감할 수 있는 홍보 쇼룸도 운영할 예정이다.  한편 LH는 현재 서울 전역에 30개소 약 1만가구 규모 LH 참여형 가로주택정비사업을 추진하고 있다. 송파구 석촌동 '송파석촌 가로주택정비사업(55가구)'은 지난달 철거가 시작됐고, 마포구 연남동 '마포연남 가로주택정비사업(82가구)'은 이주가 완료돼 연내 철거가 시작된다. 2개 지구 총 137가구 규모다.   내년에는 △양천구 목동(159가구) △광진구 자양동(129가구) △서초구 양재동(45가구) 가로주택정비사업도 착공 절차를 진행할 예정이다. LH는 사업절차 간소화, 규제완화 등 제도개선을 적극 시행하고, 지속적인 간담회를 통해 주민 참여를 독려해 사업 속도를 더 앞당긴단 계획이다.  이상욱 LH 사장 직무대행(부사장)은 ""덕수연립은 조합 설립 후 5년 만에 입주까지 마친 도심 노후 주거지 정비 우수 성공 사례이자 새로운 모델""이라며 ""공공이 가진 투명성과 안정성을 바탕으로 단기간에 신속하게 도심 정비를 이뤄내 노후 주거지 개선 및 주택공급 확대에 기여할 것""이라고 말했다.",https://n.news.naver.com/mnews/article/648/0000042361
2025-12-03 10:52:00,"내년 여의도 빌딩 월세 얼마죠?…""AI로 알려드려요""","상업용 부동산 종합서비스 기업 알스퀘어가 상업용 부동산 자산 데이터를 제공하는 'RA(Rsquare Analytics)'의 출시 1년을 맞아 그동안의 성과와 인공지능(AI) 기반 확장전략을 공개했다.   이용균 알스퀘어 대표는 지난 2일 열린 서울 더 플라자 호텔에서 RA 그랜드 오픈 행사에서 ""RA의 등장으로 인적 네트워크에 의존하던 상업용 부동산 시장에 데이터 인프라 기반의 새 시대를 열었다""며 ""축적한 인사이트를 바탕으로 AI를 접목한 서비스 고도화에 나서겠다""고 밝혔다.  상업용 부동산, AI가 미래 가치까지 따진다  2009년 설립한 알스퀘어는 30만건 이상의 부동산 정보를 보유하고 있다. 오피스 임대차 시장에서 점유율은 30%에 달한다는 게 이 대표의 설명이다.   이 대표는 상업용 부동산 시장의 정보 비대칭이 극심하다는 점에 주목했다. 상업용 부동산의 투자와 관리, 운영 단계에서 인적 네트워크에만 의존하지 않고 데이터를 내세운다면 수익 사업에 활용할 수 있다는 판단을 내렸다.  이 대표는 ""알스퀘어는 데이터를 기반으로 성장했다""면서 ""수집한 데이터를 바탕으로 임대차 서비스를 넘어 매매 서비스까지 제공하게 됐고 단순한 사무실 외에 유통·물류 시설, 데이터센터 영역까지도 확장했다""고 말했다.  알스퀘어는 △부동산 DB·업무관리 솔루션 'RTB' △상업용 시장 분석 솔루션 'RA' △부동산 5대 공부 통합 열람 솔루션 'RD' △주거·빌딩 관리 ERP '홈닷 ERP' 등 다양한 데이터 사업 모형을 운영하고 있다. 알스퀘어는 이 같은 서비스 확장을 통해 올해 예상 매출을 2000억원으로 제시했다. 전년도 매출(1593억원)보다 25.5% 성장한 수치다.  특히 상업용 시장 분석 데이터 사업 모형인 RA는 지난해 출시 이후 1년간 전국 7000개 이상의 상업용 부동산 자산 데이터를 제공했다. 싱가포르 GIC, 독일 DWS, PAG 등 50개 이상 기관에 도입되기도 했으며 월평균 1만건, 누적 10만건이 넘는 상세 데이터가 거래·평가 실무에 활용됐다.  이 대표는 ""대형 빌딩 거래에서 상세한 정보를 종합적으로 볼 수 있는 건 RA가 유일하다""면서 ""개별 자산의 임대 현황과 수익성 지표, 장기 시장 추이, 권역별 벤치마크 데이터 등 마이크로·매크로 비교 정보를 실시간으로 살펴볼 수 있다""고 설명했다.  RA에 AI를 접목해 임대료 예측 모델과 자동가치산정(AVM) 기능 등을 도입한다는 게 알스퀘어의 계획이다. RA에 탑재한 지리정보 기반 입지분석 기능을 고도화해 AI 알고리즘이 입지 조건과 주변 상권 데이터를 종합 분석한 투자 적합도 지표도 제시하도록 한다.  이 대표는 ""끊임없는 데이터 품질과 실용성 개선을 통해 부동산 업계의 '블룸버그'와 같은 독보적 입지를 구축할 데이터 솔루션으로 자리매김하도록 하겠다""고 강조했다.   ""내년도 오피스 공실률 오른다""  이날 행사에서는 알스퀘어 리서치센터의 내년도 상업용 부동산 시장에 대한 전망도 공개됐다. 오피스 공실률은 전반적으로 오르겠으나 물류센터의 공실은 개선될 것이라는 게 알스퀘어 리서치센터의 예상이다.   류강민 알스퀘어 리서치센터장은 ""과거 오피스 임대 시장은 수요가 증가했으나 이제는 수요가 감소하고 있다""면서 ""대형 신규 공급이 집중된 광화문과 시청 등 CBD(서울도심) 권역은 임대인이 실질 임대료 인하 없이 현 조건을 고수하면 공실률이 일시적으로 두 자릿수까지 높아질 수 있다""고 짚었다.  특히 류 센터장은 2031년까지 서울에 약 230만평 규모의 오피스 공급이 예정됐는데 이 중 CBD에만 90만평 이상이 공급될 것으로 내다봤다. 대규모 공급이 예상되지만 경기 둔화로 오피스 고용 증가세가 예전만 못해 수요 창출은 제한적이라는 설명이다.  물류센터를 놓고는 공급 과잉을 지나 조정기로 진입했다는 게 류 센터장의 설명이다. 그는 ""내년 물류센터 시장은 공실률이 완만하게 낮아질 것""이라면서 신규 공급 급감을 이유로 들었다.  알스퀘어 리서치센터에 따르면 수도권 기준 2027년까지 예상되는 물류센터 신규 공급량은 연평균 37만평이다. 지난해 120만평이 공급됐던 걸 고려하면 3분의 1 수준이다.  류 센터장은 ""물류센터의 입지 측면에서는 교통비용이 저렴한 지역에 대한 선호가 클 것""이라면서 ""전국 4900여개의 읍·면·동을 대상으로 교통비용(거리x물동량)을 분석한 결과 성남·용인·화성·광주 등 경기 남부 지역이 광역 물류 최적의 입지로 판단한다""고 말했다.  류 센터장은 오피스텔 시장은 매매와 전월세가 엇갈린 흐름을 보일 것이라고 내다봤다. 그는 ""과거에는 아파트 규제가 강화되면 실수요가 오피스텔로 이동하며 매매가격이 상승했으나 정부의 10·15 부동산 대책에 오피스텔도 전매제한 1년과 다주택자에 대한 세제 중과를 적용해 반사효과가 제한적일 것""이라고 설명했다.  반면 전월세 시장은 중대형 면적을 중심으로 상승 압력이 나타날 가능성이 있다는 게 류 센터장의 예상이다. 그는 ""오피스텔 시장은 독특한 수요 구조가 있다""면서 ""2017년부터 아파트 중심 규제가 강해지면 2인 이상 가구의 실수요가 중대형 오피스텔로 이동하는 흐름이 있고 이는 오피스텔의 전월세 가격 상승을 이끌 수 있는 요인""이라고 짚었다.  류 센터장은 ""부동산 시장은 전반적으로 과거 대비 안정성과 수익성이 낮아졌지만, 이는 건전한 시장 성숙 과정의 일환""이라며 ""무리한 레버리지를 통한 자산가치 급등보다는 내실 있는 운용과 장기적 관점이 필요한 시기""라고 강조했다.",https://n.news.naver.com/mnews/article/648/0000042360
2025-12-03 10:43:00,"NHN클라우드, 스트래티지와 공공·민간클라우드 공동 공략","엔에이치엔클라우드(NHN클라우드)는 인공지능(AI) 기반 데이터 분석·비즈니스 인텔리전스(BI) 기업 스트래티지 코리아와 공공·민간 클라우드 공동사업을 추진한다고 3일 밝혔다.  스트래티지는 기업이 데이터 기반 효율적인 의사결정을 내릴 수 있도록 지원하는 기술·프로세스·도구 등의 BI 솔루션을 운영한다. 텍스트를 입력하는 것만으로도 데이터를 분석해 추출하고 시각화 대시보드를 생성하는 AI 기반 분석 기능, 데이터 통합 플랫폼 '모자익' 등을 운영하고 있다.  양사는 업무협약(MOU)를 맺고 공공기관을 비롯한 엔터프라이즈 고객에 AI 기반 비즈니스 BI 분석 시스템을 클라우드 형태로 공급하기 위해 협력하기로 했다.  NHN클라우드는 스트래티지의 솔루션이 클라우드 환경에서 운영될 수 있도록 인프라, AI 애플리케이션 프로그래밍 인터페이스(API), 보안 체계 등을 제공한다. 스트래티지는 솔루션의 클라우드 전환에 필요한 데모 라이선스를 공급한다.  정성후 스트래티지코리아 지사장은 ""공공 데이터 활용은 클라우드의 확장성과 보안성, 그리고 실사용자 중심의 분석 경험이 균형 있게 제공되는 것이 핵심""이라며 “양사의 협력을 통해 공공기관의 디지털 전환 가속화는 물론, AI 기반 행정 혁신의 모범사례를 함께 만들어갈 것""이라고 말했다.  김동훈 NHN클라우드 대표는 ""양사가 갖춘 전문 역량을 결합해 공공·민간 고객사들이 더욱 쾌적한 환경에서 데이터를 파악 및 분석하고 의사결정을 돕는 서비스를 선보이고자 최선을 다하겠다""고 밝혔다.",https://n.news.naver.com/mnews/article/648/0000042359
2025-12-03 10:40:00,LGU+ 양자내성암호 공모전서 국민대팀 대상 수상,"LG유플러스는 양자내성암호(PQC, Post-Quantum Cryptography) 전환 기술 공모전을 성료했다고 3일 밝혔다. 이번 공모전은 양자컴퓨터 시대를 대비해 양자내성암호 기술의 혁신적인 적용 방안을 발굴하고 우수 인재를 양성하기 위해 마련됐다.  이번 공모전은 LG유플러스와 한국지능정보사회진흥원, 한국정보보호학회, 크립토랩, 양자산업생태계지원센터가 함께 개최했으며, 전국 대학 및 대학원에서 총 9팀이 참가했다. 참가자들은 PQC 마이그레이션 플랫폼을 활용해 알고리즘을 직접 검증하고 성능 테스트를 수행하며 실무 경험을 쌓았다.  1차 서류심사와 2차 발표평가를 통해 기술 완성도·보안성·확장성 등을 종합적으로 평가한 가운데 국민대학교 'HSM' 팀이 대상을 차지했다. HSM 팀은 제한된 메모리와 처리 능력을 가진 임베디드 환경에서 수학적 최적화 기법을 사용해 PQC 알고리즘의 성능 향상 성과를 선보여 높은 평가를 받았다. 최우수상은 한성대학교 '이음', 대구경북과학기술원 'UGRP' 팀이 수상했다. 우수상은 한성대학교 '김김윤윤모', 부경대성학교 '웨하스' 팀이 수상의 영예를 안았다.   LG유플러스는 이번 대회를 통해 국내 PQC 기술 저변 확대와 차세대 보안 인재 양성을 이어갈 계획이다. 향후 PQC 기술을 실제 통신·서비스 환경에 적용하기 위한 산학 협력 프로그램을 확대하고, 관련 세미나도 정기적으로 개최할 예정이다.  김은주 한국지능정보사회진흥원 지능기술인프라본부장은 ""참가자들의 아이디어와 기술력에서 국내 PQC 산업의 밝은 미래를 확인했다. 산업계 전반의 PQC 전환 가속화를 위해 지속적으로 협력할 것""이라고 말했다.  주엄개 LG유플러스 유선사업담당 상무는 ""모든 팀이 수준 높은 결과물을 제출하며 국내 PQC 기술에 대한 관심을 보여줬다. 이번 공모전이 국내 PQC 생태계 조성과 기술 경쟁력 강화의 촉매제가 되길 기원한다""고 말했다.",https://n.news.naver.com/mnews/article/648/0000042358
2025-12-03 10:36:00,'한국 여행 필수 코스' 올리브영…외국인 구매액 1조원 돌파,"올해 한국을 찾은 외국인 관광객들이 올리브영 매장에서 1조원 이상 구매한 것으로 나타났다.  CJ올리브영은 올 1월부터 11월까지 전국 오프라인 매장에서 발생한 방한 외국인 누적 구매 금액이 1조원을 달성했다고 3일 밝혔다.  엔데믹 전환기에 접어든 2022년 연간 실적과 비교했을 때 약 26배 커진 규모다. 당시 전체 오프라인 매출의 2% 수준이던 외국인 매출 비중은 2023년 처음으로 10%대에 진입한 데 이어 올해 처음으로 25%대를 넘었다. 올리브영 매장이 '한국 여행 필수 코스'로 자리잡으며 K뷰티 제품을 찾는 외국인들이 늘어난 결과다.  같은 기간 택스리펀드기업 글로벌텍스프리(GTF)에서 발생한 국내 화장품 결제건수의 88%는 올리브영 매장에서 나온 것으로 집계됐다. 단순 계산하면 국내에서 화장품을 구매하는 외국인 10명 중 9명이 올리브영을 찾는 셈이다. 매장에서 세금 환급을 받은 외국인 국적 수는 유엔(UN) 정회원국 기준 190개로 나타났다.  올해 올리브영에서 구매하는 외국인의 약 40%가 2곳 이상의 매장을 방문한 것으로 조사됐다. 특히 외국인 고객의 구매는 서울 외 지역에서 크게 늘어나고 있다. 올 1월부터 10월까지 비수도권 지역의 외국인 구매 건수는 2022년 대비 86.8배 늘어나며 수도권(20.5배)을 크게 상회했다. 제주(199.5배)의 성장세가 돋보였으며 광주(71.6배), 부산(59.1배), 강원(57.9배) 등 대부분의 광역 지자체에서도 외국인 구매가 크게 늘었다. 외국인 쇼핑 수요가 전국으로 확대되고 있는 셈이다.  K뷰티에 대한 외국인의 수용도가 높아지며 장바구니에 담는 브랜드도 다양해지는 추세다. 올리브영 매장을 방문한 외국인들의 과반 이상(58%)은 6개 이상의 브랜드를 구매하고 있으며, 10개 이상의 브랜드를 구매하는 고객은 전체의 33%에 달했다.  올리브영은 더 고도화된 글로벌 관광 상권 전략을 바탕으로 K관광 산업을 견인하는 한 축으로 K뷰티를 육성한다는 계획이다. 국가별 명절과 K팝 콘서트 등 방한 피크 시즌에 맞춰 상권 운영 체계를 최적화 할 예정이다. 또 외국인들이 귀국한 후에도 쇼핑 경험을 이어갈 수 있도록 역직구 플랫폼 '글로벌몰'과의 연계도 강화키로 했다.  올리브영 관계자는 ""방한 외국인 구매액 1조원 달성은 중소·인디 브랜드가 올리브영을 통해 전세계 고객을 만나며 함께 이룬 성취라는 점에서 의미가 깊다""며 ""K뷰티가 단순한 트렌드를 넘어 한국을 다시 찾는 이유이자 국내 인바운드 관광의 핵심 요소가 될 수 있도록 최선을 다하겠다""고 말했다.",https://n.news.naver.com/mnews/article/648/0000042357
2025-12-03 10:35:00,"홍라희, 삼성물산 지분 1.06% 전량 이재용에 증여","홍라희 리움미술관 명예관장이 보유해온 삼성물산 지분 전량을 장남 이재용 삼성전자 회장에게 넘긴다. 삼성그룹 지배구조 정점의 지분 이동이라는 점에서 상징적 의미가 크다.  삼성물산은 홍 명예관장이 보유하고 있던 삼성물산 주식 180만8577주(지분율 1.06%)를 이 회장에게 증여한다고 2일 공시했다. 증여일은 내년 1월 2일이다. 체결일은 지난달 28일이며 당시 종가 기준 주식 가치는 약 4070억원이다. 이로써 이 회장 지분율은 기존 19.93%에서 20.99%로 상승하게 된다.  이번 지분은 2021년 고(故) 이건희 삼성 선대회장 별세 이후 법적 상속 비율에 따라 홍 명예관장이 취득한 몫이다. 재계는 지배구조 자체가 흔들릴 가능성은 적다고 보고 있다. 이미 이 회장이 확고한 최대 주주인 만큼 1%포인트 안팎의 지분 증가가 경영권 안정성에 큰 변화를 일으키기 어렵다는 이유에서다.  다만 증여계약 체결일이 눈길을 끈다. 지난달 28일은 이 회장과 홍 명예관장이 장남 지호씨의 해군·해병대 사관후보생 임관식에 참석한 날이다. 이서현 삼성물산 사장도 함께 자리한 만큼 가족 간 상징적 의미가 담긴 결정이라는 해석이 삼성 안팎에서 나온다.  증여세 부담은 상당할 전망이다. 증여분이 30억원을 넘어서면서 최고세율 50%가 적용되고 최대주주 할증을 반영하면 세율은 약 60% 수준까지 올라간다. 이 회장이 부담해야 할 세금은 2000억원 이상으로 추산된다.  홍 명예관장은 삼성물산 외에도 삼성전자 지분을 보유하고 있다. 지난 10월 상속세 마련을 위해 삼성전자 주식 1000만주 매각 신탁 계약을 체결하면서 보유 지분은 9797만8700주에서 8797만8700주로 줄었다. 이로써 홍 명예관장의 지분율은 1.66%에서 1.49%로 내려가며 처음으로 이 회장 지분율보다 낮아졌다.  한편, 삼성 오너일가는 이 선대회장 별세 후 2021년부터 5년 동안 6회에 걸쳐 연부연납 방식으로 상속세를 납부하고 있다. 마지막 납부는 내년 4월이다. 이번 지분 증여는 상속세 납부 절차가 끝나는 시기와도 맞물려 삼성 일가의 지분·자산 정리 흐름 속에 놓여 있다는 평가다.",https://n.news.naver.com/mnews/article/648/0000042356
2025-12-03 10:34:00,"""채널 경쟁력 동시 확보""…GS리테일, 미디어 고도화","GS리테일이 온·오프라인 인프라를 활용한 통합 광고 솔루션을 내놓는다. 채널 간 유기적인 연결을 통해 일관된 고객 경험을 제공하기 위한 취지다.  GS리테일은 온∙오프라인 통합 인프라를 기반으로 한 '리테일 미디어' 사업 고도화에 속도를 낸다고 3일 밝혔다. 리테일 미디어는 유통사가 보유한 데이터를 활용해 자사 플랫폼에서 광고를 제공하고 수익을 창출하는 비즈니스 모델이다. 고객에게는 맞춤형 쇼핑 정보를, 광고주에게는 효율적인 타깃 마케팅 환경을 제공해 광고 수익은 물론 플랫폼 활용도와 자체 상품 매출 증대까지 기대할 수 있다.  이를 위해 GS리테일은 GS25·GS더프레시 매장과 우리동네GS 앱을 연동하는 등 온·오프라인 인프라를 총동원해 채널 특성에 최적화된 리테일 미디어 인프라를 구축했다. 먼저 매장에 설치된 '인스토어 미디어'는 카운터·출입문·진열대 등에서 디지털 사이니지 '탑뷰'와 'GSTV'를 통해 광고 콘텐츠를 송출하는 방식으로 운영된다. 현재 인스토어 미디어 운영 점포 수는 편의점, 슈퍼마켓을 합쳐 5000여 개에 달한다.  이 중 약 100개 매장에는 인공지능(AI) 기술 기반의 카메라를 설치했다. AI 카메라를 활용해 고객 연령대·성별·구매 행동 등을 분석해 광고주에게 광고 효과 분석과 성과 리포트를 제공, 정교한 맞춤형 광고를 송출할 수 있게끔 돕는다. 기존에 어려움을 겪었던 오프라인 광고의 성과 측정 한계를 효과적으로 극복하고 있다는 설명이다.  우리동네GS를 기반으로 운영되는 '모바일 미디어'는 배너 광고, 검색 영역 등을 활용한 다양한 모바일 광고 상품을 제공한다. 별도 이벤트 페이지를 통해 입점 브랜드의 단독 기획전도 진행한다. 이와 함께 고객 락인 효과를 높이기 위해 쇼핑·미디어·엔터테인먼트가 결합된 고객 참여형 앱테크 서비스 '우리동네 놀이터 시즌 2'도 론칭했다.  리테일 미디어 사업을 통한 효과도 가시화되고 있다. GS리테일에 따르면 최근 한 달간 GS25 온·오프라인 미디어에 노출된 편의점 행사 상품의 판매량은 전분기 대비 약 2배 이상 증가한 것으로 나타났다.   이정표 GS리테일 마케팅부문장은 ""업계 최고 수준의 온·오프라인 인프라와 마케팅 역량을 기반으로 리테일 미디어 환경을 선제적으로 구축해왔다""며 ""앞으로도 O4O(Online for Offline) 전략을 중심으로 데이터 기반 광고 기술을 고도화해 리테일 미디어 시장에서 확고한 경쟁 우위를 확보하겠다""고 말했다.",https://n.news.naver.com/mnews/article/648/0000042355
2025-12-03 10:33:00,"LF 헤지스, 키즈 라인 첫 선…'패밀리 브랜드'로 확장","헤지스가 키즈 라인업을 론칭하며 패밀리 브랜드로 확장을 꾀한다.  LF의 캐주얼 브랜드 헤지스(HAZZYS)가 2025년 F/W 시즌부터 키즈 라인업을 전개한다고 3일 밝혔다.  이번에 처음 선보이는 키즈 라인업은 온 가족이 함께 입을 수 있는 패밀리룩 콘셉트로 기획됐다. 점퍼, 스웨터, 셔츠, 팬츠 등 약 20종이다.  판매 채널은 LF몰, 헤지스닷컴 등 자사 온라인몰과 헤지스 명동 플래그십 스토어 '스페이스H', 라움 이스트, 주요 백화점과 쇼핑몰 등이다.  헤지스는 기후 변화로 계절 경계가 흐려지는 흐름에 대응해 경량 아우터와 하이브리드 제품을 전략적으로 운영하고 있다. 이 전략을 키즈 라인에도 동일하게 적용해 키즈 패딩과 키즈 구스 다운을 출시했다. 이는 판매량 증가로 이어지고 있다. 실제로 중량 점퍼와 퀼팅 점퍼 판매량이 늘었다. 성인과 키즈 제품을 동시에 구매하는 고객도 증가하는 추세다.  헤지스는 2026년 S/S 시즌부터 더 정교한 시즌별 키즈 라인업을 구축할 예정이다. 액세서리 라인 확장 등 라이프스타일까지 연결하는 패밀리 브랜드 전략을 강화할 계획이다.   헤지스 관계자는 ""헤지스가 성인 라인에서 구축해 온 고유의 프리미엄 컨템포러리 캐주얼 감도를 키즈까지 확장함으로써 가족이 함께 입었을 때 더욱 헤지스다운 일관된 무드를 완성할 수 있다""며 ""최근 글로벌 프리미엄 키즈 시장 성장 속에서, 헤지스는 시장 변화에 민첩하게 대응하며 글로벌 패밀리 브랜드로서 유연하게 성장해 나갈 계획""이라고 말했다.",https://n.news.naver.com/mnews/article/648/0000042354
