날짜,제목,본문,링크
2025-12-05 18:01:00,"포스코, 여성 리더 전면 배치…전담조직 통해 안전 경영에 '만전'","포스코그룹이 전사 구조를 손보고 여성 리더를 전면에 배치하며 조직 전열을 다시 짰다. 안전 무관용 체계와 글로벌 투자 실행력, 인공지능(AI)·DX 기반의 기술 경쟁력 강화를 세 축으로 한 조직개편과 임원 인사를 조기에 단행하며 장인화 회장 체제의 실행력 중심 경영이 본격화됐다는 평가다.  안전·해외투자·DX 중심으로 조직 재편…전사 구조 손봤다  5일 포스코그룹은 2026년도 조직개편·임원인사를 단행했다. 이번 조직개편의 최우선 순위는 안전문화 재건이다. 그룹은 안전 전문 자회사인 포스코세이프티솔루션을 출범시키고 포스코와 포스코인터내셔널에 각각 안전 전담 조직을 신설했다. 포스코이앤씨는 안전 체계 재정비와 함께 플랜트사업본부와 인프라사업본부를 통합해 임원 조직을 20% 줄였다.  글로벌 투자 실행력도 대폭 강화했다. 포스코는 인도·미국 프로젝트를 총괄하는 '전략투자본부'를 신설해 JSW 합작 사업을 포함한 해외 철강 투자 기능을 직접 관리한다.  포스코인터내셔널은 LNG 탐사·생산·운송·발전 등 전체 밸류체인을 하나로 묶는 '에너지부문'을 신설해 내부 시너지를 확대한다. 포스코퓨처엠은 에너지소재사업본부를 마케팅과 생산으로 분리해 수주 확장과 제조 효율성을 동시에 강화했다.  DX 추진도 핵심 개편 요소로 자리잡았다. 포스코인터내셔널은 기존 DX 조직을 'DX전략실'로 통합하고 포스코퓨처엠은 'DX추진반'을 신설했다. 포스코DX는 IT 인프라 구축 기능을 넓혀 그룹사 디지털 전환의 속도를 높인다.  여성 대표 전면 배치…AI·R&D 리더십도 재구성  임원 인사는 여성 약진과 세대교체가 두드러졌다. 포스웰 이사장에는 최영 포스코홀딩스 사회공헌실장(전무), 엔투비 대표에는 안미선 포스코이앤씨 구매계약실장(상무)이 각각 선임돼 사업회사 여성 대표가 두 명 동시에 배출됐다. 여성 전무 승진자도 IR·기술전략·IT사업 등 3명으로, 주요 조직에서 역할이 확대됐다.  DX·R&D 영역은 70~80년대생 중심으로 전열을 재정비했다. 그룹DX전략실장은 UNIST 임치현 부교수가 맡아 AI·디지털 기반 전략을 이끈다. AI로봇융합연구소장은 포스코DX 윤일용 센터장이 선임됐으며 철강 R&D의 핵심 거점인 포스코 기술연구소는 엄경근 강재연구소장이 승진해 이끈다. 해외사업 전담 리더십도 강화됐다. 천성래 사업시너지본부장은 인도 합작 법인(P-India)으로 이동해 현지 프로젝트 실행을 맡고 정석모 산업가스사업부장은 본부장으로 승진했다.  포스코그룹은 장 회장 취임 후 '2 코어(철강·이차전지소재)+뉴 엔진(New Engine)' 전략을 축으로 사업 포트폴리오를 재편해왔다. 그룹은 이번 조직·인사 조정으로 글로벌 투자사업을 차질 없이 추진하고 중장기 경쟁력 확보 흐름을 가속화한다는 계획이다.",https://n.news.naver.com/mnews/article/648/0000042446
2025-12-05 17:46:00,또한번 외부수혈...신한운용 사장에 운용전문가 이석원 발탁,"신한자산운용의 고속성장 주역인 조재민 사장이 올해말 임기를 끝으로 물러난다. 후임은 4년 전 조 사장처럼 외부출신 운용전문가다.   신한금융지주는 5일 자회사최고경영자후보추천위원회(자경위)를 열고 이석원 전 국민연금공단 기금운용본부 전략부문장을 신한자산운용 신임 사장 후보로 추천했다.   1968년생인 이 후보는 고려대학교 경제학과를 졸업, 같은 대학에서 석사학위를 받고, 한성대학교 경영학 박사과정을 거쳤다.   장은투자신탁운용에서 운용업계 첫발을 딛었고, 이후 미래에셋자산운용과 KB자산운용을 거쳐 2011년부터는 하이자산운용(현 iM에셋자산운용) 주식운용본부에서 상무를 지냈다. 2018년 국민연금공단으로 자리를 옮긴 후 기금운용본부 주식운용실장과 전략부문장을 맡았다.  자경위는 이 후보자에 대해 ""기금운용본부 최초로 공모에 의해 주식운용실장으로 영입된 뒤, 성공적으로 안착해 전략부문장까지 역임했으며, 자산운용업계 내에서 전문성과 리더십 모두 높은 평가를 받는 인물""이라고 평가했다.  이례적 2년 연임했던 조재민, 추가 1년 대신 다시 외부전문가  이석원 후보자 추천과 함께 현 조재민 사장은 올해말을 임기로 물러나게 됐다. 조 사장은 1988년 씨티은행에서 출발해 동양증권, 크레디트아그리콜 홍콩지점, 스탠다드뱅크 홍콩지점 등에서 외환과 채권 딜러로 활약한 외국계은행 출신이다.   1999년 마이다스에셋자산운용 인수로 운용업계에 발을 들인 후 2022년 신한운용내 최초 외부인사로 사장직에 올랐다. 특히 2024년에는 2+1의 임기 관행을 깨고 2년의 추가임기를 부여받으면서 업계에선 이례적인 2+2 연임을 했다.   업계에선 조 사장이 오랜 운용업계대표 경력과 신한운용에서의 ETF 고속성장 성과를 바탕으로 추가로 1년 더 임기를 부여받는 것을 점치기도 했다.  실제로 조 사장 취임 전인 2021년말 6000억원이 채 되지 않던 신한운용의 ETF 순자산규모는 조 사장 임기 4년만에 10조원을 돌파했다.  운용업계 관계자는 ""업계에선 유일하게 '2+2' 연임을 한 것으로 이미 조 사장의 능력은 인정받은 것""이라며 ""신한운용이 또 다른 성장을 위해 조 사장 때처럼 외부에서 운영전문가를 모신 게 아닌가 생각된다""고 평가했다.  신한금융은 이석원 후보가 연금운용 경험을 바탕으로 조 사장이 다져 놓은 신한운용을 새롭게 성장시킬 것으로 기대하고 있다. 자경위는 ""SOL ETF의 선전으로 고무된 신한자산운용에서 이석원 후보가 폭넓은 경험과 전문성을 살려 회사를 한 단계 더 도약시킬 수 있을 것""이라고 밝혔다.",https://n.news.naver.com/mnews/article/648/0000042445
2025-12-05 17:30:00,"큐리어스, 이도에 3000억 투자…IPO 체질 만들기 돌입","국내 구조개선 전문 사모펀드(PEF) 운용사 큐리어스파트너스(이하 큐리어스)가 환경·인프라 운영관리 기업 이도에 3000억원 규모의 구조화 투자를 추진한다. 이번 거래는 단순한 성장자금 투입이 아니라, 누적된 차입 부담을 조정하고 비핵심 자산 매각과 기업공개(IPO)까지 단계적으로 엮은 관리형 구조개선 패키지 성격이 강하다는 평가가 나온다.  5일 투자은행(IB) 업계에 따르면 큐리어스파트너스는 최근 이도에 3000억원을 투자하기로 결정했다. 투자는 이도가 발행하는 전환우선주(CPS)와 전환사채(CB)를 인수하는 형태다. 큐리어스는 기존 블라인드펀드에서 1050억원, 신규로 결성한 프로젝트펀드에서 450억원을 각각 투입하고, 인수금융 1500억원을 더해 재원을 마련한다.  이번 투자에는 최소 상각전영업이익(EBITDA) 달성과 순차입금 감소 조건, 콜옵션과 풋옵션 등이 결합됐다. 큐리어스는 향후 IPO, 사업부문 분할 등을 통해 전체 기준 약 13%, PEF 투자 기준 약 19% 수준의 내부수익률(IRR)을 목표로 하고 있다.  이 같은 조건 설정은 투자 성과를 IPO 성패에만 걸지 않고, 투자 기간 이도의 현금창출력 개선과 재무 안정화를 동시에 관리하겠다는 의미로 해석된다. EBITDA와 순차입금 지표가 직접 연동된 만큼 향후 경영의 주요 관리 지표는 수익성 개선과 차입 축소에 맞춰질 전망이다. 콜옵션과 풋옵션 역시 상장이나 자산 매각 일정이 지연될 가능성까지 감안한 안전장치로 풀이된다. 회수 경로에 대한 유연성을 확보하려는 의도가 읽힌다.  이도가 투자유치에 나선 배경에는 급격한 사업 확장 과정에서 누적된 재무 부담이 꼽힌다. 회사는 환경·인프라 사업을 중심으로 골프·레저, 부동산 등으로 사업 영역을 확대하며 대규모 자산 매입 투자를 지속해 왔다. 이 과정에서 차입 규모가 빠르게 늘었고, 금융비용 부담도 함께 확대됐다.  재무지표도 이러한 부담을 그대로 보여준다. 이도의 부채비율은 2021년 290%에서 지난해 446%로 치솟았다.  부채 규모뿐 아니라 만기 구조도 문제다. 지난해 유동부채는 4946억원으로 전년보다 67.9% 급증했다. 이 가운데 2798억원이 1년 안에 상환해야 하는 유동성장기차입금이다. 단순 부채가 많은 것보다 단기간에 갚아야 할 금액이 한꺼번에 늘어난 점이 부담 요인이다.  단기 상환 압박은 전환사채(CB)에서도 가시화됐다. 2023년까지 비유동부채로 분류되던 CB 전액(426억원)이 지난해 유동성CB(475억원)로 이동했다. 상환할증금 누적과 전환권 재평가로 장부금액이 증가한 가운데 풋옵션 행사 가능 시점에 진입하면서 1년 내 상환 대상 채무로 재분류된 영향이다.  지난해 말 기준 이도가 1년 안에 대응해야 했던 핵심 금융부채(단기차입금+유동성장기차입금+유동성사채+유동성CB)의 합계는 4132억원에 달했다. 영업현금흐름만으로는 대응이 어려워 외부 자금조달이나 자산 매각 없이는 유동성 리스크가 커질 수 있었다는 평가다.  큐리어스는 이번 투자를 통해 이도의 차입 구조를 정리하는 동시에 비핵심 자산 매각과 핵심 사업 중심의 선택과 집중을 병행한다는 구상이다. 실제로 이도는 지난 9월 매각 예정 자산 가운데 하나였던 ‘클럽디금강’ 매각을 통해 905억원을 확보하며 선제적인 유동성 보강에 나선 바 있다.  향후에도 추가적인 자산 매각을 통해 순차입금을 단계적으로 축소하고, 재무제표를 상장 친화적인 구조로 재편할 것으로 보인다. 이르면 내년 혹은 내후년에는 본격적인 IPO 작업에 착수할 예정이다.  IB업계에서는 이번 거래를 단순한 자금 수혈이 아니라, IPO 전에 재무구조를 미리 손질하는 ‘관리형 구조개선 투자’로 보고 있다. 기존 대주주 체제는 유지한 채 큐리어스가 재무·자산·자본 구조 전반에 사실상 실질적 관리 역할을 하며 상장 준비 과정을 함께 끌고 가는 형태다. 단기 유동성만 메우는 투자라기보다 상장에 필요한 재무 여건을 단계적으로 만들어가는 성격이 짙다는 게 시장의 평가다.  한 IB업계 관계자는 이번 딜에 대해 “재무구조를 재정비하고, 필요하면 자산을 정리해 상장 가능성을 높이는 구조화 투자”라고 평가했다.  큐리어스는 그동안 삼성중공업 드릴십, 성동조선해양 등 굵직한 구조개선 거래를 수행해 온 스페셜 시추에이션 전문 운용사다. 주로 영업은 정상적으로 이뤄지지만 재무 레버리지가 과도해진 기업에 들어가 부채와 자본 구조를 다시 정비해 회수 여건을 만드는 방식을 활용해 왔다. 이번 이도 투자 역시 같은 전략의 연장선상에 있다는 분석이다.",https://n.news.naver.com/mnews/article/648/0000042444
2025-12-05 17:14:00,[인사이드 스토리]큰 그림 그리는 현대차…구조 변화 신호탄?,"현대차그룹이 연말을 앞두고 조직 개편에 나섰습니다. 국내사업본부장과 제네시스사업본부장을 교체하고, 소프트웨어 총괄 수장까지 동시에 교체되면서 시장에서 다양한 해석이 나오고 있습니다.  국내사업본부 재정비…판매 조직 중심 재구축  지난 4일 현대차그룹은 국내사업본부장과 제네시스사업본부장 교체를 포함해 일부 임원 인사를 단행했습니다. 여기에 소프트웨어 개발을 총괄해 온 송창현 사장의 사의 표명까지 겹쳤죠.  눈에 띄는 건 영업·상품·소프트웨어 조직에 모두 변화가 있었다는 건데요. 먼저 국내사업본부를 이끌던 정유석 부사장 후임으로 국내판매사업부장 김승찬 신임 부사장이 승진 임명됐습니다. 김 부사장은 기존 직무와 겸임하며 국내판매사업을 총괄하게 됐는데요. 국내 판매 전략과 현장 운영을 오래 다져온 실무형 인사라는 평가입니다. 체계 일원화와 판매 조직의 기동성을 높이려는 의도로 풀이됩니다.  프리미엄 브랜드 제네시스도 수장이 바뀌었습니다. 제네시스사업본부장을 맡았던 송민규 부사장 자리에 북미권역상품실장 이시혁 신임 전무가 승진 발탁됐죠. 이 전무는 북미권역기획실장, 북미법인(GMNA) 업무총괄 등을 거치며 현지 시장과 소비자 요구를 읽어내는 역량을 쌓아온 인물입니다. 글로벌 프리미엄 전략을 재설계하고, 시장별로 차별화된 포트폴리오를 구축하는 역할을 맡을 것으로 보입니다.  해외 조직도 손봤습니다. 기존 '인도아중동(인도·중동·북아프리카)대권역' 조직을 개편해서 인도를 별도 권역으로 독립시켰습니다. 잠재시장으로 불리는 인도의 조직 위상을 강화하겠다는 의도죠. 인도권역본부장으로는 실무를 총괄하던 타룬 가르그 인도권역 COO(최고운영책임자)가 옮겼고, 아중동권역본부장으로는 박동휘 신임 전무가 승진 이동했습니다.  송창현 본부장의 사퇴도 주목되는 대목입니다. 현대차는 ""일신상의 사유""라고 밝혔지만, SDV(소프트웨어중심차) 개발을 이끌던 핵심 인물이 떠나면서 미래차 추진 동력이 약화되는 게 아니냐는 우려도 나왔습니다.  계열사로 흩어진 SW 역량…개편 신호탄?  이런 가운데 장재훈 현대차그룹 부회장이 그룹의 방향성을 재확인하고 나섰습니다. 장 부회장은 4일 경기도 현대 모터스튜디오 고양에서 열린 기자 간담회에서 ""자율주행 기술 흐름을 보면 지금 단계보다 다음 기술을 미리 준비하는 것이 더 중요하다""고 말했습니다.  그는 미국 자율주행 합작법인 모셔널을 언급하며 ""웨이모 수준까지는 아니지만 그렇게 할 수 있는 로보택시를 만들고 있다""며 ""상용화의 거리가 있지만, 기술을 확보하고 내재화시키는 것으로 가야한다""고 강조했죠.  특히 그룹 전체 차원에서는 에너지와 인공지능(AI) 방향으로 나아가야 한다고 밝혔습니다. 장 부회장은 ""현대차그룹은 자동차를 중심으로 수직계열화됐는데 앞으로 더 가려면 에너지와 AI 쪽이 맞는 것 같다""며 ""전체적인 조직 방향도 그쪽으로 보고 있고 실현 속도와 기술적 완성도가 중요할 것 같아 달리고 있다""고 말했습니다.  이 같은 발언 배경에는 업계가 지적해온 'SW 역량 분산' 문제가 자리하고 있습니다. 업계에서는 현대차의 소프트웨어 역량이 여러 계열사에 흩어져 있다는 점을 성장 한계로 꼽았었는데요. 현대모비스, 현대오토에버, 포티투닷(42dot), 보스턴다이내믹스 등으로 AI·소프트웨어 개발 역량이 분산돼 있다는 거죠.  최태용 DS투자증권 연구원은 최근 보고서에서 ""현대차그룹의 AI·SW 개발 역량이 현대모비스, 현대오토에버, 42dot, 보스턴다이내믹스 등으로 흩어져 있는 게 구조적 문제""라고 지적했습니다.  그러면서 ""순환출자를 해소하고 현대모비스를 실질적 지주사로 전환해 소프트웨어 역량을 통합하면 저평가 해소가 가능하다""며 ""내년 상반기 지배구조 개편과 사업 모멘텀을 주목할 시점""이라고 강조했죠.  다만 이번 조직 개편을 어떻게 해석할지는 아직 불분명합니다. 일부에서는 ""사장단 인사를 앞두고 실무 조직을 먼저 정비한 뒤 내년 본격적인 변화에 나서는 수순""이라고 보기도 합니다. 판매 조직 수장 교체, 권역 재편, 소프트웨어 총괄 교체가 동시에 일어난 게 우연만은 아닐 수 있다는 거죠. 반면 단순 조직 효율화 차원이라는 신중론도 있습니다. 송창현 본부장 사퇴도 실제로 개인 사정일 수 있고, 일각의 기대와 실제 회사 계획은 다를 수 있다는 겁니다.  현대차그룹은 이르면 다음 주 사장단 인사를 발표할 예정인데요. 여기서 SW·기술 조직의 향방이 어느 정도 윤곽이 드러날 것으로 보입니다.",https://n.news.naver.com/mnews/article/648/0000042443
2025-12-05 16:51:00,신한 이어 우리금융·BNK금융도 CEO '연임' 힘 실리나,"진옥동 신한금융지주 회장이 사실상 연임에 성공하면서 차기 금융지주 회장 인선에도 관심이 쏠린다.  우리금융지주와 BNK금융지주 모두 임종룡 우리금융 회장과 빈대인 BNK금융 회장을 포함한 4명의 최종 후보군(숏리스트)을 확정했다. 지금까지는 무난한 연임이 점쳐지지만, 금융당국의 시선이 우호적이지 않다는 시각도 있어 향후 변수로 지목된다.  5일 금융권에 따르면 우리금융 임원후보추천위원회(임추위)는 이달 말쯤, BNK금융지주 임추위는 오는 8일 차기 회장 후보를 발표할 예정이다.   우선 우리금융은 지난 2일 숏리스트로 임종룡 회장, 정진완 우리은행장 및 외부 후보 2명 등 총 4명을 선정했다. 임추위는 이들을 대상으로 한 달 간 △복수의 외부 전문가 면접 △후보자별 경영계획 발표(프리젠테이션) 및 △심층 면접 등을 거쳐 차기 회장 최종 후보 1인을 선정한다.   내부에선 임 회장 연임이 유력하다고 본다. 그는 취임 이후 우리투자증권 재출범을 이끌고 동양·ABL생명 인수를 완료하면서 우리금융을 종합금융그룹으로 끌어올렸다는 평가를 받고 있다. 자회사 편입이 원칙적으로 허용되지 않는 금감원 경영실태평가 3등급을 받았음에도 생보사 인수가 이뤄진 건 금융위원장을 지낸 임 회장의 영향력이 작용했을 것이란 시각이 많다.   생산적 금융 전환과 포용금융 확대에 5년 간 80조원을 투입하는 등 정부 정책 기조에 발맞춘 행보도 이어가고 있다. 이와 더불어 26년간 분리 운영돼 온 상업은행·한일은행 동우회를 통합하며 내부 결속력도 한층 강화했다는 평가가 나온다.   BNK금융 임추위의 경우 차기 회장 숏리스트에 빈대인 회장, 방성빈 부산은행장, 김성주 BNK캐피탈 대표, 안감찬 전 부산은행장 등 4명을 확정했다. 임추위는 이들을 대상으로 심층 면접과 추가 논의를 거쳐 8일 최종 후보를 추릴 계획이다.   업계는 빈 회장 연임 가능성에 무게를 두고 있다. BNK금융은 올해 3분기 누적 순이익 7700억원을 기록하며 역대급 성과를 거뒀고 증권·캐피탈 등 비은행 계열사 이익도 30% 이상 증가했다.   지난 10월 금감원 국정감사에서 박범계 더불어민주당 의원이 BNK금융 회장 선임 절차를 문제 삼으면서 연임에 제동이 걸렸다는 분석도 있었다. 하지만 내년 부산시장 출마가 유력한 전재수 해양수산부 장관이 지난달 초 빈 회장을 직접 만나 해수부-BNK금융 간 포괄적 업무협약(MOU)을 체결하면서 연임 가능성에 다시 힘이 실렸다는 관측이 조심스럽게 고개를 들고 있다.   당초 업계에서는 윤석열 정권 시기에 선임된 신한·우리·BNK금융 3개 금융지주 회장 모두 무난한 연임은 어려울 것이란 분석이 많았다. 지주사들은 정권이 바뀔 때마다 은연중 인사 개입 압박을 받아왔기 때문이다. 하지만 진옥동 신한금융 회장이 전날 사실상 연임을 확정지으면서 기존 체제 유지로 무게추가 기울고 있다. ▷관련기사 : '연임' 진옥동 신한금융 회장 ""중요한건 질적 성장…내년 의제 자본시장""(2025.12.04)  더욱이 현 회장의 대항마도 등장하지 않은 분위기다. 다만 금융당국의 비판적 인식과 정치적 변수에 따라 결론이 달라질 여지는 남아 있어 최종 발표까지 긴장감은 이어질 전망이다.   일례로 이찬진 금감원장은 지난 1일 열린 기자간담회에서 ""금융지주사들은 사회적으로 상당한 공공성이 요구되는 조직인데, (지주 회장들의) 과도한 연임 욕구로 거버넌스(지배구조)의 건전성이 염려되는 부분들이 있다""고 언급했다. 지난 10월 국정감사에서는 ""일부 금융지주 회장이 자기 사람으로 참호를 구축한다""고 지적하기도 했다.",https://n.news.naver.com/mnews/article/648/0000042442
2025-12-05 16:49:00,"[AGF 2025]④""미래시는 아픔과 상처를 치유하는 게임""","""시간과 인연, 그리고 치유가 게임에서 가장 중요한 키워드입니다. 유저들의 아픔과 상처를 치유하겠다는 목표로 게임을 만들었습니다.""    '미래시: 보이지 않는 미래'의 시나리오를 담당한 한경재 컨트롤나인 IP 팀장이 5일 '미래시 ON'에 참석해 이같이 말했다. 한 팀장은 ""사람들이 현실에서 벗어나 휴식을 취하기 위해 게임을 한다고 생각한다. 유저들이 게임을 하면서 어떻게 치유받을 수 있을지 고민했고, 캐릭터의 아픔을 치유함으로써 가능해질 수 있을 것이라 생각했다""고 말했다.  미래시는 스마일게이트가 퍼블리싱하고 컨트롤나인이 개발하는 수집형 역할수행게임(RPG)이다. 상대방과 번갈아 가며 공격하는 턴제 방식에 실시간 시스템을 결합한 전투 구조가 특징이다. 타임 트립(과거와 현재를 넘나들며 전개되는 게임 방식)도 핵심 요소다. 올해 도쿄게임쇼에서 첫 선을 선보였으며 국내에서는 이번 '아니메 게임 페스티벌(AGF)'를 통해 최초 공개했다.  미래시에 등장하는 인류는 시간을 다루는 힘을 지니고 있지만, 아이러니하게도 멸망이 다가오며 '미래'가 사라진 세계에 살고 있다. 게임 속 캐릭터들은 사라진 미래를 되찾기 위해 과거로 돌아가는 여정에 나선다. 개발진은 서브컬처 장르에서 중요한 스토리와 세계관 구축에 공을 들였다고 설명했다.  한 팀장은 ""서브컬처 게임에서는 세계관과 시나리오가 가장 중요하다. 미래시도 독특한 세계관을 가지고 있다""며 ""미래를 볼 수 있는 미래시라는 능력을 얻었음에도 불구하고 미래가 없다는 의미에서 부제를 '보이지 않는 미래'로 정했다""고 밝혔다.  유저들을 사로잡기 위해서는 시나리오뿐 아니라 캐릭터의 서사와 완성도가 중요하다. 개발진은 입체적인 서사를 갖춘 캐릭터를 구현하기 위해 심혈을 기울였다고 설명했다. 특히 '시간'이라는 소재를 활용해 캐릭터에게 어떤 서사를 부여할지 오랜 고민을 거쳤다고 했다. 게임 속 캐릭터들은 돌아가고 싶지 않던 과거를 마주하며 고통을 겪지만, 그럼에도 이를 극복해 나가며 성장과 치유의 서사를 완성한다.  한 팀장은 ""캐릭터도 사람이라는 말을 입에 달고 다녔다. 유저들이 캐릭터가 살아 있다고 느끼게 해야 한다고 (팀원들에게) 강조했다""며 ""캐릭터가 어떤 삶을 살아왔는지, 유저와 보낸 시간에 따라 행동이 어떻게 변하는지 디테일하게 구성했다""고 소개했다.  올해 도쿄 게임쇼에서 3D 캐릭터의 완성도가 아쉽다는 평가를 받았던 비주얼 요소도 개선하고 있다. 미래시의 비주얼 총괄은 '승리의 여신: 니케', '데스티니 차일드' 등을 통해 독보적인 화풍을 갖추고 있다는 평을 받은 김형섭(혈라) 아트디렉터가 맡았다.   김형섭(혈라) 아트디렉터는 ""3D 모델링에 대한 피드백을 많이 받았다. 아직 개발 진행 중이고 그래픽 R&D(연구·개발) 초기 단계인만큼 미흡한 부분이 있다는 걸 통감한다""며 ""앞으로 수준급의 비주얼을 선보일 수 있도록 노력할테니 많은 기대 바란다""고 말했다.",https://n.news.naver.com/mnews/article/648/0000042441
