날짜,제목,본문,링크
2025-12-03 10:32:00,"거버넌스포럼 ""금투협회장 후보들, 증시저평가 해소방안 제시하라""","한국기업거버넌스포럼이 금융투자협회장 후보 3인에게 투자자 보호 방안과 코리아 디스카운트(한국증시 저평가) 해결 방안을 제시하라고 3일 촉구했다.  기업거버넌스포럼은 이날 논평을 통해 ""금투협회장 후보들의 공약은 정책과 인허가, 상품 등에 대한 구호로 가득 차 있다""면서 ""투자자 보호 제고 및 기울어진 운동장을 바로잡아 자본시장의 품질이라 할 수 있는 시가총액 및 주가 밸류에이션을 높이겠다는 후보는 보이지 않는다""고 지적했다.  금융투자협회 후보추천위원회는 지난 1일 제7대 회장 후보자로 서유석 현 금융투자협회장, 이현승 전 SK증권·KB자산운용 대표, 황성엽 신영증권 대표를 최종 선정했다고 밝혔다. 금투협은 18일 임시총회에서 회원사 투표를 통해 차기 회장을 선임할 예정이다.  이에 대해 거버넌스포럼은 코리아 디스카운트 원인과 해소방안, 1차 상법 개정과 개정 상법에 대한 의견을 밝힐 것을 촉구했다. 개정 상법은 집중투표제 의무화와 감사위원 분리선출 확대, 그리고 사외이사인 감사위원 선임 및 해임 시 최대주주에게 합산 3%룰을 적용하는 것이 핵심이다.  포럼은 또 협회장 후보들이 △자회사 상장 원칙적 금지에 대한 입장 △배임죄 폐지에 대한 입장 △스튜어드십 코드 개정에 대한 의견 △주주 충실의무 세부 로드맵 △일반주주 이익 편취 거래에 참여하는 증권사 행태에 대한 입장을 표명해야 한다고 논평했다.  포럼은 ""자본시장이 건전하고 규모가 커져야 실물경제에 이바지하고 국민들의 안전한 투자 대상으로 자리 잡을 수 있다""며 ""차기 협회장은 업계의 단기 이익 극대화를 목표로 하지 말고 건전하고 지속가능한 자본시장 생태계를 구축하는 데 초점을 맞춰야 한다""고 덧붙였다.",https://n.news.naver.com/mnews/article/648/0000042353
2025-12-03 10:26:00,내수·수출 엇갈린 중견차...르노 45% 급성장·KGM 수출 약진,"올해 국내 중견 완성차 3사의 판매 실적이 엇갈리고 있다. 1~11월 누계 기준 KG모빌리티(KGM)은 성장세를 이어간 반면, 르노코리아와 한국GM은 감소세를 보였다. 다만 르노코리아는 내수 시장에서 45.1% 급성장하며 3사 중 유일하게 내수 증가를 기록했다.  나홀로 성장한 KGM…내수는 르노勝  올해 1~11월 누계 기준, KGM은 총 10만876대를 판매해 전년 동기 대비 2.2% 증가했다. 내수는 지난해 같은 기간보다 15.5% 감소한 3만7590대를 기록했지만, 수출이 6만3286대로 16.7% 늘어나며 전체 실적을 견인했다.   같은 기간 한국GM 판매량은 총 40만9810대로 3사 중 가장 많지만 성장세는 주춤했다. 내수는 1만3952대, 수출은 39만5858대로 각각 39.4%, 6.5% 감소했다.  르노코리아는 이 기간 총 8만1295대를 판매해 전년 동기 대비 11.9% 감소했다. 내수는 4만7500대로 45.1% 급증했지만, 수출이 3만3795대로 43.3% 감소해 전체 실적이 줄었다.  특히 11월 내수 실적을 보면 르노코리아가 3575대를 판매하며 가장 많았다. 주력 SUV(스포츠유틸리티차) '그랑 콜레오스'가 2403대로 내수 판매를 견인했다. 그랑 콜레오스는 올해 1~11월 누계 3만7398대를 기록하며 출시 이후 내수 시장에서 가장 안정적인 판매 흐름을 유지한 중형 SUV 중 하나로 자리잡았다.   월별로는 3월 5195대, 4월 4375대 등 초반 강세 이후 2000대 후반~3000대 초반 수준을 꾸준히 유지해 전체 내수 성장세를 뒷받침했다.   이밖에 아르카나는 560대(1.6 GTe 459대, 하이브리드 101대)가 팔렸다. 9년간 판매된 QM6는 601대, SM6는 6대를 마지막으로 판매를 종료했다.  KGM은 전기차 보조금 소진으로 내수 판매가 줄어들며 3121대를 기록했다. 무쏘 EV 판매량이 줄며 전년 동기 대비 감소했으나, 토레스와 액티언 하이브리드가 꾸준한 판매 상승세를 보이며 호조세를 이었다.   한국GM은 973대에 그쳤다. 쉐보레 트랙스 크로스오버가 819대 판매되며 실적을 끌어올렸지만, 판매 성장은 역부족이었다.  한국GM 물량 우위에도…달리는 르노  11월 단월 수출 실적에서는 한국GM이 4만2826대로 압도적인 물량을 보였다. 트랙스 크로스오버(파생모델 포함)가 2만7328대로 수출을 주도했다.   KGM은 5850대를 수출하며 전년 동월 대비 5.6% 증가했다. 튀르키예와 헝가리 등으로의 수출 확대가 성장을 견인했다. 특히 수출은 튀르키예와 헝가리 등으로의 판매가 늘며 전년 동월 대비 5.6%, 누계 대비로도 16.7% 증가했다.  누계 기준으로도 수출은 6만3286대로 16.7% 늘어 전체 실적을 끌어올리는 역할을 했다. 차종별로는 △코란도(1163대) △토레스 EVX(853대) △토레스 하이브리드(675대) △무쏘 EV(497대) △액티언 하이브리드(280대) 등 친환경차량의 판매 물량이 늘며 증가세를 이었다.  르노코리아는 1074대를 수출했다. 주력 수출 모델인 아르카나가 출시 6년 차를 맞으며 판매가 줄고, 신규 수출 차종인 그랑 콜레오스가 초기 단계인 점이 11월 수출 감소로 이어졌다. 11월 수출 차종별로는 그랑 콜레오스 421대, 아르카나 349대와 함께 캐나다향 폴스타 4가 304대 포함됐다. 폴스타 실적이 이번에 처음 반영된 만큼, 그랑 콜레오스 수출 확대와 함께 향후 수출 실적 개선이 전망된다.  부산공장은 올해 초 전기차 생산 기지로의 전환을 위해 68개 설비를 업데이트했다. 르노코리아는 최근 APEC CEO 서밋에서 부산공장의 전기차 생산 관련 추가 설비 투자를 비롯한 한국에 대한 신규 투자를 약속하고, 신규 투자 중 단기간 내 투입 예정 금액에 대한 외국인직접투자(FDI) 신고도 진행했다.  12월 막바지 판매 드라이브  실적 희비가 엇갈린 가운데, 3사는 12월 한 해 마무리를 위해 다양한 프로모션으로 판매 드라이브에 나섰다. 먼저 르노코리아는 개별소비세 인하 혜택이 마지막으로 적용되는 12월 모델별로 '개별소비세 더블 혜택'을 제공한다. 그랑 콜레오스는 파워트레인에 상관없이 생산 월에 따라 100만원대 개별소비세 더블 혜택을 받을 수 있다.  한국GM은 트랙스 크로스오버, 트레일블레이저, 콜로라도, 시에라 구매 고객에게 할부 프로그램과 현금 지원을 제공한다. '윈터 럭키 드라이브' 이벤트를 통해 순금, IT 기기 등 경품 추첨 기회도 마련했다.  구스타보 콜로시 한국GM 영업·서비스·마케팅 부사장은 ""글로벌 수요를 바탕으로 선전 중인 트랙스 크로스오버와 트레일블레이저의 판매를 이어가며 올해를 잘 마무리하겠다""고 말했다.  KGM은 내수 확보를 위해 '슬림페이 플랜 할부 프로그램'을 12월 렉스턴 뉴 아레나까지 확대 운영한다. 이 프로그램은 구입 초기 비용이 부담없고 월 할부 부담이 적을 뿐만 아니라 3년 최대 64%까지 중고차 잔존 가치를 보장하는 것이 특징이다. 지난달 토레스·액티언 하이브리드 구매 고객 중 이 프로그램을 선택한 MZ세대가 62%에 달할 정도로 젊은 층에서 인기를 끌고 있다는 게 사측 설명이다.  KGM 관계자는 ""슬림페이 플랜 할부 프로그램 등 고객 혜택을 강화해 내수 판매 물량을 늘려가겠다""고 말했다.",https://n.news.naver.com/mnews/article/648/0000042352
2025-12-03 10:00:00,"""네이버 광고 쓰면 스마트스토어 거래액 134%↑""","네이버 광고를 활용하는 스마트스토어 사업자가 신규고객 유입, 매출 증대 등 실질적 성과를 얻을 수 있다는 연구 결과가 나왔다.  네이버는 스마트스토어 사업자 대상 광고 설루션의 효용성을 실증한 'D-광고 리포트 2025'와 'AI 라이드(RIDE) 리포트'를 발간했다고 3일 밝혔다.  D-광고 리포트는 고려대 이건웅 교수 연구팀, 성균관대 김지영 교수 연구팀 등이 연구한 네이버 주요 광고 설루션의 효과를 담았다. AI 라이드 리포트는 성균관대 채인영 교수 연구팀이 네이버의 인공지능(AI) 광고 설루션 '애드부스트(ADVoost) 쇼핑'의 실증적 성과를 소개했다.  고려대 이건웅 교수 연구팀이 식품과 패션 분야 스마트스토어 총 5만9680개의 데이터를 분석한 결과, 네이버 광고는 사업자의 △방문자 수 △클릭 수 △거래액 △주문 건수 △리뷰 수 등 주요 지표 상승에 기여했다.   실제 패션 업종에서 광고를 활용한 스마트스토어가 그렇지 않은 스마트스토어에 비해 방문자 수는 88%, 거래액은 134% 가량 더 높았고, 리뷰 수도 83% 많았다.  또 사업자가 여러 광고 설루션을 활용하면 한 건만 활용하는 것에 비해 실제 구매까지 이어지는 효과가 더 뚜렷했다. 2023년 9월부터 2025년 8월까지 한 가지 이상 광고 설루션을 활용한 6만9295개 스토어의 광고 집행 성과를 분석한 결과, 쇼핑검색 광고만 집행했을 때보다 3종 이상의 설루션을 조합해 광고한 경우 거래액과 주문건수 모두 더 높았다.  이 가운데 AI가 접목된 광고 설루션은 특히 중소상공인의 사업 성과 개선에 효과적인 것으로 조사됐다. 성균관대 채인영 교수팀에 따르면 애드부스트 쇼핑을 활용한 사업자는 신규 구매자와 주문 건수가 각각 약 60% 가량 증가하는 등 효과를 봤다.  또 단기 신규 고객 유입에 그치지 않고 △전체 거래액 66% △광고 클릭 후 구매 전환 수 165% △잠재적 구매자의 찜 수 138% 증가 등 고객과 장기적 관계를 형성해 재구매 기반을 강화하는 것으로 확인됐다.  네이버 광고 사업 총괄 이종민 부문장은 ""네이버 광고 설루션이 스마트스토어 사업자의 성과를 개선하고 성장 기반을 마련하는데 효과적이며, 특히 애드부스트 쇼핑이 중소상공인 사업자의 실질적 성장 도구로 자리매김한 것을 확인했다""고 말했다.",https://n.news.naver.com/mnews/article/648/0000042351
2025-12-03 09:46:00,"동원홈푸드, '칙필레' 손 잡았다…글로벌 소스 공략 박차","동원홈푸드가 미국의 대표적인 치킨샌드위치 프랜차이즈 '칙필레(Chick-fil-A)'의 소스를 만든다.  동원홈푸드는 칙필레 아시아본부와 소스 공급 계약을 체결했다고 3일 밝혔다. 칙필레는 전세계 3000여 개 매장을 운영하고 있는 미국 3위 퀵서비스 레스토랑이다.   동원홈푸드는 칙필레의 아시아 지역 첫 매장인 싱가포르 1호점에 시그니처 소스인 칙필레 소스 등 디핑류 7종과 발사믹·이탈리안 등 드레싱 4종을 포함한 11개 제품을 공급한다. 이 중에는 동원홈푸드 식품과학연구원이 싱가포르 현지 맞춤으로 개발한 '스파이시 칠리 소스'도 있다. 내년 연간 수출 물량은 약 70톤 규모로 예상된다.  동원홈푸드는 식품기업, 외식 프랜차이즈 등 1000개 이상의 고객사에 소스, 분말 등을 공급하고 있는 국내 B2B 조미식품 1위 기업이다. 3000여 가지의 원료와 8만 가지 이상의 레시피를 보유하고 있다. 최근에는 홍콩 맥도날드·일본 타코벨 등 글로벌 외식 브랜드에도 소스 수출을 확대하며 해외 시장 공략에 박차를 가하고 있다.  동원홈푸드 관계자는 ""글로벌 시장에서 빠르게 성장하고 있는 칙필레와의 협력을 지속적으로 강화해나갈 예정""이라며 ""앞으로도 국내외 다양한 고객사를 확보해 글로벌 소스 기업으로 도약하겠다""고 말했다.",https://n.news.naver.com/mnews/article/648/0000042350
2025-12-03 09:33:00,"KT, 유심 무상교체 전국으로 확대","KT는 유심(USIM) 무상 교체 서비스를 3일부터 전국 모든 지역으로 확대한다고 밝혔다.  최근 KT에서 발생한 무단 소액결제·개인정보 유출 사건으로 인한 고객 불안을 해소하기 위한 조치다.  앞서 KT는 지역을 나누어 단계적으로 유심 교체를 지원해왔다. 1차로 피해가 발생한 지역에 우선적으로 지원했고, 이어 수도권·강원 지역으로 범위를 넓혔다.  이번 3차 확대는 이러한 단계적 지원을 전국으로 확대해 고객이 어디서든 유심을 교체할 수 있도록 한 것이다.  특히 KT는 고객 편의를 위해 대리점 방문 교체와 택배를 통한 교체를 제공하고 있다. 택배를 통해 고객이 직접 유심교체를 할 경우 택배 신청 다음날 도착하는 익일 배송을 제공한다.  KT망을 이용하는 알뜰폰 고객도 유심 무상 교체가 가능하다. 세부 절차는 각 알뜰폰 사업자 홈페이지 등을 통해 확인할 수 있다.",https://n.news.naver.com/mnews/article/648/0000042349
2025-12-03 09:32:00,"한컴아카데미, 서울시와 손잡고 AI 인재육성","한글과컴퓨터 자회사이자 ICT 융복합 교육 전문 기업 한컴아카데미는 서울시가 주관하는 '서울 AI 인재 얼라이언스'의 참여 기업으로 선정됐다고 3일 밝혔다.  서울 AI 인재 얼라이언스는 서울시가 AI 분야의 지속 가능한 인재 양성 생태계를 조성하기 위해 기업, 대학, 협·단체와 협력해 결성한 민관 협력체다. 이번 얼라이언스에는 한컴아카데미를 비롯해 구글, 마이크로소프트, KT, SK 등 국내외 빅테크 기업과 주요 대학 등 총 29개 기관이 함께한다.  특히 한컴아카데미는 업스테이지와 함께 AI 교육 전문 기업으로서의 역할을 수행한다. 그간 축적해 온 실무 중심의 AI 교육 커리큘럼과 취업 연계 노하우를 바탕으로 맞춤형 인재를 양성하고 서울시의 '청년취업사관학교' 등 관련 정책 사업에 기여할 방침이다.  출범 기념 행사에서는 오세훈 서울시장이 직접 비전을 선포하고, 참여 기관들이 함께 AI 인재 양성을 위한 협력을 다짐하는 퍼포먼스가 진행됐다. 한컴아카데미는 앞으로 얼라이언스 회원사들과 협력해 △AI 특화 교육 프로그램 개발 △청년 인재와 기업 간 매칭 지원 △최신 AI 기술 트렌드 공유 등 다양한 활동을 전개할 예정이다.  최성 한컴아카데미 대표는 ""차별화된 교육 역량을 발휘해 단순 지식 전달을 넘어 현장에 즉시 투입 가능한 실전형 AI 인재를 길러내는데 최선을 다하겠다""고 말했다.",https://n.news.naver.com/mnews/article/648/0000042348
2025-12-03 09:15:00,[한파 닥친 은행]교육세·가산금리·보이스피싱까지…규제만 겹겹이,"연말을 맞은 은행권에 교육세 인상과 가산금리 손질, 보이스피싱 무과실 배상 등 규제 한파가 다가오고 있다. 가중되는 부담에 은행들은 지속적으로 목소리를 내고 있지만 사회적 책임 등 현 정부의 명확한 기조에 반영이 쉽지 않은 분위기다.  728조원 규모의 2026년도 예산안이 어제(2일) 국회 본회의를 통과했다. 5년만에 법정 시한을 준수한 것이지만 은행권은 웃음 짓지 못하는 모습이다. 교육세법 개정안도 예산부수법안으로 함께 가결됐기 때문이다.  교육세법 개정안은 연간 수익이 1조원을 초과하는 금융·보험사의 교육세를 0.5%포인트 올리도록 하는 내용을 담았다. 정부가 금융·보험업을 콕 집은 까닭은 높은 수익에 비해 세 부담이 낮다는 판단에서다.▷관련기사:[2025 세제개편]이자장사 때린 대통령…교육세 올려 대출금리 인상(7월31일)  국세청에 따르면 금융·보험업의 명목GDP는 교육세가 도입된 1982년 1조4000억원에서 지난해 139조7000억원으로 연평균 11.6%씩 상승했다. 같은 기간 우리나라 총 명목GDP의 연평균 상승폭은 9.4%다. 이같은 성장세를 감안했을 때 현행 0.5%를 유지하는 것은 형평성에 어긋난다는 논리다.  금융·보험업계는 난색을 표했다. 우선 그간 납부했던 교육세도 적은 액수가 아니다. 2023년 기준 총 5조1500억원의 교육세 중 전체의 34%에 해당하는 1조7500억원을 금융·보험사가 냈다.  금융·보험사는 직접적인 수익자가 아니므로 수익자부담의 원칙 상 목적세인 교육세의 납세자가 되는 것 자체가 불합리하다고 줄곧 주장했다. 실제로 은행연합회는 국정기획위원회에 정식으로 폐지를 건의한 바 있다.  소비자에게 부담이 전가될 수 있다는 우려도 제기된다. 국회 예산정책처(이하 예정처)는 '2025년도 세법개정안 분석' 보고서를 통해 ""세율인상 시 대출금리 및 보험료 등 금융·보험서비스 가격이 상승해 소비자의 비용부담이 증가할 가능성이 존재한다""고 짚었다.  예정처는 교육세율 인상분이 전가될 경우 차주 1인당 연간 2만107원을 추가 부담해야할 것으로 예상했다. 은행연합회 제출자료에 기반해 신규 취급 대출금리 인상폭을 약 0.02%포인트로 계산한 뒤, 이를 지난해 말 기준 차주 1인당 평균 가계대출잔액에 적용한 수치다.  여당도 이를 인지, 교육세를 가산금리에 반영하지 못하도록 하는 조항을 은행법 개정안에 추가할 방침이다.▷관련기사:대출금리 단속하겠다는 이재명 정부…은행들은 '갸우뚱'(6월11일)  은행법 개정안은 지난해 12월 민병덕 민주당 의원이 대표발의해 4월 신속처리안건(패스트트랙)으로 지정됐다. 패스트트랙 시한이 지난데다 당초 반대를 표했던 국민의힘이 지난달 27일 협조 의지를 드러내면서 급물살을 타고 있다.  해당 법안은 법정 부담금을 가산금리 산정에서 제외해 소비자 부담을 완화하는 내용이다. 최근 고금리 상황 속에도 은행권은 이자수익이 크게 증가했으므로 수익자부담원칙과 사회적 책임을 고려한 대출금리 산정체계를 마련할 필요가 있다는 의도다.  보이스피싱 무과실 책임 배상제도 연내 발의가 유력하다. 이전까지는 책임이 있다고 판단되는 경우 금융회사가 자율적으로 배상해왔으나 법안이 시행되면 일부 또는 전부 배상해야 한다. 이 역시 금융회사의 사회적 책임 강조 차원이다.▷관련기사:보이스피싱 근절 '올인'…피해액 일부 혹은 전부 금융사가 배상(8월28일)  은행권은 규제 법안들에 대해 정부 건의는 물론 법률 자문까지 거쳤지만 입법 의지를 꺾지 못했다. 한 은행권 관계자는 ""계속 소통은 하고 있지만 정부의 (사회적 책임 강조) 기조 자체가 확실해 반영이 쉽지 않다""고 토로했다.  다만 금융당국은 은행이 책임을 다 했음에도 발생한 보이스피싱 피해는 배상에서 제외하기로 했다. 금융위원회 관계자는 ""면책 조항들을 꼼꼼하게 따져서 구체화하는 중""이라며 ""상당 기간 금융회사들과 얘기를 나눴기 때문에 시일 안에 결과물을 내도록 속도를 내고 있다""고 말했다.  이 관계자는 ""FDS(이상거래탐지시스템)를 활용해 계죄 정지, 송금 지연 등의 임시 조치를 취했을 경우 정확한 기록이 남으니 이런 것들이 (면책)될 수 있다""며 ""이외에도 그에 준하는 여러 기준들을 만들 예정""이라고 부연했다.",https://n.news.naver.com/mnews/article/648/0000042347
