날짜,제목,본문,링크
2025-12-06 15:00:00,"삼성전자 125개 특허, 99개 기업에 무상으로 전수","삼성전자, 125개 특허 무상 나눔  삼성전자가 99개 기업에 특허 125건을 무상으로 나누기로. 산업통상부는 삼성전자와 함께 '2025년 산업부-삼성전자 기술나눔 행사'를 개최해 올해 모바일, 통신, 디스플레이, 가전, 음향기기, 의료기기 등 다양한 분야의 특허들을 제공하기로 함. 이 특허들을 제공받은 기업들은 99개이며 총 125개의 기술이 이전.  특히 올해는 모바일 및 통신 기술이 가장 많은 기업에 이전됐는데 이 중 AI 기반 콘텐츠 자동검색 및 추천 시스템이 가장 많은 관심을 모아.  한편 삼성전자는 2015년부터 올해까지 매년 기술나눔에 참여, 그간 7008건의 기술을 제공. 이 중 1335건의 특허를 772개 기업에 무상으로 이전하는 등 기술나눔 참여기관 중 가장 우수한 실적을 기록.  효성중공업-대한전선, 통합 전력 솔루션 개발  효성중공업이 대한전선과 함께 통합 전력 솔루션 개발 완료. 양사는 효성중공업의 인공지능 기반 전력설비 자산관리 솔루션인 '아머플러스'에 대한전선의 실시간 케이블 진단 및 모니터링 시스템을 결합한 '케이블 예방진단 및 자산관리 토압 솔루션'을 개발, 본격적인 사업화에 나서기로.  이번에 개발된 솔루션은 기존 케이블과 전력설비로 분리돼 있던 진단 시스템을 하나로 통합. 기존 개별 전력설비 단위에서 변압기, 차단기, 케이블 등 변전소 전체 설비를 아우르는 통합 진단 체계를 구축하게 된 것.  이 솔루션을 사용하면 변전소 단위 전력 시스템 전체의 진단 정보를 한 화면에서 모니터링해 설비 계획 정밀화가 가능.  효성중공업은 이번 솔루션으로 초고압 전력설비와 케이블의 통합 모니터링을 제안, 기존 전력기기 고객뿐만 아니라 EPC 설계사, 데이터센터, 태양광, 해상풍력 등 다양한 사업에도 참여를 확대한다는 계획.  코오롱인더, 캐나다 수소연료기업과 MOU  코오롱인더스트리가 수소 사업 강화를 위해 캐나다 수소연료전지기업 발라드와 수소사업협력 업무협약을 체결. 발라드는 1979년 설립된 연료전지 기업. 이동형, 고정형 발전, 백업 전력 등 다양한 분야에서 청정 수소 에너지 솔루션을 제공.   양사는 이번 업뮤협약을 통해 연료전지 시스템의 핵심 구성품인 수분제어장치 안정적 공급 체계를 구축, 향후 제품 개발 및 성능 향상 협력을 확대할 계획.  허성 코오롱인더스트리 사장은 ""수소연료전지 시장의 글로벌 선도기업인 발라드와의 MOU는 양사간 전략적 파트너십 강화를 위한 중요한 이정표""라며 ""코오롱인더스트리는 앞으로도 수소 시장 확대를 위한 노력을 이어갈 것""이라고 밝혀.  곽동신 한미반도체 회장, 자사주 추가 취득  곽동신 한미반도체 회장이 사재로 62억원 규모의 자사주를 취득하기로.  취득 예정 시기는 이달 30일로 장내 취득 예정이며 이번 취득이 완료되면 곽 회장의 지분율은 33.51%에서 33.56%로 0.05%포인트 상승.  곽동신 회장은 지난 2023년부터 534억8000만원 규모의 자사주를 사재로 취득. 이는 고대역폭메모리(HBM) 장비 시장에서 한미반도체 TC본더의 기술력과 회사의 성과에 자신감에 기반한다는 평가.  이와 관련 한미반도체는 내년부터 글로벌 메모리 업체들이 양산에 돌입하는 HBM4 시장에서도 'TC 본더 4' 장비 공급을 통해 시장 주도권을 이어간다는 계획.   또 내년 말에는 '와이드 TC 본더'를 출시, 차세대 HBM 중 하나인 '와이드 HBM’ 생산 지원에 나선다는 방침.  LG전자, 스트리밍 서비스 중동 진출  LG전자가 글로벌 FAST(Free Ad-supported Streaming TV, 광고 기반 무료 스트리밍) 서비스 'LG채널'이 중동에 첫 선.  LG전자는 이달 아랍에미리트에 LG채널을 순차 론칭. 이에 아시아와 북미, 유럽, 중남미 등에 이어 중동까지 진출하며 글로벌 주요 시장으로 콘텐츠 거점 확대.   LG채널은 UAE에서 지역 뉴스와 라이프스타일 콘텐츠를 제공하는 러빙 두바이(Lovin Dubai), 아랍권 스트리밍 서비스 와치 잇(WATCH IT) 등 중동 중심 채널뿐 아니라 블룸버그 텔레비전∙유로뉴스 등 글로벌 뉴스부터 스포츠, 엔터테인먼트, 영화, 키즈, 다큐멘터리 등 다양한 컨텐츠를 제공할 예정.   LG전자는 LG채널을 조만간 대만에서도 서비스한다는 방침. 이를 위해 대만 현지 인기 OTT플랫폼인 오피와 파트너십을 맺도 다양한 컨텐츠 서비스를 시작한다는 방침.  2015년 출범한 LG채널은 LG전자 독자 스마트TV 플랫폼 webOS의 간판 콘텐츠 서비스로 각 국가와 지역의 취향에 특화된 콘텐츠를 총 4000개 이상의 채널을 통해 제공 중.   조병하 LG전자 webOS플랫폼사업센터장 전무는 ""지역 맞춤형 다채로운 콘텐츠와 서비스로 LG채널의 경쟁력을 지속적으로 강화하면서 전 세계 어디에서도 즐길 수 있도록 서비스를 더욱 확대해 나갈 갈 것""이라고 전해.",https://n.news.naver.com/mnews/article/648/0000042456
2025-12-06 14:32:00,[AGF 2025]⑤미소녀들의 의원이 됐다…기대작 '미래시',"컨트롤나인이 개발 중인 '미래시: 보이지 않는 미래'(이하 미래시)는 김형섭 일러스트레이터가 참여한 서브컬처 수집형 역할수행게임(RPG)이다. '혈라'로 알려진 김 일러스트레이터는 앞서 시프트업의 '데스티니 차일드', '승리의 여신: 니케' 아트디렉터(AD)로 명성을 쌓았다.   미래시의 퍼블리싱을 담당하는 스마일게이트는 도쿄게임쇼(TGS)에 이어 5일부터 일산 킨텍스에서 열린 '아니메 게임 페스티벌(AGF) 2025'에서 미래시를 시연했다. 특유의 독특한 일러스트 비주얼로 두터운 팬층을 가진 김 AD가 참여한 작품이라 출시 전부터 서브컬처 팬들의 관심을 모았다.   직접 해본 미래시는 시작 화면부터 김 AD 특유의 일러스트 스타일이 시선을 사로잡았다. 짧은 시간 내에 '미래시'라는 알쏭달쏭한 제목을 곧바로 이해할 수 있도록 명쾌한 설명이 이어졌다. 플레이어는 멸망을 앞두고 있는 세계로 떨어지고, 세계를 구하기 위해 '초시공의회'의 의원이 되어 캐릭터를 지휘한다.  멸망 직전의 세계, 갑자기 나타난 플레이어가 미소녀 전투원들의 지휘관이 되는 설정 자체는 드물지 않았다. 그러나 미래시는 시간여행이라는 테마를 삼아 신선함을 더했다. 등장하는 캐릭터들은 각기 다른 세계와 시간대에서 온 시간여행자이며, 전투 시스템에도 '시간'을 강조했다.  기본적으로 미래시는 캐릭터의 턴이 왔을 때 스킬을 사용하는 턴제 전투 시스템을 차용하고 있다. 이용자는 단순 이동에 치중한 퀵, 공격 스킬인 액티브, 궁극기인 얼티밋 중 하나를 골라야 한다.   그러나 모든 스킬을 사용할 때 '이동'을 어떻게 활용하는지에 따라 달라진다는 점에서, 다른 턴제 RPG와는 차별화되는 재미가 있었다. 적의 공격 범위를 파악해 미리 캐릭터를 회피시키거나, 적이 이동할 방향으로 미리 보내 다음 턴이 돌아올 때까지 효율적으로 공격할 수 있다.  '이동'을 적절하게 쓰지 못하면 다음 턴이 돌아오기도 전에 캐릭터가 사망할 수 있으므로 신중한 판단이 필요하다. 다만 잘못된 선택으로 캐릭터가 죽고 망연자실해 할 플레이어를 위한, 5턴 이전으로 돌아갈 수 있는 '시간 되돌리기' 기능도 탑재했다.  보스 몬스터를 쓰러뜨리고 나면 미소녀 캐릭터 한 명과 함께 필드 데이트를 즐길 수 있다. 닌자인 이츠카, 수녀인 티에리아, 안내인 엔데까지 다양한 유형의 미소녀들이 초반 캐릭터로 등장한다.   기자는 엔데를 골라 5분간 필드 데이트를 진행했는데, 시간은 짧았지만 필드를 구경하고 기념사진을 남기기에는 충분했다. 다만 아직까지는 필드 데이트 내 콘텐츠가 한정적이어서, 자칫 지루해지지 않도록 다양한 콘텐츠가 필요하겠다는 생각이 들었다.   스마일게이트는 AGF 2025에서 미래시 시연 부스와 함께 미래시 캐릭터 영상을 재생하는 LED 타워를 설치했다. 관람객은 타워 속 엔딩존에 들어가 미래시 캐릭터와 직접 대화해볼 수 있었다.  AGF 2025 기간 내내 미래시 시연 부스 앞에는 긴 줄이 늘어섰다. 서울 은평구에서 왔다는 직장인 박모(29)씨는 ""데스티니 차일드도 재밌게 했었고, 미래시를 해보고 싶어서 연차를 내고 왔다""면서 ""생각보다 퀄리티가 더 좋은 것 같다""고 말했다.",https://n.news.naver.com/mnews/article/648/0000042455
2025-12-06 14:00:00,"카카오벤처스, 투자 스타트업 7곳 CES 참가","카카오벤처스가 투자한 7개 스타트업이 내년 1월6일(현지시간)부터 9일까지 미국 라스베이거스에서 열리는 세계 최대 IT·가전 전시회 'CES 2026'에 참가한다.  이번에 참가하는 7개 기업은 △뉴로티엑스 △레티널 △리콘랩스 △루먼랩 △오믈렛 △컨포트랩△포트래이다. 특히 수면 장애 솔루션 개발사 '뉴로티엑스'는 이번 CES 개막에 앞서 디지털 헬스 부문 혁신상을 수상했다.  '혁신가들이 등장한다(Innovators Show Up)'를 공식 슬로건으로 출발하는 CES 2026은 인공지능(AI)이 일상과 산업에 깊숙이 파고든 미래를 조망하는 자리가 될 전망이다.  카카오벤처스가 투자한 기업들은 CES에서 AI, 디지털 헬스, 확장현실(XR), 제조 AX(인공지능 전환) 등 각 산업 분야 기술과 제품을 선보이며, 글로벌 파트너십을 확장하고 해외 시장 진출을 모색할 계획이다.  카카오벤처스 관계자는 ""참가 기업들은 일상부터 산업 현장까지 우리 삶에 활용 가능한 본질적인 기술 경쟁력을 쌓아온 팀들""이라며 ""CES 참가를 통해 글로벌 시장에서 기업들의 혁신 가치를 검증하고, 유의미한 비즈니스 기회를 발굴하는 계기가 될 것""이라고 했다.  방미통위, '통신분쟁조정 신청 안내서' 발간  방송미디어통신위원회는 '누구나 따라 할 수 있는 통신분쟁조정 신청 안내서'를 발간했다. 통신 서비스 관련 분쟁과 관련한 조정 신청 단계와 경로별 안내 등을 수록했다.  구체적으로 △신청을 위한 준비단계 △통신분쟁조정 신청서 작성하기 △신청 후 절차와 자주 묻는 질문 등 3가지 부문으로 안내서를 발간해 누구나 어렵지 않게 통신분쟁조정 제도를 이용할 수 있도록 했다.  아울러 분쟁조정 사건 개요와 신청 이유 등에 관한 모범 작성 예시를 담아 처음 분쟁조정을 신청하는 경우에도 쉽게 따라할 수 있도록 했다. 또한 이용자 편의성을 고려해 인터넷과 우편 신청, 본인 및 대리인 신청 등을 구분해 세부 유형별로 상세한 설명을 수록했다.   안내서는 방미통위·통신분쟁조정위원회 누리집을 통해 내려받을 수 있다. 방미통위 관계자는 ""이번 안내서가 쉬운 용어, 예시 제공 등을 통해 디지털 취약계층의 이해를 도와 통신분쟁조정 제도의 접근성을 높여줄 것""이라고 말했다.  라이온하트 스튜디오, 채용연계형 인턴 모집  라이온하트 스튜디오가 채용 연계형 인턴 모집을 시작했다.  이번 인턴 모집은 재학 또는 휴학 중인 대학생 및 취업 준비생을 대상으로 하며, 지원 기간은 오는 14일까지다. 최종 선발자는 내년 1월부터 4월까지 3개월간 실무를 경험하게 된다.  모집 분야는 게임 개발 내 기획 직군으로 △오딘: 발할라 라이징 △프로젝트 Q △프로젝트 C △프로젝트 O 등 개발 프로젝트의 콘텐츠, 밸런스, 시스템, 레벨 기획 파트다.  전형절차는 서류, 과제, 면접 순으로 진행된다. 라이온하트 스튜디오는 이번 인턴십을 통해 전문성을 갖춘 인재를 조기에 발굴하고, 우수 인턴에게는 정규직 채용 기회를 제공할 방침이다.  라이온하트 스튜디오 관계자는 ""이번 인턴십은 다양한 실무 경험과 멘토링을 제공하도록 구성됐다""며 ""직무를 준비하는 지원자에게 의미 있는 시간이 될 것""이라고 했다.  엔씨소프트, '리밋 제로 브레이커스' CBT 참가자 모집  엔씨소프트가 신작 '리밋 제로 브레이커스(LIMIT ZERO BREAKERS)'의 CBT(Closed Beta Test) 참가자 모집을 시작했다.  브레이커스는 빅게임스튜디오가 개발 중인 애니메이션 액션 롤플레잉게임(RPG)으로, 애니메이션의 한 장면을 직접 플레이하는 듯한 경험을 주는 것이 특징이다.  CBT 참여 신청은 브레이커스 공식 홈페이지에서 가능하다. CBT는 글로벌 이용자를 대상으로 내년 1분기 구글 플레이와 스팀을 통해 진행할 예정이다.  브레이커스는 게이머들의 기대감을 더욱 높이기 위해 'AGF 2025'에 참여해 코스프레, 미니게임 3종, 보너스 룰렛, 포토부스 등의 현장 이벤트를 운영한다.   멜론, SK텔레콤 구독플랫폼 'T 우주' 입점  카카오엔터테인먼트의 뮤직 플랫폼 '멜론'은 SK텔레콤의 구독 플랫폼 'T 우주'에 입점했다.   이에 따라 양사는 △'T 우주패스 편의점&카페' △T 우주패스 with 멜론 △멜론 단품 10~15% 할인 등의 구독 패키지와 프로모션을 선보인다.  T 우주는 SK텔레콤이 운영하는 통합 구독 플랫폼이다. 온라인동영상서비스(OTT)와 음악, 쇼핑, 식음료 등 다양한 분야의 구독 서비스를 하나의 요금제로 이용할 수 있다.  이번 제휴로 T 우주의 인기 구독 패키지인 'T 우주패스 편의점&카페' 이용자들은 멜론의 모바일기기 전용 상품인 '모바일 스트리밍 클럽'을 선택하면 추가적인 지출 없이 멜론을 이용할 수 있다.   T 우주패스 결합이 아닌 일반 단품 고객은 모바일 스트리밍 클럽과 스트리밍 클럽을 10% 할인된 가격에 이용 가능하며, 다른 T 우주패스 상품을 구독하면서 멜론을 추가로 이용하는 경우 15% 할인한 가격이 적용된다.  멜론 관계자는 ""앞으로도 멜론은 음악을 사랑하는 고객의 부담을 덜어드리기 위한 프로모션을 지속적으로 선보일 것""이라고 전했다.",https://n.news.naver.com/mnews/article/648/0000042454
2025-12-06 13:00:00,'없는 것 없는' 쿠팡에 없는 한 가지,"[주간유통]은 한주간 유통·식음료 업계에서 있었던 주요 이슈들을 쉽고 재미있게 정리해 드리는 콘텐츠입니다. 뉴스 뒤에 숨겨져 있는 또 다른 사건들과 미처 기사로 풀어내지 못했던 다양한 이야기들을 여러분께 들려드릴 예정입니다.[편집자]   마무리  메이저리그에 저와 생일이 같은 투수가 있었습니다. 현대 야구 분업화의 상징인 데니스 애커슬리(Dennis Lee Eckersley)입니다. 1954년생인 데니스 애커슬리는 1975년 클리블랜드 인디언스(현 클리블랜드 가디언스)에서 데뷔해 보스턴 레드삭스와 시카고 컵스를 거쳐 1987년 오클랜드 어슬레틱스에 왔습니다. 12년간 165승을 거둔 좋은 선발 투수였던 데니스 애커슬리는 이적 후엔 불펜 투수로 전환합니다.   이듬해인 1988년. 애슬레틱스의 감독이었던 명장 토니 라 루사가 '마지막 1이닝을 맡는 투수'라는 개념을 창안하고 그 자리에 그를 낙점합니다. '마무리 투수(Closer)'의 탄생입니다. 애커슬리는 이 해 45세이브를 기록하며 '좋은 선발'에서 '위대한 마무리'로의 전환을 시작합니다. 이듬해인 1989년엔 평균자책점 1.56, 33세이브를 기록하며 애슬레틱스의 9번쨰, 그리고 마지막 우승 주역이 됩니다. 그리고 2004년 명예의 전당에 오르죠.  라 루사와 애커슬리 이후 마무리 투수의 중요성은 점점 높아지고 있습니다. 이제 마무리 투수를 운용하지 않는 야구팀은 없습니다. 웬만한 선발 투수나 4번 타자만큼 높은 연봉을 받는 귀한 몸이 됐습니다. 마지막 1이닝을 잘 막는 게 얼마나 중요한 지 깨닫게 된 겁니다. 야구뿐만 아니라 사람의 일도 마찬가지입니다. 일 년 중 열 한 달을 잘 보내고도 마지막 한 달 동안 좋지 않은 일이 생기면 앞의 열 한 달이 다 무용지물입니다.  국내 최대의 이커머스 기업 쿠팡이 처한 상황이 딱 그렇습니다. 3분기까지 누적 매출 36조원을 넘어섰고 영업이익도 6000억원을 돌파했습니다. 매출과 이익 모두 사상 최대치가 확실시됩니다. 알리익스프레스 등 C커머스의 공세도 잘 견뎠습니다. 최근 '새벽배송 금지 논란' 이슈 때도 쿠팡의 소중함을 외치는 소비자들이 뒤를 받쳐줬죠. 이보다 더 좋을 수 없는 한 해가 되는 듯 보였습니다. 하지만 2025년을 딱 한 달 남겨둔 11월 29일. 쿠팡은 9회말 역전 만루홈런을 얻어맞았습니다.  머리카락도 안 보인다  전 국민의 60% 이상이 피해자가 된 쿠팡 해킹 사태에서 가장 이상한 건, 이쯤되면 나와야 할 이름이 여전히 나오지 않고 있다는 점입니다. 바로 김범석 쿠팡Inc 의장입니다. 아무도 찾지 않는데 먼저 나와서 해명을 해야 한다는 이야기는 아닙니다. 여러 곳에서 김 의장을 찾고 있습니다. 물론 '책임자'로서입니다.  지난 3일 열린 국회 정무위원회 긴급 현안 질의에서 강준현 더불어민주당 의원은 ""김 의장인 기업가나 경영자가 아니라 로비스트, 브로커""라고 비판했습니다. 이헌승 국민의힘 의원도 ""돈은 한국에서 다 벌어가면서 왜 오지 않느냐""고 말했습니다. 신장식 조국혁신당 의원은 ""김 의장 고발을 의결했으면 한다""고 요구해 결국 고발이 이뤄질 전망입니다. 쿠팡 앞에서 여야 분쟁이 잠시나마 사라진 모습입니다.  이날 정무위에 참석한 박대준 쿠팡 대표의 발언도 논란에 불을 붙였습니다. 박 대표는 이날 질의에서 ""올해 국내에서 김 의장을 만난 적이 없다""고 말했습니다. 앞서 박 대표는 해킹 사태 책임론이 불거지자 ""제가 한국 법인의 대표로 책임을 지겠다""고 밝혔는데요. 창립자이자 이사회 의장인 김 의장을 만나지도 못하고 있다는 발언이 이어지며 '책임자'가 맞냐는 비판이 나옵니다.   그렇다고 김 의장이 '그림자 경영' 중인 것도 아닙니다. 당장 지난 3분기 실적 발표 컨퍼런스 콜 때만 해도 직접 스피커로 등장해 향후 전망에 대한 자신감을 피력했습니다. 이러니만큼 호실적 등 좋은 일이 있을 때는 자신이 나서더니 부정 이슈가 생기면 미국에 숨어 '한국 지사 대표'를 총알받이로 내세우고 있다는 비판이 나오는 건 당연합니다.  불 끄는 자와 등 뒤에 숨는 자  앞서 전 국민적 관심사가 됐던 SK텔레콤의 개인정보 유출 피해자 수는 약 2324만명이었습니다. SK텔레콤의 해킹 피해가 알려진 건 4월 22일. 2주 후인 5월 7일 최태원 SK그룹 회장은 대국민 사과에 나섰습니다. 자회사의 문제로 국민들에게 피해를 끼친 점을 사과하고 피해 보상에 나서겠다고 밝혔습니다.   이번 쿠팡 해킹 사태로 인해 이름과 전화번호, 집 주소 등이 유출된 피해자는 3370만명에 달합니다. SK텔레콤을 뛰어넘는, 역대 개인정보 유출 사태 중 최대 규모입니다. 사태가 1주일째 이어지고 있는 상황에서 쿠팡의 대응은 ""한국 법인의 일이니 한국 대표가 책임지겠다""는 선에 머물고 있습니다.  김 의장은 미국에 상장한 쿠팡Inc의 클래스B 보통주 1억5780만주(지분율 8.8%)를 보유하고 있습니다. 클래스B 보통주는 주당 29배 의결권을 행사합니다. 실제 김 의장의 의결권은 73.7%가 되는 셈입니다. '쿠팡 한국 법인'은 이 쿠팡Inc가 지분 100%를 소유 중입니다. 이런 상황에서 김 의장이 아닌 '한국 대표'가 책임자라는 말을 누가 믿을 수 있을까요.  앞서 메이저리그 최초의 마무리 투수 데니스 애커슬리의 이야기로 [주간유통]을 시작했죠. 마무리 투수를 또다른 말로 '소방수'라고 부르기도 합니다. 한국, 미국, 일본 공통입니다. 팀의 위기 상황에 등장해 해결하는 선수라는 의미입니다. 기업의 위기에서 등장해야 할 '소방수'는 누구일까요. 월급쟁이 CEO 혹은 창업주 겸 이사회 의장 겸 최고 의결권자. 선택은 어렵지 않을 것 같습니다.",https://n.news.naver.com/mnews/article/648/0000042453
