날짜,제목,본문,링크
2025-12-05 13:53:00,[인사이드 스토리]'온·오프' 갈림길…이니스프리의 선택은,"지난달 26일 '이니스프리' 가맹점주들이 서울시 용산구의 아모레퍼시픽 본사 앞에 모였습니다. 이니스프리 본사에 항의를 하기 위해서였는데요. 온라인 채널에서 가맹점보다 훨씬 싼 가격에 이니스프리 제품이 팔리면서 가맹점이 설 자리를 잃었다는 주장이었습니다. 가맹점주들은 '올리브영과 온라인 채널 공급을 중단하라'고 요구하기도 했습니다.  가맹점과 본사간 갈등은 유통업계에서 종종 벌어지는 일입니다. 하지만 이니스프리의 경우는 해결이 쉽지 않아 보입니다. 이니스프리가 직면한 건 단순히 판매 채널의 문제가 아니라 시장의 구조적인 변화이기 때문입니다. H&B 스토어와 온라인 채널이 화장품 시장을 장악하면서 이니스프리처럼 가맹점을 중심으로 한 브랜드숍의 입지는 점점 더 좁아지고 있습니다.  브랜드숍 1등이었는데  이니스프리는 한때 국내 브랜드숍 시장을 대표하는 브랜드였습니다. 브랜드숍은 단일 브랜드 제품만을 가두점에서 판매하는 형태의 화장품 매장을 말합니다. 가두점 형태의 가맹 매장을 많이 냈기 때문에 '로드숍'이라고도 불렸습니다. 로드숍의 시초는 1999년 에이블씨앤씨가 론칭한 '미샤'입니다.  이니스프리는 아모레퍼시픽그룹이 2000년 선보였습니다.  미샤, '더페이스샵'보다 시장 진입은 늦었지만 '자연주의 화장품'이라는 점을 앞세워 가파른 성장세를 보였습니다.  이니스프리의 차별점은 '제주 천연 원료'와 '합리적인 가격'이었습니다. 제주산 유기농 녹차, 화산송이, 동백, 한란 등에서 추출한 원료로 제품을 만들었습니다. 에코 손수건, 플레이 그린 페스티벌, 이니스프리 숲 캠페인 등 환경 프로젝트도 병행하며 브랜드 이미지를 구축했죠.  2010년대 중반에는 국내에 중국인 관광객(유커)이 몰려오면서 이니스프리 역시 더욱 가파르게 성장했습니다. 미세먼지와 황사에 민감한 중국 여성들이 친환경 화장품을 표방하는 이니스프리에 지갑을 열었기 때문입니다.  실제로 이니스프리가 2010년 출시한 '제주 화산송이 모공 마스크'와 '더 그린티 씨드 세럼'은 밀리언셀러가 되기도 했죠. 이니스프리는 중국 본토에서도 인기가 높았습니다. 상하이 등 주요 도시에 오프라인 매장도 열었습니다. 2016년에는 중국 내 이니스프리 매장이 300개가 넘기도 했습니다.  이런 성장세에 힘입어 이니스프리는 2016년 국내외 합산 매출 1조원을 돌파했습니다. 중저가 브랜드숍 중 '1조 클럽'에 이름을 올린 건 이니스프리가 처음이었죠. 그해 국내 매출은 7679억원, 영업이익은 1965억원에 달했고요. 해외 매출 비중도 40% 가까이 될 정도였습니다.  설 자리 잃은 가두점  하지만 2017년 사드 사태가 터지면서 모든 것이 달라졌습니다. 한한령으로 중국인 단체 관광객 발길이 끊겼고 중국 내에서는 자국산 화장품이 애국 마케팅에 힘입어 급부상했습니다. 이니스프리는 중국에서 점점 설 자리를 잃어갔습니다. 2019년 600개가 넘었던 중국 매장은 2021년 다시 약 300개로 줄어들었죠. 결국 이니스프리는 2023년 중국 오프라인 시장에서 완전 철수할 수밖에 없었습니다.  더 큰 문제는 이 시기 국내 화장품 시장의 구조가 바뀌고 있었다는 점입니다. 2000년대 중반 미샤, 더페이스샵, 스킨푸드 등으로 시작된 브랜드숍 열풍은 2010년대 중반까지 전성기를 구가했습니다. 하나의 브랜드 제품만 모아 파는 것은 당시로서는 새로운 유통 형태였죠. 같은 브랜드 제품을 파니 정기적인 할인 행사가 가능하다는 점도 강점이었습니다. 가맹사업을 발판으로 전국에 빠르게 유통망을 펼칠 수 있었죠.  하지만 2010년대 중반부터 올리브영과 같은 H&B 스토어가 화장품 시장을 장악하기 시작했습니다. 소비자들은 다양한 브랜드를 한 곳에서 비교하며 살 수 있는 멀티 브랜드숍을 선호했습니다. 코로나19 시기를 지나면서 온라인 채널도 급속도로 성장했습니다. 쿠팡, 네이버 등에서 더 싸게, 더 편하게 화장품을 살 수 있게 되면서 굳이 브랜드숍을 찾을 이유가 없어졌습니다.  이니스프리 역시 이런 브랜드숍 시장 몰락의 직격탄을 맞았습니다. 전국이니스프리가맹점협의회에 따르면 2016년 1000개가 넘던 이니스프리 매장은 2020년 656개, 2023년 338개로 줄어들었고 현재는 전국 147개만 남아있습니다. 내년에는 100개 이하로 떨어질 것이란 우려도 나옵니다.  실적도 크게 악화했습니다. 2016년 7000억원이 넘었던 국내 매출은 2020년 3486억원으로 반토막 났습니다. 코로나19 팬데믹을 거친 후 2022년에는 2997억원까지 줄어들었죠. 이니스프리의 국내 매출액이 3000억원에도 미치지 못한 것은 2012년 이후 10년 만이었습니다.  리브랜딩마저  그렇다고 이니스프리가 가만히만 있었던 것은 아닙니다. 2023년 전면 리브랜딩을 단행하면서 브랜드의 로고, 컬러, 패키지까지 모두 바꿨습니다.  하지만 리브랜딩도 효과는 없었습니다. 오히려 이니스프리의 브랜드 정체성을 흔드는 결과만 가져왔습니다. 이니스프리를 상징하던 '제주' 이미지가 희석되면서 차별점이 약해졌습니다. 운영 품목도 크게 줄어들면서 핵심 제품이 단종됐고 고객들은 '구매하던 제품이 없어졌다'며 매장을 떠났습니다.  실제로 리브랜딩 이후에도 이니스프리의 실적 하락은 멈추지 않았습니다. 이니스프리의 매출은 2023년 2738억원, 2024년 2246억원으로 계속 줄어드는 추세입니다. 지난해 영업이익은 16억원에 불과했습니다. 영업이익률은 0.7%입니다.  이니스프리 본사가 가맹점 외에 다양한 판로 개척에 나설 수밖에 없는 이유가 여기에 있습니다. 시장 자체가 변화하고 있기 때문에 오프라인 가맹점만으로는 브랜드가 생존할 수 없다는 판단을 내린 겁니다.  문제는 이 전략이 가맹점주들의 이익과 정면으로 충돌한다는 점입니다. 가맹점들에게 이커머스는 직접적인 경쟁 상대입니다. 일반적으로 한 곳에서 구매한 제품을 다른 곳에서 또 구매하진 않으니까요. 게다가 온라인 채널에서는 공격적인 할인과 프로모션이 이뤄집니다. 손해를 감수하더라도 할인 프로모션을 감행하죠. 가맹점은 이커머스와의 가격 경쟁에서 밀릴 수밖에 없습니다.  그래서 아모레퍼시픽은 가맹점 지원책도 내놓고 있습니다. 2019년 업계 최초로 '마이샵' 제도를 도입해 온라인 매출의 일부를 가맹점에 배분하고 있고요. 상생펀드 등으로 가맹점당 연간 1000만원 수준을 지원하고 있습니다. 이외에도 정기적으로 경영주협의회와 소통하며 채널별 상품 공급과 프로모션 전략을 협의하고 있습니다. 이번에 가맹점주협의회에서 제기한 추가 요구사항에 대해서도 구체적인 지원 방안을 검토하고 있다고 밝혔습니다.  하지만 이니스프리가 처한 딜레마는 쉽게 해결되지 않을 것으로 보입니다. 온라인 채널을 축소하면 브랜드 경쟁력이 약해지고, 온라인을 확대하면 가맹점이 타격을 입을 수밖에 없으니까요. 브랜드숍이라는 유통 형태 자체가 한계에 직면한 상황에서 이니스프리가 어떻게 균형점을 찾을 수 있을지 지켜봐야겠습니다.",https://n.news.naver.com/mnews/article/648/0000042433
2025-12-05 13:51:00,"""AI를 상·하수도처럼""…이재명-손정의, '초지능 시대' 로드맵 논의","이재명 대통령이 5일 용산 대통령실에서 손정의 소프트뱅크 회장을 접견했다. 취임 이후 래리 핑크 블랙록 회장, 샘 올트먼 오픈AI CEO, 젠슨 황 엔비디아 CEO 등을 연달아 만난 데 이어 글로벌 AI 리더십 외연을 확장하는 행보다. 이날 논의는 한국의 'AI 기본사회' 비전과 초인공지능 시대 전망 그리고 한일 AI 협력 구체화에 초점이 맞춰졌다.  이 대통령은 한국의 AI 정책 방향을 손 회장에게 직접 설명했다. ""AI를 상·하수도처럼 국민 누구나 누리는 기본 인프라로 만들겠다""며 ""모든 국민과 모든 기업이 AI를 자연스럽게 활용하는 사회적 기반을 구축하겠다""고 강조했다.   이어 최근 한미 통상 협상 과정서 손 회장이 조언을 준 데 대해 감사를 전하며 ""위험은 최소화하고 유용성은 극대화하는 방향으로 AI 투자를 확대할 것""이라고 덧붙였다.  회의에는 배경훈 과기정통부 부총리, 김정관 산업부 장관, 강훈식 비서실장 등이 배석했다. 이 대통령은 ""한국이 AI 3강 국가를 지향하는 만큼 한일 간 AI 협력이 중요하다""며 ""손 회장이 가교 역할을 해달라""고 요청했다.  손 회장은 ""다음 기술 지평은 ASI(초인공지능)""라며 기존 AI 논쟁을 뛰어넘는 전망을 제시했다. 그는 ""AGI(범용인공지능)는 인간 두뇌와 비슷한 수준이지만 ASI는 인간보다 1만배 뛰어난 존재""라고 설명했다.   이어 ""지능 격차는 금붕어와 인간의 차이처럼 벌어질 것""이라며 ""AI를 통제하려는 방식에서 벗어나 공존 전략을 고민해야 한다""고 조언했다. AI가 인류를 위협할 것이란 우려에는 ""우리가 반려견을 해치지 않듯 기우에 가깝다""고 말했다.  이 대통령은 ASI가 가져올 사회적 영향에 우려도 표했다. ""과학 분야에서는 ASI가 노벨상을 받을 수 있지만 문학상까지 석권하는 상황은 바람직하지 않다""고 말하자 손 회장은 ""(그렇지만) 그렇게 될 가능성이 있다""고 답했다.  아울러 이날 접견에는 르네 하스 ARM CEO도 동행해 눈길을 끌었다. ARM은 소프트뱅크가 지분 90%를 보유한 글로벌 반도체 설계기업이다. 스마트폰 CPU 설계의 95%를 차지, 최근 AI 서버 시장까지 영역을 넓히고 있다.   이 대통령은 ARM과 국내 팹리스 기업 간 협력, AI 인재 양성을 위한 'ARM 스쿨' 추진 현황을 점검하며 ""인력 기반 확충에 큰 도움이 될 것""이라고 평가했다.  두 사람은 소프트뱅크·오픈AI·오라클이 추진하는 글로벌 데이터센터 네트워크 '스타게이트 프로젝트'에 대해서도 논의했다. 지난달 UAE 순방 당시 'UAE 스타게이트'에 한국 기업 참여를 확정한 만큼 한국 내 데이터센터 신설 가능성과 후속 로드맵이 핵심 논점으로 올랐다.  한편, 이번 회동은 한국이 추진하는 AI 전략과 손 회장이 제시한 초지능 시대의 기술 비전이 교차한 자리로 평가된다. AI 인프라 구축부터 글로벌 협력 및 기술 철학까지 폭넓은 논의가 이어지며 한국의 AI 도약 전략이 한층 입체적으로 다듬어졌다는 분석이다.",https://n.news.naver.com/mnews/article/648/0000042432
2025-12-05 13:46:00,[AGF 2025]①지스타보다 알차네…대형 게임사 총집결,"서브컬처 마니아들의 축제인 '아니메 게임 페스티벌(AGF)'이 5일 일산 킨텍스에서 막이 올랐다. 국내 최대 게임전시회 '지스타(G-STAR)'가 상대적으로 한산했던 것과 달리 AGF에는 메인 스폰서인 스마일게이트를 비롯해 엔씨소프트, 넥슨, 넷마블, 네오위즈, NHN 등 내로라 하는 대형 게임사들이 참석해 풍성한 라인업을 자랑했다.  더 커진 AGF…스마일게이트 '미래시' 최초 시연   2018년 처음으로 개최된 AGF는 올해로 6회를 맞았다. 'AGF 2025'는 일산 킨텍스 제1전시장에서 이날부터 오는 7일까지 사흘간 개최된다. 기존에는 이틀간 개최됐지만 올해는 관람객들의 호응에 힘입어 AGF 개최기간을 3일로 늘렸다. 길어진 일정에 맞춰 스페셜 스테이지나 체험 콘텐츠도 대폭 늘었다.  메인 스폰서인 스마일게이트는 2023년부터 3년 연속으로 AGF에 참가한 AGF 단골손님이다. 스마일게이트는 올해 AGF에서 80부스 규모로 대형 부스를 꾸리고 3개의 지식재산권(IP)을 선보였다. 신작 '미래시: 보이지 않는 미래(미래시)'를 국내 최초로 시연해볼 수 있도록 했고, 도쿄게임쇼(TGS)에서 큰 호응을 받았던 LED 타워를 설치했다.   두터운 팬층을 보유한 스마일게이트의 대표 IP 중 하나인 '에픽세븐' 전시존에서는 신규 에피소드 '스러진 잔불의 비가' 스토리를 담은 체험부스가 마련됐다. 스마일게이트가 퍼블리싱을 맡은 '데드 어카운트: 두 개의 푸른 불꽃'의 전시공간에서는 각종 굿즈를 만나볼 수 있다.  넷마블 역시 3년 연속으로 AGF에 참가해 '페이트 오브 그랜드오더' 단독 부스를 냈다. 출시 8주년을 맞은 '페이트 그랜드 오더'의 공식 굿즈를 판매하거나 체험 프로그램을 마련했으며, 오는 6일 성우 카와스미 아야코와 아사카와 유우를 초청한 '레드 스테이지'를 진행한다.  네오위즈도 지난해에 이어 '브라운더스트2'를 출품했다. 눈 내리는 겨울 왕국 컨셉의 단독 부스로 굿즈 스토어, 미니게임존, 코스프레 포토존 등을 운영하며 미공개 원화 일러스트를 만나볼 수 있는 별도 VIP 존을 마련했다. 성 방시우가 참여하는 토크쇼, 메인 원화 팀장을 초청한 '라이브 드로잉 쇼'도 열린다.  위메이드커넥트도 2년 연속 '로스트 소드'로 AGF에 참가한다. 브라운더스트는 로스트 소드의 새로운 PV를 AGF에서 처음으로 선보이며, 방문객을 대상으로 한 '띠부씰'을 제공하고 다양한 굿즈를 전시·판매한다.  엔씨소프트·NHN 서브컬처 도전…해외 게임사도 참석  올해 AGF에서는 낯선 얼굴들이 여럿 눈에 띄었다. 게임업계 '큰형님' 엔씨소프트는 서브컬처 장르에 도전하면서 올해 AGF에 처음으로 참가했다. 엔씨소프트는 신작 '리밋 제로 브레이커스'(이하 브레이커스) 부스를 내고 미니게임 3종, 보너스 룰렛, 인생네컷 포토존, 카페테리아 등을 운영한다. 브레이커스는 2026년 출시 예정인 애니메이션 액션 역할수행게임(RPG)으로, 엔씨소프트가 지분을 투자한 서브컬처 전문 개발사 빅게임스튜디오가 개발 중이다.   NHN도 내년 출시 예정인 '어비스디아'와 3매치 퍼즐 게임 '최애의 아이 퍼즐 스타(puzzle star)'를 출품하면서 서브컬처 팬들에게 눈도장을 찍었다. 수집형 RPG 어비스디아는 총 35개에 달하는 시연기기를 마련해, 20분 가량 준비된 빌드로 시연해볼 수 있도록 했다. 매일 오후 4시에는 시연에서 고득점을 기록한 이용자들을 대상으로 '어비스 인베이더 랭킹대전' 본선이 열린다.  최애의 아이 퍼즐 스타는 인기 애니메이션 '최애의 아이' IP를 기반으로 제작한 첫 공식 게임이다. LED 벽에서는 최애의 아이 애니메이션과 인게임 영상을 확인할 수 있다. 벽에 블록을 던져 3매치를 달성하면 성공하는 '매치3 완성하기', 원작 애니메이션 명장면의 빈칸을 채우는 '명장면 맞추기', 좋아하는 캐릭터와 추첨 이미지가 일치하는지 도전하는 '캐릭터 가챠' 체험형 콘텐츠로 마련됐으며, 부스 체험을 마치고 나면 최애의 아이 굿즈를 뽑을 수 있는 럭키 드로우에 참여할 수 있다.   넥슨은 대표 서브컬처 게임인 '블루 아카이브'가 아닌, '마비노기 모바일'로 부스를 꾸렸다. 모든 밀레시안(마비노기 모바일 이용자)들이 만나는 '티르코네일'의 풍경을 재현한 공간으로 꾸몄으며, 휴식 공간과 충전 설비를 제공하는 등 AGF에서 쉬어갈 수 있는 공간을 마련했다. 낚시 미니게임부터 캐릭터 꾸미기 체험, 쿠키와 물을 선물하는 식료품점 등 체험형 공간도 준비했다.  외국계 게임사들도 대거 참가했다. 텐센트의 '레벨 인피니트'가 퍼블리싱하는 '승리의 여신: 니케' 부스는 아침부터 성황을 이뤘다. 요스타는 '명일방주'와 '작혼: 리치마작', '스텔라 소라'까지 3종의 IP를 선보였다. 사이게임즈도 카카오게임즈가 퍼블리싱해 국내서 성공한 '우마무스메: 프리티 더비'를 내놨고, 하오플레이도 '리버스1999' 부스를 마련해 이용자들을 만났다.  지스타보다 효율적인 AGF 선호 커져  지난달 부산 벡스코에서 열린 '지스타 2025'는 대형 게임사들이 잇따라 불참하면서 예년만 못하다는 평가를 받았다. 실제로 부스 규모도 예년 대비 줄어들었고, 야외 부스와 체험형 콘텐츠도 적었다.  반면 AGF는 높아진 서브컬처 장르의 인기에 힘입어 참가사가 늘면서 화려한 참가 라인업을 자랑했다. 넥슨, NHN, 스마일게이트도 올해 지스타에는 B2C(기업과 소비자 간 거래) 부스를 내지 않았지만 AGF에서는 관람객들을 만났다. 해외 게임사인 요스타, 하오플레이, 레벨 인피니트, 사이게임즈도 올해는 지스타 대신 AGF에만 작품을 출품했다.  게임업계 한 관계자는 ""서브컬처 게임사들이 많아지기도 했지만, 장르의 특성상 불특정 다수가 참가하는 지스타보다 서브컬처 팬들이 몰리는 AGF에 출품하는 게 더 효과적이라고 판단했을 수 있다""고 말했다.",https://n.news.naver.com/mnews/article/648/0000042431
2025-12-05 13:41:00,애니메이션·게임 축제 '인산인해'…한파 뚫은 팬심,"서브컬처(애니메이션풍) 게임들이 한자리에 모이는 종합 애니메이션·게임 축제 'AGF 2025'가 국내외 게임업계의 적극적인 참여 속에 역대 최대 규모로 성황리에 개최됐다.  AGF 2025 개막일인 5일 경기 고양시 킨텍스 제1전시장 앞은 기온이 최저 영하 10도까지 떨어지는 강추위에도 젊은 애니·게임 팬들로 북적였다. 일부 열성 팬들은 전날 밤부터 킨텍스 안에 진을 치고 개막을 기다린 것으로 전해졌다.  행사 스폰서인 스마일게이트는 대표작 '에픽세븐'과 컨트롤나인이 개발 중인 차기작 '미래시: 보이지 않는 미래'를 AGF에 출품했다.  서브컬처 게임을 사랑하는 팬들은 코스프레 의상을 전시장 빈공간에서 분주하게 준비하는 모습도 보였다.   AGF는 올해 지스타에 대형 게임업체들이 잇달아 불참을 선언하고, 서브컬처 게임 비중이 늘면서 연말 국내에서 가장 주목받는 게임 행사로 떠오르고 있다.",https://n.news.naver.com/mnews/article/648/0000042430
2025-12-05 13:37:00,"""형식적 규제 탓에 보안 대응력 떨어진다""","""사이버 보안 업무 가운데 80%가 감사 컴플라이언스(규제 준수) 분야입니다. 그러니 실제 사이버 위협에 대응하는 업무를 하기 어렵죠.""(아시아·태평양 지역 이동통신사업자)  전세계적으로 사이버 보안 위협이 증가하고 있으나 이를 다루는 정부 규제가 형식적이고 복잡한 탓에 기업들의 대응력이 떨어진다는 분석이 나왔다. 세계이동통신사업자연합회(GSMA)는 최근 발간한 '사이버 보안 규제가 이동통신사업자에게 미치는 영향' 보고서에서 ""이동통신사업자들은 현재 사이버 보안 활동에 190억달러(27조9400억원)를 지출하고 있는데, 최근 사이버 공격이 증가하면서 이러한 비용이 오는 2030년 420억달러(61조7700억원)까지 증가할 것""이라며 이같이 밝혔다.  GSMA는 이어 ""사이버 위협의 증가로 규제의 역할도 중요해졌다""며 ""그러나 많은 국가의 이동통신사업자들은 여러 규제 기관의 규제가 뒤섞인 규제 환경에 직면하고 있다""고 지적했다. 그러면서 ""이는 실제 위험 완화가 아닌 형식적인 규제 준수 작업에 자원을 투입하게 만든다""고 했다.   한국의 경우도 마찬가지다. 개인정보보호와 관련한 정부 기능은 주무부처인 개인정보보호위원회만 담당하는 게 아니라 신용정보법과 위치정보법에 따라 각각 금융위원회, 방송미디어통신위원회(옛 방송통신위원회) 등으로 분산되면서 사실상 컨트롤타워가 나뉘어있는 상태다. 올해 4월 발생한 SK텔레콤 해킹 관련 조사도 과학기술정보통신부와 개인정보위가 별도로 움직였고, SKT는 두 곳 모두를 상대해야 했다.  GSMA는 ""일부 사업자는 사이버보안 운영팀 자원의 절반가량이 실제 위협 식별이나 위험 관리보다는 규정 준수 작업에 투입된다고 보고했다""며 ""이러한 비효율성은 혁신에 대한 투자를 위축시키고, 궁극적으로는 더 높은 사고 발생 가능성을 초래할 수 있다""고 경고했다.  또 ""규제 당국이 처벌이나 비난 중심의 문화를 유지할 경우 사업자들이 책임 회피에 중점을 두게 되는 등 변질될 수 있다""고 우려했다. 사이버 위협 예방과 사후 조사를 제대로 하려면 이동통신사업자들의 협조가 필수적인데, 처벌이 과할 경우 보안 취약점이나 피해 사실을 감추는데 집중하는 등 부작용이 속출할 것이란 얘기다.  실제로 최근에 고객 개인정보유출 사고를 겪은 기업들은 신속한 신고로 2차 피해를 줄이는 노력보다는 규제당국이 정한 신고기한을 지키는데 급급하고 개인정보 '유출'이 아니라 '노출'이라는 애매한 표현을 쓰는가 하면 유출 규모도 뒤늦게 알리는 등의 모습을 보이고 있다.  GSMA는 끝으로 ""사이버 보안 규제의 단편화, 다양한 규제의 중복·충돌 방지로 일관성 유지, 위험 및 성과 기반의 규제 설계, 통신업계와 협력적 규제 문화, 예방을 강조하는 접근 방식, 규제당국의 역량 강화 등의 원칙을 갖춰야 안전한 모바일 네트워크 서비스가 가능하다""고 강조했다.",https://n.news.naver.com/mnews/article/648/0000042429
2025-12-05 13:27:00,밤·주말에도 아파트 앱으로 비대면 진료…'힐스테이트'의 차별화,"아파트 브랜드 '힐스테이트'를 보유한 현대건설이 입주민 전용 플랫폼 '마이힐스(my HILLS)' 앱(app)을 통해 비대면 진료 서비스를 제공한다고 5일 밝혔다.   이를 위해 현대건설은 지난 11월21일 국내 1위 비대면진료 플랫폼 기업 닥터나우와 '비대면 의료서비스 제공을 위한 업무협약(MOU)'을 체결했다.   현대건설은 마이힐스 앱에 닥터나우 앱을 연동해 간편하게 비대면진료 서비스를 이용할 수 있도록 했다. 입주민이라면 앱을 통해 감기, 피부질환, 소아질환, 만성질환 등 일상에서 자주 발생하는 질병에 대해 비대면 진료를 받을 수 있다.   가정의학과, 내과, 소아청소년과, 안과 등 다양한 진료과목을 광범위하게 포함하며, 야간이나 주말에도 진료가 가능해 필요할 때 즉시 진료를 볼 수 있다는 게 현대건설 측 설명이다.   현대건설 관계자는 ""아파트가 더 이상 단순한 주거 공간이 아닌, 건강관리와 웰빙을 위한 인프라로 확장되고 있다""면서 ""이번 닥터나우와의 협업은 입주민이 집에서 일상적으로 편하게 접근할 수 있는 건강관리 생태계를 구축하는 중요한 계기가 될 것”이라고 말했다.  닥터나우 관계자는 ""국내 주거 플랫폼과 의료서비스의 결합은 사용자 중심 디지털 헬스케어 구축과 맞닿아 있는 점에서 유의미하다""라며 ""현대건설이 제공하는 브랜드 주거공간의 입주민이 더 빠르고 편리하게 건강관리 서비스를 이용할 수 있도록 사용자 경험(UX)을 제공하겠다""고 밝혔다.  현대건설은 향후 건강 데이터 기반의 생활 패턴 분석, 인공지능(AI) 건강 코칭, 비대면 진료 서비스 연동 등을 통해 주거 기반 디지털 헬스케어 서비스를 단계적으로 확대할 계획이다.",https://n.news.naver.com/mnews/article/648/0000042428
