날짜,제목,본문,링크
2025-12-03 09:00:00,이달 제재심 가는 MBK…금감원 중징계 예고 vs 업계선 의문 시각도,"금융감독원이 이번 달 홈플러스의 대주주 MBK파트너스에 대한 제재심의위원회(제재심)을 진행한다. 검찰이 수사 중인 유동화증권 사기발행 사건과는 별개로 MBK가 업무집행사원(GP)으로서 불건전 영업행위를 했는지를 두고 제재 수위를 심의한다.  금감원이 직무정지를 포함한 징계안을 사전통보한 것으로 알려지며 시장에서는 논란도 번지고 있다. GP에 이같은 중징계를 추진하는 것이 최초이기 때문이다.  이번 제재심의 핵심 쟁점은 홈플러스가 발행한 상환전환우선주(RCPS)의 상환조건을 변경한 조치가 국민연금 등 출자자(LP)의 이익을 훼손했는지 여부다. 금감원은 SPC(한국리테일투자)가 보유한 RCPS의 상환권 조정으로 SPC의 투자자인 국민연금이 투자 회수 기회를 잃을 위험이 커졌다고 보고있다. 반면 MBK와 일부 금융투자업계에서는 '조건 변경을 홈플러스만의 이익을 위한 행위로 단정하기 어렵다'며 금감원의 해석에 의문을 제기한다.  'RCPS 상환조건 변경' 왜 문제 삼나  금융당국과 금융투자업계에 따르면 금감원은 지난달 말 MBK에 중징계안을 사전통보했다. 금감원은 MBK가 제출한 답변서를 검토한 뒤 이달 중 제재심에 착수한다.  금감원은 올해 3월 홈플러스 기업회생 사태 직후 MBK가 단기신용등급 하락을 인지한 상태에서 유동화증권을 발행했는지를 조사하고 관련 정황을 검찰에 넘겼다. 이후 지난 8월에는 강제조사권을 가진 금융위원회와 함께 MBK 본사 현장조사에 착수했다. MBK가 GP로서 투자자 모집·운용 과정에서 충실한 역할을 했는지, 특히 국민연금 등 LP들이 권리 상실 가능성을 인지하고 있었는지를 집중 점검했다. 당시 시장에선 MBK가 홈플러스가 발행한 RCPS의 상환조건을 변경하면서 국민연금을 비롯한 LP들의 변제순위가 밀렸다는 지적이 나왔기 때문이다  유동화증권 사기발행은 검찰에 수사중인 사안이기 때문에 금감원이 이와 관련해 행정조치에 나서긴 어렵다. 이 때문에 금감원의 이번 징계는 자본시장법상 GP 영업행위 준수의무 위반 여부에 초점이 맞춰졌다.  홈플러스 경영권 지배구조를 간단히 요약하면 MBK의 기관전용 사모펀드(PEF)→한국리테일투자(SPC)→홈플러스로 정리할 수 있다. 이때 RCPS는 두 종류가 존재한다. 하나는 SPC가 발행하고 국민연금이 투자한 것(아래그림 ①), 다른 하나는 홈플러스가 발행하고 SPC가 보유한 것(아래그림 ②)이다. 이 중 MBK가 GP로서 상환권에 손을 댄 RCPS는 홈플러스가 발행하고 SPC가 보유한 것이다.   MBK는 지난해 2월말 신용평가사로부터 홈플러스 단기신용등급을 'A3'에서 'A3-'으로 내릴 것이라고 사전 통보를 받았다. 이에 홈플러스 부채비율을 낮추기 위해 홈플러스가 발행한 RCPS의 상환에 대한 재량권을 회사(홈플러스)만 갖도록 변경했다. RSCP 보유자인 SPC가 상환권을 홈플러스에 넘긴 셈이다. 상환의무에서 자유로워진 홈플러스는 RCPS를 부채에서 자본으로 재분류했다. 이 조치를 통해 홈플러스의 부채비율은 1408.6%(작년 11월 말 기준)에서 약 500%까지 낮아졌다. 그러나 신용평가회사는 신용등급 하락 결정을 바꾸지 않았고 홈플러스는 결국 기업회생 절차에 들어갔다.   금감원은 이 과정에서 MBK가 RCPS의 상환권을 포기한 행위가 궁극적으로 SPC에 투자한 국민연금에 손해를 끼쳤다고 보고 있다. 국민연금은 홈플러스에 두 갈래로 투자했다. 블라인드펀드 3-2호를 통해 295억원의 보통주를 투자하는 동시에 SPC가 발행한 RCPS 5826억원을 인수했다.  국민연금이 직접 돈을 댄 RCPS의 상환조건은 바뀌지 않았지만, 결과적으로 국민연금에도 영향을 미치게 됐다. SPC의 유일한 투자자산이 홈플러스인데, SPC가 상환권을 포기하면서 홈플러스로부터 자금을 회수하지 못하게 됐다. 그렇다 보니 연쇄적으로 국민연금이 투자한 RCPS 역시 SPC로부터 상환받지 못할 위험에 놓인 것은 맞다.  이에 금감원은 MBK가 LP의 수익을 뒷전으로 두고 GP로서 책임을 다해 펀드를 운용하지 않았다고 본다. 자본시장법과 집합투자재산을 운용할 때 정당한 이유 없이 일반적인 거래조건을 벗어나는 불공정한 조건으로 거래하거나 특정 PEF나 투자목적회사의 이익을 해치면서 자기 또는 제3자의 이익을 도모하는 행위를 금지한다.  금융투자업계 관계자는 ""법적으로 GP(MBK)가 임의적으로 해도 된다고 주장할 수 있지만 LP(국민연금) 입장에서 굉장히 큰 금액을 투자했고 결과적으로 피해를 받을 수 있는데 LP를 의사결정 과정에서 패싱했다는 것이 상식적으로 이해가 가지 않는다""고 말했다. 그러면서 ""앞으로도 거래를 이어갈 파트너이기에 업계에선 납득할 수 없다는 반응이 나온다""고 덧붙였다.  신용등급 하락 막으려 했는데 LP 이익 훼손?  반면 금감원의 논리에 의문을 제기하는 시각도 상당하다. 우선 PEF 구조상 GP는 규약과 계약 범위 내에서 자산가치 보존을 위한 주요 판단을 독자적으로 내릴 수 있다. 즉 LP의 동의를 얻지않고 바꾼 것과 관련해 절차상 문제를 제기하기 어렵다는 것이다.   특히 MBK 측은 투자자산(홈플러스)의 신용등급 하락을 막으려는 목적이었기에 LP의 이익을 침해한 것이 아니라고 강력히 맞서고 있다.   MBK는 지난달 23일 입장문을 통해 ""홈플러스 우선주 상환권 조정은 기업가치를 유지하기 위한 조치로, 결과적으로 국민연금을 포함한 모든 투자자의 이익을 보호하기 위한 GP의 운용 판단""이라고 주장했다.   업계에서도 상환권 변경만으로 GP가 선관의무를 어겼다고 보긴 애매하다는 평가를 내린다. 자산운용업계 관계자는 ""조합의 규약이나 RCPS의 인수계약서 범위를 침범하지 않는다면 GP의 권한으로 상환조건을 변경할 수 있다""며 ""누가봐도 수익을 내기 어려운 상황에서 일부만 양보했다면 종합적으로 봤을 때 문제가 되지 않는다""고 말했다.   또한 인수금융이 완전히 상환되지 않으면 SPC가 상환권을 행사해도 국민연금에 자금을 돌려주는 것이 구조적으로 불가능하다는 점도 근거로 든다.  MBK 관계자는 ""홈플러스가 발행한 RCPS를 상환할 수 있는 조건은 홈플러스에 배당가능이익이 있거나 차입금을 다 갚는 것""이라며 ""SPC가 RCPS를 갖고있도 부채비율만 높아지기 때문에 상환조건을 바꾼 것이고, 상환조건을 변경하더라도 LP에 실질적인 피해를 미치지 않는다""고 설명했다.  홈플러스 투자와 관련해 말을 아끼고 있는 국민연금도 이 점을 인지하고 있다. 국민연금은 지난 3월 국회 정무위원회에 제출한 자료에서 ""홈플러스 투자 역시 인수금융이 전액 상환을 완료돼야 RCPS 상환이 가능하도록 계약이 체결됐다""며 ""(2월 말 기준 홈플러스에) 선순위 차입금이 남아있어 한국리테일투자(SPC)가 발행한 RCPS의 상환권 행사가 불가능한 상황""이라고 밝힌 바있다.   이번 사안은 GP의 재량적 판단과 LP 이익 보호 의무가 충돌할 때 어떤 기준으로 판단해야 하는지 가늠하는 사례가 될 전망이다. 금감원 제재심이 MBK의 행위가 자산가치 보존을 위한 정당한 재량으로 평가할지, 아니면 LP 이익을 침해한 불건전 영업행위로 판단될지 귀추가 주목된다.   이찬진 금감원장은 지난 1일 기자단담회에서 MBK파트너스에 사전 통보한 직무정지(영업정지) 징계안에 대해 ""살펴봤는데 크게 문제된 부분은 발견하지 못했다""며 ""다만 제재심 논의는 관여하지 않을 것""이라고 밝혔다.  한편 이번 사안과 별개로 국민연금이 홈플러스 투자에서 자금을 얼마나 회수할지는 향후 홈플러스 인수가격에 달렸다. MBK가 '인가전 M&A'를 지원하기 위해 보통주 무상소각 선언하면서 국민연금이 보유한 보통주 가치는 0원이 됐다. 홈플러스 새주인과 책정하는 가격에 따라 RCPS 투자금을 돌려받을 수 있을지가 결정된다. 다만 최근 홈플러스 M&A 본입찰에 아무도 참여하지 않으면서 회수 여부와 시기는 불확실한 상황이다.",https://n.news.naver.com/mnews/article/648/0000042346
2025-12-03 08:45:00,"""해킹영향 1도 없어요""...증권가 'KT' 목표주가 7만원으로 상향","불법 기지국 해킹으로 무단 소액결제 사건이 일어났던KT에 대해 증권가가 일제히 해킹으로 인한 회사 수익성과 주가영향은 미미할 것이라고 분석했다. 해킹으로 인한 비용은 이미 실적 예상치에 반영했다는 것이다.   오히려 KT 매출은 늘고 수익성은 높아지며 이에따라 배당 등 주주환원 역시 계획대로 흘러갈 예정인 만큼 주가 상승을 기대해도 좋다는 전망을 내놨다.   하나증권과 유안타증권은 3일 보고서를 내고 KT의 향후 전망에 대해 분석했다.   이승용 유안타증권 연구원은 ""2028년 연결 자기자본이익률(ROE) 9~10%를 목표로 인공지능과 IT부문 매출 성장, 수익성 제고, 비핵심 자산의 유동화 등이 순조롭게 이어지고 있는 것으로 보인다""며 ""글로벌 빅테크와 추진 중인 인공지능 전환(AX)사업은 2026년부터 본격적으로 매출에 기여할 것""이라고 전망했다.   유안타증권은 지난 9월 일어난 KT해킹 사건으로 보수적인 입장을 취하면서도 이로 인한 영향은 크지 않을 것으로 봤다. 앞서 KT는 지난 8월 해커가 만든 유령기지국으로 가입자 식별 번호 등이 유출되면서 무단으로 소액결제가 이루어지는 등 해킹 피해가 일어났었다. 당시 KT는 서버 침해 사실을 인지했으나 뒤늦게 한국인터넷진흥원(KISA)에 신고하면서 논란이 일기도 했다.   이승용 연구원은 ""최근 해킹 사태로 4분기 비용이 발생할 가능성이 있고 신임 대표이사 선임을 고려해 단기적으로는 보수적인 접근을 권고한다""면서도 KT의 목표주가는 5만9000원으로 상향했다.   하나증권 역시 KT의 목표주가를 7만원으로 올려 잡았다.   김홍식·이상훈 하나증권 연구원은 ""해킹 관련 비용은 향후 실적 추정치에 상당 부분 반영된 상태이고, CEO 교체에 따른 밸류업 정책 변화 가능성은 희박하다""며 ""배당소득 분리과세, 자사주 의무소각 법제화 등에 따라 KT를 밸류업 정책 수혜주로 보고 12개월 목표주가를 7만원으로 상향한다""고 설명했다.   하나증권은 ""KT는 본사 기준 배당 성향이 50% 전후를 지속 유지 중이고 2025년 주당배당금(DPS) 성장률이 20%에 달한다""며 ""향후 3년 간 배당소득 분리과세 적용 대상에서 제외될 가능성은 희박하고 기대배당 수익률이 압도적으로 높아 국내 대표 정책 수혜주로 손색이 없다""고 강조했다.",https://n.news.naver.com/mnews/article/648/0000042345
2025-12-03 08:30:00,"[금투협회장 3인3색]④황성엽 ""협회, 혁신기업 성장 플랫폼으로""","제7대 금융투자협회장 선거 본선 대진표가 확정됐다. 금융투자협회 후보추천위원회는 서유석 현 금융투자협회장, 이현승 전 SK증권·KB운용 전 대표, 황성엽 신영증권 대표를 차기 협회장 후보로 최종 선정했다. 비즈워치는 향후 3년간 정부와 자본시장의 가교 역할을 담당할 세 후보 인터뷰를 진행했다. 이들의 출마계기 및 공약을 짚어본다.  제7대 금융투자협회장 선거 출사표를 낸 황성엽 신영증권 대표는 최근 비즈워치와의 인터뷰에서 ""그동안 금융투자업은 산업을 지원하는 보조적인 역할에 불과했지만, 한국경제의 골든타임을 맞아 생산적인 분야에 주도적으로 자원을 배분하는 '국가 성장 플랫폼'으로 거듭할 수 있도록 해야 한다""고 강조했다.  황 대표는 신영증권에서 38년 근무한 '신영맨'이다. 1987년 신영증권에 입사해 자산운용, 법인사업, 기업금융(IB), 경영총괄 분야에서 일한 경험을 토대로 폭넓은 업계 이해도를 강점으로 내세우고 있다.  황 대표는 ""증권사의 리테일, IB, 자산관리(WM), 자산운용 등 모든 부문을 맡으며 다양한 경험을 했다""며 ""신영자산운용과의 시너지를 위해 협력하며 운용업에 대한 이해도 역시 높여왔다""고 밝혔다.  황 대표는 일본의 잃어버린 20년 변곡점과 현재의 한국경제 상황이 맞닿아 있다고 분석했다. 그는 ""2014년부터 아베 정권이 기업지배구조 개혁을 시작하면서 일본의 변화가 시작됐다""며 ""우리나라도 미래 성장 동력 확보라는 새로운 변곡점에서 골든타임을 맞이했다""고 바라봤다.  그러면서 금융투자협회가 우리나라 금융 산업을 은행 중심에서 자본시장 중심으로의 변화하도록 이끌어야 한다고 강조했다. 그는 ""대출 중심의 은행시스템에 머문 일본과 투자은행 중심의 자본시장 시스템으로 혁신을 이어간 미국의 차이가 미래를 갈랐다""며 ""장기투자에 대한 인센티브와 연금에 대한 정책적 개선 등을 통해 자본시장 중심의 경제로 나아가야 할 시점""이라고 말했다.   미국의 빅테크 등 혁신 사업을 이끄는 배경이 △투자은행(IB) 중심의 자본시장 △탄탄한 연금제도라는게 그의 생각이다. 그는 ""국회와 금융당국, 정부와 긴밀히 소통해 공감대를 형성, 우리도 장기투자에 대한 인센티브와 연금정책에 대한 정책적 개선을 통해 혁신 산업을 이끌고 싶다""는 포부를 밝혔다.  황 대표는 '어항론'에 대해서도 언급하면서 대형사를 '큰 돌', 중소형사를 '작은 돌'에 비유했다. 그는 ""큰 돌·작은 돌·모래를 넣으려면 큰 돌을 먼저 넣어야 차곡차곡 쌓인다""며 ""큰 돌이 가장 큰 역할을 하지만 작은 돌·모래도 역할이 있다""고 말했다. 그러면서 ""대형·중형, 운용사·신탁사 모두 가리지 않고 균형된 감각으로 사안 조정해 당국과 소통할 것""이라고 덧붙였다.",https://n.news.naver.com/mnews/article/648/0000042344
2025-12-03 08:23:00,내년부터 고배당기업 배당소득은 전액 분리과세,"내년부터 고배당 기업으로부터 받은 배당소득은 그 소득금액이 아무리 많더라도 다른 소득과 합산하지 않고 별도의 낮은 세율로 분리과세한다.   연간 배당소득 2000만원까지는 14% 세율로 분리과세하고, 2000만원 초과~3억원 이하는 20%, 3억원 초과~50억원 이하는 25%, 50억원 초과는 30%세율로 각각 분리과세한다.   현재 2000만원이 넘는 이자와 배당소득은 금융소득종합과세 대상이 되어 다른 소득과 합산해 세금을 계산하고 있다. 근로소득 등 다른 소득이 많은 경우 최고 45%(지방소득세 포함 49.5%)의 종합소득세율로 세금을 내야 한다.   하지만 앞으로는 고배당기업으로부터 받은 배당은 예외를 적용한다. 기업의 배당 의사결정권자인 대주주들의 세부담을 줄이고, 이에 따라 기업이 많은 배당을 할 수 있도록 촉진하겠다는 취지다.  국회는 지난 2일 본회의를 열고, 이같은 내용의 조세특례제한법 개정안 등 내년도 예산안의 부수법안을 통과시켰다.  분리과세 대상 기준이 되는 고배당 기업은 △배당성향이 40% 이상이거나 △배당성향 25% 이상이면서 직전 3년 평균 배당보다 10%이상 배당이 증가한 곳이다. 이러한 기업으로부터 받은 배당소득만 분리과세 혜택을 받을 수 있다.  고배당 기업의 배당소득 분리과세와 기존 금융소득 2000만원 이하 분리과세는 별도로 적용한다. 이자소득이나 일반 기업으로부터 받은 배당, 상장지수펀드(ETF) 투자로 받은 분배금 등 일반 금융소득은 지금처럼 2000만원까지만 분리과세되고, 이를 초과하면 다른 소득과 합산과세한다.  고배당 기업 배당소득의 분리과세는 내년 1월 1일 이후 받는 배당부터 곧바로 적용하며, 오는 2028년 12월말까지 3년간 한시 적용 후 연장 여부를 검토한다.",https://n.news.naver.com/mnews/article/648/0000042343
2025-12-03 08:20:00,"[금투협회장 3인3색]③이현승 ""협회, 정책 설계 초기부터 참여""","제7대 금융투자협회장 선거 본선 대진표가 확정됐다. 금융투자협회 후보추천위원회는 서유석 현 금융투자협회장, 이현승 전 SK증권·KB운용 전 대표, 황성엽 신영증권 대표를 차기 협회장 후보로 최종 선정했다. 비즈워치는 향후 3년간 정부와 자본시장의 가교 역할을 담당할 세 후보 인터뷰를 진행했다. 이들의 출마계기 및 공약을 짚어본다.  제7대 금융투자협회장 선거 출사표를 낸 이현승 전 SK증권·KB자산운용 대표는 최근 비즈워치와의 인터뷰에서 ""시장과 정부의 언어를 모두 이해하는 사람으로서 금융투자협회가 정부 정책에 대응하는 조직을 넘어 정책 설계 초기 단계부터 참여토록 하겠다""고 강조했다.  이 대표는 행정고시(32회) 출신으로 재정경제부에서 공직생활을 시작해 메릴린치증권, SK증권, 코람코자산운용, KB자산운용 등에서 대표를 역임했다. 1988년 행정고시에 합격한 후 12년간 재정경제부에서 정부의 언어를 습득하고, 16년간 증권사(6년)와 운용사(10년) CEO로 활동하면서 얻은 현장의 언어를 강점으로 내세웠다.   이 대표는 취임 1개월 이내에 '금융투자 인가지원센터'와 '금융투자 조세지원센터'를 설립하겠다는 입장이다. 그는 ""금융투자회사 설립시 인허가 절차의 복잡성이 크다""며 ""협회를 통해 인가 준비 절차를 안내하고, 사전 컨설팅을 진행하며, 제도 및 심사 동향 분석을 제공하는 전담조직을 만들 것""이라고 말했다.   이 대표는 또 ""조세지원센터를 통해 사안별로 협회와 회원사 세무팀, 전문가로 구성한 태스크포스(TF)로 금융투자 세제의 종합 분석 및 정책설계 허브 역할을 할 것""이라고 덧붙였다.    그 외 주요 공약으로는 △경직된 규제환경 개선 △배당소득 분리과세 펀드로 확대 △디지털자산 활성화 △생산적 금융확대 등을 꼽았다.   이 대표는 경직된 규제환경 개선을 특히 강조했다. 그는 ""금융사가 신규사업에 진출할 때 업(業)과 무관한 제재 이력으로 신사업 진출이 어려워지는 불합리한 연계 제재를 폐지하고, 글로벌 기준에 맞지 않는 규제를 과감히 없애 경쟁력 있는 자본시장 생태계를 조성할 것""이라고 말했다.  또 ""혁신 기업이 자금을 더 쉽게 조달할 수 있도록 BDC(기업성장집합투자기구)의 운용주체를 증권사로 확대할 것""이라며 ""비상장기업 분석과 투자역량도 확대해야 한다""고 덧붙였다.",https://n.news.naver.com/mnews/article/648/0000042342
2025-12-03 08:10:00,"[금투협회장 3인3색]②서유석 ""3년 전도, 지금도 '회원사 청지기'""","제7대 금융투자협회장 선거 본선 대진표가 확정됐다. 금융투자협회 후보추천위원회는 서유석 현 금융투자협회장, 이현승 전 SK증권·KB운용 전 대표, 황성엽 신영증권 대표를 차기 협회장 후보로 최종 선정했다. 비즈워치는 향후 3년간 정부와 자본시장의 가교 역할을 담당할 세 후보 인터뷰를 진행했다. 이들의 출마계기 및 공약을 짚어본다.  제7대 금융투자협회장 선거에 재출마한 서유석 현 금투협회장은 최근 비즈워치와의 인터뷰에서 ""3년 전 금융투자협회 선거 출마 당시 공약도 '회원사의 청지기', 재출마한 지금 공약도 '회원사의 청기지'""라고 강조했다.  서 회장은 △미래에셋증권 리테일사업부 대표 △미래에셋증권 퇴직연금추진부분 대표 △미래에셋맵스자산운용 사장 △미래에셋자산운용 대표를 역임한 '미래에셋맨'이다. 2023년 1월부터 금투협회장직을 맡고 있다.  서 회장은 자신의 강점으로 '대관능력'을 꼽았다. 그는 ""지난 3년간 협회에 있으면서 당국, 국회와 네트워크를 쌓았다""며 ""이는 한번 쓰고 버리긴 아까운 회원사의 자산""이라고 말했다.   핵심공약으로 '생산적 금융에서의 금융투자업계 역할 확대'를 꼽았다. 그는 ""정부가 최근 '생산적 금융'을 강조하고 있는데 모험자본 공급을 금융투자업계가 해야 한다""고 밝혔다. 그러면서 ""대형증권사는 종합투자계좌(IMA)와 발행어음 인가 등을 통해 조달한 자본을 모험자본에 쓸 수 있다""며 ""대형사가 인공지능(AI)과 데이터센터, 로봇과 바이오 등 첨단기업에 앞장서 모험자본을 적극적으로 투입할 수 있도록 힘쓸 것""이라고 말했다.  '생산적 금융' 기조 아래 중소형 증권사가 할 수 있는 역할도 강조했다. 서 회장은 ""대형사가 큰 프로젝트에 투자한다면 밸류체인의 하단에 있는 부품회사 등 작은 기업을 중소형 증권사가 커버할 수 있다""며 ""중소형 증권사가 영업용순자본비율(NCR) 때문에 어려움을 겪고 있는데 이들이 자금 조달을 할 수 있는 방법을 확보해야 한다""고 말했다.  그 외에도 서 회장은 △토큰증권(STO) 및 가상자산 현물 상장지수펀드(ETF) 등 디지털자산 생태계 구축 △주식형 펀드의 배당소득 분리과세 적용 △펀드 판매절차 간소화 △기금형 퇴직연금에서의 금융투자업계 역할 확대 등을 주요 공약으로 제시했다.   한편 서 회장은 지난 3년간 협회장 재임 시절 성과로 △코리아 디스카운트 해소 △종합금융투자사업자 제도 개선 방안 마련 △넥스트레이드의 성공적인 안착 등을 꼽으면서 ""지난 3년과 마찬가지로 앞으로 3년도 회원사와 자본시장의 과제를 하나하나 풀어낼 자신이 있다""고 강조했다.",https://n.news.naver.com/mnews/article/648/0000042341
