날짜,제목,본문,링크
2025-12-19 15:29:00,"미끄럼방지 더쎈논슬립코팅, 2025년 한국소비자산업평가 우수업체 선정","(왼쪽부터)서범관 부산지사장, 송다빈경남지사장. {사진=더쎈논슬립코팅 제공}   미끄럼 방지 전문 브랜드 더쎈논슬립코팅이 2025년 KCA 한국소비자산업평가에서 실시한 KCIA 한국소비자평가를 통해 우수업체로 선정됐다.  더쎈논슬립코팅은 전국 단위 소비자 조사를 바탕으로 한 이번 평가에서 제품 만족도, 배송 만족도, 컴플레인 응대, 전반적 평가 등 주요 항목에서 높은 점수를 받아 평가 지역 내 세부 부문 소비자평가 우수업체로 이름을 올렸다.  (왼쪽부터)서범관 부산지사장, 유인강 서울경기인천지사장. (사진=더쎈논슬립코팅 제공)   이날 시상식에는 서범관 부산지사장, 송다빈 경남지사장, 유인강 서울·경기·인천지사장이 참석해 수상의 영광을 함께했다.  더쎈논슬립코팅 이동근 대표는 “소비자들의 실제 평가를 통해 우수업체로 선정돼 더욱 뜻깊다”며 “앞으로도 안전하고 신뢰할 수 있는 미끄럼방지 솔루션을 제공하기 위해 품질과 서비스 향상에 최선을 다하겠다”고 밝혔다.",https://n.news.naver.com/mnews/article/016/0002574771
2025-12-19 15:28:00,"금감원, 상생금융 잘한 은행 포상…내년 ‘종합평가체계’ 도입","“포용금융, 비용 아닌 지속가능 성장 일환”   [연합]   [헤럴드경제=박성준 기자] 금융감독원은 19일 오후 서울 여의도 금감원 본원에서 ‘2025년도 포용·상생금융 시상식’을 열고 금감원장 기관포상 6개, 개인포상 10개를 수여했다.  이날 시상식에서는 서민금융 지원 부문에서 우리은행과 경남은행이, 중소기업 지원 부문에서 농협은행과 경남은행이, 자영업자 경영컨설팅 지원 부문에서 국민은행과 광주은행이 각각 우수기관상을 받았다.  개인 부문에서는 서민·중소기업 지원, 자영업자 경영컨설팅, 상생금융 지원 등 업무를 적극 수행한 10명이 우수상을 수상했다.  금감원은 상생금융 우수사례가 금융권 내 확산될 수 있도록 우리은행, 기업은행, 신한은행의 사례 발표 자리도 마련했다.  우리은행은 청년·사회초년생, 자영업자·소상공인 등을 대상으로 새희망홀씨 특화상품을 개발해 올 상반기 611억원을 공급했다. 은행권 내 가장 많은 규모의 새희망홀씨 대출을 공급한 성과다.  기업은행은 대기업과 동반성장협약을 적극 체결하고, 예금보험공사·중소기업중앙회·네네치킨 등 다양한 기관을 신규 발굴해 협약을 맺었다. 올 상반기 동반성장대출 1조원을 공급해 은행권 내 최대 규모를 기록했다.  신한은행은 금융 접근성이 낮은 청년 소상공인(19~39세)을 위해 전국 17개 지역신용보증재단에 105억원을 단독 출연하고 보증료 35억원을 지원했다. 이를 통해 총 1050억원의 경영안정자금을 공급했다.  김병칠 금감원 은행·중소금융 부원장은 “은행권이 포용금융을 비용 측면의 과제로 인식하기보다는 지속가능 성장의 일환이자 비용 효율화 측면에서 은행 경영에 도움이 될 수 있다는 점을 인식해야 한다”며 “은행별로 중장기적 방향성을 갖고 포용금융을 체계적으로 추진해 달라”고 당부했다.  이어 “은행권의 신용평가체계가 중·저신용자, 금융이력부족자 등 다양한 계층을 충분히 아우르지 못하고 있다”며 “신용평가모형 정교화, 대안신용평가 활성화 등을 통해 신용평가체계를 고도화해 달라”고 덧붙였다.  금감원은 내년부터 은행별 포용금융 이행체계·현황 등을 종합평가하는 ‘은행권 포용금융 종합평가체계’ 도입을 추진한다. 체계·조직·전략적 방향성, 사회공헌, 서민·중소기업·소상공인 지원 부문 등을 종합 평가해 포용금융이 경영문화로 정착되도록 유도할 방침이다.",https://n.news.naver.com/mnews/article/016/0002574770
2025-12-19 15:25:00,80일간의 세계일주 현실화..리더의 크루즈 여행은 다르다[함영훈의 멋·맛·쉼],"글로벌 크루즈 예약 플랫폼 크루지아 소설에선 하루늦어 81일..이번엔 81박   글로벌 크루즈 예약 플랫폼 크루지아(Cruisia) 등이 기획한 수퍼리치 81박 크루즈여행상품의 기항지들   [헤럴드경제=함영훈 기자] 영국 빅토리아 여왕 시기, 모험가 성격을 가진 부자 필리스는 80일 동안에 지구를 한 바퀴 돌 수 있는지를 두고 클럽의 친구들과 그의 전 재산 2만 파운드를 걸고 내기를 한다.  런던을 출발해 인도의 밀림 속에서 한 미녀를 구출하는 미담도 쌓는다. 하지만 마르세이유행 열차를 놓친뒤 열기구를 긴급 수소문해 여행을 하지만, 남프랑스가 아닌 스페인에 도착하게 되는 등 어려움을 겪는다.  친절한 투우사의 도움으로 배를 타고 스페인을 벗어난뒤 계획된 여행경로를 따라 여행을 계속한다. 마지막까지 자신을 방해하며 뒤쫓는 탐정을 따돌리며 세계일주에 성공하지만, 결국 그는 기한보다 하루가 지나서 영국에 도착한다.  이렇게 프랑스 출신 소설가 쥘 베른의 모험 소설 ‘80일간의 세계일주’ 속 주인공은 81일간의 세계일주를 하게된다. 영화로 만들어져 OST가 우리 한국민에게도 친숙하다.  81일간의 수퍼리치 크루즈 여행상품이 현실화됐다.  글로벌 크루즈 예약 플랫폼 크루지아(Cruisia)는 리젠트 세븐시즈 크루즈의 대표적인 두 개의 항로를 통해, 이러한 프리미엄 여행을 현실화시켰다.  단순히 오래 떠나는 여행이 아니라, 시간과 경험을 효율적으로 설계한 고밀도 여정이라고 크루지아측은 소개한다.  2026년 6월 29일 출항하는 ‘그랜드 보야지 럭셔리 크루즈’는 뉴욕에서 출발해 캐나다 동부를 거쳐 그린란드, 아이슬란드, 북유럽, 영국과 아일랜드, 스페인, 프랑스, 이탈리아 등 지중해 주요 항구를 순차적으로 방문한 뒤 바르셀로나에 도착하는 81박 장기 항해다.  이 일정에는 총 335개의 육상 관광 프로그램이 포함돼 있어, 사실상 세계 일주에 가장 가까운 크루즈 여정으로 평가된다.  글로벌 크루즈 예약 플랫폼 크루지아(Cruisia) 등이 기획한 수퍼리치 81박 크루즈여행상품의 기항지들   짧고 굵은 리더들의 크루즈 여행도 있다. 2026년 2월 12일 출항하는 ‘아프리카 & 아라비아 럭셔리 크루즈’는 모리셔스 포트루이스에서 출발해 남아프리카공화국 케이프타운까지 이어지는 16박 일정이다. 이 여정은 인도양과 모잠비크 해협을 따라 마다가스카르(노지 보라하, 안치라나나, 노지 베), 탄자니아 다르에스살람, 모잠비크 마푸토를 거쳐 남아공 포트엘리자베스와 모셀베이까지 이어진다. 총 17개 기항지가 포함돼 있으며, 개인 여행으로는 이동과 연결이 까다로운 지역들이 하나의 항로로 묶였다.  이 항로의 특징은 모든 기항지의 육상 관광 프로그램이 일정에 포함돼 있다는 점이다. 여행자는 각 도시마다 추가 비용과 선택을 고민할 필요 없이, 사전에 설계된 프로그램을 통해 핵심 경험을 빠짐없이 누릴 수 있다. 비용 예측 가능성과 일정 효율성 측면에서 리더층에게 매력적인 구조다.  이와 같은 장기 크루즈는 ‘여행을 다녀온다’기보다 일정 기간 바다 위에서 생활하며 이동과 체류를 동시에 해결하는 방식에 가깝다. 항공 이동과 숙소 변경에 따른 피로를 최소화하면서도, 다양한 국가와 지역을 한 번의 여정으로 경험할 수 있다는 점에서 시간 효율을 중시하는 고액 소비자들에게 적합한 선택지로 꼽힌다.  리젠트 세븐시즈 크루즈는 전 객실 스위트 구성, 미식 다이닝, 프리미엄 주류, 무제한 와이파이, 사전 포함된 팁과 스파 이용 등 올 인클루시브 서비스를 제공한다. 여행 중 발생하는 추가 비용을 최소화해, 소비자가 경험 그 자체에 집중할 수 있도록 설계했다.  럭셔리 크루즈   크루지아를 통해 해당 항로를 예약할 경우, 최대 45% 할인과 함께 캐빈당 200달러 상당의 온보드 크레딧이 제공되는 단독 혜택도 적용된다. 크루지아는 복잡한 장기 항로와 일정에 대해 전문 상담을 제공하며, 고액 크루즈 상품에 대한 맞춤형 안내를 함께 지원하고 있다.  자세한 일정 안내와 예약 상담은 크루지아 공식 홈페이지 또는 전화 상담을 통해 확인할 수 있다.",https://n.news.naver.com/mnews/article/016/0002574769
2025-12-19 15:24:00,"거창군, 산림자원 활용 기후 대응·관광·지역경제 동시 추진","탄소상쇄·산림관광 연계한 산림정책 본격화…항노화힐링랜드·숲길 조성   거창군이 추진 중인 항노화힐링랜드 잔도길 조성사업 조감도. [거창군 제공]   [헤럴드경제(거창)=황상욱 기자] 거창군은 19일 군내 풍부한 산림자원을 활용해 기후위기 대응과 관광, 지역경제를 아우르는 미래 성장동력으로 육성하기 위한 산림정책을 본격 추진한다고 밝혔다.  군은 그동안 보호와 관리 중심이던 산림정책에서 벗어나 기후 대응과 임업소득 창출, 산림관광 활성화를 연계한 활용 중심 전략으로 정책 방향을 전환하고 있다. 산림레포츠파크 운영을 비롯해 항노화 힐링랜드 인프라 확충, 자작나무 숲 조성, 산림탄소상쇄사업 등을 유기적으로 연결해 지속 가능한 산림 행정 체계를 구축한다는 구상이다.  기후 대응 분야에서는 가북면 용암리 일원에 100ha 규모의 산림탄소상쇄사업을 추진한다. 향후 30년간 약 2만6000t의 이산화탄소 흡수가 예상되며, 이를 기반으로 탄소흡수량 인증과 배출권 활용 가능성도 검토하고 있다. 고제·위천면 일원의 산림경영 선도단지는 목재 생산과 산주 소득 증대를 목표로 체계적인 숲가꾸기와 임도 정비, 임목 생산이 이뤄지고 있다.  산림관광 분야에서는 북상면과 가북면 일대를 중심으로 대규모 자작나무 숲 조성을 추진하고 있다. 기존 조성된 숲에 이어 추가 식재가 진행되면서 거창을 대표하는 산림 힐링 관광자원으로 자리매김할 것으로 기대된다.  연간 25만명 이상이 찾는 항노화 힐링랜드는 접근성 개선과 체험 콘텐츠 확충에 나섰다. 국비를 투입해 진입도로를 정비하고, Y자 전망대와 스카이워크를 잇는 잔도길을 조성해 방문객의 이동 편의성과 체류 만족도를 높일 계획이다. 유아숲체험원도 함께 조성해 가족 단위 방문객 유입을 확대한다.  영호남을 잇는 ‘산마루 숲길’ 조성 사업도 단계적으로 추진된다. 해발 1000m 이상 봉우리를 연결하는 순환형 트레킹 코스로 항노화 힐링랜드와 산림레포츠파크 등 주요 산림관광 자원을 하나의 동선으로 묶는 광역 산림관광 기반 구축이 목표다.  올해 개장한 거창산림레포츠파크는 9개월 만에 13만여명이 방문하며 북부권 산림관광의 핵심 거점으로 자리 잡았다. 군은 마운틴코스터 등 추가 시설을 확충해 체류형 관광 효과를 높일 방침이다.  군 관계자는 “산림은 기후 대응과 관광, 지역경제를 함께 떠받치는 핵심 자산”이라며 “군민이 체감할 수 있는 산림정책을 통해 지속 가능한 산림휴양 도시로 거창을 육성해 나가겠다”고 말했다.",https://n.news.naver.com/mnews/article/016/0002574768
2025-12-19 15:10:00,李대통령 “국내 주식시장 불신 심각…주가 조각하면 패가망신 보여줘야”,"19일 금융위 업무보고   이재명 대통령이 19일 정부서울청사 별관에서 열린 금융위원회·공정거래위원회 업무보고에서 발언하고 있다. [연합]   [헤럴드경제=서영상 기자] 이재명 대통령은 19일 “국내 주식시장에 대한 불신이 외환 시장까지 영향을 주고 있다”며 주식시장을 정상화하는 것이 시급하다고 말했다.  이 대통령은 이날 금융위원회를 대상으로 한 업무보고에서 “대한민국 기업의 실력은 나쁘지 않은데 주식시장에 상장만 되면 60% 정도밖에 가치를 평가받지 못한다. 많이 개선됐다지만 여전히 저평가를 당한다”며 “이처럼 황당한 일의 가장 큰 원인은 시장 투명성에 대한 불신”이라고 진단했다.  그러면서 “최대한 이 문제 해결에 힘을 기울여 달라. 한국 시장에서 주가 조작이나 부정 거래를 하면 패가망신한다는 것을 확실하게 보여줘야 한다”고 강조했다.  특히 이 대통령은 주가조작 대응 인력 증원을 제안하기도 했다.  이 대통령은 “정부의 주가조작 근절 합동 대응단에 인력 문제는 없느냐”고 질문한 뒤 이억원 금융위원장이 “37명”이라고 답하자 “너무 적다. 한 두 팀을 더 만들어 보는 것은 어떤가. 팀별로 경쟁도 시킬 수 있지 않겠느냐”고 말했다.  이에 이 위원장은 “포렌식 등을 할 때도 인력이 굉장히 많이 필요하다. (인력을 늘려주면) 1호, 2호 단속뿐 아니라 10호, 20호, 50호까지 잡아내겠다”고 답했다.  이 대통령은 “(주가조작은) 탈탈 털어서 아예 꿈도 못 꾸게 해야 한다. 초기대응이 중요하다”며 “있는 것을 잡아내는 게 아니라 원천봉쇄를 해야 하고, 그러려면 초기 인력투입이 필요하다”고 거듭 강조했다.  한편 이 대통령은 코스닥 시장에 대한 불신 역시 심각하다면서 ‘저 주식은 불안하다’, ‘언제 동전주(주가 1천원 미만 주식)가 될지 모른다’ 등의 인식이 널리 퍼져있다고 지적했다.  그러면서 “(부실한 기업에 대해서는) 좀 정리해야 시장 정상화의 길이 조금 열릴 것”이라고 언급했다.",https://n.news.naver.com/mnews/article/016/0002574767
2025-12-19 15:08:00,"DI동일, 주당 0.05주 주식배당 결정",[헤럴드경제=증권부] DI동일은 보통주 1주당 0.05주의 주식배당을 결정했다고 19일 공시했다.  배당주식총수는 98만6341주이며 배당기준일은 오는 31일이다.,https://n.news.naver.com/mnews/article/016/0002574766
2025-12-19 15:07:00,"코스타크루즈, 롯데관광개발을 ‘오버 더 톱’에 선정","코스타 글로벌 서밋 우수파트너 대회 내년 6월, 9월 한국 출발 전세 크루즈 계약 백현 대표 “16년 파트너십 고객 신뢰 결실”   롯데관광개발, ‘2026 코스타 글로벌 서밋’서 ‘Over The Top’ 수상   [헤럴드경제=함영훈 기자] 롯데관광개발은 최근 열린 코스타크루즈의 ‘2026 코스타 글로벌 서밋(Costa Global Summit)’ 우수 파트너 시상식에서 ‘오버더톱(Over The Top)’을 수상했다고 19일 밝혔다.  ‘2026 코스타 글로벌 서밋’은 글로벌 대표 크루즈 선사 코스타 크루즈(Costa Cruises)가 전세계 주요 파트너사를 초청해 개최한 행사로 이번 행사는 유럽 지중해 노선을 운항하는 코스타 크루즈의 대표 선박 ‘코스타 스메랄다(Costa Smeralda)’에서 진행됐다.  ‘Over The Top’은 글로벌 시장에서 탁월한 성과와 파트너십을 구축한 기업에 수여하는 상으로, 롯데관광개발은 한국 크루즈 시장에서의 선도적인 입지와 지속적인 성과를 인정받아 이번 수상의 영예를 안았다.  롯데관광개발은 지난 2010년부터 코스타 크루즈와 협력해 한국 출발 전세 크루즈를 비롯해 지중해, 두바이, 동남아 등 다양한 지역에서 Fly&Cruise 상품을 운영하며 한국 크루즈 여행 대중화를 선도해왔다. 이를 통해 롯데관광개발은 명실상부한 대한민국 대표 크루즈 전문 기업으로 자리매김하고 있다.  같은 날, 롯데관광개발 백현 대표이사 사장은 코스타 크루즈 마리오 자네티(Mario Zanetti) 사장을 만나 2026년 6월과 9월 총 2회 운항하는 한국 출발 전세 크루즈 계약을 공식 체결하며 양사 간의 파트너십을 굳건히 했다.  백현 롯데관광개발 대표이사 사장은 “이번 수상은 지난 16년간 코스타 크루즈와 함께 한국 크루즈 시장을 개척해온 롯데관광개발의 노력과 고객들의 신뢰가 만들어낸 값진 결과”라며 “앞으로도 세계 최고 수준의 크루즈 상품과 차별화된 서비스로 대한민국 크루즈 산업의 발전을 이끌어나가겠다”고 말했다.",https://n.news.naver.com/mnews/article/016/0002574765
2025-12-19 15:06:00,"메디포스트, 2,050억 원 규모 자금조달 계약 체결…미국 임상 3상 및 글로벌 상업화 본격화","- 메디포스트, 전환사채 발행으로 신규 투자자 유치 및 최대주주 참여  - 미국 임상 3상 IND 신청 임박, 일본 임상 3상 종료… 글로벌 시장 진출 가속화    메디포스트가 스카이레이크, 크레센도 등 기존 최대주주와 국내 투자자의 참여로 카티스템의 기술력과 성장 가능성을 다시 한번 입증하며 2,050억 원 규모의 자금조달 계약을 체결했다.  글로벌 줄기세포 1위 바이오기업 메디포스트(대표이사 오원일)가 총 2,050억 원 규모의 자금조달 계약을 성공적으로 체결했다고 16일 밝혔다. 이번 자금조달은 전환사채(CB) 발행 방식으로 진행됐으며, 기존 최대주주의 참여와 신규 투자자 유치 형태로 이뤄졌다. 조달된 자금은 미국 임상 3상 진행을 위한 재원으로 활용될 계획이다.  이번 투자에는 메디포스트의 기존 최대주주이자 장기 파트너로 알려진 스카이레이크에쿼티파트너스와 크레센도에쿼티파트너스 뿐만 아니라 국내 투자자까지 모두 카티스템 미국 임상 3상에 대한 성공 가능성과 핵심 기술 경쟁력에 대한 신뢰를 바탕으로 참여해 총 2,050억 원 규모의 전환사채를 인수한다.  메디포스트는 무릎 골관절염을 적응증으로 하는 제대혈유래 중간엽줄기세포 치료제 카티스템(CARTISTEM®)의 미국 임상 3상 진행을 위해 미국 식품의약국(FDA)에 임상시험계획서(IND)를 제출할 예정이며, 2026년 상반기 첫 환자 투약을 목표로 하고 있다. 해당 임상은 허가 요건에 부합하는 활성 대조군(active control) 기반의 무작위배정 설계로 진행된다.  또한 메디포스트는 일본 시장 내 상업화 추진에도 속도를 낼 계획이다. 일본 임상 3상은 2025년 11월에 종료됐으며, 2026년 상반기 임상 결과 발표, 같은 해 하반기 일본 의약품의료기기종합기구(PMDA)에 품목허가를 신청할 예정이다.  메디포스트 관계자는 “이번 자금조달 계약 체결을 통해 향후 미국 임상 3상과 상업화에 필요한 재원을 안정적으로 확보할 수 있게 됐다”며, “카티스템의 미국 임상 3상 진입을 기점으로 본격적인 글로벌 시장 진출이 시작될 것”이라고 밝혔다.",https://n.news.naver.com/mnews/article/016/0002574764
2025-12-19 15:05:00,‘차 안 링거’ 사진 확산에 전현무 “담당 의사 처방받은 것” 의혹 차단,"온라인서 9년 전 ‘나혼산’ 방송 사진 돌자 소속사 SM C&C통해 공식입장, 빠른 해명 “의료진 호출이나 불법 시술 없다” 일축   전현무. [SM C&C]   [헤럴드경제=한지숙 기자] 방송인 전현무가 자신이 차 안에서 링거를 맞는 모습이 담긴 과거 방송 사진이 온라인 상에서 확산하자 “담당 의사의 진료와 처방을 받아 치료 받은 것”이라며 불법 의료행위 의혹을 일축했다.  개그맨 박나래를 시작으로 그룹 샤이니 키, 유명 유튜버 입짧은햇님 등이 무면허 ‘주사이모’와 관련한 불법 의료행위 의혹으로 사과와 활동 중단을 선언한 뒤 누리꾼들은 방송인 전현무에게까지 의심의 시선을 보낸 터다.  온라인 상에 빠르게 확산 중인 전현무 링거 투혼 사진. [온라인 커뮤니티 갈무리]   전현무의 소속사 SM C&C는 19일 공식 입장문을 내 “최근 온라인상에서 확산되고 있는 과거 방송 장면과 관련하여 사실관계를 정확히 하고자 한다”고 밝혔다.  소속사는 “거론되고 있는 장면은 2016년 ‘나 혼자 산다’ 방송분이다. 전현무는 당시 목 상태가 좋지 않아, 병원에서 담당 의사의 진료와 처방을 받아 치료를 받았다. 촬영 일정까지 시간이 충분하지 않아 의사의 판단 하에 부득이하게 이동하며 처치를 마무리하는 과정의 일부가 방송에 노출된 것이다”라고 설명했다.  이어 “처치의 마무리를 제외한 모든 의료 행위는 병원 내에서 의료진의 판단 및 처방에 따라 진행되었다”며 “의료인을 개인적으로 호출하거나 불법적인 시술을 받은 사실은 없다”라고 강조했다.  소삭사는 “현재 제기되고 있는 의혹은 당시의 전체적인 상황과 맥락이 충분히 전달되지 않은 상황에서, 일부 장면이 온라인에서 거론되며 비롯된 오해”라고 재차 강조하며 “근거 없는 추측과 왜곡된 해석에 대해 자제를 부탁드린다”고 당부했다.  앞서 이날 오전 여러 온라인 커뮤니티에는 전현무가 차량 안에서 링거를 맞고 있는 모습이 담긴 사진이 빠르게 퍼졌다.  해당 사진을 보면 ‘현무, 링거 맞고 있는 거야?’라고 적힌 방송 자막과 함께 누군가 스마트폰을 들여다 보고 있는데, 스마트폰에는 전현무가 차 안에서 안전벨트를 한 채 링거를 맞고 있는 모습이 표출됐다.  소속사에 따르면 해당 사진은 2016년 1월 29일 방송된 MBC 예능 프로그램 ‘나 혼자 산다’ 142회의 한 장면이다. 당시 바쁜 스케줄로 성대결절에 시달리던 전현무는 차 안에서 링거를 맞고 있는 자신의 근황 사진을 출연진 단체 메신저창에 공유했다. 이에 깜짝 놀란 김영철이 “현무 링거 맞고 있는 거야?”라며 전현무를 걱정해 전화를 걸었고, 전현무는 “목 상태가 안 좋아서 그렇다”라고 설명했다.  방송 당시엔 바쁜 스케줄을 소화하는 연예인의 일상 정도로 치부됐으나, 최근 박나래가 전 매니저들의 폭로로 ‘주사이모’, ‘링거이모’를 통한 불법 의료행위 의혹에 휩싸인 뒤 방송 9년 만에 논란이 됐다. 누리꾼들은 의료기관이나 구급차 안이 아닌 장소에서 링거를 맞는 게 적법한 지 의혹을 제기했다.",https://n.news.naver.com/mnews/article/016/0002574763
