날짜,제목,본문,링크
2025-12-18 14:34:00,"“서울 ‘글로벌 G2’ 도시로…출마 시기, 혹한기 이후로 고심”","정원오 성동구청장 인터뷰 李대통령 칭찬 인지도·지지도 급등 “갑자기 엘리베이터 탄 느낌이랄까”  ‘세금 아깝지 않은 도시’ 비전 실현 종묘 논란, 디테일 부족한 시정 탓   정원오 성동구청장이 17일 서울 성동구청 집무실에서 인터뷰를 하고 있다. 임세준 기자   내년 6·3 지방선거에서 가장 큰 격전지가 될 서울시장 선거에서 민주당 유력 후보 중 하나로 떠오르고 있는 정원오 성동구청장이 “서울을 ‘글로벌 G2’ 도시로 만들고 싶다”고 말했다. 서양의 뉴욕과 함께 동양을 대표하는 도시로 격상시켜 서울이 다시 활력을 가지도록 하겠다고 했다.  헤럴드경제는 17일 오후 서울 성동구청 전략회의실에서 정원오 구청장을 만나 서울시장 출마 시기와 후보로서 포부를 들어봤다. 최근 민주당의 유력 서울시장 후보로 언급되고 있는 정 구청장은 아침 일찍부터 이어지는 바쁜 스케줄로 피곤한 얼굴이었지만 인터뷰가 시작되자 자신의 행정 철학과 소신을 또렷하고 자신 있게 얘기했다.  -구의회 예산안이 통과된 후 서울시장 출마를 선언할 것이라고 예고했다. 언제 하나.  ▶출마 선언을 하면 그때부터 선거 운동을 해야 한다. 그런데 선거 운동을 하려면 구청장부터 사퇴해야 한다. 그게 약간 고민이다. 아직 겨울철이고 혹한기가 남아 있는데 선거운동 하겠다고 사퇴하기가 책임감 부분에 있어서 그렇다. 그동안 제가 책임감으로 일해 왔는데 그런 부분이 좀 마음에 걸린다. 그래서 출마 선언하고 사퇴하고 이거는 조금 고려해야 할 것 같다. 그리고 출마 선언을 하면 선거법 때문에 제약도 많아진다. 다만 출마를 위한 행보는 할 수 있다고 생각한다.  -그럼 사퇴는 언제.  ▶사퇴 시한이 3월 4일인데 그때까지는 사퇴해야 할 거다. 성동구민들이 양해를 해주신다면 좀 더 일찍 할 수도 있다. 요즘 분위기는 빨리 나가라는 거다. 다만 혹한기는 끝나야 하지 않을까 싶다.  -오세훈 시장과 여론조사에서 오차범위 내에서지만 앞서기도 한다.  ▶마음이 좀 무겁다. 뭐랄까 막 기쁘다기보다 오히려 더 좀 무거운 느낌이다.  -최근의 인지도 상승은 청장님의 참신함과 그동안 보여주셨던 성과 그런 것도 있지만 대통령께서 언급한 덕이 있지 않나.  ▶그 영향이 크다. 왜냐하면 그동안은 입소문으로 아주 서서히 인지도가 상승했다. 지지도를 보면 한 서너 달 정도 계속 상승하면서 한 3~5위권으로 쭉 올라가다 대통령의 언급이 있기 전에 1위를 했다. 지지도와 인지도를 따져봤을 때 인지도가 높아지면 지지도도 올라간다. 저는 천천히 올라가는 것도 나쁘지 않다 생각을 했는데 이번에 관심이 확 올라갔다. 그러면서 지지도가 같이 올라가 버린 거다. 걸어가고 있는데 갑자기 엘리베이터 탄 느낌이랄까. 반면에 그렇게 인지도가 올라가면서 반대편 공격도 심해질 거다.  -현재 서울시의 행정을 평가한다면  ▶종묘 같은 경우는 사실 쉽게 갈 수 있었는데 어렵게 간 거다. 지금 오도 가도 못하게 생겼다. 제가 처음에 이걸 보고 ‘이게 정쟁으로 가면 안 된다’ 그래서 바로 제안했던 게 “세계유산영향평가를 받자”였다. 전문가들도 다 맞다고 했다. 그런데 서울시에서 거부해 버렸다. 생각엔 진짜 위험한 건 디테일을 잘 모르는 상태에서 나온다. 디테일이 부족한 상태에서 신념만 앞세우면 정말 위험하게 된다는 걸 본 거다. 실제로는 디테일을 잘 챙겨야 한다. 시장님 스타일상 “이거는 이렇게 해야 해”, “이렇게 가는 게 좋아”라고 비전을 얘기했을 건데 그 밑에서 디테일을 안 챙긴 거 같다. 사실은 행정을 하게 되면 기본적으로 디테일을 챙겨야 한다. 이게 문제 될 소지는 없는지, 악영향은 없을지, 위법한 건 없는지, 갈등 구조는 없는지 이런 것들을 다 챙기고 가야 플랜이 빛을 발하는데 지금 보면 종묘뿐만 아니라 한강 버스도 그렇고 광화문 감사의 정원도 다 디테일에서 무너진 거다. 이게 지금 서울시가 요란스럽고 시끄러운 이유다.  -성수동의 젠트리피케이션 문제는 완전히 해결된 거 같지 않은데.  ▶젠트리피케이션은 사실상은 거의 막은 건데 딱 하나 해결 안 된 게 있다. 바로 환산보증금 제도(보증금에 월세×100을 더한 금액으로, 상가임대차보호법 적용 여부를 판단하는 기준)다. 현재 법상 환산보증금이 서울은 9억이 넘어가면 상가임대차보호법의 보호를 못 받는다. 예를 들어 보증금 3억에 월세 600만원이면 9억이 된다. 서울 시내에 있는 상가 중에 한 5% 정도가 9억원 이상이다. 큰 임차인들까지 우리가 보호할 필요가 있느냐는 게 9억 기준의 논리였다. 그런데 임대료가 계속 올라 지금 성수동처럼 상권이 활성화된 곳은 9억 이상 상가가 20%가 넘는다. 갑자기 집주인이 임대료를 100%, 200% 올려버리면 임차인인 감당을 못하고 나가는 거다. 큰 임차인이든 작은 임차인이든 임대인보다는 약자다. 제가 이걸 없애자, 이걸 폐지하라고 몇 년째 얘기하고 있는데 국회에서 안 되고 있다.환산보증금 이것만 철폐되면 젠트리피케이션이 없어진다. 그래서 만약 가정하에 제가 시장이 된다면 가장 먼저 요청할 부분은 바로 환산 보증금 폐지다. 이것만 되면 젠트리피케이션은 다 막을 수 있다.  -서울이라는 도시가 국제적으로도 유명해지고 사람들이 많이 찾는 도시가 됐다. 서울시장이 된다면 어떤 비전을 보여줄 건지.  ▶지금 서울 시민의 입장으로 보면 첫 번째는 내 세금이 아깝지 않은 도시여야 한다. 세금이 아깝지 않으려면 내가 원하는 일을 행정이 해야 한다. 근데 지금 과연 그러고 있느냐 하면 행정이 본인이 하고 싶은 일을 하고 있다. 그러니까 시민들 입장에서는 동의가 안 돼 ‘저걸 왜 해?’ 반대도 한다. 그래도 하면 ‘돈 아깝네’ 이렇게 되는 거다. 이렇게 되면 도시가 불편해지는 거다. 그래서 시민들에게 편안함을 주는 도시, 그런 행정을 해야 한다라는 게 기본이다. 두 번째는 도시의 목표가 분명해야 한다. 제가 성수동을 개발할 때 ‘한국의 브루클린’을 내걸었다. 그러면 사람들이 ‘성수동을 한국의 브루클린처럼 하려고 하는구나’라고 생각해 그걸 좋아하는 사람들이 그곳으로 온다. 그리고 그 동네에 사는 분 중에 ‘아 그렇게 가는 게 좋겠구나’ 해서 또 그렇게 간다. 서울도 비전이 있어야 한다. 지금의 서울은 일자리가 줄고 활력과 경쟁력이 떨어졌다. 저는 ‘글로벌 G2 서울’을 내걸고 서양에는 뉴욕, 동양에는 서울이 되도록 경쟁력을 끌어 올리겠다. 비전에 따른 구체적인 목표가 나오면 사람들이 움직이기 시작한다. 그럼 일자리도 생기고 지역경제도 팡팡 돌아간다. 공무원도 그 방향으로 세금을 쓰게 된다. 그런데 지금 서울시는 세금이 왜 저렇게 쓰이는지 맥락이 없다. 목표가 뚜렷하지 않기 때문에 생긴 문제다. 그래서 저는 그 부분에 있어서 목표를 명확하게 하고 가면 서울의 모습이 금방 활력을 가질 거라고 생각한다. 성수동도 한 10년 만에 엄청난 변화를 했다. 서울도 그런 명확한 비전과 목표, 시민들의 뜻이 함께 이루어지면 정말 다르게 바뀔 수 있다.  정 구청장은 마지막으로 10년 넘게 많은 지지를 보내준 성동구민들에게 감사의 인사도 전했다. 정 구청장은 “구민께서 ‘써보니 좋더라’, ‘계속 써보자’라고 입소문을 많이 내주셔서 사용 후기처럼 퍼지게 됐다”며 “서울 시민들 또한 서울시의 행정과 정책이 무엇인지 고민하고 치열하게 변화시키려고 노력하는 사람인지를 중요하게 볼 것”이라고 말했다.  신상윤·손인규 기자  ▷1968년 전남 여수 출생  ▷1986년 여수고 졸업  ▷1991년 서울시립대 경제학과 졸업  ▷2016년 한양대 경영대학 특임교수  ▷2017년 한양대 공공정책대학원 사회복지학 석사  ▷2021년 한양대 도시대학원 도시개발경영학 박사(수료)  ▷2024년 더불어민주당 당대표 자치분권특보  ▷목민관클럽 상임대표  ▷행복실현지방정부협의회 상임회장  ▷서울 성동구청장(민선6·7·8기)정원오가 걸어온 길",https://n.news.naver.com/mnews/article/016/0002574138
2025-12-18 14:34:00,‘윈터 홈플런’ 여전히 북적…삼겹살·딸기·한우가 반값,"‘윈터 홈플런’ 행사가 시작된 18일, 서울 등촌동 ‘홈플러스 메가 푸드 마켓 라이브’ 강서점이 고객들로 북적이고 있다. [홈플러스 제공]   [헤럴드경제=박연수 기자] 홈플러스는 오늘 30일까지 ‘윈터 홈플런’을 진행한다고 밝혔다.  행사에는 마트·온라인·익스프레스·몰 전 채널이 총출동한다. 삼겹살, 딸기, 한우 등을 파격가로 제공한다. 초저가 ‘홈플런딜’, ‘신선식품 반값’, ‘가공식품 1+1’, ‘홈파티 먹거리 할인’ 등도 진행한다.  먼저 미국산 ‘옥먹돼 삼겹살/목심(100g/1인 1㎏ 한정)’은 21일 50% 할인한 990원에 판매한다. ‘농협안심한우 구이류 전 품목’은 20~21일 양일간 50% 할인한다.  ‘새벽 딸기*(500g/1인 1팩 한정)’는 18~21일 50% 할인한 5990원에 만날 수 있다. 멤버십 회원에겐 ‘휘라 노르웨이 생연어 구이용/횟감용(100g)’을 반값인 각 3450원, 3800원에 제공한다.  국내산 ‘대란 30구(1인 2판 한정)’는 2000원 할인한 5890원에, 국내산 ‘양배추(통)’와 ‘단단 파프리카(개)’는 50% 할인한 각 1990원, 1290원에 담을 수 있다.",https://n.news.naver.com/mnews/article/016/0002574137
2025-12-18 14:32:00,[속보] 여의도역 신안산선 공사장서 7명 매몰…1명 심정지,[헤럴드경제 DB]   [헤럴드경제=나은정 기자] 18일 서울 여의도역 인근 신안산선 공사 현장에서 사고가 발생해 노동자 7명이 매몰됐다.  경찰 등에 따르면 서울 영등포경찰서는 이날 오후 1시 22분쯤 지하철 5호선 여의도역 2번 출구 앞 신안산선 지하차도 공사장에서 “철근이 무너져 사람이 깔렸다”는 신고를 접수했다.  사고는 지하 80m 지점에서 발생했으며 작업자 7명이 매몰된 것으로 알려졌다. 이 가운데 1명은 심정지 상태로 발견돼 심폐소생술(CPR)을 받으며 병원으로 옮겨졌다.  경찰과 소방은 경상자 1명을 포함한 나머지 인원에 대해 구조 작업을 하고 있다.,https://n.news.naver.com/mnews/article/016/0002574136
2025-12-18 14:32:00,‘이것’ 먹으면 치매 예방된다고?…대반전 음식 정체는,"[게티이미지뱅크]   [헤럴드경제=채상우 기자] 고지방 치즈와 크림이 치매 예방에 도움이 된다는 연구 결과가 나왔다.  18일 스웨덴 룬드대 에밀리 소네스테트 박사팀은 스웨덴 성인 2만7000여명을 대상으로 유제품 섭취와 치매 위험 간 관계를 25년간 추적 관찰한 연구에서 이런 결과를 얻었다고 미국신경학회(AAN) 저널 신경학(Neurology)을 통해 밝혔다.  소네스테트 박사는“고지방 치즈·크림은 치매 위험 감소와 연관성이 있었지만, 저지방 치즈·크림이나 다른 유제품은 같은 효과를 보이지 않았다”고 말했다.  이들은 스웨덴 말뫼 식이 및 암 코호트(Malmo Diet and Cancer cohort) 참가자 2만7천670명(평균 연령 58.1세)을 대상으로 7일간 식사일지와 면담 등을 통해 섭취 유제품 종류와 양 등을 측정하고, 25년간 치매 발생 여부를 조사했다.  지방 함량이 20% 이상인 체다·브리·고다 치즈 등을 하루 50ｇ 이상, 지방 함량 20% 이상인 휘핑크림, 더블 크림 등을 하루 20ｇ 이상 섭취한 사람들이 고지방 치즈·크림 섭취 그룹에 포함됐다. 추적 기간 3천208명이 치매 진단을 받았다.  고지방 치즈를 하루 50% 이상 먹은 사람은 하루 15ｇ 미만을 섭취한 사람보다 치매 위험이 13% 낮았다. 고지방 치즈와 알츠하이머병 간에 연관성은 치매 위험 변이유전자(ApoE-e4)가 영향을 미친 것으로 나타났다.  또 고지방 크림을 하루에 20ｇ 이상 섭취한 사람은 전혀 먹지 않은 사람에 비해 치매 위험이 16% 낮았다.  고지방 치즈를 많이 섭취한 사람들은 혈관성 치매 위험이 29% 낮았고, 고지방 크림도 알츠하이머병과 혈관성 치매 위험 모두와 역의 연관성을 보였다.  저지방 치즈·크림, 고·저지방 우유, 버터, 요구르트·버터밀크 등 발효유 섭취와 치매 위험 사이에는 연관성이 나타나지 않았다.  소네스테트 박사는 “고지방 식단과 저지방 식단 논쟁은 오랫동안 건강 지침에 영향을 미쳐왔다”며 “때로는 치즈가 건강에 좋지 않은 음식으로 분류되기도 했지만, 이 연구는 일부 고지방 유제품이 치매 위험을 낮출 수 있음을 보여준다”고 말했다.",https://n.news.naver.com/mnews/article/016/0002574135
2025-12-18 14:32:00,‘경도를 기다리며’순수멜로 여주가 불가능한 시대에 나타나 가능성을 보여주는 신인여배우 원지안,"원지안   [헤럴드경제 = 서병기선임기자]요즘은 순수멜로 드라마가 잘안된다. OTT의 강도가 센 장르물이나 자극강도가 높은 숏폼 등에 익숙해서져서 그런 것인가. 그냥 멜로로만 끌고가면 심심하다. 그러니 순수멜로 여주가 쉽게 나오지 않는다. 심지어 SBS ‘우리영화’에서 남궁민과 순수멜로를 연기한 전여빈도 쉽지 않았다. 이건 배우의 연기력만의 문제가 아니다.  그런데 멜로만으로 진행되어도 되는 신인 여배우가 있다. ‘경도를 기다리며’의 원지안이다. 요즘 이 드라마에는 ‘서지우’를 연기하는 원지안 보는 재미가 쏠쏠하다. 원지안이 새로운 첫사랑의 아이콘으로 떠오르고 있을 정도다.  멜로는 계급의 이야기다. 서로 전혀 다른 환경에서 자란 남녀가 불가능할 것 같지만 결합할 수 있는 ‘사랑의 묘약 성능’을 보면서 시청자들은 그 매력에 조금씩 빨려들어가게 된다.  매주 토, 일요일 방송되는 JTBC 토일드라마 ‘경도를 기다리며’(극본 유영아/ 연출 임현욱/ 제작 SLL, 아이엔, 글뫼)에서 원지안은 여린 속마음을 감추기 위해 강인한 척하는 ‘서지우’ 캐릭터의 반전을 드러내며 시청자들의 마음을 사로잡고 있다.  극 중 서지우는 자림 어패럴의 둘째 딸로 남 부럽지 않은 가정환경을 가졌지만 혼외자라는 비밀을 간직한 인물. 엄마 장현경(남기애 분)의 냉혹한 시선으로 인해 어릴 때부터 늘 외롭게 자라왔던 서지우는 우연히 친구의 학교에 놀러갔다 마주친 이경도(박서준 분)와 지독하게 엮이며 그에게서 사랑이 주는 다양한 감정을 배워갔다.  외로운 삶에 온기를 가져다준 유일한 사람인 만큼 서지우는 이경도의 말 한 마디, 한 마디에 속절없이 흔들렸다. 자림 어패럴 회장의 딸이라는 걸 우연히 들키게 된 이후 이경도에게 속여서 미안하다며 눈물을 흘리고, 사랑하기에 모든 걸 주고 싶었던 자신의 방식이 오히려 상처가 되자 이를 후회하는 등 수많은 감정이 서지우의 마음에 소용돌이를 일으켰다.  뿐만 아니라 시간이 많이 흘러 재회한 후에도 서지우는 여전히 이경도의 존재로 인해 위로를 받아 뭉클함을 더했다. 인류애라는 핑계로 더 이상 술을 먹지 못하게 막아주고 엄마처럼 살뜰히 자신을 보살펴주는 이경도를 보며 서지우는 두 사람이 행복했던 과거로 돌아가고 싶다는 생각에 사로잡혔다. 때문에 서지우는 공항에서 자신을 붙잡아주고 전남편의 횡포에서 지켜주는 이경도의 손길에 다시금 떨림을 느끼고 있었다.  그러나 오래도록 외롭게 자랐던 만큼 사랑을 표현하는 게 서툴렀던 서지우는 이경도에게 “관심 끄고 살아”라며 톡 쏘는 말투로 그를 밀어내기 바빴다. 이경도가 자신과 헤어진 뒤 어떤 삶을 보냈는지 알고 있기에 선을 그으려던 것. 그러나 뾰족한 말과 달리 이경도만 보면 다시 마음이 말랑말랑해지는 서지우의 감정 변화는 안타까움을 안겼다.  이처럼 마음속에 불어닥친 감정의 폭풍에 흔들리는 서지우 캐릭터의 면면들은 배우 원지안의 열연으로 한층 몰입감 있게 그려지고 있다. 설렘과 슬픔, 그리움과 좌절 등 사랑으로 인해 겪을 수 있는 희로애락들을 표현하며 보는 이들의 공감을 불러일으켰다.  무엇보다 지난 4회 말미, 이경도가 서지우와의 관계를 묻는 질문에 “플러팅 중입니다”라는 뜻밖의 대답을 하면서 두 사람 사이 또 한 번의 관계 변화가 예고된 상황. 과연 서지우는 이경도를 향한 감정을 정리할 수 있을지, 원지안이 완성할 서지우의 이야기가 더욱 기다려지고 있다.  어디로 튈지 모르는 사랑스러운 원지안을 만날 수 있는 JTBC 토일드라마 ‘경도를 기다리며’는 오는 20일(토) 밤 10시 40분에 5회가 방송된다.",https://n.news.naver.com/mnews/article/016/0002574134
2025-12-18 14:32:00,서울시의회 교통위원회 ‘자율주행택시시대 도래에 따른 서울택시 공존방안 모색 토론회’ 개최,"자율주행 기술 발전에 따른 택시 시장의 발전 전략 수립을 위한 토론회 개최 이병윤 교통위원장, 자율주행 기술과 기존 택시 업계의 상생을 위한 제도적 방안 마련에 앞장설 것   서울택시공존방안 토론회   [헤럴드경제=박종일 선임기자]서울특별시의회 교통위원회(위원장 이병윤, 국민의힘, 동대문1)는 2025년 12월 17일 오전 10시 서울시의회 의원회관 제2대회의실에서 ‘자율주행택시시대 도래에 따른 서울택시 공존방안 모색 토론회’라는 주제로 토론회를 개최하였다.  서울시의회가 주최하고 교통위원회가 주관한 이번 토론회는 이병윤 교통위원장 개회사로 시작, 김동완 서울특별시택시운송사업조합 이사장의 축사와 함께 문성호 서울시 의원이 사회를 맡았다.  자율주행택시에 대한 주제 발제는 한국개발연구원(KDI) 김동영 전문연구원이 진행, 이어지는 토론에서는 이경숙 교통위원회 부위원장이 좌장을 맡아 논의를 이끌었다. 토론자로는 김거중 한국교통연구원 부연구위원, 장정아 아주대 연구교수, 이우영 HC택시 대표이사, 박준환 국회입법조사처 팀장, 정준호 서울시 의원, 손형권 택시정책과장이 참여하여 토론이 진행되었다.  이 날 토론회에서는 자율주행 시대의 도래에 발맞춰 택시 산업의 지속 가능한 발전을 위한 준비가 필요하다는 데에 공감대를 형성했다.  아울러 기존 택시 시장과 첨단기술이 상생할 수 있는 자율주행 서비스 도입 방안을 모색, 관련 법·제도 정비 및 안전 관리 체계 구축 등의 전략에 대한 논의가 이루어졌다.  발제를 맡은 김동영 전문위원은 ‘서울특별시 로보택시 제도화 방안’을 주제로 기존 택시 면허 기반을 활용한 서울형 자율주행 서비스 모델을 발표하였다.  또, 공익과 사익이 조화를 이루는 선순환 생태계 조성 전략 등을 제시하였다.  이어지는 토론에서는 ▲자율주행 기술의 안전성 확보 및 사고 발생 시 책임 소재 명확화 ▲글로벌 기술 패권 경쟁에 대응한 국내 자율주행 산업 경쟁력 제고 ▲기존 운수 종사자와의 갈등 해소 및 협력적 비즈니스 모델 발굴 등 자율주행 택시 상용화를 위한 핵심적인 쟁점들이 다뤄졌다.  이병윤 교통위원장은 “자율주행 기술 도입은 미래 택시산업의 도약을 위한 발판이 될 것”이라며 “다만 신기술 도입 과정에서 발생할 수 있는 기존 업계의 우려를 불식시키고, ‘기술의 진보’와 ‘사람의 삶’이 충돌이 아닌 조화 속에서 공존할 수 있도록 서울시의회는 현실적이고 지속가능한 제도적 방안 등을 모색하는 데 앞장서겠다”고 밝혔다.",https://n.news.naver.com/mnews/article/016/0002574133
2025-12-18 14:31:00,‘고환율 공포’에 증권사 해외투자 마케팅 경쟁 ‘제동’…이찬진 “투자자 보호 뒷전” 질타,"이찬진, 금융상황 점검회의서 “심각한 우려” “실태점검 확대, 문제소지시 즉시 현장검사 전환” 고환율 속 서학개미 대상 해외투자 마케팅 중단   이찬진 금융감독원장이 지난 17일 서울 영등포구 금융투자협회에서 열린 ‘자산운용사 CEO 간담회’에서 발언하고 있다. [연합]   [헤럴드경제=정윤희 기자] 금융감독원이 증권사들의 해외증권 중개 영업행태에 제동을 걸고 나섰다. 최근 증권사들의 해외투자 마케팅이 과열되며 투자자 보호가 뒷전이 됐다는 지적이다.  다만, 시장에서는 최근 서학개미(해외 증시에 투자하는 개인투자자)들의 해외 투자가 고환율의 원인 중 하나로 지목된 만큼, 증권사들이 해외투자를 부추기지 말라는 의도인 것으로 해석하고 있다.  금감원은 18일 오전 이찬진 원장 주재로 금융상황 점검회의를 개최하고 “최근 증권사들의 해외증권 중개시장 점유율 확대경쟁이 갈수록 과열되는 가운데 증권사들이 투자자 보호는 뒷전으로 한 채 눈앞의 단기적 수수료 수입 확대에만 치중하는 것이 아닌지 심각한 우려를 표명했다”며 이같이 밝혔다.  금감원은 최근 증권사는 거래·환전수수료 등으로 매년 이익이 크게 증가한 반면, 개인투자자의 상당수가 손실을 입었다고 지적했다. 특히, 개인투자자들이 해외 파생상품 투자에서는 큰 손실을 입은 것이 이를 반증하고 있다고 강조했다.  실제 증권사의 해외증권 위탁매매수수료는 지난 2023년 7000억원에서 지난해 1조4000억원, 올해 10월 기준 2조원으로 늘어났다. 반면, 지난 8월말 기준 개인 해외주식 계좌 49%가 손실을 기록했으며, 10월 기준 해외파생상품 투자손실은 약 3700억원에 이른다.  이찬진 원장은 투자자 이익보다는 실적을 우선시하는 증권사 영업행태를 강력히 질타하며 적극 대응할 것을 주문했다.  구체적으로는 현재 진행중인 증권사 해외투자 실태점검 대상을 확대하고 문제소지가 확인된 증권사는 즉시 현장검사로 전환키로 했다.  또, 투자자를 현혹하는 과장광고, 투자자 위험감수 능력에 맞지 않는 투자권유, 투자위험에 대한 불충분한 설명 등 위법·부당행위 발견시에는 해외주식 영업중단 등 최고 수준으로 엄정 조치할 것을 지시했다.  금감원은 점검회의 직후 주요 증권사 최고경영자(CEO) 간담회를 개최해 해외증권 중개영업 전반에 걸쳐 문제점을 점검해 즉시 시정하고, 영업 유인체계 개편 등으로 투자자 이익을 최우선으로 할 것을 당부했다.  이에 증권업계는 향후 해외투자 관련 이벤트, 마케팅 등을 당분간 중단할 방침인 것으로 전해졌다.",https://n.news.naver.com/mnews/article/016/0002574132
