날짜,제목,본문,링크
2025-12-03 11:19:00,"中 딥시크, 새 AI모델 공개…“제미나이3과 성능 비슷”[AI판 지각변동]","“적은비용으로 최상위 모델 구현” “일부 영역선 GPT-5 능가” 주장   인공지능(AI) 모델 경쟁에 중국 생성형 인공지능(AI) 스타트업 딥시크(DeepSeek)도 참전을 가속화하고 있다. 딥시크는 오픈AI·구글과 직접 경쟁하는 최신 모델 ‘딥시크 V3.2’를 지난 2일 공개했다. 회사 측은 성능 면에서 GPT-5와 비견되고, 고연산 특화 모델은 구글 제미나이3 프로 수준에 도달했다고 주장하며 기술력 과시를 이어갔다.  중국 관영 신화통신·SCMP 등에 따르면 딥시크는 이날 ▷딥시크 V3.2 ▷고연산 특화 모델 ‘딥시크 V3.2-스페치알레(speciale)’를 공식 출시했다. 딥시크는 기본 모델인 V3.2가 “학습 프로토콜 강화와 훈련 후 연산능력 확장을 통해 오픈AI GPT-5에 필적하는 성능을 확보했다”고 설명했다.  고성능 모델인 V3.2-스페치알레에 대해서도 “GPT-5를 능가하고 구글 제미나이3 프로와 비슷한 수준의 추론 능력을 보였다”고 강조했다. 다만 제미나이3 프로 대비 토큰 효율성(단어·문장 단위 처리 효율)은 “눈에 띄게 열등하다”고 인정했다.  GPT-5는 지난 8월, 제미나이3 프로는 지난 11월 출시된 글로벌 최신 대형모델(LM)로, 딥시크의 이번 발표는 중국 AI업계가 다시 한 번 미국 빅테크와 ‘성능 경쟁’을 본격화했다는 신호로 해석된다. 특히 미국의 대(對)중국 수출 통제로 고성능 그래픽처리장치(GPU) 확보가 힘든 상황에서 나온 성과여서 주목된다.  딥시크 측은 V3.2-스페치알레 모델이 올해 국제수학올림피아드·국제정보올림피아드에서 “금메달 수준의 성과를 보였다”고 주장하며 고난도 논리·수학 연산 능력을 강조했다. 또 V3.2가 추론 모드와 도구 호출을 최초로 통합했다는 점도 관심을 끈다. 딥시크는 1800개 이상의 환경과 8만5000개 이상의 복잡한 명령어로 구성된 대규모 합성 데이터 생성 방법을 개발해 에이전트 학습을 진행했다. 기술 보고서에 따르면 V3.2는 현재 오픈소스 모델 중 에이전트 평가에서 최고 수준을 달성했으며, 오픈소스와 클로즈드소스 모델 간 도구 호출 능력 격차를 크게 좁혔다.  전문가들은 중국 AI기업이 ‘고성능-고연산 특화 모델’ 개발에 속도를 내는 흐름이 가속화되고 있다며, 미국 기업 중심의 AI 생태계가 중·미 경쟁 구도로 재편되는 조짐을 보인다고 평가했다. 서지연 기자",https://n.news.naver.com/mnews/article/016/0002566599
2025-12-03 11:18:00,한국종교지도자협의회 공동대표에 진우스님 재선출,"대한불교조계종 총무원장 진우스님(가운데)이 한국종교지도자협의회 공동대표의장(이사장)으로 재선출됐다. 한국종교지도자협의회는 2일 조계종 총무원에서 2025년도 제3차 임시이사회를 열고 제17대에 이어 제18대 공동대표의장으로 진우스님을 선출했다. 이날 임시이사회에는 불교(조계종 총무원장 진우스님), 개신교(고경환 한국기독교총연합회 대표회장), 원불교(나상호 교정원장), 유교(최종수 성균관장), 천도교(박인준 교령), 천주교(이용훈 한국천주교주교회의 의장), 민족종교(김령하 한국민족종교협의회 회장) 등 7대 종교 대표 모두가 참석했다. 종지협은 지난 1997년 10월 종교 간 화합과 교류 증진을 목적으로 설립된 단체로, 한국 사회를 대표하는 7개 종교의 대표들이 참여하고 있다. 진우스님은 “종지협은 종교 간 상호 존중을 바탕으로 상생의 길을 열어 나가겠다”고 밝혔다. 김현경 기자",https://n.news.naver.com/mnews/article/016/0002566598
2025-12-03 11:18:00,오픈AI ‘비상사태’ 선포 “챗GPT 품질개선 집중”[AI판 지각변동],"올트먼, 임직원에 ‘코드 레드’ 발령 개인비서 등 기타서비스 출시연기 “경쟁사 공세…선두주자 우위 흔들”     미국 인공지능(AI) 챗봇 챗GPT 개발사 오픈AI의 샘 올트먼 최고경영자(CEO·사진)가 사내에 ‘적색 경보(code red)’를 발령했다. 챗GPT 출시 3년 만에 기술력이 구글 제미나이3.0 등 경쟁사들에 밀리고 있다는 평가가 나오자 위기감을 드러낸 것이다. 이는 선도 기업의 우위가 구조적으로 흔들리기 시작했음을 보여주는 것이란 분석이 나온다.  2일(현지시간) 월스트리트저널(WSJ)에 따르면, 올트먼 CEO는 전날 임직원 대상 사내 메모를 통해 ‘적색 경보’를 발령하고 챗GPT 품질 개선에 집중하고자 다른 서비스 출시를 연기하기로 했다.  올트먼 CEO는 이에 따라 “광고를 비롯해 건강·쇼핑 AI 에이전트, 개인비서 서비스 ‘펄스’ 등 오픈AI가 추진하던 프로젝트들을 미룰 예정”이라고 말했다.  그러면서 그는 “잠정적인 인력 재배치를 유도하고 챗GPT 성능 개선 담당자들과는 일일 회의를 할 것”이라고 언급했다.  올트먼 CEO는 “다음 주 출시 예정인 새로운 추론 모델이 구글의 최신 AI 모델을 앞서고 있으며 회사가 다른 여러 부문에서도 여전히 좋은 성과를 내고 있다”고 덧붙였다.  챗GPT 앱을 총괄하는 닉 털리 오픈AI 부사장은 같은 날 엑스(X·옛 트위터) 게시글에서 “현재 우리의 초점은 챗GPT를 더욱 유능하게 만들고, 성장을 지속시키며, 세상으로의 접근을 확장하는 것”이라며 “동시에 더 직관적이고 개인화된 느낌을 주도록 만들 것”이라고 말했다.  올트먼 CEO가 이 같은 사내 메시지를 보낸 것은 최근 구글 등 경쟁사들의 자체 AI 모델 출시 소식과 관련 있다.  챗GPT를 능가하는 성능의 AI 모델이 나오기 시작하면서 핵심 경쟁력이 뒤처질 수 있다는 우려가 반영된 것이다.  실제 구글의 제미나이 3.0은 챗GPT를 능가한다는 분석이 지배적이다. 제미나이 3.0은 AI챗봇 평가사이트 ‘LM아레나’ AI 성능 평가에서 1501점(LM아레나 리더보드 기준)으로 1위를 차지했다.  또 가장 어려운 AI 성능평가로 불리는 ‘인류 마지막 시험(HLE)’에서도 최고점수(37.5%)를 받으며 오픈AI의 GPT 5 프로(31.6%)를 앞섰다.  고급 과학 지식을 시험하는 ‘GPQA Diamond’ 시험에선 91.9%의 정확도를 기록해 박사급(PhD-level) 추론 능력을 입증했으며 챗GPT 5.1의 능력을 뛰어넘었다.  세일즈포스 마크 베니오프 CEO는 구글의 ‘제미나이 3.0’에 대해 “추론, 속도, 이미지, 비디오 등 모든 것이 더 선명하고 빨라졌다. 이는 정말 놀라운 발전이다”고 극찬했다.  AI 챗봇 ‘클로드’를 운영하는 앤트로픽도 추론과 전문 작업에 적합한 최상위 모델 ‘클로드 오퍼스4.5’의 신규 버전을 출시했다. 앤트로픽은 기업 고객들의 호평을 받으며 영향력을 확대 중이다.  니혼게이자이신문은 오픈AI가 챗GPT를 출시한 직후인 2022년 12월에 대화형 AI 경쟁에서 뒤처진 구글 경영진이 내부적으로 ‘코드 레드’를 발령한 점을 상기한 뒤 “이번에는 상황이 뒤바뀌어 오픈AI의 선도적 지위가 흔들리고 있음을 보여준다”고 분석했다.  이어 “구글·앤트로픽·xAI·딥시크 등 경쟁사들의 기술과 자본 공세가 동시에 가속화하면서 오픈AI는 향후 1~2년이 생존과 전략적 재정립의 분기점이 될 가능성이 커지고 있다”고 전했다. 김영철 기자",https://n.news.naver.com/mnews/article/016/0002566597
2025-12-03 11:18:00,"아마존, 전력40% 줄인 AI칩 공개…엔비디아에 도전장[AI판 지각변동]","AWS, 자체칩 ‘트레이니엄3’ 출시 전력소모 40% 줄이고 성능 4배↑ “엔비디아 GPU대비 운영비 절반” 가성비 무장, 엔비디아와 가격경쟁 차세대 ‘트레이니엄4’도 개발 착수   맷 가먼 아마존웹서비스(AWS) 최고경영자가 미국 라스베이거스에서 열린 자사 연례 최대 행사 ‘리인벤트’에서 연설하고 있다. [AWS코리아 제공]   아마존웹서비스(AWS)가 전력 효율성을 크게 끌어올린 차세대 인공지능(AI) 칩 ‘트레이니엄3’(작은 사진)를 공개하며 엔비디아의 지배력이 절대적인 AI 반도체 시장에 정면 도전장을 냈다. AI 인프라의 가장 큰 병목으로 꼽히는 전력 소모를 40% 줄이면서 운영비를 최대 절반까지 낮출 수 있다는 점을 내세웠다. 그간 그래픽처리장치(GPU)로 독보적 우위를 점했던 엔비디아의 독주체제에 ‘가성비’로 무장한 아마존과 구글의 자체칩(주문형반도체·ASIC)이 가세하며 글로벌 AI판도에 지각변동이 일고 있다.  ▶아마존 AI칩 전력효율 40% 개선…‘전성비’ 무장 엔비디아와 가격경쟁 예고=AWS는 2일(현지시간) 미국 라스베이거스에서 열린 연례 행사 ‘리인벤트 2025(Re:Invent)’에서 트레이니엄3를 출시했다고 밝혔다.  이번 신형 칩은 전작 트레이니엄2 대비 컴퓨팅 성능을 4배 이상 높이고, 에너지 소비량은 약 40% 줄인 것이 특징이다. 이른바 전성비(전력 대비 성능 비율)를 크게 개선해 대규모 AI 훈련·추론 환경에서 비용 절감 효과가 크다는 게 회사 설명이다.  AWS는 트레이니엄3를 활용하면 엔비디아 GPU 기반 대비 AI 모델 훈련·운영 비용을 최대 50 줄일 수 있다고 강조했다. 맷 가먼 AWS 최고경영자(CEO)는 “트레이니엄3는 업계 최고 수준의 비용 효율성을 보여준다”고 말했다.  AWS는 이미 다음 세대 제품인 ‘트레이니엄4’ 개발에도 착수했다. 트레이니엄3 대비 3배 이상 성능을 목표로 하되, 엔비디아의 칩 간 고속 연결 기술 ‘NV링크’를 지원할 것이라고 예고했다. 엔비디아 기반 인프라를 쓰던 기업이 AWS 칩으로 자연스럽게 넘어오도록 ‘호환성’ 장치를 마련해 향후 시장 판도 변화를 노린 전략으로 풀이된다.  AWS는 이와 함께 자체 AI 모델 ‘노바’의 후속 버전 ‘노바2’와, 기업별 맞춤형 AI 모델 개발을 지원하는 ‘노바 포지(Nova Forge)’ 서비스도 공개하며 AI 플랫폼 생태계 확장에도 속도를 높이고 있다.    ▶구글·아마존 등 자체칩 속속 출시…엔비디아 독주체제 ‘흔들’=AI칩 시장에서 엔비디아는 80~90% 점유율로 독주하고 있지만, 최근 빅테크들이 전력 효율성을 앞세운 자체 칩으로 잇따라 견제에 나서며 지형이 흔들리고 있다.  구글은 최근 TPU 차세대 칩 ‘아이언우드’를 공개하며 메타 등 외부 고객 대상 대량 공급을 추진해 엔비디아와 정면 승부를 예고했다.  TPU는 처음부터 딥러닝 수학 계산(행렬 연산)에 최적화된 맞춤형 칩으로 설계됐다. 한 번 입력된 데이터를 다수 연산에 반복 활용하고 중간 연산 결과를 외부 메모리에 저장하지 않은 채 인접 연산 유닛으로 즉시 전달한다. AI 모델에 최적화된 제품인 셈이다. TPU는 메모리 접근에 따른 병목이 줄면서 전력 효율도 높다. TPU는 GPU 대비 35%에서 최대 80% 비용을 절감할 수 있는 것으로 알려졌다.  반면 GPU는 게임 그래픽 처리를 위해 개발된 뒤 AI 연산에 활용됐다는 점에서 TPU보다는 활용범위가 넓다. 범용 병렬 연산을 전제로 해 외부 메모리와의 데이터 입출력이 잦은 구조다. 이 때문에 GPU는 많은 전력이 필요하다.  이미 시장에선 구글의 TPU가 AI칩 공급망을 다변화시킬 것으로 전망하고 있다. 모건스탠리는 최근 보고서에서 “알파벳(구글 모회사)의 AI칩 사업이 2027년 최대 100만개 출하까지 확대될 수 있다”며 “시총 4조달러 돌파가 가시권에 들어왔다”고 평가했다.  구글의 추격을 의식한 듯 엔비디아는 지난달 말 자사 엑스(X·옛 트위터)를 통해 “모든 AI 모델을 구동하고 컴퓨팅이 이뤄지는 모든 곳에서 이를 수행하는 것은 우리 플랫폼뿐”이라며 “엔비디아 제품은 특정한 AI 구조나 기능을 위해 설계된 주ASIC보다 뛰어난 성능과 다용성과 호환성을 제공한다”고 견제구를 날린 바 있다.  서지연 기자",https://n.news.naver.com/mnews/article/016/0002566596
2025-12-03 11:18:00,"CJ올리브네트웍스, 스마트팩토리로 제조·물류기술 혁신…AX 선도한다","화요 등 F&B 스마트공장 구축 맞춤형 AX로 생산효율·품질 강화   농업회사법인 소주스토리 안동소주 스마트팩토리 조감도 [CJ올리브네트웍스 제공]   CJ올리브네트웍스가 산업 현장에서 AI(인공지능) 기반의 IT 기술로 제조물류 비즈니스의 패러다임을 바꾸고 있다. 특히 CJ그룹의 IT서비스 개발을 통해 축적한 기술력으로 식음료(F&B)·바이오 산업에 특화한 스마트제조물류 기술을 지원하며 고객 혁신의 파트너로 자리 잡았다.  프리미엄 주류 브랜드 화요는 CJ올리브네트웍스가 자체 개발한 스마트팩토리 시스템인 ‘팩토리원(Factory ONE)’을 여주공장에 적용해 전 공정을 스마트 공정으로 전환했다. 이를 통해 화요는 실시간 공정 데이터를 한 번에 확인할 수 있게 됐다. CJ올리브네트웍스는 여주 제2공장에도 스마트팩토리 모든 제조 단계를 주도했다.  최근에는 농업회사법인 소주스토리의 ‘프리미엄 주류 스마트팩토리’ 구축 사업을 수주했다. CJ올리브네트웍스는 원료 입고부터 발효, 증류, 저장·숙성, 병입까지 전 공정을 고도화해 최적의 생산현장을 구현할 계획이다.  하이트진로의 첫 해외 공장인 베트남 스마트팩토리 구축 사업도 수행했다. 해외 첫 대외 스마트팩토리 사업이다. 생산 전 과정을 설계·조달·시공까지 책임지는 EPC(Engineering, Procurement, Construction)라는 점에서 의미가 크다.  이 외에도 OB 맥주, hy 등 식음료 분야에서 각 기업과 제품에 최적화된 고객 맞춤형 AX(인공지능 전환)를 성공시키며 식품의 안정성(HACC)은 물론 효율성까지 높이고 있다.  CJ올리브네트웍스 관계자는 “레시피 관리 등 제조 공정이 유사한 바이오, 화장품 등 스마트팩토리 분야는 물론 생산공정 내 물류자동화를 포함한 스마트 물류 사업까지 사업 영역을 확장 중”이라며 “성공 사례를 바탕으로 스마트제조물류 사업 영역을 확장하면서 AX 선도기업의 입지를 공고히 하겠다”고 강조했다. 신현주 기자",https://n.news.naver.com/mnews/article/016/0002566595
2025-12-03 11:18:00,북적이는 인천공항…미소짓는 식음업계,"관광객 늘며 누적 6100만명 회복 아워홈 1~10월 컨세션 매출 11%↑ 롯데GRS·CJ프레시웨이 등도 성장세 “외식사업 성장동력…경쟁력 이어져”   인천공항 제1터미널 교통센터 내 ‘테이스티 아워홈 그라운드’. [아워홈 제공]   해외여행객이 증가하며 공항 식음료 매장을 위탁 운영하는 ‘컨세션’ 시장이 모처럼 활기를 띠고 있다.  3일 인천국제공항 통계에 따르면 올해 1~10월 인천공항 여객 수는 6099만995명으로 전년 동기 대비 4.5% 증가했다. 지난 9월 29일 시작된 중국인 단체 관광객 무비자가 영향을 미쳤다. 지난 10월 인천-중국 노선을 이용한 여객 수는 전년 동월 대비 25.4% 증가한 113만3205명으로 집계됐다. 코로나19 이전인 2019년 동월 대비 92.9%까지 회복했다.  식음업계는 코로나19로 하늘길이 닫힌 2020년 공항 컨세션 매출이 80% 이상 급감하는 등 손실을 봤다. 하지만 최근 여객 수가 회복하면서 매출은 성장세다. 컨세션은 공항·역사·쇼핑몰·병원 등 다중 이용시설 내 식음 공간을 운영하는 사업이다. 입점 브랜드와 시설 관리, 메뉴 기획까지 통합적으로 제공한다.  컨세션 사업의 강호 아워홈의 올해 1~10월 공항 컨세션 매출은 전년 동기 대비 11% 늘었다. 컨세션 사업 전체 매출은 30%나 성장했다. 아워홈은 지난 2023년 인천공항공사로부터 FB3(식음복합) 구역 운영사업권을 확보했다. 신규 매장 개점과 기존 매장 리뉴얼을 이어오며 브랜드 포트폴리오를 확장했다. 올해 상반기에는 테이스티 아워홈 그라운드, 한식소담길, 손수헌 등 매장을 추가로 열었다. 현재 제1·2터미널에서 30여개 식음 매장을 운영 중이다.  올해 3분기 롯데GRS의 컨세션 매출도 같은 기간 23% 늘었다. 롯데GRS 지난해 11월 FB2 구역 입찰 수주로, 현재 제1·2터미널에서 37개 매장을 운영 중이다. 푸드코트 3곳을 올해 연말과 내년 2월에 오픈할 예정이다.  올해 인천공항에 첫발을 내디딘 CJ프레시웨이도 성장세다. CJ프레시웨이는 올해 푸드코트 ‘고메브릿지’를 열고, 빠르게 매장을 늘리고 있다. 제2터미널에 1호점, 제1터미널 탑승동에 2호점, 제1터미널 동편에 3호점을 차례로 개점했다. 향후 1곳을 추가할 예정이다. 인천공항 매출이 늘며 3분기 레저·컨세션 사업 매출은 전년 동기 대비 17% 증가했다.  SPC는 자체 메뉴를 개발하며 경쟁력을 키우고 있다. 지난 9월에는 한정 판매 제품 ‘피넛&누텔라 샌드’를 선보였다. 지난해 4월 인천국제공항 제2터미널에 개점한 ‘던킨 T2 인천공항센트럴점’은 같은 해 12월 방문 고객 수가 100만명을 돌파했다. SPC는 인천국제공항 1·2터미널에 파리바게뜨·배스킨라빈스·쉐이크쉑 등 41개 점포를 운영하고 있다. 지난 2023년 11월 운영사업 계약을 체결해 2033년까지 장기 운영권을 확보했다.  식음료 기업들이 공항 컨세션 사업에 열을 올리는 건 안정적인 매출 때문이다. 고정적인 유동인구와 비교적 고소득층이 많은 해외여행객 특성을 고려할 때 안정적인 수익 창출이 가능하다는 판단이다.  업계 한 관계자에 따르면 “고환율 여파로 타격을 입은 면세점과 달리, 외식 물가 상승 속도 대비 가격 인상이 적은 식음료 매장의 부담이 줄었다”고 말했다. 이어 “컨세션 부문이 외식 사업의 핵심 성장 동력으로 떠오르면서 기업별 경쟁력 강화는 당분간 이어질 것”이라고 덧붙였다.  박연수 기자",https://n.news.naver.com/mnews/article/016/0002566594
2025-12-03 11:17:00,李대통령 ‘은밀한 전단지 작전’ “北에 사과해야 하지 않을까 생각”,"“자칫 잘못하면 종북몰이 될까봐 차마 말 못해” “핵잠, 미국 필라델피아 건조 현실적으로 어려워”   이재명 대통령이 3일 청와대 영빈관에서 열린 ‘새롭게 선 민주주의, 그 1년’ 외신 초청 기자회견에서 취재진 질문의 질문을 받고 있다. [연합]   [헤럴드경제=문혜현·전현건·주소현 기자] 이재명 대통령이 3일 윤석열 전 대통령이 북한에 은밀히 전단지 작전을 수행하는 등 전쟁을 유도한 것과 관련해 “(북한에) 사과해야되지 않을까 생각했다”고 밝혔다.  이 대통령은 이날 오전 청와대 영빈관에서 개최된 ‘새롭게 선 민주주의, 그 1년’ 외신 초청 기자회견에서 ‘북한과 긴장을 완화하기 위해 국가 차원의 사과를 할 생각이 있느냐’는 질문에 “어떻게 제 마음 속을 들여다보고 그런 질문을 하시는지 모르겠다. 차마 말을 못하고 있다”면서 이같이 답했다.  이 대통령은 다만 “자칫 잘못하면 소위 우리 말로 ‘종북몰이’, 정치적 이념 대결의 소재가 되지 않을까 그런 걱정이 돼서 차마 말을 못하고 있다”면서 “(기자가) 물어보니 다행스럽다 싶기도 하면서 속을 들켰나 싶은 생각도 든다. 이정도로 끝내겠다”며 말을 아꼈다.  이 대통령은 지난 1일 X(구 트위터)에 윤 전 대통령의 전쟁 유도 관련 기사를 언급하며 “계엄 명분으로 전쟁을 계시하려고 군대를 시켜 북한에 풍선까지 (보냈다)”면서 “곳곳에 숨겨진 내란 행위를 방치하면 언젠가 반드시 재발한다”고 말한 바 있다.  이 대통령은 이날 핵잠 건조 장소에 관한 입장을 밝히기도 했다. 그는 “핵잠수함 건조 장소 문제는 (도널드) 트럼프 대통령께서는 미국 제조업 부흥 측면에서 미국에서 필라델피아조선소에서 하는 게 어떠냐, 이렇게 말씀했다”면서 “우리가 가진 관점으로는 거기서 생산하는 게 현실적으로 매우 어렵다”고 선을 그었다.  이 대통령은 “아마 속도가 느려서 문제일 것”이라며 “건조 역량에 한계가 있는 것 같다”고 짚었다.  이어 이 대통령은 “우리 입장에서야 세계 최고의 조선 효율성을 가지고 있는 국내에서 하는 것이 가장 생산비도 싸고 생산 기간도 짧고 또 경제적 측면에서나 군사 안보적 측면에서도 바람직하다”면서 “우리가 요구한 것은 ‘만들어 달라, 기술을 달라’가 아니다. 우리가 우리 기술로 만들 테니 금지돼 있는 연료 공급만 하게 해 달라는 취지였다”고 했다.",https://n.news.naver.com/mnews/article/016/0002566593
