날짜,제목,본문,링크
2025-12-03 14:35:00,“우리 아파트 들어오지마…최대 벌금 20만원” 야박한 이 아파트에 원성 폭발,"‘고덕아르테온’이 인근 아파트에 보낸 공문.[고덕그라시움 관리사무소]   [헤럴드경제=김성훈 기자] 서울 강동구의 한 아파트가 외부인의 단지 출입을 금지하고, 단지 내에서 질서위반 행위를 할 경우 벌금을 부과하겠다고 주변 단지에 통보해 논란이 되고 있다.  3일 부동산 업계에 따르면, 강동구 상일동의 아파트 단지 ‘고덕아르테온’은 최근 단지 내 공공 보행로 외 모든 구역에 대해 외부인 출입 및 시설 이용을 금지하고, 단지 내에서 특정 ‘질서 위반 행위’를 하는 외부인에게 ‘질서 유지 부담금’을 징수하겠다는 내용의 공문을 주변 단지에 배포했다.  인근의 한 아파트 단지가 주민들에게 배포한 안내문에 따르면, 고덕아르테온의 공문에는 △중앙 보행로(공공 보행로)를 제외한 모든 구역 외부인 출입 및 시설 이용 금지 △전동 킥보드, 전동 자전거 등 지상 주행 시 20만원 위반금 징수 △단지 내 흡연, 반려견 배설물 미수거 등 위반, 반려견을 동반한 어린이 놀이터 출입 등 위반 사항 적발 시 10만원 위반금 징수 등이 적시돼 있는 것으로 알려졌다. 또 공문에는 “아랑길(공공 보행로) 통행 시 정숙·청결·안전 의무를 준수해야 하며, 주거환경을 침해하는 행위에 대해서는 법적 책임을 묻겠다”는 경고도 있었다.  고덕아르테온 측은 공문에서 “외부인의 단지 이용 과정에서 소란, 이물질 투기, 시설물 훼손 등이 반복됐다”며 “질서 유지 및 안전 확보를 위해 관련 규정을 강화한다”고 이유를 설명했다. 지난 여름 인근 단지 청소년들이 지하 주차장에 무단 침입해 소화기를 방출하는 등 외부인 출입과 난동이 영향을 미친 것으로 알려졌다.  고덕아르테온 측은 “입주자대표회의 의결과 입주자 등 과반 동의를 거쳐 10월 2일부로 질서 유지에 관한 규정을 시행한다”며 “고덕아르테온 사유지 내 질서 유지 및 시설 보호를 위해 협조해 달라”고 밝혔다.  인근 단지 주민들은 “아파트가 공권력도 아닌데 벌금을 받겠다고 엄포를 놓는 것이 볼썽사납다”는 등 불편한 기색을 숨기지지 않고 있다. 해당 통행로는 주민들에게 통학, 통근 등을 위한 공공 보행로 역할을 하고 있어 사유 재산이라는 논리만을 내세울 수 없다는 주장이다. 해당 아파트가 재건축 당시 외부에 개방한 공공 보행로 조성을 조건으로 인허가를 받았다는 지적도 있다. 강동구에 따르면 해당 아파트 공공보행통로는 ‘고덕택지 제1종 지구단위계획’, ‘고덕주공3단지 세부개발계획’에서 공공보행통로로 지정돼 사업이 추진됐다. ‘고덕택지 제1종 지구단위계획 시행지침’ 제4조에 따라 대지 안에 일반인이 보행에 이용할 수 있도록 24시간 개방된 공간으로 운영돼야 한다.",https://n.news.naver.com/mnews/article/016/0002566741
2025-12-03 14:35:00,"조선호텔앤리조트, 백혈병어린이재단에 헌혈증서 1004매 기부","임직원들이 2022년부터 모아…직접 만든 ‘니버 인형’ 100개도   조선호텔앤리조트 최훈학(왼쪽) 대표이사와 한국백혈병어린이재단 서선원 사무총장이 헌혈증서 전달식에서 기념촬영을 하고 있다. [조선호텔앤리조트 제공]   [헤럴드경제=강승연 기자] 조선호텔앤리조트가 소아암 어린이를 격려하기 위해 한국백혈병어린이재단에 물품 및 헌혈증서를 기부했다고 3일 밝혔다.  이날 조선호텔앤리조트는 임직원 100명이 직접 만든 ‘니버 인형’ 100개와 헌혈증서 1004매를 전달했다.  헌혈증서는 임직원들이 지난 2022년부터 모은 것이다. 혈액으로는 35만㎖에 해당한다. 조선호텔앤리조트는 지난 2008년과 2014년에 각각 1004매, 2021년에 500매를 기부하는 등 3회에 걸쳐 꾸준히 헌혈증서를 기부했다.  최훈학 조선호텔앤리조트 대표이사는 “앞으로도 소아암 어린이들을 격려할 수 있는 다양한 캠페인에 적극적으로 참여해 뜻 깊은 사회공헌활동을 펼칠 것”이라고 전했다.",https://n.news.naver.com/mnews/article/016/0002566740
2025-12-03 14:33:00,“원통에 넣고 매트로 눌렀다”…부산 유치원교사가 ‘아동 학대’ 신고,사진은 기사 내용과 무관함. [123rf]   [헤럴드경제=장연주 기자] 부산 강서구의 한 유치원에서 아동 학대가 있었다는 신고가 접수돼 경찰이 수사에 나섰다.  부산 강서경찰서는 강서구의 한 유치원에서 수업 도중 교사가 아동을 학대했다는 신고를 받고 수사하고 있다고 3일 밝혔다.  해당 유치원의 한 학부모는 “수업 중에 교사가 원생을 원통에 넣고 매트로 누르는 등 학대가 있었다”고 경찰에 신고했다.  해당 유치원은 이날 오전 유치원 강당에서 학부모들을 상대로 관련 내용을 설명한 것으로 전해졌다.  부산 강서경찰서는 사건을 조만간 부산경찰청 여성청소년범죄수사계로 이첩할 예정이다.,https://n.news.naver.com/mnews/article/016/0002566739
2025-12-03 14:31:00,분실폰 주워 지구대 맡겼더니…되레 ‘점유이탈물 횡령’ 고소 당해,"사진은 기사와 무관. [게티이미지]   [헤럴드경제=민성기 기자] 도로에서 깨진 스마트폰을 주워 지구대에 인계한 남성이 되레 ‘점유이탈물 횡령’ 혐의로 고소를 당하는 사건이 발생했다.  2일 뉴스1은 한 온라인 커뮤니티에 올라온 A씨의 사연을 공개했다.  공개된 사연에서 온라인 커뮤니티 글쓴이 A씨는 “좋은 일 한번 해보려다 경찰 조사까지 가게 생겼다”고 밝혔다.  A씨 따르면 그는 퇴근하던 길, 경기도 광주시 회덕동의 한 24시 마트 앞 차도에서 액정이 심하게 파손된 휴대전화 한 대를 발견했다.  차량에 여러 번 밟힌 듯 훼손이 컸고 안에는 카드와 사진 등이 들어 있었다.  그는 “습득 직후부터 혹시 오해받을까 싶어 바로 핸드폰 상태를 사진으로 남겼다”며 “불법 영득 의사가 없다는 걸 기록으로 남기려고 당근마켓에도 글을 올렸다”고 말했다.  그가 당근에 첨부한 사진에는 ‘분실 핸드폰 주인을 찾고 있습니다. 도로에서 발견된 거라 차에 많이 밟혀 액정 파손 심한 상태고, 내일 퇴근길에 송정파출소로 인계 예정이며 기종은 모릅니다’라는 내용이 담겨 있었다.  A 씨는 집과 지구대 사이 거리가 3~4km 정도 돼 당일 바로 이동하지 못했고, 다음날 퇴근길에 인계하기로 했다. 그러나 막상 찾아가 보니 해당 지구대는 이틀 전에 다른 곳으로 이전해 있었다고 한다. 그는 “짜증이 확 났지만 버리기도 찝찝해서, 결국 다음날 또 퇴근길에 들러 억지로 인계했다”고 했다.  그런데 약 40일 뒤 A 씨는 경찰로부터 뜻밖의 연락을 받았다. 광주경찰서 강력4팀 소속 형사로부터 ‘점유이탈물 횡령 사건 고소가 접수됐다’며 출석을 요구하는 문자였다. 그는 “처음엔 장난 문자인 줄 알았다”며 “설명까지 해가며 좋게 처리해 줬는데, 뒤늦게 나를 고소했다는 사실에 당황스러웠다”고 말했다.  A씨는 “기록을 다 남겨놔서 법적으로 문제 될 것은 없다고 본다”며 “상대방 신상도 모르니 방어 차원에서 무고로 맞고소할 생각”이라고 밝혔다. 그는 “휴대전화가 부서진 걸 빌미로 합의금을 노리는 것 아닌가 싶다”고 전했다.  현재 A 씨는 경찰과 출석 일정을 조율하고 있다며 이후 진행 상황을 공유하겠다고 했다.",https://n.news.naver.com/mnews/article/016/0002566738
2025-12-03 14:30:00,트럼프 2기 국제질서 변화와 한국의 실용외교…제주평화연구원 회기간회의 개최,"- 아태 전략 환경 변화·동맹 정책·남북 관계 등 실용외교 방향 집중 논의  [사진: 2025 제주포럼 회기간회의 개회식]   제주평화연구원은 11월 28일(금) 한국프레스센터에서 “트럼프 2기 국제질서 변화와 한국의 국익중심 실용외교 방향”을 주제로 「2025 제주포럼 회기간회의」를 개최했다. 이번 회의는 트럼프 행정부 2기 출범 이후 변화하는 국제 정세가 한반도 및 아태 지역 안보환경에 미칠 영향을 점검하고, 대한민국 정부가 추구하는 ‘국익 중심의 실용 외교’전략의 구체적 실행 방안을 다각도로 모색하기 위해 마련됐다.  개회사를 통해 강영훈 제주평화연구원장은 “다극화와 진영화로 자유주의 국제질서가 흔들리고, 글로벌 거버넌스의 공백이 커지고 있다”고 진단했다. 이어 “한국은 주변국과의 관계를 안정적으로 관리하면서도 복합적 위기 속에서 국익을 극대화할 수 있는 실용적 전략을 마련해야 한다”고 강조했다. 강 원장은 또한 “이번 회의가 주요 외교·안보 현안을 심도 있게 점검하고 실용적 정책대안을 모색하는 계기가 되기를 기대한다“고 밝혔다.  첫 번째 세션에서는 트럼프 행정부 2기 출범에 따른 아시아·태평양 전략환경 변화와 한국 외교의 대응 방향을 집중적으로 논의했다.  박인휘 이화여자대학교 국제대학원장은 트럼피즘 확대로 자유주의 국제질서가 약화하고 동맹 재조정이 불가피해졌다고 분석하며, “한국은 미·중 사이에서 거리의 균형이 아니라 이익의 균형을 실천해야 한다”고 강조했다.  김흥규 아주대학교 미중정책연구소장은 “미·중 경쟁은 공급망과 기술을 중심으로 이미 구조적 단계에 접어들었다”고 평가했다. 그는 “트럼프 2기에는 미국도 제한적 대중 타협을 병행할 가능성이 있는 만큼, 한국은 전략 사고의 범위를 넓히는 실용적 접근이 필요하다”고 제언하였다.  토론에서 문흥호 한양대 명예교수는 대만해협 긴장, 북·중·러 협력, 역내 불확실성 증가 등이 복합적으로 작용하는 상황에서 한국의 전략적 선택지가 좁아지고 있다고 분석했다. 또한 이러한 환경 속에서 “한국 외교의 장기적 정책 일관성 확보가 무엇보다 중요하다”고 강조했다.  이어 사회와 토론을 맡은 박영준 국방대학교 국가안보문제연구소장은 유엔 안보리 기능의 약화와 핵질서 불안정 등 글로벌 구조 변화가 한국 안보에 직접적인 영향을 미치고 있다고 지적했다. 그는 “대만과 한반도를 둘러싼 지정학적 위험이 교차하는 만큼, 한국은 위기관리 역량과 소다자 협력 등 복합적 외교 수단을 함께 강화해야 한다”고 제언했다.  박 소장은 세션을 정리하며 “국제질서 전환기일수록 대응형 외교가 아니라 능동적으로 전략을 설계하는 외교가 필요하다”고 말했다.  두 번째 세션에서는 트럼프 행정부 2기의 동맹정책 변화가 한미동맹과 역내 안보 구조에 미칠 영향을 분석하고, 안보·경제·기술을 아우르는 동맹 현대화 방향을 논의했다.  권보람 한국국방연구원 선임연구위원은“한국은 역량이 이미 충분한 능력 있는 동맹국(capable ally)”이라는 점을 전략적으로 활용해야한다고 강조하는 한편, “이에 따른 부담과 기회를 관리하기 위해 지경학적 기반의 동맹 재설계가 필요하다”고 제언했다.  설인효 국방대학교 교수는 중국의 A2/AD(반접근/지역거부) 고도화와 미국의 다중 분쟁 관리 부담이 동맹 구조에 직접적인 압력으로 작용하고 있다고 분석했다. 그는 “한미동맹의 구조적 재편은 약화가 아니라 새로운 환경에 맞춘 조정 과정”이라며, 대만 유사시 미국의 전략 집중 가능성을 고려하여 한국의 자주적 억제 역할 강화가 필요하다고 강조했다.  토론에서 이상현 세종연구소 수석연구위원은 “한국이 미국 안보 공약에만 의존하는 방식은 더 이상 유효하지 않다”고 지적하며, 변화한 환경 속에서 동맹의 역할과 한국의 전략적 선택을 균형 있게 재정립해야 한다고 강조했다. 박종승 KAIST 안보융합원 초빙교수는 반도체·AI·유무인 체계 등 첨단기술 협력이 한미동맹의 새로운 축이 될 수 있다고 분석하며, 군사안보와 경제안보를 연결하는‘첨단동맹(Tech Alliance)’ 구상을 제시했다. 이어 정삼만 한국해양전략연구소 해양안보센터장은“동맹 현대화의 필요성은 분명하지만, 국내 여론, 중국 변수, 북핵 리스크 등을 함께 고려하여 신중한 전략 설계 속에서 추진돼야 한다”고 강조했다.  사회를 맡은 홍현익 전 국립외교원장은 “다층적 위기가 겹치는 시기일수록 한미동맹의 안정성과 신뢰 유지가 무엇보다 중요하다”며, 한국이 동맹 기여와 자율성, 지역 안정의 세 요소를 균형 있게 관리해 나가야 한다고 정리하였다.  세 번째 세션은 트럼프 행정부 2기 출범 이후 변화할 한반도 안보 환경을 진단하고, 북한의 ‘적대적 두 국가’ 선언과 북·중·러 밀착 등 새로운 변수 속에서 남북협력의 현실적 방향과 평화공존 전략을 모색하는 데 논의의 초점을 맞추었다.  김범수 서울대 통일평화연구원장은 북한이 남북관계를 사실상 ‘전쟁 중 교전국 관계’로 규정하며 적대적 구조를 고착화하고 있다고 분석했다. 그는 “현 단계에서 남북관계의 현실적 목표는 통일이 아니라 충돌 방지와 평화공존”이라고 강조했다. 또한 최근 통일의식 조사에서도 “통일보다 평화와 안정을 우선시하는 국민 인식이 확산되고 있다”며, 이러한 현실을 반영한 단계적 접근이 필요하다고 제언했다.  오경섭 통일연구원 선임연구위원은 북한의 두 국가관계 선언이 장기화될 가능성이 높다고 평가했다. 그는 “현 상황에서는 남북 대화의 재개가 쉽지 않은 만큼, 위기관리 채널 복원과 확장억제 강화, 비정치 협력 확대 등 현실적으로 추진 가능한 분야부터 단계적으로 접근할 필요가 있다”고 강조했다.  토론에서 고유환 동국대 명예교수는 북미 정상 간 대화 가능성을 언급하며, “대화의 문턱을 낮추기 위해서는 ‘선 비핵화’ 요구를 앞세우기보다 관계 정상화와 신뢰 축적 등 실질적 여건 조성이 필요하다”고 제언했다. 조한범 통일연구원 석좌연구위원은 “적대적 두 국가 선언은 스스로 정통성 위기를 초래하는 측면이 있다”며, 향후 한국은 주민 중심 접근과 중장기 전략 마련의 필요성을 강조했다.  사회를 맡은 백학순 김대중학술원장은 “한반도는 그동안 지정학적 위험이 겹쳐 온 만큼, 전쟁 위험을 높이는 어떠한 상황도 경계해야 한다”며, “현재의 불확실성을 관리하면서 대화 여건을 마련하는 실용적 접근이 필요하다”고 세션을 마무리했다.  이번 회기간회의는 트럼프 행정부 2기 출범 이후 한국 외교가 직면한 주요 변화를 종합적으로 점검하고, 국익 중심 실용외교의 방향성을 모색하는 계기가 되었다. 제주평화연구원은 이번 논의가 내년 제21회 제주포럼에서 더욱 심층적인 정책 대화로 이어질 수 있도록 준비를 이어갈 계획이다.",https://n.news.naver.com/mnews/article/016/0002566737
2025-12-03 14:29:00,"동서식품, 제27회 맥심커피배 입신최강전 개막","내년 1월5일 첫 대국…우승자 상금 7000만원   3일 서울 성동구 한국기원에서 개최된 ‘제27회 맥심커피배 입신최강전’ 개막식에서 대회 관계자 및 참가 기사들이 기념촬영을 하고 있다. [사진제공=동서식품]   [헤럴드경제=김진 기자] 동서식품은 3일 오전 서울 성동구 한국기원에서 ‘제27회 맥심커피배 입신최강전’ 개막식을 개최하고 대진 추첨을 진행했다고 밝혔다.  맥심커피배 입신최강전은 국내 바둑 프로기사 9단에게만 출전 자격이 주어지는 권위 있는 바둑대회다. 총 32명의 프로기사들이 참가한다. 우승자에게는 ‘입신 중 입신’ 타이틀과 함께 상금 7000만원을 수여한다. 준우승자에게는 상금 3000만원이 트로피와 함께 수여된다.  개막식에는 최상인 동서식품 홍보 상무, 양재호 한국기원 사무총장을 비롯한 대회 관계자들과 지난 대회 우승자인 이지현 9단과 준우승자 신진서 9단이 참석했다. 변상일·안성준·신민준·강동윤 9단 등 상위 랭커 기사들도 자리했다.  경기는 내년 1월5일 첫 대국을 시작으로 약 4개월간 이어진다. 매주 월요일과 화요일 오후 7시 ‘바둑TV’를 통해 생중계될 예정이다.  최상인 동서식품 홍보상무는 “매회 바둑팬들의 뜨거운 관심과 사랑을 받아온 만큼 이번 시즌에도 최정상 프로기사들이 펼칠 명경기를 기대한다”며 “동서식품은 국내 바둑계 발전과 저변 확대를 위해 꾸준히 기여하겠다”고 말했다.",https://n.news.naver.com/mnews/article/016/0002566736
2025-12-03 14:24:00,인구유입 효과 사업에 내년 지방소멸기금 1조원 투입,"행안부, 지방소멸대응기금 배분계획 발표 기존 시설 조성 중심에서 사업 중심으로 개편   [헤럴드경제=이태형 기자] 1조원의 지방소멸기금이 내년에는 인구유입 효과가 있는 사업 중심으로 기금 운용체제가 개편된다.  행정안전부는 3일 지역별 투자계획 평가를 거쳐 2026년도 지방소멸대응기금 배분금액을 확정했다고 밝혔다.  지방소멸대응기금의 기본 운영 방향을 시설 조성 중심에서 실질적 인구유입 효과를 창출할 수 있는 사업 중심으로 개편했다.  배분체계를 ‘우수·양호’ 2단계에서 ‘우수·S등급·A등급·B등급’ 3·4단계로 다층화하고 추가 인센티브를 지급해 인구 유입 성과를 창출할 수 있는 사업이 추진될 수 있도록 했다.  이를 통해 사람(정주·체류인구), 산업·일자리, 마을공동체 부분에서 인구 성과가 높을 것으로 예상되는 우수 사업이 다수 발굴돼 내년부터 추진될 예정이다.  인구감소지역 중 영월군, 영동군, 금산군, 장수군, 화순군, 완도군, 영양군, 하동군 등 8개 지역, 관심지역 중 포천시, 인제군 등 2개 지역을 우수지역으로 선정하고, 지역별 평가등급(S·A·B등급)을 결정했다.  또 집행률이 저조한 지역을 우수지역에서 배제하고, 기금 사업 성과분석 배점을 상향하는 등으로 그간의 기금 운영 성과도 고려됐다.  윤호중 행안부 장관은 “지방소멸대응기금이 ‘지역에 사람이 들어오고 머물 수 있는 여건’을 만드는데 실질적으로 기여할 수 있도록, 기존 시설 조성 중심의 운영 패러다임을 인구유입 효과를 창출하는 사업 중심으로 전환했다”라며 “행안부는 이번 개편이 지방소멸 위기 극복과 국가 균형성장의 실질적 성과로 이어질 수 있도록 지방정부와 적극 협력해 나가겠다”라고 밝혔다.  한편 지방소멸대응기금은 지역 주도의 지방소멸 위기 대응을 지원하기 위해 2022년부터 2031년까지 매년 1조원 규모로 지역에 배분되는 재원이다.  지방소멸대응기금은 인구감소지역 89개, 관심지역 18개를 대상으로 하는 기초지원계정(7500억원)과 서울·세종 제외 광역자치단체(15개)를 대상으로 하는 광역지원계정(2500억원)으로 구성된다.  기초지원계정은 기금관리조합에서 구성한 평가단의 평가 결과에 따라 배분되고, 광역지원계정은 인구감소지역 비율 등에 따라 정액 배분된다.  인구감소지역[행정안전부 자료]",https://n.news.naver.com/mnews/article/016/0002566735
2025-12-03 14:23:00,"우덕윤덕병재단, 대학원생 35명에 장학금 1억7500만원 수여","16년간 1500명에게 장학금…누적 지원금 50억원 돌파   [hy 제공]   [헤럴드경제=박연수 기자] 재단법인 우덕윤덕병재단은 3일 서울 서초구 hy 본사에서 ‘2025년 우덕미래장학금 수여식(사진)’을 개최했다고 밝혔다.  수여식에는 이정렬 재단 이사장, 유상열 재단 이사(전 서울대학교 교수), 이정민 경희대학교 교수 등 관계자 50여명이 참석했다.  재단은 미래 인재 35명에게 1억7500만원의 장학금을 전달했다. 올해 장학생으로 선발된 이들은 기초학문 분야에서 석·박사 연구를 수행 중인 대학원생이다. 1인당 500만원의 장학금을 지원받는다.  한편 우덕윤덕병재단은 2010년 hy(옛 한국야쿠르트) 창업자인 고(故) 윤덕병 선대회장의 출연으로 설립됐다. 인재 육성과 연구 지원 등 공익 활동을 16년째 이어오고 있다. 지금까지 약 1500명의 인재에게 장학금을 지급했다. 누적 지원 금액은 50억원을 웃돈다.  이정열 재단법인 우덕윤덕병재단 이사장은 “앞으로도 인재들이 연구에 집중할 수 있도록 지원을 이어가겠다”고 말했다.",https://n.news.naver.com/mnews/article/016/0002566734
2025-12-03 14:23:00,"크라운해태제과 임직원들, 10일 부산서 ‘국악 공연’","국내 명인·명창도 무대 올라…“고객 감사 연말 특별공연”   오는 10일 부산 부산진구 부산콘서트홀에서 개최되는 ‘제6회 CH한음회’ 포스터. [사진제공=크라운해태제과]   [헤럴드경제=김진 기자] 크라운해태제과는 연말을 맞아 부산에서 임직원 국악 공연을 개최한다고 3일 밝혔다.  크라운해태 임직원들이 참여하는 ‘제6회 CH한음회’는 오는 10일 오후 7시에 부산진구 부산콘서트홀에서 열린다. 전통음악을 배운 임직원들이 직접 공연에 오른다. 2024년 처음 시작돼 대전, 대구, 광주 등 전국 순회공연과 오사카 엑스포 등에서 해외 공연을 한 바 있다.  이번 공연에선 락음국악단의 아리랑환상곡, 가곡 우조우편 ‘봉황대상’과 ‘종묘제례악 전폐희문’이 연주된다. 민요 ‘장기타령’, ‘자진 뱃노래’와 판소리 ‘인생백년’, ‘농부가’, ‘진도아리랑’도 선보인다. 사물놀이 무대 ‘울림’으로 마무리한다. 이미주 명무와 황숙경 명창, 채수정 판소리 명창도 무대에 동참한다.  크라운해태제과 관계자는 “올 한 해 사랑해 주신 부산 지역 고객들에게 감사의 마음을 전하기 위한 연말 특별공연”이라며 “임직원들이 스스로 배우고 익혀 즐기는 전통음악의 아름다움을 더 많은 고객과 나눌 수 있도록 확대해 나가겠다”고 말했다.",https://n.news.naver.com/mnews/article/016/0002566733
