날짜,제목,본문,링크
2025-12-18 09:31:00,국내 소비자 10명 중 3명 “향후 2년 내 수입차 구매”,"KAIDA 창립 30주년 기념 수입차 인식조사 수입차 인식 ‘긍정적으로 변했다’ 66.3% 수입차 구매 이유 ‘품질·내구성’   수입차 향후 구매시 우선 고려 브랜드 조사 결과 그래프 [한국수입자동차협회 제공]   [헤럴드경제=권제인 기자] 향후 2년 내 신차 구매를 계획하고 있는 소비자 10명 가운데 3명이 수입차 브랜드를 고려하고 있는 것으로 나타났다. 이는 지난 2015년과 비교하면 2배 이상 늘어난 수치다. 아울러 소비자들은 국내 자동차 시장에서 수입차 비중이 10년 후 26% 이상으로 확대될 것으로 전망됐다.  18일 한국수입자동차협회(KAIDA)는 창립 30주년을 맞아 실시한 ‘수입차 인식 조사’ 결과, 국내 소비자들의 인식이 크게 긍정적으로 변한 것으로 나타났다고 밝혔다. 소비자들은 품질과 내구성, 성능, 기술력 측면의 우수성을 수입차 주요 구매 이유로 꼽았다.  이번 조사의 목적은 수입차에 대한 인식 및 태도 변화를 살펴보고, 향후 수입차가 나아갈 방향성 모색을 위한 기초 자료 수집이다. 조사 대상은 전국 17개 시·도에 거주하는 만 20세~59세 운전면허증 보유자 1500명이다.  조사 결과 수입차에 대한 인식이 ‘과거에 비해 긍정적으로 변했다’는 응답 비율이 66.3%에 달했다. ‘변화 없음’ 28.9%, ‘부정적으로 변했다’는 응답은 4.9%에 그쳤다.  수입차 인식·이미지 변화 설문 조사 그래프 [한국수입자동차협회 제공]   인식 변화의 주요 요인은 ‘수입차 대중화’가 37.1%로 가장 높았다. 이어 ▷‘국산차와의 가격 차이 축소’(17.7%) ▷‘가격 대비 품질·성능이 좋아서’(12.9%) ▷‘개인의 선택을 존중하는 사회적 분위기’(9.1%) ▷‘직접 경험해보니 좋아서·좋다고 해서’(6.3%) ▷‘국가경제 발전·소득 수준 증가’(6.3%) 순으로 나타났다.  수입차가 국내 자동차 시장에 미친 영향에 대해 응답자의 48.8%가 ‘긍정적인 영향을 미쳤다’고 평가했다. 구체적으로는 ▷‘차량 품질과 기술의 상향 평준화’(28.1%) ▷‘소비자의 선택 폭 확대’(24.7%) ▷‘프리미엄·고급차 시장 활성화 계기 제공’(14.2%) ▷‘브랜드간 가격 경쟁 강화’(11.7%) ▷‘글로벌 자동차 트렌드의 유입 확대’(8.3%) 순이다.  국내 소비자들은 주행성능, 품질과 내구성, 성능·기술력 측면에서 수입차가 우수하다고 평가했다. 특히 현재 수입차를 직접 운행하고 있거나, 직·간접적 경험이 있는 응답자들이 그렇지 않은 응답자에 비해 수입차의 경쟁력을 더 높게 평가하는 경향을 보였다.  수입차 인식 변화 설문 조사 그래프 [한국수입자동차협회 제공]   국산차에서 수입차로 전환한 소비자들은 구매 이유로 품질과 내구성이 우수하고, 성능과 기술력이 앞서기 때문이라고 평가했다. 희소성과 차별성, 고급스러운 디자인, 브랜드 이미지 역시 주요 구매 요인으로 조사됐다.  수입차 구매를 고려하고 있는 응답자 역시 품질과 내구성, 성능, 기술력, 디자인에서의 강점을 이유로 들었다. 수입차의 고급스러운 디자인은 여성(43.3%)과 20대(44.1%)에서 상대적으로 높은 선호도를 보였다.  2년 이내에 차량 구매 의향이 있는 소비자 중 수입차 브랜드만 고려하고 있다는 응답자는 31.5%로 조사됐다. 이는 2015년의 2배에 해당하는 수치다. 1순위로 수입차를, 2순위로 국산차를 고려하고 있다는 응답자는 16.9%, 1순위로 국산차를 2순위로 수입차를 고려하고 있다는 응답자는 18.8%였다.  또한, 국내 소비자들은 수입차의 국내 시장 점유율이 10년 후 26.3%로 확대될 것으로 전망했다. 그 이유로는 ‘수입차 가격 경쟁력 강화(31.0%)’가 가장 많았으며, ‘개인의 선택을 존중하는 사회의 소비 성향’ (18.4%), ‘수입차 기술·성능의 지속 발전’(13.4%) 등이 뒤를 이었다.  정윤영 KAIDA 부회장은 “이번 조사를 통해 수입차에 대한 인식이 긍정적 개선되었음을 확인해 기쁘다”며 “지난 30년간 수입자동차가 국내 시장에 기술 혁신과 다양성 확대를 견인했다는 평가를 소비자들로 받았다는 점에서 의미가 깊다”고 말했다.",https://n.news.naver.com/mnews/article/016/0002573839
2025-12-18 09:31:00,"AI로 살린 듀스 故 김성재 목소리, 저작인접권 갖는다","듀스 [한국음악실연자연합회 제공]   [헤럴드경제=고승희 기자] 한 번 듀오는 영원한 듀오다. AI(인공지능)로 살려낸 故 김성재의 음성이 담긴 듀스의 신곡에 대한 저작인접권의 일부가 고인에게도 분배된다. 듀스 이현도의 결정이다.  한국음악실연자연합회(이하 음실련)는 “그룹 듀스(DEUX)의 신곡 ‘라이즈(Rise)’와 관련, 음실련 회원인 이현도가 자신의 저작인접권 일부를 고(故) 김성재의 몫으로 분배하겠다는 뜻을 밝혀 이에 따른 분배 구조를 마련했다”고 18일 밝혔다.  이번 분배는 현행 저작권법 및 저작인접권 제도에 따라, 실연자로 인정되는 이현도의 권리 판단과 자발적 결정으로 이뤄졌다.  음실련에 따르면 이현도는 28년의 시간 동안 기억된 듀스의 멤버이자 동료인 故 김성재를 향한 헌정의 의미를 담아 이 같은 결정을 내렸다. 관계자는 “단순한 권리 이전을 넘어, 음악으로 함께 호흡했던 동료에 대한 깊은 존중을 보여주는 사례”라고 했다  음실련은 법적 절차에 부합하는 범위 내에서 김성재의 유가족에게 분배가 이루어지도록 조치를 취했다. 현행 법과 제도의 틀 안에서 생존 실연자인 이현도의 권리 행사와 뜻을 최대한 반영한 결과로, 신곡 ‘라이즈’의 저작인접권 분배금 일부는 故 김성재의 유가족에게 지급된다.  28년 만에 발표된 듀스의 신곡 ‘라이즈’는 이현도가 직접 작사와 작곡을 맡았다. 듀스 특유의 뉴잭스윙 사운드를 현대적으로 재해석했다. 이번 곡은 故 김성재의 과거 음원 자료를 기반으로 AI 기술을 활용해 그의 목소리를 복원했다.",https://n.news.naver.com/mnews/article/016/0002573838
2025-12-18 09:31:00,"집값 오르고, MZ세대 유입도 증가… 인천 부동산 회복세에 ‘인하대역 수자인 로이센트’ 관심 확대","- 인천 부동산, 1년여 이어진 하락세 멈추고 상승 전환, 최근 4년 간 MZ세대 유입도 늘어  - 가격·거래 모두 상승한 미추홀구, 인천 회복의 중심으로 부상    인천 부동산 시장이 마침내 반등의 기지개를 켜고 있다. 11개월간 이어진 조정 흐름이 멈추며 집값이 상승 전환한 데 이어, 최근에는 MZ세대 인구 순유입까지 확대되면서 “회복 초입에 들어섰다”는 평가가 힘을 얻고 있다.  특히 가격과 거래량 회복이 동시에 나타나고 있는 미추홀구가 인천 반등의 중심 지역으로 부상하면서, 이 일대 역세권 신축 아파트에 대한 관심도 빠르게 높아지는 분위기다.  ■ 인천 아파트값, 11개월 조정 끝내고 상승 전환… MZ세대 유입에 효과  한국부동산원 아파트 매매가격지수에 따르면 인천 아파트값은 지난해 11월부터 올해 9월까지 11개월 연속 하락세를 기록했으나, 2025년 10월 전월 대비 0.08% 상승하며 하락 흐름을 멈췄다.  2024년 12월 –0.32%, 2025년 1월 –0.30% 등 큰 폭의 하락이 이어졌던 시기와 비교하면, 올해 들어 낙폭이 꾸준히 축소된 끝에 확인된 첫 상승 전환이라는 점에서 의미가 크다. 지역별로도 회복 흐름은 뚜렷하다. 미추홀구(0.14%), 동구(0.15%), 서구(0.09%), 중구(0.02%) 등 대부분 자치구가 동시에 플러스로 전환하며 인천 전반의 분위기 반등을 이끌었다.  이와 같은 인천 부동산 회복 흐름의 배경으로는 MZ세대(20~39세)의 순유입 증가가 주목받고 있다. 실제 리더스인덱스가 국가데이터처 자료를 바탕으로 분석한 자료에 따르면 인천은 팬데믹 이전 4년간(2018~2021년) MZ세대 547명이 순유출됐으나, 이후 4년간(2022~2025년)은 4만6245명이 순유입으로 전환돼 증가율이 8500%를 넘었다. 이는 서울 대비 합리적인 주거 비용, 수도권 접근성, 대규모 신축 공급과 생활 인프라 확충 등이 복합적으로 작용한 결과로 풀이된다.  업계에서는 이와 같은 MZ세대 유입 확대가 중장기적인 주거 수요 기반을 강화하며, 인천 부동산의 회복 국면의 지속 가능성을 높이는 요소로 작용할 것으로 보고 있다. 특히 직주근접과 교통 편의성을 중시하는 젊은 실수요자들의 특성상, 역세권 신축 단지로 수요가 집중되는 경향이 더욱 뚜렷해질 것이란 전망이다.  ■ 미추홀구 중심으로 거래 회복…하락폭 빠르게 축소∙거래량 증가  그런 가운데, 인천에서는 원도심 개발이 집중되고 있는 미추홀구가 가장 빠르게 회복 흐름을 보인 지역으로 꼽히고 있어 눈에 띈다.  실제 한국부동산원 자료에 따르면 미추홀구는 올해 초(1월) –0.23%에서 △2월 –0.14% △3월 –0.12%로 낙폭을 빠르게 줄이고, △4월 0.17% △5월 0.16%은 상승세를 보이기도 했다. 특히 미추홀구가 상승 전환을 보였던 4월의 경우는 인천 전체 아파트 가격이 -0.07% 하락하고 연수구가 –0.38% 하락했던 상황이어서 이와 대비된다.  거래량 증가도 두드러졌다. 미추홀구 아파트 매매거래량은 △2024년 12월 190건에서 △2025년 6월 기준 540건으로 약 180% 증가(2.8배)했다. 이는 같은 기간 인천 전체의 증가 속도(약 130%)보다 1.4배 빠른 회복세다.  현지 중개업소 관계자들은 “3월부터 급증한 거래량으로 저가 매물이 빠르게 소진됐고, 여름 이후에는 일부 단지 호가가 상승하며 거래가 이어졌다”며 “하반기에는 서울 규제지역 수요까지 유입되며 체감 시장 분위기가 완전히 달라졌다”고 설명했다.  ■ 회복세 탄 미추홀구, 신축 관심 확대 속 ‘인하대역 수자인 로이센트’에 이목 쏠려  이 같은 흐름에 미추홀구에서는 신축 단지에 대한 관심도 다시 확대되고 있다. 대표적으로 주목을 받는 곳은 (주)BS한양이 공급하는 ‘인하대역 수자인 로이센트’다.  인천광역시 미추홀구 용현학익 2-2블록 인하대역1구역 도시개발사업을 통해 선보이는 이 단지는 지하 2층~지상 최고 43층 규모, 전용 84~101㎡, 6개 동, 총 1,199세대로 조성된다.  인하대역 수자인 로이센트 미추홀구 내에서도 뛰어난 입지가 돋보인다. 특히 수인분당선 인하대역을 도보로 이용할 수 있는 역세권 단지로, 인하대역 인근의 대형마트, CGV, 상권 등 완성된 생활 인프라를 입주와 동시에 바로 누릴 수 있다.  또 도담공원과 다솜어린이공원, 용정근린공원, 용현도시농업공원 등 녹지공간이 가까워 쾌적성이 우수하며, 단지 바로 앞에 위치한 인천용학초와 용현중, 용현여중, 인항고 등 초·중·고교를 모두 도보로 통학할 수 있는 우수한 교육환경까지 갖춰 실거주 만족도가 높을 것으로 전망되고 있다.  이에 단지는 현재 미추홀구 용현동 일대에 자리한 견본주택에서 진행 중인 선착순 동·호수 지정 계약에 연일 수요자들의 발길이 이어지며 계약이 순항을 이어가고 있다는 게 주변 관계자들의 전언이다.  한 업계관계자는 “반등 초입에는 역세권·신축·대단지 위주의 선별적 상승이 먼저 나타난다”며 “인하대역 수자인 로이센트는 이러한 역세권·신축·대단지 장점과 함께 미추홀구의 중심 입지와 미래 호재 등으로 이번 회복장의 대표 단지로 부상할 가능성이 크다는 게 업계의 평가”라고 말했다.",https://n.news.naver.com/mnews/article/016/0002573837
2025-12-18 09:30:00,감정원부지 비즈니스 거점으로…공중보행로도 조성,"서울시 ‘건축계획·공공기여 계획(안)’ 열람공고 MICE·문화 복합공간 재탄생… 공공기여분 편의시설에 투입 탄천·한강 조망하는 선형 랜드마크 ‘도시고원’   강남구 한국감정원 부지가 마이스 비즈니스 거점으로 재탄생한다. 사진은 조감도. [서울시 제공]   [헤럴드경제=박병국 기자]서울 강남구 삼성동 옛 한국감정원 부지가 높이 38층 글로벌 비즈니스 거점으로 변신한다.  서울시는 19일부터 내달 2일까지 민간사업자인 삼성생명과 사전협상으로 합의한 옛 한국감정원 본사 부지(강남구 삼성동 171-2) 주민제안 지구단위계획 변경(안)을 열람공고 한다고 18일 밝혔다. 삼성생명은 서울시, 전문가와 함께 ‘협상조정협의회’를 구성, 지난해 8월부터 올해 9월까지 시와 합의한 내용을 담은 주민 제안서를 서울시에 제출했다.  이 부지는 지난 2013년 한국감정원이 대구로 이전하며 삼성생명이 매입한 땅이다. 건축 설계공모를 통해 지하 7층~지상 38층, 총 면적 12만6536㎡ 규모의 MICE·업무·스포츠·문화 복합 공간 계획돼 국제교류복합지구의 글로벌 경쟁력을 한층 높일 것으로 기대된다.  특히 기업 형태에 따라 500평 이상(1653㎡) 오피스를 가변형으로 활용할 수 있게 했다 .네트워킹에 활용할 수 있는 비즈니스 라운지, 다목적 업무공간 등도 조성해 입주 기업을 지원한다. 제3종일반주거지역(용적률 250%)→ 일반상업지역(용적률 800%) 용도지역 변경에 따른 공공기여분 3630억 원은 국제교류복합지구 지구단위계획구역 내 ‘우선 투입’ 원칙에 따라 영동대로 지하공간 복합개발에 투입된다.  도시고원 조감도. [서울시 제공]   서울시는 도시관리계획 변경 절차를 통해 이르면 내년 상반기 지구단위계획을 변경 결정하고, 민관 공공기여 협약서를 체결할 계획이다. 사업자는 건축 인허가 절차를 진행해 2027년 건축 착공, 2031년 준공을 목표로 사업을 추진한다.  옛 한국감정원 부지에는 탄천과 한강을 조망할 수 있는 공중 보행산책로도 조성된다. 약 700㎡ 규모 특화전시시설과 공중보행로가 이어진 ‘도시고원(Urban Plateau)’은 국제교류복합지구의 선형 랜드마크로 자리매김할 것으로 기대된다.  탄천변 건물 저층부는 수변가로 활성화를 위해 전면이 개방감 있게 계획됐다. 실내형 공개 공간, 스텝라이브러리, 컬처그라운드 등 열린 공간을 조성해 사계절 내내 날씨의 영향을 받지 않고 문화생활을 즐길 수 있는 체험 공간으로 제공할 예정이다.  실내형 공개 공간은 외부에서 자연스럽게 접근할 수 있는 개방 공간으로 조성된다. 스텝라이브러리는 경사진 지형을 활용해 계단식 쉼터이자 독서 활동을 즐길 수 있는 아늑한 문화 공간으로 꾸민다. 컬처그라운드는 개방형 로비에서 다양한 이벤트를 즐기며 소통하는 활력 공간으로 조성, 활용한다.  앞으로 해당 사업 부지가 코엑스~탄천~잠실종합운동장~한강까지 연결하는 주 보행축 연계 거점 역할을 할 수 있도록 부지 북측에 동서 방향을 이어주는 공공보행통로도 조성된다.  탄천 제방의 단차를 극복하고 안전한 보행환경을 조성하기 위해 유니버셜디자인을 적용, 유모차나 휠체어도 다니기 좋은 쾌적한 보행환경을 제공할 예정이다.  아울러 주변 교통 흐름과 영향을 고려해 테헤란로~사업 부지를 잇는 테헤란로113길 도로 폭을 기존 15m→ 20m로 확장하고, 현재 일방통행인 도로는 양방통행으로 변경한다.",https://n.news.naver.com/mnews/article/016/0002573836
2025-12-18 09:30:00,"‘이혼 소송 중’ 류중일 前며느리 가족, 몰래 홈캠 설치","[채널A 영상 캡처]   [헤럴드경제=민성기 기자] 류중일 전 야구대표팀 감독이 전 며느리가 제자와 부적절한 관계를 가졌다며 엄벌을 호소하는 청원을 올린 가운데, 사돈 가족이 아들 부부의 집에 카메라를 무단 설치한 혐의로 재판에 넘겨졌다.  17일 채널A 보도에 따르면, 류 전 감독 아들 류 모 씨는 지난해 5월 이혼 소송 제기 후 별거 당시 처남이 신혼집에 몰래 들어와 카메라를 설치했다면서 전 처남과 전 부인을 경찰에 신고했다.  홈캠이 설치된 장소는 류씨 부부의 신혼집이었다. 류씨의 전 아내 남동생과 장인이 카메라를 설치한 것으로 알려졌다. 해당 카메라는 영상 녹화와 음성 녹음이 가능한 모델이었다.  공개된 영상에는 이들이 카메라를 설치하고, 제대로 설치됐는지 휴대전화로 확인하는 모습까지 담겼다.  카메라가 설치됐을 당시 류씨 부부는 이혼 소송 중으로 신혼집은 비운 채 따로 살고 있었다. 류씨는 물건을 찾으러 집에 왔다가 종이 상자 속에 있는 카메라를 발견하고 경찰에 고소장을 접수했다.  류 씨는 전 처남이 감시 목적으로 동의 없이 집에 침입했고, 몰래카메라까지 설치했다며 전처도 함께 고소했다.  검찰은 약 1년 반 동안 수사한 끝에, 지난달 류 씨의 전 처남과 전 장인을 통신 보호법 위반 혐의로 재판에 넘겼다.  전 장인은 채널A에 “재판 중인 사안이라 말할 것이 없다”면서도 “가장 큰 피해자인 손주가 손가락질을 당할까 걱정된다”고 밝혔다.  한편 류 전 감독은 지난 4일 국회 국민동의청원 게시판에 ‘아동복지법 개선 및 수사 기준 강화 요구에 관한 청원’이라는 제목의 글을 올려 교사인 전 며느리 A 씨의 불륜 의혹을 폭로했다.  류 전 감독은 “민사재판에서도 두 사람(며느리와 제자)의 관계는 부적절하며 손자를 동행하는 ‘비윤리적인 행동’을 자행했다는 것이 인정됐다. 그럼에도 경찰과 검찰은 ‘증거불충분’으로 불기소 처분을 내렸다”고 지적했다. 그러면서 “이 사건은 반드시 바로잡아야 한다. 현재 전 며느리는 복직 준비까지 하고 있으며 교육청 역시 아무 문제 없다는 의견을 줬다”고 억울함을 호소했다.  앞서 서울남부지검 지난달 14일 아동학대처벌법과 아동복지법 위반 혐의를 받는 A 씨에게 혐의가 없다고 보고 불기소했다.  검찰은 경찰로부터 ‘혐의없음’ 의견으로 사건을 송치받은 뒤, A 씨 휴대전화를 압수해 분석하고 관련자를 재조사했지만, 혐의 인정이 어렵다고 보고 이러한 판단을 한 것으로 파악됐다.  A 씨를 고소·고발한 류 전 감독의 아들은 최근 검찰 결정에 불복해 항고장을 제출한 것으로 알려졌다.",https://n.news.naver.com/mnews/article/016/0002573835
2025-12-18 09:30:00,"“계기판 뒤 감쪽같이” LG이노텍, ‘차세대 언더 디스플레이 카메라’ 공개 [CES 2026]","자율주행 시대 운전자 모니터링 핵심부품 각광 AI로 화질저하 문제 해결…고급차 탑재 기대 카메라·라이다 등으로 2030년 매출 2조원 목표   LG이노텍 직원이 ‘차세대 언더 디스플레이 카메라 모듈’을 소개하고 있다. [LG이노텍 제공]   [헤럴드경제=김현일 기자] LG이노텍이 차량 계기판 뒤에 탑재되는 운전자 모니터링용 ‘차세대 언더 디스플레이 카메라 모듈(차세대 UDC)’을 내년 1월 미국 라스베이거스에서 열리는 CES 2026에서 최초 공개한다고 18일 밝혔다.  언더 디스플레이 카메라는 최근 자율주행 단계가 고도화하면서 운전자 모니터링 시스템의 핵심 부품으로 주목받고 있다. 졸음운전이나 시선이탈 등을 실시간 감지하고 모니터링하는 역할을 한다.  차량용 디스플레이 뒤에 숨겨져 외부에서는 보이지 않는 특징 때문에 고급차를 중심으로 언더 디스플레이 카메라 수요가 늘고 있다.  다만 카메라 앞을 차량용 디스플레이가 가리는 구조여서 화질 저하가 단점으로 지적됐다. 운전자의 표정, 눈 깜빡임, 움직임 등을 정확히 감지해야 하는 만큼 카메라의 화질 저하는 완성차 업체들이 언더 디스플레이 카메라 도입을 주저하는 요인이었다.  그러나 LG이노텍은 작년부터 LG디스플레이와 손잡고 1년 간 연구개발을 진행한 끝에 이 문제를 해결한 ‘차세대 UDC’를 업계 최초로 선보이게 됐다. 화질이 카메라 앞에 디스플레이 패널이 없는 상태에서 촬영했을 때와 99% 이상 비슷해 기존 화질 저하 문제를 사실상 완벽하게 해결했다는 설명이다.  LG이노텍은 자체 개발한 ‘AI 화질 복원 소프트웨어’를 적용해 화질 저하 문제를 해결했다고 밝혔다. AI 알고리즘을 통해 흐릿한 이미지 및 영상을 선명하게 만들어주고 촬영 시 발생한 노이즈를 제거하는 등 손상된 화질을 완벽히 복구해준다.  또한, 차량 디스플레이 패널 뒤에 깔끔하게 숨겨져 하이엔드 완성차 업체들로부터 높은 인기를 얻을 것으로 기대하고 있다.  LG이노텍 관계자는 “향후에는 ‘차세대 UDC’가 운전자뿐 아니라 탑승자, 색깔 등을 인식해 시트 조절, 내부 온도 설정 등 차량의 맞춤형 편의 기능을 지원할 수 있을 것”이라고 말했다.  LG이노텍은 이번 ‘차세대 UDC’로 차량 내∙외부를 아우르는 자율주행 센싱 설루션 라인업을 한층 강화할 수 있게 됐다. 차량 카메라 모듈∙라이다(LiDAR)∙레이더(Radar)를 융∙복합한 설루션을 앞세워 글로벌 시장을 빠르게 선점한다는 방침이다.  앞서 지난 7월 라이다 기술 선도 기업 미국 아에바와의 전략적 파트너십 체결에 이어 9월에는 4D 이미징 레이더 전문기업인 스마트레이더시스템에 전략적 지분 투자를 단행하는 등 자율주행 센싱 기술력 확보에 주력하고 있다.  문혁수 LG이노텍 대표는 “2030년까지 차량 센싱 설루션 사업 매출을 2조원 규모로 키울 것”이라며 “차별적 고객가치를 제공하는 혁신 부품을 지속 선보이겠다”고 밝혔다.",https://n.news.naver.com/mnews/article/016/0002573834
2025-12-18 09:29:00,한국관광공사-서울관광재단 5천명 오는 면역학회 유치,"서울, 초대형 마이스 유치 성공. 세계면역학회 주최 2024 국제학술대회 행사 사진[서울관광재단 제공]   [헤럴드경제=함영훈 기자] 한국관광공사, 서울관광재단, 대한면역학회는 2031년 제21차 세계면역학회 국제학술대회IUIS 2031)를 한국으로 유치하는 데 성공했다고 18일 밝혔다.  IUIS 2031은 3년 주기로 전 세계 면역학 전문가들이 모여 최신 연구 성과를 공유하는 국제 행사로, 글로벌 면역학계를 대표하는 최고 권위의 학술대회이다.  이번에 유치한 회의는 2031년 8월 24일부터 29일까지 서울 코엑스(COEX)에서 개최되며, 이를 통한 경제적 파급효과는 266억 원에 달할 것으로 기대된다.  1969년 세계면역학회가 설립된 이후 최초로 한국에서 개최되며, 전체 7000명 중 5000명 이상의 외국의 면역학 전문가들이 한국을 찾을 것으로 예상된다.  관광공사는 이번 유치를 위해 대한면역학회, 서울관광재단과 함께 유치위원회를 구성하고, 유치 전 단계에 걸쳐 재정적, 행정적으로 적극 지원해 왔다.  관광공사 박진호 MICE협력팀장은 “IUIS 2031의 한국 유치 성공은 한국의 뛰어난 면역학 연구 수준과 개최 지역의 우수한 인프라 강점을 적극 활용한 맞춤형 유치 전략 덕분”이라며 “앞으로도 맞춤형 전략과 관계기관 간 긴밀한 협력을 통해 대형 국제회의를 적극 유치하겠다”라고 밝혔다.",https://n.news.naver.com/mnews/article/016/0002573833
