날짜,제목,본문,링크
2025-12-19 11:27:00,공간·사람·정치…‘서울러’가 들려주는 ‘서울다움’,"이토록 서울 김진애 지음 창비   올해 전 세계를 휩쓴 넷플릭스 애니메이션 영화 ‘케이팝 데몬 헌터스’에선 주인공 루미와 진우가 달밤에 서울이 한눈에 내려다보이는 성곽길에서 만나 비밀을 고백하며 서로를 향한 마음을 전한다. 한국인이라면 어디서 본 듯한 이 배경은 서울 종로구의 낙산 성곽길을 모티브로 했다. 케데헌의 대흥행으로 낙산 성곽길은 이제 한국인뿐 아니라 세계인에게 알려진 ‘성지’가 됐다.  건축과 정치를 아우르는 도시전문가인 김진애 국가건축정책위원장이 서울을 입체적으로 그려낸 신간 ‘이토록 서울’을 출간했다. 세 살부터 서울과 함께 자라고 일해온 ‘서울러’이자 인사동길과 산본신도시를 설계한 건축가인 저자는 ‘공간·사람·정치’ 세 가지 키워드로 서울을 이야기한다.  서울은 한국의 수도이자 세계 도시의 위상을 갖춘 메트로폴리스다. 과거와 현재, 다양한 문화와 계층이 부딪히면서도 공존하는 복잡다단한 공간이자 미래가 꿈틀거리는 역동적 공간이기도 하다.  저자는 자신의 삶을 따라 서울 주요 공간의 진화를 짚어본다. 마포는 저자가 살아본 동네 중 가장 천지개벽한 곳으로 꼽는다. 1970년대만 해도 ‘새우젓 동네’로 불리다 여의도 개발이 시작된 후 마포대로에 ‘귀빈로’라는 이름이 붙었고, 줄줄이 고층건물이 세워지기 시작했다. 현대적 아파트의 효시로 불리는 아파트단지가 개발된 곳도 마포다. 이후 21세기 들어 상암에 월드컵경기장이 건립되고, 디지털미디어시티가 구축되면서 마포는 다시 한번 전기를 맞는다.  용산은 임진왜란, 병자호란 등을 통해 외세에 끊임없이 농락당한 슬픈 역사의 땅이다. 현대사에선 여러 정치 리더가 흔적을 남기려 시도했다. 윤석열 전 대통령은 대통령실을 용산으로 이전했고, 이후 비상계엄 선포를 거쳐 정치집회의 장이 됐다.  ‘부자동네’의 상징인 강남은 욕망과 허영이 공존하는 이중적 특징을 갖는다. 저자는 서울이 ‘아파트 공화국’보다도 ‘단지 공화국’이 된 것을 문제로 짚으며 그 발원지인 강남을 조명한다.  저자는 20세기 도시인의 대명사였던 뉴요커, 런더너, 파리지앵처럼 세계의 주목을 받게 된 ‘서울러(서울 사람)’와 ‘서울다움’이 무엇인지도 살펴본다. ‘도시 이미지’란 인위적인 공산물이 아닌 여러 동네의 다채로운 특색과 그곳의 사람들 이야기가 시간의 흐름 위에서 교차하며 탄생한다고 역설한다. 이어 ‘서울시장 이야기’를 통해 공간과 권력의 관계를 이야기한다. 민선 시장들이 남긴 공간 유산을 통해 그들의 업적과 과오를 분석한 뒤, 도시의 가장 절실한 문제에 대해 창의적인 해법을 찾아내고 시민의 의견을 듣는 시장이 필요하다고 강조한다.  서울의 곳곳이 돈과 권력의 소유물이 돼 가는 지금, 시민이 도시와 건축을 함께 만들어가고 누구나 그 공간을 자유롭게 활용할 수 있도록 하는 사회적 과정으로서 ‘공간 민주주의’가 절실하다고 저자는 주장한다. 김현경 기자",https://n.news.naver.com/mnews/article/016/0002574626
2025-12-19 11:26:00,한반도에 다시 ‘아기울음 커지는’ 희망을 찾아서,"인구에서 인간으로 이철희 지음 위즈덤하우스   “인구 문제 해결에 실패할 경우 한국은 세계 최초로 인구소멸을 맞는 국가가 될 것이다.”  세계적 인구학자인 데이비드 콜먼 옥스퍼드대 명예교수는 지난해 11월 서울에서 열린 SBS D포럼에서 섬뜩한 경고를 내놨다. 같은 시기 일론 머스크 테슬라 최고경영자(CEO)는 자신의 엑스(X·옛 트위터) 계정에 “세대마다 한국 인구의 3분의 2가 사라질 것이다. 인구붕괴”라는 글을 올렸다. 올해 2월 한국을 방문한 전설적 투자자 짐 로저스 로저스홀딩스 회장은 “뭐라도 하지 않으면 30년 뒤 한국은 없을 것”이라며 인구 문제를 투자의 가장 큰 걸림돌로 지적했다.  국내뿐 아니라 세계에서도 주목할 정도로 한국은 매우 심각한 인구 문제에 직면했다. 통계청 장래인구추계 중위 전망에 따르면, 2072년까지 한국의 인구는 현재 인구의 70% 수준인 3600만명으로 감소할 전망이다. 게다가 출생아 수 감소에 따른 급속한 인구고령화가 진행되면서 현재 20% 수준인 65세 이상 인구비율은 50년 이내에 48%로 올라가 고령인구 비율이 가장 높은 국가가 될 것으로 보인다.  한국은 인구 문제로 사라지는 국가가 될까. 30년 이상 인구경제학을 연구해온 이철희 서울대 경제학부 교수는 신간 ‘인구에서 인간으로’에서 한국은 아직 끝나지 않았다는 희망의 단초를 제시한다.  저자는 한국의 초저출산 문제에 대해 “제대로 된 공부와 담론이 여전히 부족하다”고 지적하면서 사람들이 모르거나 오해하는 내용에 대해 실증적인 데이터를 바탕으로 분석한다. 예컨대 정부의 출산지원금 정책의 효과가 전혀 없었다는 주장은 타당하지 않다고 지적한다. 저자가 지방자치단체(시군구)의 평균 출산지원금과 다음 연도 30세에 결혼한 유배우 여성의 합계출산율을 분석한 결과, 출산지원금 지급은 출산에 양(+)의 효과를 미치는 것으로 나타났다.  한국의 출생아 수 감소 원인에 대해선 여성 인구, 결혼, 출산 등 각 인구학적 요인과 교육비, 주거비, 일자리 등 경제적 요인, 성평등, 세대 간 격차 등 사회·문화적 요인에 따라 꼼꼼하게 들여다본다. 만혼과 비혼 증가로 기혼여성의 비율이 줄어든 것이 1990년대 초 이후 일관되게 출생아 수 감소 요인이었고, 최근엔 결혼을 하더라도 자녀를 낳지 않는 경향이 강화되고 있다. 여기에 경제적·사회적 불평등 심화와 일자리질 하락으로 인한 노동시장 및 교육의 경쟁과열, 지역 간 불균형 심화로 인한 집값 상승, 여성이 가정과 사회에서 직면하는 가정과 출산의 페널티 등은 저출산을 가속화했다.  책은 또한 지난 20년간 한국의 저출산 대응 정책에 대한 문제점을 살펴보는 한편, 어떻게 하면 더 잘할 수 있었을지를 생각해본다. 이어 아이가 줄어드는 사회의 미래를 전망한다. 분만실이 줄고 보육시설과 학교가 없어지는 등 장차 발생할 여러 사회·경제적 문제들을 진단한다.  이러한 미래의 모습을 바꾸기 위해선 정치 지도자가 국가와 국민을 위해 멀리 내다보는 좋은 정책을 일관되게 추진하는 것이 필수적이라고 저자는 강조한다. 저출산 문제의 표피를 건드리는 정책을 넘어 한국 사회의 뿌리 깊은 불평등과 경쟁을 완화하기 위한 노력을 기울여야 한다는 것이다.  한국이 처한 인구학적 상황이 엄중한 것은 맞지만 미래 또한 열려 있다. “아이들이 인간으로 존중받는 사회로 전환해야 한다”는 저자의 주장은 정부와 사회가 앞으로 어떤 방향으로 인구 정책을 도모해야 할지 모색하는 과정에서 새겨 볼 만한 대목이다. 김현경 기자",https://n.news.naver.com/mnews/article/016/0002574625
2025-12-19 11:26:00,HL만도 “2035년 온실가스 63% 감축”,"‘HL 2045 탄소중립 비전’ 공식화   HL만도가 글로벌 기후변화 대응 이니셔티브(SBTi)로부터 ‘2035년 온실가스 감축 목표’를 공식 승인 받았다고 19일 밝혔다.  이번에 승인을 받은 목표는 2023년 대비 2035년까지 사업장 직·간접 배출(Scope 1·2) 63% 감축, 공급망 간접 배출(Scope 3) 66.3% 감축을 골자로 한다.  HL만도는 SBTi 승인과 함께 2023년 선포한 ‘HL 2045 탄소중립 비전’도 공식화했다. 탄소중립 비전은 실질적 이행 단계 진입, 지속 가능 기업 증명과 함께 HL그룹의 지향점인 ‘보다 나은 삶’을 담아냈다.  HL만도는 지구 평균기온 1.5도 이내 상승 제한을 준수하기 위해, 탄소중립추진위원회를 운영하여 최고경영자(CEO)를 중심으로 전사적 노력을 기울이고 있다. 지난해 글로벌 사업장 전력 사용량의 약 15.1%를 재생에너지로 전환했고 전력구매계약(PPA)을 체결했다.  아울러 신재생에너지공급인증서(REC)를 구입해 전 세계 7개국 12개 주요 거점에 단계적으로 확대 도입하고 있다.  특히, 지난 2년간 Scope 1·2·3 배출 데이터 표준화, SBTi 요구 기준 검증 체계 구축 등 감축 관리 역량을 강화해 왔다. 또한, ESG(환경·사회·지배구조) 공시 의무화에 대비해 투명성·일관성·검증가능성을 갖춘 데이터를 확보하고 있다.  이 외에도 HL만도는 협력사 탄소 감축 프로그램 운영, 저탄소 원부자재 도입, 친환경 제품 설계, 온실가스 인벤토리 고도화 등 공급망 ESG 관리 수준을 높이기 위해 노력하고 있다. 권제인 기자",https://n.news.naver.com/mnews/article/016/0002574624
2025-12-19 11:26:00,한눈에 읽는 신간,"▶어차피 우리 집도 아니잖아(김의경·장강명·정명섭·정진영·최유안 지음, 현대문학)=“전세 사기 피해자가 3천 명이 넘는 것으로, 피해액도 3천억 원이 넘는 것으로 집계됐다. 피해자 수도, 피해 규모도 점점 증가하고 있었다.” 인간 생활의 3대 기본 요소인 의식주 중 ‘주(住)’는 우리 모두가 기본 요소로 누리고 있다고 선뜻 대답하기 어려운 현실이다. 김의경, 장강명, 정명섭, 정진영, 최유안 5인의 작가는 ‘집’과 ‘거주’에 대한 불편한 진실을 다섯 편의 소설로 풀어낸다. 집주인이 아니면 반려동물을 키울 자격조차 주어지지 않는 삶, 할 수 있는 안전장치를 다 갖춰도 속절없이 당하는 전월세 사기, 치솟는 집값, 계약서의 위선과 함정, 무너진 인간에 대한 신뢰…. 평범한 월급쟁이들의 자산 마련 수단으로 기능했던 전세가 끝나고 월세가 ‘뉴 노멀’이 된 시대에 ‘나의 이야기’가 될 수도 있는 가슴 저미는 현실을 가감 없이 보여준다.    ▶생각의 진화(미하엘 슈미트잘로몬 지음·이덕임 옮김, 추수밭)=정보의 홍수 속에서 우리는 오히려 그 어느 때보다 길을 잃기 쉬워졌다. 사실과 가짜, 중요한 것과 필요 없는 것 등을 더 구별하기가 어려워진 것이다. 저자는 ‘인류세’에 인간의 문제를 더욱 합리적으로 해결할 수 있는, 현대 세계관에 중요한 영향을 미친 10인의 사상가에게서 우리가 당면한 문제에 대한 올바른 결론을 내릴 수 있다고 주장한다. 더 나아가 삶과 세상을 바꾸는 ‘위대한 생각’을 이끌어낼 수 있다고 말한다. 저자가 선택한 10인은 찰스 다윈이나 아인슈타인, 마리 퀴리, 칼 세이건 등 과학자에만 국한되지 않는다. 에피쿠로스, 프리드리히 니체, 카를 마르크스, 카를 포퍼 등 사상가들도 포함된다. 저자는 이들이 연구한 분야는 각기 다르지만, 숱한 반대와 공격에도 기존의 통념을 깨고 나아갔다는 점에서 공통점을 찾을 수 있다고 했다. 그야말로 더 나은 세계를 위한 ‘10인의 인플루언서’인 셈이다.    ▶피벗 오어 다이(게리 샤피로 지음·이동기 옮김, 시공사)=불확실성이 일상화된 시대, 살아남는 기업과 사라지는 기업을 가르는 힘은 무엇일까. 세계 최대 정보기술(IT) 전시회인 CES(Consumer Electronics Show)를 40년 이상 진두지휘한 게리 샤피로 CTA(미국소비자기술협회) 사장은 명쾌하게 해답을 제시한다. 바로 피벗(Pivot). 방향을 잃지 않되, 방향을 고집하지도 않는 전략적 전환의 기술이다. 저자는 스타트업부터 글로벌 대기업, 정부 등에 이르기까지 이같은 혼란을 헤쳐 나갈 수 있는 생존 전략을 해부해 구체적으로 제시한다. 저자가 강조하는 피벗은 격렬한 혁신과 다르다. 본질은 남기고 경로만 조정하는, 무리하지 않는 변화다. 혼란 속에서도 지켜야 할 가치가 있고, 바꿔야 할 관성이 있다는 게 저자의 주장이다. 특히 저자는 미국 정부에 대해 ‘과잉 피벗’을 하는 정부 정책은 기술 산업을 오히려 혼란에 빠뜨리고 있다고 지적한다.",https://n.news.naver.com/mnews/article/016/0002574623
2025-12-19 11:26:00,이용욱 SK온 CEO “원가·제품·수주 경쟁력이 생존”,"SK온 ‘CEO 레코그니션’ 시상식 우수성과 조직·구성원 시상 격려     “치열한 시장 환경에서 생존하기 위해서는 원가 경쟁력에 제품 경쟁력을 더해 수주 경쟁력을 갖춰야 하고, 원가·제품·수주 경쟁력이 선순환하는 구조를 만들어야 합니다.”  19일 SK온에 따르면 이용욱(사진) SK온 최고경영자(CEO)는 전날 오후 서울 종로구 SK온 관훈캠퍼스에서 열린 ‘2025 CEO 레코그니션’ 행사에 참석해 한 해 동안 우수한 성과를 낸 구성원과 조직을 시상하고 격려하면서 이같이 강조했다.  CEO 레코그니션은 구성원의 자부심을 높이고 우수 성과와 창의적 경험을 공유하기 위해 마련된 공적 시상식이다. 2023년 신설된 이후 매년 이어지고 있다.  시상은 ‘온빌더스’와 ‘온프로너’ 등 2개 부문으로 나눠 진행됐다. 온빌더스는 도전적인 과제를 수행해 성과를 낸 팀과 프로젝트에 수여된다. 경영진 평가를 거쳐 10대 공적을 선정하고, 이 가운데 구성원 투표로 최우수 공적을 뽑는다. 온프로너는 협업 과정에서 모범이 된 개인에게 수여된다. 구성원 추천 및 투표를 통해 총 60명이 뽑혔다.  이 CEO는 마무리 발언에서 “올 한 해 쉽지 않은 경영 환경 속에서도 협력과 소통으로 의미 있는 성과를 일궈냈다”며 “내년 역시 도전적인 한 해가 될 것으로 보이지만, 현장에서 함께 쌓아온 경험을 바탕으로 충분히 극복해 나갈 수 있을 것”이라고 말했다. 서재근 기자",https://n.news.naver.com/mnews/article/016/0002574622
2025-12-19 11:26:00,류재철 LG전자 CEO 첫 일성은 ‘AX 가속화’,"취임 첫 전사 확대경영회의 개최 300여 임원 앞 성장전략 밝힐 듯 환율 등 대외변수 영향 논의 예상   LG전자가 19일 전사 확대경영회의를 개최한다. LG전자의 새 사령탑에 오른 류재철 최고경영자(CEO)가 주재하는 첫 공식 대규모 회의다. 이날 회의에서는 전사 차원에서 강조하고 있는 AX(인공지능 전환)를 비롯한 내년도 사업 전략 계획과 환율 등 대내외 불확실성에 대한 대응 논의가 이뤄질 전망이다.  연 2회(상·하반기) 개최되는 확대경영회의는 본사·사업본부 경영진과 해외 지역 대표, 법인장 등 약 300여명이 참여하는 자리다. 국내외 수뇌부가 모여 경영 현황을 점검하고 사업 추진 방향에 대해 의견을 공유하는 시간을 갖는다.  이날 확대경영회의는 지난달 새 CEO에 오른 류재철 사장이 처음으로 공식 키를 쥐고 회사 비전과 성장 전략에 대한 구상을 밝히는 자리가 될 전망이다. 류 사장은 단기 실적 관리, 중장기 성장동력 확보 등의 과제를 점검하면서 새해 운영 기조를 밝힐 것으로 보인다.  이날 회의의 최대 화두는 LG가 그룹 차원에서 강조하고 있는 AX가 될 것으로 예상된다. 구광모 LG그룹 회장은 지난 10일 그룹 내 CEO 약 40여명 참석한 사장단 회의에서 “생산력과 원가 경쟁력을 높이려면 AX 가속화에 몰입해야 한다”고 강조했다. 구 회장은 앞서 지난 9월 사장단 회의에서도 “중국 경쟁사들은 우리보다 자본, 인력에서 3~4배 이상의 자원을 투입하고 있다”며 AX 가속화를 강력히 주문했다. 이에 그룹의 대표 기업인 LG전자가 이에 대한 실행 플랜을 구체화하는 작업을 이어갈 것으로 보인다.  앞서 LG전자는 향후 2~3년 내에 업무 생산성을 30% 이상 높이겠다는 공격적인 목표를 수립한 바 있다. 류 사장은 취임 직후 첫 조직개편으로 기존 DX(디지털 전환)센터를 AX센터로 격상, R&D 뿐 아니라 마케팅, 공급망 등 전 밸류체인에 AI를 접목하는 역할을 맡겼다.  또 이날 회의는 사업부문별 목표와 달성 전략을 공유·독려하는 자리가 될 전망이다. 아울러 중국 가전의 공세와 수요 감소로 주춤하고 있는 가전·TV 사업의 돌파구 마련과 성장 엔진인 전장(VS)·냉난방공조(HVAC) 중심의 B2B 성장 가속, 가전 구독, 웹OS 플랫폼 등 사업에 대한 확장 방안도 논의될 것으로 보인다. 여기에 불안정한 외환시장에 따른 손익 영향 최소화에 대한 의견도 오갈 전망이다.  류 사장은 1989년 금성사 가전연구소로 입사해 36년간 가전업계만 몸담은 ‘가전 원로’이자 세탁기 개발자 출신으로 LG전자의 세탁기 신화를 쓴 엔지니어형 사업가다. 끊임없는 자기반성과 해결책을 제시하는 ‘문제 드러내기’와 ‘강한 실행력’ 등 류 사장의 강점이 전사로 확대되면 기술경쟁력 강화와 수익성 개선을 노릴 수 있다는 분석이 나온다.  박지영 기자",https://n.news.naver.com/mnews/article/016/0002574620
2025-12-19 11:25:00,"HD건설기계, 글로벌 8개 ‘권역장’ 체제 도입","HD현대건설기계·인프라코어 통합 영업본부 산하 지역별 컨트롤타워 ‘미래 사업’ 컴팩·AM 전담도 신설     오는 1월 공식 출범을 앞둔 HD현대그룹 건설기계 합병 법인 ‘HD건설기계’가 글로벌 시장 권역장 체제 도입을 골자로 한 조직 정비를 마무리했다. 선진국이나 신흥시장 등 시장 맞춤형 영업 전략을 펼쳐 합병 시너지를 극대화한다는 계획이다.  19일 헤럴드경제 취재에 따르면 내년 출범 예정인 HD건설기계는 최근 조직 개편을 마쳤다.  가장 큰 변화는 글로벌 주요 시장별로 담당 조직을 두는 ‘권역장’ 체제 도입이다. 영업 본부 아래 권역별 조직을 통해 각 시장 특성에 맞는 전략을 짠다는 취지다.  권역 조직은 북미, 유럽, 인도, 중남미, 중동·아프리카 등 8개 시장으로 나눠 신설했다. 권역장은 상무급이 맡아 영업부터 생산까지 시장별 판매 전략을 총괄한다. 산하에는 HD건설기계 두 브랜드인 ‘HYUNDAI’와 ‘DEVELON’를 전담하는 팀을 둔다. 합병 전 법인인 HD현대건설기계와 HD현대인프라코어가 각각 운영하던 브랜드다. HD건설기계 관계자는 “각 브랜드의 영업망과 서비스망 시너지를 극대화할 것”이라고 설명했다.  건설장비 외에 수익 모델을 다변화하기 위한 조직 개편도 이뤄졌다. HD건설기계 미래 사업인 컴팩(소형 건설장비)와 AM(After Market·판매 후 사후관리) 사업도 전담 조직을 별도로 구성했다. 컴팩 사업 부문은 컴팩개발팀·컴팩패키지레이아웃팀·컴팩영업팀·컴팩기획팀 등으로 구성했다. 기존에 영업 부문에 속해있던 AM 사업도 AM·PS(Product Service·유지보수, 수리 등 고객 서비스) 조직으로 분리했다.  HD건설기계는 2030년까지 컴팩 사업은 매출 1조3000억원, AM 사업은 1조4000억원까지 성장시킨다는 계획이다. 합병 후에는 해외에 흩어져 있는 부품관리센터 통합 운영, AM 전용부품 개발 등에 본격적으로 나선다.  HD현대 건설기계 부문은 지난 7월 HD현대건설기계와 HD현대인프라코어의 합병을 발표했다. 통합 법인인 HD건설기계는 글로벌 14위권 규모로 올라서게 된다. HD건설기계는 양사 합산 매출(8조원)을 2030년까지 14조8000억원까지 끌어올리겠다는 목표를 세웠다.  그동안 두 회사는 굴착기 등 생산 제품군이 대동소이해 사실상 같은 사업을 영위해 왔다. HD현대건설기계는 2017년 현대중공업에서 독립한 법인이다. HD현대인프라코어는 대우에서 두산으로 인수된 후 2021년 HD현대 품에 안겼다. 이후 양 법인이 그룹 내 한 지주사 아래 운영되다 사업 효율화를 위해 통합이 결정됐다.  HD건설기계 관계자는 “시장 수요에 보다 기민하게 대처하고, 미래 기술력 및 원가 경쟁력을 확보할 것”이라며 “‘HYUNDAI·DEVELON’ 듀얼 브랜드 체제를 통해 사업 전 영역의 고른 성장으로 글로벌 톱티어 수준 매출을 달성할 것”이라고 말했다.  박혜원 기자",https://n.news.naver.com/mnews/article/016/0002574619
2025-12-19 11:25:00,"“北, 올해 3조원 규모 가상화폐 탈취…지난해 1.5배 규모”","체이널리시스 보고서 “IT인력 침투 등 수법…중국어권 서비스로 돈세탁”  북한 김정일 국방위원장 사망 14주기를 맞아 평양 만수대언덕을 비롯한 각지의 김일성·김정일 동상에 당·정권·무력기관, 조선인민군, 사회안전군 부대, 각급 기관·기업소·대학 등의 명의로 꽃바구니와 꽃다발을 진정했다고 조선중앙통신이 18일 보도했다. [AFP]   [헤럴드경제=김영철 기자] 북한 해커들이 올해 20억달러(약 3조원) 규모의 가상화폐를 탈취했다는 분석이 나왔다.  미국에 본사를 둔 블록체인 분석 기업 체이널리시스는 18일(현지시간) 이 같은 내용의 보고서를 홈페이지에 공개했다.  보고서에 따르면 올해 세계 가상화폐 업계 전체 탈취 규모는 34억달러로, 북한 해커의 탈취액은 전체의 59%, 개인 지갑 침해를 제외한 서비스 침해 규모의 76%에 해당한다.  북한의 가상화폐 탈취액은 지난해보다 51%가 늘어나, 북한이 가상화폐 보안의 중대한 위협이 되는 국가로 자리 잡았다고 보고서는 평가했다.  지금까지 알려진 북한의 누적 가상화폐 탈취액은 67억5000만달러로 집계됐다.  북한이 올해 저지른 가장 큰 규모의 가상화폐 탈취는 지난 2월 북한 해킹 조직 라자루스가 가상화폐 거래소 바이비트(Bybit)를 상대로 15억 달러 상당의 가상화폐를 빼돌린 해킹 사건이다.  올해 알려진 북한의 가상화폐 탈취 건수는 예년보다 적었지만, IT(정보통신) 인력을 가상화폐 서비스 업체에 침투시켜 시스템 접근권을 얻는 수법 등을 통해 건당 탈취 규모는 더 커졌다고 보고서는 분석했다.  특히 북한 연계 해킹 조직들은 IT 인력을 직접 취업시키는 데서 나아가 유명 웹3 및 AI(인공지능) 기업의 채용 담당자를 사칭해 ‘기술 면접’을 한다며 피해자의 자격 증명, 소스 코드, 접근 권한 등 현재 근무 중인 회사의 민감한 정보를 탈취하는 방식을 쓰고 있다고 체이널리시스가 전했다.  북한은 이렇게 탈취한 대부분의 가상화폐를 상대적으로 소규모인 50만 달러 이하로 쪼개 이동시켜 자금 세탁을 하는 것으로 나타났다. 특히 중국어 기반 자금 이동·지급보증서비스 등 중국어권 돈세탁 서비스를 많이 사용하며, 탈취된 가상화폐는 약 45일 만에 세탁 과정이 마무리될 수 있다고 보고서는 설명했다.  앤드루 피어만 체이널리시스 국가 안보 정보 총괄은 블룸버그통신과이 이메일 인터뷰에서 가상화폐 탈취가 북한의 자금 조달을 위한 수익사업이 됐다며 “해킹을 통해 얻은 자금이 북한 정권과 대량살상무기 프로그램을 강화할 것”이라고 말했다.",https://n.news.naver.com/mnews/article/016/0002574618
