날짜,제목,본문,링크
2025-12-19 09:59:00,"부산시-MS, 데이터센터 아카데미 첫 수료생 28명 배출","부산시와 마이크로소프트가 협력해 추진한 ‘마이크로 소프트 데이터센터 아카데미(MS DCA)’ 1기 교육생 28명의 수료식이 19일 오후 열린다. 사진은 부산시청 전경{부산시 제공]   [헤럴드경제(부산)=이주현 기자] 부산시는 19일 오후 수영구 호메르스 호텔에서 글로벌 정보기술(IT) 기업 마이크로소프트(MS)와 협력해 추진한 ‘마이크로 소프트 데이터센터 아카데미(MS DCA)’ 1기 교육생 28명의 수료식을 개최한다고 밝혔다  ‘마이크로소프트 데이터센터 아카데미’는 지난 9월부터 운영된 데이터센터 전문 인력 양성 프로그램으로, 서버·네트워크·클라우드 분야 이론과 실습을 포함한 총 450시간의 실무 중심 무료 교육 과정이다. 이번 수료생 28명은 해당 교육과정을 성공적으로 이수한 청년 인재들로 이 가운데 다수는 (재)부산정보산업진흥원이 운영한 ‘그린데이터센터 전문 인력 양성 교육’과 연계해 참여했다.  이날 수료식에서는 교육생들이 5개 팀으로 수행한 프로젝트 성과 발표회도 함께 열렸으며, 우수 프로젝트 1개 팀에 ‘부산광역시장상’이 수여된다. 팀별 프로젝트는 ▷게임 서버 호스팅 서비스 ▷외국인 관광객 전용 시각체험형 관광지도 플랫폼 ▷하이브리드 클라우드 기반 티켓팅 시스템 구축 등 클라우드·네트워크 분야의 현장성을 반영한 실무형 과제로 구성됐다.  이날 프로젝트 성과 발표를 포함한 교육 성과를 종합적으로 평가해 부산마이크로소프트 데이터센터 현장 인턴십 참여자 6명을 이달 말 선발할 예정이다. 선발된 교육생은 내년 1월부터 3개월간 부산 마이크로소프트 데이터센터에서 근무하며 현장 실무 경험을 쌓게 된다.  시는 해당 인턴십이 향후 정규 취업으로 연계될 수 있는 발판이 될 것으로 기대하며, 나머지 수료생들에게도 기업 채용 정보 제공 등 취업 지원을 지속해 나갈 계획이다. 한편 시는 내년 상반기 중 ‘마이크로소프트 데이터센터 아카데미’ 2기 교육생 모집할 계획이다.  조정명 마이크로소프트 동북아시아 지역 데이터센터 커뮤니티 총괄은 “마이크로소프트는 지역 인재 육성과 지속 가능한 디지털 기반시설 확충을 통해 커뮤니티와 함께 성장해 나가고 있으며, 부산 청년들이 글로벌 데이터센터 기술 인재로 성장할 수 있도록 지속적으로 지원하겠다”고 밝혔다.",https://n.news.naver.com/mnews/article/016/0002574477
2025-12-19 09:59:00,"“하루13시간, 주7일 일했다” 5년만에 3억 번 20대 배달기사","중국에서 5년간 배달 일을 하며 3억원을 벌어 2억원 넘게 저축한 20대 배달 기사가 화제다. [소셜미디어 갈무리]   [헤럴드경제=김보영 기자] 중국에서 5년간 배달 일을 하며 약 3억원을 벌고 이 중 2억원 이상을 저축한 20대 배달 기사의 사연이 화제다.  18일 홍콩 사우스차이나모닝포스트(SCMP)에 따르면 주인공은 올해 25세인 장쉐창으로, 그는 2020년 중국 최대 배달 플랫폼에서 일하기 위해 상하이로 향했다.  장씨가 배달 일을 시작하게 된 계기는 고향 푸젠성 장저우에서 친구와 함께 운영하던 음식점을 정리하면서 떠안은 약 5만위안(약 1000만원)의 빚이었다. 생계를 위해 선택한 배달 일이 그의 인생을 바꿨다.  장씨는 지난 11월 말 소셜미디어를 통해 “5년간 총 140만위안(약 3억원)을 벌었고, 생활비를 제외한 112만위안(약 2억3600만원)을 저축했다”고 밝혔다. 그는 배달 수입으로 빚을 모두 갚았다고 전했다.  비결은 ‘성실함’이었다. 장씨는 하루 평균 13시간, 주 7일 근무하며 오전 10시 40분부터 다음 날 새벽 1시까지 배달을 이어간다. 한 달 평균 처리하는 주문은 300건 이상이며, 주문 1건당 소요 시간은 약 25분이다. 지금까지 누적 배송 거리는 약 32만4000㎞에 달한다.  그는 “체력을 유지하기 위해 하루 8시간 반 정도는 반드시 잠을 잔다”면서도 “휴무는 춘절 연휴 며칠이 전부”라고 말했다. 이러한 근무 태도로 그는 동료들 사이에서 ‘주문왕(Order King)’이라는 별명을 얻었다.  장씨가 근무하는 배달센터 소장은 “그는 말이 적고 오로지 배달에만 집중한다”며 “걷는 모습을 거의 본 적이 없고 늘 뛰어다닌다”고 전했다. 이어 “열심히 일하면 돈을 벌 수 있는 업계이지만, 장씨처럼 성실하면서도 극도로 검소한 사례는 드물다”고 평가했다.  장씨는 “생활필수품 외에는 거의 돈을 쓰지 않았다”며 “열심히 일해 빚을 갚고 많은 돈을 모은 것에 만족한다”고 말했다. 그는 내년 상반기 80만위안(약 1억6000만원)을 투자해 상하이에 아침 식사 전문점 두 곳을 열 계획이라며 재도전에 대한 의지도 밝혔다.  이 사연은 중국 온라인 커뮤니티에서도 큰 반향을 일으켰다. 누리꾼들은 “정말 대단하다”, “젊은이들의 좋은 본보기”라며 찬사를 보냈다. 반면 “목숨 걸고 번 돈이라 따라 해선 안 된다”, “사실인지 의심된다”는 반응도 나왔다.",https://n.news.naver.com/mnews/article/016/0002574476
2025-12-19 09:58:00,나경원 “말 안한다 했잖아요”…‘천정궁 가셨냐’ 질문에 ‘발끈’,"[연합]   [헤럴드경제=김주리 기자] 나경원 국민의힘 의원이 ‘통일교 접촉설’에 휘말린 가운데 통일교 본산인 ‘천정궁’ 방문 여부와 관련해 즉답을 피했다.  나 의원은 17일 CBS라디오 ‘김현정의 뉴스쇼’에 출연해 “저희(국민의힘)는 통일교 관련해서는 두 가지 특검을 주장한다“며 ”하나는 통일교와 관련된 의혹을 밝히는 특검이고 또 하나는 민중기 특검이 8월 초에 진술을 받고 수사하지 않았다는 전 전재수 장관 관련된 것부터 해서 특검이 왜 수사를 뭉갰는지 이 두 가지 특검을 반드시 해야 되지 않느냐”고 반문했다..  진행자가 나 의원에게 ‘윤 전 본부장이 천정궁에 온 걸 봤다고 진술한 의원 명단에 나 의원, 정동영 통일부 장관 등도 있었다’는 진행자 언급에 나 의원은 “참 어이가 없다는 말씀 이상 더 드릴 게 없다”고 답했다.  ‘천정궁에 가기는 가셨나’라는 진행자의 추가 질문에도 나 의원은 “제가 더는 말씀 안 드리겠다고 말씀드렸죠”라고 말했다.  앞서 나 의원은 윤 전 본부장이 특검에 진술한 통일교 관련 여야 정치인에 자신이 포함된 데 대해 “저질 물타기 정치공작”이라는 입장을 밝힌 바 있다. 경기 가평군 소재 종교 시설인 천정궁은 통일교의 본부 격으로, 한학자 통일교 총재가 머무르는 곳으로 알려져 있다.  이와 관련 한민수 더불어민주당 의원은 이날 페이스북에 글을 올려 “천정궁 관련 답변은 왜 얼버무리느냐”며 “이러니 국힘당의 통일교 특검 주장이 정치공세 그 이상도 이하도 아니라고 하는 것이다. 당당하면 국가수사본부 수사에 응하라. 내란 그리고 김건희 물타기 정도껏 하라”고 말했다.  통일교의 정치권 로비 의혹 사건을 수사중인 경찰청 국가수사본부 특별전담수사팀은 전재수 전 장관과 더불어민주당 임종성 의원, 김규환 전 미래통합당 의원 등 3명을 피의자로 입건하고 출국금지를 조치했다. 나 의원과 정 장관은 입건되지 않은 상태다.",https://n.news.naver.com/mnews/article/016/0002574475
2025-12-19 09:57:00,"신한운용, 원전산업펀드 2종 자펀드 연내 결성","총 1000억원 이상 규모로 조성   [신한자산운용 제공]   [헤럴드경제=신주희 기자] 신한자산운용은 위탁운용 중인 원전산업성장펀드의 자펀드 운용사들이 연내 펀드 결성을 완료할 것이라고 19일 밝혔다.  원전산업성장펀드는 올해 3월 제10차 정책금융지원협의회에서 발표된 원전산업성장펀드 조성 계획에 따라 총 1000억원 이상의 규모로 조성된다. 정책자금 700억원과 민간자금 300억원이 투입되며, 원전 산업을 영위하는 중소·중견기업과 소형모듈원자로(SMR) 관련 기업에 중점 투자될 예정이다.  원전산업성장펀드의 모펀드 운용사인 신한자산운용은 올해 6월 자펀드 운용사로 인라이트벤처스와 브이엘인베스트먼트를 선정했다. 각 운용사는 500억원 이상 규모로 연내 펀드 결성을 마무리할 예정이다.  이 가운데 인라이트벤처스가 운용하는 ‘인라이트 에너지 첨단산업 벤처펀드’는 18일 결성총회를 개최, 총 535억원 규모로 결성을 먼저 완료했다.  조성호 신한자산운용 실장은 “원전산업에 특화된 정책펀드 조성을 계기로 SMR 등 국내 원전산업 경쟁력 강화를 위한 투자가 본격화될 것으로 기대한다”고 말했다.",https://n.news.naver.com/mnews/article/016/0002574474
2025-12-19 09:56:00,"“내 집 재건축인데, 방 한 칸 늘리는데 7억” 개포 억소리 분담금, 펜트는 77억 [부동산360]","개포주공6·7단지 15일부터 조합원 분양신청 추정 추가분담금, 53㎡→84㎡ 최대 7억원대 147㎡ 펜트 선택 시 최소 69억~최대 77억원   서울 강남구 개포동 개포주공7단지 모습. [네이버지도 거리뷰 갈무리]   [헤럴드경제=신혜원 기자] 서울 강남권 재건축 대어로 꼽히는 ‘개포주공6·7단지’ 정비사업의 추정 추가분담금이 공개됐다. 조합원의 소유 면적, 선택 평형에 따라 다르지만 소형 타입을 보유한 조합원이 국민평형이라 불리는 84㎡(이하 전용면적)을 분양받으면 7억원대 분담금을 내야 하는 것으로 나타났다. 펜트하우스를 선택할 시 분담금은 최대 77억원대로 늘어나게 된다.  19일 정비업계에 따르면 서울 강남구 개포동 개포주공6·7단지 재건축정비사업조합은 지난 15일부터 내년 1월 20일까지 조합원 분양신청을 진행한다. 이에 따라 조합원들에게 주택형별 추정 추가분담금, 설계안, 단위세대 계획안 등이 담긴 안내서를 배포했다.  조합이 제시한 추정분담금 표를 구체적으로 살펴보면 공사비 3.3㎡(평)당 890만원, 비례율 79.89%를 적용해 산출했다.  6단지의 경우 53㎡를 보유하고 있는 조합원의 예상 추가분담금은 45㎡A·B로 면적을 좁혀 분양받을 시 약 4억3000만원을 환급받을 수 있다. 같은 조합원이 면적을 넓혀 택한다면 ▷59㎡ 최대 1억9353만원 ▷75㎡ 최대 5억5203만원 ▷84㎡ 최대 7억2343만원 ▷100㎡ 최대 11억2733만원 ▷110㎡ 최대 12억9903만원 ▷119㎡ 15억1853만원을 분담금으로 납부해야 한다.  기존에 6단지 83㎡를 갖고 있던 조합원이라면 환급 범위는 더욱 넓어진다. 75㎡까지는 분양받아도 최소 3875만원에서 최대 10억2875만원을 돌려받게 된다. 그러나 비슷한 면적인 84㎡를 택하면 1억원대 분담금을 내야 하고, 100㎡로 넓혀가면 분담금은 5억원대로 뛴다. 일반 타입 중 가장 큰 119㎡를 분양받으면 9억2775만원의 분담금이 나오게 된다. 7단지 또한 6단지와 비슷한 수준으로 책정됐다.  서울 강남구 개포동 개포주공6·7단지 재건축정비사업조합이 최근 조합원들에게 안내한 추정분담금 표. [독자 제공]   최근 고가 아파트에 필수적으로 조성되는 펜트하우스의 경우 분담금은 천문학적으로 커진다. 개포주공6·7단지는 펜트하우스를 ▷138㎡A 2가구 ▷138㎡B 2가구 ▷147㎡ 3가구 등 총 7가구를 조성할 계획인데 조합원이 이를 분양받을 시 분담금은 70억원대다. 7단지 53㎡를 보유한 조합원이 가장 큰 면적의 펜트 타입을 선택하면 분담금은 77억5418만원을 내야한다. 7단지 83㎡를 가진 조합원이라면 71억6971만원을 납부하게 된다.  이 같은 추정 추가분담금은 향후 사업 진행과정, 공사비 인상 여부에 따라 변동될 전망이다. 일부 조합원 사이에선 조합 추산 추가분담금에 대해 “애초 예상되던 분담금보다 증가했다”며 불만의 목소리가 나오는 분위기다. 이에 조합 관계자는 조합원들에게 “타 단지의 경우 일반분양 수익을 대형타입 위주로 잡아 계산했지만, 개포주공6·7단지는 소형타입을 선택할 조합원이 많지 않을 것이라고 판단해 일반분양 수익에 소형타입이 많이 포함됐다”며 “평당 공사비 또한 890만원으로 높은 편이라 분담금 상승은 있을 수밖에 없다”고 설명했다.  개포주공6·7단지는 재건축을 통해 지하 5층~지상 35층, 21개 동, 총 2698가구 규모로 탈바꿈한다. 현대건설이 자사 하이엔드 브랜드인 디에이치(THE H)를 적용한 ‘디에이치 르베르(THE H Le Vert)’를 단지명으로 제안해 올해 5월 시공사로 선정됐다. 스카이라운지를 비롯해 커뮤니티 시설을 개포 최대 규모로 조성해 단지 고급화를 이루겠단 목표다.  한편 개포주공6·7단지와 양재천을 사이에 둔 대치동 ‘은마아파트’도 지난 10월 추정 추가분담금이 공개되며 시장의 관심을 받았다. 76㎡를 보유한 조합원이 동일평형 아파트를 분양받으면 2억3000만원을 내야 하고, 84㎡는 4억7000만원, 109㎡는 12억2000만원, 128㎡는 17억9000만원으로 분담금이 책정됐다. 펜트하우스는 143㎡를 택할 시 37억4000만원, 286㎡를 분양받으면 97억3000만원을 내야하는 것으로 추산됐다. 이를 바탕으로 평형 설문조사를 진행했는데 100억원에 가까운 분담금에도 286㎡를 선택한 조합원은 12명에 달했다.",https://n.news.naver.com/mnews/article/016/0002574473
2025-12-19 09:56:00,한중정상회담 채비 나선 李대통령…1월 방중·방일 가능성,"안중근 의사 유해 송환 ‘사전 의제’ 지시 한중 외교차관 전략대화로 ‘사전 답사’ 중일 갈등 격화 속 신년 ‘실용외교’ 시작   이재명 대통령이 직접 한중 정상회담 사전 의제 논의를 언급하면서 방중 채비에 나선 것으로 풀이된다. 지난 11월 시진핑 중국 국가주석을 환송하는 이 대통령. [이재명 대통령 SNS]   [헤럴드경제=문혜현 기자] 이재명 대통령이 직접 한중 정상회담 사전 의제 논의를 지시하면서 내년 첫 순방 일정으로 중국 방문에 나설지 주목된다.  19일 대통령실에 따르면 한중 정상회담 일정은 아직 확정되지 않았다. 다만 최근 한중 외교차관 전략대화가 개최되고 이 대통령도 한중 정상회담을 언급하면서 사실상 채비에 나선 것 아니냐는 분석이 나온다.  전날 이 대통령은 국방부·국가보훈부 업무보고에서 안중근 의사 유해봉환 사업과 관련한 보고를 듣고 “(한중) 정상회담 사전에 의제로 미리 논의해 달라”고 주문했다. 이어 권오을 국가보훈부 장관이 “중국 협조를 얻어 최대한 위치라도 추적할 수 있게 현지 출장을 가서 파악하겠다”고 보고하자 이 대통령은 “유해 발굴·송환의 경우 중국과의 협의가 중요하다. 조만간 중국과 (정상회담을 통해) 다시 만나게 될 가능성이 있다”고 재차 언급했다.  이 대통령은 지난 11월 1일 경주 아시아태평양경제협력체(APEC) 정상회의 계기 국빈방한한 시진핑 중국 국가주석과 정상회담한 바 있다. 시 주석이 올해 한국을 찾은 만큼 이 대통령도 내년 중 방중할 가능성이 있다.  특히 한중 정상회담의 경우 다양한 외교 절차가 필요해 다소 시간이 걸리지만, 같은 날 박윤주 외교부 1차관이 중국 베이징을 방문하면서 이 대통령의 1월 방중 가능성이 더욱 커지고 있다.  박 차관은 전날 마자오쉬 중국 외교부 상무부부장과 제11차 한중 외교차관 전략대화를 열고 서해 문제를 비롯한 한반도 정세를 논의했다. 이번 전략대화는 지난해 7월 서울에서 열린 9차 회의 이후 베이징에서 이어진 것으로, 사실상 한중 정상회담의 ‘사전 답사’ 성격으로 해석된다. 이 자리에서 박 차관은 중국 측과 이 대통령의 방중 일정과 정상회담 의제 등을 논의했을 것으로 보인다.  이 대통령이 1월 중국을 방문할 경우, 11월 선전에서 열리는 APEC 정상회의까지 포함해 내년 최소 두 차례 중국을 찾을 것으로 보인다. 이 대통령이 내년 4월 도널드 트럼프 미국 대통령의 중국 방문에 앞서 방중한다는 점도 눈길을 끈다. 이 대통령은 시 주석을 만나 북한과 대화 재개 여건 조성을 위한 역할을 당부하고 안보 현안을 논의할 전망이다.  이 대통령은 아울러 방중 이후 다카이치 사나에 일본 총리와 약속한 ‘셔틀외교’에도 나설 것으로 예상된다. 이 대통령은 지난 10월 말 한일 정상회담에서 다카이치 총리의 고향인 나라현 나라시에서 만나자고 제안한 바 있다.  이 대통령의 방중·방일은 새해 첫 ‘실용외교 시험대’가 될 전망이다. 다카이치 총리의 ‘대만 유사시’ 발언으로 중일관계가 급속히 얼어붙으면서 한중일 정상회의가 무산되는 등 긴장이 높아지고 있기 때문이다. 이 대통령은 중국과 일본 등 방문을 통해 역내 외교 균형을 모색할 것으로 관측된다.",https://n.news.naver.com/mnews/article/016/0002574472
2025-12-19 09:53:00,8년 만에 다 바꾼 이마트24…업계 돌풍 일으킬까 [르포],"서울 마곡프리미엄점 경영주 대상 상품설명회 “2026년 비전 축약” 전략 담은 ‘프로토타입’  체류 시간 늘린 설계·차별화 상품군 대폭 강화 “가맹점 매출 상승 이어지는 선순환 만들 것”   이마트24 마곡프리미엄점 내부 모습 [이마트24 제공]   [헤럴드경제=김진 기자] “마곡프리미엄점은 2026년 이마트24의 비전을 축약해 놓은 곳입니다.”  이상일 서울 경기북부 3권역 팀장은 18일 오후 서울 강서구 이마트24 마곡프리미엄점에서 경영주(점주) 10여명을 대상으로 열린 ‘2026년도 상품 설명회’에서 “앞으로 수익을 추가 창출하는 데 도움이 되길 바란다”며 이같이 말했다.  이달 초 문을 연 마곡프리미엄점은 새롭게 단장한 이마트24를 보여주는 ‘프로토타입’ 매장이다. 전신인 ‘위드미’ 편의점을 이마트24로 리브랜딩한 이후 8년 만에 선보이는 일종의 모델하우스다. 간판부터 내부 인테리어까지 밝은 노란색과 주황색, 흰색을 활용해 가시성을 높이고 화사한 분위기를 연출했다. 테이블·선반에는 곡선을 적용해 편안한 느낌을 극대화했다.  약 50평 규모인 매장 동선은 고객의 ‘체류 시간 증대’에 초점을 맞췄다. 머무르는 시간을 늘려 구매를 유도하는 전략이다. 입구 앞에 인기 상품 매대를 설치하고, 선반의 코너 모서리인 ‘엔드 캡’에 디저트·건강식품 등 주력 상품을 배치했다. 이마트24의 차별화 상품인 ‘서울대빵’ 시리즈, 유명 셰프와 협업한 도시락 등이다.  냉동·냉장, 주류·음료, FF(신선식품), 디저트로 이어지는 ‘프레시레인’은 직선형 배치를 활용해 개방감을 줬다. ‘투 고 카페’ 존에는 자체브랜드인 ‘성수310’의 커피·베이커리 제품을 전략적으로 배치했고, 즉석커피와 과일 스무디를 즐길 수 있도록 했다. 인기 있는 제품의 주목도를 높일 수 있는 상품군별 ‘진열 포인트’도 설계해 경영주들과 공유했다.  이마트24 마곡프리미엄점 코너 모서리인 엔드 캡에 차별화 상품을 모은 ‘셰프 라인업’, ‘서울대빵’ 등 디저트가 배치됐다. 김진 기자   많은 상품이 진열된 만큼 방문객의 이해를 돕기 위한 장치도 곳곳에서 두드러졌다. 예를 들어 와인 코너에는 상품마다 유명 와인 앱 ‘비비’의 평점과 주요 특징을 적은 인식표가 부착됐다. 라면 코너도 맵기와 상품별 특징에 따라 구매할 수 있도록 분류됐다.  이날 경영주들은 “신제품 단가는 어느정도냐”, “반응이 좋은 ‘인절미콘’ 같은 상품을 더 많이 만들어 달라”며 적극적으로 의견을 냈다. 서울 성북구 R종암래미안점을 운영하는 임순혁 씨는 설명회 직후 “트렌드를 볼 수 있으니까 좋더라”며 “재고가 다 팔린 뒤 새로 발주 넣을 때 참고하려고 한다”고 말했다. 또 “대대적인 리뉴얼이란 게 체감됐다”며 “체류 시간을 늘려서 객단가를 높이겠다는 부분이 인상적이었다”고 했다.  상품설명회는 16~18일(1차), 23~24일(2차) 진행된다. 마곡프리미엄점을 비롯해 광주, 대전, 부산 등 전국 7개 권역의 프로토타입 매장에서 실시된다. 설명회에는 총 380여명의 점주들이 참여한다.  [이마트24 제공]   이번 이마트24의 변신은 ‘만년 업계 4위’의 부진을 털고 도약하기 위한 것이다. 올해 1~3분기 누적 적자가 226억원에 달했고, 점포 수가 손익분기점인 6000개 미만으로 줄었다. 최근에는 부장급 이상 직원을 대상으로 창사 이후 첫 희망퇴직을 실시했다.  이마트24는 매장 전략과 제품 혁신을 통해 돌파구를 찾겠다는 목표다. 올해 차별화 상품 400종을 선보인 데 이어, 내년 600종을 추가 출시할 계획이다. 이를 위해 올해 ‘트렌드 연구소’를 신설하고 AI(인공지능) 기반 상품 기획 시스템을 도입하기로 했다. 경영주들이 차별화 상품을 부담 없이 발주할 수 있도록 신상품 도입 시 인센티브를 지원하고, 대표 상품에 대해서는 100% 폐기 지원을 운영한다.  지난달 선보인 식품·생활용품 자체브랜드인 ‘옐로우’(ye!low)의 트렌드 상품을 늘리고, 자체 와인 브랜드인 ‘꼬모’(COMO)는 리뉴얼을 통해 내년 상품 12종을 순차 출시할 예정이다.  명수영 이마트24 영업기획팀 팀장은 “외형적인 변화뿐만 아니라 우수한 상품 경쟁력을 바탕으로 실질적인 가맹점 매출 상승으로 이어지는 선순환 구조를 만드는 게 골자”라며 “앞으로도 화제성과 수익성 측면에서 경영주의 만족도를 높일 수 있는 운영 전략과 상품 개발에 전력을 다하겠다”고 말했다.",https://n.news.naver.com/mnews/article/016/0002574471
2025-12-19 09:52:00,“조훈현 기록 63년만에 넘었다”…9살 프로바둑기사 유하준 군,"왼쪽부터 표현우 초단, 유하준 초단[한국기원 제공]   [헤럴드경제=김성훈 기자] 조훈현 9단은 1962년 9세 7개월 5일의 나이로 프로바둑기사에 입단해 최연소 입단 기록을 보유해왔다. 이 기록이 63년만에 깨졌다.  한국기원은 18일 오후 성동구 마장로 사옥에서 열린 제3회 12세 이하 입단대회 본선 4회전에서 표현우(12)와 유하준(9)이 최종 관문을 통과했다고 밝혔다.  이번 입단 대회는 2013년 이후 출생한 만 12세 이하 본원 연구생 및 지역 연구생 총 55명이 출전해 두 자리를 놓고 더블일리미네이션 방식으로 경쟁했다.  표현우는 마지막 4회전에서 오세현과 유하준을 연파하고 먼저 프로 입단에 성공했다. 이어 유하준이 이서준과 마지막 대국에서 승리해 입단 자격을 획득했다.  유하준의 입단 나이는 만 9세 6개월 12일이다. 종전에 조훈현 9단이 보유했던 최연소 입단 기록을 갈아치우게 됐다.  유하준 초단은 “최종국 중반 패싸움에서 이득을 본 뒤 그때부터 입단을 확신했다”며 “최연소 프로 입단 기록을 경신할 수 있어 기쁘고, 신진서 9단처럼 강한 전투력을 가진 프로기사가 되겠다”고 말했다.  표현우 초단은 “입단해서 정말 기분이 좋고, 신진서·박정환 9단 같은 프로기사로 성장하고 싶다”며 “농심신라면배 세계바둑최강전에 한국 대표로 출전해 10연승 하는 게 목표”라며 포부를 밝혔다.  한국기원 소속 프로기사는 유하준, 표현우를 포함해 총 456명(남자 366명·여자 90명)이다.",https://n.news.naver.com/mnews/article/016/0002574470
