날짜,제목,본문,링크
2025-12-03 09:45:00,‘선장은 단 한번도 조타실에 나오지 않았다’ 신안 여객선 좌초 사고 60대 선장 구속 [세상&],"사고구간서 ‘조타실 지휘 의무’ 내버린 혐의 여객선 취항 이후 한 번도 조타실서 안 나와   승객 246명과 승무원 21명 등 총 267명을 태운 퀸제누비아2호는 지난달 19일 오후 8시17분께 전남 신안군 장산면 장산도 남방 족도에 좌초했다. 해경은 구조본부를 가동하고 여객선 승객들을 경비함정으로 이동시키며 사고 발생 3시간10분 만인 오후 11시27분께 267명 전원을 구조했다. [연합]   [헤럴드경제=이용경 기자] 전남 신안군 앞바다에서 좌초 사고가 난 대형 카페리 여객선 퀸제누비아2호의 선장이 구속됐다. 3일 해양경찰에 따르면 중과실치상, 선원법 위 등 혐의로 입건된 60대 선장 A씨에 대한 구속영장이 전날 법원에서 발부됐다.  A씨는 여객선 좌초 사고 당시 협수로 구간에서 조타실 지휘 의무를 방기한 혐의를 받는다.  앞서 승객 246명과 승무원 21명 등 총 267명을 태운 퀸제누비아2호는 지난달 19일 오후 8시17분께 전남 신안군 장산면 장산도 남방 족도에 좌초했다. 변침(방향 전환) 구간에서 방향 전환을 하지 않고 통상적인 항로를 이탈하면서다.  출동한 해경은 구조본부를 가동하고 여객선 승객들을 경비함정으로 이동시키며 사고 발생 3시간 10분 만인 오후 11시27분께 267명 전원을 구조했다. 이 가운데 30명은 통증을 호소해 병원에서 치료받았다.  해경의 조사 결과 선장 A씨는 퀸제누비아2호 취항 이후 사고 해역을 1000여차례 지나면서 단 한 번도 조타실로 나오지 않은 것으로 드러났다. 사고 당일에도 마찬가지였다. A씨는 선원법에 따라 협수로 항해 시 선장으로서 직접 지휘해야 하지만, 조타실에 가지 않고 선장실에서 휴식한 것으로 조사됐다.  전날 광주지법 목포지원에서 열린 영장실질심사에 출석한 A씨는 “승객들에게 죄송하다고 생각한다”고 말했다.  한편 사고 당시 자동항법장치에 선박 조종을 맡기고 휴대전화를 보는 등 임무를 소홀히 한 일등항해사 B씨와 인도네시아 국적 조타수 C씨는 중과실치상 혐의로 검찰에 구속 송치됐다.  해경은 당시 항로 이탈 알람을 켜놓지 않은 사고 해역 관제사 D씨도 업무상 과실치상 혐의로 입건해 조사하고 있다.",https://n.news.naver.com/mnews/article/016/0002566451
2025-12-03 09:44:00,"현대글로비스, 한국기업평가 신용등급 AA+로 상향…“재무건전성 강화”","AA에서 한 단계 상향 국내외 신용평가사에서 최상위권 신용등급 획득   현대글로비스 CI   [헤럴드경제=서재근 기자] 현대글로비스는 국내 3대 신용평가회사 가운데 하나인 한국기업평가로부터 평가받은 기업신용등급이 ‘AA’에서 ‘AA+’로 한 단계 상향됐다고 3일 밝혔다.  그동안 현대글로비스 신용등급을 AA로 평가했던 한기평은 이번 수시 평가에서 외형 확대와 우수한 재무건전성을 높이 평가하고 가장 높은 등급 ‘AAA’ 다음인 AA+를 부여했다.  신용등급 AA+는 재정 건전성 등이 최고 수준이라는 것을 의미한다. 한국기업평가는 사업부문별 고른 매출 성장에 따른 영업실적 개선을 핵심으로 꼽았다. 특히 해운 사업에 주목하며 “올해 들어 해운부문의 이익창출력이 크게 개선되며 전사 수익성이 향상됐다”고 평가했다.  그러면서 “인프라 경쟁력 강화를 위한 투자 확대에도 실질적 무차입 구조의 매우 우수한 재무 안정성을 유지하고 있다”며 “자금소요가 확대되겠으나 보유 유동성과 현금창출력을 바탕으로 차입부담을 통제하며 우수한 재무 안정성을 유지할 것으로 판단한다”고 설명했다.  현대글로비스는 잇따라 국내외 신용평가사로부터 우수한 평가를 받고 있다. 올해 초 국제 신용평가사 무디스의 평가에서 신용등급 전망이 ‘안정적(Stable)’에서 ‘긍정적(Positive)’로 상향 조정됐다. 무디스가 기업신용등급 전망을 안정적에서 긍정적으로 조정한 것은 향후 12~18개월 사이에 기업 신용등급 상향 검토가 가능해진다는 것을 의미한다.  지난해 12월에는 국내 신용평가사인 한국신용평가로부터 기업신용등급 ‘AA+’를 받았으며, 나이스신용평가로부터도 우수한 신용등급인 ‘AA’를 유지하고 있다.  현대글로비스는 우수한 신용등급을 기반으로 글로벌 물류시장에서 영향력을 확대하겠다는 계획이다.  현대글로비스 관계자는 “재무 건정성을 기반으로 사업의 지속 가능성을 확보하고 있다. 앞으로도 책임 있는 경영과 전략적 실행을 통해 글로벌 경쟁력을 강화하며 주주 및 이해관계자의 기대에 부응해 나갈 것”이라고 말했다.",https://n.news.naver.com/mnews/article/016/0002566450
2025-12-03 09:44:00,"셀트리온, 美서 ’옴리클로’ 300㎎ PFS 제형 허가 획득","‘세계 첫 졸레어 시밀러’ 지위 이어 ‘PFS 풀라인업’ 확보…시장 선도 가속   만성 특발성 두드러기 치료제 ‘옴리클로(성분명 오말리주맙)’. [셀트리온 제공]   [헤럴드경제=최은지 기자] 셀트리온은 미국 식품의약국(FDA)으로부터 만성 특발성 두드러기 치료제 ‘옴리클로(성분명 오말리주맙)’ 300㎎ 프리필드시린지(PFS∙사전충전형주사제) 제형 허가를 추가 획득했다고 3일 밝혔다.  옴리클로는 이로써 오리지널 의약품과 동일한 3종의 PFS 용량 제형(75㎎, 150㎎, 300㎎)을 모두 갖추게 돼 본격적인 환자 맞춤형 투약이 가능하게 됐다. 이번에 추가 승인된 300㎎ PFS 고용량 제형은 단일 투여로 더 많은 약물량을 전달할 수 있어, 기존 저용량 제품을 여러 번 투약 받아야 했던 환자들에게 치료 편의성을 크게 높이고 투약에 대한 심적 부담도 낮춰줘 처방 선택 폭을 넓히는 중요한 계기가 될 전망이다.  셀트리온은 옴리클로 300㎎ PFS 제형에 대해 지난달 초 유럽 승인을 획득한데 이어 미국에서도 승인을 받으면서, 글로벌 오말리주맙 시장의 약 89%를 차지하는 미국과 유럽에서 오리지널 의약품과 동일한 PFS 제형의 전체 용량 라인업을 단독으로 확보한 유일한 바이오시밀러 공급사가 됐다. 이제 옴리클로도 환자 상태에 따른 용량별 맞춤 투약이 가능해지면서 제품 경쟁력과 처방 선호도도 한층 높아질 전망이다.  글로벌 주요 시장에서 옴리클로에 대한 ‘퍼스트무버(First Mover)’ 지위를 확보한 데 이어 단독으로 오리지널 제품과 동일한 용량 구성의 PFS 제품 라인업까지 갖추게 돼, 보다 빠른 속도로 시장을 선점할 수 있을 것으로 기대하고 있다. 미국과 유럽 시장내 후속 경쟁 제품 중에서는 현재까지 PFS 전 제형 라인업을 확보한 공급사가 없다.  옴리클로는 지난해 5월과 올해 3월 각각 유럽과 미국에서 시장 최초로 졸레어 바이오시밀러 허가를 획득했다. 이후 유럽(EC)은 물론 호주, 브라질 등 주요 국가에서 잇따라 출시를 완료하며 본격적인 글로벌 시장 공략에 나섰다.  유럽에서는 직판 경쟁력을 기반으로 출시 이후 3분기까지 누적 매출 약 470억원을 기록했으며, 최근 독일∙스페인∙영국∙프랑스 등 주요 국가에도 퍼스트무버로 출시하면서 시장 점유율을 빠르게 확대하고 있다.  옴리클로의 오리지널 의약품인 졸레어는 만성 특발성 두드러기, 천식 등 치료제로 지난해 기준 글로벌 매출 약 6조4992억원을 기록한 제품이다.  셀트리온 관계자는 “이번 옴리클로 300㎎ PFS 용량 제형 추가 허가 획득으로 미국 환자들에게 새로운 치료 옵션을 제공할 수 있게 됐다”며 “시장 내 PFS제형 제품 라인업을 모두 확보해 환자별 다양한 사례에 따른 맞춤형 처방이 가능해진 만큼 제품 경쟁력을 바탕으로 글로벌 시장 점유율 확대에 최선을 다할 것”이라고 말했다.",https://n.news.naver.com/mnews/article/016/0002566449
2025-12-03 09:42:00,성평등부 예산 2조원 넘었다…‘역대 최대’ [세상&],"올해 예산 대비 13.0% 증가   서울 종로구 정부서울청사에서 성평등가족부 현판 설치 작업이 이뤄지고 있다. [연합]   [헤럴드경제=전새날 기자] 성평등가족부는 2026년도 부처 예산이 2조87억원으로 확정됐다고 3일 밝혔다. 올해(1조7783억원) 대비 2303억원(13.0%) 늘어난 규모다.  내년도 예산은 성평등부(여성가족부) 출범 이래로 역대 최대 규모다. 예산이 2조원대를 넘은 것도 이번이 처음이다. 최근 5개년 예산(본예산 기준)은 ▷2021년 1조2325억원, ▷2022년 1조4650억원, ▷2023년 1조5678억원, ▷2024년 1조7234억원, ▷2025년 1조7777억원이다.  정부가 당초 제출한 예산안은 1조9996억원이었으나, 국회 예산 심의 과정에서 91억원이 증액되면서 2조원을 넘겼다.  디지털 성범죄가 급증하면서 중앙디지털성범죄피해자지원센터 인력 증원 등에 14억원이 증액됐다. 가정폭력·성폭력·스토킹 피해자 무료법률지원 확대 9억원, 성착취 피해 아동·청소년 치유·회복을 위한 지역전담지원센터 사업비 2억원 등도 증액됐다.  청소년상담 1388 상담 대기시간 단축을 위한 온라인상담인력 증원 4억원, 미디어 과의존 청소년 치유프로그램 확대 2억원, 노후화된 청소년복지시설 개보수 지원 예산 4억원이 증액됐다.  아이돌봄 지원법 개정에 따라 내년부터 시행되는 아이돌봄사 국가자격제도 운영을 위한 관리시스템 구축예산 54억원도 반영됐다.  정책 분야별로는 성평등정책(2908억9700만원), 청소년정책(2690억3900만원), 가족정책(1조3999억 2700만원), 행정지원(487억9900만원)을 확정했다.  원민경 성평등가족부 장관은 “내년도 성평등가족부 예산은 안전하고 성평등한 사회 조성, 아이돌봄 및 한부모 지원 강화, 청소년의 건강한 성장 지원에 중점을 두고 편성했다”라며 “사회 구성원 모두가 행복하고 성평등한 사회에서 더 나은 삶을 누릴 수 있도록 여건 조성에 힘쓸 것”이라고 말했다.",https://n.news.naver.com/mnews/article/016/0002566448
2025-12-03 09:40:00,"글랜우드PE, 아랍 국부펀드 무바달라 손잡고 ‘나노H2O’ 공동 투자[투자360]","LG [연합]   [헤럴드경제=심아란 기자] 국내 사모펀드(PE) 운용사 글랜우드프라이빗에쿼티(이하 글랜우드PE)와 아랍에미리트(UAE) 아부다비 기반 국부펀드 무바달라투자회사(이하 무바달라)가 나노H2O(전 LG화학 워터솔루션 사업부)의 공동 투자를 최종 완료했다고 3일 밝혔다.  나노H2O는 2014년 LG화학 사업부로 출범했다. 서울에 본사를 두고 있으며 해수 및 기수(해수와 담수 혼합수) 담수화용 역삼투(RO) 분리막 분야 글로벌 선도 기업이다. 역삼투 방식은 열처리 방식보다 에너지 효율이 높아 대규모 담수화에 널리 쓰인다. 전 세계 지자체와 산업체를 고객으로 매출의 95% 이상을 해외에서 올리며 글로벌 물 수요 확대에 대응력을 갖추고 있다.  이상호 글랜우드PE 대표는 “이번 나노H2O 투자는 대기업 내 비핵심 또는 저핵심으로 분류된 우량 사업을 발굴해 사업부문 분할(카브아웃)을 통해 가치를 높여온 글랜우드의 투자 철학을 보여주는 사례”라며 “무바달라 등 공동 투자자들과 함께 나노H2O가 전 세계 물 문제 해결을 위한 지속 가능한 솔루션을 확대하고 지속적인 성장과 글로벌 영향력을 강화하는 데 적극적으로 지원할 것”이라고 밝혔다.  모하메드 알바드르(Mohamed Albadr) 무바달라 아시아 총괄은 “나노H2O의 기술력과 장기 성장 가능성에 강한 확신을 갖고 있다”며 “이번 투자는 글로벌 문제 해결에 기여하는 기업과 파트너십을 맺는 무바달라의 전략과 맞닿아 있으며 한국과 아시아 시장 전반에 대한 우리의 장기적인 투자 의지를 보여준다”고 밝혔다.  이어 “글랜우드와의 협력을 통해 나노H2O의 성장과 글로벌 선도 기업으로서의 위상을 공고히 하는 데 지원할 것”이라고 덧붙였다.  압둘라 모하메드 샤디드(Abdulla Mohamed Shadid) 무바달라 에너지·지속가능성 총괄은 “물 안보와 탈탄소화가 전 세계적으로 최우선 과제로 부상하는 가운데,역삼투압 멤브레인은 에너지 효율적으로 대규모 물 공급을 가능하게 하는 핵심 기술”이라며 “나노H2O는 검증된 기술력과 글로벌 네트워크, 교체 수요 기반 비즈니스 모델을 갖춰 차별화된 경쟁력을 보유하고 있다”고 말했다.  아울러 그는 “이번 투자를 통해 나노H2O가 중동·북아프리카(MENA) 지역을 포함한 글로벌 주요 시장의 수요 확대에 대응하고 장기적 가치 창출을 이어가도록 기여할 것”이라고 강조했다.",https://n.news.naver.com/mnews/article/016/0002566447
2025-12-03 09:40:00,"기후부 내년 예산 19조원, 9.9%↑…재생에너지 금융 지원 98.6%↑[2026년도 예산]","재생에너지 보급 37.1% 증가...서해안에너지고속도로 120억원 책정 물난리 예방 위한 예산 늘려…가습기살균제 문제 해결 100억원 편성  기후부 현판   [헤럴드경제=배문숙 기자] 재생에너지 중심의 에너지체계 대전환을 위해 태양광, 해상풍력 등을 위한 금융지원이 올해보다 100%가량 확대된다.  또 내년에 내연기관차를 전기차로 바꿀 경우 정부가 보조금을 100만원 추가 지급하기 위해 1775억원이 투입된다.  기후에너지환경부는 국회 예산 심의를 통해 올해 17조4351억원보다 9.9% 증가한 19조1662억원으로 확정됐다고 3일 밝혔다. 정부안보다는 최종 379억원 증액 조정된 규모다.  분야별로 보면 에너지(36.4%), 자원순환(14.8%), 자연환경(13.5%), 물관리(12.0%), 환경·에너지일반 등(11.2%) 순으로 예산 증가 폭이 컸다.  내년도 기후부 예산 증가 부문은 산업통상부로부터의 에너지 업무 이관에 따른 것으로 재생에너지 전환을 위한 지원이 크게 늘었다. 재생에너지 보급을 가속화하고 분산 전원을 제어하는 차세대 전력망을 구축해 재생에너지 중심의 에너지체계 대전환 이행을 뒷받침한다는 게 기후부 계획이다.  우선, RE100 산업단지와 영농형 태양광, 해상풍력 확대 등을 위한 금융지원 예산은 내년에 6480억원 편성하면서 올해(3263억원)와 비교해 98.6% 확대했다.  재생에너지 보급지원 예산은 1564억원에서 2143억원으로 37.1% 증가했다. 서해안 에너지고속도로를 조기 구축하기 위한 고압직류송전(HVDC) 기술 개발 예산은 올해 추경 편성에 이어 내년에 120억원을 책정했다.  또 기후부는 전기·수소차 전 차종의 구매보조금 단가를 올해와 동일하게 책정했다. 전기차의 경우 1대당 보조금 단가가 승용차 300만원, 버스(일반) 7000만원, 화물차 1억원이다. 수소차는 승용차 2250만원, 시내버스와 광역버스 각 2억1000만원과 2억6000만원, 트럭 2억5000만원 등이다.  기후부는 2011년 공공부문부터 전기차 보조금 지급한 이래 자생력 유도를 위해 보조금을 매년 깎았다.  그러나 최근 전기차 화재 등으로 보급세가 꺾이자 내년에는 보조금 규모를 그대로 유지하기로 했다. 추가로 내년에 휘발유차 등 내연기관차를 폐차하거나 팔고 전기차로 교체할 경우 보조금을 최대 100만원 추가 지급한다.  이렇게 되면 내년 전기차 구매 보조금은 사실상 인상되는 셈이다. 정부는 내년 ‘전기차 전환 지원금’ 예산으로 1775억원을 신규 편성했다.  전기차 안심보험도 신설한다. 화재로 인한 전기차주의 배상책임 우려를 해소하기 위해서다. 전기차 안심보험 예산으로는 20억원을 새로 책정했다.  탈탄소 정책의 일환으로 일회용품 사용이 많은 지역축제, 카페, 야구장 등에는 다회용기 보급지원 사업을 확대하기로 했다 다회용기 보급사업 예산은 올해 100억원에서 내년 157억원으로 증액됐다.  사회복지시설의 전기효율향상을 위한 히트펌프 설치 등 지원 사업 예산은 내년에 13억원 신규 편성했다.  매년 반복되는 도시 침수로 인한 인명피해를 막기 위한 예산도 늘렸다. 도시침수 예보체계 시범운영을 위해 내년 예산에 25억원을 새로 편성했고, 맨홀 추락방지 시설 20만7000개 설치에 1104억원을 책정했다.  지류·지천의 홍수 예방을 위한 국가하천정비 예산은 올해 688억원에서 863억원으로 25.5% 늘렸다. 대심도 빗물터널 및 지하방수로 투자 예산은 199억원으로 올해(130억원)보다 33.0% 확대했다.  김성환 기후부 장관은 “국민이 편성된 재정사업의 성과를 체감할 수 있도록 집행 관련 사전 준비를 철저히 하고, 내년도 예산의 차질 없는 집행에도 최선을 다하겠다”고 강조했다.",https://n.news.naver.com/mnews/article/016/0002566445
2025-12-03 09:39:00,"미닉스 미니 김치냉장고 ‘더 시프트’, 품절 대란에 추가 생산 결정","1~3인 소가구·주류 애호가 선호 미니멀 인테리어 트렌드에 맞춰   미닉스 미니 김치냉장고 ‘더 시프트’ [앳홈 제공]   [헤럴드경제=최은지 기자] 앳홈의 공간의 가능성을 넓히는 가전 브랜드 ‘미닉스(Minix)’는 자사의 신제품 미니 김치냉장고 ‘더 시프트(The Shift)’가 공식 출시 두 달 만에 초기 생산분 수천여 대가 모두 판매되며 전 채널에서 품절되었다고 3일 밝혔다.  출시 직후부터 예상을 넘어선 주문량이 이어지면서 지난 11월 29일 기준 모든 판매 채널에서 판매가 일시 중단됐으며, 예약 및 재입고 알림 역시 급증해 ‘품절 대란템’으로 자리 잡았다.  미닉스는 11월 말 즉시 추가 생산에 돌입, 현재 12월 11일 순차 출고를 목표로 주문을 받고 있다. 일부 판매 채널은 자체 확보 물량을 통해 판매를 진행 중이다.  이에 대해 미닉스는 더 시프트의 주요 구매층이 1인 가구뿐 아니라 2~3인 소규모 가구, 취미용 냉장고를 찾는 주류 애호가, 세컨드 냉장고를 선호하는 미니멀 라이프스타일 소비층 등으로 확대되며 예상보다 넓은 타깃에서 판매가 빠르게 증가했다고 설명했다.  미닉스 ‘더 시프트’는 두 뼘 크기의 360㎜ 슬림한 폭, 김치 6포기를 보관할 수 있는 39L 용량, 도서관 수준의 저소음 설계, 직접 냉각·냉기 순환 팬·듀얼 센서 인버터 온도 제어 기술을 기반으로 정밀 냉각 기능을 갖췄다.  이 제품은 김치를 대량으로 저장하기보다 소량을 신선하게 보관하는 최근의 김치 라이프와 부피가 큰 가전보다 공간에 알맞게 어울리는 가전을 선호하는 미니멀 인테리어 트렌드와 맞물려 좋은 평가를 받고 있다.  미닉스 브랜드 관계자는 “출시 두 달도 되지 않아 초기 생산분이 모두 판매되며 전 채널 품절이 발생했다”며 “ 원활한 공급을 위해 생산 일정을 최대한 앞당기는 등 많은 소비자분들이 ‘더 시프트’를 경험할 수 있도록 노력하고 있다”고 말했다.",https://n.news.naver.com/mnews/article/016/0002566444
2025-12-03 09:38:00,전남 광양만권특화단지에 배터리 제조사 유치 총력,"호남권 ‘핵심광물(원료)･양극재’ 중심  광양만권(여수·순천·광양)에 포스코 이차전지 제조 공장이 입주해 있다.   [헤럴드경제(광양)=박대성 기자] 전라남도가 정부의 ‘케이(K)-배터리 경쟁력 강화 방안’ 발표에 발맞춰 ‘광양만권 이차전지 특화단지’에 배터리 제조사 유치에 총력을 기울이기로 했다.  앞서 정부는 호남, 영남, 충청을 잇는 ‘배터리 삼각 벨트’ 구축을 제시하고 이 가운데 호남권은 ‘핵심 광물(원료)･양극재’ 중심의 중심 거점으로 특화하겠다는 계획을 밝혔다.  또한 니켈･리튬 등 기초원료 생산을 집중적으로 지원하는 신규 이차전지 특화단지 추가 지정을 추진하고 연내에 공모 절차를 진행할 예정이다.  전남도는 정부의 정책 방향이 K-배터리 산업의 핵심 과제로 떠오른 원료(핵심 광물) 공급망 강화와 직결되는 만큼, 광양만권을 ‘원료소재 니켈, 리튬–기초소재 전구체–재활용’으로 이어지는 전주기 생태계 구축을 목표로 특화단지 유치 전략을 고도화할 방침이다.  그동안 전남도는 이차전지 산업 육성과 특화단지 유치를 위한 준비 작업을 선제적으로 준비했다.  실제로 ▷이차전지 산업 육성·지원을 위한 관련 조례 제정 ▷광양만권 이차전지 특화단지 육성계획 초안 작성 ▷이차전지 특화단지 협의체와 TF를 구성·운영해 자체 대응 역량을 강화했다.  앞으로도 ▷지차체–유관기관-기업 간 공모 대응과 협력 강화를 위한 협의체 ▷전력·용수·폐수·도로 등 핵심 인프라 확충을 포함한 특화단지 육성 계획 구체화 ▷기업 수요 기반의 전문인력 양성 ▷중앙정부·국회·산업계와의 협력 채널 상시화 등 이차전지 특화단지 강점을 살려 배터리 제조사를 유치하는데 총력을 기울일 계획이다.  전남도는 이차전지 정책에 대한 공감대 확산과 홍보를 위해 오는 22일 서울 국회에서 ‘광양만권 이차전지 특화단지 유치 토론회’를 개최해 공모 대응자료와 대정부 건의에 적극 활용키로 했다.",https://n.news.naver.com/mnews/article/016/0002566442
