date,title,article,url,산업
2025-11-24,[시승기] 서킷서도 안정적 주행감·포르쉐보다 나은 사운드…GV60 마그마,"""포르쉐 타이칸도 몰아봤지만, GV60 마그마가 성능이 더 뛰어난 점도 있고 운전하기도 매우 편해요. 거기에다 이 가상 사운드는 정말 '진짜' 같아요"" (제네시스 마그마 레이싱(GMR) 드라이버 다니엘 훈카데야)
21일(현지시간) 오전 눈밭이 날리는 프랑스 남부 르 카스텔레의 폴 리카르 서킷.
출범 10주년을 맞은 현대차 고급 브랜드 제네시스는 1969년 개장해 F1(포뮬러원) 개최 이력까지 있는 이곳에서 고성능 프로그램 '마그마'의 월드 프리미어를 열고 'GV60 마그마'를 처음 공개했다.
마그마의 첫 양산품으로 향후 제네시스의 10년을 이끌 선봉이 될 GV60 마그마 동승 시승을 위해 남프랑스에서만 부는 세찬 바람인 '미스트랄'을 맞으며 5.8㎞의 서킷을 찾았다.
직접 본 GV60 마그마는 기존 GV60보다 전폭은 넓어지고, 전고는 낮아져 한 눈에도 레이스카 면모를 보였다.
F1이나 내구레이스에 출전하는 레이스카는 강한 출력과 민첩한 응답성을 위해 승차감을 희생하는 경우가 많다.
하지만 '럭셔리 고성능'을 지향하는 제네시스 마그마 모델들은 승차감 개선에도 큰 노력을 기울였고, 그 노력이 차체 비율에도 반영이 된 듯싶었다.
다만 루프라인과 연결된 윙 타입의 리어 스포일러는 뿔을 연상시키는 모습으로 미관상으로는 합격점을 주긴 어려웠다.

헬멧을 쓰고 긴장된 마음으로 뒷좌석에 타자 주황색 안전벨트와 더불어 GMR 드라이버 다니엘 훈카데야가 기자를 포함한 승객들을 맞았다.
올해 유럽 내구 레이스 '르망24시'에 출전했던 훈카데야 드라이버는 ""환영합니다. 한번 달려보시죠""라며 활짝 웃었다.
그는 능숙한 운전으로 폴 리카르 서킷 시작점에 도착한 후 제로백을 체험하기 위해 급가속을 할 테니 마음의 준비를 하라고 했다.
GV60 마그마는 최대토크 790Nm, 최고출력 650마력을 발휘해 제네시스 전기차로서는 가장 빠른 속도인 시속 264km를 자랑한다. 정지 상태에서 시속 200km까지 가속하는 제로백은 10.9초에 불과하다.
훈카데야 드라이버가 가속을 위해 페달을 깊게 밟자 차는 빠르게 응답하며 시속이 1∼2초 만에 100㎞를 넘었고, 또 몇 초 후에는 계기판에 200㎞ 글자가 떴다.
처음 경험해본 빠른 속도에 눈이 질끈 감겼지만 의외로 불안하지 않았다.
한국의 트랙에서 몇 초 만에 시속 100㎞를 넘기는 제로백 시승을 해봤을 때는 몸이 붕 뜨는 느낌 때문에 불안감이 컸는데 전기차의 묵직함에다 승차감 개선을 위한 기능까지 더해지면서 생각만큼 무섭지 않았다.

코너링 구간의 주행 능력과 승차감도 기대 이상이었다.
트랙에서 빠른 속도로 큰 각도의 코너를 돌게 되면 머리를 포함한 몸이 반대쪽으로 크게 기울게 되고 이에 따라 멀미 증상까지 느끼게 된다.
하지만 훈카데야 드라이버가 코너링에 이어 드리프트까지 진행했는데도 몸은 크게 기울지 않았다.
기존 대비 크게 낮아진 롤센터와 GV60 마그마 전용 휠, 고급 전자제어 서스펜션(ECS) 및 EoT(End-of-Travel) 제어 시스템 등이 복합적으로 적용된 덕분이었다.
심지어 차가 빙빙 도는 드리프트에도 놀이공원 기구를 타는 듯한 기분이 느껴져 다른 동승객과 웃으며 농담하기도 했다.
이후 훈카데야 드라이버가 평균 180㎞의 속도로 트랙을 질주했는데도 안정감은 유지됐다.
특히 차가 이러한 고속 상태를 유지할 때는 출력이 불안정해지는 경우가 종종 있는데 GV60 마그마는 이런 느낌도 전혀 없었다.
GV60 마그마에는 최대 15초 동안 차량의 출력과 토크를 높여 고속 영역에서도 차량이 출력을 지속해 유지할 수 있는 부스트 모드가 탑재됐다.

하지만 GV60 마그마의 화룡점정은 마그마 전용으로 개발된 전용 가상 사운드 시스템이었다.
전기 레이스카는 기존 내연기관 레이스카에서 느껴지던 '웅웅' 거리는 공명음이 없어 흥미도가 떨어진다는 지적이 있다.
하지만 제네시스는 GV60 마그마에 액티브 사운드 디자인(e-ASD+)을 적용해 전기 사운드를 경험할 수 있게 했다. 여기에다 가상 변속 시스템(VGS) 기능을 더할 경우 고성능 6기통 엔진 소리가 그대로 재현됐는데 이 덕분에 이 차가 내연기관차인지 전기차인지 헷갈릴 정도였다.
훈카데야 드라이버는 ""포르쉐 타이칸도 이러한 기능이 있는데 '가짜'(fake) 느낌이 너무 풍겼다""며 ""하지만 제네시스 GV60 마그마는 '진짜'(real)다""라며 엄지를 내밀었다.
트랙에서 뒷좌석 시승을 하면 한결같이 멀미가 나는 느낌으로 끝이 났는데 GV60 마그마는 이런 선례를 따르지 않았다.
다만 한국에서 이런 마그마의 성능을 경험해보고 즐길 수 있는 공간이 과연 있을지는 의문이 들었다.
vivid@yna.co.kr
",https://www.yna.co.kr/view/AKR20251124034700003?section=industry/automobile,자동차
2025-11-24,"""제네시스, 지난 10년 성적은 '수'…향후 모든 모델에 마그마 추가""","출범 10주년을 맞은 현대차의 고급 브랜드 제네시스가 향후 10년을 이끌 새로운 성장동력으로 고성능차 프로그램 '마그마'를 낙점했다.
제네시스 마그마 출시를 이끈 제네시스 경영진들은 지난 10년간 제네시스가 '수우미양가' 중 '수'에 해당하는 큰 성과를 거뒀다고 평가하며 향후 출시될 모든 제네시스 모델에 마그마를 하나의 트림으로 정착시켜 '럭셔리 고성능' 영역을 새롭게 구축하겠다는 의지를 보였다.
제네시스는 지난 21일(현지시간) 프랑스 르 카스텔레에서 연 '마그마 월드 프리미어'에서 글로벌 취재진과 간담회를 열었다.
간담회에는 현대차그룹 최고 디자인책임자(CDO) 겸 최고 크리에이티브 책임자(CCO)인 루크 동커볼케 사장과 제네시스 사업본부장인 송민규 부사장, 차량 개발담당 만프레드 하러 부사장, 제네시스 유럽사업 총괄 피터 크론슈나블 법인장 등이 참석했다.
동커볼케 사장은 지난 10년간 제네시스의 성과를 묻는 말에 ""제네시스의 DNA를 창조하고, 진화시키고, 성장시킨 것은 다른 브랜드와는 비교할 수 없는 특별한 경험이었다""며 ""제네시스의 첫 10년은 마그마 이전이고, 다음 10년은 마그마의 10년이 될 것""이라고 말했다.

제네시스 사업부를 총괄하는 송민규 부사장은 ""지난 10년간을 평가하면 우리는 100점에는 도달하지 못했지만, 수우미양가 중 적어도 수는 맞았다고 생각한다""며 ""이제 다음 10년을 모터스포츠와 할 것이고, 이제는 고성능에 럭셔리(Luxury)를 더해야 한다""고 강조했다.
이들은 제네시스의 마그마의 첫 번째 차량으로 전동화 모델 GV60을 선택한 것에 대해선 젊은 감각을 유지하기 위해서였다며 향후 모든 제네시스 라인업에 마그마를 추가하겠다고 밝혔다.
송민규 부사장은 ""마그마가 지향하는 고성능 럭셔리를 생각했을 때 가장 젊은 모델을 선택해야 한다고 봤다""며 ""지금은 수정됐지만 앞서 제네시스는 2025년부터는 모든 모델을 전기차로 출시하겠다는 계획을 밝혔고, 그러한 관점에서 볼 때 가장 젊은 차량이 GV60이었다""고 전했다.
이어 ""트랙에서 가장 성능이 뛰어난 차보다는 '이 차의 잠재력은 어느 정도일까?'라는 의구심이 드는 차를 만들고 싶었다""며 ""앞으로 나올 모든 모델에서 마그마는 상품 기획 단계부터 하나의 프로그램으로 자리 잡을 것이고, 최고 중의 최고 사양이 될 것""이라고 자신했다.
다만 그는 고성능 브랜드는 가격 경쟁력에 초점을 두지 않는 만큼 마그마 차량은 제공하는 가치보다는 가격이 조금 낮을 수 있다고 덧붙였다.

제네시스 경영진들은 마그마의 성공 여부와 관련해선 제네시스의 과거 경험을 토대로 큰 자신감을 드러냈다.
동커볼케 사장은 ""이전 여러 브랜드와 함께했지만, 현대차그룹과과 같은 회사를 본 적이 없다""며 ""다른 회사는 브랜드를 출시할 때 첫 모델을 내놓고 제대로 효과가 있는지 보고 천천히 라인업을 구축하지만, 제네시스는 단기간에 다양한 모델을 동시에 구축해 성공했다""고 밝혔다.
그러면서 ""다른 브랜드들이 고민하는 시간 제네시스는 한 브랜드로 완전한 포트폴리오로 구축한 것""이라며 ""이것이 제네시스 브랜드에 대한 자신감의 근원""이라고 덧붙였다.
송민규 부사장도 ""제네시스는 2015년 출범 당시부터 스타트업이라는 생각으로 하나의 캐릭터를 만들어왔다""며 ""그냥 우리가 지금까지 걸어왔던 길을 계속 가야 한다는 것이고, 그런 측면에서 계속 힘을 받고 있다""고 설명했다.

다만 고성능 영역에서 '럭셔리 고성능'이라는 새로운 영역을 구축해야 하는 만큼 일본, 독일, 중국 등 다른 브랜드는 많이 참고하겠다는 계획도 전했다.
동커볼케 사장은 ""완성차 업계가 중국의 시대라고 하는데 이제 15년만 있으면 인도의 시대가 될 것""이라며 ""하지만 경쟁은 우리를 더욱 나아지게 하고, 차별화를 할 수 있게 해준다""고 강조했다.
송민규 부사장은 ""일본 도요타, 렉서스로부터는 품질에 대한 무한한 노력을, 독일 메르세데스-벤츠 등으로부터는 100년간 쌓아온 엔지니어링과 경험을 배워야 한다""며 ""중국 기업들로부터는 '타임 투 마켓'(빠른 시장 대응속도)을 배워 제네시스만의 색깔을 만들면 된다""고 말했다.
제네시스는 마그마 출시를 계기로 럭셔리차와 고성능차의 본거지와 같은 유럽 공략도 강화할 계획이다.
피터 크론슈나블 법인장은 ""유럽에는 독일 '빅3'가 있지만 저희는 그들의 방식으로는 성공할 수 없다""며 ""새로운 프리미엄을 찾아야 하고, 마그마로 대표되는 '고성능 럭셔리'가 그것이 될 것""이라고 밝혔다.
vivid@yna.co.kr",https://www.yna.co.kr/view/AKR20251124014200003?section=industry/automobile,자동차
2025-11-24,"""인도 車시장 잠재력 막대…계층화 구조·전동화 규제 기회요인""","글로벌 3위 규모로 커진 인도 완성차시장의 성장 여력이 여전히 크다는 분석이 나왔다.
24일 한국자동차연구원의 '인도 완성차 시장 현황 및 전망'에 따르면 2022년 기준 인도의 승용차 보급률은 인구 1천명당 34대에 그쳤다. 미국(772대), 유럽연합(560대), 한국(455대) 등을 크게 밑도는 수준이다.
보고서는 14억5천명에 달하는 인구와 연간 6% 이상의 경제성장률을 고려하면 인도 자동차 시장은 세계 최고 수준의 성장 잠재력을 보유하고 있다고 보고서는 강조했다.
특히 인도는 이륜차 보급률(1천명당 185대)이 높다는 점에서 향후 경제발전에 따라 이륜차 수요가 승용차 수요로 전환될 가능성도 있다.
작년 4월부터 올해 3월까지 인도에서 자동차(사륜차)는 525만9천대 팔렸고 이륜차, 삼륜차 등은 총 2천34만9천대 판매됐다.
인도 사회구조가 지역, 사회계층, 성별, 종교별로 분절화돼있다는 점도 모빌리티 서비스 시장의 기회 요소로 작용할 수 있다고 보고서는 강조했다.
인도는 주(州)별 경제력 격차가 최대 10배이고 성별 노동참여율 차이는 40%포인트가 넘는 등 집단별 생활 양식이 상이하다. 이에 따라 모빌리티 서비스도 택시, 오토릭샤(삼륜차), 바이크, 자전거 등으로 분화돼있다.
보고서는 ""대개 플랫폼 기반 서비스는 네트워크 효과에 의해 특정 기업의 과점 체제로 귀결되지만, 인도 특유의 계층화·분절화된 사회가 모빌리티 서비스의 분화와 병존을 가능케 한다""며 ""많은 인구 덕분에 각 서비스가 규모의 경제를 이룰 수 있다는 점은 인도 모빌리티 서비스 시장의 기회 요인""이라고 설명했다.
선진국 시장보다 전동화 규제가 강하지 않은 점도 글로벌 완성차업계의 주목을 끌 수 있다. 내연기관차, 하이브리드차 기술을 적극적으로 활용할 기회가 되기 때문이다. 인도 승용차 시장의 전기차 침투율은 2.7%에 불과하다.
보고서는 ""인도는 파워트레인 전동화 규제의 완충지대이자 새로운 제품 시장으로서의 가치를 보유한다""며 ""향후 전기차 보급 본격화에 맞춰 수익성 증대가 가능한 점, 글로벌사우스 전반에 통용될 수 있는 제품 특성 등은 인도 시장의 전략적 가치를 배가한다""고 설명했다.
아울러 완성차 업계가 중국으로부터 공급망을 다변화하는 과정에서 인도의 생산·수출 기지 역할이 주목받을 수 있다고 보고서는 덧붙였다.
(서울=연합뉴스) 기아가 4m 이하 콤팩트 SUV '시로스'를 인도에서 세계 최초로 공개했다고 22일 밝혔다. 사진은 기아 시로스 외장 이미지. 2024.12.22  photo@yna.co.kr
bingo@yna.co.kr",https://www.yna.co.kr/view/AKR20251123028700003?section=industry/automobile,자동차
2025-11-23,사용 늘어나는 '리튬인산철 배터리' 재활용 위해 규제특례 부여,"전기차가 늘면서 사용이 많아지고 있는 '리튬인산철(LFP) 배터리' 재활용 기준 마련을 위해 규제특례가 부여됐다.
기후에너지환경부는 LFP 배터리 기준 마련을 위해 규제특례를 부여하기로 19일 순환경제 신기술·서비스 심의위원회에서 확정했다고 23일 밝혔다.
중국 배터리업체들이 주력으로 삼는 LFP 배터리는 그간 국내 업체들이 주력해온 '니켈·코발트·망간(NCM) 배터리'와 비교해 에너지 밀도가 낮지만, 안전성이 높고 수명이 길며 가격이 싸 최근 전기차에 많이 사용되고 있다.
문제는 현행 폐기물관리법 시행규칙은 전기차 폐배터리를 금속 원료물질로 재활용할 경우 재활용된 원료물질 니켈 함량이 무게 비율로 10% 이상이어야 하도록 규정하는 등 LFP 배터리를 재활용하려고 할 때는 지키기 어렵게 구성돼있다는 점이다. LFP 배터리에는 니켈이 쓰이지 않는다.
이번 규제특례는 사용한 LFP 배터리를 전처리 후 침출 기술을 활용, 리튬과 인산철을 분리·정제한 뒤 탄산리튬과 인산철을 제조하는 재활용 기술을 검증하고자 부여됐다.
지난 순환경제 신기술·서비스 심의위에서는 대부분 전자제품에 들어 있는 인쇄회로기판(PCB)에서 핵심 광물을 추출할 수 있도록 하는 규제특례도 확정됐다.
인쇄회로기판(PCB). 
합성수지에 반도체나 저항 같은 부품이 결합한 형태인 PCB는 소재 중 합성수지 비율이 높다는 이유로 폐기물이 되면 '폐합성수지로' 분류된다. 폐합성수지류가 '순환자원'으로 인정받아 폐기물관리법상 규제를 벗어나 재활용이 쉽게 되려면 이물질 비율이 무게의 5% 이하여야 하는데 PCB는 이를 충족하기 어렵다.
현재 폐기물관리법상 '그 밖의 폐기물'로 규정돼 재활용할 수 없는 폐암면을 재활용할 수 있도록 하는 규제특례도 이번에 확정됐다.
암면은 현무암 등 암석을 고온에서 녹여 가공해 만드는 인조 광물성 섬유로, 수경재배 시 토양 대신 작물이 뿌리를 내리게 지지해주는 배지로 사용된다.
규제특례를 통해 암면 배지 폐기물을 입상압면으로 가공해 시설재배 딸기 배지로 활용할 수 있는지와 폐암면을 가공해 시멘트 부원료로 사용하는 것이 적합한지 실증이 이뤄질 예정이다.
jylee24@yna.co.kr",https://www.yna.co.kr/view/AKR20251122029300530?section=industry/automobile,자동차
2025-11-23,"전문가들 ""12월 제조업 경기 개선 전망""…전망 PSI 연중 최고","인공지능(AI) 열풍에 반도체 호조가 계속되고 한미 관세 협상이 마무리되면서 미국의 자동차 관세가 25%에서 15%로 내려갈 것이라는 기대감 등이 반영된 것으로 해석된다.

산업연구원은 지난 10∼14일 업종별 전문가 120명을 상대로 전문가 서베이 지수(PSI)를 조사한 결과 12월 제조업 업황 전망 PSI가 110으로 기준치를 웃도는 것으로 집계됐다고 23일 밝혔다.
PSI는 100(전월 대비 변화 없음)을 기준으로 200에 가까울수록 전월보다 업황이 개선됐다는 의견이 많다는 것을, 0에 근접할수록 업황이 악화했다는 의견이 많다는 것을 뜻한다.
12월 업황 전망 PSI는 전달보다 4포인트 상승하면서 연중 최고치를 기록했다. 작년 8월(110) 이후 1년 6개월 만에 최고치이자, 6개월 연속 기준치를 상회한 것이다.
세부 지표로는 수출(111)과 내수(108)가 모두 기준치를 웃돌고, 생산수준(102)도 기준치를 소폭 상회한 가운데 투자(109)와 채산성(113)도 상승세를 보이며 전체적으로 개선 기대감이 커졌다.
업종별로는 반도체(158)가 전월 대비 15포인트 상승하며 업황 개선 기대감이 더욱 커졌다.
바이오·헬스(127), 전자(108), 기계(106), 자동차(105) 등도 기준선인 100 이상을 나타내 전망이 밝았고, 섬유(100)는 기준선에 걸쳤다.
디스플레이(83), 조선·화학(93), 철강(88) 등은 기준선을 밑돌았다.
한편, 11월 제조업 업황 현황 지수는 111로 전월(103)보다 8포인트 오르며 상승세로 전환했다.
내수(106)와 수출(109), 생산(109), 투자(108), 채산성(107) 모두 기준치를 웃돌았다.
dkkim@yna.co.kr",https://www.yna.co.kr/view/AKR20251123007200003?section=industry/automobile,자동차
2025-11-23,"제네시스, 미국 매체 '최고의 럭셔리 자동차 브랜드' 선정","현대차 고급 브랜드 제네시스는 미국 매체 US뉴스앤드월드리포트로부터 '최고의 럭셔리 자동차 브랜드'로 선정됐다고 23일 밝혔다.
US뉴스앤드월드리포트는 최근 '2026 최고의 자동차 브랜드 어워즈'를 열고 럭셔리, 스포츠유틸리티차(SUV), 승용, 트럭, 전동화, 럭셔리 전동화 등 6개 부문별 수상 브랜드를 발표했다.
제네시스는 품질, 안전, 디자인, 가격 경쟁력 등을 높게 평가받아 최종 후보에 함께 오른 포르쉐를 제치고 '최고의 럭셔리 자동차 브랜드'에 올랐다.
현대차는 팰리세이드, 투싼 등에 대한 호평에 힘입어 2년 연속 '최고의 SUV 브랜드'로 선정됐다.
알렉스 크완텐 US뉴스앤드월드리포트 편집장은 ""제네시스는 지난 10년 가까이 세계적인 수준의 차량과 프리미엄 고객 경험을 꾸준히 선보였다""며 ""다른 럭셔리 브랜드를 압도하는 경쟁력을 증명하고 있다""고 말했다.
테드 멘지스테 제네시스 북미법인 최고운영책임자(COO)는 ""제네시스는 시대를 초월한 디자인과 첨단 기술, 정교한 주행 경험을 결합한 차량을 제공하기 위해 최선을 다하고 있다""며 ""이번 수상은 고객의 기대를 뛰어넘기 위한 지속적인 노력의 증거""라고 말했다.
bingo@yna.co.kr",https://www.yna.co.kr/view/AKR20251123015600003?section=industry/automobile,자동차
2025-11-23,車 첨단안전장치 달면 사고율 20%↓…보급률은 연령 높을수록↓,"충돌 위험이나 차선 이탈을 감지해 운전자에게 경고하는 첨단 안전장치를 장착한 차량이 그렇지 않은 차보다 탑승자가 다치는 교통사고가 날 확률이 20%가량 낮은 것으로 나타났다.
이들 장치는 운전자의 연령과 상관없이 사고율을 다소 낮추는 효과가 있는 것으로 나타났지만, 보급률은 운전자의 연령대가 높을수록 낮은 것으로 확인됐다.
23일 국회 국토교통위원회 소속 더불어민주당 이연희 의원실이 국토교통부로부터 받은 2023년 1월∼2025년 6월 보험사 유효 계약 961만건 기반 사고 분석자료에 따르면 전방 충돌 경고(FCW) 및 차선이탈 경고(LDW) 장치를 모두 단 차량은 탑승자가 경상을 입을 확률이 7.9%로 집계됐다.
이는 두 장치를 모두 달지 않은 차량의 경상 사고율(9.6%)보다 약 18% 낮다. 경상 사고율은 충돌 경고 장치만 달았을 때는 8.6%(11% 감소), 차선이탈 경고 장치만 있을 때는 9.0%(6% 감소)였다.

중상 사고율도 충돌·차선이탈 경고 장치를 모두 단 차량이 0.07%로 두 장치가 모두 없는 경우(0.09%)보다 22% 낮았다. 각 장치를 하나씩만 단 경우 중상 사고율은 모두 0.08%로 11% 낮은 것으로 나타났다.
첨단 안전장치는 차량이 충돌로 전손 처리되는 사고도 줄이는 것으로 분석됐다. 충돌·차선이탈 경고 장치가 없는 차량의 전손 사고율은 0.28%였지만 차선이탈 경고 장치를 단 차량은 0.26%, 전방 충돌 경고 장치를 단 차량은 0.23%였다. 두 장치가 다 있으면 0.22%로 가장 낮았다.
전방 충돌·차선이탈 경고 장치를 동시에 단 차량은 모든 운전자의 연령대에서 미장착 차량보다 사고율이 낮았다.
중상 사고율은 40대 이상에서 29%(장치 없을 때 0.07%→모두 장착했을 때 0.05%)로 가장 큰 폭으로 줄었다. 중상 사고가 줄어드는 비율은 20대와 70대 이상에서는 21%였고, 60대에서는 20%, 30대에서는 14%, 50대에서는 13%였다.
경상 사고율 감소 효과는 연령대가 낮을수록 큰 것으로 나타났다. 20대의 경우 사고율은 장치가 없을 때 17.4%에서 11.8%로 32%가량 낮아졌다. 사고 감소율은 30대는 25%, 40대는 24%, 50대는 20%, 60대는 15%, 70대 이상은 3%였다.

다만 전방 충돌·차선이탈 경고 장치 보급률은 연령대가 높아질수록 저조했다. 두 장치를 모두 단 비율은 20대 51.4%, 30대 42%, 40대 30.9%, 50대 30.4%, 60대 26.9%, 70대 이상 18.4%였다. 이는 고령층 중심 보조금 지원, 보험 할인 등 첨단안전장치 장착 유도 정책의 필요성을 시사한다고 보고서는 밝혔다.
국토부는 고령 운전자의 경우 전방 충돌·차선이탈 경고 장치에 더해 페달 오조작 방지 장치를 설치하면 사고 예방 효과가 더욱 높을 것으로 보고 국내외 보급 지원 제도를 분석하고 있다.
실제로 삼성화재 교통안전문화연구소가 2019∼2024년 페달 오조작 사고를 분석한 결과 사고의 39.1%는 운전자가 61세 이상이었으며 65세 이상은 전체의 25.7%를 차지했다. 최근 22명의 사상자가 발생한 부천 제일시장 화물차 돌진 사고를 낸 운전자도 67세로, 사고 당시 브레이크가 아닌 가속 페달을 잘못 밟은 것으로 조사됐다.
국토부 관계자는 ""국내 교통사고 사망자 수는 계속 줄고 있지만 여전히 경제협력개발기구(OECD) 중하위권 수준""이라며 ""첨단안전장치의 사고 감소 효과를 분석하고 장치 보급 활성화 방안을 검토해 운전자 부주의에 의한 사고를 더욱 줄이는 데 기여할 것""이라고 말했다.

sh@yna.co.kr",https://www.yna.co.kr/view/AKR20251121141500003?section=industry/automobile,자동차
2025-11-21,"[게시판] GM, 글로벌 여성 엔지니어 콘퍼런스 개최","▲ 제너럴모터스(GM)는 지난 19일 인천 부평공장 홍보관에서 여성 엔지니어들의 연결과 성장을 지원하는 '2025 SWE(Society of Women Engineers) 코리아 콘퍼런스'를 개최했다고 21일 밝혔다. SWE는 1950년 설립된 글로벌 여성 엔지니어 단체로 한국GM은 2020년 국내 완성차업계 최초로 가입했다. 지엠테크니컬센터코리아(GMTCK) 소속 임소영 SWE 코리아 부회장은 ""이번 콘퍼런스는 기술적 논의뿐 아니라 글로벌 협업, 사고방식, 미래 기술 비전에 대한 깊이 있는 대화를 나누는 자리였다""고 말했다. (서울=연합뉴스)",https://www.yna.co.kr/view/AKR20251121104900003?section=industry/automobile,자동차
